cookbook/07-Tool/NetworkSerialization/log-main.py.log
[04/24/2026-02:20:03] [TRT] [V] *************** Autotuning format combination: Float(784,784,28,1) -> Float(25088,784,28,1) ***************
[04/24/2026-02:20:03] [TRT] [V] --------------- Timing Runner: Convolution1 + Activation1 (CaskConvolution[0x80000009])
[04/24/2026-02:20:03] [TRT] [V] Tactic Name: ampere_scudnn_128x128_relu_medium_nn_v1 Tactic: 0xf067e6205da31c2e Time: 0.00957623
[04/24/2026-02:20:03] [TRT] [V] Tactic Name: ampere_scudnn_128x32_relu_small_nn_v1 Tactic: 0xa8609adc4e0ceb90 Time: 0.00795378
[04/24/2026-02:20:03] [TRT] [V] Tactic Name: ampere_scudnn_128x64_relu_medium_nn_v1 Tactic: 0xf64396b97c889179 Time: 0.00861894
[04/24/2026-02:20:03] [TRT] [V] Tactic Name: sm70_xmma_fprop_implicit_gemm_f32f32_f32f32_f32_nchwkcrs_nchw_tilesize64x64x8_stage1_warpsize1x4x1_g1_ffma_aligna4_alignc4 Tactic: 0xe40b38338a3a7d7e Time: 0.00502113
[04/24/2026-02:20:03] [TRT] [V] Tactic Name: sm70_xmma_fprop_implicit_gemm_f32f32_f32f32_f32_nchwkcrs_nchw_tilesize32x32x8_stage1_warpsize1x2x1_g1_ffma_aligna4_alignc4 Tactic: 0xf7a98be0a08d77c4 Time: 0.00452843
[04/24/2026-02:20:03] [TRT] [V] Tactic Name: sm70_xmma_fprop_implicit_gemm_f32f32_f32f32_f32_nchwkcrs_nchw_tilesize64x128x8_stage1_warpsize1x4x1_g1_ffma_aligna4_alignc4 Tactic: 0xd1338f4b38d341e2 Time: 0.00592449
[04/24/2026-02:20:03] [TRT] [V] Tactic Name: sm80_xmma_fprop_implicit_gemm_f32f32_f32f32_f32_nchwkcrs_nchw_tilesize64x128x8_stage3_warpsize1x4x1_g1_ffma_aligna4_alignc4 Tactic: 0x5aa723e0481da855 Time: 0.00613935
[04/24/2026-02:20:03] [TRT] [V] Tactic Name: sm80_xmma_fprop_implicit_gemm_f32f32_f32f32_f32_nchwkcrs_nchw_tilesize256x128x8_stage3_warpsize4x2x1_g1_ffma_aligna4_alignc4 Tactic: 0xbb8c3889c7eacd30 Time: 0.0126522
[04/24/2026-02:20:03] [TRT] [V] Tactic Name: sm70_xmma_fprop_implicit_gemm_indexed_f32f32_f32f32_f32_nchwkcrs_nchw_tilesize128x16x8_stage1_warpsize4x1x1_g1_ffma_aligna4_alignc4 Tactic: 0x65d82d184f452332 Time: 0.00553635
[04/24/2026-02:20:03] [TRT] [V] Tactic Name: sm70_xmma_fprop_implicit_gemm_indexed_f32f32_f32f32_f32_nchwkcrs_nchw_tilesize32x32x8_stage1_warpsize1x2x1_g1_ffma_aligna4_alignc4 Tactic: 0x9efed776051c0873 Time: 0.00501588
[04/24/2026-02:20:03] [TRT] [V] Tactic Name: sm70_xmma_fprop_implicit_gemm_indexed_f32f32_f32f32_f32_nchwkcrs_nchw_tilesize128x32x8_stage1_warpsize2x2x1_g1_ffma_aligna4_alignc4 Tactic: 0x8c4f6360145d6a1f Time: 0.00603505
[04/24/2026-02:20:03] [TRT] [V] Tactic Name: sm70_xmma_fprop_implicit_gemm_indexed_f32f32_f32f32_f32_nchwkcrs_nchw_tilesize64x64x8_stage1_warpsize1x4x1_g1_ffma_aligna4_alignc4 Tactic: 0x8d5c64a52fab02c9 Time: 0.00521267
[04/24/2026-02:20:03] [TRT] [V] Tactic Name: sm80_xmma_fprop_implicit_gemm_indexed_f32f32_f32f32_f32_nchwkcrs_nchw_tilesize128x64x8_stage2_warpsize4x1x1_g1_ffma_aligna4_alignc4_beta0_packed_stride Tactic: 0x1673e3594ce11cea Time: 0.0072895
[04/24/2026-02:20:03] [TRT] [V] Tactic Name: sm80_xmma_fprop_implicit_gemm_indexed_f32f32_f32f32_f32_nchwkcrs_nchw_tilesize128x16x8_stage3_warpsize4x1x1_g1_ffma_aligna4_alignc4 Tactic: 0x40a12e3938221818 Time: 0.00560498
[04/24/2026-02:20:03] [TRT] [V] Tactic Name: sm80_xmma_fprop_implicit_gemm_indexed_f32f32_f32f32_f32_nchwkcrs_nchw_tilesize128x32x8_stage3_warpsize2x2x1_g1_ffma_aligna4_alignc4 Tactic: 0xa9366041633a5135 Time: 0.0060581
[04/24/2026-02:20:03] [TRT] [V] Tactic Name: sm80_xmma_fprop_implicit_gemm_f32f32_f32f32_f32_nchwkcrs_nchw_tilesize32x32x8_stage3_warpsize1x2x1_g1_ffma_t1r5s5_aligna4_alignc4 Tactic: 0x5b8bf1b8028629d9 Time: 0.00442877
[04/24/2026-02:20:03] [TRT] [V] Tactic Name: sm70_xmma_fprop_implicit_gemm_f32f32_f32f32_f32_nchwkcrs_nchw_tilesize32x32x8_stage1_warpsize1x2x1_g1_ffma_t1r5s5_aligna4_alignc4 Tactic: 0x7e1e4d26cfa285f9 Time: 0.00459558
[04/24/2026-02:20:03] [TRT] [V] Tactic Name: ampere_scudnn_128x64_relu_small_nn_v1 Tactic: 0x3f243c490d502deb Time: 0.00803454
[04/24/2026-02:20:03] [TRT] [V] Tactic Name: sm70_xmma_fprop_implicit_gemm_f32f32_f32f32_f32_nchwkcrs_nchw_tilesize128x16x8_stage1_warpsize4x1x1_g1_ffma_aligna4_alignc4 Tactic: 0x160b77f4a95ab6d3 Time: 0.0051242
[04/24/2026-02:20:03] [TRT] [V] Tactic Name: sm70_xmma_fprop_implicit_gemm_f32f32_f32f32_f32_nchwkcrs_nchw_tilesize128x64x8_stage1_warpsize2x2x1_g1_ffma_aligna4_alignc4 Tactic: 0x994f5b723e2d80da Time: 0.00629394
[04/24/2026-02:20:03] [TRT] [V] Tactic Name: sm80_xmma_fprop_implicit_gemm_f32f32_f32f32_f32_nchwkcrs_nchw_tilesize64x64x8_stage3_warpsize1x4x1_g1_ffma_aligna4_alignc4 Tactic: 0xa31d27de74b895ff Time: 0.00499327
[04/24/2026-02:20:03] [TRT] [V] Tactic Name: sm80_xmma_fprop_implicit_gemm_f32f32_f32f32_f32_nchwkcrs_nchw_tilesize32x32x8_stage3_warpsize1x2x1_g1_ffma_aligna4_alignc4 Tactic: 0xb0bf940d5e0f9f45 Time: 0.00466785
[04/24/2026-02:20:03] [TRT] [V] Tactic Name: ampere_scudnn_128x64_relu_xregs_large_nn_v1 Tactic: 0x5deb29b7a8e275f7 Time: 0.008412
[04/24/2026-02:20:03] [TRT] [V] Tactic Name: sm70_xmma_fprop_implicit_gemm_f32f32_f32f32_f32_nchwkcrs_nchw_tilesize64x64x8_stage1_warpsize1x4x1_g1_ffma_t1r5s5_aligna4_alignc4 Tactic: 0xb3ea28771604ad88 Time: 0.00499375
[04/24/2026-02:20:03] [TRT] [V] Tactic Name: sm80_xmma_fprop_implicit_gemm_f32f32_f32f32_f32_nchwkcrs_nchw_tilesize128x16x8_stage3_warpsize4x1x1_g1_ffma_aligna4_alignc4 Tactic: 0x9d9fdb5fd9945f64 Time: 0.00495247
[04/24/2026-02:20:03] [TRT] [V] Tactic Name: sm80_xmma_fprop_implicit_gemm_indexed_f32f32_f32f32_f32_nchwkcrs_nchw_tilesize64x64x8_stage3_warpsize1x4x1_g1_ffma_aligna4_alignc4 Tactic: 0xd828f024626fa982 Time: 0.00515906
[04/24/2026-02:20:03] [TRT] [V] Tactic Name: sm80_xmma_fprop_implicit_gemm_f32f32_f32f32_f32_nchwkcrs_nchw_tilesize128x64x8_stage3_warpsize2x2x1_g1_ffma_aligna4_alignc4 Tactic: 0x12dbf7d94ee3696d Time: 0.00642154
[04/24/2026-02:20:03] [TRT] [V] Tactic Name: sm80_xmma_fprop_implicit_gemm_f32f32_f32f32_f32_nchwkcrs_nchw_tilesize64x64x8_stage3_warpsize1x4x1_g1_ffma_t1r5s5_aligna4_alignc4 Tactic: 0x967f94e9db2001a8 Time: 0.00488487
[04/24/2026-02:20:03] [TRT] [V] Tactic Name: sm80_xmma_fprop_implicit_gemm_indexed_f32f32_f32f32_f32_nchwkcrs_nchw_tilesize32x32x8_stage3_warpsize1x2x1_g1_ffma_aligna4_alignc4 Tactic: 0xcb8a43f748d8a338 Time: 0.00472098
[04/24/2026-02:20:03] [TRT] [V] Tactic Name: sm70_xmma_fprop_implicit_gemm_f32f32_f32f32_f32_nchwkcrs_nchw_tilesize128x256x8_stage1_warpsize2x4x1_g1_ffma_aligna4_alignc4 Tactic: 0xd2aa21bfe2167c0c Time: 0.0119413
[04/24/2026-02:20:03] [TRT] [V] Tactic Name: ampere_scudnn_128x128_relu_small_nn_v1 Tactic: 0x503619c69ae500ff Time: 0.00904735
[04/24/2026-02:20:03] [TRT] [V] Tactic Name: sm80_xmma_fprop_implicit_gemm_indexed_f32f32_f32f32_f32_nchwkcrs_nchw_tilesize128x64x8_stage2_warpsize1x4x1_g1_ffma_aligna4_alignc4_beta0_packed_stride Tactic: 0xede36641840ce3d2 Time: 0.00674539
[04/24/2026-02:20:03] [TRT] [V] Tactic Name: sm70_xmma_fprop_implicit_gemm_f32f32_f32f32_f32_nchwkcrs_nchw_tilesize128x128x8_stage1_warpsize2x2x1_g1_ffma_aligna4_alignc4 Tactic: 0xac49795b871b0d29 Time: 0.00958903
[04/24/2026-02:20:03] [TRT] [V] Tactic Name: sm80_xmma_fprop_implicit_gemm_indexed_f32f32_f32f32_f32_nchwkcrs_nchw_tilesize128x64x8_stage2_warpsize2x2x1_g1_ffma_aligna4_alignc4_beta0_packed_stride Tactic: 0x31aa67f57c5aea77 Time: 0.00677013
[04/24/2026-02:20:03] [TRT] [V] Convolution1 + Activation1 (CaskConvolution[0x80000009]) profiling completed in 0.172199 seconds. Fastest Tactic: 0x5b8bf1b8028629d9 Time: 0.00442877
[04/24/2026-02:20:03] [TRT] [V] Skipping CaskFlattenConvolution: No valid tactics for Convolution1 + Activation1
[04/24/2026-02:20:03] [TRT] [V] >>>>>>>>>>>>>>> Chose Runner Type: CaskConvolution Tactic: 0x5b8bf1b8028629d9
[04/24/2026-02:20:03] [TRT] [V] *************** Autotuning format combination: Float(784,1,28,1) -> Float(25088,1,896,32) ***************
[04/24/2026-02:20:03] [TRT] [V] --------------- Timing Runner: Convolution1 + Activation1 (CaskConvolution[0x80000009])
[04/24/2026-02:20:03] [TRT] [V] Tactic Name: sm70_xmma_fprop_implicit_gemm_f32f32_f32f32_f32_nhwckrsc_nhwc_tilesize64x32x32_stage1_warpsize1x1x1_g1_ffma_t1r5s5_aligna4_alignc4 Tactic: 0x737793996edbf8e2 Time: 0.113323
[04/24/2026-02:20:03] [TRT] [V] Tactic Name: sm80_xmma_fprop_implicit_gemm_f32f32_f32f32_f32_nhwckrsc_nhwc_tilesize64x64x8_stage3_warpsize1x4x1_g1_ffma_t1r5s5_aligna4_alignc4 Tactic: 0x45ff0c3a09b02e78 Time: 0.00969264
[04/24/2026-02:20:03] [TRT] [V] Tactic Name: sm80_xmma_fprop_implicit_gemm_f32f32_f32f32_f32_nhwckrsc_nhwc_tilesize128x64x8_stage3_warpsize2x2x1_g1_ffma_aligna4_alignc4 Tactic: 0x1da91d865428f237 Time: 0.0148225
[04/24/2026-02:20:03] [TRT] [V] Tactic Name: sm70_xmma_fprop_implicit_gemm_indexed_f32f32_f32f32_f32_nhwckrsc_nhwc_tilesize32x32x8_stage1_warpsize1x2x1_g1_ffma_aligna4_alignc4 Tactic: 0x5f60af66e8eb9b51 Time: 0.0100317
[04/24/2026-02:20:03] [TRT] [V] Tactic Name: sm70_xmma_fprop_implicit_gemm_indexed_f32f32_f32f32_f32_nhwckrsc_nhwc_tilesize128x32x8_stage1_warpsize2x2x1_g1_ffma_aligna4_alignc4 Tactic: 0x833d893f0e96f145 Time: 0.0118444
[04/24/2026-02:20:03] [TRT] [V] Tactic Name: sm80_xmma_fprop_implicit_gemm_indexed_wo_smem_f32f32_tf32f32_f32_nhwckrsc_nhwc_tilesize128x32x16_stage1_warpsize4x1x1_g1_tensor16x8x8_aligna4_alignc4 Tactic: 0xf231cca3335919a4 Time: 0.00480122
[04/24/2026-02:20:03] [TRT] [V] Tactic Name: sm70_xmma_fprop_implicit_gemm_f32f32_f32f32_f32_nhwckrsc_nhwc_tilesize64x16x16_stage1_warpsize1x1x1_g1_ffma_t1r5s5_aligna4_alignc4 Tactic: 0x247bb0dcaf6f9760 Time: 0.0187467
[04/24/2026-02:20:03] [TRT] [V] Tactic Name: sm80_xmma_fprop_implicit_gemm_indexed_f32f32_f32f32_f32_nhwckrsc_nhwc_tilesize128x16x8_stage3_warpsize4x1x1_g1_ffma_aligna4_alignc4 Tactic: 0x4fd3c46622e98342 Time: 0.0110434
[04/24/2026-02:20:03] [TRT] [V] Tactic Name: sm80_xmma_fprop_implicit_gemm_indexed_wo_smem_f32f32_tf32f32_f32_nhwckrsc_nhwc_tilesize128x16x32_stage1_warpsize4x1x1_g1_tensor16x8x8_aligna4_alignc4 Tactic: 0xcf8ea142095f02d2 Time: 0.0043986
[04/24/2026-02:20:03] [TRT] [V] Tactic Name: sm80_xmma_fprop_implicit_gemm_f32f32_f32f32_f32_nhwckrsc_nhwc_tilesize32x32x8_stage3_warpsize1x2x1_g1_ffma_t1r5s5_aligna4_alignc4 Tactic: 0x880b696bd0160609 Time: 0.00706044
[04/24/2026-02:20:03] [TRT] [V] Tactic Name: sm70_xmma_fprop_implicit_gemm_f32f32_f32f32_f32_nhwckrsc_nhwc_tilesize128x16x8_stage1_warpsize4x1x1_g1_ffma_aligna4_alignc4 Tactic: 0x19799dabb3912d89 Time: 0.0104197
[04/24/2026-02:20:03] [TRT] [V] Tactic Name: sm70_xmma_fprop_implicit_gemm_f32f32_f32f32_f32_nhwckrsc_nhwc_tilesize64x128x8_stage1_warpsize1x4x1_g1_ffma_aligna4_alignc4 Tactic: 0xde4165142218dab8 Time: 0.0138893
[04/24/2026-02:20:03] [TRT] [V] Tactic Name: sm70_xmma_fprop_implicit_gemm_f32f32_f32f32_f32_nhwckrsc_nhwc_tilesize128x64x8_stage1_warpsize2x2x1_g1_ffma_aligna4_alignc4 Tactic: 0x963db12d24e61b80 Time: 0.0143022
[04/24/2026-02:20:03] [TRT] [V] Tactic Name: sm80_xmma_fprop_implicit_gemm_indexed_f32f32_f32f32_f32_nhwckrsc_nhwc_tilesize128x32x8_stage3_warpsize2x2x1_g1_ffma_aligna4_alignc4 Tactic: 0xa6448a1e79f1ca6f Time: 0.010922
[04/24/2026-02:20:03] [TRT] [V] Tactic Name: sm80_xmma_fprop_implicit_gemm_f32f32_f32f32_f32_nhwckrsc_nhwc_tilesize128x16x8_stage3_warpsize4x1x1_g1_ffma_t1r5s5_aligna4_alignc4 Tactic: 0xe35d4a4a3b499fe7 Time: 0.00828748
[04/24/2026-02:20:03] [TRT] [V] Tactic Name: sm80_xmma_fprop_implicit_gemm_indexed_f32f32_f32f32_f32_nhwckrsc_nhwc_tilesize64x64x8_stage3_warpsize1x4x1_g1_ffma_aligna4_alignc4 Tactic: 0x19b688348f983aa0 Time: 0.0101033
[04/24/2026-02:20:03] [TRT] [V] Tactic Name: sm80_xmma_fprop_implicit_gemm_f32f32_f32f32_f32_nhwckrsc_nhwc_tilesize256x64x8_stage3_warpsize2x2x1_g1_ffma_aligna4_alignc4 Tactic: 0x8014228ec08b4d49 Time: 0.0254728
[04/24/2026-02:20:03] [TRT] [V] Tactic Name: sm70_xmma_fprop_implicit_gemm_f32f32_f32f32_f32_nhwckrsc_nhwc_tilesize128x16x8_stage1_warpsize4x1x1_g1_ffma_t1r5s5_aligna4_alignc4 Tactic: 0x54e3b8c9b1e5f17a Time: 0.010143
[04/24/2026-02:20:03] [TRT] [V] Tactic Name: sm70_xmma_fprop_implicit_gemm_indexed_f32f32_f32f32_f32_nhwckrsc_nhwc_tilesize128x16x8_stage1_warpsize4x1x1_g1_ffma_aligna4_alignc4 Tactic: 0x6aaac747558eb868 Time: 0.0110648
[04/24/2026-02:20:03] [TRT] [V] Tactic Name: sm70_xmma_fprop_implicit_gemm_f32f32_f32f32_f32_nhwckrsc_nhwc_tilesize32x32x8_stage1_warpsize1x2x1_g1_ffma_aligna4_alignc4 Tactic: 0x3637f3f04d7ae4e6 Time: 0.0103981
[04/24/2026-02:20:03] [TRT] [V] Tactic Name: sm70_xmma_fprop_implicit_gemm_f32f32_f32f32_f32_nhwckrsc_nhwc_tilesize64x32x32_stage1_warpsize1x1x1_g1_ffma_aligna4_alignc4 Tactic: 0xdb73e25ae4006f74 Time: 0.112885
[04/24/2026-02:20:03] [TRT] [V] Tactic Name: sm70_xmma_fprop_implicit_gemm_f32f32_f32f32_f32_nhwckrsc_nhwc_tilesize64x64x8_stage1_warpsize1x4x1_g1_ffma_aligna4_alignc4 Tactic: 0x2595402367cdee5c Time: 0.0104877
[04/24/2026-02:20:03] [TRT] [V] Tactic Name: sm80_xmma_fprop_implicit_gemm_f32f32_f32f32_f32_nhwckrsc_nhwc_tilesize128x16x8_stage3_warpsize4x1x1_g1_ffma_aligna4_alignc4 Tactic: 0x92ed3100c35fc43e Time: 0.0085248
[04/24/2026-02:20:03] [TRT] [V] Tactic Name: sm80_xmma_fprop_implicit_gemm_f32f32_f32f32_f32_nhwckrsc_nhwc_tilesize64x64x8_stage3_warpsize1x4x1_g1_ffma_aligna4_alignc4 Tactic: 0x62835fce994f06dd Time: 0.00992408
[04/24/2026-02:20:03] [TRT] [V] Tactic Name: sm70_xmma_fprop_implicit_gemm_f32f32_f32f32_f32_nhwckrsc_nhwc_tilesize32x32x8_stage1_warpsize1x2x1_g1_ffma_t1r5s5_aligna4_alignc4 Tactic: 0xad9ed5f51d32aa29 Time: 0.0097664
[04/24/2026-02:20:03] [TRT] [V] Tactic Name: sm70_xmma_fprop_implicit_gemm_f32f32_f32f32_f32_nhwckrsc_nhwc_tilesize64x16x16_stage1_warpsize1x1x1_g1_ffma_aligna4_alignc4 Tactic: 0x3f904b355d9ca8e6 Time: 0.0189754
[04/24/2026-02:20:03] [TRT] [V] Tactic Name: sm80_xmma_fprop_implicit_gemm_indexed_f32f32_f32f32_f32_nhwckrsc_nhwc_tilesize32x32x8_stage3_warpsize1x2x1_g1_ffma_aligna4_alignc4 Tactic: 0x0a143be7a52f301a Time: 0.00796292
[04/24/2026-02:20:03] [TRT] [V] Tactic Name: sm80_xmma_fprop_implicit_gemm_f32f32_f32f32_f32_nhwckrsc_nhwc_tilesize32x32x8_stage3_warpsize1x2x1_g1_ffma_aligna4_alignc4 Tactic: 0x7121ec1db3f80c67 Time: 0.00732081
[04/24/2026-02:20:03] [TRT] [V] Tactic Name: sm70_xmma_fprop_implicit_gemm_f32f32_f32f32_f32_nhwckrsc_nhwc_tilesize256x128x8_stage1_warpsize2x4x1_g1_ffma_aligna4_alignc4 Tactic: 0x0447933cc2be855a Time: 0.0360576
[04/24/2026-02:20:03] [TRT] [V] Convolution1 + Activation1 (CaskConvolution[0x80000009]) profiling completed in 0.0880858 seconds. Fastest Tactic: 0xcf8ea142095f02d2 Time: 0.0043986
[04/24/2026-02:20:03] [TRT] [V] Skipping CaskFlattenConvolution: No valid tactics for Convolution1 + Activation1
[04/24/2026-02:20:03] [TRT] [V] >>>>>>>>>>>>>>> Chose Runner Type: CaskConvolution Tactic: 0xcf8ea142095f02d2
[04/24/2026-02:20:03] [TRT] [V] *************** Autotuning format combination: Float(784,1:4,28,1) -> Float(25088,784,28,1) ***************
[04/24/2026-02:20:03] [TRT] [V] --------------- Timing Runner: Convolution1 + Activation1 (CaskConvolution[0x80000009])
[04/24/2026-02:20:03] [TRT] [V] Tactic Name: sm80_xmma_fprop_implicit_gemm_indexed_f32f32_tf32f32_f32_nhwckrsc_nchw_tilesize128x128x16_stage4_warpsize2x2x1_g1_tensor16x8x8 Tactic: 0xe0a307ffe0ffb6a5 Time: 0.0168363
[04/24/2026-02:20:03] [TRT] [V] Tactic Name: sm80_xmma_fprop_implicit_gemm_f32f32_tf32f32_f32_nhwckrsc_nchw_tilesize128x128x16_stage4_warpsize2x2x1_g1_tensor16x8x8 Tactic: 0x3104d85fecdd547c Time: 0.0171605
[04/24/2026-02:20:03] [TRT] [V] Tactic Name: sm80_xmma_fprop_implicit_gemm_indexed_f32f32_tf32f32_f32_nhwckrsc_nchw_tilesize128x128x16_stage4_warpsize2x2x1_g1_tensor16x8x8_alignc4 Tactic: 0xe8f7b6a5bab325f8 Time: 0.0180632
[04/24/2026-02:20:03] [TRT] [V] Tactic Name: sm80_xmma_fprop_implicit_gemm_f32f32_tf32f32_f32_nhwckrsc_nchw_tilesize128x128x16_stage4_warpsize2x2x1_g1_tensor16x8x8_alignc4 Tactic: 0x9fd9fe001908ce2e Time: 0.0173189
[04/24/2026-02:20:03] [TRT] [V] Convolution1 + Activation1 (CaskConvolution[0x80000009]) profiling completed in 0.0110026 seconds. Fastest Tactic: 0xe0a307ffe0ffb6a5 Time: 0.0168363
[04/24/2026-02:20:03] [TRT] [V] Skipping CaskFlattenConvolution: No valid tactics for Convolution1 + Activation1
[04/24/2026-02:20:03] [TRT] [V] >>>>>>>>>>>>>>> Chose Runner Type: CaskConvolution Tactic: 0xe0a307ffe0ffb6a5
[04/24/2026-02:20:03] [TRT] [V] *************** Autotuning format combination: Float(784,1:4,28,1) -> Float(6272,1:4,224,8) ***************
[04/24/2026-02:20:03] [TRT] [V] --------------- Timing Runner: Convolution1 + Activation1 (CaskConvolution[0x80000009])
[04/24/2026-02:20:03] [TRT] [V] Tactic Name: ampere_scudnn_128x32_sliced1x4_ldg4_relu_exp_small_nhwc_tn_v1 Tactic: 0x3e2b881168d9689d Time: 0.0256755
[04/24/2026-02:20:03] [TRT] [V] Tactic Name: ampere_scudnn_128x128_ldg4_relu_exp_medium_nhwc_tn_v1 Tactic: 0x7bc32c782b800c48 Time: 0.0224562
[04/24/2026-02:20:04] [TRT] [V] Tactic Name: sm80_xmma_fprop_implicit_gemm_f32f32_tf32f32_f32_nhwckrsc_nhwc_tilesize128x128x16_stage4_warpsize2x2x1_g1_tensor16x8x8 Tactic: 0xb443c221fcb1565b Time: 0.0164978
[04/24/2026-02:20:04] [TRT] [V] Tactic Name: sm80_xmma_fprop_implicit_gemm_indexed_f32f32_tf32f32_f32_nhwckrsc_nhwc_tilesize128x128x16_stage4_warpsize2x2x1_g1_tensor16x8x8 Tactic: 0x65e41d81f093b482 Time: 0.0173995
[04/24/2026-02:20:04] [TRT] [V] Tactic Name: sm80_xmma_fprop_implicit_gemm_indexed_wo_smem_f32f32_tf32f32_f32_nhwckrsc_nhwc_tilesize128x32x16_stage1_warpsize4x1x1_g1_tensor16x8x8_aligna8_alignc4 Tactic: 0xf78ec258f27b3e23 Time: 0.00852613
[04/24/2026-02:20:04] [TRT] [V] Tactic Name: sm80_xmma_fprop_implicit_gemm_indexed_wo_smem_f32f32_tf32f32_f32_nhwckrsc_nhwc_tilesize128x32x16_stage1_warpsize4x1x1_g1_tensor16x8x8_aligna4_alignc8 Tactic: 0x7e40882e33c8fbf1 Time: 0.00720794
[04/24/2026-02:20:04] [TRT] [V] Tactic Name: sm80_xmma_fprop_implicit_gemm_indexed_wo_smem_f32f32_tf32f32_f32_nhwckrsc_nhwc_tilesize128x16x32_stage1_warpsize4x1x1_g1_tensor16x8x8_aligna8_alignc8 Tactic: 0x4640eb34c8ecc700 Time: 0.00804927
[04/24/2026-02:20:04] [TRT] [V] Tactic Name: sm80_xmma_fprop_implicit_gemm_indexed_wo_smem_f32f32_tf32f32_f32_nhwckrsc_nhwc_tilesize128x16x32_stage1_warpsize4x1x1_g1_tensor16x8x8_aligna4 Tactic: 0xb3e5ce9d1b1da232 Time: 0.00804063
[04/24/2026-02:20:04] [TRT] [V] Tactic Name: sm80_xmma_fprop_implicit_gemm_indexed_wo_smem_f32f32_tf32f32_f32_nhwckrsc_nhwc_tilesize128x16x64_stage1_warpsize4x1x1_g1_tensor16x8x8 Tactic: 0x10383a0781d24dde Time: 0.00445653
[04/24/2026-02:20:04] [TRT] [V] Tactic Name: sm80_xmma_fprop_implicit_gemm_indexed_wo_smem_f32f32_tf32f32_f32_nhwckrsc_nhwc_tilesize128x16x64_stage1_warpsize4x1x1_g1_tensor16x8x8_alignc8 Tactic: 0x4037b478ce77e422 Time: 0.00542503
[04/24/2026-02:20:04] [TRT] [V] Tactic Name: sm80_xmma_fprop_implicit_gemm_indexed_wo_smem_f32f32_tf32f32_f32_nhwckrsc_nhwc_tilesize128x32x64_stage1_warpsize4x1x1_g1_tensor16x8x8_alignc8 Tactic: 0x3a8712b17741b582 Time: 0.00550557
[04/24/2026-02:20:04] [TRT] [V] Tactic Name: sm80_xmma_fprop_implicit_gemm_indexed_wo_smem_f32f32_tf32f32_f32_nhwckrsc_nhwc_tilesize128x32x64_stage1_warpsize4x1x1_g1_tensor16x8x8_alignc4 Tactic: 0xb6f6563c77d057d7 Time: 0.0060641
[04/24/2026-02:20:04] [TRT] [V] Tactic Name: sm80_xmma_fprop_implicit_gemm_indexed_wo_smem_f32f32_tf32f32_f32_nhwckrsc_nhwc_tilesize128x32x64_stage1_warpsize4x1x1_g1_tensor16x8x8_aligna8 Tactic: 0x9355e195cee05798 Time: 0.00624771
[04/24/2026-02:20:04] [TRT] [V] Tactic Name: sm80_xmma_fprop_implicit_gemm_indexed_wo_smem_f32f32_tf32f32_f32_nhwckrsc_nhwc_tilesize128x32x64_stage1_warpsize4x1x1_g1_tensor16x8x8_aligna4_alignc8 Tactic: 0x1acd4f006848c62b Time: 0.0081561
[04/24/2026-02:20:04] [TRT] [V] Tactic Name: sm80_xmma_fprop_implicit_gemm_indexed_wo_smem_f32f32_tf32f32_f32_nhwckrsc_nhwc_tilesize128x16x64_stage1_warpsize4x1x1_g1_tensor16x8x8_alignc4 Tactic: 0xcc46f0f5cee60677 Time: 0.00473375
[04/24/2026-02:20:04] [TRT] [V] Tactic Name: sm80_xmma_fprop_implicit_gemm_indexed_wo_smem_f32f32_tf32f32_f32_nhwckrsc_nhwc_tilesize128x32x16_stage1_warpsize4x1x1_g1_tensor16x8x8 Tactic: 0x9cb304e2edbc1221 Time: 0.00629394
[04/24/2026-02:20:04] [TRT] [V] Tactic Name: sm80_xmma_fprop_implicit_gemm_indexed_wo_smem_f32f32_tf32f32_f32_nhwckrsc_nhwc_tilesize128x32x64_stage1_warpsize4x1x1_g1_tensor16x8x8_aligna8_alignc4 Tactic: 0x93030576a9fb03f9 Time: 0.00662086
[04/24/2026-02:20:04] [TRT] [V] Tactic Name: sm80_xmma_fprop_implicit_gemm_indexed_wo_smem_f32f32_tf32f32_f32_nhwckrsc_nhwc_tilesize128x16x32_stage1_warpsize4x1x1_g1_tensor16x8x8_aligna8 Tactic: 0x3f948a101b8c4067 Time: 0.00771757
[04/24/2026-02:20:04] [TRT] [V] Tactic Name: sm80_xmma_fprop_implicit_gemm_indexed_wo_smem_f32f32_tf32f32_f32_nhwckrsc_nhwc_tilesize128x16x32_stage1_warpsize4x1x1_g1_tensor16x8x8_alignc4 Tactic: 0x1a373db9a2bc4028 Time: 0.00610735
[04/24/2026-02:20:04] [TRT] [V] Tactic Name: sm80_xmma_fprop_implicit_gemm_indexed_wo_smem_f32f32_tf32f32_f32_nhwckrsc_nhwc_tilesize128x16x64_stage1_warpsize4x1x1_g1_tensor16x8x8_aligna8_alignc4 Tactic: 0xab0496509b88ebe0 Time: 0.00688544
[04/24/2026-02:20:04] [TRT] [V] Tactic Name: sm80_xmma_fprop_implicit_gemm_indexed_wo_smem_f32f32_tf32f32_f32_nhwckrsc_nhwc_tilesize128x32x64_stage1_warpsize4x1x1_g1_tensor16x8x8 Tactic: 0xb33296dda7141c64 Time: 0.0056669
[04/24/2026-02:20:04] [TRT] [V] Tactic Name: ampere_scudnn_128x128_ldg4_relu_exp_small_nhwc_tn_v1 Tactic: 0xf90060ce8193b811 Time: 0.022118
[04/24/2026-02:20:04] [TRT] [V] Tactic Name: sm80_xmma_fprop_implicit_gemm_indexed_wo_smem_f32f32_tf32f32_f32_nhwckrsc_nhwc_tilesize128x32x16_stage1_warpsize4x1x1_g1_tensor16x8x8_aligna4 Tactic: 0x570667f2a28165a0 Time: 0.00823753
[04/24/2026-02:20:04] [TRT] [V] Tactic Name: sm80_xmma_fprop_implicit_gemm_indexed_wo_smem_f32f32_tf32f32_f32_nhwckrsc_nhwc_tilesize128x32x16_stage1_warpsize4x1x1_g1_tensor16x8x8_alignc4 Tactic: 0xfed494d61b2087ba Time: 0.00673301
[04/24/2026-02:20:04] [TRT] [V] Tactic Name: sm80_xmma_fprop_implicit_gemm_indexed_wo_smem_f32f32_tf32f32_f32_nhwckrsc_nhwc_tilesize128x32x16_stage1_warpsize4x1x1_g1_tensor16x8x8_aligna8_alignc8 Tactic: 0x7bff86d5f2eadc76 Time: 0.00807111
[04/24/2026-02:20:04] [TRT] [V] Tactic Name: sm80_xmma_fprop_implicit_gemm_f32f32_tf32f32_f32_nhwckrsc_nhwc_tilesize128x128x16_stage4_warpsize2x2x1_g1_tensor16x8x8_t1r5s5 Tactic: 0x94f2b2320bb3fc74 Time: 0.0159258
[04/24/2026-02:20:04] [TRT] [V] Tactic Name: sm80_xmma_fprop_implicit_gemm_indexed_wo_smem_f32f32_tf32f32_f32_nhwckrsc_nhwc_tilesize128x16x32_stage1_warpsize4x1x1_g1_tensor16x8x8_alignc8 Tactic: 0x96467934a22da27d Time: 0.00588482
[04/24/2026-02:20:04] [TRT] [V] Tactic Name: sm80_xmma_fprop_implicit_gemm_indexed_wo_smem_f32f32_tf32f32_f32_nhwckrsc_nhwc_tilesize128x32x16_stage1_warpsize4x1x1_g1_tensor16x8x8_aligna8 Tactic: 0xdb77237fa21087f5 Time: 0.00789309
[04/24/2026-02:20:04] [TRT] [V] Tactic Name: sm80_xmma_fprop_implicit_gemm_indexed_wo_smem_f32f32_tf32f32_f32_nhwckrsc_nhwc_tilesize128x16x64_stage1_warpsize4x1x1_g1_tensor16x8x8_aligna4_alignc8 Tactic: 0x22cadc265a3b2e32 Time: 0.00720771
[04/24/2026-02:20:04] [TRT] [V] Tactic Name: sm80_xmma_fprop_implicit_gemm_indexed_wo_smem_f32f32_tf32f32_f32_nhwckrsc_nhwc_tilesize128x32x16_stage1_warpsize4x1x1_g1_tensor16x8x8_alignc8 Tactic: 0x72a5d05b1bb165ef Time: 0.00626568
[04/24/2026-02:20:04] [TRT] [V] Tactic Name: sm80_xmma_fprop_implicit_gemm_indexed_wo_smem_f32f32_tf32f32_f32_nhwckrsc_nhwc_tilesize128x16x64_stage1_warpsize4x1x1_g1_tensor16x8x8_aligna8 Tactic: 0xe9e5475c77d60638 Time: 0.00653334
[04/24/2026-02:20:04] [TRT] [V] Tactic Name: ampere_scudnn_128x64_sliced1x2_ldg4_relu_exp_large_nhwc_tn_v1 Tactic: 0xbdfdef6b84f7ccc9 Time: 0.0251855
[04/24/2026-02:20:04] [TRT] [V] Tactic Name: sm80_xmma_fprop_implicit_gemm_indexed_wo_smem_f32f32_tf32f32_f32_nhwckrsc_nhwc_tilesize128x16x32_stage1_warpsize4x1x1_g1_tensor16x8x8_aligna4_alignc8 Tactic: 0x43ffe5cf09cee087 Time: 0.00742495
[04/24/2026-02:20:04] [TRT] [V] Tactic Name: sm80_xmma_fprop_implicit_gemm_indexed_wo_smem_f32f32_tf32f32_f32_nhwckrsc_nhwc_tilesize128x16x32_stage1_warpsize4x1x1_g1_tensor16x8x8 Tactic: 0xae48d3ccfe1edfcd Time: 0.005056
[04/24/2026-02:20:04] [TRT] [V] Convolution1 + Activation1 (CaskConvolution[0x80000009]) profiling completed in 0.105935 seconds. Fastest Tactic: 0x10383a0781d24dde Time: 0.00445653
[04/24/2026-02:20:04] [TRT] [V] Skipping CaskFlattenConvolution: No valid tactics for Convolution1 + Activation1
[04/24/2026-02:20:04] [TRT] [V] >>>>>>>>>>>>>>> Chose Runner Type: CaskConvolution Tactic: 0x10383a0781d24dde
[04/24/2026-02:20:04] [TRT] [V] =============== Computing costs for Pooling1
[04/24/2026-02:20:04] [TRT] [V] *************** Autotuning format combination: Float(25088,784,28,1) -> Float(6272,196,14,1) ***************
[04/24/2026-02:20:04] [TRT] [V] --------------- Timing Runner: Pooling1 (CaskPooling[0x8000002f])
[04/24/2026-02:20:04] [TRT] [V] Tactic Name: sm50_xmma_pooling_tiled_FP32NCHW_kMAX_tP2_tQ32_tR2_tS2_tU2_tV2_tUnroll6_tThreads256 Tactic: 0x60eceb67eff69444 Time: 0.00242102
[04/24/2026-02:20:04] [TRT] [V] Tactic Name: sm50_xmma_pooling_tiled_FP32NCHW_kMAX_tP2_tQ32_tR2_tS2_tU2_tV2_tUnroll1_tThreads256 Tactic: 0xc7d8c563bd6ced88 Time: 0.00249791
[04/24/2026-02:20:04] [TRT] [V] Tactic Name: sm50_xmma_pooling_nd_NCDHW_kMAX_kGENERIC_3D_POOLING_MODE_kFLOAT_0 Tactic: 0x5faf4a0a8a5670ed Time: 0.00269815
[04/24/2026-02:20:04] [TRT] [V] Tactic Name: sm50_xmma_pooling_tiled_FP32NCHW_kMAX_tP2_tQ16_tR2_tS2_tU2_tV2_tUnroll6_tThreads128 Tactic: 0xf4b20242f8c135e7 Time: 0.00235162
[04/24/2026-02:20:04] [TRT] [V] Tactic Name: sm50_xmma_pooling_tiled_FP32NCHW_kMAX_tP2_tQ16_tR2_tS2_tU2_tV2_tUnroll2_tThreads128 Tactic: 0xa7a495ee24d0c659 Time: 0.00236444
[04/24/2026-02:20:04] [TRT] [V] Tactic Name: sm50_xmma_pooling_fw_4d_FP32FP32NCHW_Max Tactic: 0xb59f9cfb90407c92 Time: 0.00278649
[04/24/2026-02:20:04] [TRT] [V] Tactic Name: sm50_xmma_pooling_tiled_FP32NCHW_kMAX_tP2_tQ32_tR2_tS2_tU2_tV2_tUnroll8_tThreads256 Tactic: 0xbc5c1844e5cc7959 Time: 0.00249863
[04/24/2026-02:20:04] [TRT] [V] Tactic Name: sm50_xmma_pooling_tiled_FP32NCHW_kMAX_tP2_tQ16_tR2_tS2_tU2_tV2_tUnroll8_tThreads128 Tactic: 0x2802f161f2fbd8fa Time: 0.00247071
[04/24/2026-02:20:04] [TRT] [V] Tactic Name: sm50_xmma_pooling_tiled_FP32NCHW_kMAX_tP2_tQ16_tR2_tS2_tU2_tV2_tUnroll3_tThreads128 Tactic: 0x7a0d6790c453b5f4 Time: 0.00242728
[04/24/2026-02:20:04] [TRT] [V] Tactic Name: sm50_xmma_pooling_tiled_FP32NCHW_kMAX_tP2_tQ16_tR2_tS2_tU2_tV2_tUnroll1_tThreads128 Tactic: 0x53862c46aa5b4c2b Time: 0.00249059
[04/24/2026-02:20:04] [TRT] [V] Tactic Name: sm50_xmma_pooling_tiled_FP32NCHW_kMAX_tP2_tQ16_tR2_tS2_tU2_tV2_tUnroll7_tThreads128 Tactic: 0x291bf03c1842464a Time: 0.00244422
[04/24/2026-02:20:04] [TRT] [V] Tactic Name: sm50_xmma_pooling_tiled_FP32NCHW_kMAX_tP2_tQ32_tR2_tS2_tU2_tV2_tUnroll5_tThreads256 Tactic: 0x94ce52cf617d1e36 Time: 0.00240069
[04/24/2026-02:20:04] [TRT] [V] Tactic Name: sm50_xmma_pooling_tiled_FP32NCHW_kMAX_tP2_tQ32_tR2_tS2_tU2_tV2_tUnroll4_tThreads256 Tactic: 0x4967a0b181fe6d9b Time: 0.00239825
[04/24/2026-02:20:04] [TRT] [V] Tactic Name: sm50_xmma_pooling_tiled_FP32NCHW_kMAX_tP2_tQ16_tR2_tS2_tU2_tV2_tUnroll5_tThreads128 Tactic: 0x0090bbea764abf95 Time: 0.00236679
[04/24/2026-02:20:04] [TRT] [V] Tactic Name: sm50_xmma_pooling_tiled_FP32NCHW_kMAX_tP2_tQ32_tR2_tS2_tU2_tV2_tUnroll7_tThreads256 Tactic: 0xbd4519190f75e7e9 Time: 0.00244282
[04/24/2026-02:20:04] [TRT] [V] Tactic Name: sm50_xmma_pooling_tiled_FP32NCHW_kMAX_tP2_tQ32_tR2_tS2_tU2_tV2_tUnroll2_tThreads256 Tactic: 0x33fa7ccb33e767fa Time: 0.00240215
[04/24/2026-02:20:04] [TRT] [V] Tactic Name: sm50_xmma_pooling_tiled_FP32NCHW_kMAX_tP2_tQ32_tR2_tS2_tU2_tV2_tUnroll3_tThreads256 Tactic: 0xee538eb5d3641457 Time: 0.00280587
[04/24/2026-02:20:04] [TRT] [V] Tactic Name: sm50_xmma_pooling_tiled_FP32NCHW_kMAX_tP2_tQ16_tR2_tS2_tU2_tV2_tUnroll4_tThreads128 Tactic: 0xdd39499496c9cc38 Time: 0.00242427
[04/24/2026-02:20:04] [TRT] [V] Pooling1 (CaskPooling[0x8000002f]) profiling completed in 0.052607 seconds. Fastest Tactic: 0xf4b20242f8c135e7 Time: 0.00235162
[04/24/2026-02:20:04] [TRT] [V] >>>>>>>>>>>>>>> Chose Runner Type: CaskPooling Tactic: 0xf4b20242f8c135e7
[04/24/2026-02:20:04] [TRT] [V] *************** Autotuning format combination: Float(6272,1:4,224,8) -> Float(1568,1:4,112,8) ***************
[04/24/2026-02:20:04] [TRT] [V] --------------- Timing Runner: Pooling1 (CaskPooling[0x8000002f])
[04/24/2026-02:20:04] [TRT] [V] Tactic Name: sm50_xmma_pooling_max_nhwc_FP32FP32_WINDOWSIZE_0_PROPAGATE_NAN_2D Tactic: 0x8382d5c464539e87 Time: 0.00289913
[04/24/2026-02:20:04] [TRT] [V] Tactic Name: sm50_xmma_pooling_max_nhwc_FP32FP32_WINDOWSIZE_0_NOT_PROPAGATE_NAN_2D Tactic: 0xaec8628e8180bced Time: 0.00293053
[04/24/2026-02:20:04] [TRT] [V] Tactic Name: sm50_xmma_pooling_max_nhwc_FP32FP32_WINDOWSIZE_0_PROPAGATE_NAN_3D Tactic: 0xd76bac5638836f8a Time: 0.002903
[04/24/2026-02:20:04] [TRT] [V] Tactic Name: sm50_xmma_pooling_max_nhwc_FP32FP32_WINDOWSIZE_0_NOT_PROPAGATE_NAN_3D Tactic: 0xfa211b1cdd504de0 Time: 0.00283797
[04/24/2026-02:20:04] [TRT] [V] Tactic Name: sm50_xmma_pooling_fw_4d_FP32FP32NHWC_Max_CAlign4 Tactic: 0x22fb1bb4a70e340d Time: 0.00284809
[04/24/2026-02:20:04] [TRT] [V] Pooling1 (CaskPooling[0x8000002f]) profiling completed in 0.014992 seconds. Fastest Tactic: 0xfa211b1cdd504de0 Time: 0.00283797
[04/24/2026-02:20:04] [TRT] [V] >>>>>>>>>>>>>>> Chose Runner Type: CaskPooling Tactic: 0xfa211b1cdd504de0
[04/24/2026-02:20:04] [TRT] [V] =============== Computing costs for Convolution2 + Activation2
[04/24/2026-02:20:04] [TRT] [V] *************** Autotuning format combination: Float(6272,196,14,1) -> Float(12544,196,14,1) ***************
[04/24/2026-02:20:04] [TRT] [V] --------------- Timing Runner: Convolution2 + Activation2 (CaskConvolution[0x80000009])
[04/24/2026-02:20:04] [TRT] [V] Tactic Name: ampere_scudnn_128x128_relu_medium_nn_v1 Tactic: 0xf067e6205da31c2e Time: 0.0770731
[04/24/2026-02:20:04] [TRT] [V] Tactic Name: ampere_scudnn_128x32_relu_small_nn_v1 Tactic: 0xa8609adc4e0ceb90 Time: 0.067168
[04/24/2026-02:20:04] [TRT] [V] Tactic Name: ampere_scudnn_128x64_relu_medium_nn_v1 Tactic: 0xf64396b97c889179 Time: 0.0706645
[04/24/2026-02:20:04] [TRT] [V] Tactic Name: sm70_xmma_fprop_implicit_gemm_f32f32_f32f32_f32_nchwkcrs_nchw_tilesize64x64x8_stage1_warpsize1x4x1_g1_ffma_aligna4_alignc4 Tactic: 0xe40b38338a3a7d7e Time: 0.0265255
[04/24/2026-02:20:04] [TRT] [V] Tactic Name: sm70_xmma_fprop_implicit_gemm_f32f32_f32f32_f32_nchwkcrs_nchw_tilesize32x32x8_stage1_warpsize1x2x1_g1_ffma_aligna4_alignc4 Tactic: 0xf7a98be0a08d77c4 Time: 0.0240579
[04/24/2026-02:20:04] [TRT] [V] Tactic Name: sm70_xmma_fprop_implicit_gemm_f32f32_f32f32_f32_nchwkcrs_nchw_tilesize64x128x8_stage1_warpsize1x4x1_g1_ffma_aligna4_alignc4 Tactic: 0xd1338f4b38d341e2 Time: 0.0357472
[04/24/2026-02:20:04] [TRT] [V] Tactic Name: sm80_xmma_fprop_implicit_gemm_f32f32_f32f32_f32_nchwkcrs_nchw_tilesize64x128x8_stage3_warpsize1x4x1_g1_ffma_aligna4_alignc4 Tactic: 0x5aa723e0481da855 Time: 0.0384095
[04/24/2026-02:20:04] [TRT] [V] Tactic Name: sm80_xmma_fprop_implicit_gemm_f32f32_f32f32_f32_nchwkcrs_nchw_tilesize256x128x8_stage3_warpsize4x2x1_g1_ffma_aligna4_alignc4 Tactic: 0xbb8c3889c7eacd30 Time: 0.113895
[04/24/2026-02:20:04] [TRT] [V] Tactic Name: sm70_xmma_fprop_implicit_gemm_indexed_f32f32_f32f32_f32_nchwkcrs_nchw_tilesize128x16x8_stage1_warpsize4x1x1_g1_ffma_aligna4_alignc4 Tactic: 0x65d82d184f452332 Time: 0.0423347
[04/24/2026-02:20:04] [TRT] [V] Tactic Name: sm70_xmma_fprop_implicit_gemm_indexed_f32f32_f32f32_f32_nchwkcrs_nchw_tilesize32x32x8_stage1_warpsize1x2x1_g1_ffma_aligna4_alignc4 Tactic: 0x9efed776051c0873 Time: 0.0381748
[04/24/2026-02:20:04] [TRT] [V] Tactic Name: sm70_xmma_fprop_implicit_gemm_indexed_f32f32_f32f32_f32_nchwkcrs_nchw_tilesize128x32x8_stage1_warpsize2x2x1_g1_ffma_aligna4_alignc4 Tactic: 0x8c4f6360145d6a1f Time: 0.046208
[04/24/2026-02:20:04] [TRT] [V] Tactic Name: sm70_xmma_fprop_implicit_gemm_indexed_f32f32_f32f32_f32_nchwkcrs_nchw_tilesize64x64x8_stage1_warpsize1x4x1_g1_ffma_aligna4_alignc4 Tactic: 0x8d5c64a52fab02c9 Time: 0.0328785
[04/24/2026-02:20:04] [TRT] [V] Tactic Name: sm80_xmma_fprop_implicit_gemm_indexed_f32f32_f32f32_f32_nchwkcrs_nchw_tilesize128x64x8_stage2_warpsize4x1x1_g1_ffma_aligna4_alignc4_beta0_packed_stride Tactic: 0x1673e3594ce11cea Time: 0.0552137
[04/24/2026-02:20:04] [TRT] [V] Tactic Name: sm80_xmma_fprop_implicit_gemm_indexed_f32f32_f32f32_f32_nchwkcrs_nchw_tilesize128x16x8_stage3_warpsize4x1x1_g1_ffma_aligna4_alignc4 Tactic: 0x40a12e3938221818 Time: 0.0384439
[04/24/2026-02:20:04] [TRT] [V] Tactic Name: sm80_xmma_fprop_implicit_gemm_indexed_f32f32_f32f32_f32_nchwkcrs_nchw_tilesize128x32x8_stage3_warpsize2x2x1_g1_ffma_aligna4_alignc4 Tactic: 0xa9366041633a5135 Time: 0.04258
[04/24/2026-02:20:04] [TRT] [V] Tactic Name: sm80_xmma_fprop_implicit_gemm_f32f32_f32f32_f32_nchwkcrs_nchw_tilesize32x32x8_stage3_warpsize1x2x1_g1_ffma_t1r5s5_aligna4_alignc4 Tactic: 0x5b8bf1b8028629d9 Time: 0.0193683
[04/24/2026-02:20:04] [TRT] [V] Tactic Name: sm70_xmma_fprop_implicit_gemm_f32f32_f32f32_f32_nchwkcrs_nchw_tilesize32x32x8_stage1_warpsize1x2x1_g1_ffma_t1r5s5_aligna4_alignc4 Tactic: 0x7e1e4d26cfa285f9 Time: 0.0277826
[04/24/2026-02:20:04] [TRT] [V] Tactic Name: ampere_scudnn_128x64_relu_small_nn_v1 Tactic: 0x3f243c490d502deb Time: 0.0520244
[04/24/2026-02:20:04] [TRT] [V] Tactic Name: sm70_xmma_fprop_implicit_gemm_f32f32_f32f32_f32_nchwkcrs_nchw_tilesize128x16x8_stage1_warpsize4x1x1_g1_ffma_aligna4_alignc4 Tactic: 0x160b77f4a95ab6d3 Time: 0.033424
[04/24/2026-02:20:04] [TRT] [V] Tactic Name: sm70_xmma_fprop_implicit_gemm_f32f32_f32f32_f32_nchwkcrs_nchw_tilesize128x64x8_stage1_warpsize2x2x1_g1_ffma_aligna4_alignc4 Tactic: 0x994f5b723e2d80da Time: 0.042232
[04/24/2026-02:20:04] [TRT] [V] Tactic Name: sm80_xmma_fprop_implicit_gemm_f32f32_f32f32_f32_nchwkcrs_nchw_tilesize64x64x8_stage3_warpsize1x4x1_g1_ffma_aligna4_alignc4 Tactic: 0xa31d27de74b895ff Time: 0.0253653
[04/24/2026-02:20:04] [TRT] [V] Tactic Name: sm80_xmma_fprop_implicit_gemm_f32f32_f32f32_f32_nchwkcrs_nchw_tilesize32x32x8_stage3_warpsize1x2x1_g1_ffma_aligna4_alignc4 Tactic: 0xb0bf940d5e0f9f45 Time: 0.0193807
[04/24/2026-02:20:04] [TRT] [V] Tactic Name: ampere_scudnn_128x64_relu_xregs_large_nn_v1 Tactic: 0x5deb29b7a8e275f7 Time: 0.0626773
[04/24/2026-02:20:04] [TRT] [V] Tactic Name: sm70_xmma_fprop_implicit_gemm_f32f32_f32f32_f32_nchwkcrs_nchw_tilesize64x64x8_stage1_warpsize1x4x1_g1_ffma_t1r5s5_aligna4_alignc4 Tactic: 0xb3ea28771604ad88 Time: 0.0262622
[04/24/2026-02:20:04] [TRT] [V] Tactic Name: sm80_xmma_fprop_implicit_gemm_f32f32_f32f32_f32_nchwkcrs_nchw_tilesize128x16x8_stage3_warpsize4x1x1_g1_ffma_aligna4_alignc4 Tactic: 0x9d9fdb5fd9945f64 Time: 0.0252274
[04/24/2026-02:20:04] [TRT] [V] Tactic Name: sm80_xmma_fprop_implicit_gemm_indexed_f32f32_f32f32_f32_nchwkcrs_nchw_tilesize64x64x8_stage3_warpsize1x4x1_g1_ffma_aligna4_alignc4 Tactic: 0xd828f024626fa982 Time: 0.0310672
[04/24/2026-02:20:04] [TRT] [V] Tactic Name: sm80_xmma_fprop_implicit_gemm_f32f32_f32f32_f32_nchwkcrs_nchw_tilesize128x64x8_stage3_warpsize2x2x1_g1_ffma_aligna4_alignc4 Tactic: 0x12dbf7d94ee3696d Time: 0.0410169
[04/24/2026-02:20:04] [TRT] [V] Tactic Name: sm80_xmma_fprop_implicit_gemm_f32f32_f32f32_f32_nchwkcrs_nchw_tilesize64x64x8_stage3_warpsize1x4x1_g1_ffma_t1r5s5_aligna4_alignc4 Tactic: 0x967f94e9db2001a8 Time: 0.0241661
[04/24/2026-02:20:04] [TRT] [V] Tactic Name: sm80_xmma_fprop_implicit_gemm_indexed_f32f32_f32f32_f32_nchwkcrs_nchw_tilesize32x32x8_stage3_warpsize1x2x1_g1_ffma_aligna4_alignc4 Tactic: 0xcb8a43f748d8a338 Time: 0.0251558
[04/24/2026-02:20:04] [TRT] [V] Tactic Name: sm70_xmma_fprop_implicit_gemm_f32f32_f32f32_f32_nchwkcrs_nchw_tilesize128x256x8_stage1_warpsize2x4x1_g1_ffma_aligna4_alignc4 Tactic: 0xd2aa21bfe2167c0c Time: 0.10752
[04/24/2026-02:20:04] [TRT] [V] Tactic Name: ampere_scudnn_128x128_relu_small_nn_v1 Tactic: 0x503619c69ae500ff Time: 0.0661991
[04/24/2026-02:20:04] [TRT] [V] Tactic Name: sm80_xmma_fprop_implicit_gemm_indexed_f32f32_f32f32_f32_nchwkcrs_nchw_tilesize128x64x8_stage2_warpsize1x4x1_g1_ffma_aligna4_alignc4_beta0_packed_stride Tactic: 0xede36641840ce3d2 Time: 0.0505707
[04/24/2026-02:20:04] [TRT] [V] Tactic Name: sm70_xmma_fprop_implicit_gemm_f32f32_f32f32_f32_nchwkcrs_nchw_tilesize128x128x8_stage1_warpsize2x2x1_g1_ffma_aligna4_alignc4 Tactic: 0xac49795b871b0d29 Time: 0.0664053
[04/24/2026-02:20:04] [TRT] [V] Tactic Name: sm80_xmma_fprop_implicit_gemm_indexed_f32f32_f32f32_f32_nchwkcrs_nchw_tilesize128x64x8_stage2_warpsize2x2x1_g1_ffma_aligna4_alignc4_beta0_packed_stride Tactic: 0x31aa67f57c5aea77 Time: 0.0507124
[04/24/2026-02:20:04] [TRT] [V] Convolution2 + Activation2 (CaskConvolution[0x80000009]) profiling completed in 0.0804451 seconds. Fastest Tactic: 0x5b8bf1b8028629d9 Time: 0.0193683
[04/24/2026-02:20:04] [TRT] [V] Skipping CaskFlattenConvolution: No valid tactics for Convolution2 + Activation2
[04/24/2026-02:20:04] [TRT] [V] >>>>>>>>>>>>>>> Chose Runner Type: CaskConvolution Tactic: 0x5b8bf1b8028629d9
[04/24/2026-02:20:04] [TRT] [V] *************** Autotuning format combination: Float(6272,1,448,32) -> Float(12544,1,896,64) ***************
[04/24/2026-02:20:04] [TRT] [V] --------------- Timing Runner: Convolution2 + Activation2 (CaskConvolution[0x80000009])
[04/24/2026-02:20:04] [TRT] [V] Tactic Name: sm70_xmma_fprop_implicit_gemm_f32f32_f32f32_f32_nhwckrsc_nhwc_tilesize64x32x32_stage1_warpsize1x1x1_g1_ffma_t1r5s5_aligna4_alignc4 Tactic: 0x737793996edbf8e2 Time: 0.110224
[04/24/2026-02:20:04] [TRT] [V] Tactic Name: sm80_xmma_fprop_implicit_gemm_f32f32_f32f32_f32_nhwckrsc_nhwc_tilesize64x64x8_stage3_warpsize1x4x1_g1_ffma_t1r5s5_aligna4_alignc4 Tactic: 0x45ff0c3a09b02e78 Time: 0.0239398
[04/24/2026-02:20:04] [TRT] [V] Tactic Name: sm80_xmma_fprop_implicit_gemm_f32f32_f32f32_f32_nhwckrsc_nhwc_tilesize128x64x8_stage3_warpsize2x2x1_g1_ffma_aligna4_alignc4 Tactic: 0x1da91d865428f237 Time: 0.0364224
[04/24/2026-02:20:04] [TRT] [V] Tactic Name: sm70_xmma_fprop_implicit_gemm_indexed_f32f32_f32f32_f32_nhwckrsc_nhwc_tilesize32x32x8_stage1_warpsize1x2x1_g1_ffma_aligna4_alignc4 Tactic: 0x5f60af66e8eb9b51 Time: 0.030224
[04/24/2026-02:20:04] [TRT] [V] Tactic Name: sm70_xmma_fprop_implicit_gemm_indexed_f32f32_f32f32_f32_nhwckrsc_nhwc_tilesize128x32x8_stage1_warpsize2x2x1_g1_ffma_aligna4_alignc4 Tactic: 0x833d893f0e96f145 Time: 0.0338571
[04/24/2026-02:20:04] [TRT] [V] Tactic Name: sm80_xmma_fprop_implicit_gemm_indexed_wo_smem_f32f32_tf32f32_f32_nhwckrsc_nhwc_tilesize128x32x16_stage1_warpsize4x1x1_g1_tensor16x8x8_aligna4_alignc4 Tactic: 0xf231cca3335919a4 Time: 0.0353205
[04/24/2026-02:20:04] [TRT] [V] Tactic Name: sm70_xmma_fprop_implicit_gemm_f32f32_f32f32_f32_nhwckrsc_nhwc_tilesize64x16x16_stage1_warpsize1x1x1_g1_ffma_t1r5s5_aligna4_alignc4 Tactic: 0x247bb0dcaf6f9760 Time: 0.0301467
[04/24/2026-02:20:04] [TRT] [V] Tactic Name: sm80_xmma_fprop_implicit_gemm_indexed_f32f32_f32f32_f32_nhwckrsc_nhwc_tilesize128x16x8_stage3_warpsize4x1x1_g1_ffma_aligna4_alignc4 Tactic: 0x4fd3c46622e98342 Time: 0.0300267
[04/24/2026-02:20:04] [TRT] [V] Tactic Name: sm80_xmma_fprop_implicit_gemm_indexed_wo_smem_f32f32_tf32f32_f32_nhwckrsc_nhwc_tilesize128x16x32_stage1_warpsize4x1x1_g1_tensor16x8x8_aligna4_alignc4 Tactic: 0xcf8ea142095f02d2 Time: 0.0296791
[04/24/2026-02:20:04] [TRT] [V] Tactic Name: sm80_xmma_fprop_implicit_gemm_f32f32_f32f32_f32_nhwckrsc_nhwc_tilesize32x32x8_stage3_warpsize1x2x1_g1_ffma_t1r5s5_aligna4_alignc4 Tactic: 0x880b696bd0160609 Time: 0.0148828
[04/24/2026-02:20:04] [TRT] [V] Tactic Name: sm70_xmma_fprop_implicit_gemm_f32f32_f32f32_f32_nhwckrsc_nhwc_tilesize128x16x8_stage1_warpsize4x1x1_g1_ffma_aligna4_alignc4 Tactic: 0x19799dabb3912d89 Time: 0.0296551
[04/24/2026-02:20:04] [TRT] [V] Tactic Name: sm70_xmma_fprop_implicit_gemm_f32f32_f32f32_f32_nhwckrsc_nhwc_tilesize64x128x8_stage1_warpsize1x4x1_g1_ffma_aligna4_alignc4 Tactic: 0xde4165142218dab8 Time: 0.0348128
[04/24/2026-02:20:04] [TRT] [V] Tactic Name: sm70_xmma_fprop_implicit_gemm_f32f32_f32f32_f32_nhwckrsc_nhwc_tilesize128x64x8_stage1_warpsize2x2x1_g1_ffma_aligna4_alignc4 Tactic: 0x963db12d24e61b80 Time: 0.035808
[04/24/2026-02:20:04] [TRT] [V] Tactic Name: sm80_xmma_fprop_implicit_gemm_indexed_f32f32_f32f32_f32_nhwckrsc_nhwc_tilesize128x32x8_stage3_warpsize2x2x1_g1_ffma_aligna4_alignc4 Tactic: 0xa6448a1e79f1ca6f Time: 0.0297298
[04/24/2026-02:20:04] [TRT] [V] Tactic Name: sm80_xmma_fprop_implicit_gemm_f32f32_f32f32_f32_nhwckrsc_nhwc_tilesize128x16x8_stage3_warpsize4x1x1_g1_ffma_t1r5s5_aligna4_alignc4 Tactic: 0xe35d4a4a3b499fe7 Time: 0.0198657
[04/24/2026-02:20:04] [TRT] [V] Tactic Name: sm80_xmma_fprop_implicit_gemm_indexed_f32f32_f32f32_f32_nhwckrsc_nhwc_tilesize64x64x8_stage3_warpsize1x4x1_g1_ffma_aligna4_alignc4 Tactic: 0x19b688348f983aa0 Time: 0.0263278
[04/24/2026-02:20:04] [TRT] [V] Tactic Name: sm80_xmma_fprop_implicit_gemm_f32f32_f32f32_f32_nhwckrsc_nhwc_tilesize256x64x8_stage3_warpsize2x2x1_g1_ffma_aligna4_alignc4 Tactic: 0x8014228ec08b4d49 Time: 0.0621387
[04/24/2026-02:20:04] [TRT] [V] Tactic Name: sm70_xmma_fprop_implicit_gemm_f32f32_f32f32_f32_nhwckrsc_nhwc_tilesize128x16x8_stage1_warpsize4x1x1_g1_ffma_t1r5s5_aligna4_alignc4 Tactic: 0x54e3b8c9b1e5f17a Time: 0.0298907
[04/24/2026-02:20:04] [TRT] [V] Tactic Name: sm70_xmma_fprop_implicit_gemm_indexed_f32f32_f32f32_f32_nhwckrsc_nhwc_tilesize128x16x8_stage1_warpsize4x1x1_g1_ffma_aligna4_alignc4 Tactic: 0x6aaac747558eb868 Time: 0.033824
[04/24/2026-02:20:04] [TRT] [V] Tactic Name: sm70_xmma_fprop_implicit_gemm_f32f32_f32f32_f32_nhwckrsc_nhwc_tilesize32x32x8_stage1_warpsize1x2x1_g1_ffma_aligna4_alignc4 Tactic: 0x3637f3f04d7ae4e6 Time: 0.0300204
[04/24/2026-02:20:04] [TRT] [V] Tactic Name: sm70_xmma_fprop_implicit_gemm_f32f32_f32f32_f32_nhwckrsc_nhwc_tilesize64x32x32_stage1_warpsize1x1x1_g1_ffma_aligna4_alignc4 Tactic: 0xdb73e25ae4006f74 Time: 0.110251
[04/24/2026-02:20:04] [TRT] [V] Tactic Name: sm70_xmma_fprop_implicit_gemm_f32f32_f32f32_f32_nhwckrsc_nhwc_tilesize64x64x8_stage1_warpsize1x4x1_g1_ffma_aligna4_alignc4 Tactic: 0x2595402367cdee5c Time: 0.028304
[04/24/2026-02:20:04] [TRT] [V] Tactic Name: sm80_xmma_fprop_implicit_gemm_f32f32_f32f32_f32_nhwckrsc_nhwc_tilesize128x16x8_stage3_warpsize4x1x1_g1_ffma_aligna4_alignc4 Tactic: 0x92ed3100c35fc43e Time: 0.0207793
[04/24/2026-02:20:04] [TRT] [V] Tactic Name: sm80_xmma_fprop_implicit_gemm_f32f32_f32f32_f32_nhwckrsc_nhwc_tilesize64x64x8_stage3_warpsize1x4x1_g1_ffma_aligna4_alignc4 Tactic: 0x62835fce994f06dd Time: 0.024237
[04/24/2026-02:20:04] [TRT] [V] Tactic Name: sm70_xmma_fprop_implicit_gemm_f32f32_f32f32_f32_nhwckrsc_nhwc_tilesize32x32x8_stage1_warpsize1x2x1_g1_ffma_t1r5s5_aligna4_alignc4 Tactic: 0xad9ed5f51d32aa29 Time: 0.0285858
[04/24/2026-02:20:04] [TRT] [V] Tactic Name: sm70_xmma_fprop_implicit_gemm_f32f32_f32f32_f32_nhwckrsc_nhwc_tilesize64x16x16_stage1_warpsize1x1x1_g1_ffma_aligna4_alignc4 Tactic: 0x3f904b355d9ca8e6 Time: 0.0301209
[04/24/2026-02:20:04] [TRT] [V] Tactic Name: sm80_xmma_fprop_implicit_gemm_indexed_f32f32_f32f32_f32_nhwckrsc_nhwc_tilesize32x32x8_stage3_warpsize1x2x1_g1_ffma_aligna4_alignc4 Tactic: 0x0a143be7a52f301a Time: 0.0188361
[04/24/2026-02:20:04] [TRT] [V] Tactic Name: sm80_xmma_fprop_implicit_gemm_f32f32_f32f32_f32_nhwckrsc_nhwc_tilesize32x32x8_stage3_warpsize1x2x1_g1_ffma_aligna4_alignc4 Tactic: 0x7121ec1db3f80c67 Time: 0.0154764
[04/24/2026-02:20:04] [TRT] [V] Tactic Name: sm70_xmma_fprop_implicit_gemm_f32f32_f32f32_f32_nhwckrsc_nhwc_tilesize256x128x8_stage1_warpsize2x4x1_g1_ffma_aligna4_alignc4 Tactic: 0x0447933cc2be855a Time: 0.103835
[04/24/2026-02:20:04] [TRT] [V] Convolution2 + Activation2 (CaskConvolution[0x80000009]) profiling completed in 0.0682499 seconds. Fastest Tactic: 0x880b696bd0160609 Time: 0.0148828
[04/24/2026-02:20:04] [TRT] [V] Skipping CaskFlattenConvolution: No valid tactics for Convolution2 + Activation2
[04/24/2026-02:20:04] [TRT] [V] >>>>>>>>>>>>>>> Chose Runner Type: CaskConvolution Tactic: 0x880b696bd0160609
[04/24/2026-02:20:04] [TRT] [V] *************** Autotuning format combination: Float(1568,1:4,112,8) -> Float(12544,196,14,1) ***************
[04/24/2026-02:20:04] [TRT] [V] --------------- Timing Runner: Convolution2 + Activation2 (CaskConvolution[0x80000009])
[04/24/2026-02:20:04] [TRT] [V] Tactic Name: sm80_xmma_fprop_implicit_gemm_indexed_f32f32_tf32f32_f32_nhwckrsc_nchw_tilesize128x128x16_stage4_warpsize2x2x1_g1_tensor16x8x8_alignc4 Tactic: 0xe8f7b6a5bab325f8 Time: 0.0280364
[04/24/2026-02:20:04] [TRT] [V] Tactic Name: sm80_xmma_fprop_implicit_gemm_f32f32_tf32f32_f32_nhwckrsc_nchw_tilesize128x128x16_stage4_warpsize2x2x1_g1_tensor16x8x8_alignc4 Tactic: 0x9fd9fe001908ce2e Time: 0.0263844
[04/24/2026-02:20:04] [TRT] [V] Convolution2 + Activation2 (CaskConvolution[0x80000009]) profiling completed in 0.00436398 seconds. Fastest Tactic: 0x9fd9fe001908ce2e Time: 0.0263844
[04/24/2026-02:20:04] [TRT] [V] Skipping CaskFlattenConvolution: No valid tactics for Convolution2 + Activation2
[04/24/2026-02:20:04] [TRT] [V] >>>>>>>>>>>>>>> Chose Runner Type: CaskConvolution Tactic: 0x9fd9fe001908ce2e
[04/24/2026-02:20:04] [TRT] [V] *************** Autotuning format combination: Float(1568,1:4,112,8) -> Float(3136,1:4,224,16) ***************
[04/24/2026-02:20:04] [TRT] [V] --------------- Timing Runner: Convolution2 + Activation2 (CaskConvolution[0x80000009])
[04/24/2026-02:20:04] [TRT] [V] Tactic Name: ampere_scudnn_128x32_sliced1x4_ldg4_relu_exp_small_nhwc_tn_v1 Tactic: 0x3e2b881168d9689d Time: 0.0234233
[04/24/2026-02:20:04] [TRT] [V] Tactic Name: ampere_scudnn_128x128_ldg4_relu_exp_medium_nhwc_tn_v1 Tactic: 0x7bc32c782b800c48 Time: 0.0656089
[04/24/2026-02:20:04] [TRT] [V] Tactic Name: sm80_xmma_fprop_implicit_gemm_f32f32_tf32f32_f32_nhwckrsc_nhwc_tilesize128x128x16_stage4_warpsize2x2x1_g1_tensor16x8x8 Tactic: 0xb443c221fcb1565b Time: 0.0255337
[04/24/2026-02:20:04] [TRT] [V] Tactic Name: sm80_xmma_fprop_implicit_gemm_indexed_f32f32_tf32f32_f32_nhwckrsc_nhwc_tilesize128x128x16_stage4_warpsize2x2x1_g1_tensor16x8x8 Tactic: 0x65e41d81f093b482 Time: 0.0273108
[04/24/2026-02:20:04] [TRT] [V] Tactic Name: sm80_xmma_fprop_implicit_gemm_indexed_wo_smem_f32f32_tf32f32_f32_nhwckrsc_nhwc_tilesize128x32x16_stage1_warpsize4x1x1_g1_tensor16x8x8_aligna8_alignc4 Tactic: 0xf78ec258f27b3e23 Time: 0.0381025
[04/24/2026-02:20:04] [TRT] [V] Tactic Name: sm80_xmma_fprop_implicit_gemm_indexed_wo_smem_f32f32_tf32f32_f32_nhwckrsc_nhwc_tilesize128x32x16_stage1_warpsize4x1x1_g1_tensor16x8x8_aligna4_alignc8 Tactic: 0x7e40882e33c8fbf1 Time: 0.0349909
[04/24/2026-02:20:04] [TRT] [V] Tactic Name: sm80_xmma_fprop_implicit_gemm_indexed_wo_smem_f32f32_tf32f32_f32_nhwckrsc_nhwc_tilesize128x16x32_stage1_warpsize4x1x1_g1_tensor16x8x8_aligna8_alignc8 Tactic: 0x4640eb34c8ecc700 Time: 0.0380646
[04/24/2026-02:20:04] [TRT] [V] Tactic Name: sm80_xmma_fprop_implicit_gemm_indexed_wo_smem_f32f32_tf32f32_f32_nhwckrsc_nhwc_tilesize128x16x32_stage1_warpsize4x1x1_g1_tensor16x8x8_aligna4 Tactic: 0xb3e5ce9d1b1da232 Time: 0.0344363
[04/24/2026-02:20:04] [TRT] [V] Tactic Name: sm80_xmma_fprop_implicit_gemm_indexed_wo_smem_f32f32_tf32f32_f32_nhwckrsc_nhwc_tilesize128x16x64_stage1_warpsize4x1x1_g1_tensor16x8x8 Tactic: 0x10383a0781d24dde Time: 0.0109371
[04/24/2026-02:20:04] [TRT] [V] Tactic Name: sm80_xmma_fprop_implicit_gemm_indexed_wo_smem_f32f32_tf32f32_f32_nhwckrsc_nhwc_tilesize128x16x64_stage1_warpsize4x1x1_g1_tensor16x8x8_alignc8 Tactic: 0x4037b478ce77e422 Time: 0.0180822
[04/24/2026-02:20:04] [TRT] [V] Tactic Name: sm80_xmma_fprop_implicit_gemm_indexed_wo_smem_f32f32_tf32f32_f32_nhwckrsc_nhwc_tilesize128x32x64_stage1_warpsize4x1x1_g1_tensor16x8x8_alignc8 Tactic: 0x3a8712b17741b582 Time: 0.0173776
[04/24/2026-02:20:04] [TRT] [V] Tactic Name: sm80_xmma_fprop_implicit_gemm_indexed_wo_smem_f32f32_tf32f32_f32_nhwckrsc_nhwc_tilesize128x32x64_stage1_warpsize4x1x1_g1_tensor16x8x8_alignc4 Tactic: 0xb6f6563c77d057d7 Time: 0.0179116
[04/24/2026-02:20:04] [TRT] [V] Tactic Name: sm80_xmma_fprop_implicit_gemm_indexed_wo_smem_f32f32_tf32f32_f32_nhwckrsc_nhwc_tilesize128x32x64_stage1_warpsize4x1x1_g1_tensor16x8x8_aligna8 Tactic: 0x9355e195cee05798 Time: 0.021152
[04/24/2026-02:20:04] [TRT] [V] Tactic Name: sm80_xmma_fprop_implicit_gemm_indexed_wo_smem_f32f32_tf32f32_f32_nhwckrsc_nhwc_tilesize128x32x64_stage1_warpsize4x1x1_g1_tensor16x8x8_aligna4_alignc8 Tactic: 0x1acd4f006848c62b Time: 0.0364704
[04/24/2026-02:20:04] [TRT] [V] Tactic Name: sm80_xmma_fprop_implicit_gemm_indexed_wo_smem_f32f32_tf32f32_f32_nhwckrsc_nhwc_tilesize128x16x64_stage1_warpsize4x1x1_g1_tensor16x8x8_alignc4 Tactic: 0xcc46f0f5cee60677 Time: 0.0112892
[04/24/2026-02:20:04] [TRT] [V] Tactic Name: sm80_xmma_fprop_implicit_gemm_indexed_wo_smem_f32f32_tf32f32_f32_nhwckrsc_nhwc_tilesize128x32x16_stage1_warpsize4x1x1_g1_tensor16x8x8 Tactic: 0x9cb304e2edbc1221 Time: 0.0232107
[04/24/2026-02:20:04] [TRT] [V] Tactic Name: sm80_xmma_fprop_implicit_gemm_indexed_wo_smem_f32f32_tf32f32_f32_nhwckrsc_nhwc_tilesize128x32x64_stage1_warpsize4x1x1_g1_tensor16x8x8_aligna8_alignc4 Tactic: 0x93030576a9fb03f9 Time: 0.02113
[04/24/2026-02:20:04] [TRT] [V] Tactic Name: sm80_xmma_fprop_implicit_gemm_indexed_wo_smem_f32f32_tf32f32_f32_nhwckrsc_nhwc_tilesize128x16x32_stage1_warpsize4x1x1_g1_tensor16x8x8_aligna8 Tactic: 0x3f948a101b8c4067 Time: 0.0345355
[04/24/2026-02:20:04] [TRT] [V] Tactic Name: sm80_xmma_fprop_implicit_gemm_indexed_wo_smem_f32f32_tf32f32_f32_nhwckrsc_nhwc_tilesize128x16x32_stage1_warpsize4x1x1_g1_tensor16x8x8_alignc4 Tactic: 0x1a373db9a2bc4028 Time: 0.0203639
[04/24/2026-02:20:04] [TRT] [V] Tactic Name: sm80_xmma_fprop_implicit_gemm_indexed_wo_smem_f32f32_tf32f32_f32_nhwckrsc_nhwc_tilesize128x16x64_stage1_warpsize4x1x1_g1_tensor16x8x8_aligna8_alignc4 Tactic: 0xab0496509b88ebe0 Time: 0.0275512
[04/24/2026-02:20:04] [TRT] [V] Tactic Name: sm80_xmma_fprop_implicit_gemm_indexed_wo_smem_f32f32_tf32f32_f32_nhwckrsc_nhwc_tilesize128x32x64_stage1_warpsize4x1x1_g1_tensor16x8x8 Tactic: 0xb33296dda7141c64 Time: 0.0180626
[04/24/2026-02:20:04] [TRT] [V] Tactic Name: ampere_scudnn_128x128_ldg4_relu_exp_small_nhwc_tn_v1 Tactic: 0xf90060ce8193b811 Time: 0.0645689
[04/24/2026-02:20:04] [TRT] [V] Tactic Name: sm80_xmma_fprop_implicit_gemm_indexed_wo_smem_f32f32_tf32f32_f32_nhwckrsc_nhwc_tilesize128x32x16_stage1_warpsize4x1x1_g1_tensor16x8x8_aligna4 Tactic: 0x570667f2a28165a0 Time: 0.0383372
[04/24/2026-02:20:04] [TRT] [V] Tactic Name: sm80_xmma_fprop_implicit_gemm_indexed_wo_smem_f32f32_tf32f32_f32_nhwckrsc_nhwc_tilesize128x32x16_stage1_warpsize4x1x1_g1_tensor16x8x8_alignc4 Tactic: 0xfed494d61b2087ba Time: 0.0235008
[04/24/2026-02:20:04] [TRT] [V] Tactic Name: sm80_xmma_fprop_implicit_gemm_indexed_wo_smem_f32f32_tf32f32_f32_nhwckrsc_nhwc_tilesize128x32x16_stage1_warpsize4x1x1_g1_tensor16x8x8_aligna8_alignc8 Tactic: 0x7bff86d5f2eadc76 Time: 0.0375692
[04/24/2026-02:20:04] [TRT] [V] Tactic Name: sm80_xmma_fprop_implicit_gemm_f32f32_tf32f32_f32_nhwckrsc_nhwc_tilesize128x128x16_stage4_warpsize2x2x1_g1_tensor16x8x8_t1r5s5 Tactic: 0x94f2b2320bb3fc74 Time: 0.0247002
[04/24/2026-02:20:04] [TRT] [V] Tactic Name: sm80_xmma_fprop_implicit_gemm_indexed_wo_smem_f32f32_tf32f32_f32_nhwckrsc_nhwc_tilesize128x16x32_stage1_warpsize4x1x1_g1_tensor16x8x8_alignc8 Tactic: 0x96467934a22da27d Time: 0.0203062
[04/24/2026-02:20:04] [TRT] [V] Tactic Name: sm80_xmma_fprop_implicit_gemm_indexed_wo_smem_f32f32_tf32f32_f32_nhwckrsc_nhwc_tilesize128x32x16_stage1_warpsize4x1x1_g1_tensor16x8x8_aligna8 Tactic: 0xdb77237fa21087f5 Time: 0.0363563
[04/24/2026-02:20:04] [TRT] [V] Tactic Name: sm80_xmma_fprop_implicit_gemm_indexed_wo_smem_f32f32_tf32f32_f32_nhwckrsc_nhwc_tilesize128x16x64_stage1_warpsize4x1x1_g1_tensor16x8x8_aligna4_alignc8 Tactic: 0x22cadc265a3b2e32 Time: 0.0283164
[04/24/2026-02:20:04] [TRT] [V] Tactic Name: sm80_xmma_fprop_implicit_gemm_indexed_wo_smem_f32f32_tf32f32_f32_nhwckrsc_nhwc_tilesize128x32x16_stage1_warpsize4x1x1_g1_tensor16x8x8_alignc8 Tactic: 0x72a5d05b1bb165ef Time: 0.0230016
[04/24/2026-02:20:04] [TRT] [V] Tactic Name: sm80_xmma_fprop_implicit_gemm_indexed_wo_smem_f32f32_tf32f32_f32_nhwckrsc_nhwc_tilesize128x16x64_stage1_warpsize4x1x1_g1_tensor16x8x8_aligna8 Tactic: 0xe9e5475c77d60638 Time: 0.0264747
[04/24/2026-02:20:04] [TRT] [V] Tactic Name: ampere_scudnn_128x64_sliced1x2_ldg4_relu_exp_large_nhwc_tn_v1 Tactic: 0xbdfdef6b84f7ccc9 Time: 0.042376
[04/24/2026-02:20:04] [TRT] [V] Tactic Name: sm80_xmma_fprop_implicit_gemm_indexed_wo_smem_f32f32_tf32f32_f32_nhwckrsc_nhwc_tilesize128x16x32_stage1_warpsize4x1x1_g1_tensor16x8x8_aligna4_alignc8 Tactic: 0x43ffe5cf09cee087 Time: 0.029456
[04/24/2026-02:20:04] [TRT] [V] Tactic Name: sm80_xmma_fprop_implicit_gemm_indexed_wo_smem_f32f32_tf32f32_f32_nhwckrsc_nhwc_tilesize128x16x32_stage1_warpsize4x1x1_g1_tensor16x8x8 Tactic: 0xae48d3ccfe1edfcd Time: 0.0160467
[04/24/2026-02:20:04] [TRT] [V] Convolution2 + Activation2 (CaskConvolution[0x80000009]) profiling completed in 0.0783494 seconds. Fastest Tactic: 0x10383a0781d24dde Time: 0.0109371
[04/24/2026-02:20:04] [TRT] [V] Skipping CaskFlattenConvolution: No valid tactics for Convolution2 + Activation2
[04/24/2026-02:20:04] [TRT] [V] >>>>>>>>>>>>>>> Chose Runner Type: CaskConvolution Tactic: 0x10383a0781d24dde
[04/24/2026-02:20:04] [TRT] [V] =============== Computing costs for Pooling2
[04/24/2026-02:20:04] [TRT] [V] *************** Autotuning format combination: Float(12544,196,14,1) -> Float(3136,49,7,1) ***************
[04/24/2026-02:20:04] [TRT] [V] --------------- Timing Runner: Pooling2 (CaskPooling[0x8000002f])
[04/24/2026-02:20:04] [TRT] [V] Tactic Name: sm50_xmma_pooling_tiled_FP32NCHW_kMAX_tP2_tQ32_tR2_tS2_tU2_tV2_tUnroll6_tThreads256 Tactic: 0x60eceb67eff69444 Time: 0.00240606
[04/24/2026-02:20:04] [TRT] [V] Tactic Name: sm50_xmma_pooling_tiled_FP32NCHW_kMAX_tP2_tQ32_tR2_tS2_tU2_tV2_tUnroll1_tThreads256 Tactic: 0xc7d8c563bd6ced88 Time: 0.00252824
[04/24/2026-02:20:04] [TRT] [V] Tactic Name: sm50_xmma_pooling_nd_NCDHW_kMAX_kGENERIC_3D_POOLING_MODE_kFLOAT_0 Tactic: 0x5faf4a0a8a5670ed Time: 0.00263467
[04/24/2026-02:20:04] [TRT] [V] Tactic Name: sm50_xmma_pooling_tiled_FP32NCHW_kMAX_tP2_tQ16_tR2_tS2_tU2_tV2_tUnroll6_tThreads128 Tactic: 0xf4b20242f8c135e7 Time: 0.00236558
[04/24/2026-02:20:04] [TRT] [V] Tactic Name: sm50_xmma_pooling_tiled_FP32NCHW_kMAX_tP2_tQ16_tR2_tS2_tU2_tV2_tUnroll2_tThreads128 Tactic: 0xa7a495ee24d0c659 Time: 0.00238056
[04/24/2026-02:20:04] [TRT] [V] Tactic Name: sm50_xmma_pooling_fw_4d_FP32FP32NCHW_Max Tactic: 0xb59f9cfb90407c92 Time: 0.00276849
[04/24/2026-02:20:04] [TRT] [V] Tactic Name: sm50_xmma_pooling_tiled_FP32NCHW_kMAX_tP2_tQ32_tR2_tS2_tU2_tV2_tUnroll8_tThreads256 Tactic: 0xbc5c1844e5cc7959 Time: 0.00250038
[04/24/2026-02:20:04] [TRT] [V] Tactic Name: sm50_xmma_pooling_tiled_FP32NCHW_kMAX_tP2_tQ16_tR2_tS2_tU2_tV2_tUnroll8_tThreads128 Tactic: 0x2802f161f2fbd8fa Time: 0.00243714
[04/24/2026-02:20:04] [TRT] [V] Tactic Name: sm50_xmma_pooling_tiled_FP32NCHW_kMAX_tP2_tQ16_tR2_tS2_tU2_tV2_tUnroll3_tThreads128 Tactic: 0x7a0d6790c453b5f4 Time: 0.00231755
[04/24/2026-02:20:04] [TRT] [V] Tactic Name: sm50_xmma_pooling_tiled_FP32NCHW_kMAX_tP2_tQ16_tR2_tS2_tU2_tV2_tUnroll1_tThreads128 Tactic: 0x53862c46aa5b4c2b Time: 0.00248828
[04/24/2026-02:20:04] [TRT] [V] Tactic Name: sm50_xmma_pooling_tiled_FP32NCHW_kMAX_tP2_tQ16_tR2_tS2_tU2_tV2_tUnroll7_tThreads128 Tactic: 0x291bf03c1842464a Time: 0.00239505
[04/24/2026-02:20:04] [TRT] [V] Tactic Name: sm50_xmma_pooling_tiled_FP32NCHW_kMAX_tP2_tQ32_tR2_tS2_tU2_tV2_tUnroll5_tThreads256 Tactic: 0x94ce52cf617d1e36 Time: 0.00240537
[04/24/2026-02:20:04] [TRT] [V] Tactic Name: sm50_xmma_pooling_tiled_FP32NCHW_kMAX_tP2_tQ32_tR2_tS2_tU2_tV2_tUnroll4_tThreads256 Tactic: 0x4967a0b181fe6d9b Time: 0.00235876
[04/24/2026-02:20:04] [TRT] [V] Tactic Name: sm50_xmma_pooling_tiled_FP32NCHW_kMAX_tP2_tQ16_tR2_tS2_tU2_tV2_tUnroll5_tThreads128 Tactic: 0x0090bbea764abf95 Time: 0.00236936
[04/24/2026-02:20:04] [TRT] [V] Tactic Name: sm50_xmma_pooling_tiled_FP32NCHW_kMAX_tP2_tQ32_tR2_tS2_tU2_tV2_tUnroll7_tThreads256 Tactic: 0xbd4519190f75e7e9 Time: 0.00240959
[04/24/2026-02:20:04] [TRT] [V] Tactic Name: sm50_xmma_pooling_tiled_FP32NCHW_kMAX_tP2_tQ32_tR2_tS2_tU2_tV2_tUnroll2_tThreads256 Tactic: 0x33fa7ccb33e767fa Time: 0.00239116
[04/24/2026-02:20:04] [TRT] [V] Tactic Name: sm50_xmma_pooling_tiled_FP32NCHW_kMAX_tP2_tQ32_tR2_tS2_tU2_tV2_tUnroll3_tThreads256 Tactic: 0xee538eb5d3641457 Time: 0.00240721
[04/24/2026-02:20:04] [TRT] [V] Tactic Name: sm50_xmma_pooling_tiled_FP32NCHW_kMAX_tP2_tQ16_tR2_tS2_tU2_tV2_tUnroll4_tThreads128 Tactic: 0xdd39499496c9cc38 Time: 0.00230569
[04/24/2026-02:20:04] [TRT] [V] Pooling2 (CaskPooling[0x8000002f]) profiling completed in 0.0517559 seconds. Fastest Tactic: 0xdd39499496c9cc38 Time: 0.00230569
[04/24/2026-02:20:04] [TRT] [V] >>>>>>>>>>>>>>> Chose Runner Type: CaskPooling Tactic: 0xdd39499496c9cc38
[04/24/2026-02:20:04] [TRT] [V] *************** Autotuning format combination: Float(3136,1:4,224,16) -> Float(784,1:4,112,16) ***************
[04/24/2026-02:20:04] [TRT] [V] --------------- Timing Runner: Pooling2 (CaskPooling[0x8000002f])
[04/24/2026-02:20:04] [TRT] [V] Tactic Name: sm50_xmma_pooling_max_nhwc_FP32FP32_WINDOWSIZE_0_PROPAGATE_NAN_2D Tactic: 0x8382d5c464539e87 Time: 0.00286715
[04/24/2026-02:20:04] [TRT] [V] Tactic Name: sm50_xmma_pooling_max_nhwc_FP32FP32_WINDOWSIZE_0_NOT_PROPAGATE_NAN_2D Tactic: 0xaec8628e8180bced Time: 0.00282522
[04/24/2026-02:20:04] [TRT] [V] Tactic Name: sm50_xmma_pooling_max_nhwc_FP32FP32_WINDOWSIZE_0_PROPAGATE_NAN_3D Tactic: 0xd76bac5638836f8a Time: 0.00285931
[04/24/2026-02:20:04] [TRT] [V] Tactic Name: sm50_xmma_pooling_max_nhwc_FP32FP32_WINDOWSIZE_0_NOT_PROPAGATE_NAN_3D Tactic: 0xfa211b1cdd504de0 Time: 0.00284077
[04/24/2026-02:20:04] [TRT] [V] Tactic Name: sm50_xmma_pooling_fw_4d_FP32FP32NHWC_Max_CAlign4 Tactic: 0x22fb1bb4a70e340d Time: 0.00286304
[04/24/2026-02:20:04] [TRT] [V] Pooling2 (CaskPooling[0x8000002f]) profiling completed in 0.0127941 seconds. Fastest Tactic: 0xaec8628e8180bced Time: 0.00282522
[04/24/2026-02:20:04] [TRT] [V] >>>>>>>>>>>>>>> Chose Runner Type: CaskPooling Tactic: 0xaec8628e8180bced
[04/24/2026-02:20:04] [TRT] [V] =============== Computing costs for {ForeignNode[Shuffle...TopK]}
[04/24/2026-02:20:04] [TRT] [V] ForeignNode {ForeignNode[Shuffle...TopK]} metadata:
[04/24/2026-02:20:04] [TRT] [V] *************** Autotuning format combination: Float(3136,49,7,1) -> Float(10,1), Int32(1,1) ***************
[04/24/2026-02:20:04] [TRT] [V] --------------- Timing Runner: {ForeignNode[Shuffle...TopK]} (Myelin[0x80000023])
[04/24/2026-02:20:04] [TRT] [I] Compiler backend is used during engine build.
[04/24/2026-02:20:06] [TRT] [V]  (foreignNode) Set user's cuda kernel library
[04/24/2026-02:20:06] [TRT] [V]  (foreignNode) Autotuning op MatrixMultiplication1:
[04/24/2026-02:20:06] [TRT] [V]  (foreignNode) Sorted table of all evaluated tactics:
[04/24/2026-02:20:06] [TRT] [V]  (foreignNode) tactic_id, cost(in ms), cost/fastest_cost, prediction_correlation, kernel_name, tactic_hash, tunable_parameter
[04/24/2026-02:20:06] [TRT] [V]  (foreignNode)   34, 0.0083648, 1.00000, 2.10203, sm80_xmma_gemm_f32f32_tf32f32_f32_tn_n_tilesize32x32x64_stage3_warpsize2x1x2_tensor16x8x8, 0x4754af3ee6112,
[04/24/2026-02:20:06] [TRT] [V]  (foreignNode)   32, 0.0086016, 1.02831, 2.04416, sm80_xmma_gemm_f32f32_tf32f32_f32_nn_n_tilesize32x32x64_stage3_warpsize2x1x2_tensor16x8x8, 0x601ffa534e573,
[04/24/2026-02:20:06] [TRT] [V]  (foreignNode)   55, 0.0086016, 1.02831, 2.04803, sm86_xmma_gemm_f32f32_tf32f32_f32_tn_n_tilesize32x32x64_stage6_warpsize2x2x1_tensor16x8x8, 0x49440904257ce,
[04/24/2026-02:20:06] [TRT] [V]  (foreignNode)   54, 0.0089760, 1.07307, 1.96260, sm86_xmma_gemm_f32f32_tf32f32_f32_nn_n_tilesize32x32x64_stage6_warpsize2x2x1_tensor16x8x8, 0x5f006fb224208,
[04/24/2026-02:20:06] [TRT] [V]  (foreignNode)   47, 0.0091136, 1.08952, 1.93192, sm86_xmma_gemm_f32f32_tf32f32_f32_tn_n_tilesize32x32x64_stage6_warpsize2x2x1_tensor16x8x8, 0x334d6aeb9ee39,
[04/24/2026-02:20:06] [TRT] [V]  (foreignNode)   24, 0.0092160, 1.10176, 1.90684, sm80_xmma_gemm_f32f32_tf32f32_f32_tn_n_tilesize32x32x64_stage3_warpsize2x1x2_tensor16x8x8, 0x55ca59c01c8e6,
[04/24/2026-02:20:06] [TRT] [V]  (foreignNode)   51, 0.0092384, 1.10444, 1.90606, sm80_xmma_gemm_f32f32_tf32f32_f32_tn_n_tilesize64x32x64_stage4_warpsize2x1x2_tensor16x8x8, 0x53bebff85b741,
[04/24/2026-02:20:06] [TRT] [V]  (foreignNode)   14, 0.0093280, 1.11515, 1.88092, sm80_xmma_gemm_f32f32_tf32f32_f32_tn_n_tilesize32x32x64_stage3_warpsize2x1x2_tensor16x8x8, 0x49387e4fabbcb,
[04/24/2026-02:20:06] [TRT] [V]  (foreignNode)   22, 0.0095232, 1.13849, 1.84533, sm80_xmma_gemm_f32f32_tf32f32_f32_nn_n_tilesize32x32x64_stage3_warpsize2x1x2_tensor16x8x8, 0x60be6a68c09be,
[04/24/2026-02:20:06] [TRT] [V]  (foreignNode)   46, 0.0095232, 1.13849, 1.84882, sm86_xmma_gemm_f32f32_tf32f32_f32_nn_n_tilesize32x32x64_stage6_warpsize2x2x1_tensor16x8x8, 0x66dc88611833d,
[04/24/2026-02:20:06] [TRT] [V]  (foreignNode)   18, 0.0097280, 1.16297, 1.80452, sm80_xmma_gemm_f32f32_tf32f32_f32_tn_n_tilesize32x32x64_stage3_warpsize2x1x2_tensor16x8x8, 0x2b826e27b0430,
[04/24/2026-02:20:06] [TRT] [V]  (foreignNode)   50, 0.0098176, 1.17368, 1.79361, sm86_xmma_gemm_f32f32_tf32f32_f32_tn_n_tilesize64x32x64_stage4_warpsize2x2x1_tensor16x8x8, 0x694678a07693e,
[04/24/2026-02:20:06] [TRT] [V]  (foreignNode)   49, 0.0098304, 1.17521, 1.79127, sm80_xmma_gemm_f32f32_tf32f32_f32_nn_n_tilesize64x32x64_stage4_warpsize2x1x2_tensor16x8x8, 0x4a785364cf633,
[04/24/2026-02:20:06] [TRT] [V]  (foreignNode)   27, 0.0099232, 1.18630, 1.77159, sm86_xmma_gemm_f32f32_tf32f32_f32_tn_n_tilesize32x32x64_stage6_warpsize2x2x1_tensor16x8x8, 0x666742dc17af9,
[04/24/2026-02:20:06] [TRT] [V]  (foreignNode)   37, 0.0103424, 1.23642, 1.70067, sm86_xmma_gemm_f32f32_tf32f32_f32_tn_n_tilesize32x32x64_stage6_warpsize2x2x1_tensor16x8x8, 0x3dbcaf58d3467,
[04/24/2026-02:20:06] [TRT] [V]  (foreignNode)   48, 0.0103424, 1.23642, 1.70259, sm86_xmma_gemm_f32f32_tf32f32_f32_nn_n_tilesize64x32x64_stage4_warpsize2x2x1_tensor16x8x8, 0x4d62854379fc9,
[04/24/2026-02:20:06] [TRT] [V]  (foreignNode)   12, 0.0105472, 1.26090, 1.66349, sm80_xmma_gemm_f32f32_tf32f32_f32_nn_n_tilesize32x32x64_stage3_warpsize2x1x2_tensor16x8x8, 0x5c2792944e3c4,
[04/24/2026-02:20:06] [TRT] [V]  (foreignNode)   16, 0.0107520, 1.28539, 1.63266, sm80_xmma_gemm_f32f32_tf32f32_f32_nn_n_tilesize32x32x64_stage3_warpsize2x1x2_tensor16x8x8, 0x50069414d8929,
[04/24/2026-02:20:06] [TRT] [V]  (foreignNode)   44, 0.0108544, 1.29763, 1.62140, sm86_xmma_gemm_f32f32_tf32f32_f32_tn_n_tilesize64x32x64_stage4_warpsize2x2x1_tensor16x8x8, 0x5bdb18571edf6,
[04/24/2026-02:20:06] [TRT] [V]  (foreignNode)   26, 0.0109568, 1.30987, 1.60446, sm86_xmma_gemm_f32f32_tf32f32_f32_nn_n_tilesize32x32x64_stage6_warpsize2x2x1_tensor16x8x8, 0x5f3ab6c1e639c,
[04/24/2026-02:20:06] [TRT] [V]  (foreignNode)   45, 0.0111616, 1.33435, 1.57677, sm80_xmma_gemm_f32f32_tf32f32_f32_tn_n_tilesize64x32x64_stage4_warpsize2x1x2_tensor16x8x8, 0x6115cd11889d1,
[04/24/2026-02:20:06] [TRT] [V]  (foreignNode)   36, 0.0114368, 1.36725, 1.53793, sm86_xmma_gemm_f32f32_tf32f32_f32_nn_n_tilesize32x32x64_stage6_warpsize2x2x1_tensor16x8x8, 0x4880ea4ce8166,
[04/24/2026-02:20:06] [TRT] [V]  (foreignNode)    2, 0.0115712, 1.38332, 1.44570, sm80_xmma_gemm_f32f32_tf32f32_f32_tn_n_tilesize32x32x64_stage3_warpsize2x1x2_tensor16x8x8, 0x3954c87e6ea47,
[04/24/2026-02:20:06] [TRT] [V]  (foreignNode)   42, 0.0115712, 1.38332, 1.52096, sm86_xmma_gemm_f32f32_tf32f32_f32_nn_n_tilesize64x32x64_stage4_warpsize2x2x1_tensor16x8x8, 0x2d3ed03083ee6,
[04/24/2026-02:20:06] [TRT] [V]  (foreignNode)   43, 0.0115712, 1.38332, 1.52096, sm80_xmma_gemm_f32f32_tf32f32_f32_nn_n_tilesize64x32x64_stage4_warpsize2x1x2_tensor16x8x8, 0x505b265d2fd84,
[04/24/2026-02:20:06] [TRT] [V]  (foreignNode)   31, 0.0116736, 1.39556, 1.50616, sm80_xmma_gemm_f32f32_tf32f32_f32_tn_n_tilesize64x32x64_stage4_warpsize2x1x2_tensor16x8x8, 0x4e5efd68a1834,
[04/24/2026-02:20:06] [TRT] [V]  (foreignNode)   35, 0.0116800, 1.39633, 1.50540, sm80_xmma_gemm_f32f32_tf32f32_f32_tn_n_tilesize32x32x64_stage3_warpsize2x2x1_tensor16x8x8_aligna4_alignc4, 0x4556015dc0d65,
