cookbook/10-BestPractice/ConvertTranposeMultiplicationToConvolution/result.log
[09/07/2022-04:04:59] [TRT] [V] *************** Autotuning Reformat: Float((* 4864 (# 2 (SHAPE inputTensor))),(* 19 (# 2 (SHAPE inputTensor))),19,1) -> Float((* 4864 (# 2 (SHAPE inputTensor))),1,4864,256) ***************
[09/07/2022-04:04:59] [TRT] [V] --------------- Timing Runner: Optimizer Reformat(inputTensor -> <out>) (Reformat)
[09/07/2022-04:04:59] [TRT] [V] Tactic: 0x00000000000003e8 Time: 0.342357
[09/07/2022-04:04:59] [TRT] [V] Tactic: 0x00000000000003ea Time: 0.443051
[09/07/2022-04:04:59] [TRT] [V] Tactic: 0x0000000000000000 Time: 0.343381
[09/07/2022-04:04:59] [TRT] [V] Fastest Tactic: 0x00000000000003e8 Time: 0.342357
[09/07/2022-04:04:59] [TRT] [V] *************** Autotuning Reformat: Float((* 4864 (# 2 (SHAPE inputTensor))),(* 19 (# 2 (SHAPE inputTensor))),19,1) -> Float((* 152 (# 2 (SHAPE inputTensor))),(* 19 (# 2 (SHAPE inputTensor))):32,19,1) ***************
[09/07/2022-04:04:59] [TRT] [V] --------------- Timing Runner: Optimizer Reformat(inputTensor -> <out>) (Reformat)
[09/07/2022-04:04:59] [TRT] [V] Tactic: 0x00000000000003e8 Time: 0.410965
[09/07/2022-04:04:59] [TRT] [V] Tactic: 0x00000000000003ea Time: 0.443733
[09/07/2022-04:04:59] [TRT] [V] Tactic: 0x0000000000000000 Time: 0.409941
[09/07/2022-04:04:59] [TRT] [V] Fastest Tactic: 0x0000000000000000 Time: 0.409941
[09/07/2022-04:04:59] [TRT] [V] =============== Computing reformatting costs
[09/07/2022-04:04:59] [TRT] [V] *************** Autotuning Reformat: Float(4864,1,1,1) -> Float(4864,1,4864,4864) ***************
[09/07/2022-04:04:59] [TRT] [V] --------------- Timing Runner: Optimizer Reformat(reshape_before_MatMul_61_out_tensor -> <out>) (Reformat)
[09/07/2022-04:04:59] [TRT] [V] Tactic: 0x00000000000003e8 Time: 0.258048
[09/07/2022-04:04:59] [TRT] [V] Tactic: 0x00000000000003ea Time: 0.201216
[09/07/2022-04:04:59] [TRT] [V] Tactic: 0x0000000000000000 Time: 0.258219
[09/07/2022-04:04:59] [TRT] [V] Fastest Tactic: 0x00000000000003ea Time: 0.201216
[09/07/2022-04:04:59] [TRT] [V] *************** Autotuning Reformat: Float(4864,1,4864,4864) -> Float(4864,1,1,1) ***************
[09/07/2022-04:04:59] [TRT] [V] --------------- Timing Runner: Optimizer Reformat(reshape_before_MatMul_61_out_tensor -> <out>) (Reformat)
[09/07/2022-04:04:59] [TRT] [V] Tactic: 0x00000000000003e8 Time: 0.244395
[09/07/2022-04:04:59] [TRT] [V] Tactic: 0x00000000000003ea Time: 0.201387
[09/07/2022-04:04:59] [TRT] [V] Tactic: 0x0000000000000000 Time: 0.244224
[09/07/2022-04:04:59] [TRT] [V] Fastest Tactic: 0x00000000000003ea Time: 0.201387
[09/07/2022-04:04:59] [TRT] [V] *************** Autotuning Reformat: Float(152,1:32,1,1) -> Float(4864,1,1,1) ***************
[09/07/2022-04:04:59] [TRT] [V] --------------- Timing Runner: Optimizer Reformat(reshape_before_MatMul_61_out_tensor -> <out>) (Reformat)
[09/07/2022-04:04:59] [TRT] [V] Tactic: 0x00000000000003e8 Time: 0.28928
[09/07/2022-04:04:59] [TRT] [V] Tactic: 0x00000000000003ea Time: 12.3846
[09/07/2022-04:04:59] [TRT] [V] Tactic: 0x0000000000000000 Time: 0.289109
[09/07/2022-04:04:59] [TRT] [V] Fastest Tactic: 0x0000000000000000 Time: 0.289109
[09/07/2022-04:04:59] [TRT] [V] *************** Autotuning Reformat: Float(152,1:32,1,1) -> Float(4864,1,4864,4864) ***************
[09/07/2022-04:04:59] [TRT] [V] --------------- Timing Runner: Optimizer Reformat(reshape_before_MatMul_61_out_tensor -> <out>) (Reformat)
[09/07/2022-04:04:59] [TRT] [V] Tactic: 0x00000000000003e8 Time: 0.303616
[09/07/2022-04:04:59] [TRT] [V] Tactic: 0x00000000000003ea Time: 0.397312
[09/07/2022-04:04:59] [TRT] [V] Tactic: 0x0000000000000000 Time: 0.303957
[09/07/2022-04:04:59] [TRT] [V] Fastest Tactic: 0x00000000000003e8 Time: 0.303616
[09/07/2022-04:04:59] [TRT] [V] =============== Computing reformatting costs
[09/07/2022-04:04:59] [TRT] [V] *************** Autotuning Reformat: Float(256,1,1,1) -> Float(256,1,256,256) ***************
[09/07/2022-04:04:59] [TRT] [V] --------------- Timing Runner: Optimizer Reformat(MatMul_61_out_tensor -> <out>) (Reformat)
[09/07/2022-04:04:59] [TRT] [V] Tactic: 0x00000000000003e8 Time: 0.0161813
[09/07/2022-04:04:59] [TRT] [V] Tactic: 0x00000000000003ea Time: 0.0129657
[09/07/2022-04:04:59] [TRT] [V] Tactic: 0x0000000000000000 Time: 0.0162265
[09/07/2022-04:04:59] [TRT] [V] Fastest Tactic: 0x00000000000003ea Time: 0.0129657
[09/07/2022-04:04:59] [TRT] [V] *************** Autotuning Reformat: Float(256,1,1,1) -> Float(8,1:32,1,1) ***************
[09/07/2022-04:04:59] [TRT] [V] --------------- Timing Runner: Optimizer Reformat(MatMul_61_out_tensor -> <out>) (Reformat)
[09/07/2022-04:04:59] [TRT] [V] Tactic: 0x00000000000003e8 Time: 0.0178947
[09/07/2022-04:04:59] [TRT] [V] Tactic: 0x00000000000003ea Time: 0.663211
[09/07/2022-04:04:59] [TRT] [V] Tactic: 0x0000000000000000 Time: 0.0179997
[09/07/2022-04:04:59] [TRT] [V] Fastest Tactic: 0x00000000000003e8 Time: 0.0178947
[09/07/2022-04:04:59] [TRT] [V] *************** Autotuning Reformat: Float(256,1,256,256) -> Float(256,1,1,1) ***************
[09/07/2022-04:04:59] [TRT] [V] --------------- Timing Runner: Optimizer Reformat(MatMul_61_out_tensor -> <out>) (Reformat)
[09/07/2022-04:04:59] [TRT] [V] Tactic: 0x00000000000003e8 Time: 0.0155491
[09/07/2022-04:04:59] [TRT] [V] Tactic: 0x00000000000003ea Time: 0.0229632
[09/07/2022-04:05:00] [TRT] [V] Tactic: 0x0000000000000000 Time: 0.0149788
[09/07/2022-04:05:00] [TRT] [V] Fastest Tactic: 0x0000000000000000 Time: 0.0149788
[09/07/2022-04:05:00] [TRT] [V] *************** Autotuning Reformat: Float(256,1,256,256) -> Float(8,1:32,1,1) ***************
[09/07/2022-04:05:00] [TRT] [V] --------------- Timing Runner: Optimizer Reformat(MatMul_61_out_tensor -> <out>) (Reformat)
[09/07/2022-04:05:00] [TRT] [V] Tactic: 0x00000000000003e8 Time: 0.0165211
[09/07/2022-04:05:00] [TRT] [V] Tactic: 0x00000000000003ea Time: 0.602453
[09/07/2022-04:05:00] [TRT] [V] Tactic: 0x0000000000000000 Time: 0.0168832
[09/07/2022-04:05:00] [TRT] [V] Fastest Tactic: 0x00000000000003e8 Time: 0.0165211
[09/07/2022-04:05:00] [TRT] [V] *************** Autotuning Reformat: Float(8,1:32,1,1) -> Float(256,1,1,1) ***************
[09/07/2022-04:05:00] [TRT] [V] --------------- Timing Runner: Optimizer Reformat(MatMul_61_out_tensor -> <out>) (Reformat)
[09/07/2022-04:05:00] [TRT] [V] Tactic: 0x00000000000003e8 Time: 0.0164114
[09/07/2022-04:05:00] [TRT] [V] Tactic: 0x00000000000003ea Time: 0.607573
[09/07/2022-04:05:00] [TRT] [V] Tactic: 0x0000000000000000 Time: 0.0163754
[09/07/2022-04:05:00] [TRT] [V] Fastest Tactic: 0x0000000000000000 Time: 0.0163754
[09/07/2022-04:05:00] [TRT] [V] *************** Autotuning Reformat: Float(8,1:32,1,1) -> Float(256,1,256,256) ***************
[09/07/2022-04:05:00] [TRT] [V] --------------- Timing Runner: Optimizer Reformat(MatMul_61_out_tensor -> <out>) (Reformat)
[09/07/2022-04:05:00] [TRT] [V] Tactic: 0x00000000000003e8 Time: 0.0170496
[09/07/2022-04:05:00] [TRT] [V] Tactic: 0x00000000000003ea Time: 0.0222322
[09/07/2022-04:05:00] [TRT] [V] Tactic: 0x0000000000000000 Time: 0.0171061
[09/07/2022-04:05:00] [TRT] [V] Fastest Tactic: 0x00000000000003e8 Time: 0.0170496
[09/07/2022-04:05:00] [TRT] [V] =============== Computing reformatting costs
[09/07/2022-04:05:00] [TRT] [V] *************** Autotuning Reformat: Float(256,256,1) -> Float(256:32,256,1) ***************
[09/07/2022-04:05:00] [TRT] [V] --------------- Timing Runner: Optimizer Reformat(<in> -> (Unnamed Layer* 16) [Shuffle]_output) (Reformat)
[09/07/2022-04:05:00] [TRT] [V] Tactic: 0x00000000000003e8 Time: 0.00815037
[09/07/2022-04:05:00] [TRT] [V] Tactic: 0x00000000000003ea Time: 0.0212907
[09/07/2022-04:05:00] [TRT] [V] Tactic: 0x0000000000000000 Time: 0.00833707
[09/07/2022-04:05:00] [TRT] [V] Fastest Tactic: 0x00000000000003e8 Time: 0.00815037
[09/07/2022-04:05:00] [TRT] [V] =============== Computing reformatting costs
[09/07/2022-04:05:00] [TRT] [V] *************** Autotuning Reformat: Float(256,256,1) -> Float(256:32,256,1) ***************
[09/07/2022-04:05:00] [TRT] [V] --------------- Timing Runner: Optimizer Reformat((Unnamed Layer* 16) [Shuffle]_output -> <out>) (Reformat)
[09/07/2022-04:05:00] [TRT] [V] Tactic: 0x00000000000003e8 Time: 0.00807695
[09/07/2022-04:05:00] [TRT] [V] Tactic: 0x00000000000003ea Time: 0.0218667
[09/07/2022-04:05:00] [TRT] [V] Tactic: 0x0000000000000000 Time: 0.00827629
[09/07/2022-04:05:00] [TRT] [V] Fastest Tactic: 0x00000000000003e8 Time: 0.00807695
[09/07/2022-04:05:00] [TRT] [V] *************** Autotuning Reformat: Float(256:32,256,1) -> Float(256,256,1) ***************
[09/07/2022-04:05:00] [TRT] [V] --------------- Timing Runner: Optimizer Reformat((Unnamed Layer* 16) [Shuffle]_output -> <out>) (Reformat)
[09/07/2022-04:05:00] [TRT] [V] Tactic: 0x00000000000003e8 Time: 0.00835493
[09/07/2022-04:05:00] [TRT] [V] Tactic: 0x00000000000003ea Time: 0.021312
[09/07/2022-04:05:00] [TRT] [V] Tactic: 0x0000000000000000 Time: 0.00802006
[09/07/2022-04:05:00] [TRT] [V] Fastest Tactic: 0x0000000000000000 Time: 0.00802006
[09/07/2022-04:05:00] [TRT] [V] =============== Computing reformatting costs
[09/07/2022-04:05:00] [TRT] [V] *************** Autotuning Reformat: Float((* 256 (# 2 (SHAPE inputTensor))),256,1) -> Float((* 256 (# 2 (SHAPE inputTensor))):32,256,1) ***************
[09/07/2022-04:05:00] [TRT] [V] --------------- Timing Runner: Optimizer Reformat(584 -> <out>) (Reformat)
[09/07/2022-04:05:00] [TRT] [V] Tactic: 0x00000000000003e8 Time: 0.133575
[09/07/2022-04:05:00] [TRT] [V] Tactic: 0x00000000000003ea Time: 0.0574578
[09/07/2022-04:05:00] [TRT] [V] Tactic: 0x0000000000000000 Time: 0.133689
[09/07/2022-04:05:00] [TRT] [V] Fastest Tactic: 0x00000000000003ea Time: 0.0574578
[09/07/2022-04:05:00] [TRT] [V] *************** Autotuning Reformat: Float(1,(* 256 (# 0 (SHAPE inputTensor))),(# 0 (SHAPE inputTensor))) -> Float((* 256 (# 2 (SHAPE inputTensor))),256,1) ***************
[09/07/2022-04:05:00] [TRT] [V] --------------- Timing Runner: Optimizer Reformat(584 -> <out>) (Reformat)
[09/07/2022-04:05:00] [TRT] [V] Tactic: 0x00000000000003e8 Time: 0.0141067
[09/07/2022-04:05:00] [TRT] [V] Tactic: 0x00000000000003ea Time: 0.0557511
[09/07/2022-04:05:00] [TRT] [V] Tactic: 0x0000000000000000 Time: 0.0141711
[09/07/2022-04:05:00] [TRT] [V] Fastest Tactic: 0x00000000000003e8 Time: 0.0141067
[09/07/2022-04:05:00] [TRT] [V] *************** Autotuning Reformat: Float(1,(* 256 (# 0 (SHAPE inputTensor))),(# 0 (SHAPE inputTensor))) -> Float((* 256 (# 2 (SHAPE inputTensor))):32,256,1) ***************
[09/07/2022-04:05:00] [TRT] [V] --------------- Timing Runner: Optimizer Reformat(584 -> <out>) (Reformat)
[09/07/2022-04:05:00] [TRT] [V] Tactic: 0x00000000000003e8 Time: 0.171179
[09/07/2022-04:05:00] [TRT] [V] Tactic: 0x00000000000003ea Time: 0.0541745
[09/07/2022-04:05:00] [TRT] [V] Tactic: 0x0000000000000000 Time: 0.173056
[09/07/2022-04:05:00] [TRT] [V] Fastest Tactic: 0x00000000000003ea Time: 0.0541745
[09/07/2022-04:05:00] [TRT] [V] *************** Autotuning Reformat: Float((* 256 (# 2 (SHAPE inputTensor))):32,256,1) -> Float((* 256 (# 2 (SHAPE inputTensor))),256,1) ***************
[09/07/2022-04:05:00] [TRT] [V] --------------- Timing Runner: Optimizer Reformat(584 -> <out>) (Reformat)
[09/07/2022-04:05:00] [TRT] [V] Tactic: 0x00000000000003e8 Time: 0.0231424
[09/07/2022-04:05:00] [TRT] [V] Tactic: 0x00000000000003ea Time: 0.0561493
[09/07/2022-04:05:00] [TRT] [V] Tactic: 0x0000000000000000 Time: 0.0231765
[09/07/2022-04:05:00] [TRT] [V] Fastest Tactic: 0x00000000000003e8 Time: 0.0231424
[09/07/2022-04:05:00] [TRT] [V] =============== Computing reformatting costs
[09/07/2022-04:05:00] [TRT] [V] *************** Autotuning Reformat: Float((* 256 (# 2 (SHAPE inputTensor))):32,256,1) -> Float((* 256 (# 2 (SHAPE inputTensor))),256,1) ***************
[09/07/2022-04:05:00] [TRT] [V] --------------- Timing Runner: Optimizer Reformat(<in> -> 585) (Reformat)
[09/07/2022-04:05:00] [TRT] [V] Tactic: 0x00000000000003e8 Time: 0.0232334
[09/07/2022-04:05:00] [TRT] [V] Tactic: 0x00000000000003ea Time: 0.0562631
[09/07/2022-04:05:00] [TRT] [V] Tactic: 0x0000000000000000 Time: 0.0231879
[09/07/2022-04:05:00] [TRT] [V] Fastest Tactic: 0x0000000000000000 Time: 0.0231879
[09/07/2022-04:05:00] [TRT] [V] =============== Computing costs for 
[09/07/2022-04:05:00] [TRT] [V] *************** Autotuning format combination: Float((* 4864 (# 2 (SHAPE inputTensor))),(* 19 (# 2 (SHAPE inputTensor))),19,1) -> Float(4864,1,1,1) ***************
[09/07/2022-04:05:00] [TRT] [V] --------------- Timing Runner: Transpose_51 + Reshape_60 + reshape_before_MatMul_61 (Shuffle)
[09/07/2022-04:05:00] [TRT] [V] Tactic: 0x0000000000000000 Time: 0.230229
[09/07/2022-04:05:00] [TRT] [V] Tactic: 0x0000000000000001 Time: 0.868352
[09/07/2022-04:05:00] [TRT] [V] Fastest Tactic: 0x0000000000000000 Time: 0.230229
[09/07/2022-04:05:00] [TRT] [V] >>>>>>>>>>>>>>> Chose Runner Type: Shuffle Tactic: 0x0000000000000000
[09/07/2022-04:05:00] [TRT] [V] *************** Autotuning format combination: Float((* 4864 (# 2 (SHAPE inputTensor))),1,4864,256) -> Float(4864,1,4864,4864) ***************
[09/07/2022-04:05:00] [TRT] [V] --------------- Timing Runner: Transpose_51 + Reshape_60 + reshape_before_MatMul_61 (Shuffle)
[09/07/2022-04:05:00] [TRT] [V] Tactic: 0x0000000000000000 Time: 0.236373
[09/07/2022-04:05:00] [TRT] [V] Tactic: 0x0000000000000001 Time: 0.874155
[09/07/2022-04:05:00] [TRT] [V] Fastest Tactic: 0x0000000000000000 Time: 0.236373
[09/07/2022-04:05:00] [TRT] [V] >>>>>>>>>>>>>>> Chose Runner Type: Shuffle Tactic: 0x0000000000000000
[09/07/2022-04:05:00] [TRT] [V] *************** Autotuning format combination: Float((* 152 (# 2 (SHAPE inputTensor))),(* 19 (# 2 (SHAPE inputTensor))):32,19,1) -> Float(152,1:32,1,1) ***************
[09/07/2022-04:05:00] [TRT] [V] --------------- Timing Runner: Transpose_51 + Reshape_60 + reshape_before_MatMul_61 (Shuffle)
[09/07/2022-04:05:00] [TRT] [V] Tactic: 0x0000000000000000 Time: 0.309248
[09/07/2022-04:05:00] [TRT] [V] Tactic: 0x0000000000000001 Time: 12.0143
[09/07/2022-04:05:00] [TRT] [V] Fastest Tactic: 0x0000000000000000 Time: 0.309248
[09/07/2022-04:05:00] [TRT] [V] >>>>>>>>>>>>>>> Chose Runner Type: Shuffle Tactic: 0x0000000000000000
[09/07/2022-04:05:00] [TRT] [V] =============== Computing costs for 
[09/07/2022-04:05:00] [TRT] [V] *************** Autotuning format combination: Float(4864,1,1,1) -> Float(256,1,1,1) ***************
[09/07/2022-04:05:00] [TRT] [V] --------------- Timing Runner: MatMul_61 (CudaDepthwiseConvolution)
[09/07/2022-04:05:00] [TRT] [V] CudaDepthwiseConvolution has no valid tactics for this config, skipping
[09/07/2022-04:05:00] [TRT] [V] --------------- Timing Runner: MatMul_61 (FusedConvActConvolution)
[09/07/2022-04:05:00] [TRT] [V] FusedConvActConvolution has no valid tactics for this config, skipping
[09/07/2022-04:05:00] [TRT] [V] --------------- Timing Runner: MatMul_61 (CudnnConvolution)
[09/07/2022-04:05:00] [TRT] [V] Tactic: 0x0000000000000000 Time: 0.909995
[09/07/2022-04:05:00] [TRT] [V] Tactic: 0x0000000000000001 Time: 0.616725
[09/07/2022-04:05:00] [TRT] [V] Tactic: 0x0000000000000002 Time: 2.41562
[09/07/2022-04:05:00] [TRT] [V] Tactic: 0x0000000000000005 Time: 33.7005
[09/07/2022-04:05:00] [TRT] [V] Fastest Tactic: 0x0000000000000001 Time: 0.616725
[09/07/2022-04:05:00] [TRT] [V] --------------- Timing Runner: MatMul_61 (CublasConvolution)
[09/07/2022-04:05:00] [TRT] [V] Tactic: 0x0000000000000000 Time: 0.616779
[09/07/2022-04:05:00] [TRT] [V] Tactic: 0x0000000000000001 Time: 0.613717
[09/07/2022-04:05:00] [TRT] [V] Fastest Tactic: 0x0000000000000001 Time: 0.613717
[09/07/2022-04:05:00] [TRT] [V] --------------- Timing Runner: MatMul_61 (CaskConvolution)
[09/07/2022-04:05:00] [TRT] [V] MatMul_61 Set Tactic Name: maxwell_scudnn_128x32_relu_medium_nn_v1 Tactic: 0x0ebe499388e08286
[09/07/2022-04:05:00] [TRT] [V] Tactic: 0x0ebe499388e08286 Time: 0.837632
[09/07/2022-04:05:00] [TRT] [V] MatMul_61 Set Tactic Name: maxwell_scudnn_128x32_relu_interior_nn_v0 Tactic: 0x1792ed6b0f1ea883
[09/07/2022-04:05:00] [TRT] [V] Tactic: 0x1792ed6b0f1ea883 Time: 0.865621
[09/07/2022-04:05:00] [TRT] [V] MatMul_61 Set Tactic Name: maxwell_scudnn_128x128_relu_medium_nn_v1 Tactic: 0x3e787008e11a6129
[09/07/2022-04:05:00] [TRT] [V] Tactic: 0x3e787008e11a6129 Time: 0.698027
[09/07/2022-04:05:00] [TRT] [V] MatMul_61 Set Tactic Name: maxwell_scudnn_128x64_relu_small_nn_v1 Tactic: 0x474c9edd1ecfbbba
[09/07/2022-04:05:00] [TRT] [V] Tactic: 0x474c9edd1ecfbbba Time: 0.665259
[09/07/2022-04:05:00] [TRT] [V] MatMul_61 Set Tactic Name: maxwell_scudnn_128x128_relu_small_nn_v0 Tactic: 0x4963fb96b4067e81
[09/07/2022-04:05:00] [TRT] [V] Tactic: 0x4963fb96b4067e81 Time: 0.717824
[09/07/2022-04:05:00] [TRT] [V] MatMul_61 Set Tactic Name: maxwell_scudnn_128x128_relu_interior_nn_v1 Tactic: 0x49ecad9da64c487b
[09/07/2022-04:05:00] [TRT] [V] Tactic: 0x49ecad9da64c487b Time: 0.690859
[09/07/2022-04:05:00] [TRT] [V] MatMul_61 Set Tactic Name: maxwell_scudnn_128x64_relu_interior_nn_v0 Tactic: 0x4c5584586319b832
[09/07/2022-04:05:00] [TRT] [V] Tactic: 0x4c5584586319b832 Time: 1.05779
[09/07/2022-04:05:00] [TRT] [V] MatMul_61 Set Tactic Name: maxwell_scudnn_128x64_relu_medium_nn_v1 Tactic: 0x5c38385751ccb068
[09/07/2022-04:05:00] [TRT] [V] Tactic: 0x5c38385751ccb068 Time: 0.672427
[09/07/2022-04:05:00] [TRT] [V] MatMul_61 Set Tactic Name: maxwell_scudnn_128x32_relu_small_nn_v0 Tactic: 0x632674f65e3422ae
[09/07/2022-04:05:00] [TRT] [V] Tactic: 0x632674f65e3422ae Time: 0.897365
[09/07/2022-04:05:00] [TRT] [V] MatMul_61 Set Tactic Name: maxwell_scudnn_128x128_relu_medium_nn_v0 Tactic: 0x8d563cb6e2bd3e46
[09/07/2022-04:05:00] [TRT] [V] Tactic: 0x8d563cb6e2bd3e46 Time: 0.730795
[09/07/2022-04:05:00] [TRT] [V] MatMul_61 Set Tactic Name: maxwell_scudnn_128x32_relu_interior_nn_v1 Tactic: 0xa4bca1d50cb9f7ec
[09/07/2022-04:05:00] [TRT] [V] Tactic: 0xa4bca1d50cb9f7ec Time: 0.834901
[09/07/2022-04:05:00] [TRT] [V] MatMul_61 Set Tactic Name: maxwell_scudnn_128x32_relu_medium_nn_v0 Tactic: 0xbd90052d8b47dde9
[09/07/2022-04:05:00] [TRT] [V] Tactic: 0xbd90052d8b47dde9 Time: 0.910336
[09/07/2022-04:05:00] [TRT] [V] MatMul_61 Set Tactic Name: maxwell_scudnn_128x32_relu_small_nn_v1 Tactic: 0xd00838485d937dc1
[09/07/2022-04:05:00] [TRT] [V] Tactic: 0xd00838485d937dc1 Time: 0.83456
[09/07/2022-04:05:00] [TRT] [V] MatMul_61 Set Tactic Name: maxwell_scudnn_128x64_relu_medium_nn_v0 Tactic: 0xef1674e9526bef07
[09/07/2022-04:05:00] [TRT] [V] Tactic: 0xef1674e9526bef07 Time: 1.12265
[09/07/2022-04:05:00] [TRT] [V] MatMul_61 Set Tactic Name: maxwell_scudnn_128x64_relu_small_nn_v0 Tactic: 0xf462d2631d68e4d5
[09/07/2022-04:05:00] [TRT] [V] Tactic: 0xf462d2631d68e4d5 Time: 1.05711
[09/07/2022-04:05:00] [TRT] [V] MatMul_61 Set Tactic Name: maxwell_scudnn_128x128_relu_small_nn_v1 Tactic: 0xfa4db728b7a121ee
[09/07/2022-04:05:00] [TRT] [V] Tactic: 0xfa4db728b7a121ee Time: 0.693589
[09/07/2022-04:05:00] [TRT] [V] MatMul_61 Set Tactic Name: maxwell_scudnn_128x128_relu_interior_nn_v0 Tactic: 0xfac2e123a5eb1714
[09/07/2022-04:05:00] [TRT] [V] Tactic: 0xfac2e123a5eb1714 Time: 0.713045
[09/07/2022-04:05:00] [TRT] [V] MatMul_61 Set Tactic Name: maxwell_scudnn_128x64_relu_interior_nn_v1 Tactic: 0xff7bc8e660bee75d
[09/07/2022-04:05:00] [TRT] [V] Tactic: 0xff7bc8e660bee75d Time: 0.765269
[09/07/2022-04:05:00] [TRT] [V] Fastest Tactic: 0x474c9edd1ecfbbba Time: 0.665259
[09/07/2022-04:05:00] [TRT] [V] >>>>>>>>>>>>>>> Chose Runner Type: CublasConvolution Tactic: 0x0000000000000001
[09/07/2022-04:05:00] [TRT] [V] *************** Autotuning format combination: Float(4864,1,4864,4864) -> Float(256,1,256,256) ***************
[09/07/2022-04:05:00] [TRT] [V] --------------- Timing Runner: MatMul_61 (CublasConvolution)
[09/07/2022-04:05:00] [TRT] [V] CublasConvolution has no valid tactics for this config, skipping
[09/07/2022-04:05:00] [TRT] [V] --------------- Timing Runner: MatMul_61 (CaskConvolution)
[09/07/2022-04:05:00] [TRT] [V] MatMul_61 Set Tactic Name: maxwell_scudnn_128x64_sliced1x2_ldg4_relu_exp_interior_nhwc_tn_v1 Tactic: 0x35f071de80e3b3c4
[09/07/2022-04:05:00] [TRT] [V] Tactic: 0x35f071de80e3b3c4 Time: 0.42496
[09/07/2022-04:05:00] [TRT] [V] MatMul_61 Set Tactic Name: maxwell_scudnn_128x32_sliced1x4_ldg4_relu_exp_interior_nhwc_tn_v1 Tactic: 0x5c024b37b78e77c0
[09/07/2022-04:05:00] [TRT] [V] Tactic: 0x5c024b37b78e77c0 Time: 0.390752
[09/07/2022-04:05:00] [TRT] [V] MatMul_61 Set Tactic Name: maxwell_scudnn_128x32_sliced1x4_ldg4_relu_exp_small_nhwc_tn_v1 Tactic: 0x80f932c0b8ce5940
[09/07/2022-04:05:00] [TRT] [V] Tactic: 0x80f932c0b8ce5940 Time: 0.394581
[09/07/2022-04:05:00] [TRT] [V] MatMul_61 Set Tactic Name: maxwell_scudnn_128x64_sliced1x2_ldg4_relu_exp_small_nhwc_tn_v1 Tactic: 0x9961ac24fc07a1df
[09/07/2022-04:05:00] [TRT] [V] Tactic: 0x9961ac24fc07a1df Time: 0.389803
[09/07/2022-04:05:00] [TRT] [V] Fastest Tactic: 0x9961ac24fc07a1df Time: 0.389803
[09/07/2022-04:05:00] [TRT] [V] >>>>>>>>>>>>>>> Chose Runner Type: CaskConvolution Tactic: 0x9961ac24fc07a1df
[09/07/2022-04:05:00] [TRT] [V] =============== Computing costs for 
[09/07/2022-04:05:00] [TRT] [V] *************** Autotuning format combination: Float(256,1,1,1) -> Float((* 256 (# 2 (SHAPE inputTensor))),256,1) ***************
[09/07/2022-04:05:00] [TRT] [V] --------------- Timing Runner: reshape_after_MatMul_61 (Shuffle)
[09/07/2022-04:05:00] [TRT] [V] Tactic: 0x0000000000000000 Time: 0.00540267
[09/07/2022-04:05:00] [TRT] [V] Tactic: 0x0000000000000001 Time: 0.0198488
[09/07/2022-04:05:00] [TRT] [V] Fastest Tactic: 0x0000000000000000 Time: 0.00540267
[09/07/2022-04:05:00] [TRT] [V] >>>>>>>>>>>>>>> Chose Runner Type: Shuffle Tactic: 0x0000000000000000
[09/07/2022-04:05:00] [TRT] [V] *************** Autotuning format combination: Float(256,1,256,256) -> Float(1,(* 256 (# 0 (SHAPE inputTensor))),(# 0 (SHAPE inputTensor))) ***************
[09/07/2022-04:05:00] [TRT] [V] --------------- Timing Runner: reshape_after_MatMul_61 (Shuffle)
[09/07/2022-04:05:00] [TRT] [V] Tactic: 0x0000000000000000 Time: 0.0287004
[09/07/2022-04:05:00] [TRT] [V] Tactic: 0x0000000000000001 Time: 0.0241333
[09/07/2022-04:05:00] [TRT] [V] Fastest Tactic: 0x0000000000000001 Time: 0.0241333
[09/07/2022-04:05:00] [TRT] [V] >>>>>>>>>>>>>>> Chose Runner Type: Shuffle Tactic: 0x0000000000000001
[09/07/2022-04:05:00] [TRT] [V] *************** Autotuning format combination: Float(8,1:32,1,1) -> Float((* 256 (# 2 (SHAPE inputTensor))):32,256,1) ***************
[09/07/2022-04:05:00] [TRT] [V] --------------- Timing Runner: reshape_after_MatMul_61 (Shuffle)
[09/07/2022-04:05:00] [TRT] [V] Tactic: 0x0000000000000000 Time: 0.104107
[09/07/2022-04:05:00] [TRT] [V] Tactic: 0x0000000000000001 Time: 0.665941
[09/07/2022-04:05:00] [TRT] [V] Fastest Tactic: 0x0000000000000000 Time: 0.104107
[09/07/2022-04:05:00] [TRT] [V] >>>>>>>>>>>>>>> Chose Runner Type: Shuffle Tactic: 0x0000000000000000
[09/07/2022-04:05:00] [TRT] [V] =============== Computing costs for 
[09/07/2022-04:05:00] [TRT] [V] *************** Autotuning format combination:  -> Float(256,256,1) ***************
[09/07/2022-04:05:00] [TRT] [V] =============== Computing costs for 
[09/07/2022-04:05:00] [TRT] [V] *************** Autotuning format combination: Float(256,256,1), Float(E0,256,1) -> Float(E0,256,1) where E0=(* 256 (# 2 (SHAPE inputTensor))) ***************
[09/07/2022-04:05:00] [TRT] [V] --------------- Timing Runner: Add_62 (ElementWise)
[09/07/2022-04:05:00] [TRT] [V] Tactic: 0x0000000000000001 Time: 0.0107613
[09/07/2022-04:05:00] [TRT] [V] Fastest Tactic: 0x0000000000000001 Time: 0.0107613
[09/07/2022-04:05:00] [TRT] [V] >>>>>>>>>>>>>>> Chose Runner Type: ElementWise Tactic: 0x0000000000000001
[09/07/2022-04:05:00] [TRT] [V] *************** Autotuning format combination: Float(256:32,256,1), Float(E0:32,256,1) -> Float(E0:32,256,1) where E0=(* 256 (# 2 (SHAPE inputTensor))) ***************
[09/07/2022-04:05:00] [TRT] [V] --------------- Timing Runner: Add_62 (ElementWise)
[09/07/2022-04:05:00] [TRT] [V] Tactic: 0x0000000000000001 Time: 0.0303486
[09/07/2022-04:05:00] [TRT] [V] Fastest Tactic: 0x0000000000000001 Time: 0.0303486
[09/07/2022-04:05:00] [TRT] [V] >>>>>>>>>>>>>>> Chose Runner Type: ElementWise Tactic: 0x0000000000000001
[09/07/2022-04:05:00] [TRT] [V] Adding reformat layer: Reformatted Input Tensor 0 to MatMul_61 (reshape_before_MatMul_61_out_tensor) from Float(4864,1,1,1) to Float(4864,1,4864,4864)
[09/07/2022-04:05:00] [TRT] [V] Adding reformat layer: Reformatted Input Tensor 0 to reshape_after_MatMul_61 (MatMul_61_out_tensor) from Float(256,1,256,256) to Float(256,1,1,1)
[09/07/2022-04:05:00] [TRT] [V] Formats and tactics selection completed in 0.996718 seconds.
[09/07/2022-04:05:00] [TRT] [V] After reformat layers: 7 layers
[09/07/2022-04:05:00] [TRT] [V] Pre-optimized block assignment.
[09/07/2022-04:05:00] [TRT] [V] Block size 4
[09/07/2022-04:05:00] [TRT] [V] Block size 19922944
[09/07/2022-04:05:00] [TRT] [V] Block size 1048576
[09/07/2022-04:05:00] [TRT] [V] Block size 4
[09/07/2022-04:05:00] [TRT] [V] Block size 4
[09/07/2022-04:05:00] [TRT] [V] Block size 23622320128
[09/07/2022-04:05:00] [TRT] [V] Total Activation Memory: 23643291660
[09/07/2022-04:05:00] [TRT] [I] Detected 1 inputs and 1 output network tensors.
[09/07/2022-04:05:00] [TRT] [V] MatMul_61 Set Tactic Name: maxwell_scudnn_128x64_sliced1x2_ldg4_relu_exp_small_nhwc_tn_v1 Tactic: 0x9961ac24fc07a1df
[09/07/2022-04:05:00] [TRT] [V] Layer: Transpose_51 + Reshape_60 + reshape_before_MatMul_61 Host Persistent: 0 Device Persistent: 0 Scratch Memory: 0
[09/07/2022-04:05:00] [TRT] [V] Layer: Reformatting CopyNode for Input Tensor 0 to MatMul_61 Host Persistent: 0 Device Persistent: 0 Scratch Memory: 0
[09/07/2022-04:05:00] [TRT] [V] Layer: MatMul_61 Host Persistent: 1664 Device Persistent: 512 Scratch Memory: 0
[09/07/2022-04:05:00] [TRT] [V] Layer: Reformatting CopyNode for Input Tensor 0 to reshape_after_MatMul_61 Host Persistent: 0 Device Persistent: 0 Scratch Memory: 0
[09/07/2022-04:05:00] [TRT] [V] Layer: reshape_after_MatMul_61 Host Persistent: 0 Device Persistent: 0 Scratch Memory: 0
[09/07/2022-04:05:00] [TRT] [V] Layer: encoder.embed.out.0.bias + (Unnamed Layer* 16) [Shuffle] Host Persistent: 0 Device Persistent: 0 Scratch Memory: 0
[09/07/2022-04:05:00] [TRT] [V] Layer: Add_62 Host Persistent: 0 Device Persistent: 0 Scratch Memory: 0
[09/07/2022-04:05:00] [TRT] [I] Total Host Persistent Memory: 1664
[09/07/2022-04:05:00] [TRT] [I] Total Device Persistent Memory: 512
[09/07/2022-04:05:00] [TRT] [I] Total Scratch Memory: 0
[09/07/2022-04:05:00] [TRT] [I] [MemUsageStats] Peak memory usage of TRT CPU/GPU memory allocators: CPU 9 MiB, GPU 867 MiB
[09/07/2022-04:05:00] [TRT] [I] [BlockAssignment] Algorithm ShiftNTopDown took 0.00915ms to assign 3 blocks to 5 nodes requiring 20971524 bytes.
[09/07/2022-04:05:00] [TRT] [V] Optimized block assignment.
[09/07/2022-04:05:00] [TRT] [V] Block size 19922944
[09/07/2022-04:05:00] [TRT] [V] Block size 1048576
[09/07/2022-04:05:00] [TRT] [V] Block size 4
[09/07/2022-04:05:00] [TRT] [I] Total Activation Memory: 20971524
[09/07/2022-04:05:00] [TRT] [V] Disabling unused tactic source: CUDNN
[09/07/2022-04:05:00] [TRT] [V] Disabling unused tactic source: CUBLAS, CUBLAS_LT
[09/07/2022-04:05:00] [TRT] [V] Engine generation completed in 1.31791 seconds.
[09/07/2022-04:05:00] [TRT] [V] Deleting timing cache: 28 entries, served 0 hits since creation.
[09/07/2022-04:05:00] [TRT] [V] Engine Layer Information:
Layer(Shuffle): Transpose_51 + Reshape_60 + reshape_before_MatMul_61, Tactic: 0x0000000000000000, inputTensor[Float(-6,256,-8,19)] -> reshape_before_MatMul_61_out_region[Float(-10,4864,1,1)]
Layer(NoOp): Reformatting CopyNode for Input Tensor 0 to MatMul_61, Tactic: 0x0000000000000000, reshape_before_MatMul_61_out_region[Float(-10,4864,1,1)] -> Reformatted Input Tensor 0 to MatMul_61[Float(-10,4864,1,1)]
Layer(CaskConvolution): MatMul_61, Tactic: 0x9961ac24fc07a1df, Reformatted Input Tensor 0 to MatMul_61[Float(-10,4864,1,1)] -> MatMul_61_out_region[Float(-10,256,1,1)]
Layer(NoOp): Reformatting CopyNode for Input Tensor 0 to reshape_after_MatMul_61, Tactic: 0x0000000000000000, MatMul_61_out_region[Float(-10,256,1,1)] -> Reformatted Input Tensor 0 to reshape_after_MatMul_61[Float(-10,256,1,1)]
Layer(NoOp): reshape_after_MatMul_61, Tactic: 0x0000000000000000, Reformatted Input Tensor 0 to reshape_after_MatMul_61[Float(-10,256,1,1)] -> 584[Float(-6,-8,256)]
Layer(Constant): encoder.embed.out.0.bias + (Unnamed Layer* 16) [Shuffle], Tactic: 0x0000000000000000,  -> (Unnamed Layer* 16) [Shuffle]_output[Float(1,1,256)]
Layer(ElementWise): Add_62, Tactic: 0x0000000000000001, (Unnamed Layer* 16) [Shuffle]_output[Float(1,1,256)], 584[Float(-6,-8,256)] -> 585[Float(-6,-8,256)]
[09/07/2022-04:05:00] [TRT] [I] [MemUsageChange] TensorRT-managed allocation in building engine: CPU +4, GPU +8, now: CPU 4, GPU 8 (MiB)
[09/07/2022-04:05:00] [TRT] [W] The getMaxBatchSize() function should not be used with an engine built from a network created with NetworkDefinitionCreationFlag::kEXPLICIT_BATCH flag. This function will always return 1.
[09/07/2022-04:05:00] [TRT] [W] The getMaxBatchSize() function should not be used with an engine built from a network created with NetworkDefinitionCreationFlag::kEXPLICIT_BATCH flag. This function will always return 1.
&&&& RUNNING TensorRT.trtexec [TensorRT v8401] # trtexec --loadEngine=model-0.plan --verbose --useCudaGraph --noDataTransfers --shapes=inputTensor:16x256x64x19
[09/07/2022-04:05:00] [I] === Model Options ===
[09/07/2022-04:05:00] [I] Format: *
[09/07/2022-04:05:00] [I] Model: 
[09/07/2022-04:05:00] [I] Output:
[09/07/2022-04:05:00] [I] === Build Options ===
[09/07/2022-04:05:00] [I] Max batch: explicit batch
[09/07/2022-04:05:00] [I] Memory Pools: workspace: default, dlaSRAM: default, dlaLocalDRAM: default, dlaGlobalDRAM: default
[09/07/2022-04:05:00] [I] minTiming: 1
[09/07/2022-04:05:00] [I] avgTiming: 8
[09/07/2022-04:05:00] [I] Precision: FP32
[09/07/2022-04:05:00] [I] LayerPrecisions: 
[09/07/2022-04:05:00] [I] Calibration: 
[09/07/2022-04:05:00] [I] Refit: Disabled
[09/07/2022-04:05:00] [I] Sparsity: Disabled
[09/07/2022-04:05:00] [I] Safe mode: Disabled
[09/07/2022-04:05:00] [I] DirectIO mode: Disabled
[09/07/2022-04:05:00] [I] Restricted mode: Disabled
[09/07/2022-04:05:00] [I] Build only: Disabled
[09/07/2022-04:05:00] [I] Save engine: 
[09/07/2022-04:05:00] [I] Load engine: model-0.plan
[09/07/2022-04:05:00] [I] Profiling verbosity: 0
[09/07/2022-04:05:00] [I] Tactic sources: Using default tactic sources
[09/07/2022-04:05:00] [I] timingCacheMode: local
[09/07/2022-04:05:00] [I] timingCacheFile: 
[09/07/2022-04:05:00] [I] Input(s)s format: fp32:CHW
[09/07/2022-04:05:00] [I] Output(s)s format: fp32:CHW
[09/07/2022-04:05:00] [I] Input build shape: inputTensor=16x256x64x19+16x256x64x19+16x256x64x19
[09/07/2022-04:05:00] [I] Input calibration shapes: model
[09/07/2022-04:05:00] [I] === System Options ===
[09/07/2022-04:05:00] [I] Device: 0
[09/07/2022-04:05:00] [I] DLACore: 
[09/07/2022-04:05:00] [I] Plugins:
[09/07/2022-04:05:00] [I] === Inference Options ===
[09/07/2022-04:05:00] [I] Batch: Explicit
[09/07/2022-04:05:00] [I] Input inference shape: inputTensor=16x256x64x19
[09/07/2022-04:05:00] [I] Iterations: 10
[09/07/2022-04:05:00] [I] Duration: 3s (+ 200ms warm up)
[09/07/2022-04:05:00] [I] Sleep time: 0ms
[09/07/2022-04:05:00] [I] Idle time: 0ms
[09/07/2022-04:05:00] [I] Streams: 1
[09/07/2022-04:05:00] [I] ExposeDMA: Disabled
[09/07/2022-04:05:00] [I] Data transfers: Disabled
[09/07/2022-04:05:00] [I] Spin-wait: Disabled
[09/07/2022-04:05:00] [I] Multithreading: Disabled
[09/07/2022-04:05:00] [I] CUDA Graph: Enabled
[09/07/2022-04:05:00] [I] Separate profiling: Disabled
[09/07/2022-04:05:00] [I] Time Deserialize: Disabled
[09/07/2022-04:05:00] [I] Time Refit: Disabled
[09/07/2022-04:05:00] [I] Inputs:
[09/07/2022-04:05:00] [I] === Reporting Options ===
[09/07/2022-04:05:00] [I] Verbose: Enabled
[09/07/2022-04:05:00] [I] Averages: 10 inferences
[09/07/2022-04:05:00] [I] Percentile: 99
[09/07/2022-04:05:00] [I] Dump refittable layers:Disabled
[09/07/2022-04:05:00] [I] Dump output: Disabled
[09/07/2022-04:05:00] [I] Profile: Disabled
[09/07/2022-04:05:00] [I] Export timing to JSON file: 
[09/07/2022-04:05:00] [I] Export output to JSON file: 
[09/07/2022-04:05:00] [I] Export profile to JSON file: 
[09/07/2022-04:05:00] [I] 
[09/07/2022-04:05:00] [I] === Device Information ===
[09/07/2022-04:05:00] [I] Selected Device: NVIDIA GeForce GTX 1070
[09/07/2022-04:05:00] [I] Compute Capability: 6.1
[09/07/2022-04:05:00] [I] SMs: 16
[09/07/2022-04:05:00] [I] Compute Clock Rate: 1.645 GHz
[09/07/2022-04:05:00] [I] Device Global Memory: 8111 MiB
[09/07/2022-04:05:00] [I] Shared Memory per SM: 96 KiB
[09/07/2022-04:05:00] [I] Memory Bus Width: 256 bits (ECC disabled)
[09/07/2022-04:05:00] [I] Memory Clock Rate: 4.004 GHz
[09/07/2022-04:05:00] [I] 
[09/07/2022-04:05:00] [I] TensorRT version: 8.4.1
[09/07/2022-04:05:00] [V] [TRT] Registered plugin creator - ::BatchTilePlugin_TRT version 1
[09/07/2022-04:05:00] [V] [TRT] Registered plugin creator - ::BatchedNMS_TRT version 1
[09/07/2022-04:05:00] [V] [TRT] Registered plugin creator - ::BatchedNMSDynamic_TRT version 1
[09/07/2022-04:05:00] [V] [TRT] Registered plugin creator - ::CoordConvAC version 1
[09/07/2022-04:05:00] [V] [TRT] Registered plugin creator - ::CropAndResize version 1
[09/07/2022-04:05:00] [V] [TRT] Registered plugin creator - ::CropAndResizeDynamic version 1
[09/07/2022-04:05:00] [V] [TRT] Registered plugin creator - ::DecodeBbox3DPlugin version 1
[09/07/2022-04:05:00] [V] [TRT] Registered plugin creator - ::DetectionLayer_TRT version 1
[09/07/2022-04:05:00] [V] [TRT] Registered plugin creator - ::EfficientNMS_TRT version 1
[09/07/2022-04:05:00] [V] [TRT] Registered plugin creator - ::EfficientNMS_ONNX_TRT version 1
[09/07/2022-04:05:00] [V] [TRT] Registered plugin creator - ::EfficientNMS_Explicit_TF_TRT version 1
[09/07/2022-04:05:00] [V] [TRT] Registered plugin creator - ::EfficientNMS_Implicit_TF_TRT version 1
[09/07/2022-04:05:00] [V] [TRT] Registered plugin creator - ::FlattenConcat_TRT version 1
[09/07/2022-04:05:00] [V] [TRT] Registered plugin creator - ::GenerateDetection_TRT version 1
[09/07/2022-04:05:00] [V] [TRT] Registered plugin creator - ::GridAnchor_TRT version 1
[09/07/2022-04:05:00] [V] [TRT] Registered plugin creator - ::GridAnchorRect_TRT version 1
[09/07/2022-04:05:00] [V] [TRT] Registered plugin creator - ::InstanceNormalization_TRT version 1
[09/07/2022-04:05:00] [V] [TRT] Registered plugin creator - ::LReLU_TRT version 1
[09/07/2022-04:05:00] [V] [TRT] Registered plugin creator - ::MultilevelCropAndResize_TRT version 1
[09/07/2022-04:05:00] [V] [TRT] Registered plugin creator - ::MultilevelProposeROI_TRT version 1
[09/07/2022-04:05:00] [V] [TRT] Registered plugin creator - ::MultiscaleDeformableAttnPlugin_TRT version 1
[09/07/2022-04:05:00] [V] [TRT] Registered plugin creator - ::NMS_TRT version 1
[09/07/2022-04:05:00] [V] [TRT] Registered plugin creator - ::NMSDynamic_TRT version 1
[09/07/2022-04:05:00] [V] [TRT] Registered plugin creator - ::Normalize_TRT version 1
[09/07/2022-04:05:00] [V] [TRT] Registered plugin creator - ::PillarScatterPlugin version 1
[09/07/2022-04:05:00] [V] [TRT] Registered plugin creator - ::PriorBox_TRT version 1
[09/07/2022-04:05:00] [V] [TRT] Registered plugin creator - ::ProposalLayer_TRT version 1
[09/07/2022-04:05:00] [V] [TRT] Registered plugin creator - ::Proposal version 1
[09/07/2022-04:05:00] [V] [TRT] Registered plugin creator - ::ProposalDynamic version 1
[09/07/2022-04:05:00] [V] [TRT] Registered plugin creator - ::PyramidROIAlign_TRT version 1
[09/07/2022-04:05:00] [V] [TRT] Registered plugin creator - ::Region_TRT version 1
[09/07/2022-04:05:00] [V] [TRT] Registered plugin creator - ::Reorg_TRT version 1
[09/07/2022-04:05:00] [V] [TRT] Registered plugin creator - ::ResizeNearest_TRT version 1
[09/07/2022-04:05:00] [V] [TRT] Registered plugin creator - ::RPROI_TRT version 1
[09/07/2022-04:05:00] [V] [TRT] Registered plugin creator - ::ScatterND version 1
[09/07/2022-04:05:00] [V] [TRT] Registered plugin creator - ::SpecialSlice_TRT version 1
[09/07/2022-04:05:00] [V] [TRT] Registered plugin creator - ::Split version 1
[09/07/2022-04:05:00] [V] [TRT] Registered plugin creator - ::VoxelGeneratorPlugin version 1
[09/07/2022-04:05:00] [I] Engine loaded in 0.00349039 sec.
[09/07/2022-04:05:01] [I] [TRT] [MemUsageChange] Init CUDA: CPU +194, GPU +0, now: CPU 207, GPU 846 (MiB)
[09/07/2022-04:05:01] [I] [TRT] Loaded engine size: 4 MiB
[09/07/2022-04:05:01] [V] [TRT] Deserialization required 1113 microseconds.
[09/07/2022-04:05:01] [I] [TRT] [MemUsageChange] TensorRT-managed allocation in engine deserialization: CPU +0, GPU +4, now: CPU 0, GPU 4 (MiB)
[09/07/2022-04:05:01] [I] Engine deserialized in 0.201304 sec.
[09/07/2022-04:05:01] [V] [TRT] Total per-runner device persistent memory is 512
[09/07/2022-04:05:01] [V] [TRT] Total per-runner host persistent memory is 1664
[09/07/2022-04:05:01] [V] [TRT] Allocated activation device memory of size 20972032
[09/07/2022-04:05:01] [I] [TRT] [MemUsageChange] TensorRT-managed allocation in IExecutionContext creation: CPU +0, GPU +20, now: CPU 0, GPU 24 (MiB)
[09/07/2022-04:05:01] [I] Using random values for input inputTensor
[09/07/2022-04:05:01] [I] Created input binding for inputTensor with dimensions 16x256x64x19
[09/07/2022-04:05:01] [I] Using random values for output 585
[09/07/2022-04:05:01] [I] Created output binding for 585 with dimensions 16x64x256
[09/07/2022-04:05:01] [I] Starting inference
[09/07/2022-04:05:04] [I] Warmup completed 212 queries over 200 ms
[09/07/2022-04:05:04] [I] Timing trace has 2923 queries over 3.00139 s
[09/07/2022-04:05:04] [I] 
[09/07/2022-04:05:04] [I] === Trace details ===
[09/07/2022-04:05:04] [I] Trace averages of 10 runs:
[09/07/2022-04:05:04] [I] Average on 10 runs - GPU latency: 0.729874 ms - Host latency: 0.729874 ms (enqueue 0.0184174 ms)
[09/07/2022-04:05:04] [I] Average on 10 runs - GPU latency: 0.729189 ms - Host latency: 0.729189 ms (enqueue 0.0161652 ms)
[09/07/2022-04:05:04] [I] Average on 10 runs - GPU latency: 0.72948 ms - Host latency: 0.72948 ms (enqueue 0.0160507 ms)
[09/07/2022-04:05:04] [I] Average on 10 runs - GPU latency: 0.73228 ms - Host latency: 0.73228 ms (enqueue 0.0195297 ms)
[09/07/2022-04:05:04] [I] Average on 10 runs - GPU latency: 0.728822 ms - Host latency: 0.728822 ms (enqueue 0.0169724 ms)
[09/07/2022-04:05:04] [I] Average on 10 runs - GPU latency: 0.730319 ms - Host latency: 0.730319 ms (enqueue 0.0227005 ms)
[09/07/2022-04:05:04] [I] Average on 10 runs - GPU latency: 0.729529 ms - Host latency: 0.729529 ms (enqueue 0.0226227 ms)
[09/07/2022-04:05:04] [I] Average on 10 runs - GPU latency: 0.72959 ms - Host latency: 0.72959 ms (enqueue 0.0223969 ms)
[09/07/2022-04:05:04] [I] Average on 10 runs - GPU latency: 0.728885 ms - Host latency: 0.728885 ms (enqueue 0.023877 ms)
[09/07/2022-04:05:04] [I] Average on 10 runs - GPU latency: 0.729065 ms - Host latency: 0.729065 ms (enqueue 0.0245056 ms)
[09/07/2022-04:05:04] [I] Average on 10 runs - GPU latency: 0.72814 ms - Host latency: 0.72814 ms (enqueue 0.021582 ms)
[09/07/2022-04:05:04] [I] Average on 10 runs - GPU latency: 0.729199 ms - Host latency: 0.729199 ms (enqueue 0.0198975 ms)
[09/07/2022-04:05:04] [I] Average on 10 runs - GPU latency: 0.728497 ms - Host latency: 0.728497 ms (enqueue 0.0189819 ms)
[09/07/2022-04:05:04] [I] Average on 10 runs - GPU latency: 0.728842 ms - Host latency: 0.728842 ms (enqueue 0.0206421 ms)
[09/07/2022-04:05:04] [I] Average on 10 runs - GPU latency: 0.727814 ms - Host latency: 0.727814 ms (enqueue 0.0226837 ms)
[09/07/2022-04:05:04] [I] Average on 10 runs - GPU latency: 0.723563 ms - Host latency: 0.723563 ms (enqueue 0.0169067 ms)
[09/07/2022-04:05:04] [I] Average on 10 runs - GPU latency: 0.693231 ms - Host latency: 0.693231 ms (enqueue 0.0176697 ms)
[09/07/2022-04:05:04] [I] Average on 10 runs - GPU latency: 0.694583 ms - Host latency: 0.694583 ms (enqueue 0.0212402 ms)
[09/07/2022-04:05:04] [I] Average on 10 runs - GPU latency: 0.693796 ms - Host latency: 0.693796 ms (enqueue 0.0179413 ms)
[09/07/2022-04:05:04] [I] Average on 10 runs - GPU latency: 0.69407 ms - Host latency: 0.69407 ms (enqueue 0.0204926 ms)
[09/07/2022-04:05:04] [I] Average on 10 runs - GPU latency: 0.692224 ms - Host latency: 0.692224 ms (enqueue 0.020343 ms)
[09/07/2022-04:05:04] [I] Average on 10 runs - GPU latency: 0.692862 ms - Host latency: 0.692862 ms (enqueue 0.019455 ms)
[09/07/2022-04:05:04] [I] Average on 10 runs - GPU latency: 0.692154 ms - Host latency: 0.692154 ms (enqueue 0.0184906 ms)
[09/07/2022-04:05:04] [I] Average on 10 runs - GPU latency: 0.69223 ms - Host latency: 0.69223 ms (enqueue 0.0174316 ms)
[09/07/2022-04:05:04] [I] Average on 10 runs - GPU latency: 0.706357 ms - Host latency: 0.706357 ms (enqueue 0.01604 ms)
[09/07/2022-04:05:04] [I] Average on 10 runs - GPU latency: 0.771152 ms - Host latency: 0.771152 ms (enqueue 0.0198669 ms)
[09/07/2022-04:05:04] [I] Average on 10 runs - GPU latency: 0.770303 ms - Host latency: 0.770303 ms (enqueue 0.0178894 ms)
[09/07/2022-04:05:04] [I] Average on 10 runs - GPU latency: 0.769138 ms - Host latency: 0.769138 ms (enqueue 0.0212097 ms)
[09/07/2022-04:05:04] [I] Average on 10 runs - GPU latency: 0.794614 ms - Host latency: 0.794614 ms (enqueue 0.0185242 ms)
[09/07/2022-04:05:04] [I] Average on 10 runs - GPU latency: 0.768872 ms - Host latency: 0.768872 ms (enqueue 0.02052 ms)
[09/07/2022-04:05:04] [I] Average on 10 runs - GPU latency: 0.770148 ms - Host latency: 0.770148 ms (enqueue 0.0200592 ms)
[09/07/2022-04:05:04] [I] Average on 10 runs - GPU latency: 0.76817 ms - Host latency: 0.76817 ms (enqueue 0.0212158 ms)
[09/07/2022-04:05:04] [I] Average on 10 runs - GPU latency: 0.74364 ms - Host latency: 0.74364 ms (enqueue 0.0167938 ms)
[09/07/2022-04:05:04] [I] Average on 10 runs - GPU latency: 0.703064 ms - Host latency: 0.703064 ms (enqueue 0.0212097 ms)
[09/07/2022-04:05:04] [I] Average on 10 runs - GPU latency: 0.70307 ms - Host latency: 0.70307 ms (enqueue 0.0216553 ms)
[09/07/2022-04:05:04] [I] Average on 10 runs - GPU latency: 0.702966 ms - Host latency: 0.702966 ms (enqueue 0.0207886 ms)
[09/07/2022-04:05:04] [I] Average on 10 runs - GPU latency: 0.702667 ms - Host latency: 0.702667 ms (enqueue 0.0187256 ms)
[09/07/2022-04:05:04] [I] Average on 10 runs - GPU latency: 0.703473 ms - Host latency: 0.703473 ms (enqueue 0.0203796 ms)
[09/07/2022-04:05:04] [I] Average on 10 runs - GPU latency: 0.7224 ms - Host latency: 0.7224 ms (enqueue 0.0152222 ms)
[09/07/2022-04:05:04] [I] Average on 10 runs - GPU latency: 0.70929 ms - Host latency: 0.70929 ms (enqueue 0.0170776 ms)
[09/07/2022-04:05:04] [I] Average on 10 runs - GPU latency: 0.707794 ms - Host latency: 0.707794 ms (enqueue 0.0207275 ms)
[09/07/2022-04:05:04] [I] Average on 10 runs - GPU latency: 0.709778 ms - Host latency: 0.709778 ms (enqueue 0.0178528 ms)
[09/07/2022-04:05:04] [I] Average on 10 runs - GPU latency: 0.708411 ms - Host latency: 0.708411 ms (enqueue 0.022699 ms)
[09/07/2022-04:05:04] [I] Average on 10 runs - GPU latency: 0.707172 ms - Host latency: 0.707172 ms (enqueue 0.0212097 ms)
[09/07/2022-04:05:04] [I] Average on 10 runs - GPU latency: 0.788922 ms - Host latency: 0.788922 ms (enqueue 0.0287659 ms)
[09/07/2022-04:05:04] [I] Average on 10 runs - GPU latency: 0.707788 ms - Host latency: 0.707788 ms (enqueue 0.024054 ms)
[09/07/2022-04:05:04] [I] Average on 10 runs - GPU latency: 0.709741 ms - Host latency: 0.709741 ms (enqueue 0.0217957 ms)
[09/07/2022-04:05:04] [I] Average on 10 runs - GPU latency: 0.707684 ms - Host latency: 0.707684 ms (enqueue 0.019574 ms)
[09/07/2022-04:05:04] [I] Average on 10 runs - GPU latency: 0.710712 ms - Host latency: 0.710712 ms (enqueue 0.0211243 ms)
[09/07/2022-04:05:04] [I] Average on 10 runs - GPU latency: 0.721393 ms - Host latency: 0.721393 ms (enqueue 0.0187378 ms)
[09/07/2022-04:05:04] [I] Average on 10 runs - GPU latency: 0.696283 ms - Host latency: 0.696283 ms (enqueue 0.0117554 ms)
[09/07/2022-04:05:04] [I] Average on 10 runs - GPU latency: 0.694489 ms - Host latency: 0.694489 ms (enqueue 0.00875244 ms)
[09/07/2022-04:05:04] [I] Average on 10 runs - GPU latency: 0.694165 ms - Host latency: 0.694165 ms (enqueue 0.00921631 ms)
[09/07/2022-04:05:04] [I] Average on 10 runs - GPU latency: 0.694257 ms - Host latency: 0.694257 ms (enqueue 0.00720825 ms)
[09/07/2022-04:05:04] [I] Average on 10 runs - GPU latency: 0.693964 ms - Host latency: 0.693964 ms (enqueue 0.00449829 ms)
[09/07/2022-04:05:04] [I] Average on 10 runs - GPU latency: 0.693646 ms - Host latency: 0.693646 ms (enqueue 0.00501709 ms)
[09/07/2022-04:05:04] [I] Average on 10 runs - GPU latency: 0.733997 ms - Host latency: 0.733997 ms (enqueue 0.0110779 ms)
[09/07/2022-04:05:04] [I] Average on 10 runs - GPU latency: 0.744366 ms - Host latency: 0.744366 ms (enqueue 0.0213074 ms)
[09/07/2022-04:05:04] [I] Average on 10 runs - GPU latency: 0.770532 ms - Host latency: 0.770532 ms (enqueue 0.0168152 ms)
[09/07/2022-04:05:04] [I] Average on 10 runs - GPU latency: 0.752722 ms - Host latency: 0.752722 ms (enqueue 0.0187744 ms)
[09/07/2022-04:05:04] [I] Average on 10 runs - GPU latency: 0.754535 ms - Host latency: 0.754535 ms (enqueue 0.0162415 ms)
[09/07/2022-04:05:04] [I] Average on 10 runs - GPU latency: 0.753699 ms - Host latency: 0.753699 ms (enqueue 0.0176941 ms)
[09/07/2022-04:05:04] [I] Average on 10 runs - GPU latency: 0.753912 ms - Host latency: 0.753912 ms (enqueue 0.0165771 ms)
[09/07/2022-04:05:04] [I] Average on 10 runs - GPU latency: 0.752582 ms - Host latency: 0.752582 ms (enqueue 0.0147949 ms)
[09/07/2022-04:05:04] [I] Average on 10 runs - GPU latency: 0.755786 ms - Host latency: 0.755786 ms (enqueue 0.0235352 ms)
[09/07/2022-04:05:04] [I] Average on 10 runs - GPU latency: 0.753766 ms - Host latency: 0.753766 ms (enqueue 0.020343 ms)
[09/07/2022-04:05:04] [I] Average on 10 runs - GPU latency: 0.738904 ms - Host latency: 0.738904 ms (enqueue 0.0161987 ms)
[09/07/2022-04:05:04] [I] Average on 10 runs - GPU latency: 0.71571 ms - Host latency: 0.71571 ms (enqueue 0.0205505 ms)
[09/07/2022-04:05:04] [I] Average on 10 runs - GPU latency: 0.717358 ms - Host latency: 0.717358 ms (enqueue 0.0192383 ms)
[09/07/2022-04:05:04] [I] Average on 10 runs - GPU latency: 0.718121 ms - Host latency: 0.718121 ms (enqueue 0.0157593 ms)
[09/07/2022-04:05:04] [I] Average on 10 runs - GPU latency: 0.71676 ms - Host latency: 0.71676 ms (enqueue 0.0236816 ms)
[09/07/2022-04:05:04] [I] Average on 10 runs - GPU latency: 0.715082 ms - Host latency: 0.715082 ms (enqueue 0.0190125 ms)
[09/07/2022-04:05:04] [I] Average on 10 runs - GPU latency: 0.717505 ms - Host latency: 0.717505 ms (enqueue 0.0169983 ms)
[09/07/2022-04:05:04] [I] Average on 10 runs - GPU latency: 0.716089 ms - Host latency: 0.716089 ms (enqueue 0.0184448 ms)
[09/07/2022-04:05:04] [I] Average on 10 runs - GPU latency: 0.715179 ms - Host latency: 0.715179 ms (enqueue 0.0175537 ms)
[09/07/2022-04:05:04] [I] Average on 10 runs - GPU latency: 0.715668 ms - Host latency: 0.715668 ms (enqueue 0.0120728 ms)
[09/07/2022-04:05:04] [I] Average on 10 runs - GPU latency: 0.715869 ms - Host latency: 0.715869 ms (enqueue 0.00970459 ms)
[09/07/2022-04:05:04] [I] Average on 10 runs - GPU latency: 0.746613 ms - Host latency: 0.746613 ms (enqueue 0.00964966 ms)
[09/07/2022-04:05:04] [I] Average on 10 runs - GPU latency: 0.777423 ms - Host latency: 0.777423 ms (enqueue 0.0216675 ms)
[09/07/2022-04:05:04] [I] Average on 10 runs - GPU latency: 0.784216 ms - Host latency: 0.784216 ms (enqueue 0.0178711 ms)
[09/07/2022-04:05:04] [I] Average on 10 runs - GPU latency: 0.784363 ms - Host latency: 0.784363 ms (enqueue 0.0213501 ms)
[09/07/2022-04:05:04] [I] Average on 10 runs - GPU latency: 0.782153 ms - Host latency: 0.782153 ms (enqueue 0.022522 ms)
[09/07/2022-04:05:04] [I] Average on 10 runs - GPU latency: 0.783057 ms - Host latency: 0.783057 ms (enqueue 0.0172974 ms)
[09/07/2022-04:05:04] [I] Average on 10 runs - GPU latency: 0.78363 ms - Host latency: 0.78363 ms (enqueue 0.012439 ms)
[09/07/2022-04:05:04] [I] Average on 10 runs - GPU latency: 0.764893 ms - Host latency: 0.764893 ms (enqueue 0.0188354 ms)
[09/07/2022-04:05:04] [I] Average on 10 runs - GPU latency: 0.754492 ms - Host latency: 0.754492 ms (enqueue 0.0231567 ms)
[09/07/2022-04:05:04] [I] Average on 10 runs - GPU latency: 0.795239 ms - Host latency: 0.795239 ms (enqueue 0.0184448 ms)
[09/07/2022-04:05:04] [I] Average on 10 runs - GPU latency: 0.773767 ms - Host latency: 0.773767 ms (enqueue 0.0229004 ms)
[09/07/2022-04:05:04] [I] Average on 10 runs - GPU latency: 0.754724 ms - Host latency: 0.754724 ms (enqueue 0.0197021 ms)
[09/07/2022-04:05:04] [I] Average on 10 runs - GPU latency: 0.755041 ms - Host latency: 0.755041 ms (enqueue 0.0213745 ms)
[09/07/2022-04:05:04] [I] Average on 10 runs - GPU latency: 0.754285 ms - Host latency: 0.754285 ms (enqueue 0.0199951 ms)
[09/07/2022-04:05:04] [I] Average on 10 runs - GPU latency: 0.752722 ms - Host latency: 0.752722 ms (enqueue 0.0205444 ms)
[09/07/2022-04:05:04] [I] Average on 10 runs - GPU latency: 0.75415 ms - Host latency: 0.75415 ms (enqueue 0.0189209 ms)
[09/07/2022-04:05:04] [I] Average on 10 runs - GPU latency: 0.752466 ms - Host latency: 0.752466 ms (enqueue 0.0237183 ms)
[09/07/2022-04:05:04] [I] Average on 10 runs - GPU latency: 0.761084 ms - Host latency: 0.761084 ms (enqueue 0.0215942 ms)
[09/07/2022-04:05:04] [I] Average on 10 runs - GPU latency: 0.752905 ms - Host latency: 0.752905 ms (enqueue 0.0226318 ms)
[09/07/2022-04:05:04] [I] Average on 10 runs - GPU latency: 0.76106 ms - Host latency: 0.76106 ms (enqueue 0.0249512 ms)
[09/07/2022-04:05:04] [I] Average on 10 runs - GPU latency: 0.752405 ms - Host latency: 0.752405 ms (enqueue 0.0218628 ms)
[09/07/2022-04:05:04] [I] Average on 10 runs - GPU latency: 0.752258 ms - Host latency: 0.752258 ms (enqueue 0.0228516 ms)
[09/07/2022-04:05:04] [I] Average on 10 runs - GPU latency: 0.759937 ms - Host latency: 0.759937 ms (enqueue 0.0286621 ms)
[09/07/2022-04:05:04] [I] Average on 10 runs - GPU latency: 0.729395 ms - Host latency: 0.729395 ms (enqueue 0.0227661 ms)
[09/07/2022-04:05:04] [I] Average on 10 runs - GPU latency: 0.716284 ms - Host latency: 0.716284 ms (enqueue 0.0265381 ms)
[09/07/2022-04:05:04] [I] Average on 10 runs - GPU latency: 0.708301 ms - Host latency: 0.708301 ms (enqueue 0.0213867 ms)
[09/07/2022-04:05:04] [I] Average on 10 runs - GPU latency: 0.707996 ms - Host latency: 0.707996 ms (enqueue 0.0137207 ms)
[09/07/2022-04:05:04] [I] Average on 10 runs - GPU latency: 0.72655 ms - Host latency: 0.72655 ms (enqueue 0.0132202 ms)
[09/07/2022-04:05:04] [I] Average on 10 runs - GPU latency: 0.711536 ms - Host latency: 0.711536 ms (enqueue 0.020459 ms)
[09/07/2022-04:05:04] [I] Average on 10 runs - GPU latency: 0.709326 ms - Host latency: 0.709326 ms (enqueue 0.0211914 ms)
[09/07/2022-04:05:04] [I] Average on 10 runs - GPU latency: 0.71023 ms - Host latency: 0.71023 ms (enqueue 0.0190186 ms)
[09/07/2022-04:05:04] [I] Average on 10 runs - GPU latency: 0.710315 ms - Host latency: 0.710315 ms (enqueue 0.0201416 ms)
[09/07/2022-04:05:04] [I] Average on 10 runs - GPU latency: 0.709338 ms - Host latency: 0.709338 ms (enqueue 0.0234863 ms)
[09/07/2022-04:05:04] [I] Average on 10 runs - GPU latency: 0.709338 ms - Host latency: 0.709338 ms (enqueue 0.0189453 ms)
[09/07/2022-04:05:04] [I] Average on 10 runs - GPU latency: 0.709216 ms - Host latency: 0.709216 ms (enqueue 0.0197266 ms)
[09/07/2022-04:05:04] [I] Average on 10 runs - GPU latency: 0.709338 ms - Host latency: 0.709338 ms (enqueue 0.0195312 ms)
[09/07/2022-04:05:04] [I] Average on 10 runs - GPU latency: 0.718408 ms - Host latency: 0.718408 ms (enqueue 0.0188843 ms)
[09/07/2022-04:05:04] [I] Average on 10 runs - GPU latency: 0.772107 ms - Host latency: 0.772107 ms (enqueue 0.0191528 ms)
[09/07/2022-04:05:04] [I] Average on 10 runs - GPU latency: 0.769897 ms - Host latency: 0.769897 ms (enqueue 0.0202271 ms)
[09/07/2022-04:05:04] [I] Average on 10 runs - GPU latency: 0.776917 ms - Host latency: 0.776917 ms (enqueue 0.0209473 ms)
[09/07/2022-04:05:04] [I] Average on 10 runs - GPU latency: 0.751062 ms - Host latency: 0.751062 ms (enqueue 0.0195312 ms)
[09/07/2022-04:05:04] [I] Average on 10 runs - GPU latency: 0.747058 ms - Host latency: 0.747058 ms (enqueue 0.0245361 ms)
[09/07/2022-04:05:04] [I] Average on 10 runs - GPU latency: 0.748071 ms - Host latency: 0.748071 ms (enqueue 0.0216675 ms)
[09/07/2022-04:05:04] [I] Average on 10 runs - GPU latency: 0.744409 ms - Host latency: 0.744409 ms (enqueue 0.0211792 ms)
[09/07/2022-04:05:04] [I] Average on 10 runs - GPU latency: 0.744727 ms - Host latency: 0.744727 ms (enqueue 0.0222656 ms)
[09/07/2022-04:05:04] [I] Average on 10 runs - GPU latency: 0.746948 ms - Host latency: 0.746948 ms (enqueue 0.017627 ms)
[09/07/2022-04:05:04] [I] Average on 10 runs - GPU latency: 0.745496 ms - Host latency: 0.745496 ms (enqueue 0.025061 ms)
[09/07/2022-04:05:04] [I] Average on 10 runs - GPU latency: 0.746106 ms - Host latency: 0.746106 ms (enqueue 0.0218384 ms)
[09/07/2022-04:05:04] [I] Average on 10 runs - GPU latency: 0.745593 ms - Host latency: 0.745593 ms (enqueue 0.0213745 ms)
[09/07/2022-04:05:04] [I] Average on 10 runs - GPU latency: 0.748633 ms - Host latency: 0.748633 ms (enqueue 0.016687 ms)
[09/07/2022-04:05:04] [I] Average on 10 runs - GPU latency: 0.7448 ms - Host latency: 0.7448 ms (enqueue 0.0220459 ms)
[09/07/2022-04:05:04] [I] Average on 10 runs - GPU latency: 0.746082 ms - Host latency: 0.746082 ms (enqueue 0.0238159 ms)
[09/07/2022-04:05:04] [I] Average on 10 runs - GPU latency: 0.743384 ms - Host latency: 0.743384 ms (enqueue 0.0209961 ms)
[09/07/2022-04:05:04] [I] Average on 10 runs - GPU latency: 0.745386 ms - Host latency: 0.745386 ms (enqueue 0.0218262 ms)
[09/07/2022-04:05:04] [I] Average on 10 runs - GPU latency: 0.744421 ms - Host latency: 0.744421 ms (enqueue 0.0250854 ms)
[09/07/2022-04:05:04] [I] Average on 10 runs - GPU latency: 0.75033 ms - Host latency: 0.75033 ms (enqueue 0.0190186 ms)
[09/07/2022-04:05:04] [I] Average on 10 runs - GPU latency: 0.694311 ms - Host latency: 0.694311 ms (enqueue 0.0178833 ms)
[09/07/2022-04:05:04] [I] Average on 10 runs - GPU latency: 0.695947 ms - Host latency: 0.695947 ms (enqueue 0.017334 ms)
[09/07/2022-04:05:04] [I] Average on 10 runs - GPU latency: 0.693665 ms - Host latency: 0.693665 ms (enqueue 0.0258057 ms)
[09/07/2022-04:05:04] [I] Average on 10 runs - GPU latency: 0.693652 ms - Host latency: 0.693652 ms (enqueue 0.0221802 ms)
[09/07/2022-04:05:04] [I] Average on 10 runs - GPU latency: 0.69375 ms - Host latency: 0.69375 ms (enqueue 0.0197388 ms)
[09/07/2022-04:05:04] [I] Average on 10 runs - GPU latency: 0.722815 ms - Host latency: 0.722815 ms (enqueue 0.0194092 ms)
[09/07/2022-04:05:04] [I] Average on 10 runs - GPU latency: 0.709412 ms - Host latency: 0.709412 ms (enqueue 0.0232056 ms)
[09/07/2022-04:05:04] [I] Average on 10 runs - GPU latency: 0.708948 ms - Host latency: 0.708948 ms (enqueue 0.0194946 ms)
[09/07/2022-04:05:04] [I] Average on 10 runs - GPU latency: 0.70769 ms - Host latency: 0.70769 ms (enqueue 0.022998 ms)
[09/07/2022-04:05:04] [I] Average on 10 runs - GPU latency: 0.707361 ms - Host latency: 0.707361 ms (enqueue 0.0214355 ms)
[09/07/2022-04:05:04] [I] Average on 10 runs - GPU latency: 0.709326 ms - Host latency: 0.709326 ms (enqueue 0.0190796 ms)
[09/07/2022-04:05:04] [I] Average on 10 runs - GPU latency: 0.70791 ms - Host latency: 0.70791 ms (enqueue 0.0212646 ms)
[09/07/2022-04:05:04] [I] Average on 10 runs - GPU latency: 0.771704 ms - Host latency: 0.771704 ms (enqueue 0.0237915 ms)
[09/07/2022-04:05:04] [I] Average on 10 runs - GPU latency: 0.707874 ms - Host latency: 0.707874 ms (enqueue 0.0226074 ms)
[09/07/2022-04:05:04] [I] Average on 10 runs - GPU latency: 0.729822 ms - Host latency: 0.729822 ms (enqueue 0.0215088 ms)
[09/07/2022-04:05:04] [I] Average on 10 runs - GPU latency: 0.715784 ms - Host latency: 0.715784 ms (enqueue 0.0238159 ms)
[09/07/2022-04:05:04] [I] Average on 10 runs - GPU latency: 0.760181 ms - Host latency: 0.760181 ms (enqueue 0.0198364 ms)
[09/07/2022-04:05:04] [I] Average on 10 runs - GPU latency: 0.756104 ms - Host latency: 0.756104 ms (enqueue 0.024231 ms)
[09/07/2022-04:05:04] [I] Average on 10 runs - GPU latency: 0.755005 ms - Host latency: 0.755005 ms (enqueue 0.0217041 ms)
[09/07/2022-04:05:04] [I] Average on 10 runs - GPU latency: 0.757117 ms - Host latency: 0.757117 ms (enqueue 0.0200073 ms)
[09/07/2022-04:05:04] [I] Average on 10 runs - GPU latency: 0.757105 ms - Host latency: 0.757105 ms (enqueue 0.0185547 ms)
[09/07/2022-04:05:04] [I] Average on 10 runs - GPU latency: 0.755066 ms - Host latency: 0.755066 ms (enqueue 0.0221558 ms)
[09/07/2022-04:05:04] [I] Average on 10 runs - GPU latency: 0.756702 ms - Host latency: 0.756702 ms (enqueue 0.0176758 ms)
[09/07/2022-04:05:04] [I] Average on 10 runs - GPU latency: 0.755615 ms - Host latency: 0.755615 ms (enqueue 0.0186768 ms)
[09/07/2022-04:05:04] [I] Average on 10 runs - GPU latency: 0.7547 ms - Host latency: 0.7547 ms (enqueue 0.0204468 ms)
[09/07/2022-04:05:04] [I] Average on 10 runs - GPU latency: 0.755444 ms - Host latency: 0.755444 ms (enqueue 0.0210205 ms)
[09/07/2022-04:05:04] [I] Average on 10 runs - GPU latency: 0.756372 ms - Host latency: 0.756372 ms (enqueue 0.0241699 ms)
[09/07/2022-04:05:04] [I] Average on 10 runs - GPU latency: 0.753394 ms - Host latency: 0.753394 ms (enqueue 0.0187134 ms)
[09/07/2022-04:05:04] [I] Average on 10 runs - GPU latency: 0.77572 ms - Host latency: 0.77572 ms (enqueue 0.0170898 ms)
[09/07/2022-04:05:04] [I] Average on 10 runs - GPU latency: 0.768835 ms - Host latency: 0.768835 ms (enqueue 0.0216309 ms)
[09/07/2022-04:05:04] [I] Average on 10 runs - GPU latency: 0.770862 ms - Host latency: 0.770862 ms (enqueue 0.0218384 ms)
[09/07/2022-04:05:04] [I] Average on 10 runs - GPU latency: 0.770825 ms - Host latency: 0.770825 ms (enqueue 0.0221558 ms)
[09/07/2022-04:05:04] [I] Average on 10 runs - GPU latency: 0.768811 ms - Host latency: 0.768811 ms (enqueue 0.0235352 ms)
[09/07/2022-04:05:04] [I] Average on 10 runs - GPU latency: 0.744263 ms - Host latency: 0.744263 ms (enqueue 0.0157227 ms)
[09/07/2022-04:05:04] [I] Average on 10 runs - GPU latency: 0.710791 ms - Host latency: 0.710791 ms (enqueue 0.0184692 ms)
[09/07/2022-04:05:04] [I] Average on 10 runs - GPU latency: 0.709546 ms - Host latency: 0.709546 ms (enqueue 0.0142456 ms)
[09/07/2022-04:05:04] [I] Average on 10 runs - GPU latency: 0.710864 ms - Host latency: 0.710864 ms (enqueue 0.0169312 ms)
[09/07/2022-04:05:04] [I] Average on 10 runs - GPU latency: 0.711291 ms - Host latency: 0.711291 ms (enqueue 0.0149414 ms)
[09/07/2022-04:05:04] [I] Average on 10 runs - GPU latency: 0.709912 ms - Host latency: 0.709912 ms (enqueue 0.0129639 ms)
[09/07/2022-04:05:04] [I] Average on 10 runs - GPU latency: 0.730383 ms - Host latency: 0.730383 ms (enqueue 0.0130737 ms)
[09/07/2022-04:05:04] [I] Average on 10 runs - GPU latency: 0.729211 ms - Host latency: 0.729211 ms (enqueue 0.0164307 ms)
[09/07/2022-04:05:04] [I] Average on 10 runs - GPU latency: 0.728589 ms - Host latency: 0.728589 ms (enqueue 0.0163208 ms)
[09/07/2022-04:05:04] [I] Average on 10 runs - GPU latency: 0.729309 ms - Host latency: 0.729309 ms (enqueue 0.018811 ms)
[09/07/2022-04:05:04] [I] Average on 10 runs - GPU latency: 0.728223 ms - Host latency: 0.728223 ms (enqueue 0.0156616 ms)
[09/07/2022-04:05:04] [I] Average on 10 runs - GPU latency: 0.728125 ms - Host latency: 0.728125 ms (enqueue 0.0150757 ms)
[09/07/2022-04:05:04] [I] Average on 10 runs - GPU latency: 0.730029 ms - Host latency: 0.730029 ms (enqueue 0.0162598 ms)
[09/07/2022-04:05:04] [I] Average on 10 runs - GPU latency: 0.727808 ms - Host latency: 0.727808 ms (enqueue 0.0211914 ms)
[09/07/2022-04:05:04] [I] Average on 10 runs - GPU latency: 0.73667 ms - Host latency: 0.73667 ms (enqueue 0.0255249 ms)
[09/07/2022-04:05:04] [I] Average on 10 runs - GPU latency: 0.72782 ms - Host latency: 0.72782 ms (enqueue 0.0152222 ms)
[09/07/2022-04:05:04] [I] Average on 10 runs - GPU latency: 0.728296 ms - Host latency: 0.728296 ms (enqueue 0.0184326 ms)
[09/07/2022-04:05:04] [I] Average on 10 runs - GPU latency: 0.730957 ms - Host latency: 0.730957 ms (enqueue 0.0165283 ms)
[09/07/2022-04:05:04] [I] Average on 10 runs - GPU latency: 0.707812 ms - Host latency: 0.707812 ms (enqueue 0.0209229 ms)
[09/07/2022-04:05:04] [I] Average on 10 runs - GPU latency: 0.754443 ms - Host latency: 0.754443 ms (enqueue 0.0261475 ms)
[09/07/2022-04:05:04] [I] Average on 10 runs - GPU latency: 0.755469 ms - Host latency: 0.755469 ms (enqueue 0.0233887 ms)
[09/07/2022-04:05:04] [I] Average on 10 runs - GPU latency: 0.753247 ms - Host latency: 0.753247 ms (enqueue 0.0243408 ms)
[09/07/2022-04:05:04] [I] Average on 10 runs - GPU latency: 0.763086 ms - Host latency: 0.763086 ms (enqueue 0.022876 ms)
[09/07/2022-04:05:04] [I] Average on 10 runs - GPU latency: 0.752173 ms - Host latency: 0.752173 ms (enqueue 0.0177002 ms)
[09/07/2022-04:05:04] [I] Average on 10 runs - GPU latency: 0.761865 ms - Host latency: 0.761865 ms (enqueue 0.0251709 ms)
[09/07/2022-04:05:04] [I] Average on 10 runs - GPU latency: 0.75271 ms - Host latency: 0.75271 ms (enqueue 0.0174561 ms)
[09/07/2022-04:05:04] [I] Average on 10 runs - GPU latency: 0.755298 ms - Host latency: 0.755298 ms (enqueue 0.0187256 ms)
[09/07/2022-04:05:04] [I] Average on 10 runs - GPU latency: 0.754175 ms - Host latency: 0.754175 ms (enqueue 0.0216309 ms)
[09/07/2022-04:05:04] [I] Average on 10 runs - GPU latency: 0.756006 ms - Host latency: 0.756006 ms (enqueue 0.0175781 ms)
[09/07/2022-04:05:04] [I] Average on 10 runs - GPU latency: 0.753296 ms - Host latency: 0.753296 ms (enqueue 0.0224365 ms)
[09/07/2022-04:05:04] [I] Average on 10 runs - GPU latency: 0.752197 ms - Host latency: 0.752197 ms (enqueue 0.0231934 ms)
[09/07/2022-04:05:04] [I] Average on 10 runs - GPU latency: 0.757007 ms - Host latency: 0.757007 ms (enqueue 0.0222168 ms)
[09/07/2022-04:05:04] [I] Average on 10 runs - GPU latency: 0.753662 ms - Host latency: 0.753662 ms (enqueue 0.0211426 ms)
[09/07/2022-04:05:04] [I] Average on 10 runs - GPU latency: 0.752002 ms - Host latency: 0.752002 ms (enqueue 0.0211914 ms)
[09/07/2022-04:05:04] [I] Average on 10 runs - GPU latency: 0.734888 ms - Host latency: 0.734888 ms (enqueue 0.0165527 ms)
[09/07/2022-04:05:04] [I] Average on 10 runs - GPU latency: 0.702319 ms - Host latency: 0.702319 ms (enqueue 0.0239014 ms)
[09/07/2022-04:05:04] [I] Average on 10 runs - GPU latency: 0.70166 ms - Host latency: 0.70166 ms (enqueue 0.0186768 ms)
[09/07/2022-04:05:04] [I] Average on 10 runs - GPU latency: 0.703174 ms - Host latency: 0.703174 ms (enqueue 0.0189209 ms)
[09/07/2022-04:05:04] [I] Average on 10 runs - GPU latency: 0.723584 ms - Host latency: 0.723584 ms (enqueue 0.0209229 ms)
[09/07/2022-04:05:04] [I] Average on 10 runs - GPU latency: 0.738257 ms - Host latency: 0.738257 ms (enqueue 0.0234619 ms)
[09/07/2022-04:05:04] [I] Average on 10 runs - GPU latency: 0.703418 ms - Host latency: 0.703418 ms (enqueue 0.0182617 ms)
[09/07/2022-04:05:04] [I] Average on 10 runs - GPU latency: 0.702417 ms - Host latency: 0.702417 ms (enqueue 0.0101807 ms)
[09/07/2022-04:05:04] [I] Average on 10 runs - GPU latency: 0.702197 ms - Host latency: 0.702197 ms (enqueue 0.0104248 ms)
[09/07/2022-04:05:04] [I] Average on 10 runs - GPU latency: 0.749146 ms - Host latency: 0.749146 ms (enqueue 0.014624 ms)
[09/07/2022-04:05:04] [I] Average on 10 runs - GPU latency: 0.768921 ms - Host latency: 0.768921 ms (enqueue 0.0217285 ms)
[09/07/2022-04:05:04] [I] Average on 10 runs - GPU latency: 0.770386 ms - Host latency: 0.770386 ms (enqueue 0.0224609 ms)
