cookbook/10-BestPractice/EliminateSqueezeUnsqueezeTranspose/result.log
[09/07/2022-04:07:27] [TRT] [V] *************** Autotuning Reformat: Float(256,256,16,1) -> Float(256,1,16,1) ***************
[09/07/2022-04:07:27] [TRT] [V] --------------- Timing Runner: Optimizer Reformat(tensor-0 -> <out>) (Reformat)
[09/07/2022-04:07:27] [TRT] [V] Tactic: 0x00000000000003e8 Time: 0.00273015
[09/07/2022-04:07:27] [TRT] [V] Tactic: 0x00000000000003ea Time: 0.00517908
[09/07/2022-04:07:27] [TRT] [V] Tactic: 0x0000000000000000 Time: 0.00267418
[09/07/2022-04:07:27] [TRT] [V] Fastest Tactic: 0x0000000000000000 Time: 0.00267418
[09/07/2022-04:07:27] [TRT] [V] =============== Computing reformatting costs
[09/07/2022-04:07:27] [TRT] [V] *************** Autotuning Reformat: Float(8192,256,16,1) -> Float(8192,1,512,32) ***************
[09/07/2022-04:07:27] [TRT] [V] --------------- Timing Runner: Optimizer Reformat(tensor-1 -> <out>) (Reformat)
[09/07/2022-04:07:27] [TRT] [V] Tactic: 0x00000000000003e8 Time: 0.00635049
[09/07/2022-04:07:27] [TRT] [V] Tactic: 0x00000000000003ea Time: 0.0183596
[09/07/2022-04:07:27] [TRT] [V] Tactic: 0x0000000000000000 Time: 0.0063684
[09/07/2022-04:07:27] [TRT] [V] Fastest Tactic: 0x00000000000003e8 Time: 0.00635049
[09/07/2022-04:07:27] [TRT] [V] *************** Autotuning Reformat: Float(8192,1,512,32) -> Float(8192,256,16,1) ***************
[09/07/2022-04:07:27] [TRT] [V] --------------- Timing Runner: Optimizer Reformat(tensor-1 -> <out>) (Reformat)
[09/07/2022-04:07:27] [TRT] [V] Tactic: 0x00000000000003e8 Time: 0.00623329
[09/07/2022-04:07:27] [TRT] [V] Tactic: 0x00000000000003ea Time: 0.0179295
[09/07/2022-04:07:27] [TRT] [V] Tactic: 0x0000000000000000 Time: 0.00619872
[09/07/2022-04:07:27] [TRT] [V] Fastest Tactic: 0x0000000000000000 Time: 0.00619872
[09/07/2022-04:07:27] [TRT] [V] =============== Computing reformatting costs
[09/07/2022-04:07:27] [TRT] [V] *************** Autotuning Reformat: Float(8192,256,16,1) -> Float(8192,1,512,32) ***************
[09/07/2022-04:07:27] [TRT] [V] *************** Autotuning Reformat: Float(8192,256,16,1) -> Float(256,256:32,16,1) ***************
[09/07/2022-04:07:27] [TRT] [V] --------------- Timing Runner: Optimizer Reformat(tensor-0-1 -> <out>) (Reformat)
[09/07/2022-04:07:27] [TRT] [V] Tactic: 0x00000000000003e8 Time: 0.00925203
[09/07/2022-04:07:27] [TRT] [V] Tactic: 0x00000000000003ea Time: 0.0183186
[09/07/2022-04:07:27] [TRT] [V] Tactic: 0x0000000000000000 Time: 0.00926607
[09/07/2022-04:07:27] [TRT] [V] Fastest Tactic: 0x00000000000003e8 Time: 0.00925203
[09/07/2022-04:07:27] [TRT] [V] *************** Autotuning Reformat: Float(8192,1,512,32) -> Float(8192,256,16,1) ***************
[09/07/2022-04:07:27] [TRT] [V] *************** Autotuning Reformat: Float(8192,1,512,32) -> Float(256,256:32,16,1) ***************
[09/07/2022-04:07:27] [TRT] [V] --------------- Timing Runner: Optimizer Reformat(tensor-0-1 -> <out>) (Reformat)
[09/07/2022-04:07:27] [TRT] [V] Tactic: 0x00000000000003e8 Time: 0.0109464
[09/07/2022-04:07:27] [TRT] [V] Tactic: 0x00000000000003ea Time: 0.0164267
[09/07/2022-04:07:27] [TRT] [V] Tactic: 0x0000000000000000 Time: 0.0109037
[09/07/2022-04:07:27] [TRT] [V] Fastest Tactic: 0x0000000000000000 Time: 0.0109037
[09/07/2022-04:07:27] [TRT] [V] *************** Autotuning Reformat: Float(256,256:32,16,1) -> Float(8192,256,16,1) ***************
[09/07/2022-04:07:27] [TRT] [V] --------------- Timing Runner: Optimizer Reformat(tensor-0-1 -> <out>) (Reformat)
[09/07/2022-04:07:27] [TRT] [V] Tactic: 0x00000000000003e8 Time: 0.00667947
[09/07/2022-04:07:27] [TRT] [V] Tactic: 0x00000000000003ea Time: 0.0179335
[09/07/2022-04:07:27] [TRT] [V] Tactic: 0x0000000000000000 Time: 0.00668352
[09/07/2022-04:07:27] [TRT] [V] Fastest Tactic: 0x00000000000003e8 Time: 0.00667947
[09/07/2022-04:07:27] [TRT] [V] *************** Autotuning Reformat: Float(256,256:32,16,1) -> Float(8192,1,512,32) ***************
[09/07/2022-04:07:27] [TRT] [V] --------------- Timing Runner: Optimizer Reformat(tensor-0-1 -> <out>) (Reformat)
[09/07/2022-04:07:27] [TRT] [V] Tactic: 0x00000000000003e8 Time: 0.00687891
[09/07/2022-04:07:27] [TRT] [V] Tactic: 0x00000000000003ea Time: 0.0163835
[09/07/2022-04:07:27] [TRT] [V] Tactic: 0x0000000000000000 Time: 0.00687673
[09/07/2022-04:07:27] [TRT] [V] Fastest Tactic: 0x0000000000000000 Time: 0.00687673
[09/07/2022-04:07:27] [TRT] [V] =============== Computing reformatting costs
[09/07/2022-04:07:27] [TRT] [V] *************** Autotuning Reformat: Float(8192,8192,256,16,1) -> Float(8192,8192,1,512,32) ***************
[09/07/2022-04:07:27] [TRT] [V] --------------- Timing Runner: Optimizer Reformat(tensor-0-2 -> <out>) (Reformat)
[09/07/2022-04:07:27] [TRT] [V] Tactic: 0x00000000000003e8 Time: 0.00638149
[09/07/2022-04:07:27] [TRT] [V] Tactic: 0x00000000000003ea Time: 0.0183422
[09/07/2022-04:07:27] [TRT] [V] Tactic: 0x0000000000000000 Time: 0.00633379
[09/07/2022-04:07:27] [TRT] [V] Fastest Tactic: 0x0000000000000000 Time: 0.00633379
[09/07/2022-04:07:27] [TRT] [V] *************** Autotuning Reformat: Float(8192,8192,1,512,32) -> Float(8192,8192,256,16,1) ***************
[09/07/2022-04:07:27] [TRT] [V] --------------- Timing Runner: Optimizer Reformat(tensor-0-2 -> <out>) (Reformat)
[09/07/2022-04:07:27] [TRT] [V] Tactic: 0x00000000000003e8 Time: 0.00621986
[09/07/2022-04:07:27] [TRT] [V] Tactic: 0x00000000000003ea Time: 0.017961
[09/07/2022-04:07:27] [TRT] [V] Tactic: 0x0000000000000000 Time: 0.00622914
[09/07/2022-04:07:27] [TRT] [V] Fastest Tactic: 0x00000000000003e8 Time: 0.00621986
[09/07/2022-04:07:27] [TRT] [V] *************** Autotuning Reformat: Float(256,256,256:32,16,1) -> Float(8192,8192,256,16,1) ***************
[09/07/2022-04:07:27] [TRT] [V] --------------- Timing Runner: Optimizer Reformat(tensor-0-2 -> <out>) (Reformat)
[09/07/2022-04:07:27] [TRT] [V] Tactic: 0x00000000000003e8 Time: 0.006656
[09/07/2022-04:07:27] [TRT] [V] Tactic: 0x00000000000003ea Time: 0.0179469
[09/07/2022-04:07:27] [TRT] [V] Tactic: 0x0000000000000000 Time: 0.00666688
[09/07/2022-04:07:27] [TRT] [V] Fastest Tactic: 0x00000000000003e8 Time: 0.006656
[09/07/2022-04:07:27] [TRT] [V] *************** Autotuning Reformat: Float(256,256,256:32,16,1) -> Float(8192,8192,1,512,32) ***************
[09/07/2022-04:07:27] [TRT] [V] --------------- Timing Runner: Optimizer Reformat(tensor-0-2 -> <out>) (Reformat)
[09/07/2022-04:07:27] [TRT] [V] Tactic: 0x00000000000003e8 Time: 0.00685235
[09/07/2022-04:07:27] [TRT] [V] Tactic: 0x00000000000003ea Time: 0.0164861
[09/07/2022-04:07:27] [TRT] [V] Tactic: 0x0000000000000000 Time: 0.00686476
[09/07/2022-04:07:27] [TRT] [V] Fastest Tactic: 0x00000000000003e8 Time: 0.00685235
[09/07/2022-04:07:27] [TRT] [V] =============== Computing reformatting costs
[09/07/2022-04:07:27] [TRT] [V] *************** Autotuning Reformat: Float(8192,8192,256,16,1) -> Float(8192,8192,1,512,32) ***************
[09/07/2022-04:07:27] [TRT] [V] *************** Autotuning Reformat: Float(8192,8192,256,16,1) -> Float(256,256,256:32,16,1) ***************
[09/07/2022-04:07:27] [TRT] [V] --------------- Timing Runner: Optimizer Reformat(tensor-0-3 -> <out>) (Reformat)
[09/07/2022-04:07:27] [TRT] [V] Tactic: 0x00000000000003e8 Time: 0.00929007
[09/07/2022-04:07:27] [TRT] [V] Tactic: 0x00000000000003ea Time: 0.0182709
[09/07/2022-04:07:27] [TRT] [V] Tactic: 0x0000000000000000 Time: 0.00928711
[09/07/2022-04:07:27] [TRT] [V] Fastest Tactic: 0x0000000000000000 Time: 0.00928711
[09/07/2022-04:07:27] [TRT] [V] *************** Autotuning Reformat: Float(8192,8192,1,512,32) -> Float(8192,8192,256,16,1) ***************
[09/07/2022-04:07:27] [TRT] [V] *************** Autotuning Reformat: Float(8192,8192,1,512,32) -> Float(256,256,256:32,16,1) ***************
[09/07/2022-04:07:27] [TRT] [V] --------------- Timing Runner: Optimizer Reformat(tensor-0-3 -> <out>) (Reformat)
[09/07/2022-04:07:27] [TRT] [V] Tactic: 0x00000000000003e8 Time: 0.0109337
[09/07/2022-04:07:27] [TRT] [V] Tactic: 0x00000000000003ea Time: 0.0164048
[09/07/2022-04:07:27] [TRT] [V] Tactic: 0x0000000000000000 Time: 0.0109189
[09/07/2022-04:07:27] [TRT] [V] Fastest Tactic: 0x0000000000000000 Time: 0.0109189
[09/07/2022-04:07:27] [TRT] [V] *************** Autotuning Reformat: Float(256,256,256:32,16,1) -> Float(8192,8192,256,16,1) ***************
[09/07/2022-04:07:27] [TRT] [V] *************** Autotuning Reformat: Float(256,256,256:32,16,1) -> Float(8192,8192,1,512,32) ***************
[09/07/2022-04:07:27] [TRT] [V] =============== Computing reformatting costs
[09/07/2022-04:07:27] [TRT] [V] *************** Autotuning Reformat: Float(8192,256,16,1) -> Float(8192,1,512,32) ***************
[09/07/2022-04:07:27] [TRT] [V] *************** Autotuning Reformat: Float(8192,256,16,1) -> Float(256,256:32,16,1) ***************
[09/07/2022-04:07:27] [TRT] [V] *************** Autotuning Reformat: Float(8192,1,512,32) -> Float(8192,256,16,1) ***************
[09/07/2022-04:07:27] [TRT] [V] *************** Autotuning Reformat: Float(8192,1,512,32) -> Float(256,256:32,16,1) ***************
[09/07/2022-04:07:27] [TRT] [V] *************** Autotuning Reformat: Float(256,256:32,16,1) -> Float(8192,256,16,1) ***************
[09/07/2022-04:07:27] [TRT] [V] *************** Autotuning Reformat: Float(256,256:32,16,1) -> Float(8192,1,512,32) ***************
[09/07/2022-04:07:27] [TRT] [V] =============== Computing reformatting costs
[09/07/2022-04:07:27] [TRT] [V] *************** Autotuning Reformat: Float(8192,256,16,1) -> Float(8192,1,512,32) ***************
[09/07/2022-04:07:27] [TRT] [V] *************** Autotuning Reformat: Float(8192,1,512,32) -> Float(8192,256,16,1) ***************
[09/07/2022-04:07:27] [TRT] [V] *************** Autotuning Reformat: Float(256,256:32,16,1) -> Float(8192,256,16,1) ***************
[09/07/2022-04:07:27] [TRT] [V] *************** Autotuning Reformat: Float(256,256:32,16,1) -> Float(8192,1,512,32) ***************
[09/07/2022-04:07:27] [TRT] [V] =============== Computing reformatting costs
[09/07/2022-04:07:27] [TRT] [V] *************** Autotuning Reformat: Float(8192,256,16,1) -> Float(8192,1,512,32) ***************
[09/07/2022-04:07:27] [TRT] [V] *************** Autotuning Reformat: Float(8192,256,16,1) -> Float(256,256:32,16,1) ***************
[09/07/2022-04:07:27] [TRT] [V] *************** Autotuning Reformat: Float(8192,1,512,32) -> Float(8192,256,16,1) ***************
[09/07/2022-04:07:27] [TRT] [V] *************** Autotuning Reformat: Float(8192,1,512,32) -> Float(256,256:32,16,1) ***************
[09/07/2022-04:07:27] [TRT] [V] *************** Autotuning Reformat: Float(256,256:32,16,1) -> Float(8192,256,16,1) ***************
[09/07/2022-04:07:27] [TRT] [V] *************** Autotuning Reformat: Float(256,256:32,16,1) -> Float(8192,1,512,32) ***************
[09/07/2022-04:07:27] [TRT] [V] =============== Computing reformatting costs
[09/07/2022-04:07:27] [TRT] [V] *************** Autotuning Reformat: Float(8192,8192,256,16,1) -> Float(8192,8192,1,512,32) ***************
[09/07/2022-04:07:27] [TRT] [V] *************** Autotuning Reformat: Float(8192,8192,1,512,32) -> Float(8192,8192,256,16,1) ***************
[09/07/2022-04:07:27] [TRT] [V] *************** Autotuning Reformat: Float(256,256,256:32,16,1) -> Float(8192,8192,256,16,1) ***************
[09/07/2022-04:07:27] [TRT] [V] *************** Autotuning Reformat: Float(256,256,256:32,16,1) -> Float(8192,8192,1,512,32) ***************
[09/07/2022-04:07:27] [TRT] [V] =============== Computing reformatting costs
[09/07/2022-04:07:27] [TRT] [V] *************** Autotuning Reformat: Float(8192,8192,256,16,1) -> Float(8192,8192,1,512,32) ***************
[09/07/2022-04:07:27] [TRT] [V] *************** Autotuning Reformat: Float(8192,8192,256,16,1) -> Float(256,256,256:32,16,1) ***************
[09/07/2022-04:07:27] [TRT] [V] *************** Autotuning Reformat: Float(8192,8192,1,512,32) -> Float(8192,8192,256,16,1) ***************
[09/07/2022-04:07:27] [TRT] [V] *************** Autotuning Reformat: Float(8192,8192,1,512,32) -> Float(256,256,256:32,16,1) ***************
[09/07/2022-04:07:27] [TRT] [V] *************** Autotuning Reformat: Float(256,256,256:32,16,1) -> Float(8192,8192,256,16,1) ***************
[09/07/2022-04:07:27] [TRT] [V] *************** Autotuning Reformat: Float(256,256,256:32,16,1) -> Float(8192,8192,1,512,32) ***************
[09/07/2022-04:07:27] [TRT] [V] =============== Computing reformatting costs
[09/07/2022-04:07:27] [TRT] [V] *************** Autotuning Reformat: Float(8192,256,16,1) -> Float(8192,1,512,32) ***************
[09/07/2022-04:07:27] [TRT] [V] *************** Autotuning Reformat: Float(8192,256,16,1) -> Float(256,256:32,16,1) ***************
[09/07/2022-04:07:27] [TRT] [V] *************** Autotuning Reformat: Float(8192,1,512,32) -> Float(8192,256,16,1) ***************
[09/07/2022-04:07:27] [TRT] [V] *************** Autotuning Reformat: Float(8192,1,512,32) -> Float(256,256:32,16,1) ***************
[09/07/2022-04:07:27] [TRT] [V] *************** Autotuning Reformat: Float(256,256:32,16,1) -> Float(8192,256,16,1) ***************
[09/07/2022-04:07:27] [TRT] [V] *************** Autotuning Reformat: Float(256,256:32,16,1) -> Float(8192,1,512,32) ***************
[09/07/2022-04:07:27] [TRT] [V] =============== Computing reformatting costs
[09/07/2022-04:07:27] [TRT] [V] *************** Autotuning Reformat: Float(8192,256,16,1) -> Float(8192,1,512,32) ***************
[09/07/2022-04:07:27] [TRT] [V] *************** Autotuning Reformat: Float(8192,1,512,32) -> Float(8192,256,16,1) ***************
[09/07/2022-04:07:27] [TRT] [V] *************** Autotuning Reformat: Float(256,256:32,16,1) -> Float(8192,256,16,1) ***************
[09/07/2022-04:07:27] [TRT] [V] *************** Autotuning Reformat: Float(256,256:32,16,1) -> Float(8192,1,512,32) ***************
[09/07/2022-04:07:27] [TRT] [V] =============== Computing reformatting costs
[09/07/2022-04:07:27] [TRT] [V] *************** Autotuning Reformat: Float(8192,256,16,1) -> Float(8192,1,512,32) ***************
[09/07/2022-04:07:27] [TRT] [V] *************** Autotuning Reformat: Float(8192,256,16,1) -> Float(256,256:32,16,1) ***************
[09/07/2022-04:07:27] [TRT] [V] *************** Autotuning Reformat: Float(8192,1,512,32) -> Float(8192,256,16,1) ***************
[09/07/2022-04:07:27] [TRT] [V] *************** Autotuning Reformat: Float(8192,1,512,32) -> Float(256,256:32,16,1) ***************
[09/07/2022-04:07:27] [TRT] [V] *************** Autotuning Reformat: Float(256,256:32,16,1) -> Float(8192,256,16,1) ***************
[09/07/2022-04:07:27] [TRT] [V] *************** Autotuning Reformat: Float(256,256:32,16,1) -> Float(8192,1,512,32) ***************
[09/07/2022-04:07:27] [TRT] [V] =============== Computing reformatting costs
[09/07/2022-04:07:27] [TRT] [V] *************** Autotuning Reformat: Float(8192,8192,256,16,1) -> Float(8192,8192,1,512,32) ***************
[09/07/2022-04:07:27] [TRT] [V] *************** Autotuning Reformat: Float(8192,8192,1,512,32) -> Float(8192,8192,256,16,1) ***************
[09/07/2022-04:07:27] [TRT] [V] *************** Autotuning Reformat: Float(256,256,256:32,16,1) -> Float(8192,8192,256,16,1) ***************
[09/07/2022-04:07:27] [TRT] [V] *************** Autotuning Reformat: Float(256,256,256:32,16,1) -> Float(8192,8192,1,512,32) ***************
[09/07/2022-04:07:27] [TRT] [V] =============== Computing reformatting costs
[09/07/2022-04:07:27] [TRT] [V] *************** Autotuning Reformat: Float(8192,8192,256,16,1) -> Float(8192,8192,1,512,32) ***************
[09/07/2022-04:07:27] [TRT] [V] *************** Autotuning Reformat: Float(8192,8192,256,16,1) -> Float(256,256,256:32,16,1) ***************
[09/07/2022-04:07:27] [TRT] [V] *************** Autotuning Reformat: Float(8192,8192,1,512,32) -> Float(8192,8192,256,16,1) ***************
[09/07/2022-04:07:27] [TRT] [V] *************** Autotuning Reformat: Float(8192,8192,1,512,32) -> Float(256,256,256:32,16,1) ***************
[09/07/2022-04:07:27] [TRT] [V] *************** Autotuning Reformat: Float(256,256,256:32,16,1) -> Float(8192,8192,256,16,1) ***************
[09/07/2022-04:07:27] [TRT] [V] *************** Autotuning Reformat: Float(256,256,256:32,16,1) -> Float(8192,8192,1,512,32) ***************
[09/07/2022-04:07:27] [TRT] [V] =============== Computing reformatting costs
[09/07/2022-04:07:27] [TRT] [V] *************** Autotuning Reformat: Float(8192,256,16,1) -> Float(8192,1,512,32) ***************
[09/07/2022-04:07:27] [TRT] [V] *************** Autotuning Reformat: Float(8192,256,16,1) -> Float(256,256:32,16,1) ***************
[09/07/2022-04:07:27] [TRT] [V] *************** Autotuning Reformat: Float(8192,1,512,32) -> Float(8192,256,16,1) ***************
[09/07/2022-04:07:27] [TRT] [V] *************** Autotuning Reformat: Float(8192,1,512,32) -> Float(256,256:32,16,1) ***************
[09/07/2022-04:07:27] [TRT] [V] *************** Autotuning Reformat: Float(256,256:32,16,1) -> Float(8192,256,16,1) ***************
[09/07/2022-04:07:27] [TRT] [V] *************** Autotuning Reformat: Float(256,256:32,16,1) -> Float(8192,1,512,32) ***************
[09/07/2022-04:07:27] [TRT] [V] =============== Computing reformatting costs
[09/07/2022-04:07:27] [TRT] [V] *************** Autotuning Reformat: Float(8192,256,16,1) -> Float(8192,1,512,32) ***************
[09/07/2022-04:07:27] [TRT] [V] *************** Autotuning Reformat: Float(8192,1,512,32) -> Float(8192,256,16,1) ***************
[09/07/2022-04:07:27] [TRT] [V] *************** Autotuning Reformat: Float(256,256:32,16,1) -> Float(8192,256,16,1) ***************
[09/07/2022-04:07:27] [TRT] [V] *************** Autotuning Reformat: Float(256,256:32,16,1) -> Float(8192,1,512,32) ***************
[09/07/2022-04:07:27] [TRT] [V] =============== Computing reformatting costs
[09/07/2022-04:07:27] [TRT] [V] *************** Autotuning Reformat: Float(8192,256,16,1) -> Float(8192,1,512,32) ***************
[09/07/2022-04:07:27] [TRT] [V] *************** Autotuning Reformat: Float(8192,256,16,1) -> Float(256,256:32,16,1) ***************
[09/07/2022-04:07:27] [TRT] [V] *************** Autotuning Reformat: Float(8192,1,512,32) -> Float(8192,256,16,1) ***************
[09/07/2022-04:07:27] [TRT] [V] *************** Autotuning Reformat: Float(8192,1,512,32) -> Float(256,256:32,16,1) ***************
[09/07/2022-04:07:27] [TRT] [V] *************** Autotuning Reformat: Float(256,256:32,16,1) -> Float(8192,256,16,1) ***************
[09/07/2022-04:07:27] [TRT] [V] *************** Autotuning Reformat: Float(256,256:32,16,1) -> Float(8192,1,512,32) ***************
[09/07/2022-04:07:27] [TRT] [V] =============== Computing reformatting costs
[09/07/2022-04:07:27] [TRT] [V] *************** Autotuning Reformat: Float(8192,8192,256,16,1) -> Float(8192,8192,1,512,32) ***************
[09/07/2022-04:07:27] [TRT] [V] *************** Autotuning Reformat: Float(8192,8192,1,512,32) -> Float(8192,8192,256,16,1) ***************
[09/07/2022-04:07:27] [TRT] [V] *************** Autotuning Reformat: Float(256,256,256:32,16,1) -> Float(8192,8192,256,16,1) ***************
[09/07/2022-04:07:27] [TRT] [V] *************** Autotuning Reformat: Float(256,256,256:32,16,1) -> Float(8192,8192,1,512,32) ***************
[09/07/2022-04:07:27] [TRT] [V] =============== Computing reformatting costs
[09/07/2022-04:07:27] [TRT] [V] *************** Autotuning Reformat: Float(8192,8192,256,16,1) -> Float(8192,8192,1,512,32) ***************
[09/07/2022-04:07:27] [TRT] [V] *************** Autotuning Reformat: Float(8192,8192,256,16,1) -> Float(256,256,256:32,16,1) ***************
[09/07/2022-04:07:27] [TRT] [V] *************** Autotuning Reformat: Float(8192,8192,1,512,32) -> Float(8192,8192,256,16,1) ***************
[09/07/2022-04:07:27] [TRT] [V] *************** Autotuning Reformat: Float(8192,8192,1,512,32) -> Float(256,256,256:32,16,1) ***************
[09/07/2022-04:07:27] [TRT] [V] *************** Autotuning Reformat: Float(256,256,256:32,16,1) -> Float(8192,8192,256,16,1) ***************
[09/07/2022-04:07:27] [TRT] [V] *************** Autotuning Reformat: Float(256,256,256:32,16,1) -> Float(8192,8192,1,512,32) ***************
[09/07/2022-04:07:27] [TRT] [V] =============== Computing reformatting costs
[09/07/2022-04:07:27] [TRT] [V] *************** Autotuning Reformat: Float(8192,256,16,1) -> Float(8192,1,512,32) ***************
[09/07/2022-04:07:27] [TRT] [V] *************** Autotuning Reformat: Float(8192,256,16,1) -> Float(256,256:32,16,1) ***************
[09/07/2022-04:07:27] [TRT] [V] *************** Autotuning Reformat: Float(8192,1,512,32) -> Float(8192,256,16,1) ***************
[09/07/2022-04:07:27] [TRT] [V] *************** Autotuning Reformat: Float(8192,1,512,32) -> Float(256,256:32,16,1) ***************
[09/07/2022-04:07:27] [TRT] [V] *************** Autotuning Reformat: Float(256,256:32,16,1) -> Float(8192,256,16,1) ***************
[09/07/2022-04:07:27] [TRT] [V] *************** Autotuning Reformat: Float(256,256:32,16,1) -> Float(8192,1,512,32) ***************
[09/07/2022-04:07:27] [TRT] [V] =============== Computing reformatting costs
[09/07/2022-04:07:27] [TRT] [V] *************** Autotuning Reformat: Float(8192,256,16,1) -> Float(8192,1,512,32) ***************
[09/07/2022-04:07:27] [TRT] [V] *************** Autotuning Reformat: Float(8192,1,512,32) -> Float(8192,256,16,1) ***************
[09/07/2022-04:07:27] [TRT] [V] *************** Autotuning Reformat: Float(256,256:32,16,1) -> Float(8192,256,16,1) ***************
[09/07/2022-04:07:27] [TRT] [V] *************** Autotuning Reformat: Float(256,256:32,16,1) -> Float(8192,1,512,32) ***************
[09/07/2022-04:07:27] [TRT] [V] =============== Computing reformatting costs
[09/07/2022-04:07:27] [TRT] [V] *************** Autotuning Reformat: Float(8192,256,16,1) -> Float(8192,1,512,32) ***************
[09/07/2022-04:07:27] [TRT] [V] *************** Autotuning Reformat: Float(8192,256,16,1) -> Float(256,256:32,16,1) ***************
[09/07/2022-04:07:27] [TRT] [V] *************** Autotuning Reformat: Float(8192,1,512,32) -> Float(8192,256,16,1) ***************
[09/07/2022-04:07:27] [TRT] [V] *************** Autotuning Reformat: Float(8192,1,512,32) -> Float(256,256:32,16,1) ***************
[09/07/2022-04:07:27] [TRT] [V] *************** Autotuning Reformat: Float(256,256:32,16,1) -> Float(8192,256,16,1) ***************
[09/07/2022-04:07:27] [TRT] [V] *************** Autotuning Reformat: Float(256,256:32,16,1) -> Float(8192,1,512,32) ***************
[09/07/2022-04:07:27] [TRT] [V] =============== Computing reformatting costs
[09/07/2022-04:07:27] [TRT] [V] *************** Autotuning Reformat: Float(8192,8192,256,16,1) -> Float(8192,8192,1,512,32) ***************
[09/07/2022-04:07:27] [TRT] [V] *************** Autotuning Reformat: Float(8192,8192,1,512,32) -> Float(8192,8192,256,16,1) ***************
[09/07/2022-04:07:27] [TRT] [V] *************** Autotuning Reformat: Float(256,256,256:32,16,1) -> Float(8192,8192,256,16,1) ***************
[09/07/2022-04:07:27] [TRT] [V] *************** Autotuning Reformat: Float(256,256,256:32,16,1) -> Float(8192,8192,1,512,32) ***************
[09/07/2022-04:07:27] [TRT] [V] =============== Computing reformatting costs
[09/07/2022-04:07:27] [TRT] [V] *************** Autotuning Reformat: Float(8192,8192,256,16,1) -> Float(8192,8192,1,512,32) ***************
[09/07/2022-04:07:27] [TRT] [V] *************** Autotuning Reformat: Float(8192,8192,256,16,1) -> Float(256,256,256:32,16,1) ***************
[09/07/2022-04:07:27] [TRT] [V] *************** Autotuning Reformat: Float(8192,8192,1,512,32) -> Float(8192,8192,256,16,1) ***************
[09/07/2022-04:07:27] [TRT] [V] *************** Autotuning Reformat: Float(8192,8192,1,512,32) -> Float(256,256,256:32,16,1) ***************
[09/07/2022-04:07:27] [TRT] [V] *************** Autotuning Reformat: Float(256,256,256:32,16,1) -> Float(8192,8192,256,16,1) ***************
[09/07/2022-04:07:27] [TRT] [V] *************** Autotuning Reformat: Float(256,256,256:32,16,1) -> Float(8192,8192,1,512,32) ***************
[09/07/2022-04:07:27] [TRT] [V] =============== Computing reformatting costs
[09/07/2022-04:07:27] [TRT] [V] *************** Autotuning Reformat: Float(8192,256,16,1) -> Float(8192,1,512,32) ***************
[09/07/2022-04:07:27] [TRT] [V] *************** Autotuning Reformat: Float(8192,256,16,1) -> Float(256,256:32,16,1) ***************
[09/07/2022-04:07:27] [TRT] [V] *************** Autotuning Reformat: Float(8192,1,512,32) -> Float(8192,256,16,1) ***************
[09/07/2022-04:07:27] [TRT] [V] *************** Autotuning Reformat: Float(8192,1,512,32) -> Float(256,256:32,16,1) ***************
[09/07/2022-04:07:27] [TRT] [V] *************** Autotuning Reformat: Float(256,256:32,16,1) -> Float(8192,256,16,1) ***************
[09/07/2022-04:07:27] [TRT] [V] *************** Autotuning Reformat: Float(256,256:32,16,1) -> Float(8192,1,512,32) ***************
[09/07/2022-04:07:27] [TRT] [V] =============== Computing reformatting costs
[09/07/2022-04:07:27] [TRT] [V] *************** Autotuning Reformat: Float(8192,256,16,1) -> Float(8192,1,512,32) ***************
[09/07/2022-04:07:27] [TRT] [V] *************** Autotuning Reformat: Float(8192,1,512,32) -> Float(8192,256,16,1) ***************
[09/07/2022-04:07:27] [TRT] [V] *************** Autotuning Reformat: Float(256,256:32,16,1) -> Float(8192,256,16,1) ***************
[09/07/2022-04:07:27] [TRT] [V] *************** Autotuning Reformat: Float(256,256:32,16,1) -> Float(8192,1,512,32) ***************
[09/07/2022-04:07:27] [TRT] [V] =============== Computing reformatting costs
[09/07/2022-04:07:27] [TRT] [V] *************** Autotuning Reformat: Float(8192,256,16,1) -> Float(8192,1,512,32) ***************
[09/07/2022-04:07:27] [TRT] [V] *************** Autotuning Reformat: Float(8192,1,512,32) -> Float(8192,256,16,1) ***************
[09/07/2022-04:07:27] [TRT] [V] =============== Computing reformatting costs
[09/07/2022-04:07:27] [TRT] [V] *************** Autotuning Reformat: Float(8192,256,16,1) -> Float(8192,1,512,32) ***************
[09/07/2022-04:07:27] [TRT] [V] *************** Autotuning Reformat: Float(8192,1,512,32) -> Float(8192,256,16,1) ***************
[09/07/2022-04:07:27] [TRT] [V] =============== Computing reformatting costs
[09/07/2022-04:07:27] [TRT] [V] *************** Autotuning Reformat: Float(8192,256,16,1) -> Float(8192,1,512,32) ***************
[09/07/2022-04:07:27] [TRT] [V] *************** Autotuning Reformat: Float(8192,1,512,32) -> Float(8192,256,16,1) ***************
[09/07/2022-04:07:27] [TRT] [V] =============== Computing reformatting costs
[09/07/2022-04:07:27] [TRT] [V] *************** Autotuning Reformat: Float(8192,256,16,1) -> Float(8192,1,512,32) ***************
[09/07/2022-04:07:27] [TRT] [V] *************** Autotuning Reformat: Float(8192,1,512,32) -> Float(8192,256,16,1) ***************
[09/07/2022-04:07:27] [TRT] [V] =============== Computing reformatting costs
[09/07/2022-04:07:27] [TRT] [V] *************** Autotuning Reformat: Float(8192,256,16,1) -> Float(8192,1,512,32) ***************
[09/07/2022-04:07:27] [TRT] [V] *************** Autotuning Reformat: Float(8192,1,512,32) -> Float(8192,256,16,1) ***************
[09/07/2022-04:07:27] [TRT] [V] =============== Computing reformatting costs
[09/07/2022-04:07:27] [TRT] [V] *************** Autotuning Reformat: Float(196,1,14,1) -> Float(196,196,14,1) ***************
[09/07/2022-04:07:27] [TRT] [V] --------------- Timing Runner: Optimizer Reformat(<in> -> tensor-6) (Reformat)
[09/07/2022-04:07:27] [TRT] [V] Tactic: 0x00000000000003e8 Time: 0.00253164
[09/07/2022-04:07:27] [TRT] [V] Tactic: 0x00000000000003ea Time: 0.016254
[09/07/2022-04:07:27] [TRT] [V] Tactic: 0x0000000000000000 Time: 0.00255772
[09/07/2022-04:07:27] [TRT] [V] Fastest Tactic: 0x00000000000003e8 Time: 0.00253164
[09/07/2022-04:07:27] [TRT] [V] =============== Computing costs for 
[09/07/2022-04:07:27] [TRT] [V] *************** Autotuning format combination: Float(256,256,16,1) -> Float(8192,256,16,1) ***************
[09/07/2022-04:07:27] [TRT] [V] --------------- Timing Runner: Conv0 (CudaDepthwiseConvolution)
[09/07/2022-04:07:27] [TRT] [V] CudaDepthwiseConvolution has no valid tactics for this config, skipping
[09/07/2022-04:07:27] [TRT] [V] --------------- Timing Runner: Conv0 (FusedConvActConvolution)
[09/07/2022-04:07:27] [TRT] [V] FusedConvActConvolution has no valid tactics for this config, skipping
[09/07/2022-04:07:27] [TRT] [V] --------------- Timing Runner: Conv0 (CudnnConvolution)
[09/07/2022-04:07:28] [TRT] [V] Tactic: 0x0000000000000000 Time: 0.00730272
[09/07/2022-04:07:28] [TRT] [V] Tactic: 0x0000000000000001 Time: 0.00688087
[09/07/2022-04:07:28] [TRT] [V] Tactic: 0x0000000000000002 Time: 0.0112185
[09/07/2022-04:07:28] [TRT] [V] Tactic: 0x0000000000000004 Time: 0.0287893
[09/07/2022-04:07:28] [TRT] [V] Tactic: 0x0000000000000005 Time: 0.0279822
[09/07/2022-04:07:28] [TRT] [V] Tactic: 0x0000000000000006 Time: 0.00954453
[09/07/2022-04:07:28] [TRT] [V] Fastest Tactic: 0x0000000000000001 Time: 0.00688087
[09/07/2022-04:07:28] [TRT] [V] --------------- Timing Runner: Conv0 (CaskConvolution)
[09/07/2022-04:07:28] [TRT] [V] Conv0 Set Tactic Name: maxwell_scudnn_128x32_relu_medium_nn_v1 Tactic: 0x0ebe499388e08286
[09/07/2022-04:07:28] [TRT] [V] Tactic: 0x0ebe499388e08286 Time: 0.0110548
[09/07/2022-04:07:28] [TRT] [V] Conv0 Set Tactic Name: maxwell_scudnn_128x32_relu_large_nn_v0 Tactic: 0x185af5379580418f
[09/07/2022-04:07:28] [TRT] [V] Tactic: 0x185af5379580418f Time: 0.00763321
[09/07/2022-04:07:28] [TRT] [V] Conv0 Set Tactic Name: maxwell_scudnn_128x128_relu_large_nn_v0 Tactic: 0x321f7a577fb21da0
[09/07/2022-04:07:28] [TRT] [V] Tactic: 0x321f7a577fb21da0 Time: 0.011322
[09/07/2022-04:07:28] [TRT] [V] Conv0 Set Tactic Name: maxwell_scudnn_winograd_128x128_ldg1_ldg4_relu_tile148n_nt_v1 Tactic: 0x351dd956e9e8e4c4
[09/07/2022-04:07:28] [TRT] [V] Tactic: 0x351dd956e9e8e4c4 Time: 0.00668459
[09/07/2022-04:07:28] [TRT] [V] Conv0 Set Tactic Name: maxwell_scudnn_128x64_relu_large_nn_v1 Tactic: 0x3c301f1cd57bd89b
[09/07/2022-04:07:28] [TRT] [V] Tactic: 0x3c301f1cd57bd89b Time: 0.0103638
[09/07/2022-04:07:28] [TRT] [V] Conv0 Set Tactic Name: maxwell_scudnn_128x128_relu_medium_nn_v1 Tactic: 0x3e787008e11a6129
[09/07/2022-04:07:28] [TRT] [V] Tactic: 0x3e787008e11a6129 Time: 0.0107671
[09/07/2022-04:07:28] [TRT] [V] Conv0 Set Tactic Name: maxwell_scudnn_128x64_relu_small_nn_v1 Tactic: 0x474c9edd1ecfbbba
[09/07/2022-04:07:28] [TRT] [V] Tactic: 0x474c9edd1ecfbbba Time: 0.00973897
[09/07/2022-04:07:28] [TRT] [V] Conv0 Set Tactic Name: maxwell_scudnn_128x128_relu_small_nn_v0 Tactic: 0x4963fb96b4067e81
[09/07/2022-04:07:28] [TRT] [V] Tactic: 0x4963fb96b4067e81 Time: 0.0109633
[09/07/2022-04:07:28] [TRT] [V] Conv0 Set Tactic Name: maxwell_scudnn_winograd_128x128_ldg1_ldg4_relu_tile148m_nt_v1 Tactic: 0x522ccebdb4e349f0
[09/07/2022-04:07:28] [TRT] [V] Tactic: 0x522ccebdb4e349f0 Time: 0.00692549
[09/07/2022-04:07:28] [TRT] [V] Conv0 Set Tactic Name: maxwell_scudnn_128x64_relu_medium_nn_v1 Tactic: 0x5c38385751ccb068
[09/07/2022-04:07:28] [TRT] [V] Tactic: 0x5c38385751ccb068 Time: 0.0100035
[09/07/2022-04:07:28] [TRT] [V] Conv0 Set Tactic Name: maxwell_scudnn_128x32_relu_small_nn_v0 Tactic: 0x632674f65e3422ae
[09/07/2022-04:07:28] [TRT] [V] Tactic: 0x632674f65e3422ae Time: 0.00715665
[09/07/2022-04:07:28] [TRT] [V] Conv0 Set Tactic Name: maxwell_scudnn_winograd_128x128_ldg1_ldg4_relu_tile148t_nt_v1 Tactic: 0x6cfa22e9365b79b6
[09/07/2022-04:07:28] [TRT] [V] Tactic: 0x6cfa22e9365b79b6 Time: 0.00697489
[09/07/2022-04:07:28] [TRT] [V] Conv0 Set Tactic Name: maxwell_scudnn_128x128_relu_large_nn_v1 Tactic: 0x813136e97c1542cf
[09/07/2022-04:07:28] [TRT] [V] Tactic: 0x813136e97c1542cf Time: 0.0109626
[09/07/2022-04:07:28] [TRT] [V] Conv0 Set Tactic Name: maxwell_scudnn_winograd_128x128_ldg1_ldg4_relu_tile148n_nt_v0 Tactic: 0x863395e8ea4fbbab
[09/07/2022-04:07:28] [TRT] [V] Tactic: 0x863395e8ea4fbbab Time: 0.0066445
[09/07/2022-04:07:28] [TRT] [V] Conv0 Set Tactic Name: maxwell_scudnn_128x128_relu_medium_nn_v0 Tactic: 0x8d563cb6e2bd3e46
[09/07/2022-04:07:28] [TRT] [V] Tactic: 0x8d563cb6e2bd3e46 Time: 0.0111452
[09/07/2022-04:07:28] [TRT] [V] Conv0 Set Tactic Name: maxwell_scudnn_128x64_relu_large_nn_v0 Tactic: 0x8f1e53a2d6dc87f4
[09/07/2022-04:07:28] [TRT] [V] Tactic: 0x8f1e53a2d6dc87f4 Time: 0.00972373
[09/07/2022-04:07:28] [TRT] [V] Conv0 Set Tactic Name: maxwell_scudnn_128x32_relu_large_nn_v1 Tactic: 0xab74b98996271ee0
[09/07/2022-04:07:28] [TRT] [V] Tactic: 0xab74b98996271ee0 Time: 0.0115524
[09/07/2022-04:07:28] [TRT] [V] Conv0 Set Tactic Name: maxwell_scudnn_128x32_relu_medium_nn_v0 Tactic: 0xbd90052d8b47dde9
[09/07/2022-04:07:28] [TRT] [V] Tactic: 0xbd90052d8b47dde9 Time: 0.00741902
[09/07/2022-04:07:28] [TRT] [V] Conv0 Set Tactic Name: maxwell_scudnn_128x32_relu_small_nn_v1 Tactic: 0xd00838485d937dc1
[09/07/2022-04:07:28] [TRT] [V] Tactic: 0xd00838485d937dc1 Time: 0.0102371
[09/07/2022-04:07:28] [TRT] [V] Conv0 Set Tactic Name: maxwell_scudnn_winograd_128x128_ldg1_ldg4_relu_tile148t_nt_v0 Tactic: 0xdfd46e5735fc26d9
[09/07/2022-04:07:28] [TRT] [V] Tactic: 0xdfd46e5735fc26d9 Time: 0.00676715
[09/07/2022-04:07:28] [TRT] [V] Conv0 Set Tactic Name: maxwell_scudnn_winograd_128x128_ldg1_ldg4_mobile_relu_tile148t_nt_v0 Tactic: 0xed5bbdc3eeb5aa67
[09/07/2022-04:07:28] [TRT] [V] Tactic: 0xed5bbdc3eeb5aa67 Time: 0.00665746
[09/07/2022-04:07:28] [TRT] [V] Conv0 Set Tactic Name: maxwell_scudnn_128x64_relu_medium_nn_v0 Tactic: 0xef1674e9526bef07
[09/07/2022-04:07:28] [TRT] [V] Tactic: 0xef1674e9526bef07 Time: 0.00952
[09/07/2022-04:07:28] [TRT] [V] Conv0 Set Tactic Name: maxwell_scudnn_128x64_relu_small_nn_v0 Tactic: 0xf462d2631d68e4d5
[09/07/2022-04:07:28] [TRT] [V] Tactic: 0xf462d2631d68e4d5 Time: 0.00928355
[09/07/2022-04:07:28] [TRT] [V] Conv0 Set Tactic Name: maxwell_scudnn_128x128_relu_small_nn_v1 Tactic: 0xfa4db728b7a121ee
[09/07/2022-04:07:28] [TRT] [V] Tactic: 0xfa4db728b7a121ee Time: 0.0105183
[09/07/2022-04:07:28] [TRT] [V] Fastest Tactic: 0x863395e8ea4fbbab Time: 0.0066445
[09/07/2022-04:07:28] [TRT] [V] >>>>>>>>>>>>>>> Chose Runner Type: CaskConvolution Tactic: 0x863395e8ea4fbbab
[09/07/2022-04:07:28] [TRT] [V] *************** Autotuning format combination: Float(256,1,16,1) -> Float(8192,1,512,32) ***************
[09/07/2022-04:07:28] [TRT] [V] --------------- Timing Runner: Conv0 (CaskConvolution)
[09/07/2022-04:07:28] [TRT] [V] CaskConvolution has no valid tactics for this config, skipping
[09/07/2022-04:07:28] [TRT] [V] =============== Computing costs for 
[09/07/2022-04:07:28] [TRT] [V] *************** Autotuning format combination: Float(8192,256,16,1) -> Float(8192,256,16,1) ***************
[09/07/2022-04:07:28] [TRT] [V] --------------- Timing Runner: Conv-0 (CudaDepthwiseConvolution)
[09/07/2022-04:07:28] [TRT] [V] CudaDepthwiseConvolution has no valid tactics for this config, skipping
[09/07/2022-04:07:28] [TRT] [V] --------------- Timing Runner: Conv-0 (FusedConvActConvolution)
[09/07/2022-04:07:28] [TRT] [V] FusedConvActConvolution has no valid tactics for this config, skipping
[09/07/2022-04:07:28] [TRT] [V] --------------- Timing Runner: Conv-0 (CudnnConvolution)
[09/07/2022-04:07:28] [TRT] [V] Tactic: 0x0000000000000000 Time: 0.0309217
[09/07/2022-04:07:28] [TRT] [V] Tactic: 0x0000000000000001 Time: 0.0309198
[09/07/2022-04:07:28] [TRT] [V] Tactic: 0x0000000000000002 Time: 0.214357
[09/07/2022-04:07:28] [TRT] [V] Tactic: 0x0000000000000004 Time: 0.130386
[09/07/2022-04:07:28] [TRT] [V] Tactic: 0x0000000000000005 Time: 0.136334
[09/07/2022-04:07:28] [TRT] [V] Tactic: 0x0000000000000006 Time: 0.0126677
[09/07/2022-04:07:28] [TRT] [V] Fastest Tactic: 0x0000000000000006 Time: 0.0126677
[09/07/2022-04:07:28] [TRT] [V] --------------- Timing Runner: Conv-0 (CaskConvolution)
[09/07/2022-04:07:28] [TRT] [V] Conv-0 Set Tactic Name: maxwell_scudnn_128x32_relu_medium_nn_v1 Tactic: 0x0ebe499388e08286
[09/07/2022-04:07:28] [TRT] [V] Tactic: 0x0ebe499388e08286 Time: 0.045556
[09/07/2022-04:07:28] [TRT] [V] Conv-0 Set Tactic Name: maxwell_scudnn_128x32_relu_large_nn_v0 Tactic: 0x185af5379580418f
[09/07/2022-04:07:28] [TRT] [V] Tactic: 0x185af5379580418f Time: 0.0367445
[09/07/2022-04:07:28] [TRT] [V] Conv-0 Set Tactic Name: maxwell_scudnn_128x128_relu_large_nn_v0 Tactic: 0x321f7a577fb21da0
[09/07/2022-04:07:28] [TRT] [V] Tactic: 0x321f7a577fb21da0 Time: 0.0419813
[09/07/2022-04:07:28] [TRT] [V] Conv-0 Set Tactic Name: maxwell_scudnn_winograd_128x128_ldg1_ldg4_relu_tile148n_nt_v1 Tactic: 0x351dd956e9e8e4c4
[09/07/2022-04:07:28] [TRT] [V] Tactic: 0x351dd956e9e8e4c4 Time: 0.00961676
[09/07/2022-04:07:28] [TRT] [V] Conv-0 Set Tactic Name: maxwell_scudnn_128x64_relu_large_nn_v1 Tactic: 0x3c301f1cd57bd89b
[09/07/2022-04:07:28] [TRT] [V] Tactic: 0x3c301f1cd57bd89b Time: 0.0358901
[09/07/2022-04:07:28] [TRT] [V] Conv-0 Set Tactic Name: maxwell_scudnn_128x128_relu_medium_nn_v1 Tactic: 0x3e787008e11a6129
[09/07/2022-04:07:28] [TRT] [V] Tactic: 0x3e787008e11a6129 Time: 0.042236
[09/07/2022-04:07:28] [TRT] [V] Conv-0 Set Tactic Name: maxwell_scudnn_128x64_relu_small_nn_v1 Tactic: 0x474c9edd1ecfbbba
[09/07/2022-04:07:28] [TRT] [V] Tactic: 0x474c9edd1ecfbbba Time: 0.0291147
[09/07/2022-04:07:28] [TRT] [V] Conv-0 Set Tactic Name: maxwell_scudnn_128x128_relu_small_nn_v0 Tactic: 0x4963fb96b4067e81
[09/07/2022-04:07:28] [TRT] [V] Tactic: 0x4963fb96b4067e81 Time: 0.0398246
[09/07/2022-04:07:28] [TRT] [V] Conv-0 Set Tactic Name: maxwell_scudnn_winograd_128x128_ldg1_ldg4_relu_tile148m_nt_v1 Tactic: 0x522ccebdb4e349f0
[09/07/2022-04:07:28] [TRT] [V] Tactic: 0x522ccebdb4e349f0 Time: 0.0102452
[09/07/2022-04:07:28] [TRT] [V] Conv-0 Set Tactic Name: maxwell_scudnn_128x64_relu_medium_nn_v1 Tactic: 0x5c38385751ccb068
[09/07/2022-04:07:28] [TRT] [V] Tactic: 0x5c38385751ccb068 Time: 0.0343723
[09/07/2022-04:07:28] [TRT] [V] Conv-0 Set Tactic Name: maxwell_scudnn_128x32_relu_small_nn_v0 Tactic: 0x632674f65e3422ae
[09/07/2022-04:07:28] [TRT] [V] Tactic: 0x632674f65e3422ae Time: 0.0312873
[09/07/2022-04:07:28] [TRT] [V] Conv-0 Set Tactic Name: maxwell_scudnn_winograd_128x128_ldg1_ldg4_relu_tile148t_nt_v1 Tactic: 0x6cfa22e9365b79b6
[09/07/2022-04:07:28] [TRT] [V] Tactic: 0x6cfa22e9365b79b6 Time: 0.0103813
[09/07/2022-04:07:28] [TRT] [V] Conv-0 Set Tactic Name: maxwell_scudnn_128x128_relu_large_nn_v1 Tactic: 0x813136e97c1542cf
[09/07/2022-04:07:28] [TRT] [V] Tactic: 0x813136e97c1542cf Time: 0.0433053
[09/07/2022-04:07:28] [TRT] [V] Conv-0 Set Tactic Name: maxwell_scudnn_winograd_128x128_ldg1_ldg4_relu_tile148n_nt_v0 Tactic: 0x863395e8ea4fbbab
[09/07/2022-04:07:28] [TRT] [V] Tactic: 0x863395e8ea4fbbab Time: 0.00936
[09/07/2022-04:07:28] [TRT] [V] Conv-0 Set Tactic Name: maxwell_scudnn_128x128_relu_medium_nn_v0 Tactic: 0x8d563cb6e2bd3e46
[09/07/2022-04:07:28] [TRT] [V] Tactic: 0x8d563cb6e2bd3e46 Time: 0.0405807
[09/07/2022-04:07:28] [TRT] [V] Conv-0 Set Tactic Name: maxwell_scudnn_128x64_relu_large_nn_v0 Tactic: 0x8f1e53a2d6dc87f4
[09/07/2022-04:07:28] [TRT] [V] Tactic: 0x8f1e53a2d6dc87f4 Time: 0.0428373
[09/07/2022-04:07:28] [TRT] [V] Conv-0 Set Tactic Name: maxwell_scudnn_128x32_relu_large_nn_v1 Tactic: 0xab74b98996271ee0
[09/07/2022-04:07:28] [TRT] [V] Tactic: 0xab74b98996271ee0 Time: 0.0476891
[09/07/2022-04:07:28] [TRT] [V] Conv-0 Set Tactic Name: maxwell_scudnn_128x32_relu_medium_nn_v0 Tactic: 0xbd90052d8b47dde9
[09/07/2022-04:07:28] [TRT] [V] Tactic: 0xbd90052d8b47dde9 Time: 0.0349728
[09/07/2022-04:07:28] [TRT] [V] Conv-0 Set Tactic Name: maxwell_scudnn_128x32_relu_small_nn_v1 Tactic: 0xd00838485d937dc1
[09/07/2022-04:07:28] [TRT] [V] Tactic: 0xd00838485d937dc1 Time: 0.0326439
[09/07/2022-04:07:28] [TRT] [V] Conv-0 Set Tactic Name: maxwell_scudnn_winograd_128x128_ldg1_ldg4_relu_tile148t_nt_v0 Tactic: 0xdfd46e5735fc26d9
[09/07/2022-04:07:28] [TRT] [V] Tactic: 0xdfd46e5735fc26d9 Time: 0.00967436
[09/07/2022-04:07:28] [TRT] [V] Conv-0 Set Tactic Name: maxwell_scudnn_winograd_128x128_ldg1_ldg4_mobile_relu_tile148t_nt_v0 Tactic: 0xed5bbdc3eeb5aa67
[09/07/2022-04:07:28] [TRT] [V] Tactic: 0xed5bbdc3eeb5aa67 Time: 0.00962164
[09/07/2022-04:07:28] [TRT] [V] Conv-0 Set Tactic Name: maxwell_scudnn_128x64_relu_medium_nn_v0 Tactic: 0xef1674e9526bef07
[09/07/2022-04:07:28] [TRT] [V] Tactic: 0xef1674e9526bef07 Time: 0.0424533
[09/07/2022-04:07:28] [TRT] [V] Conv-0 Set Tactic Name: maxwell_scudnn_128x64_relu_small_nn_v0 Tactic: 0xf462d2631d68e4d5
[09/07/2022-04:07:28] [TRT] [V] Tactic: 0xf462d2631d68e4d5 Time: 0.0375846
[09/07/2022-04:07:28] [TRT] [V] Conv-0 Set Tactic Name: maxwell_scudnn_128x128_relu_small_nn_v1 Tactic: 0xfa4db728b7a121ee
[09/07/2022-04:07:28] [TRT] [V] Tactic: 0xfa4db728b7a121ee Time: 0.0378122
[09/07/2022-04:07:28] [TRT] [V] Fastest Tactic: 0x863395e8ea4fbbab Time: 0.00936
[09/07/2022-04:07:28] [TRT] [V] >>>>>>>>>>>>>>> Chose Runner Type: CaskConvolution Tactic: 0x863395e8ea4fbbab
[09/07/2022-04:07:28] [TRT] [V] *************** Autotuning format combination: Float(8192,1,512,32) -> Float(8192,1,512,32) ***************
[09/07/2022-04:07:28] [TRT] [V] --------------- Timing Runner: Conv-0 (CaskConvolution)
[09/07/2022-04:07:28] [TRT] [V] Conv-0 Set Tactic Name: maxwell_scudnn_128x32_sliced1x4_ldg4_relu_exp_small_nhwc_tn_v1 Tactic: 0x80f932c0b8ce5940
[09/07/2022-04:07:28] [TRT] [V] Tactic: 0x80f932c0b8ce5940 Time: 0.0149115
[09/07/2022-04:07:28] [TRT] [V] Conv-0 Set Tactic Name: maxwell_scudnn_128x64_sliced1x2_ldg4_relu_exp_small_nhwc_tn_v1 Tactic: 0x9961ac24fc07a1df
[09/07/2022-04:07:28] [TRT] [V] Tactic: 0x9961ac24fc07a1df Time: 0.0224121
[09/07/2022-04:07:28] [TRT] [V] Fastest Tactic: 0x80f932c0b8ce5940 Time: 0.0149115
[09/07/2022-04:07:28] [TRT] [V] >>>>>>>>>>>>>>> Chose Runner Type: CaskConvolution Tactic: 0x80f932c0b8ce5940
[09/07/2022-04:07:28] [TRT] [V] =============== Computing costs for 
[09/07/2022-04:07:28] [TRT] [V] *************** Autotuning format combination: Float(8192,256,16,1) -> Float(8192,8192,256,16,1) ***************
[09/07/2022-04:07:28] [TRT] [V] --------------- Timing Runner: Unsqueeze-%d0 (Shuffle)
[09/07/2022-04:07:28] [TRT] [V] Tactic: 0x0000000000000000 Time: 0.00367672
[09/07/2022-04:07:28] [TRT] [V] Tactic: 0x0000000000000001 Time: 0.0191336
[09/07/2022-04:07:28] [TRT] [V] Fastest Tactic: 0x0000000000000000 Time: 0.00367672
[09/07/2022-04:07:28] [TRT] [V] >>>>>>>>>>>>>>> Chose Runner Type: Shuffle Tactic: 0x0000000000000000
[09/07/2022-04:07:28] [TRT] [V] *************** Autotuning format combination: Float(8192,1,512,32) -> Float(8192,8192,1,512,32) ***************
[09/07/2022-04:07:28] [TRT] [V] --------------- Timing Runner: Unsqueeze-%d0 (Shuffle)
[09/07/2022-04:07:28] [TRT] [V] Tactic: 0x0000000000000000 Time: 0.0094077
[09/07/2022-04:07:28] [TRT] [V] Tactic: 0x0000000000000001 Time: 0.0323336
[09/07/2022-04:07:28] [TRT] [V] Fastest Tactic: 0x0000000000000000 Time: 0.0094077
[09/07/2022-04:07:28] [TRT] [V] >>>>>>>>>>>>>>> Chose Runner Type: Shuffle Tactic: 0x0000000000000000
[09/07/2022-04:07:28] [TRT] [V] *************** Autotuning format combination: Float(256,256:32,16,1) -> Float(256,256,256:32,16,1) ***************
[09/07/2022-04:07:28] [TRT] [V] --------------- Timing Runner: Unsqueeze-%d0 (Shuffle)
[09/07/2022-04:07:28] [TRT] [V] Tactic: 0x0000000000000000 Time: 0.0108274
[09/07/2022-04:07:28] [TRT] [V] Tactic: 0x0000000000000001 Time: 0.0324209
[09/07/2022-04:07:28] [TRT] [V] Fastest Tactic: 0x0000000000000000 Time: 0.0108274
[09/07/2022-04:07:28] [TRT] [V] >>>>>>>>>>>>>>> Chose Runner Type: Shuffle Tactic: 0x0000000000000000
[09/07/2022-04:07:28] [TRT] [V] =============== Computing costs for 
[09/07/2022-04:07:28] [TRT] [V] *************** Autotuning format combination: Float(8192,8192,256,16,1) -> Float(8192,8192,256,16,1) ***************
[09/07/2022-04:07:28] [TRT] [V] --------------- Timing Runner: constant32 + (Unnamed Layer* 9) [Shuffle] + Add-0 (Scale)
[09/07/2022-04:07:28] [TRT] [V] Tactic: 0x0000000000000000 Time: 0.00366441
[09/07/2022-04:07:28] [TRT] [V] Fastest Tactic: 0x0000000000000000 Time: 0.00366441
[09/07/2022-04:07:28] [TRT] [V] >>>>>>>>>>>>>>> Chose Runner Type: Scale Tactic: 0x0000000000000000
[09/07/2022-04:07:28] [TRT] [V] *************** Autotuning format combination: Float(8192,8192,1,512,32) -> Float(8192,8192,1,512,32) ***************
[09/07/2022-04:07:28] [TRT] [V] --------------- Timing Runner: constant32 + (Unnamed Layer* 9) [Shuffle] + Add-0 (Scale)
[09/07/2022-04:07:28] [TRT] [V] Scale has no valid tactics for this config, skipping
[09/07/2022-04:07:28] [TRT] [V] =============== Computing costs for 
[09/07/2022-04:07:28] [TRT] [V] *************** Autotuning format combination: Float(8192,8192,256,16,1) -> Float(8192,256,16,1) ***************
[09/07/2022-04:07:28] [TRT] [V] --------------- Timing Runner: Squeeze-%d0 (Shuffle)
[09/07/2022-04:07:28] [TRT] [V] Tactic: 0x0000000000000000 Time: 0.00364244
[09/07/2022-04:07:28] [TRT] [V] Tactic: 0x0000000000000001 Time: 0.0190708
[09/07/2022-04:07:28] [TRT] [V] Fastest Tactic: 0x0000000000000000 Time: 0.00364244
[09/07/2022-04:07:28] [TRT] [V] >>>>>>>>>>>>>>> Chose Runner Type: Shuffle Tactic: 0x0000000000000000
[09/07/2022-04:07:28] [TRT] [V] *************** Autotuning format combination: Float(8192,8192,1,512,32) -> Float(8192,1,512,32) ***************
[09/07/2022-04:07:28] [TRT] [V] --------------- Timing Runner: Squeeze-%d0 (Shuffle)
[09/07/2022-04:07:28] [TRT] [V] Tactic: 0x0000000000000000 Time: 0.00943822
[09/07/2022-04:07:28] [TRT] [V] Tactic: 0x0000000000000001 Time: 0.0324577
[09/07/2022-04:07:28] [TRT] [V] Fastest Tactic: 0x0000000000000000 Time: 0.00943822
[09/07/2022-04:07:28] [TRT] [V] >>>>>>>>>>>>>>> Chose Runner Type: Shuffle Tactic: 0x0000000000000000
[09/07/2022-04:07:28] [TRT] [V] *************** Autotuning format combination: Float(256,256,256:32,16,1) -> Float(256,256:32,16,1) ***************
[09/07/2022-04:07:28] [TRT] [V] --------------- Timing Runner: Squeeze-%d0 (Shuffle)
[09/07/2022-04:07:28] [TRT] [V] Tactic: 0x0000000000000000 Time: 0.0108157
[09/07/2022-04:07:28] [TRT] [V] Tactic: 0x0000000000000001 Time: 0.0324267
[09/07/2022-04:07:28] [TRT] [V] Fastest Tactic: 0x0000000000000000 Time: 0.0108157
[09/07/2022-04:07:28] [TRT] [V] >>>>>>>>>>>>>>> Chose Runner Type: Shuffle Tactic: 0x0000000000000000
[09/07/2022-04:07:28] [TRT] [V] =============== Computing costs for 
[09/07/2022-04:07:28] [TRT] [V] *************** Autotuning format combination: Float(8192,256,16,1) -> Float(8192,256,16,1) ***************
[09/07/2022-04:07:28] [TRT] [V] --------------- Timing Runner: PWN(ReLU-0) (PointWiseV2)
[09/07/2022-04:07:28] [TRT] [V] Tactic: 0x0000000000000000 Time: 0.00416434
[09/07/2022-04:07:28] [TRT] [V] Tactic: 0x0000000000000001 Time: 0.00351473
[09/07/2022-04:07:28] [TRT] [V] Tactic: 0x0000000000000002 Time: 0.00336555
[09/07/2022-04:07:28] [TRT] [V] Tactic: 0x0000000000000003 Time: 0.0033092
[09/07/2022-04:07:29] [TRT] [V] Tactic: 0x0000000000000004 Time: 0.00304989
[09/07/2022-04:07:29] [TRT] [V] Tactic: 0x0000000000000005 Time: 0.00289883
[09/07/2022-04:07:29] [TRT] [V] Tactic: 0x0000000000000006 Time: 0.00361405
[09/07/2022-04:07:29] [TRT] [V] Tactic: 0x0000000000000007 Time: 0.0031808
[09/07/2022-04:07:29] [TRT] [V] Tactic: 0x0000000000000008 Time: 0.00290569
[09/07/2022-04:07:29] [TRT] [V] Tactic: 0x0000000000000009 Time: 0.00301069
[09/07/2022-04:07:30] [TRT] [V] Tactic: 0x000000000000001c Time: 0.00404986
[09/07/2022-04:07:30] [TRT] [V] Fastest Tactic: 0x0000000000000005 Time: 0.00289883
[09/07/2022-04:07:30] [TRT] [V] --------------- Timing Runner: PWN(ReLU-0) (PointWise)
[09/07/2022-04:07:30] [TRT] [V] PointWise has no valid tactics for this config, skipping
[09/07/2022-04:07:30] [TRT] [V] >>>>>>>>>>>>>>> Chose Runner Type: PointWiseV2 Tactic: 0x0000000000000005
[09/07/2022-04:07:30] [TRT] [V] *************** Autotuning format combination: Float(8192,1,512,32) -> Float(8192,1,512,32) ***************
[09/07/2022-04:07:30] [TRT] [V] --------------- Timing Runner: PWN(ReLU-0) (PointWiseV2)
[09/07/2022-04:07:30] [TRT] [V] Tactic: 0x0000000000000000 Time: 0.00409014
[09/07/2022-04:07:30] [TRT] [V] Tactic: 0x0000000000000001 Time: 0.00348411
[09/07/2022-04:07:30] [TRT] [V] Tactic: 0x0000000000000002 Time: 0.00334838
[09/07/2022-04:07:30] [TRT] [V] Tactic: 0x0000000000000003 Time: 0.00328701
[09/07/2022-04:07:30] [TRT] [V] Tactic: 0x0000000000000004 Time: 0.00304757
[09/07/2022-04:07:30] [TRT] [V] Tactic: 0x0000000000000005 Time: 0.00292313
[09/07/2022-04:07:30] [TRT] [V] Tactic: 0x0000000000000006 Time: 0.00365021
[09/07/2022-04:07:30] [TRT] [V] Tactic: 0x0000000000000007 Time: 0.00316488
[09/07/2022-04:07:30] [TRT] [V] Tactic: 0x0000000000000008 Time: 0.00287936
[09/07/2022-04:07:30] [TRT] [V] Tactic: 0x0000000000000009 Time: 0.00300964
[09/07/2022-04:07:30] [TRT] [V] Tactic: 0x000000000000001c Time: 0.00397257
[09/07/2022-04:07:30] [TRT] [V] Fastest Tactic: 0x0000000000000008 Time: 0.00287936
[09/07/2022-04:07:30] [TRT] [V] --------------- Timing Runner: PWN(ReLU-0) (PointWise)
[09/07/2022-04:07:30] [TRT] [V] PointWise has no valid tactics for this config, skipping
[09/07/2022-04:07:30] [TRT] [V] >>>>>>>>>>>>>>> Chose Runner Type: PointWiseV2 Tactic: 0x0000000000000008
[09/07/2022-04:07:30] [TRT] [V] *************** Autotuning format combination: Float(256,256:32,16,1) -> Float(256,256:32,16,1) ***************
[09/07/2022-04:07:30] [TRT] [V] --------------- Timing Runner: PWN(ReLU-0) (PointWiseV2)
[09/07/2022-04:07:30] [TRT] [V] Tactic: 0x0000000000000018 Time: 0.00283562
[09/07/2022-04:07:30] [TRT] [V] Tactic: 0x0000000000000019 Time: 0.00275148
[09/07/2022-04:07:30] [TRT] [V] Tactic: 0x000000000000001a Time: 0.00316257
[09/07/2022-04:07:30] [TRT] [V] Tactic: 0x000000000000001b Time: 0.00402069
[09/07/2022-04:07:30] [TRT] [V] Tactic: 0x000000000000001f Time: 0.00279822
[09/07/2022-04:07:30] [TRT] [V] Fastest Tactic: 0x0000000000000019 Time: 0.00275148
[09/07/2022-04:07:30] [TRT] [V] --------------- Timing Runner: PWN(ReLU-0) (PointWise)
[09/07/2022-04:07:30] [TRT] [V] PointWise has no valid tactics for this config, skipping
[09/07/2022-04:07:30] [TRT] [V] >>>>>>>>>>>>>>> Chose Runner Type: PointWiseV2 Tactic: 0x0000000000000019
[09/07/2022-04:07:30] [TRT] [V] =============== Computing costs for 
[09/07/2022-04:07:30] [TRT] [V] *************** Autotuning format combination: Float(8192,256,16,1) -> Float(8192,256,16,1) ***************
[09/07/2022-04:07:30] [TRT] [V] *************** Autotuning format combination: Float(8192,1,512,32) -> Float(8192,1,512,32) ***************
[09/07/2022-04:07:30] [TRT] [V] =============== Computing costs for 
[09/07/2022-04:07:30] [TRT] [V] *************** Autotuning format combination: Float(8192,256,16,1) -> Float(8192,8192,256,16,1) ***************
[09/07/2022-04:07:30] [TRT] [V] *************** Autotuning format combination: Float(8192,1,512,32) -> Float(8192,8192,1,512,32) ***************
[09/07/2022-04:07:30] [TRT] [V] *************** Autotuning format combination: Float(256,256:32,16,1) -> Float(256,256,256:32,16,1) ***************
[09/07/2022-04:07:30] [TRT] [V] =============== Computing costs for 
[09/07/2022-04:07:30] [TRT] [V] *************** Autotuning format combination: Float(8192,8192,256,16,1) -> Float(8192,8192,256,16,1) ***************
[09/07/2022-04:07:30] [TRT] [V] *************** Autotuning format combination: Float(8192,8192,1,512,32) -> Float(8192,8192,1,512,32) ***************
[09/07/2022-04:07:30] [TRT] [V] --------------- Timing Runner: constant32_clone_1 + (Unnamed Layer* 23) [Shuffle] + Add-1 (Scale)
[09/07/2022-04:07:30] [TRT] [V] Scale has no valid tactics for this config, skipping
[09/07/2022-04:07:30] [TRT] [V] =============== Computing costs for 
[09/07/2022-04:07:30] [TRT] [V] *************** Autotuning format combination: Float(8192,8192,256,16,1) -> Float(8192,256,16,1) ***************
[09/07/2022-04:07:30] [TRT] [V] *************** Autotuning format combination: Float(8192,8192,1,512,32) -> Float(8192,1,512,32) ***************
[09/07/2022-04:07:30] [TRT] [V] *************** Autotuning format combination: Float(256,256,256:32,16,1) -> Float(256,256:32,16,1) ***************
[09/07/2022-04:07:30] [TRT] [V] =============== Computing costs for 
[09/07/2022-04:07:30] [TRT] [V] *************** Autotuning format combination: Float(8192,256,16,1) -> Float(8192,256,16,1) ***************
[09/07/2022-04:07:30] [TRT] [V] *************** Autotuning format combination: Float(8192,1,512,32) -> Float(8192,1,512,32) ***************
[09/07/2022-04:07:30] [TRT] [V] *************** Autotuning format combination: Float(256,256:32,16,1) -> Float(256,256:32,16,1) ***************
[09/07/2022-04:07:30] [TRT] [V] =============== Computing costs for 
[09/07/2022-04:07:30] [TRT] [V] *************** Autotuning format combination: Float(8192,256,16,1) -> Float(8192,256,16,1) ***************
[09/07/2022-04:07:30] [TRT] [V] *************** Autotuning format combination: Float(8192,1,512,32) -> Float(8192,1,512,32) ***************
[09/07/2022-04:07:30] [TRT] [V] =============== Computing costs for 
[09/07/2022-04:07:30] [TRT] [V] *************** Autotuning format combination: Float(8192,256,16,1) -> Float(8192,8192,256,16,1) ***************
[09/07/2022-04:07:30] [TRT] [V] *************** Autotuning format combination: Float(8192,1,512,32) -> Float(8192,8192,1,512,32) ***************
[09/07/2022-04:07:30] [TRT] [V] *************** Autotuning format combination: Float(256,256:32,16,1) -> Float(256,256,256:32,16,1) ***************
[09/07/2022-04:07:30] [TRT] [V] =============== Computing costs for 
[09/07/2022-04:07:30] [TRT] [V] *************** Autotuning format combination: Float(8192,8192,256,16,1) -> Float(8192,8192,256,16,1) ***************
[09/07/2022-04:07:30] [TRT] [V] *************** Autotuning format combination: Float(8192,8192,1,512,32) -> Float(8192,8192,1,512,32) ***************
[09/07/2022-04:07:30] [TRT] [V] --------------- Timing Runner: constant32_clone_2 + (Unnamed Layer* 37) [Shuffle] + Add-2 (Scale)
[09/07/2022-04:07:30] [TRT] [V] Scale has no valid tactics for this config, skipping
[09/07/2022-04:07:30] [TRT] [V] =============== Computing costs for 
[09/07/2022-04:07:30] [TRT] [V] *************** Autotuning format combination: Float(8192,8192,256,16,1) -> Float(8192,256,16,1) ***************
[09/07/2022-04:07:30] [TRT] [V] *************** Autotuning format combination: Float(8192,8192,1,512,32) -> Float(8192,1,512,32) ***************
[09/07/2022-04:07:30] [TRT] [V] *************** Autotuning format combination: Float(256,256,256:32,16,1) -> Float(256,256:32,16,1) ***************
[09/07/2022-04:07:30] [TRT] [V] =============== Computing costs for 
[09/07/2022-04:07:30] [TRT] [V] *************** Autotuning format combination: Float(8192,256,16,1) -> Float(8192,256,16,1) ***************
[09/07/2022-04:07:30] [TRT] [V] *************** Autotuning format combination: Float(8192,1,512,32) -> Float(8192,1,512,32) ***************
[09/07/2022-04:07:30] [TRT] [V] *************** Autotuning format combination: Float(256,256:32,16,1) -> Float(256,256:32,16,1) ***************
[09/07/2022-04:07:30] [TRT] [V] =============== Computing costs for 
[09/07/2022-04:07:30] [TRT] [V] *************** Autotuning format combination: Float(8192,256,16,1) -> Float(8192,256,16,1) ***************
[09/07/2022-04:07:30] [TRT] [V] *************** Autotuning format combination: Float(8192,1,512,32) -> Float(8192,1,512,32) ***************
[09/07/2022-04:07:30] [TRT] [V] =============== Computing costs for 
[09/07/2022-04:07:30] [TRT] [V] *************** Autotuning format combination: Float(8192,256,16,1) -> Float(8192,8192,256,16,1) ***************
[09/07/2022-04:07:30] [TRT] [V] *************** Autotuning format combination: Float(8192,1,512,32) -> Float(8192,8192,1,512,32) ***************
[09/07/2022-04:07:30] [TRT] [V] *************** Autotuning format combination: Float(256,256:32,16,1) -> Float(256,256,256:32,16,1) ***************
[09/07/2022-04:07:30] [TRT] [V] =============== Computing costs for 
[09/07/2022-04:07:30] [TRT] [V] *************** Autotuning format combination: Float(8192,8192,256,16,1) -> Float(8192,8192,256,16,1) ***************
[09/07/2022-04:07:30] [TRT] [V] *************** Autotuning format combination: Float(8192,8192,1,512,32) -> Float(8192,8192,1,512,32) ***************
[09/07/2022-04:07:30] [TRT] [V] --------------- Timing Runner: constant32_clone_3 + (Unnamed Layer* 51) [Shuffle] + Add-3 (Scale)
[09/07/2022-04:07:30] [TRT] [V] Scale has no valid tactics for this config, skipping
[09/07/2022-04:07:30] [TRT] [V] =============== Computing costs for 
[09/07/2022-04:07:30] [TRT] [V] *************** Autotuning format combination: Float(8192,8192,256,16,1) -> Float(8192,256,16,1) ***************
[09/07/2022-04:07:30] [TRT] [V] *************** Autotuning format combination: Float(8192,8192,1,512,32) -> Float(8192,1,512,32) ***************
[09/07/2022-04:07:30] [TRT] [V] *************** Autotuning format combination: Float(256,256,256:32,16,1) -> Float(256,256:32,16,1) ***************
[09/07/2022-04:07:30] [TRT] [V] =============== Computing costs for 
[09/07/2022-04:07:30] [TRT] [V] *************** Autotuning format combination: Float(8192,256,16,1) -> Float(8192,256,16,1) ***************
[09/07/2022-04:07:30] [TRT] [V] *************** Autotuning format combination: Float(8192,1,512,32) -> Float(8192,1,512,32) ***************
[09/07/2022-04:07:30] [TRT] [V] *************** Autotuning format combination: Float(256,256:32,16,1) -> Float(256,256:32,16,1) ***************
[09/07/2022-04:07:30] [TRT] [V] =============== Computing costs for 
[09/07/2022-04:07:30] [TRT] [V] *************** Autotuning format combination: Float(8192,256,16,1) -> Float(8192,256,16,1) ***************
[09/07/2022-04:07:30] [TRT] [V] *************** Autotuning format combination: Float(8192,1,512,32) -> Float(8192,1,512,32) ***************
[09/07/2022-04:07:30] [TRT] [V] =============== Computing costs for 
[09/07/2022-04:07:30] [TRT] [V] *************** Autotuning format combination: Float(8192,256,16,1) -> Float(8192,8192,256,16,1) ***************
[09/07/2022-04:07:30] [TRT] [V] *************** Autotuning format combination: Float(8192,1,512,32) -> Float(8192,8192,1,512,32) ***************
[09/07/2022-04:07:30] [TRT] [V] *************** Autotuning format combination: Float(256,256:32,16,1) -> Float(256,256,256:32,16,1) ***************
[09/07/2022-04:07:30] [TRT] [V] =============== Computing costs for 
[09/07/2022-04:07:30] [TRT] [V] *************** Autotuning format combination: Float(8192,8192,256,16,1) -> Float(8192,8192,256,16,1) ***************
[09/07/2022-04:07:30] [TRT] [V] *************** Autotuning format combination: Float(8192,8192,1,512,32) -> Float(8192,8192,1,512,32) ***************
[09/07/2022-04:07:30] [TRT] [V] --------------- Timing Runner: constant32_clone_4 + (Unnamed Layer* 65) [Shuffle] + Add-4 (Scale)
[09/07/2022-04:07:30] [TRT] [V] Scale has no valid tactics for this config, skipping
[09/07/2022-04:07:30] [TRT] [V] =============== Computing costs for 
[09/07/2022-04:07:30] [TRT] [V] *************** Autotuning format combination: Float(8192,8192,256,16,1) -> Float(8192,256,16,1) ***************
[09/07/2022-04:07:30] [TRT] [V] *************** Autotuning format combination: Float(8192,8192,1,512,32) -> Float(8192,1,512,32) ***************
[09/07/2022-04:07:30] [TRT] [V] *************** Autotuning format combination: Float(256,256,256:32,16,1) -> Float(256,256:32,16,1) ***************
[09/07/2022-04:07:30] [TRT] [V] =============== Computing costs for 
[09/07/2022-04:07:30] [TRT] [V] *************** Autotuning format combination: Float(8192,256,16,1) -> Float(8192,256,16,1) ***************
[09/07/2022-04:07:30] [TRT] [V] *************** Autotuning format combination: Float(8192,1,512,32) -> Float(8192,1,512,32) ***************
[09/07/2022-04:07:30] [TRT] [V] *************** Autotuning format combination: Float(256,256:32,16,1) -> Float(256,256:32,16,1) ***************
[09/07/2022-04:07:30] [TRT] [V] =============== Computing costs for 
[09/07/2022-04:07:30] [TRT] [V] *************** Autotuning format combination: Float(8192,256,16,1) -> Float(8192,256,16,1) ***************
[09/07/2022-04:07:30] [TRT] [V] --------------- Timing Runner: Conv-5 + constant32t + Add-5 + ReLU-5 (CudaDepthwiseConvolution)
[09/07/2022-04:07:30] [TRT] [V] CudaDepthwiseConvolution has no valid tactics for this config, skipping
[09/07/2022-04:07:30] [TRT] [V] --------------- Timing Runner: Conv-5 + constant32t + Add-5 + ReLU-5 (FusedConvActConvolution)
[09/07/2022-04:07:30] [TRT] [V] FusedConvActConvolution has no valid tactics for this config, skipping
[09/07/2022-04:07:30] [TRT] [V] --------------- Timing Runner: Conv-5 + constant32t + Add-5 + ReLU-5 (CudnnConvolution)
[09/07/2022-04:07:30] [TRT] [V] Tactic: 0x0000000000000000 Time: 0.0397464
[09/07/2022-04:07:30] [TRT] [V] Tactic: 0x0000000000000001 Time: 0.0395567
[09/07/2022-04:07:30] [TRT] [V] Tactic: 0x0000000000000002 Time: 0.213163
[09/07/2022-04:07:30] [TRT] [V] Tactic: 0x0000000000000004 Time: 0.140668
[09/07/2022-04:07:30] [TRT] [V] Tactic: 0x0000000000000005 Time: 0.150201
[09/07/2022-04:07:30] [TRT] [V] Tactic: 0x0000000000000006 Time: 0.0219733
[09/07/2022-04:07:30] [TRT] [V] Fastest Tactic: 0x0000000000000006 Time: 0.0219733
[09/07/2022-04:07:30] [TRT] [V] --------------- Timing Runner: Conv-5 + constant32t + Add-5 + ReLU-5 (CaskConvolution)
[09/07/2022-04:07:30] [TRT] [V] Conv-5 + constant32t + Add-5 + ReLU-5 Set Tactic Name: maxwell_scudnn_128x32_relu_medium_nn_v1 Tactic: 0x0ebe499388e08286
[09/07/2022-04:07:30] [TRT] [V] Tactic: 0x0ebe499388e08286 Time: 0.043688
[09/07/2022-04:07:30] [TRT] [V] Conv-5 + constant32t + Add-5 + ReLU-5 Set Tactic Name: maxwell_scudnn_128x32_relu_large_nn_v0 Tactic: 0x185af5379580418f
[09/07/2022-04:07:30] [TRT] [V] Tactic: 0x185af5379580418f Time: 0.0351915
[09/07/2022-04:07:30] [TRT] [V] Conv-5 + constant32t + Add-5 + ReLU-5 Set Tactic Name: maxwell_scudnn_128x128_relu_large_nn_v0 Tactic: 0x321f7a577fb21da0
[09/07/2022-04:07:30] [TRT] [V] Tactic: 0x321f7a577fb21da0 Time: 0.0402323
[09/07/2022-04:07:30] [TRT] [V] Conv-5 + constant32t + Add-5 + ReLU-5 Set Tactic Name: maxwell_scudnn_winograd_128x128_ldg1_ldg4_relu_tile148n_nt_v1 Tactic: 0x351dd956e9e8e4c4
[09/07/2022-04:07:30] [TRT] [V] Tactic: 0x351dd956e9e8e4c4 Time: 0.00932474
[09/07/2022-04:07:30] [TRT] [V] Conv-5 + constant32t + Add-5 + ReLU-5 Set Tactic Name: maxwell_scudnn_128x64_relu_large_nn_v1 Tactic: 0x3c301f1cd57bd89b
[09/07/2022-04:07:30] [TRT] [V] Tactic: 0x3c301f1cd57bd89b Time: 0.0344427
[09/07/2022-04:07:30] [TRT] [V] Conv-5 + constant32t + Add-5 + ReLU-5 Set Tactic Name: maxwell_scudnn_128x128_relu_medium_nn_v1 Tactic: 0x3e787008e11a6129
[09/07/2022-04:07:30] [TRT] [V] Tactic: 0x3e787008e11a6129 Time: 0.0405049
[09/07/2022-04:07:30] [TRT] [V] Conv-5 + constant32t + Add-5 + ReLU-5 Set Tactic Name: maxwell_scudnn_128x64_relu_small_nn_v1 Tactic: 0x474c9edd1ecfbbba
[09/07/2022-04:07:30] [TRT] [V] Tactic: 0x474c9edd1ecfbbba Time: 0.027904
[09/07/2022-04:07:30] [TRT] [V] Conv-5 + constant32t + Add-5 + ReLU-5 Set Tactic Name: maxwell_scudnn_128x128_relu_small_nn_v0 Tactic: 0x4963fb96b4067e81
[09/07/2022-04:07:30] [TRT] [V] Tactic: 0x4963fb96b4067e81 Time: 0.0382673
[09/07/2022-04:07:30] [TRT] [V] Conv-5 + constant32t + Add-5 + ReLU-5 Set Tactic Name: maxwell_scudnn_winograd_128x128_ldg1_ldg4_relu_tile148m_nt_v1 Tactic: 0x522ccebdb4e349f0
[09/07/2022-04:07:30] [TRT] [V] Tactic: 0x522ccebdb4e349f0 Time: 0.00988423
[09/07/2022-04:07:30] [TRT] [V] Conv-5 + constant32t + Add-5 + ReLU-5 Set Tactic Name: maxwell_scudnn_128x64_relu_medium_nn_v1 Tactic: 0x5c38385751ccb068
[09/07/2022-04:07:30] [TRT] [V] Tactic: 0x5c38385751ccb068 Time: 0.0329309
[09/07/2022-04:07:30] [TRT] [V] Conv-5 + constant32t + Add-5 + ReLU-5 Set Tactic Name: maxwell_scudnn_128x32_relu_small_nn_v0 Tactic: 0x632674f65e3422ae
[09/07/2022-04:07:30] [TRT] [V] Tactic: 0x632674f65e3422ae Time: 0.0299227
