cookbook/04-Feature/Sparsity/log-main.py.log
[04/25/2026-04:16:04] [TRT] [V] *************** Autotuning format combination: Float(784,784,28,1) -> Float(25088,784,28,1) ***************
[04/25/2026-04:16:04] [TRT] [V] --------------- Timing Runner: node_conv2d + node_relu (CaskConvolution[0x80000009])
[04/25/2026-04:16:04] [TRT] [V] Tactic Name: ampere_scudnn_128x128_relu_medium_nn_v1 Tactic: 0xf067e6205da31c2e Time: 0.00951792
[04/25/2026-04:16:04] [TRT] [V] Tactic Name: ampere_scudnn_128x32_relu_small_nn_v1 Tactic: 0xa8609adc4e0ceb90 Time: 0.00790995
[04/25/2026-04:16:04] [TRT] [V] Tactic Name: ampere_scudnn_128x64_relu_medium_nn_v1 Tactic: 0xf64396b97c889179 Time: 0.0083912
[04/25/2026-04:16:04] [TRT] [V] Tactic Name: sm70_xmma_fprop_implicit_gemm_f32f32_f32f32_f32_nchwkcrs_nchw_tilesize64x64x8_stage1_warpsize1x4x1_g1_ffma_aligna4_alignc4 Tactic: 0xe40b38338a3a7d7e Time: 0.0051305
[04/25/2026-04:16:04] [TRT] [V] Tactic Name: sm70_xmma_fprop_implicit_gemm_f32f32_f32f32_f32_nchwkcrs_nchw_tilesize32x32x8_stage1_warpsize1x2x1_g1_ffma_aligna4_alignc4 Tactic: 0xf7a98be0a08d77c4 Time: 0.00472683
[04/25/2026-04:16:04] [TRT] [V] Tactic Name: sm70_xmma_fprop_implicit_gemm_f32f32_f32f32_f32_nchwkcrs_nchw_tilesize64x128x8_stage1_warpsize1x4x1_g1_ffma_aligna4_alignc4 Tactic: 0xd1338f4b38d341e2 Time: 0.00601334
[04/25/2026-04:16:04] [TRT] [V] Tactic Name: sm80_xmma_fprop_implicit_gemm_f32f32_f32f32_f32_nchwkcrs_nchw_tilesize64x128x8_stage3_warpsize1x4x1_g1_ffma_aligna4_alignc4 Tactic: 0x5aa723e0481da855 Time: 0.00615409
[04/25/2026-04:16:04] [TRT] [V] Tactic Name: sm80_xmma_fprop_implicit_gemm_f32f32_f32f32_f32_nchwkcrs_nchw_tilesize256x128x8_stage3_warpsize4x2x1_g1_ffma_aligna4_alignc4 Tactic: 0xbb8c3889c7eacd30 Time: 0.0128488
[04/25/2026-04:16:04] [TRT] [V] Tactic Name: sm70_xmma_fprop_implicit_gemm_indexed_f32f32_f32f32_f32_nchwkcrs_nchw_tilesize128x16x8_stage1_warpsize4x1x1_g1_ffma_aligna4_alignc4 Tactic: 0x65d82d184f452332 Time: 0.00555244
[04/25/2026-04:16:04] [TRT] [V] Tactic Name: sm70_xmma_fprop_implicit_gemm_indexed_f32f32_f32f32_f32_nchwkcrs_nchw_tilesize32x32x8_stage1_warpsize1x2x1_g1_ffma_aligna4_alignc4 Tactic: 0x9efed776051c0873 Time: 0.00511547
[04/25/2026-04:16:04] [TRT] [V] Tactic Name: sm70_xmma_fprop_implicit_gemm_indexed_f32f32_f32f32_f32_nchwkcrs_nchw_tilesize128x32x8_stage1_warpsize2x2x1_g1_ffma_aligna4_alignc4 Tactic: 0x8c4f6360145d6a1f Time: 0.00600229
[04/25/2026-04:16:04] [TRT] [V] Tactic Name: sm70_xmma_fprop_implicit_gemm_indexed_f32f32_f32f32_f32_nchwkcrs_nchw_tilesize64x64x8_stage1_warpsize1x4x1_g1_ffma_aligna4_alignc4 Tactic: 0x8d5c64a52fab02c9 Time: 0.00538856
[04/25/2026-04:16:04] [TRT] [V] Tactic Name: sm80_xmma_fprop_implicit_gemm_indexed_f32f32_f32f32_f32_nchwkcrs_nchw_tilesize128x64x8_stage2_warpsize4x1x1_g1_ffma_aligna4_alignc4_beta0_packed_stride Tactic: 0x1673e3594ce11cea Time: 0.00726585
[04/25/2026-04:16:04] [TRT] [V] Tactic Name: sm80_xmma_fprop_implicit_gemm_indexed_f32f32_f32f32_f32_nchwkcrs_nchw_tilesize128x16x8_stage3_warpsize4x1x1_g1_ffma_aligna4_alignc4 Tactic: 0x40a12e3938221818 Time: 0.00563787
[04/25/2026-04:16:04] [TRT] [V] Tactic Name: sm80_xmma_fprop_implicit_gemm_indexed_f32f32_f32f32_f32_nchwkcrs_nchw_tilesize128x32x8_stage3_warpsize2x2x1_g1_ffma_aligna4_alignc4 Tactic: 0xa9366041633a5135 Time: 0.00603048
[04/25/2026-04:16:04] [TRT] [V] Tactic Name: sm80_xmma_fprop_implicit_gemm_f32f32_f32f32_f32_nchwkcrs_nchw_tilesize32x32x8_stage3_warpsize1x2x1_g1_ffma_t1r5s5_aligna4_alignc4 Tactic: 0x5b8bf1b8028629d9 Time: 0.00471256
[04/25/2026-04:16:04] [TRT] [V] Tactic Name: sm70_xmma_fprop_implicit_gemm_f32f32_f32f32_f32_nchwkcrs_nchw_tilesize32x32x8_stage1_warpsize1x2x1_g1_ffma_t1r5s5_aligna4_alignc4 Tactic: 0x7e1e4d26cfa285f9 Time: 0.00458769
[04/25/2026-04:16:04] [TRT] [V] Tactic Name: ampere_scudnn_128x64_relu_small_nn_v1 Tactic: 0x3f243c490d502deb Time: 0.00786803
[04/25/2026-04:16:04] [TRT] [V] Tactic Name: sm70_xmma_fprop_implicit_gemm_f32f32_f32f32_f32_nchwkcrs_nchw_tilesize128x16x8_stage1_warpsize4x1x1_g1_ffma_aligna4_alignc4 Tactic: 0x160b77f4a95ab6d3 Time: 0.00516857
[04/25/2026-04:16:04] [TRT] [V] Tactic Name: sm70_xmma_fprop_implicit_gemm_f32f32_f32f32_f32_nchwkcrs_nchw_tilesize128x64x8_stage1_warpsize2x2x1_g1_ffma_aligna4_alignc4 Tactic: 0x994f5b723e2d80da Time: 0.00629353
[04/25/2026-04:16:04] [TRT] [V] Tactic Name: sm80_xmma_fprop_implicit_gemm_f32f32_f32f32_f32_nchwkcrs_nchw_tilesize64x64x8_stage3_warpsize1x4x1_g1_ffma_aligna4_alignc4 Tactic: 0xa31d27de74b895ff Time: 0.00511014
[04/25/2026-04:16:04] [TRT] [V] Tactic Name: sm80_xmma_fprop_implicit_gemm_f32f32_f32f32_f32_nchwkcrs_nchw_tilesize32x32x8_stage3_warpsize1x2x1_g1_ffma_aligna4_alignc4 Tactic: 0xb0bf940d5e0f9f45 Time: 0.0046194
[04/25/2026-04:16:04] [TRT] [V] Tactic Name: ampere_scudnn_128x64_relu_xregs_large_nn_v1 Tactic: 0x5deb29b7a8e275f7 Time: 0.00832208
[04/25/2026-04:16:04] [TRT] [V] Tactic Name: sm70_xmma_fprop_implicit_gemm_f32f32_f32f32_f32_nchwkcrs_nchw_tilesize64x64x8_stage1_warpsize1x4x1_g1_ffma_t1r5s5_aligna4_alignc4 Tactic: 0xb3ea28771604ad88 Time: 0.00505261
[04/25/2026-04:16:04] [TRT] [V] Tactic Name: sm80_xmma_fprop_implicit_gemm_f32f32_f32f32_f32_nchwkcrs_nchw_tilesize128x16x8_stage3_warpsize4x1x1_g1_ffma_aligna4_alignc4 Tactic: 0x9d9fdb5fd9945f64 Time: 0.0051777
[04/25/2026-04:16:04] [TRT] [V] Tactic Name: sm80_xmma_fprop_implicit_gemm_indexed_f32f32_f32f32_f32_nchwkcrs_nchw_tilesize64x64x8_stage3_warpsize1x4x1_g1_ffma_aligna4_alignc4 Tactic: 0xd828f024626fa982 Time: 0.005258
[04/25/2026-04:16:04] [TRT] [V] Tactic Name: sm80_xmma_fprop_implicit_gemm_f32f32_f32f32_f32_nchwkcrs_nchw_tilesize128x64x8_stage3_warpsize2x2x1_g1_ffma_aligna4_alignc4 Tactic: 0x12dbf7d94ee3696d Time: 0.00644964
[04/25/2026-04:16:04] [TRT] [V] Tactic Name: sm80_xmma_fprop_implicit_gemm_f32f32_f32f32_f32_nchwkcrs_nchw_tilesize64x64x8_stage3_warpsize1x4x1_g1_ffma_t1r5s5_aligna4_alignc4 Tactic: 0x967f94e9db2001a8 Time: 0.00490002
[04/25/2026-04:16:04] [TRT] [V] Tactic Name: sm80_xmma_fprop_implicit_gemm_indexed_f32f32_f32f32_f32_nchwkcrs_nchw_tilesize32x32x8_stage3_warpsize1x2x1_g1_ffma_aligna4_alignc4 Tactic: 0xcb8a43f748d8a338 Time: 0.0047939
[04/25/2026-04:16:04] [TRT] [V] Tactic Name: sm70_xmma_fprop_implicit_gemm_f32f32_f32f32_f32_nchwkcrs_nchw_tilesize128x256x8_stage1_warpsize2x4x1_g1_ffma_aligna4_alignc4 Tactic: 0xd2aa21bfe2167c0c Time: 0.0118974
[04/25/2026-04:16:04] [TRT] [V] Tactic Name: ampere_scudnn_128x128_relu_small_nn_v1 Tactic: 0x503619c69ae500ff Time: 0.00907531
[04/25/2026-04:16:04] [TRT] [V] Tactic Name: sm80_xmma_fprop_implicit_gemm_indexed_f32f32_f32f32_f32_nchwkcrs_nchw_tilesize128x64x8_stage2_warpsize1x4x1_g1_ffma_aligna4_alignc4_beta0_packed_stride Tactic: 0xede36641840ce3d2 Time: 0.0066698
[04/25/2026-04:16:04] [TRT] [V] Tactic Name: sm70_xmma_fprop_implicit_gemm_f32f32_f32f32_f32_nchwkcrs_nchw_tilesize128x128x8_stage1_warpsize2x2x1_g1_ffma_aligna4_alignc4 Tactic: 0xac49795b871b0d29 Time: 0.00953204
[04/25/2026-04:16:04] [TRT] [V] Tactic Name: sm80_xmma_fprop_implicit_gemm_indexed_f32f32_f32f32_f32_nchwkcrs_nchw_tilesize128x64x8_stage2_warpsize2x2x1_g1_ffma_aligna4_alignc4_beta0_packed_stride Tactic: 0x31aa67f57c5aea77 Time: 0.00673984
[04/25/2026-04:16:04] [TRT] [V] node_conv2d + node_relu (CaskConvolution[0x80000009]) profiling completed in 0.183693 seconds. Fastest Tactic: 0x7e1e4d26cfa285f9 Time: 0.00458769
[04/25/2026-04:16:04] [TRT] [V] Skipping CaskFlattenConvolution: No valid tactics for node_conv2d + node_relu
[04/25/2026-04:16:04] [TRT] [V] >>>>>>>>>>>>>>> Chose Runner Type: CaskConvolution Tactic: 0x7e1e4d26cfa285f9
[04/25/2026-04:16:04] [TRT] [V] *************** Autotuning format combination: Float(784,1,28,1) -> Float(25088,1,896,32) ***************
[04/25/2026-04:16:04] [TRT] [V] --------------- Timing Runner: node_conv2d + node_relu (CaskConvolution[0x80000009])
[04/25/2026-04:16:04] [TRT] [V] Tactic Name: sm70_xmma_fprop_implicit_gemm_f32f32_f32f32_f32_nhwckrsc_nhwc_tilesize64x32x32_stage1_warpsize1x1x1_g1_ffma_t1r5s5_aligna4_alignc4 Tactic: 0x737793996edbf8e2 Time: 0.12038
[04/25/2026-04:16:04] [TRT] [V] Tactic Name: sm80_xmma_fprop_implicit_gemm_f32f32_f32f32_f32_nhwckrsc_nhwc_tilesize64x64x8_stage3_warpsize1x4x1_g1_ffma_t1r5s5_aligna4_alignc4 Tactic: 0x45ff0c3a09b02e78 Time: 0.00964571
[04/25/2026-04:16:04] [TRT] [V] Tactic Name: sm80_xmma_fprop_implicit_gemm_f32f32_f32f32_f32_nhwckrsc_nhwc_tilesize128x64x8_stage3_warpsize2x2x1_g1_ffma_aligna4_alignc4 Tactic: 0x1da91d865428f237 Time: 0.0148179
[04/25/2026-04:16:04] [TRT] [V] Tactic Name: sm70_xmma_fprop_implicit_gemm_indexed_f32f32_f32f32_f32_nhwckrsc_nhwc_tilesize32x32x8_stage1_warpsize1x2x1_g1_ffma_aligna4_alignc4 Tactic: 0x5f60af66e8eb9b51 Time: 0.00989176
[04/25/2026-04:16:04] [TRT] [V] Tactic Name: sm70_xmma_fprop_implicit_gemm_indexed_f32f32_f32f32_f32_nhwckrsc_nhwc_tilesize128x32x8_stage1_warpsize2x2x1_g1_ffma_aligna4_alignc4 Tactic: 0x833d893f0e96f145 Time: 0.0117701
[04/25/2026-04:16:04] [TRT] [V] Tactic Name: sm80_xmma_fprop_implicit_gemm_indexed_wo_smem_f32f32_tf32f32_f32_nhwckrsc_nhwc_tilesize128x32x16_stage1_warpsize4x1x1_g1_tensor16x8x8_aligna4_alignc4 Tactic: 0xf231cca3335919a4 Time: 0.00472233
[04/25/2026-04:16:04] [TRT] [V] Tactic Name: sm70_xmma_fprop_implicit_gemm_f32f32_f32f32_f32_nhwckrsc_nhwc_tilesize64x16x16_stage1_warpsize1x1x1_g1_ffma_t1r5s5_aligna4_alignc4 Tactic: 0x247bb0dcaf6f9760 Time: 0.0187437
[04/25/2026-04:16:04] [TRT] [V] Tactic Name: sm80_xmma_fprop_implicit_gemm_indexed_f32f32_f32f32_f32_nhwckrsc_nhwc_tilesize128x16x8_stage3_warpsize4x1x1_g1_ffma_aligna4_alignc4 Tactic: 0x4fd3c46622e98342 Time: 0.0110954
[04/25/2026-04:16:04] [TRT] [V] Tactic Name: sm80_xmma_fprop_implicit_gemm_indexed_wo_smem_f32f32_tf32f32_f32_nhwckrsc_nhwc_tilesize128x16x32_stage1_warpsize4x1x1_g1_tensor16x8x8_aligna4_alignc4 Tactic: 0xcf8ea142095f02d2 Time: 0.00463081
[04/25/2026-04:16:04] [TRT] [V] Tactic Name: sm80_xmma_fprop_implicit_gemm_f32f32_f32f32_f32_nhwckrsc_nhwc_tilesize32x32x8_stage3_warpsize1x2x1_g1_ffma_t1r5s5_aligna4_alignc4 Tactic: 0x880b696bd0160609 Time: 0.00711625
[04/25/2026-04:16:04] [TRT] [V] Tactic Name: sm70_xmma_fprop_implicit_gemm_f32f32_f32f32_f32_nhwckrsc_nhwc_tilesize128x16x8_stage1_warpsize4x1x1_g1_ffma_aligna4_alignc4 Tactic: 0x19799dabb3912d89 Time: 0.0104447
[04/25/2026-04:16:04] [TRT] [V] Tactic Name: sm70_xmma_fprop_implicit_gemm_f32f32_f32f32_f32_nhwckrsc_nhwc_tilesize64x128x8_stage1_warpsize1x4x1_g1_ffma_aligna4_alignc4 Tactic: 0xde4165142218dab8 Time: 0.0139031
[04/25/2026-04:16:04] [TRT] [V] Tactic Name: sm70_xmma_fprop_implicit_gemm_f32f32_f32f32_f32_nhwckrsc_nhwc_tilesize128x64x8_stage1_warpsize2x2x1_g1_ffma_aligna4_alignc4 Tactic: 0x963db12d24e61b80 Time: 0.0143129
[04/25/2026-04:16:04] [TRT] [V] Tactic Name: sm80_xmma_fprop_implicit_gemm_indexed_f32f32_f32f32_f32_nhwckrsc_nhwc_tilesize128x32x8_stage3_warpsize2x2x1_g1_ffma_aligna4_alignc4 Tactic: 0xa6448a1e79f1ca6f Time: 0.0109192
[04/25/2026-04:16:04] [TRT] [V] Tactic Name: sm80_xmma_fprop_implicit_gemm_f32f32_f32f32_f32_nhwckrsc_nhwc_tilesize128x16x8_stage3_warpsize4x1x1_g1_ffma_t1r5s5_aligna4_alignc4 Tactic: 0xe35d4a4a3b499fe7 Time: 0.008404
[04/25/2026-04:16:04] [TRT] [V] Tactic Name: sm80_xmma_fprop_implicit_gemm_indexed_f32f32_f32f32_f32_nhwckrsc_nhwc_tilesize64x64x8_stage3_warpsize1x4x1_g1_ffma_aligna4_alignc4 Tactic: 0x19b688348f983aa0 Time: 0.0101097
[04/25/2026-04:16:04] [TRT] [V] Tactic Name: sm80_xmma_fprop_implicit_gemm_f32f32_f32f32_f32_nhwckrsc_nhwc_tilesize256x64x8_stage3_warpsize2x2x1_g1_ffma_aligna4_alignc4 Tactic: 0x8014228ec08b4d49 Time: 0.0255169
[04/25/2026-04:16:04] [TRT] [V] Tactic Name: sm70_xmma_fprop_implicit_gemm_f32f32_f32f32_f32_nhwckrsc_nhwc_tilesize128x16x8_stage1_warpsize4x1x1_g1_ffma_t1r5s5_aligna4_alignc4 Tactic: 0x54e3b8c9b1e5f17a Time: 0.0101621
[04/25/2026-04:16:04] [TRT] [V] Tactic Name: sm70_xmma_fprop_implicit_gemm_indexed_f32f32_f32f32_f32_nhwckrsc_nhwc_tilesize128x16x8_stage1_warpsize4x1x1_g1_ffma_aligna4_alignc4 Tactic: 0x6aaac747558eb868 Time: 0.0111088
[04/25/2026-04:16:04] [TRT] [V] Tactic Name: sm70_xmma_fprop_implicit_gemm_f32f32_f32f32_f32_nhwckrsc_nhwc_tilesize32x32x8_stage1_warpsize1x2x1_g1_ffma_aligna4_alignc4 Tactic: 0x3637f3f04d7ae4e6 Time: 0.0103632
[04/25/2026-04:16:04] [TRT] [V] Tactic Name: sm70_xmma_fprop_implicit_gemm_f32f32_f32f32_f32_nhwckrsc_nhwc_tilesize64x32x32_stage1_warpsize1x1x1_g1_ffma_aligna4_alignc4 Tactic: 0xdb73e25ae4006f74 Time: 0.119292
[04/25/2026-04:16:04] [TRT] [V] Tactic Name: sm70_xmma_fprop_implicit_gemm_f32f32_f32f32_f32_nhwckrsc_nhwc_tilesize64x64x8_stage1_warpsize1x4x1_g1_ffma_aligna4_alignc4 Tactic: 0x2595402367cdee5c Time: 0.0105
[04/25/2026-04:16:04] [TRT] [V] Tactic Name: sm80_xmma_fprop_implicit_gemm_f32f32_f32f32_f32_nhwckrsc_nhwc_tilesize128x16x8_stage3_warpsize4x1x1_g1_ffma_aligna4_alignc4 Tactic: 0x92ed3100c35fc43e Time: 0.00853333
[04/25/2026-04:16:04] [TRT] [V] Tactic Name: sm80_xmma_fprop_implicit_gemm_f32f32_f32f32_f32_nhwckrsc_nhwc_tilesize64x64x8_stage3_warpsize1x4x1_g1_ffma_aligna4_alignc4 Tactic: 0x62835fce994f06dd Time: 0.0099727
[04/25/2026-04:16:04] [TRT] [V] Tactic Name: sm70_xmma_fprop_implicit_gemm_f32f32_f32f32_f32_nhwckrsc_nhwc_tilesize32x32x8_stage1_warpsize1x2x1_g1_ffma_t1r5s5_aligna4_alignc4 Tactic: 0xad9ed5f51d32aa29 Time: 0.00971703
[04/25/2026-04:16:04] [TRT] [V] Tactic Name: sm70_xmma_fprop_implicit_gemm_f32f32_f32f32_f32_nhwckrsc_nhwc_tilesize64x16x16_stage1_warpsize1x1x1_g1_ffma_aligna4_alignc4 Tactic: 0x3f904b355d9ca8e6 Time: 0.0190258
[04/25/2026-04:16:04] [TRT] [V] Tactic Name: sm80_xmma_fprop_implicit_gemm_indexed_f32f32_f32f32_f32_nhwckrsc_nhwc_tilesize32x32x8_stage3_warpsize1x2x1_g1_ffma_aligna4_alignc4 Tactic: 0x0a143be7a52f301a Time: 0.0079236
[04/25/2026-04:16:04] [TRT] [V] Tactic Name: sm80_xmma_fprop_implicit_gemm_f32f32_f32f32_f32_nhwckrsc_nhwc_tilesize32x32x8_stage3_warpsize1x2x1_g1_ffma_aligna4_alignc4 Tactic: 0x7121ec1db3f80c67 Time: 0.00736556
[04/25/2026-04:16:04] [TRT] [V] Tactic Name: sm70_xmma_fprop_implicit_gemm_f32f32_f32f32_f32_nhwckrsc_nhwc_tilesize256x128x8_stage1_warpsize2x4x1_g1_ffma_aligna4_alignc4 Tactic: 0x0447933cc2be855a Time: 0.0361472
[04/25/2026-04:16:04] [TRT] [V] node_conv2d + node_relu (CaskConvolution[0x80000009]) profiling completed in 0.0970493 seconds. Fastest Tactic: 0xcf8ea142095f02d2 Time: 0.00463081
[04/25/2026-04:16:04] [TRT] [V] Skipping CaskFlattenConvolution: No valid tactics for node_conv2d + node_relu
[04/25/2026-04:16:04] [TRT] [V] >>>>>>>>>>>>>>> Chose Runner Type: CaskConvolution Tactic: 0xcf8ea142095f02d2
[04/25/2026-04:16:04] [TRT] [V] *************** Autotuning format combination: Float(784,1:4,28,1) -> Float(25088,784,28,1) ***************
[04/25/2026-04:16:04] [TRT] [V] --------------- Timing Runner: node_conv2d + node_relu (CaskConvolution[0x80000009])
[04/25/2026-04:16:04] [TRT] [V] Tactic Name: sm80_xmma_fprop_implicit_gemm_indexed_f32f32_tf32f32_f32_nhwckrsc_nchw_tilesize128x128x16_stage4_warpsize2x2x1_g1_tensor16x8x8 Tactic: 0xe0a307ffe0ffb6a5 Time: 0.0168368
[04/25/2026-04:16:04] [TRT] [V] Tactic Name: sm80_xmma_fprop_implicit_gemm_f32f32_tf32f32_f32_nhwckrsc_nchw_tilesize128x128x16_stage4_warpsize2x2x1_g1_tensor16x8x8 Tactic: 0x3104d85fecdd547c Time: 0.0167243
[04/25/2026-04:16:04] [TRT] [V] Tactic Name: sm80_xmma_fprop_implicit_gemm_indexed_f32f32_tf32f32_f32_nhwckrsc_nchw_tilesize128x128x16_stage4_warpsize2x2x1_g1_tensor16x8x8_alignc4 Tactic: 0xe8f7b6a5bab325f8 Time: 0.0179756
[04/25/2026-04:16:04] [TRT] [V] Tactic Name: sm80_xmma_fprop_implicit_gemm_f32f32_tf32f32_f32_nhwckrsc_nchw_tilesize128x128x16_stage4_warpsize2x2x1_g1_tensor16x8x8_alignc4 Tactic: 0x9fd9fe001908ce2e Time: 0.0173333
[04/25/2026-04:16:04] [TRT] [V] node_conv2d + node_relu (CaskConvolution[0x80000009]) profiling completed in 0.0116014 seconds. Fastest Tactic: 0x3104d85fecdd547c Time: 0.0167243
[04/25/2026-04:16:04] [TRT] [V] Skipping CaskFlattenConvolution: No valid tactics for node_conv2d + node_relu
[04/25/2026-04:16:04] [TRT] [V] >>>>>>>>>>>>>>> Chose Runner Type: CaskConvolution Tactic: 0x3104d85fecdd547c
[04/25/2026-04:16:04] [TRT] [V] *************** Autotuning format combination: Float(784,1:4,28,1) -> Float(6272,1:4,224,8) ***************
[04/25/2026-04:16:04] [TRT] [V] --------------- Timing Runner: node_conv2d + node_relu (CaskConvolution[0x80000009])
[04/25/2026-04:16:05] [TRT] [V] Tactic Name: ampere_scudnn_128x32_sliced1x4_ldg4_relu_exp_small_nhwc_tn_v1 Tactic: 0x3e2b881168d9689d Time: 0.0256297
[04/25/2026-04:16:05] [TRT] [V] Tactic Name: ampere_scudnn_128x128_ldg4_relu_exp_medium_nhwc_tn_v1 Tactic: 0x7bc32c782b800c48 Time: 0.0224064
[04/25/2026-04:16:05] [TRT] [V] Tactic Name: sm80_xmma_fprop_implicit_gemm_f32f32_tf32f32_f32_nhwckrsc_nhwc_tilesize128x128x16_stage4_warpsize2x2x1_g1_tensor16x8x8 Tactic: 0xb443c221fcb1565b Time: 0.0153222
[04/25/2026-04:16:05] [TRT] [V] Tactic Name: sm80_xmma_fprop_implicit_gemm_indexed_f32f32_tf32f32_f32_nhwckrsc_nhwc_tilesize128x128x16_stage4_warpsize2x2x1_g1_tensor16x8x8 Tactic: 0x65e41d81f093b482 Time: 0.0160721
[04/25/2026-04:16:05] [TRT] [V] Tactic Name: sm80_xmma_fprop_implicit_gemm_indexed_wo_smem_f32f32_tf32f32_f32_nhwckrsc_nhwc_tilesize128x32x16_stage1_warpsize4x1x1_g1_tensor16x8x8_aligna8_alignc4 Tactic: 0xf78ec258f27b3e23 Time: 0.00785042
[04/25/2026-04:16:05] [TRT] [V] Tactic Name: sm80_xmma_fprop_implicit_gemm_indexed_wo_smem_f32f32_tf32f32_f32_nhwckrsc_nhwc_tilesize128x32x16_stage1_warpsize4x1x1_g1_tensor16x8x8_aligna4_alignc8 Tactic: 0x7e40882e33c8fbf1 Time: 0.00667968
[04/25/2026-04:16:05] [TRT] [V] Tactic Name: sm80_xmma_fprop_implicit_gemm_indexed_wo_smem_f32f32_tf32f32_f32_nhwckrsc_nhwc_tilesize128x16x32_stage1_warpsize4x1x1_g1_tensor16x8x8_aligna8_alignc8 Tactic: 0x4640eb34c8ecc700 Time: 0.00750246
[04/25/2026-04:16:05] [TRT] [V] Tactic Name: sm80_xmma_fprop_implicit_gemm_indexed_wo_smem_f32f32_tf32f32_f32_nhwckrsc_nhwc_tilesize128x16x32_stage1_warpsize4x1x1_g1_tensor16x8x8_aligna4 Tactic: 0xb3e5ce9d1b1da232 Time: 0.00752332
[04/25/2026-04:16:05] [TRT] [V] Tactic Name: sm80_xmma_fprop_implicit_gemm_indexed_wo_smem_f32f32_tf32f32_f32_nhwckrsc_nhwc_tilesize128x16x64_stage1_warpsize4x1x1_g1_tensor16x8x8 Tactic: 0x10383a0781d24dde Time: 0.00417453
[04/25/2026-04:16:05] [TRT] [V] Tactic Name: sm80_xmma_fprop_implicit_gemm_indexed_wo_smem_f32f32_tf32f32_f32_nhwckrsc_nhwc_tilesize128x16x64_stage1_warpsize4x1x1_g1_tensor16x8x8_alignc8 Tactic: 0x4037b478ce77e422 Time: 0.00509155
[04/25/2026-04:16:05] [TRT] [V] Tactic Name: sm80_xmma_fprop_implicit_gemm_indexed_wo_smem_f32f32_tf32f32_f32_nhwckrsc_nhwc_tilesize128x32x64_stage1_warpsize4x1x1_g1_tensor16x8x8_alignc8 Tactic: 0x3a8712b17741b582 Time: 0.00513411
[04/25/2026-04:16:05] [TRT] [V] Tactic Name: sm80_xmma_fprop_implicit_gemm_indexed_wo_smem_f32f32_tf32f32_f32_nhwckrsc_nhwc_tilesize128x32x64_stage1_warpsize4x1x1_g1_tensor16x8x8_alignc4 Tactic: 0xb6f6563c77d057d7 Time: 0.00560249
[04/25/2026-04:16:05] [TRT] [V] Tactic Name: sm80_xmma_fprop_implicit_gemm_indexed_wo_smem_f32f32_tf32f32_f32_nhwckrsc_nhwc_tilesize128x32x64_stage1_warpsize4x1x1_g1_tensor16x8x8_aligna8 Tactic: 0x9355e195cee05798 Time: 0.00580837
[04/25/2026-04:16:05] [TRT] [V] Tactic Name: sm80_xmma_fprop_implicit_gemm_indexed_wo_smem_f32f32_tf32f32_f32_nhwckrsc_nhwc_tilesize128x32x64_stage1_warpsize4x1x1_g1_tensor16x8x8_aligna4_alignc8 Tactic: 0x1acd4f006848c62b Time: 0.00760897
[04/25/2026-04:16:05] [TRT] [V] Tactic Name: sm80_xmma_fprop_implicit_gemm_indexed_wo_smem_f32f32_tf32f32_f32_nhwckrsc_nhwc_tilesize128x16x64_stage1_warpsize4x1x1_g1_tensor16x8x8_alignc4 Tactic: 0xcc46f0f5cee60677 Time: 0.0046397
[04/25/2026-04:16:05] [TRT] [V] Tactic Name: sm80_xmma_fprop_implicit_gemm_indexed_wo_smem_f32f32_tf32f32_f32_nhwckrsc_nhwc_tilesize128x32x16_stage1_warpsize4x1x1_g1_tensor16x8x8 Tactic: 0x9cb304e2edbc1221 Time: 0.00588538
[04/25/2026-04:16:05] [TRT] [V] Tactic Name: sm80_xmma_fprop_implicit_gemm_indexed_wo_smem_f32f32_tf32f32_f32_nhwckrsc_nhwc_tilesize128x32x64_stage1_warpsize4x1x1_g1_tensor16x8x8_aligna8_alignc4 Tactic: 0x93030576a9fb03f9 Time: 0.00617679
[04/25/2026-04:16:05] [TRT] [V] Tactic Name: sm80_xmma_fprop_implicit_gemm_indexed_wo_smem_f32f32_tf32f32_f32_nhwckrsc_nhwc_tilesize128x16x32_stage1_warpsize4x1x1_g1_tensor16x8x8_aligna8 Tactic: 0x3f948a101b8c4067 Time: 0.00720885
[04/25/2026-04:16:05] [TRT] [V] Tactic Name: sm80_xmma_fprop_implicit_gemm_indexed_wo_smem_f32f32_tf32f32_f32_nhwckrsc_nhwc_tilesize128x16x32_stage1_warpsize4x1x1_g1_tensor16x8x8_alignc4 Tactic: 0x1a373db9a2bc4028 Time: 0.0065393
[04/25/2026-04:16:05] [TRT] [V] Tactic Name: sm80_xmma_fprop_implicit_gemm_indexed_wo_smem_f32f32_tf32f32_f32_nhwckrsc_nhwc_tilesize128x16x64_stage1_warpsize4x1x1_g1_tensor16x8x8_aligna8_alignc4 Tactic: 0xab0496509b88ebe0 Time: 0.00642031
[04/25/2026-04:16:05] [TRT] [V] Tactic Name: sm80_xmma_fprop_implicit_gemm_indexed_wo_smem_f32f32_tf32f32_f32_nhwckrsc_nhwc_tilesize128x32x64_stage1_warpsize4x1x1_g1_tensor16x8x8 Tactic: 0xb33296dda7141c64 Time: 0.00521367
[04/25/2026-04:16:05] [TRT] [V] Tactic Name: ampere_scudnn_128x128_ldg4_relu_exp_small_nhwc_tn_v1 Tactic: 0xf90060ce8193b811 Time: 0.0205754
[04/25/2026-04:16:05] [TRT] [V] Tactic Name: sm80_xmma_fprop_implicit_gemm_indexed_wo_smem_f32f32_tf32f32_f32_nhwckrsc_nhwc_tilesize128x32x16_stage1_warpsize4x1x1_g1_tensor16x8x8_aligna4 Tactic: 0x570667f2a28165a0 Time: 0.00764048
[04/25/2026-04:16:05] [TRT] [V] Tactic Name: sm80_xmma_fprop_implicit_gemm_indexed_wo_smem_f32f32_tf32f32_f32_nhwckrsc_nhwc_tilesize128x32x16_stage1_warpsize4x1x1_g1_tensor16x8x8_alignc4 Tactic: 0xfed494d61b2087ba Time: 0.00624534
[04/25/2026-04:16:05] [TRT] [V] Tactic Name: sm80_xmma_fprop_implicit_gemm_indexed_wo_smem_f32f32_tf32f32_f32_nhwckrsc_nhwc_tilesize128x32x16_stage1_warpsize4x1x1_g1_tensor16x8x8_aligna8_alignc8 Tactic: 0x7bff86d5f2eadc76 Time: 0.00741238
[04/25/2026-04:16:05] [TRT] [V] Tactic Name: sm80_xmma_fprop_implicit_gemm_f32f32_tf32f32_f32_nhwckrsc_nhwc_tilesize128x128x16_stage4_warpsize2x2x1_g1_tensor16x8x8_t1r5s5 Tactic: 0x94f2b2320bb3fc74 Time: 0.0148063
[04/25/2026-04:16:05] [TRT] [V] Tactic Name: sm80_xmma_fprop_implicit_gemm_indexed_wo_smem_f32f32_tf32f32_f32_nhwckrsc_nhwc_tilesize128x16x32_stage1_warpsize4x1x1_g1_tensor16x8x8_alignc8 Tactic: 0x96467934a22da27d Time: 0.0055026
[04/25/2026-04:16:05] [TRT] [V] Tactic Name: sm80_xmma_fprop_implicit_gemm_indexed_wo_smem_f32f32_tf32f32_f32_nhwckrsc_nhwc_tilesize128x32x16_stage1_warpsize4x1x1_g1_tensor16x8x8_aligna8 Tactic: 0xdb77237fa21087f5 Time: 0.00728023
[04/25/2026-04:16:05] [TRT] [V] Tactic Name: sm80_xmma_fprop_implicit_gemm_indexed_wo_smem_f32f32_tf32f32_f32_nhwckrsc_nhwc_tilesize128x16x64_stage1_warpsize4x1x1_g1_tensor16x8x8_aligna4_alignc8 Tactic: 0x22cadc265a3b2e32 Time: 0.00668416
[04/25/2026-04:16:05] [TRT] [V] Tactic Name: sm80_xmma_fprop_implicit_gemm_indexed_wo_smem_f32f32_tf32f32_f32_nhwckrsc_nhwc_tilesize128x32x16_stage1_warpsize4x1x1_g1_tensor16x8x8_alignc8 Tactic: 0x72a5d05b1bb165ef Time: 0.00584147
[04/25/2026-04:16:05] [TRT] [V] Tactic Name: sm80_xmma_fprop_implicit_gemm_indexed_wo_smem_f32f32_tf32f32_f32_nhwckrsc_nhwc_tilesize128x16x64_stage1_warpsize4x1x1_g1_tensor16x8x8_aligna8 Tactic: 0xe9e5475c77d60638 Time: 0.00617936
[04/25/2026-04:16:05] [TRT] [V] Tactic Name: ampere_scudnn_128x64_sliced1x2_ldg4_relu_exp_large_nhwc_tn_v1 Tactic: 0xbdfdef6b84f7ccc9 Time: 0.0232768
[04/25/2026-04:16:05] [TRT] [V] Tactic Name: sm80_xmma_fprop_implicit_gemm_indexed_wo_smem_f32f32_tf32f32_f32_nhwckrsc_nhwc_tilesize128x16x32_stage1_warpsize4x1x1_g1_tensor16x8x8_aligna4_alignc8 Tactic: 0x43ffe5cf09cee087 Time: 0.00697022
[04/25/2026-04:16:05] [TRT] [V] Tactic Name: sm80_xmma_fprop_implicit_gemm_indexed_wo_smem_f32f32_tf32f32_f32_nhwckrsc_nhwc_tilesize128x16x32_stage1_warpsize4x1x1_g1_tensor16x8x8 Tactic: 0xae48d3ccfe1edfcd Time: 0.00498786
[04/25/2026-04:16:05] [TRT] [V] node_conv2d + node_relu (CaskConvolution[0x80000009]) profiling completed in 0.116358 seconds. Fastest Tactic: 0x10383a0781d24dde Time: 0.00417453
[04/25/2026-04:16:05] [TRT] [V] Skipping CaskFlattenConvolution: No valid tactics for node_conv2d + node_relu
[04/25/2026-04:16:05] [TRT] [V] >>>>>>>>>>>>>>> Chose Runner Type: CaskConvolution Tactic: 0x10383a0781d24dde
[04/25/2026-04:16:05] [TRT] [V] =============== Computing costs for node_max_pool2d
[04/25/2026-04:16:05] [TRT] [V] *************** Autotuning format combination: Float(25088,784,28,1) -> Float(6272,196,14,1) ***************
[04/25/2026-04:16:05] [TRT] [V] --------------- Timing Runner: node_max_pool2d (CaskPooling[0x8000002f])
[04/25/2026-04:16:05] [TRT] [V] Tactic Name: sm50_xmma_pooling_tiled_FP32NCHW_kMAX_tP2_tQ32_tR2_tS2_tU2_tV2_tUnroll6_tThreads256 Tactic: 0x60eceb67eff69444 Time: 0.00242319
[04/25/2026-04:16:05] [TRT] [V] Tactic Name: sm50_xmma_pooling_tiled_FP32NCHW_kMAX_tP2_tQ32_tR2_tS2_tU2_tV2_tUnroll1_tThreads256 Tactic: 0xc7d8c563bd6ced88 Time: 0.00241971
[04/25/2026-04:16:05] [TRT] [V] Tactic Name: sm50_xmma_pooling_nd_NCDHW_kMAX_kGENERIC_3D_POOLING_MODE_kFLOAT_0 Tactic: 0x5faf4a0a8a5670ed Time: 0.0034141
[04/25/2026-04:16:05] [TRT] [V] Tactic Name: sm50_xmma_pooling_tiled_FP32NCHW_kMAX_tP2_tQ16_tR2_tS2_tU2_tV2_tUnroll6_tThreads128 Tactic: 0xf4b20242f8c135e7 Time: 0.00238773
[04/25/2026-04:16:05] [TRT] [V] Tactic Name: sm50_xmma_pooling_tiled_FP32NCHW_kMAX_tP2_tQ16_tR2_tS2_tU2_tV2_tUnroll2_tThreads128 Tactic: 0xa7a495ee24d0c659 Time: 0.00268117
[04/25/2026-04:16:05] [TRT] [V] Tactic Name: sm50_xmma_pooling_fw_4d_FP32FP32NCHW_Max Tactic: 0xb59f9cfb90407c92 Time: 0.00287006
[04/25/2026-04:16:05] [TRT] [V] Tactic Name: sm50_xmma_pooling_tiled_FP32NCHW_kMAX_tP2_tQ32_tR2_tS2_tU2_tV2_tUnroll8_tThreads256 Tactic: 0xbc5c1844e5cc7959 Time: 0.00254779
[04/25/2026-04:16:05] [TRT] [V] Tactic Name: sm50_xmma_pooling_tiled_FP32NCHW_kMAX_tP2_tQ16_tR2_tS2_tU2_tV2_tUnroll8_tThreads128 Tactic: 0x2802f161f2fbd8fa Time: 0.00256468
[04/25/2026-04:16:05] [TRT] [V] Tactic Name: sm50_xmma_pooling_tiled_FP32NCHW_kMAX_tP2_tQ16_tR2_tS2_tU2_tV2_tUnroll3_tThreads128 Tactic: 0x7a0d6790c453b5f4 Time: 0.00293034
[04/25/2026-04:16:05] [TRT] [V] Tactic Name: sm50_xmma_pooling_tiled_FP32NCHW_kMAX_tP2_tQ16_tR2_tS2_tU2_tV2_tUnroll1_tThreads128 Tactic: 0x53862c46aa5b4c2b Time: 0.00243672
[04/25/2026-04:16:05] [TRT] [V] Tactic Name: sm50_xmma_pooling_tiled_FP32NCHW_kMAX_tP2_tQ16_tR2_tS2_tU2_tV2_tUnroll7_tThreads128 Tactic: 0x291bf03c1842464a Time: 0.00359467
[04/25/2026-04:16:05] [TRT] [V] Tactic Name: sm50_xmma_pooling_tiled_FP32NCHW_kMAX_tP2_tQ32_tR2_tS2_tU2_tV2_tUnroll5_tThreads256 Tactic: 0x94ce52cf617d1e36 Time: 0.00246243
[04/25/2026-04:16:05] [TRT] [V] Tactic Name: sm50_xmma_pooling_tiled_FP32NCHW_kMAX_tP2_tQ32_tR2_tS2_tU2_tV2_tUnroll4_tThreads256 Tactic: 0x4967a0b181fe6d9b Time: 0.00246118
[04/25/2026-04:16:05] [TRT] [V] Tactic Name: sm50_xmma_pooling_tiled_FP32NCHW_kMAX_tP2_tQ16_tR2_tS2_tU2_tV2_tUnroll5_tThreads128 Tactic: 0x0090bbea764abf95 Time: 0.00260817
[04/25/2026-04:16:05] [TRT] [V] Tactic Name: sm50_xmma_pooling_tiled_FP32NCHW_kMAX_tP2_tQ32_tR2_tS2_tU2_tV2_tUnroll7_tThreads256 Tactic: 0xbd4519190f75e7e9 Time: 0.0025034
[04/25/2026-04:16:05] [TRT] [V] Tactic Name: sm50_xmma_pooling_tiled_FP32NCHW_kMAX_tP2_tQ32_tR2_tS2_tU2_tV2_tUnroll2_tThreads256 Tactic: 0x33fa7ccb33e767fa Time: 0.00242868
[04/25/2026-04:16:05] [TRT] [V] Tactic Name: sm50_xmma_pooling_tiled_FP32NCHW_kMAX_tP2_tQ32_tR2_tS2_tU2_tV2_tUnroll3_tThreads256 Tactic: 0xee538eb5d3641457 Time: 0.00245537
[04/25/2026-04:16:05] [TRT] [V] Tactic Name: sm50_xmma_pooling_tiled_FP32NCHW_kMAX_tP2_tQ16_tR2_tS2_tU2_tV2_tUnroll4_tThreads128 Tactic: 0xdd39499496c9cc38 Time: 0.002445
[04/25/2026-04:16:05] [TRT] [V] node_max_pool2d (CaskPooling[0x8000002f]) profiling completed in 0.0603958 seconds. Fastest Tactic: 0xf4b20242f8c135e7 Time: 0.00238773
[04/25/2026-04:16:05] [TRT] [V] >>>>>>>>>>>>>>> Chose Runner Type: CaskPooling Tactic: 0xf4b20242f8c135e7
[04/25/2026-04:16:05] [TRT] [V] *************** Autotuning format combination: Float(6272,1:4,224,8) -> Float(1568,1:4,112,8) ***************
[04/25/2026-04:16:05] [TRT] [V] --------------- Timing Runner: node_max_pool2d (CaskPooling[0x8000002f])
[04/25/2026-04:16:05] [TRT] [V] Tactic Name: sm50_xmma_pooling_max_nhwc_FP32FP32_WINDOWSIZE_0_PROPAGATE_NAN_2D Tactic: 0x8382d5c464539e87 Time: 0.00294447
[04/25/2026-04:16:05] [TRT] [V] Tactic Name: sm50_xmma_pooling_max_nhwc_FP32FP32_WINDOWSIZE_0_NOT_PROPAGATE_NAN_2D Tactic: 0xaec8628e8180bced Time: 0.00310766
[04/25/2026-04:16:05] [TRT] [V] Tactic Name: sm50_xmma_pooling_max_nhwc_FP32FP32_WINDOWSIZE_0_PROPAGATE_NAN_3D Tactic: 0xd76bac5638836f8a Time: 0.0031378
[04/25/2026-04:16:05] [TRT] [V] Tactic Name: sm50_xmma_pooling_max_nhwc_FP32FP32_WINDOWSIZE_0_NOT_PROPAGATE_NAN_3D Tactic: 0xfa211b1cdd504de0 Time: 0.00317999
[04/25/2026-04:16:05] [TRT] [V] Tactic Name: sm50_xmma_pooling_fw_4d_FP32FP32NHWC_Max_CAlign4 Tactic: 0x22fb1bb4a70e340d Time: 0.00404729
[04/25/2026-04:16:05] [TRT] [V] node_max_pool2d (CaskPooling[0x8000002f]) profiling completed in 0.0146224 seconds. Fastest Tactic: 0x8382d5c464539e87 Time: 0.00294447
[04/25/2026-04:16:05] [TRT] [V] >>>>>>>>>>>>>>> Chose Runner Type: CaskPooling Tactic: 0x8382d5c464539e87
[04/25/2026-04:16:05] [TRT] [V] =============== Computing costs for node_conv2d_1 + node_relu_1
[04/25/2026-04:16:05] [TRT] [V] *************** Autotuning format combination: Float(6272,196,14,1) -> Float(12544,196,14,1) ***************
[04/25/2026-04:16:05] [TRT] [V] --------------- Timing Runner: node_conv2d_1 + node_relu_1 (CaskConvolution[0x80000009])
[04/25/2026-04:16:05] [TRT] [V] Tactic Name: ampere_scudnn_128x128_relu_medium_nn_v1 Tactic: 0xf067e6205da31c2e Time: 0.0749568
[04/25/2026-04:16:05] [TRT] [V] Tactic Name: ampere_scudnn_128x32_relu_small_nn_v1 Tactic: 0xa8609adc4e0ceb90 Time: 0.0667264
[04/25/2026-04:16:05] [TRT] [V] Tactic Name: ampere_scudnn_128x64_relu_medium_nn_v1 Tactic: 0xf64396b97c889179 Time: 0.0701205
[04/25/2026-04:16:05] [TRT] [V] Tactic Name: sm70_xmma_fprop_implicit_gemm_f32f32_f32f32_f32_nchwkcrs_nchw_tilesize64x64x8_stage1_warpsize1x4x1_g1_ffma_aligna4_alignc4 Tactic: 0xe40b38338a3a7d7e Time: 0.0266732
[04/25/2026-04:16:05] [TRT] [V] Tactic Name: sm70_xmma_fprop_implicit_gemm_f32f32_f32f32_f32_nchwkcrs_nchw_tilesize32x32x8_stage1_warpsize1x2x1_g1_ffma_aligna4_alignc4 Tactic: 0xf7a98be0a08d77c4 Time: 0.0243924
[04/25/2026-04:16:05] [TRT] [V] Tactic Name: sm70_xmma_fprop_implicit_gemm_f32f32_f32f32_f32_nchwkcrs_nchw_tilesize64x128x8_stage1_warpsize1x4x1_g1_ffma_aligna4_alignc4 Tactic: 0xd1338f4b38d341e2 Time: 0.0360139
[04/25/2026-04:16:05] [TRT] [V] Tactic Name: sm80_xmma_fprop_implicit_gemm_f32f32_f32f32_f32_nchwkcrs_nchw_tilesize64x128x8_stage3_warpsize1x4x1_g1_ffma_aligna4_alignc4 Tactic: 0x5aa723e0481da855 Time: 0.0387591
[04/25/2026-04:16:05] [TRT] [V] Tactic Name: sm80_xmma_fprop_implicit_gemm_f32f32_f32f32_f32_nchwkcrs_nchw_tilesize256x128x8_stage3_warpsize4x2x1_g1_ffma_aligna4_alignc4 Tactic: 0xbb8c3889c7eacd30 Time: 0.114347
[04/25/2026-04:16:05] [TRT] [V] Tactic Name: sm70_xmma_fprop_implicit_gemm_indexed_f32f32_f32f32_f32_nchwkcrs_nchw_tilesize128x16x8_stage1_warpsize4x1x1_g1_ffma_aligna4_alignc4 Tactic: 0x65d82d184f452332 Time: 0.042616
[04/25/2026-04:16:05] [TRT] [V] Tactic Name: sm70_xmma_fprop_implicit_gemm_indexed_f32f32_f32f32_f32_nchwkcrs_nchw_tilesize32x32x8_stage1_warpsize1x2x1_g1_ffma_aligna4_alignc4 Tactic: 0x9efed776051c0873 Time: 0.0383704
[04/25/2026-04:16:05] [TRT] [V] Tactic Name: sm70_xmma_fprop_implicit_gemm_indexed_f32f32_f32f32_f32_nchwkcrs_nchw_tilesize128x32x8_stage1_warpsize2x2x1_g1_ffma_aligna4_alignc4 Tactic: 0x8c4f6360145d6a1f Time: 0.0462867
[04/25/2026-04:16:05] [TRT] [V] Tactic Name: sm70_xmma_fprop_implicit_gemm_indexed_f32f32_f32f32_f32_nchwkcrs_nchw_tilesize64x64x8_stage1_warpsize1x4x1_g1_ffma_aligna4_alignc4 Tactic: 0x8d5c64a52fab02c9 Time: 0.033121
[04/25/2026-04:16:05] [TRT] [V] Tactic Name: sm80_xmma_fprop_implicit_gemm_indexed_f32f32_f32f32_f32_nchwkcrs_nchw_tilesize128x64x8_stage2_warpsize4x1x1_g1_ffma_aligna4_alignc4_beta0_packed_stride Tactic: 0x1673e3594ce11cea Time: 0.0552716
[04/25/2026-04:16:05] [TRT] [V] Tactic Name: sm80_xmma_fprop_implicit_gemm_indexed_f32f32_f32f32_f32_nchwkcrs_nchw_tilesize128x16x8_stage3_warpsize4x1x1_g1_ffma_aligna4_alignc4 Tactic: 0x40a12e3938221818 Time: 0.0382459
[04/25/2026-04:16:05] [TRT] [V] Tactic Name: sm80_xmma_fprop_implicit_gemm_indexed_f32f32_f32f32_f32_nchwkcrs_nchw_tilesize128x32x8_stage3_warpsize2x2x1_g1_ffma_aligna4_alignc4 Tactic: 0xa9366041633a5135 Time: 0.042676
[04/25/2026-04:16:05] [TRT] [V] Tactic Name: sm80_xmma_fprop_implicit_gemm_f32f32_f32f32_f32_nchwkcrs_nchw_tilesize32x32x8_stage3_warpsize1x2x1_g1_ffma_t1r5s5_aligna4_alignc4 Tactic: 0x5b8bf1b8028629d9 Time: 0.0188753
[04/25/2026-04:16:05] [TRT] [V] Tactic Name: sm70_xmma_fprop_implicit_gemm_f32f32_f32f32_f32_nchwkcrs_nchw_tilesize32x32x8_stage1_warpsize1x2x1_g1_ffma_t1r5s5_aligna4_alignc4 Tactic: 0x7e1e4d26cfa285f9 Time: 0.0290356
[04/25/2026-04:16:05] [TRT] [V] Tactic Name: ampere_scudnn_128x64_relu_small_nn_v1 Tactic: 0x3f243c490d502deb Time: 0.0522133
[04/25/2026-04:16:05] [TRT] [V] Tactic Name: sm50_xmma_conv_fprop_fused_conv_act_fp32_NCHW_fp32_NCHW_KCRS_fp32_fp32_fp32_Accfloat_1_1_cC1_dC1_srcVec1_fltVec1_1_TP4_TQ6_C8_R5_S5_U1_V1 Tactic: 0x8cd18f46ddf66c98 Time: 0.0091765
[04/25/2026-04:16:05] [TRT] [V] Tactic Name: sm50_xmma_conv_fprop_fused_conv_act_fp32_NCHW_fp32_NCHW_KCRS_fp32_fp32_fp32_Accfloat_1_1_cC1_dC1_srcVec1_fltVec1_1_TP4_TQ5_C4_R5_S5_U1_V1 Tactic: 0xcbd4e520488129f3 Time: 0.0124721
[04/25/2026-04:16:05] [TRT] [V] Tactic Name: sm50_xmma_conv_fprop_fused_conv_act_fp32_NCHW_fp32_NCHW_KCRS_fp32_fp32_fp32_Accfloat_1_1_cC1_dC1_srcVec1_fltVec2_2_TP4_TQ3_C8_R5_S5_U1_V1 Tactic: 0x9025a4d7b7b308e8 Time: 0.00907589
[04/25/2026-04:16:05] [TRT] [V] Tactic Name: sm70_xmma_fprop_implicit_gemm_f32f32_f32f32_f32_nchwkcrs_nchw_tilesize128x16x8_stage1_warpsize4x1x1_g1_ffma_aligna4_alignc4 Tactic: 0x160b77f4a95ab6d3 Time: 0.0331365
[04/25/2026-04:16:05] [TRT] [V] Tactic Name: sm70_xmma_fprop_implicit_gemm_f32f32_f32f32_f32_nchwkcrs_nchw_tilesize128x64x8_stage1_warpsize2x2x1_g1_ffma_aligna4_alignc4 Tactic: 0x994f5b723e2d80da Time: 0.0426227
[04/25/2026-04:16:05] [TRT] [V] Tactic Name: sm50_xmma_conv_fprop_fused_conv_act_fp32_NCHW_fp32_NCHW_KCRS_fp32_fp32_fp32_Accfloat_1_1_cC1_dC1_srcVec1_fltVec1_1_TP3_TQ4_C8_R5_S5_U1_V1 Tactic: 0xf26d5b1bbc7d3ee9 Time: 0.00720022
[04/25/2026-04:16:05] [TRT] [V] Tactic Name: sm80_xmma_fprop_implicit_gemm_f32f32_f32f32_f32_nchwkcrs_nchw_tilesize64x64x8_stage3_warpsize1x4x1_g1_ffma_aligna4_alignc4 Tactic: 0xa31d27de74b895ff Time: 0.0258109
[04/25/2026-04:16:05] [TRT] [V] Tactic Name: sm80_xmma_fprop_implicit_gemm_f32f32_f32f32_f32_nchwkcrs_nchw_tilesize32x32x8_stage3_warpsize1x2x1_g1_ffma_aligna4_alignc4 Tactic: 0xb0bf940d5e0f9f45 Time: 0.019568
[04/25/2026-04:16:05] [TRT] [V] Tactic Name: sm50_xmma_conv_fprop_fused_conv_act_fp32_NCHW_fp32_NCHW_KCRS_fp32_fp32_fp32_Accfloat_1_1_cC1_dC1_srcVec1_fltVec1_1_TP4_TQ4_C8_R5_S5_U1_V1 Tactic: 0xdeb28942e68a07d5 Time: 0.00726864
[04/25/2026-04:16:05] [TRT] [V] Tactic Name: ampere_scudnn_128x64_relu_xregs_large_nn_v1 Tactic: 0x5deb29b7a8e275f7 Time: 0.0608711
[04/25/2026-04:16:05] [TRT] [V] Tactic Name: sm70_xmma_fprop_implicit_gemm_f32f32_f32f32_f32_nchwkcrs_nchw_tilesize64x64x8_stage1_warpsize1x4x1_g1_ffma_t1r5s5_aligna4_alignc4 Tactic: 0xb3ea28771604ad88 Time: 0.0264418
[04/25/2026-04:16:05] [TRT] [V] Tactic Name: sm80_xmma_fprop_implicit_gemm_f32f32_f32f32_f32_nchwkcrs_nchw_tilesize128x16x8_stage3_warpsize4x1x1_g1_ffma_aligna4_alignc4 Tactic: 0x9d9fdb5fd9945f64 Time: 0.0245189
[04/25/2026-04:16:05] [TRT] [V] Tactic Name: sm80_xmma_fprop_implicit_gemm_indexed_f32f32_f32f32_f32_nchwkcrs_nchw_tilesize64x64x8_stage3_warpsize1x4x1_g1_ffma_aligna4_alignc4 Tactic: 0xd828f024626fa982 Time: 0.0311952
[04/25/2026-04:16:05] [TRT] [V] Tactic Name: sm80_xmma_fprop_implicit_gemm_f32f32_f32f32_f32_nchwkcrs_nchw_tilesize128x64x8_stage3_warpsize2x2x1_g1_ffma_aligna4_alignc4 Tactic: 0x12dbf7d94ee3696d Time: 0.0408747
[04/25/2026-04:16:05] [TRT] [V] Tactic Name: sm50_xmma_conv_fprop_fused_conv_act_fp32_NCHW_fp32_NCHW_KCRS_fp32_fp32_fp32_Accfloat_1_1_cC1_dC1_srcVec1_fltVec2_2_TP3_TQ5_C8_R5_S5_U1_V1 Tactic: 0x4a5f7c82a0c08c03 Time: 0.0092601
[04/25/2026-04:16:05] [TRT] [V] Tactic Name: sm80_xmma_fprop_implicit_gemm_f32f32_f32f32_f32_nchwkcrs_nchw_tilesize64x64x8_stage3_warpsize1x4x1_g1_ffma_t1r5s5_aligna4_alignc4 Tactic: 0x967f94e9db2001a8 Time: 0.0242461
[04/25/2026-04:16:05] [TRT] [V] Tactic Name: sm80_xmma_fprop_implicit_gemm_indexed_f32f32_f32f32_f32_nchwkcrs_nchw_tilesize32x32x8_stage3_warpsize1x2x1_g1_ffma_aligna4_alignc4 Tactic: 0xcb8a43f748d8a338 Time: 0.0254316
[04/25/2026-04:16:05] [TRT] [V] Tactic Name: sm70_xmma_fprop_implicit_gemm_f32f32_f32f32_f32_nchwkcrs_nchw_tilesize128x256x8_stage1_warpsize2x4x1_g1_ffma_aligna4_alignc4 Tactic: 0xd2aa21bfe2167c0c Time: 0.111264
[04/25/2026-04:16:05] [TRT] [V] Tactic Name: ampere_scudnn_128x128_relu_small_nn_v1 Tactic: 0x503619c69ae500ff Time: 0.06656
[04/25/2026-04:16:05] [TRT] [V] Tactic Name: sm80_xmma_fprop_implicit_gemm_indexed_f32f32_f32f32_f32_nchwkcrs_nchw_tilesize128x64x8_stage2_warpsize1x4x1_g1_ffma_aligna4_alignc4_beta0_packed_stride Tactic: 0xede36641840ce3d2 Time: 0.0503101
[04/25/2026-04:16:05] [TRT] [V] Tactic Name: sm70_xmma_fprop_implicit_gemm_f32f32_f32f32_f32_nchwkcrs_nchw_tilesize128x128x8_stage1_warpsize2x2x1_g1_ffma_aligna4_alignc4 Tactic: 0xac49795b871b0d29 Time: 0.0667691
[04/25/2026-04:16:05] [TRT] [V] Tactic Name: sm80_xmma_fprop_implicit_gemm_indexed_f32f32_f32f32_f32_nchwkcrs_nchw_tilesize128x64x8_stage2_warpsize2x2x1_g1_ffma_aligna4_alignc4_beta0_packed_stride Tactic: 0x31aa67f57c5aea77 Time: 0.0502034
[04/25/2026-04:16:05] [TRT] [V] node_conv2d_1 + node_relu_1 (CaskConvolution[0x80000009]) profiling completed in 0.101646 seconds. Fastest Tactic: 0xf26d5b1bbc7d3ee9 Time: 0.00720022
[04/25/2026-04:16:05] [TRT] [V] Skipping CaskFlattenConvolution: No valid tactics for node_conv2d_1 + node_relu_1
[04/25/2026-04:16:05] [TRT] [V] >>>>>>>>>>>>>>> Chose Runner Type: CaskConvolution Tactic: 0xf26d5b1bbc7d3ee9
[04/25/2026-04:16:05] [TRT] [V] *************** Autotuning format combination: Float(6272,1,448,32) -> Float(12544,1,896,64) ***************
[04/25/2026-04:16:05] [TRT] [V] --------------- Timing Runner: node_conv2d_1 + node_relu_1 (CaskConvolution[0x80000009])
[04/25/2026-04:16:05] [TRT] [V] Tactic Name: sm70_xmma_fprop_implicit_gemm_f32f32_f32f32_f32_nhwckrsc_nhwc_tilesize64x32x32_stage1_warpsize1x1x1_g1_ffma_t1r5s5_aligna4_alignc4 Tactic: 0x737793996edbf8e2 Time: 0.109571
[04/25/2026-04:16:05] [TRT] [V] Tactic Name: sm80_xmma_fprop_implicit_gemm_f32f32_f32f32_f32_nhwckrsc_nhwc_tilesize64x64x8_stage3_warpsize1x4x1_g1_ffma_t1r5s5_aligna4_alignc4 Tactic: 0x45ff0c3a09b02e78 Time: 0.0241684
[04/25/2026-04:16:05] [TRT] [V] Tactic Name: sm80_xmma_fprop_implicit_gemm_f32f32_f32f32_f32_nhwckrsc_nhwc_tilesize128x64x8_stage3_warpsize2x2x1_g1_ffma_aligna4_alignc4 Tactic: 0x1da91d865428f237 Time: 0.0366528
[04/25/2026-04:16:05] [TRT] [V] Tactic Name: sm70_xmma_fprop_implicit_gemm_indexed_f32f32_f32f32_f32_nhwckrsc_nhwc_tilesize32x32x8_stage1_warpsize1x2x1_g1_ffma_aligna4_alignc4 Tactic: 0x5f60af66e8eb9b51 Time: 0.0305338
[04/25/2026-04:16:05] [TRT] [V] Tactic Name: sm70_xmma_fprop_implicit_gemm_indexed_f32f32_f32f32_f32_nhwckrsc_nhwc_tilesize128x32x8_stage1_warpsize2x2x1_g1_ffma_aligna4_alignc4 Tactic: 0x833d893f0e96f145 Time: 0.0341056
[04/25/2026-04:16:05] [TRT] [V] Tactic Name: sm80_xmma_fprop_implicit_gemm_indexed_wo_smem_f32f32_tf32f32_f32_nhwckrsc_nhwc_tilesize128x32x16_stage1_warpsize4x1x1_g1_tensor16x8x8_aligna4_alignc4 Tactic: 0xf231cca3335919a4 Time: 0.0355328
[04/25/2026-04:16:05] [TRT] [V] Tactic Name: sm70_xmma_fprop_implicit_gemm_f32f32_f32f32_f32_nhwckrsc_nhwc_tilesize64x16x16_stage1_warpsize1x1x1_g1_ffma_t1r5s5_aligna4_alignc4 Tactic: 0x247bb0dcaf6f9760 Time: 0.0299031
[04/25/2026-04:16:05] [TRT] [V] Tactic Name: sm80_xmma_fprop_implicit_gemm_indexed_f32f32_f32f32_f32_nhwckrsc_nhwc_tilesize128x16x8_stage3_warpsize4x1x1_g1_ffma_aligna4_alignc4 Tactic: 0x4fd3c46622e98342 Time: 0.0302098
[04/25/2026-04:16:05] [TRT] [V] Tactic Name: sm80_xmma_fprop_implicit_gemm_indexed_wo_smem_f32f32_tf32f32_f32_nhwckrsc_nhwc_tilesize128x16x32_stage1_warpsize4x1x1_g1_tensor16x8x8_aligna4_alignc4 Tactic: 0xcf8ea142095f02d2 Time: 0.0296951
[04/25/2026-04:16:05] [TRT] [V] Tactic Name: sm80_xmma_fprop_implicit_gemm_f32f32_f32f32_f32_nhwckrsc_nhwc_tilesize32x32x8_stage3_warpsize1x2x1_g1_ffma_t1r5s5_aligna4_alignc4 Tactic: 0x880b696bd0160609 Time: 0.0149969
[04/25/2026-04:16:05] [TRT] [V] Tactic Name: sm70_xmma_fprop_implicit_gemm_f32f32_f32f32_f32_nhwckrsc_nhwc_tilesize128x16x8_stage1_warpsize4x1x1_g1_ffma_aligna4_alignc4 Tactic: 0x19799dabb3912d89 Time: 0.0292747
[04/25/2026-04:16:05] [TRT] [V] Tactic Name: sm70_xmma_fprop_implicit_gemm_f32f32_f32f32_f32_nhwckrsc_nhwc_tilesize64x128x8_stage1_warpsize1x4x1_g1_ffma_aligna4_alignc4 Tactic: 0xde4165142218dab8 Time: 0.0350315
[04/25/2026-04:16:05] [TRT] [V] Tactic Name: sm70_xmma_fprop_implicit_gemm_f32f32_f32f32_f32_nhwckrsc_nhwc_tilesize128x64x8_stage1_warpsize2x2x1_g1_ffma_aligna4_alignc4 Tactic: 0x963db12d24e61b80 Time: 0.0356224
[04/25/2026-04:16:05] [TRT] [V] Tactic Name: sm80_xmma_fprop_implicit_gemm_indexed_f32f32_f32f32_f32_nhwckrsc_nhwc_tilesize128x32x8_stage3_warpsize2x2x1_g1_ffma_aligna4_alignc4 Tactic: 0xa6448a1e79f1ca6f Time: 0.0288169
[04/25/2026-04:16:05] [TRT] [V] Tactic Name: sm80_xmma_fprop_implicit_gemm_f32f32_f32f32_f32_nhwckrsc_nhwc_tilesize128x16x8_stage3_warpsize4x1x1_g1_ffma_t1r5s5_aligna4_alignc4 Tactic: 0xe35d4a4a3b499fe7 Time: 0.0199084
[04/25/2026-04:16:05] [TRT] [V] Tactic Name: sm80_xmma_fprop_implicit_gemm_indexed_f32f32_f32f32_f32_nhwckrsc_nhwc_tilesize64x64x8_stage3_warpsize1x4x1_g1_ffma_aligna4_alignc4 Tactic: 0x19b688348f983aa0 Time: 0.026482
[04/25/2026-04:16:05] [TRT] [V] Tactic Name: sm80_xmma_fprop_implicit_gemm_f32f32_f32f32_f32_nhwckrsc_nhwc_tilesize256x64x8_stage3_warpsize2x2x1_g1_ffma_aligna4_alignc4 Tactic: 0x8014228ec08b4d49 Time: 0.0624818
[04/25/2026-04:16:05] [TRT] [V] Tactic Name: sm70_xmma_fprop_implicit_gemm_f32f32_f32f32_f32_nhwckrsc_nhwc_tilesize128x16x8_stage1_warpsize4x1x1_g1_ffma_t1r5s5_aligna4_alignc4 Tactic: 0x54e3b8c9b1e5f17a Time: 0.0293111
[04/25/2026-04:16:05] [TRT] [V] Tactic Name: sm70_xmma_fprop_implicit_gemm_indexed_f32f32_f32f32_f32_nhwckrsc_nhwc_tilesize128x16x8_stage1_warpsize4x1x1_g1_ffma_aligna4_alignc4 Tactic: 0x6aaac747558eb868 Time: 0.0335445
[04/25/2026-04:16:05] [TRT] [V] Tactic Name: sm70_xmma_fprop_implicit_gemm_f32f32_f32f32_f32_nhwckrsc_nhwc_tilesize32x32x8_stage1_warpsize1x2x1_g1_ffma_aligna4_alignc4 Tactic: 0x3637f3f04d7ae4e6 Time: 0.0300596
[04/25/2026-04:16:05] [TRT] [V] Tactic Name: sm70_xmma_fprop_implicit_gemm_f32f32_f32f32_f32_nhwckrsc_nhwc_tilesize64x32x32_stage1_warpsize1x1x1_g1_ffma_aligna4_alignc4 Tactic: 0xdb73e25ae4006f74 Time: 0.113436
[04/25/2026-04:16:05] [TRT] [V] Tactic Name: sm70_xmma_fprop_implicit_gemm_f32f32_f32f32_f32_nhwckrsc_nhwc_tilesize64x64x8_stage1_warpsize1x4x1_g1_ffma_aligna4_alignc4 Tactic: 0x2595402367cdee5c Time: 0.0284604
[04/25/2026-04:16:05] [TRT] [V] Tactic Name: sm80_xmma_fprop_implicit_gemm_f32f32_f32f32_f32_nhwckrsc_nhwc_tilesize128x16x8_stage3_warpsize4x1x1_g1_ffma_aligna4_alignc4 Tactic: 0x92ed3100c35fc43e Time: 0.0208447
[04/25/2026-04:16:05] [TRT] [V] Tactic Name: sm80_xmma_fprop_implicit_gemm_f32f32_f32f32_f32_nhwckrsc_nhwc_tilesize64x64x8_stage3_warpsize1x4x1_g1_ffma_aligna4_alignc4 Tactic: 0x62835fce994f06dd Time: 0.024355
[04/25/2026-04:16:05] [TRT] [V] Tactic Name: sm70_xmma_fprop_implicit_gemm_f32f32_f32f32_f32_nhwckrsc_nhwc_tilesize32x32x8_stage1_warpsize1x2x1_g1_ffma_t1r5s5_aligna4_alignc4 Tactic: 0xad9ed5f51d32aa29 Time: 0.0288898
[04/25/2026-04:16:05] [TRT] [V] Tactic Name: sm70_xmma_fprop_implicit_gemm_f32f32_f32f32_f32_nhwckrsc_nhwc_tilesize64x16x16_stage1_warpsize1x1x1_g1_ffma_aligna4_alignc4 Tactic: 0x3f904b355d9ca8e6 Time: 0.0304524
[04/25/2026-04:16:05] [TRT] [V] Tactic Name: sm80_xmma_fprop_implicit_gemm_indexed_f32f32_f32f32_f32_nhwckrsc_nhwc_tilesize32x32x8_stage3_warpsize1x2x1_g1_ffma_aligna4_alignc4 Tactic: 0x0a143be7a52f301a Time: 0.0189499
[04/25/2026-04:16:05] [TRT] [V] Tactic Name: sm80_xmma_fprop_implicit_gemm_f32f32_f32f32_f32_nhwckrsc_nhwc_tilesize32x32x8_stage3_warpsize1x2x1_g1_ffma_aligna4_alignc4 Tactic: 0x7121ec1db3f80c67 Time: 0.0155898
[04/25/2026-04:16:05] [TRT] [V] Tactic Name: sm70_xmma_fprop_implicit_gemm_f32f32_f32f32_f32_nhwckrsc_nhwc_tilesize256x128x8_stage1_warpsize2x4x1_g1_ffma_aligna4_alignc4 Tactic: 0x0447933cc2be855a Time: 0.104021
[04/25/2026-04:16:05] [TRT] [V] node_conv2d_1 + node_relu_1 (CaskConvolution[0x80000009]) profiling completed in 0.0682467 seconds. Fastest Tactic: 0x880b696bd0160609 Time: 0.0149969
[04/25/2026-04:16:05] [TRT] [V] Skipping CaskFlattenConvolution: No valid tactics for node_conv2d_1 + node_relu_1
[04/25/2026-04:16:05] [TRT] [V] >>>>>>>>>>>>>>> Chose Runner Type: CaskConvolution Tactic: 0x880b696bd0160609
[04/25/2026-04:16:05] [TRT] [V] *************** Autotuning format combination: Float(1568,1:4,112,8) -> Float(12544,196,14,1) ***************
[04/25/2026-04:16:05] [TRT] [V] --------------- Timing Runner: node_conv2d_1 + node_relu_1 (CaskConvolution[0x80000009])
[04/25/2026-04:16:05] [TRT] [V] Tactic Name: sm80_xmma_fprop_implicit_gemm_indexed_f32f32_tf32f32_f32_nhwckrsc_nchw_tilesize128x128x16_stage4_warpsize2x2x1_g1_tensor16x8x8_alignc4 Tactic: 0xe8f7b6a5bab325f8 Time: 0.0282453
[04/25/2026-04:16:05] [TRT] [V] Tactic Name: sm80_xmma_fprop_implicit_gemm_f32f32_tf32f32_f32_nhwckrsc_nchw_tilesize128x128x16_stage4_warpsize2x2x1_g1_tensor16x8x8_alignc4 Tactic: 0x9fd9fe001908ce2e Time: 0.0264295
[04/25/2026-04:16:05] [TRT] [V] node_conv2d_1 + node_relu_1 (CaskConvolution[0x80000009]) profiling completed in 0.00440894 seconds. Fastest Tactic: 0x9fd9fe001908ce2e Time: 0.0264295
[04/25/2026-04:16:05] [TRT] [V] Skipping CaskFlattenConvolution: No valid tactics for node_conv2d_1 + node_relu_1
[04/25/2026-04:16:05] [TRT] [V] >>>>>>>>>>>>>>> Chose Runner Type: CaskConvolution Tactic: 0x9fd9fe001908ce2e
[04/25/2026-04:16:05] [TRT] [V] *************** Autotuning format combination: Float(1568,1:4,112,8) -> Float(3136,1:4,224,16) ***************
[04/25/2026-04:16:05] [TRT] [V] --------------- Timing Runner: node_conv2d_1 + node_relu_1 (CaskConvolution[0x80000009])
[04/25/2026-04:16:05] [TRT] [V] Tactic Name: ampere_scudnn_128x32_sliced1x4_ldg4_relu_exp_small_nhwc_tn_v1 Tactic: 0x3e2b881168d9689d Time: 0.0235108
[04/25/2026-04:16:05] [TRT] [V] Tactic Name: ampere_scudnn_128x128_ldg4_relu_exp_medium_nhwc_tn_v1 Tactic: 0x7bc32c782b800c48 Time: 0.0658773
[04/25/2026-04:16:05] [TRT] [V] Tactic Name: sm80_xmma_fprop_implicit_gemm_f32f32_tf32f32_f32_nhwckrsc_nhwc_tilesize128x128x16_stage4_warpsize2x2x1_g1_tensor16x8x8 Tactic: 0xb443c221fcb1565b Time: 0.0255878
[04/25/2026-04:16:05] [TRT] [V] Tactic Name: sm80_xmma_fprop_implicit_gemm_indexed_f32f32_tf32f32_f32_nhwckrsc_nhwc_tilesize128x128x16_stage4_warpsize2x2x1_g1_tensor16x8x8 Tactic: 0x65e41d81f093b482 Time: 0.0274429
[04/25/2026-04:16:05] [TRT] [V] Tactic Name: sm80_xmma_fprop_implicit_gemm_indexed_wo_smem_f32f32_tf32f32_f32_nhwckrsc_nhwc_tilesize128x32x16_stage1_warpsize4x1x1_g1_tensor16x8x8_aligna8_alignc4 Tactic: 0xf78ec258f27b3e23 Time: 0.0395579
[04/25/2026-04:16:05] [TRT] [V] Tactic Name: sm80_xmma_fprop_implicit_gemm_indexed_wo_smem_f32f32_tf32f32_f32_nhwckrsc_nhwc_tilesize128x32x16_stage1_warpsize4x1x1_g1_tensor16x8x8_aligna4_alignc8 Tactic: 0x7e40882e33c8fbf1 Time: 0.0352725
[04/25/2026-04:16:05] [TRT] [V] Tactic Name: sm80_xmma_fprop_implicit_gemm_indexed_wo_smem_f32f32_tf32f32_f32_nhwckrsc_nhwc_tilesize128x16x32_stage1_warpsize4x1x1_g1_tensor16x8x8_aligna8_alignc8 Tactic: 0x4640eb34c8ecc700 Time: 0.0361195
[04/25/2026-04:16:05] [TRT] [V] Tactic Name: sm80_xmma_fprop_implicit_gemm_indexed_wo_smem_f32f32_tf32f32_f32_nhwckrsc_nhwc_tilesize128x16x32_stage1_warpsize4x1x1_g1_tensor16x8x8_aligna4 Tactic: 0xb3e5ce9d1b1da232 Time: 0.034128
[04/25/2026-04:16:05] [TRT] [V] Tactic Name: sm80_xmma_fprop_implicit_gemm_indexed_wo_smem_f32f32_tf32f32_f32_nhwckrsc_nhwc_tilesize128x16x64_stage1_warpsize4x1x1_g1_tensor16x8x8 Tactic: 0x10383a0781d24dde Time: 0.0109953
[04/25/2026-04:16:05] [TRT] [V] Tactic Name: sm80_xmma_fprop_implicit_gemm_indexed_wo_smem_f32f32_tf32f32_f32_nhwckrsc_nhwc_tilesize128x16x64_stage1_warpsize4x1x1_g1_tensor16x8x8_alignc8 Tactic: 0x4037b478ce77e422 Time: 0.018121
[04/25/2026-04:16:05] [TRT] [V] Tactic Name: sm80_xmma_fprop_implicit_gemm_indexed_wo_smem_f32f32_tf32f32_f32_nhwckrsc_nhwc_tilesize128x32x64_stage1_warpsize4x1x1_g1_tensor16x8x8_alignc8 Tactic: 0x3a8712b17741b582 Time: 0.017392
[04/25/2026-04:16:05] [TRT] [V] Tactic Name: sm80_xmma_fprop_implicit_gemm_indexed_wo_smem_f32f32_tf32f32_f32_nhwckrsc_nhwc_tilesize128x32x64_stage1_warpsize4x1x1_g1_tensor16x8x8_alignc4 Tactic: 0xb6f6563c77d057d7 Time: 0.0178706
[04/25/2026-04:16:05] [TRT] [V] Tactic Name: sm80_xmma_fprop_implicit_gemm_indexed_wo_smem_f32f32_tf32f32_f32_nhwckrsc_nhwc_tilesize128x32x64_stage1_warpsize4x1x1_g1_tensor16x8x8_aligna8 Tactic: 0x9355e195cee05798 Time: 0.0213247
[04/25/2026-04:16:05] [TRT] [V] Tactic Name: sm80_xmma_fprop_implicit_gemm_indexed_wo_smem_f32f32_tf32f32_f32_nhwckrsc_nhwc_tilesize128x32x64_stage1_warpsize4x1x1_g1_tensor16x8x8_aligna4_alignc8 Tactic: 0x1acd4f006848c62b Time: 0.0356405
[04/25/2026-04:16:05] [TRT] [V] Tactic Name: sm80_xmma_fprop_implicit_gemm_indexed_wo_smem_f32f32_tf32f32_f32_nhwckrsc_nhwc_tilesize128x16x64_stage1_warpsize4x1x1_g1_tensor16x8x8_alignc4 Tactic: 0xcc46f0f5cee60677 Time: 0.0113408
[04/25/2026-04:16:05] [TRT] [V] Tactic Name: sm80_xmma_fprop_implicit_gemm_indexed_wo_smem_f32f32_tf32f32_f32_nhwckrsc_nhwc_tilesize128x32x16_stage1_warpsize4x1x1_g1_tensor16x8x8 Tactic: 0x9cb304e2edbc1221 Time: 0.0233266
[04/25/2026-04:16:05] [TRT] [V] Tactic Name: sm80_xmma_fprop_implicit_gemm_indexed_wo_smem_f32f32_tf32f32_f32_nhwckrsc_nhwc_tilesize128x32x64_stage1_warpsize4x1x1_g1_tensor16x8x8_aligna8_alignc4 Tactic: 0x93030576a9fb03f9 Time: 0.0212633
[04/25/2026-04:16:05] [TRT] [V] Tactic Name: sm80_xmma_fprop_implicit_gemm_indexed_wo_smem_f32f32_tf32f32_f32_nhwckrsc_nhwc_tilesize128x16x32_stage1_warpsize4x1x1_g1_tensor16x8x8_aligna8 Tactic: 0x3f948a101b8c4067 Time: 0.0341013
[04/25/2026-04:16:05] [TRT] [V] Tactic Name: sm80_xmma_fprop_implicit_gemm_indexed_wo_smem_f32f32_tf32f32_f32_nhwckrsc_nhwc_tilesize128x16x32_stage1_warpsize4x1x1_g1_tensor16x8x8_alignc4 Tactic: 0x1a373db9a2bc4028 Time: 0.0206557
[04/25/2026-04:16:05] [TRT] [V] Tactic Name: sm80_xmma_fprop_implicit_gemm_indexed_wo_smem_f32f32_tf32f32_f32_nhwckrsc_nhwc_tilesize128x16x64_stage1_warpsize4x1x1_g1_tensor16x8x8_aligna8_alignc4 Tactic: 0xab0496509b88ebe0 Time: 0.0274683
[04/25/2026-04:16:05] [TRT] [V] Tactic Name: sm80_xmma_fprop_implicit_gemm_indexed_wo_smem_f32f32_tf32f32_f32_nhwckrsc_nhwc_tilesize128x32x64_stage1_warpsize4x1x1_g1_tensor16x8x8 Tactic: 0xb33296dda7141c64 Time: 0.0181232
[04/25/2026-04:16:05] [TRT] [V] Tactic Name: ampere_scudnn_128x128_ldg4_relu_exp_small_nhwc_tn_v1 Tactic: 0xf90060ce8193b811 Time: 0.0649102
[04/25/2026-04:16:05] [TRT] [V] Tactic Name: sm80_xmma_fprop_implicit_gemm_indexed_wo_smem_f32f32_tf32f32_f32_nhwckrsc_nhwc_tilesize128x32x16_stage1_warpsize4x1x1_g1_tensor16x8x8_aligna4 Tactic: 0x570667f2a28165a0 Time: 0.0385813
[04/25/2026-04:16:05] [TRT] [V] Tactic Name: sm80_xmma_fprop_implicit_gemm_indexed_wo_smem_f32f32_tf32f32_f32_nhwckrsc_nhwc_tilesize128x32x16_stage1_warpsize4x1x1_g1_tensor16x8x8_alignc4 Tactic: 0xfed494d61b2087ba Time: 0.023552
[04/25/2026-04:16:05] [TRT] [V] Tactic Name: sm80_xmma_fprop_implicit_gemm_indexed_wo_smem_f32f32_tf32f32_f32_nhwckrsc_nhwc_tilesize128x32x16_stage1_warpsize4x1x1_g1_tensor16x8x8_aligna8_alignc8 Tactic: 0x7bff86d5f2eadc76 Time: 0.0375846
[04/25/2026-04:16:05] [TRT] [V] Tactic Name: sm80_xmma_fprop_implicit_gemm_f32f32_tf32f32_f32_nhwckrsc_nhwc_tilesize128x128x16_stage4_warpsize2x2x1_g1_tensor16x8x8_t1r5s5 Tactic: 0x94f2b2320bb3fc74 Time: 0.0247055
[04/25/2026-04:16:05] [TRT] [V] Tactic Name: sm80_xmma_fprop_implicit_gemm_indexed_wo_smem_f32f32_tf32f32_f32_nhwckrsc_nhwc_tilesize128x16x32_stage1_warpsize4x1x1_g1_tensor16x8x8_alignc8 Tactic: 0x96467934a22da27d Time: 0.0204436
[04/25/2026-04:16:05] [TRT] [V] Tactic Name: sm80_xmma_fprop_implicit_gemm_indexed_wo_smem_f32f32_tf32f32_f32_nhwckrsc_nhwc_tilesize128x32x16_stage1_warpsize4x1x1_g1_tensor16x8x8_aligna8 Tactic: 0xdb77237fa21087f5 Time: 0.0364821
[04/25/2026-04:16:05] [TRT] [V] Tactic Name: sm80_xmma_fprop_implicit_gemm_indexed_wo_smem_f32f32_tf32f32_f32_nhwckrsc_nhwc_tilesize128x16x64_stage1_warpsize4x1x1_g1_tensor16x8x8_aligna4_alignc8 Tactic: 0x22cadc265a3b2e32 Time: 0.0283449
[04/25/2026-04:16:05] [TRT] [V] Tactic Name: sm80_xmma_fprop_implicit_gemm_indexed_wo_smem_f32f32_tf32f32_f32_nhwckrsc_nhwc_tilesize128x32x16_stage1_warpsize4x1x1_g1_tensor16x8x8_alignc8 Tactic: 0x72a5d05b1bb165ef Time: 0.0230507
[04/25/2026-04:16:05] [TRT] [V] Tactic Name: sm80_xmma_fprop_implicit_gemm_indexed_wo_smem_f32f32_tf32f32_f32_nhwckrsc_nhwc_tilesize128x16x64_stage1_warpsize4x1x1_g1_tensor16x8x8_aligna8 Tactic: 0xe9e5475c77d60638 Time: 0.0265182
[04/25/2026-04:16:05] [TRT] [V] Tactic Name: ampere_scudnn_128x64_sliced1x2_ldg4_relu_exp_large_nhwc_tn_v1 Tactic: 0xbdfdef6b84f7ccc9 Time: 0.04254
[04/25/2026-04:16:05] [TRT] [V] Tactic Name: sm80_xmma_fprop_implicit_gemm_indexed_wo_smem_f32f32_tf32f32_f32_nhwckrsc_nhwc_tilesize128x16x32_stage1_warpsize4x1x1_g1_tensor16x8x8_aligna4_alignc8 Tactic: 0x43ffe5cf09cee087 Time: 0.0293956
[04/25/2026-04:16:05] [TRT] [V] Tactic Name: sm80_xmma_fprop_implicit_gemm_indexed_wo_smem_f32f32_tf32f32_f32_nhwckrsc_nhwc_tilesize128x16x32_stage1_warpsize4x1x1_g1_tensor16x8x8 Tactic: 0xae48d3ccfe1edfcd Time: 0.0162509
[04/25/2026-04:16:05] [TRT] [V] node_conv2d_1 + node_relu_1 (CaskConvolution[0x80000009]) profiling completed in 0.0839867 seconds. Fastest Tactic: 0x10383a0781d24dde Time: 0.0109953
[04/25/2026-04:16:05] [TRT] [V] Skipping CaskFlattenConvolution: No valid tactics for node_conv2d_1 + node_relu_1
[04/25/2026-04:16:05] [TRT] [V] >>>>>>>>>>>>>>> Chose Runner Type: CaskConvolution Tactic: 0x10383a0781d24dde
[04/25/2026-04:16:05] [TRT] [V] =============== Computing costs for node_max_pool2d_1
[04/25/2026-04:16:05] [TRT] [V] *************** Autotuning format combination: Float(12544,196,14,1) -> Float(3136,49,7,1) ***************
[04/25/2026-04:16:05] [TRT] [V] --------------- Timing Runner: node_max_pool2d_1 (CaskPooling[0x8000002f])
[04/25/2026-04:16:05] [TRT] [V] Tactic Name: sm50_xmma_pooling_tiled_FP32NCHW_kMAX_tP2_tQ32_tR2_tS2_tU2_tV2_tUnroll6_tThreads256 Tactic: 0x60eceb67eff69444 Time: 0.00240545
[04/25/2026-04:16:05] [TRT] [V] Tactic Name: sm50_xmma_pooling_tiled_FP32NCHW_kMAX_tP2_tQ32_tR2_tS2_tU2_tV2_tUnroll1_tThreads256 Tactic: 0xc7d8c563bd6ced88 Time: 0.00238712
[04/25/2026-04:16:05] [TRT] [V] Tactic Name: sm50_xmma_pooling_nd_NCDHW_kMAX_kGENERIC_3D_POOLING_MODE_kFLOAT_0 Tactic: 0x5faf4a0a8a5670ed Time: 0.00276739
[04/25/2026-04:16:05] [TRT] [V] Tactic Name: sm50_xmma_pooling_tiled_FP32NCHW_kMAX_tP2_tQ16_tR2_tS2_tU2_tV2_tUnroll6_tThreads128 Tactic: 0xf4b20242f8c135e7 Time: 0.00245084
[04/25/2026-04:16:05] [TRT] [V] Tactic Name: sm50_xmma_pooling_tiled_FP32NCHW_kMAX_tP2_tQ16_tR2_tS2_tU2_tV2_tUnroll2_tThreads128 Tactic: 0xa7a495ee24d0c659 Time: 0.0030673
[04/25/2026-04:16:05] [TRT] [V] Tactic Name: sm50_xmma_pooling_fw_4d_FP32FP32NCHW_Max Tactic: 0xb59f9cfb90407c92 Time: 0.00277982
[04/25/2026-04:16:05] [TRT] [V] Tactic Name: sm50_xmma_pooling_tiled_FP32NCHW_kMAX_tP2_tQ32_tR2_tS2_tU2_tV2_tUnroll8_tThreads256 Tactic: 0xbc5c1844e5cc7959 Time: 0.00253026
[04/25/2026-04:16:05] [TRT] [V] Tactic Name: sm50_xmma_pooling_tiled_FP32NCHW_kMAX_tP2_tQ16_tR2_tS2_tU2_tV2_tUnroll8_tThreads128 Tactic: 0x2802f161f2fbd8fa Time: 0.00247696
[04/25/2026-04:16:05] [TRT] [V] Tactic Name: sm50_xmma_pooling_tiled_FP32NCHW_kMAX_tP2_tQ16_tR2_tS2_tU2_tV2_tUnroll3_tThreads128 Tactic: 0x7a0d6790c453b5f4 Time: 0.00248486
[04/25/2026-04:16:05] [TRT] [V] Tactic Name: sm50_xmma_pooling_tiled_FP32NCHW_kMAX_tP2_tQ16_tR2_tS2_tU2_tV2_tUnroll1_tThreads128 Tactic: 0x53862c46aa5b4c2b Time: 0.00239787
[04/25/2026-04:16:05] [TRT] [V] Tactic Name: sm50_xmma_pooling_tiled_FP32NCHW_kMAX_tP2_tQ16_tR2_tS2_tU2_tV2_tUnroll7_tThreads128 Tactic: 0x291bf03c1842464a Time: 0.00242543
[04/25/2026-04:16:05] [TRT] [V] Tactic Name: sm50_xmma_pooling_tiled_FP32NCHW_kMAX_tP2_tQ32_tR2_tS2_tU2_tV2_tUnroll5_tThreads256 Tactic: 0x94ce52cf617d1e36 Time: 0.00244368
[04/25/2026-04:16:05] [TRT] [V] Tactic Name: sm50_xmma_pooling_tiled_FP32NCHW_kMAX_tP2_tQ32_tR2_tS2_tU2_tV2_tUnroll4_tThreads256 Tactic: 0x4967a0b181fe6d9b Time: 0.00241205
[04/25/2026-04:16:05] [TRT] [V] Tactic Name: sm50_xmma_pooling_tiled_FP32NCHW_kMAX_tP2_tQ16_tR2_tS2_tU2_tV2_tUnroll5_tThreads128 Tactic: 0x0090bbea764abf95 Time: 0.00247885
[04/25/2026-04:16:05] [TRT] [V] Tactic Name: sm50_xmma_pooling_tiled_FP32NCHW_kMAX_tP2_tQ32_tR2_tS2_tU2_tV2_tUnroll7_tThreads256 Tactic: 0xbd4519190f75e7e9 Time: 0.00283977
[04/25/2026-04:16:05] [TRT] [V] Tactic Name: sm50_xmma_pooling_tiled_FP32NCHW_kMAX_tP2_tQ32_tR2_tS2_tU2_tV2_tUnroll2_tThreads256 Tactic: 0x33fa7ccb33e767fa Time: 0.00237246
[04/25/2026-04:16:05] [TRT] [V] Tactic Name: sm50_xmma_pooling_tiled_FP32NCHW_kMAX_tP2_tQ32_tR2_tS2_tU2_tV2_tUnroll3_tThreads256 Tactic: 0xee538eb5d3641457 Time: 0.00270006
[04/25/2026-04:16:05] [TRT] [V] Tactic Name: sm50_xmma_pooling_tiled_FP32NCHW_kMAX_tP2_tQ16_tR2_tS2_tU2_tV2_tUnroll4_tThreads128 Tactic: 0xdd39499496c9cc38 Time: 0.00236823
[04/25/2026-04:16:05] [TRT] [V] node_max_pool2d_1 (CaskPooling[0x8000002f]) profiling completed in 0.0549818 seconds. Fastest Tactic: 0xdd39499496c9cc38 Time: 0.00236823
[04/25/2026-04:16:05] [TRT] [V] >>>>>>>>>>>>>>> Chose Runner Type: CaskPooling Tactic: 0xdd39499496c9cc38
[04/25/2026-04:16:05] [TRT] [V] *************** Autotuning format combination: Float(3136,1:4,224,16) -> Float(784,1:4,112,16) ***************
[04/25/2026-04:16:05] [TRT] [V] --------------- Timing Runner: node_max_pool2d_1 (CaskPooling[0x8000002f])
[04/25/2026-04:16:05] [TRT] [V] Tactic Name: sm50_xmma_pooling_max_nhwc_FP32FP32_WINDOWSIZE_0_PROPAGATE_NAN_2D Tactic: 0x8382d5c464539e87 Time: 0.00287678
[04/25/2026-04:16:05] [TRT] [V] Tactic Name: sm50_xmma_pooling_max_nhwc_FP32FP32_WINDOWSIZE_0_NOT_PROPAGATE_NAN_2D Tactic: 0xaec8628e8180bced Time: 0.00295335
[04/25/2026-04:16:05] [TRT] [V] Tactic Name: sm50_xmma_pooling_max_nhwc_FP32FP32_WINDOWSIZE_0_PROPAGATE_NAN_3D Tactic: 0xd76bac5638836f8a Time: 0.00290208
[04/25/2026-04:16:05] [TRT] [V] Tactic Name: sm50_xmma_pooling_max_nhwc_FP32FP32_WINDOWSIZE_0_NOT_PROPAGATE_NAN_3D Tactic: 0xfa211b1cdd504de0 Time: 0.00287706
[04/25/2026-04:16:05] [TRT] [V] Tactic Name: sm50_xmma_pooling_fw_4d_FP32FP32NHWC_Max_CAlign4 Tactic: 0x22fb1bb4a70e340d Time: 0.0028039
[04/25/2026-04:16:05] [TRT] [V] node_max_pool2d_1 (CaskPooling[0x8000002f]) profiling completed in 0.0153715 seconds. Fastest Tactic: 0x22fb1bb4a70e340d Time: 0.0028039
[04/25/2026-04:16:05] [TRT] [V] >>>>>>>>>>>>>>> Chose Runner Type: CaskPooling Tactic: 0x22fb1bb4a70e340d
[04/25/2026-04:16:05] [TRT] [V] =============== Computing costs for {ForeignNode[gemm1.weight...ONNXTRT_castHelper_9]}
[04/25/2026-04:16:05] [TRT] [V] ForeignNode {ForeignNode[gemm1.weight...ONNXTRT_castHelper_9]} metadata: [ONNX Layer: node_view][ONNX Layer: node_linear][ONNX Layer: node_relu_2][ONNX Layer: node_linear_1][ONNX Layer: node_softmax][ONNX Layer: node_argmax]
[04/25/2026-04:16:05] [TRT] [V] *************** Autotuning format combination: Float(3136,49,7,1) -> Float(10,1), Int64(1) ***************
[04/25/2026-04:16:05] [TRT] [V] --------------- Timing Runner: {ForeignNode[gemm1.weight...ONNXTRT_castHelper_9]} (Myelin[0x80000023])
[04/25/2026-04:16:05] [TRT] [I] Compiler backend is used during engine build.
[04/25/2026-04:16:07] [TRT] [V]  (foreignNode) Set user's cuda kernel library
[04/25/2026-04:16:07] [TRT] [V]  (foreignNode) Autotuning op node_linear: [ONNX Layer: node_linear][ONNX Layer: node_relu_2]
[04/25/2026-04:16:07] [TRT] [V]  (foreignNode) Sorted table of all evaluated tactics:
[04/25/2026-04:16:07] [TRT] [V]  (foreignNode) tactic_id, cost(in ms), cost/fastest_cost, prediction_correlation, kernel_name, tactic_hash, tunable_parameter
[04/25/2026-04:16:07] [TRT] [V]  (foreignNode)    3, 0.0058368, 1.00000, 0.00000, sm50_xmma_cublas_gemvx_f32f32_f32_f32_tn_n_int32_unit_n_launch_param4x32x32_strided_unit_stride, 0x4b9ef35ad8721,
[04/25/2026-04:16:07] [TRT] [V]  (foreignNode)    2, 0.0059392, 1.01754, 0.00000, sm50_xmma_cublas_gemvx_f32f32_f32_f32_tn_n_int32_unit_n_launch_param8x32x32_strided_unit_stride, 0x38ea0fde9bb4e,
[04/25/2026-04:16:07] [TRT] [V]  (foreignNode)    0, 0.0061440, 1.05263, 0.00000, sm50_xmma_cublas_gemvx_f32f32_f32_f32_tn_n_int32_unit_n_launch_param16x32x32_strided_unit_stride, 0x5c6c62dcbe95d,
[04/25/2026-04:16:07] [TRT] [V]  (foreignNode)    4, 0.0081920, 1.40351, 0.00000, sm50_xmma_cublas_gemvx_f32f32_f32_f32_tn_n_int32_unit_n_launch_param16x8x8_strided_unit_stride, 0x4090907df7451,
[04/25/2026-04:16:07] [TRT] [V]  (foreignNode)   40, 0.0090816, 1.55592, 1.93073, sm80_xmma_gemm_f32f32_tf32f32_f32_tn_n_tilesize32x32x64_stage3_warpsize2x1x2_tensor16x8x8, 0x2e07f9c91191d,
[04/25/2026-04:16:07] [TRT] [V]  (foreignNode)   38, 0.0094208, 1.61404, 1.86121, sm80_xmma_gemm_f32f32_tf32f32_f32_nn_n_tilesize32x32x64_stage3_warpsize2x1x2_tensor16x8x8, 0x4e38d5c9d53cb,
[04/25/2026-04:16:07] [TRT] [V]  (foreignNode)   51, 0.0098304, 1.68421, 1.78646, sm86_xmma_gemm_f32f32_tf32f32_f32_tn_n_tilesize32x32x64_stage6_warpsize2x2x1_tensor16x8x8, 0x30a33b3d54e32,
[04/25/2026-04:16:07] [TRT] [V]  (foreignNode)   36, 0.0099328, 1.70175, 1.76479, sm80_xmma_gemm_f32f32_tf32f32_f32_tn_n_tilesize32x32x64_stage3_warpsize2x1x2_tensor16x8x8, 0x3e452ee032199,
[04/25/2026-04:16:07] [TRT] [V]  (foreignNode)   26, 0.0102400, 1.75439, 1.71103, sm80_xmma_gemm_f32f32_tf32f32_f32_tn_n_tilesize32x32x64_stage3_warpsize2x1x2_tensor16x8x8, 0x44646b7f27b4f,
[04/25/2026-04:16:07] [TRT] [V]  (foreignNode)   50, 0.0102400, 1.75439, 1.71500, sm86_xmma_gemm_f32f32_tf32f32_f32_nn_n_tilesize32x32x64_stage6_warpsize2x2x1_tensor16x8x8, 0x63f3554777b74,
[04/25/2026-04:16:07] [TRT] [V]  (foreignNode)   34, 0.0103424, 1.77193, 1.69490, sm80_xmma_gemm_f32f32_tf32f32_f32_nn_n_tilesize32x32x64_stage3_warpsize2x1x2_tensor16x8x8, 0x306517367d40b,
[04/25/2026-04:16:07] [TRT] [V]  (foreignNode)   32, 0.0105216, 1.80263, 1.66566, sm80_xmma_gemm_f32f32_tf32f32_f32_tn_n_tilesize32x32x64_stage3_warpsize2x1x2_tensor16x8x8, 0x40c75f4db4558,
[04/25/2026-04:16:07] [TRT] [V]  (foreignNode)   43, 0.0106496, 1.82456, 1.64838, sm86_xmma_gemm_f32f32_tf32f32_f32_tn_n_tilesize32x32x64_stage6_warpsize2x2x1_tensor16x8x8, 0x4a298d28f4e14,
[04/25/2026-04:16:07] [TRT] [V]  (foreignNode)   49, 0.0112608, 1.92928, 1.55930, sm86_xmma_gemm_f32f32_tf32f32_f32_tn_n_tilesize32x32x64_stage6_warpsize2x2x1_tensor16x8x8, 0x29b20339dcac8,
[04/25/2026-04:16:07] [TRT] [V]  (foreignNode)   24, 0.0114656, 1.96436, 1.52813, sm80_xmma_gemm_f32f32_tf32f32_f32_nn_n_tilesize32x32x64_stage3_warpsize2x1x2_tensor16x8x8, 0x4336ba3393b55,
[04/25/2026-04:16:07] [TRT] [V]  (foreignNode)   30, 0.0117760, 2.01754, 1.48823, sm80_xmma_gemm_f32f32_tf32f32_f32_nn_n_tilesize32x32x64_stage3_warpsize2x1x2_tensor16x8x8, 0x4270ca2b1b249,
[04/25/2026-04:16:07] [TRT] [V]  (foreignNode)   58, 0.0118688, 2.03344, 1.47998, sm86_xmma_gemm_f32f32_tf32f32_f32_tn_n_tilesize64x32x64_stage4_warpsize2x2x1_tensor16x8x8, 0x67b09b3ba279a,
[04/25/2026-04:16:07] [TRT] [V]  (foreignNode)   42, 0.0118784, 2.03509, 1.47785, sm86_xmma_gemm_f32f32_tf32f32_f32_nn_n_tilesize32x32x64_stage6_warpsize2x2x1_tensor16x8x8, 0x2b08233262b3f,
