cookbook/09-Advance/Sparsity/result.log
[09/13/2022-08:25:37] [TRT] [V] *************** Autotuning Reformat: Float(E0,E0,(# 3 (SHAPE inputT0)),1) where E0=(* (# 2 (SHAPE inputT0)) (# 3 (SHAPE inputT0))) -> Float((* (# 2 (SHAPE inputT0)) (# 3 (SHAPE inputT0))),1,(# 3 (SHAPE inputT0)),1) ***************
[09/13/2022-08:25:37] [TRT] [V] --------------- Timing Runner: Optimizer Reformat(inputT0 -> <out>) (Reformat)
[09/13/2022-08:25:37] [TRT] [V] Tactic: 0x00000000000003e8 Time: 0.00410302
[09/13/2022-08:25:37] [TRT] [V] Tactic: 0x00000000000003ea Time: 0.008492
[09/13/2022-08:25:37] [TRT] [V] Tactic: 0x0000000000000000 Time: 0.0041824
[09/13/2022-08:25:37] [TRT] [V] Fastest Tactic: 0x00000000000003e8 Time: 0.00410302
[09/13/2022-08:25:37] [TRT] [V] *************** Autotuning Reformat: Float(E0,E0,(# 3 (SHAPE inputT0)),1) where E0=(* (# 2 (SHAPE inputT0)) (# 3 (SHAPE inputT0))) -> Float((* (# 2 (SHAPE inputT0)) (# 3 (SHAPE inputT0))),1:4,(# 3 (SHAPE inputT0)),1) ***************
[09/13/2022-08:25:37] [TRT] [V] --------------- Timing Runner: Optimizer Reformat(inputT0 -> <out>) (Reformat)
[09/13/2022-08:25:37] [TRT] [V] Tactic: 0x00000000000003e8 Time: 0.00541626
[09/13/2022-08:25:37] [TRT] [V] Tactic: 0x00000000000003ea Time: 0.00870756
[09/13/2022-08:25:37] [TRT] [V] Tactic: 0x0000000000000000 Time: 0.00539871
[09/13/2022-08:25:37] [TRT] [V] Fastest Tactic: 0x0000000000000000 Time: 0.00539871
[09/13/2022-08:25:37] [TRT] [V] =============== Computing reformatting costs
[09/13/2022-08:25:37] [TRT] [V] *************** Autotuning Reformat: Float((* 256 E0),E0,(# 3 (SHAPE inputT0)),1) where E0=(* (# 2 (SHAPE inputT0)) (# 3 (SHAPE inputT0))) -> Float((* (# 2 (SHAPE inputT0)) E0),1,E0,256) where E0=(* 256 (# 3 (SHAPE inputT0))) ***************
[09/13/2022-08:25:37] [TRT] [V] --------------- Timing Runner: Optimizer Reformat((Unnamed Layer* 0) [Convolution]_output -> <out>) (Reformat)
[09/13/2022-08:25:37] [TRT] [V] Tactic: 0x00000000000003e8 Time: 0.334165
[09/13/2022-08:25:37] [TRT] [V] Tactic: 0x00000000000003ea Time: 0.283477
[09/13/2022-08:25:37] [TRT] [V] Tactic: 0x0000000000000000 Time: 0.335189
[09/13/2022-08:25:37] [TRT] [V] Fastest Tactic: 0x00000000000003ea Time: 0.283477
[09/13/2022-08:25:37] [TRT] [V] *************** Autotuning Reformat: Float((* 256 E0),E0,(# 3 (SHAPE inputT0)),1) where E0=(* (# 2 (SHAPE inputT0)) (# 3 (SHAPE inputT0))) -> Float((* (# 2 (SHAPE inputT0)) E0),1:4,E0,64) where E0=(* 64 (# 3 (SHAPE inputT0))) ***************
[09/13/2022-08:25:37] [TRT] [V] --------------- Timing Runner: Optimizer Reformat((Unnamed Layer* 0) [Convolution]_output -> <out>) (Reformat)
[09/13/2022-08:25:37] [TRT] [V] Tactic: 0x00000000000003e8 Time: 0.336896
[09/13/2022-08:25:37] [TRT] [V] Tactic: 0x00000000000003ea Time: 0.2828
[09/13/2022-08:25:37] [TRT] [V] Tactic: 0x0000000000000000 Time: 0.336896
[09/13/2022-08:25:37] [TRT] [V] Fastest Tactic: 0x00000000000003ea Time: 0.2828
[09/13/2022-08:25:37] [TRT] [V] *************** Autotuning Reformat: Float((* (# 2 (SHAPE inputT0)) E0),1,E0,256) where E0=(* 256 (# 3 (SHAPE inputT0))) -> Float((* 256 E0),E0,(# 3 (SHAPE inputT0)),1) where E0=(* (# 2 (SHAPE inputT0)) (# 3 (SHAPE inputT0))) ***************
[09/13/2022-08:25:37] [TRT] [V] --------------- Timing Runner: Optimizer Reformat((Unnamed Layer* 0) [Convolution]_output -> <out>) (Reformat)
[09/13/2022-08:25:37] [TRT] [V] Tactic: 0x00000000000003e8 Time: 0.365227
[09/13/2022-08:25:37] [TRT] [V] Tactic: 0x00000000000003ea Time: 0.291488
[09/13/2022-08:25:37] [TRT] [V] Tactic: 0x0000000000000000 Time: 0.364885
[09/13/2022-08:25:37] [TRT] [V] Fastest Tactic: 0x00000000000003ea Time: 0.291488
[09/13/2022-08:25:37] [TRT] [V] *************** Autotuning Reformat: Float((* (# 2 (SHAPE inputT0)) E0),1,E0,256) where E0=(* 256 (# 3 (SHAPE inputT0))) -> Float((* (# 2 (SHAPE inputT0)) E0),1:4,E0,64) where E0=(* 64 (# 3 (SHAPE inputT0))) ***************
[09/13/2022-08:25:37] [TRT] [V] --------------- Timing Runner: Optimizer Reformat((Unnamed Layer* 0) [Convolution]_output -> <out>) (Reformat)
[09/13/2022-08:25:37] [TRT] [V] Tactic: 0x00000000000003e8 Time: 0.273237
[09/13/2022-08:25:37] [TRT] [V] Tactic: 0x00000000000003ea Time: 0.283477
[09/13/2022-08:25:37] [TRT] [V] Tactic: 0x0000000000000000 Time: 0.274261
[09/13/2022-08:25:37] [TRT] [V] Fastest Tactic: 0x00000000000003e8 Time: 0.273237
[09/13/2022-08:25:37] [TRT] [V] *************** Autotuning Reformat: Float((* (# 2 (SHAPE inputT0)) E0),1:4,E0,64) where E0=(* 64 (# 3 (SHAPE inputT0))) -> Float((* 256 E0),E0,(# 3 (SHAPE inputT0)),1) where E0=(* (# 2 (SHAPE inputT0)) (# 3 (SHAPE inputT0))) ***************
[09/13/2022-08:25:37] [TRT] [V] --------------- Timing Runner: Optimizer Reformat((Unnamed Layer* 0) [Convolution]_output -> <out>) (Reformat)
[09/13/2022-08:25:37] [TRT] [V] Tactic: 0x00000000000003e8 Time: 0.368981
[09/13/2022-08:25:37] [TRT] [V] Tactic: 0x00000000000003ea Time: 0.290816
[09/13/2022-08:25:37] [TRT] [V] Tactic: 0x0000000000000000 Time: 0.369664
[09/13/2022-08:25:37] [TRT] [V] Fastest Tactic: 0x00000000000003ea Time: 0.290816
[09/13/2022-08:25:37] [TRT] [V] *************** Autotuning Reformat: Float((* (# 2 (SHAPE inputT0)) E0),1:4,E0,64) where E0=(* 64 (# 3 (SHAPE inputT0))) -> Float((* (# 2 (SHAPE inputT0)) E0),1,E0,256) where E0=(* 256 (# 3 (SHAPE inputT0))) ***************
[09/13/2022-08:25:37] [TRT] [V] --------------- Timing Runner: Optimizer Reformat((Unnamed Layer* 0) [Convolution]_output -> <out>) (Reformat)
[09/13/2022-08:25:37] [TRT] [V] Tactic: 0x00000000000003e8 Time: 0.274432
[09/13/2022-08:25:37] [TRT] [V] Tactic: 0x00000000000003ea Time: 0.282965
[09/13/2022-08:25:37] [TRT] [V] Tactic: 0x0000000000000000 Time: 0.271872
[09/13/2022-08:25:37] [TRT] [V] Fastest Tactic: 0x0000000000000000 Time: 0.271872
[09/13/2022-08:25:37] [TRT] [V] =============== Computing reformatting costs
[09/13/2022-08:25:37] [TRT] [V] *************** Autotuning Reformat: Float(E0,E0,(# 3 (SHAPE inputT0)),1) where E0=(* (# 2 (SHAPE inputT0)) (# 3 (SHAPE inputT0))) -> Float((* (# 2 (SHAPE inputT0)) (# 3 (SHAPE inputT0))),1,(# 3 (SHAPE inputT0)),1) ***************
[09/13/2022-08:25:37] [TRT] [V] *************** Autotuning Reformat: Float(E0,E0,(# 3 (SHAPE inputT0)),1) where E0=(* (# 2 (SHAPE inputT0)) (# 3 (SHAPE inputT0))) -> Float((* (# 2 (SHAPE inputT0)) (# 3 (SHAPE inputT0))),1:4,(# 3 (SHAPE inputT0)),1) ***************
[09/13/2022-08:25:37] [TRT] [V] *************** Autotuning Reformat: Float((* (# 2 (SHAPE inputT0)) (# 3 (SHAPE inputT0))),1,(# 3 (SHAPE inputT0)),1) -> Float(E0,E0,(# 3 (SHAPE inputT0)),1) where E0=(* (# 2 (SHAPE inputT0)) (# 3 (SHAPE inputT0))) ***************
[09/13/2022-08:25:37] [TRT] [V] --------------- Timing Runner: Optimizer Reformat((Unnamed Layer* 1) [Convolution]_output -> <out>) (Reformat)
[09/13/2022-08:25:37] [TRT] [V] Tactic: 0x00000000000003e8 Time: 0.0101605
[09/13/2022-08:25:37] [TRT] [V] Tactic: 0x00000000000003ea Time: 0.0258002
[09/13/2022-08:25:37] [TRT] [V] Tactic: 0x0000000000000000 Time: 0.0104557
[09/13/2022-08:25:37] [TRT] [V] Fastest Tactic: 0x00000000000003e8 Time: 0.0101605
[09/13/2022-08:25:37] [TRT] [V] *************** Autotuning Reformat: Float((* (# 2 (SHAPE inputT0)) (# 3 (SHAPE inputT0))),1,(# 3 (SHAPE inputT0)),1) -> Float((* (# 2 (SHAPE inputT0)) (# 3 (SHAPE inputT0))),1:4,(# 3 (SHAPE inputT0)),1) ***************
[09/13/2022-08:25:37] [TRT] [V] --------------- Timing Runner: Optimizer Reformat((Unnamed Layer* 1) [Convolution]_output -> <out>) (Reformat)
[09/13/2022-08:25:37] [TRT] [V] Tactic: 0x00000000000003e8 Time: 0.010069
[09/13/2022-08:25:37] [TRT] [V] Tactic: 0x00000000000003ea Time: 0.0326749
[09/13/2022-08:25:37] [TRT] [V] Tactic: 0x0000000000000000 Time: 0.0105483
[09/13/2022-08:25:37] [TRT] [V] Fastest Tactic: 0x00000000000003e8 Time: 0.010069
[09/13/2022-08:25:37] [TRT] [V] *************** Autotuning Reformat: Float((* (# 2 (SHAPE inputT0)) (# 3 (SHAPE inputT0))),1:4,(# 3 (SHAPE inputT0)),1) -> Float(E0,E0,(# 3 (SHAPE inputT0)),1) where E0=(* (# 2 (SHAPE inputT0)) (# 3 (SHAPE inputT0))) ***************
[09/13/2022-08:25:37] [TRT] [V] --------------- Timing Runner: Optimizer Reformat((Unnamed Layer* 1) [Convolution]_output -> <out>) (Reformat)
[09/13/2022-08:25:37] [TRT] [V] Tactic: 0x00000000000003e8 Time: 0.00974964
[09/13/2022-08:25:37] [TRT] [V] Tactic: 0x00000000000003ea Time: 0.032737
[09/13/2022-08:25:37] [TRT] [V] Tactic: 0x0000000000000000 Time: 0.00872205
[09/13/2022-08:25:37] [TRT] [V] Fastest Tactic: 0x0000000000000000 Time: 0.00872205
[09/13/2022-08:25:37] [TRT] [V] *************** Autotuning Reformat: Float((* (# 2 (SHAPE inputT0)) (# 3 (SHAPE inputT0))),1:4,(# 3 (SHAPE inputT0)),1) -> Float((* (# 2 (SHAPE inputT0)) (# 3 (SHAPE inputT0))),1,(# 3 (SHAPE inputT0)),1) ***************
[09/13/2022-08:25:37] [TRT] [V] --------------- Timing Runner: Optimizer Reformat((Unnamed Layer* 1) [Convolution]_output -> <out>) (Reformat)
[09/13/2022-08:25:37] [TRT] [V] Tactic: 0x00000000000003e8 Time: 0.0085048
[09/13/2022-08:25:37] [TRT] [V] Tactic: 0x00000000000003ea Time: 0.0327981
[09/13/2022-08:25:37] [TRT] [V] Tactic: 0x0000000000000000 Time: 0.00754868
[09/13/2022-08:25:37] [TRT] [V] Fastest Tactic: 0x0000000000000000 Time: 0.00754868
[09/13/2022-08:25:37] [TRT] [V] =============== Computing reformatting costs
[09/13/2022-08:25:37] [TRT] [V] *************** Autotuning Reformat: Float((* 256 E0),E0,(# 3 (SHAPE inputT0)),1) where E0=(* (# 2 (SHAPE inputT0)) (# 3 (SHAPE inputT0))) -> Float((* (# 2 (SHAPE inputT0)) E0),1,E0,256) where E0=(* 256 (# 3 (SHAPE inputT0))) ***************
[09/13/2022-08:25:37] [TRT] [V] *************** Autotuning Reformat: Float((* 256 E0),E0,(# 3 (SHAPE inputT0)),1) where E0=(* (# 2 (SHAPE inputT0)) (# 3 (SHAPE inputT0))) -> Float((* (# 2 (SHAPE inputT0)) E0),1:4,E0,64) where E0=(* 64 (# 3 (SHAPE inputT0))) ***************
[09/13/2022-08:25:37] [TRT] [V] *************** Autotuning Reformat: Float((* (# 2 (SHAPE inputT0)) E0),1,E0,256) where E0=(* 256 (# 3 (SHAPE inputT0))) -> Float((* 256 E0),E0,(# 3 (SHAPE inputT0)),1) where E0=(* (# 2 (SHAPE inputT0)) (# 3 (SHAPE inputT0))) ***************
[09/13/2022-08:25:37] [TRT] [V] *************** Autotuning Reformat: Float((* (# 2 (SHAPE inputT0)) E0),1,E0,256) where E0=(* 256 (# 3 (SHAPE inputT0))) -> Float((* (# 2 (SHAPE inputT0)) E0),1:4,E0,64) where E0=(* 64 (# 3 (SHAPE inputT0))) ***************
[09/13/2022-08:25:37] [TRT] [V] *************** Autotuning Reformat: Float((* (# 2 (SHAPE inputT0)) E0),1:4,E0,64) where E0=(* 64 (# 3 (SHAPE inputT0))) -> Float((* 256 E0),E0,(# 3 (SHAPE inputT0)),1) where E0=(* (# 2 (SHAPE inputT0)) (# 3 (SHAPE inputT0))) ***************
[09/13/2022-08:25:37] [TRT] [V] *************** Autotuning Reformat: Float((* (# 2 (SHAPE inputT0)) E0),1:4,E0,64) where E0=(* 64 (# 3 (SHAPE inputT0))) -> Float((* (# 2 (SHAPE inputT0)) E0),1,E0,256) where E0=(* 256 (# 3 (SHAPE inputT0))) ***************
[09/13/2022-08:25:37] [TRT] [V] =============== Computing reformatting costs
[09/13/2022-08:25:37] [TRT] [V] *************** Autotuning Reformat: Float(E0,E0,(# 3 (SHAPE inputT0)),1) where E0=(* (# 2 (SHAPE inputT0)) (# 3 (SHAPE inputT0))) -> Float((* (# 2 (SHAPE inputT0)) (# 3 (SHAPE inputT0))),1,(# 3 (SHAPE inputT0)),1) ***************
[09/13/2022-08:25:37] [TRT] [V] *************** Autotuning Reformat: Float(E0,E0,(# 3 (SHAPE inputT0)),1) where E0=(* (# 2 (SHAPE inputT0)) (# 3 (SHAPE inputT0))) -> Float((* (# 2 (SHAPE inputT0)) (# 3 (SHAPE inputT0))),1:4,(# 3 (SHAPE inputT0)),1) ***************
[09/13/2022-08:25:37] [TRT] [V] *************** Autotuning Reformat: Float((* (# 2 (SHAPE inputT0)) (# 3 (SHAPE inputT0))),1,(# 3 (SHAPE inputT0)),1) -> Float(E0,E0,(# 3 (SHAPE inputT0)),1) where E0=(* (# 2 (SHAPE inputT0)) (# 3 (SHAPE inputT0))) ***************
[09/13/2022-08:25:37] [TRT] [V] *************** Autotuning Reformat: Float((* (# 2 (SHAPE inputT0)) (# 3 (SHAPE inputT0))),1,(# 3 (SHAPE inputT0)),1) -> Float((* (# 2 (SHAPE inputT0)) (# 3 (SHAPE inputT0))),1:4,(# 3 (SHAPE inputT0)),1) ***************
[09/13/2022-08:25:37] [TRT] [V] *************** Autotuning Reformat: Float((* (# 2 (SHAPE inputT0)) (# 3 (SHAPE inputT0))),1:4,(# 3 (SHAPE inputT0)),1) -> Float(E0,E0,(# 3 (SHAPE inputT0)),1) where E0=(* (# 2 (SHAPE inputT0)) (# 3 (SHAPE inputT0))) ***************
[09/13/2022-08:25:37] [TRT] [V] *************** Autotuning Reformat: Float((* (# 2 (SHAPE inputT0)) (# 3 (SHAPE inputT0))),1:4,(# 3 (SHAPE inputT0)),1) -> Float((* (# 2 (SHAPE inputT0)) (# 3 (SHAPE inputT0))),1,(# 3 (SHAPE inputT0)),1) ***************
[09/13/2022-08:25:37] [TRT] [V] =============== Computing reformatting costs
[09/13/2022-08:25:37] [TRT] [V] *************** Autotuning Reformat: Float((* 256 E0),E0,(# 3 (SHAPE inputT0)),1) where E0=(* (# 2 (SHAPE inputT0)) (# 3 (SHAPE inputT0))) -> Float((* (# 2 (SHAPE inputT0)) E0),1,E0,256) where E0=(* 256 (# 3 (SHAPE inputT0))) ***************
[09/13/2022-08:25:37] [TRT] [V] *************** Autotuning Reformat: Float((* 256 E0),E0,(# 3 (SHAPE inputT0)),1) where E0=(* (# 2 (SHAPE inputT0)) (# 3 (SHAPE inputT0))) -> Float((* (# 2 (SHAPE inputT0)) E0),1:4,E0,64) where E0=(* 64 (# 3 (SHAPE inputT0))) ***************
[09/13/2022-08:25:37] [TRT] [V] *************** Autotuning Reformat: Float((* (# 2 (SHAPE inputT0)) E0),1,E0,256) where E0=(* 256 (# 3 (SHAPE inputT0))) -> Float((* 256 E0),E0,(# 3 (SHAPE inputT0)),1) where E0=(* (# 2 (SHAPE inputT0)) (# 3 (SHAPE inputT0))) ***************
[09/13/2022-08:25:37] [TRT] [V] *************** Autotuning Reformat: Float((* (# 2 (SHAPE inputT0)) E0),1,E0,256) where E0=(* 256 (# 3 (SHAPE inputT0))) -> Float((* (# 2 (SHAPE inputT0)) E0),1:4,E0,64) where E0=(* 64 (# 3 (SHAPE inputT0))) ***************
[09/13/2022-08:25:37] [TRT] [V] *************** Autotuning Reformat: Float((* (# 2 (SHAPE inputT0)) E0),1:4,E0,64) where E0=(* 64 (# 3 (SHAPE inputT0))) -> Float((* 256 E0),E0,(# 3 (SHAPE inputT0)),1) where E0=(* (# 2 (SHAPE inputT0)) (# 3 (SHAPE inputT0))) ***************
[09/13/2022-08:25:37] [TRT] [V] *************** Autotuning Reformat: Float((* (# 2 (SHAPE inputT0)) E0),1:4,E0,64) where E0=(* 64 (# 3 (SHAPE inputT0))) -> Float((* (# 2 (SHAPE inputT0)) E0),1,E0,256) where E0=(* 256 (# 3 (SHAPE inputT0))) ***************
[09/13/2022-08:25:37] [TRT] [V] =============== Computing reformatting costs
[09/13/2022-08:25:37] [TRT] [V] *************** Autotuning Reformat: Float(E0,E0,(# 3 (SHAPE inputT0)),1) where E0=(* (# 2 (SHAPE inputT0)) (# 3 (SHAPE inputT0))) -> Float((* (# 2 (SHAPE inputT0)) (# 3 (SHAPE inputT0))),1,(# 3 (SHAPE inputT0)),1) ***************
[09/13/2022-08:25:37] [TRT] [V] *************** Autotuning Reformat: Float(E0,E0,(# 3 (SHAPE inputT0)),1) where E0=(* (# 2 (SHAPE inputT0)) (# 3 (SHAPE inputT0))) -> Float((* (# 2 (SHAPE inputT0)) (# 3 (SHAPE inputT0))),1:4,(# 3 (SHAPE inputT0)),1) ***************
[09/13/2022-08:25:37] [TRT] [V] *************** Autotuning Reformat: Float((* (# 2 (SHAPE inputT0)) (# 3 (SHAPE inputT0))),1,(# 3 (SHAPE inputT0)),1) -> Float(E0,E0,(# 3 (SHAPE inputT0)),1) where E0=(* (# 2 (SHAPE inputT0)) (# 3 (SHAPE inputT0))) ***************
[09/13/2022-08:25:37] [TRT] [V] *************** Autotuning Reformat: Float((* (# 2 (SHAPE inputT0)) (# 3 (SHAPE inputT0))),1,(# 3 (SHAPE inputT0)),1) -> Float((* (# 2 (SHAPE inputT0)) (# 3 (SHAPE inputT0))),1:4,(# 3 (SHAPE inputT0)),1) ***************
[09/13/2022-08:25:37] [TRT] [V] *************** Autotuning Reformat: Float((* (# 2 (SHAPE inputT0)) (# 3 (SHAPE inputT0))),1:4,(# 3 (SHAPE inputT0)),1) -> Float(E0,E0,(# 3 (SHAPE inputT0)),1) where E0=(* (# 2 (SHAPE inputT0)) (# 3 (SHAPE inputT0))) ***************
[09/13/2022-08:25:37] [TRT] [V] *************** Autotuning Reformat: Float((* (# 2 (SHAPE inputT0)) (# 3 (SHAPE inputT0))),1:4,(# 3 (SHAPE inputT0)),1) -> Float((* (# 2 (SHAPE inputT0)) (# 3 (SHAPE inputT0))),1,(# 3 (SHAPE inputT0)),1) ***************
[09/13/2022-08:25:37] [TRT] [V] =============== Computing reformatting costs
[09/13/2022-08:25:37] [TRT] [V] *************** Autotuning Reformat: Float((* 256 E0),E0,(# 3 (SHAPE inputT0)),1) where E0=(* (# 2 (SHAPE inputT0)) (# 3 (SHAPE inputT0))) -> Float((* (# 2 (SHAPE inputT0)) E0),1,E0,256) where E0=(* 256 (# 3 (SHAPE inputT0))) ***************
[09/13/2022-08:25:37] [TRT] [V] *************** Autotuning Reformat: Float((* 256 E0),E0,(# 3 (SHAPE inputT0)),1) where E0=(* (# 2 (SHAPE inputT0)) (# 3 (SHAPE inputT0))) -> Float((* (# 2 (SHAPE inputT0)) E0),1:4,E0,64) where E0=(* 64 (# 3 (SHAPE inputT0))) ***************
[09/13/2022-08:25:37] [TRT] [V] *************** Autotuning Reformat: Float((* (# 2 (SHAPE inputT0)) E0),1,E0,256) where E0=(* 256 (# 3 (SHAPE inputT0))) -> Float((* 256 E0),E0,(# 3 (SHAPE inputT0)),1) where E0=(* (# 2 (SHAPE inputT0)) (# 3 (SHAPE inputT0))) ***************
[09/13/2022-08:25:37] [TRT] [V] *************** Autotuning Reformat: Float((* (# 2 (SHAPE inputT0)) E0),1,E0,256) where E0=(* 256 (# 3 (SHAPE inputT0))) -> Float((* (# 2 (SHAPE inputT0)) E0),1:4,E0,64) where E0=(* 64 (# 3 (SHAPE inputT0))) ***************
[09/13/2022-08:25:37] [TRT] [V] *************** Autotuning Reformat: Float((* (# 2 (SHAPE inputT0)) E0),1:4,E0,64) where E0=(* 64 (# 3 (SHAPE inputT0))) -> Float((* 256 E0),E0,(# 3 (SHAPE inputT0)),1) where E0=(* (# 2 (SHAPE inputT0)) (# 3 (SHAPE inputT0))) ***************
[09/13/2022-08:25:37] [TRT] [V] *************** Autotuning Reformat: Float((* (# 2 (SHAPE inputT0)) E0),1:4,E0,64) where E0=(* 64 (# 3 (SHAPE inputT0))) -> Float((* (# 2 (SHAPE inputT0)) E0),1,E0,256) where E0=(* 256 (# 3 (SHAPE inputT0))) ***************
[09/13/2022-08:25:37] [TRT] [V] =============== Computing reformatting costs
[09/13/2022-08:25:37] [TRT] [V] *************** Autotuning Reformat: Float(E0,E0,(# 3 (SHAPE inputT0)),1) where E0=(* (# 2 (SHAPE inputT0)) (# 3 (SHAPE inputT0))) -> Float((* (# 2 (SHAPE inputT0)) (# 3 (SHAPE inputT0))),1,(# 3 (SHAPE inputT0)),1) ***************
[09/13/2022-08:25:37] [TRT] [V] *************** Autotuning Reformat: Float(E0,E0,(# 3 (SHAPE inputT0)),1) where E0=(* (# 2 (SHAPE inputT0)) (# 3 (SHAPE inputT0))) -> Float((* (# 2 (SHAPE inputT0)) (# 3 (SHAPE inputT0))),1:4,(# 3 (SHAPE inputT0)),1) ***************
[09/13/2022-08:25:37] [TRT] [V] *************** Autotuning Reformat: Float((* (# 2 (SHAPE inputT0)) (# 3 (SHAPE inputT0))),1,(# 3 (SHAPE inputT0)),1) -> Float(E0,E0,(# 3 (SHAPE inputT0)),1) where E0=(* (# 2 (SHAPE inputT0)) (# 3 (SHAPE inputT0))) ***************
[09/13/2022-08:25:37] [TRT] [V] *************** Autotuning Reformat: Float((* (# 2 (SHAPE inputT0)) (# 3 (SHAPE inputT0))),1,(# 3 (SHAPE inputT0)),1) -> Float((* (# 2 (SHAPE inputT0)) (# 3 (SHAPE inputT0))),1:4,(# 3 (SHAPE inputT0)),1) ***************
[09/13/2022-08:25:37] [TRT] [V] *************** Autotuning Reformat: Float((* (# 2 (SHAPE inputT0)) (# 3 (SHAPE inputT0))),1:4,(# 3 (SHAPE inputT0)),1) -> Float(E0,E0,(# 3 (SHAPE inputT0)),1) where E0=(* (# 2 (SHAPE inputT0)) (# 3 (SHAPE inputT0))) ***************
[09/13/2022-08:25:37] [TRT] [V] *************** Autotuning Reformat: Float((* (# 2 (SHAPE inputT0)) (# 3 (SHAPE inputT0))),1:4,(# 3 (SHAPE inputT0)),1) -> Float((* (# 2 (SHAPE inputT0)) (# 3 (SHAPE inputT0))),1,(# 3 (SHAPE inputT0)),1) ***************
[09/13/2022-08:25:37] [TRT] [V] =============== Computing reformatting costs
[09/13/2022-08:25:37] [TRT] [V] *************** Autotuning Reformat: Float((* 256 E0),E0,(# 3 (SHAPE inputT0)),1) where E0=(* (# 2 (SHAPE inputT0)) (# 3 (SHAPE inputT0))) -> Float((* (# 2 (SHAPE inputT0)) E0),1,E0,256) where E0=(* 256 (# 3 (SHAPE inputT0))) ***************
[09/13/2022-08:25:37] [TRT] [V] *************** Autotuning Reformat: Float((* 256 E0),E0,(# 3 (SHAPE inputT0)),1) where E0=(* (# 2 (SHAPE inputT0)) (# 3 (SHAPE inputT0))) -> Float((* (# 2 (SHAPE inputT0)) E0),1:4,E0,64) where E0=(* 64 (# 3 (SHAPE inputT0))) ***************
[09/13/2022-08:25:37] [TRT] [V] *************** Autotuning Reformat: Float((* (# 2 (SHAPE inputT0)) E0),1,E0,256) where E0=(* 256 (# 3 (SHAPE inputT0))) -> Float((* 256 E0),E0,(# 3 (SHAPE inputT0)),1) where E0=(* (# 2 (SHAPE inputT0)) (# 3 (SHAPE inputT0))) ***************
[09/13/2022-08:25:37] [TRT] [V] *************** Autotuning Reformat: Float((* (# 2 (SHAPE inputT0)) E0),1,E0,256) where E0=(* 256 (# 3 (SHAPE inputT0))) -> Float((* (# 2 (SHAPE inputT0)) E0),1:4,E0,64) where E0=(* 64 (# 3 (SHAPE inputT0))) ***************
[09/13/2022-08:25:37] [TRT] [V] *************** Autotuning Reformat: Float((* (# 2 (SHAPE inputT0)) E0),1:4,E0,64) where E0=(* 64 (# 3 (SHAPE inputT0))) -> Float((* 256 E0),E0,(# 3 (SHAPE inputT0)),1) where E0=(* (# 2 (SHAPE inputT0)) (# 3 (SHAPE inputT0))) ***************
[09/13/2022-08:25:37] [TRT] [V] *************** Autotuning Reformat: Float((* (# 2 (SHAPE inputT0)) E0),1:4,E0,64) where E0=(* 64 (# 3 (SHAPE inputT0))) -> Float((* (# 2 (SHAPE inputT0)) E0),1,E0,256) where E0=(* 256 (# 3 (SHAPE inputT0))) ***************
[09/13/2022-08:25:37] [TRT] [V] =============== Computing reformatting costs
[09/13/2022-08:25:37] [TRT] [V] *************** Autotuning Reformat: Float(E0,E0,(# 3 (SHAPE inputT0)),1) where E0=(* (# 2 (SHAPE inputT0)) (# 3 (SHAPE inputT0))) -> Float((* (# 2 (SHAPE inputT0)) (# 3 (SHAPE inputT0))),1,(# 3 (SHAPE inputT0)),1) ***************
[09/13/2022-08:25:37] [TRT] [V] *************** Autotuning Reformat: Float(E0,E0,(# 3 (SHAPE inputT0)),1) where E0=(* (# 2 (SHAPE inputT0)) (# 3 (SHAPE inputT0))) -> Float((* (# 2 (SHAPE inputT0)) (# 3 (SHAPE inputT0))),1:4,(# 3 (SHAPE inputT0)),1) ***************
[09/13/2022-08:25:37] [TRT] [V] *************** Autotuning Reformat: Float((* (# 2 (SHAPE inputT0)) (# 3 (SHAPE inputT0))),1,(# 3 (SHAPE inputT0)),1) -> Float(E0,E0,(# 3 (SHAPE inputT0)),1) where E0=(* (# 2 (SHAPE inputT0)) (# 3 (SHAPE inputT0))) ***************
[09/13/2022-08:25:37] [TRT] [V] *************** Autotuning Reformat: Float((* (# 2 (SHAPE inputT0)) (# 3 (SHAPE inputT0))),1,(# 3 (SHAPE inputT0)),1) -> Float((* (# 2 (SHAPE inputT0)) (# 3 (SHAPE inputT0))),1:4,(# 3 (SHAPE inputT0)),1) ***************
[09/13/2022-08:25:37] [TRT] [V] *************** Autotuning Reformat: Float((* (# 2 (SHAPE inputT0)) (# 3 (SHAPE inputT0))),1:4,(# 3 (SHAPE inputT0)),1) -> Float(E0,E0,(# 3 (SHAPE inputT0)),1) where E0=(* (# 2 (SHAPE inputT0)) (# 3 (SHAPE inputT0))) ***************
[09/13/2022-08:25:37] [TRT] [V] *************** Autotuning Reformat: Float((* (# 2 (SHAPE inputT0)) (# 3 (SHAPE inputT0))),1:4,(# 3 (SHAPE inputT0)),1) -> Float((* (# 2 (SHAPE inputT0)) (# 3 (SHAPE inputT0))),1,(# 3 (SHAPE inputT0)),1) ***************
[09/13/2022-08:25:37] [TRT] [V] =============== Computing reformatting costs
[09/13/2022-08:25:37] [TRT] [V] *************** Autotuning Reformat: Float((* 256 E0),E0,(# 3 (SHAPE inputT0)),1) where E0=(* (# 2 (SHAPE inputT0)) (# 3 (SHAPE inputT0))) -> Float((* (# 2 (SHAPE inputT0)) E0),1,E0,256) where E0=(* 256 (# 3 (SHAPE inputT0))) ***************
[09/13/2022-08:25:37] [TRT] [V] *************** Autotuning Reformat: Float((* 256 E0),E0,(# 3 (SHAPE inputT0)),1) where E0=(* (# 2 (SHAPE inputT0)) (# 3 (SHAPE inputT0))) -> Float((* (# 2 (SHAPE inputT0)) E0),1:4,E0,64) where E0=(* 64 (# 3 (SHAPE inputT0))) ***************
[09/13/2022-08:25:37] [TRT] [V] *************** Autotuning Reformat: Float((* (# 2 (SHAPE inputT0)) E0),1,E0,256) where E0=(* 256 (# 3 (SHAPE inputT0))) -> Float((* 256 E0),E0,(# 3 (SHAPE inputT0)),1) where E0=(* (# 2 (SHAPE inputT0)) (# 3 (SHAPE inputT0))) ***************
[09/13/2022-08:25:37] [TRT] [V] *************** Autotuning Reformat: Float((* (# 2 (SHAPE inputT0)) E0),1,E0,256) where E0=(* 256 (# 3 (SHAPE inputT0))) -> Float((* (# 2 (SHAPE inputT0)) E0),1:4,E0,64) where E0=(* 64 (# 3 (SHAPE inputT0))) ***************
[09/13/2022-08:25:37] [TRT] [V] *************** Autotuning Reformat: Float((* (# 2 (SHAPE inputT0)) E0),1:4,E0,64) where E0=(* 64 (# 3 (SHAPE inputT0))) -> Float((* 256 E0),E0,(# 3 (SHAPE inputT0)),1) where E0=(* (# 2 (SHAPE inputT0)) (# 3 (SHAPE inputT0))) ***************
[09/13/2022-08:25:37] [TRT] [V] *************** Autotuning Reformat: Float((* (# 2 (SHAPE inputT0)) E0),1:4,E0,64) where E0=(* 64 (# 3 (SHAPE inputT0))) -> Float((* (# 2 (SHAPE inputT0)) E0),1,E0,256) where E0=(* 256 (# 3 (SHAPE inputT0))) ***************
[09/13/2022-08:25:37] [TRT] [V] =============== Computing reformatting costs
[09/13/2022-08:25:37] [TRT] [V] *************** Autotuning Reformat: Float(E0,E0,(# 3 (SHAPE inputT0)),1) where E0=(* (# 2 (SHAPE inputT0)) (# 3 (SHAPE inputT0))) -> Float((* (# 2 (SHAPE inputT0)) (# 3 (SHAPE inputT0))),1,(# 3 (SHAPE inputT0)),1) ***************
[09/13/2022-08:25:37] [TRT] [V] *************** Autotuning Reformat: Float(E0,E0,(# 3 (SHAPE inputT0)),1) where E0=(* (# 2 (SHAPE inputT0)) (# 3 (SHAPE inputT0))) -> Float((* (# 2 (SHAPE inputT0)) (# 3 (SHAPE inputT0))),1:4,(# 3 (SHAPE inputT0)),1) ***************
[09/13/2022-08:25:37] [TRT] [V] *************** Autotuning Reformat: Float((* (# 2 (SHAPE inputT0)) (# 3 (SHAPE inputT0))),1,(# 3 (SHAPE inputT0)),1) -> Float(E0,E0,(# 3 (SHAPE inputT0)),1) where E0=(* (# 2 (SHAPE inputT0)) (# 3 (SHAPE inputT0))) ***************
[09/13/2022-08:25:37] [TRT] [V] *************** Autotuning Reformat: Float((* (# 2 (SHAPE inputT0)) (# 3 (SHAPE inputT0))),1,(# 3 (SHAPE inputT0)),1) -> Float((* (# 2 (SHAPE inputT0)) (# 3 (SHAPE inputT0))),1:4,(# 3 (SHAPE inputT0)),1) ***************
[09/13/2022-08:25:37] [TRT] [V] *************** Autotuning Reformat: Float((* (# 2 (SHAPE inputT0)) (# 3 (SHAPE inputT0))),1:4,(# 3 (SHAPE inputT0)),1) -> Float(E0,E0,(# 3 (SHAPE inputT0)),1) where E0=(* (# 2 (SHAPE inputT0)) (# 3 (SHAPE inputT0))) ***************
[09/13/2022-08:25:37] [TRT] [V] *************** Autotuning Reformat: Float((* (# 2 (SHAPE inputT0)) (# 3 (SHAPE inputT0))),1:4,(# 3 (SHAPE inputT0)),1) -> Float((* (# 2 (SHAPE inputT0)) (# 3 (SHAPE inputT0))),1,(# 3 (SHAPE inputT0)),1) ***************
[09/13/2022-08:25:37] [TRT] [V] =============== Computing reformatting costs
[09/13/2022-08:25:37] [TRT] [V] *************** Autotuning Reformat: Float((* 256 E0),E0,(# 3 (SHAPE inputT0)),1) where E0=(* (# 2 (SHAPE inputT0)) (# 3 (SHAPE inputT0))) -> Float((* (# 2 (SHAPE inputT0)) E0),1,E0,256) where E0=(* 256 (# 3 (SHAPE inputT0))) ***************
[09/13/2022-08:25:37] [TRT] [V] *************** Autotuning Reformat: Float((* 256 E0),E0,(# 3 (SHAPE inputT0)),1) where E0=(* (# 2 (SHAPE inputT0)) (# 3 (SHAPE inputT0))) -> Float((* (# 2 (SHAPE inputT0)) E0),1:4,E0,64) where E0=(* 64 (# 3 (SHAPE inputT0))) ***************
[09/13/2022-08:25:37] [TRT] [V] *************** Autotuning Reformat: Float((* (# 2 (SHAPE inputT0)) E0),1,E0,256) where E0=(* 256 (# 3 (SHAPE inputT0))) -> Float((* 256 E0),E0,(# 3 (SHAPE inputT0)),1) where E0=(* (# 2 (SHAPE inputT0)) (# 3 (SHAPE inputT0))) ***************
[09/13/2022-08:25:37] [TRT] [V] *************** Autotuning Reformat: Float((* (# 2 (SHAPE inputT0)) E0),1,E0,256) where E0=(* 256 (# 3 (SHAPE inputT0))) -> Float((* (# 2 (SHAPE inputT0)) E0),1:4,E0,64) where E0=(* 64 (# 3 (SHAPE inputT0))) ***************
[09/13/2022-08:25:37] [TRT] [V] *************** Autotuning Reformat: Float((* (# 2 (SHAPE inputT0)) E0),1:4,E0,64) where E0=(* 64 (# 3 (SHAPE inputT0))) -> Float((* 256 E0),E0,(# 3 (SHAPE inputT0)),1) where E0=(* (# 2 (SHAPE inputT0)) (# 3 (SHAPE inputT0))) ***************
[09/13/2022-08:25:37] [TRT] [V] *************** Autotuning Reformat: Float((* (# 2 (SHAPE inputT0)) E0),1:4,E0,64) where E0=(* 64 (# 3 (SHAPE inputT0))) -> Float((* (# 2 (SHAPE inputT0)) E0),1,E0,256) where E0=(* 256 (# 3 (SHAPE inputT0))) ***************
[09/13/2022-08:25:37] [TRT] [V] =============== Computing reformatting costs
[09/13/2022-08:25:37] [TRT] [V] *************** Autotuning Reformat: Float(E0,E0,(# 3 (SHAPE inputT0)),1) where E0=(* (# 2 (SHAPE inputT0)) (# 3 (SHAPE inputT0))) -> Float((* (# 2 (SHAPE inputT0)) (# 3 (SHAPE inputT0))),1,(# 3 (SHAPE inputT0)),1) ***************
[09/13/2022-08:25:37] [TRT] [V] *************** Autotuning Reformat: Float(E0,E0,(# 3 (SHAPE inputT0)),1) where E0=(* (# 2 (SHAPE inputT0)) (# 3 (SHAPE inputT0))) -> Float((* (# 2 (SHAPE inputT0)) (# 3 (SHAPE inputT0))),1:4,(# 3 (SHAPE inputT0)),1) ***************
[09/13/2022-08:25:37] [TRT] [V] *************** Autotuning Reformat: Float((* (# 2 (SHAPE inputT0)) (# 3 (SHAPE inputT0))),1,(# 3 (SHAPE inputT0)),1) -> Float(E0,E0,(# 3 (SHAPE inputT0)),1) where E0=(* (# 2 (SHAPE inputT0)) (# 3 (SHAPE inputT0))) ***************
[09/13/2022-08:25:37] [TRT] [V] *************** Autotuning Reformat: Float((* (# 2 (SHAPE inputT0)) (# 3 (SHAPE inputT0))),1,(# 3 (SHAPE inputT0)),1) -> Float((* (# 2 (SHAPE inputT0)) (# 3 (SHAPE inputT0))),1:4,(# 3 (SHAPE inputT0)),1) ***************
[09/13/2022-08:25:37] [TRT] [V] *************** Autotuning Reformat: Float((* (# 2 (SHAPE inputT0)) (# 3 (SHAPE inputT0))),1:4,(# 3 (SHAPE inputT0)),1) -> Float(E0,E0,(# 3 (SHAPE inputT0)),1) where E0=(* (# 2 (SHAPE inputT0)) (# 3 (SHAPE inputT0))) ***************
[09/13/2022-08:25:37] [TRT] [V] *************** Autotuning Reformat: Float((* (# 2 (SHAPE inputT0)) (# 3 (SHAPE inputT0))),1:4,(# 3 (SHAPE inputT0)),1) -> Float((* (# 2 (SHAPE inputT0)) (# 3 (SHAPE inputT0))),1,(# 3 (SHAPE inputT0)),1) ***************
[09/13/2022-08:25:37] [TRT] [V] =============== Computing reformatting costs
[09/13/2022-08:25:37] [TRT] [V] *************** Autotuning Reformat: Float((* 256 E0),E0,(# 3 (SHAPE inputT0)),1) where E0=(* (# 2 (SHAPE inputT0)) (# 3 (SHAPE inputT0))) -> Float((* (# 2 (SHAPE inputT0)) E0),1,E0,256) where E0=(* 256 (# 3 (SHAPE inputT0))) ***************
[09/13/2022-08:25:37] [TRT] [V] *************** Autotuning Reformat: Float((* 256 E0),E0,(# 3 (SHAPE inputT0)),1) where E0=(* (# 2 (SHAPE inputT0)) (# 3 (SHAPE inputT0))) -> Float((* (# 2 (SHAPE inputT0)) E0),1:4,E0,64) where E0=(* 64 (# 3 (SHAPE inputT0))) ***************
[09/13/2022-08:25:37] [TRT] [V] *************** Autotuning Reformat: Float((* (# 2 (SHAPE inputT0)) E0),1,E0,256) where E0=(* 256 (# 3 (SHAPE inputT0))) -> Float((* 256 E0),E0,(# 3 (SHAPE inputT0)),1) where E0=(* (# 2 (SHAPE inputT0)) (# 3 (SHAPE inputT0))) ***************
[09/13/2022-08:25:37] [TRT] [V] *************** Autotuning Reformat: Float((* (# 2 (SHAPE inputT0)) E0),1,E0,256) where E0=(* 256 (# 3 (SHAPE inputT0))) -> Float((* (# 2 (SHAPE inputT0)) E0),1:4,E0,64) where E0=(* 64 (# 3 (SHAPE inputT0))) ***************
[09/13/2022-08:25:37] [TRT] [V] *************** Autotuning Reformat: Float((* (# 2 (SHAPE inputT0)) E0),1:4,E0,64) where E0=(* 64 (# 3 (SHAPE inputT0))) -> Float((* 256 E0),E0,(# 3 (SHAPE inputT0)),1) where E0=(* (# 2 (SHAPE inputT0)) (# 3 (SHAPE inputT0))) ***************
[09/13/2022-08:25:37] [TRT] [V] *************** Autotuning Reformat: Float((* (# 2 (SHAPE inputT0)) E0),1:4,E0,64) where E0=(* 64 (# 3 (SHAPE inputT0))) -> Float((* (# 2 (SHAPE inputT0)) E0),1,E0,256) where E0=(* 256 (# 3 (SHAPE inputT0))) ***************
[09/13/2022-08:25:37] [TRT] [V] =============== Computing reformatting costs
[09/13/2022-08:25:37] [TRT] [V] *************** Autotuning Reformat: Float(E0,E0,(# 3 (SHAPE inputT0)),1) where E0=(* (# 2 (SHAPE inputT0)) (# 3 (SHAPE inputT0))) -> Float((* (# 2 (SHAPE inputT0)) (# 3 (SHAPE inputT0))),1,(# 3 (SHAPE inputT0)),1) ***************
[09/13/2022-08:25:37] [TRT] [V] *************** Autotuning Reformat: Float(E0,E0,(# 3 (SHAPE inputT0)),1) where E0=(* (# 2 (SHAPE inputT0)) (# 3 (SHAPE inputT0))) -> Float((* (# 2 (SHAPE inputT0)) (# 3 (SHAPE inputT0))),1:4,(# 3 (SHAPE inputT0)),1) ***************
[09/13/2022-08:25:37] [TRT] [V] *************** Autotuning Reformat: Float((* (# 2 (SHAPE inputT0)) (# 3 (SHAPE inputT0))),1,(# 3 (SHAPE inputT0)),1) -> Float(E0,E0,(# 3 (SHAPE inputT0)),1) where E0=(* (# 2 (SHAPE inputT0)) (# 3 (SHAPE inputT0))) ***************
[09/13/2022-08:25:37] [TRT] [V] *************** Autotuning Reformat: Float((* (# 2 (SHAPE inputT0)) (# 3 (SHAPE inputT0))),1,(# 3 (SHAPE inputT0)),1) -> Float((* (# 2 (SHAPE inputT0)) (# 3 (SHAPE inputT0))),1:4,(# 3 (SHAPE inputT0)),1) ***************
[09/13/2022-08:25:37] [TRT] [V] *************** Autotuning Reformat: Float((* (# 2 (SHAPE inputT0)) (# 3 (SHAPE inputT0))),1:4,(# 3 (SHAPE inputT0)),1) -> Float(E0,E0,(# 3 (SHAPE inputT0)),1) where E0=(* (# 2 (SHAPE inputT0)) (# 3 (SHAPE inputT0))) ***************
[09/13/2022-08:25:37] [TRT] [V] *************** Autotuning Reformat: Float((* (# 2 (SHAPE inputT0)) (# 3 (SHAPE inputT0))),1:4,(# 3 (SHAPE inputT0)),1) -> Float((* (# 2 (SHAPE inputT0)) (# 3 (SHAPE inputT0))),1,(# 3 (SHAPE inputT0)),1) ***************
[09/13/2022-08:25:37] [TRT] [V] =============== Computing reformatting costs
[09/13/2022-08:25:37] [TRT] [V] *************** Autotuning Reformat: Float((* 256 E0),E0,(# 3 (SHAPE inputT0)),1) where E0=(* (# 2 (SHAPE inputT0)) (# 3 (SHAPE inputT0))) -> Float((* (# 2 (SHAPE inputT0)) E0),1,E0,256) where E0=(* 256 (# 3 (SHAPE inputT0))) ***************
[09/13/2022-08:25:37] [TRT] [V] *************** Autotuning Reformat: Float((* 256 E0),E0,(# 3 (SHAPE inputT0)),1) where E0=(* (# 2 (SHAPE inputT0)) (# 3 (SHAPE inputT0))) -> Float((* (# 2 (SHAPE inputT0)) E0),1:4,E0,64) where E0=(* 64 (# 3 (SHAPE inputT0))) ***************
[09/13/2022-08:25:37] [TRT] [V] *************** Autotuning Reformat: Float((* (# 2 (SHAPE inputT0)) E0),1,E0,256) where E0=(* 256 (# 3 (SHAPE inputT0))) -> Float((* 256 E0),E0,(# 3 (SHAPE inputT0)),1) where E0=(* (# 2 (SHAPE inputT0)) (# 3 (SHAPE inputT0))) ***************
[09/13/2022-08:25:37] [TRT] [V] *************** Autotuning Reformat: Float((* (# 2 (SHAPE inputT0)) E0),1,E0,256) where E0=(* 256 (# 3 (SHAPE inputT0))) -> Float((* (# 2 (SHAPE inputT0)) E0),1:4,E0,64) where E0=(* 64 (# 3 (SHAPE inputT0))) ***************
[09/13/2022-08:25:37] [TRT] [V] *************** Autotuning Reformat: Float((* (# 2 (SHAPE inputT0)) E0),1:4,E0,64) where E0=(* 64 (# 3 (SHAPE inputT0))) -> Float((* 256 E0),E0,(# 3 (SHAPE inputT0)),1) where E0=(* (# 2 (SHAPE inputT0)) (# 3 (SHAPE inputT0))) ***************
[09/13/2022-08:25:37] [TRT] [V] *************** Autotuning Reformat: Float((* (# 2 (SHAPE inputT0)) E0),1:4,E0,64) where E0=(* 64 (# 3 (SHAPE inputT0))) -> Float((* (# 2 (SHAPE inputT0)) E0),1,E0,256) where E0=(* 256 (# 3 (SHAPE inputT0))) ***************
[09/13/2022-08:25:37] [TRT] [V] =============== Computing reformatting costs
[09/13/2022-08:25:37] [TRT] [V] *************** Autotuning Reformat: Float(E0,E0,(# 3 (SHAPE inputT0)),1) where E0=(* (# 2 (SHAPE inputT0)) (# 3 (SHAPE inputT0))) -> Float((* (# 2 (SHAPE inputT0)) (# 3 (SHAPE inputT0))),1,(# 3 (SHAPE inputT0)),1) ***************
[09/13/2022-08:25:37] [TRT] [V] *************** Autotuning Reformat: Float(E0,E0,(# 3 (SHAPE inputT0)),1) where E0=(* (# 2 (SHAPE inputT0)) (# 3 (SHAPE inputT0))) -> Float((* (# 2 (SHAPE inputT0)) (# 3 (SHAPE inputT0))),1:4,(# 3 (SHAPE inputT0)),1) ***************
[09/13/2022-08:25:37] [TRT] [V] *************** Autotuning Reformat: Float((* (# 2 (SHAPE inputT0)) (# 3 (SHAPE inputT0))),1,(# 3 (SHAPE inputT0)),1) -> Float(E0,E0,(# 3 (SHAPE inputT0)),1) where E0=(* (# 2 (SHAPE inputT0)) (# 3 (SHAPE inputT0))) ***************
[09/13/2022-08:25:37] [TRT] [V] *************** Autotuning Reformat: Float((* (# 2 (SHAPE inputT0)) (# 3 (SHAPE inputT0))),1,(# 3 (SHAPE inputT0)),1) -> Float((* (# 2 (SHAPE inputT0)) (# 3 (SHAPE inputT0))),1:4,(# 3 (SHAPE inputT0)),1) ***************
[09/13/2022-08:25:37] [TRT] [V] *************** Autotuning Reformat: Float((* (# 2 (SHAPE inputT0)) (# 3 (SHAPE inputT0))),1:4,(# 3 (SHAPE inputT0)),1) -> Float(E0,E0,(# 3 (SHAPE inputT0)),1) where E0=(* (# 2 (SHAPE inputT0)) (# 3 (SHAPE inputT0))) ***************
[09/13/2022-08:25:37] [TRT] [V] *************** Autotuning Reformat: Float((* (# 2 (SHAPE inputT0)) (# 3 (SHAPE inputT0))),1:4,(# 3 (SHAPE inputT0)),1) -> Float((* (# 2 (SHAPE inputT0)) (# 3 (SHAPE inputT0))),1,(# 3 (SHAPE inputT0)),1) ***************
[09/13/2022-08:25:37] [TRT] [V] =============== Computing reformatting costs
[09/13/2022-08:25:37] [TRT] [V] *************** Autotuning Reformat: Float((* 256 E0),E0,(# 3 (SHAPE inputT0)),1) where E0=(* (# 2 (SHAPE inputT0)) (# 3 (SHAPE inputT0))) -> Float((* (# 2 (SHAPE inputT0)) E0),1,E0,256) where E0=(* 256 (# 3 (SHAPE inputT0))) ***************
[09/13/2022-08:25:37] [TRT] [V] *************** Autotuning Reformat: Float((* 256 E0),E0,(# 3 (SHAPE inputT0)),1) where E0=(* (# 2 (SHAPE inputT0)) (# 3 (SHAPE inputT0))) -> Float((* (# 2 (SHAPE inputT0)) E0),1:4,E0,64) where E0=(* 64 (# 3 (SHAPE inputT0))) ***************
[09/13/2022-08:25:37] [TRT] [V] *************** Autotuning Reformat: Float((* (# 2 (SHAPE inputT0)) E0),1,E0,256) where E0=(* 256 (# 3 (SHAPE inputT0))) -> Float((* 256 E0),E0,(# 3 (SHAPE inputT0)),1) where E0=(* (# 2 (SHAPE inputT0)) (# 3 (SHAPE inputT0))) ***************
[09/13/2022-08:25:37] [TRT] [V] *************** Autotuning Reformat: Float((* (# 2 (SHAPE inputT0)) E0),1,E0,256) where E0=(* 256 (# 3 (SHAPE inputT0))) -> Float((* (# 2 (SHAPE inputT0)) E0),1:4,E0,64) where E0=(* 64 (# 3 (SHAPE inputT0))) ***************
[09/13/2022-08:25:37] [TRT] [V] *************** Autotuning Reformat: Float((* (# 2 (SHAPE inputT0)) E0),1:4,E0,64) where E0=(* 64 (# 3 (SHAPE inputT0))) -> Float((* 256 E0),E0,(# 3 (SHAPE inputT0)),1) where E0=(* (# 2 (SHAPE inputT0)) (# 3 (SHAPE inputT0))) ***************
[09/13/2022-08:25:37] [TRT] [V] *************** Autotuning Reformat: Float((* (# 2 (SHAPE inputT0)) E0),1:4,E0,64) where E0=(* 64 (# 3 (SHAPE inputT0))) -> Float((* (# 2 (SHAPE inputT0)) E0),1,E0,256) where E0=(* 256 (# 3 (SHAPE inputT0))) ***************
[09/13/2022-08:25:37] [TRT] [V] =============== Computing reformatting costs
[09/13/2022-08:25:37] [TRT] [V] *************** Autotuning Reformat: Float((* (# 2 (SHAPE inputT0)) (# 3 (SHAPE inputT0))),1,(# 3 (SHAPE inputT0)),1) -> Float(E0,E0,(# 3 (SHAPE inputT0)),1) where E0=(* (# 2 (SHAPE inputT0)) (# 3 (SHAPE inputT0))) ***************
[09/13/2022-08:25:37] [TRT] [V] --------------- Timing Runner: Optimizer Reformat(<in> -> (Unnamed Layer* 19) [Convolution]_output) (Reformat)
[09/13/2022-08:25:37] [TRT] [V] Tactic: 0x00000000000003e8 Time: 0.006736
[09/13/2022-08:25:37] [TRT] [V] Tactic: 0x00000000000003ea Time: 0.0157605
[09/13/2022-08:25:37] [TRT] [V] Tactic: 0x0000000000000000 Time: 0.00679402
[09/13/2022-08:25:37] [TRT] [V] Fastest Tactic: 0x00000000000003e8 Time: 0.006736
[09/13/2022-08:25:37] [TRT] [V] *************** Autotuning Reformat: Float((* (# 2 (SHAPE inputT0)) (# 3 (SHAPE inputT0))),1:4,(# 3 (SHAPE inputT0)),1) -> Float(E0,E0,(# 3 (SHAPE inputT0)),1) where E0=(* (# 2 (SHAPE inputT0)) (# 3 (SHAPE inputT0))) ***************
[09/13/2022-08:25:37] [TRT] [V] --------------- Timing Runner: Optimizer Reformat(<in> -> (Unnamed Layer* 19) [Convolution]_output) (Reformat)
[09/13/2022-08:25:37] [TRT] [V] Tactic: 0x00000000000003e8 Time: 0.00579697
[09/13/2022-08:25:37] [TRT] [V] Tactic: 0x00000000000003ea Time: 0.032737
[09/13/2022-08:25:37] [TRT] [V] Tactic: 0x0000000000000000 Time: 0.00577343
[09/13/2022-08:25:37] [TRT] [V] Fastest Tactic: 0x0000000000000000 Time: 0.00577343
[09/13/2022-08:25:37] [TRT] [V] =============== Computing costs for 
[09/13/2022-08:25:37] [TRT] [V] *************** Autotuning format combination: Float(E0,E0,(# 3 (SHAPE inputT0)),1) -> Float((* 256 E0),E0,(# 3 (SHAPE inputT0)),1) where E0=(* (# 2 (SHAPE inputT0)) (# 3 (SHAPE inputT0))) ***************
[09/13/2022-08:25:37] [TRT] [V] --------------- Timing Runner: (Unnamed Layer* 0) [Convolution] (CudaDepthwiseConvolution)
[09/13/2022-08:25:37] [TRT] [V] CudaDepthwiseConvolution has no valid tactics for this config, skipping
[09/13/2022-08:25:37] [TRT] [V] --------------- Timing Runner: (Unnamed Layer* 0) [Convolution] (FusedConvActConvolution)
[09/13/2022-08:25:37] [TRT] [V] FusedConvActConvolution has no valid tactics for this config, skipping
[09/13/2022-08:25:37] [TRT] [V] --------------- Timing Runner: (Unnamed Layer* 0) [Convolution] (CudnnConvolution)
[09/13/2022-08:25:39] [TRT] [V] Tactic: 0x0000000000000000 Time: 0.498005
[09/13/2022-08:25:39] [TRT] [V] Tactic: 0x0000000000000001 Time: 0.469333
[09/13/2022-08:25:39] [TRT] [V] Tactic: 0x0000000000000002 Time: 0.638976
[09/13/2022-08:25:39] [TRT] [V] Tactic: 0x0000000000000004 Time: 2.94127
[09/13/2022-08:25:39] [TRT] [V] Tactic: 0x0000000000000005 Time: 1.30901
[09/13/2022-08:25:39] [TRT] [V] Tactic: 0x0000000000000038 Time: 0.498005
[09/13/2022-08:25:39] [TRT] [V] Tactic: 0x0000000000000039 Time: 0.462165
[09/13/2022-08:25:39] [TRT] [V] Tactic: 0x000000000000003a Time: 0.639371
[09/13/2022-08:25:39] [TRT] [V] Tactic: 0x000000000000003c Time: 2.93888
[09/13/2022-08:25:39] [TRT] [V] Tactic: 0x000000000000003d Time: 1.31584
[09/13/2022-08:25:39] [TRT] [V] Tactic: 0x0000000000000070 Time: 0.495957
[09/13/2022-08:25:39] [TRT] [V] Tactic: 0x0000000000000071 Time: 0.467691
[09/13/2022-08:25:39] [TRT] [V] Tactic: 0x0000000000000072 Time: 0.64
[09/13/2022-08:25:39] [TRT] [V] Tactic: 0x0000000000000074 Time: 2.94298
[09/13/2022-08:25:39] [TRT] [V] Tactic: 0x0000000000000075 Time: 1.31004
[09/13/2022-08:25:39] [TRT] [V] Fastest Tactic: 0x0000000000000039 Time: 0.462165
[09/13/2022-08:25:39] [TRT] [V] --------------- Timing Runner: (Unnamed Layer* 0) [Convolution] (CaskConvolution)
[09/13/2022-08:25:39] [TRT] [V] (Unnamed Layer* 0) [Convolution] Set Tactic Name: sm80_xmma_fprop_implicit_gemm_f32f32_f32f32_f32_nchwkcrs_nchw_tilesize128x64x8_stage3_warpsize2x2x1_g1_ffma_aligna4_alignc4 Tactic: 0x12dbf7d94ee3696d
[09/13/2022-08:25:39] [TRT] [V] Tactic: 0x12dbf7d94ee3696d Time: 0.206165
[09/13/2022-08:25:39] [TRT] [V] (Unnamed Layer* 0) [Convolution] Set Tactic Name: ampere_scudnn_128x64_relu_small_nn_v1 Tactic: 0x3f243c490d502deb
[09/13/2022-08:25:39] [TRT] [V] Tactic: 0x3f243c490d502deb Time: 0.181931
[09/13/2022-08:25:39] [TRT] [V] (Unnamed Layer* 0) [Convolution] Set Tactic Name: ampere_scudnn_128x128_relu_small_nn_v1 Tactic: 0x503619c69ae500ff
[09/13/2022-08:25:39] [TRT] [V] Tactic: 0x503619c69ae500ff Time: 0.201547
[09/13/2022-08:25:39] [TRT] [V] (Unnamed Layer* 0) [Convolution] Set Tactic Name: ampere_scudnn_128x128_relu_xregs_large_nn_v1 Tactic: 0x5403ad713f811a18
[09/13/2022-08:25:39] [TRT] [V] Tactic: 0x5403ad713f811a18 Time: 0.221184
[09/13/2022-08:25:39] [TRT] [V] (Unnamed Layer* 0) [Convolution] Set Tactic Name: sm80_xmma_fprop_implicit_gemm_f32f32_f32f32_f32_nchwkcrs_nchw_tilesize64x128x8_stage3_warpsize1x4x1_g1_ffma_aligna4_alignc4 Tactic: 0x5aa723e0481da855
[09/13/2022-08:25:39] [TRT] [V] Tactic: 0x5aa723e0481da855 Time: 0.195563
[09/13/2022-08:25:39] [TRT] [V] (Unnamed Layer* 0) [Convolution] Set Tactic Name: ampere_scudnn_128x64_relu_xregs_large_nn_v1 Tactic: 0x5deb29b7a8e275f7
[09/13/2022-08:25:39] [TRT] [V] Tactic: 0x5deb29b7a8e275f7 Time: 0.19968
[09/13/2022-08:25:39] [TRT] [V] (Unnamed Layer* 0) [Convolution] Set Tactic Name: sm80_xmma_fprop_implicit_gemm_f32f32_f32f32_f32_nchwkcrs_nchw_tilesize64x64x8_stage3_warpsize1x4x1_g1_ffma_t1r5s5_aligna4_alignc4 Tactic: 0x967f94e9db2001a8
[09/13/2022-08:25:39] [TRT] [V] Tactic: 0x967f94e9db2001a8 Time: 0.189749
[09/13/2022-08:25:39] [TRT] [V] (Unnamed Layer* 0) [Convolution] Set Tactic Name: sm80_xmma_fprop_implicit_gemm_f32f32_f32f32_f32_nchwkcrs_nchw_tilesize64x64x8_stage3_warpsize1x4x1_g1_ffma_aligna4_alignc4 Tactic: 0xa31d27de74b895ff
[09/13/2022-08:25:39] [TRT] [V] Tactic: 0xa31d27de74b895ff Time: 0.196411
[09/13/2022-08:25:39] [TRT] [V] (Unnamed Layer* 0) [Convolution] Set Tactic Name: ampere_scudnn_128x32_relu_small_nn_v1 Tactic: 0xa8609adc4e0ceb90
[09/13/2022-08:25:39] [TRT] [V] Tactic: 0xa8609adc4e0ceb90 Time: 0.18688
[09/13/2022-08:25:39] [TRT] [V] (Unnamed Layer* 0) [Convolution] Set Tactic Name: sm80_xmma_fprop_implicit_gemm_f32f32_f32f32_f32_nchwkcrs_nchw_tilesize256x128x8_stage3_warpsize4x2x1_g1_ffma_aligna4_alignc4 Tactic: 0xbb8c3889c7eacd30
[09/13/2022-08:25:39] [TRT] [V] Tactic: 0xbb8c3889c7eacd30 Time: 0.299861
[09/13/2022-08:25:39] [TRT] [V] (Unnamed Layer* 0) [Convolution] Set Tactic Name: sm80_xmma_fprop_implicit_gemm_indexed_f32f32_f32f32_f32_nchwkcrs_nchw_tilesize64x64x8_stage3_warpsize1x4x1_g1_ffma_aligna4_alignc4 Tactic: 0xd828f024626fa982
[09/13/2022-08:25:39] [TRT] [V] Tactic: 0xd828f024626fa982 Time: 0.215381
[09/13/2022-08:25:39] [TRT] [V] (Unnamed Layer* 0) [Convolution] Set Tactic Name: ampere_scudnn_128x128_relu_medium_nn_v1 Tactic: 0xf067e6205da31c2e
[09/13/2022-08:25:39] [TRT] [V] Tactic: 0xf067e6205da31c2e Time: 0.200192
[09/13/2022-08:25:39] [TRT] [V] (Unnamed Layer* 0) [Convolution] Set Tactic Name: ampere_scudnn_128x64_relu_medium_nn_v1 Tactic: 0xf64396b97c889179
[09/13/2022-08:25:39] [TRT] [V] Tactic: 0xf64396b97c889179 Time: 0.185173
[09/13/2022-08:25:39] [TRT] [V] Fastest Tactic: 0x3f243c490d502deb Time: 0.181931
[09/13/2022-08:25:39] [TRT] [V] >>>>>>>>>>>>>>> Chose Runner Type: CaskConvolution Tactic: 0x3f243c490d502deb
[09/13/2022-08:25:39] [TRT] [V] *************** Autotuning format combination: Float((* (# 2 (SHAPE inputT0)) (# 3 (SHAPE inputT0))),1,(# 3 (SHAPE inputT0)),1) -> Float((* (# 2 (SHAPE inputT0)) E0),1,E0,256) where E0=(* 256 (# 3 (SHAPE inputT0))) ***************
[09/13/2022-08:25:39] [TRT] [V] --------------- Timing Runner: (Unnamed Layer* 0) [Convolution] (CaskConvolution)
[09/13/2022-08:25:39] [TRT] [V] (Unnamed Layer* 0) [Convolution] Set Tactic Name: sm80_xmma_fprop_implicit_gemm_indexed_f32f32_f32f32_f32_nhwckrsc_nhwc_tilesize64x64x8_stage3_warpsize1x4x1_g1_ffma_aligna4_alignc4 Tactic: 0x19b688348f983aa0
[09/13/2022-08:25:39] [TRT] [V] Tactic: 0x19b688348f983aa0 Time: 0.503413
[09/13/2022-08:25:39] [TRT] [V] (Unnamed Layer* 0) [Convolution] Set Tactic Name: sm80_xmma_fprop_implicit_gemm_f32f32_f32f32_f32_nhwckrsc_nhwc_tilesize128x64x8_stage3_warpsize2x2x1_g1_ffma_aligna4_alignc4 Tactic: 0x1da91d865428f237
[09/13/2022-08:25:39] [TRT] [V] Tactic: 0x1da91d865428f237 Time: 0.422912
[09/13/2022-08:25:39] [TRT] [V] (Unnamed Layer* 0) [Convolution] Set Tactic Name: sm80_xmma_fprop_implicit_gemm_f32f32_f32f32_f32_nhwckrsc_nhwc_tilesize64x64x8_stage3_warpsize1x4x1_g1_ffma_t1r5s5_aligna4_alignc4 Tactic: 0x45ff0c3a09b02e78
[09/13/2022-08:25:39] [TRT] [V] Tactic: 0x45ff0c3a09b02e78 Time: 0.444757
[09/13/2022-08:25:39] [TRT] [V] (Unnamed Layer* 0) [Convolution] Set Tactic Name: sm80_xmma_fprop_implicit_gemm_f32f32_f32f32_f32_nhwckrsc_nhwc_tilesize64x64x8_stage3_warpsize1x4x1_g1_ffma_aligna4_alignc4 Tactic: 0x62835fce994f06dd
[09/13/2022-08:25:39] [TRT] [V] Tactic: 0x62835fce994f06dd Time: 0.455339
[09/13/2022-08:25:39] [TRT] [V] (Unnamed Layer* 0) [Convolution] Set Tactic Name: sm80_xmma_fprop_implicit_gemm_f32f32_f32f32_f32_nhwckrsc_nhwc_tilesize256x64x8_stage3_warpsize2x2x1_g1_ffma_aligna4_alignc4 Tactic: 0x8014228ec08b4d49
[09/13/2022-08:25:39] [TRT] [V] Tactic: 0x8014228ec08b4d49 Time: 0.564907
[09/13/2022-08:25:39] [TRT] [V] Fastest Tactic: 0x1da91d865428f237 Time: 0.422912
[09/13/2022-08:25:39] [TRT] [V] >>>>>>>>>>>>>>> Chose Runner Type: CaskConvolution Tactic: 0x1da91d865428f237
[09/13/2022-08:25:39] [TRT] [V] *************** Autotuning format combination: Float((* (# 2 (SHAPE inputT0)) (# 3 (SHAPE inputT0))),1:4,(# 3 (SHAPE inputT0)),1) -> Float((* (# 2 (SHAPE inputT0)) E0),1:4,E0,64) where E0=(* 64 (# 3 (SHAPE inputT0))) ***************
[09/13/2022-08:25:39] [TRT] [V] --------------- Timing Runner: (Unnamed Layer* 0) [Convolution] (CaskConvolution)
[09/13/2022-08:25:39] [TRT] [V] (Unnamed Layer* 0) [Convolution] Set Tactic Name: sm80_xmma_fprop_implicit_gemm_indexed_f32f32_f32f32_f32_nhwckrsc_nhwc_tilesize64x64x8_stage3_warpsize1x4x1_g1_ffma_aligna4_alignc4 Tactic: 0x19b688348f983aa0
[09/13/2022-08:25:39] [TRT] [V] Tactic: 0x19b688348f983aa0 Time: 0.510976
[09/13/2022-08:25:39] [TRT] [V] (Unnamed Layer* 0) [Convolution] Set Tactic Name: sm80_xmma_fprop_implicit_gemm_f32f32_f32f32_f32_nhwckrsc_nhwc_tilesize128x64x8_stage3_warpsize2x2x1_g1_ffma_aligna4_alignc4 Tactic: 0x1da91d865428f237
[09/13/2022-08:25:39] [TRT] [V] Tactic: 0x1da91d865428f237 Time: 0.433152
[09/13/2022-08:25:39] [TRT] [V] (Unnamed Layer* 0) [Convolution] Set Tactic Name: sm80_xmma_fprop_implicit_gemm_f32f32_f32f32_f32_nhwckrsc_nhwc_tilesize64x64x8_stage3_warpsize1x4x1_g1_ffma_t1r5s5_aligna4_alignc4 Tactic: 0x45ff0c3a09b02e78
[09/13/2022-08:25:39] [TRT] [V] Tactic: 0x45ff0c3a09b02e78 Time: 0.459435
[09/13/2022-08:25:39] [TRT] [V] (Unnamed Layer* 0) [Convolution] Set Tactic Name: sm80_xmma_fprop_implicit_gemm_f32f32_f32f32_f32_nhwckrsc_nhwc_tilesize64x64x8_stage3_warpsize1x4x1_g1_ffma_aligna4_alignc4 Tactic: 0x62835fce994f06dd
[09/13/2022-08:25:39] [TRT] [V] Tactic: 0x62835fce994f06dd Time: 0.468309
[09/13/2022-08:25:39] [TRT] [V] (Unnamed Layer* 0) [Convolution] Set Tactic Name: sm80_xmma_fprop_implicit_gemm_indexed_f32f32_tf32f32_f32_nhwckrsc_nhwc_tilesize128x128x16_stage4_warpsize2x2x1_g1_tensor16x8x8 Tactic: 0x65e41d81f093b482
[09/13/2022-08:25:39] [TRT] [V] Tactic: 0x65e41d81f093b482 Time: 0.41472
[09/13/2022-08:25:39] [TRT] [V] (Unnamed Layer* 0) [Convolution] Set Tactic Name: sm80_xmma_fprop_implicit_gemm_f32f32_f32f32_f32_nhwckrsc_nhwc_tilesize256x64x8_stage3_warpsize2x2x1_g1_ffma_aligna4_alignc4 Tactic: 0x8014228ec08b4d49
[09/13/2022-08:25:39] [TRT] [V] Tactic: 0x8014228ec08b4d49 Time: 0.569344
[09/13/2022-08:25:39] [TRT] [V] (Unnamed Layer* 0) [Convolution] Set Tactic Name: sm80_xmma_fprop_implicit_gemm_f32f32_tf32f32_f32_nhwckrsc_nhwc_tilesize128x128x16_stage4_warpsize2x2x1_g1_tensor16x8x8_t1r5s5 Tactic: 0x94f2b2320bb3fc74
[09/13/2022-08:25:39] [TRT] [V] Tactic: 0x94f2b2320bb3fc74 Time: 0.394923
[09/13/2022-08:25:39] [TRT] [V] (Unnamed Layer* 0) [Convolution] Set Tactic Name: sm80_xmma_fprop_implicit_gemm_f32f32_tf32f32_f32_nhwckrsc_nhwc_tilesize128x128x16_stage4_warpsize2x2x1_g1_tensor16x8x8 Tactic: 0xb443c221fcb1565b
[09/13/2022-08:25:39] [TRT] [V] Tactic: 0xb443c221fcb1565b Time: 0.39936
[09/13/2022-08:25:39] [TRT] [V] Fastest Tactic: 0x94f2b2320bb3fc74 Time: 0.394923
[09/13/2022-08:25:39] [TRT] [V] >>>>>>>>>>>>>>> Chose Runner Type: CaskConvolution Tactic: 0x94f2b2320bb3fc74
[09/13/2022-08:25:39] [TRT] [V] =============== Computing costs for 
[09/13/2022-08:25:39] [TRT] [V] *************** Autotuning format combination: Float((* 256 E0),E0,(# 3 (SHAPE inputT0)),1) -> Float(E0,E0,(# 3 (SHAPE inputT0)),1) where E0=(* (# 2 (SHAPE inputT0)) (# 3 (SHAPE inputT0))) ***************
[09/13/2022-08:25:39] [TRT] [V] --------------- Timing Runner: (Unnamed Layer* 1) [Convolution] (CudaDepthwiseConvolution)
[09/13/2022-08:25:39] [TRT] [V] CudaDepthwiseConvolution has no valid tactics for this config, skipping
[09/13/2022-08:25:39] [TRT] [V] --------------- Timing Runner: (Unnamed Layer* 1) [Convolution] (FusedConvActConvolution)
[09/13/2022-08:25:39] [TRT] [V] FusedConvActConvolution has no valid tactics for this config, skipping
[09/13/2022-08:25:39] [TRT] [V] --------------- Timing Runner: (Unnamed Layer* 1) [Convolution] (CudnnConvolution)
[09/13/2022-08:25:39] [TRT] [V] Tactic: 0x0000000000000000 Time: 2.62963
[09/13/2022-08:25:39] [TRT] [V] Tactic: 0x0000000000000001 Time: 2.6327
[09/13/2022-08:25:39] [TRT] [V] Tactic: 0x0000000000000002 Time: 0.732779
[09/13/2022-08:25:39] [TRT] [V] Tactic: 0x0000000000000004 Time: 3.83554
[09/13/2022-08:25:39] [TRT] [V] Tactic: 0x0000000000000005 Time: 0.980992
[09/13/2022-08:25:39] [TRT] [V] Tactic: 0x0000000000000038 Time: 2.74466
[09/13/2022-08:25:39] [TRT] [V] Tactic: 0x0000000000000039 Time: 2.69141
[09/13/2022-08:25:39] [TRT] [V] Tactic: 0x000000000000003a Time: 0.762539
[09/13/2022-08:25:39] [TRT] [V] Tactic: 0x000000000000003c Time: 3.82942
[09/13/2022-08:25:39] [TRT] [V] Tactic: 0x000000000000003d Time: 0.974848
[09/13/2022-08:25:39] [TRT] [V] Tactic: 0x0000000000000070 Time: 2.64499
[09/13/2022-08:25:39] [TRT] [V] Tactic: 0x0000000000000071 Time: 2.66103
[09/13/2022-08:25:39] [TRT] [V] Tactic: 0x0000000000000072 Time: 0.749909
[09/13/2022-08:25:39] [TRT] [V] Tactic: 0x0000000000000074 Time: 3.82942
[09/13/2022-08:25:39] [TRT] [V] Tactic: 0x0000000000000075 Time: 0.979659
[09/13/2022-08:25:39] [TRT] [V] Fastest Tactic: 0x0000000000000002 Time: 0.732779
[09/13/2022-08:25:39] [TRT] [V] --------------- Timing Runner: (Unnamed Layer* 1) [Convolution] (CaskConvolution)
[09/13/2022-08:25:39] [TRT] [V] (Unnamed Layer* 1) [Convolution] Set Tactic Name: sm80_xmma_fprop_implicit_gemm_f32f32_f32f32_f32_nchwkcrs_nchw_tilesize128x64x8_stage3_warpsize2x2x1_g1_ffma_aligna4_alignc4 Tactic: 0x12dbf7d94ee3696d
[09/13/2022-08:25:39] [TRT] [V] Tactic: 0x12dbf7d94ee3696d Time: 3.93484
[09/13/2022-08:25:39] [TRT] [V] (Unnamed Layer* 1) [Convolution] Set Tactic Name: ampere_scudnn_128x64_relu_small_nn_v1 Tactic: 0x3f243c490d502deb
[09/13/2022-08:25:39] [TRT] [V] Tactic: 0x3f243c490d502deb Time: 3.58468
[09/13/2022-08:25:39] [TRT] [V] (Unnamed Layer* 1) [Convolution] Set Tactic Name: ampere_scudnn_128x128_relu_small_nn_v1 Tactic: 0x503619c69ae500ff
[09/13/2022-08:25:39] [TRT] [V] Tactic: 0x503619c69ae500ff Time: 6.85773
[09/13/2022-08:25:39] [TRT] [V] (Unnamed Layer* 1) [Convolution] Set Tactic Name: ampere_scudnn_128x128_relu_xregs_large_nn_v1 Tactic: 0x5403ad713f811a18
[09/13/2022-08:25:39] [TRT] [V] Tactic: 0x5403ad713f811a18 Time: 7.62778
[09/13/2022-08:25:39] [TRT] [V] (Unnamed Layer* 1) [Convolution] Set Tactic Name: sm80_xmma_fprop_implicit_gemm_f32f32_f32f32_f32_nchwkcrs_nchw_tilesize64x128x8_stage3_warpsize1x4x1_g1_ffma_aligna4_alignc4 Tactic: 0x5aa723e0481da855
[09/13/2022-08:25:39] [TRT] [V] Tactic: 0x5aa723e0481da855 Time: 7.83633
[09/13/2022-08:25:39] [TRT] [V] (Unnamed Layer* 1) [Convolution] Set Tactic Name: ampere_scudnn_128x64_relu_xregs_large_nn_v1 Tactic: 0x5deb29b7a8e275f7
[09/13/2022-08:25:39] [TRT] [V] Tactic: 0x5deb29b7a8e275f7 Time: 3.99599
[09/13/2022-08:25:39] [TRT] [V] (Unnamed Layer* 1) [Convolution] Set Tactic Name: sm80_xmma_fprop_implicit_gemm_f32f32_f32f32_f32_nchwkcrs_nchw_tilesize64x64x8_stage3_warpsize1x4x1_g1_ffma_t1r5s5_aligna4_alignc4 Tactic: 0x967f94e9db2001a8
[09/13/2022-08:25:39] [TRT] [V] Tactic: 0x967f94e9db2001a8 Time: 4.42948
[09/13/2022-08:25:39] [TRT] [V] (Unnamed Layer* 1) [Convolution] Set Tactic Name: sm80_xmma_fprop_implicit_gemm_f32f32_f32f32_f32_nchwkcrs_nchw_tilesize64x64x8_stage3_warpsize1x4x1_g1_ffma_aligna4_alignc4 Tactic: 0xa31d27de74b895ff
[09/13/2022-08:25:39] [TRT] [V] Tactic: 0xa31d27de74b895ff Time: 4.35675
[09/13/2022-08:25:39] [TRT] [V] (Unnamed Layer* 1) [Convolution] Set Tactic Name: ampere_scudnn_128x32_relu_small_nn_v1 Tactic: 0xa8609adc4e0ceb90
[09/13/2022-08:25:39] [TRT] [V] Tactic: 0xa8609adc4e0ceb90 Time: 2.52689
[09/13/2022-08:25:39] [TRT] [V] (Unnamed Layer* 1) [Convolution] Set Tactic Name: sm80_xmma_fprop_implicit_gemm_f32f32_f32f32_f32_nchwkcrs_nchw_tilesize256x128x8_stage3_warpsize4x2x1_g1_ffma_aligna4_alignc4 Tactic: 0xbb8c3889c7eacd30
[09/13/2022-08:25:39] [TRT] [V] Tactic: 0xbb8c3889c7eacd30 Time: 8.01587
[09/13/2022-08:25:39] [TRT] [V] (Unnamed Layer* 1) [Convolution] Set Tactic Name: sm80_xmma_fprop_implicit_gemm_indexed_f32f32_f32f32_f32_nchwkcrs_nchw_tilesize64x64x8_stage3_warpsize1x4x1_g1_ffma_aligna4_alignc4 Tactic: 0xd828f024626fa982
[09/13/2022-08:25:39] [TRT] [V] Tactic: 0xd828f024626fa982 Time: 6.2109
[09/13/2022-08:25:39] [TRT] [V] (Unnamed Layer* 1) [Convolution] Set Tactic Name: ampere_scudnn_128x128_relu_medium_nn_v1 Tactic: 0xf067e6205da31c2e
[09/13/2022-08:25:39] [TRT] [V] Tactic: 0xf067e6205da31c2e Time: 7.31853
[09/13/2022-08:25:39] [TRT] [V] (Unnamed Layer* 1) [Convolution] Set Tactic Name: ampere_scudnn_128x64_relu_medium_nn_v1 Tactic: 0xf64396b97c889179
[09/13/2022-08:25:39] [TRT] [V] Tactic: 0xf64396b97c889179 Time: 4.21717
[09/13/2022-08:25:39] [TRT] [V] Fastest Tactic: 0xa8609adc4e0ceb90 Time: 2.52689
[09/13/2022-08:25:39] [TRT] [V] >>>>>>>>>>>>>>> Chose Runner Type: CudnnConvolution Tactic: 0x0000000000000002
[09/13/2022-08:25:39] [TRT] [V] *************** Autotuning format combination: Float((* (# 2 (SHAPE inputT0)) E0),1,E0,256) -> Float((* (# 2 (SHAPE inputT0)) (# 3 (SHAPE inputT0))),1,(# 3 (SHAPE inputT0)),1) where E0=(* 256 (# 3 (SHAPE inputT0))) ***************
[09/13/2022-08:25:39] [TRT] [V] --------------- Timing Runner: (Unnamed Layer* 1) [Convolution] (CaskConvolution)
[09/13/2022-08:25:39] [TRT] [V] (Unnamed Layer* 1) [Convolution] Set Tactic Name: sm80_xmma_fprop_implicit_gemm_indexed_f32f32_f32f32_f32_nhwckrsc_nhwc_tilesize64x64x8_stage3_warpsize1x4x1_g1_ffma_aligna4_alignc4 Tactic: 0x19b688348f983aa0
[09/13/2022-08:25:39] [TRT] [V] Tactic: 0x19b688348f983aa0 Time: 3.79699
[09/13/2022-08:25:39] [TRT] [V] (Unnamed Layer* 1) [Convolution] Set Tactic Name: sm80_xmma_fprop_implicit_gemm_f32f32_f32f32_f32_nhwckrsc_nhwc_tilesize128x64x8_stage3_warpsize2x2x1_g1_ffma_aligna4_alignc4 Tactic: 0x1da91d865428f237
[09/13/2022-08:25:39] [TRT] [V] Tactic: 0x1da91d865428f237 Time: 2.89963
[09/13/2022-08:25:39] [TRT] [V] (Unnamed Layer* 1) [Convolution] Set Tactic Name: sm80_xmma_fprop_implicit_gemm_f32f32_f32f32_f32_nhwckrsc_nhwc_tilesize64x64x8_stage3_warpsize1x4x1_g1_ffma_t1r5s5_aligna4_alignc4 Tactic: 0x45ff0c3a09b02e78
[09/13/2022-08:25:39] [TRT] [V] Tactic: 0x45ff0c3a09b02e78 Time: 3.70517
[09/13/2022-08:25:39] [TRT] [V] (Unnamed Layer* 1) [Convolution] Set Tactic Name: sm80_xmma_fprop_implicit_gemm_f32f32_f32f32_f32_nhwckrsc_nhwc_tilesize64x64x8_stage3_warpsize1x4x1_g1_ffma_aligna4_alignc4 Tactic: 0x62835fce994f06dd
[09/13/2022-08:25:39] [TRT] [V] Tactic: 0x62835fce994f06dd Time: 4.00246
[09/13/2022-08:25:39] [TRT] [V] (Unnamed Layer* 1) [Convolution] Set Tactic Name: sm80_xmma_fprop_implicit_gemm_f32f32_f32f32_f32_nhwckrsc_nhwc_tilesize256x64x8_stage3_warpsize2x2x1_g1_ffma_aligna4_alignc4 Tactic: 0x8014228ec08b4d49
[09/13/2022-08:25:39] [TRT] [V] Tactic: 0x8014228ec08b4d49 Time: 3.5287
[09/13/2022-08:25:39] [TRT] [V] Fastest Tactic: 0x1da91d865428f237 Time: 2.89963
[09/13/2022-08:25:39] [TRT] [V] >>>>>>>>>>>>>>> Chose Runner Type: CaskConvolution Tactic: 0x1da91d865428f237
[09/13/2022-08:25:39] [TRT] [V] *************** Autotuning format combination: Float((* (# 2 (SHAPE inputT0)) E0),1:4,E0,64) -> Float((* (# 2 (SHAPE inputT0)) (# 3 (SHAPE inputT0))),1:4,(# 3 (SHAPE inputT0)),1) where E0=(* 64 (# 3 (SHAPE inputT0))) ***************
[09/13/2022-08:25:39] [TRT] [V] --------------- Timing Runner: (Unnamed Layer* 1) [Convolution] (CaskConvolution)
[09/13/2022-08:25:39] [TRT] [V] (Unnamed Layer* 1) [Convolution] Set Tactic Name: sm80_xmma_fprop_implicit_gemm_indexed_f32f32_tf32f32_f32_nhwckrsc_nhwc_tilesize128x128x16_stage4_warpsize2x2x1_g1_tensor16x8x8 Tactic: 0x65e41d81f093b482
[09/13/2022-08:25:39] [TRT] [V] Tactic: 0x65e41d81f093b482 Time: 2.85184
[09/13/2022-08:25:39] [TRT] [V] (Unnamed Layer* 1) [Convolution] Set Tactic Name: sm80_xmma_fprop_implicit_gemm_f32f32_tf32f32_f32_nhwckrsc_nhwc_tilesize128x128x16_stage4_warpsize2x2x1_g1_tensor16x8x8_t1r5s5 Tactic: 0x94f2b2320bb3fc74
[09/13/2022-08:25:39] [TRT] [V] Tactic: 0x94f2b2320bb3fc74 Time: 2.432
[09/13/2022-08:25:39] [TRT] [V] (Unnamed Layer* 1) [Convolution] Set Tactic Name: sm80_xmma_fprop_implicit_gemm_f32f32_tf32f32_f32_nhwckrsc_nhwc_tilesize128x128x16_stage4_warpsize2x2x1_g1_tensor16x8x8 Tactic: 0xb443c221fcb1565b
[09/13/2022-08:25:40] [TRT] [V] Tactic: 0xb443c221fcb1565b Time: 2.34975
[09/13/2022-08:25:40] [TRT] [V] Fastest Tactic: 0xb443c221fcb1565b Time: 2.34975
[09/13/2022-08:25:40] [TRT] [V] >>>>>>>>>>>>>>> Chose Runner Type: CaskConvolution Tactic: 0xb443c221fcb1565b
[09/13/2022-08:25:40] [TRT] [V] =============== Computing costs for 
[09/13/2022-08:25:40] [TRT] [V] *************** Autotuning format combination: Float(E0,E0,(# 3 (SHAPE inputT0)),1) -> Float((* 256 E0),E0,(# 3 (SHAPE inputT0)),1) where E0=(* (# 2 (SHAPE inputT0)) (# 3 (SHAPE inputT0))) ***************
[09/13/2022-08:25:40] [TRT] [V] *************** Autotuning format combination: Float((* (# 2 (SHAPE inputT0)) (# 3 (SHAPE inputT0))),1,(# 3 (SHAPE inputT0)),1) -> Float((* (# 2 (SHAPE inputT0)) E0),1,E0,256) where E0=(* 256 (# 3 (SHAPE inputT0))) ***************
[09/13/2022-08:25:40] [TRT] [V] *************** Autotuning format combination: Float((* (# 2 (SHAPE inputT0)) (# 3 (SHAPE inputT0))),1:4,(# 3 (SHAPE inputT0)),1) -> Float((* (# 2 (SHAPE inputT0)) E0),1:4,E0,64) where E0=(* 64 (# 3 (SHAPE inputT0))) ***************
[09/13/2022-08:25:40] [TRT] [V] =============== Computing costs for 
[09/13/2022-08:25:40] [TRT] [V] *************** Autotuning format combination: Float((* 256 E0),E0,(# 3 (SHAPE inputT0)),1) -> Float(E0,E0,(# 3 (SHAPE inputT0)),1) where E0=(* (# 2 (SHAPE inputT0)) (# 3 (SHAPE inputT0))) ***************
[09/13/2022-08:25:40] [TRT] [V] *************** Autotuning format combination: Float((* (# 2 (SHAPE inputT0)) E0),1,E0,256) -> Float((* (# 2 (SHAPE inputT0)) (# 3 (SHAPE inputT0))),1,(# 3 (SHAPE inputT0)),1) where E0=(* 256 (# 3 (SHAPE inputT0))) ***************
[09/13/2022-08:25:40] [TRT] [V] *************** Autotuning format combination: Float((* (# 2 (SHAPE inputT0)) E0),1:4,E0,64) -> Float((* (# 2 (SHAPE inputT0)) (# 3 (SHAPE inputT0))),1:4,(# 3 (SHAPE inputT0)),1) where E0=(* 64 (# 3 (SHAPE inputT0))) ***************
[09/13/2022-08:25:40] [TRT] [V] =============== Computing costs for 
[09/13/2022-08:25:40] [TRT] [V] *************** Autotuning format combination: Float(E0,E0,(# 3 (SHAPE inputT0)),1) -> Float((* 256 E0),E0,(# 3 (SHAPE inputT0)),1) where E0=(* (# 2 (SHAPE inputT0)) (# 3 (SHAPE inputT0))) ***************
[09/13/2022-08:25:40] [TRT] [V] *************** Autotuning format combination: Float((* (# 2 (SHAPE inputT0)) (# 3 (SHAPE inputT0))),1,(# 3 (SHAPE inputT0)),1) -> Float((* (# 2 (SHAPE inputT0)) E0),1,E0,256) where E0=(* 256 (# 3 (SHAPE inputT0))) ***************
[09/13/2022-08:25:40] [TRT] [V] *************** Autotuning format combination: Float((* (# 2 (SHAPE inputT0)) (# 3 (SHAPE inputT0))),1:4,(# 3 (SHAPE inputT0)),1) -> Float((* (# 2 (SHAPE inputT0)) E0),1:4,E0,64) where E0=(* 64 (# 3 (SHAPE inputT0))) ***************
[09/13/2022-08:25:40] [TRT] [V] =============== Computing costs for 
[09/13/2022-08:25:40] [TRT] [V] *************** Autotuning format combination: Float((* 256 E0),E0,(# 3 (SHAPE inputT0)),1) -> Float(E0,E0,(# 3 (SHAPE inputT0)),1) where E0=(* (# 2 (SHAPE inputT0)) (# 3 (SHAPE inputT0))) ***************
[09/13/2022-08:25:40] [TRT] [V] *************** Autotuning format combination: Float((* (# 2 (SHAPE inputT0)) E0),1,E0,256) -> Float((* (# 2 (SHAPE inputT0)) (# 3 (SHAPE inputT0))),1,(# 3 (SHAPE inputT0)),1) where E0=(* 256 (# 3 (SHAPE inputT0))) ***************
[09/13/2022-08:25:40] [TRT] [V] *************** Autotuning format combination: Float((* (# 2 (SHAPE inputT0)) E0),1:4,E0,64) -> Float((* (# 2 (SHAPE inputT0)) (# 3 (SHAPE inputT0))),1:4,(# 3 (SHAPE inputT0)),1) where E0=(* 64 (# 3 (SHAPE inputT0))) ***************
[09/13/2022-08:25:40] [TRT] [V] =============== Computing costs for 
[09/13/2022-08:25:40] [TRT] [V] *************** Autotuning format combination: Float(E0,E0,(# 3 (SHAPE inputT0)),1) -> Float((* 256 E0),E0,(# 3 (SHAPE inputT0)),1) where E0=(* (# 2 (SHAPE inputT0)) (# 3 (SHAPE inputT0))) ***************
[09/13/2022-08:25:40] [TRT] [V] *************** Autotuning format combination: Float((* (# 2 (SHAPE inputT0)) (# 3 (SHAPE inputT0))),1,(# 3 (SHAPE inputT0)),1) -> Float((* (# 2 (SHAPE inputT0)) E0),1,E0,256) where E0=(* 256 (# 3 (SHAPE inputT0))) ***************
[09/13/2022-08:25:40] [TRT] [V] *************** Autotuning format combination: Float((* (# 2 (SHAPE inputT0)) (# 3 (SHAPE inputT0))),1:4,(# 3 (SHAPE inputT0)),1) -> Float((* (# 2 (SHAPE inputT0)) E0),1:4,E0,64) where E0=(* 64 (# 3 (SHAPE inputT0))) ***************
[09/13/2022-08:25:40] [TRT] [V] =============== Computing costs for 
[09/13/2022-08:25:40] [TRT] [V] *************** Autotuning format combination: Float((* 256 E0),E0,(# 3 (SHAPE inputT0)),1) -> Float(E0,E0,(# 3 (SHAPE inputT0)),1) where E0=(* (# 2 (SHAPE inputT0)) (# 3 (SHAPE inputT0))) ***************
[09/13/2022-08:25:40] [TRT] [V] *************** Autotuning format combination: Float((* (# 2 (SHAPE inputT0)) E0),1,E0,256) -> Float((* (# 2 (SHAPE inputT0)) (# 3 (SHAPE inputT0))),1,(# 3 (SHAPE inputT0)),1) where E0=(* 256 (# 3 (SHAPE inputT0))) ***************
