cookbook/08-Tool/trtexec/result-FP16.txt
[03/19/2022-12:28:31] [V] [TRT] *************** Autotuning Reformat:Float(784,784,28,1) -> Float(784,1,28,1) ***************
[03/19/2022-12:28:31] [V] [TRT] --------------- Timing Runner: Optimizer Reformat (Reformat)
[03/19/2022-12:28:31] [V] [TRT] Tactic: 1002 Time: 0.00432
[03/19/2022-12:28:31] [V] [TRT] Tactic: 0 Time: 0.003324
[03/19/2022-12:28:31] [V] [TRT] Fastest Tactic: 0 Time: 0.003324
[03/19/2022-12:28:31] [V] [TRT] *************** Autotuning Reformat:Float(784,784,28,1) -> Half(784,784,28,1) ***************
[03/19/2022-12:28:31] [V] [TRT] --------------- Timing Runner: Optimizer Reformat (Reformat)
[03/19/2022-12:28:31] [V] [TRT] Tactic: 1002 Time: 0.004468
[03/19/2022-12:28:31] [V] [TRT] Tactic: 0 Time: 0.004404
[03/19/2022-12:28:31] [V] [TRT] Fastest Tactic: 0 Time: 0.004404
[03/19/2022-12:28:31] [V] [TRT] *************** Autotuning format combination: Float(784,784,28,1) -> Float(25088,784,28,1) ***************
[03/19/2022-12:28:31] [V] [TRT] --------------- Timing Runner: Conv__25 + Relu (CudaDepthwiseConvolution)
[03/19/2022-12:28:31] [V] [TRT] CudaDepthwiseConvolution has no valid tactics for this config, skipping
[03/19/2022-12:28:31] [V] [TRT] --------------- Timing Runner: Conv__25 + Relu (FusedConvActConvolution)
[03/19/2022-12:28:31] [V] [TRT] FusedConvActConvolution has no valid tactics for this config, skipping
[03/19/2022-12:28:31] [V] [TRT] --------------- Timing Runner: Conv__25 + Relu (CudnnConvolution)
[03/19/2022-12:28:31] [V] [TRT] Tactic: 0 Time: 0.017332
[03/19/2022-12:28:31] [V] [TRT] Tactic: 1 Time: 0.0199
[03/19/2022-12:28:31] [V] [TRT] Tactic: 2 Time: 0.023856
[03/19/2022-12:28:31] [V] [TRT] Tactic: 4 Time: 0.04352
[03/19/2022-12:28:31] [V] [TRT] Tactic: 5 Time: 0.04736
[03/19/2022-12:28:31] [V] [TRT] Fastest Tactic: 0 Time: 0.017332
[03/19/2022-12:28:31] [V] [TRT] --------------- Timing Runner: Conv__25 + Relu (CaskConvolution)
[03/19/2022-12:28:31] [V] [TRT] Conv__25 + Relu Set Tactic Name: maxwell_scudnn_128x32_relu_medium_nn_v1 Tactic: 1062367460111450758
[03/19/2022-12:28:31] [V] [TRT] Tactic: 1062367460111450758 Time: 0.011488
[03/19/2022-12:28:31] [V] [TRT] Conv__25 + Relu Set Tactic Name: maxwell_scudnn_128x32_relu_large_nn_v0 Tactic: 1754984623894446479
[03/19/2022-12:28:31] [V] [TRT] Tactic: 1754984623894446479 Time: 0.008752
[03/19/2022-12:28:31] [V] [TRT] Conv__25 + Relu Set Tactic Name: maxwell_scudnn_128x128_relu_large_nn_v0 Tactic: 3611739942397549984
[03/19/2022-12:28:31] [V] [TRT] Tactic: 3611739942397549984 Time: 0.014848
[03/19/2022-12:28:31] [V] [TRT] Conv__25 + Relu Set Tactic Name: maxwell_scudnn_128x64_relu_large_nn_v1 Tactic: 4337000649858996379
[03/19/2022-12:28:31] [V] [TRT] Tactic: 4337000649858996379 Time: 0.011624
[03/19/2022-12:28:31] [V] [TRT] Conv__25 + Relu Set Tactic Name: maxwell_scudnn_128x128_relu_medium_nn_v1 Tactic: 4501471010995462441
[03/19/2022-12:28:31] [V] [TRT] Tactic: 4501471010995462441 Time: 0.013556
[03/19/2022-12:28:31] [V] [TRT] Conv__25 + Relu Set Tactic Name: maxwell_scudnn_128x64_relu_small_nn_v1 Tactic: 5137655947464784826
[03/19/2022-12:28:31] [V] [TRT] Tactic: 5137655947464784826 Time: 0.01034
[03/19/2022-12:28:31] [V] [TRT] Conv__25 + Relu Set Tactic Name: maxwell_scudnn_128x128_relu_small_nn_v0 Tactic: 5288347012147084929
[03/19/2022-12:28:31] [V] [TRT] Tactic: 5288347012147084929 Time: 0.01412
[03/19/2022-12:28:31] [V] [TRT] Conv__25 + Relu Set Tactic Name: maxwell_scudnn_128x64_relu_medium_nn_v1 Tactic: 6645123197870846056
[03/19/2022-12:28:31] [V] [TRT] Tactic: 6645123197870846056 Time: 0.010724
[03/19/2022-12:28:31] [V] [TRT] Conv__25 + Relu Set Tactic Name: maxwell_scudnn_128x32_relu_small_nn_v0 Tactic: 7144526460361122478
[03/19/2022-12:28:31] [V] [TRT] Tactic: 7144526460361122478 Time: 0.008356
[03/19/2022-12:28:31] [V] [TRT] Conv__25 + Relu Set Tactic Name: maxwell_scudnn_128x128_relu_large_nn_v1 Tactic: -9137461792520977713
[03/19/2022-12:28:31] [V] [TRT] Tactic: -9137461792520977713 Time: 0.01466
[03/19/2022-12:28:31] [V] [TRT] Conv__25 + Relu Set Tactic Name: maxwell_scudnn_128x128_relu_medium_nn_v0 Tactic: -8262349710178828730
[03/19/2022-12:28:31] [V] [TRT] Tactic: -8262349710178828730 Time: 0.014568
[03/19/2022-12:28:31] [V] [TRT] Conv__25 + Relu Set Tactic Name: maxwell_scudnn_128x64_relu_large_nn_v0 Tactic: -8133971918129952780
[03/19/2022-12:28:31] [V] [TRT] Tactic: -8133971918129952780 Time: 0.011624
[03/19/2022-12:28:31] [V] [TRT] Conv__25 + Relu Set Tactic Name: maxwell_scudnn_128x32_relu_large_nn_v1 Tactic: -6092040395344634144
[03/19/2022-12:28:31] [V] [TRT] Tactic: -6092040395344634144 Time: 0.011704
[03/19/2022-12:28:31] [V] [TRT] Conv__25 + Relu Set Tactic Name: maxwell_scudnn_128x32_relu_medium_nn_v0 Tactic: -4787320710726427159
[03/19/2022-12:28:31] [V] [TRT] Tactic: -4787320710726427159 Time: 0.00876
[03/19/2022-12:28:31] [V] [TRT] Conv__25 + Relu Set Tactic Name: maxwell_scudnn_128x32_relu_small_nn_v1 Tactic: -3456450830548107839
[03/19/2022-12:28:31] [V] [TRT] Tactic: -3456450830548107839 Time: 0.009864
[03/19/2022-12:28:31] [V] [TRT] Conv__25 + Relu Set Tactic Name: maxwell_scudnn_128x64_relu_medium_nn_v0 Tactic: -1218658103698133241
[03/19/2022-12:28:31] [V] [TRT] Tactic: -1218658103698133241 Time: 0.01086
[03/19/2022-12:28:31] [V] [TRT] Conv__25 + Relu Set Tactic Name: maxwell_scudnn_128x64_relu_small_nn_v0 Tactic: -836875257600482091
[03/19/2022-12:28:31] [V] [TRT] Tactic: -836875257600482091 Time: 0.01076
[03/19/2022-12:28:31] [V] [TRT] Conv__25 + Relu Set Tactic Name: maxwell_scudnn_128x128_relu_small_nn_v1 Tactic: -410470605513481746
[03/19/2022-12:28:31] [V] [TRT] Tactic: -410470605513481746 Time: 0.013628
[03/19/2022-12:28:31] [V] [TRT] Fastest Tactic: 7144526460361122478 Time: 0.008356
[03/19/2022-12:28:31] [V] [TRT] >>>>>>>>>>>>>>> Chose Runner Type: CaskConvolution Tactic: 7144526460361122478
[03/19/2022-12:28:31] [V] [TRT] *************** Autotuning format combination: Float(784,1,28,1) -> Float(25088,1,896,32) ***************
[03/19/2022-12:28:31] [V] [TRT] --------------- Timing Runner: Conv__25 + Relu (CudnnConvolution)
[03/19/2022-12:28:31] [V] [TRT] CudnnConvolution has no valid tactics for this config, skipping
[03/19/2022-12:28:31] [V] [TRT] --------------- Timing Runner: Conv__25 + Relu (CaskConvolution)
[03/19/2022-12:28:31] [V] [TRT] CaskConvolution has no valid tactics for this config, skipping
[03/19/2022-12:28:31] [V] [TRT] *************** Autotuning format combination: Half(784,784,28,1) -> Half(25088,784,28,1) ***************
[03/19/2022-12:28:31] [V] [TRT] --------------- Timing Runner: Conv__25 + Relu (CudnnConvolution)
[03/19/2022-12:28:31] [V] [TRT] Tactic: 0 Time: 0.017536
[03/19/2022-12:28:31] [V] [TRT] Tactic: 1 Time: 0.017276
[03/19/2022-12:28:31] [V] [TRT] Tactic: 2 Time: 0.0341
[03/19/2022-12:28:31] [V] [TRT] Tactic: 4 Time: 0.044532
[03/19/2022-12:28:31] [V] [TRT] Tactic: 5 Time: 0.04772
[03/19/2022-12:28:31] [V] [TRT] Fastest Tactic: 1 Time: 0.017276
[03/19/2022-12:28:31] [V] [TRT] --------------- Timing Runner: Conv__25 + Relu (CaskConvolution)
[03/19/2022-12:28:31] [V] [TRT] CaskConvolution has no valid tactics for this config, skipping
[03/19/2022-12:28:31] [V] [TRT] >>>>>>>>>>>>>>> Chose Runner Type: CudnnConvolution Tactic: 1
[03/19/2022-12:28:31] [V] [TRT] *************** Autotuning Reformat:Float(25088,784,28,1) -> Half(25088,784,28,1) ***************
[03/19/2022-12:28:31] [V] [TRT] --------------- Timing Runner: Optimizer Reformat (Reformat)
[03/19/2022-12:28:31] [V] [TRT] Tactic: 1002 Time: 0.0076
[03/19/2022-12:28:31] [V] [TRT] Tactic: 0 Time: 0.00638
[03/19/2022-12:28:31] [V] [TRT] Fastest Tactic: 0 Time: 0.00638
[03/19/2022-12:28:31] [V] [TRT] *************** Autotuning Reformat:Float(25088,1,896,32) -> Float(25088,784,28,1) ***************
[03/19/2022-12:28:31] [V] [TRT] --------------- Timing Runner: Optimizer Reformat (Reformat)
[03/19/2022-12:28:31] [V] [TRT] Tactic: 1002 Time: 0.011136
[03/19/2022-12:28:31] [V] [TRT] Tactic: 0 Time: 0.007416
[03/19/2022-12:28:31] [V] [TRT] Fastest Tactic: 0 Time: 0.007416
[03/19/2022-12:28:31] [V] [TRT] *************** Autotuning Reformat:Float(25088,1,896,32) -> Half(25088,784,28,1) ***************
[03/19/2022-12:28:31] [V] [TRT] --------------- Timing Runner: Optimizer Reformat (Reformat)
[03/19/2022-12:28:31] [V] [TRT] Tactic: 1002 Time: 0.006912
[03/19/2022-12:28:31] [V] [TRT] Tactic: 0 Time: 0.007404
[03/19/2022-12:28:31] [V] [TRT] Fastest Tactic: 1002 Time: 0.006912
[03/19/2022-12:28:31] [V] [TRT] *************** Autotuning Reformat:Half(25088,784,28,1) -> Float(25088,784,28,1) ***************
[03/19/2022-12:28:31] [V] [TRT] --------------- Timing Runner: Optimizer Reformat (Reformat)
[03/19/2022-12:28:31] [V] [TRT] Tactic: 1002 Time: 0.008688
[03/19/2022-12:28:31] [V] [TRT] Tactic: 0 Time: 0.005676
[03/19/2022-12:28:31] [V] [TRT] Fastest Tactic: 0 Time: 0.005676
[03/19/2022-12:28:31] [V] [TRT] *************** Autotuning format combination: Float(25088,784,28,1) -> Float(6272,196,14,1) ***************
[03/19/2022-12:28:31] [V] [TRT] --------------- Timing Runner: MaxPool2d (TiledPooling)
[03/19/2022-12:28:31] [V] [TRT] Tactic: 5505281 Time: 0.00832
[03/19/2022-12:28:31] [V] [TRT] Tactic: 5570817 Time: 0.006112
[03/19/2022-12:28:31] [V] [TRT] Tactic: 5636353 Time: 0.005236
[03/19/2022-12:28:31] [V] [TRT] Tactic: 5701889 Time: 0.005092
[03/19/2022-12:28:31] [V] [TRT] Tactic: 5767425 Time: 0.005092
[03/19/2022-12:28:32] [V] [TRT] Tactic: 5832961 Time: 0.00506
[03/19/2022-12:28:32] [V] [TRT] Tactic: 5898497 Time: 0.005076
[03/19/2022-12:28:32] [V] [TRT] Tactic: 5964033 Time: 0.004396
[03/19/2022-12:28:32] [V] [TRT] Tactic: 6029569 Time: 0.005568
[03/19/2022-12:28:32] [V] [TRT] Tactic: 6095105 Time: 0.00412
[03/19/2022-12:28:32] [V] [TRT] Tactic: 6160641 Time: 0.004056
[03/19/2022-12:28:32] [V] [TRT] Tactic: 6226177 Time: 0.004056
[03/19/2022-12:28:32] [V] [TRT] Tactic: 6291713 Time: 0.00406
[03/19/2022-12:28:32] [V] [TRT] Tactic: 6357249 Time: 0.004024
[03/19/2022-12:28:32] [V] [TRT] Tactic: 6422785 Time: 0.003904
[03/19/2022-12:28:32] [V] [TRT] Tactic: 6488321 Time: 0.003704
[03/19/2022-12:28:32] [V] [TRT] Fastest Tactic: 6488321 Time: 0.003704
[03/19/2022-12:28:32] [V] [TRT] --------------- Timing Runner: MaxPool2d (CudnnPooling)
[03/19/2022-12:28:32] [V] [TRT] Tactic: -1 Time: 0.004096
[03/19/2022-12:28:32] [V] [TRT] Fastest Tactic: -1 Time: 0.004096
[03/19/2022-12:28:32] [V] [TRT] >>>>>>>>>>>>>>> Chose Runner Type: TiledPooling Tactic: 6488321
[03/19/2022-12:28:32] [V] [TRT] *************** Autotuning format combination: Half(25088,784,28,1) -> Half(6272,196,14,1) ***************
[03/19/2022-12:28:32] [V] [TRT] --------------- Timing Runner: MaxPool2d (TiledPooling)
[03/19/2022-12:28:32] [V] [TRT] TiledPooling has no valid tactics for this config, skipping
[03/19/2022-12:28:32] [V] [TRT] --------------- Timing Runner: MaxPool2d (CudnnPooling)
[03/19/2022-12:28:32] [V] [TRT] Tactic: -1 Time: 0.004096
[03/19/2022-12:28:32] [V] [TRT] Fastest Tactic: -1 Time: 0.004096
[03/19/2022-12:28:32] [V] [TRT] >>>>>>>>>>>>>>> Chose Runner Type: CudnnPooling Tactic: -1
[03/19/2022-12:28:32] [V] [TRT] *************** Autotuning Reformat:Float(6272,196,14,1) -> Float(6272,1,448,32) ***************
[03/19/2022-12:28:32] [V] [TRT] --------------- Timing Runner: Optimizer Reformat (Reformat)
[03/19/2022-12:28:32] [V] [TRT] Tactic: 1002 Time: 0.007152
[03/19/2022-12:28:32] [V] [TRT] Tactic: 0 Time: 0.004312
[03/19/2022-12:28:32] [V] [TRT] Fastest Tactic: 0 Time: 0.004312
[03/19/2022-12:28:32] [V] [TRT] *************** Autotuning Reformat:Float(6272,196,14,1) -> Half(6272,196,14,1) ***************
[03/19/2022-12:28:32] [V] [TRT] --------------- Timing Runner: Optimizer Reformat (Reformat)
[03/19/2022-12:28:32] [V] [TRT] Tactic: 1002 Time: 0.022508
[03/19/2022-12:28:32] [V] [TRT] Tactic: 0 Time: 0.004224
[03/19/2022-12:28:32] [V] [TRT] Fastest Tactic: 0 Time: 0.004224
[03/19/2022-12:28:32] [V] [TRT] *************** Autotuning Reformat:Float(6272,1,448,32) -> Float(6272,196,14,1) ***************
[03/19/2022-12:28:32] [V] [TRT] --------------- Timing Runner: Optimizer Reformat (Reformat)
[03/19/2022-12:28:32] [V] [TRT] Tactic: 1002 Time: 0.00716
[03/19/2022-12:28:32] [V] [TRT] Tactic: 0 Time: 0.004096
[03/19/2022-12:28:32] [V] [TRT] Fastest Tactic: 0 Time: 0.004096
[03/19/2022-12:28:32] [V] [TRT] *************** Autotuning Reformat:Float(6272,1,448,32) -> Half(6272,196,14,1) ***************
[03/19/2022-12:28:32] [V] [TRT] --------------- Timing Runner: Optimizer Reformat (Reformat)
[03/19/2022-12:28:32] [V] [TRT] Tactic: 1002 Time: 0.005112
[03/19/2022-12:28:32] [V] [TRT] Tactic: 0 Time: 0.0042
[03/19/2022-12:28:32] [V] [TRT] Fastest Tactic: 0 Time: 0.0042
[03/19/2022-12:28:32] [V] [TRT] *************** Autotuning Reformat:Half(6272,196,14,1) -> Float(6272,196,14,1) ***************
[03/19/2022-12:28:32] [V] [TRT] --------------- Timing Runner: Optimizer Reformat (Reformat)
[03/19/2022-12:28:32] [V] [TRT] Tactic: 1002 Time: 0.022656
[03/19/2022-12:28:32] [V] [TRT] Tactic: 0 Time: 0.00338
[03/19/2022-12:28:32] [V] [TRT] Fastest Tactic: 0 Time: 0.00338
[03/19/2022-12:28:32] [V] [TRT] *************** Autotuning Reformat:Half(6272,196,14,1) -> Float(6272,1,448,32) ***************
[03/19/2022-12:28:32] [V] [TRT] --------------- Timing Runner: Optimizer Reformat (Reformat)
[03/19/2022-12:28:32] [V] [TRT] Tactic: 1002 Time: 0.00514
[03/19/2022-12:28:32] [V] [TRT] Tactic: 0 Time: 0.004696
[03/19/2022-12:28:32] [V] [TRT] Fastest Tactic: 0 Time: 0.004696
[03/19/2022-12:28:32] [V] [TRT] *************** Autotuning format combination: Float(6272,196,14,1) -> Float(12544,196,14,1) ***************
[03/19/2022-12:28:32] [V] [TRT] --------------- Timing Runner: Conv__27 + Relu_1 (CudaDepthwiseConvolution)
[03/19/2022-12:28:32] [V] [TRT] CudaDepthwiseConvolution has no valid tactics for this config, skipping
[03/19/2022-12:28:32] [V] [TRT] --------------- Timing Runner: Conv__27 + Relu_1 (FusedConvActConvolution)
[03/19/2022-12:28:32] [V] [TRT] FusedConvActConvolution has no valid tactics for this config, skipping
[03/19/2022-12:28:32] [V] [TRT] --------------- Timing Runner: Conv__27 + Relu_1 (CudnnConvolution)
[03/19/2022-12:28:32] [V] [TRT] Tactic: 0 Time: 0.063976
[03/19/2022-12:28:32] [V] [TRT] Tactic: 1 Time: 0.063904
[03/19/2022-12:28:32] [V] [TRT] Tactic: 2 Time: 0.128428
[03/19/2022-12:28:32] [V] [TRT] Tactic: 4 Time: 0.163036
[03/19/2022-12:28:32] [V] [TRT] Tactic: 5 Time: 0.180304
[03/19/2022-12:28:32] [V] [TRT] Fastest Tactic: 1 Time: 0.063904
[03/19/2022-12:28:32] [V] [TRT] --------------- Timing Runner: Conv__27 + Relu_1 (CaskConvolution)
[03/19/2022-12:28:32] [V] [TRT] Conv__27 + Relu_1 Set Tactic Name: maxwell_scudnn_128x32_relu_medium_nn_v1 Tactic: 1062367460111450758
[03/19/2022-12:28:32] [V] [TRT] Tactic: 1062367460111450758 Time: 0.10578
[03/19/2022-12:28:32] [V] [TRT] Conv__27 + Relu_1 Set Tactic Name: maxwell_scudnn_128x32_relu_large_nn_v0 Tactic: 1754984623894446479
[03/19/2022-12:28:32] [V] [TRT] Tactic: 1754984623894446479 Time: 0.078128
[03/19/2022-12:28:32] [V] [TRT] Conv__27 + Relu_1 Set Tactic Name: maxwell_scudnn_128x128_relu_large_nn_v0 Tactic: 3611739942397549984
[03/19/2022-12:28:32] [V] [TRT] Tactic: 3611739942397549984 Time: 0.085488
[03/19/2022-12:28:32] [V] [TRT] Conv__27 + Relu_1 Set Tactic Name: maxwell_scudnn_128x64_relu_large_nn_v1 Tactic: 4337000649858996379
[03/19/2022-12:28:32] [V] [TRT] Tactic: 4337000649858996379 Time: 0.079296
[03/19/2022-12:28:32] [V] [TRT] Conv__27 + Relu_1 Set Tactic Name: maxwell_scudnn_128x128_relu_medium_nn_v1 Tactic: 4501471010995462441
[03/19/2022-12:28:32] [V] [TRT] Tactic: 4501471010995462441 Time: 0.085812
[03/19/2022-12:28:32] [V] [TRT] Conv__27 + Relu_1 Set Tactic Name: maxwell_scudnn_128x64_relu_small_nn_v1 Tactic: 5137655947464784826
[03/19/2022-12:28:32] [V] [TRT] Tactic: 5137655947464784826 Time: 0.0524
[03/19/2022-12:28:32] [V] [TRT] Conv__27 + Relu_1 Set Tactic Name: maxwell_scudnn_128x128_relu_small_nn_v0 Tactic: 5288347012147084929
[03/19/2022-12:28:32] [V] [TRT] Tactic: 5288347012147084929 Time: 0.074792
[03/19/2022-12:28:32] [V] [TRT] Conv__27 + Relu_1 Set Tactic Name: maxwell_scudnn_128x64_relu_medium_nn_v1 Tactic: 6645123197870846056
[03/19/2022-12:28:32] [V] [TRT] Tactic: 6645123197870846056 Time: 0.071096
[03/19/2022-12:28:32] [V] [TRT] Conv__27 + Relu_1 Set Tactic Name: maxwell_scudnn_128x32_relu_small_nn_v0 Tactic: 7144526460361122478
[03/19/2022-12:28:32] [V] [TRT] Tactic: 7144526460361122478 Time: 0.05986
[03/19/2022-12:28:32] [V] [TRT] Conv__27 + Relu_1 Set Tactic Name: maxwell_scudnn_128x128_relu_large_nn_v1 Tactic: -9137461792520977713
[03/19/2022-12:28:32] [V] [TRT] Tactic: -9137461792520977713 Time: 0.088872
[03/19/2022-12:28:32] [V] [TRT] Conv__27 + Relu_1 Set Tactic Name: maxwell_scudnn_128x128_relu_medium_nn_v0 Tactic: -8262349710178828730
[03/19/2022-12:28:32] [V] [TRT] Tactic: -8262349710178828730 Time: 0.085824
[03/19/2022-12:28:32] [V] [TRT] Conv__27 + Relu_1 Set Tactic Name: maxwell_scudnn_128x64_relu_large_nn_v0 Tactic: -8133971918129952780
[03/19/2022-12:28:32] [V] [TRT] Tactic: -8133971918129952780 Time: 0.09224
[03/19/2022-12:28:32] [V] [TRT] Conv__27 + Relu_1 Set Tactic Name: maxwell_scudnn_128x32_relu_large_nn_v1 Tactic: -6092040395344634144
[03/19/2022-12:28:32] [V] [TRT] Tactic: -6092040395344634144 Time: 0.110192
[03/19/2022-12:28:32] [V] [TRT] Conv__27 + Relu_1 Set Tactic Name: maxwell_scudnn_128x32_relu_medium_nn_v0 Tactic: -4787320710726427159
[03/19/2022-12:28:32] [V] [TRT] Tactic: -4787320710726427159 Time: 0.077292
[03/19/2022-12:28:32] [V] [TRT] Conv__27 + Relu_1 Set Tactic Name: maxwell_scudnn_128x32_relu_small_nn_v1 Tactic: -3456450830548107839
[03/19/2022-12:28:32] [V] [TRT] Tactic: -3456450830548107839 Time: 0.061024
[03/19/2022-12:28:32] [V] [TRT] Conv__27 + Relu_1 Set Tactic Name: maxwell_scudnn_128x64_relu_medium_nn_v0 Tactic: -1218658103698133241
[03/19/2022-12:28:32] [V] [TRT] Tactic: -1218658103698133241 Time: 0.091336
[03/19/2022-12:28:32] [V] [TRT] Conv__27 + Relu_1 Set Tactic Name: maxwell_scudnn_128x64_relu_small_nn_v0 Tactic: -836875257600482091
[03/19/2022-12:28:32] [V] [TRT] Tactic: -836875257600482091 Time: 0.07544
[03/19/2022-12:28:32] [V] [TRT] Conv__27 + Relu_1 Set Tactic Name: maxwell_scudnn_128x128_relu_small_nn_v1 Tactic: -410470605513481746
[03/19/2022-12:28:32] [V] [TRT] Tactic: -410470605513481746 Time: 0.073268
[03/19/2022-12:28:32] [V] [TRT] Fastest Tactic: 5137655947464784826 Time: 0.0524
[03/19/2022-12:28:32] [V] [TRT] >>>>>>>>>>>>>>> Chose Runner Type: CaskConvolution Tactic: 5137655947464784826
[03/19/2022-12:28:32] [V] [TRT] *************** Autotuning format combination: Float(6272,1,448,32) -> Float(12544,1,896,64) ***************
[03/19/2022-12:28:32] [V] [TRT] --------------- Timing Runner: Conv__27 + Relu_1 (CudnnConvolution)
[03/19/2022-12:28:32] [V] [TRT] CudnnConvolution has no valid tactics for this config, skipping
[03/19/2022-12:28:32] [V] [TRT] --------------- Timing Runner: Conv__27 + Relu_1 (CaskConvolution)
[03/19/2022-12:28:32] [V] [TRT] Conv__27 + Relu_1 Set Tactic Name: maxwell_scudnn_128x32_sliced1x4_ldg4_relu_exp_small_nhwc_tn_v1 Tactic: -9153228964338181824
[03/19/2022-12:28:32] [V] [TRT] Tactic: -9153228964338181824 Time: 0.02378
[03/19/2022-12:28:32] [V] [TRT] Conv__27 + Relu_1 Set Tactic Name: maxwell_scudnn_128x64_sliced1x2_ldg4_relu_exp_small_nhwc_tn_v1 Tactic: -7394439838318485025
[03/19/2022-12:28:32] [V] [TRT] Tactic: -7394439838318485025 Time: 0.04134
[03/19/2022-12:28:32] [V] [TRT] Fastest Tactic: -9153228964338181824 Time: 0.02378
[03/19/2022-12:28:32] [V] [TRT] >>>>>>>>>>>>>>> Chose Runner Type: CaskConvolution Tactic: -9153228964338181824
[03/19/2022-12:28:32] [V] [TRT] *************** Autotuning format combination: Half(6272,196,14,1) -> Half(12544,196,14,1) ***************
[03/19/2022-12:28:32] [V] [TRT] --------------- Timing Runner: Conv__27 + Relu_1 (CudnnConvolution)
[03/19/2022-12:28:32] [V] [TRT] Tactic: 0 Time: 0.071916
[03/19/2022-12:28:32] [V] [TRT] Tactic: 1 Time: 0.07
[03/19/2022-12:28:32] [V] [TRT] Tactic: 2 Time: 0.128192
[03/19/2022-12:28:32] [V] [TRT] Tactic: 4 Time: 0.162032
[03/19/2022-12:28:32] [V] [TRT] Tactic: 5 Time: 0.179596
[03/19/2022-12:28:32] [V] [TRT] Fastest Tactic: 1 Time: 0.07
[03/19/2022-12:28:32] [V] [TRT] --------------- Timing Runner: Conv__27 + Relu_1 (CaskConvolution)
[03/19/2022-12:28:32] [V] [TRT] CaskConvolution has no valid tactics for this config, skipping
[03/19/2022-12:28:32] [V] [TRT] >>>>>>>>>>>>>>> Chose Runner Type: CudnnConvolution Tactic: 1
[03/19/2022-12:28:32] [V] [TRT] *************** Autotuning Reformat:Float(12544,196,14,1) -> Half(12544,196,14,1) ***************
[03/19/2022-12:28:32] [V] [TRT] --------------- Timing Runner: Optimizer Reformat (Reformat)
[03/19/2022-12:28:32] [V] [TRT] Tactic: 1002 Time: 0.041328
[03/19/2022-12:28:32] [V] [TRT] Tactic: 0 Time: 0.0051
[03/19/2022-12:28:32] [V] [TRT] Fastest Tactic: 0 Time: 0.0051
[03/19/2022-12:28:32] [V] [TRT] *************** Autotuning Reformat:Float(12544,1,896,64) -> Float(12544,196,14,1) ***************
[03/19/2022-12:28:32] [V] [TRT] --------------- Timing Runner: Optimizer Reformat (Reformat)
[03/19/2022-12:28:32] [V] [TRT] Tactic: 1002 Time: 0.007168
[03/19/2022-12:28:32] [V] [TRT] Tactic: 0 Time: 0.00518
[03/19/2022-12:28:32] [V] [TRT] Fastest Tactic: 0 Time: 0.00518
[03/19/2022-12:28:32] [V] [TRT] *************** Autotuning Reformat:Float(12544,1,896,64) -> Half(12544,196,14,1) ***************
[03/19/2022-12:28:32] [V] [TRT] --------------- Timing Runner: Optimizer Reformat (Reformat)
[03/19/2022-12:28:32] [V] [TRT] Tactic: 1002 Time: 0.006452
[03/19/2022-12:28:32] [V] [TRT] Tactic: 0 Time: 0.005548
[03/19/2022-12:28:32] [V] [TRT] Fastest Tactic: 0 Time: 0.005548
[03/19/2022-12:28:32] [V] [TRT] *************** Autotuning Reformat:Half(12544,196,14,1) -> Float(12544,196,14,1) ***************
[03/19/2022-12:28:32] [V] [TRT] --------------- Timing Runner: Optimizer Reformat (Reformat)
[03/19/2022-12:28:32] [V] [TRT] Tactic: 1002 Time: 0.042364
[03/19/2022-12:28:32] [V] [TRT] Tactic: 0 Time: 0.004416
[03/19/2022-12:28:32] [V] [TRT] Fastest Tactic: 0 Time: 0.004416
[03/19/2022-12:28:32] [V] [TRT] *************** Autotuning format combination: Float(12544,196,14,1) -> Float(3136,49,7,1) ***************
[03/19/2022-12:28:32] [V] [TRT] --------------- Timing Runner: MaxPool2d_1 (TiledPooling)
[03/19/2022-12:28:32] [V] [TRT] Tactic: 5505281 Time: 0.009168
[03/19/2022-12:28:32] [V] [TRT] Tactic: 5570817 Time: 0.006132
[03/19/2022-12:28:32] [V] [TRT] Tactic: 5636353 Time: 0.005376
[03/19/2022-12:28:33] [V] [TRT] Tactic: 5701889 Time: 0.00512
[03/19/2022-12:28:33] [V] [TRT] Tactic: 5767425 Time: 0.0051
[03/19/2022-12:28:33] [V] [TRT] Tactic: 5832961 Time: 0.00506
[03/19/2022-12:28:33] [V] [TRT] Tactic: 5898497 Time: 0.005152
[03/19/2022-12:28:33] [V] [TRT] Tactic: 5964033 Time: 0.004312
[03/19/2022-12:28:33] [V] [TRT] Tactic: 6029569 Time: 0.006108
[03/19/2022-12:28:33] [V] [TRT] Tactic: 6095105 Time: 0.004096
[03/19/2022-12:28:33] [V] [TRT] Tactic: 6160641 Time: 0.0041
[03/19/2022-12:28:33] [V] [TRT] Tactic: 6226177 Time: 0.00406
[03/19/2022-12:28:33] [V] [TRT] Tactic: 6291713 Time: 0.004068
[03/19/2022-12:28:33] [V] [TRT] Tactic: 6357249 Time: 0.004072
[03/19/2022-12:28:33] [V] [TRT] Tactic: 6422785 Time: 0.004076
[03/19/2022-12:28:33] [V] [TRT] Tactic: 6488321 Time: 0.003968
[03/19/2022-12:28:33] [V] [TRT] Fastest Tactic: 6488321 Time: 0.003968
[03/19/2022-12:28:33] [V] [TRT] --------------- Timing Runner: MaxPool2d_1 (CudnnPooling)
[03/19/2022-12:28:33] [V] [TRT] Tactic: -1 Time: 0.003992
[03/19/2022-12:28:33] [V] [TRT] Fastest Tactic: -1 Time: 0.003992
[03/19/2022-12:28:33] [V] [TRT] >>>>>>>>>>>>>>> Chose Runner Type: TiledPooling Tactic: 6488321
[03/19/2022-12:28:33] [V] [TRT] *************** Autotuning format combination: Half(12544,196,14,1) -> Half(3136,49,7,1) ***************
[03/19/2022-12:28:33] [V] [TRT] --------------- Timing Runner: MaxPool2d_1 (TiledPooling)
[03/19/2022-12:28:33] [V] [TRT] TiledPooling has no valid tactics for this config, skipping
[03/19/2022-12:28:33] [V] [TRT] --------------- Timing Runner: MaxPool2d_1 (CudnnPooling)
[03/19/2022-12:28:33] [V] [TRT] Tactic: -1 Time: 0.004056
[03/19/2022-12:28:33] [V] [TRT] Fastest Tactic: -1 Time: 0.004056
[03/19/2022-12:28:33] [V] [TRT] >>>>>>>>>>>>>>> Chose Runner Type: CudnnPooling Tactic: -1
[03/19/2022-12:28:33] [V] [TRT] *************** Autotuning Reformat:Float(3136,49,7,1) -> Float(3136,1,448,64) ***************
[03/19/2022-12:28:33] [V] [TRT] --------------- Timing Runner: Optimizer Reformat (Reformat)
[03/19/2022-12:28:33] [V] [TRT] Tactic: 1002 Time: 0.007152
[03/19/2022-12:28:33] [V] [TRT] Tactic: 0 Time: 0.0032
[03/19/2022-12:28:33] [V] [TRT] Fastest Tactic: 0 Time: 0.0032
[03/19/2022-12:28:33] [V] [TRT] *************** Autotuning Reformat:Float(3136,49,7,1) -> Float(98,49:32,7,1) ***************
[03/19/2022-12:28:33] [V] [TRT] --------------- Timing Runner: Optimizer Reformat (Reformat)
[03/19/2022-12:28:33] [V] [TRT] Tactic: 1002 Time: 0.006824
[03/19/2022-12:28:33] [V] [TRT] Tactic: 0 Time: 0.004448
[03/19/2022-12:28:33] [V] [TRT] Fastest Tactic: 0 Time: 0.004448
[03/19/2022-12:28:33] [V] [TRT] *************** Autotuning Reformat:Float(3136,49,7,1) -> Half(3136,49,7,1) ***************
[03/19/2022-12:28:33] [V] [TRT] --------------- Timing Runner: Optimizer Reformat (Reformat)
[03/19/2022-12:28:33] [V] [TRT] Tactic: 1002 Time: 0.0146
[03/19/2022-12:28:33] [V] [TRT] Tactic: 0 Time: 0.004524
[03/19/2022-12:28:33] [V] [TRT] Fastest Tactic: 0 Time: 0.004524
[03/19/2022-12:28:33] [V] [TRT] *************** Autotuning Reformat:Float(3136,1,448,64) -> Float(3136,49,7,1) ***************
[03/19/2022-12:28:33] [V] [TRT] --------------- Timing Runner: Optimizer Reformat (Reformat)
[03/19/2022-12:28:33] [V] [TRT] Tactic: 1002 Time: 0.00706
[03/19/2022-12:28:33] [V] [TRT] Tactic: 0 Time: 0.00344
[03/19/2022-12:28:33] [V] [TRT] Fastest Tactic: 0 Time: 0.00344
[03/19/2022-12:28:33] [V] [TRT] *************** Autotuning Reformat:Float(3136,1,448,64) -> Float(98,49:32,7,1) ***************
[03/19/2022-12:28:33] [V] [TRT] --------------- Timing Runner: Optimizer Reformat (Reformat)
[03/19/2022-12:28:33] [V] [TRT] Tactic: 1002 Time: 0.007532
[03/19/2022-12:28:33] [V] [TRT] Tactic: 0 Time: 0.00426
[03/19/2022-12:28:33] [V] [TRT] Fastest Tactic: 0 Time: 0.00426
[03/19/2022-12:28:33] [V] [TRT] *************** Autotuning Reformat:Float(3136,1,448,64) -> Half(3136,49,7,1) ***************
[03/19/2022-12:28:33] [V] [TRT] --------------- Timing Runner: Optimizer Reformat (Reformat)
[03/19/2022-12:28:33] [V] [TRT] Tactic: 1002 Time: 0.0046
[03/19/2022-12:28:33] [V] [TRT] Tactic: 0 Time: 0.003592
[03/19/2022-12:28:33] [V] [TRT] Fastest Tactic: 0 Time: 0.003592
[03/19/2022-12:28:33] [V] [TRT] *************** Autotuning Reformat:Float(98,49:32,7,1) -> Float(3136,49,7,1) ***************
[03/19/2022-12:28:33] [V] [TRT] --------------- Timing Runner: Optimizer Reformat (Reformat)
[03/19/2022-12:28:33] [V] [TRT] Tactic: 1002 Time: 0.007536
[03/19/2022-12:28:33] [V] [TRT] Tactic: 0 Time: 0.003568
[03/19/2022-12:28:33] [V] [TRT] Fastest Tactic: 0 Time: 0.003568
[03/19/2022-12:28:33] [V] [TRT] *************** Autotuning Reformat:Float(98,49:32,7,1) -> Float(3136,1,448,64) ***************
[03/19/2022-12:28:33] [V] [TRT] --------------- Timing Runner: Optimizer Reformat (Reformat)
[03/19/2022-12:28:33] [V] [TRT] Tactic: 1002 Time: 0.007544
[03/19/2022-12:28:33] [V] [TRT] Tactic: 0 Time: 0.00362
[03/19/2022-12:28:33] [V] [TRT] Fastest Tactic: 0 Time: 0.00362
[03/19/2022-12:28:33] [V] [TRT] *************** Autotuning Reformat:Float(98,49:32,7,1) -> Half(3136,49,7,1) ***************
[03/19/2022-12:28:33] [V] [TRT] --------------- Timing Runner: Optimizer Reformat (Reformat)
[03/19/2022-12:28:33] [V] [TRT] Tactic: 1002 Time: 0.004716
[03/19/2022-12:28:33] [V] [TRT] Tactic: 0 Time: 0.00352
[03/19/2022-12:28:33] [V] [TRT] Fastest Tactic: 0 Time: 0.00352
[03/19/2022-12:28:33] [V] [TRT] *************** Autotuning Reformat:Half(3136,49,7,1) -> Float(3136,49,7,1) ***************
[03/19/2022-12:28:33] [V] [TRT] --------------- Timing Runner: Optimizer Reformat (Reformat)
[03/19/2022-12:28:33] [V] [TRT] Tactic: 1002 Time: 0.014748
[03/19/2022-12:28:33] [V] [TRT] Tactic: 0 Time: 0.003456
[03/19/2022-12:28:33] [V] [TRT] Fastest Tactic: 0 Time: 0.003456
[03/19/2022-12:28:33] [V] [TRT] *************** Autotuning Reformat:Half(3136,49,7,1) -> Float(3136,1,448,64) ***************
[03/19/2022-12:28:33] [V] [TRT] --------------- Timing Runner: Optimizer Reformat (Reformat)
[03/19/2022-12:28:33] [V] [TRT] Tactic: 1002 Time: 0.005556
[03/19/2022-12:28:33] [V] [TRT] Tactic: 0 Time: 0.003588
[03/19/2022-12:28:33] [V] [TRT] Fastest Tactic: 0 Time: 0.003588
[03/19/2022-12:28:33] [V] [TRT] *************** Autotuning Reformat:Half(3136,49,7,1) -> Float(98,49:32,7,1) ***************
[03/19/2022-12:28:33] [V] [TRT] --------------- Timing Runner: Optimizer Reformat (Reformat)
[03/19/2022-12:28:33] [V] [TRT] Tactic: 1002 Time: 0.005436
[03/19/2022-12:28:33] [V] [TRT] Tactic: 0 Time: 0.004196
[03/19/2022-12:28:33] [V] [TRT] Fastest Tactic: 0 Time: 0.004196
[03/19/2022-12:28:33] [V] [TRT] *************** Autotuning format combination: Float(3136,49,7,1) -> Float(3136,1,1,1) ***************
[03/19/2022-12:28:33] [V] [TRT] --------------- Timing Runner: MaxPool2d_1__22 + Reshape + (Unnamed Layer* 14) [Shuffle] (Shuffle)
[03/19/2022-12:28:33] [V] [TRT] Tactic: 0 Time: 0.00376
[03/19/2022-12:28:33] [V] [TRT] Fastest Tactic: 0 Time: 0.00376
[03/19/2022-12:28:33] [V] [TRT] >>>>>>>>>>>>>>> Chose Runner Type: Shuffle Tactic: 0
[03/19/2022-12:28:33] [V] [TRT] *************** Autotuning format combination: Float(3136,1,448,64) -> Float(3136,1,3136,3136) ***************
[03/19/2022-12:28:33] [V] [TRT] --------------- Timing Runner: MaxPool2d_1__22 + Reshape + (Unnamed Layer* 14) [Shuffle] (Shuffle)
[03/19/2022-12:28:33] [V] [TRT] Tactic: 0 Time: 0.003316
[03/19/2022-12:28:33] [V] [TRT] Fastest Tactic: 0 Time: 0.003316
[03/19/2022-12:28:33] [V] [TRT] >>>>>>>>>>>>>>> Chose Runner Type: Shuffle Tactic: 0
[03/19/2022-12:28:33] [V] [TRT] *************** Autotuning format combination: Float(98,49:32,7,1) -> Float(98,1:32,1,1) ***************
[03/19/2022-12:28:33] [V] [TRT] --------------- Timing Runner: MaxPool2d_1__22 + Reshape + (Unnamed Layer* 14) [Shuffle] (Shuffle)
[03/19/2022-12:28:33] [V] [TRT] Tactic: 0 Time: 0.003552
[03/19/2022-12:28:33] [V] [TRT] Fastest Tactic: 0 Time: 0.003552
[03/19/2022-12:28:33] [V] [TRT] >>>>>>>>>>>>>>> Chose Runner Type: Shuffle Tactic: 0
[03/19/2022-12:28:33] [V] [TRT] *************** Autotuning format combination: Half(3136,49,7,1) -> Half(3136,1,1,1) ***************
[03/19/2022-12:28:33] [V] [TRT] --------------- Timing Runner: MaxPool2d_1__22 + Reshape + (Unnamed Layer* 14) [Shuffle] (Shuffle)
[03/19/2022-12:28:33] [V] [TRT] Tactic: 0 Time: 0.003384
[03/19/2022-12:28:33] [V] [TRT] Fastest Tactic: 0 Time: 0.003384
[03/19/2022-12:28:33] [V] [TRT] >>>>>>>>>>>>>>> Chose Runner Type: Shuffle Tactic: 0
[03/19/2022-12:28:33] [V] [TRT] *************** Autotuning Reformat:Float(3136,1,1,1) -> Float(3136,1,3136,3136) ***************
[03/19/2022-12:28:33] [V] [TRT] --------------- Timing Runner: Optimizer Reformat (Reformat)
[03/19/2022-12:28:33] [V] [TRT] Tactic: 1002 Time: 0.004348
[03/19/2022-12:28:33] [V] [TRT] Tactic: 0 Time: 0.003244
[03/19/2022-12:28:33] [V] [TRT] Fastest Tactic: 0 Time: 0.003244
[03/19/2022-12:28:33] [V] [TRT] *************** Autotuning Reformat:Float(3136,1,1,1) -> Half(3136,1,1,1) ***************
[03/19/2022-12:28:33] [V] [TRT] --------------- Timing Runner: Optimizer Reformat (Reformat)
[03/19/2022-12:28:33] [V] [TRT] Tactic: 1002 Time: 0.004444
[03/19/2022-12:28:33] [V] [TRT] Tactic: 0 Time: 0.003996
[03/19/2022-12:28:33] [V] [TRT] Fastest Tactic: 0 Time: 0.003996
[03/19/2022-12:28:33] [V] [TRT] *************** Autotuning Reformat:Float(3136,1,3136,3136) -> Float(3136,1,1,1) ***************
[03/19/2022-12:28:33] [V] [TRT] --------------- Timing Runner: Optimizer Reformat (Reformat)
[03/19/2022-12:28:33] [V] [TRT] Tactic: 1002 Time: 0.004424
[03/19/2022-12:28:33] [V] [TRT] Tactic: 0 Time: 0.003372
[03/19/2022-12:28:33] [V] [TRT] Fastest Tactic: 0 Time: 0.003372
[03/19/2022-12:28:33] [V] [TRT] *************** Autotuning Reformat:Float(3136,1,3136,3136) -> Half(3136,1,1,1) ***************
[03/19/2022-12:28:33] [V] [TRT] --------------- Timing Runner: Optimizer Reformat (Reformat)
[03/19/2022-12:28:33] [V] [TRT] Tactic: 1002 Time: 0.003636
[03/19/2022-12:28:33] [V] [TRT] Tactic: 0 Time: 0.003304
[03/19/2022-12:28:33] [V] [TRT] Fastest Tactic: 0 Time: 0.003304
[03/19/2022-12:28:33] [V] [TRT] *************** Autotuning Reformat:Float(98,1:32,1,1) -> Float(3136,1,1,1) ***************
[03/19/2022-12:28:33] [V] [TRT] --------------- Timing Runner: Optimizer Reformat (Reformat)
[03/19/2022-12:28:33] [V] [TRT] Tactic: 1002 Time: 0.026296
[03/19/2022-12:28:33] [V] [TRT] Tactic: 0 Time: 0.003392
[03/19/2022-12:28:33] [V] [TRT] Fastest Tactic: 0 Time: 0.003392
[03/19/2022-12:28:33] [V] [TRT] *************** Autotuning Reformat:Float(98,1:32,1,1) -> Float(3136,1,3136,3136) ***************
[03/19/2022-12:28:33] [V] [TRT] --------------- Timing Runner: Optimizer Reformat (Reformat)
[03/19/2022-12:28:33] [V] [TRT] Tactic: 1002 Time: 0.00852
[03/19/2022-12:28:33] [V] [TRT] Tactic: 0 Time: 0.00344
[03/19/2022-12:28:33] [V] [TRT] Fastest Tactic: 0 Time: 0.00344
[03/19/2022-12:28:33] [V] [TRT] *************** Autotuning Reformat:Float(98,1:32,1,1) -> Half(3136,1,1,1) ***************
[03/19/2022-12:28:33] [V] [TRT] --------------- Timing Runner: Optimizer Reformat (Reformat)
[03/19/2022-12:28:33] [V] [TRT] Tactic: 1002 Time: 0.011644
[03/19/2022-12:28:33] [V] [TRT] Tactic: 0 Time: 0.003376
[03/19/2022-12:28:33] [V] [TRT] Fastest Tactic: 0 Time: 0.003376
[03/19/2022-12:28:33] [V] [TRT] *************** Autotuning Reformat:Half(3136,1,1,1) -> Float(3136,1,1,1) ***************
[03/19/2022-12:28:33] [V] [TRT] --------------- Timing Runner: Optimizer Reformat (Reformat)
[03/19/2022-12:28:33] [V] [TRT] Tactic: 1002 Time: 0.004468
[03/19/2022-12:28:33] [V] [TRT] Tactic: 0 Time: 0.003504
[03/19/2022-12:28:33] [V] [TRT] Fastest Tactic: 0 Time: 0.003504
[03/19/2022-12:28:33] [V] [TRT] *************** Autotuning Reformat:Half(3136,1,1,1) -> Float(3136,1,3136,3136) ***************
[03/19/2022-12:28:33] [V] [TRT] --------------- Timing Runner: Optimizer Reformat (Reformat)
[03/19/2022-12:28:33] [V] [TRT] Tactic: 1002 Time: 0.0044
[03/19/2022-12:28:33] [V] [TRT] Tactic: 0 Time: 0.003428
[03/19/2022-12:28:33] [V] [TRT] Fastest Tactic: 0 Time: 0.003428
[03/19/2022-12:28:33] [V] [TRT] *************** Autotuning format combination: Float(3136,1,1,1) -> Float(1024,1,1,1) ***************
[03/19/2022-12:28:33] [V] [TRT] --------------- Timing Runner: MatMul + b3/read:0 + (Unnamed Layer* 21) [Shuffle] + unsqueeze_node_after_b3/read:0 + (Unnamed Layer* 21) [Shuffle] + add_2 + Relu_2 (CudaDepthwiseConvolution)
[03/19/2022-12:28:33] [V] [TRT] CudaDepthwiseConvolution has no valid tactics for this config, skipping
[03/19/2022-12:28:33] [V] [TRT] --------------- Timing Runner: MatMul + b3/read:0 + (Unnamed Layer* 21) [Shuffle] + unsqueeze_node_after_b3/read:0 + (Unnamed Layer* 21) [Shuffle] + add_2 + Relu_2 (FusedConvActConvolution)
[03/19/2022-12:28:33] [V] [TRT] FusedConvActConvolution has no valid tactics for this config, skipping
[03/19/2022-12:28:33] [V] [TRT] --------------- Timing Runner: MatMul + b3/read:0 + (Unnamed Layer* 21) [Shuffle] + unsqueeze_node_after_b3/read:0 + (Unnamed Layer* 21) [Shuffle] + add_2 + Relu_2 (CudnnConvolution)
[03/19/2022-12:28:33] [V] [TRT] Tactic: 0 Time: 0.3233
[03/19/2022-12:28:33] [V] [TRT] Tactic: 1 Time: 0.179172
[03/19/2022-12:28:33] [V] [TRT] Tactic: 2 Time: 0.396204
[03/19/2022-12:28:33] [V] [TRT] Tactic: 4 skipped. Scratch requested: 7527202816, available: 1073741824
[03/19/2022-12:28:34] [V] [TRT] Tactic: 5 Time: 5.97915
[03/19/2022-12:28:34] [I] [TRT] Some tactics do not have sufficient workspace memory to run. Increasing workspace size may increase performance, please check verbose output.
[03/19/2022-12:28:34] [V] [TRT] Fastest Tactic: 1 Time: 0.179172
[03/19/2022-12:28:34] [V] [TRT] --------------- Timing Runner: MatMul + b3/read:0 + (Unnamed Layer* 21) [Shuffle] + unsqueeze_node_after_b3/read:0 + (Unnamed Layer* 21) [Shuffle] + add_2 + Relu_2 (CublasConvolution)
[03/19/2022-12:28:34] [V] [TRT] Tactic: 0 Time: 0.068908
[03/19/2022-12:28:34] [V] [TRT] Tactic: 1 Time: 0.06986
[03/19/2022-12:28:34] [V] [TRT] Fastest Tactic: 0 Time: 0.068908
[03/19/2022-12:28:34] [V] [TRT] --------------- Timing Runner: MatMul + b3/read:0 + (Unnamed Layer* 21) [Shuffle] + unsqueeze_node_after_b3/read:0 + (Unnamed Layer* 21) [Shuffle] + add_2 + Relu_2 (CaskConvolution)
[03/19/2022-12:28:34] [V] [TRT] MatMul + b3/read:0 + (Unnamed Layer* 21) [Shuffle] + unsqueeze_node_after_b3/read:0 + (Unnamed Layer* 21) [Shuffle] + add_2 + Relu_2 Set Tactic Name: maxwell_scudnn_128x32_relu_medium_nn_v1 Tactic: 1062367460111450758
[03/19/2022-12:28:34] [V] [TRT] Tactic: 1062367460111450758 Time: 0.379224
[03/19/2022-12:28:34] [V] [TRT] MatMul + b3/read:0 + (Unnamed Layer* 21) [Shuffle] + unsqueeze_node_after_b3/read:0 + (Unnamed Layer* 21) [Shuffle] + add_2 + Relu_2 Set Tactic Name: maxwell_scudnn_128x32_relu_interior_nn_v0 Tactic: 1698681053543049347
[03/19/2022-12:28:34] [V] [TRT] Tactic: 1698681053543049347 Time: 0.375052
[03/19/2022-12:28:34] [V] [TRT] MatMul + b3/read:0 + (Unnamed Layer* 21) [Shuffle] + unsqueeze_node_after_b3/read:0 + (Unnamed Layer* 21) [Shuffle] + add_2 + Relu_2 Set Tactic Name: maxwell_scudnn_128x128_relu_medium_nn_v1 Tactic: 4501471010995462441
[03/19/2022-12:28:34] [V] [TRT] Tactic: 4501471010995462441 Time: 0.396628
[03/19/2022-12:28:34] [V] [TRT] MatMul + b3/read:0 + (Unnamed Layer* 21) [Shuffle] + unsqueeze_node_after_b3/read:0 + (Unnamed Layer* 21) [Shuffle] + add_2 + Relu_2 Set Tactic Name: maxwell_scudnn_128x64_relu_small_nn_v1 Tactic: 5137655947464784826
[03/19/2022-12:28:34] [V] [TRT] Tactic: 5137655947464784826 Time: 0.334756
[03/19/2022-12:28:34] [V] [TRT] MatMul + b3/read:0 + (Unnamed Layer* 21) [Shuffle] + unsqueeze_node_after_b3/read:0 + (Unnamed Layer* 21) [Shuffle] + add_2 + Relu_2 Set Tactic Name: maxwell_scudnn_128x128_relu_small_nn_v0 Tactic: 5288347012147084929
[03/19/2022-12:28:34] [V] [TRT] Tactic: 5288347012147084929 Time: 0.380936
[03/19/2022-12:28:34] [V] [TRT] MatMul + b3/read:0 + (Unnamed Layer* 21) [Shuffle] + unsqueeze_node_after_b3/read:0 + (Unnamed Layer* 21) [Shuffle] + add_2 + Relu_2 Set Tactic Name: maxwell_scudnn_128x128_relu_interior_nn_v1 Tactic: 5326823351883942011
[03/19/2022-12:28:34] [V] [TRT] Tactic: 5326823351883942011 Time: 0.389136
[03/19/2022-12:28:34] [V] [TRT] MatMul + b3/read:0 + (Unnamed Layer* 21) [Shuffle] + unsqueeze_node_after_b3/read:0 + (Unnamed Layer* 21) [Shuffle] + add_2 + Relu_2 Set Tactic Name: maxwell_scudnn_128x64_relu_interior_nn_v0 Tactic: 5500448035057547314
[03/19/2022-12:28:34] [V] [TRT] Tactic: 5500448035057547314 Time: 0.365692
[03/19/2022-12:28:34] [V] [TRT] MatMul + b3/read:0 + (Unnamed Layer* 21) [Shuffle] + unsqueeze_node_after_b3/read:0 + (Unnamed Layer* 21) [Shuffle] + add_2 + Relu_2 Set Tactic Name: maxwell_scudnn_128x64_relu_medium_nn_v1 Tactic: 6645123197870846056
[03/19/2022-12:28:34] [V] [TRT] Tactic: 6645123197870846056 Time: 0.339416
[03/19/2022-12:28:34] [V] [TRT] MatMul + b3/read:0 + (Unnamed Layer* 21) [Shuffle] + unsqueeze_node_after_b3/read:0 + (Unnamed Layer* 21) [Shuffle] + add_2 + Relu_2 Set Tactic Name: maxwell_scudnn_128x32_relu_small_nn_v0 Tactic: 7144526460361122478
[03/19/2022-12:28:34] [V] [TRT] Tactic: 7144526460361122478 Time: 0.376876
[03/19/2022-12:28:34] [V] [TRT] MatMul + b3/read:0 + (Unnamed Layer* 21) [Shuffle] + unsqueeze_node_after_b3/read:0 + (Unnamed Layer* 21) [Shuffle] + add_2 + Relu_2 Set Tactic Name: maxwell_scudnn_128x128_relu_medium_nn_v0 Tactic: -8262349710178828730
[03/19/2022-12:28:34] [V] [TRT] Tactic: -8262349710178828730 Time: 0.374876
[03/19/2022-12:28:34] [V] [TRT] MatMul + b3/read:0 + (Unnamed Layer* 21) [Shuffle] + unsqueeze_node_after_b3/read:0 + (Unnamed Layer* 21) [Shuffle] + add_2 + Relu_2 Set Tactic Name: maxwell_scudnn_128x32_relu_interior_nn_v1 Tactic: -6576203419454146580
[03/19/2022-12:28:34] [V] [TRT] Tactic: -6576203419454146580 Time: 0.340012
[03/19/2022-12:28:34] [V] [TRT] MatMul + b3/read:0 + (Unnamed Layer* 21) [Shuffle] + unsqueeze_node_after_b3/read:0 + (Unnamed Layer* 21) [Shuffle] + add_2 + Relu_2 Set Tactic Name: maxwell_scudnn_128x32_relu_medium_nn_v0 Tactic: -4787320710726427159
[03/19/2022-12:28:34] [V] [TRT] Tactic: -4787320710726427159 Time: 0.358504
[03/19/2022-12:28:34] [V] [TRT] MatMul + b3/read:0 + (Unnamed Layer* 21) [Shuffle] + unsqueeze_node_after_b3/read:0 + (Unnamed Layer* 21) [Shuffle] + add_2 + Relu_2 Set Tactic Name: maxwell_scudnn_128x32_relu_small_nn_v1 Tactic: -3456450830548107839
[03/19/2022-12:28:34] [V] [TRT] Tactic: -3456450830548107839 Time: 0.346544
[03/19/2022-12:28:34] [V] [TRT] MatMul + b3/read:0 + (Unnamed Layer* 21) [Shuffle] + unsqueeze_node_after_b3/read:0 + (Unnamed Layer* 21) [Shuffle] + add_2 + Relu_2 Set Tactic Name: maxwell_scudnn_128x64_relu_medium_nn_v0 Tactic: -1218658103698133241
[03/19/2022-12:28:34] [V] [TRT] Tactic: -1218658103698133241 Time: 0.379068
[03/19/2022-12:28:34] [V] [TRT] MatMul + b3/read:0 + (Unnamed Layer* 21) [Shuffle] + unsqueeze_node_after_b3/read:0 + (Unnamed Layer* 21) [Shuffle] + add_2 + Relu_2 Set Tactic Name: maxwell_scudnn_128x64_relu_small_nn_v0 Tactic: -836875257600482091
[03/19/2022-12:28:34] [V] [TRT] Tactic: -836875257600482091 Time: 0.370544
[03/19/2022-12:28:34] [V] [TRT] MatMul + b3/read:0 + (Unnamed Layer* 21) [Shuffle] + unsqueeze_node_after_b3/read:0 + (Unnamed Layer* 21) [Shuffle] + add_2 + Relu_2 Set Tactic Name: maxwell_scudnn_128x128_relu_small_nn_v1 Tactic: -410470605513481746
[03/19/2022-12:28:34] [V] [TRT] Tactic: -410470605513481746 Time: 0.390508
[03/19/2022-12:28:34] [V] [TRT] MatMul + b3/read:0 + (Unnamed Layer* 21) [Shuffle] + unsqueeze_node_after_b3/read:0 + (Unnamed Layer* 21) [Shuffle] + add_2 + Relu_2 Set Tactic Name: maxwell_scudnn_128x128_relu_interior_nn_v0 Tactic: -377491875521947884
[03/19/2022-12:28:34] [V] [TRT] Tactic: -377491875521947884 Time: 0.377324
[03/19/2022-12:28:34] [V] [TRT] MatMul + b3/read:0 + (Unnamed Layer* 21) [Shuffle] + unsqueeze_node_after_b3/read:0 + (Unnamed Layer* 21) [Shuffle] + add_2 + Relu_2 Set Tactic Name: maxwell_scudnn_128x64_relu_interior_nn_v1 Tactic: -37215280111360163
[03/19/2022-12:28:34] [V] [TRT] Tactic: -37215280111360163 Time: 0.332712
[03/19/2022-12:28:34] [V] [TRT] Fastest Tactic: -37215280111360163 Time: 0.332712
[03/19/2022-12:28:34] [V] [TRT] >>>>>>>>>>>>>>> Chose Runner Type: CublasConvolution Tactic: 0
[03/19/2022-12:28:34] [V] [TRT] *************** Autotuning format combination: Float(3136,1,3136,3136) -> Float(1024,1,1024,1024) ***************
[03/19/2022-12:28:34] [V] [TRT] --------------- Timing Runner: MatMul + b3/read:0 + (Unnamed Layer* 21) [Shuffle] + unsqueeze_node_after_b3/read:0 + (Unnamed Layer* 21) [Shuffle] + add_2 + Relu_2 (CudnnConvolution)
[03/19/2022-12:28:34] [V] [TRT] CudnnConvolution has no valid tactics for this config, skipping
[03/19/2022-12:28:34] [V] [TRT] --------------- Timing Runner: MatMul + b3/read:0 + (Unnamed Layer* 21) [Shuffle] + unsqueeze_node_after_b3/read:0 + (Unnamed Layer* 21) [Shuffle] + add_2 + Relu_2 (CublasConvolution)
[03/19/2022-12:28:34] [V] [TRT] CublasConvolution has no valid tactics for this config, skipping
[03/19/2022-12:28:34] [V] [TRT] --------------- Timing Runner: MatMul + b3/read:0 + (Unnamed Layer* 21) [Shuffle] + unsqueeze_node_after_b3/read:0 + (Unnamed Layer* 21) [Shuffle] + add_2 + Relu_2 (CaskConvolution)
[03/19/2022-12:28:34] [V] [TRT] MatMul + b3/read:0 + (Unnamed Layer* 21) [Shuffle] + unsqueeze_node_after_b3/read:0 + (Unnamed Layer* 21) [Shuffle] + add_2 + Relu_2 Set Tactic Name: maxwell_scudnn_128x64_sliced1x2_ldg4_relu_exp_interior_nhwc_tn_v1 Tactic: 3886731678879822788
[03/19/2022-12:28:34] [V] [TRT] Tactic: 3886731678879822788 Time: 0.188084
[03/19/2022-12:28:34] [V] [TRT] MatMul + b3/read:0 + (Unnamed Layer* 21) [Shuffle] + unsqueeze_node_after_b3/read:0 + (Unnamed Layer* 21) [Shuffle] + add_2 + Relu_2 Set Tactic Name: maxwell_scudnn_128x32_sliced1x4_ldg4_relu_exp_interior_nhwc_tn_v1 Tactic: 6629944304117643200
[03/19/2022-12:28:34] [V] [TRT] Tactic: 6629944304117643200 Time: 0.138568
[03/19/2022-12:28:34] [V] [TRT] MatMul + b3/read:0 + (Unnamed Layer* 21) [Shuffle] + unsqueeze_node_after_b3/read:0 + (Unnamed Layer* 21) [Shuffle] + add_2 + Relu_2 Set Tactic Name: maxwell_scudnn_128x32_sliced1x4_ldg4_relu_exp_small_nhwc_tn_v1 Tactic: -9153228964338181824
[03/19/2022-12:28:34] [V] [TRT] Tactic: -9153228964338181824 Time: 0.140276
[03/19/2022-12:28:34] [V] [TRT] MatMul + b3/read:0 + (Unnamed Layer* 21) [Shuffle] + unsqueeze_node_after_b3/read:0 + (Unnamed Layer* 21) [Shuffle] + add_2 + Relu_2 Set Tactic Name: maxwell_scudnn_128x64_sliced1x2_ldg4_relu_exp_small_nhwc_tn_v1 Tactic: -7394439838318485025
[03/19/2022-12:28:34] [V] [TRT] Tactic: -7394439838318485025 Time: 0.187388
[03/19/2022-12:28:34] [V] [TRT] Fastest Tactic: 6629944304117643200 Time: 0.138568
[03/19/2022-12:28:34] [V] [TRT] >>>>>>>>>>>>>>> Chose Runner Type: CaskConvolution Tactic: 6629944304117643200
[03/19/2022-12:28:34] [V] [TRT] *************** Autotuning format combination: Half(3136,1,1,1) -> Half(1024,1,1,1) ***************
[03/19/2022-12:28:34] [V] [TRT] --------------- Timing Runner: MatMul + b3/read:0 + (Unnamed Layer* 21) [Shuffle] + unsqueeze_node_after_b3/read:0 + (Unnamed Layer* 21) [Shuffle] + add_2 + Relu_2 (CudnnConvolution)
[03/19/2022-12:28:34] [V] [TRT] Tactic: 0 Time: 0.275436
[03/19/2022-12:28:34] [V] [TRT] Tactic: 1 Time: 0.283292
[03/19/2022-12:28:34] [V] [TRT] Tactic: 2 Time: 0.37946
[03/19/2022-12:28:34] [V] [TRT] Tactic: 4 skipped. Scratch requested: 7527202816, available: 1073741824
[03/19/2022-12:28:34] [V] [TRT] Tactic: 5 Time: 5.76184
[03/19/2022-12:28:34] [V] [TRT] Fastest Tactic: 0 Time: 0.275436
[03/19/2022-12:28:34] [V] [TRT] --------------- Timing Runner: MatMul + b3/read:0 + (Unnamed Layer* 21) [Shuffle] + unsqueeze_node_after_b3/read:0 + (Unnamed Layer* 21) [Shuffle] + add_2 + Relu_2 (CublasConvolution)
[03/19/2022-12:28:34] [V] [TRT] CublasConvolution has no valid tactics for this config, skipping
[03/19/2022-12:28:35] [V] [TRT] --------------- Timing Runner: MatMul + b3/read:0 + (Unnamed Layer* 21) [Shuffle] + unsqueeze_node_after_b3/read:0 + (Unnamed Layer* 21) [Shuffle] + add_2 + Relu_2 (CaskConvolution)
[03/19/2022-12:28:35] [V] [TRT] CaskConvolution has no valid tactics for this config, skipping
[03/19/2022-12:28:35] [V] [TRT] >>>>>>>>>>>>>>> Chose Runner Type: CudnnConvolution Tactic: 0
[03/19/2022-12:28:35] [V] [TRT] *************** Autotuning Reformat:Float(1024,1,1,1) -> Float(1024,1,1024,1024) ***************
[03/19/2022-12:28:35] [V] [TRT] --------------- Timing Runner: Optimizer Reformat (Reformat)
[03/19/2022-12:28:35] [V] [TRT] Tactic: 1002 Time: 0.004036
[03/19/2022-12:28:35] [V] [TRT] Tactic: 0 Time: 0.00332
[03/19/2022-12:28:35] [V] [TRT] Fastest Tactic: 0 Time: 0.00332
[03/19/2022-12:28:35] [V] [TRT] *************** Autotuning Reformat:Float(1024,1,1,1) -> Half(1024,1,1,1) ***************
[03/19/2022-12:28:35] [V] [TRT] --------------- Timing Runner: Optimizer Reformat (Reformat)
[03/19/2022-12:28:35] [V] [TRT] Tactic: 1002 Time: 0.003636
[03/19/2022-12:28:35] [V] [TRT] Tactic: 0 Time: 0.004468
[03/19/2022-12:28:35] [V] [TRT] Fastest Tactic: 1002 Time: 0.003636
[03/19/2022-12:28:35] [V] [TRT] *************** Autotuning Reformat:Float(1024,1,1024,1024) -> Float(1024,1,1,1) ***************
[03/19/2022-12:28:35] [V] [TRT] --------------- Timing Runner: Optimizer Reformat (Reformat)
[03/19/2022-12:28:35] [V] [TRT] Tactic: 1002 Time: 0.003896
[03/19/2022-12:28:35] [V] [TRT] Tactic: 0 Time: 0.003444
[03/19/2022-12:28:35] [V] [TRT] Fastest Tactic: 0 Time: 0.003444
[03/19/2022-12:28:35] [V] [TRT] *************** Autotuning Reformat:Float(1024,1,1024,1024) -> Half(1024,1,1,1) ***************
[03/19/2022-12:28:35] [V] [TRT] --------------- Timing Runner: Optimizer Reformat (Reformat)
[03/19/2022-12:28:35] [V] [TRT] Tactic: 1002 Time: 0.003628
[03/19/2022-12:28:35] [V] [TRT] Tactic: 0 Time: 0.003376
[03/19/2022-12:28:35] [V] [TRT] Fastest Tactic: 0 Time: 0.003376
[03/19/2022-12:28:35] [V] [TRT] *************** Autotuning Reformat:Half(1024,1,1,1) -> Float(1024,1,1,1) ***************
[03/19/2022-12:28:35] [V] [TRT] --------------- Timing Runner: Optimizer Reformat (Reformat)
[03/19/2022-12:28:35] [V] [TRT] Tactic: 1002 Time: 0.004464
[03/19/2022-12:28:35] [V] [TRT] Tactic: 0 Time: 0.003244
[03/19/2022-12:28:35] [V] [TRT] Fastest Tactic: 0 Time: 0.003244
[03/19/2022-12:28:35] [V] [TRT] *************** Autotuning Reformat:Half(1024,1,1,1) -> Float(1024,1,1024,1024) ***************
[03/19/2022-12:28:35] [V] [TRT] --------------- Timing Runner: Optimizer Reformat (Reformat)
[03/19/2022-12:28:35] [V] [TRT] Tactic: 1002 Time: 0.00434
[03/19/2022-12:28:35] [V] [TRT] Tactic: 0 Time: 0.0035
[03/19/2022-12:28:35] [V] [TRT] Fastest Tactic: 0 Time: 0.0035
[03/19/2022-12:28:35] [V] [TRT] *************** Autotuning format combination: Float(1024,1,1,1) -> Float(10,1,1,1) ***************
[03/19/2022-12:28:35] [V] [TRT] --------------- Timing Runner: MatMul_1 + b4/read:0 + (Unnamed Layer* 37) [Shuffle] + unsqueeze_node_after_b4/read:0 + (Unnamed Layer* 37) [Shuffle] + add_3 (CudaDepthwiseConvolution)
[03/19/2022-12:28:35] [V] [TRT] CudaDepthwiseConvolution has no valid tactics for this config, skipping
[03/19/2022-12:28:35] [V] [TRT] --------------- Timing Runner: MatMul_1 + b4/read:0 + (Unnamed Layer* 37) [Shuffle] + unsqueeze_node_after_b4/read:0 + (Unnamed Layer* 37) [Shuffle] + add_3 (FusedConvActConvolution)
[03/19/2022-12:28:35] [V] [TRT] FusedConvActConvolution has no valid tactics for this config, skipping
[03/19/2022-12:28:35] [V] [TRT] --------------- Timing Runner: MatMul_1 + b4/read:0 + (Unnamed Layer* 37) [Shuffle] + unsqueeze_node_after_b4/read:0 + (Unnamed Layer* 37) [Shuffle] + add_3 (CudnnConvolution)
[03/19/2022-12:28:35] [V] [TRT] Tactic: 0 Time: 0.12036
[03/19/2022-12:28:35] [V] [TRT] Tactic: 1 Time: 0.051516
[03/19/2022-12:28:35] [V] [TRT] Tactic: 2 Time: 0.146736
[03/19/2022-12:28:35] [V] [TRT] Tactic: 4 Time: 0.306836
[03/19/2022-12:28:35] [V] [TRT] Tactic: 5 Time: 0.09408
[03/19/2022-12:28:35] [V] [TRT] Fastest Tactic: 1 Time: 0.051516
[03/19/2022-12:28:35] [V] [TRT] --------------- Timing Runner: MatMul_1 + b4/read:0 + (Unnamed Layer* 37) [Shuffle] + unsqueeze_node_after_b4/read:0 + (Unnamed Layer* 37) [Shuffle] + add_3 (CublasConvolution)
[03/19/2022-12:28:35] [V] [TRT] Tactic: 0 Time: 0.008468
[03/19/2022-12:28:35] [V] [TRT] Tactic: 1 Time: 0.011704
[03/19/2022-12:28:35] [V] [TRT] Fastest Tactic: 0 Time: 0.008468
[03/19/2022-12:28:35] [V] [TRT] --------------- Timing Runner: MatMul_1 + b4/read:0 + (Unnamed Layer* 37) [Shuffle] + unsqueeze_node_after_b4/read:0 + (Unnamed Layer* 37) [Shuffle] + add_3 (CaskConvolution)
[03/19/2022-12:28:35] [V] [TRT] MatMul_1 + b4/read:0 + (Unnamed Layer* 37) [Shuffle] + unsqueeze_node_after_b4/read:0 + (Unnamed Layer* 37) [Shuffle] + add_3 Set Tactic Name: maxwell_scudnn_128x32_relu_medium_nn_v1 Tactic: 1062367460111450758
[03/19/2022-12:28:35] [V] [TRT] Tactic: 1062367460111450758 Time: 0.086012
[03/19/2022-12:28:35] [V] [TRT] MatMul_1 + b4/read:0 + (Unnamed Layer* 37) [Shuffle] + unsqueeze_node_after_b4/read:0 + (Unnamed Layer* 37) [Shuffle] + add_3 Set Tactic Name: maxwell_scudnn_128x32_relu_interior_nn_v0 Tactic: 1698681053543049347
[03/19/2022-12:28:35] [V] [TRT] Tactic: 1698681053543049347 Time: 0.061428
[03/19/2022-12:28:35] [V] [TRT] MatMul_1 + b4/read:0 + (Unnamed Layer* 37) [Shuffle] + unsqueeze_node_after_b4/read:0 + (Unnamed Layer* 37) [Shuffle] + add_3 Set Tactic Name: maxwell_scudnn_128x128_relu_medium_nn_v1 Tactic: 4501471010995462441
[03/19/2022-12:28:35] [V] [TRT] Tactic: 4501471010995462441 Time: 0.09412
[03/19/2022-12:28:35] [V] [TRT] MatMul_1 + b4/read:0 + (Unnamed Layer* 37) [Shuffle] + unsqueeze_node_after_b4/read:0 + (Unnamed Layer* 37) [Shuffle] + add_3 Set Tactic Name: maxwell_scudnn_128x64_relu_small_nn_v1 Tactic: 5137655947464784826
[03/19/2022-12:28:35] [V] [TRT] Tactic: 5137655947464784826 Time: 0.062884
[03/19/2022-12:28:35] [V] [TRT] MatMul_1 + b4/read:0 + (Unnamed Layer* 37) [Shuffle] + unsqueeze_node_after_b4/read:0 + (Unnamed Layer* 37) [Shuffle] + add_3 Set Tactic Name: maxwell_scudnn_128x128_relu_small_nn_v0 Tactic: 5288347012147084929
[03/19/2022-12:28:35] [V] [TRT] Tactic: 5288347012147084929 Time: 0.091056
[03/19/2022-12:28:35] [V] [TRT] MatMul_1 + b4/read:0 + (Unnamed Layer* 37) [Shuffle] + unsqueeze_node_after_b4/read:0 + (Unnamed Layer* 37) [Shuffle] + add_3 Set Tactic Name: maxwell_scudnn_128x128_relu_interior_nn_v1 Tactic: 5326823351883942011
[03/19/2022-12:28:35] [V] [TRT] Tactic: 5326823351883942011 Time: 0.090736
[03/19/2022-12:28:35] [V] [TRT] MatMul_1 + b4/read:0 + (Unnamed Layer* 37) [Shuffle] + unsqueeze_node_after_b4/read:0 + (Unnamed Layer* 37) [Shuffle] + add_3 Set Tactic Name: maxwell_scudnn_128x64_relu_interior_nn_v0 Tactic: 5500448035057547314
[03/19/2022-12:28:35] [V] [TRT] Tactic: 5500448035057547314 Time: 0.078208
[03/19/2022-12:28:35] [V] [TRT] MatMul_1 + b4/read:0 + (Unnamed Layer* 37) [Shuffle] + unsqueeze_node_after_b4/read:0 + (Unnamed Layer* 37) [Shuffle] + add_3 Set Tactic Name: maxwell_scudnn_128x64_relu_medium_nn_v1 Tactic: 6645123197870846056
[03/19/2022-12:28:35] [V] [TRT] Tactic: 6645123197870846056 Time: 0.068264
[03/19/2022-12:28:35] [V] [TRT] MatMul_1 + b4/read:0 + (Unnamed Layer* 37) [Shuffle] + unsqueeze_node_after_b4/read:0 + (Unnamed Layer* 37) [Shuffle] + add_3 Set Tactic Name: maxwell_scudnn_128x32_relu_small_nn_v0 Tactic: 7144526460361122478
[03/19/2022-12:28:35] [V] [TRT] Tactic: 7144526460361122478 Time: 0.064184
[03/19/2022-12:28:35] [V] [TRT] MatMul_1 + b4/read:0 + (Unnamed Layer* 37) [Shuffle] + unsqueeze_node_after_b4/read:0 + (Unnamed Layer* 37) [Shuffle] + add_3 Set Tactic Name: maxwell_scudnn_128x128_relu_medium_nn_v0 Tactic: -8262349710178828730
[03/19/2022-12:28:35] [V] [TRT] Tactic: -8262349710178828730 Time: 0.093424
[03/19/2022-12:28:35] [V] [TRT] MatMul_1 + b4/read:0 + (Unnamed Layer* 37) [Shuffle] + unsqueeze_node_after_b4/read:0 + (Unnamed Layer* 37) [Shuffle] + add_3 Set Tactic Name: maxwell_scudnn_128x32_relu_interior_nn_v1 Tactic: -6576203419454146580
[03/19/2022-12:28:35] [V] [TRT] Tactic: -6576203419454146580 Time: 0.065884
[03/19/2022-12:28:35] [V] [TRT] MatMul_1 + b4/read:0 + (Unnamed Layer* 37) [Shuffle] + unsqueeze_node_after_b4/read:0 + (Unnamed Layer* 37) [Shuffle] + add_3 Set Tactic Name: maxwell_scudnn_128x32_relu_medium_nn_v0 Tactic: -4787320710726427159
[03/19/2022-12:28:35] [V] [TRT] Tactic: -4787320710726427159 Time: 0.069364
[03/19/2022-12:28:35] [V] [TRT] MatMul_1 + b4/read:0 + (Unnamed Layer* 37) [Shuffle] + unsqueeze_node_after_b4/read:0 + (Unnamed Layer* 37) [Shuffle] + add_3 Set Tactic Name: maxwell_scudnn_128x32_relu_small_nn_v1 Tactic: -3456450830548107839
[03/19/2022-12:28:35] [V] [TRT] Tactic: -3456450830548107839 Time: 0.069812
[03/19/2022-12:28:35] [V] [TRT] MatMul_1 + b4/read:0 + (Unnamed Layer* 37) [Shuffle] + unsqueeze_node_after_b4/read:0 + (Unnamed Layer* 37) [Shuffle] + add_3 Set Tactic Name: maxwell_scudnn_128x64_relu_medium_nn_v0 Tactic: -1218658103698133241
[03/19/2022-12:28:35] [V] [TRT] Tactic: -1218658103698133241 Time: 0.084524
[03/19/2022-12:28:35] [V] [TRT] MatMul_1 + b4/read:0 + (Unnamed Layer* 37) [Shuffle] + unsqueeze_node_after_b4/read:0 + (Unnamed Layer* 37) [Shuffle] + add_3 Set Tactic Name: maxwell_scudnn_128x64_relu_small_nn_v0 Tactic: -836875257600482091
[03/19/2022-12:28:35] [V] [TRT] Tactic: -836875257600482091 Time: 0.07974
[03/19/2022-12:28:35] [V] [TRT] MatMul_1 + b4/read:0 + (Unnamed Layer* 37) [Shuffle] + unsqueeze_node_after_b4/read:0 + (Unnamed Layer* 37) [Shuffle] + add_3 Set Tactic Name: maxwell_scudnn_128x128_relu_small_nn_v1 Tactic: -410470605513481746
[03/19/2022-12:28:35] [V] [TRT] Tactic: -410470605513481746 Time: 0.090544
[03/19/2022-12:28:35] [V] [TRT] MatMul_1 + b4/read:0 + (Unnamed Layer* 37) [Shuffle] + unsqueeze_node_after_b4/read:0 + (Unnamed Layer* 37) [Shuffle] + add_3 Set Tactic Name: maxwell_scudnn_128x128_relu_interior_nn_v0 Tactic: -377491875521947884
[03/19/2022-12:28:35] [V] [TRT] Tactic: -377491875521947884 Time: 0.089904
[03/19/2022-12:28:35] [V] [TRT] MatMul_1 + b4/read:0 + (Unnamed Layer* 37) [Shuffle] + unsqueeze_node_after_b4/read:0 + (Unnamed Layer* 37) [Shuffle] + add_3 Set Tactic Name: maxwell_scudnn_128x64_relu_interior_nn_v1 Tactic: -37215280111360163
[03/19/2022-12:28:35] [V] [TRT] Tactic: -37215280111360163 Time: 0.06112
[03/19/2022-12:28:35] [V] [TRT] Fastest Tactic: -37215280111360163 Time: 0.06112
[03/19/2022-12:28:35] [V] [TRT] >>>>>>>>>>>>>>> Chose Runner Type: CublasConvolution Tactic: 0
[03/19/2022-12:28:35] [V] [TRT] *************** Autotuning format combination: Float(1024,1,1024,1024) -> Float(10,1,10,10) ***************
[03/19/2022-12:28:35] [V] [TRT] --------------- Timing Runner: MatMul_1 + b4/read:0 + (Unnamed Layer* 37) [Shuffle] + unsqueeze_node_after_b4/read:0 + (Unnamed Layer* 37) [Shuffle] + add_3 (CudnnConvolution)
[03/19/2022-12:28:35] [V] [TRT] CudnnConvolution has no valid tactics for this config, skipping
[03/19/2022-12:28:35] [V] [TRT] --------------- Timing Runner: MatMul_1 + b4/read:0 + (Unnamed Layer* 37) [Shuffle] + unsqueeze_node_after_b4/read:0 + (Unnamed Layer* 37) [Shuffle] + add_3 (CublasConvolution)
[03/19/2022-12:28:35] [V] [TRT] CublasConvolution has no valid tactics for this config, skipping
[03/19/2022-12:28:35] [V] [TRT] --------------- Timing Runner: MatMul_1 + b4/read:0 + (Unnamed Layer* 37) [Shuffle] + unsqueeze_node_after_b4/read:0 + (Unnamed Layer* 37) [Shuffle] + add_3 (CaskConvolution)
[03/19/2022-12:28:35] [V] [TRT] CaskConvolution has no valid tactics for this config, skipping
[03/19/2022-12:28:35] [V] [TRT] *************** Autotuning format combination: Half(1024,1,1,1) -> Half(10,1,1,1) ***************
[03/19/2022-12:28:35] [V] [TRT] --------------- Timing Runner: MatMul_1 + b4/read:0 + (Unnamed Layer* 37) [Shuffle] + unsqueeze_node_after_b4/read:0 + (Unnamed Layer* 37) [Shuffle] + add_3 (CudnnConvolution)
[03/19/2022-12:28:35] [V] [TRT] Tactic: 0 Time: 0.07108
[03/19/2022-12:28:35] [V] [TRT] Tactic: 1 Time: 0.068656
[03/19/2022-12:28:35] [V] [TRT] Tactic: 2 Time: 0.156324
[03/19/2022-12:28:35] [V] [TRT] Tactic: 4 Time: 0.30854
[03/19/2022-12:28:35] [V] [TRT] Tactic: 5 Time: 0.092832
[03/19/2022-12:28:35] [V] [TRT] Fastest Tactic: 1 Time: 0.068656
[03/19/2022-12:28:35] [V] [TRT] --------------- Timing Runner: MatMul_1 + b4/read:0 + (Unnamed Layer* 37) [Shuffle] + unsqueeze_node_after_b4/read:0 + (Unnamed Layer* 37) [Shuffle] + add_3 (CublasConvolution)
[03/19/2022-12:28:35] [V] [TRT] CublasConvolution has no valid tactics for this config, skipping
[03/19/2022-12:28:35] [V] [TRT] --------------- Timing Runner: MatMul_1 + b4/read:0 + (Unnamed Layer* 37) [Shuffle] + unsqueeze_node_after_b4/read:0 + (Unnamed Layer* 37) [Shuffle] + add_3 (CaskConvolution)
[03/19/2022-12:28:35] [V] [TRT] CaskConvolution has no valid tactics for this config, skipping
[03/19/2022-12:28:35] [V] [TRT] >>>>>>>>>>>>>>> Chose Runner Type: CudnnConvolution Tactic: 1
[03/19/2022-12:28:35] [V] [TRT] *************** Autotuning Reformat:Float(10,1,1,1) -> Half(10,1,1,1) ***************
[03/19/2022-12:28:35] [V] [TRT] --------------- Timing Runner: Optimizer Reformat (Reformat)
[03/19/2022-12:28:35] [V] [TRT] Tactic: 1002 Time: 0.004256
[03/19/2022-12:28:35] [V] [TRT] Tactic: 0 Time: 0.003572
[03/19/2022-12:28:35] [V] [TRT] Fastest Tactic: 0 Time: 0.003572
[03/19/2022-12:28:35] [V] [TRT] *************** Autotuning Reformat:Float(10,1,10,10) -> Float(10,1,1,1) ***************
[03/19/2022-12:28:35] [V] [TRT] --------------- Timing Runner: Optimizer Reformat (Reformat)
[03/19/2022-12:28:35] [V] [TRT] Tactic: 1002 Time: 0.004588
[03/19/2022-12:28:35] [V] [TRT] Tactic: 0 Time: 0.00338
[03/19/2022-12:28:35] [V] [TRT] Fastest Tactic: 0 Time: 0.00338
[03/19/2022-12:28:35] [V] [TRT] *************** Autotuning Reformat:Float(10,1,10,10) -> Half(10,1,1,1) ***************
[03/19/2022-12:28:35] [V] [TRT] --------------- Timing Runner: Optimizer Reformat (Reformat)
[03/19/2022-12:28:35] [V] [TRT] Tactic: 1002 Time: 0.004528
[03/19/2022-12:28:35] [V] [TRT] Tactic: 0 Time: 0.003196
[03/19/2022-12:28:35] [V] [TRT] Fastest Tactic: 0 Time: 0.003196
[03/19/2022-12:28:35] [V] [TRT] *************** Autotuning Reformat:Half(10,1,1,1) -> Float(10,1,1,1) ***************
[03/19/2022-12:28:35] [V] [TRT] --------------- Timing Runner: Optimizer Reformat (Reformat)
[03/19/2022-12:28:35] [V] [TRT] Tactic: 1002 Time: 0.004536
[03/19/2022-12:28:35] [V] [TRT] Tactic: 0 Time: 0.003392
[03/19/2022-12:28:35] [V] [TRT] Fastest Tactic: 0 Time: 0.003392
[03/19/2022-12:28:35] [V] [TRT] *************** Autotuning format combination: Float(10,1,1,1) -> Float(10,1) ***************
[03/19/2022-12:28:35] [V] [TRT] --------------- Timing Runner: copied_squeeze_after_add_3 (Shuffle)
[03/19/2022-12:28:35] [V] [TRT] Tactic: 0 Time: 0.002232
[03/19/2022-12:28:35] [V] [TRT] Fastest Tactic: 0 Time: 0.002232
[03/19/2022-12:28:35] [V] [TRT] >>>>>>>>>>>>>>> Chose Runner Type: Shuffle Tactic: 0
[03/19/2022-12:28:35] [V] [TRT] *************** Autotuning format combination: Half(10,1,1,1) -> Half(10,1) ***************
[03/19/2022-12:28:35] [V] [TRT] --------------- Timing Runner: copied_squeeze_after_add_3 (Shuffle)
[03/19/2022-12:28:35] [V] [TRT] Tactic: 0 Time: 0.00254
[03/19/2022-12:28:35] [V] [TRT] Fastest Tactic: 0 Time: 0.00254
[03/19/2022-12:28:35] [V] [TRT] >>>>>>>>>>>>>>> Chose Runner Type: Shuffle Tactic: 0
[03/19/2022-12:28:35] [V] [TRT] *************** Autotuning Reformat:Float(10,1) -> Half(10,1) ***************
[03/19/2022-12:28:35] [V] [TRT] --------------- Timing Runner: Optimizer Reformat (Reformat)
[03/19/2022-12:28:35] [V] [TRT] Tactic: 1002 Time: 0.004464
[03/19/2022-12:28:35] [V] [TRT] Tactic: 0 Time: 0.003696
[03/19/2022-12:28:35] [V] [TRT] Fastest Tactic: 0 Time: 0.003696
[03/19/2022-12:28:35] [V] [TRT] *************** Autotuning Reformat:Half(10,1) -> Float(10,1) ***************
[03/19/2022-12:28:35] [V] [TRT] --------------- Timing Runner: Optimizer Reformat (Reformat)
[03/19/2022-12:28:35] [V] [TRT] Tactic: 1002 Time: 0.004528
[03/19/2022-12:28:35] [V] [TRT] Tactic: 0 Time: 0.003296
[03/19/2022-12:28:35] [V] [TRT] Fastest Tactic: 0 Time: 0.003296
[03/19/2022-12:28:35] [V] [TRT] *************** Autotuning format combination: Float(10,1) -> Float(1,1), Int32(1,1) ***************
[03/19/2022-12:28:35] [V] [TRT] --------------- Timing Runner: y + z (LogSoftmaxTopK)
[03/19/2022-12:28:35] [V] [TRT] Tactic: 1001 Time: 0.003352
[03/19/2022-12:28:35] [V] [TRT] Tactic: 1002 Time: 0.014508
[03/19/2022-12:28:35] [V] [TRT] Fastest Tactic: 1001 Time: 0.003352
[03/19/2022-12:28:35] [V] [TRT] >>>>>>>>>>>>>>> Chose Runner Type: LogSoftmaxTopK Tactic: 1001
[03/19/2022-12:28:35] [V] [TRT] *************** Autotuning format combination: Half(10,1) -> Half(1,1), Int32(1,1) ***************
[03/19/2022-12:28:35] [V] [TRT] --------------- Timing Runner: y + z (LogSoftmaxTopK)
[03/19/2022-12:28:35] [V] [TRT] Tactic: 1001 Time: 0.003228
[03/19/2022-12:28:35] [V] [TRT] Tactic: 1002 Time: 0.014576
[03/19/2022-12:28:35] [V] [TRT] Fastest Tactic: 1001 Time: 0.003228
[03/19/2022-12:28:35] [V] [TRT] >>>>>>>>>>>>>>> Chose Runner Type: LogSoftmaxTopK Tactic: 1001
[03/19/2022-12:28:35] [V] [TRT] *************** Autotuning Reformat:Float(1,1) -> Half(1,1) ***************
