cookbook/08-Tool/trtexec/result-FP32.log
[08/17/2022-07:50:54] [V] [TRT] *************** Autotuning Reformat: Float(784,784,28,1) -> Float(784,1,28,1) ***************
[08/17/2022-07:50:54] [V] [TRT] --------------- Timing Runner: Optimizer Reformat(tensor-0 -> <out>) (Reformat)
[08/17/2022-07:50:54] [V] [TRT] Tactic: 0x00000000000003e8 Time: 0.00189931
[08/17/2022-07:50:54] [V] [TRT] Tactic: 0x00000000000003ea Time: 0.00529879
[08/17/2022-07:50:54] [V] [TRT] Tactic: 0x0000000000000000 Time: 0.00186752
[08/17/2022-07:50:54] [V] [TRT] Fastest Tactic: 0x0000000000000000 Time: 0.00186752
[08/17/2022-07:50:54] [V] [TRT] =============== Computing reformatting costs
[08/17/2022-07:50:54] [V] [TRT] *************** Autotuning Reformat: Float(25088,1,896,32) -> Float(25088,784,28,1) ***************
[08/17/2022-07:50:54] [V] [TRT] --------------- Timing Runner: Optimizer Reformat(tensor-2 -> <out>) (Reformat)
[08/17/2022-07:50:54] [V] [TRT] Tactic: 0x00000000000003e8 Time: 0.00600419
[08/17/2022-07:50:54] [V] [TRT] Tactic: 0x00000000000003ea Time: 0.0137243
[08/17/2022-07:50:54] [V] [TRT] Tactic: 0x0000000000000000 Time: 0.00597829
[08/17/2022-07:50:54] [V] [TRT] Fastest Tactic: 0x0000000000000000 Time: 0.00597829
[08/17/2022-07:50:54] [V] [TRT] =============== Computing reformatting costs
[08/17/2022-07:50:54] [V] [TRT] *************** Autotuning Reformat: Float(6272,196,14,1) -> Float(6272,1,448,32) ***************
[08/17/2022-07:50:54] [V] [TRT] --------------- Timing Runner: Optimizer Reformat(<in> -> tensor-3) (Reformat)
[08/17/2022-07:50:54] [V] [TRT] Tactic: 0x00000000000003e8 Time: 0.00317376
[08/17/2022-07:50:54] [V] [TRT] Tactic: 0x00000000000003ea Time: 0.01407
[08/17/2022-07:50:54] [V] [TRT] Tactic: 0x0000000000000000 Time: 0.00315995
[08/17/2022-07:50:54] [V] [TRT] Fastest Tactic: 0x0000000000000000 Time: 0.00315995
[08/17/2022-07:50:54] [V] [TRT] =============== Computing reformatting costs
[08/17/2022-07:50:54] [V] [TRT] *************** Autotuning Reformat: Float(6272,196,14,1) -> Float(6272,1,448,32) ***************
[08/17/2022-07:50:54] [V] [TRT] --------------- Timing Runner: Optimizer Reformat(tensor-3 -> <out>) (Reformat)
[08/17/2022-07:50:54] [V] [TRT] Tactic: 0x00000000000003e8 Time: 0.00318903
[08/17/2022-07:50:54] [V] [TRT] Tactic: 0x00000000000003ea Time: 0.0140567
[08/17/2022-07:50:54] [V] [TRT] Tactic: 0x0000000000000000 Time: 0.00316104
[08/17/2022-07:50:54] [V] [TRT] Fastest Tactic: 0x0000000000000000 Time: 0.00316104
[08/17/2022-07:50:54] [V] [TRT] *************** Autotuning Reformat: Float(6272,1,448,32) -> Float(6272,196,14,1) ***************
[08/17/2022-07:50:54] [V] [TRT] --------------- Timing Runner: Optimizer Reformat(tensor-3 -> <out>) (Reformat)
[08/17/2022-07:50:54] [V] [TRT] Tactic: 0x00000000000003e8 Time: 0.00468586
[08/17/2022-07:50:54] [V] [TRT] Tactic: 0x00000000000003ea Time: 0.0136844
[08/17/2022-07:50:54] [V] [TRT] Tactic: 0x0000000000000000 Time: 0.00389288
[08/17/2022-07:50:54] [V] [TRT] Fastest Tactic: 0x0000000000000000 Time: 0.00389288
[08/17/2022-07:50:54] [V] [TRT] =============== Computing reformatting costs
[08/17/2022-07:50:54] [V] [TRT] *************** Autotuning Reformat: Float(12544,1,896,64) -> Float(12544,196,14,1) ***************
[08/17/2022-07:50:54] [V] [TRT] --------------- Timing Runner: Optimizer Reformat(tensor-5 -> <out>) (Reformat)
[08/17/2022-07:50:54] [V] [TRT] Tactic: 0x00000000000003e8 Time: 0.00408346
[08/17/2022-07:50:54] [V] [TRT] Tactic: 0x00000000000003ea Time: 0.0135115
[08/17/2022-07:50:54] [V] [TRT] Tactic: 0x0000000000000000 Time: 0.00407594
[08/17/2022-07:50:54] [V] [TRT] Fastest Tactic: 0x0000000000000000 Time: 0.00407594
[08/17/2022-07:50:54] [V] [TRT] =============== Computing reformatting costs
[08/17/2022-07:50:54] [V] [TRT] *************** Autotuning Reformat: Float(3136,49,7,1) -> Float(3136,1,448,64) ***************
[08/17/2022-07:50:54] [V] [TRT] --------------- Timing Runner: Optimizer Reformat(<in> -> tensor-6) (Reformat)
[08/17/2022-07:50:54] [V] [TRT] Tactic: 0x00000000000003e8 Time: 0.00255216
[08/17/2022-07:50:54] [V] [TRT] Tactic: 0x00000000000003ea Time: 0.0130298
[08/17/2022-07:50:54] [V] [TRT] Tactic: 0x0000000000000000 Time: 0.00290423
[08/17/2022-07:50:54] [V] [TRT] Fastest Tactic: 0x00000000000003e8 Time: 0.00255216
[08/17/2022-07:50:54] [V] [TRT] *************** Autotuning Reformat: Float(3136,49,7,1) -> Float(98,49:32,7,1) ***************
[08/17/2022-07:50:54] [V] [TRT] --------------- Timing Runner: Optimizer Reformat(<in> -> tensor-6) (Reformat)
[08/17/2022-07:50:54] [V] [TRT] Tactic: 0x00000000000003e8 Time: 0.00290222
[08/17/2022-07:50:54] [V] [TRT] Tactic: 0x00000000000003ea Time: 0.0130327
[08/17/2022-07:50:54] [V] [TRT] Tactic: 0x0000000000000000 Time: 0.00290816
[08/17/2022-07:50:54] [V] [TRT] Fastest Tactic: 0x00000000000003e8 Time: 0.00290222
[08/17/2022-07:50:54] [V] [TRT] =============== Computing reformatting costs
[08/17/2022-07:50:54] [V] [TRT] *************** Autotuning Reformat: Float(3136,49,7,1) -> Float(3136,1,448,64) ***************
[08/17/2022-07:50:54] [V] [TRT] --------------- Timing Runner: Optimizer Reformat(tensor-6 -> <out>) (Reformat)
[08/17/2022-07:50:54] [V] [TRT] Tactic: 0x00000000000003e8 Time: 0.00268165
[08/17/2022-07:50:54] [V] [TRT] Tactic: 0x00000000000003ea Time: 0.0130726
[08/17/2022-07:50:54] [V] [TRT] Tactic: 0x0000000000000000 Time: 0.00277275
[08/17/2022-07:50:54] [V] [TRT] Fastest Tactic: 0x00000000000003e8 Time: 0.00268165
[08/17/2022-07:50:54] [V] [TRT] *************** Autotuning Reformat: Float(3136,49,7,1) -> Float(98,49:32,7,1) ***************
[08/17/2022-07:50:54] [V] [TRT] --------------- Timing Runner: Optimizer Reformat(tensor-6 -> <out>) (Reformat)
[08/17/2022-07:50:54] [V] [TRT] Tactic: 0x00000000000003e8 Time: 0.00290523
[08/17/2022-07:50:54] [V] [TRT] Tactic: 0x00000000000003ea Time: 0.012995
[08/17/2022-07:50:54] [V] [TRT] Tactic: 0x0000000000000000 Time: 0.00291108
[08/17/2022-07:50:54] [V] [TRT] Fastest Tactic: 0x00000000000003e8 Time: 0.00290523
[08/17/2022-07:50:54] [V] [TRT] *************** Autotuning Reformat: Float(3136,1,448,64) -> Float(3136,49,7,1) ***************
[08/17/2022-07:50:54] [V] [TRT] --------------- Timing Runner: Optimizer Reformat(tensor-6 -> <out>) (Reformat)
[08/17/2022-07:50:54] [V] [TRT] Tactic: 0x00000000000003e8 Time: 0.00260746
[08/17/2022-07:50:54] [V] [TRT] Tactic: 0x00000000000003ea Time: 0.013179
[08/17/2022-07:50:54] [V] [TRT] Tactic: 0x0000000000000000 Time: 0.00266015
[08/17/2022-07:50:54] [V] [TRT] Fastest Tactic: 0x00000000000003e8 Time: 0.00260746
[08/17/2022-07:50:54] [V] [TRT] *************** Autotuning Reformat: Float(3136,1,448,64) -> Float(98,49:32,7,1) ***************
[08/17/2022-07:50:54] [V] [TRT] --------------- Timing Runner: Optimizer Reformat(tensor-6 -> <out>) (Reformat)
[08/17/2022-07:50:54] [V] [TRT] Tactic: 0x00000000000003e8 Time: 0.00309311
[08/17/2022-07:50:54] [V] [TRT] Tactic: 0x00000000000003ea Time: 0.0107729
[08/17/2022-07:50:54] [V] [TRT] Tactic: 0x0000000000000000 Time: 0.00308756
[08/17/2022-07:50:54] [V] [TRT] Fastest Tactic: 0x0000000000000000 Time: 0.00308756
[08/17/2022-07:50:54] [V] [TRT] *************** Autotuning Reformat: Float(98,49:32,7,1) -> Float(3136,49,7,1) ***************
[08/17/2022-07:50:54] [V] [TRT] --------------- Timing Runner: Optimizer Reformat(tensor-6 -> <out>) (Reformat)
[08/17/2022-07:50:54] [V] [TRT] Tactic: 0x00000000000003e8 Time: 0.00362789
[08/17/2022-07:50:54] [V] [TRT] Tactic: 0x00000000000003ea Time: 0.0131391
[08/17/2022-07:50:54] [V] [TRT] Tactic: 0x0000000000000000 Time: 0.00277925
[08/17/2022-07:50:54] [V] [TRT] Fastest Tactic: 0x0000000000000000 Time: 0.00277925
[08/17/2022-07:50:54] [V] [TRT] *************** Autotuning Reformat: Float(98,49:32,7,1) -> Float(3136,1,448,64) ***************
[08/17/2022-07:50:54] [V] [TRT] --------------- Timing Runner: Optimizer Reformat(tensor-6 -> <out>) (Reformat)
[08/17/2022-07:50:54] [V] [TRT] Tactic: 0x00000000000003e8 Time: 0.00274884
[08/17/2022-07:50:54] [V] [TRT] Tactic: 0x00000000000003ea Time: 0.0108042
[08/17/2022-07:50:54] [V] [TRT] Tactic: 0x0000000000000000 Time: 0.00276062
[08/17/2022-07:50:54] [V] [TRT] Fastest Tactic: 0x00000000000003e8 Time: 0.00274884
[08/17/2022-07:50:54] [V] [TRT] =============== Computing reformatting costs
[08/17/2022-07:50:54] [V] [TRT] *************** Autotuning Reformat: Float(3136,1,1,1) -> Float(3136,1,3136,3136) ***************
[08/17/2022-07:50:54] [V] [TRT] --------------- Timing Runner: Optimizer Reformat(reshape_before_MatMul-9_out_tensor -> <out>) (Reformat)
[08/17/2022-07:50:54] [V] [TRT] Tactic: 0x00000000000003e8 Time: 0.00263514
[08/17/2022-07:50:54] [V] [TRT] Tactic: 0x00000000000003ea Time: 0.00681273
[08/17/2022-07:50:54] [V] [TRT] Tactic: 0x0000000000000000 Time: 0.00280238
[08/17/2022-07:50:54] [V] [TRT] Fastest Tactic: 0x00000000000003e8 Time: 0.00263514
[08/17/2022-07:50:54] [V] [TRT] *************** Autotuning Reformat: Float(3136,1,3136,3136) -> Float(3136,1,1,1) ***************
[08/17/2022-07:50:54] [V] [TRT] --------------- Timing Runner: Optimizer Reformat(reshape_before_MatMul-9_out_tensor -> <out>) (Reformat)
[08/17/2022-07:50:54] [V] [TRT] Tactic: 0x00000000000003e8 Time: 0.00265753
[08/17/2022-07:50:54] [V] [TRT] Tactic: 0x00000000000003ea Time: 0.00626484
[08/17/2022-07:50:54] [V] [TRT] Tactic: 0x0000000000000000 Time: 0.00212544
[08/17/2022-07:50:54] [V] [TRT] Fastest Tactic: 0x0000000000000000 Time: 0.00212544
[08/17/2022-07:50:54] [V] [TRT] *************** Autotuning Reformat: Float(98,1:32,1,1) -> Float(3136,1,1,1) ***************
[08/17/2022-07:50:54] [V] [TRT] --------------- Timing Runner: Optimizer Reformat(reshape_before_MatMul-9_out_tensor -> <out>) (Reformat)
[08/17/2022-07:50:54] [V] [TRT] Tactic: 0x00000000000003e8 Time: 0.00225336
[08/17/2022-07:50:54] [V] [TRT] Tactic: 0x00000000000003ea Time: 0.0354889
[08/17/2022-07:50:54] [V] [TRT] Tactic: 0x0000000000000000 Time: 0.002256
[08/17/2022-07:50:54] [V] [TRT] Fastest Tactic: 0x00000000000003e8 Time: 0.00225336
[08/17/2022-07:50:54] [V] [TRT] *************** Autotuning Reformat: Float(98,1:32,1,1) -> Float(3136,1,3136,3136) ***************
[08/17/2022-07:50:54] [V] [TRT] --------------- Timing Runner: Optimizer Reformat(reshape_before_MatMul-9_out_tensor -> <out>) (Reformat)
[08/17/2022-07:50:54] [V] [TRT] Tactic: 0x00000000000003e8 Time: 0.00236935
[08/17/2022-07:50:54] [V] [TRT] Tactic: 0x00000000000003ea Time: 0.011444
[08/17/2022-07:50:54] [V] [TRT] Tactic: 0x0000000000000000 Time: 0.00284101
[08/17/2022-07:50:54] [V] [TRT] Fastest Tactic: 0x00000000000003e8 Time: 0.00236935
[08/17/2022-07:50:54] [V] [TRT] =============== Computing reformatting costs
[08/17/2022-07:50:54] [V] [TRT] *************** Autotuning Reformat: Float(1024,1,1,1) -> Float(1024,1,1024,1024) ***************
[08/17/2022-07:50:54] [V] [TRT] --------------- Timing Runner: Optimizer Reformat(ReLU-11_out_tensor -> <out>) (Reformat)
[08/17/2022-07:50:54] [V] [TRT] Tactic: 0x00000000000003e8 Time: 0.00191147
[08/17/2022-07:50:54] [V] [TRT] Tactic: 0x00000000000003ea Time: 0.00529337
[08/17/2022-07:50:54] [V] [TRT] Tactic: 0x0000000000000000 Time: 0.00187322
[08/17/2022-07:50:54] [V] [TRT] Fastest Tactic: 0x0000000000000000 Time: 0.00187322
[08/17/2022-07:50:54] [V] [TRT] *************** Autotuning Reformat: Float(1024,1,1024,1024) -> Float(1024,1,1,1) ***************
[08/17/2022-07:50:54] [V] [TRT] --------------- Timing Runner: Optimizer Reformat(ReLU-11_out_tensor -> <out>) (Reformat)
[08/17/2022-07:50:54] [V] [TRT] Tactic: 0x00000000000003e8 Time: 0.00191342
[08/17/2022-07:50:54] [V] [TRT] Tactic: 0x00000000000003ea Time: 0.0057578
[08/17/2022-07:50:54] [V] [TRT] Tactic: 0x0000000000000000 Time: 0.00190781
[08/17/2022-07:50:54] [V] [TRT] Fastest Tactic: 0x0000000000000000 Time: 0.00190781
[08/17/2022-07:50:54] [V] [TRT] =============== Computing reformatting costs
[08/17/2022-07:50:54] [V] [TRT] *************** Autotuning Reformat: Float(10,1,10,10) -> Float(10,1,1,1) ***************
[08/17/2022-07:50:54] [V] [TRT] --------------- Timing Runner: Optimizer Reformat(MatMul-12_out_tensor -> <out>) (Reformat)
[08/17/2022-07:50:54] [V] [TRT] Tactic: 0x00000000000003e8 Time: 0.00202894
[08/17/2022-07:50:54] [V] [TRT] Tactic: 0x00000000000003ea Time: 0.0123611
[08/17/2022-07:50:54] [V] [TRT] Tactic: 0x0000000000000000 Time: 0.0027949
[08/17/2022-07:50:54] [V] [TRT] Fastest Tactic: 0x00000000000003e8 Time: 0.00202894
[08/17/2022-07:50:54] [V] [TRT] =============== Computing reformatting costs
[08/17/2022-07:50:54] [V] [TRT] =============== Computing reformatting costs
[08/17/2022-07:50:54] [V] [TRT] =============== Computing reformatting costs
[08/17/2022-07:50:54] [V] [TRT] =============== Computing reformatting costs
[08/17/2022-07:50:54] [V] [TRT] =============== Computing reformatting costs
[08/17/2022-07:50:54] [V] [TRT] =============== Computing reformatting costs
[08/17/2022-07:50:54] [V] [TRT] =============== Computing costs for 
[08/17/2022-07:50:54] [V] [TRT] *************** Autotuning format combination: Float(784,784,28,1) -> Float(25088,784,28,1) ***************
[08/17/2022-07:50:54] [V] [TRT] --------------- Timing Runner: Conv-1 + ReLU-2 (CudaDepthwiseConvolution)
[08/17/2022-07:50:54] [V] [TRT] CudaDepthwiseConvolution has no valid tactics for this config, skipping
[08/17/2022-07:50:54] [V] [TRT] --------------- Timing Runner: Conv-1 + ReLU-2 (FusedConvActConvolution)
[08/17/2022-07:50:54] [V] [TRT] FusedConvActConvolution has no valid tactics for this config, skipping
[08/17/2022-07:50:54] [V] [TRT] --------------- Timing Runner: Conv-1 + ReLU-2 (CudnnConvolution)
[08/17/2022-07:50:54] [V] [TRT] Tactic: 0x0000000000000000 Time: 0.018432
[08/17/2022-07:50:54] [V] [TRT] Tactic: 0x0000000000000001 Time: 0.0175705
[08/17/2022-07:50:54] [V] [TRT] Tactic: 0x0000000000000002 Time: 0.0231758
[08/17/2022-07:50:54] [V] [TRT] Tactic: 0x0000000000000004 Time: 0.0374103
[08/17/2022-07:50:54] [V] [TRT] Tactic: 0x0000000000000005 Time: 0.035944
[08/17/2022-07:50:54] [V] [TRT] Fastest Tactic: 0x0000000000000001 Time: 0.0175705
[08/17/2022-07:50:54] [V] [TRT] --------------- Timing Runner: Conv-1 + ReLU-2 (CaskConvolution)
[08/17/2022-07:50:54] [V] [TRT] Conv-1 + ReLU-2 Set Tactic Name: maxwell_scudnn_128x32_relu_medium_nn_v1 Tactic: 0x0ebe499388e08286
[08/17/2022-07:50:54] [V] [TRT] Tactic: 0x0ebe499388e08286 Time: 0.00994743
[08/17/2022-07:50:54] [V] [TRT] Conv-1 + ReLU-2 Set Tactic Name: maxwell_scudnn_128x32_relu_large_nn_v0 Tactic: 0x185af5379580418f
[08/17/2022-07:50:54] [V] [TRT] Tactic: 0x185af5379580418f Time: 0.00760686
[08/17/2022-07:50:54] [V] [TRT] Conv-1 + ReLU-2 Set Tactic Name: maxwell_scudnn_128x128_relu_large_nn_v0 Tactic: 0x321f7a577fb21da0
[08/17/2022-07:50:54] [V] [TRT] Tactic: 0x321f7a577fb21da0 Time: 0.0135115
[08/17/2022-07:50:54] [V] [TRT] Conv-1 + ReLU-2 Set Tactic Name: maxwell_scudnn_128x64_relu_large_nn_v1 Tactic: 0x3c301f1cd57bd89b
[08/17/2022-07:50:54] [V] [TRT] Tactic: 0x3c301f1cd57bd89b Time: 0.0100937
[08/17/2022-07:50:54] [V] [TRT] Conv-1 + ReLU-2 Set Tactic Name: maxwell_scudnn_128x128_relu_medium_nn_v1 Tactic: 0x3e787008e11a6129
[08/17/2022-07:50:54] [V] [TRT] Tactic: 0x3e787008e11a6129 Time: 0.0128731
[08/17/2022-07:50:54] [V] [TRT] Conv-1 + ReLU-2 Set Tactic Name: maxwell_scudnn_128x64_relu_small_nn_v1 Tactic: 0x474c9edd1ecfbbba
[08/17/2022-07:50:54] [V] [TRT] Tactic: 0x474c9edd1ecfbbba Time: 0.00917943
[08/17/2022-07:50:54] [V] [TRT] Conv-1 + ReLU-2 Set Tactic Name: maxwell_scudnn_128x128_relu_small_nn_v0 Tactic: 0x4963fb96b4067e81
[08/17/2022-07:50:54] [V] [TRT] Tactic: 0x4963fb96b4067e81 Time: 0.0130061
[08/17/2022-07:50:54] [V] [TRT] Conv-1 + ReLU-2 Set Tactic Name: maxwell_scudnn_128x64_relu_medium_nn_v1 Tactic: 0x5c38385751ccb068
[08/17/2022-07:50:54] [V] [TRT] Tactic: 0x5c38385751ccb068 Time: 0.0098499
[08/17/2022-07:50:54] [V] [TRT] Conv-1 + ReLU-2 Set Tactic Name: maxwell_scudnn_128x32_relu_small_nn_v0 Tactic: 0x632674f65e3422ae
[08/17/2022-07:50:54] [V] [TRT] Tactic: 0x632674f65e3422ae Time: 0.00706787
[08/17/2022-07:50:54] [V] [TRT] Conv-1 + ReLU-2 Set Tactic Name: maxwell_scudnn_128x128_relu_large_nn_v1 Tactic: 0x813136e97c1542cf
[08/17/2022-07:50:54] [V] [TRT] Tactic: 0x813136e97c1542cf Time: 0.013179
[08/17/2022-07:50:54] [V] [TRT] Conv-1 + ReLU-2 Set Tactic Name: maxwell_scudnn_128x128_relu_medium_nn_v0 Tactic: 0x8d563cb6e2bd3e46
[08/17/2022-07:50:54] [V] [TRT] Tactic: 0x8d563cb6e2bd3e46 Time: 0.0134849
[08/17/2022-07:50:54] [V] [TRT] Conv-1 + ReLU-2 Set Tactic Name: maxwell_scudnn_128x64_relu_large_nn_v0 Tactic: 0x8f1e53a2d6dc87f4
[08/17/2022-07:50:54] [V] [TRT] Tactic: 0x8f1e53a2d6dc87f4 Time: 0.0100157
[08/17/2022-07:50:54] [V] [TRT] Conv-1 + ReLU-2 Set Tactic Name: maxwell_scudnn_128x32_relu_large_nn_v1 Tactic: 0xab74b98996271ee0
[08/17/2022-07:50:54] [V] [TRT] Tactic: 0xab74b98996271ee0 Time: 0.0104072
[08/17/2022-07:50:54] [V] [TRT] Conv-1 + ReLU-2 Set Tactic Name: maxwell_scudnn_128x32_relu_medium_nn_v0 Tactic: 0xbd90052d8b47dde9
[08/17/2022-07:50:54] [V] [TRT] Tactic: 0xbd90052d8b47dde9 Time: 0.00746788
[08/17/2022-07:50:54] [V] [TRT] Conv-1 + ReLU-2 Set Tactic Name: maxwell_scudnn_128x32_relu_small_nn_v1 Tactic: 0xd00838485d937dc1
[08/17/2022-07:50:54] [V] [TRT] Tactic: 0xd00838485d937dc1 Time: 0.00871691
[08/17/2022-07:50:54] [V] [TRT] Conv-1 + ReLU-2 Set Tactic Name: maxwell_scudnn_128x64_relu_medium_nn_v0 Tactic: 0xef1674e9526bef07
[08/17/2022-07:50:54] [V] [TRT] Tactic: 0xef1674e9526bef07 Time: 0.00985874
[08/17/2022-07:50:54] [V] [TRT] Conv-1 + ReLU-2 Set Tactic Name: maxwell_scudnn_128x64_relu_small_nn_v0 Tactic: 0xf462d2631d68e4d5
[08/17/2022-07:50:54] [V] [TRT] Tactic: 0xf462d2631d68e4d5 Time: 0.00955733
[08/17/2022-07:50:54] [V] [TRT] Conv-1 + ReLU-2 Set Tactic Name: maxwell_scudnn_128x128_relu_small_nn_v1 Tactic: 0xfa4db728b7a121ee
[08/17/2022-07:50:54] [V] [TRT] Tactic: 0xfa4db728b7a121ee Time: 0.0124709
[08/17/2022-07:50:54] [V] [TRT] Fastest Tactic: 0x632674f65e3422ae Time: 0.00706787
[08/17/2022-07:50:54] [V] [TRT] >>>>>>>>>>>>>>> Chose Runner Type: CaskConvolution Tactic: 0x632674f65e3422ae
[08/17/2022-07:50:54] [V] [TRT] *************** Autotuning format combination: Float(784,1,28,1) -> Float(25088,1,896,32) ***************
[08/17/2022-07:50:54] [V] [TRT] --------------- Timing Runner: Conv-1 + ReLU-2 (CaskConvolution)
[08/17/2022-07:50:54] [V] [TRT] CaskConvolution has no valid tactics for this config, skipping
[08/17/2022-07:50:54] [V] [TRT] =============== Computing costs for 
[08/17/2022-07:50:54] [V] [TRT] *************** Autotuning format combination: Float(25088,784,28,1) -> Float(6272,196,14,1) ***************
[08/17/2022-07:50:54] [V] [TRT] --------------- Timing Runner: MaxPool-3 (TiledPooling)
[08/17/2022-07:50:54] [V] [TRT] Tactic: 0x0000000000540101 Time: 0.00674909
[08/17/2022-07:50:54] [V] [TRT] Tactic: 0x0000000000550101 Time: 0.00460343
[08/17/2022-07:50:54] [V] [TRT] Tactic: 0x0000000000560101 Time: 0.00406235
[08/17/2022-07:50:54] [V] [TRT] Tactic: 0x0000000000570101 Time: 0.00378526
[08/17/2022-07:50:54] [V] [TRT] Tactic: 0x0000000000580101 Time: 0.00367215
[08/17/2022-07:50:54] [V] [TRT] Tactic: 0x0000000000590101 Time: 0.00379958
[08/17/2022-07:50:54] [V] [TRT] Tactic: 0x00000000005a0101 Time: 0.00385636
[08/17/2022-07:50:54] [V] [TRT] Tactic: 0x00000000005b0101 Time: 0.00318202
[08/17/2022-07:50:54] [V] [TRT] Tactic: 0x00000000005c0101 Time: 0.0042638
[08/17/2022-07:50:54] [V] [TRT] Tactic: 0x00000000005d0101 Time: 0.00310312
[08/17/2022-07:50:54] [V] [TRT] Tactic: 0x00000000005e0101 Time: 0.00290231
[08/17/2022-07:50:54] [V] [TRT] Tactic: 0x00000000005f0101 Time: 0.00261985
[08/17/2022-07:50:54] [V] [TRT] Tactic: 0x0000000000600101 Time: 0.00268157
[08/17/2022-07:50:54] [V] [TRT] Tactic: 0x0000000000610101 Time: 0.00261187
[08/17/2022-07:50:54] [V] [TRT] Tactic: 0x0000000000620101 Time: 0.00283106
[08/17/2022-07:50:54] [V] [TRT] Tactic: 0x0000000000630101 Time: 0.00247929
[08/17/2022-07:50:54] [V] [TRT] Fastest Tactic: 0x0000000000630101 Time: 0.00247929
[08/17/2022-07:50:54] [V] [TRT] --------------- Timing Runner: MaxPool-3 (CudnnPooling)
[08/17/2022-07:50:54] [V] [TRT] Tactic: 0xffffffffffffffff Time: 0.0030436
[08/17/2022-07:50:54] [V] [TRT] Fastest Tactic: 0xffffffffffffffff Time: 0.0030436
[08/17/2022-07:50:54] [V] [TRT] --------------- Timing Runner: MaxPool-3 (CaskPooling)
[08/17/2022-07:50:54] [V] [TRT] MaxPool-3 Set Tactic Name: sm50_xmma_pooling_fw_4d_FP32FP32NCHW_Max Tactic: 0xb59f9cfb90407c92
[08/17/2022-07:50:54] [V] [TRT] Tactic: 0xb59f9cfb90407c92 Time: 0.00314902
[08/17/2022-07:50:54] [V] [TRT] Fastest Tactic: 0xb59f9cfb90407c92 Time: 0.00314902
[08/17/2022-07:50:54] [V] [TRT] >>>>>>>>>>>>>>> Chose Runner Type: TiledPooling Tactic: 0x0000000000630101
[08/17/2022-07:50:54] [V] [TRT] =============== Computing costs for 
[08/17/2022-07:50:54] [V] [TRT] *************** Autotuning format combination: Float(6272,196,14,1) -> Float(12544,196,14,1) ***************
[08/17/2022-07:50:54] [V] [TRT] --------------- Timing Runner: Conv-4 + ReLU-5 (CudaDepthwiseConvolution)
[08/17/2022-07:50:54] [V] [TRT] CudaDepthwiseConvolution has no valid tactics for this config, skipping
[08/17/2022-07:50:54] [V] [TRT] --------------- Timing Runner: Conv-4 + ReLU-5 (FusedConvActConvolution)
[08/17/2022-07:50:54] [V] [TRT] FusedConvActConvolution has no valid tactics for this config, skipping
[08/17/2022-07:50:54] [V] [TRT] --------------- Timing Runner: Conv-4 + ReLU-5 (CudnnConvolution)
[08/17/2022-07:50:54] [V] [TRT] Tactic: 0x0000000000000000 Time: 0.065731
[08/17/2022-07:50:54] [V] [TRT] Tactic: 0x0000000000000001 Time: 0.0682667
[08/17/2022-07:50:54] [V] [TRT] Tactic: 0x0000000000000002 Time: 0.106642
[08/17/2022-07:50:54] [V] [TRT] Tactic: 0x0000000000000004 Time: 0.176567
[08/17/2022-07:50:54] [V] [TRT] Tactic: 0x0000000000000005 Time: 0.183881
[08/17/2022-07:50:54] [V] [TRT] Fastest Tactic: 0x0000000000000000 Time: 0.065731
[08/17/2022-07:50:54] [V] [TRT] --------------- Timing Runner: Conv-4 + ReLU-5 (CaskConvolution)
[08/17/2022-07:50:54] [V] [TRT] Conv-4 + ReLU-5 Set Tactic Name: maxwell_scudnn_128x32_relu_medium_nn_v1 Tactic: 0x0ebe499388e08286
[08/17/2022-07:50:54] [V] [TRT] Tactic: 0x0ebe499388e08286 Time: 0.106057
[08/17/2022-07:50:54] [V] [TRT] Conv-4 + ReLU-5 Set Tactic Name: maxwell_scudnn_128x32_relu_large_nn_v0 Tactic: 0x185af5379580418f
[08/17/2022-07:50:54] [V] [TRT] Tactic: 0x185af5379580418f Time: 0.0772389
[08/17/2022-07:50:54] [V] [TRT] Conv-4 + ReLU-5 Set Tactic Name: maxwell_scudnn_128x128_relu_large_nn_v0 Tactic: 0x321f7a577fb21da0
[08/17/2022-07:50:54] [V] [TRT] Tactic: 0x321f7a577fb21da0 Time: 0.0846263
[08/17/2022-07:50:54] [V] [TRT] Conv-4 + ReLU-5 Set Tactic Name: maxwell_scudnn_128x64_relu_large_nn_v1 Tactic: 0x3c301f1cd57bd89b
[08/17/2022-07:50:54] [V] [TRT] Tactic: 0x3c301f1cd57bd89b Time: 0.0781166
[08/17/2022-07:50:54] [V] [TRT] Conv-4 + ReLU-5 Set Tactic Name: maxwell_scudnn_128x128_relu_medium_nn_v1 Tactic: 0x3e787008e11a6129
[08/17/2022-07:50:54] [V] [TRT] Tactic: 0x3e787008e11a6129 Time: 0.0849189
[08/17/2022-07:50:54] [V] [TRT] Conv-4 + ReLU-5 Set Tactic Name: maxwell_scudnn_128x64_relu_small_nn_v1 Tactic: 0x474c9edd1ecfbbba
[08/17/2022-07:50:54] [V] [TRT] Tactic: 0x474c9edd1ecfbbba Time: 0.0511512
[08/17/2022-07:50:54] [V] [TRT] Conv-4 + ReLU-5 Set Tactic Name: maxwell_scudnn_128x128_relu_small_nn_v0 Tactic: 0x4963fb96b4067e81
[08/17/2022-07:50:54] [V] [TRT] Tactic: 0x4963fb96b4067e81 Time: 0.0736549
[08/17/2022-07:50:54] [V] [TRT] Conv-4 + ReLU-5 Set Tactic Name: maxwell_scudnn_128x64_relu_medium_nn_v1 Tactic: 0x5c38385751ccb068
[08/17/2022-07:50:54] [V] [TRT] Tactic: 0x5c38385751ccb068 Time: 0.0701044
[08/17/2022-07:50:54] [V] [TRT] Conv-4 + ReLU-5 Set Tactic Name: maxwell_scudnn_128x32_relu_small_nn_v0 Tactic: 0x632674f65e3422ae
[08/17/2022-07:50:54] [V] [TRT] Tactic: 0x632674f65e3422ae Time: 0.0591482
[08/17/2022-07:50:54] [V] [TRT] Conv-4 + ReLU-5 Set Tactic Name: maxwell_scudnn_128x128_relu_large_nn_v1 Tactic: 0x813136e97c1542cf
[08/17/2022-07:50:54] [V] [TRT] Tactic: 0x813136e97c1542cf Time: 0.0879909
[08/17/2022-07:50:54] [V] [TRT] Conv-4 + ReLU-5 Set Tactic Name: maxwell_scudnn_128x128_relu_medium_nn_v0 Tactic: 0x8d563cb6e2bd3e46
[08/17/2022-07:50:54] [V] [TRT] Tactic: 0x8d563cb6e2bd3e46 Time: 0.0846994
[08/17/2022-07:50:54] [V] [TRT] Conv-4 + ReLU-5 Set Tactic Name: maxwell_scudnn_128x64_relu_large_nn_v0 Tactic: 0x8f1e53a2d6dc87f4
[08/17/2022-07:50:54] [V] [TRT] Tactic: 0x8f1e53a2d6dc87f4 Time: 0.0912823
[08/17/2022-07:50:54] [V] [TRT] Conv-4 + ReLU-5 Set Tactic Name: maxwell_scudnn_128x32_relu_large_nn_v1 Tactic: 0xab74b98996271ee0
[08/17/2022-07:50:54] [V] [TRT] Tactic: 0xab74b98996271ee0 Time: 0.107739
[08/17/2022-07:50:54] [V] [TRT] Conv-4 + ReLU-5 Set Tactic Name: maxwell_scudnn_128x32_relu_medium_nn_v0 Tactic: 0xbd90052d8b47dde9
[08/17/2022-07:50:54] [V] [TRT] Tactic: 0xbd90052d8b47dde9 Time: 0.0762149
[08/17/2022-07:50:54] [V] [TRT] Conv-4 + ReLU-5 Set Tactic Name: maxwell_scudnn_128x32_relu_small_nn_v1 Tactic: 0xd00838485d937dc1
[08/17/2022-07:50:54] [V] [TRT] Tactic: 0xd00838485d937dc1 Time: 0.0603672
[08/17/2022-07:50:54] [V] [TRT] Conv-4 + ReLU-5 Set Tactic Name: maxwell_scudnn_128x64_relu_medium_nn_v0 Tactic: 0xef1674e9526bef07
[08/17/2022-07:50:54] [V] [TRT] Tactic: 0xef1674e9526bef07 Time: 0.0900389
[08/17/2022-07:50:54] [V] [TRT] Conv-4 + ReLU-5 Set Tactic Name: maxwell_scudnn_128x64_relu_small_nn_v0 Tactic: 0xf462d2631d68e4d5
[08/17/2022-07:50:54] [V] [TRT] Tactic: 0xf462d2631d68e4d5 Time: 0.0744594
[08/17/2022-07:50:54] [V] [TRT] Conv-4 + ReLU-5 Set Tactic Name: maxwell_scudnn_128x128_relu_small_nn_v1 Tactic: 0xfa4db728b7a121ee
[08/17/2022-07:50:54] [V] [TRT] Tactic: 0xfa4db728b7a121ee Time: 0.0718994
[08/17/2022-07:50:54] [V] [TRT] Fastest Tactic: 0x474c9edd1ecfbbba Time: 0.0511512
[08/17/2022-07:50:54] [V] [TRT] >>>>>>>>>>>>>>> Chose Runner Type: CaskConvolution Tactic: 0x474c9edd1ecfbbba
[08/17/2022-07:50:54] [V] [TRT] *************** Autotuning format combination: Float(6272,1,448,32) -> Float(12544,1,896,64) ***************
[08/17/2022-07:50:54] [V] [TRT] --------------- Timing Runner: Conv-4 + ReLU-5 (CaskConvolution)
[08/17/2022-07:50:54] [V] [TRT] Conv-4 + ReLU-5 Set Tactic Name: maxwell_scudnn_128x32_sliced1x4_ldg4_relu_exp_small_nhwc_tn_v1 Tactic: 0x80f932c0b8ce5940
[08/17/2022-07:50:54] [V] [TRT] Tactic: 0x80f932c0b8ce5940 Time: 0.0224653
[08/17/2022-07:50:54] [V] [TRT] Conv-4 + ReLU-5 Set Tactic Name: maxwell_scudnn_128x64_sliced1x2_ldg4_relu_exp_small_nhwc_tn_v1 Tactic: 0x9961ac24fc07a1df
[08/17/2022-07:50:54] [V] [TRT] Tactic: 0x9961ac24fc07a1df Time: 0.0401189
[08/17/2022-07:50:54] [V] [TRT] Fastest Tactic: 0x80f932c0b8ce5940 Time: 0.0224653
[08/17/2022-07:50:54] [V] [TRT] >>>>>>>>>>>>>>> Chose Runner Type: CaskConvolution Tactic: 0x80f932c0b8ce5940
[08/17/2022-07:50:54] [V] [TRT] =============== Computing costs for 
[08/17/2022-07:50:54] [V] [TRT] *************** Autotuning format combination: Float(12544,196,14,1) -> Float(3136,49,7,1) ***************
[08/17/2022-07:50:54] [V] [TRT] --------------- Timing Runner: MaxPool-6 (TiledPooling)
[08/17/2022-07:50:54] [V] [TRT] Tactic: 0x0000000000540101 Time: 0.00772235
[08/17/2022-07:50:54] [V] [TRT] Tactic: 0x0000000000550101 Time: 0.00769395
[08/17/2022-07:50:54] [V] [TRT] Tactic: 0x0000000000560101 Time: 0.00736548
[08/17/2022-07:50:54] [V] [TRT] Tactic: 0x0000000000570101 Time: 0.00920686
[08/17/2022-07:50:54] [V] [TRT] Tactic: 0x0000000000580101 Time: 0.00643061
[08/17/2022-07:50:54] [V] [TRT] Tactic: 0x0000000000590101 Time: 0.00582802
[08/17/2022-07:50:54] [V] [TRT] Tactic: 0x00000000005a0101 Time: 0.0050292
[08/17/2022-07:50:54] [V] [TRT] Tactic: 0x00000000005b0101 Time: 0.00480061
[08/17/2022-07:50:54] [V] [TRT] Tactic: 0x00000000005c0101 Time: 0.005053
[08/17/2022-07:50:54] [V] [TRT] Tactic: 0x00000000005d0101 Time: 0.00414877
[08/17/2022-07:50:54] [V] [TRT] Tactic: 0x00000000005e0101 Time: 0.00406946
[08/17/2022-07:50:54] [V] [TRT] Tactic: 0x00000000005f0101 Time: 0.00394737
[08/17/2022-07:50:54] [V] [TRT] Tactic: 0x0000000000600101 Time: 0.00369289
[08/17/2022-07:50:54] [V] [TRT] Tactic: 0x0000000000610101 Time: 0.00356438
[08/17/2022-07:50:54] [V] [TRT] Tactic: 0x0000000000620101 Time: 0.00326816
[08/17/2022-07:50:54] [V] [TRT] Tactic: 0x0000000000630101 Time: 0.00321503
[08/17/2022-07:50:54] [V] [TRT] Fastest Tactic: 0x0000000000630101 Time: 0.00321503
[08/17/2022-07:50:54] [V] [TRT] --------------- Timing Runner: MaxPool-6 (CudnnPooling)
[08/17/2022-07:50:54] [V] [TRT] Tactic: 0xffffffffffffffff Time: 0.00377648
[08/17/2022-07:50:54] [V] [TRT] Fastest Tactic: 0xffffffffffffffff Time: 0.00377648
[08/17/2022-07:50:54] [V] [TRT] --------------- Timing Runner: MaxPool-6 (CaskPooling)
[08/17/2022-07:50:54] [V] [TRT] MaxPool-6 Set Tactic Name: sm50_xmma_pooling_fw_4d_FP32FP32NCHW_Max Tactic: 0xb59f9cfb90407c92
[08/17/2022-07:50:54] [V] [TRT] Tactic: 0xb59f9cfb90407c92 Time: 0.00278506
[08/17/2022-07:50:54] [V] [TRT] Fastest Tactic: 0xb59f9cfb90407c92 Time: 0.00278506
[08/17/2022-07:50:54] [V] [TRT] >>>>>>>>>>>>>>> Chose Runner Type: CaskPooling Tactic: 0xb59f9cfb90407c92
[08/17/2022-07:50:54] [V] [TRT] =============== Computing costs for 
[08/17/2022-07:50:54] [V] [TRT] *************** Autotuning format combination: Float(3136,49,7,1) -> Float(3136,1,1,1) ***************
[08/17/2022-07:50:54] [V] [TRT] --------------- Timing Runner: Transpose-7 + Reshape-7 + reshape_before_MatMul-9 (Shuffle)
[08/17/2022-07:50:54] [V] [TRT] Tactic: 0x0000000000000000 Time: 0.00313113
[08/17/2022-07:50:54] [V] [TRT] Tactic: 0x0000000000000001 Time: 0.0167091
[08/17/2022-07:50:54] [V] [TRT] Fastest Tactic: 0x0000000000000000 Time: 0.00313113
[08/17/2022-07:50:54] [V] [TRT] >>>>>>>>>>>>>>> Chose Runner Type: Shuffle Tactic: 0x0000000000000000
[08/17/2022-07:50:54] [V] [TRT] *************** Autotuning format combination: Float(3136,1,448,64) -> Float(3136,1,3136,3136) ***************
[08/17/2022-07:50:54] [V] [TRT] --------------- Timing Runner: Transpose-7 + Reshape-7 + reshape_before_MatMul-9 (Shuffle)
[08/17/2022-07:50:54] [V] [TRT] Tactic: 0x0000000000000000 Time: 0.00382027
[08/17/2022-07:50:54] [V] [TRT] Tactic: 0x0000000000000001 Time: 0.0118154
[08/17/2022-07:50:54] [V] [TRT] Fastest Tactic: 0x0000000000000000 Time: 0.00382027
[08/17/2022-07:50:54] [V] [TRT] >>>>>>>>>>>>>>> Chose Runner Type: Shuffle Tactic: 0x0000000000000000
[08/17/2022-07:50:54] [V] [TRT] *************** Autotuning format combination: Float(98,49:32,7,1) -> Float(98,1:32,1,1) ***************
[08/17/2022-07:50:54] [V] [TRT] --------------- Timing Runner: Transpose-7 + Reshape-7 + reshape_before_MatMul-9 (Shuffle)
[08/17/2022-07:50:54] [V] [TRT] Tactic: 0x0000000000000000 Time: 0.00266311
[08/17/2022-07:50:54] [V] [TRT] Tactic: 0x0000000000000001 Time: 0.046336
[08/17/2022-07:50:54] [V] [TRT] Fastest Tactic: 0x0000000000000000 Time: 0.00266311
[08/17/2022-07:50:54] [V] [TRT] >>>>>>>>>>>>>>> Chose Runner Type: Shuffle Tactic: 0x0000000000000000
[08/17/2022-07:50:54] [V] [TRT] =============== Computing costs for 
[08/17/2022-07:50:54] [V] [TRT] *************** Autotuning format combination: Float(3136,1,1,1) -> Float(1024,1,1,1) ***************
[08/17/2022-07:50:54] [V] [TRT] --------------- Timing Runner: MatMul-9 + ReLU-11 (CudaDepthwiseConvolution)
[08/17/2022-07:50:54] [V] [TRT] CudaDepthwiseConvolution has no valid tactics for this config, skipping
[08/17/2022-07:50:54] [V] [TRT] --------------- Timing Runner: MatMul-9 + ReLU-11 (FusedConvActConvolution)
[08/17/2022-07:50:54] [V] [TRT] FusedConvActConvolution has no valid tactics for this config, skipping
[08/17/2022-07:50:54] [V] [TRT] --------------- Timing Runner: MatMul-9 + ReLU-11 (CudnnConvolution)
[08/17/2022-07:50:54] [V] [TRT] Tactic: 0x0000000000000000 Time: 0.354011
[08/17/2022-07:50:54] [V] [TRT] Tactic: 0x0000000000000001 Time: 0.271506
[08/17/2022-07:50:54] [V] [TRT] Tactic: 0x0000000000000002 Time: 0.387511
[08/17/2022-07:50:54] [V] [TRT] Tactic: 0x0000000000000004 skipped. Scratch requested: 7527202816, available: 1073741824
[08/17/2022-07:50:54] [V] [TRT] Tactic: 0x0000000000000005 Time: 6.31003
[08/17/2022-07:50:54] [I] [TRT] Some tactics do not have sufficient workspace memory to run. Increasing workspace size will enable more tactics, please check verbose output for requested sizes.
[08/17/2022-07:50:54] [V] [TRT] Fastest Tactic: 0x0000000000000001 Time: 0.271506
[08/17/2022-07:50:54] [V] [TRT] Setting workspace to 7527202816enables more tactics for profiling
[08/17/2022-07:50:54] [V] [TRT] --------------- Timing Runner: MatMul-9 + ReLU-11 (CublasConvolution)
[08/17/2022-07:50:54] [V] [TRT] Tactic: 0x0000000000000000 Time: 0.0690469
[08/17/2022-07:50:54] [V] [TRT] Tactic: 0x0000000000000001 Time: 0.0672427
[08/17/2022-07:50:54] [V] [TRT] Fastest Tactic: 0x0000000000000001 Time: 0.0672427
[08/17/2022-07:50:54] [V] [TRT] --------------- Timing Runner: MatMul-9 + ReLU-11 (CaskConvolution)
[08/17/2022-07:50:54] [V] [TRT] MatMul-9 + ReLU-11 Set Tactic Name: maxwell_scudnn_128x32_relu_medium_nn_v1 Tactic: 0x0ebe499388e08286
[08/17/2022-07:50:54] [V] [TRT] Tactic: 0x0ebe499388e08286 Time: 0.369225
[08/17/2022-07:50:54] [V] [TRT] MatMul-9 + ReLU-11 Set Tactic Name: maxwell_scudnn_128x32_relu_interior_nn_v0 Tactic: 0x1792ed6b0f1ea883
[08/17/2022-07:50:54] [V] [TRT] Tactic: 0x1792ed6b0f1ea883 Time: 0.363374
[08/17/2022-07:50:54] [V] [TRT] MatMul-9 + ReLU-11 Set Tactic Name: maxwell_scudnn_128x128_relu_medium_nn_v1 Tactic: 0x3e787008e11a6129
[08/17/2022-07:50:55] [V] [TRT] Tactic: 0x3e787008e11a6129 Time: 0.382098
[08/17/2022-07:50:55] [V] [TRT] MatMul-9 + ReLU-11 Set Tactic Name: maxwell_scudnn_128x64_relu_small_nn_v1 Tactic: 0x474c9edd1ecfbbba
[08/17/2022-07:50:55] [V] [TRT] Tactic: 0x474c9edd1ecfbbba Time: 0.326217
[08/17/2022-07:50:55] [V] [TRT] MatMul-9 + ReLU-11 Set Tactic Name: maxwell_scudnn_128x128_relu_small_nn_v0 Tactic: 0x4963fb96b4067e81
[08/17/2022-07:50:55] [V] [TRT] Tactic: 0x4963fb96b4067e81 Time: 0.36747
[08/17/2022-07:50:55] [V] [TRT] MatMul-9 + ReLU-11 Set Tactic Name: maxwell_scudnn_128x128_relu_interior_nn_v1 Tactic: 0x49ecad9da64c487b
[08/17/2022-07:50:55] [V] [TRT] Tactic: 0x49ecad9da64c487b Time: 0.437979
[08/17/2022-07:50:55] [V] [TRT] MatMul-9 + ReLU-11 Set Tactic Name: maxwell_scudnn_128x64_relu_interior_nn_v0 Tactic: 0x4c5584586319b832
[08/17/2022-07:50:55] [V] [TRT] Tactic: 0x4c5584586319b832 Time: 0.352256
[08/17/2022-07:50:55] [V] [TRT] MatMul-9 + ReLU-11 Set Tactic Name: maxwell_scudnn_128x64_relu_medium_nn_v1 Tactic: 0x5c38385751ccb068
[08/17/2022-07:50:55] [V] [TRT] Tactic: 0x5c38385751ccb068 Time: 0.334409
[08/17/2022-07:50:55] [V] [TRT] MatMul-9 + ReLU-11 Set Tactic Name: maxwell_scudnn_128x32_relu_small_nn_v0 Tactic: 0x632674f65e3422ae
[08/17/2022-07:50:55] [V] [TRT] Tactic: 0x632674f65e3422ae Time: 0.396873
[08/17/2022-07:50:55] [V] [TRT] MatMul-9 + ReLU-11 Set Tactic Name: maxwell_scudnn_128x128_relu_medium_nn_v0 Tactic: 0x8d563cb6e2bd3e46
[08/17/2022-07:50:55] [V] [TRT] Tactic: 0x8d563cb6e2bd3e46 Time: 0.364544
[08/17/2022-07:50:55] [V] [TRT] MatMul-9 + ReLU-11 Set Tactic Name: maxwell_scudnn_128x32_relu_interior_nn_v1 Tactic: 0xa4bca1d50cb9f7ec
[08/17/2022-07:50:55] [V] [TRT] Tactic: 0xa4bca1d50cb9f7ec Time: 0.333678
[08/17/2022-07:50:55] [V] [TRT] MatMul-9 + ReLU-11 Set Tactic Name: maxwell_scudnn_128x32_relu_medium_nn_v0 Tactic: 0xbd90052d8b47dde9
[08/17/2022-07:50:55] [V] [TRT] Tactic: 0xbd90052d8b47dde9 Time: 0.345381
[08/17/2022-07:50:55] [V] [TRT] MatMul-9 + ReLU-11 Set Tactic Name: maxwell_scudnn_128x32_relu_small_nn_v1 Tactic: 0xd00838485d937dc1
[08/17/2022-07:50:55] [V] [TRT] Tactic: 0xd00838485d937dc1 Time: 0.456119
[08/17/2022-07:50:55] [V] [TRT] MatMul-9 + ReLU-11 Set Tactic Name: maxwell_scudnn_128x64_relu_medium_nn_v0 Tactic: 0xef1674e9526bef07
[08/17/2022-07:50:55] [V] [TRT] Tactic: 0xef1674e9526bef07 Time: 0.367762
[08/17/2022-07:50:55] [V] [TRT] MatMul-9 + ReLU-11 Set Tactic Name: maxwell_scudnn_128x64_relu_small_nn_v0 Tactic: 0xf462d2631d68e4d5
[08/17/2022-07:50:55] [V] [TRT] Tactic: 0xf462d2631d68e4d5 Time: 0.35957
[08/17/2022-07:50:55] [V] [TRT] MatMul-9 + ReLU-11 Set Tactic Name: maxwell_scudnn_128x128_relu_small_nn_v1 Tactic: 0xfa4db728b7a121ee
[08/17/2022-07:50:55] [V] [TRT] Tactic: 0xfa4db728b7a121ee Time: 0.376978
[08/17/2022-07:50:55] [V] [TRT] MatMul-9 + ReLU-11 Set Tactic Name: maxwell_scudnn_128x128_relu_interior_nn_v0 Tactic: 0xfac2e123a5eb1714
[08/17/2022-07:50:55] [V] [TRT] Tactic: 0xfac2e123a5eb1714 Time: 0.365568
[08/17/2022-07:50:55] [V] [TRT] MatMul-9 + ReLU-11 Set Tactic Name: maxwell_scudnn_128x64_relu_interior_nn_v1 Tactic: 0xff7bc8e660bee75d
[08/17/2022-07:50:55] [V] [TRT] Tactic: 0xff7bc8e660bee75d Time: 0.395849
[08/17/2022-07:50:55] [V] [TRT] Fastest Tactic: 0x474c9edd1ecfbbba Time: 0.326217
[08/17/2022-07:50:55] [V] [TRT] >>>>>>>>>>>>>>> Chose Runner Type: CublasConvolution Tactic: 0x0000000000000001
[08/17/2022-07:50:55] [V] [TRT] *************** Autotuning format combination: Float(3136,1,3136,3136) -> Float(1024,1,1024,1024) ***************
[08/17/2022-07:50:55] [V] [TRT] --------------- Timing Runner: MatMul-9 + ReLU-11 (CublasConvolution)
[08/17/2022-07:50:55] [V] [TRT] CublasConvolution has no valid tactics for this config, skipping
[08/17/2022-07:50:55] [V] [TRT] --------------- Timing Runner: MatMul-9 + ReLU-11 (CaskConvolution)
[08/17/2022-07:50:55] [V] [TRT] MatMul-9 + ReLU-11 Set Tactic Name: maxwell_scudnn_128x64_sliced1x2_ldg4_relu_exp_interior_nhwc_tn_v1 Tactic: 0x35f071de80e3b3c4
[08/17/2022-07:50:55] [V] [TRT] Tactic: 0x35f071de80e3b3c4 Time: 0.18315
[08/17/2022-07:50:55] [V] [TRT] MatMul-9 + ReLU-11 Set Tactic Name: maxwell_scudnn_128x32_sliced1x4_ldg4_relu_exp_interior_nhwc_tn_v1 Tactic: 0x5c024b37b78e77c0
[08/17/2022-07:50:55] [V] [TRT] Tactic: 0x5c024b37b78e77c0 Time: 0.128219
[08/17/2022-07:50:55] [V] [TRT] MatMul-9 + ReLU-11 Set Tactic Name: maxwell_scudnn_128x32_sliced1x4_ldg4_relu_exp_small_nhwc_tn_v1 Tactic: 0x80f932c0b8ce5940
[08/17/2022-07:50:55] [V] [TRT] Tactic: 0x80f932c0b8ce5940 Time: 0.129682
[08/17/2022-07:50:55] [V] [TRT] MatMul-9 + ReLU-11 Set Tactic Name: maxwell_scudnn_128x64_sliced1x2_ldg4_relu_exp_small_nhwc_tn_v1 Tactic: 0x9961ac24fc07a1df
[08/17/2022-07:50:55] [V] [TRT] Tactic: 0x9961ac24fc07a1df Time: 0.183735
[08/17/2022-07:50:55] [V] [TRT] Fastest Tactic: 0x5c024b37b78e77c0 Time: 0.128219
[08/17/2022-07:50:55] [V] [TRT] >>>>>>>>>>>>>>> Chose Runner Type: CaskConvolution Tactic: 0x5c024b37b78e77c0
[08/17/2022-07:50:55] [V] [TRT] =============== Computing costs for 
[08/17/2022-07:50:55] [V] [TRT] *************** Autotuning format combination: Float(1024,1,1,1) -> Float(10,1,1,1) ***************
[08/17/2022-07:50:55] [V] [TRT] --------------- Timing Runner: MatMul-12 (CudaDepthwiseConvolution)
[08/17/2022-07:50:55] [V] [TRT] CudaDepthwiseConvolution has no valid tactics for this config, skipping
[08/17/2022-07:50:55] [V] [TRT] --------------- Timing Runner: MatMul-12 (FusedConvActConvolution)
[08/17/2022-07:50:55] [V] [TRT] FusedConvActConvolution has no valid tactics for this config, skipping
[08/17/2022-07:50:55] [V] [TRT] --------------- Timing Runner: MatMul-12 (CudnnConvolution)
[08/17/2022-07:50:55] [V] [TRT] Tactic: 0x0000000000000000 Time: 0.0594408
[08/17/2022-07:50:55] [V] [TRT] Tactic: 0x0000000000000001 Time: 0.00740937
[08/17/2022-07:50:55] [V] [TRT] Tactic: 0x0000000000000002 Time: 0.286427
[08/17/2022-07:50:55] [V] [TRT] Tactic: 0x0000000000000004 Time: 0.346843
[08/17/2022-07:50:55] [V] [TRT] Tactic: 0x0000000000000005 Time: 0.0965486
[08/17/2022-07:50:55] [V] [TRT] Fastest Tactic: 0x0000000000000001 Time: 0.00740937
[08/17/2022-07:50:55] [V] [TRT] --------------- Timing Runner: MatMul-12 (CublasConvolution)
[08/17/2022-07:50:55] [V] [TRT] Tactic: 0x0000000000000000 Time: 0.00712621
[08/17/2022-07:50:55] [V] [TRT] Tactic: 0x0000000000000001 Time: 0.0103549
[08/17/2022-07:50:55] [V] [TRT] Fastest Tactic: 0x0000000000000000 Time: 0.00712621
[08/17/2022-07:50:55] [V] [TRT] --------------- Timing Runner: MatMul-12 (CaskConvolution)
[08/17/2022-07:50:55] [V] [TRT] MatMul-12 Set Tactic Name: maxwell_scudnn_128x32_relu_medium_nn_v1 Tactic: 0x0ebe499388e08286
[08/17/2022-07:50:55] [V] [TRT] Tactic: 0x0ebe499388e08286 Time: 0.0877714
[08/17/2022-07:50:55] [V] [TRT] MatMul-12 Set Tactic Name: maxwell_scudnn_128x32_relu_interior_nn_v0 Tactic: 0x1792ed6b0f1ea883
[08/17/2022-07:50:55] [V] [TRT] Tactic: 0x1792ed6b0f1ea883 Time: 0.0602209
[08/17/2022-07:50:55] [V] [TRT] MatMul-12 Set Tactic Name: maxwell_scudnn_128x128_relu_medium_nn_v1 Tactic: 0x3e787008e11a6129
[08/17/2022-07:50:55] [V] [TRT] Tactic: 0x3e787008e11a6129 Time: 0.0932571
[08/17/2022-07:50:55] [V] [TRT] MatMul-12 Set Tactic Name: maxwell_scudnn_128x64_relu_small_nn_v1 Tactic: 0x474c9edd1ecfbbba
[08/17/2022-07:50:55] [V] [TRT] Tactic: 0x474c9edd1ecfbbba Time: 0.0617326
[08/17/2022-07:50:55] [V] [TRT] MatMul-12 Set Tactic Name: maxwell_scudnn_128x128_relu_small_nn_v0 Tactic: 0x4963fb96b4067e81
[08/17/2022-07:50:55] [V] [TRT] Tactic: 0x4963fb96b4067e81 Time: 0.0903314
[08/17/2022-07:50:55] [V] [TRT] MatMul-12 Set Tactic Name: maxwell_scudnn_128x128_relu_interior_nn_v1 Tactic: 0x49ecad9da64c487b
[08/17/2022-07:50:55] [V] [TRT] Tactic: 0x49ecad9da64c487b Time: 0.0898926
[08/17/2022-07:50:55] [V] [TRT] MatMul-12 Set Tactic Name: maxwell_scudnn_128x64_relu_interior_nn_v0 Tactic: 0x4c5584586319b832
[08/17/2022-07:50:55] [V] [TRT] Tactic: 0x4c5584586319b832 Time: 0.0770926
[08/17/2022-07:50:55] [V] [TRT] MatMul-12 Set Tactic Name: maxwell_scudnn_128x64_relu_medium_nn_v1 Tactic: 0x5c38385751ccb068
[08/17/2022-07:50:55] [V] [TRT] Tactic: 0x5c38385751ccb068 Time: 0.0671451
[08/17/2022-07:50:55] [V] [TRT] MatMul-12 Set Tactic Name: maxwell_scudnn_128x32_relu_small_nn_v0 Tactic: 0x632674f65e3422ae
[08/17/2022-07:50:55] [V] [TRT] Tactic: 0x632674f65e3422ae Time: 0.0631954
[08/17/2022-07:50:55] [V] [TRT] MatMul-12 Set Tactic Name: maxwell_scudnn_128x128_relu_medium_nn_v0 Tactic: 0x8d563cb6e2bd3e46
[08/17/2022-07:50:55] [V] [TRT] Tactic: 0x8d563cb6e2bd3e46 Time: 0.0922331
[08/17/2022-07:50:55] [V] [TRT] MatMul-12 Set Tactic Name: maxwell_scudnn_128x32_relu_interior_nn_v1 Tactic: 0xa4bca1d50cb9f7ec
[08/17/2022-07:50:55] [V] [TRT] Tactic: 0xa4bca1d50cb9f7ec Time: 0.0659749
[08/17/2022-07:50:55] [V] [TRT] MatMul-12 Set Tactic Name: maxwell_scudnn_128x32_relu_medium_nn_v0 Tactic: 0xbd90052d8b47dde9
[08/17/2022-07:50:55] [V] [TRT] Tactic: 0xbd90052d8b47dde9 Time: 0.0683154
[08/17/2022-07:50:55] [V] [TRT] MatMul-12 Set Tactic Name: maxwell_scudnn_128x32_relu_small_nn_v1 Tactic: 0xd00838485d937dc1
[08/17/2022-07:50:55] [V] [TRT] Tactic: 0xd00838485d937dc1 Time: 0.0702659
[08/17/2022-07:50:55] [V] [TRT] MatMul-12 Set Tactic Name: maxwell_scudnn_128x64_relu_medium_nn_v0 Tactic: 0xef1674e9526bef07
[08/17/2022-07:50:55] [V] [TRT] Tactic: 0xef1674e9526bef07 Time: 0.0837486
[08/17/2022-07:50:55] [V] [TRT] MatMul-12 Set Tactic Name: maxwell_scudnn_128x64_relu_small_nn_v0 Tactic: 0xf462d2631d68e4d5
[08/17/2022-07:50:55] [V] [TRT] Tactic: 0xf462d2631d68e4d5 Time: 0.0787017
[08/17/2022-07:50:55] [V] [TRT] MatMul-12 Set Tactic Name: maxwell_scudnn_128x128_relu_small_nn_v1 Tactic: 0xfa4db728b7a121ee
[08/17/2022-07:50:55] [V] [TRT] Tactic: 0xfa4db728b7a121ee Time: 0.0893806
[08/17/2022-07:50:55] [V] [TRT] MatMul-12 Set Tactic Name: maxwell_scudnn_128x128_relu_interior_nn_v0 Tactic: 0xfac2e123a5eb1714
[08/17/2022-07:50:55] [V] [TRT] Tactic: 0xfac2e123a5eb1714 Time: 0.0890149
[08/17/2022-07:50:55] [V] [TRT] MatMul-12 Set Tactic Name: maxwell_scudnn_128x64_relu_interior_nn_v1 Tactic: 0xff7bc8e660bee75d
[08/17/2022-07:50:55] [V] [TRT] Tactic: 0xff7bc8e660bee75d Time: 0.0601234
[08/17/2022-07:50:55] [V] [TRT] Fastest Tactic: 0xff7bc8e660bee75d Time: 0.0601234
[08/17/2022-07:50:55] [V] [TRT] >>>>>>>>>>>>>>> Chose Runner Type: CublasConvolution Tactic: 0x0000000000000000
[08/17/2022-07:50:55] [V] [TRT] *************** Autotuning format combination: Float(1024,1,1024,1024) -> Float(10,1,10,10) ***************
[08/17/2022-07:50:55] [V] [TRT] --------------- Timing Runner: MatMul-12 (CublasConvolution)
[08/17/2022-07:50:55] [V] [TRT] CublasConvolution has no valid tactics for this config, skipping
[08/17/2022-07:50:55] [V] [TRT] --------------- Timing Runner: MatMul-12 (CaskConvolution)
[08/17/2022-07:50:55] [V] [TRT] CaskConvolution has no valid tactics for this config, skipping
[08/17/2022-07:50:55] [V] [TRT] =============== Computing costs for 
[08/17/2022-07:50:55] [V] [TRT] *************** Autotuning format combination: Float(10,1,1,1) -> Float(10,1) ***************
[08/17/2022-07:50:55] [V] [TRT] --------------- Timing Runner: reshape_after_MatMul-12 (Shuffle)
[08/17/2022-07:50:55] [V] [TRT] Tactic: 0x0000000000000000 Time: 0.00190519
[08/17/2022-07:50:55] [V] [TRT] Tactic: 0x0000000000000001 Time: 0.017278
[08/17/2022-07:50:55] [V] [TRT] Fastest Tactic: 0x0000000000000000 Time: 0.00190519
[08/17/2022-07:50:55] [V] [TRT] >>>>>>>>>>>>>>> Chose Runner Type: Shuffle Tactic: 0x0000000000000000
[08/17/2022-07:50:55] [V] [TRT] =============== Computing costs for 
[08/17/2022-07:50:55] [V] [TRT] *************** Autotuning format combination: Float(10,1) -> Float(1,1), Int32(1,1) ***************
[08/17/2022-07:50:55] [V] [TRT] --------------- Timing Runner: Softmax-14 + ArgMax-15 (LogSoftmaxTopK)
[08/17/2022-07:50:55] [V] [TRT] Tactic: 0x00000000000003e9 Time: 0.00206217
[08/17/2022-07:50:55] [V] [TRT] Tactic: 0x00000000000003ea Time: 0.0138174
[08/17/2022-07:50:55] [V] [TRT] Fastest Tactic: 0x00000000000003e9 Time: 0.00206217
[08/17/2022-07:50:55] [V] [TRT] >>>>>>>>>>>>>>> Chose Runner Type: LogSoftmaxTopK Tactic: 0x00000000000003e9
[08/17/2022-07:50:55] [V] [TRT] =============== Computing costs for 
[08/17/2022-07:50:55] [V] [TRT] *************** Autotuning format combination: Int32(1,1) -> Int32(1) ***************
[08/17/2022-07:50:55] [V] [TRT] --------------- Timing Runner: (Unnamed Layer* 32) [Shuffle] (Shuffle)
[08/17/2022-07:50:55] [V] [TRT] Tactic: 0x0000000000000000 Time: 0.00311086
[08/17/2022-07:50:55] [V] [TRT] Tactic: 0x0000000000000001 Time: 0.00812699
[08/17/2022-07:50:55] [V] [TRT] Fastest Tactic: 0x0000000000000000 Time: 0.00311086
[08/17/2022-07:50:55] [V] [TRT] >>>>>>>>>>>>>>> Chose Runner Type: Shuffle Tactic: 0x0000000000000000
[08/17/2022-07:50:55] [V] [TRT] Adding reformat layer: Reformatted Output Tensor 0 to MaxPool-3 (tensor-3) from Float(6272,196,14,1) to Float(6272,1,448,32)
[08/17/2022-07:50:55] [V] [TRT] Adding reformat layer: Reformatted Input Tensor 0 to MaxPool-6 (tensor-5) from Float(12544,1,896,64) to Float(12544,196,14,1)
[08/17/2022-07:50:55] [V] [TRT] Formats and tactics selection completed in 1.40551 seconds.
[08/17/2022-07:50:55] [V] [TRT] After reformat layers: 12 layers
[08/17/2022-07:50:55] [V] [TRT] Pre-optimized block assignment.
[08/17/2022-07:50:55] [V] [TRT] Block size 1605632
[08/17/2022-07:50:55] [V] [TRT] Block size 401408
[08/17/2022-07:50:55] [V] [TRT] Block size 802816
[08/17/2022-07:50:55] [V] [TRT] Block size 200704
[08/17/2022-07:50:55] [V] [TRT] Block size 4
[08/17/2022-07:50:55] [V] [TRT] Block size 512
[08/17/2022-07:50:55] [V] [TRT] Block size 4
[08/17/2022-07:50:55] [V] [TRT] Block size 200704
[08/17/2022-07:50:55] [V] [TRT] Block size 1024
[08/17/2022-07:50:55] [V] [TRT] Block size 65536
[08/17/2022-07:50:55] [V] [TRT] Block size 401408
[08/17/2022-07:50:55] [V] [TRT] Block size 802816
[08/17/2022-07:50:55] [V] [TRT] Block size 1073741824
[08/17/2022-07:50:55] [V] [TRT] Total Activation Memory: 1078224392
[08/17/2022-07:50:55] [I] [TRT] Detected 1 inputs and 1 output network tensors.
[08/17/2022-07:50:55] [V] [TRT] Conv-1 + ReLU-2 Set Tactic Name: maxwell_scudnn_128x32_relu_small_nn_v0 Tactic: 0x632674f65e3422ae
[08/17/2022-07:50:55] [V] [TRT] Conv-4 + ReLU-5 Set Tactic Name: maxwell_scudnn_128x32_sliced1x4_ldg4_relu_exp_small_nhwc_tn_v1 Tactic: 0x80f932c0b8ce5940
[08/17/2022-07:50:55] [V] [TRT] MaxPool-6 Set Tactic Name: sm50_xmma_pooling_fw_4d_FP32FP32NCHW_Max Tactic: 0xb59f9cfb90407c92
[08/17/2022-07:50:55] [V] [TRT] Layer: Conv-1 + ReLU-2 Host Persistent: 1664 Device Persistent: 5120 Scratch Memory: 0
[08/17/2022-07:50:55] [V] [TRT] Layer: MaxPool-3 Host Persistent: 0 Device Persistent: 0 Scratch Memory: 0
[08/17/2022-07:50:55] [V] [TRT] Layer: Reformatting CopyNode for Output Tensor 0 to MaxPool-3 Host Persistent: 0 Device Persistent: 0 Scratch Memory: 0
[08/17/2022-07:50:55] [V] [TRT] Layer: Conv-4 + ReLU-5 Host Persistent: 1664 Device Persistent: 1536 Scratch Memory: 0
[08/17/2022-07:50:55] [V] [TRT] Layer: Reformatting CopyNode for Input Tensor 0 to MaxPool-6 Host Persistent: 0 Device Persistent: 0 Scratch Memory: 0
[08/17/2022-07:50:55] [V] [TRT] Layer: MaxPool-6 Host Persistent: 1088 Device Persistent: 0 Scratch Memory: 0
[08/17/2022-07:50:55] [V] [TRT] Layer: Transpose-7 + Reshape-7 + reshape_before_MatMul-9 Host Persistent: 0 Device Persistent: 0 Scratch Memory: 0
[08/17/2022-07:50:55] [V] [TRT] Layer: MatMul-9 + ReLU-11 Host Persistent: 340 Device Persistent: 0 Scratch Memory: 0
[08/17/2022-07:50:55] [V] [TRT] Layer: MatMul-12 Host Persistent: 340 Device Persistent: 0 Scratch Memory: 0
[08/17/2022-07:50:55] [V] [TRT] Layer: reshape_after_MatMul-12 Host Persistent: 0 Device Persistent: 0 Scratch Memory: 0
[08/17/2022-07:50:55] [V] [TRT] Layer: Softmax-14 + ArgMax-15 Host Persistent: 0 Device Persistent: 0 Scratch Memory: 0
[08/17/2022-07:50:55] [V] [TRT] Layer: (Unnamed Layer* 32) [Shuffle] Host Persistent: 0 Device Persistent: 0 Scratch Memory: 0
[08/17/2022-07:50:55] [I] [TRT] Total Host Persistent Memory: 5120
[08/17/2022-07:50:55] [I] [TRT] Total Device Persistent Memory: 6656
[08/17/2022-07:50:55] [I] [TRT] Total Scratch Memory: 0
[08/17/2022-07:50:55] [I] [TRT] [MemUsageStats] Peak memory usage of TRT CPU/GPU memory allocators: CPU 24 MiB, GPU 438 MiB
[08/17/2022-07:50:55] [I] [TRT] [BlockAssignment] Algorithm ShiftNTopDown took 0.042167ms to assign 4 blocks to 12 nodes requiring 2408456 bytes.
[08/17/2022-07:50:55] [V] [TRT] Optimized block assignment.
[08/17/2022-07:50:55] [V] [TRT] Block size 1605632
[08/17/2022-07:50:55] [V] [TRT] Block size 802816
[08/17/2022-07:50:55] [V] [TRT] Block size 4
[08/17/2022-07:50:55] [V] [TRT] Block size 4
[08/17/2022-07:50:55] [I] [TRT] Total Activation Memory: 2408456
[08/17/2022-07:50:55] [V] [TRT] Disabling unused tactic source: CUDNN
[08/17/2022-07:50:55] [V] [TRT] Using cublas as a tactic source
[08/17/2022-07:50:55] [I] [TRT] [MemUsageChange] Init cuBLAS/cuBLASLt: CPU +0, GPU +8, now: CPU 932, GPU 893 (MiB)
[08/17/2022-07:50:55] [V] [TRT] Engine generation completed in 1.7773 seconds.
[08/17/2022-07:50:55] [V] [TRT] Deleting timing cache: 34 entries, served 0 hits since creation.
[08/17/2022-07:50:55] [V] [TRT] Engine Layer Information:
Layer(CaskConvolution): Conv-1 + ReLU-2, Tactic: 0x632674f65e3422ae, tensor-0[Float(-2,1,28,28)] -> tensor-2[Float(-2,32,28,28)]
Layer(TiledPooling): MaxPool-3, Tactic: 0x0000000000630101, tensor-2[Float(-2,32,28,28)] -> Reformatted Output Tensor 0 to MaxPool-3[Float(-2,32,14,14)]
Layer(Reformat): Reformatting CopyNode for Output Tensor 0 to MaxPool-3, Tactic: 0x0000000000000000, Reformatted Output Tensor 0 to MaxPool-3[Float(-2,32,14,14)] -> tensor-3[Float(-2,32,14,14)]
Layer(CaskConvolution): Conv-4 + ReLU-5, Tactic: 0x80f932c0b8ce5940, tensor-3[Float(-2,32,14,14)] -> tensor-5[Float(-2,64,14,14)]
Layer(Reformat): Reformatting CopyNode for Input Tensor 0 to MaxPool-6, Tactic: 0x0000000000000000, tensor-5[Float(-2,64,14,14)] -> Reformatted Input Tensor 0 to MaxPool-6[Float(-2,64,14,14)]
Layer(CaskPooling): MaxPool-6, Tactic: 0xb59f9cfb90407c92, Reformatted Input Tensor 0 to MaxPool-6[Float(-2,64,14,14)] -> tensor-6[Float(-2,64,7,7)]
Layer(Shuffle): Transpose-7 + Reshape-7 + reshape_before_MatMul-9, Tactic: 0x0000000000000000, tensor-6[Float(-2,64,7,7)] -> reshape_before_MatMul-9_out_region[Float(-2,3136,1,1)]
Layer(CublasConvolution): MatMul-9 + ReLU-11, Tactic: 0x0000000000000001, reshape_before_MatMul-9_out_region[Float(-2,3136,1,1)] -> ReLU-11_out_tensor[Float(-2,1024,1,1)]
Layer(CublasConvolution): MatMul-12, Tactic: 0x0000000000000000, ReLU-11_out_tensor[Float(-2,1024,1,1)] -> MatMul-12_out_region[Float(-2,10,1,1)]
Layer(NoOp): reshape_after_MatMul-12, Tactic: 0x0000000000000000, MatMul-12_out_region[Float(-2,10,1,1)] -> tensor-13[Float(-2,10)]
Layer(LogSoftmaxTopK): Softmax-14 + ArgMax-15, Tactic: 0x00000000000003e9, tensor-13[Float(-2,10)] -> (Unnamed Layer* 28) [TopK]_output_1[Float(-2,1)], (Unnamed Layer* 28) [TopK]_output_2[Int32(-2,1)]
Layer(NoOp): (Unnamed Layer* 32) [Shuffle], Tactic: 0x0000000000000000, (Unnamed Layer* 28) [TopK]_output_2[Int32(-2,1)] -> tensor-15[Int32(-2)]
[08/17/2022-07:50:55] [I] [TRT] [MemUsageChange] TensorRT-managed allocation in building engine: CPU +12, GPU +13, now: CPU 12, GPU 13 (MiB)
[08/17/2022-07:50:55] [I] Engine built in 2.6722 sec.
[08/17/2022-07:50:55] [I] [TRT] [MemUsageChange] Init CUDA: CPU +0, GPU +0, now: CPU 914, GPU 853 (MiB)
[08/17/2022-07:50:55] [I] [TRT] Loaded engine size: 12 MiB
[08/17/2022-07:50:55] [V] [TRT] Using cublas as a tactic source
[08/17/2022-07:50:55] [I] [TRT] [MemUsageChange] Init cuBLAS/cuBLASLt: CPU +0, GPU +10, now: CPU 914, GPU 877 (MiB)
[08/17/2022-07:50:55] [V] [TRT] Deserialization required 3625 microseconds.
[08/17/2022-07:50:55] [I] [TRT] [MemUsageChange] TensorRT-managed allocation in engine deserialization: CPU +0, GPU +12, now: CPU 0, GPU 12 (MiB)
[08/17/2022-07:50:55] [I] Engine deserialized in 0.00404977 sec.
[08/17/2022-07:50:55] [V] [TRT] Using cublas as a tactic source
[08/17/2022-07:50:55] [I] [TRT] [MemUsageChange] Init cuBLAS/cuBLASLt: CPU +0, GPU +8, now: CPU 914, GPU 877 (MiB)
[08/17/2022-07:50:55] [V] [TRT] Total per-runner device persistent memory is 6656
[08/17/2022-07:50:55] [V] [TRT] Total per-runner host persistent memory is 5120
[08/17/2022-07:50:55] [V] [TRT] Allocated activation device memory of size 2409472
[08/17/2022-07:50:55] [I] [TRT] [MemUsageChange] TensorRT-managed allocation in IExecutionContext creation: CPU +0, GPU +2, now: CPU 0, GPU 14 (MiB)
[08/17/2022-07:50:55] [I] Using random values for input tensor-0
[08/17/2022-07:50:55] [I] Created input binding for tensor-0 with dimensions 4x1x28x28
[08/17/2022-07:50:55] [I] Using random values for output tensor-15
[08/17/2022-07:50:55] [I] Created output binding for tensor-15 with dimensions 4
[08/17/2022-07:50:55] [I] Starting inference
[08/17/2022-07:50:58] [I] Warmup completed 1230 queries over 200 ms
[08/17/2022-07:50:58] [I] Timing trace has 18516 queries over 3.00054 s
[08/17/2022-07:50:58] [I] 
[08/17/2022-07:50:58] [I] === Trace details ===
[08/17/2022-07:50:58] [I] Trace averages of 10 runs:
[08/17/2022-07:50:58] [I] Average on 10 runs - GPU latency: 0.156569 ms - Host latency: 0.162646 ms (enqueue 0.0300674 ms)
[08/17/2022-07:50:58] [I] Average on 10 runs - GPU latency: 0.156776 ms - Host latency: 0.163046 ms (enqueue 0.0288696 ms)
[08/17/2022-07:50:58] [I] Average on 10 runs - GPU latency: 0.156468 ms - Host latency: 0.162967 ms (enqueue 0.032222 ms)
[08/17/2022-07:50:58] [I] Average on 10 runs - GPU latency: 0.17869 ms - Host latency: 0.186073 ms (enqueue 0.0379044 ms)
[08/17/2022-07:50:58] [I] Average on 10 runs - GPU latency: 0.177867 ms - Host latency: 0.184981 ms (enqueue 0.039241 ms)
[08/17/2022-07:50:58] [I] Average on 10 runs - GPU latency: 0.156367 ms - Host latency: 0.163313 ms (enqueue 0.0367187 ms)
[08/17/2022-07:50:58] [I] Average on 10 runs - GPU latency: 0.157385 ms - Host latency: 0.164359 ms (enqueue 0.0396515 ms)
[08/17/2022-07:50:58] [I] Average on 10 runs - GPU latency: 0.189287 ms - Host latency: 0.195477 ms (enqueue 0.030957 ms)
[08/17/2022-07:50:58] [I] Average on 10 runs - GPU latency: 0.156671 ms - Host latency: 0.162877 ms (enqueue 0.0302017 ms)
[08/17/2022-07:50:58] [I] Average on 10 runs - GPU latency: 0.15667 ms - Host latency: 0.163461 ms (enqueue 0.0365448 ms)
[08/17/2022-07:50:58] [I] Average on 10 runs - GPU latency: 0.156981 ms - Host latency: 0.163736 ms (enqueue 0.034053 ms)
[08/17/2022-07:50:58] [I] Average on 10 runs - GPU latency: 0.156978 ms - Host latency: 0.163228 ms (enqueue 0.0292679 ms)
[08/17/2022-07:50:58] [I] Average on 10 runs - GPU latency: 0.156416 ms - Host latency: 0.162976 ms (enqueue 0.0305893 ms)
[08/17/2022-07:50:58] [I] Average on 10 runs - GPU latency: 0.156162 ms - Host latency: 0.162393 ms (enqueue 0.0291763 ms)
[08/17/2022-07:50:58] [I] Average on 10 runs - GPU latency: 0.156569 ms - Host latency: 0.162903 ms (enqueue 0.0335831 ms)
[08/17/2022-07:50:58] [I] Average on 10 runs - GPU latency: 0.156264 ms - Host latency: 0.162242 ms (enqueue 0.0292328 ms)
[08/17/2022-07:50:58] [I] Average on 10 runs - GPU latency: 0.177051 ms - Host latency: 0.183794 ms (enqueue 0.0351227 ms)
[08/17/2022-07:50:58] [I] Average on 10 runs - GPU latency: 0.156569 ms - Host latency: 0.16299 ms (enqueue 0.0329834 ms)
[08/17/2022-07:50:58] [I] Average on 10 runs - GPU latency: 0.156366 ms - Host latency: 0.162527 ms (enqueue 0.0291626 ms)
[08/17/2022-07:50:58] [I] Average on 10 runs - GPU latency: 0.156465 ms - Host latency: 0.162788 ms (enqueue 0.0326721 ms)
[08/17/2022-07:50:58] [I] Average on 10 runs - GPU latency: 0.156671 ms - Host latency: 0.163774 ms (enqueue 0.035614 ms)
[08/17/2022-07:50:58] [I] Average on 10 runs - GPU latency: 0.157596 ms - Host latency: 0.164592 ms (enqueue 0.0369751 ms)
[08/17/2022-07:50:58] [I] Average on 10 runs - GPU latency: 0.156264 ms - Host latency: 0.16315 ms (enqueue 0.0373306 ms)
[08/17/2022-07:50:58] [I] Average on 10 runs - GPU latency: 0.18432 ms - Host latency: 0.191167 ms (enqueue 0.0351486 ms)
[08/17/2022-07:50:58] [I] Average on 10 runs - GPU latency: 0.156364 ms - Host latency: 0.163179 ms (enqueue 0.03582 ms)
[08/17/2022-07:50:58] [I] Average on 10 runs - GPU latency: 0.156467 ms - Host latency: 0.163533 ms (enqueue 0.0362686 ms)
[08/17/2022-07:50:58] [I] Average on 10 runs - GPU latency: 0.156693 ms - Host latency: 0.163379 ms (enqueue 0.0348373 ms)
[08/17/2022-07:50:58] [I] Average on 10 runs - GPU latency: 0.185039 ms - Host latency: 0.191141 ms (enqueue 0.031958 ms)
[08/17/2022-07:50:58] [I] Average on 10 runs - GPU latency: 0.156947 ms - Host latency: 0.163083 ms (enqueue 0.0313583 ms)
[08/17/2022-07:50:58] [I] Average on 10 runs - GPU latency: 0.156569 ms - Host latency: 0.163177 ms (enqueue 0.0348312 ms)
[08/17/2022-07:50:58] [I] Average on 10 runs - GPU latency: 0.156776 ms - Host latency: 0.163766 ms (enqueue 0.0353271 ms)
[08/17/2022-07:50:58] [I] Average on 10 runs - GPU latency: 0.15708 ms - Host latency: 0.163193 ms (enqueue 0.0302338 ms)
[08/17/2022-07:50:58] [I] Average on 10 runs - GPU latency: 0.156364 ms - Host latency: 0.162508 ms (enqueue 0.0296509 ms)
[08/17/2022-07:50:58] [I] Average on 10 runs - GPU latency: 0.156468 ms - Host latency: 0.162483 ms (enqueue 0.0300674 ms)
[08/17/2022-07:50:58] [I] Average on 10 runs - GPU latency: 0.156363 ms - Host latency: 0.162607 ms (enqueue 0.0289398 ms)
[08/17/2022-07:50:58] [I] Average on 10 runs - GPU latency: 0.156564 ms - Host latency: 0.163135 ms (enqueue 0.0316376 ms)
[08/17/2022-07:50:58] [I] Average on 10 runs - GPU latency: 0.156366 ms - Host latency: 0.164841 ms (enqueue 0.0363068 ms)
[08/17/2022-07:50:58] [I] Average on 10 runs - GPU latency: 0.180231 ms - Host latency: 0.187408 ms (enqueue 0.0358551 ms)
[08/17/2022-07:50:58] [I] Average on 10 runs - GPU latency: 0.156674 ms - Host latency: 0.163388 ms (enqueue 0.0341766 ms)
[08/17/2022-07:50:58] [I] Average on 10 runs - GPU latency: 0.156879 ms - Host latency: 0.163913 ms (enqueue 0.0368317 ms)
[08/17/2022-07:50:58] [I] Average on 10 runs - GPU latency: 0.156369 ms - Host latency: 0.1633 ms (enqueue 0.0380127 ms)
[08/17/2022-07:50:58] [I] Average on 10 runs - GPU latency: 0.157178 ms - Host latency: 0.164175 ms (enqueue 0.0368103 ms)
[08/17/2022-07:50:58] [I] Average on 10 runs - GPU latency: 0.157083 ms - Host latency: 0.164319 ms (enqueue 0.0386444 ms)
[08/17/2022-07:50:58] [I] Average on 10 runs - GPU latency: 0.156464 ms - Host latency: 0.163354 ms (enqueue 0.0359467 ms)
[08/17/2022-07:50:58] [I] Average on 10 runs - GPU latency: 0.18494 ms - Host latency: 0.191171 ms (enqueue 0.0322113 ms)
[08/17/2022-07:50:58] [I] Average on 10 runs - GPU latency: 0.156256 ms - Host latency: 0.162402 ms (enqueue 0.0298096 ms)
[08/17/2022-07:50:58] [I] Average on 10 runs - GPU latency: 0.156564 ms - Host latency: 0.164447 ms (enqueue 0.041806 ms)
[08/17/2022-07:50:58] [I] Average on 10 runs - GPU latency: 0.15708 ms - Host latency: 0.164053 ms (enqueue 0.0370972 ms)
[08/17/2022-07:50:58] [I] Average on 10 runs - GPU latency: 0.188217 ms - Host latency: 0.195337 ms (enqueue 0.0329651 ms)
[08/17/2022-07:50:58] [I] Average on 10 runs - GPU latency: 0.156464 ms - Host latency: 0.162653 ms (enqueue 0.030011 ms)
[08/17/2022-07:50:58] [I] Average on 10 runs - GPU latency: 0.156876 ms - Host latency: 0.1629 ms (enqueue 0.0303528 ms)
[08/17/2022-07:50:58] [I] Average on 10 runs - GPU latency: 0.157086 ms - Host latency: 0.163422 ms (enqueue 0.0289551 ms)
[08/17/2022-07:50:58] [I] Average on 10 runs - GPU latency: 0.156781 ms - Host latency: 0.163144 ms (enqueue 0.0303558 ms)
[08/17/2022-07:50:58] [I] Average on 10 runs - GPU latency: 0.156369 ms - Host latency: 0.163126 ms (enqueue 0.0332275 ms)
[08/17/2022-07:50:58] [I] Average on 10 runs - GPU latency: 0.156357 ms - Host latency: 0.162817 ms (enqueue 0.0326752 ms)
[08/17/2022-07:50:58] [I] Average on 10 runs - GPU latency: 0.156677 ms - Host latency: 0.162878 ms (enqueue 0.030423 ms)
[08/17/2022-07:50:58] [I] Average on 10 runs - GPU latency: 0.156375 ms - Host latency: 0.162686 ms (enqueue 0.031012 ms)
[08/17/2022-07:50:58] [I] Average on 10 runs - GPU latency: 0.156781 ms - Host latency: 0.163049 ms (enqueue 0.031076 ms)
[08/17/2022-07:50:58] [I] Average on 10 runs - GPU latency: 0.176123 ms - Host latency: 0.182523 ms (enqueue 0.033194 ms)
[08/17/2022-07:50:58] [I] Average on 10 runs - GPU latency: 0.156467 ms - Host latency: 0.1634 ms (enqueue 0.0376923 ms)
[08/17/2022-07:50:58] [I] Average on 10 runs - GPU latency: 0.15647 ms - Host latency: 0.163391 ms (enqueue 0.0379395 ms)
[08/17/2022-07:50:58] [I] Average on 10 runs - GPU latency: 0.156573 ms - Host latency: 0.163632 ms (enqueue 0.0369415 ms)
[08/17/2022-07:50:58] [I] Average on 10 runs - GPU latency: 0.157184 ms - Host latency: 0.16384 ms (enqueue 0.0353546 ms)
[08/17/2022-07:50:58] [I] Average on 10 runs - GPU latency: 0.156894 ms - Host latency: 0.163235 ms (enqueue 0.0343048 ms)
[08/17/2022-07:50:58] [I] Average on 10 runs - GPU latency: 0.171017 ms - Host latency: 0.177023 ms (enqueue 0.0338867 ms)
[08/17/2022-07:50:58] [I] Average on 10 runs - GPU latency: 0.177869 ms - Host latency: 0.184631 ms (enqueue 0.0343933 ms)
[08/17/2022-07:50:58] [I] Average on 10 runs - GPU latency: 0.156506 ms - Host latency: 0.16283 ms (enqueue 0.0336212 ms)
[08/17/2022-07:50:58] [I] Average on 10 runs - GPU latency: 0.156473 ms - Host latency: 0.16246 ms (enqueue 0.0333923 ms)
[08/17/2022-07:50:58] [I] Average on 10 runs - GPU latency: 0.157031 ms - Host latency: 0.163989 ms (enqueue 0.036496 ms)
[08/17/2022-07:50:58] [I] Average on 10 runs - GPU latency: 0.1879 ms - Host latency: 0.193875 ms (enqueue 0.0308533 ms)
[08/17/2022-07:50:58] [I] Average on 10 runs - GPU latency: 0.156674 ms - Host latency: 0.162753 ms (enqueue 0.0307129 ms)
[08/17/2022-07:50:58] [I] Average on 10 runs - GPU latency: 0.156677 ms - Host latency: 0.162656 ms (enqueue 0.0302155 ms)
[08/17/2022-07:50:58] [I] Average on 10 runs - GPU latency: 0.156876 ms - Host latency: 0.162924 ms (enqueue 0.0295746 ms)
[08/17/2022-07:50:58] [I] Average on 10 runs - GPU latency: 0.156778 ms - Host latency: 0.162912 ms (enqueue 0.0306519 ms)
[08/17/2022-07:50:58] [I] Average on 10 runs - GPU latency: 0.156162 ms - Host latency: 0.162265 ms (enqueue 0.028891 ms)
