cookbook/08-Tool/trtexec/result-FP32.txt
[03/19/2022-12:29:29] [V] [TRT] *************** Autotuning Reformat: Float(784,784,28,1) -> Float(784,1,28,1) ***************
[03/19/2022-12:29:29] [V] [TRT] --------------- Timing Runner: Optimizer Reformat(x:0 -> <out>) (Reformat)
[03/19/2022-12:29:29] [V] [TRT] Tactic: 1002 Time: 0.005324
[03/19/2022-12:29:29] [V] [TRT] Tactic: 0 Time: 0.003076
[03/19/2022-12:29:29] [V] [TRT] Fastest Tactic: 0 Time: 0.003076
[03/19/2022-12:29:29] [V] [TRT] =============== Computing reformatting costs
[03/19/2022-12:29:29] [V] [TRT] *************** Autotuning Reformat: Float(25088,1,896,32) -> Float(25088,784,28,1) ***************
[03/19/2022-12:29:29] [V] [TRT] --------------- Timing Runner: Optimizer Reformat(Relu:0 -> <out>) (Reformat)
[03/19/2022-12:29:29] [V] [TRT] Tactic: 1002 Time: 0.015332
[03/19/2022-12:29:29] [V] [TRT] Tactic: 0 Time: 0.009156
[03/19/2022-12:29:29] [V] [TRT] Fastest Tactic: 0 Time: 0.009156
[03/19/2022-12:29:29] [V] [TRT] =============== Computing reformatting costs
[03/19/2022-12:29:29] [V] [TRT] *************** Autotuning Reformat: Float(6272,196,14,1) -> Float(6272,1,448,32) ***************
[03/19/2022-12:29:29] [V] [TRT] --------------- Timing Runner: Optimizer Reformat(<in> -> MaxPool2d:0) (Reformat)
[03/19/2022-12:29:29] [V] [TRT] Tactic: 1002 Time: 0.010216
[03/19/2022-12:29:29] [V] [TRT] Tactic: 0 Time: 0.00512
[03/19/2022-12:29:29] [V] [TRT] Fastest Tactic: 0 Time: 0.00512
[03/19/2022-12:29:29] [V] [TRT] =============== Computing reformatting costs
[03/19/2022-12:29:29] [V] [TRT] *************** Autotuning Reformat: Float(6272,196,14,1) -> Float(6272,1,448,32) ***************
[03/19/2022-12:29:29] [V] [TRT] --------------- Timing Runner: Optimizer Reformat(MaxPool2d:0 -> <out>) (Reformat)
[03/19/2022-12:29:29] [V] [TRT] Tactic: 1002 Time: 0.010216
[03/19/2022-12:29:29] [V] [TRT] Tactic: 0 Time: 0.00512
[03/19/2022-12:29:29] [V] [TRT] Fastest Tactic: 0 Time: 0.00512
[03/19/2022-12:29:29] [V] [TRT] *************** Autotuning Reformat: Float(6272,1,448,32) -> Float(6272,196,14,1) ***************
[03/19/2022-12:29:29] [V] [TRT] --------------- Timing Runner: Optimizer Reformat(MaxPool2d:0 -> <out>) (Reformat)
[03/19/2022-12:29:29] [V] [TRT] Tactic: 1002 Time: 0.010172
[03/19/2022-12:29:29] [V] [TRT] Tactic: 0 Time: 0.00512
[03/19/2022-12:29:29] [V] [TRT] Fastest Tactic: 0 Time: 0.00512
[03/19/2022-12:29:29] [V] [TRT] =============== Computing reformatting costs
[03/19/2022-12:29:29] [V] [TRT] *************** Autotuning Reformat: Float(12544,1,896,64) -> Float(12544,196,14,1) ***************
[03/19/2022-12:29:29] [V] [TRT] --------------- Timing Runner: Optimizer Reformat(Relu_1:0 -> <out>) (Reformat)
[03/19/2022-12:29:29] [V] [TRT] Tactic: 1002 Time: 0.009216
[03/19/2022-12:29:29] [V] [TRT] Tactic: 0 Time: 0.00614
[03/19/2022-12:29:29] [V] [TRT] Fastest Tactic: 0 Time: 0.00614
[03/19/2022-12:29:29] [V] [TRT] =============== Computing reformatting costs
[03/19/2022-12:29:29] [V] [TRT] *************** Autotuning Reformat: Float(3136,49,7,1) -> Float(3136,1,448,64) ***************
[03/19/2022-12:29:29] [V] [TRT] --------------- Timing Runner: Optimizer Reformat(<in> -> MaxPool2d_1:0) (Reformat)
[03/19/2022-12:29:29] [V] [TRT] Tactic: 1002 Time: 0.009216
[03/19/2022-12:29:29] [V] [TRT] Tactic: 0 Time: 0.004096
[03/19/2022-12:29:29] [V] [TRT] Fastest Tactic: 0 Time: 0.004096
[03/19/2022-12:29:29] [V] [TRT] *************** Autotuning Reformat: Float(3136,49,7,1) -> Float(98,49:32,7,1) ***************
[03/19/2022-12:29:29] [V] [TRT] --------------- Timing Runner: Optimizer Reformat(<in> -> MaxPool2d_1:0) (Reformat)
[03/19/2022-12:29:29] [V] [TRT] Tactic: 1002 Time: 0.009216
[03/19/2022-12:29:29] [V] [TRT] Tactic: 0 Time: 0.005008
[03/19/2022-12:29:29] [V] [TRT] Fastest Tactic: 0 Time: 0.005008
[03/19/2022-12:29:29] [V] [TRT] =============== Computing reformatting costs
[03/19/2022-12:29:29] [V] [TRT] *************** Autotuning Reformat: Float(3136,49,7,1) -> Float(3136,1,448,64) ***************
[03/19/2022-12:29:29] [V] [TRT] --------------- Timing Runner: Optimizer Reformat(MaxPool2d_1:0 -> <out>) (Reformat)
[03/19/2022-12:29:29] [V] [TRT] Tactic: 1002 Time: 0.009316
[03/19/2022-12:29:29] [V] [TRT] Tactic: 0 Time: 0.004088
[03/19/2022-12:29:29] [V] [TRT] Fastest Tactic: 0 Time: 0.004088
[03/19/2022-12:29:29] [V] [TRT] *************** Autotuning Reformat: Float(3136,49,7,1) -> Float(98,49:32,7,1) ***************
[03/19/2022-12:29:29] [V] [TRT] --------------- Timing Runner: Optimizer Reformat(MaxPool2d_1:0 -> <out>) (Reformat)
[03/19/2022-12:29:29] [V] [TRT] Tactic: 1002 Time: 0.00922
[03/19/2022-12:29:29] [V] [TRT] Tactic: 0 Time: 0.005116
[03/19/2022-12:29:29] [V] [TRT] Fastest Tactic: 0 Time: 0.005116
[03/19/2022-12:29:29] [V] [TRT] *************** Autotuning Reformat: Float(3136,1,448,64) -> Float(3136,49,7,1) ***************
[03/19/2022-12:29:29] [V] [TRT] --------------- Timing Runner: Optimizer Reformat(MaxPool2d_1:0 -> <out>) (Reformat)
[03/19/2022-12:29:29] [V] [TRT] Tactic: 1002 Time: 0.009344
[03/19/2022-12:29:29] [V] [TRT] Tactic: 0 Time: 0.004096
[03/19/2022-12:29:29] [V] [TRT] Fastest Tactic: 0 Time: 0.004096
[03/19/2022-12:29:29] [V] [TRT] *************** Autotuning Reformat: Float(3136,1,448,64) -> Float(98,49:32,7,1) ***************
[03/19/2022-12:29:29] [V] [TRT] --------------- Timing Runner: Optimizer Reformat(MaxPool2d_1:0 -> <out>) (Reformat)
[03/19/2022-12:29:29] [V] [TRT] Tactic: 1002 Time: 0.0084
[03/19/2022-12:29:29] [V] [TRT] Tactic: 0 Time: 0.005116
[03/19/2022-12:29:29] [V] [TRT] Fastest Tactic: 0 Time: 0.005116
[03/19/2022-12:29:29] [V] [TRT] *************** Autotuning Reformat: Float(98,49:32,7,1) -> Float(3136,49,7,1) ***************
[03/19/2022-12:29:29] [V] [TRT] --------------- Timing Runner: Optimizer Reformat(MaxPool2d_1:0 -> <out>) (Reformat)
[03/19/2022-12:29:29] [V] [TRT] Tactic: 1002 Time: 0.009636
[03/19/2022-12:29:29] [V] [TRT] Tactic: 0 Time: 0.004096
[03/19/2022-12:29:29] [V] [TRT] Fastest Tactic: 0 Time: 0.004096
[03/19/2022-12:29:29] [V] [TRT] *************** Autotuning Reformat: Float(98,49:32,7,1) -> Float(3136,1,448,64) ***************
[03/19/2022-12:29:29] [V] [TRT] --------------- Timing Runner: Optimizer Reformat(MaxPool2d_1:0 -> <out>) (Reformat)
[03/19/2022-12:29:29] [V] [TRT] Tactic: 1002 Time: 0.008636
[03/19/2022-12:29:29] [V] [TRT] Tactic: 0 Time: 0.004096
[03/19/2022-12:29:29] [V] [TRT] Fastest Tactic: 0 Time: 0.004096
[03/19/2022-12:29:29] [V] [TRT] =============== Computing reformatting costs
[03/19/2022-12:29:29] [V] [TRT] *************** Autotuning Reformat: Float(3136,1,1,1) -> Float(3136,1,3136,3136) ***************
[03/19/2022-12:29:29] [V] [TRT] --------------- Timing Runner: Optimizer Reformat((Unnamed Layer* 14) [Shuffle]_output -> <out>) (Reformat)
[03/19/2022-12:29:29] [V] [TRT] Tactic: 1002 Time: 0.005056
[03/19/2022-12:29:29] [V] [TRT] Tactic: 0 Time: 0.004096
[03/19/2022-12:29:29] [V] [TRT] Fastest Tactic: 0 Time: 0.004096
[03/19/2022-12:29:29] [V] [TRT] *************** Autotuning Reformat: Float(3136,1,3136,3136) -> Float(3136,1,1,1) ***************
[03/19/2022-12:29:29] [V] [TRT] --------------- Timing Runner: Optimizer Reformat((Unnamed Layer* 14) [Shuffle]_output -> <out>) (Reformat)
[03/19/2022-12:29:29] [V] [TRT] Tactic: 1002 Time: 0.00512
[03/19/2022-12:29:29] [V] [TRT] Tactic: 0 Time: 0.004092
[03/19/2022-12:29:29] [V] [TRT] Fastest Tactic: 0 Time: 0.004092
[03/19/2022-12:29:29] [V] [TRT] *************** Autotuning Reformat: Float(98,1:32,1,1) -> Float(3136,1,1,1) ***************
[03/19/2022-12:29:29] [V] [TRT] --------------- Timing Runner: Optimizer Reformat((Unnamed Layer* 14) [Shuffle]_output -> <out>) (Reformat)
[03/19/2022-12:29:29] [V] [TRT] Tactic: 1002 Time: 0.030948
[03/19/2022-12:29:29] [V] [TRT] Tactic: 0 Time: 0.004096
[03/19/2022-12:29:29] [V] [TRT] Fastest Tactic: 0 Time: 0.004096
[03/19/2022-12:29:29] [V] [TRT] *************** Autotuning Reformat: Float(98,1:32,1,1) -> Float(3136,1,3136,3136) ***************
[03/19/2022-12:29:29] [V] [TRT] --------------- Timing Runner: Optimizer Reformat((Unnamed Layer* 14) [Shuffle]_output -> <out>) (Reformat)
[03/19/2022-12:29:29] [V] [TRT] Tactic: 1002 Time: 0.011492
[03/19/2022-12:29:29] [V] [TRT] Tactic: 0 Time: 0.004204
[03/19/2022-12:29:29] [V] [TRT] Fastest Tactic: 0 Time: 0.004204
[03/19/2022-12:29:29] [V] [TRT] =============== Computing reformatting costs
[03/19/2022-12:29:29] [V] [TRT] *************** Autotuning Reformat: Float(1024,1,1,1) -> Float(1024,1,1024,1024) ***************
[03/19/2022-12:29:29] [V] [TRT] --------------- Timing Runner: Optimizer Reformat(Relu_2_out_tensor -> <out>) (Reformat)
[03/19/2022-12:29:29] [V] [TRT] Tactic: 1002 Time: 0.00454
[03/19/2022-12:29:29] [V] [TRT] Tactic: 0 Time: 0.003072
[03/19/2022-12:29:29] [V] [TRT] Fastest Tactic: 0 Time: 0.003072
[03/19/2022-12:29:29] [V] [TRT] *************** Autotuning Reformat: Float(1024,1,1024,1024) -> Float(1024,1,1,1) ***************
[03/19/2022-12:29:29] [V] [TRT] --------------- Timing Runner: Optimizer Reformat(Relu_2_out_tensor -> <out>) (Reformat)
[03/19/2022-12:29:29] [V] [TRT] Tactic: 1002 Time: 0.0043
[03/19/2022-12:29:29] [V] [TRT] Tactic: 0 Time: 0.0032
[03/19/2022-12:29:29] [V] [TRT] Fastest Tactic: 0 Time: 0.0032
[03/19/2022-12:29:29] [V] [TRT] =============== Computing reformatting costs
[03/19/2022-12:29:29] [V] [TRT] *************** Autotuning Reformat: Float(10,1,10,10) -> Float(10,1,1,1) ***************
[03/19/2022-12:29:29] [V] [TRT] --------------- Timing Runner: Optimizer Reformat(add_3_out_tensor -> <out>) (Reformat)
[03/19/2022-12:29:29] [V] [TRT] Tactic: 1002 Time: 0.008296
[03/19/2022-12:29:29] [V] [TRT] Tactic: 0 Time: 0.003184
[03/19/2022-12:29:29] [V] [TRT] Fastest Tactic: 0 Time: 0.003184
[03/19/2022-12:29:29] [V] [TRT] =============== Computing reformatting costs
[03/19/2022-12:29:29] [V] [TRT] =============== Computing reformatting costs
[03/19/2022-12:29:29] [V] [TRT] =============== Computing reformatting costs
[03/19/2022-12:29:29] [V] [TRT] =============== Computing reformatting costs
[03/19/2022-12:29:29] [V] [TRT] =============== Computing reformatting costs
[03/19/2022-12:29:29] [V] [TRT] =============== Computing reformatting costs
[03/19/2022-12:29:29] [V] [TRT] =============== Computing costs for 
[03/19/2022-12:29:29] [V] [TRT] *************** Autotuning format combination: Float(784,784,28,1) -> Float(25088,784,28,1) ***************
[03/19/2022-12:29:29] [V] [TRT] --------------- Timing Runner: Conv__25 + Relu (CudaDepthwiseConvolution)
[03/19/2022-12:29:29] [V] [TRT] CudaDepthwiseConvolution has no valid tactics for this config, skipping
[03/19/2022-12:29:29] [V] [TRT] --------------- Timing Runner: Conv__25 + Relu (FusedConvActConvolution)
[03/19/2022-12:29:29] [V] [TRT] FusedConvActConvolution has no valid tactics for this config, skipping
[03/19/2022-12:29:29] [V] [TRT] --------------- Timing Runner: Conv__25 + Relu (CudnnConvolution)
[03/19/2022-12:29:30] [V] [TRT] Tactic: 0 Time: 0.0267
[03/19/2022-12:29:30] [V] [TRT] Tactic: 1 Time: 0.024684
[03/19/2022-12:29:30] [V] [TRT] Tactic: 2 Time: 0.031852
[03/19/2022-12:29:30] [V] [TRT] Tactic: 4 Time: 0.039528
[03/19/2022-12:29:30] [V] [TRT] Tactic: 5 Time: 0.040392
[03/19/2022-12:29:30] [V] [TRT] Fastest Tactic: 1 Time: 0.024684
[03/19/2022-12:29:30] [V] [TRT] --------------- Timing Runner: Conv__25 + Relu (CaskConvolution)
[03/19/2022-12:29:30] [V] [TRT] Conv__25 + Relu Set Tactic Name: maxwell_scudnn_128x32_relu_medium_nn_v1 Tactic: 1062367460111450758
[03/19/2022-12:29:30] [V] [TRT] Tactic: 1062367460111450758 Time: 0.014168
[03/19/2022-12:29:30] [V] [TRT] Conv__25 + Relu Set Tactic Name: maxwell_scudnn_128x32_relu_large_nn_v0 Tactic: 1754984623894446479
[03/19/2022-12:29:30] [V] [TRT] Tactic: 1754984623894446479 Time: 0.011236
[03/19/2022-12:29:30] [V] [TRT] Conv__25 + Relu Set Tactic Name: maxwell_scudnn_128x128_relu_large_nn_v0 Tactic: 3611739942397549984
[03/19/2022-12:29:30] [V] [TRT] Tactic: 3611739942397549984 Time: 0.01928
[03/19/2022-12:29:30] [V] [TRT] Conv__25 + Relu Set Tactic Name: maxwell_scudnn_128x64_relu_large_nn_v1 Tactic: 4337000649858996379
[03/19/2022-12:29:30] [V] [TRT] Tactic: 4337000649858996379 Time: 0.014468
[03/19/2022-12:29:30] [V] [TRT] Conv__25 + Relu Set Tactic Name: maxwell_scudnn_128x128_relu_medium_nn_v1 Tactic: 4501471010995462441
[03/19/2022-12:29:30] [V] [TRT] Tactic: 4501471010995462441 Time: 0.017832
[03/19/2022-12:29:30] [V] [TRT] Conv__25 + Relu Set Tactic Name: maxwell_scudnn_128x64_relu_small_nn_v1 Tactic: 5137655947464784826
[03/19/2022-12:29:30] [V] [TRT] Tactic: 5137655947464784826 Time: 0.013308
[03/19/2022-12:29:30] [V] [TRT] Conv__25 + Relu Set Tactic Name: maxwell_scudnn_128x128_relu_small_nn_v0 Tactic: 5288347012147084929
[03/19/2022-12:29:30] [V] [TRT] Tactic: 5288347012147084929 Time: 0.018756
[03/19/2022-12:29:30] [V] [TRT] Conv__25 + Relu Set Tactic Name: maxwell_scudnn_128x64_relu_medium_nn_v1 Tactic: 6645123197870846056
[03/19/2022-12:29:30] [V] [TRT] Tactic: 6645123197870846056 Time: 0.013892
[03/19/2022-12:29:30] [V] [TRT] Conv__25 + Relu Set Tactic Name: maxwell_scudnn_128x32_relu_small_nn_v0 Tactic: 7144526460361122478
[03/19/2022-12:29:30] [V] [TRT] Tactic: 7144526460361122478 Time: 0.010752
[03/19/2022-12:29:30] [V] [TRT] Conv__25 + Relu Set Tactic Name: maxwell_scudnn_128x128_relu_large_nn_v1 Tactic: -9137461792520977713
[03/19/2022-12:29:30] [V] [TRT] Tactic: -9137461792520977713 Time: 0.018428
[03/19/2022-12:29:30] [V] [TRT] Conv__25 + Relu Set Tactic Name: maxwell_scudnn_128x128_relu_medium_nn_v0 Tactic: -8262349710178828730
[03/19/2022-12:29:30] [V] [TRT] Tactic: -8262349710178828730 Time: 0.019752
[03/19/2022-12:29:30] [V] [TRT] Conv__25 + Relu Set Tactic Name: maxwell_scudnn_128x64_relu_large_nn_v0 Tactic: -8133971918129952780
[03/19/2022-12:29:30] [V] [TRT] Tactic: -8133971918129952780 Time: 0.01446
[03/19/2022-12:29:30] [V] [TRT] Conv__25 + Relu Set Tactic Name: maxwell_scudnn_128x32_relu_large_nn_v1 Tactic: -6092040395344634144
[03/19/2022-12:29:30] [V] [TRT] Tactic: -6092040395344634144 Time: 0.014336
[03/19/2022-12:29:30] [V] [TRT] Conv__25 + Relu Set Tactic Name: maxwell_scudnn_128x32_relu_medium_nn_v0 Tactic: -4787320710726427159
[03/19/2022-12:29:30] [V] [TRT] Tactic: -4787320710726427159 Time: 0.0111
[03/19/2022-12:29:30] [V] [TRT] Conv__25 + Relu Set Tactic Name: maxwell_scudnn_128x32_relu_small_nn_v1 Tactic: -3456450830548107839
[03/19/2022-12:29:30] [V] [TRT] Tactic: -3456450830548107839 Time: 0.012288
[03/19/2022-12:29:30] [V] [TRT] Conv__25 + Relu Set Tactic Name: maxwell_scudnn_128x64_relu_medium_nn_v0 Tactic: -1218658103698133241
[03/19/2022-12:29:30] [V] [TRT] Tactic: -1218658103698133241 Time: 0.014332
[03/19/2022-12:29:30] [V] [TRT] Conv__25 + Relu Set Tactic Name: maxwell_scudnn_128x64_relu_small_nn_v0 Tactic: -836875257600482091
[03/19/2022-12:29:30] [V] [TRT] Tactic: -836875257600482091 Time: 0.013448
[03/19/2022-12:29:30] [V] [TRT] Conv__25 + Relu Set Tactic Name: maxwell_scudnn_128x128_relu_small_nn_v1 Tactic: -410470605513481746
[03/19/2022-12:29:30] [V] [TRT] Tactic: -410470605513481746 Time: 0.017408
[03/19/2022-12:29:30] [V] [TRT] Fastest Tactic: 7144526460361122478 Time: 0.010752
[03/19/2022-12:29:30] [V] [TRT] >>>>>>>>>>>>>>> Chose Runner Type: CaskConvolution Tactic: 7144526460361122478
[03/19/2022-12:29:30] [V] [TRT] *************** Autotuning format combination: Float(784,1,28,1) -> Float(25088,1,896,32) ***************
[03/19/2022-12:29:30] [V] [TRT] --------------- Timing Runner: Conv__25 + Relu (CudnnConvolution)
[03/19/2022-12:29:30] [V] [TRT] CudnnConvolution has no valid tactics for this config, skipping
[03/19/2022-12:29:30] [V] [TRT] --------------- Timing Runner: Conv__25 + Relu (CaskConvolution)
[03/19/2022-12:29:30] [V] [TRT] CaskConvolution has no valid tactics for this config, skipping
[03/19/2022-12:29:30] [V] [TRT] =============== Computing costs for 
[03/19/2022-12:29:30] [V] [TRT] *************** Autotuning format combination: Float(25088,784,28,1) -> Float(6272,196,14,1) ***************
[03/19/2022-12:29:30] [V] [TRT] --------------- Timing Runner: MaxPool2d (TiledPooling)
[03/19/2022-12:29:30] [V] [TRT] Tactic: 5505281 Time: 0.010472
[03/19/2022-12:29:30] [V] [TRT] Tactic: 5570817 Time: 0.00742
[03/19/2022-12:29:30] [V] [TRT] Tactic: 5636353 Time: 0.007296
[03/19/2022-12:29:30] [V] [TRT] Tactic: 5701889 Time: 0.006264
[03/19/2022-12:29:30] [V] [TRT] Tactic: 5767425 Time: 0.00652
[03/19/2022-12:29:30] [V] [TRT] Tactic: 5832961 Time: 0.006528
[03/19/2022-12:29:30] [V] [TRT] Tactic: 5898497 Time: 0.006144
[03/19/2022-12:29:30] [V] [TRT] Tactic: 5964033 Time: 0.005216
[03/19/2022-12:29:30] [V] [TRT] Tactic: 6029569 Time: 0.007096
[03/19/2022-12:29:30] [V] [TRT] Tactic: 6095105 Time: 0.005252
[03/19/2022-12:29:30] [V] [TRT] Tactic: 6160641 Time: 0.005124
[03/19/2022-12:29:30] [V] [TRT] Tactic: 6226177 Time: 0.004864
[03/19/2022-12:29:30] [V] [TRT] Tactic: 6291713 Time: 0.005088
[03/19/2022-12:29:31] [V] [TRT] Tactic: 6357249 Time: 0.004792
[03/19/2022-12:29:31] [V] [TRT] Tactic: 6422785 Time: 0.004984
[03/19/2022-12:29:31] [V] [TRT] Tactic: 6488321 Time: 0.004416
[03/19/2022-12:29:31] [V] [TRT] Fastest Tactic: 6488321 Time: 0.004416
[03/19/2022-12:29:31] [V] [TRT] --------------- Timing Runner: MaxPool2d (CudnnPooling)
[03/19/2022-12:29:31] [V] [TRT] Tactic: -1 Time: 0.005208
[03/19/2022-12:29:31] [V] [TRT] Fastest Tactic: -1 Time: 0.005208
[03/19/2022-12:29:31] [V] [TRT] >>>>>>>>>>>>>>> Chose Runner Type: TiledPooling Tactic: 6488321
[03/19/2022-12:29:31] [V] [TRT] =============== Computing costs for 
[03/19/2022-12:29:31] [V] [TRT] *************** Autotuning format combination: Float(6272,196,14,1) -> Float(12544,196,14,1) ***************
[03/19/2022-12:29:31] [V] [TRT] --------------- Timing Runner: Conv__27 + Relu_1 (CudaDepthwiseConvolution)
[03/19/2022-12:29:31] [V] [TRT] CudaDepthwiseConvolution has no valid tactics for this config, skipping
[03/19/2022-12:29:31] [V] [TRT] --------------- Timing Runner: Conv__27 + Relu_1 (FusedConvActConvolution)
[03/19/2022-12:29:31] [V] [TRT] FusedConvActConvolution has no valid tactics for this config, skipping
[03/19/2022-12:29:31] [V] [TRT] --------------- Timing Runner: Conv__27 + Relu_1 (CudnnConvolution)
[03/19/2022-12:29:31] [V] [TRT] Tactic: 0 Time: 0.087396
[03/19/2022-12:29:31] [V] [TRT] Tactic: 1 Time: 0.090108
[03/19/2022-12:29:31] [V] [TRT] Tactic: 2 Time: 0.135012
[03/19/2022-12:29:31] [V] [TRT] Tactic: 4 Time: 0.189432
[03/19/2022-12:29:31] [V] [TRT] Tactic: 5 Time: 0.20192
[03/19/2022-12:29:31] [V] [TRT] Fastest Tactic: 0 Time: 0.087396
[03/19/2022-12:29:31] [V] [TRT] --------------- Timing Runner: Conv__27 + Relu_1 (CaskConvolution)
[03/19/2022-12:29:31] [V] [TRT] Conv__27 + Relu_1 Set Tactic Name: maxwell_scudnn_128x32_relu_medium_nn_v1 Tactic: 1062367460111450758
[03/19/2022-12:29:31] [V] [TRT] Tactic: 1062367460111450758 Time: 0.138876
[03/19/2022-12:29:31] [V] [TRT] Conv__27 + Relu_1 Set Tactic Name: maxwell_scudnn_128x32_relu_large_nn_v0 Tactic: 1754984623894446479
[03/19/2022-12:29:31] [V] [TRT] Tactic: 1754984623894446479 Time: 0.101724
[03/19/2022-12:29:31] [V] [TRT] Conv__27 + Relu_1 Set Tactic Name: maxwell_scudnn_128x128_relu_large_nn_v0 Tactic: 3611739942397549984
[03/19/2022-12:29:31] [V] [TRT] Tactic: 3611739942397549984 Time: 0.111588
[03/19/2022-12:29:31] [V] [TRT] Conv__27 + Relu_1 Set Tactic Name: maxwell_scudnn_128x64_relu_large_nn_v1 Tactic: 4337000649858996379
[03/19/2022-12:29:31] [V] [TRT] Tactic: 4337000649858996379 Time: 0.102616
[03/19/2022-12:29:31] [V] [TRT] Conv__27 + Relu_1 Set Tactic Name: maxwell_scudnn_128x128_relu_medium_nn_v1 Tactic: 4501471010995462441
[03/19/2022-12:29:31] [V] [TRT] Tactic: 4501471010995462441 Time: 0.111604
[03/19/2022-12:29:31] [V] [TRT] Conv__27 + Relu_1 Set Tactic Name: maxwell_scudnn_128x64_relu_small_nn_v1 Tactic: 5137655947464784826
[03/19/2022-12:29:31] [V] [TRT] Tactic: 5137655947464784826 Time: 0.067584
[03/19/2022-12:29:31] [V] [TRT] Conv__27 + Relu_1 Set Tactic Name: maxwell_scudnn_128x128_relu_small_nn_v0 Tactic: 5288347012147084929
[03/19/2022-12:29:31] [V] [TRT] Tactic: 5288347012147084929 Time: 0.096248
[03/19/2022-12:29:31] [V] [TRT] Conv__27 + Relu_1 Set Tactic Name: maxwell_scudnn_128x64_relu_medium_nn_v1 Tactic: 6645123197870846056
[03/19/2022-12:29:31] [V] [TRT] Tactic: 6645123197870846056 Time: 0.092156
[03/19/2022-12:29:31] [V] [TRT] Conv__27 + Relu_1 Set Tactic Name: maxwell_scudnn_128x32_relu_small_nn_v0 Tactic: 7144526460361122478
[03/19/2022-12:29:31] [V] [TRT] Tactic: 7144526460361122478 Time: 0.0777
[03/19/2022-12:29:31] [V] [TRT] Conv__27 + Relu_1 Set Tactic Name: maxwell_scudnn_128x128_relu_large_nn_v1 Tactic: -9137461792520977713
[03/19/2022-12:29:31] [V] [TRT] Tactic: -9137461792520977713 Time: 0.115328
[03/19/2022-12:29:31] [V] [TRT] Conv__27 + Relu_1 Set Tactic Name: maxwell_scudnn_128x128_relu_medium_nn_v0 Tactic: -8262349710178828730
[03/19/2022-12:29:31] [V] [TRT] Tactic: -8262349710178828730 Time: 0.111552
[03/19/2022-12:29:31] [V] [TRT] Conv__27 + Relu_1 Set Tactic Name: maxwell_scudnn_128x64_relu_large_nn_v0 Tactic: -8133971918129952780
[03/19/2022-12:29:31] [V] [TRT] Tactic: -8133971918129952780 Time: 0.120256
[03/19/2022-12:29:31] [V] [TRT] Conv__27 + Relu_1 Set Tactic Name: maxwell_scudnn_128x32_relu_large_nn_v1 Tactic: -6092040395344634144
[03/19/2022-12:29:31] [V] [TRT] Tactic: -6092040395344634144 Time: 0.141412
[03/19/2022-12:29:31] [V] [TRT] Conv__27 + Relu_1 Set Tactic Name: maxwell_scudnn_128x32_relu_medium_nn_v0 Tactic: -4787320710726427159
[03/19/2022-12:29:31] [V] [TRT] Tactic: -4787320710726427159 Time: 0.10048
[03/19/2022-12:29:31] [V] [TRT] Conv__27 + Relu_1 Set Tactic Name: maxwell_scudnn_128x32_relu_small_nn_v1 Tactic: -3456450830548107839
[03/19/2022-12:29:31] [V] [TRT] Tactic: -3456450830548107839 Time: 0.079336
[03/19/2022-12:29:31] [V] [TRT] Conv__27 + Relu_1 Set Tactic Name: maxwell_scudnn_128x64_relu_medium_nn_v0 Tactic: -1218658103698133241
[03/19/2022-12:29:31] [V] [TRT] Tactic: -1218658103698133241 Time: 0.118252
[03/19/2022-12:29:31] [V] [TRT] Conv__27 + Relu_1 Set Tactic Name: maxwell_scudnn_128x64_relu_small_nn_v0 Tactic: -836875257600482091
[03/19/2022-12:29:31] [V] [TRT] Tactic: -836875257600482091 Time: 0.097476
[03/19/2022-12:29:31] [V] [TRT] Conv__27 + Relu_1 Set Tactic Name: maxwell_scudnn_128x128_relu_small_nn_v1 Tactic: -410470605513481746
[03/19/2022-12:29:31] [V] [TRT] Tactic: -410470605513481746 Time: 0.094624
[03/19/2022-12:29:31] [V] [TRT] Fastest Tactic: 5137655947464784826 Time: 0.067584
[03/19/2022-12:29:31] [V] [TRT] >>>>>>>>>>>>>>> Chose Runner Type: CaskConvolution Tactic: 5137655947464784826
[03/19/2022-12:29:31] [V] [TRT] *************** Autotuning format combination: Float(6272,1,448,32) -> Float(12544,1,896,64) ***************
[03/19/2022-12:29:31] [V] [TRT] --------------- Timing Runner: Conv__27 + Relu_1 (CudnnConvolution)
[03/19/2022-12:29:31] [V] [TRT] CudnnConvolution has no valid tactics for this config, skipping
[03/19/2022-12:29:31] [V] [TRT] --------------- Timing Runner: Conv__27 + Relu_1 (CaskConvolution)
[03/19/2022-12:29:31] [V] [TRT] Conv__27 + Relu_1 Set Tactic Name: maxwell_scudnn_128x32_sliced1x4_ldg4_relu_exp_small_nhwc_tn_v1 Tactic: -9153228964338181824
[03/19/2022-12:29:31] [V] [TRT] Tactic: -9153228964338181824 Time: 0.030572
[03/19/2022-12:29:31] [V] [TRT] Conv__27 + Relu_1 Set Tactic Name: maxwell_scudnn_128x64_sliced1x2_ldg4_relu_exp_small_nhwc_tn_v1 Tactic: -7394439838318485025
[03/19/2022-12:29:31] [V] [TRT] Tactic: -7394439838318485025 Time: 0.052704
[03/19/2022-12:29:31] [V] [TRT] Fastest Tactic: -9153228964338181824 Time: 0.030572
[03/19/2022-12:29:31] [V] [TRT] >>>>>>>>>>>>>>> Chose Runner Type: CaskConvolution Tactic: -9153228964338181824
[03/19/2022-12:29:31] [V] [TRT] =============== Computing costs for 
[03/19/2022-12:29:31] [V] [TRT] *************** Autotuning format combination: Float(12544,196,14,1) -> Float(3136,49,7,1) ***************
[03/19/2022-12:29:31] [V] [TRT] --------------- Timing Runner: MaxPool2d_1 (TiledPooling)
[03/19/2022-12:29:31] [V] [TRT] Tactic: 5505281 Time: 0.011192
[03/19/2022-12:29:31] [V] [TRT] Tactic: 5570817 Time: 0.008148
[03/19/2022-12:29:31] [V] [TRT] Tactic: 5636353 Time: 0.007128
[03/19/2022-12:29:31] [V] [TRT] Tactic: 5701889 Time: 0.006268
[03/19/2022-12:29:31] [V] [TRT] Tactic: 5767425 Time: 0.006224
[03/19/2022-12:29:31] [V] [TRT] Tactic: 5832961 Time: 0.006144
[03/19/2022-12:29:31] [V] [TRT] Tactic: 5898497 Time: 0.006404
[03/19/2022-12:29:31] [V] [TRT] Tactic: 5964033 Time: 0.006108
[03/19/2022-12:29:31] [V] [TRT] Tactic: 6029569 Time: 0.007168
[03/19/2022-12:29:31] [V] [TRT] Tactic: 6095105 Time: 0.005512
[03/19/2022-12:29:31] [V] [TRT] Tactic: 6160641 Time: 0.005124
[03/19/2022-12:29:31] [V] [TRT] Tactic: 6226177 Time: 0.005104
[03/19/2022-12:29:31] [V] [TRT] Tactic: 6291713 Time: 0.005036
[03/19/2022-12:29:31] [V] [TRT] Tactic: 6357249 Time: 0.004852
[03/19/2022-12:29:31] [V] [TRT] Tactic: 6422785 Time: 0.004992
[03/19/2022-12:29:32] [V] [TRT] Tactic: 6488321 Time: 0.004816
[03/19/2022-12:29:32] [V] [TRT] Fastest Tactic: 6488321 Time: 0.004816
[03/19/2022-12:29:32] [V] [TRT] --------------- Timing Runner: MaxPool2d_1 (CudnnPooling)
[03/19/2022-12:29:32] [V] [TRT] Tactic: -1 Time: 0.004856
[03/19/2022-12:29:32] [V] [TRT] Fastest Tactic: -1 Time: 0.004856
[03/19/2022-12:29:32] [V] [TRT] >>>>>>>>>>>>>>> Chose Runner Type: TiledPooling Tactic: 6488321
[03/19/2022-12:29:32] [V] [TRT] =============== Computing costs for 
[03/19/2022-12:29:32] [V] [TRT] *************** Autotuning format combination: Float(3136,49,7,1) -> Float(3136,1,1,1) ***************
[03/19/2022-12:29:32] [V] [TRT] --------------- Timing Runner: MaxPool2d_1__22 + Reshape + (Unnamed Layer* 14) [Shuffle] (Shuffle)
[03/19/2022-12:29:32] [V] [TRT] Tactic: 0 Time: 0.004492
[03/19/2022-12:29:32] [V] [TRT] Fastest Tactic: 0 Time: 0.004492
[03/19/2022-12:29:32] [V] [TRT] >>>>>>>>>>>>>>> Chose Runner Type: Shuffle Tactic: 0
[03/19/2022-12:29:32] [V] [TRT] *************** Autotuning format combination: Float(3136,1,448,64) -> Float(3136,1,3136,3136) ***************
[03/19/2022-12:29:32] [V] [TRT] --------------- Timing Runner: MaxPool2d_1__22 + Reshape + (Unnamed Layer* 14) [Shuffle] (Shuffle)
[03/19/2022-12:29:32] [V] [TRT] Tactic: 0 Time: 0.004096
[03/19/2022-12:29:32] [V] [TRT] Fastest Tactic: 0 Time: 0.004096
[03/19/2022-12:29:32] [V] [TRT] >>>>>>>>>>>>>>> Chose Runner Type: Shuffle Tactic: 0
[03/19/2022-12:29:32] [V] [TRT] *************** Autotuning format combination: Float(98,49:32,7,1) -> Float(98,1:32,1,1) ***************
[03/19/2022-12:29:32] [V] [TRT] --------------- Timing Runner: MaxPool2d_1__22 + Reshape + (Unnamed Layer* 14) [Shuffle] (Shuffle)
[03/19/2022-12:29:32] [V] [TRT] Tactic: 0 Time: 0.004348
[03/19/2022-12:29:32] [V] [TRT] Fastest Tactic: 0 Time: 0.004348
[03/19/2022-12:29:32] [V] [TRT] >>>>>>>>>>>>>>> Chose Runner Type: Shuffle Tactic: 0
[03/19/2022-12:29:32] [V] [TRT] =============== Computing costs for 
[03/19/2022-12:29:32] [V] [TRT] *************** Autotuning format combination: Float(3136,1,1,1) -> Float(1024,1,1,1) ***************
[03/19/2022-12:29:32] [V] [TRT] --------------- Timing Runner: MatMul + b3/read:0 + (Unnamed Layer* 21) [Shuffle] + unsqueeze_node_after_b3/read:0 + (Unnamed Layer* 21) [Shuffle]_(Unnamed Layer* 21) [Shuffle]_output + add_2 + Relu_2 (CudaDepthwiseConvolution)
[03/19/2022-12:29:32] [V] [TRT] CudaDepthwiseConvolution has no valid tactics for this config, skipping
[03/19/2022-12:29:32] [V] [TRT] --------------- Timing Runner: MatMul + b3/read:0 + (Unnamed Layer* 21) [Shuffle] + unsqueeze_node_after_b3/read:0 + (Unnamed Layer* 21) [Shuffle]_(Unnamed Layer* 21) [Shuffle]_output + add_2 + Relu_2 (FusedConvActConvolution)
[03/19/2022-12:29:32] [V] [TRT] FusedConvActConvolution has no valid tactics for this config, skipping
[03/19/2022-12:29:32] [V] [TRT] --------------- Timing Runner: MatMul + b3/read:0 + (Unnamed Layer* 21) [Shuffle] + unsqueeze_node_after_b3/read:0 + (Unnamed Layer* 21) [Shuffle]_(Unnamed Layer* 21) [Shuffle]_output + add_2 + Relu_2 (CudnnConvolution)
[03/19/2022-12:29:32] [V] [TRT] Tactic: 0 Time: 0.330104
[03/19/2022-12:29:32] [V] [TRT] Tactic: 1 Time: 0.3182
[03/19/2022-12:29:32] [V] [TRT] Tactic: 2 Time: 0.40486
[03/19/2022-12:29:32] [V] [TRT] Tactic: 4 skipped. Scratch requested: 7527202816, available: 1073741824
[03/19/2022-12:29:32] [V] [TRT] Tactic: 5 Time: 7.03809
[03/19/2022-12:29:32] [I] [TRT] Some tactics do not have sufficient workspace memory to run. Increasing workspace size may increase performance, please check verbose output.
[03/19/2022-12:29:32] [V] [TRT] Fastest Tactic: 1 Time: 0.3182
[03/19/2022-12:29:32] [V] [TRT] Setting workspace to 7527202816enables more tactics for profiling
[03/19/2022-12:29:32] [V] [TRT] --------------- Timing Runner: MatMul + b3/read:0 + (Unnamed Layer* 21) [Shuffle] + unsqueeze_node_after_b3/read:0 + (Unnamed Layer* 21) [Shuffle]_(Unnamed Layer* 21) [Shuffle]_output + add_2 + Relu_2 (CublasConvolution)
[03/19/2022-12:29:32] [V] [TRT] Tactic: 0 Time: 0.073076
[03/19/2022-12:29:32] [V] [TRT] Tactic: 1 Time: 0.0704
[03/19/2022-12:29:32] [V] [TRT] Fastest Tactic: 1 Time: 0.0704
[03/19/2022-12:29:32] [V] [TRT] --------------- Timing Runner: MatMul + b3/read:0 + (Unnamed Layer* 21) [Shuffle] + unsqueeze_node_after_b3/read:0 + (Unnamed Layer* 21) [Shuffle]_(Unnamed Layer* 21) [Shuffle]_output + add_2 + Relu_2 (CaskConvolution)
[03/19/2022-12:29:32] [V] [TRT] MatMul + b3/read:0 + (Unnamed Layer* 21) [Shuffle] + unsqueeze_node_after_b3/read:0 + (Unnamed Layer* 21) [Shuffle]_(Unnamed Layer* 21) [Shuffle]_output + add_2 + Relu_2 Set Tactic Name: maxwell_scudnn_128x32_relu_medium_nn_v1 Tactic: 1062367460111450758
[03/19/2022-12:29:32] [V] [TRT] Tactic: 1062367460111450758 Time: 0.39064
[03/19/2022-12:29:32] [V] [TRT] MatMul + b3/read:0 + (Unnamed Layer* 21) [Shuffle] + unsqueeze_node_after_b3/read:0 + (Unnamed Layer* 21) [Shuffle]_(Unnamed Layer* 21) [Shuffle]_output + add_2 + Relu_2 Set Tactic Name: maxwell_scudnn_128x32_relu_interior_nn_v0 Tactic: 1698681053543049347
[03/19/2022-12:29:32] [V] [TRT] Tactic: 1698681053543049347 Time: 0.384488
[03/19/2022-12:29:32] [V] [TRT] MatMul + b3/read:0 + (Unnamed Layer* 21) [Shuffle] + unsqueeze_node_after_b3/read:0 + (Unnamed Layer* 21) [Shuffle]_(Unnamed Layer* 21) [Shuffle]_output + add_2 + Relu_2 Set Tactic Name: maxwell_scudnn_128x128_relu_medium_nn_v1 Tactic: 4501471010995462441
[03/19/2022-12:29:32] [V] [TRT] Tactic: 4501471010995462441 Time: 0.424488
[03/19/2022-12:29:32] [V] [TRT] MatMul + b3/read:0 + (Unnamed Layer* 21) [Shuffle] + unsqueeze_node_after_b3/read:0 + (Unnamed Layer* 21) [Shuffle]_(Unnamed Layer* 21) [Shuffle]_output + add_2 + Relu_2 Set Tactic Name: maxwell_scudnn_128x64_relu_small_nn_v1 Tactic: 5137655947464784826
[03/19/2022-12:29:32] [V] [TRT] Tactic: 5137655947464784826 Time: 0.336512
[03/19/2022-12:29:32] [V] [TRT] MatMul + b3/read:0 + (Unnamed Layer* 21) [Shuffle] + unsqueeze_node_after_b3/read:0 + (Unnamed Layer* 21) [Shuffle]_(Unnamed Layer* 21) [Shuffle]_output + add_2 + Relu_2 Set Tactic Name: maxwell_scudnn_128x128_relu_small_nn_v0 Tactic: 5288347012147084929
[03/19/2022-12:29:32] [V] [TRT] Tactic: 5288347012147084929 Time: 0.393076
[03/19/2022-12:29:32] [V] [TRT] MatMul + b3/read:0 + (Unnamed Layer* 21) [Shuffle] + unsqueeze_node_after_b3/read:0 + (Unnamed Layer* 21) [Shuffle]_(Unnamed Layer* 21) [Shuffle]_output + add_2 + Relu_2 Set Tactic Name: maxwell_scudnn_128x128_relu_interior_nn_v1 Tactic: 5326823351883942011
[03/19/2022-12:29:32] [V] [TRT] Tactic: 5326823351883942011 Time: 0.412672
[03/19/2022-12:29:32] [V] [TRT] MatMul + b3/read:0 + (Unnamed Layer* 21) [Shuffle] + unsqueeze_node_after_b3/read:0 + (Unnamed Layer* 21) [Shuffle]_(Unnamed Layer* 21) [Shuffle]_output + add_2 + Relu_2 Set Tactic Name: maxwell_scudnn_128x64_relu_interior_nn_v0 Tactic: 5500448035057547314
[03/19/2022-12:29:32] [V] [TRT] Tactic: 5500448035057547314 Time: 0.377856
[03/19/2022-12:29:32] [V] [TRT] MatMul + b3/read:0 + (Unnamed Layer* 21) [Shuffle] + unsqueeze_node_after_b3/read:0 + (Unnamed Layer* 21) [Shuffle]_(Unnamed Layer* 21) [Shuffle]_output + add_2 + Relu_2 Set Tactic Name: maxwell_scudnn_128x64_relu_medium_nn_v1 Tactic: 6645123197870846056
[03/19/2022-12:29:32] [V] [TRT] Tactic: 6645123197870846056 Time: 0.343168
[03/19/2022-12:29:32] [V] [TRT] MatMul + b3/read:0 + (Unnamed Layer* 21) [Shuffle] + unsqueeze_node_after_b3/read:0 + (Unnamed Layer* 21) [Shuffle]_(Unnamed Layer* 21) [Shuffle]_output + add_2 + Relu_2 Set Tactic Name: maxwell_scudnn_128x32_relu_small_nn_v0 Tactic: 7144526460361122478
[03/19/2022-12:29:32] [V] [TRT] Tactic: 7144526460361122478 Time: 0.384768
[03/19/2022-12:29:32] [V] [TRT] MatMul + b3/read:0 + (Unnamed Layer* 21) [Shuffle] + unsqueeze_node_after_b3/read:0 + (Unnamed Layer* 21) [Shuffle]_(Unnamed Layer* 21) [Shuffle]_output + add_2 + Relu_2 Set Tactic Name: maxwell_scudnn_128x128_relu_medium_nn_v0 Tactic: -8262349710178828730
[03/19/2022-12:29:32] [V] [TRT] Tactic: -8262349710178828730 Time: 0.388288
[03/19/2022-12:29:32] [V] [TRT] MatMul + b3/read:0 + (Unnamed Layer* 21) [Shuffle] + unsqueeze_node_after_b3/read:0 + (Unnamed Layer* 21) [Shuffle]_(Unnamed Layer* 21) [Shuffle]_output + add_2 + Relu_2 Set Tactic Name: maxwell_scudnn_128x32_relu_interior_nn_v1 Tactic: -6576203419454146580
[03/19/2022-12:29:32] [V] [TRT] Tactic: -6576203419454146580 Time: 0.345016
[03/19/2022-12:29:32] [V] [TRT] MatMul + b3/read:0 + (Unnamed Layer* 21) [Shuffle] + unsqueeze_node_after_b3/read:0 + (Unnamed Layer* 21) [Shuffle]_(Unnamed Layer* 21) [Shuffle]_output + add_2 + Relu_2 Set Tactic Name: maxwell_scudnn_128x32_relu_medium_nn_v0 Tactic: -4787320710726427159
[03/19/2022-12:29:32] [V] [TRT] Tactic: -4787320710726427159 Time: 0.370928
[03/19/2022-12:29:32] [V] [TRT] MatMul + b3/read:0 + (Unnamed Layer* 21) [Shuffle] + unsqueeze_node_after_b3/read:0 + (Unnamed Layer* 21) [Shuffle]_(Unnamed Layer* 21) [Shuffle]_output + add_2 + Relu_2 Set Tactic Name: maxwell_scudnn_128x32_relu_small_nn_v1 Tactic: -3456450830548107839
[03/19/2022-12:29:32] [V] [TRT] Tactic: -3456450830548107839 Time: 0.353392
[03/19/2022-12:29:32] [V] [TRT] MatMul + b3/read:0 + (Unnamed Layer* 21) [Shuffle] + unsqueeze_node_after_b3/read:0 + (Unnamed Layer* 21) [Shuffle]_(Unnamed Layer* 21) [Shuffle]_output + add_2 + Relu_2 Set Tactic Name: maxwell_scudnn_128x64_relu_medium_nn_v0 Tactic: -1218658103698133241
[03/19/2022-12:29:32] [V] [TRT] Tactic: -1218658103698133241 Time: 0.392048
[03/19/2022-12:29:32] [V] [TRT] MatMul + b3/read:0 + (Unnamed Layer* 21) [Shuffle] + unsqueeze_node_after_b3/read:0 + (Unnamed Layer* 21) [Shuffle]_(Unnamed Layer* 21) [Shuffle]_output + add_2 + Relu_2 Set Tactic Name: maxwell_scudnn_128x64_relu_small_nn_v0 Tactic: -836875257600482091
[03/19/2022-12:29:32] [V] [TRT] Tactic: -836875257600482091 Time: 0.380032
[03/19/2022-12:29:32] [V] [TRT] MatMul + b3/read:0 + (Unnamed Layer* 21) [Shuffle] + unsqueeze_node_after_b3/read:0 + (Unnamed Layer* 21) [Shuffle]_(Unnamed Layer* 21) [Shuffle]_output + add_2 + Relu_2 Set Tactic Name: maxwell_scudnn_128x128_relu_small_nn_v1 Tactic: -410470605513481746
[03/19/2022-12:29:32] [V] [TRT] Tactic: -410470605513481746 Time: 0.41408
[03/19/2022-12:29:33] [V] [TRT] MatMul + b3/read:0 + (Unnamed Layer* 21) [Shuffle] + unsqueeze_node_after_b3/read:0 + (Unnamed Layer* 21) [Shuffle]_(Unnamed Layer* 21) [Shuffle]_output + add_2 + Relu_2 Set Tactic Name: maxwell_scudnn_128x128_relu_interior_nn_v0 Tactic: -377491875521947884
[03/19/2022-12:29:33] [V] [TRT] Tactic: -377491875521947884 Time: 0.389616
[03/19/2022-12:29:33] [V] [TRT] MatMul + b3/read:0 + (Unnamed Layer* 21) [Shuffle] + unsqueeze_node_after_b3/read:0 + (Unnamed Layer* 21) [Shuffle]_(Unnamed Layer* 21) [Shuffle]_output + add_2 + Relu_2 Set Tactic Name: maxwell_scudnn_128x64_relu_interior_nn_v1 Tactic: -37215280111360163
[03/19/2022-12:29:33] [V] [TRT] Tactic: -37215280111360163 Time: 0.335344
[03/19/2022-12:29:33] [V] [TRT] Fastest Tactic: -37215280111360163 Time: 0.335344
[03/19/2022-12:29:33] [V] [TRT] >>>>>>>>>>>>>>> Chose Runner Type: CublasConvolution Tactic: 1
[03/19/2022-12:29:33] [V] [TRT] *************** Autotuning format combination: Float(3136,1,3136,3136) -> Float(1024,1,1024,1024) ***************
[03/19/2022-12:29:33] [V] [TRT] --------------- Timing Runner: MatMul + b3/read:0 + (Unnamed Layer* 21) [Shuffle] + unsqueeze_node_after_b3/read:0 + (Unnamed Layer* 21) [Shuffle]_(Unnamed Layer* 21) [Shuffle]_output + add_2 + Relu_2 (CudnnConvolution)
[03/19/2022-12:29:33] [V] [TRT] CudnnConvolution has no valid tactics for this config, skipping
[03/19/2022-12:29:33] [V] [TRT] --------------- Timing Runner: MatMul + b3/read:0 + (Unnamed Layer* 21) [Shuffle] + unsqueeze_node_after_b3/read:0 + (Unnamed Layer* 21) [Shuffle]_(Unnamed Layer* 21) [Shuffle]_output + add_2 + Relu_2 (CublasConvolution)
[03/19/2022-12:29:33] [V] [TRT] CublasConvolution has no valid tactics for this config, skipping
[03/19/2022-12:29:33] [V] [TRT] --------------- Timing Runner: MatMul + b3/read:0 + (Unnamed Layer* 21) [Shuffle] + unsqueeze_node_after_b3/read:0 + (Unnamed Layer* 21) [Shuffle]_(Unnamed Layer* 21) [Shuffle]_output + add_2 + Relu_2 (CaskConvolution)
[03/19/2022-12:29:33] [V] [TRT] MatMul + b3/read:0 + (Unnamed Layer* 21) [Shuffle] + unsqueeze_node_after_b3/read:0 + (Unnamed Layer* 21) [Shuffle]_(Unnamed Layer* 21) [Shuffle]_output + add_2 + Relu_2 Set Tactic Name: maxwell_scudnn_128x64_sliced1x2_ldg4_relu_exp_interior_nhwc_tn_v1 Tactic: 3886731678879822788
[03/19/2022-12:29:33] [V] [TRT] Tactic: 3886731678879822788 Time: 0.191488
[03/19/2022-12:29:33] [V] [TRT] MatMul + b3/read:0 + (Unnamed Layer* 21) [Shuffle] + unsqueeze_node_after_b3/read:0 + (Unnamed Layer* 21) [Shuffle]_(Unnamed Layer* 21) [Shuffle]_output + add_2 + Relu_2 Set Tactic Name: maxwell_scudnn_128x32_sliced1x4_ldg4_relu_exp_interior_nhwc_tn_v1 Tactic: 6629944304117643200
[03/19/2022-12:29:33] [V] [TRT] Tactic: 6629944304117643200 Time: 0.150008
[03/19/2022-12:29:33] [V] [TRT] MatMul + b3/read:0 + (Unnamed Layer* 21) [Shuffle] + unsqueeze_node_after_b3/read:0 + (Unnamed Layer* 21) [Shuffle]_(Unnamed Layer* 21) [Shuffle]_output + add_2 + Relu_2 Set Tactic Name: maxwell_scudnn_128x32_sliced1x4_ldg4_relu_exp_small_nhwc_tn_v1 Tactic: -9153228964338181824
[03/19/2022-12:29:33] [V] [TRT] Tactic: -9153228964338181824 Time: 0.151648
[03/19/2022-12:29:33] [V] [TRT] MatMul + b3/read:0 + (Unnamed Layer* 21) [Shuffle] + unsqueeze_node_after_b3/read:0 + (Unnamed Layer* 21) [Shuffle]_(Unnamed Layer* 21) [Shuffle]_output + add_2 + Relu_2 Set Tactic Name: maxwell_scudnn_128x64_sliced1x2_ldg4_relu_exp_small_nhwc_tn_v1 Tactic: -7394439838318485025
[03/19/2022-12:29:33] [V] [TRT] Tactic: -7394439838318485025 Time: 0.192996
[03/19/2022-12:29:33] [V] [TRT] Fastest Tactic: 6629944304117643200 Time: 0.150008
[03/19/2022-12:29:33] [V] [TRT] >>>>>>>>>>>>>>> Chose Runner Type: CaskConvolution Tactic: 6629944304117643200
[03/19/2022-12:29:33] [V] [TRT] =============== Computing costs for 
[03/19/2022-12:29:33] [V] [TRT] *************** Autotuning format combination: Float(1024,1,1,1) -> Float(10,1,1,1) ***************
[03/19/2022-12:29:33] [V] [TRT] --------------- Timing Runner: MatMul_1 + b4/read:0 + (Unnamed Layer* 37) [Shuffle] + unsqueeze_node_after_b4/read:0 + (Unnamed Layer* 37) [Shuffle]_(Unnamed Layer* 37) [Shuffle]_output + add_3 (CudaDepthwiseConvolution)
[03/19/2022-12:29:33] [V] [TRT] CudaDepthwiseConvolution has no valid tactics for this config, skipping
[03/19/2022-12:29:33] [V] [TRT] --------------- Timing Runner: MatMul_1 + b4/read:0 + (Unnamed Layer* 37) [Shuffle] + unsqueeze_node_after_b4/read:0 + (Unnamed Layer* 37) [Shuffle]_(Unnamed Layer* 37) [Shuffle]_output + add_3 (FusedConvActConvolution)
[03/19/2022-12:29:33] [V] [TRT] FusedConvActConvolution has no valid tactics for this config, skipping
[03/19/2022-12:29:33] [V] [TRT] --------------- Timing Runner: MatMul_1 + b4/read:0 + (Unnamed Layer* 37) [Shuffle] + unsqueeze_node_after_b4/read:0 + (Unnamed Layer* 37) [Shuffle]_(Unnamed Layer* 37) [Shuffle]_output + add_3 (CudnnConvolution)
[03/19/2022-12:29:33] [V] [TRT] Tactic: 0 Time: 0.0704
[03/19/2022-12:29:33] [V] [TRT] Tactic: 1 Time: 0.00896
[03/19/2022-12:29:33] [V] [TRT] Tactic: 2 Time: 0.334436
[03/19/2022-12:29:33] [V] [TRT] Tactic: 4 Time: 0.375504
[03/19/2022-12:29:33] [V] [TRT] Tactic: 5 Time: 0.114284
[03/19/2022-12:29:33] [V] [TRT] Fastest Tactic: 1 Time: 0.00896
[03/19/2022-12:29:33] [V] [TRT] --------------- Timing Runner: MatMul_1 + b4/read:0 + (Unnamed Layer* 37) [Shuffle] + unsqueeze_node_after_b4/read:0 + (Unnamed Layer* 37) [Shuffle]_(Unnamed Layer* 37) [Shuffle]_output + add_3 (CublasConvolution)
[03/19/2022-12:29:33] [V] [TRT] Tactic: 0 Time: 0.00918
[03/19/2022-12:29:33] [V] [TRT] Tactic: 1 Time: 0.0133
[03/19/2022-12:29:33] [V] [TRT] Fastest Tactic: 0 Time: 0.00918
[03/19/2022-12:29:33] [V] [TRT] --------------- Timing Runner: MatMul_1 + b4/read:0 + (Unnamed Layer* 37) [Shuffle] + unsqueeze_node_after_b4/read:0 + (Unnamed Layer* 37) [Shuffle]_(Unnamed Layer* 37) [Shuffle]_output + add_3 (CaskConvolution)
[03/19/2022-12:29:33] [V] [TRT] MatMul_1 + b4/read:0 + (Unnamed Layer* 37) [Shuffle] + unsqueeze_node_after_b4/read:0 + (Unnamed Layer* 37) [Shuffle]_(Unnamed Layer* 37) [Shuffle]_output + add_3 Set Tactic Name: maxwell_scudnn_128x32_relu_medium_nn_v1 Tactic: 1062367460111450758
[03/19/2022-12:29:33] [V] [TRT] Tactic: 1062367460111450758 Time: 0.103152
[03/19/2022-12:29:33] [V] [TRT] MatMul_1 + b4/read:0 + (Unnamed Layer* 37) [Shuffle] + unsqueeze_node_after_b4/read:0 + (Unnamed Layer* 37) [Shuffle]_(Unnamed Layer* 37) [Shuffle]_output + add_3 Set Tactic Name: maxwell_scudnn_128x32_relu_interior_nn_v0 Tactic: 1698681053543049347
[03/19/2022-12:29:33] [V] [TRT] Tactic: 1698681053543049347 Time: 0.070928
[03/19/2022-12:29:33] [V] [TRT] MatMul_1 + b4/read:0 + (Unnamed Layer* 37) [Shuffle] + unsqueeze_node_after_b4/read:0 + (Unnamed Layer* 37) [Shuffle]_(Unnamed Layer* 37) [Shuffle]_output + add_3 Set Tactic Name: maxwell_scudnn_128x128_relu_medium_nn_v1 Tactic: 4501471010995462441
[03/19/2022-12:29:33] [V] [TRT] Tactic: 4501471010995462441 Time: 0.109428
[03/19/2022-12:29:33] [V] [TRT] MatMul_1 + b4/read:0 + (Unnamed Layer* 37) [Shuffle] + unsqueeze_node_after_b4/read:0 + (Unnamed Layer* 37) [Shuffle]_(Unnamed Layer* 37) [Shuffle]_output + add_3 Set Tactic Name: maxwell_scudnn_128x64_relu_small_nn_v1 Tactic: 5137655947464784826
[03/19/2022-12:29:33] [V] [TRT] Tactic: 5137655947464784826 Time: 0.073048
[03/19/2022-12:29:33] [V] [TRT] MatMul_1 + b4/read:0 + (Unnamed Layer* 37) [Shuffle] + unsqueeze_node_after_b4/read:0 + (Unnamed Layer* 37) [Shuffle]_(Unnamed Layer* 37) [Shuffle]_output + add_3 Set Tactic Name: maxwell_scudnn_128x128_relu_small_nn_v0 Tactic: 5288347012147084929
[03/19/2022-12:29:33] [V] [TRT] Tactic: 5288347012147084929 Time: 0.106132
[03/19/2022-12:29:33] [V] [TRT] MatMul_1 + b4/read:0 + (Unnamed Layer* 37) [Shuffle] + unsqueeze_node_after_b4/read:0 + (Unnamed Layer* 37) [Shuffle]_(Unnamed Layer* 37) [Shuffle]_output + add_3 Set Tactic Name: maxwell_scudnn_128x128_relu_interior_nn_v1 Tactic: 5326823351883942011
[03/19/2022-12:29:33] [V] [TRT] Tactic: 5326823351883942011 Time: 0.105712
[03/19/2022-12:29:33] [V] [TRT] MatMul_1 + b4/read:0 + (Unnamed Layer* 37) [Shuffle] + unsqueeze_node_after_b4/read:0 + (Unnamed Layer* 37) [Shuffle]_(Unnamed Layer* 37) [Shuffle]_output + add_3 Set Tactic Name: maxwell_scudnn_128x64_relu_interior_nn_v0 Tactic: 5500448035057547314
[03/19/2022-12:29:33] [V] [TRT] Tactic: 5500448035057547314 Time: 0.090916
[03/19/2022-12:29:33] [V] [TRT] MatMul_1 + b4/read:0 + (Unnamed Layer* 37) [Shuffle] + unsqueeze_node_after_b4/read:0 + (Unnamed Layer* 37) [Shuffle]_(Unnamed Layer* 37) [Shuffle]_output + add_3 Set Tactic Name: maxwell_scudnn_128x64_relu_medium_nn_v1 Tactic: 6645123197870846056
[03/19/2022-12:29:33] [V] [TRT] Tactic: 6645123197870846056 Time: 0.078996
[03/19/2022-12:29:33] [V] [TRT] MatMul_1 + b4/read:0 + (Unnamed Layer* 37) [Shuffle] + unsqueeze_node_after_b4/read:0 + (Unnamed Layer* 37) [Shuffle]_(Unnamed Layer* 37) [Shuffle]_output + add_3 Set Tactic Name: maxwell_scudnn_128x32_relu_small_nn_v0 Tactic: 7144526460361122478
[03/19/2022-12:29:33] [V] [TRT] Tactic: 7144526460361122478 Time: 0.074496
[03/19/2022-12:29:33] [V] [TRT] MatMul_1 + b4/read:0 + (Unnamed Layer* 37) [Shuffle] + unsqueeze_node_after_b4/read:0 + (Unnamed Layer* 37) [Shuffle]_(Unnamed Layer* 37) [Shuffle]_output + add_3 Set Tactic Name: maxwell_scudnn_128x128_relu_medium_nn_v0 Tactic: -8262349710178828730
[03/19/2022-12:29:33] [V] [TRT] Tactic: -8262349710178828730 Time: 0.108028
[03/19/2022-12:29:33] [V] [TRT] MatMul_1 + b4/read:0 + (Unnamed Layer* 37) [Shuffle] + unsqueeze_node_after_b4/read:0 + (Unnamed Layer* 37) [Shuffle]_(Unnamed Layer* 37) [Shuffle]_output + add_3 Set Tactic Name: maxwell_scudnn_128x32_relu_interior_nn_v1 Tactic: -6576203419454146580
[03/19/2022-12:29:33] [V] [TRT] Tactic: -6576203419454146580 Time: 0.077908
[03/19/2022-12:29:33] [V] [TRT] MatMul_1 + b4/read:0 + (Unnamed Layer* 37) [Shuffle] + unsqueeze_node_after_b4/read:0 + (Unnamed Layer* 37) [Shuffle]_(Unnamed Layer* 37) [Shuffle]_output + add_3 Set Tactic Name: maxwell_scudnn_128x32_relu_medium_nn_v0 Tactic: -4787320710726427159
[03/19/2022-12:29:33] [V] [TRT] Tactic: -4787320710726427159 Time: 0.080256
[03/19/2022-12:29:33] [V] [TRT] MatMul_1 + b4/read:0 + (Unnamed Layer* 37) [Shuffle] + unsqueeze_node_after_b4/read:0 + (Unnamed Layer* 37) [Shuffle]_(Unnamed Layer* 37) [Shuffle]_output + add_3 Set Tactic Name: maxwell_scudnn_128x32_relu_small_nn_v1 Tactic: -3456450830548107839
[03/19/2022-12:29:33] [V] [TRT] Tactic: -3456450830548107839 Time: 0.082816
[03/19/2022-12:29:33] [V] [TRT] MatMul_1 + b4/read:0 + (Unnamed Layer* 37) [Shuffle] + unsqueeze_node_after_b4/read:0 + (Unnamed Layer* 37) [Shuffle]_(Unnamed Layer* 37) [Shuffle]_output + add_3 Set Tactic Name: maxwell_scudnn_128x64_relu_medium_nn_v0 Tactic: -1218658103698133241
[03/19/2022-12:29:33] [V] [TRT] Tactic: -1218658103698133241 Time: 0.098032
[03/19/2022-12:29:33] [V] [TRT] MatMul_1 + b4/read:0 + (Unnamed Layer* 37) [Shuffle] + unsqueeze_node_after_b4/read:0 + (Unnamed Layer* 37) [Shuffle]_(Unnamed Layer* 37) [Shuffle]_output + add_3 Set Tactic Name: maxwell_scudnn_128x64_relu_small_nn_v0 Tactic: -836875257600482091
[03/19/2022-12:29:33] [V] [TRT] Tactic: -836875257600482091 Time: 0.09216
[03/19/2022-12:29:33] [V] [TRT] MatMul_1 + b4/read:0 + (Unnamed Layer* 37) [Shuffle] + unsqueeze_node_after_b4/read:0 + (Unnamed Layer* 37) [Shuffle]_(Unnamed Layer* 37) [Shuffle]_output + add_3 Set Tactic Name: maxwell_scudnn_128x128_relu_small_nn_v1 Tactic: -410470605513481746
[03/19/2022-12:29:33] [V] [TRT] Tactic: -410470605513481746 Time: 0.104908
[03/19/2022-12:29:33] [V] [TRT] MatMul_1 + b4/read:0 + (Unnamed Layer* 37) [Shuffle] + unsqueeze_node_after_b4/read:0 + (Unnamed Layer* 37) [Shuffle]_(Unnamed Layer* 37) [Shuffle]_output + add_3 Set Tactic Name: maxwell_scudnn_128x128_relu_interior_nn_v0 Tactic: -377491875521947884
[03/19/2022-12:29:33] [V] [TRT] Tactic: -377491875521947884 Time: 0.104536
[03/19/2022-12:29:33] [V] [TRT] MatMul_1 + b4/read:0 + (Unnamed Layer* 37) [Shuffle] + unsqueeze_node_after_b4/read:0 + (Unnamed Layer* 37) [Shuffle]_(Unnamed Layer* 37) [Shuffle]_output + add_3 Set Tactic Name: maxwell_scudnn_128x64_relu_interior_nn_v1 Tactic: -37215280111360163
[03/19/2022-12:29:33] [V] [TRT] Tactic: -37215280111360163 Time: 0.070888
[03/19/2022-12:29:33] [V] [TRT] Fastest Tactic: -37215280111360163 Time: 0.070888
[03/19/2022-12:29:33] [V] [TRT] >>>>>>>>>>>>>>> Chose Runner Type: CudnnConvolution Tactic: 1
[03/19/2022-12:29:33] [V] [TRT] *************** Autotuning format combination: Float(1024,1,1024,1024) -> Float(10,1,10,10) ***************
[03/19/2022-12:29:33] [V] [TRT] --------------- Timing Runner: MatMul_1 + b4/read:0 + (Unnamed Layer* 37) [Shuffle] + unsqueeze_node_after_b4/read:0 + (Unnamed Layer* 37) [Shuffle]_(Unnamed Layer* 37) [Shuffle]_output + add_3 (CudnnConvolution)
[03/19/2022-12:29:33] [V] [TRT] CudnnConvolution has no valid tactics for this config, skipping
[03/19/2022-12:29:33] [V] [TRT] --------------- Timing Runner: MatMul_1 + b4/read:0 + (Unnamed Layer* 37) [Shuffle] + unsqueeze_node_after_b4/read:0 + (Unnamed Layer* 37) [Shuffle]_(Unnamed Layer* 37) [Shuffle]_output + add_3 (CublasConvolution)
[03/19/2022-12:29:33] [V] [TRT] CublasConvolution has no valid tactics for this config, skipping
[03/19/2022-12:29:33] [V] [TRT] --------------- Timing Runner: MatMul_1 + b4/read:0 + (Unnamed Layer* 37) [Shuffle] + unsqueeze_node_after_b4/read:0 + (Unnamed Layer* 37) [Shuffle]_(Unnamed Layer* 37) [Shuffle]_output + add_3 (CaskConvolution)
[03/19/2022-12:29:33] [V] [TRT] CaskConvolution has no valid tactics for this config, skipping
[03/19/2022-12:29:33] [V] [TRT] =============== Computing costs for 
[03/19/2022-12:29:33] [V] [TRT] *************** Autotuning format combination: Float(10,1,1,1) -> Float(10,1) ***************
[03/19/2022-12:29:33] [V] [TRT] --------------- Timing Runner: copied_squeeze_after_add_3 (Shuffle)
[03/19/2022-12:29:33] [V] [TRT] Tactic: 0 Time: 0.002524
[03/19/2022-12:29:33] [V] [TRT] Fastest Tactic: 0 Time: 0.002524
[03/19/2022-12:29:33] [V] [TRT] >>>>>>>>>>>>>>> Chose Runner Type: Shuffle Tactic: 0
[03/19/2022-12:29:33] [V] [TRT] =============== Computing costs for 
[03/19/2022-12:29:33] [V] [TRT] *************** Autotuning format combination: Float(10,1) -> Float(1,1), Int32(1,1) ***************
[03/19/2022-12:29:33] [V] [TRT] --------------- Timing Runner: y + z (LogSoftmaxTopK)
[03/19/2022-12:29:33] [V] [TRT] Tactic: 1001 Time: 0.003268
[03/19/2022-12:29:33] [V] [TRT] Tactic: 1002 Time: 0.0165
[03/19/2022-12:29:33] [V] [TRT] Fastest Tactic: 1001 Time: 0.003268
[03/19/2022-12:29:33] [V] [TRT] >>>>>>>>>>>>>>> Chose Runner Type: LogSoftmaxTopK Tactic: 1001
[03/19/2022-12:29:33] [V] [TRT] =============== Computing costs for 
[03/19/2022-12:29:33] [V] [TRT] *************** Autotuning format combination: Int32(1,1) -> Int32(1) ***************
[03/19/2022-12:29:33] [V] [TRT] --------------- Timing Runner: (Unnamed Layer* 52) [Shuffle] (Shuffle)
[03/19/2022-12:29:33] [V] [TRT] Tactic: 0 Time: 0.002048
[03/19/2022-12:29:33] [V] [TRT] Fastest Tactic: 0 Time: 0.002048
[03/19/2022-12:29:33] [V] [TRT] >>>>>>>>>>>>>>> Chose Runner Type: Shuffle Tactic: 0
[03/19/2022-12:29:33] [V] [TRT] Adding reformat layer: Reformatted Input Tensor 0 to Conv__27 + Relu_1 (MaxPool2d:0) from Float(6272,196,14,1) to Float(6272,1,448,32)
[03/19/2022-12:29:33] [V] [TRT] Adding reformat layer: Reformatted Input Tensor 0 to MaxPool2d_1 (Relu_1:0) from Float(12544,1,896,64) to Float(12544,196,14,1)
[03/19/2022-12:29:33] [V] [TRT] Formats and tactics selection completed in 3.90351 seconds.
[03/19/2022-12:29:33] [V] [TRT] After reformat layers: 12 layers
[03/19/2022-12:29:33] [V] [TRT] Pre-optimized block assignment.
[03/19/2022-12:29:33] [V] [TRT] Block size 1605632
[03/19/2022-12:29:33] [V] [TRT] Block size 401408
[03/19/2022-12:29:33] [V] [TRT] Block size 802816
[03/19/2022-12:29:33] [V] [TRT] Block size 200704
[03/19/2022-12:29:33] [V] [TRT] Block size 200704
[03/19/2022-12:29:33] [V] [TRT] Block size 1
[03/19/2022-12:29:33] [V] [TRT] Block size 512
[03/19/2022-12:29:33] [V] [TRT] Block size 1
[03/19/2022-12:29:33] [V] [TRT] Block size 1024
[03/19/2022-12:29:33] [V] [TRT] Block size 65536
[03/19/2022-12:29:33] [V] [TRT] Block size 401408
[03/19/2022-12:29:33] [V] [TRT] Block size 802816
[03/19/2022-12:29:33] [V] [TRT] Block size 1073741824
[03/19/2022-12:29:33] [V] [TRT] Total Activation Memory: 1078224386
[03/19/2022-12:29:33] [I] [TRT] Detected 1 inputs and 1 output network tensors.
[03/19/2022-12:29:33] [V] [TRT] Conv__25 + Relu Set Tactic Name: maxwell_scudnn_128x32_relu_small_nn_v0 Tactic: 7144526460361122478
[03/19/2022-12:29:33] [V] [TRT] Conv__27 + Relu_1 Set Tactic Name: maxwell_scudnn_128x32_sliced1x4_ldg4_relu_exp_small_nhwc_tn_v1 Tactic: -9153228964338181824
[03/19/2022-12:29:33] [V] [TRT] Layer: Conv__25 + Relu Host Persistent: 1664 Device Persistent: 8192 Scratch Memory: 0
[03/19/2022-12:29:33] [V] [TRT] Layer: MaxPool2d Host Persistent: 0 Device Persistent: 0 Scratch Memory: 0
[03/19/2022-12:29:33] [V] [TRT] Layer: Reformatting CopyNode for Input Tensor 0 to Conv__27 + Relu_1 Host Persistent: 0 Device Persistent: 0 Scratch Memory: 0
[03/19/2022-12:29:33] [V] [TRT] Layer: Conv__27 + Relu_1 Host Persistent: 1664 Device Persistent: 206336 Scratch Memory: 0
[03/19/2022-12:29:33] [V] [TRT] Layer: Reformatting CopyNode for Input Tensor 0 to MaxPool2d_1 Host Persistent: 0 Device Persistent: 0 Scratch Memory: 0
[03/19/2022-12:29:33] [V] [TRT] Layer: MaxPool2d_1 Host Persistent: 0 Device Persistent: 0 Scratch Memory: 0
[03/19/2022-12:29:33] [V] [TRT] Layer: MaxPool2d_1__22 + Reshape + (Unnamed Layer* 14) [Shuffle] Host Persistent: 0 Device Persistent: 0 Scratch Memory: 0
[03/19/2022-12:29:33] [V] [TRT] Layer: MatMul + b3/read:0 + (Unnamed Layer* 21) [Shuffle] + unsqueeze_node_after_b3/read:0 + (Unnamed Layer* 21) [Shuffle]_(Unnamed Layer* 21) [Shuffle]_output + add_2 + Relu_2 Host Persistent: 340 Device Persistent: 0 Scratch Memory: 0
[03/19/2022-12:29:33] [V] [TRT] Layer: MatMul_1 + b4/read:0 + (Unnamed Layer* 37) [Shuffle] + unsqueeze_node_after_b4/read:0 + (Unnamed Layer* 37) [Shuffle]_(Unnamed Layer* 37) [Shuffle]_output + add_3 Host Persistent: 32 Device Persistent: 0 Scratch Memory: 4096
[03/19/2022-12:29:33] [V] [TRT] Layer: copied_squeeze_after_add_3 Host Persistent: 0 Device Persistent: 0 Scratch Memory: 0
[03/19/2022-12:29:33] [V] [TRT] Layer: y + z Host Persistent: 0 Device Persistent: 0 Scratch Memory: 0
[03/19/2022-12:29:33] [V] [TRT] Layer: (Unnamed Layer* 52) [Shuffle] Host Persistent: 0 Device Persistent: 0 Scratch Memory: 0
[03/19/2022-12:29:33] [I] [TRT] Total Host Persistent Memory: 3712
[03/19/2022-12:29:33] [I] [TRT] Total Device Persistent Memory: 214528
[03/19/2022-12:29:33] [I] [TRT] Total Scratch Memory: 4096
[03/19/2022-12:29:33] [I] [TRT] [MemUsageStats] Peak memory usage of TRT CPU/GPU memory allocators: CPU 12 MiB, GPU 438 MiB
[03/19/2022-12:29:33] [I] [TRT] [BlockAssignment] Algorithm ShiftNTopDown took 0.05705ms to assign 4 blocks to 13 nodes requiring 2409473 bytes.
[03/19/2022-12:29:33] [V] [TRT] Optimized block assignment.
[03/19/2022-12:29:33] [V] [TRT] Block size 1605632
[03/19/2022-12:29:33] [V] [TRT] Block size 802816
[03/19/2022-12:29:33] [V] [TRT] Block size 1024
[03/19/2022-12:29:33] [V] [TRT] Block size 1
[03/19/2022-12:29:33] [I] [TRT] Total Activation Memory: 2409473
[03/19/2022-12:29:33] [V] [TRT] Using cublas as a tactic source
[03/19/2022-12:29:33] [I] [TRT] [MemUsageChange] Init cuBLAS/cuBLASLt: CPU +0, GPU +8, now: CPU 974, GPU 933 (MiB)
[03/19/2022-12:29:33] [V] [TRT] Using cuDNN as a tactic source
[03/19/2022-12:29:33] [I] [TRT] [MemUsageChange] Init cuDNN: CPU +0, GPU +10, now: CPU 974, GPU 943 (MiB)
[03/19/2022-12:29:33] [V] [TRT] Engine generation completed in 4.31827 seconds.
[03/19/2022-12:29:33] [V] [TRT] Deleting timing cache: 31 entries, 0 hits
[03/19/2022-12:29:33] [V] [TRT] Engine Layer Information:
Layer(CaskConvolution): Conv__25 + Relu, Tactic: 7144526460361122478, x:0[Float(-2,1,28,28)] -> Relu:0[Float(-2,32,28,28)]
Layer(TiledPooling): MaxPool2d, Tactic: 6488321, Relu:0[Float(-2,32,28,28)] -> MaxPool2d:0[Float(-2,32,14,14)]
Layer(Reformat): Reformatting CopyNode for Input Tensor 0 to Conv__27 + Relu_1, Tactic: 0, MaxPool2d:0[Float(-2,32,14,14)] -> Reformatted Input Tensor 0 to Conv__27 + Relu_1[Float(-2,32,14,14)]
Layer(CaskConvolution): Conv__27 + Relu_1, Tactic: -9153228964338181824, Reformatted Input Tensor 0 to Conv__27 + Relu_1[Float(-2,32,14,14)] -> Relu_1:0[Float(-2,64,14,14)]
Layer(Reformat): Reformatting CopyNode for Input Tensor 0 to MaxPool2d_1, Tactic: 0, Relu_1:0[Float(-2,64,14,14)] -> Reformatted Input Tensor 0 to MaxPool2d_1[Float(-2,64,14,14)]
Layer(TiledPooling): MaxPool2d_1, Tactic: 6488321, Reformatted Input Tensor 0 to MaxPool2d_1[Float(-2,64,14,14)] -> MaxPool2d_1:0[Float(-2,64,7,7)]
Layer(Shuffle): MaxPool2d_1__22 + Reshape + (Unnamed Layer* 14) [Shuffle], Tactic: 0, MaxPool2d_1:0[Float(-2,64,7,7)] -> (Unnamed Layer* 14) [Shuffle]_output[Float(-2,3136,1,1)]
Layer(CublasConvolution): MatMul + b3/read:0 + (Unnamed Layer* 21) [Shuffle] + unsqueeze_node_after_b3/read:0 + (Unnamed Layer* 21) [Shuffle]_(Unnamed Layer* 21) [Shuffle]_output + add_2 + Relu_2, Tactic: 1, (Unnamed Layer* 14) [Shuffle]_output[Float(-2,3136,1,1)] -> Relu_2_out_tensor[Float(-2,1024,1,1)]
Layer(CudnnConvolution): MatMul_1 + b4/read:0 + (Unnamed Layer* 37) [Shuffle] + unsqueeze_node_after_b4/read:0 + (Unnamed Layer* 37) [Shuffle]_(Unnamed Layer* 37) [Shuffle]_output + add_3, Tactic: 1, Relu_2_out_tensor[Float(-2,1024,1,1)] -> add_3_out_tensor[Float(-2,10,1,1)]
Layer(NoOp): copied_squeeze_after_add_3, Tactic: 0, add_3_out_tensor[Float(-2,10,1,1)] -> add_3:0[Float(-2,10)]
Layer(LogSoftmaxTopK): y + z, Tactic: 1001, add_3:0[Float(-2,10)] -> (Unnamed Layer* 48) [TopK]_output_1[Float(-2,1)], (Unnamed Layer* 48) [TopK]_output_2[Int32(-2,1)]
Layer(NoOp): (Unnamed Layer* 52) [Shuffle], Tactic: 0, (Unnamed Layer* 48) [TopK]_output_2[Int32(-2,1)] -> z:0[Int32(-2)]
[03/19/2022-12:29:33] [I] [TRT] [MemUsageChange] TensorRT-managed allocation in building engine: CPU +0, GPU +13, now: CPU 0, GPU 13 (MiB)
[03/19/2022-12:29:33] [I] [TRT] [MemUsageChange] Init CUDA: CPU +0, GPU +0, now: CPU 986, GPU 895 (MiB)
[03/19/2022-12:29:33] [I] [TRT] Loaded engine size: 12 MiB
[03/19/2022-12:29:33] [V] [TRT] Using cublas as a tactic source
[03/19/2022-12:29:33] [I] [TRT] [MemUsageChange] Init cuBLAS/cuBLASLt: CPU +1, GPU +10, now: CPU 987, GPU 919 (MiB)
[03/19/2022-12:29:33] [V] [TRT] Using cuDNN as a tactic source
[03/19/2022-12:29:33] [I] [TRT] [MemUsageChange] Init cuDNN: CPU +0, GPU +8, now: CPU 987, GPU 927 (MiB)
[03/19/2022-12:29:33] [V] [TRT] Deserialization required 3834 microseconds.
[03/19/2022-12:29:33] [I] [TRT] [MemUsageChange] TensorRT-managed allocation in engine deserialization: CPU +0, GPU +12, now: CPU 0, GPU 12 (MiB)
[03/19/2022-12:29:33] [I] Engine built in 4.89571 sec.
[03/19/2022-12:29:33] [V] [TRT] Using cublas as a tactic source
[03/19/2022-12:29:33] [I] [TRT] [MemUsageChange] Init cuBLAS/cuBLASLt: CPU +0, GPU +10, now: CPU 887, GPU 919 (MiB)
[03/19/2022-12:29:33] [V] [TRT] Using cuDNN as a tactic source
[03/19/2022-12:29:33] [I] [TRT] [MemUsageChange] Init cuDNN: CPU +0, GPU +8, now: CPU 887, GPU 927 (MiB)
[03/19/2022-12:29:33] [V] [TRT] Total per-runner device persistent memory is 214528
[03/19/2022-12:29:33] [V] [TRT] Total per-runner host persistent memory is 3712
[03/19/2022-12:29:33] [V] [TRT] Allocated activation device memory of size 2409984
[03/19/2022-12:29:33] [I] [TRT] [MemUsageChange] TensorRT-managed allocation in IExecutionContext creation: CPU +0, GPU +3, now: CPU 0, GPU 15 (MiB)
[03/19/2022-12:29:33] [I] Using random values for input x:0
[03/19/2022-12:29:33] [I] Created input binding for x:0 with dimensions 4x1x28x28
[03/19/2022-12:29:33] [I] Using random values for output z:0
[03/19/2022-12:29:33] [I] Created output binding for z:0 with dimensions 4
[03/19/2022-12:29:33] [I] Starting inference
[03/19/2022-12:29:36] [I] Warmup completed 1230 queries over 200 ms
[03/19/2022-12:29:36] [I] Timing trace has 19599 queries over 3.0005 s
[03/19/2022-12:29:36] [I] 
[03/19/2022-12:29:36] [I] === Trace details ===
[03/19/2022-12:29:36] [I] Trace averages of 10 runs:
[03/19/2022-12:29:36] [I] Average on 10 runs - GPU latency: 0.150734 ms - Host latency: 0.156972 ms (end to end 0.285962 ms, enqueue 0.0556671 ms)
[03/19/2022-12:29:36] [I] Average on 10 runs - GPU latency: 0.151141 ms - Host latency: 0.157346 ms (end to end 0.285083 ms, enqueue 0.0544769 ms)
[03/19/2022-12:29:36] [I] Average on 10 runs - GPU latency: 0.150937 ms - Host latency: 0.15712 ms (end to end 0.282915 ms, enqueue 0.0556046 ms)
[03/19/2022-12:29:36] [I] Average on 10 runs - GPU latency: 0.151039 ms - Host latency: 0.157249 ms (end to end 0.287865 ms, enqueue 0.0483521 ms)
[03/19/2022-12:29:36] [I] Average on 10 runs - GPU latency: 0.150734 ms - Host latency: 0.156985 ms (end to end 0.287358 ms, enqueue 0.049295 ms)
[03/19/2022-12:29:36] [I] Average on 10 runs - GPU latency: 0.151451 ms - Host latency: 0.15909 ms (end to end 0.284186 ms, enqueue 0.0557251 ms)
[03/19/2022-12:29:36] [I] Average on 10 runs - GPU latency: 0.151143 ms - Host latency: 0.157465 ms (end to end 0.286697 ms, enqueue 0.0554077 ms)
[03/19/2022-12:29:36] [I] Average on 10 runs - GPU latency: 0.151143 ms - Host latency: 0.157262 ms (end to end 0.28683 ms, enqueue 0.0545578 ms)
[03/19/2022-12:29:36] [I] Average on 10 runs - GPU latency: 0.151067 ms - Host latency: 0.157463 ms (end to end 0.28679 ms, enqueue 0.0540222 ms)
[03/19/2022-12:29:36] [I] Average on 10 runs - GPU latency: 0.151247 ms - Host latency: 0.157538 ms (end to end 0.286746 ms, enqueue 0.0542038 ms)
[03/19/2022-12:29:36] [I] Average on 10 runs - GPU latency: 0.151143 ms - Host latency: 0.158456 ms (end to end 0.266216 ms, enqueue 0.0620499 ms)
[03/19/2022-12:29:36] [I] Average on 10 runs - GPU latency: 0.151039 ms - Host latency: 0.16096 ms (end to end 0.274873 ms, enqueue 0.0612167 ms)
[03/19/2022-12:29:36] [I] Average on 10 runs - GPU latency: 0.150938 ms - Host latency: 0.156961 ms (end to end 0.287128 ms, enqueue 0.0492462 ms)
[03/19/2022-12:29:36] [I] Average on 10 runs - GPU latency: 0.151141 ms - Host latency: 0.157533 ms (end to end 0.287144 ms, enqueue 0.0489105 ms)
[03/19/2022-12:29:36] [I] Average on 10 runs - GPU latency: 0.150732 ms - Host latency: 0.156638 ms (end to end 0.286627 ms, enqueue 0.0495193 ms)
[03/19/2022-12:29:36] [I] Average on 10 runs - GPU latency: 0.150836 ms - Host latency: 0.156796 ms (end to end 0.284631 ms, enqueue 0.0485077 ms)
[03/19/2022-12:29:36] [I] Average on 10 runs - GPU latency: 0.15145 ms - Host latency: 0.157736 ms (end to end 0.282649 ms, enqueue 0.0509262 ms)
[03/19/2022-12:29:36] [I] Average on 10 runs - GPU latency: 0.151141 ms - Host latency: 0.157555 ms (end to end 0.286801 ms, enqueue 0.0491562 ms)
[03/19/2022-12:29:36] [I] Average on 10 runs - GPU latency: 0.151038 ms - Host latency: 0.15731 ms (end to end 0.288174 ms, enqueue 0.0486481 ms)
[03/19/2022-12:29:36] [I] Average on 10 runs - GPU latency: 0.150954 ms - Host latency: 0.156894 ms (end to end 0.287672 ms, enqueue 0.0492661 ms)
[03/19/2022-12:29:36] [I] Average on 10 runs - GPU latency: 0.151041 ms - Host latency: 0.157068 ms (end to end 0.286115 ms, enqueue 0.0486649 ms)
[03/19/2022-12:29:36] [I] Average on 10 runs - GPU latency: 0.151041 ms - Host latency: 0.157091 ms (end to end 0.287105 ms, enqueue 0.0487396 ms)
[03/19/2022-12:29:36] [I] Average on 10 runs - GPU latency: 0.150835 ms - Host latency: 0.157141 ms (end to end 0.281601 ms, enqueue 0.0525619 ms)
[03/19/2022-12:29:36] [I] Average on 10 runs - GPU latency: 0.150937 ms - Host latency: 0.157541 ms (end to end 0.282532 ms, enqueue 0.0514755 ms)
[03/19/2022-12:29:36] [I] Average on 10 runs - GPU latency: 0.151039 ms - Host latency: 0.157323 ms (end to end 0.287671 ms, enqueue 0.0488647 ms)
[03/19/2022-12:29:36] [I] Average on 10 runs - GPU latency: 0.151042 ms - Host latency: 0.157207 ms (end to end 0.287256 ms, enqueue 0.0496475 ms)
[03/19/2022-12:29:36] [I] Average on 10 runs - GPU latency: 0.150835 ms - Host latency: 0.157199 ms (end to end 0.287152 ms, enqueue 0.0488892 ms)
[03/19/2022-12:29:36] [I] Average on 10 runs - GPU latency: 0.151862 ms - Host latency: 0.157869 ms (end to end 0.28643 ms, enqueue 0.0490921 ms)
[03/19/2022-12:29:36] [I] Average on 10 runs - GPU latency: 0.151244 ms - Host latency: 0.157417 ms (end to end 0.286592 ms, enqueue 0.0507507 ms)
