cookbook/08-Tool/trtexec/result-FP32.txt
[06/15/2022-05:43:21] [V] [TRT] *************** Autotuning Reformat: Float(784,784,28,1) -> Float(784,1,28,1) ***************
[06/15/2022-05:43:21] [V] [TRT] --------------- Timing Runner: Optimizer Reformat(tensor-0 -> <out>) (Reformat)
[06/15/2022-05:43:21] [V] [TRT] Tactic: 0x00000000000003e8 Time: 0.00252351
[06/15/2022-05:43:21] [V] [TRT] Tactic: 0x00000000000003ea Time: 0.00534739
[06/15/2022-05:43:21] [V] [TRT] Tactic: 0x0000000000000000 Time: 0.00277407
[06/15/2022-05:43:21] [V] [TRT] Fastest Tactic: 0x00000000000003e8 Time: 0.00252351
[06/15/2022-05:43:21] [V] [TRT] =============== Computing reformatting costs
[06/15/2022-05:43:21] [V] [TRT] *************** Autotuning Reformat: Float(25088,1,896,32) -> Float(25088,784,28,1) ***************
[06/15/2022-05:43:21] [V] [TRT] --------------- Timing Runner: Optimizer Reformat(tensor-2 -> <out>) (Reformat)
[06/15/2022-05:43:21] [V] [TRT] Tactic: 0x00000000000003e8 Time: 0.00773101
[06/15/2022-05:43:21] [V] [TRT] Tactic: 0x00000000000003ea Time: 0.0175873
[06/15/2022-05:43:21] [V] [TRT] Tactic: 0x0000000000000000 Time: 0.00766508
[06/15/2022-05:43:21] [V] [TRT] Fastest Tactic: 0x0000000000000000 Time: 0.00766508
[06/15/2022-05:43:21] [V] [TRT] =============== Computing reformatting costs
[06/15/2022-05:43:21] [V] [TRT] *************** Autotuning Reformat: Float(6272,196,14,1) -> Float(6272,1,448,32) ***************
[06/15/2022-05:43:21] [V] [TRT] --------------- Timing Runner: Optimizer Reformat(<in> -> tensor-3) (Reformat)
[06/15/2022-05:43:21] [V] [TRT] Tactic: 0x00000000000003e8 Time: 0.00407314
[06/15/2022-05:43:21] [V] [TRT] Tactic: 0x00000000000003ea Time: 0.0171266
[06/15/2022-05:43:21] [V] [TRT] Tactic: 0x0000000000000000 Time: 0.00408242
[06/15/2022-05:43:21] [V] [TRT] Fastest Tactic: 0x00000000000003e8 Time: 0.00407314
[06/15/2022-05:43:21] [V] [TRT] =============== Computing reformatting costs
[06/15/2022-05:43:21] [V] [TRT] *************** Autotuning Reformat: Float(6272,196,14,1) -> Float(6272,1,448,32) ***************
[06/15/2022-05:43:21] [V] [TRT] --------------- Timing Runner: Optimizer Reformat(tensor-3 -> <out>) (Reformat)
[06/15/2022-05:43:21] [V] [TRT] Tactic: 0x00000000000003e8 Time: 0.00405701
[06/15/2022-05:43:21] [V] [TRT] Tactic: 0x00000000000003ea Time: 0.0170829
[06/15/2022-05:43:21] [V] [TRT] Tactic: 0x0000000000000000 Time: 0.0040659
[06/15/2022-05:43:21] [V] [TRT] Fastest Tactic: 0x00000000000003e8 Time: 0.00405701
[06/15/2022-05:43:21] [V] [TRT] *************** Autotuning Reformat: Float(6272,1,448,32) -> Float(6272,196,14,1) ***************
[06/15/2022-05:43:21] [V] [TRT] --------------- Timing Runner: Optimizer Reformat(tensor-3 -> <out>) (Reformat)
[06/15/2022-05:43:21] [V] [TRT] Tactic: 0x00000000000003e8 Time: 0.00399035
[06/15/2022-05:43:21] [V] [TRT] Tactic: 0x00000000000003ea Time: 0.0172003
[06/15/2022-05:43:21] [V] [TRT] Tactic: 0x0000000000000000 Time: 0.00400508
[06/15/2022-05:43:21] [V] [TRT] Fastest Tactic: 0x00000000000003e8 Time: 0.00399035
[06/15/2022-05:43:21] [V] [TRT] =============== Computing reformatting costs
[06/15/2022-05:43:21] [V] [TRT] *************** Autotuning Reformat: Float(12544,1,896,64) -> Float(12544,196,14,1) ***************
[06/15/2022-05:43:21] [V] [TRT] --------------- Timing Runner: Optimizer Reformat(tensor-5 -> <out>) (Reformat)
[06/15/2022-05:43:21] [V] [TRT] Tactic: 0x00000000000003e8 Time: 0.0052222
[06/15/2022-05:43:21] [V] [TRT] Tactic: 0x00000000000003ea Time: 0.0167416
[06/15/2022-05:43:21] [V] [TRT] Tactic: 0x0000000000000000 Time: 0.00522498
[06/15/2022-05:43:21] [V] [TRT] Fastest Tactic: 0x00000000000003e8 Time: 0.0052222
[06/15/2022-05:43:21] [V] [TRT] =============== Computing reformatting costs
[06/15/2022-05:43:21] [V] [TRT] *************** Autotuning Reformat: Float(3136,49,7,1) -> Float(3136,1,448,64) ***************
[06/15/2022-05:43:21] [V] [TRT] --------------- Timing Runner: Optimizer Reformat(<in> -> tensor-6) (Reformat)
[06/15/2022-05:43:21] [V] [TRT] Tactic: 0x00000000000003e8 Time: 0.00321056
[06/15/2022-05:43:21] [V] [TRT] Tactic: 0x00000000000003ea Time: 0.0162702
[06/15/2022-05:43:21] [V] [TRT] Tactic: 0x0000000000000000 Time: 0.00321199
[06/15/2022-05:43:21] [V] [TRT] Fastest Tactic: 0x00000000000003e8 Time: 0.00321056
[06/15/2022-05:43:21] [V] [TRT] *************** Autotuning Reformat: Float(3136,49,7,1) -> Float(98,49:32,7,1) ***************
[06/15/2022-05:43:21] [V] [TRT] --------------- Timing Runner: Optimizer Reformat(<in> -> tensor-6) (Reformat)
[06/15/2022-05:43:21] [V] [TRT] Tactic: 0x00000000000003e8 Time: 0.00370391
[06/15/2022-05:43:21] [V] [TRT] Tactic: 0x00000000000003ea Time: 0.0162377
[06/15/2022-05:43:21] [V] [TRT] Tactic: 0x0000000000000000 Time: 0.00370872
[06/15/2022-05:43:21] [V] [TRT] Fastest Tactic: 0x00000000000003e8 Time: 0.00370391
[06/15/2022-05:43:21] [V] [TRT] =============== Computing reformatting costs
[06/15/2022-05:43:21] [V] [TRT] *************** Autotuning Reformat: Float(3136,49,7,1) -> Float(3136,1,448,64) ***************
[06/15/2022-05:43:21] [V] [TRT] --------------- Timing Runner: Optimizer Reformat(tensor-6 -> <out>) (Reformat)
[06/15/2022-05:43:21] [V] [TRT] Tactic: 0x00000000000003e8 Time: 0.00319908
[06/15/2022-05:43:21] [V] [TRT] Tactic: 0x00000000000003ea Time: 0.016285
[06/15/2022-05:43:21] [V] [TRT] Tactic: 0x0000000000000000 Time: 0.00320538
[06/15/2022-05:43:21] [V] [TRT] Fastest Tactic: 0x00000000000003e8 Time: 0.00319908
[06/15/2022-05:43:21] [V] [TRT] *************** Autotuning Reformat: Float(3136,49,7,1) -> Float(98,49:32,7,1) ***************
[06/15/2022-05:43:21] [V] [TRT] --------------- Timing Runner: Optimizer Reformat(tensor-6 -> <out>) (Reformat)
[06/15/2022-05:43:21] [V] [TRT] Tactic: 0x00000000000003e8 Time: 0.00370051
[06/15/2022-05:43:21] [V] [TRT] Tactic: 0x00000000000003ea Time: 0.0162697
[06/15/2022-05:43:21] [V] [TRT] Tactic: 0x0000000000000000 Time: 0.00371446
[06/15/2022-05:43:21] [V] [TRT] Fastest Tactic: 0x00000000000003e8 Time: 0.00370051
[06/15/2022-05:43:21] [V] [TRT] *************** Autotuning Reformat: Float(3136,1,448,64) -> Float(3136,49,7,1) ***************
[06/15/2022-05:43:21] [V] [TRT] --------------- Timing Runner: Optimizer Reformat(tensor-6 -> <out>) (Reformat)
[06/15/2022-05:43:21] [V] [TRT] Tactic: 0x00000000000003e8 Time: 0.00306227
[06/15/2022-05:43:21] [V] [TRT] Tactic: 0x00000000000003ea Time: 0.0165298
[06/15/2022-05:43:21] [V] [TRT] Tactic: 0x0000000000000000 Time: 0.00305002
[06/15/2022-05:43:21] [V] [TRT] Fastest Tactic: 0x0000000000000000 Time: 0.00305002
[06/15/2022-05:43:21] [V] [TRT] *************** Autotuning Reformat: Float(3136,1,448,64) -> Float(98,49:32,7,1) ***************
[06/15/2022-05:43:21] [V] [TRT] --------------- Timing Runner: Optimizer Reformat(tensor-6 -> <out>) (Reformat)
[06/15/2022-05:43:21] [V] [TRT] Tactic: 0x00000000000003e8 Time: 0.00393699
[06/15/2022-05:43:21] [V] [TRT] Tactic: 0x00000000000003ea Time: 0.0136707
[06/15/2022-05:43:21] [V] [TRT] Tactic: 0x0000000000000000 Time: 0.00393266
[06/15/2022-05:43:21] [V] [TRT] Fastest Tactic: 0x0000000000000000 Time: 0.00393266
[06/15/2022-05:43:21] [V] [TRT] *************** Autotuning Reformat: Float(98,49:32,7,1) -> Float(3136,49,7,1) ***************
[06/15/2022-05:43:21] [V] [TRT] --------------- Timing Runner: Optimizer Reformat(tensor-6 -> <out>) (Reformat)
[06/15/2022-05:43:21] [V] [TRT] Tactic: 0x00000000000003e8 Time: 0.00304827
[06/15/2022-05:43:21] [V] [TRT] Tactic: 0x00000000000003ea Time: 0.0165623
[06/15/2022-05:43:21] [V] [TRT] Tactic: 0x0000000000000000 Time: 0.00305858
[06/15/2022-05:43:21] [V] [TRT] Fastest Tactic: 0x00000000000003e8 Time: 0.00304827
[06/15/2022-05:43:21] [V] [TRT] *************** Autotuning Reformat: Float(98,49:32,7,1) -> Float(3136,1,448,64) ***************
[06/15/2022-05:43:21] [V] [TRT] --------------- Timing Runner: Optimizer Reformat(tensor-6 -> <out>) (Reformat)
[06/15/2022-05:43:21] [V] [TRT] Tactic: 0x00000000000003e8 Time: 0.00296938
[06/15/2022-05:43:21] [V] [TRT] Tactic: 0x00000000000003ea Time: 0.0136985
[06/15/2022-05:43:21] [V] [TRT] Tactic: 0x0000000000000000 Time: 0.00296695
[06/15/2022-05:43:21] [V] [TRT] Fastest Tactic: 0x0000000000000000 Time: 0.00296695
[06/15/2022-05:43:21] [V] [TRT] =============== Computing reformatting costs
[06/15/2022-05:43:21] [V] [TRT] *************** Autotuning Reformat: Float(3136,1,1,1) -> Float(3136,1,3136,3136) ***************
[06/15/2022-05:43:21] [V] [TRT] --------------- Timing Runner: Optimizer Reformat(reshape_before_MatMul-9_out_tensor -> <out>) (Reformat)
[06/15/2022-05:43:21] [V] [TRT] Tactic: 0x00000000000003e8 Time: 0.00278418
[06/15/2022-05:43:21] [V] [TRT] Tactic: 0x00000000000003ea Time: 0.00586898
[06/15/2022-05:43:21] [V] [TRT] Tactic: 0x0000000000000000 Time: 0.00279323
[06/15/2022-05:43:21] [V] [TRT] Fastest Tactic: 0x00000000000003e8 Time: 0.00278418
[06/15/2022-05:43:21] [V] [TRT] *************** Autotuning Reformat: Float(3136,1,3136,3136) -> Float(3136,1,1,1) ***************
[06/15/2022-05:43:21] [V] [TRT] --------------- Timing Runner: Optimizer Reformat(reshape_before_MatMul-9_out_tensor -> <out>) (Reformat)
[06/15/2022-05:43:21] [V] [TRT] Tactic: 0x00000000000003e8 Time: 0.00275103
[06/15/2022-05:43:21] [V] [TRT] Tactic: 0x00000000000003ea Time: 0.00594524
[06/15/2022-05:43:21] [V] [TRT] Tactic: 0x0000000000000000 Time: 0.00278242
[06/15/2022-05:43:21] [V] [TRT] Fastest Tactic: 0x00000000000003e8 Time: 0.00275103
[06/15/2022-05:43:21] [V] [TRT] *************** Autotuning Reformat: Float(98,1:32,1,1) -> Float(3136,1,1,1) ***************
[06/15/2022-05:43:21] [V] [TRT] --------------- Timing Runner: Optimizer Reformat(reshape_before_MatMul-9_out_tensor -> <out>) (Reformat)
[06/15/2022-05:43:21] [V] [TRT] Tactic: 0x00000000000003e8 Time: 0.00292273
[06/15/2022-05:43:21] [V] [TRT] Tactic: 0x00000000000003ea Time: 0.0454937
[06/15/2022-05:43:21] [V] [TRT] Tactic: 0x0000000000000000 Time: 0.00291638
[06/15/2022-05:43:21] [V] [TRT] Fastest Tactic: 0x0000000000000000 Time: 0.00291638
[06/15/2022-05:43:21] [V] [TRT] *************** Autotuning Reformat: Float(98,1:32,1,1) -> Float(3136,1,3136,3136) ***************
[06/15/2022-05:43:21] [V] [TRT] --------------- Timing Runner: Optimizer Reformat(reshape_before_MatMul-9_out_tensor -> <out>) (Reformat)
[06/15/2022-05:43:21] [V] [TRT] Tactic: 0x00000000000003e8 Time: 0.00294325
[06/15/2022-05:43:21] [V] [TRT] Tactic: 0x00000000000003ea Time: 0.0148485
[06/15/2022-05:43:21] [V] [TRT] Tactic: 0x0000000000000000 Time: 0.00296723
[06/15/2022-05:43:21] [V] [TRT] Fastest Tactic: 0x00000000000003e8 Time: 0.00294325
[06/15/2022-05:43:21] [V] [TRT] =============== Computing reformatting costs
[06/15/2022-05:43:21] [V] [TRT] *************** Autotuning Reformat: Float(1024,1,1,1) -> Float(1024,1,1024,1024) ***************
[06/15/2022-05:43:21] [V] [TRT] --------------- Timing Runner: Optimizer Reformat(ReLU-11_out_tensor -> <out>) (Reformat)
[06/15/2022-05:43:21] [V] [TRT] Tactic: 0x00000000000003e8 Time: 0.00248142
[06/15/2022-05:43:21] [V] [TRT] Tactic: 0x00000000000003ea Time: 0.00611352
[06/15/2022-05:43:21] [V] [TRT] Tactic: 0x0000000000000000 Time: 0.00276229
[06/15/2022-05:43:21] [V] [TRT] Fastest Tactic: 0x00000000000003e8 Time: 0.00248142
[06/15/2022-05:43:21] [V] [TRT] *************** Autotuning Reformat: Float(1024,1,1024,1024) -> Float(1024,1,1,1) ***************
[06/15/2022-05:43:21] [V] [TRT] --------------- Timing Runner: Optimizer Reformat(ReLU-11_out_tensor -> <out>) (Reformat)
[06/15/2022-05:43:21] [V] [TRT] Tactic: 0x00000000000003e8 Time: 0.00260123
[06/15/2022-05:43:21] [V] [TRT] Tactic: 0x00000000000003ea Time: 0.00597333
[06/15/2022-05:43:21] [V] [TRT] Tactic: 0x0000000000000000 Time: 0.00275139
[06/15/2022-05:43:21] [V] [TRT] Fastest Tactic: 0x00000000000003e8 Time: 0.00260123
[06/15/2022-05:43:21] [V] [TRT] =============== Computing reformatting costs
[06/15/2022-05:43:21] [V] [TRT] *************** Autotuning Reformat: Float(10,1,10,10) -> Float(10,1,1,1) ***************
[06/15/2022-05:43:21] [V] [TRT] --------------- Timing Runner: Optimizer Reformat(MatMul-12_out_tensor -> <out>) (Reformat)
[06/15/2022-05:43:21] [V] [TRT] Tactic: 0x00000000000003e8 Time: 0.00268944
[06/15/2022-05:43:21] [V] [TRT] Tactic: 0x00000000000003ea Time: 0.0143799
[06/15/2022-05:43:21] [V] [TRT] Tactic: 0x0000000000000000 Time: 0.00276114
[06/15/2022-05:43:21] [V] [TRT] Fastest Tactic: 0x00000000000003e8 Time: 0.00268944
[06/15/2022-05:43:21] [V] [TRT] =============== Computing reformatting costs
[06/15/2022-05:43:21] [V] [TRT] =============== Computing reformatting costs
[06/15/2022-05:43:21] [V] [TRT] =============== Computing reformatting costs
[06/15/2022-05:43:21] [V] [TRT] =============== Computing reformatting costs
[06/15/2022-05:43:21] [V] [TRT] =============== Computing reformatting costs
[06/15/2022-05:43:21] [V] [TRT] =============== Computing reformatting costs
[06/15/2022-05:43:21] [V] [TRT] =============== Computing costs for 
[06/15/2022-05:43:21] [V] [TRT] *************** Autotuning format combination: Float(784,784,28,1) -> Float(25088,784,28,1) ***************
[06/15/2022-05:43:21] [V] [TRT] --------------- Timing Runner: Conv-1 + ReLU-2 (CudaDepthwiseConvolution)
[06/15/2022-05:43:21] [V] [TRT] CudaDepthwiseConvolution has no valid tactics for this config, skipping
[06/15/2022-05:43:21] [V] [TRT] --------------- Timing Runner: Conv-1 + ReLU-2 (FusedConvActConvolution)
[06/15/2022-05:43:21] [V] [TRT] FusedConvActConvolution has no valid tactics for this config, skipping
[06/15/2022-05:43:21] [V] [TRT] --------------- Timing Runner: Conv-1 + ReLU-2 (CudnnConvolution)
[06/15/2022-05:43:21] [V] [TRT] Tactic: 0x0000000000000000 Time: 0.0232385
[06/15/2022-05:43:21] [V] [TRT] Tactic: 0x0000000000000001 Time: 0.0217489
[06/15/2022-05:43:21] [V] [TRT] Tactic: 0x0000000000000002 Time: 0.0291986
[06/15/2022-05:43:21] [V] [TRT] Tactic: 0x0000000000000004 Time: 0.048224
[06/15/2022-05:43:21] [V] [TRT] Tactic: 0x0000000000000005 Time: 0.0480168
[06/15/2022-05:43:21] [V] [TRT] Fastest Tactic: 0x0000000000000001 Time: 0.0217489
[06/15/2022-05:43:21] [V] [TRT] --------------- Timing Runner: Conv-1 + ReLU-2 (CaskConvolution)
[06/15/2022-05:43:21] [V] [TRT] Conv-1 + ReLU-2 Set Tactic Name: maxwell_scudnn_128x32_relu_medium_nn_v1 Tactic: 0x0ebe499388e08286
[06/15/2022-05:43:21] [V] [TRT] Tactic: 0x0ebe499388e08286 Time: 0.0124952
[06/15/2022-05:43:21] [V] [TRT] Conv-1 + ReLU-2 Set Tactic Name: maxwell_scudnn_128x32_relu_large_nn_v0 Tactic: 0x185af5379580418f
[06/15/2022-05:43:21] [V] [TRT] Tactic: 0x185af5379580418f Time: 0.00939486
[06/15/2022-05:43:21] [V] [TRT] Conv-1 + ReLU-2 Set Tactic Name: maxwell_scudnn_128x128_relu_large_nn_v0 Tactic: 0x321f7a577fb21da0
[06/15/2022-05:43:21] [V] [TRT] Tactic: 0x321f7a577fb21da0 Time: 0.0165303
[06/15/2022-05:43:21] [V] [TRT] Conv-1 + ReLU-2 Set Tactic Name: maxwell_scudnn_128x64_relu_large_nn_v1 Tactic: 0x3c301f1cd57bd89b
[06/15/2022-05:43:21] [V] [TRT] Tactic: 0x3c301f1cd57bd89b Time: 0.0123855
[06/15/2022-05:43:21] [V] [TRT] Conv-1 + ReLU-2 Set Tactic Name: maxwell_scudnn_128x128_relu_medium_nn_v1 Tactic: 0x3e787008e11a6129
[06/15/2022-05:43:21] [V] [TRT] Tactic: 0x3e787008e11a6129 Time: 0.0157669
[06/15/2022-05:43:21] [V] [TRT] Conv-1 + ReLU-2 Set Tactic Name: maxwell_scudnn_128x64_relu_small_nn_v1 Tactic: 0x474c9edd1ecfbbba
[06/15/2022-05:43:21] [V] [TRT] Tactic: 0x474c9edd1ecfbbba Time: 0.0114103
[06/15/2022-05:43:21] [V] [TRT] Conv-1 + ReLU-2 Set Tactic Name: maxwell_scudnn_128x128_relu_small_nn_v0 Tactic: 0x4963fb96b4067e81
[06/15/2022-05:43:21] [V] [TRT] Tactic: 0x4963fb96b4067e81 Time: 0.0158959
[06/15/2022-05:43:21] [V] [TRT] Conv-1 + ReLU-2 Set Tactic Name: maxwell_scudnn_128x64_relu_medium_nn_v1 Tactic: 0x5c38385751ccb068
[06/15/2022-05:43:21] [V] [TRT] Tactic: 0x5c38385751ccb068 Time: 0.0120095
[06/15/2022-05:43:21] [V] [TRT] Conv-1 + ReLU-2 Set Tactic Name: maxwell_scudnn_128x32_relu_small_nn_v0 Tactic: 0x632674f65e3422ae
[06/15/2022-05:43:21] [V] [TRT] Tactic: 0x632674f65e3422ae Time: 0.00875133
[06/15/2022-05:43:21] [V] [TRT] Conv-1 + ReLU-2 Set Tactic Name: maxwell_scudnn_128x128_relu_large_nn_v1 Tactic: 0x813136e97c1542cf
[06/15/2022-05:43:21] [V] [TRT] Tactic: 0x813136e97c1542cf Time: 0.0161727
[06/15/2022-05:43:21] [V] [TRT] Conv-1 + ReLU-2 Set Tactic Name: maxwell_scudnn_128x128_relu_medium_nn_v0 Tactic: 0x8d563cb6e2bd3e46
[06/15/2022-05:43:21] [V] [TRT] Tactic: 0x8d563cb6e2bd3e46 Time: 0.0164587
[06/15/2022-05:43:21] [V] [TRT] Conv-1 + ReLU-2 Set Tactic Name: maxwell_scudnn_128x64_relu_large_nn_v0 Tactic: 0x8f1e53a2d6dc87f4
[06/15/2022-05:43:21] [V] [TRT] Tactic: 0x8f1e53a2d6dc87f4 Time: 0.0122027
[06/15/2022-05:43:21] [V] [TRT] Conv-1 + ReLU-2 Set Tactic Name: maxwell_scudnn_128x32_relu_large_nn_v1 Tactic: 0xab74b98996271ee0
[06/15/2022-05:43:21] [V] [TRT] Tactic: 0xab74b98996271ee0 Time: 0.0125684
[06/15/2022-05:43:21] [V] [TRT] Conv-1 + ReLU-2 Set Tactic Name: maxwell_scudnn_128x32_relu_medium_nn_v0 Tactic: 0xbd90052d8b47dde9
[06/15/2022-05:43:21] [V] [TRT] Tactic: 0xbd90052d8b47dde9 Time: 0.00925257
[06/15/2022-05:43:21] [V] [TRT] Conv-1 + ReLU-2 Set Tactic Name: maxwell_scudnn_128x32_relu_small_nn_v1 Tactic: 0xd00838485d937dc1
[06/15/2022-05:43:21] [V] [TRT] Tactic: 0xd00838485d937dc1 Time: 0.0106811
[06/15/2022-05:43:21] [V] [TRT] Conv-1 + ReLU-2 Set Tactic Name: maxwell_scudnn_128x64_relu_medium_nn_v0 Tactic: 0xef1674e9526bef07
[06/15/2022-05:43:21] [V] [TRT] Tactic: 0xef1674e9526bef07 Time: 0.0121051
[06/15/2022-05:43:21] [V] [TRT] Conv-1 + ReLU-2 Set Tactic Name: maxwell_scudnn_128x64_relu_small_nn_v0 Tactic: 0xf462d2631d68e4d5
[06/15/2022-05:43:21] [V] [TRT] Tactic: 0xf462d2631d68e4d5 Time: 0.0117029
[06/15/2022-05:43:21] [V] [TRT] Conv-1 + ReLU-2 Set Tactic Name: maxwell_scudnn_128x128_relu_small_nn_v1 Tactic: 0xfa4db728b7a121ee
[06/15/2022-05:43:21] [V] [TRT] Tactic: 0xfa4db728b7a121ee Time: 0.0152722
[06/15/2022-05:43:21] [V] [TRT] Fastest Tactic: 0x632674f65e3422ae Time: 0.00875133
[06/15/2022-05:43:21] [V] [TRT] >>>>>>>>>>>>>>> Chose Runner Type: CaskConvolution Tactic: 0x632674f65e3422ae
[06/15/2022-05:43:21] [V] [TRT] *************** Autotuning format combination: Float(784,1,28,1) -> Float(25088,1,896,32) ***************
[06/15/2022-05:43:21] [V] [TRT] --------------- Timing Runner: Conv-1 + ReLU-2 (CaskConvolution)
[06/15/2022-05:43:21] [V] [TRT] CaskConvolution has no valid tactics for this config, skipping
[06/15/2022-05:43:21] [V] [TRT] =============== Computing costs for 
[06/15/2022-05:43:21] [V] [TRT] *************** Autotuning format combination: Float(25088,784,28,1) -> Float(6272,196,14,1) ***************
[06/15/2022-05:43:21] [V] [TRT] --------------- Timing Runner: MaxPool-3 (TiledPooling)
[06/15/2022-05:43:21] [V] [TRT] Tactic: 0x0000000000540101 Time: 0.00830375
[06/15/2022-05:43:21] [V] [TRT] Tactic: 0x0000000000550101 Time: 0.00570198
[06/15/2022-05:43:21] [V] [TRT] Tactic: 0x0000000000560101 Time: 0.00493841
[06/15/2022-05:43:21] [V] [TRT] Tactic: 0x0000000000570101 Time: 0.00448314
[06/15/2022-05:43:21] [V] [TRT] Tactic: 0x0000000000580101 Time: 0.00446629
[06/15/2022-05:43:21] [V] [TRT] Tactic: 0x0000000000590101 Time: 0.00468129
[06/15/2022-05:43:21] [V] [TRT] Tactic: 0x00000000005a0101 Time: 0.00471418
[06/15/2022-05:43:21] [V] [TRT] Tactic: 0x00000000005b0101 Time: 0.0038465
[06/15/2022-05:43:21] [V] [TRT] Tactic: 0x00000000005c0101 Time: 0.00527151
[06/15/2022-05:43:21] [V] [TRT] Tactic: 0x00000000005d0101 Time: 0.00379874
[06/15/2022-05:43:21] [V] [TRT] Tactic: 0x00000000005e0101 Time: 0.00355858
[06/15/2022-05:43:21] [V] [TRT] Tactic: 0x00000000005f0101 Time: 0.00317592
[06/15/2022-05:43:21] [V] [TRT] Tactic: 0x0000000000600101 Time: 0.00325922
[06/15/2022-05:43:21] [V] [TRT] Tactic: 0x0000000000610101 Time: 0.00321168
[06/15/2022-05:43:21] [V] [TRT] Tactic: 0x0000000000620101 Time: 0.00311722
[06/15/2022-05:43:21] [V] [TRT] Tactic: 0x0000000000630101 Time: 0.00304292
[06/15/2022-05:43:21] [V] [TRT] Fastest Tactic: 0x0000000000630101 Time: 0.00304292
[06/15/2022-05:43:21] [V] [TRT] --------------- Timing Runner: MaxPool-3 (CudnnPooling)
[06/15/2022-05:43:21] [V] [TRT] Tactic: 0xffffffffffffffff Time: 0.00366886
[06/15/2022-05:43:21] [V] [TRT] Fastest Tactic: 0xffffffffffffffff Time: 0.00366886
[06/15/2022-05:43:21] [V] [TRT] --------------- Timing Runner: MaxPool-3 (CaskPooling)
[06/15/2022-05:43:21] [V] [TRT] MaxPool-3 Set Tactic Name: sm50_xmma_pooling_fw_4d_FP32FP32NCHW_Max Tactic: 0xb59f9cfb90407c92
[06/15/2022-05:43:21] [V] [TRT] Tactic: 0xb59f9cfb90407c92 Time: 0.00390919
[06/15/2022-05:43:21] [V] [TRT] Fastest Tactic: 0xb59f9cfb90407c92 Time: 0.00390919
[06/15/2022-05:43:21] [V] [TRT] >>>>>>>>>>>>>>> Chose Runner Type: TiledPooling Tactic: 0x0000000000630101
[06/15/2022-05:43:21] [V] [TRT] =============== Computing costs for 
[06/15/2022-05:43:21] [V] [TRT] *************** Autotuning format combination: Float(6272,196,14,1) -> Float(12544,196,14,1) ***************
[06/15/2022-05:43:21] [V] [TRT] --------------- Timing Runner: Conv-4 + ReLU-5 (CudaDepthwiseConvolution)
[06/15/2022-05:43:21] [V] [TRT] CudaDepthwiseConvolution has no valid tactics for this config, skipping
[06/15/2022-05:43:21] [V] [TRT] --------------- Timing Runner: Conv-4 + ReLU-5 (FusedConvActConvolution)
[06/15/2022-05:43:21] [V] [TRT] FusedConvActConvolution has no valid tactics for this config, skipping
[06/15/2022-05:43:21] [V] [TRT] --------------- Timing Runner: Conv-4 + ReLU-5 (CudnnConvolution)
[06/15/2022-05:43:21] [V] [TRT] Tactic: 0x0000000000000000 Time: 0.0805303
[06/15/2022-05:43:21] [V] [TRT] Tactic: 0x0000000000000001 Time: 0.0833097
[06/15/2022-05:43:21] [V] [TRT] Tactic: 0x0000000000000002 Time: 0.12544
[06/15/2022-05:43:21] [V] [TRT] Tactic: 0x0000000000000004 Time: 0.193618
[06/15/2022-05:43:21] [V] [TRT] Tactic: 0x0000000000000005 Time: 0.201111
[06/15/2022-05:43:21] [V] [TRT] Fastest Tactic: 0x0000000000000000 Time: 0.0805303
[06/15/2022-05:43:21] [V] [TRT] --------------- Timing Runner: Conv-4 + ReLU-5 (CaskConvolution)
[06/15/2022-05:43:21] [V] [TRT] Conv-4 + ReLU-5 Set Tactic Name: maxwell_scudnn_128x32_relu_medium_nn_v1 Tactic: 0x0ebe499388e08286
[06/15/2022-05:43:21] [V] [TRT] Tactic: 0x0ebe499388e08286 Time: 0.127707
[06/15/2022-05:43:21] [V] [TRT] Conv-4 + ReLU-5 Set Tactic Name: maxwell_scudnn_128x32_relu_large_nn_v0 Tactic: 0x185af5379580418f
[06/15/2022-05:43:21] [V] [TRT] Tactic: 0x185af5379580418f Time: 0.0944274
[06/15/2022-05:43:21] [V] [TRT] Conv-4 + ReLU-5 Set Tactic Name: maxwell_scudnn_128x128_relu_large_nn_v0 Tactic: 0x321f7a577fb21da0
[06/15/2022-05:43:21] [V] [TRT] Tactic: 0x321f7a577fb21da0 Time: 0.103426
[06/15/2022-05:43:21] [V] [TRT] Conv-4 + ReLU-5 Set Tactic Name: maxwell_scudnn_128x64_relu_large_nn_v1 Tactic: 0x3c301f1cd57bd89b
[06/15/2022-05:43:21] [V] [TRT] Tactic: 0x3c301f1cd57bd89b Time: 0.0953783
[06/15/2022-05:43:21] [V] [TRT] Conv-4 + ReLU-5 Set Tactic Name: maxwell_scudnn_128x128_relu_medium_nn_v1 Tactic: 0x3e787008e11a6129
[06/15/2022-05:43:21] [V] [TRT] Tactic: 0x3e787008e11a6129 Time: 0.103863
[06/15/2022-05:43:21] [V] [TRT] Conv-4 + ReLU-5 Set Tactic Name: maxwell_scudnn_128x64_relu_small_nn_v1 Tactic: 0x474c9edd1ecfbbba
[06/15/2022-05:43:21] [V] [TRT] Tactic: 0x474c9edd1ecfbbba Time: 0.0628053
[06/15/2022-05:43:21] [V] [TRT] Conv-4 + ReLU-5 Set Tactic Name: maxwell_scudnn_128x128_relu_small_nn_v0 Tactic: 0x4963fb96b4067e81
[06/15/2022-05:43:21] [V] [TRT] Tactic: 0x4963fb96b4067e81 Time: 0.0896731
[06/15/2022-05:43:21] [V] [TRT] Conv-4 + ReLU-5 Set Tactic Name: maxwell_scudnn_128x64_relu_medium_nn_v1 Tactic: 0x5c38385751ccb068
[06/15/2022-05:43:21] [V] [TRT] Tactic: 0x5c38385751ccb068 Time: 0.0857234
[06/15/2022-05:43:21] [V] [TRT] Conv-4 + ReLU-5 Set Tactic Name: maxwell_scudnn_128x32_relu_small_nn_v0 Tactic: 0x632674f65e3422ae
[06/15/2022-05:43:21] [V] [TRT] Tactic: 0x632674f65e3422ae Time: 0.072192
[06/15/2022-05:43:21] [V] [TRT] Conv-4 + ReLU-5 Set Tactic Name: maxwell_scudnn_128x128_relu_large_nn_v1 Tactic: 0x813136e97c1542cf
[06/15/2022-05:43:21] [V] [TRT] Tactic: 0x813136e97c1542cf Time: 0.10752
[06/15/2022-05:43:21] [V] [TRT] Conv-4 + ReLU-5 Set Tactic Name: maxwell_scudnn_128x128_relu_medium_nn_v0 Tactic: 0x8d563cb6e2bd3e46
[06/15/2022-05:43:21] [V] [TRT] Tactic: 0x8d563cb6e2bd3e46 Time: 0.10357
[06/15/2022-05:43:21] [V] [TRT] Conv-4 + ReLU-5 Set Tactic Name: maxwell_scudnn_128x64_relu_large_nn_v0 Tactic: 0x8f1e53a2d6dc87f4
[06/15/2022-05:43:21] [V] [TRT] Tactic: 0x8f1e53a2d6dc87f4 Time: 0.111543
[06/15/2022-05:43:21] [V] [TRT] Conv-4 + ReLU-5 Set Tactic Name: maxwell_scudnn_128x32_relu_large_nn_v1 Tactic: 0xab74b98996271ee0
[06/15/2022-05:43:21] [V] [TRT] Tactic: 0xab74b98996271ee0 Time: 0.133778
[06/15/2022-05:43:21] [V] [TRT] Conv-4 + ReLU-5 Set Tactic Name: maxwell_scudnn_128x32_relu_medium_nn_v0 Tactic: 0xbd90052d8b47dde9
[06/15/2022-05:43:21] [V] [TRT] Tactic: 0xbd90052d8b47dde9 Time: 0.0933303
[06/15/2022-05:43:21] [V] [TRT] Conv-4 + ReLU-5 Set Tactic Name: maxwell_scudnn_128x32_relu_small_nn_v1 Tactic: 0xd00838485d937dc1
[06/15/2022-05:43:21] [V] [TRT] Tactic: 0xd00838485d937dc1 Time: 0.0736549
[06/15/2022-05:43:21] [V] [TRT] Conv-4 + ReLU-5 Set Tactic Name: maxwell_scudnn_128x64_relu_medium_nn_v0 Tactic: 0xef1674e9526bef07
[06/15/2022-05:43:21] [V] [TRT] Tactic: 0xef1674e9526bef07 Time: 0.110226
[06/15/2022-05:43:21] [V] [TRT] Conv-4 + ReLU-5 Set Tactic Name: maxwell_scudnn_128x64_relu_small_nn_v0 Tactic: 0xf462d2631d68e4d5
[06/15/2022-05:43:21] [V] [TRT] Tactic: 0xf462d2631d68e4d5 Time: 0.0906971
[06/15/2022-05:43:21] [V] [TRT] Conv-4 + ReLU-5 Set Tactic Name: maxwell_scudnn_128x128_relu_small_nn_v1 Tactic: 0xfa4db728b7a121ee
[06/15/2022-05:43:21] [V] [TRT] Tactic: 0xfa4db728b7a121ee Time: 0.0877714
[06/15/2022-05:43:21] [V] [TRT] Fastest Tactic: 0x474c9edd1ecfbbba Time: 0.0628053
[06/15/2022-05:43:21] [V] [TRT] >>>>>>>>>>>>>>> Chose Runner Type: CaskConvolution Tactic: 0x474c9edd1ecfbbba
[06/15/2022-05:43:21] [V] [TRT] *************** Autotuning format combination: Float(6272,1,448,32) -> Float(12544,1,896,64) ***************
[06/15/2022-05:43:21] [V] [TRT] --------------- Timing Runner: Conv-4 + ReLU-5 (CaskConvolution)
[06/15/2022-05:43:21] [V] [TRT] Conv-4 + ReLU-5 Set Tactic Name: maxwell_scudnn_128x32_sliced1x4_ldg4_relu_exp_small_nhwc_tn_v1 Tactic: 0x80f932c0b8ce5940
[06/15/2022-05:43:21] [V] [TRT] Tactic: 0x80f932c0b8ce5940 Time: 0.0277211
[06/15/2022-05:43:21] [V] [TRT] Conv-4 + ReLU-5 Set Tactic Name: maxwell_scudnn_128x64_sliced1x2_ldg4_relu_exp_small_nhwc_tn_v1 Tactic: 0x9961ac24fc07a1df
[06/15/2022-05:43:21] [V] [TRT] Tactic: 0x9961ac24fc07a1df Time: 0.0487619
[06/15/2022-05:43:21] [V] [TRT] Fastest Tactic: 0x80f932c0b8ce5940 Time: 0.0277211
[06/15/2022-05:43:21] [V] [TRT] >>>>>>>>>>>>>>> Chose Runner Type: CaskConvolution Tactic: 0x80f932c0b8ce5940
[06/15/2022-05:43:21] [V] [TRT] =============== Computing costs for 
[06/15/2022-05:43:21] [V] [TRT] *************** Autotuning format combination: Float(12544,196,14,1) -> Float(3136,49,7,1) ***************
[06/15/2022-05:43:21] [V] [TRT] --------------- Timing Runner: MaxPool-6 (TiledPooling)
[06/15/2022-05:43:21] [V] [TRT] Tactic: 0x0000000000540101 Time: 0.00911514
[06/15/2022-05:43:21] [V] [TRT] Tactic: 0x0000000000550101 Time: 0.00619028
[06/15/2022-05:43:21] [V] [TRT] Tactic: 0x0000000000560101 Time: 0.00536821
[06/15/2022-05:43:21] [V] [TRT] Tactic: 0x0000000000570101 Time: 0.00488366
[06/15/2022-05:43:21] [V] [TRT] Tactic: 0x0000000000580101 Time: 0.00461021
[06/15/2022-05:43:21] [V] [TRT] Tactic: 0x0000000000590101 Time: 0.00515951
[06/15/2022-05:43:21] [V] [TRT] Tactic: 0x00000000005a0101 Time: 0.00484206
[06/15/2022-05:43:21] [V] [TRT] Tactic: 0x00000000005b0101 Time: 0.00413962
[06/15/2022-05:43:21] [V] [TRT] Tactic: 0x00000000005c0101 Time: 0.00565363
[06/15/2022-05:43:21] [V] [TRT] Tactic: 0x00000000005d0101 Time: 0.00414171
[06/15/2022-05:43:21] [V] [TRT] Tactic: 0x00000000005e0101 Time: 0.00369512
[06/15/2022-05:43:21] [V] [TRT] Tactic: 0x00000000005f0101 Time: 0.00366687
[06/15/2022-05:43:21] [V] [TRT] Tactic: 0x0000000000600101 Time: 0.00404292
[06/15/2022-05:43:21] [V] [TRT] Tactic: 0x0000000000610101 Time: 0.00390919
[06/15/2022-05:43:21] [V] [TRT] Tactic: 0x0000000000620101 Time: 0.00369559
[06/15/2022-05:43:21] [V] [TRT] Tactic: 0x0000000000630101 Time: 0.00371446
[06/15/2022-05:43:21] [V] [TRT] Fastest Tactic: 0x00000000005f0101 Time: 0.00366687
[06/15/2022-05:43:21] [V] [TRT] --------------- Timing Runner: MaxPool-6 (CudnnPooling)
[06/15/2022-05:43:21] [V] [TRT] Tactic: 0xffffffffffffffff Time: 0.0047933
[06/15/2022-05:43:21] [V] [TRT] Fastest Tactic: 0xffffffffffffffff Time: 0.0047933
[06/15/2022-05:43:21] [V] [TRT] --------------- Timing Runner: MaxPool-6 (CaskPooling)
[06/15/2022-05:43:21] [V] [TRT] MaxPool-6 Set Tactic Name: sm50_xmma_pooling_fw_4d_FP32FP32NCHW_Max Tactic: 0xb59f9cfb90407c92
[06/15/2022-05:43:21] [V] [TRT] Tactic: 0xb59f9cfb90407c92 Time: 0.00341627
[06/15/2022-05:43:21] [V] [TRT] Fastest Tactic: 0xb59f9cfb90407c92 Time: 0.00341627
[06/15/2022-05:43:21] [V] [TRT] >>>>>>>>>>>>>>> Chose Runner Type: CaskPooling Tactic: 0xb59f9cfb90407c92
[06/15/2022-05:43:21] [V] [TRT] =============== Computing costs for 
[06/15/2022-05:43:21] [V] [TRT] *************** Autotuning format combination: Float(3136,49,7,1) -> Float(3136,1,1,1) ***************
[06/15/2022-05:43:21] [V] [TRT] --------------- Timing Runner: Transpose-7 + Reshape-7 + reshape_before_MatMul-9 (Shuffle)
[06/15/2022-05:43:21] [V] [TRT] Tactic: 0x0000000000000000 Time: 0.00424914
[06/15/2022-05:43:21] [V] [TRT] Tactic: 0x0000000000000001 Time: 0.0261851
[06/15/2022-05:43:21] [V] [TRT] Fastest Tactic: 0x0000000000000000 Time: 0.00424914
[06/15/2022-05:43:21] [V] [TRT] >>>>>>>>>>>>>>> Chose Runner Type: Shuffle Tactic: 0x0000000000000000
[06/15/2022-05:43:21] [V] [TRT] *************** Autotuning format combination: Float(3136,1,448,64) -> Float(3136,1,3136,3136) ***************
[06/15/2022-05:43:21] [V] [TRT] --------------- Timing Runner: Transpose-7 + Reshape-7 + reshape_before_MatMul-9 (Shuffle)
[06/15/2022-05:43:21] [V] [TRT] Tactic: 0x0000000000000000 Time: 0.00420356
[06/15/2022-05:43:21] [V] [TRT] Tactic: 0x0000000000000001 Time: 0.0248686
[06/15/2022-05:43:21] [V] [TRT] Fastest Tactic: 0x0000000000000000 Time: 0.00420356
[06/15/2022-05:43:21] [V] [TRT] >>>>>>>>>>>>>>> Chose Runner Type: Shuffle Tactic: 0x0000000000000000
[06/15/2022-05:43:21] [V] [TRT] *************** Autotuning format combination: Float(98,49:32,7,1) -> Float(98,1:32,1,1) ***************
[06/15/2022-05:43:21] [V] [TRT] --------------- Timing Runner: Transpose-7 + Reshape-7 + reshape_before_MatMul-9 (Shuffle)
[06/15/2022-05:43:21] [V] [TRT] Tactic: 0x0000000000000000 Time: 0.00355234
[06/15/2022-05:43:21] [V] [TRT] Tactic: 0x0000000000000001 Time: 0.0558324
[06/15/2022-05:43:21] [V] [TRT] Fastest Tactic: 0x0000000000000000 Time: 0.00355234
[06/15/2022-05:43:21] [V] [TRT] >>>>>>>>>>>>>>> Chose Runner Type: Shuffle Tactic: 0x0000000000000000
[06/15/2022-05:43:21] [V] [TRT] =============== Computing costs for 
[06/15/2022-05:43:21] [V] [TRT] *************** Autotuning format combination: Float(3136,1,1,1) -> Float(1024,1,1,1) ***************
[06/15/2022-05:43:21] [V] [TRT] --------------- Timing Runner: MatMul-9 + ReLU-11 (CudaDepthwiseConvolution)
[06/15/2022-05:43:21] [V] [TRT] CudaDepthwiseConvolution has no valid tactics for this config, skipping
[06/15/2022-05:43:21] [V] [TRT] --------------- Timing Runner: MatMul-9 + ReLU-11 (FusedConvActConvolution)
[06/15/2022-05:43:21] [V] [TRT] FusedConvActConvolution has no valid tactics for this config, skipping
[06/15/2022-05:43:21] [V] [TRT] --------------- Timing Runner: MatMul-9 + ReLU-11 (CudnnConvolution)
[06/15/2022-05:43:21] [V] [TRT] Tactic: 0x0000000000000000 Time: 0.329289
[06/15/2022-05:43:21] [V] [TRT] Tactic: 0x0000000000000001 Time: 0.283941
[06/15/2022-05:43:21] [V] [TRT] Tactic: 0x0000000000000002 Time: 0.382245
[06/15/2022-05:43:21] [V] [TRT] Tactic: 0x0000000000000004 skipped. Scratch requested: 7527202816, available: 1073741824
[06/15/2022-05:43:21] [V] [TRT] Tactic: 0x0000000000000005 Time: 6.30257
[06/15/2022-05:43:21] [I] [TRT] Some tactics do not have sufficient workspace memory to run. Increasing workspace size will enable more tactics, please check verbose output for requested sizes.
[06/15/2022-05:43:21] [V] [TRT] Fastest Tactic: 0x0000000000000001 Time: 0.283941
[06/15/2022-05:43:21] [V] [TRT] Setting workspace to 7527202816enables more tactics for profiling
[06/15/2022-05:43:21] [V] [TRT] --------------- Timing Runner: MatMul-9 + ReLU-11 (CublasConvolution)
[06/15/2022-05:43:22] [V] [TRT] Tactic: 0x0000000000000000 Time: 0.0689006
[06/15/2022-05:43:22] [V] [TRT] Tactic: 0x0000000000000001 Time: 0.0697783
[06/15/2022-05:43:22] [V] [TRT] Fastest Tactic: 0x0000000000000000 Time: 0.0689006
[06/15/2022-05:43:22] [V] [TRT] --------------- Timing Runner: MatMul-9 + ReLU-11 (CaskConvolution)
[06/15/2022-05:43:22] [V] [TRT] MatMul-9 + ReLU-11 Set Tactic Name: maxwell_scudnn_128x32_relu_medium_nn_v1 Tactic: 0x0ebe499388e08286
[06/15/2022-05:43:22] [V] [TRT] Tactic: 0x0ebe499388e08286 Time: 0.381806
[06/15/2022-05:43:22] [V] [TRT] MatMul-9 + ReLU-11 Set Tactic Name: maxwell_scudnn_128x32_relu_interior_nn_v0 Tactic: 0x1792ed6b0f1ea883
[06/15/2022-05:43:22] [V] [TRT] Tactic: 0x1792ed6b0f1ea883 Time: 0.377563
[06/15/2022-05:43:22] [V] [TRT] MatMul-9 + ReLU-11 Set Tactic Name: maxwell_scudnn_128x128_relu_medium_nn_v1 Tactic: 0x3e787008e11a6129
[06/15/2022-05:43:22] [V] [TRT] Tactic: 0x3e787008e11a6129 Time: 0.405943
[06/15/2022-05:43:22] [V] [TRT] MatMul-9 + ReLU-11 Set Tactic Name: maxwell_scudnn_128x64_relu_small_nn_v1 Tactic: 0x474c9edd1ecfbbba
[06/15/2022-05:43:22] [V] [TRT] Tactic: 0x474c9edd1ecfbbba Time: 0.327973
[06/15/2022-05:43:22] [V] [TRT] MatMul-9 + ReLU-11 Set Tactic Name: maxwell_scudnn_128x128_relu_small_nn_v0 Tactic: 0x4963fb96b4067e81
[06/15/2022-05:43:22] [V] [TRT] Tactic: 0x4963fb96b4067e81 Time: 0.384146
[06/15/2022-05:43:22] [V] [TRT] MatMul-9 + ReLU-11 Set Tactic Name: maxwell_scudnn_128x128_relu_interior_nn_v1 Tactic: 0x49ecad9da64c487b
[06/15/2022-05:43:22] [V] [TRT] Tactic: 0x49ecad9da64c487b Time: 0.401701
[06/15/2022-05:43:22] [V] [TRT] MatMul-9 + ReLU-11 Set Tactic Name: maxwell_scudnn_128x64_relu_interior_nn_v0 Tactic: 0x4c5584586319b832
[06/15/2022-05:43:22] [V] [TRT] Tactic: 0x4c5584586319b832 Time: 0.371566
[06/15/2022-05:43:22] [V] [TRT] MatMul-9 + ReLU-11 Set Tactic Name: maxwell_scudnn_128x64_relu_medium_nn_v1 Tactic: 0x5c38385751ccb068
[06/15/2022-05:43:22] [V] [TRT] Tactic: 0x5c38385751ccb068 Time: 0.385024
[06/15/2022-05:43:22] [V] [TRT] MatMul-9 + ReLU-11 Set Tactic Name: maxwell_scudnn_128x32_relu_small_nn_v0 Tactic: 0x632674f65e3422ae
[06/15/2022-05:43:22] [V] [TRT] Tactic: 0x632674f65e3422ae Time: 0.37888
[06/15/2022-05:43:22] [V] [TRT] MatMul-9 + ReLU-11 Set Tactic Name: maxwell_scudnn_128x128_relu_medium_nn_v0 Tactic: 0x8d563cb6e2bd3e46
[06/15/2022-05:43:22] [V] [TRT] Tactic: 0x8d563cb6e2bd3e46 Time: 0.436955
[06/15/2022-05:43:22] [V] [TRT] MatMul-9 + ReLU-11 Set Tactic Name: maxwell_scudnn_128x32_relu_interior_nn_v1 Tactic: 0xa4bca1d50cb9f7ec
[06/15/2022-05:43:22] [V] [TRT] Tactic: 0xa4bca1d50cb9f7ec Time: 0.337335
[06/15/2022-05:43:22] [V] [TRT] MatMul-9 + ReLU-11 Set Tactic Name: maxwell_scudnn_128x32_relu_medium_nn_v0 Tactic: 0xbd90052d8b47dde9
[06/15/2022-05:43:22] [V] [TRT] Tactic: 0xbd90052d8b47dde9 Time: 0.362496
[06/15/2022-05:43:22] [V] [TRT] MatMul-9 + ReLU-11 Set Tactic Name: maxwell_scudnn_128x32_relu_small_nn_v1 Tactic: 0xd00838485d937dc1
[06/15/2022-05:43:22] [V] [TRT] Tactic: 0xd00838485d937dc1 Time: 0.34699
[06/15/2022-05:43:22] [V] [TRT] MatMul-9 + ReLU-11 Set Tactic Name: maxwell_scudnn_128x64_relu_medium_nn_v0 Tactic: 0xef1674e9526bef07
[06/15/2022-05:43:22] [V] [TRT] Tactic: 0xef1674e9526bef07 Time: 0.383854
[06/15/2022-05:43:22] [V] [TRT] MatMul-9 + ReLU-11 Set Tactic Name: maxwell_scudnn_128x64_relu_small_nn_v0 Tactic: 0xf462d2631d68e4d5
[06/15/2022-05:43:22] [V] [TRT] Tactic: 0xf462d2631d68e4d5 Time: 0.374638
[06/15/2022-05:43:22] [V] [TRT] MatMul-9 + ReLU-11 Set Tactic Name: maxwell_scudnn_128x128_relu_small_nn_v1 Tactic: 0xfa4db728b7a121ee
[06/15/2022-05:43:22] [V] [TRT] Tactic: 0xfa4db728b7a121ee Time: 0.403017
[06/15/2022-05:43:22] [V] [TRT] MatMul-9 + ReLU-11 Set Tactic Name: maxwell_scudnn_128x128_relu_interior_nn_v0 Tactic: 0xfac2e123a5eb1714
[06/15/2022-05:43:22] [V] [TRT] Tactic: 0xfac2e123a5eb1714 Time: 0.382976
[06/15/2022-05:43:22] [V] [TRT] MatMul-9 + ReLU-11 Set Tactic Name: maxwell_scudnn_128x64_relu_interior_nn_v1 Tactic: 0xff7bc8e660bee75d
[06/15/2022-05:43:22] [V] [TRT] Tactic: 0xff7bc8e660bee75d Time: 0.32651
[06/15/2022-05:43:22] [V] [TRT] Fastest Tactic: 0xff7bc8e660bee75d Time: 0.32651
[06/15/2022-05:43:22] [V] [TRT] >>>>>>>>>>>>>>> Chose Runner Type: CublasConvolution Tactic: 0x0000000000000000
[06/15/2022-05:43:22] [V] [TRT] *************** Autotuning format combination: Float(3136,1,3136,3136) -> Float(1024,1,1024,1024) ***************
[06/15/2022-05:43:22] [V] [TRT] --------------- Timing Runner: MatMul-9 + ReLU-11 (CublasConvolution)
[06/15/2022-05:43:22] [V] [TRT] CublasConvolution has no valid tactics for this config, skipping
[06/15/2022-05:43:22] [V] [TRT] --------------- Timing Runner: MatMul-9 + ReLU-11 (CaskConvolution)
[06/15/2022-05:43:22] [V] [TRT] MatMul-9 + ReLU-11 Set Tactic Name: maxwell_scudnn_128x64_sliced1x2_ldg4_relu_exp_interior_nhwc_tn_v1 Tactic: 0x35f071de80e3b3c4
[06/15/2022-05:43:22] [V] [TRT] Tactic: 0x35f071de80e3b3c4 Time: 0.18944
[06/15/2022-05:43:22] [V] [TRT] MatMul-9 + ReLU-11 Set Tactic Name: maxwell_scudnn_128x32_sliced1x4_ldg4_relu_exp_interior_nhwc_tn_v1 Tactic: 0x5c024b37b78e77c0
[06/15/2022-05:43:22] [V] [TRT] Tactic: 0x5c024b37b78e77c0 Time: 0.143067
[06/15/2022-05:43:22] [V] [TRT] MatMul-9 + ReLU-11 Set Tactic Name: maxwell_scudnn_128x32_sliced1x4_ldg4_relu_exp_small_nhwc_tn_v1 Tactic: 0x80f932c0b8ce5940
[06/15/2022-05:43:22] [V] [TRT] Tactic: 0x80f932c0b8ce5940 Time: 0.14453
[06/15/2022-05:43:22] [V] [TRT] MatMul-9 + ReLU-11 Set Tactic Name: maxwell_scudnn_128x64_sliced1x2_ldg4_relu_exp_small_nhwc_tn_v1 Tactic: 0x9961ac24fc07a1df
[06/15/2022-05:43:22] [V] [TRT] Tactic: 0x9961ac24fc07a1df Time: 0.189879
[06/15/2022-05:43:22] [V] [TRT] Fastest Tactic: 0x5c024b37b78e77c0 Time: 0.143067
[06/15/2022-05:43:22] [V] [TRT] >>>>>>>>>>>>>>> Chose Runner Type: CaskConvolution Tactic: 0x5c024b37b78e77c0
[06/15/2022-05:43:22] [V] [TRT] =============== Computing costs for 
[06/15/2022-05:43:22] [V] [TRT] *************** Autotuning format combination: Float(1024,1,1,1) -> Float(10,1,1,1) ***************
[06/15/2022-05:43:22] [V] [TRT] --------------- Timing Runner: MatMul-12 (CudaDepthwiseConvolution)
[06/15/2022-05:43:22] [V] [TRT] CudaDepthwiseConvolution has no valid tactics for this config, skipping
[06/15/2022-05:43:22] [V] [TRT] --------------- Timing Runner: MatMul-12 (FusedConvActConvolution)
[06/15/2022-05:43:22] [V] [TRT] FusedConvActConvolution has no valid tactics for this config, skipping
[06/15/2022-05:43:22] [V] [TRT] --------------- Timing Runner: MatMul-12 (CudnnConvolution)
[06/15/2022-05:43:22] [V] [TRT] Tactic: 0x0000000000000000 Time: 0.0661211
[06/15/2022-05:43:22] [V] [TRT] Tactic: 0x0000000000000001 Time: 0.00745326
[06/15/2022-05:43:22] [V] [TRT] Tactic: 0x0000000000000002 Time: 0.285989
[06/15/2022-05:43:22] [V] [TRT] Tactic: 0x0000000000000004 Time: 0.346647
[06/15/2022-05:43:22] [V] [TRT] Tactic: 0x0000000000000005 Time: 0.103303
[06/15/2022-05:43:22] [V] [TRT] Fastest Tactic: 0x0000000000000001 Time: 0.00745326
[06/15/2022-05:43:22] [V] [TRT] --------------- Timing Runner: MatMul-12 (CublasConvolution)
[06/15/2022-05:43:22] [V] [TRT] Tactic: 0x0000000000000000 Time: 0.00737097
[06/15/2022-05:43:22] [V] [TRT] Tactic: 0x0000000000000001 Time: 0.0102998
[06/15/2022-05:43:22] [V] [TRT] Fastest Tactic: 0x0000000000000000 Time: 0.00737097
[06/15/2022-05:43:22] [V] [TRT] --------------- Timing Runner: MatMul-12 (CaskConvolution)
[06/15/2022-05:43:22] [V] [TRT] MatMul-12 Set Tactic Name: maxwell_scudnn_128x32_relu_medium_nn_v1 Tactic: 0x0ebe499388e08286
[06/15/2022-05:43:22] [V] [TRT] Tactic: 0x0ebe499388e08286 Time: 0.0842606
[06/15/2022-05:43:22] [V] [TRT] MatMul-12 Set Tactic Name: maxwell_scudnn_128x32_relu_interior_nn_v0 Tactic: 0x1792ed6b0f1ea883
[06/15/2022-05:43:22] [V] [TRT] Tactic: 0x1792ed6b0f1ea883 Time: 0.0602697
[06/15/2022-05:43:22] [V] [TRT] MatMul-12 Set Tactic Name: maxwell_scudnn_128x128_relu_medium_nn_v1 Tactic: 0x3e787008e11a6129
[06/15/2022-05:43:22] [V] [TRT] Tactic: 0x3e787008e11a6129 Time: 0.0930377
[06/15/2022-05:43:22] [V] [TRT] MatMul-12 Set Tactic Name: maxwell_scudnn_128x64_relu_small_nn_v1 Tactic: 0x474c9edd1ecfbbba
[06/15/2022-05:43:22] [V] [TRT] Tactic: 0x474c9edd1ecfbbba Time: 0.0618789
[06/15/2022-05:43:22] [V] [TRT] MatMul-12 Set Tactic Name: maxwell_scudnn_128x128_relu_small_nn_v0 Tactic: 0x4963fb96b4067e81
[06/15/2022-05:43:22] [V] [TRT] Tactic: 0x4963fb96b4067e81 Time: 0.0898194
[06/15/2022-05:43:22] [V] [TRT] MatMul-12 Set Tactic Name: maxwell_scudnn_128x128_relu_interior_nn_v1 Tactic: 0x49ecad9da64c487b
[06/15/2022-05:43:22] [V] [TRT] Tactic: 0x49ecad9da64c487b Time: 0.0897463
[06/15/2022-05:43:22] [V] [TRT] MatMul-12 Set Tactic Name: maxwell_scudnn_128x64_relu_interior_nn_v0 Tactic: 0x4c5584586319b832
[06/15/2022-05:43:22] [V] [TRT] Tactic: 0x4c5584586319b832 Time: 0.0767269
[06/15/2022-05:43:22] [V] [TRT] MatMul-12 Set Tactic Name: maxwell_scudnn_128x64_relu_medium_nn_v1 Tactic: 0x5c38385751ccb068
[06/15/2022-05:43:22] [V] [TRT] Tactic: 0x5c38385751ccb068 Time: 0.0669501
[06/15/2022-05:43:22] [V] [TRT] MatMul-12 Set Tactic Name: maxwell_scudnn_128x32_relu_small_nn_v0 Tactic: 0x632674f65e3422ae
[06/15/2022-05:43:22] [V] [TRT] Tactic: 0x632674f65e3422ae Time: 0.0629516
[06/15/2022-05:43:22] [V] [TRT] MatMul-12 Set Tactic Name: maxwell_scudnn_128x128_relu_medium_nn_v0 Tactic: 0x8d563cb6e2bd3e46
[06/15/2022-05:43:22] [V] [TRT] Tactic: 0x8d563cb6e2bd3e46 Time: 0.0920137
[06/15/2022-05:43:22] [V] [TRT] MatMul-12 Set Tactic Name: maxwell_scudnn_128x32_relu_interior_nn_v1 Tactic: 0xa4bca1d50cb9f7ec
[06/15/2022-05:43:22] [V] [TRT] Tactic: 0xa4bca1d50cb9f7ec Time: 0.0646583
[06/15/2022-05:43:22] [V] [TRT] MatMul-12 Set Tactic Name: maxwell_scudnn_128x32_relu_medium_nn_v0 Tactic: 0xbd90052d8b47dde9
[06/15/2022-05:43:22] [V] [TRT] Tactic: 0xbd90052d8b47dde9 Time: 0.0680716
[06/15/2022-05:43:22] [V] [TRT] MatMul-12 Set Tactic Name: maxwell_scudnn_128x32_relu_small_nn_v1 Tactic: 0xd00838485d937dc1
[06/15/2022-05:43:22] [V] [TRT] Tactic: 0xd00838485d937dc1 Time: 0.0683642
[06/15/2022-05:43:22] [V] [TRT] MatMul-12 Set Tactic Name: maxwell_scudnn_128x64_relu_medium_nn_v0 Tactic: 0xef1674e9526bef07
[06/15/2022-05:43:22] [V] [TRT] Tactic: 0xef1674e9526bef07 Time: 0.083456
[06/15/2022-05:43:22] [V] [TRT] MatMul-12 Set Tactic Name: maxwell_scudnn_128x64_relu_small_nn_v0 Tactic: 0xf462d2631d68e4d5
[06/15/2022-05:43:22] [V] [TRT] Tactic: 0xf462d2631d68e4d5 Time: 0.0784091
[06/15/2022-05:43:22] [V] [TRT] MatMul-12 Set Tactic Name: maxwell_scudnn_128x128_relu_small_nn_v1 Tactic: 0xfa4db728b7a121ee
[06/15/2022-05:43:22] [V] [TRT] Tactic: 0xfa4db728b7a121ee Time: 0.0891611
[06/15/2022-05:43:22] [V] [TRT] MatMul-12 Set Tactic Name: maxwell_scudnn_128x128_relu_interior_nn_v0 Tactic: 0xfac2e123a5eb1714
[06/15/2022-05:43:22] [V] [TRT] Tactic: 0xfac2e123a5eb1714 Time: 0.0887954
[06/15/2022-05:43:22] [V] [TRT] MatMul-12 Set Tactic Name: maxwell_scudnn_128x64_relu_interior_nn_v1 Tactic: 0xff7bc8e660bee75d
[06/15/2022-05:43:22] [V] [TRT] Tactic: 0xff7bc8e660bee75d Time: 0.0599558
[06/15/2022-05:43:22] [V] [TRT] Fastest Tactic: 0xff7bc8e660bee75d Time: 0.0599558
[06/15/2022-05:43:22] [V] [TRT] >>>>>>>>>>>>>>> Chose Runner Type: CublasConvolution Tactic: 0x0000000000000000
[06/15/2022-05:43:22] [V] [TRT] *************** Autotuning format combination: Float(1024,1,1024,1024) -> Float(10,1,10,10) ***************
[06/15/2022-05:43:22] [V] [TRT] --------------- Timing Runner: MatMul-12 (CublasConvolution)
[06/15/2022-05:43:22] [V] [TRT] CublasConvolution has no valid tactics for this config, skipping
[06/15/2022-05:43:22] [V] [TRT] --------------- Timing Runner: MatMul-12 (CaskConvolution)
[06/15/2022-05:43:22] [V] [TRT] CaskConvolution has no valid tactics for this config, skipping
[06/15/2022-05:43:22] [V] [TRT] =============== Computing costs for 
[06/15/2022-05:43:22] [V] [TRT] *************** Autotuning format combination: Float(10,1,1,1) -> Float(10,1) ***************
[06/15/2022-05:43:22] [V] [TRT] --------------- Timing Runner: reshape_after_MatMul-12 (Shuffle)
[06/15/2022-05:43:22] [V] [TRT] Tactic: 0x0000000000000000 Time: 0.0105737
[06/15/2022-05:43:22] [V] [TRT] Tactic: 0x0000000000000001 Time: 0.0405474
[06/15/2022-05:43:22] [V] [TRT] Fastest Tactic: 0x0000000000000000 Time: 0.0105737
[06/15/2022-05:43:22] [V] [TRT] >>>>>>>>>>>>>>> Chose Runner Type: Shuffle Tactic: 0x0000000000000000
[06/15/2022-05:43:22] [V] [TRT] =============== Computing costs for 
[06/15/2022-05:43:22] [V] [TRT] *************** Autotuning format combination: Float(10,1) -> Float(1,1), Int32(1,1) ***************
[06/15/2022-05:43:22] [V] [TRT] --------------- Timing Runner: Softmax-14 + ArgMax-15 (LogSoftmaxTopK)
[06/15/2022-05:43:22] [V] [TRT] Tactic: 0x00000000000003e9 Time: 0.00590226
[06/15/2022-05:43:22] [V] [TRT] Tactic: 0x00000000000003ea Time: 0.0138439
[06/15/2022-05:43:22] [V] [TRT] Fastest Tactic: 0x00000000000003e9 Time: 0.00590226
[06/15/2022-05:43:22] [V] [TRT] >>>>>>>>>>>>>>> Chose Runner Type: LogSoftmaxTopK Tactic: 0x00000000000003e9
[06/15/2022-05:43:22] [V] [TRT] =============== Computing costs for 
[06/15/2022-05:43:22] [V] [TRT] *************** Autotuning format combination: Int32(1,1) -> Int32(1) ***************
[06/15/2022-05:43:22] [V] [TRT] --------------- Timing Runner: (Unnamed Layer* 32) [Shuffle] (Shuffle)
[06/15/2022-05:43:22] [V] [TRT] Tactic: 0x0000000000000000 Time: 0.0105414
[06/15/2022-05:43:22] [V] [TRT] Tactic: 0x0000000000000001 Time: 0.029472
[06/15/2022-05:43:22] [V] [TRT] Fastest Tactic: 0x0000000000000000 Time: 0.0105414
[06/15/2022-05:43:22] [V] [TRT] >>>>>>>>>>>>>>> Chose Runner Type: Shuffle Tactic: 0x0000000000000000
[06/15/2022-05:43:22] [V] [TRT] Adding reformat layer: Reformatted Input Tensor 0 to Conv-4 + ReLU-5 (tensor-3) from Float(6272,196,14,1) to Float(6272,1,448,32)
[06/15/2022-05:43:22] [V] [TRT] Adding reformat layer: Reformatted Input Tensor 0 to MaxPool-6 (tensor-5) from Float(12544,1,896,64) to Float(12544,196,14,1)
[06/15/2022-05:43:22] [V] [TRT] Formats and tactics selection completed in 1.3987 seconds.
[06/15/2022-05:43:22] [V] [TRT] After reformat layers: 12 layers
[06/15/2022-05:43:22] [V] [TRT] Pre-optimized block assignment.
[06/15/2022-05:43:22] [V] [TRT] Block size 1605632
[06/15/2022-05:43:22] [V] [TRT] Block size 401408
[06/15/2022-05:43:22] [V] [TRT] Block size 802816
[06/15/2022-05:43:22] [V] [TRT] Block size 200704
[06/15/2022-05:43:22] [V] [TRT] Block size 4
[06/15/2022-05:43:22] [V] [TRT] Block size 512
[06/15/2022-05:43:22] [V] [TRT] Block size 4
[06/15/2022-05:43:22] [V] [TRT] Block size 200704
[06/15/2022-05:43:22] [V] [TRT] Block size 1024
[06/15/2022-05:43:22] [V] [TRT] Block size 65536
[06/15/2022-05:43:22] [V] [TRT] Block size 401408
[06/15/2022-05:43:22] [V] [TRT] Block size 802816
[06/15/2022-05:43:22] [V] [TRT] Block size 1073741824
[06/15/2022-05:43:22] [V] [TRT] Total Activation Memory: 1078224392
[06/15/2022-05:43:22] [I] [TRT] Detected 1 inputs and 1 output network tensors.
[06/15/2022-05:43:22] [V] [TRT] Conv-1 + ReLU-2 Set Tactic Name: maxwell_scudnn_128x32_relu_small_nn_v0 Tactic: 0x632674f65e3422ae
[06/15/2022-05:43:22] [V] [TRT] Conv-4 + ReLU-5 Set Tactic Name: maxwell_scudnn_128x32_sliced1x4_ldg4_relu_exp_small_nhwc_tn_v1 Tactic: 0x80f932c0b8ce5940
[06/15/2022-05:43:22] [V] [TRT] MaxPool-6 Set Tactic Name: sm50_xmma_pooling_fw_4d_FP32FP32NCHW_Max Tactic: 0xb59f9cfb90407c92
[06/15/2022-05:43:22] [V] [TRT] Layer: Conv-1 + ReLU-2 Host Persistent: 1664 Device Persistent: 5120 Scratch Memory: 0
[06/15/2022-05:43:22] [V] [TRT] Layer: MaxPool-3 Host Persistent: 0 Device Persistent: 0 Scratch Memory: 0
[06/15/2022-05:43:22] [V] [TRT] Layer: Reformatting CopyNode for Input Tensor 0 to Conv-4 + ReLU-5 Host Persistent: 0 Device Persistent: 0 Scratch Memory: 0
[06/15/2022-05:43:22] [V] [TRT] Layer: Conv-4 + ReLU-5 Host Persistent: 1664 Device Persistent: 1536 Scratch Memory: 0
[06/15/2022-05:43:22] [V] [TRT] Layer: Reformatting CopyNode for Input Tensor 0 to MaxPool-6 Host Persistent: 0 Device Persistent: 0 Scratch Memory: 0
[06/15/2022-05:43:22] [V] [TRT] Layer: MaxPool-6 Host Persistent: 1088 Device Persistent: 0 Scratch Memory: 0
[06/15/2022-05:43:22] [V] [TRT] Layer: Transpose-7 + Reshape-7 + reshape_before_MatMul-9 Host Persistent: 0 Device Persistent: 0 Scratch Memory: 0
[06/15/2022-05:43:22] [V] [TRT] Layer: MatMul-9 + ReLU-11 Host Persistent: 340 Device Persistent: 0 Scratch Memory: 0
[06/15/2022-05:43:22] [V] [TRT] Layer: MatMul-12 Host Persistent: 340 Device Persistent: 0 Scratch Memory: 0
[06/15/2022-05:43:22] [V] [TRT] Layer: reshape_after_MatMul-12 Host Persistent: 0 Device Persistent: 0 Scratch Memory: 0
[06/15/2022-05:43:22] [V] [TRT] Layer: Softmax-14 + ArgMax-15 Host Persistent: 0 Device Persistent: 0 Scratch Memory: 0
[06/15/2022-05:43:22] [V] [TRT] Layer: (Unnamed Layer* 32) [Shuffle] Host Persistent: 0 Device Persistent: 0 Scratch Memory: 0
[06/15/2022-05:43:22] [I] [TRT] Total Host Persistent Memory: 5120
[06/15/2022-05:43:22] [I] [TRT] Total Device Persistent Memory: 6656
[06/15/2022-05:43:22] [I] [TRT] Total Scratch Memory: 0
[06/15/2022-05:43:22] [I] [TRT] [MemUsageStats] Peak memory usage of TRT CPU/GPU memory allocators: CPU 24 MiB, GPU 438 MiB
[06/15/2022-05:43:22] [I] [TRT] [BlockAssignment] Algorithm ShiftNTopDown took 0.052745ms to assign 4 blocks to 12 nodes requiring 2408456 bytes.
[06/15/2022-05:43:22] [V] [TRT] Optimized block assignment.
[06/15/2022-05:43:22] [V] [TRT] Block size 1605632
[06/15/2022-05:43:22] [V] [TRT] Block size 802816
[06/15/2022-05:43:22] [V] [TRT] Block size 4
[06/15/2022-05:43:22] [V] [TRT] Block size 4
[06/15/2022-05:43:22] [I] [TRT] Total Activation Memory: 2408456
[06/15/2022-05:43:22] [V] [TRT] Disabling unused tactic source: CUDNN
[06/15/2022-05:43:22] [V] [TRT] Using cublas as a tactic source
[06/15/2022-05:43:22] [I] [TRT] [MemUsageChange] Init cuBLAS/cuBLASLt: CPU +0, GPU +8, now: CPU 934, GPU 1012 (MiB)
[06/15/2022-05:43:22] [V] [TRT] Engine generation completed in 1.73457 seconds.
[06/15/2022-05:43:22] [V] [TRT] Deleting timing cache: 34 entries, served 0 hits since creation.
[06/15/2022-05:43:22] [V] [TRT] Engine Layer Information:
Layer(CaskConvolution): Conv-1 + ReLU-2, Tactic: 0x632674f65e3422ae, tensor-0[Float(-2,1,28,28)] -> tensor-2[Float(-2,32,28,28)]
Layer(TiledPooling): MaxPool-3, Tactic: 0x0000000000630101, tensor-2[Float(-2,32,28,28)] -> tensor-3[Float(-2,32,14,14)]
Layer(Reformat): Reformatting CopyNode for Input Tensor 0 to Conv-4 + ReLU-5, Tactic: 0x00000000000003e8, tensor-3[Float(-2,32,14,14)] -> Reformatted Input Tensor 0 to Conv-4 + ReLU-5[Float(-2,32,14,14)]
Layer(CaskConvolution): Conv-4 + ReLU-5, Tactic: 0x80f932c0b8ce5940, Reformatted Input Tensor 0 to Conv-4 + ReLU-5[Float(-2,32,14,14)] -> tensor-5[Float(-2,64,14,14)]
Layer(Reformat): Reformatting CopyNode for Input Tensor 0 to MaxPool-6, Tactic: 0x00000000000003e8, tensor-5[Float(-2,64,14,14)] -> Reformatted Input Tensor 0 to MaxPool-6[Float(-2,64,14,14)]
Layer(CaskPooling): MaxPool-6, Tactic: 0xb59f9cfb90407c92, Reformatted Input Tensor 0 to MaxPool-6[Float(-2,64,14,14)] -> tensor-6[Float(-2,64,7,7)]
Layer(Shuffle): Transpose-7 + Reshape-7 + reshape_before_MatMul-9, Tactic: 0x0000000000000000, tensor-6[Float(-2,64,7,7)] -> reshape_before_MatMul-9_out_region[Float(-2,3136,1,1)]
Layer(CublasConvolution): MatMul-9 + ReLU-11, Tactic: 0x0000000000000000, reshape_before_MatMul-9_out_region[Float(-2,3136,1,1)] -> ReLU-11_out_tensor[Float(-2,1024,1,1)]
Layer(CublasConvolution): MatMul-12, Tactic: 0x0000000000000000, ReLU-11_out_tensor[Float(-2,1024,1,1)] -> MatMul-12_out_region[Float(-2,10,1,1)]
Layer(NoOp): reshape_after_MatMul-12, Tactic: 0x0000000000000000, MatMul-12_out_region[Float(-2,10,1,1)] -> tensor-13[Float(-2,10)]
Layer(LogSoftmaxTopK): Softmax-14 + ArgMax-15, Tactic: 0x00000000000003e9, tensor-13[Float(-2,10)] -> (Unnamed Layer* 28) [TopK]_output_1[Float(-2,1)], (Unnamed Layer* 28) [TopK]_output_2[Int32(-2,1)]
Layer(NoOp): (Unnamed Layer* 32) [Shuffle], Tactic: 0x0000000000000000, (Unnamed Layer* 28) [TopK]_output_2[Int32(-2,1)] -> tensor-15[Int32(-2)]
[06/15/2022-05:43:22] [I] [TRT] [MemUsageChange] TensorRT-managed allocation in building engine: CPU +12, GPU +13, now: CPU 12, GPU 13 (MiB)
[06/15/2022-05:43:22] [I] Engine built in 2.61442 sec.
[06/15/2022-05:43:22] [I] [TRT] [MemUsageChange] Init CUDA: CPU +0, GPU +0, now: CPU 915, GPU 972 (MiB)
[06/15/2022-05:43:22] [I] [TRT] Loaded engine size: 12 MiB
[06/15/2022-05:43:22] [V] [TRT] Using cublas as a tactic source
[06/15/2022-05:43:22] [I] [TRT] [MemUsageChange] Init cuBLAS/cuBLASLt: CPU +0, GPU +10, now: CPU 915, GPU 996 (MiB)
[06/15/2022-05:43:22] [V] [TRT] Deserialization required 2912 microseconds.
[06/15/2022-05:43:22] [I] [TRT] [MemUsageChange] TensorRT-managed allocation in engine deserialization: CPU +0, GPU +12, now: CPU 0, GPU 12 (MiB)
[06/15/2022-05:43:22] [I] Engine deserialized in 0.00329095 sec.
[06/15/2022-05:43:22] [V] [TRT] Using cublas as a tactic source
[06/15/2022-05:43:22] [I] [TRT] [MemUsageChange] Init cuBLAS/cuBLASLt: CPU +1, GPU +8, now: CPU 916, GPU 996 (MiB)
[06/15/2022-05:43:22] [V] [TRT] Total per-runner device persistent memory is 6656
[06/15/2022-05:43:22] [V] [TRT] Total per-runner host persistent memory is 5120
[06/15/2022-05:43:22] [V] [TRT] Allocated activation device memory of size 2409472
[06/15/2022-05:43:22] [I] [TRT] [MemUsageChange] TensorRT-managed allocation in IExecutionContext creation: CPU +0, GPU +2, now: CPU 0, GPU 14 (MiB)
[06/15/2022-05:43:22] [I] Using random values for input tensor-0
[06/15/2022-05:43:22] [I] Created input binding for tensor-0 with dimensions 4x1x28x28
[06/15/2022-05:43:22] [I] Using random values for output tensor-15
[06/15/2022-05:43:22] [I] Created output binding for tensor-15 with dimensions 4
[06/15/2022-05:43:22] [I] Starting inference
[06/15/2022-05:43:25] [I] Warmup completed 1244 queries over 200 ms
[06/15/2022-05:43:25] [I] Timing trace has 17577 queries over 3.00043 s
[06/15/2022-05:43:25] [I] 
[06/15/2022-05:43:25] [I] === Trace details ===
[06/15/2022-05:43:25] [I] Trace averages of 10 runs:
[06/15/2022-05:43:25] [I] Average on 10 runs - GPU latency: 0.173466 ms - Host latency: 0.180208 ms (enqueue 0.0358612 ms)
[06/15/2022-05:43:25] [I] Average on 10 runs - GPU latency: 0.154726 ms - Host latency: 0.161252 ms (enqueue 0.0397171 ms)
[06/15/2022-05:43:25] [I] Average on 10 runs - GPU latency: 0.155646 ms - Host latency: 0.162393 ms (enqueue 0.03918 ms)
[06/15/2022-05:43:25] [I] Average on 10 runs - GPU latency: 0.155545 ms - Host latency: 0.165645 ms (enqueue 0.0487701 ms)
[06/15/2022-05:43:25] [I] Average on 10 runs - GPU latency: 0.155339 ms - Host latency: 0.162662 ms (enqueue 0.0469772 ms)
[06/15/2022-05:43:25] [I] Average on 10 runs - GPU latency: 0.154932 ms - Host latency: 0.16312 ms (enqueue 0.0500839 ms)
[06/15/2022-05:43:25] [I] Average on 10 runs - GPU latency: 0.154727 ms - Host latency: 0.161842 ms (enqueue 0.0436279 ms)
[06/15/2022-05:43:25] [I] Average on 10 runs - GPU latency: 0.154419 ms - Host latency: 0.160893 ms (enqueue 0.0397614 ms)
[06/15/2022-05:43:25] [I] Average on 10 runs - GPU latency: 0.154726 ms - Host latency: 0.161642 ms (enqueue 0.0398361 ms)
[06/15/2022-05:43:25] [I] Average on 10 runs - GPU latency: 0.154523 ms - Host latency: 0.16113 ms (enqueue 0.0405609 ms)
[06/15/2022-05:43:25] [I] Average on 10 runs - GPU latency: 0.154622 ms - Host latency: 0.161162 ms (enqueue 0.0397156 ms)
[06/15/2022-05:43:25] [I] Average on 10 runs - GPU latency: 0.155032 ms - Host latency: 0.161841 ms (enqueue 0.0398376 ms)
[06/15/2022-05:43:25] [I] Average on 10 runs - GPU latency: 0.154932 ms - Host latency: 0.161374 ms (enqueue 0.0397079 ms)
[06/15/2022-05:43:25] [I] Average on 10 runs - GPU latency: 0.155957 ms - Host latency: 0.16284 ms (enqueue 0.0398926 ms)
[06/15/2022-05:43:25] [I] Average on 10 runs - GPU latency: 0.15616 ms - Host latency: 0.164114 ms (enqueue 0.0463959 ms)
[06/15/2022-05:43:25] [I] Average on 10 runs - GPU latency: 0.154826 ms - Host latency: 0.162772 ms (enqueue 0.0498657 ms)
[06/15/2022-05:43:25] [I] Average on 10 runs - GPU latency: 0.154315 ms - Host latency: 0.16071 ms (enqueue 0.0415756 ms)
[06/15/2022-05:43:25] [I] Average on 10 runs - GPU latency: 0.15493 ms - Host latency: 0.163115 ms (enqueue 0.0499207 ms)
[06/15/2022-05:43:25] [I] Average on 10 runs - GPU latency: 0.154727 ms - Host latency: 0.162756 ms (enqueue 0.0500473 ms)
[06/15/2022-05:43:25] [I] Average on 10 runs - GPU latency: 0.154726 ms - Host latency: 0.161638 ms (enqueue 0.043689 ms)
[06/15/2022-05:43:25] [I] Average on 10 runs - GPU latency: 0.154829 ms - Host latency: 0.161391 ms (enqueue 0.03983 ms)
[06/15/2022-05:43:25] [I] Average on 10 runs - GPU latency: 0.154727 ms - Host latency: 0.161427 ms (enqueue 0.0399811 ms)
[06/15/2022-05:43:25] [I] Average on 10 runs - GPU latency: 0.155237 ms - Host latency: 0.161861 ms (enqueue 0.0408783 ms)
[06/15/2022-05:43:25] [I] Average on 10 runs - GPU latency: 0.155136 ms - Host latency: 0.161551 ms (enqueue 0.0395966 ms)
[06/15/2022-05:43:25] [I] Average on 10 runs - GPU latency: 0.156058 ms - Host latency: 0.162451 ms (enqueue 0.0397827 ms)
[06/15/2022-05:43:25] [I] Average on 10 runs - GPU latency: 0.154727 ms - Host latency: 0.161194 ms (enqueue 0.0397339 ms)
[06/15/2022-05:43:25] [I] Average on 10 runs - GPU latency: 0.154521 ms - Host latency: 0.161369 ms (enqueue 0.0414413 ms)
[06/15/2022-05:43:25] [I] Average on 10 runs - GPU latency: 0.155402 ms - Host latency: 0.161905 ms (enqueue 0.0406952 ms)
[06/15/2022-05:43:25] [I] Average on 10 runs - GPU latency: 0.154419 ms - Host latency: 0.160948 ms (enqueue 0.0404388 ms)
[06/15/2022-05:43:25] [I] Average on 10 runs - GPU latency: 0.154933 ms - Host latency: 0.161436 ms (enqueue 0.0395981 ms)
[06/15/2022-05:43:25] [I] Average on 10 runs - GPU latency: 0.154826 ms - Host latency: 0.161264 ms (enqueue 0.039447 ms)
[06/15/2022-05:43:25] [I] Average on 10 runs - GPU latency: 0.155136 ms - Host latency: 0.162035 ms (enqueue 0.0436401 ms)
[06/15/2022-05:43:25] [I] Average on 10 runs - GPU latency: 0.155034 ms - Host latency: 0.162152 ms (enqueue 0.0455276 ms)
[06/15/2022-05:43:25] [I] Average on 10 runs - GPU latency: 0.155235 ms - Host latency: 0.162964 ms (enqueue 0.0481201 ms)
[06/15/2022-05:43:25] [I] Average on 10 runs - GPU latency: 0.155446 ms - Host latency: 0.162163 ms (enqueue 0.0419113 ms)
[06/15/2022-05:43:25] [I] Average on 10 runs - GPU latency: 0.154825 ms - Host latency: 0.161383 ms (enqueue 0.0401001 ms)
[06/15/2022-05:43:25] [I] Average on 10 runs - GPU latency: 0.154724 ms - Host latency: 0.162207 ms (enqueue 0.0458679 ms)
[06/15/2022-05:43:25] [I] Average on 10 runs - GPU latency: 0.154422 ms - Host latency: 0.161365 ms (enqueue 0.0439575 ms)
[06/15/2022-05:43:25] [I] Average on 10 runs - GPU latency: 0.155753 ms - Host latency: 0.163239 ms (enqueue 0.048999 ms)
[06/15/2022-05:43:25] [I] Average on 10 runs - GPU latency: 0.15462 ms - Host latency: 0.16261 ms (enqueue 0.0495026 ms)
[06/15/2022-05:43:25] [I] Average on 10 runs - GPU latency: 0.154724 ms - Host latency: 0.162189 ms (enqueue 0.0456879 ms)
[06/15/2022-05:43:25] [I] Average on 10 runs - GPU latency: 0.154828 ms - Host latency: 0.162839 ms (enqueue 0.0516937 ms)
[06/15/2022-05:43:25] [I] Average on 10 runs - GPU latency: 0.155026 ms - Host latency: 0.162875 ms (enqueue 0.0494598 ms)
[06/15/2022-05:43:25] [I] Average on 10 runs - GPU latency: 0.15704 ms - Host latency: 0.164862 ms (enqueue 0.0509247 ms)
[06/15/2022-05:43:25] [I] Average on 10 runs - GPU latency: 0.155148 ms - Host latency: 0.162042 ms (enqueue 0.0427338 ms)
[06/15/2022-05:43:25] [I] Average on 10 runs - GPU latency: 0.154315 ms - Host latency: 0.160706 ms (enqueue 0.0396149 ms)
[06/15/2022-05:43:25] [I] Average on 10 runs - GPU latency: 0.154523 ms - Host latency: 0.161438 ms (enqueue 0.0403809 ms)
[06/15/2022-05:43:25] [I] Average on 10 runs - GPU latency: 0.15452 ms - Host latency: 0.161163 ms (enqueue 0.0400879 ms)
[06/15/2022-05:43:25] [I] Average on 10 runs - GPU latency: 0.155338 ms - Host latency: 0.163287 ms (enqueue 0.0492279 ms)
[06/15/2022-05:43:25] [I] Average on 10 runs - GPU latency: 0.154825 ms - Host latency: 0.161221 ms (enqueue 0.0403564 ms)
[06/15/2022-05:43:25] [I] Average on 10 runs - GPU latency: 0.154312 ms - Host latency: 0.16084 ms (enqueue 0.0403259 ms)
[06/15/2022-05:43:25] [I] Average on 10 runs - GPU latency: 0.154724 ms - Host latency: 0.161237 ms (enqueue 0.0410187 ms)
[06/15/2022-05:43:25] [I] Average on 10 runs - GPU latency: 0.155539 ms - Host latency: 0.162146 ms (enqueue 0.0399139 ms)
[06/15/2022-05:43:25] [I] Average on 10 runs - GPU latency: 0.155951 ms - Host latency: 0.162329 ms (enqueue 0.0393311 ms)
[06/15/2022-05:43:25] [I] Average on 10 runs - GPU latency: 0.15452 ms - Host latency: 0.162537 ms (enqueue 0.0492188 ms)
[06/15/2022-05:43:25] [I] Average on 10 runs - GPU latency: 0.155133 ms - Host latency: 0.161465 ms (enqueue 0.0412323 ms)
[06/15/2022-05:43:25] [I] Average on 10 runs - GPU latency: 0.154825 ms - Host latency: 0.161133 ms (enqueue 0.0390991 ms)
[06/15/2022-05:43:25] [I] Average on 10 runs - GPU latency: 0.154929 ms - Host latency: 0.162552 ms (enqueue 0.045224 ms)
[06/15/2022-05:43:25] [I] Average on 10 runs - GPU latency: 0.154825 ms - Host latency: 0.163028 ms (enqueue 0.0495422 ms)
[06/15/2022-05:43:25] [I] Average on 10 runs - GPU latency: 0.154523 ms - Host latency: 0.161932 ms (enqueue 0.0465881 ms)
[06/15/2022-05:43:25] [I] Average on 10 runs - GPU latency: 0.154309 ms - Host latency: 0.16192 ms (enqueue 0.0486725 ms)
[06/15/2022-05:43:25] [I] Average on 10 runs - GPU latency: 0.15524 ms - Host latency: 0.163629 ms (enqueue 0.0503479 ms)
[06/15/2022-05:43:25] [I] Average on 10 runs - GPU latency: 0.156464 ms - Host latency: 0.165497 ms (enqueue 0.050119 ms)
[06/15/2022-05:43:25] [I] Average on 10 runs - GPU latency: 0.155344 ms - Host latency: 0.162952 ms (enqueue 0.050708 ms)
[06/15/2022-05:43:25] [I] Average on 10 runs - GPU latency: 0.154721 ms - Host latency: 0.162158 ms (enqueue 0.0460236 ms)
[06/15/2022-05:43:25] [I] Average on 10 runs - GPU latency: 0.155139 ms - Host latency: 0.163077 ms (enqueue 0.0495392 ms)
[06/15/2022-05:43:25] [I] Average on 10 runs - GPU latency: 0.154633 ms - Host latency: 0.161984 ms (enqueue 0.0461304 ms)
[06/15/2022-05:43:25] [I] Average on 10 runs - GPU latency: 0.15462 ms - Host latency: 0.162665 ms (enqueue 0.0514801 ms)
[06/15/2022-05:43:25] [I] Average on 10 runs - GPU latency: 0.154938 ms - Host latency: 0.161765 ms (enqueue 0.0467102 ms)
[06/15/2022-05:43:25] [I] Average on 10 runs - GPU latency: 0.154623 ms - Host latency: 0.162045 ms (enqueue 0.0492584 ms)
[06/15/2022-05:43:25] [I] Average on 10 runs - GPU latency: 0.154626 ms - Host latency: 0.161322 ms (enqueue 0.0463348 ms)
[06/15/2022-05:43:25] [I] Average on 10 runs - GPU latency: 0.155746 ms - Host latency: 0.162408 ms (enqueue 0.049469 ms)
[06/15/2022-05:43:25] [I] Average on 10 runs - GPU latency: 0.154929 ms - Host latency: 0.161731 ms (enqueue 0.0458618 ms)
[06/15/2022-05:43:25] [I] Average on 10 runs - GPU latency: 0.156162 ms - Host latency: 0.162863 ms (enqueue 0.0460449 ms)
[06/15/2022-05:43:25] [I] Average on 10 runs - GPU latency: 0.155099 ms - Host latency: 0.161963 ms (enqueue 0.0467957 ms)
