cookbook/08-Tool/trtexec/result-FP16.txt
[03/07/2022-05:05:53] [V] [TRT] *************** Autotuning Reformat:Float(784,784,28,1) -> Float(784,1,28,1) ***************
[03/07/2022-05:05:53] [V] [TRT] --------------- Timing Runner: Optimizer Reformat (Reformat)
[03/07/2022-05:05:53] [V] [TRT] Tactic: 1002 Time: 0.004392
[03/07/2022-05:05:53] [V] [TRT] Tactic: 0 Time: 0.003256
[03/07/2022-05:05:53] [V] [TRT] Fastest Tactic: 0 Time: 0.003256
[03/07/2022-05:05:53] [V] [TRT] *************** Autotuning Reformat:Float(784,784,28,1) -> Half(784,784,28,1) ***************
[03/07/2022-05:05:53] [V] [TRT] --------------- Timing Runner: Optimizer Reformat (Reformat)
[03/07/2022-05:05:53] [V] [TRT] Tactic: 1002 Time: 0.00436
[03/07/2022-05:05:53] [V] [TRT] Tactic: 0 Time: 0.004476
[03/07/2022-05:05:53] [V] [TRT] Fastest Tactic: 1002 Time: 0.00436
[03/07/2022-05:05:53] [V] [TRT] *************** Autotuning format combination: Float(784,784,28,1) -> Float(25088,784,28,1) ***************
[03/07/2022-05:05:53] [V] [TRT] --------------- Timing Runner: Conv__25 + Relu (CudaDepthwiseConvolution)
[03/07/2022-05:05:53] [V] [TRT] CudaDepthwiseConvolution has no valid tactics for this config, skipping
[03/07/2022-05:05:53] [V] [TRT] --------------- Timing Runner: Conv__25 + Relu (FusedConvActConvolution)
[03/07/2022-05:05:53] [V] [TRT] FusedConvActConvolution has no valid tactics for this config, skipping
[03/07/2022-05:05:53] [V] [TRT] --------------- Timing Runner: Conv__25 + Relu (CudnnConvolution)
[03/07/2022-05:05:53] [V] [TRT] Tactic: 0 Time: 0.016964
[03/07/2022-05:05:53] [V] [TRT] Tactic: 1 Time: 0.019576
[03/07/2022-05:05:53] [V] [TRT] Tactic: 2 Time: 0.023124
[03/07/2022-05:05:53] [V] [TRT] Tactic: 4 Time: 0.043392
[03/07/2022-05:05:53] [V] [TRT] Tactic: 5 Time: 0.046552
[03/07/2022-05:05:53] [V] [TRT] Fastest Tactic: 0 Time: 0.016964
[03/07/2022-05:05:53] [V] [TRT] --------------- Timing Runner: Conv__25 + Relu (CaskConvolution)
[03/07/2022-05:05:53] [V] [TRT] Conv__25 + Relu Set Tactic Name: maxwell_scudnn_128x32_relu_medium_nn_v1 Tactic: 1062367460111450758
[03/07/2022-05:05:53] [V] [TRT] Tactic: 1062367460111450758 Time: 0.01094
[03/07/2022-05:05:53] [V] [TRT] Conv__25 + Relu Set Tactic Name: maxwell_scudnn_128x32_relu_large_nn_v0 Tactic: 1754984623894446479
[03/07/2022-05:05:53] [V] [TRT] Tactic: 1754984623894446479 Time: 0.008636
[03/07/2022-05:05:53] [V] [TRT] Conv__25 + Relu Set Tactic Name: maxwell_scudnn_128x128_relu_large_nn_v0 Tactic: 3611739942397549984
[03/07/2022-05:05:53] [V] [TRT] Tactic: 3611739942397549984 Time: 0.014696
[03/07/2022-05:05:53] [V] [TRT] Conv__25 + Relu Set Tactic Name: maxwell_scudnn_128x64_relu_large_nn_v1 Tactic: 4337000649858996379
[03/07/2022-05:05:53] [V] [TRT] Tactic: 4337000649858996379 Time: 0.011404
[03/07/2022-05:05:53] [V] [TRT] Conv__25 + Relu Set Tactic Name: maxwell_scudnn_128x128_relu_medium_nn_v1 Tactic: 4501471010995462441
[03/07/2022-05:05:53] [V] [TRT] Tactic: 4501471010995462441 Time: 0.013812
[03/07/2022-05:05:53] [V] [TRT] Conv__25 + Relu Set Tactic Name: maxwell_scudnn_128x64_relu_small_nn_v1 Tactic: 5137655947464784826
[03/07/2022-05:05:53] [V] [TRT] Tactic: 5137655947464784826 Time: 0.010276
[03/07/2022-05:05:53] [V] [TRT] Conv__25 + Relu Set Tactic Name: maxwell_scudnn_128x128_relu_small_nn_v0 Tactic: 5288347012147084929
[03/07/2022-05:05:53] [V] [TRT] Tactic: 5288347012147084929 Time: 0.014064
[03/07/2022-05:05:53] [V] [TRT] Conv__25 + Relu Set Tactic Name: maxwell_scudnn_128x64_relu_medium_nn_v1 Tactic: 6645123197870846056
[03/07/2022-05:05:53] [V] [TRT] Tactic: 6645123197870846056 Time: 0.010968
[03/07/2022-05:05:53] [V] [TRT] Conv__25 + Relu Set Tactic Name: maxwell_scudnn_128x32_relu_small_nn_v0 Tactic: 7144526460361122478
[03/07/2022-05:05:53] [V] [TRT] Tactic: 7144526460361122478 Time: 0.008372
[03/07/2022-05:05:53] [V] [TRT] Conv__25 + Relu Set Tactic Name: maxwell_scudnn_128x128_relu_large_nn_v1 Tactic: -9137461792520977713
[03/07/2022-05:05:53] [V] [TRT] Tactic: -9137461792520977713 Time: 0.01472
[03/07/2022-05:05:53] [V] [TRT] Conv__25 + Relu Set Tactic Name: maxwell_scudnn_128x128_relu_medium_nn_v0 Tactic: -8262349710178828730
[03/07/2022-05:05:53] [V] [TRT] Tactic: -8262349710178828730 Time: 0.014584
[03/07/2022-05:05:53] [V] [TRT] Conv__25 + Relu Set Tactic Name: maxwell_scudnn_128x64_relu_large_nn_v0 Tactic: -8133971918129952780
[03/07/2022-05:05:53] [V] [TRT] Tactic: -8133971918129952780 Time: 0.011672
[03/07/2022-05:05:53] [V] [TRT] Conv__25 + Relu Set Tactic Name: maxwell_scudnn_128x32_relu_large_nn_v1 Tactic: -6092040395344634144
[03/07/2022-05:05:53] [V] [TRT] Tactic: -6092040395344634144 Time: 0.011616
[03/07/2022-05:05:53] [V] [TRT] Conv__25 + Relu Set Tactic Name: maxwell_scudnn_128x32_relu_medium_nn_v0 Tactic: -4787320710726427159
[03/07/2022-05:05:53] [V] [TRT] Tactic: -4787320710726427159 Time: 0.008576
[03/07/2022-05:05:53] [V] [TRT] Conv__25 + Relu Set Tactic Name: maxwell_scudnn_128x32_relu_small_nn_v1 Tactic: -3456450830548107839
[03/07/2022-05:05:53] [V] [TRT] Tactic: -3456450830548107839 Time: 0.00978
[03/07/2022-05:05:53] [V] [TRT] Conv__25 + Relu Set Tactic Name: maxwell_scudnn_128x64_relu_medium_nn_v0 Tactic: -1218658103698133241
[03/07/2022-05:05:53] [V] [TRT] Tactic: -1218658103698133241 Time: 0.01104
[03/07/2022-05:05:53] [V] [TRT] Conv__25 + Relu Set Tactic Name: maxwell_scudnn_128x64_relu_small_nn_v0 Tactic: -836875257600482091
[03/07/2022-05:05:53] [V] [TRT] Tactic: -836875257600482091 Time: 0.010556
[03/07/2022-05:05:53] [V] [TRT] Conv__25 + Relu Set Tactic Name: maxwell_scudnn_128x128_relu_small_nn_v1 Tactic: -410470605513481746
[03/07/2022-05:05:53] [V] [TRT] Tactic: -410470605513481746 Time: 0.013436
[03/07/2022-05:05:53] [V] [TRT] Fastest Tactic: 7144526460361122478 Time: 0.008372
[03/07/2022-05:05:53] [V] [TRT] >>>>>>>>>>>>>>> Chose Runner Type: CaskConvolution Tactic: 7144526460361122478
[03/07/2022-05:05:53] [V] [TRT] *************** Autotuning format combination: Float(784,1,28,1) -> Float(25088,1,896,32) ***************
[03/07/2022-05:05:53] [V] [TRT] --------------- Timing Runner: Conv__25 + Relu (CudnnConvolution)
[03/07/2022-05:05:53] [V] [TRT] CudnnConvolution has no valid tactics for this config, skipping
[03/07/2022-05:05:53] [V] [TRT] --------------- Timing Runner: Conv__25 + Relu (CaskConvolution)
[03/07/2022-05:05:53] [V] [TRT] CaskConvolution has no valid tactics for this config, skipping
[03/07/2022-05:05:53] [V] [TRT] *************** Autotuning format combination: Half(784,784,28,1) -> Half(25088,784,28,1) ***************
[03/07/2022-05:05:53] [V] [TRT] --------------- Timing Runner: Conv__25 + Relu (CudnnConvolution)
[03/07/2022-05:05:53] [V] [TRT] Tactic: 0 Time: 0.017296
[03/07/2022-05:05:53] [V] [TRT] Tactic: 1 Time: 0.017464
[03/07/2022-05:05:53] [V] [TRT] Tactic: 2 Time: 0.032952
[03/07/2022-05:05:53] [V] [TRT] Tactic: 4 Time: 0.044288
[03/07/2022-05:05:53] [V] [TRT] Tactic: 5 Time: 0.04748
[03/07/2022-05:05:53] [V] [TRT] Fastest Tactic: 0 Time: 0.017296
[03/07/2022-05:05:53] [V] [TRT] --------------- Timing Runner: Conv__25 + Relu (CaskConvolution)
[03/07/2022-05:05:53] [V] [TRT] CaskConvolution has no valid tactics for this config, skipping
[03/07/2022-05:05:53] [V] [TRT] >>>>>>>>>>>>>>> Chose Runner Type: CudnnConvolution Tactic: 0
[03/07/2022-05:05:53] [V] [TRT] *************** Autotuning Reformat:Float(25088,784,28,1) -> Half(25088,784,28,1) ***************
[03/07/2022-05:05:53] [V] [TRT] --------------- Timing Runner: Optimizer Reformat (Reformat)
[03/07/2022-05:05:53] [V] [TRT] Tactic: 1002 Time: 0.007484
[03/07/2022-05:05:53] [V] [TRT] Tactic: 0 Time: 0.006472
[03/07/2022-05:05:53] [V] [TRT] Fastest Tactic: 0 Time: 0.006472
[03/07/2022-05:05:53] [V] [TRT] *************** Autotuning Reformat:Float(25088,1,896,32) -> Float(25088,784,28,1) ***************
[03/07/2022-05:05:53] [V] [TRT] --------------- Timing Runner: Optimizer Reformat (Reformat)
[03/07/2022-05:05:53] [V] [TRT] Tactic: 1002 Time: 0.0108
[03/07/2022-05:05:53] [V] [TRT] Tactic: 0 Time: 0.007432
[03/07/2022-05:05:53] [V] [TRT] Fastest Tactic: 0 Time: 0.007432
[03/07/2022-05:05:53] [V] [TRT] *************** Autotuning Reformat:Float(25088,1,896,32) -> Half(25088,784,28,1) ***************
[03/07/2022-05:05:53] [V] [TRT] --------------- Timing Runner: Optimizer Reformat (Reformat)
[03/07/2022-05:05:53] [V] [TRT] Tactic: 1002 Time: 0.006848
[03/07/2022-05:05:53] [V] [TRT] Tactic: 0 Time: 0.007532
[03/07/2022-05:05:53] [V] [TRT] Fastest Tactic: 1002 Time: 0.006848
[03/07/2022-05:05:53] [V] [TRT] *************** Autotuning Reformat:Half(25088,784,28,1) -> Float(25088,784,28,1) ***************
[03/07/2022-05:05:53] [V] [TRT] --------------- Timing Runner: Optimizer Reformat (Reformat)
[03/07/2022-05:05:53] [V] [TRT] Tactic: 1002 Time: 0.008544
[03/07/2022-05:05:53] [V] [TRT] Tactic: 0 Time: 0.005564
[03/07/2022-05:05:53] [V] [TRT] Fastest Tactic: 0 Time: 0.005564
[03/07/2022-05:05:53] [V] [TRT] *************** Autotuning format combination: Float(25088,784,28,1) -> Float(6272,196,14,1) ***************
[03/07/2022-05:05:53] [V] [TRT] --------------- Timing Runner: MaxPool2d (TiledPooling)
[03/07/2022-05:05:53] [V] [TRT] Tactic: 5505281 Time: 0.0085
[03/07/2022-05:05:53] [V] [TRT] Tactic: 5570817 Time: 0.005644
[03/07/2022-05:05:53] [V] [TRT] Tactic: 5636353 Time: 0.005188
[03/07/2022-05:05:54] [V] [TRT] Tactic: 5701889 Time: 0.005028
[03/07/2022-05:05:54] [V] [TRT] Tactic: 5767425 Time: 0.005048
[03/07/2022-05:05:54] [V] [TRT] Tactic: 5832961 Time: 0.005088
[03/07/2022-05:05:54] [V] [TRT] Tactic: 5898497 Time: 0.005156
[03/07/2022-05:05:54] [V] [TRT] Tactic: 5964033 Time: 0.004096
[03/07/2022-05:05:54] [V] [TRT] Tactic: 6029569 Time: 0.00512
[03/07/2022-05:05:54] [V] [TRT] Tactic: 6095105 Time: 0.004096
[03/07/2022-05:05:54] [V] [TRT] Tactic: 6160641 Time: 0.004076
[03/07/2022-05:05:54] [V] [TRT] Tactic: 6226177 Time: 0.004032
[03/07/2022-05:05:54] [V] [TRT] Tactic: 6291713 Time: 0.004076
[03/07/2022-05:05:54] [V] [TRT] Tactic: 6357249 Time: 0.004
[03/07/2022-05:05:54] [V] [TRT] Tactic: 6422785 Time: 0.00402
[03/07/2022-05:05:54] [V] [TRT] Tactic: 6488321 Time: 0.0032
[03/07/2022-05:05:54] [V] [TRT] Fastest Tactic: 6488321 Time: 0.0032
[03/07/2022-05:05:54] [V] [TRT] --------------- Timing Runner: MaxPool2d (CudnnPooling)
[03/07/2022-05:05:54] [V] [TRT] Tactic: -1 Time: 0.004096
[03/07/2022-05:05:54] [V] [TRT] Fastest Tactic: -1 Time: 0.004096
[03/07/2022-05:05:54] [V] [TRT] >>>>>>>>>>>>>>> Chose Runner Type: TiledPooling Tactic: 6488321
[03/07/2022-05:05:54] [V] [TRT] *************** Autotuning format combination: Half(25088,784,28,1) -> Half(6272,196,14,1) ***************
[03/07/2022-05:05:54] [V] [TRT] --------------- Timing Runner: MaxPool2d (TiledPooling)
[03/07/2022-05:05:54] [V] [TRT] TiledPooling has no valid tactics for this config, skipping
[03/07/2022-05:05:54] [V] [TRT] --------------- Timing Runner: MaxPool2d (CudnnPooling)
[03/07/2022-05:05:54] [V] [TRT] Tactic: -1 Time: 0.004096
[03/07/2022-05:05:54] [V] [TRT] Fastest Tactic: -1 Time: 0.004096
[03/07/2022-05:05:54] [V] [TRT] >>>>>>>>>>>>>>> Chose Runner Type: CudnnPooling Tactic: -1
[03/07/2022-05:05:54] [V] [TRT] *************** Autotuning Reformat:Float(6272,196,14,1) -> Float(6272,1,448,32) ***************
[03/07/2022-05:05:54] [V] [TRT] --------------- Timing Runner: Optimizer Reformat (Reformat)
[03/07/2022-05:05:54] [V] [TRT] Tactic: 1002 Time: 0.007168
[03/07/2022-05:05:54] [V] [TRT] Tactic: 0 Time: 0.004288
[03/07/2022-05:05:54] [V] [TRT] Fastest Tactic: 0 Time: 0.004288
[03/07/2022-05:05:54] [V] [TRT] *************** Autotuning Reformat:Float(6272,196,14,1) -> Half(6272,196,14,1) ***************
[03/07/2022-05:05:54] [V] [TRT] --------------- Timing Runner: Optimizer Reformat (Reformat)
[03/07/2022-05:05:54] [V] [TRT] Tactic: 1002 Time: 0.022528
[03/07/2022-05:05:54] [V] [TRT] Tactic: 0 Time: 0.004352
[03/07/2022-05:05:54] [V] [TRT] Fastest Tactic: 0 Time: 0.004352
[03/07/2022-05:05:54] [V] [TRT] *************** Autotuning Reformat:Float(6272,1,448,32) -> Float(6272,196,14,1) ***************
[03/07/2022-05:05:54] [V] [TRT] --------------- Timing Runner: Optimizer Reformat (Reformat)
[03/07/2022-05:05:54] [V] [TRT] Tactic: 1002 Time: 0.00748
[03/07/2022-05:05:54] [V] [TRT] Tactic: 0 Time: 0.004476
[03/07/2022-05:05:54] [V] [TRT] Fastest Tactic: 0 Time: 0.004476
[03/07/2022-05:05:54] [V] [TRT] *************** Autotuning Reformat:Float(6272,1,448,32) -> Half(6272,196,14,1) ***************
[03/07/2022-05:05:54] [V] [TRT] --------------- Timing Runner: Optimizer Reformat (Reformat)
[03/07/2022-05:05:54] [V] [TRT] Tactic: 1002 Time: 0.00486
[03/07/2022-05:05:54] [V] [TRT] Tactic: 0 Time: 0.004396
[03/07/2022-05:05:54] [V] [TRT] Fastest Tactic: 0 Time: 0.004396
[03/07/2022-05:05:54] [V] [TRT] *************** Autotuning Reformat:Half(6272,196,14,1) -> Float(6272,196,14,1) ***************
[03/07/2022-05:05:54] [V] [TRT] --------------- Timing Runner: Optimizer Reformat (Reformat)
[03/07/2022-05:05:54] [V] [TRT] Tactic: 1002 Time: 0.023024
[03/07/2022-05:05:54] [V] [TRT] Tactic: 0 Time: 0.003616
[03/07/2022-05:05:54] [V] [TRT] Fastest Tactic: 0 Time: 0.003616
[03/07/2022-05:05:54] [V] [TRT] *************** Autotuning Reformat:Half(6272,196,14,1) -> Float(6272,1,448,32) ***************
[03/07/2022-05:05:54] [V] [TRT] --------------- Timing Runner: Optimizer Reformat (Reformat)
[03/07/2022-05:05:54] [V] [TRT] Tactic: 1002 Time: 0.00556
[03/07/2022-05:05:54] [V] [TRT] Tactic: 0 Time: 0.004336
[03/07/2022-05:05:54] [V] [TRT] Fastest Tactic: 0 Time: 0.004336
[03/07/2022-05:05:54] [V] [TRT] *************** Autotuning format combination: Float(6272,196,14,1) -> Float(12544,196,14,1) ***************
[03/07/2022-05:05:54] [V] [TRT] --------------- Timing Runner: Conv__27 + Relu_1 (CudaDepthwiseConvolution)
[03/07/2022-05:05:54] [V] [TRT] CudaDepthwiseConvolution has no valid tactics for this config, skipping
[03/07/2022-05:05:54] [V] [TRT] --------------- Timing Runner: Conv__27 + Relu_1 (FusedConvActConvolution)
[03/07/2022-05:05:54] [V] [TRT] FusedConvActConvolution has no valid tactics for this config, skipping
[03/07/2022-05:05:54] [V] [TRT] --------------- Timing Runner: Conv__27 + Relu_1 (CudnnConvolution)
[03/07/2022-05:05:54] [V] [TRT] Tactic: 0 Time: 0.063544
[03/07/2022-05:05:54] [V] [TRT] Tactic: 1 Time: 0.063584
[03/07/2022-05:05:54] [V] [TRT] Tactic: 2 Time: 0.126028
[03/07/2022-05:05:54] [V] [TRT] Tactic: 4 Time: 0.162944
[03/07/2022-05:05:54] [V] [TRT] Tactic: 5 Time: 0.180784
[03/07/2022-05:05:54] [V] [TRT] Fastest Tactic: 0 Time: 0.063544
[03/07/2022-05:05:54] [V] [TRT] --------------- Timing Runner: Conv__27 + Relu_1 (CaskConvolution)
[03/07/2022-05:05:54] [V] [TRT] Conv__27 + Relu_1 Set Tactic Name: maxwell_scudnn_128x32_relu_medium_nn_v1 Tactic: 1062367460111450758
[03/07/2022-05:05:54] [V] [TRT] Tactic: 1062367460111450758 Time: 0.103552
[03/07/2022-05:05:54] [V] [TRT] Conv__27 + Relu_1 Set Tactic Name: maxwell_scudnn_128x32_relu_large_nn_v0 Tactic: 1754984623894446479
[03/07/2022-05:05:54] [V] [TRT] Tactic: 1754984623894446479 Time: 0.078264
[03/07/2022-05:05:54] [V] [TRT] Conv__27 + Relu_1 Set Tactic Name: maxwell_scudnn_128x128_relu_large_nn_v0 Tactic: 3611739942397549984
[03/07/2022-05:05:54] [V] [TRT] Tactic: 3611739942397549984 Time: 0.085376
[03/07/2022-05:05:54] [V] [TRT] Conv__27 + Relu_1 Set Tactic Name: maxwell_scudnn_128x64_relu_large_nn_v1 Tactic: 4337000649858996379
[03/07/2022-05:05:54] [V] [TRT] Tactic: 4337000649858996379 Time: 0.078356
[03/07/2022-05:05:54] [V] [TRT] Conv__27 + Relu_1 Set Tactic Name: maxwell_scudnn_128x128_relu_medium_nn_v1 Tactic: 4501471010995462441
[03/07/2022-05:05:54] [V] [TRT] Tactic: 4501471010995462441 Time: 0.08562
[03/07/2022-05:05:54] [V] [TRT] Conv__27 + Relu_1 Set Tactic Name: maxwell_scudnn_128x64_relu_small_nn_v1 Tactic: 5137655947464784826
[03/07/2022-05:05:54] [V] [TRT] Tactic: 5137655947464784826 Time: 0.051952
[03/07/2022-05:05:54] [V] [TRT] Conv__27 + Relu_1 Set Tactic Name: maxwell_scudnn_128x128_relu_small_nn_v0 Tactic: 5288347012147084929
[03/07/2022-05:05:54] [V] [TRT] Tactic: 5288347012147084929 Time: 0.073972
[03/07/2022-05:05:54] [V] [TRT] Conv__27 + Relu_1 Set Tactic Name: maxwell_scudnn_128x64_relu_medium_nn_v1 Tactic: 6645123197870846056
[03/07/2022-05:05:54] [V] [TRT] Tactic: 6645123197870846056 Time: 0.071096
[03/07/2022-05:05:54] [V] [TRT] Conv__27 + Relu_1 Set Tactic Name: maxwell_scudnn_128x32_relu_small_nn_v0 Tactic: 7144526460361122478
[03/07/2022-05:05:54] [V] [TRT] Tactic: 7144526460361122478 Time: 0.059708
[03/07/2022-05:05:54] [V] [TRT] Conv__27 + Relu_1 Set Tactic Name: maxwell_scudnn_128x128_relu_large_nn_v1 Tactic: -9137461792520977713
[03/07/2022-05:05:54] [V] [TRT] Tactic: -9137461792520977713 Time: 0.088432
[03/07/2022-05:05:54] [V] [TRT] Conv__27 + Relu_1 Set Tactic Name: maxwell_scudnn_128x128_relu_medium_nn_v0 Tactic: -8262349710178828730
[03/07/2022-05:05:54] [V] [TRT] Tactic: -8262349710178828730 Time: 0.085236
[03/07/2022-05:05:54] [V] [TRT] Conv__27 + Relu_1 Set Tactic Name: maxwell_scudnn_128x64_relu_large_nn_v0 Tactic: -8133971918129952780
[03/07/2022-05:05:54] [V] [TRT] Tactic: -8133971918129952780 Time: 0.091632
[03/07/2022-05:05:54] [V] [TRT] Conv__27 + Relu_1 Set Tactic Name: maxwell_scudnn_128x32_relu_large_nn_v1 Tactic: -6092040395344634144
[03/07/2022-05:05:54] [V] [TRT] Tactic: -6092040395344634144 Time: 0.109012
[03/07/2022-05:05:54] [V] [TRT] Conv__27 + Relu_1 Set Tactic Name: maxwell_scudnn_128x32_relu_medium_nn_v0 Tactic: -4787320710726427159
[03/07/2022-05:05:54] [V] [TRT] Tactic: -4787320710726427159 Time: 0.077292
[03/07/2022-05:05:54] [V] [TRT] Conv__27 + Relu_1 Set Tactic Name: maxwell_scudnn_128x32_relu_small_nn_v1 Tactic: -3456450830548107839
[03/07/2022-05:05:54] [V] [TRT] Tactic: -3456450830548107839 Time: 0.061112
[03/07/2022-05:05:54] [V] [TRT] Conv__27 + Relu_1 Set Tactic Name: maxwell_scudnn_128x64_relu_medium_nn_v0 Tactic: -1218658103698133241
[03/07/2022-05:05:54] [V] [TRT] Tactic: -1218658103698133241 Time: 0.090768
[03/07/2022-05:05:54] [V] [TRT] Conv__27 + Relu_1 Set Tactic Name: maxwell_scudnn_128x64_relu_small_nn_v0 Tactic: -836875257600482091
[03/07/2022-05:05:54] [V] [TRT] Tactic: -836875257600482091 Time: 0.074812
[03/07/2022-05:05:54] [V] [TRT] Conv__27 + Relu_1 Set Tactic Name: maxwell_scudnn_128x128_relu_small_nn_v1 Tactic: -410470605513481746
[03/07/2022-05:05:54] [V] [TRT] Tactic: -410470605513481746 Time: 0.072728
[03/07/2022-05:05:54] [V] [TRT] Fastest Tactic: 5137655947464784826 Time: 0.051952
[03/07/2022-05:05:54] [V] [TRT] >>>>>>>>>>>>>>> Chose Runner Type: CaskConvolution Tactic: 5137655947464784826
[03/07/2022-05:05:54] [V] [TRT] *************** Autotuning format combination: Float(6272,1,448,32) -> Float(12544,1,896,64) ***************
[03/07/2022-05:05:54] [V] [TRT] --------------- Timing Runner: Conv__27 + Relu_1 (CudnnConvolution)
[03/07/2022-05:05:54] [V] [TRT] CudnnConvolution has no valid tactics for this config, skipping
[03/07/2022-05:05:54] [V] [TRT] --------------- Timing Runner: Conv__27 + Relu_1 (CaskConvolution)
[03/07/2022-05:05:54] [V] [TRT] Conv__27 + Relu_1 Set Tactic Name: maxwell_scudnn_128x32_sliced1x4_ldg4_relu_exp_small_nhwc_tn_v1 Tactic: -9153228964338181824
[03/07/2022-05:05:54] [V] [TRT] Tactic: -9153228964338181824 Time: 0.023776
[03/07/2022-05:05:54] [V] [TRT] Conv__27 + Relu_1 Set Tactic Name: maxwell_scudnn_128x64_sliced1x2_ldg4_relu_exp_small_nhwc_tn_v1 Tactic: -7394439838318485025
[03/07/2022-05:05:54] [V] [TRT] Tactic: -7394439838318485025 Time: 0.041016
[03/07/2022-05:05:54] [V] [TRT] Fastest Tactic: -9153228964338181824 Time: 0.023776
[03/07/2022-05:05:54] [V] [TRT] >>>>>>>>>>>>>>> Chose Runner Type: CaskConvolution Tactic: -9153228964338181824
[03/07/2022-05:05:54] [V] [TRT] *************** Autotuning format combination: Half(6272,196,14,1) -> Half(12544,196,14,1) ***************
[03/07/2022-05:05:54] [V] [TRT] --------------- Timing Runner: Conv__27 + Relu_1 (CudnnConvolution)
[03/07/2022-05:05:54] [V] [TRT] Tactic: 0 Time: 0.071116
[03/07/2022-05:05:54] [V] [TRT] Tactic: 1 Time: 0.069676
[03/07/2022-05:05:54] [V] [TRT] Tactic: 2 Time: 0.125636
[03/07/2022-05:05:54] [V] [TRT] Tactic: 4 Time: 0.161784
[03/07/2022-05:05:54] [V] [TRT] Tactic: 5 Time: 0.178956
[03/07/2022-05:05:54] [V] [TRT] Fastest Tactic: 1 Time: 0.069676
[03/07/2022-05:05:54] [V] [TRT] --------------- Timing Runner: Conv__27 + Relu_1 (CaskConvolution)
[03/07/2022-05:05:54] [V] [TRT] CaskConvolution has no valid tactics for this config, skipping
[03/07/2022-05:05:54] [V] [TRT] >>>>>>>>>>>>>>> Chose Runner Type: CudnnConvolution Tactic: 1
[03/07/2022-05:05:54] [V] [TRT] *************** Autotuning Reformat:Float(12544,196,14,1) -> Half(12544,196,14,1) ***************
[03/07/2022-05:05:54] [V] [TRT] --------------- Timing Runner: Optimizer Reformat (Reformat)
[03/07/2022-05:05:54] [V] [TRT] Tactic: 1002 Time: 0.041404
[03/07/2022-05:05:54] [V] [TRT] Tactic: 0 Time: 0.004916
[03/07/2022-05:05:54] [V] [TRT] Fastest Tactic: 0 Time: 0.004916
[03/07/2022-05:05:54] [V] [TRT] *************** Autotuning Reformat:Float(12544,1,896,64) -> Float(12544,196,14,1) ***************
[03/07/2022-05:05:54] [V] [TRT] --------------- Timing Runner: Optimizer Reformat (Reformat)
[03/07/2022-05:05:54] [V] [TRT] Tactic: 1002 Time: 0.007472
[03/07/2022-05:05:54] [V] [TRT] Tactic: 0 Time: 0.005496
[03/07/2022-05:05:54] [V] [TRT] Fastest Tactic: 0 Time: 0.005496
[03/07/2022-05:05:54] [V] [TRT] *************** Autotuning Reformat:Float(12544,1,896,64) -> Half(12544,196,14,1) ***************
[03/07/2022-05:05:54] [V] [TRT] --------------- Timing Runner: Optimizer Reformat (Reformat)
[03/07/2022-05:05:54] [V] [TRT] Tactic: 1002 Time: 0.006452
[03/07/2022-05:05:54] [V] [TRT] Tactic: 0 Time: 0.005556
[03/07/2022-05:05:54] [V] [TRT] Fastest Tactic: 0 Time: 0.005556
[03/07/2022-05:05:54] [V] [TRT] *************** Autotuning Reformat:Half(12544,196,14,1) -> Float(12544,196,14,1) ***************
[03/07/2022-05:05:54] [V] [TRT] --------------- Timing Runner: Optimizer Reformat (Reformat)
[03/07/2022-05:05:54] [V] [TRT] Tactic: 1002 Time: 0.042304
[03/07/2022-05:05:54] [V] [TRT] Tactic: 0 Time: 0.004488
[03/07/2022-05:05:54] [V] [TRT] Fastest Tactic: 0 Time: 0.004488
[03/07/2022-05:05:54] [V] [TRT] *************** Autotuning format combination: Float(12544,196,14,1) -> Float(3136,49,7,1) ***************
[03/07/2022-05:05:54] [V] [TRT] --------------- Timing Runner: MaxPool2d_1 (TiledPooling)
[03/07/2022-05:05:54] [V] [TRT] Tactic: 5505281 Time: 0.009144
[03/07/2022-05:05:55] [V] [TRT] Tactic: 5570817 Time: 0.006208
[03/07/2022-05:05:55] [V] [TRT] Tactic: 5636353 Time: 0.00512
[03/07/2022-05:05:55] [V] [TRT] Tactic: 5701889 Time: 0.00512
[03/07/2022-05:05:55] [V] [TRT] Tactic: 5767425 Time: 0.0048
[03/07/2022-05:05:55] [V] [TRT] Tactic: 5832961 Time: 0.005096
[03/07/2022-05:05:55] [V] [TRT] Tactic: 5898497 Time: 0.005108
[03/07/2022-05:05:55] [V] [TRT] Tactic: 5964033 Time: 0.004344
[03/07/2022-05:05:55] [V] [TRT] Tactic: 6029569 Time: 0.006144
[03/07/2022-05:05:55] [V] [TRT] Tactic: 6095105 Time: 0.004224
[03/07/2022-05:05:55] [V] [TRT] Tactic: 6160641 Time: 0.004096
[03/07/2022-05:05:55] [V] [TRT] Tactic: 6226177 Time: 0.004096
[03/07/2022-05:05:55] [V] [TRT] Tactic: 6291713 Time: 0.00406
[03/07/2022-05:05:55] [V] [TRT] Tactic: 6357249 Time: 0.004096
[03/07/2022-05:05:55] [V] [TRT] Tactic: 6422785 Time: 0.003972
[03/07/2022-05:05:55] [V] [TRT] Tactic: 6488321 Time: 0.004096
[03/07/2022-05:05:55] [V] [TRT] Fastest Tactic: 6422785 Time: 0.003972
[03/07/2022-05:05:55] [V] [TRT] --------------- Timing Runner: MaxPool2d_1 (CudnnPooling)
[03/07/2022-05:05:55] [V] [TRT] Tactic: -1 Time: 0.004096
[03/07/2022-05:05:55] [V] [TRT] Fastest Tactic: -1 Time: 0.004096
[03/07/2022-05:05:55] [V] [TRT] >>>>>>>>>>>>>>> Chose Runner Type: TiledPooling Tactic: 6422785
[03/07/2022-05:05:55] [V] [TRT] *************** Autotuning format combination: Half(12544,196,14,1) -> Half(3136,49,7,1) ***************
[03/07/2022-05:05:55] [V] [TRT] --------------- Timing Runner: MaxPool2d_1 (TiledPooling)
[03/07/2022-05:05:55] [V] [TRT] TiledPooling has no valid tactics for this config, skipping
[03/07/2022-05:05:55] [V] [TRT] --------------- Timing Runner: MaxPool2d_1 (CudnnPooling)
[03/07/2022-05:05:55] [V] [TRT] Tactic: -1 Time: 0.004076
[03/07/2022-05:05:55] [V] [TRT] Fastest Tactic: -1 Time: 0.004076
[03/07/2022-05:05:55] [V] [TRT] >>>>>>>>>>>>>>> Chose Runner Type: CudnnPooling Tactic: -1
[03/07/2022-05:05:55] [V] [TRT] *************** Autotuning Reformat:Float(3136,49,7,1) -> Float(3136,1,448,64) ***************
[03/07/2022-05:05:55] [V] [TRT] --------------- Timing Runner: Optimizer Reformat (Reformat)
[03/07/2022-05:05:55] [V] [TRT] Tactic: 1002 Time: 0.007168
[03/07/2022-05:05:55] [V] [TRT] Tactic: 0 Time: 0.003544
[03/07/2022-05:05:55] [V] [TRT] Fastest Tactic: 0 Time: 0.003544
[03/07/2022-05:05:55] [V] [TRT] *************** Autotuning Reformat:Float(3136,49,7,1) -> Float(98,49:32,7,1) ***************
[03/07/2022-05:05:55] [V] [TRT] --------------- Timing Runner: Optimizer Reformat (Reformat)
[03/07/2022-05:05:55] [V] [TRT] Tactic: 1002 Time: 0.007136
[03/07/2022-05:05:55] [V] [TRT] Tactic: 0 Time: 0.004096
[03/07/2022-05:05:55] [V] [TRT] Fastest Tactic: 0 Time: 0.004096
[03/07/2022-05:05:55] [V] [TRT] *************** Autotuning Reformat:Float(3136,49,7,1) -> Half(3136,49,7,1) ***************
[03/07/2022-05:05:55] [V] [TRT] --------------- Timing Runner: Optimizer Reformat (Reformat)
[03/07/2022-05:05:55] [V] [TRT] Tactic: 1002 Time: 0.0144
[03/07/2022-05:05:55] [V] [TRT] Tactic: 0 Time: 0.004076
[03/07/2022-05:05:55] [V] [TRT] Fastest Tactic: 0 Time: 0.004076
[03/07/2022-05:05:55] [V] [TRT] *************** Autotuning Reformat:Float(3136,1,448,64) -> Float(3136,49,7,1) ***************
[03/07/2022-05:05:55] [V] [TRT] --------------- Timing Runner: Optimizer Reformat (Reformat)
[03/07/2022-05:05:55] [V] [TRT] Tactic: 1002 Time: 0.007148
[03/07/2022-05:05:55] [V] [TRT] Tactic: 0 Time: 0.003308
[03/07/2022-05:05:55] [V] [TRT] Fastest Tactic: 0 Time: 0.003308
[03/07/2022-05:05:55] [V] [TRT] *************** Autotuning Reformat:Float(3136,1,448,64) -> Float(98,49:32,7,1) ***************
[03/07/2022-05:05:55] [V] [TRT] --------------- Timing Runner: Optimizer Reformat (Reformat)
[03/07/2022-05:05:55] [V] [TRT] Tactic: 1002 Time: 0.007252
[03/07/2022-05:05:55] [V] [TRT] Tactic: 0 Time: 0.004096
[03/07/2022-05:05:55] [V] [TRT] Fastest Tactic: 0 Time: 0.004096
[03/07/2022-05:05:55] [V] [TRT] *************** Autotuning Reformat:Float(3136,1,448,64) -> Half(3136,49,7,1) ***************
[03/07/2022-05:05:55] [V] [TRT] --------------- Timing Runner: Optimizer Reformat (Reformat)
[03/07/2022-05:05:55] [V] [TRT] Tactic: 1002 Time: 0.004608
[03/07/2022-05:05:55] [V] [TRT] Tactic: 0 Time: 0.003456
[03/07/2022-05:05:55] [V] [TRT] Fastest Tactic: 0 Time: 0.003456
[03/07/2022-05:05:55] [V] [TRT] *************** Autotuning Reformat:Float(98,49:32,7,1) -> Float(3136,49,7,1) ***************
[03/07/2022-05:05:55] [V] [TRT] --------------- Timing Runner: Optimizer Reformat (Reformat)
[03/07/2022-05:05:55] [V] [TRT] Tactic: 1002 Time: 0.007168
[03/07/2022-05:05:55] [V] [TRT] Tactic: 0 Time: 0.003456
[03/07/2022-05:05:55] [V] [TRT] Fastest Tactic: 0 Time: 0.003456
[03/07/2022-05:05:55] [V] [TRT] *************** Autotuning Reformat:Float(98,49:32,7,1) -> Float(3136,1,448,64) ***************
[03/07/2022-05:05:55] [V] [TRT] --------------- Timing Runner: Optimizer Reformat (Reformat)
[03/07/2022-05:05:55] [V] [TRT] Tactic: 1002 Time: 0.007184
[03/07/2022-05:05:55] [V] [TRT] Tactic: 0 Time: 0.00318
[03/07/2022-05:05:55] [V] [TRT] Fastest Tactic: 0 Time: 0.00318
[03/07/2022-05:05:55] [V] [TRT] *************** Autotuning Reformat:Float(98,49:32,7,1) -> Half(3136,49,7,1) ***************
[03/07/2022-05:05:55] [V] [TRT] --------------- Timing Runner: Optimizer Reformat (Reformat)
[03/07/2022-05:05:55] [V] [TRT] Tactic: 1002 Time: 0.0051
[03/07/2022-05:05:55] [V] [TRT] Tactic: 0 Time: 0.00332
[03/07/2022-05:05:55] [V] [TRT] Fastest Tactic: 0 Time: 0.00332
[03/07/2022-05:05:55] [V] [TRT] *************** Autotuning Reformat:Half(3136,49,7,1) -> Float(3136,49,7,1) ***************
[03/07/2022-05:05:55] [V] [TRT] --------------- Timing Runner: Optimizer Reformat (Reformat)
[03/07/2022-05:05:55] [V] [TRT] Tactic: 1002 Time: 0.014336
[03/07/2022-05:05:55] [V] [TRT] Tactic: 0 Time: 0.003264
[03/07/2022-05:05:55] [V] [TRT] Fastest Tactic: 0 Time: 0.003264
[03/07/2022-05:05:55] [V] [TRT] *************** Autotuning Reformat:Half(3136,49,7,1) -> Float(3136,1,448,64) ***************
[03/07/2022-05:05:55] [V] [TRT] --------------- Timing Runner: Optimizer Reformat (Reformat)
[03/07/2022-05:05:55] [V] [TRT] Tactic: 1002 Time: 0.005096
[03/07/2022-05:05:55] [V] [TRT] Tactic: 0 Time: 0.003584
[03/07/2022-05:05:55] [V] [TRT] Fastest Tactic: 0 Time: 0.003584
[03/07/2022-05:05:55] [V] [TRT] *************** Autotuning Reformat:Half(3136,49,7,1) -> Float(98,49:32,7,1) ***************
[03/07/2022-05:05:55] [V] [TRT] --------------- Timing Runner: Optimizer Reformat (Reformat)
[03/07/2022-05:05:55] [V] [TRT] Tactic: 1002 Time: 0.00512
[03/07/2022-05:05:55] [V] [TRT] Tactic: 0 Time: 0.004096
[03/07/2022-05:05:55] [V] [TRT] Fastest Tactic: 0 Time: 0.004096
[03/07/2022-05:05:55] [V] [TRT] *************** Autotuning format combination: Float(3136,49,7,1) -> Float(3136,1,1,1) ***************
[03/07/2022-05:05:55] [V] [TRT] --------------- Timing Runner: MaxPool2d_1__22 + Reshape + (Unnamed Layer* 14) [Shuffle] (Shuffle)
[03/07/2022-05:05:55] [V] [TRT] Tactic: 0 Time: 0.003552
[03/07/2022-05:05:55] [V] [TRT] Fastest Tactic: 0 Time: 0.003552
[03/07/2022-05:05:55] [V] [TRT] >>>>>>>>>>>>>>> Chose Runner Type: Shuffle Tactic: 0
[03/07/2022-05:05:55] [V] [TRT] *************** Autotuning format combination: Float(3136,1,448,64) -> Float(3136,1,3136,3136) ***************
[03/07/2022-05:05:55] [V] [TRT] --------------- Timing Runner: MaxPool2d_1__22 + Reshape + (Unnamed Layer* 14) [Shuffle] (Shuffle)
[03/07/2022-05:05:55] [V] [TRT] Tactic: 0 Time: 0.003072
[03/07/2022-05:05:55] [V] [TRT] Fastest Tactic: 0 Time: 0.003072
[03/07/2022-05:05:55] [V] [TRT] >>>>>>>>>>>>>>> Chose Runner Type: Shuffle Tactic: 0
[03/07/2022-05:05:55] [V] [TRT] *************** Autotuning format combination: Float(98,49:32,7,1) -> Float(98,1:32,1,1) ***************
[03/07/2022-05:05:55] [V] [TRT] --------------- Timing Runner: MaxPool2d_1__22 + Reshape + (Unnamed Layer* 14) [Shuffle] (Shuffle)
[03/07/2022-05:05:55] [V] [TRT] Tactic: 0 Time: 0.003328
[03/07/2022-05:05:55] [V] [TRT] Fastest Tactic: 0 Time: 0.003328
[03/07/2022-05:05:55] [V] [TRT] >>>>>>>>>>>>>>> Chose Runner Type: Shuffle Tactic: 0
[03/07/2022-05:05:55] [V] [TRT] *************** Autotuning format combination: Half(3136,49,7,1) -> Half(3136,1,1,1) ***************
[03/07/2022-05:05:55] [V] [TRT] --------------- Timing Runner: MaxPool2d_1__22 + Reshape + (Unnamed Layer* 14) [Shuffle] (Shuffle)
[03/07/2022-05:05:55] [V] [TRT] Tactic: 0 Time: 0.0032
[03/07/2022-05:05:55] [V] [TRT] Fastest Tactic: 0 Time: 0.0032
[03/07/2022-05:05:55] [V] [TRT] >>>>>>>>>>>>>>> Chose Runner Type: Shuffle Tactic: 0
[03/07/2022-05:05:55] [V] [TRT] *************** Autotuning Reformat:Float(3136,1,1,1) -> Float(3136,1,3136,3136) ***************
[03/07/2022-05:05:55] [V] [TRT] --------------- Timing Runner: Optimizer Reformat (Reformat)
[03/07/2022-05:05:55] [V] [TRT] Tactic: 1002 Time: 0.004076
[03/07/2022-05:05:56] [V] [TRT] Tactic: 0 Time: 0.003072
[03/07/2022-05:05:56] [V] [TRT] Fastest Tactic: 0 Time: 0.003072
[03/07/2022-05:05:56] [V] [TRT] *************** Autotuning Reformat:Float(3136,1,1,1) -> Half(3136,1,1,1) ***************
[03/07/2022-05:05:56] [V] [TRT] --------------- Timing Runner: Optimizer Reformat (Reformat)
[03/07/2022-05:05:56] [V] [TRT] Tactic: 1002 Time: 0.004096
[03/07/2022-05:05:56] [V] [TRT] Tactic: 0 Time: 0.004096
[03/07/2022-05:05:56] [V] [TRT] Fastest Tactic: 1002 Time: 0.004096
[03/07/2022-05:05:56] [V] [TRT] *************** Autotuning Reformat:Float(3136,1,3136,3136) -> Float(3136,1,1,1) ***************
[03/07/2022-05:05:56] [V] [TRT] --------------- Timing Runner: Optimizer Reformat (Reformat)
[03/07/2022-05:05:56] [V] [TRT] Tactic: 1002 Time: 0.004096
[03/07/2022-05:05:56] [V] [TRT] Tactic: 0 Time: 0.003072
[03/07/2022-05:05:56] [V] [TRT] Fastest Tactic: 0 Time: 0.003072
[03/07/2022-05:05:56] [V] [TRT] *************** Autotuning Reformat:Float(3136,1,3136,3136) -> Half(3136,1,1,1) ***************
[03/07/2022-05:05:56] [V] [TRT] --------------- Timing Runner: Optimizer Reformat (Reformat)
[03/07/2022-05:05:56] [V] [TRT] Tactic: 1002 Time: 0.004052
[03/07/2022-05:05:56] [V] [TRT] Tactic: 0 Time: 0.003248
[03/07/2022-05:05:56] [V] [TRT] Fastest Tactic: 0 Time: 0.003248
[03/07/2022-05:05:56] [V] [TRT] *************** Autotuning Reformat:Float(98,1:32,1,1) -> Float(3136,1,1,1) ***************
[03/07/2022-05:05:56] [V] [TRT] --------------- Timing Runner: Optimizer Reformat (Reformat)
[03/07/2022-05:05:56] [V] [TRT] Tactic: 1002 Time: 0.026328
[03/07/2022-05:05:56] [V] [TRT] Tactic: 0 Time: 0.003192
[03/07/2022-05:05:56] [V] [TRT] Fastest Tactic: 0 Time: 0.003192
[03/07/2022-05:05:56] [V] [TRT] *************** Autotuning Reformat:Float(98,1:32,1,1) -> Float(3136,1,3136,3136) ***************
[03/07/2022-05:05:56] [V] [TRT] --------------- Timing Runner: Optimizer Reformat (Reformat)
[03/07/2022-05:05:56] [V] [TRT] Tactic: 1002 Time: 0.008292
[03/07/2022-05:05:56] [V] [TRT] Tactic: 0 Time: 0.003228
[03/07/2022-05:05:56] [V] [TRT] Fastest Tactic: 0 Time: 0.003228
[03/07/2022-05:05:56] [V] [TRT] *************** Autotuning Reformat:Float(98,1:32,1,1) -> Half(3136,1,1,1) ***************
[03/07/2022-05:05:56] [V] [TRT] --------------- Timing Runner: Optimizer Reformat (Reformat)
[03/07/2022-05:05:56] [V] [TRT] Tactic: 1002 Time: 0.011488
[03/07/2022-05:05:56] [V] [TRT] Tactic: 0 Time: 0.003072
[03/07/2022-05:05:56] [V] [TRT] Fastest Tactic: 0 Time: 0.003072
[03/07/2022-05:05:56] [V] [TRT] *************** Autotuning Reformat:Half(3136,1,1,1) -> Float(3136,1,1,1) ***************
[03/07/2022-05:05:56] [V] [TRT] --------------- Timing Runner: Optimizer Reformat (Reformat)
[03/07/2022-05:05:56] [V] [TRT] Tactic: 1002 Time: 0.004096
[03/07/2022-05:05:56] [V] [TRT] Tactic: 0 Time: 0.003312
[03/07/2022-05:05:56] [V] [TRT] Fastest Tactic: 0 Time: 0.003312
[03/07/2022-05:05:56] [V] [TRT] *************** Autotuning Reformat:Half(3136,1,1,1) -> Float(3136,1,3136,3136) ***************
[03/07/2022-05:05:56] [V] [TRT] --------------- Timing Runner: Optimizer Reformat (Reformat)
[03/07/2022-05:05:56] [V] [TRT] Tactic: 1002 Time: 0.004096
[03/07/2022-05:05:56] [V] [TRT] Tactic: 0 Time: 0.003192
[03/07/2022-05:05:56] [V] [TRT] Fastest Tactic: 0 Time: 0.003192
[03/07/2022-05:05:56] [V] [TRT] *************** Autotuning format combination: Float(3136,1,1,1) -> Float(1024,1,1,1) ***************
[03/07/2022-05:05:56] [V] [TRT] --------------- Timing Runner: MatMul + b3/read:0 + (Unnamed Layer* 21) [Shuffle] + unsqueeze_node_after_b3/read:0 + (Unnamed Layer* 21) [Shuffle] + add_2 + Relu_2 (CudaDepthwiseConvolution)
[03/07/2022-05:05:56] [V] [TRT] CudaDepthwiseConvolution has no valid tactics for this config, skipping
[03/07/2022-05:05:56] [V] [TRT] --------------- Timing Runner: MatMul + b3/read:0 + (Unnamed Layer* 21) [Shuffle] + unsqueeze_node_after_b3/read:0 + (Unnamed Layer* 21) [Shuffle] + add_2 + Relu_2 (FusedConvActConvolution)
[03/07/2022-05:05:56] [V] [TRT] FusedConvActConvolution has no valid tactics for this config, skipping
[03/07/2022-05:05:56] [V] [TRT] --------------- Timing Runner: MatMul + b3/read:0 + (Unnamed Layer* 21) [Shuffle] + unsqueeze_node_after_b3/read:0 + (Unnamed Layer* 21) [Shuffle] + add_2 + Relu_2 (CudnnConvolution)
[03/07/2022-05:05:56] [V] [TRT] Tactic: 0 Time: 0.311008
[03/07/2022-05:05:56] [V] [TRT] Tactic: 1 Time: 0.176384
[03/07/2022-05:05:56] [V] [TRT] Tactic: 2 Time: 0.384512
[03/07/2022-05:05:56] [V] [TRT] Tactic: 4 skipped. Scratch requested: 7527202816, available: 1073741824
[03/07/2022-05:05:56] [V] [TRT] Tactic: 5 Time: 5.99217
[03/07/2022-05:05:56] [I] [TRT] Some tactics do not have sufficient workspace memory to run. Increasing workspace size may increase performance, please check verbose output.
[03/07/2022-05:05:56] [V] [TRT] Fastest Tactic: 1 Time: 0.176384
[03/07/2022-05:05:56] [V] [TRT] --------------- Timing Runner: MatMul + b3/read:0 + (Unnamed Layer* 21) [Shuffle] + unsqueeze_node_after_b3/read:0 + (Unnamed Layer* 21) [Shuffle] + add_2 + Relu_2 (CublasConvolution)
[03/07/2022-05:05:56] [V] [TRT] Tactic: 0 Time: 0.06788
[03/07/2022-05:05:56] [V] [TRT] Tactic: 1 Time: 0.068788
[03/07/2022-05:05:56] [V] [TRT] Fastest Tactic: 0 Time: 0.06788
[03/07/2022-05:05:56] [V] [TRT] --------------- Timing Runner: MatMul + b3/read:0 + (Unnamed Layer* 21) [Shuffle] + unsqueeze_node_after_b3/read:0 + (Unnamed Layer* 21) [Shuffle] + add_2 + Relu_2 (CaskConvolution)
[03/07/2022-05:05:56] [V] [TRT] MatMul + b3/read:0 + (Unnamed Layer* 21) [Shuffle] + unsqueeze_node_after_b3/read:0 + (Unnamed Layer* 21) [Shuffle] + add_2 + Relu_2 Set Tactic Name: maxwell_scudnn_128x32_relu_medium_nn_v1 Tactic: 1062367460111450758
[03/07/2022-05:05:56] [V] [TRT] Tactic: 1062367460111450758 Time: 0.356452
[03/07/2022-05:05:56] [V] [TRT] MatMul + b3/read:0 + (Unnamed Layer* 21) [Shuffle] + unsqueeze_node_after_b3/read:0 + (Unnamed Layer* 21) [Shuffle] + add_2 + Relu_2 Set Tactic Name: maxwell_scudnn_128x32_relu_interior_nn_v0 Tactic: 1698681053543049347
[03/07/2022-05:05:56] [V] [TRT] Tactic: 1698681053543049347 Time: 0.36334
[03/07/2022-05:05:56] [V] [TRT] MatMul + b3/read:0 + (Unnamed Layer* 21) [Shuffle] + unsqueeze_node_after_b3/read:0 + (Unnamed Layer* 21) [Shuffle] + add_2 + Relu_2 Set Tactic Name: maxwell_scudnn_128x128_relu_medium_nn_v1 Tactic: 4501471010995462441
[03/07/2022-05:05:56] [V] [TRT] Tactic: 4501471010995462441 Time: 0.388028
[03/07/2022-05:05:56] [V] [TRT] MatMul + b3/read:0 + (Unnamed Layer* 21) [Shuffle] + unsqueeze_node_after_b3/read:0 + (Unnamed Layer* 21) [Shuffle] + add_2 + Relu_2 Set Tactic Name: maxwell_scudnn_128x64_relu_small_nn_v1 Tactic: 5137655947464784826
[03/07/2022-05:05:56] [V] [TRT] Tactic: 5137655947464784826 Time: 0.313976
[03/07/2022-05:05:56] [V] [TRT] MatMul + b3/read:0 + (Unnamed Layer* 21) [Shuffle] + unsqueeze_node_after_b3/read:0 + (Unnamed Layer* 21) [Shuffle] + add_2 + Relu_2 Set Tactic Name: maxwell_scudnn_128x128_relu_small_nn_v0 Tactic: 5288347012147084929
[03/07/2022-05:05:56] [V] [TRT] Tactic: 5288347012147084929 Time: 0.367648
[03/07/2022-05:05:56] [V] [TRT] MatMul + b3/read:0 + (Unnamed Layer* 21) [Shuffle] + unsqueeze_node_after_b3/read:0 + (Unnamed Layer* 21) [Shuffle] + add_2 + Relu_2 Set Tactic Name: maxwell_scudnn_128x128_relu_interior_nn_v1 Tactic: 5326823351883942011
[03/07/2022-05:05:56] [V] [TRT] Tactic: 5326823351883942011 Time: 0.38126
[03/07/2022-05:05:56] [V] [TRT] MatMul + b3/read:0 + (Unnamed Layer* 21) [Shuffle] + unsqueeze_node_after_b3/read:0 + (Unnamed Layer* 21) [Shuffle] + add_2 + Relu_2 Set Tactic Name: maxwell_scudnn_128x64_relu_interior_nn_v0 Tactic: 5500448035057547314
[03/07/2022-05:05:56] [V] [TRT] Tactic: 5500448035057547314 Time: 0.348376
[03/07/2022-05:05:56] [V] [TRT] MatMul + b3/read:0 + (Unnamed Layer* 21) [Shuffle] + unsqueeze_node_after_b3/read:0 + (Unnamed Layer* 21) [Shuffle] + add_2 + Relu_2 Set Tactic Name: maxwell_scudnn_128x64_relu_medium_nn_v1 Tactic: 6645123197870846056
[03/07/2022-05:05:56] [V] [TRT] Tactic: 6645123197870846056 Time: 0.3199
[03/07/2022-05:05:56] [V] [TRT] MatMul + b3/read:0 + (Unnamed Layer* 21) [Shuffle] + unsqueeze_node_after_b3/read:0 + (Unnamed Layer* 21) [Shuffle] + add_2 + Relu_2 Set Tactic Name: maxwell_scudnn_128x32_relu_small_nn_v0 Tactic: 7144526460361122478
[03/07/2022-05:05:56] [V] [TRT] Tactic: 7144526460361122478 Time: 0.362504
[03/07/2022-05:05:56] [V] [TRT] MatMul + b3/read:0 + (Unnamed Layer* 21) [Shuffle] + unsqueeze_node_after_b3/read:0 + (Unnamed Layer* 21) [Shuffle] + add_2 + Relu_2 Set Tactic Name: maxwell_scudnn_128x128_relu_medium_nn_v0 Tactic: -8262349710178828730
[03/07/2022-05:05:56] [V] [TRT] Tactic: -8262349710178828730 Time: 0.360832
[03/07/2022-05:05:56] [V] [TRT] MatMul + b3/read:0 + (Unnamed Layer* 21) [Shuffle] + unsqueeze_node_after_b3/read:0 + (Unnamed Layer* 21) [Shuffle] + add_2 + Relu_2 Set Tactic Name: maxwell_scudnn_128x32_relu_interior_nn_v1 Tactic: -6576203419454146580
[03/07/2022-05:05:56] [V] [TRT] Tactic: -6576203419454146580 Time: 0.320128
[03/07/2022-05:05:56] [V] [TRT] MatMul + b3/read:0 + (Unnamed Layer* 21) [Shuffle] + unsqueeze_node_after_b3/read:0 + (Unnamed Layer* 21) [Shuffle] + add_2 + Relu_2 Set Tactic Name: maxwell_scudnn_128x32_relu_medium_nn_v0 Tactic: -4787320710726427159
[03/07/2022-05:05:56] [V] [TRT] Tactic: -4787320710726427159 Time: 0.340024
[03/07/2022-05:05:56] [V] [TRT] MatMul + b3/read:0 + (Unnamed Layer* 21) [Shuffle] + unsqueeze_node_after_b3/read:0 + (Unnamed Layer* 21) [Shuffle] + add_2 + Relu_2 Set Tactic Name: maxwell_scudnn_128x32_relu_small_nn_v1 Tactic: -3456450830548107839
[03/07/2022-05:05:56] [V] [TRT] Tactic: -3456450830548107839 Time: 0.327744
[03/07/2022-05:05:57] [V] [TRT] MatMul + b3/read:0 + (Unnamed Layer* 21) [Shuffle] + unsqueeze_node_after_b3/read:0 + (Unnamed Layer* 21) [Shuffle] + add_2 + Relu_2 Set Tactic Name: maxwell_scudnn_128x64_relu_medium_nn_v0 Tactic: -1218658103698133241
[03/07/2022-05:05:57] [V] [TRT] Tactic: -1218658103698133241 Time: 0.365304
[03/07/2022-05:05:57] [V] [TRT] MatMul + b3/read:0 + (Unnamed Layer* 21) [Shuffle] + unsqueeze_node_after_b3/read:0 + (Unnamed Layer* 21) [Shuffle] + add_2 + Relu_2 Set Tactic Name: maxwell_scudnn_128x64_relu_small_nn_v0 Tactic: -836875257600482091
[03/07/2022-05:05:57] [V] [TRT] Tactic: -836875257600482091 Time: 0.352956
[03/07/2022-05:05:57] [V] [TRT] MatMul + b3/read:0 + (Unnamed Layer* 21) [Shuffle] + unsqueeze_node_after_b3/read:0 + (Unnamed Layer* 21) [Shuffle] + add_2 + Relu_2 Set Tactic Name: maxwell_scudnn_128x128_relu_small_nn_v1 Tactic: -410470605513481746
[03/07/2022-05:05:57] [V] [TRT] Tactic: -410470605513481746 Time: 0.38216
[03/07/2022-05:05:57] [V] [TRT] MatMul + b3/read:0 + (Unnamed Layer* 21) [Shuffle] + unsqueeze_node_after_b3/read:0 + (Unnamed Layer* 21) [Shuffle] + add_2 + Relu_2 Set Tactic Name: maxwell_scudnn_128x128_relu_interior_nn_v0 Tactic: -377491875521947884
[03/07/2022-05:05:57] [V] [TRT] Tactic: -377491875521947884 Time: 0.364676
[03/07/2022-05:05:57] [V] [TRT] MatMul + b3/read:0 + (Unnamed Layer* 21) [Shuffle] + unsqueeze_node_after_b3/read:0 + (Unnamed Layer* 21) [Shuffle] + add_2 + Relu_2 Set Tactic Name: maxwell_scudnn_128x64_relu_interior_nn_v1 Tactic: -37215280111360163
[03/07/2022-05:05:57] [V] [TRT] Tactic: -37215280111360163 Time: 0.313644
[03/07/2022-05:05:57] [V] [TRT] Fastest Tactic: -37215280111360163 Time: 0.313644
[03/07/2022-05:05:57] [V] [TRT] >>>>>>>>>>>>>>> Chose Runner Type: CublasConvolution Tactic: 0
[03/07/2022-05:05:57] [V] [TRT] *************** Autotuning format combination: Float(3136,1,3136,3136) -> Float(1024,1,1024,1024) ***************
[03/07/2022-05:05:57] [V] [TRT] --------------- Timing Runner: MatMul + b3/read:0 + (Unnamed Layer* 21) [Shuffle] + unsqueeze_node_after_b3/read:0 + (Unnamed Layer* 21) [Shuffle] + add_2 + Relu_2 (CudnnConvolution)
[03/07/2022-05:05:57] [V] [TRT] CudnnConvolution has no valid tactics for this config, skipping
[03/07/2022-05:05:57] [V] [TRT] --------------- Timing Runner: MatMul + b3/read:0 + (Unnamed Layer* 21) [Shuffle] + unsqueeze_node_after_b3/read:0 + (Unnamed Layer* 21) [Shuffle] + add_2 + Relu_2 (CublasConvolution)
[03/07/2022-05:05:57] [V] [TRT] CublasConvolution has no valid tactics for this config, skipping
[03/07/2022-05:05:57] [V] [TRT] --------------- Timing Runner: MatMul + b3/read:0 + (Unnamed Layer* 21) [Shuffle] + unsqueeze_node_after_b3/read:0 + (Unnamed Layer* 21) [Shuffle] + add_2 + Relu_2 (CaskConvolution)
[03/07/2022-05:05:57] [V] [TRT] MatMul + b3/read:0 + (Unnamed Layer* 21) [Shuffle] + unsqueeze_node_after_b3/read:0 + (Unnamed Layer* 21) [Shuffle] + add_2 + Relu_2 Set Tactic Name: maxwell_scudnn_128x64_sliced1x2_ldg4_relu_exp_interior_nhwc_tn_v1 Tactic: 3886731678879822788
[03/07/2022-05:05:57] [V] [TRT] Tactic: 3886731678879822788 Time: 0.182604
[03/07/2022-05:05:57] [V] [TRT] MatMul + b3/read:0 + (Unnamed Layer* 21) [Shuffle] + unsqueeze_node_after_b3/read:0 + (Unnamed Layer* 21) [Shuffle] + add_2 + Relu_2 Set Tactic Name: maxwell_scudnn_128x32_sliced1x4_ldg4_relu_exp_interior_nhwc_tn_v1 Tactic: 6629944304117643200
[03/07/2022-05:05:57] [V] [TRT] Tactic: 6629944304117643200 Time: 0.128564
[03/07/2022-05:05:57] [V] [TRT] MatMul + b3/read:0 + (Unnamed Layer* 21) [Shuffle] + unsqueeze_node_after_b3/read:0 + (Unnamed Layer* 21) [Shuffle] + add_2 + Relu_2 Set Tactic Name: maxwell_scudnn_128x32_sliced1x4_ldg4_relu_exp_small_nhwc_tn_v1 Tactic: -9153228964338181824
[03/07/2022-05:05:57] [V] [TRT] Tactic: -9153228964338181824 Time: 0.130228
[03/07/2022-05:05:57] [V] [TRT] MatMul + b3/read:0 + (Unnamed Layer* 21) [Shuffle] + unsqueeze_node_after_b3/read:0 + (Unnamed Layer* 21) [Shuffle] + add_2 + Relu_2 Set Tactic Name: maxwell_scudnn_128x64_sliced1x2_ldg4_relu_exp_small_nhwc_tn_v1 Tactic: -7394439838318485025
[03/07/2022-05:05:57] [V] [TRT] Tactic: -7394439838318485025 Time: 0.182776
[03/07/2022-05:05:57] [V] [TRT] Fastest Tactic: 6629944304117643200 Time: 0.128564
[03/07/2022-05:05:57] [V] [TRT] >>>>>>>>>>>>>>> Chose Runner Type: CaskConvolution Tactic: 6629944304117643200
[03/07/2022-05:05:57] [V] [TRT] *************** Autotuning format combination: Half(3136,1,1,1) -> Half(1024,1,1,1) ***************
[03/07/2022-05:05:57] [V] [TRT] --------------- Timing Runner: MatMul + b3/read:0 + (Unnamed Layer* 21) [Shuffle] + unsqueeze_node_after_b3/read:0 + (Unnamed Layer* 21) [Shuffle] + add_2 + Relu_2 (CudnnConvolution)
[03/07/2022-05:05:57] [V] [TRT] Tactic: 0 Time: 0.25758
[03/07/2022-05:05:57] [V] [TRT] Tactic: 1 Time: 0.2695
[03/07/2022-05:05:57] [V] [TRT] Tactic: 2 Time: 0.355772
[03/07/2022-05:05:57] [V] [TRT] Tactic: 4 skipped. Scratch requested: 7527202816, available: 1073741824
[03/07/2022-05:05:57] [V] [TRT] Tactic: 5 Time: 5.62885
[03/07/2022-05:05:57] [V] [TRT] Fastest Tactic: 0 Time: 0.25758
[03/07/2022-05:05:57] [V] [TRT] --------------- Timing Runner: MatMul + b3/read:0 + (Unnamed Layer* 21) [Shuffle] + unsqueeze_node_after_b3/read:0 + (Unnamed Layer* 21) [Shuffle] + add_2 + Relu_2 (CublasConvolution)
[03/07/2022-05:05:57] [V] [TRT] CublasConvolution has no valid tactics for this config, skipping
[03/07/2022-05:05:57] [V] [TRT] --------------- Timing Runner: MatMul + b3/read:0 + (Unnamed Layer* 21) [Shuffle] + unsqueeze_node_after_b3/read:0 + (Unnamed Layer* 21) [Shuffle] + add_2 + Relu_2 (CaskConvolution)
[03/07/2022-05:05:57] [V] [TRT] CaskConvolution has no valid tactics for this config, skipping
[03/07/2022-05:05:57] [V] [TRT] >>>>>>>>>>>>>>> Chose Runner Type: CudnnConvolution Tactic: 0
[03/07/2022-05:05:57] [V] [TRT] *************** Autotuning Reformat:Float(1024,1,1,1) -> Float(1024,1,1024,1024) ***************
[03/07/2022-05:05:57] [V] [TRT] --------------- Timing Runner: Optimizer Reformat (Reformat)
[03/07/2022-05:05:57] [V] [TRT] Tactic: 1002 Time: 0.003704
[03/07/2022-05:05:57] [V] [TRT] Tactic: 0 Time: 0.003296
[03/07/2022-05:05:57] [V] [TRT] Fastest Tactic: 0 Time: 0.003296
[03/07/2022-05:05:57] [V] [TRT] *************** Autotuning Reformat:Float(1024,1,1,1) -> Half(1024,1,1,1) ***************
[03/07/2022-05:05:57] [V] [TRT] --------------- Timing Runner: Optimizer Reformat (Reformat)
[03/07/2022-05:05:57] [V] [TRT] Tactic: 1002 Time: 0.004288
[03/07/2022-05:05:57] [V] [TRT] Tactic: 0 Time: 0.004408
[03/07/2022-05:05:57] [V] [TRT] Fastest Tactic: 1002 Time: 0.004288
[03/07/2022-05:05:57] [V] [TRT] *************** Autotuning Reformat:Float(1024,1,1024,1024) -> Float(1024,1,1,1) ***************
[03/07/2022-05:05:57] [V] [TRT] --------------- Timing Runner: Optimizer Reformat (Reformat)
[03/07/2022-05:05:57] [V] [TRT] Tactic: 1002 Time: 0.003632
[03/07/2022-05:05:57] [V] [TRT] Tactic: 0 Time: 0.003448
[03/07/2022-05:05:57] [V] [TRT] Fastest Tactic: 0 Time: 0.003448
[03/07/2022-05:05:57] [V] [TRT] *************** Autotuning Reformat:Float(1024,1,1024,1024) -> Half(1024,1,1,1) ***************
[03/07/2022-05:05:57] [V] [TRT] --------------- Timing Runner: Optimizer Reformat (Reformat)
[03/07/2022-05:05:57] [V] [TRT] Tactic: 1002 Time: 0.003568
[03/07/2022-05:05:57] [V] [TRT] Tactic: 0 Time: 0.003404
[03/07/2022-05:05:57] [V] [TRT] Fastest Tactic: 0 Time: 0.003404
[03/07/2022-05:05:57] [V] [TRT] *************** Autotuning Reformat:Half(1024,1,1,1) -> Float(1024,1,1,1) ***************
[03/07/2022-05:05:57] [V] [TRT] --------------- Timing Runner: Optimizer Reformat (Reformat)
[03/07/2022-05:05:57] [V] [TRT] Tactic: 1002 Time: 0.004408
[03/07/2022-05:05:57] [V] [TRT] Tactic: 0 Time: 0.003468
[03/07/2022-05:05:57] [V] [TRT] Fastest Tactic: 0 Time: 0.003468
[03/07/2022-05:05:57] [V] [TRT] *************** Autotuning Reformat:Half(1024,1,1,1) -> Float(1024,1,1024,1024) ***************
[03/07/2022-05:05:57] [V] [TRT] --------------- Timing Runner: Optimizer Reformat (Reformat)
[03/07/2022-05:05:57] [V] [TRT] Tactic: 1002 Time: 0.00416
[03/07/2022-05:05:57] [V] [TRT] Tactic: 0 Time: 0.00344
[03/07/2022-05:05:57] [V] [TRT] Fastest Tactic: 0 Time: 0.00344
[03/07/2022-05:05:57] [V] [TRT] *************** Autotuning format combination: Float(1024,1,1,1) -> Float(10,1,1,1) ***************
[03/07/2022-05:05:57] [V] [TRT] --------------- Timing Runner: MatMul_1 + b4/read:0 + (Unnamed Layer* 37) [Shuffle] + unsqueeze_node_after_b4/read:0 + (Unnamed Layer* 37) [Shuffle] + add_3 (CudaDepthwiseConvolution)
[03/07/2022-05:05:57] [V] [TRT] CudaDepthwiseConvolution has no valid tactics for this config, skipping
[03/07/2022-05:05:57] [V] [TRT] --------------- Timing Runner: MatMul_1 + b4/read:0 + (Unnamed Layer* 37) [Shuffle] + unsqueeze_node_after_b4/read:0 + (Unnamed Layer* 37) [Shuffle] + add_3 (FusedConvActConvolution)
[03/07/2022-05:05:57] [V] [TRT] FusedConvActConvolution has no valid tactics for this config, skipping
[03/07/2022-05:05:57] [V] [TRT] --------------- Timing Runner: MatMul_1 + b4/read:0 + (Unnamed Layer* 37) [Shuffle] + unsqueeze_node_after_b4/read:0 + (Unnamed Layer* 37) [Shuffle] + add_3 (CudnnConvolution)
[03/07/2022-05:05:57] [V] [TRT] Tactic: 0 Time: 0.12032
[03/07/2022-05:05:57] [V] [TRT] Tactic: 1 Time: 0.05058
[03/07/2022-05:05:57] [V] [TRT] Tactic: 2 Time: 0.145596
[03/07/2022-05:05:57] [V] [TRT] Tactic: 4 Time: 0.305524
[03/07/2022-05:05:57] [V] [TRT] Tactic: 5 Time: 0.092516
[03/07/2022-05:05:57] [V] [TRT] Fastest Tactic: 1 Time: 0.05058
[03/07/2022-05:05:57] [V] [TRT] --------------- Timing Runner: MatMul_1 + b4/read:0 + (Unnamed Layer* 37) [Shuffle] + unsqueeze_node_after_b4/read:0 + (Unnamed Layer* 37) [Shuffle] + add_3 (CublasConvolution)
[03/07/2022-05:05:57] [V] [TRT] Tactic: 0 Time: 0.008512
[03/07/2022-05:05:57] [V] [TRT] Tactic: 1 Time: 0.011512
[03/07/2022-05:05:57] [V] [TRT] Fastest Tactic: 0 Time: 0.008512
[03/07/2022-05:05:57] [V] [TRT] --------------- Timing Runner: MatMul_1 + b4/read:0 + (Unnamed Layer* 37) [Shuffle] + unsqueeze_node_after_b4/read:0 + (Unnamed Layer* 37) [Shuffle] + add_3 (CaskConvolution)
[03/07/2022-05:05:57] [V] [TRT] MatMul_1 + b4/read:0 + (Unnamed Layer* 37) [Shuffle] + unsqueeze_node_after_b4/read:0 + (Unnamed Layer* 37) [Shuffle] + add_3 Set Tactic Name: maxwell_scudnn_128x32_relu_medium_nn_v1 Tactic: 1062367460111450758
[03/07/2022-05:05:57] [V] [TRT] Tactic: 1062367460111450758 Time: 0.082332
[03/07/2022-05:05:57] [V] [TRT] MatMul_1 + b4/read:0 + (Unnamed Layer* 37) [Shuffle] + unsqueeze_node_after_b4/read:0 + (Unnamed Layer* 37) [Shuffle] + add_3 Set Tactic Name: maxwell_scudnn_128x32_relu_interior_nn_v0 Tactic: 1698681053543049347
[03/07/2022-05:05:57] [V] [TRT] Tactic: 1698681053543049347 Time: 0.06098
[03/07/2022-05:05:57] [V] [TRT] MatMul_1 + b4/read:0 + (Unnamed Layer* 37) [Shuffle] + unsqueeze_node_after_b4/read:0 + (Unnamed Layer* 37) [Shuffle] + add_3 Set Tactic Name: maxwell_scudnn_128x128_relu_medium_nn_v1 Tactic: 4501471010995462441
[03/07/2022-05:05:57] [V] [TRT] Tactic: 4501471010995462441 Time: 0.09374
[03/07/2022-05:05:57] [V] [TRT] MatMul_1 + b4/read:0 + (Unnamed Layer* 37) [Shuffle] + unsqueeze_node_after_b4/read:0 + (Unnamed Layer* 37) [Shuffle] + add_3 Set Tactic Name: maxwell_scudnn_128x64_relu_small_nn_v1 Tactic: 5137655947464784826
[03/07/2022-05:05:57] [V] [TRT] Tactic: 5137655947464784826 Time: 0.062672
[03/07/2022-05:05:57] [V] [TRT] MatMul_1 + b4/read:0 + (Unnamed Layer* 37) [Shuffle] + unsqueeze_node_after_b4/read:0 + (Unnamed Layer* 37) [Shuffle] + add_3 Set Tactic Name: maxwell_scudnn_128x128_relu_small_nn_v0 Tactic: 5288347012147084929
[03/07/2022-05:05:57] [V] [TRT] Tactic: 5288347012147084929 Time: 0.090608
[03/07/2022-05:05:57] [V] [TRT] MatMul_1 + b4/read:0 + (Unnamed Layer* 37) [Shuffle] + unsqueeze_node_after_b4/read:0 + (Unnamed Layer* 37) [Shuffle] + add_3 Set Tactic Name: maxwell_scudnn_128x128_relu_interior_nn_v1 Tactic: 5326823351883942011
[03/07/2022-05:05:57] [V] [TRT] Tactic: 5326823351883942011 Time: 0.090484
[03/07/2022-05:05:57] [V] [TRT] MatMul_1 + b4/read:0 + (Unnamed Layer* 37) [Shuffle] + unsqueeze_node_after_b4/read:0 + (Unnamed Layer* 37) [Shuffle] + add_3 Set Tactic Name: maxwell_scudnn_128x64_relu_interior_nn_v0 Tactic: 5500448035057547314
[03/07/2022-05:05:57] [V] [TRT] Tactic: 5500448035057547314 Time: 0.077672
[03/07/2022-05:05:57] [V] [TRT] MatMul_1 + b4/read:0 + (Unnamed Layer* 37) [Shuffle] + unsqueeze_node_after_b4/read:0 + (Unnamed Layer* 37) [Shuffle] + add_3 Set Tactic Name: maxwell_scudnn_128x64_relu_medium_nn_v1 Tactic: 6645123197870846056
[03/07/2022-05:05:57] [V] [TRT] Tactic: 6645123197870846056 Time: 0.06802
[03/07/2022-05:05:57] [V] [TRT] MatMul_1 + b4/read:0 + (Unnamed Layer* 37) [Shuffle] + unsqueeze_node_after_b4/read:0 + (Unnamed Layer* 37) [Shuffle] + add_3 Set Tactic Name: maxwell_scudnn_128x32_relu_small_nn_v0 Tactic: 7144526460361122478
[03/07/2022-05:05:57] [V] [TRT] Tactic: 7144526460361122478 Time: 0.063928
[03/07/2022-05:05:57] [V] [TRT] MatMul_1 + b4/read:0 + (Unnamed Layer* 37) [Shuffle] + unsqueeze_node_after_b4/read:0 + (Unnamed Layer* 37) [Shuffle] + add_3 Set Tactic Name: maxwell_scudnn_128x128_relu_medium_nn_v0 Tactic: -8262349710178828730
[03/07/2022-05:05:57] [V] [TRT] Tactic: -8262349710178828730 Time: 0.092588
[03/07/2022-05:05:57] [V] [TRT] MatMul_1 + b4/read:0 + (Unnamed Layer* 37) [Shuffle] + unsqueeze_node_after_b4/read:0 + (Unnamed Layer* 37) [Shuffle] + add_3 Set Tactic Name: maxwell_scudnn_128x32_relu_interior_nn_v1 Tactic: -6576203419454146580
[03/07/2022-05:05:57] [V] [TRT] Tactic: -6576203419454146580 Time: 0.065164
[03/07/2022-05:05:57] [V] [TRT] MatMul_1 + b4/read:0 + (Unnamed Layer* 37) [Shuffle] + unsqueeze_node_after_b4/read:0 + (Unnamed Layer* 37) [Shuffle] + add_3 Set Tactic Name: maxwell_scudnn_128x32_relu_medium_nn_v0 Tactic: -4787320710726427159
[03/07/2022-05:05:57] [V] [TRT] Tactic: -4787320710726427159 Time: 0.068848
[03/07/2022-05:05:57] [V] [TRT] MatMul_1 + b4/read:0 + (Unnamed Layer* 37) [Shuffle] + unsqueeze_node_after_b4/read:0 + (Unnamed Layer* 37) [Shuffle] + add_3 Set Tactic Name: maxwell_scudnn_128x32_relu_small_nn_v1 Tactic: -3456450830548107839
[03/07/2022-05:05:57] [V] [TRT] Tactic: -3456450830548107839 Time: 0.069156
[03/07/2022-05:05:57] [V] [TRT] MatMul_1 + b4/read:0 + (Unnamed Layer* 37) [Shuffle] + unsqueeze_node_after_b4/read:0 + (Unnamed Layer* 37) [Shuffle] + add_3 Set Tactic Name: maxwell_scudnn_128x64_relu_medium_nn_v0 Tactic: -1218658103698133241
[03/07/2022-05:05:57] [V] [TRT] Tactic: -1218658103698133241 Time: 0.084084
[03/07/2022-05:05:57] [V] [TRT] MatMul_1 + b4/read:0 + (Unnamed Layer* 37) [Shuffle] + unsqueeze_node_after_b4/read:0 + (Unnamed Layer* 37) [Shuffle] + add_3 Set Tactic Name: maxwell_scudnn_128x64_relu_small_nn_v0 Tactic: -836875257600482091
[03/07/2022-05:05:57] [V] [TRT] Tactic: -836875257600482091 Time: 0.07926
[03/07/2022-05:05:57] [V] [TRT] MatMul_1 + b4/read:0 + (Unnamed Layer* 37) [Shuffle] + unsqueeze_node_after_b4/read:0 + (Unnamed Layer* 37) [Shuffle] + add_3 Set Tactic Name: maxwell_scudnn_128x128_relu_small_nn_v1 Tactic: -410470605513481746
[03/07/2022-05:05:57] [V] [TRT] Tactic: -410470605513481746 Time: 0.089764
[03/07/2022-05:05:57] [V] [TRT] MatMul_1 + b4/read:0 + (Unnamed Layer* 37) [Shuffle] + unsqueeze_node_after_b4/read:0 + (Unnamed Layer* 37) [Shuffle] + add_3 Set Tactic Name: maxwell_scudnn_128x128_relu_interior_nn_v0 Tactic: -377491875521947884
[03/07/2022-05:05:57] [V] [TRT] Tactic: -377491875521947884 Time: 0.089608
[03/07/2022-05:05:57] [V] [TRT] MatMul_1 + b4/read:0 + (Unnamed Layer* 37) [Shuffle] + unsqueeze_node_after_b4/read:0 + (Unnamed Layer* 37) [Shuffle] + add_3 Set Tactic Name: maxwell_scudnn_128x64_relu_interior_nn_v1 Tactic: -37215280111360163
[03/07/2022-05:05:57] [V] [TRT] Tactic: -37215280111360163 Time: 0.060912
[03/07/2022-05:05:57] [V] [TRT] Fastest Tactic: -37215280111360163 Time: 0.060912
[03/07/2022-05:05:57] [V] [TRT] >>>>>>>>>>>>>>> Chose Runner Type: CublasConvolution Tactic: 0
[03/07/2022-05:05:57] [V] [TRT] *************** Autotuning format combination: Float(1024,1,1024,1024) -> Float(10,1,10,10) ***************
[03/07/2022-05:05:57] [V] [TRT] --------------- Timing Runner: MatMul_1 + b4/read:0 + (Unnamed Layer* 37) [Shuffle] + unsqueeze_node_after_b4/read:0 + (Unnamed Layer* 37) [Shuffle] + add_3 (CudnnConvolution)
[03/07/2022-05:05:57] [V] [TRT] CudnnConvolution has no valid tactics for this config, skipping
[03/07/2022-05:05:57] [V] [TRT] --------------- Timing Runner: MatMul_1 + b4/read:0 + (Unnamed Layer* 37) [Shuffle] + unsqueeze_node_after_b4/read:0 + (Unnamed Layer* 37) [Shuffle] + add_3 (CublasConvolution)
[03/07/2022-05:05:57] [V] [TRT] CublasConvolution has no valid tactics for this config, skipping
[03/07/2022-05:05:57] [V] [TRT] --------------- Timing Runner: MatMul_1 + b4/read:0 + (Unnamed Layer* 37) [Shuffle] + unsqueeze_node_after_b4/read:0 + (Unnamed Layer* 37) [Shuffle] + add_3 (CaskConvolution)
[03/07/2022-05:05:57] [V] [TRT] CaskConvolution has no valid tactics for this config, skipping
[03/07/2022-05:05:57] [V] [TRT] *************** Autotuning format combination: Half(1024,1,1,1) -> Half(10,1,1,1) ***************
[03/07/2022-05:05:57] [V] [TRT] --------------- Timing Runner: MatMul_1 + b4/read:0 + (Unnamed Layer* 37) [Shuffle] + unsqueeze_node_after_b4/read:0 + (Unnamed Layer* 37) [Shuffle] + add_3 (CudnnConvolution)
[03/07/2022-05:05:57] [V] [TRT] Tactic: 0 Time: 0.071732
[03/07/2022-05:05:57] [V] [TRT] Tactic: 1 Time: 0.067616
[03/07/2022-05:05:57] [V] [TRT] Tactic: 2 Time: 0.155452
[03/07/2022-05:05:57] [V] [TRT] Tactic: 4 Time: 0.307508
[03/07/2022-05:05:57] [V] [TRT] Tactic: 5 Time: 0.093936
[03/07/2022-05:05:57] [V] [TRT] Fastest Tactic: 1 Time: 0.067616
[03/07/2022-05:05:57] [V] [TRT] --------------- Timing Runner: MatMul_1 + b4/read:0 + (Unnamed Layer* 37) [Shuffle] + unsqueeze_node_after_b4/read:0 + (Unnamed Layer* 37) [Shuffle] + add_3 (CublasConvolution)
[03/07/2022-05:05:57] [V] [TRT] CublasConvolution has no valid tactics for this config, skipping
[03/07/2022-05:05:57] [V] [TRT] --------------- Timing Runner: MatMul_1 + b4/read:0 + (Unnamed Layer* 37) [Shuffle] + unsqueeze_node_after_b4/read:0 + (Unnamed Layer* 37) [Shuffle] + add_3 (CaskConvolution)
[03/07/2022-05:05:57] [V] [TRT] CaskConvolution has no valid tactics for this config, skipping
[03/07/2022-05:05:57] [V] [TRT] >>>>>>>>>>>>>>> Chose Runner Type: CudnnConvolution Tactic: 1
[03/07/2022-05:05:57] [V] [TRT] *************** Autotuning Reformat:Float(10,1,1,1) -> Half(10,1,1,1) ***************
[03/07/2022-05:05:57] [V] [TRT] --------------- Timing Runner: Optimizer Reformat (Reformat)
[03/07/2022-05:05:57] [V] [TRT] Tactic: 1002 Time: 0.004232
[03/07/2022-05:05:57] [V] [TRT] Tactic: 0 Time: 0.003512
[03/07/2022-05:05:57] [V] [TRT] Fastest Tactic: 0 Time: 0.003512
[03/07/2022-05:05:57] [V] [TRT] *************** Autotuning Reformat:Float(10,1,10,10) -> Float(10,1,1,1) ***************
[03/07/2022-05:05:57] [V] [TRT] --------------- Timing Runner: Optimizer Reformat (Reformat)
[03/07/2022-05:05:57] [V] [TRT] Tactic: 1002 Time: 0.0048
[03/07/2022-05:05:57] [V] [TRT] Tactic: 0 Time: 0.00332
[03/07/2022-05:05:57] [V] [TRT] Fastest Tactic: 0 Time: 0.00332
[03/07/2022-05:05:57] [V] [TRT] *************** Autotuning Reformat:Float(10,1,10,10) -> Half(10,1,1,1) ***************
[03/07/2022-05:05:57] [V] [TRT] --------------- Timing Runner: Optimizer Reformat (Reformat)
[03/07/2022-05:05:57] [V] [TRT] Tactic: 1002 Time: 0.004464
[03/07/2022-05:05:57] [V] [TRT] Tactic: 0 Time: 0.003272
[03/07/2022-05:05:57] [V] [TRT] Fastest Tactic: 0 Time: 0.003272
[03/07/2022-05:05:57] [V] [TRT] *************** Autotuning Reformat:Half(10,1,1,1) -> Float(10,1,1,1) ***************
[03/07/2022-05:05:57] [V] [TRT] --------------- Timing Runner: Optimizer Reformat (Reformat)
[03/07/2022-05:05:57] [V] [TRT] Tactic: 1002 Time: 0.004488
[03/07/2022-05:05:57] [V] [TRT] Tactic: 0 Time: 0.003308
[03/07/2022-05:05:57] [V] [TRT] Fastest Tactic: 0 Time: 0.003308
[03/07/2022-05:05:57] [V] [TRT] *************** Autotuning format combination: Float(10,1,1,1) -> Float(10,1) ***************
[03/07/2022-05:05:57] [V] [TRT] --------------- Timing Runner: copied_squeeze_after_add_3 (Shuffle)
[03/07/2022-05:05:57] [V] [TRT] Tactic: 0 Time: 0.00248
[03/07/2022-05:05:57] [V] [TRT] Fastest Tactic: 0 Time: 0.00248
[03/07/2022-05:05:57] [V] [TRT] >>>>>>>>>>>>>>> Chose Runner Type: Shuffle Tactic: 0
[03/07/2022-05:05:57] [V] [TRT] *************** Autotuning format combination: Half(10,1,1,1) -> Half(10,1) ***************
[03/07/2022-05:05:57] [V] [TRT] --------------- Timing Runner: copied_squeeze_after_add_3 (Shuffle)
[03/07/2022-05:05:57] [V] [TRT] Tactic: 0 Time: 0.00236
[03/07/2022-05:05:57] [V] [TRT] Fastest Tactic: 0 Time: 0.00236
[03/07/2022-05:05:57] [V] [TRT] >>>>>>>>>>>>>>> Chose Runner Type: Shuffle Tactic: 0
[03/07/2022-05:05:57] [V] [TRT] *************** Autotuning Reformat:Float(10,1) -> Half(10,1) ***************
[03/07/2022-05:05:57] [V] [TRT] --------------- Timing Runner: Optimizer Reformat (Reformat)
[03/07/2022-05:05:57] [V] [TRT] Tactic: 1002 Time: 0.004436
[03/07/2022-05:05:57] [V] [TRT] Tactic: 0 Time: 0.003572
[03/07/2022-05:05:57] [V] [TRT] Fastest Tactic: 0 Time: 0.003572
[03/07/2022-05:05:57] [V] [TRT] *************** Autotuning Reformat:Half(10,1) -> Float(10,1) ***************
[03/07/2022-05:05:57] [V] [TRT] --------------- Timing Runner: Optimizer Reformat (Reformat)
[03/07/2022-05:05:57] [V] [TRT] Tactic: 1002 Time: 0.004476
[03/07/2022-05:05:57] [V] [TRT] Tactic: 0 Time: 0.00318
[03/07/2022-05:05:57] [V] [TRT] Fastest Tactic: 0 Time: 0.00318
[03/07/2022-05:05:57] [V] [TRT] *************** Autotuning format combination: Float(10,1) -> Float(1,1), Int32(1,1) ***************
[03/07/2022-05:05:57] [V] [TRT] --------------- Timing Runner: y + z (LogSoftmaxTopK)
[03/07/2022-05:05:57] [V] [TRT] Tactic: 1001 Time: 0.003232
[03/07/2022-05:05:57] [V] [TRT] Tactic: 1002 Time: 0.01452
[03/07/2022-05:05:57] [V] [TRT] Fastest Tactic: 1001 Time: 0.003232
[03/07/2022-05:05:57] [V] [TRT] >>>>>>>>>>>>>>> Chose Runner Type: LogSoftmaxTopK Tactic: 1001
[03/07/2022-05:05:57] [V] [TRT] *************** Autotuning format combination: Half(10,1) -> Half(1,1), Int32(1,1) ***************
[03/07/2022-05:05:57] [V] [TRT] --------------- Timing Runner: y + z (LogSoftmaxTopK)
[03/07/2022-05:05:57] [V] [TRT] Tactic: 1001 Time: 0.003108
[03/07/2022-05:05:58] [V] [TRT] Tactic: 1002 Time: 0.01472
[03/07/2022-05:05:58] [V] [TRT] Fastest Tactic: 1001 Time: 0.003108
[03/07/2022-05:05:58] [V] [TRT] >>>>>>>>>>>>>>> Chose Runner Type: LogSoftmaxTopK Tactic: 1001
