cookbook/08-Tool/trtexec/result-FP32.txt
[05/07/2022-06:14:11] [V] [TRT] *************** Autotuning Reformat: Float(784,784,28,1) -> Float(784,1,28,1) ***************
[05/07/2022-06:14:11] [V] [TRT] --------------- Timing Runner: Optimizer Reformat(x:0 -> <out>) (Reformat)
[05/07/2022-06:14:11] [V] [TRT] Tactic: 1002 Time: 0.00434
[05/07/2022-06:14:11] [V] [TRT] Tactic: 0 Time: 0.003072
[05/07/2022-06:14:11] [V] [TRT] Fastest Tactic: 0 Time: 0.003072
[05/07/2022-06:14:11] [V] [TRT] =============== Computing reformatting costs
[05/07/2022-06:14:11] [V] [TRT] *************** Autotuning Reformat: Float(25088,1,896,32) -> Float(25088,784,28,1) ***************
[05/07/2022-06:14:11] [V] [TRT] --------------- Timing Runner: Optimizer Reformat(Relu:0 -> <out>) (Reformat)
[05/07/2022-06:14:11] [V] [TRT] Tactic: 1002 Time: 0.013312
[05/07/2022-06:14:11] [V] [TRT] Tactic: 0 Time: 0.008176
[05/07/2022-06:14:11] [V] [TRT] Fastest Tactic: 0 Time: 0.008176
[05/07/2022-06:14:11] [V] [TRT] =============== Computing reformatting costs
[05/07/2022-06:14:11] [V] [TRT] *************** Autotuning Reformat: Float(6272,196,14,1) -> Float(6272,1,448,32) ***************
[05/07/2022-06:14:11] [V] [TRT] --------------- Timing Runner: Optimizer Reformat(<in> -> MaxPool2d:0) (Reformat)
[05/07/2022-06:14:11] [V] [TRT] Tactic: 1002 Time: 0.009192
[05/07/2022-06:14:11] [V] [TRT] Tactic: 0 Time: 0.004224
[05/07/2022-06:14:11] [V] [TRT] Fastest Tactic: 0 Time: 0.004224
[05/07/2022-06:14:11] [V] [TRT] =============== Computing reformatting costs
[05/07/2022-06:14:11] [V] [TRT] *************** Autotuning Reformat: Float(6272,196,14,1) -> Float(6272,1,448,32) ***************
[05/07/2022-06:14:11] [V] [TRT] --------------- Timing Runner: Optimizer Reformat(MaxPool2d:0 -> <out>) (Reformat)
[05/07/2022-06:14:11] [V] [TRT] Tactic: 1002 Time: 0.009148
[05/07/2022-06:14:11] [V] [TRT] Tactic: 0 Time: 0.004468
[05/07/2022-06:14:11] [V] [TRT] Fastest Tactic: 0 Time: 0.004468
[05/07/2022-06:14:11] [V] [TRT] *************** Autotuning Reformat: Float(6272,1,448,32) -> Float(6272,196,14,1) ***************
[05/07/2022-06:14:11] [V] [TRT] --------------- Timing Runner: Optimizer Reformat(MaxPool2d:0 -> <out>) (Reformat)
[05/07/2022-06:14:11] [V] [TRT] Tactic: 1002 Time: 0.009192
[05/07/2022-06:14:11] [V] [TRT] Tactic: 0 Time: 0.004564
[05/07/2022-06:14:11] [V] [TRT] Fastest Tactic: 0 Time: 0.004564
[05/07/2022-06:14:11] [V] [TRT] =============== Computing reformatting costs
[05/07/2022-06:14:11] [V] [TRT] *************** Autotuning Reformat: Float(12544,1,896,64) -> Float(12544,196,14,1) ***************
[05/07/2022-06:14:11] [V] [TRT] --------------- Timing Runner: Optimizer Reformat(Relu_1:0 -> <out>) (Reformat)
[05/07/2022-06:14:11] [V] [TRT] Tactic: 1002 Time: 0.00832
[05/07/2022-06:14:11] [V] [TRT] Tactic: 0 Time: 0.006132
[05/07/2022-06:14:11] [V] [TRT] Fastest Tactic: 0 Time: 0.006132
[05/07/2022-06:14:11] [V] [TRT] =============== Computing reformatting costs
[05/07/2022-06:14:11] [V] [TRT] *************** Autotuning Reformat: Float(3136,49,7,1) -> Float(3136,1,448,64) ***************
[05/07/2022-06:14:11] [V] [TRT] --------------- Timing Runner: Optimizer Reformat(<in> -> MaxPool2d_1:0) (Reformat)
[05/07/2022-06:14:11] [V] [TRT] Tactic: 1002 Time: 0.008192
[05/07/2022-06:14:11] [V] [TRT] Tactic: 0 Time: 0.004084
[05/07/2022-06:14:11] [V] [TRT] Fastest Tactic: 0 Time: 0.004084
[05/07/2022-06:14:11] [V] [TRT] *************** Autotuning Reformat: Float(3136,49,7,1) -> Float(98,49:32,7,1) ***************
[05/07/2022-06:14:11] [V] [TRT] --------------- Timing Runner: Optimizer Reformat(<in> -> MaxPool2d_1:0) (Reformat)
[05/07/2022-06:14:11] [V] [TRT] Tactic: 1002 Time: 0.008192
[05/07/2022-06:14:11] [V] [TRT] Tactic: 0 Time: 0.004096
[05/07/2022-06:14:11] [V] [TRT] Fastest Tactic: 0 Time: 0.004096
[05/07/2022-06:14:11] [V] [TRT] =============== Computing reformatting costs
[05/07/2022-06:14:11] [V] [TRT] *************** Autotuning Reformat: Float(3136,49,7,1) -> Float(3136,1,448,64) ***************
[05/07/2022-06:14:11] [V] [TRT] --------------- Timing Runner: Optimizer Reformat(MaxPool2d_1:0 -> <out>) (Reformat)
[05/07/2022-06:14:11] [V] [TRT] Tactic: 1002 Time: 0.008192
[05/07/2022-06:14:11] [V] [TRT] Tactic: 0 Time: 0.004096
[05/07/2022-06:14:11] [V] [TRT] Fastest Tactic: 0 Time: 0.004096
[05/07/2022-06:14:11] [V] [TRT] *************** Autotuning Reformat: Float(3136,49,7,1) -> Float(98,49:32,7,1) ***************
[05/07/2022-06:14:11] [V] [TRT] --------------- Timing Runner: Optimizer Reformat(MaxPool2d_1:0 -> <out>) (Reformat)
[05/07/2022-06:14:11] [V] [TRT] Tactic: 1002 Time: 0.008308
[05/07/2022-06:14:11] [V] [TRT] Tactic: 0 Time: 0.004096
[05/07/2022-06:14:11] [V] [TRT] Fastest Tactic: 0 Time: 0.004096
[05/07/2022-06:14:11] [V] [TRT] *************** Autotuning Reformat: Float(3136,1,448,64) -> Float(3136,49,7,1) ***************
[05/07/2022-06:14:11] [V] [TRT] --------------- Timing Runner: Optimizer Reformat(MaxPool2d_1:0 -> <out>) (Reformat)
[05/07/2022-06:14:11] [V] [TRT] Tactic: 1002 Time: 0.00828
[05/07/2022-06:14:11] [V] [TRT] Tactic: 0 Time: 0.00406
[05/07/2022-06:14:11] [V] [TRT] Fastest Tactic: 0 Time: 0.00406
[05/07/2022-06:14:11] [V] [TRT] *************** Autotuning Reformat: Float(3136,1,448,64) -> Float(98,49:32,7,1) ***************
[05/07/2022-06:14:11] [V] [TRT] --------------- Timing Runner: Optimizer Reformat(MaxPool2d_1:0 -> <out>) (Reformat)
[05/07/2022-06:14:11] [V] [TRT] Tactic: 1002 Time: 0.008144
[05/07/2022-06:14:11] [V] [TRT] Tactic: 0 Time: 0.00416
[05/07/2022-06:14:11] [V] [TRT] Fastest Tactic: 0 Time: 0.00416
[05/07/2022-06:14:11] [V] [TRT] *************** Autotuning Reformat: Float(98,49:32,7,1) -> Float(3136,49,7,1) ***************
[05/07/2022-06:14:11] [V] [TRT] --------------- Timing Runner: Optimizer Reformat(MaxPool2d_1:0 -> <out>) (Reformat)
[05/07/2022-06:14:11] [V] [TRT] Tactic: 1002 Time: 0.008364
[05/07/2022-06:14:11] [V] [TRT] Tactic: 0 Time: 0.004096
[05/07/2022-06:14:11] [V] [TRT] Fastest Tactic: 0 Time: 0.004096
[05/07/2022-06:14:11] [V] [TRT] *************** Autotuning Reformat: Float(98,49:32,7,1) -> Float(3136,1,448,64) ***************
[05/07/2022-06:14:11] [V] [TRT] --------------- Timing Runner: Optimizer Reformat(MaxPool2d_1:0 -> <out>) (Reformat)
[05/07/2022-06:14:11] [V] [TRT] Tactic: 1002 Time: 0.008176
[05/07/2022-06:14:11] [V] [TRT] Tactic: 0 Time: 0.003944
[05/07/2022-06:14:11] [V] [TRT] Fastest Tactic: 0 Time: 0.003944
[05/07/2022-06:14:11] [V] [TRT] =============== Computing reformatting costs
[05/07/2022-06:14:11] [V] [TRT] *************** Autotuning Reformat: Float(3136,1,1,1) -> Float(3136,1,3136,3136) ***************
[05/07/2022-06:14:11] [V] [TRT] --------------- Timing Runner: Optimizer Reformat((Unnamed Layer* 14) [Shuffle]_output -> <out>) (Reformat)
[05/07/2022-06:14:11] [V] [TRT] Tactic: 1002 Time: 0.004224
[05/07/2022-06:14:11] [V] [TRT] Tactic: 0 Time: 0.003072
[05/07/2022-06:14:11] [V] [TRT] Fastest Tactic: 0 Time: 0.003072
[05/07/2022-06:14:11] [V] [TRT] *************** Autotuning Reformat: Float(3136,1,3136,3136) -> Float(3136,1,1,1) ***************
[05/07/2022-06:14:11] [V] [TRT] --------------- Timing Runner: Optimizer Reformat((Unnamed Layer* 14) [Shuffle]_output -> <out>) (Reformat)
[05/07/2022-06:14:11] [V] [TRT] Tactic: 1002 Time: 0.004336
[05/07/2022-06:14:11] [V] [TRT] Tactic: 0 Time: 0.0032
[05/07/2022-06:14:11] [V] [TRT] Fastest Tactic: 0 Time: 0.0032
[05/07/2022-06:14:11] [V] [TRT] *************** Autotuning Reformat: Float(98,1:32,1,1) -> Float(3136,1,1,1) ***************
[05/07/2022-06:14:11] [V] [TRT] --------------- Timing Runner: Optimizer Reformat((Unnamed Layer* 14) [Shuffle]_output -> <out>) (Reformat)
[05/07/2022-06:14:11] [V] [TRT] Tactic: 1002 Time: 0.027936
[05/07/2022-06:14:11] [V] [TRT] Tactic: 0 Time: 0.0032
[05/07/2022-06:14:11] [V] [TRT] Fastest Tactic: 0 Time: 0.0032
[05/07/2022-06:14:11] [V] [TRT] *************** Autotuning Reformat: Float(98,1:32,1,1) -> Float(3136,1,3136,3136) ***************
[05/07/2022-06:14:11] [V] [TRT] --------------- Timing Runner: Optimizer Reformat((Unnamed Layer* 14) [Shuffle]_output -> <out>) (Reformat)
[05/07/2022-06:14:11] [V] [TRT] Tactic: 1002 Time: 0.010592
[05/07/2022-06:14:11] [V] [TRT] Tactic: 0 Time: 0.003456
[05/07/2022-06:14:11] [V] [TRT] Fastest Tactic: 0 Time: 0.003456
[05/07/2022-06:14:11] [V] [TRT] =============== Computing reformatting costs
[05/07/2022-06:14:11] [V] [TRT] *************** Autotuning Reformat: Float(1024,1,1,1) -> Float(1024,1,1024,1024) ***************
[05/07/2022-06:14:11] [V] [TRT] --------------- Timing Runner: Optimizer Reformat(Relu_2_out_tensor -> <out>) (Reformat)
[05/07/2022-06:14:11] [V] [TRT] Tactic: 1002 Time: 0.004292
[05/07/2022-06:14:11] [V] [TRT] Tactic: 0 Time: 0.003072
[05/07/2022-06:14:11] [V] [TRT] Fastest Tactic: 0 Time: 0.003072
[05/07/2022-06:14:11] [V] [TRT] *************** Autotuning Reformat: Float(1024,1,1024,1024) -> Float(1024,1,1,1) ***************
[05/07/2022-06:14:11] [V] [TRT] --------------- Timing Runner: Optimizer Reformat(Relu_2_out_tensor -> <out>) (Reformat)
[05/07/2022-06:14:11] [V] [TRT] Tactic: 1002 Time: 0.00418
[05/07/2022-06:14:11] [V] [TRT] Tactic: 0 Time: 0.003072
[05/07/2022-06:14:11] [V] [TRT] Fastest Tactic: 0 Time: 0.003072
[05/07/2022-06:14:11] [V] [TRT] =============== Computing reformatting costs
[05/07/2022-06:14:11] [V] [TRT] *************** Autotuning Reformat: Float(10,1,10,10) -> Float(10,1,1,1) ***************
[05/07/2022-06:14:11] [V] [TRT] --------------- Timing Runner: Optimizer Reformat(add_3_out_tensor -> <out>) (Reformat)
[05/07/2022-06:14:11] [V] [TRT] Tactic: 1002 Time: 0.007832
[05/07/2022-06:14:11] [V] [TRT] Tactic: 0 Time: 0.003072
[05/07/2022-06:14:11] [V] [TRT] Fastest Tactic: 0 Time: 0.003072
[05/07/2022-06:14:11] [V] [TRT] =============== Computing reformatting costs
[05/07/2022-06:14:11] [V] [TRT] =============== Computing reformatting costs
[05/07/2022-06:14:11] [V] [TRT] =============== Computing reformatting costs
[05/07/2022-06:14:11] [V] [TRT] =============== Computing reformatting costs
[05/07/2022-06:14:11] [V] [TRT] =============== Computing reformatting costs
[05/07/2022-06:14:11] [V] [TRT] =============== Computing reformatting costs
[05/07/2022-06:14:11] [V] [TRT] =============== Computing costs for 
[05/07/2022-06:14:11] [V] [TRT] *************** Autotuning format combination: Float(784,784,28,1) -> Float(25088,784,28,1) ***************
[05/07/2022-06:14:11] [V] [TRT] --------------- Timing Runner: Conv__25 + Relu (CudaDepthwiseConvolution)
[05/07/2022-06:14:11] [V] [TRT] CudaDepthwiseConvolution has no valid tactics for this config, skipping
[05/07/2022-06:14:11] [V] [TRT] --------------- Timing Runner: Conv__25 + Relu (FusedConvActConvolution)
[05/07/2022-06:14:11] [V] [TRT] FusedConvActConvolution has no valid tactics for this config, skipping
[05/07/2022-06:14:11] [V] [TRT] --------------- Timing Runner: Conv__25 + Relu (CudnnConvolution)
[05/07/2022-06:14:11] [V] [TRT] Tactic: 0 Time: 0.02206
[05/07/2022-06:14:11] [V] [TRT] Tactic: 1 Time: 0.02162
[05/07/2022-06:14:11] [V] [TRT] Tactic: 2 Time: 0.028644
[05/07/2022-06:14:11] [V] [TRT] Tactic: 4 Time: 0.036268
[05/07/2022-06:14:11] [V] [TRT] Tactic: 5 Time: 0.036536
[05/07/2022-06:14:11] [V] [TRT] Fastest Tactic: 1 Time: 0.02162
[05/07/2022-06:14:11] [V] [TRT] --------------- Timing Runner: Conv__25 + Relu (CaskConvolution)
[05/07/2022-06:14:11] [V] [TRT] Conv__25 + Relu Set Tactic Name: maxwell_scudnn_128x32_relu_medium_nn_v1 Tactic: 1062367460111450758
[05/07/2022-06:14:11] [V] [TRT] Tactic: 1062367460111450758 Time: 0.012316
[05/07/2022-06:14:11] [V] [TRT] Conv__25 + Relu Set Tactic Name: maxwell_scudnn_128x32_relu_large_nn_v0 Tactic: 1754984623894446479
[05/07/2022-06:14:11] [V] [TRT] Tactic: 1754984623894446479 Time: 0.01022
[05/07/2022-06:14:11] [V] [TRT] Conv__25 + Relu Set Tactic Name: maxwell_scudnn_128x128_relu_large_nn_v0 Tactic: 3611739942397549984
[05/07/2022-06:14:11] [V] [TRT] Tactic: 3611739942397549984 Time: 0.016732
[05/07/2022-06:14:11] [V] [TRT] Conv__25 + Relu Set Tactic Name: maxwell_scudnn_128x64_relu_large_nn_v1 Tactic: 4337000649858996379
[05/07/2022-06:14:11] [V] [TRT] Tactic: 4337000649858996379 Time: 0.012544
[05/07/2022-06:14:11] [V] [TRT] Conv__25 + Relu Set Tactic Name: maxwell_scudnn_128x128_relu_medium_nn_v1 Tactic: 4501471010995462441
[05/07/2022-06:14:11] [V] [TRT] Tactic: 4501471010995462441 Time: 0.015872
[05/07/2022-06:14:11] [V] [TRT] Conv__25 + Relu Set Tactic Name: maxwell_scudnn_128x64_relu_small_nn_v1 Tactic: 5137655947464784826
[05/07/2022-06:14:11] [V] [TRT] Tactic: 5137655947464784826 Time: 0.011616
[05/07/2022-06:14:11] [V] [TRT] Conv__25 + Relu Set Tactic Name: maxwell_scudnn_128x128_relu_small_nn_v0 Tactic: 5288347012147084929
[05/07/2022-06:14:11] [V] [TRT] Tactic: 5288347012147084929 Time: 0.016348
[05/07/2022-06:14:11] [V] [TRT] Conv__25 + Relu Set Tactic Name: maxwell_scudnn_128x64_relu_medium_nn_v1 Tactic: 6645123197870846056
[05/07/2022-06:14:11] [V] [TRT] Tactic: 6645123197870846056 Time: 0.012396
[05/07/2022-06:14:11] [V] [TRT] Conv__25 + Relu Set Tactic Name: maxwell_scudnn_128x32_relu_small_nn_v0 Tactic: 7144526460361122478
[05/07/2022-06:14:11] [V] [TRT] Tactic: 7144526460361122478 Time: 0.00932
[05/07/2022-06:14:11] [V] [TRT] Conv__25 + Relu Set Tactic Name: maxwell_scudnn_128x128_relu_large_nn_v1 Tactic: -9137461792520977713
[05/07/2022-06:14:11] [V] [TRT] Tactic: -9137461792520977713 Time: 0.01658
[05/07/2022-06:14:11] [V] [TRT] Conv__25 + Relu Set Tactic Name: maxwell_scudnn_128x128_relu_medium_nn_v0 Tactic: -8262349710178828730
[05/07/2022-06:14:11] [V] [TRT] Tactic: -8262349710178828730 Time: 0.016576
[05/07/2022-06:14:11] [V] [TRT] Conv__25 + Relu Set Tactic Name: maxwell_scudnn_128x64_relu_large_nn_v0 Tactic: -8133971918129952780
[05/07/2022-06:14:11] [V] [TRT] Tactic: -8133971918129952780 Time: 0.013288
[05/07/2022-06:14:11] [V] [TRT] Conv__25 + Relu Set Tactic Name: maxwell_scudnn_128x32_relu_large_nn_v1 Tactic: -6092040395344634144
[05/07/2022-06:14:11] [V] [TRT] Tactic: -6092040395344634144 Time: 0.0133
[05/07/2022-06:14:11] [V] [TRT] Conv__25 + Relu Set Tactic Name: maxwell_scudnn_128x32_relu_medium_nn_v0 Tactic: -4787320710726427159
[05/07/2022-06:14:11] [V] [TRT] Tactic: -4787320710726427159 Time: 0.009956
[05/07/2022-06:14:11] [V] [TRT] Conv__25 + Relu Set Tactic Name: maxwell_scudnn_128x32_relu_small_nn_v1 Tactic: -3456450830548107839
[05/07/2022-06:14:11] [V] [TRT] Tactic: -3456450830548107839 Time: 0.01124
[05/07/2022-06:14:11] [V] [TRT] Conv__25 + Relu Set Tactic Name: maxwell_scudnn_128x64_relu_medium_nn_v0 Tactic: -1218658103698133241
[05/07/2022-06:14:11] [V] [TRT] Tactic: -1218658103698133241 Time: 0.012288
[05/07/2022-06:14:11] [V] [TRT] Conv__25 + Relu Set Tactic Name: maxwell_scudnn_128x64_relu_small_nn_v0 Tactic: -836875257600482091
[05/07/2022-06:14:11] [V] [TRT] Tactic: -836875257600482091 Time: 0.012288
[05/07/2022-06:14:11] [V] [TRT] Conv__25 + Relu Set Tactic Name: maxwell_scudnn_128x128_relu_small_nn_v1 Tactic: -410470605513481746
[05/07/2022-06:14:11] [V] [TRT] Tactic: -410470605513481746 Time: 0.015512
[05/07/2022-06:14:11] [V] [TRT] Fastest Tactic: 7144526460361122478 Time: 0.00932
[05/07/2022-06:14:11] [V] [TRT] >>>>>>>>>>>>>>> Chose Runner Type: CaskConvolution Tactic: 7144526460361122478
[05/07/2022-06:14:11] [V] [TRT] *************** Autotuning format combination: Float(784,1,28,1) -> Float(25088,1,896,32) ***************
[05/07/2022-06:14:11] [V] [TRT] --------------- Timing Runner: Conv__25 + Relu (CudnnConvolution)
[05/07/2022-06:14:11] [V] [TRT] CudnnConvolution has no valid tactics for this config, skipping
[05/07/2022-06:14:11] [V] [TRT] --------------- Timing Runner: Conv__25 + Relu (CaskConvolution)
[05/07/2022-06:14:11] [V] [TRT] CaskConvolution has no valid tactics for this config, skipping
[05/07/2022-06:14:11] [V] [TRT] =============== Computing costs for 
[05/07/2022-06:14:11] [V] [TRT] *************** Autotuning format combination: Float(25088,784,28,1) -> Float(6272,196,14,1) ***************
[05/07/2022-06:14:11] [V] [TRT] --------------- Timing Runner: MaxPool2d (TiledPooling)
[05/07/2022-06:14:11] [V] [TRT] Tactic: 5505281 Time: 0.009188
[05/07/2022-06:14:11] [V] [TRT] Tactic: 5570817 Time: 0.006848
[05/07/2022-06:14:11] [V] [TRT] Tactic: 5636353 Time: 0.006164
[05/07/2022-06:14:11] [V] [TRT] Tactic: 5701889 Time: 0.005344
[05/07/2022-06:14:12] [V] [TRT] Tactic: 5767425 Time: 0.005528
[05/07/2022-06:14:12] [V] [TRT] Tactic: 5832961 Time: 0.005632
[05/07/2022-06:14:12] [V] [TRT] Tactic: 5898497 Time: 0.005992
[05/07/2022-06:14:12] [V] [TRT] Tactic: 5964033 Time: 0.005096
[05/07/2022-06:14:12] [V] [TRT] Tactic: 6029569 Time: 0.00626
[05/07/2022-06:14:12] [V] [TRT] Tactic: 6095105 Time: 0.00512
[05/07/2022-06:14:12] [V] [TRT] Tactic: 6160641 Time: 0.00448
[05/07/2022-06:14:12] [V] [TRT] Tactic: 6226177 Time: 0.004096
[05/07/2022-06:14:12] [V] [TRT] Tactic: 6291713 Time: 0.004132
[05/07/2022-06:14:12] [V] [TRT] Tactic: 6357249 Time: 0.004224
[05/07/2022-06:14:12] [V] [TRT] Tactic: 6422785 Time: 0.00422
[05/07/2022-06:14:12] [V] [TRT] Tactic: 6488321 Time: 0.004096
[05/07/2022-06:14:12] [V] [TRT] Fastest Tactic: 6226177 Time: 0.004096
[05/07/2022-06:14:12] [V] [TRT] --------------- Timing Runner: MaxPool2d (CudnnPooling)
[05/07/2022-06:14:12] [V] [TRT] Tactic: -1 Time: 0.005064
[05/07/2022-06:14:12] [V] [TRT] Fastest Tactic: -1 Time: 0.005064
[05/07/2022-06:14:12] [V] [TRT] >>>>>>>>>>>>>>> Chose Runner Type: TiledPooling Tactic: 6226177
[05/07/2022-06:14:12] [V] [TRT] =============== Computing costs for 
[05/07/2022-06:14:12] [V] [TRT] *************** Autotuning format combination: Float(6272,196,14,1) -> Float(12544,196,14,1) ***************
[05/07/2022-06:14:12] [V] [TRT] --------------- Timing Runner: Conv__27 + Relu_1 (CudaDepthwiseConvolution)
[05/07/2022-06:14:12] [V] [TRT] CudaDepthwiseConvolution has no valid tactics for this config, skipping
[05/07/2022-06:14:12] [V] [TRT] --------------- Timing Runner: Conv__27 + Relu_1 (FusedConvActConvolution)
[05/07/2022-06:14:12] [V] [TRT] FusedConvActConvolution has no valid tactics for this config, skipping
[05/07/2022-06:14:12] [V] [TRT] --------------- Timing Runner: Conv__27 + Relu_1 (CudnnConvolution)
[05/07/2022-06:14:12] [V] [TRT] Tactic: 0 Time: 0.07808
[05/07/2022-06:14:12] [V] [TRT] Tactic: 1 Time: 0.080708
[05/07/2022-06:14:12] [V] [TRT] Tactic: 2 Time: 0.122308
[05/07/2022-06:14:12] [V] [TRT] Tactic: 4 Time: 0.179044
[05/07/2022-06:14:12] [V] [TRT] Tactic: 5 Time: 0.19502
[05/07/2022-06:14:12] [V] [TRT] Fastest Tactic: 0 Time: 0.07808
[05/07/2022-06:14:12] [V] [TRT] --------------- Timing Runner: Conv__27 + Relu_1 (CaskConvolution)
[05/07/2022-06:14:12] [V] [TRT] Conv__27 + Relu_1 Set Tactic Name: maxwell_scudnn_128x32_relu_medium_nn_v1 Tactic: 1062367460111450758
[05/07/2022-06:14:12] [V] [TRT] Tactic: 1062367460111450758 Time: 0.120712
[05/07/2022-06:14:12] [V] [TRT] Conv__27 + Relu_1 Set Tactic Name: maxwell_scudnn_128x32_relu_large_nn_v0 Tactic: 1754984623894446479
[05/07/2022-06:14:12] [V] [TRT] Tactic: 1754984623894446479 Time: 0.09122
[05/07/2022-06:14:12] [V] [TRT] Conv__27 + Relu_1 Set Tactic Name: maxwell_scudnn_128x128_relu_large_nn_v0 Tactic: 3611739942397549984
[05/07/2022-06:14:12] [V] [TRT] Tactic: 3611739942397549984 Time: 0.099464
[05/07/2022-06:14:12] [V] [TRT] Conv__27 + Relu_1 Set Tactic Name: maxwell_scudnn_128x64_relu_large_nn_v1 Tactic: 4337000649858996379
[05/07/2022-06:14:12] [V] [TRT] Tactic: 4337000649858996379 Time: 0.091136
[05/07/2022-06:14:12] [V] [TRT] Conv__27 + Relu_1 Set Tactic Name: maxwell_scudnn_128x128_relu_medium_nn_v1 Tactic: 4501471010995462441
[05/07/2022-06:14:12] [V] [TRT] Tactic: 4501471010995462441 Time: 0.099564
[05/07/2022-06:14:12] [V] [TRT] Conv__27 + Relu_1 Set Tactic Name: maxwell_scudnn_128x64_relu_small_nn_v1 Tactic: 5137655947464784826
[05/07/2022-06:14:12] [V] [TRT] Tactic: 5137655947464784826 Time: 0.060392
[05/07/2022-06:14:12] [V] [TRT] Conv__27 + Relu_1 Set Tactic Name: maxwell_scudnn_128x128_relu_small_nn_v0 Tactic: 5288347012147084929
[05/07/2022-06:14:12] [V] [TRT] Tactic: 5288347012147084929 Time: 0.086288
[05/07/2022-06:14:12] [V] [TRT] Conv__27 + Relu_1 Set Tactic Name: maxwell_scudnn_128x64_relu_medium_nn_v1 Tactic: 6645123197870846056
[05/07/2022-06:14:12] [V] [TRT] Tactic: 6645123197870846056 Time: 0.082304
[05/07/2022-06:14:12] [V] [TRT] Conv__27 + Relu_1 Set Tactic Name: maxwell_scudnn_128x32_relu_small_nn_v0 Tactic: 7144526460361122478
[05/07/2022-06:14:12] [V] [TRT] Tactic: 7144526460361122478 Time: 0.069588
[05/07/2022-06:14:12] [V] [TRT] Conv__27 + Relu_1 Set Tactic Name: maxwell_scudnn_128x128_relu_large_nn_v1 Tactic: -9137461792520977713
[05/07/2022-06:14:12] [V] [TRT] Tactic: -9137461792520977713 Time: 0.103144
[05/07/2022-06:14:12] [V] [TRT] Conv__27 + Relu_1 Set Tactic Name: maxwell_scudnn_128x128_relu_medium_nn_v0 Tactic: -8262349710178828730
[05/07/2022-06:14:12] [V] [TRT] Tactic: -8262349710178828730 Time: 0.099456
[05/07/2022-06:14:12] [V] [TRT] Conv__27 + Relu_1 Set Tactic Name: maxwell_scudnn_128x64_relu_large_nn_v0 Tactic: -8133971918129952780
[05/07/2022-06:14:12] [V] [TRT] Tactic: -8133971918129952780 Time: 0.1071
[05/07/2022-06:14:12] [V] [TRT] Conv__27 + Relu_1 Set Tactic Name: maxwell_scudnn_128x32_relu_large_nn_v1 Tactic: -6092040395344634144
[05/07/2022-06:14:12] [V] [TRT] Tactic: -6092040395344634144 Time: 0.125884
[05/07/2022-06:14:12] [V] [TRT] Conv__27 + Relu_1 Set Tactic Name: maxwell_scudnn_128x32_relu_medium_nn_v0 Tactic: -4787320710726427159
[05/07/2022-06:14:12] [V] [TRT] Tactic: -4787320710726427159 Time: 0.0896
[05/07/2022-06:14:12] [V] [TRT] Conv__27 + Relu_1 Set Tactic Name: maxwell_scudnn_128x32_relu_small_nn_v1 Tactic: -3456450830548107839
[05/07/2022-06:14:12] [V] [TRT] Tactic: -3456450830548107839 Time: 0.07112
[05/07/2022-06:14:12] [V] [TRT] Conv__27 + Relu_1 Set Tactic Name: maxwell_scudnn_128x64_relu_medium_nn_v0 Tactic: -1218658103698133241
[05/07/2022-06:14:12] [V] [TRT] Tactic: -1218658103698133241 Time: 0.105952
[05/07/2022-06:14:12] [V] [TRT] Conv__27 + Relu_1 Set Tactic Name: maxwell_scudnn_128x64_relu_small_nn_v0 Tactic: -836875257600482091
[05/07/2022-06:14:12] [V] [TRT] Tactic: -836875257600482091 Time: 0.087372
[05/07/2022-06:14:12] [V] [TRT] Conv__27 + Relu_1 Set Tactic Name: maxwell_scudnn_128x128_relu_small_nn_v1 Tactic: -410470605513481746
[05/07/2022-06:14:12] [V] [TRT] Tactic: -410470605513481746 Time: 0.084712
[05/07/2022-06:14:12] [V] [TRT] Fastest Tactic: 5137655947464784826 Time: 0.060392
[05/07/2022-06:14:12] [V] [TRT] >>>>>>>>>>>>>>> Chose Runner Type: CaskConvolution Tactic: 5137655947464784826
[05/07/2022-06:14:12] [V] [TRT] *************** Autotuning format combination: Float(6272,1,448,32) -> Float(12544,1,896,64) ***************
[05/07/2022-06:14:12] [V] [TRT] --------------- Timing Runner: Conv__27 + Relu_1 (CudnnConvolution)
[05/07/2022-06:14:12] [V] [TRT] CudnnConvolution has no valid tactics for this config, skipping
[05/07/2022-06:14:12] [V] [TRT] --------------- Timing Runner: Conv__27 + Relu_1 (CaskConvolution)
[05/07/2022-06:14:12] [V] [TRT] Conv__27 + Relu_1 Set Tactic Name: maxwell_scudnn_128x32_sliced1x4_ldg4_relu_exp_small_nhwc_tn_v1 Tactic: -9153228964338181824
[05/07/2022-06:14:12] [V] [TRT] Tactic: -9153228964338181824 Time: 0.027576
[05/07/2022-06:14:12] [V] [TRT] Conv__27 + Relu_1 Set Tactic Name: maxwell_scudnn_128x64_sliced1x2_ldg4_relu_exp_small_nhwc_tn_v1 Tactic: -7394439838318485025
[05/07/2022-06:14:12] [V] [TRT] Tactic: -7394439838318485025 Time: 0.047244
[05/07/2022-06:14:12] [V] [TRT] Fastest Tactic: -9153228964338181824 Time: 0.027576
[05/07/2022-06:14:12] [V] [TRT] >>>>>>>>>>>>>>> Chose Runner Type: CaskConvolution Tactic: -9153228964338181824
[05/07/2022-06:14:12] [V] [TRT] =============== Computing costs for 
[05/07/2022-06:14:12] [V] [TRT] *************** Autotuning format combination: Float(12544,196,14,1) -> Float(3136,49,7,1) ***************
[05/07/2022-06:14:12] [V] [TRT] --------------- Timing Runner: MaxPool2d_1 (TiledPooling)
[05/07/2022-06:14:12] [V] [TRT] Tactic: 5505281 Time: 0.011176
[05/07/2022-06:14:12] [V] [TRT] Tactic: 5570817 Time: 0.008128
[05/07/2022-06:14:12] [V] [TRT] Tactic: 5636353 Time: 0.007144
[05/07/2022-06:14:12] [V] [TRT] Tactic: 5701889 Time: 0.006236
[05/07/2022-06:14:12] [V] [TRT] Tactic: 5767425 Time: 0.006156
[05/07/2022-06:14:12] [V] [TRT] Tactic: 5832961 Time: 0.006272
[05/07/2022-06:14:13] [V] [TRT] Tactic: 5898497 Time: 0.006416
[05/07/2022-06:14:13] [V] [TRT] Tactic: 5964033 Time: 0.00598
[05/07/2022-06:14:13] [V] [TRT] Tactic: 6029569 Time: 0.007244
[05/07/2022-06:14:13] [V] [TRT] Tactic: 6095105 Time: 0.00538
[05/07/2022-06:14:13] [V] [TRT] Tactic: 6160641 Time: 0.00512
[05/07/2022-06:14:13] [V] [TRT] Tactic: 6226177 Time: 0.005084
[05/07/2022-06:14:13] [V] [TRT] Tactic: 6291713 Time: 0.00448
[05/07/2022-06:14:13] [V] [TRT] Tactic: 6357249 Time: 0.004336
[05/07/2022-06:14:13] [V] [TRT] Tactic: 6422785 Time: 0.005028
[05/07/2022-06:14:13] [V] [TRT] Tactic: 6488321 Time: 0.005032
[05/07/2022-06:14:13] [V] [TRT] Fastest Tactic: 6357249 Time: 0.004336
[05/07/2022-06:14:13] [V] [TRT] --------------- Timing Runner: MaxPool2d_1 (CudnnPooling)
[05/07/2022-06:14:13] [V] [TRT] Tactic: -1 Time: 0.004964
[05/07/2022-06:14:13] [V] [TRT] Fastest Tactic: -1 Time: 0.004964
[05/07/2022-06:14:13] [V] [TRT] >>>>>>>>>>>>>>> Chose Runner Type: TiledPooling Tactic: 6357249
[05/07/2022-06:14:13] [V] [TRT] =============== Computing costs for 
[05/07/2022-06:14:13] [V] [TRT] *************** Autotuning format combination: Float(3136,49,7,1) -> Float(3136,1,1,1) ***************
[05/07/2022-06:14:13] [V] [TRT] --------------- Timing Runner: MaxPool2d_1__22 + Reshape + (Unnamed Layer* 14) [Shuffle] (Shuffle)
[05/07/2022-06:14:13] [V] [TRT] Tactic: 0 Time: 0.004228
[05/07/2022-06:14:13] [V] [TRT] Fastest Tactic: 0 Time: 0.004228
[05/07/2022-06:14:13] [V] [TRT] >>>>>>>>>>>>>>> Chose Runner Type: Shuffle Tactic: 0
[05/07/2022-06:14:13] [V] [TRT] *************** Autotuning format combination: Float(3136,1,448,64) -> Float(3136,1,3136,3136) ***************
[05/07/2022-06:14:13] [V] [TRT] --------------- Timing Runner: MaxPool2d_1__22 + Reshape + (Unnamed Layer* 14) [Shuffle] (Shuffle)
[05/07/2022-06:14:13] [V] [TRT] Tactic: 0 Time: 0.004096
[05/07/2022-06:14:13] [V] [TRT] Fastest Tactic: 0 Time: 0.004096
[05/07/2022-06:14:13] [V] [TRT] >>>>>>>>>>>>>>> Chose Runner Type: Shuffle Tactic: 0
[05/07/2022-06:14:13] [V] [TRT] *************** Autotuning format combination: Float(98,49:32,7,1) -> Float(98,1:32,1,1) ***************
[05/07/2022-06:14:13] [V] [TRT] --------------- Timing Runner: MaxPool2d_1__22 + Reshape + (Unnamed Layer* 14) [Shuffle] (Shuffle)
[05/07/2022-06:14:13] [V] [TRT] Tactic: 0 Time: 0.004192
[05/07/2022-06:14:13] [V] [TRT] Fastest Tactic: 0 Time: 0.004192
[05/07/2022-06:14:13] [V] [TRT] >>>>>>>>>>>>>>> Chose Runner Type: Shuffle Tactic: 0
[05/07/2022-06:14:13] [V] [TRT] =============== Computing costs for 
[05/07/2022-06:14:13] [V] [TRT] *************** Autotuning format combination: Float(3136,1,1,1) -> Float(1024,1,1,1) ***************
[05/07/2022-06:14:13] [V] [TRT] --------------- Timing Runner: MatMul + b3/read:0 + (Unnamed Layer* 21) [Shuffle] + unsqueeze_node_after_b3/read:0 + (Unnamed Layer* 21) [Shuffle]_(Unnamed Layer* 21) [Shuffle]_output + add_2 + Relu_2 (CudaDepthwiseConvolution)
[05/07/2022-06:14:13] [V] [TRT] CudaDepthwiseConvolution has no valid tactics for this config, skipping
[05/07/2022-06:14:13] [V] [TRT] --------------- Timing Runner: MatMul + b3/read:0 + (Unnamed Layer* 21) [Shuffle] + unsqueeze_node_after_b3/read:0 + (Unnamed Layer* 21) [Shuffle]_(Unnamed Layer* 21) [Shuffle]_output + add_2 + Relu_2 (FusedConvActConvolution)
[05/07/2022-06:14:13] [V] [TRT] FusedConvActConvolution has no valid tactics for this config, skipping
[05/07/2022-06:14:13] [V] [TRT] --------------- Timing Runner: MatMul + b3/read:0 + (Unnamed Layer* 21) [Shuffle] + unsqueeze_node_after_b3/read:0 + (Unnamed Layer* 21) [Shuffle]_(Unnamed Layer* 21) [Shuffle]_output + add_2 + Relu_2 (CudnnConvolution)
[05/07/2022-06:14:13] [V] [TRT] Tactic: 0 Time: 0.330908
[05/07/2022-06:14:13] [V] [TRT] Tactic: 1 Time: 0.315988
[05/07/2022-06:14:13] [V] [TRT] Tactic: 2 Time: 0.413752
[05/07/2022-06:14:13] [V] [TRT] Tactic: 4 skipped. Scratch requested: 7527202816, available: 1073741824
[05/07/2022-06:14:13] [V] [TRT] Tactic: 5 Time: 7.00793
[05/07/2022-06:14:13] [I] [TRT] Some tactics do not have sufficient workspace memory to run. Increasing workspace size may increase performance, please check verbose output.
[05/07/2022-06:14:13] [V] [TRT] Fastest Tactic: 1 Time: 0.315988
[05/07/2022-06:14:13] [V] [TRT] Setting workspace to 7527202816enables more tactics for profiling
[05/07/2022-06:14:13] [V] [TRT] --------------- Timing Runner: MatMul + b3/read:0 + (Unnamed Layer* 21) [Shuffle] + unsqueeze_node_after_b3/read:0 + (Unnamed Layer* 21) [Shuffle]_(Unnamed Layer* 21) [Shuffle]_output + add_2 + Relu_2 (CublasConvolution)
[05/07/2022-06:14:13] [V] [TRT] Tactic: 0 Time: 0.071156
[05/07/2022-06:14:13] [V] [TRT] Tactic: 1 Time: 0.071296
[05/07/2022-06:14:13] [V] [TRT] Fastest Tactic: 0 Time: 0.071156
[05/07/2022-06:14:13] [V] [TRT] --------------- Timing Runner: MatMul + b3/read:0 + (Unnamed Layer* 21) [Shuffle] + unsqueeze_node_after_b3/read:0 + (Unnamed Layer* 21) [Shuffle]_(Unnamed Layer* 21) [Shuffle]_output + add_2 + Relu_2 (CaskConvolution)
[05/07/2022-06:14:13] [V] [TRT] MatMul + b3/read:0 + (Unnamed Layer* 21) [Shuffle] + unsqueeze_node_after_b3/read:0 + (Unnamed Layer* 21) [Shuffle]_(Unnamed Layer* 21) [Shuffle]_output + add_2 + Relu_2 Set Tactic Name: maxwell_scudnn_128x32_relu_medium_nn_v1 Tactic: 1062367460111450758
[05/07/2022-06:14:13] [V] [TRT] Tactic: 1062367460111450758 Time: 0.380904
[05/07/2022-06:14:13] [V] [TRT] MatMul + b3/read:0 + (Unnamed Layer* 21) [Shuffle] + unsqueeze_node_after_b3/read:0 + (Unnamed Layer* 21) [Shuffle]_(Unnamed Layer* 21) [Shuffle]_output + add_2 + Relu_2 Set Tactic Name: maxwell_scudnn_128x32_relu_interior_nn_v0 Tactic: 1698681053543049347
[05/07/2022-06:14:13] [V] [TRT] Tactic: 1698681053543049347 Time: 0.383304
[05/07/2022-06:14:13] [V] [TRT] MatMul + b3/read:0 + (Unnamed Layer* 21) [Shuffle] + unsqueeze_node_after_b3/read:0 + (Unnamed Layer* 21) [Shuffle]_(Unnamed Layer* 21) [Shuffle]_output + add_2 + Relu_2 Set Tactic Name: maxwell_scudnn_128x128_relu_medium_nn_v1 Tactic: 4501471010995462441
[05/07/2022-06:14:13] [V] [TRT] Tactic: 4501471010995462441 Time: 0.435056
[05/07/2022-06:14:14] [V] [TRT] MatMul + b3/read:0 + (Unnamed Layer* 21) [Shuffle] + unsqueeze_node_after_b3/read:0 + (Unnamed Layer* 21) [Shuffle]_(Unnamed Layer* 21) [Shuffle]_output + add_2 + Relu_2 Set Tactic Name: maxwell_scudnn_128x64_relu_small_nn_v1 Tactic: 5137655947464784826
[05/07/2022-06:14:14] [V] [TRT] Tactic: 5137655947464784826 Time: 0.328704
[05/07/2022-06:14:14] [V] [TRT] MatMul + b3/read:0 + (Unnamed Layer* 21) [Shuffle] + unsqueeze_node_after_b3/read:0 + (Unnamed Layer* 21) [Shuffle]_(Unnamed Layer* 21) [Shuffle]_output + add_2 + Relu_2 Set Tactic Name: maxwell_scudnn_128x128_relu_small_nn_v0 Tactic: 5288347012147084929
[05/07/2022-06:14:14] [V] [TRT] Tactic: 5288347012147084929 Time: 0.395736
[05/07/2022-06:14:14] [V] [TRT] MatMul + b3/read:0 + (Unnamed Layer* 21) [Shuffle] + unsqueeze_node_after_b3/read:0 + (Unnamed Layer* 21) [Shuffle]_(Unnamed Layer* 21) [Shuffle]_output + add_2 + Relu_2 Set Tactic Name: maxwell_scudnn_128x128_relu_interior_nn_v1 Tactic: 5326823351883942011
[05/07/2022-06:14:14] [V] [TRT] Tactic: 5326823351883942011 Time: 0.426992
[05/07/2022-06:14:14] [V] [TRT] MatMul + b3/read:0 + (Unnamed Layer* 21) [Shuffle] + unsqueeze_node_after_b3/read:0 + (Unnamed Layer* 21) [Shuffle]_(Unnamed Layer* 21) [Shuffle]_output + add_2 + Relu_2 Set Tactic Name: maxwell_scudnn_128x64_relu_interior_nn_v0 Tactic: 5500448035057547314
[05/07/2022-06:14:14] [V] [TRT] Tactic: 5500448035057547314 Time: 0.376684
[05/07/2022-06:14:14] [V] [TRT] MatMul + b3/read:0 + (Unnamed Layer* 21) [Shuffle] + unsqueeze_node_after_b3/read:0 + (Unnamed Layer* 21) [Shuffle]_(Unnamed Layer* 21) [Shuffle]_output + add_2 + Relu_2 Set Tactic Name: maxwell_scudnn_128x64_relu_medium_nn_v1 Tactic: 6645123197870846056
[05/07/2022-06:14:14] [V] [TRT] Tactic: 6645123197870846056 Time: 0.337664
[05/07/2022-06:14:14] [V] [TRT] MatMul + b3/read:0 + (Unnamed Layer* 21) [Shuffle] + unsqueeze_node_after_b3/read:0 + (Unnamed Layer* 21) [Shuffle]_(Unnamed Layer* 21) [Shuffle]_output + add_2 + Relu_2 Set Tactic Name: maxwell_scudnn_128x32_relu_small_nn_v0 Tactic: 7144526460361122478
[05/07/2022-06:14:14] [V] [TRT] Tactic: 7144526460361122478 Time: 0.383232
[05/07/2022-06:14:14] [V] [TRT] MatMul + b3/read:0 + (Unnamed Layer* 21) [Shuffle] + unsqueeze_node_after_b3/read:0 + (Unnamed Layer* 21) [Shuffle]_(Unnamed Layer* 21) [Shuffle]_output + add_2 + Relu_2 Set Tactic Name: maxwell_scudnn_128x128_relu_medium_nn_v0 Tactic: -8262349710178828730
[05/07/2022-06:14:14] [V] [TRT] Tactic: -8262349710178828730 Time: 0.387328
[05/07/2022-06:14:14] [V] [TRT] MatMul + b3/read:0 + (Unnamed Layer* 21) [Shuffle] + unsqueeze_node_after_b3/read:0 + (Unnamed Layer* 21) [Shuffle]_(Unnamed Layer* 21) [Shuffle]_output + add_2 + Relu_2 Set Tactic Name: maxwell_scudnn_128x32_relu_interior_nn_v1 Tactic: -6576203419454146580
[05/07/2022-06:14:14] [V] [TRT] Tactic: -6576203419454146580 Time: 0.342112
[05/07/2022-06:14:14] [V] [TRT] MatMul + b3/read:0 + (Unnamed Layer* 21) [Shuffle] + unsqueeze_node_after_b3/read:0 + (Unnamed Layer* 21) [Shuffle]_(Unnamed Layer* 21) [Shuffle]_output + add_2 + Relu_2 Set Tactic Name: maxwell_scudnn_128x32_relu_medium_nn_v0 Tactic: -4787320710726427159
[05/07/2022-06:14:14] [V] [TRT] Tactic: -4787320710726427159 Time: 0.36736
[05/07/2022-06:14:14] [V] [TRT] MatMul + b3/read:0 + (Unnamed Layer* 21) [Shuffle] + unsqueeze_node_after_b3/read:0 + (Unnamed Layer* 21) [Shuffle]_(Unnamed Layer* 21) [Shuffle]_output + add_2 + Relu_2 Set Tactic Name: maxwell_scudnn_128x32_relu_small_nn_v1 Tactic: -3456450830548107839
[05/07/2022-06:14:14] [V] [TRT] Tactic: -3456450830548107839 Time: 0.353164
[05/07/2022-06:14:14] [V] [TRT] MatMul + b3/read:0 + (Unnamed Layer* 21) [Shuffle] + unsqueeze_node_after_b3/read:0 + (Unnamed Layer* 21) [Shuffle]_(Unnamed Layer* 21) [Shuffle]_output + add_2 + Relu_2 Set Tactic Name: maxwell_scudnn_128x64_relu_medium_nn_v0 Tactic: -1218658103698133241
[05/07/2022-06:14:14] [V] [TRT] Tactic: -1218658103698133241 Time: 0.391296
[05/07/2022-06:14:14] [V] [TRT] MatMul + b3/read:0 + (Unnamed Layer* 21) [Shuffle] + unsqueeze_node_after_b3/read:0 + (Unnamed Layer* 21) [Shuffle]_(Unnamed Layer* 21) [Shuffle]_output + add_2 + Relu_2 Set Tactic Name: maxwell_scudnn_128x64_relu_small_nn_v0 Tactic: -836875257600482091
[05/07/2022-06:14:14] [V] [TRT] Tactic: -836875257600482091 Time: 0.380004
[05/07/2022-06:14:14] [V] [TRT] MatMul + b3/read:0 + (Unnamed Layer* 21) [Shuffle] + unsqueeze_node_after_b3/read:0 + (Unnamed Layer* 21) [Shuffle]_(Unnamed Layer* 21) [Shuffle]_output + add_2 + Relu_2 Set Tactic Name: maxwell_scudnn_128x128_relu_small_nn_v1 Tactic: -410470605513481746
[05/07/2022-06:14:14] [V] [TRT] Tactic: -410470605513481746 Time: 0.428328
[05/07/2022-06:14:14] [V] [TRT] MatMul + b3/read:0 + (Unnamed Layer* 21) [Shuffle] + unsqueeze_node_after_b3/read:0 + (Unnamed Layer* 21) [Shuffle]_(Unnamed Layer* 21) [Shuffle]_output + add_2 + Relu_2 Set Tactic Name: maxwell_scudnn_128x128_relu_interior_nn_v0 Tactic: -377491875521947884
[05/07/2022-06:14:14] [V] [TRT] Tactic: -377491875521947884 Time: 0.391392
[05/07/2022-06:14:14] [V] [TRT] MatMul + b3/read:0 + (Unnamed Layer* 21) [Shuffle] + unsqueeze_node_after_b3/read:0 + (Unnamed Layer* 21) [Shuffle]_(Unnamed Layer* 21) [Shuffle]_output + add_2 + Relu_2 Set Tactic Name: maxwell_scudnn_128x64_relu_interior_nn_v1 Tactic: -37215280111360163
[05/07/2022-06:14:14] [V] [TRT] Tactic: -37215280111360163 Time: 0.326764
[05/07/2022-06:14:14] [V] [TRT] Fastest Tactic: -37215280111360163 Time: 0.326764
[05/07/2022-06:14:14] [V] [TRT] >>>>>>>>>>>>>>> Chose Runner Type: CublasConvolution Tactic: 0
[05/07/2022-06:14:14] [V] [TRT] *************** Autotuning format combination: Float(3136,1,3136,3136) -> Float(1024,1,1024,1024) ***************
[05/07/2022-06:14:14] [V] [TRT] --------------- Timing Runner: MatMul + b3/read:0 + (Unnamed Layer* 21) [Shuffle] + unsqueeze_node_after_b3/read:0 + (Unnamed Layer* 21) [Shuffle]_(Unnamed Layer* 21) [Shuffle]_output + add_2 + Relu_2 (CudnnConvolution)
[05/07/2022-06:14:14] [V] [TRT] CudnnConvolution has no valid tactics for this config, skipping
[05/07/2022-06:14:14] [V] [TRT] --------------- Timing Runner: MatMul + b3/read:0 + (Unnamed Layer* 21) [Shuffle] + unsqueeze_node_after_b3/read:0 + (Unnamed Layer* 21) [Shuffle]_(Unnamed Layer* 21) [Shuffle]_output + add_2 + Relu_2 (CublasConvolution)
[05/07/2022-06:14:14] [V] [TRT] CublasConvolution has no valid tactics for this config, skipping
[05/07/2022-06:14:14] [V] [TRT] --------------- Timing Runner: MatMul + b3/read:0 + (Unnamed Layer* 21) [Shuffle] + unsqueeze_node_after_b3/read:0 + (Unnamed Layer* 21) [Shuffle]_(Unnamed Layer* 21) [Shuffle]_output + add_2 + Relu_2 (CaskConvolution)
[05/07/2022-06:14:14] [V] [TRT] MatMul + b3/read:0 + (Unnamed Layer* 21) [Shuffle] + unsqueeze_node_after_b3/read:0 + (Unnamed Layer* 21) [Shuffle]_(Unnamed Layer* 21) [Shuffle]_output + add_2 + Relu_2 Set Tactic Name: maxwell_scudnn_128x64_sliced1x2_ldg4_relu_exp_interior_nhwc_tn_v1 Tactic: 3886731678879822788
[05/07/2022-06:14:14] [V] [TRT] Tactic: 3886731678879822788 Time: 0.191648
[05/07/2022-06:14:14] [V] [TRT] MatMul + b3/read:0 + (Unnamed Layer* 21) [Shuffle] + unsqueeze_node_after_b3/read:0 + (Unnamed Layer* 21) [Shuffle]_(Unnamed Layer* 21) [Shuffle]_output + add_2 + Relu_2 Set Tactic Name: maxwell_scudnn_128x32_sliced1x4_ldg4_relu_exp_interior_nhwc_tn_v1 Tactic: 6629944304117643200
[05/07/2022-06:14:14] [V] [TRT] Tactic: 6629944304117643200 Time: 0.149664
[05/07/2022-06:14:14] [V] [TRT] MatMul + b3/read:0 + (Unnamed Layer* 21) [Shuffle] + unsqueeze_node_after_b3/read:0 + (Unnamed Layer* 21) [Shuffle]_(Unnamed Layer* 21) [Shuffle]_output + add_2 + Relu_2 Set Tactic Name: maxwell_scudnn_128x32_sliced1x4_ldg4_relu_exp_small_nhwc_tn_v1 Tactic: -9153228964338181824
[05/07/2022-06:14:14] [V] [TRT] Tactic: -9153228964338181824 Time: 0.150884
[05/07/2022-06:14:14] [V] [TRT] MatMul + b3/read:0 + (Unnamed Layer* 21) [Shuffle] + unsqueeze_node_after_b3/read:0 + (Unnamed Layer* 21) [Shuffle]_(Unnamed Layer* 21) [Shuffle]_output + add_2 + Relu_2 Set Tactic Name: maxwell_scudnn_128x64_sliced1x2_ldg4_relu_exp_small_nhwc_tn_v1 Tactic: -7394439838318485025
[05/07/2022-06:14:14] [V] [TRT] Tactic: -7394439838318485025 Time: 0.1926
[05/07/2022-06:14:14] [V] [TRT] Fastest Tactic: 6629944304117643200 Time: 0.149664
[05/07/2022-06:14:14] [V] [TRT] >>>>>>>>>>>>>>> Chose Runner Type: CaskConvolution Tactic: 6629944304117643200
[05/07/2022-06:14:14] [V] [TRT] =============== Computing costs for 
[05/07/2022-06:14:14] [V] [TRT] *************** Autotuning format combination: Float(1024,1,1,1) -> Float(10,1,1,1) ***************
[05/07/2022-06:14:14] [V] [TRT] --------------- Timing Runner: MatMul_1 + b4/read:0 + (Unnamed Layer* 37) [Shuffle] + unsqueeze_node_after_b4/read:0 + (Unnamed Layer* 37) [Shuffle]_(Unnamed Layer* 37) [Shuffle]_output + add_3 (CudaDepthwiseConvolution)
[05/07/2022-06:14:14] [V] [TRT] CudaDepthwiseConvolution has no valid tactics for this config, skipping
[05/07/2022-06:14:14] [V] [TRT] --------------- Timing Runner: MatMul_1 + b4/read:0 + (Unnamed Layer* 37) [Shuffle] + unsqueeze_node_after_b4/read:0 + (Unnamed Layer* 37) [Shuffle]_(Unnamed Layer* 37) [Shuffle]_output + add_3 (FusedConvActConvolution)
[05/07/2022-06:14:14] [V] [TRT] FusedConvActConvolution has no valid tactics for this config, skipping
[05/07/2022-06:14:14] [V] [TRT] --------------- Timing Runner: MatMul_1 + b4/read:0 + (Unnamed Layer* 37) [Shuffle] + unsqueeze_node_after_b4/read:0 + (Unnamed Layer* 37) [Shuffle]_(Unnamed Layer* 37) [Shuffle]_output + add_3 (CudnnConvolution)
[05/07/2022-06:14:14] [V] [TRT] Tactic: 0 Time: 0.070256
[05/07/2022-06:14:14] [V] [TRT] Tactic: 1 Time: 0.009156
[05/07/2022-06:14:14] [V] [TRT] Tactic: 2 Time: 0.344804
[05/07/2022-06:14:14] [V] [TRT] Tactic: 4 Time: 0.37528
[05/07/2022-06:14:14] [V] [TRT] Tactic: 5 Time: 0.11038
[05/07/2022-06:14:14] [V] [TRT] Fastest Tactic: 1 Time: 0.009156
[05/07/2022-06:14:14] [V] [TRT] --------------- Timing Runner: MatMul_1 + b4/read:0 + (Unnamed Layer* 37) [Shuffle] + unsqueeze_node_after_b4/read:0 + (Unnamed Layer* 37) [Shuffle]_(Unnamed Layer* 37) [Shuffle]_output + add_3 (CublasConvolution)
[05/07/2022-06:14:14] [V] [TRT] Tactic: 0 Time: 0.009192
[05/07/2022-06:14:14] [V] [TRT] Tactic: 1 Time: 0.013284
[05/07/2022-06:14:14] [V] [TRT] Fastest Tactic: 0 Time: 0.009192
[05/07/2022-06:14:14] [V] [TRT] --------------- Timing Runner: MatMul_1 + b4/read:0 + (Unnamed Layer* 37) [Shuffle] + unsqueeze_node_after_b4/read:0 + (Unnamed Layer* 37) [Shuffle]_(Unnamed Layer* 37) [Shuffle]_output + add_3 (CaskConvolution)
[05/07/2022-06:14:14] [V] [TRT] MatMul_1 + b4/read:0 + (Unnamed Layer* 37) [Shuffle] + unsqueeze_node_after_b4/read:0 + (Unnamed Layer* 37) [Shuffle]_(Unnamed Layer* 37) [Shuffle]_output + add_3 Set Tactic Name: maxwell_scudnn_128x32_relu_medium_nn_v1 Tactic: 1062367460111450758
[05/07/2022-06:14:14] [V] [TRT] Tactic: 1062367460111450758 Time: 0.099316
[05/07/2022-06:14:14] [V] [TRT] MatMul_1 + b4/read:0 + (Unnamed Layer* 37) [Shuffle] + unsqueeze_node_after_b4/read:0 + (Unnamed Layer* 37) [Shuffle]_(Unnamed Layer* 37) [Shuffle]_output + add_3 Set Tactic Name: maxwell_scudnn_128x32_relu_interior_nn_v0 Tactic: 1698681053543049347
[05/07/2022-06:14:14] [V] [TRT] Tactic: 1698681053543049347 Time: 0.071092
[05/07/2022-06:14:14] [V] [TRT] MatMul_1 + b4/read:0 + (Unnamed Layer* 37) [Shuffle] + unsqueeze_node_after_b4/read:0 + (Unnamed Layer* 37) [Shuffle]_(Unnamed Layer* 37) [Shuffle]_output + add_3 Set Tactic Name: maxwell_scudnn_128x128_relu_medium_nn_v1 Tactic: 4501471010995462441
[05/07/2022-06:14:14] [V] [TRT] Tactic: 4501471010995462441 Time: 0.109276
[05/07/2022-06:14:14] [V] [TRT] MatMul_1 + b4/read:0 + (Unnamed Layer* 37) [Shuffle] + unsqueeze_node_after_b4/read:0 + (Unnamed Layer* 37) [Shuffle]_(Unnamed Layer* 37) [Shuffle]_output + add_3 Set Tactic Name: maxwell_scudnn_128x64_relu_small_nn_v1 Tactic: 5137655947464784826
[05/07/2022-06:14:14] [V] [TRT] Tactic: 5137655947464784826 Time: 0.073044
[05/07/2022-06:14:14] [V] [TRT] MatMul_1 + b4/read:0 + (Unnamed Layer* 37) [Shuffle] + unsqueeze_node_after_b4/read:0 + (Unnamed Layer* 37) [Shuffle]_(Unnamed Layer* 37) [Shuffle]_output + add_3 Set Tactic Name: maxwell_scudnn_128x128_relu_small_nn_v0 Tactic: 5288347012147084929
[05/07/2022-06:14:14] [V] [TRT] Tactic: 5288347012147084929 Time: 0.1056
[05/07/2022-06:14:14] [V] [TRT] MatMul_1 + b4/read:0 + (Unnamed Layer* 37) [Shuffle] + unsqueeze_node_after_b4/read:0 + (Unnamed Layer* 37) [Shuffle]_(Unnamed Layer* 37) [Shuffle]_output + add_3 Set Tactic Name: maxwell_scudnn_128x128_relu_interior_nn_v1 Tactic: 5326823351883942011
[05/07/2022-06:14:14] [V] [TRT] Tactic: 5326823351883942011 Time: 0.105472
[05/07/2022-06:14:14] [V] [TRT] MatMul_1 + b4/read:0 + (Unnamed Layer* 37) [Shuffle] + unsqueeze_node_after_b4/read:0 + (Unnamed Layer* 37) [Shuffle]_(Unnamed Layer* 37) [Shuffle]_output + add_3 Set Tactic Name: maxwell_scudnn_128x64_relu_interior_nn_v0 Tactic: 5500448035057547314
[05/07/2022-06:14:14] [V] [TRT] Tactic: 5500448035057547314 Time: 0.090416
[05/07/2022-06:14:14] [V] [TRT] MatMul_1 + b4/read:0 + (Unnamed Layer* 37) [Shuffle] + unsqueeze_node_after_b4/read:0 + (Unnamed Layer* 37) [Shuffle]_(Unnamed Layer* 37) [Shuffle]_output + add_3 Set Tactic Name: maxwell_scudnn_128x64_relu_medium_nn_v1 Tactic: 6645123197870846056
[05/07/2022-06:14:14] [V] [TRT] Tactic: 6645123197870846056 Time: 0.078848
[05/07/2022-06:14:14] [V] [TRT] MatMul_1 + b4/read:0 + (Unnamed Layer* 37) [Shuffle] + unsqueeze_node_after_b4/read:0 + (Unnamed Layer* 37) [Shuffle]_(Unnamed Layer* 37) [Shuffle]_output + add_3 Set Tactic Name: maxwell_scudnn_128x32_relu_small_nn_v0 Tactic: 7144526460361122478
[05/07/2022-06:14:14] [V] [TRT] Tactic: 7144526460361122478 Time: 0.074108
[05/07/2022-06:14:14] [V] [TRT] MatMul_1 + b4/read:0 + (Unnamed Layer* 37) [Shuffle] + unsqueeze_node_after_b4/read:0 + (Unnamed Layer* 37) [Shuffle]_(Unnamed Layer* 37) [Shuffle]_output + add_3 Set Tactic Name: maxwell_scudnn_128x128_relu_medium_nn_v0 Tactic: -8262349710178828730
[05/07/2022-06:14:14] [V] [TRT] Tactic: -8262349710178828730 Time: 0.107904
[05/07/2022-06:14:14] [V] [TRT] MatMul_1 + b4/read:0 + (Unnamed Layer* 37) [Shuffle] + unsqueeze_node_after_b4/read:0 + (Unnamed Layer* 37) [Shuffle]_(Unnamed Layer* 37) [Shuffle]_output + add_3 Set Tactic Name: maxwell_scudnn_128x32_relu_interior_nn_v1 Tactic: -6576203419454146580
[05/07/2022-06:14:14] [V] [TRT] Tactic: -6576203419454146580 Time: 0.077824
[05/07/2022-06:14:14] [V] [TRT] MatMul_1 + b4/read:0 + (Unnamed Layer* 37) [Shuffle] + unsqueeze_node_after_b4/read:0 + (Unnamed Layer* 37) [Shuffle]_(Unnamed Layer* 37) [Shuffle]_output + add_3 Set Tactic Name: maxwell_scudnn_128x32_relu_medium_nn_v0 Tactic: -4787320710726427159
[05/07/2022-06:14:14] [V] [TRT] Tactic: -4787320710726427159 Time: 0.080256
[05/07/2022-06:14:14] [V] [TRT] MatMul_1 + b4/read:0 + (Unnamed Layer* 37) [Shuffle] + unsqueeze_node_after_b4/read:0 + (Unnamed Layer* 37) [Shuffle]_(Unnamed Layer* 37) [Shuffle]_output + add_3 Set Tactic Name: maxwell_scudnn_128x32_relu_small_nn_v1 Tactic: -3456450830548107839
[05/07/2022-06:14:14] [V] [TRT] Tactic: -3456450830548107839 Time: 0.082432
[05/07/2022-06:14:14] [V] [TRT] MatMul_1 + b4/read:0 + (Unnamed Layer* 37) [Shuffle] + unsqueeze_node_after_b4/read:0 + (Unnamed Layer* 37) [Shuffle]_(Unnamed Layer* 37) [Shuffle]_output + add_3 Set Tactic Name: maxwell_scudnn_128x64_relu_medium_nn_v0 Tactic: -1218658103698133241
[05/07/2022-06:14:14] [V] [TRT] Tactic: -1218658103698133241 Time: 0.097792
[05/07/2022-06:14:14] [V] [TRT] MatMul_1 + b4/read:0 + (Unnamed Layer* 37) [Shuffle] + unsqueeze_node_after_b4/read:0 + (Unnamed Layer* 37) [Shuffle]_(Unnamed Layer* 37) [Shuffle]_output + add_3 Set Tactic Name: maxwell_scudnn_128x64_relu_small_nn_v0 Tactic: -836875257600482091
[05/07/2022-06:14:14] [V] [TRT] Tactic: -836875257600482091 Time: 0.09216
[05/07/2022-06:14:14] [V] [TRT] MatMul_1 + b4/read:0 + (Unnamed Layer* 37) [Shuffle] + unsqueeze_node_after_b4/read:0 + (Unnamed Layer* 37) [Shuffle]_(Unnamed Layer* 37) [Shuffle]_output + add_3 Set Tactic Name: maxwell_scudnn_128x128_relu_small_nn_v1 Tactic: -410470605513481746
[05/07/2022-06:14:14] [V] [TRT] Tactic: -410470605513481746 Time: 0.104608
[05/07/2022-06:14:14] [V] [TRT] MatMul_1 + b4/read:0 + (Unnamed Layer* 37) [Shuffle] + unsqueeze_node_after_b4/read:0 + (Unnamed Layer* 37) [Shuffle]_(Unnamed Layer* 37) [Shuffle]_output + add_3 Set Tactic Name: maxwell_scudnn_128x128_relu_interior_nn_v0 Tactic: -377491875521947884
[05/07/2022-06:14:14] [V] [TRT] Tactic: -377491875521947884 Time: 0.104448
[05/07/2022-06:14:14] [V] [TRT] MatMul_1 + b4/read:0 + (Unnamed Layer* 37) [Shuffle] + unsqueeze_node_after_b4/read:0 + (Unnamed Layer* 37) [Shuffle]_(Unnamed Layer* 37) [Shuffle]_output + add_3 Set Tactic Name: maxwell_scudnn_128x64_relu_interior_nn_v1 Tactic: -37215280111360163
[05/07/2022-06:14:14] [V] [TRT] Tactic: -37215280111360163 Time: 0.070656
[05/07/2022-06:14:14] [V] [TRT] Fastest Tactic: -37215280111360163 Time: 0.070656
[05/07/2022-06:14:14] [V] [TRT] >>>>>>>>>>>>>>> Chose Runner Type: CudnnConvolution Tactic: 1
[05/07/2022-06:14:14] [V] [TRT] *************** Autotuning format combination: Float(1024,1,1024,1024) -> Float(10,1,10,10) ***************
[05/07/2022-06:14:14] [V] [TRT] --------------- Timing Runner: MatMul_1 + b4/read:0 + (Unnamed Layer* 37) [Shuffle] + unsqueeze_node_after_b4/read:0 + (Unnamed Layer* 37) [Shuffle]_(Unnamed Layer* 37) [Shuffle]_output + add_3 (CudnnConvolution)
[05/07/2022-06:14:14] [V] [TRT] CudnnConvolution has no valid tactics for this config, skipping
[05/07/2022-06:14:14] [V] [TRT] --------------- Timing Runner: MatMul_1 + b4/read:0 + (Unnamed Layer* 37) [Shuffle] + unsqueeze_node_after_b4/read:0 + (Unnamed Layer* 37) [Shuffle]_(Unnamed Layer* 37) [Shuffle]_output + add_3 (CublasConvolution)
[05/07/2022-06:14:14] [V] [TRT] CublasConvolution has no valid tactics for this config, skipping
[05/07/2022-06:14:14] [V] [TRT] --------------- Timing Runner: MatMul_1 + b4/read:0 + (Unnamed Layer* 37) [Shuffle] + unsqueeze_node_after_b4/read:0 + (Unnamed Layer* 37) [Shuffle]_(Unnamed Layer* 37) [Shuffle]_output + add_3 (CaskConvolution)
[05/07/2022-06:14:14] [V] [TRT] CaskConvolution has no valid tactics for this config, skipping
[05/07/2022-06:14:14] [V] [TRT] =============== Computing costs for 
[05/07/2022-06:14:14] [V] [TRT] *************** Autotuning format combination: Float(10,1,1,1) -> Float(10,1) ***************
[05/07/2022-06:14:14] [V] [TRT] --------------- Timing Runner: copied_squeeze_after_add_3 (Shuffle)
[05/07/2022-06:14:14] [V] [TRT] Tactic: 0 Time: 0.002048
[05/07/2022-06:14:14] [V] [TRT] Fastest Tactic: 0 Time: 0.002048
[05/07/2022-06:14:14] [V] [TRT] >>>>>>>>>>>>>>> Chose Runner Type: Shuffle Tactic: 0
[05/07/2022-06:14:14] [V] [TRT] =============== Computing costs for 
[05/07/2022-06:14:14] [V] [TRT] *************** Autotuning format combination: Float(10,1) -> Float(1,1), Int32(1,1) ***************
[05/07/2022-06:14:14] [V] [TRT] --------------- Timing Runner: y + z (LogSoftmaxTopK)
[05/07/2022-06:14:14] [V] [TRT] Tactic: 1001 Time: 0.003072
[05/07/2022-06:14:14] [V] [TRT] Tactic: 1002 Time: 0.016384
[05/07/2022-06:14:14] [V] [TRT] Fastest Tactic: 1001 Time: 0.003072
[05/07/2022-06:14:14] [V] [TRT] >>>>>>>>>>>>>>> Chose Runner Type: LogSoftmaxTopK Tactic: 1001
[05/07/2022-06:14:14] [V] [TRT] =============== Computing costs for 
[05/07/2022-06:14:14] [V] [TRT] *************** Autotuning format combination: Int32(1,1) -> Int32(1) ***************
[05/07/2022-06:14:14] [V] [TRT] --------------- Timing Runner: (Unnamed Layer* 52) [Shuffle] (Shuffle)
[05/07/2022-06:14:14] [V] [TRT] Tactic: 0 Time: 0.002176
[05/07/2022-06:14:14] [V] [TRT] Fastest Tactic: 0 Time: 0.002176
[05/07/2022-06:14:14] [V] [TRT] >>>>>>>>>>>>>>> Chose Runner Type: Shuffle Tactic: 0
[05/07/2022-06:14:14] [V] [TRT] Adding reformat layer: Reformatted Output Tensor 0 to MaxPool2d (MaxPool2d:0) from Float(6272,196,14,1) to Float(6272,1,448,32)
[05/07/2022-06:14:14] [V] [TRT] Adding reformat layer: Reformatted Input Tensor 0 to MaxPool2d_1 (Relu_1:0) from Float(12544,1,896,64) to Float(12544,196,14,1)
[05/07/2022-06:14:14] [V] [TRT] Formats and tactics selection completed in 3.7465 seconds.
[05/07/2022-06:14:14] [V] [TRT] After reformat layers: 12 layers
[05/07/2022-06:14:14] [V] [TRT] Pre-optimized block assignment.
[05/07/2022-06:14:14] [V] [TRT] Block size 1605632
[05/07/2022-06:14:14] [V] [TRT] Block size 401408
[05/07/2022-06:14:14] [V] [TRT] Block size 802816
[05/07/2022-06:14:14] [V] [TRT] Block size 200704
[05/07/2022-06:14:14] [V] [TRT] Block size 200704
[05/07/2022-06:14:14] [V] [TRT] Block size 1
[05/07/2022-06:14:14] [V] [TRT] Block size 512
[05/07/2022-06:14:14] [V] [TRT] Block size 1
[05/07/2022-06:14:14] [V] [TRT] Block size 1024
[05/07/2022-06:14:14] [V] [TRT] Block size 65536
[05/07/2022-06:14:14] [V] [TRT] Block size 401408
[05/07/2022-06:14:14] [V] [TRT] Block size 802816
[05/07/2022-06:14:14] [V] [TRT] Block size 1073741824
[05/07/2022-06:14:14] [V] [TRT] Total Activation Memory: 1078224386
[05/07/2022-06:14:14] [I] [TRT] Detected 1 inputs and 1 output network tensors.
[05/07/2022-06:14:14] [V] [TRT] Conv__25 + Relu Set Tactic Name: maxwell_scudnn_128x32_relu_small_nn_v0 Tactic: 7144526460361122478
[05/07/2022-06:14:14] [V] [TRT] Conv__27 + Relu_1 Set Tactic Name: maxwell_scudnn_128x32_sliced1x4_ldg4_relu_exp_small_nhwc_tn_v1 Tactic: -9153228964338181824
[05/07/2022-06:14:14] [V] [TRT] Layer: Conv__25 + Relu Host Persistent: 1664 Device Persistent: 8192 Scratch Memory: 0
[05/07/2022-06:14:14] [V] [TRT] Layer: MaxPool2d Host Persistent: 0 Device Persistent: 0 Scratch Memory: 0
[05/07/2022-06:14:14] [V] [TRT] Layer: Reformatting CopyNode for Output Tensor 0 to MaxPool2d Host Persistent: 0 Device Persistent: 0 Scratch Memory: 0
[05/07/2022-06:14:14] [V] [TRT] Layer: Conv__27 + Relu_1 Host Persistent: 1664 Device Persistent: 206336 Scratch Memory: 0
[05/07/2022-06:14:14] [V] [TRT] Layer: Reformatting CopyNode for Input Tensor 0 to MaxPool2d_1 Host Persistent: 0 Device Persistent: 0 Scratch Memory: 0
[05/07/2022-06:14:14] [V] [TRT] Layer: MaxPool2d_1 Host Persistent: 0 Device Persistent: 0 Scratch Memory: 0
[05/07/2022-06:14:14] [V] [TRT] Layer: MaxPool2d_1__22 + Reshape + (Unnamed Layer* 14) [Shuffle] Host Persistent: 0 Device Persistent: 0 Scratch Memory: 0
[05/07/2022-06:14:14] [V] [TRT] Layer: MatMul + b3/read:0 + (Unnamed Layer* 21) [Shuffle] + unsqueeze_node_after_b3/read:0 + (Unnamed Layer* 21) [Shuffle]_(Unnamed Layer* 21) [Shuffle]_output + add_2 + Relu_2 Host Persistent: 340 Device Persistent: 0 Scratch Memory: 0
[05/07/2022-06:14:14] [V] [TRT] Layer: MatMul_1 + b4/read:0 + (Unnamed Layer* 37) [Shuffle] + unsqueeze_node_after_b4/read:0 + (Unnamed Layer* 37) [Shuffle]_(Unnamed Layer* 37) [Shuffle]_output + add_3 Host Persistent: 32 Device Persistent: 0 Scratch Memory: 4096
[05/07/2022-06:14:14] [V] [TRT] Layer: copied_squeeze_after_add_3 Host Persistent: 0 Device Persistent: 0 Scratch Memory: 0
[05/07/2022-06:14:14] [V] [TRT] Layer: y + z Host Persistent: 0 Device Persistent: 0 Scratch Memory: 0
[05/07/2022-06:14:14] [V] [TRT] Layer: (Unnamed Layer* 52) [Shuffle] Host Persistent: 0 Device Persistent: 0 Scratch Memory: 0
[05/07/2022-06:14:14] [I] [TRT] Total Host Persistent Memory: 3712
[05/07/2022-06:14:14] [I] [TRT] Total Device Persistent Memory: 214528
[05/07/2022-06:14:14] [I] [TRT] Total Scratch Memory: 4096
[05/07/2022-06:14:14] [I] [TRT] [MemUsageStats] Peak memory usage of TRT CPU/GPU memory allocators: CPU 12 MiB, GPU 438 MiB
[05/07/2022-06:14:14] [I] [TRT] [BlockAssignment] Algorithm ShiftNTopDown took 0.056774ms to assign 4 blocks to 13 nodes requiring 2409473 bytes.
[05/07/2022-06:14:14] [V] [TRT] Optimized block assignment.
[05/07/2022-06:14:14] [V] [TRT] Block size 1605632
[05/07/2022-06:14:14] [V] [TRT] Block size 802816
[05/07/2022-06:14:14] [V] [TRT] Block size 1024
[05/07/2022-06:14:14] [V] [TRT] Block size 1
[05/07/2022-06:14:14] [I] [TRT] Total Activation Memory: 2409473
[05/07/2022-06:14:14] [V] [TRT] Using cublas as a tactic source
[05/07/2022-06:14:14] [I] [TRT] [MemUsageChange] Init cuBLAS/cuBLASLt: CPU +0, GPU +8, now: CPU 974, GPU 986 (MiB)
[05/07/2022-06:14:14] [V] [TRT] Using cuDNN as a tactic source
[05/07/2022-06:14:14] [I] [TRT] [MemUsageChange] Init cuDNN: CPU +0, GPU +10, now: CPU 974, GPU 996 (MiB)
[05/07/2022-06:14:14] [V] [TRT] Engine generation completed in 4.0899 seconds.
[05/07/2022-06:14:14] [V] [TRT] Deleting timing cache: 31 entries, 0 hits
[05/07/2022-06:14:14] [V] [TRT] Engine Layer Information:
Layer(CaskConvolution): Conv__25 + Relu, Tactic: 7144526460361122478, x:0[Float(-2,1,28,28)] -> Relu:0[Float(-2,32,28,28)]
Layer(TiledPooling): MaxPool2d, Tactic: 6226177, Relu:0[Float(-2,32,28,28)] -> Reformatted Output Tensor 0 to MaxPool2d[Float(-2,32,14,14)]
Layer(Reformat): Reformatting CopyNode for Output Tensor 0 to MaxPool2d, Tactic: 0, Reformatted Output Tensor 0 to MaxPool2d[Float(-2,32,14,14)] -> MaxPool2d:0[Float(-2,32,14,14)]
Layer(CaskConvolution): Conv__27 + Relu_1, Tactic: -9153228964338181824, MaxPool2d:0[Float(-2,32,14,14)] -> Relu_1:0[Float(-2,64,14,14)]
Layer(Reformat): Reformatting CopyNode for Input Tensor 0 to MaxPool2d_1, Tactic: 0, Relu_1:0[Float(-2,64,14,14)] -> Reformatted Input Tensor 0 to MaxPool2d_1[Float(-2,64,14,14)]
Layer(TiledPooling): MaxPool2d_1, Tactic: 6357249, Reformatted Input Tensor 0 to MaxPool2d_1[Float(-2,64,14,14)] -> MaxPool2d_1:0[Float(-2,64,7,7)]
Layer(Shuffle): MaxPool2d_1__22 + Reshape + (Unnamed Layer* 14) [Shuffle], Tactic: 0, MaxPool2d_1:0[Float(-2,64,7,7)] -> (Unnamed Layer* 14) [Shuffle]_output[Float(-2,3136,1,1)]
Layer(CublasConvolution): MatMul + b3/read:0 + (Unnamed Layer* 21) [Shuffle] + unsqueeze_node_after_b3/read:0 + (Unnamed Layer* 21) [Shuffle]_(Unnamed Layer* 21) [Shuffle]_output + add_2 + Relu_2, Tactic: 0, (Unnamed Layer* 14) [Shuffle]_output[Float(-2,3136,1,1)] -> Relu_2_out_tensor[Float(-2,1024,1,1)]
Layer(CudnnConvolution): MatMul_1 + b4/read:0 + (Unnamed Layer* 37) [Shuffle] + unsqueeze_node_after_b4/read:0 + (Unnamed Layer* 37) [Shuffle]_(Unnamed Layer* 37) [Shuffle]_output + add_3, Tactic: 1, Relu_2_out_tensor[Float(-2,1024,1,1)] -> add_3_out_tensor[Float(-2,10,1,1)]
Layer(NoOp): copied_squeeze_after_add_3, Tactic: 0, add_3_out_tensor[Float(-2,10,1,1)] -> add_3:0[Float(-2,10)]
Layer(LogSoftmaxTopK): y + z, Tactic: 1001, add_3:0[Float(-2,10)] -> (Unnamed Layer* 48) [TopK]_output_1[Float(-2,1)], (Unnamed Layer* 48) [TopK]_output_2[Int32(-2,1)]
Layer(NoOp): (Unnamed Layer* 52) [Shuffle], Tactic: 0, (Unnamed Layer* 48) [TopK]_output_2[Int32(-2,1)] -> z:0[Int32(-2)]
[05/07/2022-06:14:14] [I] [TRT] [MemUsageChange] TensorRT-managed allocation in building engine: CPU +0, GPU +13, now: CPU 0, GPU 13 (MiB)
[05/07/2022-06:14:14] [I] [TRT] [MemUsageChange] Init CUDA: CPU +0, GPU +0, now: CPU 986, GPU 948 (MiB)
[05/07/2022-06:14:14] [I] [TRT] Loaded engine size: 12 MiB
[05/07/2022-06:14:14] [V] [TRT] Using cublas as a tactic source
[05/07/2022-06:14:14] [I] [TRT] [MemUsageChange] Init cuBLAS/cuBLASLt: CPU +1, GPU +10, now: CPU 987, GPU 972 (MiB)
[05/07/2022-06:14:14] [V] [TRT] Using cuDNN as a tactic source
[05/07/2022-06:14:14] [I] [TRT] [MemUsageChange] Init cuDNN: CPU +0, GPU +8, now: CPU 987, GPU 980 (MiB)
[05/07/2022-06:14:14] [V] [TRT] Deserialization required 3998 microseconds.
[05/07/2022-06:14:14] [I] [TRT] [MemUsageChange] TensorRT-managed allocation in engine deserialization: CPU +0, GPU +12, now: CPU 0, GPU 12 (MiB)
[05/07/2022-06:14:14] [I] Engine built in 4.62952 sec.
[05/07/2022-06:14:14] [V] [TRT] Using cublas as a tactic source
[05/07/2022-06:14:14] [I] [TRT] [MemUsageChange] Init cuBLAS/cuBLASLt: CPU +0, GPU +10, now: CPU 887, GPU 972 (MiB)
[05/07/2022-06:14:14] [V] [TRT] Using cuDNN as a tactic source
[05/07/2022-06:14:14] [I] [TRT] [MemUsageChange] Init cuDNN: CPU +0, GPU +8, now: CPU 887, GPU 980 (MiB)
[05/07/2022-06:14:14] [V] [TRT] Total per-runner device persistent memory is 214528
[05/07/2022-06:14:14] [V] [TRT] Total per-runner host persistent memory is 3712
[05/07/2022-06:14:14] [V] [TRT] Allocated activation device memory of size 2409984
[05/07/2022-06:14:14] [I] [TRT] [MemUsageChange] TensorRT-managed allocation in IExecutionContext creation: CPU +0, GPU +3, now: CPU 0, GPU 15 (MiB)
[05/07/2022-06:14:14] [I] Using random values for input x:0
[05/07/2022-06:14:14] [I] Created input binding for x:0 with dimensions 4x1x28x28
[05/07/2022-06:14:14] [I] Using random values for output z:0
[05/07/2022-06:14:14] [I] Created output binding for z:0 with dimensions 4
[05/07/2022-06:14:14] [I] Starting inference
[05/07/2022-06:14:18] [I] Warmup completed 1188 queries over 200 ms
[05/07/2022-06:14:18] [I] Timing trace has 18722 queries over 3.00048 s
[05/07/2022-06:14:18] [I] 
[05/07/2022-06:14:18] [I] === Trace details ===
[05/07/2022-06:14:18] [I] Trace averages of 10 runs:
[05/07/2022-06:14:18] [I] Average on 10 runs - GPU latency: 0.157082 ms - Host latency: 0.164255 ms (end to end 0.286913 ms, enqueue 0.0559418 ms)
[05/07/2022-06:14:18] [I] Average on 10 runs - GPU latency: 0.157695 ms - Host latency: 0.164236 ms (end to end 0.297467 ms, enqueue 0.0480362 ms)
[05/07/2022-06:14:18] [I] Average on 10 runs - GPU latency: 0.157594 ms - Host latency: 0.164113 ms (end to end 0.297414 ms, enqueue 0.0459335 ms)
[05/07/2022-06:14:18] [I] Average on 10 runs - GPU latency: 0.15739 ms - Host latency: 0.163538 ms (end to end 0.299866 ms, enqueue 0.0470184 ms)
[05/07/2022-06:14:18] [I] Average on 10 runs - GPU latency: 0.157802 ms - Host latency: 0.16423 ms (end to end 0.301855 ms, enqueue 0.0465912 ms)
[05/07/2022-06:14:18] [I] Average on 10 runs - GPU latency: 0.157082 ms - Host latency: 0.163466 ms (end to end 0.296677 ms, enqueue 0.0464447 ms)
[05/07/2022-06:14:18] [I] Average on 10 runs - GPU latency: 0.157285 ms - Host latency: 0.163564 ms (end to end 0.300693 ms, enqueue 0.0462891 ms)
[05/07/2022-06:14:18] [I] Average on 10 runs - GPU latency: 0.157082 ms - Host latency: 0.163246 ms (end to end 0.29698 ms, enqueue 0.0457108 ms)
[05/07/2022-06:14:18] [I] Average on 10 runs - GPU latency: 0.157182 ms - Host latency: 0.163457 ms (end to end 0.297327 ms, enqueue 0.0510468 ms)
[05/07/2022-06:14:18] [I] Average on 10 runs - GPU latency: 0.156979 ms - Host latency: 0.163031 ms (end to end 0.2979 ms, enqueue 0.0453781 ms)
[05/07/2022-06:14:18] [I] Average on 10 runs - GPU latency: 0.160809 ms - Host latency: 0.16729 ms (end to end 0.252364 ms, enqueue 0.0538925 ms)
[05/07/2022-06:14:18] [I] Average on 10 runs - GPU latency: 0.154008 ms - Host latency: 0.161043 ms (end to end 0.27963 ms, enqueue 0.0516785 ms)
[05/07/2022-06:14:18] [I] Average on 10 runs - GPU latency: 0.1536 ms - Host latency: 0.159631 ms (end to end 0.289374 ms, enqueue 0.0477539 ms)
[05/07/2022-06:14:18] [I] Average on 10 runs - GPU latency: 0.153806 ms - Host latency: 0.159906 ms (end to end 0.281667 ms, enqueue 0.0455048 ms)
[05/07/2022-06:14:18] [I] Average on 10 runs - GPU latency: 0.154214 ms - Host latency: 0.160303 ms (end to end 0.289883 ms, enqueue 0.0465912 ms)
[05/07/2022-06:14:18] [I] Average on 10 runs - GPU latency: 0.153703 ms - Host latency: 0.159891 ms (end to end 0.284001 ms, enqueue 0.0480774 ms)
[05/07/2022-06:14:18] [I] Average on 10 runs - GPU latency: 0.153496 ms - Host latency: 0.159824 ms (end to end 0.278334 ms, enqueue 0.0514786 ms)
[05/07/2022-06:14:18] [I] Average on 10 runs - GPU latency: 0.1536 ms - Host latency: 0.160011 ms (end to end 0.292131 ms, enqueue 0.0511169 ms)
[05/07/2022-06:14:18] [I] Average on 10 runs - GPU latency: 0.153497 ms - Host latency: 0.159715 ms (end to end 0.272682 ms, enqueue 0.0485809 ms)
[05/07/2022-06:14:18] [I] Average on 10 runs - GPU latency: 0.15401 ms - Host latency: 0.160184 ms (end to end 0.286642 ms, enqueue 0.0461319 ms)
[05/07/2022-06:14:18] [I] Average on 10 runs - GPU latency: 0.153802 ms - Host latency: 0.160892 ms (end to end 0.291632 ms, enqueue 0.0484131 ms)
[05/07/2022-06:14:18] [I] Average on 10 runs - GPU latency: 0.154207 ms - Host latency: 0.160493 ms (end to end 0.276955 ms, enqueue 0.0456039 ms)
[05/07/2022-06:14:18] [I] Average on 10 runs - GPU latency: 0.153188 ms - Host latency: 0.159581 ms (end to end 0.282237 ms, enqueue 0.0487 ms)
[05/07/2022-06:14:18] [I] Average on 10 runs - GPU latency: 0.153641 ms - Host latency: 0.159897 ms (end to end 0.282979 ms, enqueue 0.0492676 ms)
[05/07/2022-06:14:18] [I] Average on 10 runs - GPU latency: 0.153807 ms - Host latency: 0.159845 ms (end to end 0.294586 ms, enqueue 0.0458344 ms)
[05/07/2022-06:14:18] [I] Average on 10 runs - GPU latency: 0.153496 ms - Host latency: 0.159503 ms (end to end 0.289938 ms, enqueue 0.0462494 ms)
[05/07/2022-06:14:18] [I] Average on 10 runs - GPU latency: 0.153909 ms - Host latency: 0.160088 ms (end to end 0.295062 ms, enqueue 0.0463425 ms)
[05/07/2022-06:14:18] [I] Average on 10 runs - GPU latency: 0.154007 ms - Host latency: 0.160347 ms (end to end 0.292802 ms, enqueue 0.0469757 ms)
[05/07/2022-06:14:18] [I] Average on 10 runs - GPU latency: 0.153395 ms - Host latency: 0.159685 ms (end to end 0.280406 ms, enqueue 0.0481583 ms)
