cookbook/08-Tool/trtexec/result-FP32.txt
[03/07/2022-05:05:45] [V] [TRT] *************** Autotuning Reformat:Float(784,784,28,1) -> Float(784,1,28,1) ***************
[03/07/2022-05:05:45] [V] [TRT] --------------- Timing Runner: Optimizer Reformat (Reformat)
[03/07/2022-05:05:45] [V] [TRT] Tactic: 1002 Time: 0.004096
[03/07/2022-05:05:45] [V] [TRT] Tactic: 0 Time: 0.003068
[03/07/2022-05:05:45] [V] [TRT] Fastest Tactic: 0 Time: 0.003068
[03/07/2022-05:05:45] [V] [TRT] *************** Autotuning format combination: Float(784,784,28,1) -> Float(25088,784,28,1) ***************
[03/07/2022-05:05:45] [V] [TRT] --------------- Timing Runner: Conv__25 + Relu (CudaDepthwiseConvolution)
[03/07/2022-05:05:45] [V] [TRT] CudaDepthwiseConvolution has no valid tactics for this config, skipping
[03/07/2022-05:05:45] [V] [TRT] --------------- Timing Runner: Conv__25 + Relu (FusedConvActConvolution)
[03/07/2022-05:05:45] [V] [TRT] FusedConvActConvolution has no valid tactics for this config, skipping
[03/07/2022-05:05:45] [V] [TRT] --------------- Timing Runner: Conv__25 + Relu (CudnnConvolution)
[03/07/2022-05:05:45] [V] [TRT] Tactic: 0 Time: 0.01944
[03/07/2022-05:05:45] [V] [TRT] Tactic: 1 Time: 0.022256
[03/07/2022-05:05:45] [V] [TRT] Tactic: 2 Time: 0.026624
[03/07/2022-05:05:45] [V] [TRT] Tactic: 4 Time: 0.0503
[03/07/2022-05:05:45] [V] [TRT] Tactic: 5 Time: 0.053504
[03/07/2022-05:05:45] [V] [TRT] Fastest Tactic: 0 Time: 0.01944
[03/07/2022-05:05:45] [V] [TRT] --------------- Timing Runner: Conv__25 + Relu (CaskConvolution)
[03/07/2022-05:05:45] [V] [TRT] Conv__25 + Relu Set Tactic Name: maxwell_scudnn_128x32_relu_medium_nn_v1 Tactic: 1062367460111450758
[03/07/2022-05:05:45] [V] [TRT] Tactic: 1062367460111450758 Time: 0.012412
[03/07/2022-05:05:45] [V] [TRT] Conv__25 + Relu Set Tactic Name: maxwell_scudnn_128x32_relu_large_nn_v0 Tactic: 1754984623894446479
[03/07/2022-05:05:45] [V] [TRT] Tactic: 1754984623894446479 Time: 0.010224
[03/07/2022-05:05:45] [V] [TRT] Conv__25 + Relu Set Tactic Name: maxwell_scudnn_128x128_relu_large_nn_v0 Tactic: 3611739942397549984
[03/07/2022-05:05:45] [V] [TRT] Tactic: 3611739942397549984 Time: 0.016384
[03/07/2022-05:05:45] [V] [TRT] Conv__25 + Relu Set Tactic Name: maxwell_scudnn_128x64_relu_large_nn_v1 Tactic: 4337000649858996379
[03/07/2022-05:05:45] [V] [TRT] Tactic: 4337000649858996379 Time: 0.01264
[03/07/2022-05:05:45] [V] [TRT] Conv__25 + Relu Set Tactic Name: maxwell_scudnn_128x128_relu_medium_nn_v1 Tactic: 4501471010995462441
[03/07/2022-05:05:45] [V] [TRT] Tactic: 4501471010995462441 Time: 0.015896
[03/07/2022-05:05:45] [V] [TRT] Conv__25 + Relu Set Tactic Name: maxwell_scudnn_128x64_relu_small_nn_v1 Tactic: 5137655947464784826
[03/07/2022-05:05:45] [V] [TRT] Tactic: 5137655947464784826 Time: 0.011736
[03/07/2022-05:05:45] [V] [TRT] Conv__25 + Relu Set Tactic Name: maxwell_scudnn_128x128_relu_small_nn_v0 Tactic: 5288347012147084929
[03/07/2022-05:05:45] [V] [TRT] Tactic: 5288347012147084929 Time: 0.016216
[03/07/2022-05:05:45] [V] [TRT] Conv__25 + Relu Set Tactic Name: maxwell_scudnn_128x64_relu_medium_nn_v1 Tactic: 6645123197870846056
[03/07/2022-05:05:45] [V] [TRT] Tactic: 6645123197870846056 Time: 0.012392
[03/07/2022-05:05:45] [V] [TRT] Conv__25 + Relu Set Tactic Name: maxwell_scudnn_128x32_relu_small_nn_v0 Tactic: 7144526460361122478
[03/07/2022-05:05:45] [V] [TRT] Tactic: 7144526460361122478 Time: 0.009212
[03/07/2022-05:05:45] [V] [TRT] Conv__25 + Relu Set Tactic Name: maxwell_scudnn_128x128_relu_large_nn_v1 Tactic: -9137461792520977713
[03/07/2022-05:05:45] [V] [TRT] Tactic: -9137461792520977713 Time: 0.016384
[03/07/2022-05:05:45] [V] [TRT] Conv__25 + Relu Set Tactic Name: maxwell_scudnn_128x128_relu_medium_nn_v0 Tactic: -8262349710178828730
[03/07/2022-05:05:45] [V] [TRT] Tactic: -8262349710178828730 Time: 0.016616
[03/07/2022-05:05:45] [V] [TRT] Conv__25 + Relu Set Tactic Name: maxwell_scudnn_128x64_relu_large_nn_v0 Tactic: -8133971918129952780
[03/07/2022-05:05:45] [V] [TRT] Tactic: -8133971918129952780 Time: 0.012288
[03/07/2022-05:05:45] [V] [TRT] Conv__25 + Relu Set Tactic Name: maxwell_scudnn_128x32_relu_large_nn_v1 Tactic: -6092040395344634144
[03/07/2022-05:05:45] [V] [TRT] Tactic: -6092040395344634144 Time: 0.013248
[03/07/2022-05:05:45] [V] [TRT] Conv__25 + Relu Set Tactic Name: maxwell_scudnn_128x32_relu_medium_nn_v0 Tactic: -4787320710726427159
[03/07/2022-05:05:45] [V] [TRT] Tactic: -4787320710726427159 Time: 0.009728
[03/07/2022-05:05:45] [V] [TRT] Conv__25 + Relu Set Tactic Name: maxwell_scudnn_128x32_relu_small_nn_v1 Tactic: -3456450830548107839
[03/07/2022-05:05:45] [V] [TRT] Tactic: -3456450830548107839 Time: 0.01124
[03/07/2022-05:05:45] [V] [TRT] Conv__25 + Relu Set Tactic Name: maxwell_scudnn_128x64_relu_medium_nn_v0 Tactic: -1218658103698133241
[03/07/2022-05:05:45] [V] [TRT] Tactic: -1218658103698133241 Time: 0.0124
[03/07/2022-05:05:45] [V] [TRT] Conv__25 + Relu Set Tactic Name: maxwell_scudnn_128x64_relu_small_nn_v0 Tactic: -836875257600482091
[03/07/2022-05:05:45] [V] [TRT] Tactic: -836875257600482091 Time: 0.01226
[03/07/2022-05:05:45] [V] [TRT] Conv__25 + Relu Set Tactic Name: maxwell_scudnn_128x128_relu_small_nn_v1 Tactic: -410470605513481746
[03/07/2022-05:05:45] [V] [TRT] Tactic: -410470605513481746 Time: 0.01536
[03/07/2022-05:05:45] [V] [TRT] Fastest Tactic: 7144526460361122478 Time: 0.009212
[03/07/2022-05:05:45] [V] [TRT] >>>>>>>>>>>>>>> Chose Runner Type: CaskConvolution Tactic: 7144526460361122478
[03/07/2022-05:05:45] [V] [TRT] *************** Autotuning format combination: Float(784,1,28,1) -> Float(25088,1,896,32) ***************
[03/07/2022-05:05:45] [V] [TRT] --------------- Timing Runner: Conv__25 + Relu (CudnnConvolution)
[03/07/2022-05:05:45] [V] [TRT] CudnnConvolution has no valid tactics for this config, skipping
[03/07/2022-05:05:45] [V] [TRT] --------------- Timing Runner: Conv__25 + Relu (CaskConvolution)
[03/07/2022-05:05:45] [V] [TRT] CaskConvolution has no valid tactics for this config, skipping
[03/07/2022-05:05:45] [V] [TRT] *************** Autotuning Reformat:Float(25088,1,896,32) -> Float(25088,784,28,1) ***************
[03/07/2022-05:05:45] [V] [TRT] --------------- Timing Runner: Optimizer Reformat (Reformat)
[03/07/2022-05:05:45] [V] [TRT] Tactic: 1002 Time: 0.012288
[03/07/2022-05:05:45] [V] [TRT] Tactic: 0 Time: 0.008192
[03/07/2022-05:05:45] [V] [TRT] Fastest Tactic: 0 Time: 0.008192
[03/07/2022-05:05:45] [V] [TRT] *************** Autotuning format combination: Float(25088,784,28,1) -> Float(6272,196,14,1) ***************
[03/07/2022-05:05:45] [V] [TRT] --------------- Timing Runner: MaxPool2d (TiledPooling)
[03/07/2022-05:05:45] [V] [TRT] Tactic: 5505281 Time: 0.009216
[03/07/2022-05:05:45] [V] [TRT] Tactic: 5570817 Time: 0.006516
[03/07/2022-05:05:45] [V] [TRT] Tactic: 5636353 Time: 0.006084
[03/07/2022-05:05:45] [V] [TRT] Tactic: 5701889 Time: 0.00512
[03/07/2022-05:05:45] [V] [TRT] Tactic: 5767425 Time: 0.00512
[03/07/2022-05:05:46] [V] [TRT] Tactic: 5832961 Time: 0.005376
[03/07/2022-05:05:46] [V] [TRT] Tactic: 5898497 Time: 0.005604
[03/07/2022-05:05:46] [V] [TRT] Tactic: 5964033 Time: 0.005072
[03/07/2022-05:05:46] [V] [TRT] Tactic: 6029569 Time: 0.006344
[03/07/2022-05:05:46] [V] [TRT] Tactic: 6095105 Time: 0.005056
[03/07/2022-05:05:46] [V] [TRT] Tactic: 6160641 Time: 0.004196
[03/07/2022-05:05:46] [V] [TRT] Tactic: 6226177 Time: 0.004096
[03/07/2022-05:05:46] [V] [TRT] Tactic: 6291713 Time: 0.004192
[03/07/2022-05:05:46] [V] [TRT] Tactic: 6357249 Time: 0.00412
[03/07/2022-05:05:46] [V] [TRT] Tactic: 6422785 Time: 0.004096
[03/07/2022-05:05:46] [V] [TRT] Tactic: 6488321 Time: 0.004096
[03/07/2022-05:05:46] [V] [TRT] Fastest Tactic: 6226177 Time: 0.004096
[03/07/2022-05:05:46] [V] [TRT] --------------- Timing Runner: MaxPool2d (CudnnPooling)
[03/07/2022-05:05:46] [V] [TRT] Tactic: -1 Time: 0.00512
[03/07/2022-05:05:46] [V] [TRT] Fastest Tactic: -1 Time: 0.00512
[03/07/2022-05:05:46] [V] [TRT] >>>>>>>>>>>>>>> Chose Runner Type: TiledPooling Tactic: 6226177
[03/07/2022-05:05:46] [V] [TRT] *************** Autotuning Reformat:Float(6272,196,14,1) -> Float(6272,1,448,32) ***************
[03/07/2022-05:05:46] [V] [TRT] --------------- Timing Runner: Optimizer Reformat (Reformat)
[03/07/2022-05:05:46] [V] [TRT] Tactic: 1002 Time: 0.00816
[03/07/2022-05:05:46] [V] [TRT] Tactic: 0 Time: 0.005088
[03/07/2022-05:05:46] [V] [TRT] Fastest Tactic: 0 Time: 0.005088
[03/07/2022-05:05:46] [V] [TRT] *************** Autotuning Reformat:Float(6272,196,14,1) -> Float(6272,1,448,32) ***************
[03/07/2022-05:05:46] [V] [TRT] --------------- Timing Runner: Optimizer Reformat (Reformat)
[03/07/2022-05:05:46] [V] [TRT] Tactic: 1002 Time: 0.008128
[03/07/2022-05:05:46] [V] [TRT] Tactic: 0 Time: 0.004864
[03/07/2022-05:05:46] [V] [TRT] Fastest Tactic: 0 Time: 0.004864
[03/07/2022-05:05:46] [V] [TRT] *************** Autotuning Reformat:Float(6272,1,448,32) -> Float(6272,196,14,1) ***************
[03/07/2022-05:05:46] [V] [TRT] --------------- Timing Runner: Optimizer Reformat (Reformat)
[03/07/2022-05:05:46] [V] [TRT] Tactic: 1002 Time: 0.008192
[03/07/2022-05:05:46] [V] [TRT] Tactic: 0 Time: 0.004208
[03/07/2022-05:05:46] [V] [TRT] Fastest Tactic: 0 Time: 0.004208
[03/07/2022-05:05:46] [V] [TRT] *************** Autotuning format combination: Float(6272,196,14,1) -> Float(12544,196,14,1) ***************
[03/07/2022-05:05:46] [V] [TRT] --------------- Timing Runner: Conv__27 + Relu_1 (CudaDepthwiseConvolution)
[03/07/2022-05:05:46] [V] [TRT] CudaDepthwiseConvolution has no valid tactics for this config, skipping
[03/07/2022-05:05:46] [V] [TRT] --------------- Timing Runner: Conv__27 + Relu_1 (FusedConvActConvolution)
[03/07/2022-05:05:46] [V] [TRT] FusedConvActConvolution has no valid tactics for this config, skipping
[03/07/2022-05:05:46] [V] [TRT] --------------- Timing Runner: Conv__27 + Relu_1 (CudnnConvolution)
[03/07/2022-05:05:46] [V] [TRT] Tactic: 0 Time: 0.073556
[03/07/2022-05:05:46] [V] [TRT] Tactic: 1 Time: 0.073528
[03/07/2022-05:05:46] [V] [TRT] Tactic: 2 Time: 0.149884
[03/07/2022-05:05:46] [V] [TRT] Tactic: 4 Time: 0.1719
[03/07/2022-05:05:46] [V] [TRT] Tactic: 5 Time: 0.190704
[03/07/2022-05:05:46] [V] [TRT] Fastest Tactic: 1 Time: 0.073528
[03/07/2022-05:05:46] [V] [TRT] --------------- Timing Runner: Conv__27 + Relu_1 (CaskConvolution)
[03/07/2022-05:05:46] [V] [TRT] Conv__27 + Relu_1 Set Tactic Name: maxwell_scudnn_128x32_relu_medium_nn_v1 Tactic: 1062367460111450758
[03/07/2022-05:05:46] [V] [TRT] Tactic: 1062367460111450758 Time: 0.123116
[03/07/2022-05:05:46] [V] [TRT] Conv__27 + Relu_1 Set Tactic Name: maxwell_scudnn_128x32_relu_large_nn_v0 Tactic: 1754984623894446479
[03/07/2022-05:05:46] [V] [TRT] Tactic: 1754984623894446479 Time: 0.090704
[03/07/2022-05:05:46] [V] [TRT] Conv__27 + Relu_1 Set Tactic Name: maxwell_scudnn_128x128_relu_large_nn_v0 Tactic: 3611739942397549984
[03/07/2022-05:05:46] [V] [TRT] Tactic: 3611739942397549984 Time: 0.099324
[03/07/2022-05:05:46] [V] [TRT] Conv__27 + Relu_1 Set Tactic Name: maxwell_scudnn_128x64_relu_large_nn_v1 Tactic: 4337000649858996379
[03/07/2022-05:05:46] [V] [TRT] Tactic: 4337000649858996379 Time: 0.091136
[03/07/2022-05:05:46] [V] [TRT] Conv__27 + Relu_1 Set Tactic Name: maxwell_scudnn_128x128_relu_medium_nn_v1 Tactic: 4501471010995462441
[03/07/2022-05:05:46] [V] [TRT] Tactic: 4501471010995462441 Time: 0.099328
[03/07/2022-05:05:46] [V] [TRT] Conv__27 + Relu_1 Set Tactic Name: maxwell_scudnn_128x64_relu_small_nn_v1 Tactic: 5137655947464784826
[03/07/2022-05:05:46] [V] [TRT] Tactic: 5137655947464784826 Time: 0.060204
[03/07/2022-05:05:46] [V] [TRT] Conv__27 + Relu_1 Set Tactic Name: maxwell_scudnn_128x128_relu_small_nn_v0 Tactic: 5288347012147084929
[03/07/2022-05:05:46] [V] [TRT] Tactic: 5288347012147084929 Time: 0.086016
[03/07/2022-05:05:46] [V] [TRT] Conv__27 + Relu_1 Set Tactic Name: maxwell_scudnn_128x64_relu_medium_nn_v1 Tactic: 6645123197870846056
[03/07/2022-05:05:46] [V] [TRT] Tactic: 6645123197870846056 Time: 0.082396
[03/07/2022-05:05:46] [V] [TRT] Conv__27 + Relu_1 Set Tactic Name: maxwell_scudnn_128x32_relu_small_nn_v0 Tactic: 7144526460361122478
[03/07/2022-05:05:46] [V] [TRT] Tactic: 7144526460361122478 Time: 0.069504
[03/07/2022-05:05:46] [V] [TRT] Conv__27 + Relu_1 Set Tactic Name: maxwell_scudnn_128x128_relu_large_nn_v1 Tactic: -9137461792520977713
[03/07/2022-05:05:46] [V] [TRT] Tactic: -9137461792520977713 Time: 0.102528
[03/07/2022-05:05:46] [V] [TRT] Conv__27 + Relu_1 Set Tactic Name: maxwell_scudnn_128x128_relu_medium_nn_v0 Tactic: -8262349710178828730
[03/07/2022-05:05:46] [V] [TRT] Tactic: -8262349710178828730 Time: 0.099328
[03/07/2022-05:05:46] [V] [TRT] Conv__27 + Relu_1 Set Tactic Name: maxwell_scudnn_128x64_relu_large_nn_v0 Tactic: -8133971918129952780
[03/07/2022-05:05:46] [V] [TRT] Tactic: -8133971918129952780 Time: 0.107136
[03/07/2022-05:05:46] [V] [TRT] Conv__27 + Relu_1 Set Tactic Name: maxwell_scudnn_128x32_relu_large_nn_v1 Tactic: -6092040395344634144
[03/07/2022-05:05:46] [V] [TRT] Tactic: -6092040395344634144 Time: 0.126592
[03/07/2022-05:05:46] [V] [TRT] Conv__27 + Relu_1 Set Tactic Name: maxwell_scudnn_128x32_relu_medium_nn_v0 Tactic: -4787320710726427159
[03/07/2022-05:05:46] [V] [TRT] Tactic: -4787320710726427159 Time: 0.089472
[03/07/2022-05:05:46] [V] [TRT] Conv__27 + Relu_1 Set Tactic Name: maxwell_scudnn_128x32_relu_small_nn_v1 Tactic: -3456450830548107839
[03/07/2022-05:05:46] [V] [TRT] Tactic: -3456450830548107839 Time: 0.070656
[03/07/2022-05:05:46] [V] [TRT] Conv__27 + Relu_1 Set Tactic Name: maxwell_scudnn_128x64_relu_medium_nn_v0 Tactic: -1218658103698133241
[03/07/2022-05:05:46] [V] [TRT] Tactic: -1218658103698133241 Time: 0.105672
[03/07/2022-05:05:46] [V] [TRT] Conv__27 + Relu_1 Set Tactic Name: maxwell_scudnn_128x64_relu_small_nn_v0 Tactic: -836875257600482091
[03/07/2022-05:05:46] [V] [TRT] Tactic: -836875257600482091 Time: 0.08704
[03/07/2022-05:05:46] [V] [TRT] Conv__27 + Relu_1 Set Tactic Name: maxwell_scudnn_128x128_relu_small_nn_v1 Tactic: -410470605513481746
[03/07/2022-05:05:46] [V] [TRT] Tactic: -410470605513481746 Time: 0.084096
[03/07/2022-05:05:46] [V] [TRT] Fastest Tactic: 5137655947464784826 Time: 0.060204
[03/07/2022-05:05:46] [V] [TRT] >>>>>>>>>>>>>>> Chose Runner Type: CaskConvolution Tactic: 5137655947464784826
[03/07/2022-05:05:46] [V] [TRT] *************** Autotuning format combination: Float(6272,1,448,32) -> Float(12544,1,896,64) ***************
[03/07/2022-05:05:46] [V] [TRT] --------------- Timing Runner: Conv__27 + Relu_1 (CudnnConvolution)
[03/07/2022-05:05:46] [V] [TRT] CudnnConvolution has no valid tactics for this config, skipping
[03/07/2022-05:05:46] [V] [TRT] --------------- Timing Runner: Conv__27 + Relu_1 (CaskConvolution)
[03/07/2022-05:05:46] [V] [TRT] Conv__27 + Relu_1 Set Tactic Name: maxwell_scudnn_128x32_sliced1x4_ldg4_relu_exp_small_nhwc_tn_v1 Tactic: -9153228964338181824
[03/07/2022-05:05:46] [V] [TRT] Tactic: -9153228964338181824 Time: 0.02688
[03/07/2022-05:05:46] [V] [TRT] Conv__27 + Relu_1 Set Tactic Name: maxwell_scudnn_128x64_sliced1x2_ldg4_relu_exp_small_nhwc_tn_v1 Tactic: -7394439838318485025
[03/07/2022-05:05:46] [V] [TRT] Tactic: -7394439838318485025 Time: 0.047104
[03/07/2022-05:05:46] [V] [TRT] Fastest Tactic: -9153228964338181824 Time: 0.02688
[03/07/2022-05:05:46] [V] [TRT] >>>>>>>>>>>>>>> Chose Runner Type: CaskConvolution Tactic: -9153228964338181824
[03/07/2022-05:05:46] [V] [TRT] *************** Autotuning Reformat:Float(12544,1,896,64) -> Float(12544,196,14,1) ***************
[03/07/2022-05:05:46] [V] [TRT] --------------- Timing Runner: Optimizer Reformat (Reformat)
[03/07/2022-05:05:46] [V] [TRT] Tactic: 1002 Time: 0.008192
[03/07/2022-05:05:46] [V] [TRT] Tactic: 0 Time: 0.005888
[03/07/2022-05:05:46] [V] [TRT] Fastest Tactic: 0 Time: 0.005888
[03/07/2022-05:05:46] [V] [TRT] *************** Autotuning format combination: Float(12544,196,14,1) -> Float(3136,49,7,1) ***************
[03/07/2022-05:05:46] [V] [TRT] --------------- Timing Runner: MaxPool2d_1 (TiledPooling)
[03/07/2022-05:05:46] [V] [TRT] Tactic: 5505281 Time: 0.01022
[03/07/2022-05:05:46] [V] [TRT] Tactic: 5570817 Time: 0.007168
[03/07/2022-05:05:46] [V] [TRT] Tactic: 5636353 Time: 0.006144
[03/07/2022-05:05:46] [V] [TRT] Tactic: 5701889 Time: 0.006144
[03/07/2022-05:05:46] [V] [TRT] Tactic: 5767425 Time: 0.005476
[03/07/2022-05:05:46] [V] [TRT] Tactic: 5832961 Time: 0.005708
[03/07/2022-05:05:46] [V] [TRT] Tactic: 5898497 Time: 0.006016
[03/07/2022-05:05:47] [V] [TRT] Tactic: 5964033 Time: 0.00512
[03/07/2022-05:05:47] [V] [TRT] Tactic: 6029569 Time: 0.00714
[03/07/2022-05:05:47] [V] [TRT] Tactic: 6095105 Time: 0.005088
[03/07/2022-05:05:47] [V] [TRT] Tactic: 6160641 Time: 0.00496
[03/07/2022-05:05:47] [V] [TRT] Tactic: 6226177 Time: 0.004184
[03/07/2022-05:05:47] [V] [TRT] Tactic: 6291713 Time: 0.004096
[03/07/2022-05:05:47] [V] [TRT] Tactic: 6357249 Time: 0.00418
[03/07/2022-05:05:47] [V] [TRT] Tactic: 6422785 Time: 0.004096
[03/07/2022-05:05:47] [V] [TRT] Tactic: 6488321 Time: 0.004208
[03/07/2022-05:05:47] [V] [TRT] Fastest Tactic: 6291713 Time: 0.004096
[03/07/2022-05:05:47] [V] [TRT] --------------- Timing Runner: MaxPool2d_1 (CudnnPooling)
[03/07/2022-05:05:47] [V] [TRT] Tactic: -1 Time: 0.00418
[03/07/2022-05:05:47] [V] [TRT] Fastest Tactic: -1 Time: 0.00418
[03/07/2022-05:05:47] [V] [TRT] >>>>>>>>>>>>>>> Chose Runner Type: TiledPooling Tactic: 6291713
[03/07/2022-05:05:47] [V] [TRT] *************** Autotuning Reformat:Float(3136,49,7,1) -> Float(3136,1,448,64) ***************
[03/07/2022-05:05:47] [V] [TRT] --------------- Timing Runner: Optimizer Reformat (Reformat)
[03/07/2022-05:05:47] [V] [TRT] Tactic: 1002 Time: 0.00814
[03/07/2022-05:05:47] [V] [TRT] Tactic: 0 Time: 0.004096
[03/07/2022-05:05:47] [V] [TRT] Fastest Tactic: 0 Time: 0.004096
[03/07/2022-05:05:47] [V] [TRT] *************** Autotuning Reformat:Float(3136,49,7,1) -> Float(98,49:32,7,1) ***************
[03/07/2022-05:05:47] [V] [TRT] --------------- Timing Runner: Optimizer Reformat (Reformat)
[03/07/2022-05:05:47] [V] [TRT] Tactic: 1002 Time: 0.00816
[03/07/2022-05:05:47] [V] [TRT] Tactic: 0 Time: 0.004584
[03/07/2022-05:05:47] [V] [TRT] Fastest Tactic: 0 Time: 0.004584
[03/07/2022-05:05:47] [V] [TRT] *************** Autotuning Reformat:Float(3136,49,7,1) -> Float(3136,1,448,64) ***************
[03/07/2022-05:05:47] [V] [TRT] --------------- Timing Runner: Optimizer Reformat (Reformat)
[03/07/2022-05:05:47] [V] [TRT] Tactic: 1002 Time: 0.008004
[03/07/2022-05:05:47] [V] [TRT] Tactic: 0 Time: 0.00408
[03/07/2022-05:05:47] [V] [TRT] Fastest Tactic: 0 Time: 0.00408
[03/07/2022-05:05:47] [V] [TRT] *************** Autotuning Reformat:Float(3136,49,7,1) -> Float(98,49:32,7,1) ***************
[03/07/2022-05:05:47] [V] [TRT] --------------- Timing Runner: Optimizer Reformat (Reformat)
[03/07/2022-05:05:47] [V] [TRT] Tactic: 1002 Time: 0.008176
[03/07/2022-05:05:47] [V] [TRT] Tactic: 0 Time: 0.004464
[03/07/2022-05:05:47] [V] [TRT] Fastest Tactic: 0 Time: 0.004464
[03/07/2022-05:05:47] [V] [TRT] *************** Autotuning Reformat:Float(3136,1,448,64) -> Float(3136,49,7,1) ***************
[03/07/2022-05:05:47] [V] [TRT] --------------- Timing Runner: Optimizer Reformat (Reformat)
[03/07/2022-05:05:47] [V] [TRT] Tactic: 1002 Time: 0.008116
[03/07/2022-05:05:47] [V] [TRT] Tactic: 0 Time: 0.00408
[03/07/2022-05:05:47] [V] [TRT] Fastest Tactic: 0 Time: 0.00408
[03/07/2022-05:05:47] [V] [TRT] *************** Autotuning Reformat:Float(3136,1,448,64) -> Float(98,49:32,7,1) ***************
[03/07/2022-05:05:47] [V] [TRT] --------------- Timing Runner: Optimizer Reformat (Reformat)
[03/07/2022-05:05:47] [V] [TRT] Tactic: 1002 Time: 0.008304
[03/07/2022-05:05:47] [V] [TRT] Tactic: 0 Time: 0.005068
[03/07/2022-05:05:47] [V] [TRT] Fastest Tactic: 0 Time: 0.005068
[03/07/2022-05:05:47] [V] [TRT] *************** Autotuning Reformat:Float(98,49:32,7,1) -> Float(3136,49,7,1) ***************
[03/07/2022-05:05:47] [V] [TRT] --------------- Timing Runner: Optimizer Reformat (Reformat)
[03/07/2022-05:05:47] [V] [TRT] Tactic: 1002 Time: 0.008176
[03/07/2022-05:05:47] [V] [TRT] Tactic: 0 Time: 0.004024
[03/07/2022-05:05:47] [V] [TRT] Fastest Tactic: 0 Time: 0.004024
[03/07/2022-05:05:47] [V] [TRT] *************** Autotuning Reformat:Float(98,49:32,7,1) -> Float(3136,1,448,64) ***************
[03/07/2022-05:05:47] [V] [TRT] --------------- Timing Runner: Optimizer Reformat (Reformat)
[03/07/2022-05:05:47] [V] [TRT] Tactic: 1002 Time: 0.008192
[03/07/2022-05:05:47] [V] [TRT] Tactic: 0 Time: 0.004064
[03/07/2022-05:05:47] [V] [TRT] Fastest Tactic: 0 Time: 0.004064
[03/07/2022-05:05:47] [V] [TRT] *************** Autotuning format combination: Float(3136,49,7,1) -> Float(3136,1,1,1) ***************
[03/07/2022-05:05:47] [V] [TRT] --------------- Timing Runner: MaxPool2d_1__22 + Reshape + (Unnamed Layer* 14) [Shuffle] (Shuffle)
[03/07/2022-05:05:47] [V] [TRT] Tactic: 0 Time: 0.004096
[03/07/2022-05:05:47] [V] [TRT] Fastest Tactic: 0 Time: 0.004096
[03/07/2022-05:05:47] [V] [TRT] >>>>>>>>>>>>>>> Chose Runner Type: Shuffle Tactic: 0
[03/07/2022-05:05:47] [V] [TRT] *************** Autotuning format combination: Float(3136,1,448,64) -> Float(3136,1,3136,3136) ***************
[03/07/2022-05:05:47] [V] [TRT] --------------- Timing Runner: MaxPool2d_1__22 + Reshape + (Unnamed Layer* 14) [Shuffle] (Shuffle)
[03/07/2022-05:05:47] [V] [TRT] Tactic: 0 Time: 0.004048
[03/07/2022-05:05:47] [V] [TRT] Fastest Tactic: 0 Time: 0.004048
[03/07/2022-05:05:47] [V] [TRT] >>>>>>>>>>>>>>> Chose Runner Type: Shuffle Tactic: 0
[03/07/2022-05:05:47] [V] [TRT] *************** Autotuning format combination: Float(98,49:32,7,1) -> Float(98,1:32,1,1) ***************
[03/07/2022-05:05:47] [V] [TRT] --------------- Timing Runner: MaxPool2d_1__22 + Reshape + (Unnamed Layer* 14) [Shuffle] (Shuffle)
[03/07/2022-05:05:47] [V] [TRT] Tactic: 0 Time: 0.004096
[03/07/2022-05:05:47] [V] [TRT] Fastest Tactic: 0 Time: 0.004096
[03/07/2022-05:05:47] [V] [TRT] >>>>>>>>>>>>>>> Chose Runner Type: Shuffle Tactic: 0
[03/07/2022-05:05:47] [V] [TRT] *************** Autotuning Reformat:Float(3136,1,1,1) -> Float(3136,1,3136,3136) ***************
[03/07/2022-05:05:47] [V] [TRT] --------------- Timing Runner: Optimizer Reformat (Reformat)
[03/07/2022-05:05:47] [V] [TRT] Tactic: 1002 Time: 0.004336
[03/07/2022-05:05:47] [V] [TRT] Tactic: 0 Time: 0.00404
[03/07/2022-05:05:47] [V] [TRT] Fastest Tactic: 0 Time: 0.00404
[03/07/2022-05:05:47] [V] [TRT] *************** Autotuning Reformat:Float(3136,1,3136,3136) -> Float(3136,1,1,1) ***************
[03/07/2022-05:05:47] [V] [TRT] --------------- Timing Runner: Optimizer Reformat (Reformat)
[03/07/2022-05:05:47] [V] [TRT] Tactic: 1002 Time: 0.004464
[03/07/2022-05:05:47] [V] [TRT] Tactic: 0 Time: 0.004028
[03/07/2022-05:05:47] [V] [TRT] Fastest Tactic: 0 Time: 0.004028
[03/07/2022-05:05:47] [V] [TRT] *************** Autotuning Reformat:Float(98,1:32,1,1) -> Float(3136,1,1,1) ***************
[03/07/2022-05:05:47] [V] [TRT] --------------- Timing Runner: Optimizer Reformat (Reformat)
[03/07/2022-05:05:47] [V] [TRT] Tactic: 1002 Time: 0.03068
[03/07/2022-05:05:47] [V] [TRT] Tactic: 0 Time: 0.004076
[03/07/2022-05:05:47] [V] [TRT] Fastest Tactic: 0 Time: 0.004076
[03/07/2022-05:05:47] [V] [TRT] *************** Autotuning Reformat:Float(98,1:32,1,1) -> Float(3136,1,3136,3136) ***************
[03/07/2022-05:05:47] [V] [TRT] --------------- Timing Runner: Optimizer Reformat (Reformat)
[03/07/2022-05:05:47] [V] [TRT] Tactic: 1002 Time: 0.009972
[03/07/2022-05:05:47] [V] [TRT] Tactic: 0 Time: 0.004064
[03/07/2022-05:05:47] [V] [TRT] Fastest Tactic: 0 Time: 0.004064
[03/07/2022-05:05:47] [V] [TRT] *************** Autotuning format combination: Float(3136,1,1,1) -> Float(1024,1,1,1) ***************
[03/07/2022-05:05:47] [V] [TRT] --------------- Timing Runner: MatMul + b3/read:0 + (Unnamed Layer* 21) [Shuffle] + unsqueeze_node_after_b3/read:0 + (Unnamed Layer* 21) [Shuffle] + add_2 + Relu_2 (CudaDepthwiseConvolution)
[03/07/2022-05:05:47] [V] [TRT] CudaDepthwiseConvolution has no valid tactics for this config, skipping
[03/07/2022-05:05:47] [V] [TRT] --------------- Timing Runner: MatMul + b3/read:0 + (Unnamed Layer* 21) [Shuffle] + unsqueeze_node_after_b3/read:0 + (Unnamed Layer* 21) [Shuffle] + add_2 + Relu_2 (FusedConvActConvolution)
[03/07/2022-05:05:47] [V] [TRT] FusedConvActConvolution has no valid tactics for this config, skipping
[03/07/2022-05:05:47] [V] [TRT] --------------- Timing Runner: MatMul + b3/read:0 + (Unnamed Layer* 21) [Shuffle] + unsqueeze_node_after_b3/read:0 + (Unnamed Layer* 21) [Shuffle] + add_2 + Relu_2 (CudnnConvolution)
[03/07/2022-05:05:47] [V] [TRT] Tactic: 0 Time: 0.324992
[03/07/2022-05:05:47] [V] [TRT] Tactic: 1 Time: 0.189924
[03/07/2022-05:05:47] [V] [TRT] Tactic: 2 Time: 0.41728
[03/07/2022-05:05:47] [V] [TRT] Tactic: 4 skipped. Scratch requested: 7527202816, available: 1073741824
[03/07/2022-05:05:47] [V] [TRT] Tactic: 5 Time: 6.4589
[03/07/2022-05:05:47] [I] [TRT] Some tactics do not have sufficient workspace memory to run. Increasing workspace size may increase performance, please check verbose output.
[03/07/2022-05:05:47] [V] [TRT] Fastest Tactic: 1 Time: 0.189924
[03/07/2022-05:05:47] [V] [TRT] --------------- Timing Runner: MatMul + b3/read:0 + (Unnamed Layer* 21) [Shuffle] + unsqueeze_node_after_b3/read:0 + (Unnamed Layer* 21) [Shuffle] + add_2 + Relu_2 (CublasConvolution)
[03/07/2022-05:05:48] [V] [TRT] Tactic: 0 Time: 0.06994
[03/07/2022-05:05:48] [V] [TRT] Tactic: 1 Time: 0.069428
[03/07/2022-05:05:48] [V] [TRT] Fastest Tactic: 1 Time: 0.069428
[03/07/2022-05:05:48] [V] [TRT] --------------- Timing Runner: MatMul + b3/read:0 + (Unnamed Layer* 21) [Shuffle] + unsqueeze_node_after_b3/read:0 + (Unnamed Layer* 21) [Shuffle] + add_2 + Relu_2 (CaskConvolution)
[03/07/2022-05:05:48] [V] [TRT] MatMul + b3/read:0 + (Unnamed Layer* 21) [Shuffle] + unsqueeze_node_after_b3/read:0 + (Unnamed Layer* 21) [Shuffle] + add_2 + Relu_2 Set Tactic Name: maxwell_scudnn_128x32_relu_medium_nn_v1 Tactic: 1062367460111450758
[03/07/2022-05:05:48] [V] [TRT] Tactic: 1062367460111450758 Time: 0.372968
[03/07/2022-05:05:48] [V] [TRT] MatMul + b3/read:0 + (Unnamed Layer* 21) [Shuffle] + unsqueeze_node_after_b3/read:0 + (Unnamed Layer* 21) [Shuffle] + add_2 + Relu_2 Set Tactic Name: maxwell_scudnn_128x32_relu_interior_nn_v0 Tactic: 1698681053543049347
[03/07/2022-05:05:48] [V] [TRT] Tactic: 1698681053543049347 Time: 0.369664
[03/07/2022-05:05:48] [V] [TRT] MatMul + b3/read:0 + (Unnamed Layer* 21) [Shuffle] + unsqueeze_node_after_b3/read:0 + (Unnamed Layer* 21) [Shuffle] + add_2 + Relu_2 Set Tactic Name: maxwell_scudnn_128x128_relu_medium_nn_v1 Tactic: 4501471010995462441
[03/07/2022-05:05:48] [V] [TRT] Tactic: 4501471010995462441 Time: 0.39424
[03/07/2022-05:05:48] [V] [TRT] MatMul + b3/read:0 + (Unnamed Layer* 21) [Shuffle] + unsqueeze_node_after_b3/read:0 + (Unnamed Layer* 21) [Shuffle] + add_2 + Relu_2 Set Tactic Name: maxwell_scudnn_128x64_relu_small_nn_v1 Tactic: 5137655947464784826
[03/07/2022-05:05:48] [V] [TRT] Tactic: 5137655947464784826 Time: 0.318244
[03/07/2022-05:05:48] [V] [TRT] MatMul + b3/read:0 + (Unnamed Layer* 21) [Shuffle] + unsqueeze_node_after_b3/read:0 + (Unnamed Layer* 21) [Shuffle] + add_2 + Relu_2 Set Tactic Name: maxwell_scudnn_128x128_relu_small_nn_v0 Tactic: 5288347012147084929
[03/07/2022-05:05:48] [V] [TRT] Tactic: 5288347012147084929 Time: 0.375036
[03/07/2022-05:05:48] [V] [TRT] MatMul + b3/read:0 + (Unnamed Layer* 21) [Shuffle] + unsqueeze_node_after_b3/read:0 + (Unnamed Layer* 21) [Shuffle] + add_2 + Relu_2 Set Tactic Name: maxwell_scudnn_128x128_relu_interior_nn_v1 Tactic: 5326823351883942011
[03/07/2022-05:05:48] [V] [TRT] Tactic: 5326823351883942011 Time: 0.38756
[03/07/2022-05:05:48] [V] [TRT] MatMul + b3/read:0 + (Unnamed Layer* 21) [Shuffle] + unsqueeze_node_after_b3/read:0 + (Unnamed Layer* 21) [Shuffle] + add_2 + Relu_2 Set Tactic Name: maxwell_scudnn_128x64_relu_interior_nn_v0 Tactic: 5500448035057547314
[03/07/2022-05:05:48] [V] [TRT] Tactic: 5500448035057547314 Time: 0.35782
[03/07/2022-05:05:48] [V] [TRT] MatMul + b3/read:0 + (Unnamed Layer* 21) [Shuffle] + unsqueeze_node_after_b3/read:0 + (Unnamed Layer* 21) [Shuffle] + add_2 + Relu_2 Set Tactic Name: maxwell_scudnn_128x64_relu_medium_nn_v1 Tactic: 6645123197870846056
[03/07/2022-05:05:48] [V] [TRT] Tactic: 6645123197870846056 Time: 0.32484
[03/07/2022-05:05:48] [V] [TRT] MatMul + b3/read:0 + (Unnamed Layer* 21) [Shuffle] + unsqueeze_node_after_b3/read:0 + (Unnamed Layer* 21) [Shuffle] + add_2 + Relu_2 Set Tactic Name: maxwell_scudnn_128x32_relu_small_nn_v0 Tactic: 7144526460361122478
[03/07/2022-05:05:48] [V] [TRT] Tactic: 7144526460361122478 Time: 0.370016
[03/07/2022-05:05:48] [V] [TRT] MatMul + b3/read:0 + (Unnamed Layer* 21) [Shuffle] + unsqueeze_node_after_b3/read:0 + (Unnamed Layer* 21) [Shuffle] + add_2 + Relu_2 Set Tactic Name: maxwell_scudnn_128x128_relu_medium_nn_v0 Tactic: -8262349710178828730
[03/07/2022-05:05:48] [V] [TRT] Tactic: -8262349710178828730 Time: 0.368944
[03/07/2022-05:05:48] [V] [TRT] MatMul + b3/read:0 + (Unnamed Layer* 21) [Shuffle] + unsqueeze_node_after_b3/read:0 + (Unnamed Layer* 21) [Shuffle] + add_2 + Relu_2 Set Tactic Name: maxwell_scudnn_128x32_relu_interior_nn_v1 Tactic: -6576203419454146580
[03/07/2022-05:05:48] [V] [TRT] Tactic: -6576203419454146580 Time: 0.328888
[03/07/2022-05:05:48] [V] [TRT] MatMul + b3/read:0 + (Unnamed Layer* 21) [Shuffle] + unsqueeze_node_after_b3/read:0 + (Unnamed Layer* 21) [Shuffle] + add_2 + Relu_2 Set Tactic Name: maxwell_scudnn_128x32_relu_medium_nn_v0 Tactic: -4787320710726427159
[03/07/2022-05:05:48] [V] [TRT] Tactic: -4787320710726427159 Time: 0.348852
[03/07/2022-05:05:48] [V] [TRT] MatMul + b3/read:0 + (Unnamed Layer* 21) [Shuffle] + unsqueeze_node_after_b3/read:0 + (Unnamed Layer* 21) [Shuffle] + add_2 + Relu_2 Set Tactic Name: maxwell_scudnn_128x32_relu_small_nn_v1 Tactic: -3456450830548107839
[03/07/2022-05:05:48] [V] [TRT] Tactic: -3456450830548107839 Time: 0.336132
[03/07/2022-05:05:48] [V] [TRT] MatMul + b3/read:0 + (Unnamed Layer* 21) [Shuffle] + unsqueeze_node_after_b3/read:0 + (Unnamed Layer* 21) [Shuffle] + add_2 + Relu_2 Set Tactic Name: maxwell_scudnn_128x64_relu_medium_nn_v0 Tactic: -1218658103698133241
[03/07/2022-05:05:48] [V] [TRT] Tactic: -1218658103698133241 Time: 0.37382
[03/07/2022-05:05:48] [V] [TRT] MatMul + b3/read:0 + (Unnamed Layer* 21) [Shuffle] + unsqueeze_node_after_b3/read:0 + (Unnamed Layer* 21) [Shuffle] + add_2 + Relu_2 Set Tactic Name: maxwell_scudnn_128x64_relu_small_nn_v0 Tactic: -836875257600482091
[03/07/2022-05:05:48] [V] [TRT] Tactic: -836875257600482091 Time: 0.362112
[03/07/2022-05:05:48] [V] [TRT] MatMul + b3/read:0 + (Unnamed Layer* 21) [Shuffle] + unsqueeze_node_after_b3/read:0 + (Unnamed Layer* 21) [Shuffle] + add_2 + Relu_2 Set Tactic Name: maxwell_scudnn_128x128_relu_small_nn_v1 Tactic: -410470605513481746
[03/07/2022-05:05:48] [V] [TRT] Tactic: -410470605513481746 Time: 0.389548
[03/07/2022-05:05:48] [V] [TRT] MatMul + b3/read:0 + (Unnamed Layer* 21) [Shuffle] + unsqueeze_node_after_b3/read:0 + (Unnamed Layer* 21) [Shuffle] + add_2 + Relu_2 Set Tactic Name: maxwell_scudnn_128x128_relu_interior_nn_v0 Tactic: -377491875521947884
[03/07/2022-05:05:48] [V] [TRT] Tactic: -377491875521947884 Time: 0.372716
[03/07/2022-05:05:48] [V] [TRT] MatMul + b3/read:0 + (Unnamed Layer* 21) [Shuffle] + unsqueeze_node_after_b3/read:0 + (Unnamed Layer* 21) [Shuffle] + add_2 + Relu_2 Set Tactic Name: maxwell_scudnn_128x64_relu_interior_nn_v1 Tactic: -37215280111360163
[03/07/2022-05:05:48] [V] [TRT] Tactic: -37215280111360163 Time: 0.317928
[03/07/2022-05:05:48] [V] [TRT] Fastest Tactic: -37215280111360163 Time: 0.317928
[03/07/2022-05:05:48] [V] [TRT] >>>>>>>>>>>>>>> Chose Runner Type: CublasConvolution Tactic: 1
[03/07/2022-05:05:48] [V] [TRT] *************** Autotuning format combination: Float(3136,1,3136,3136) -> Float(1024,1,1024,1024) ***************
[03/07/2022-05:05:48] [V] [TRT] --------------- Timing Runner: MatMul + b3/read:0 + (Unnamed Layer* 21) [Shuffle] + unsqueeze_node_after_b3/read:0 + (Unnamed Layer* 21) [Shuffle] + add_2 + Relu_2 (CudnnConvolution)
[03/07/2022-05:05:48] [V] [TRT] CudnnConvolution has no valid tactics for this config, skipping
[03/07/2022-05:05:48] [V] [TRT] --------------- Timing Runner: MatMul + b3/read:0 + (Unnamed Layer* 21) [Shuffle] + unsqueeze_node_after_b3/read:0 + (Unnamed Layer* 21) [Shuffle] + add_2 + Relu_2 (CublasConvolution)
[03/07/2022-05:05:48] [V] [TRT] CublasConvolution has no valid tactics for this config, skipping
[03/07/2022-05:05:48] [V] [TRT] --------------- Timing Runner: MatMul + b3/read:0 + (Unnamed Layer* 21) [Shuffle] + unsqueeze_node_after_b3/read:0 + (Unnamed Layer* 21) [Shuffle] + add_2 + Relu_2 (CaskConvolution)
[03/07/2022-05:05:48] [V] [TRT] MatMul + b3/read:0 + (Unnamed Layer* 21) [Shuffle] + unsqueeze_node_after_b3/read:0 + (Unnamed Layer* 21) [Shuffle] + add_2 + Relu_2 Set Tactic Name: maxwell_scudnn_128x64_sliced1x2_ldg4_relu_exp_interior_nhwc_tn_v1 Tactic: 3886731678879822788
[03/07/2022-05:05:48] [V] [TRT] Tactic: 3886731678879822788 Time: 0.186728
[03/07/2022-05:05:48] [V] [TRT] MatMul + b3/read:0 + (Unnamed Layer* 21) [Shuffle] + unsqueeze_node_after_b3/read:0 + (Unnamed Layer* 21) [Shuffle] + add_2 + Relu_2 Set Tactic Name: maxwell_scudnn_128x32_sliced1x4_ldg4_relu_exp_interior_nhwc_tn_v1 Tactic: 6629944304117643200
[03/07/2022-05:05:48] [V] [TRT] Tactic: 6629944304117643200 Time: 0.135212
[03/07/2022-05:05:48] [V] [TRT] MatMul + b3/read:0 + (Unnamed Layer* 21) [Shuffle] + unsqueeze_node_after_b3/read:0 + (Unnamed Layer* 21) [Shuffle] + add_2 + Relu_2 Set Tactic Name: maxwell_scudnn_128x32_sliced1x4_ldg4_relu_exp_small_nhwc_tn_v1 Tactic: -9153228964338181824
[03/07/2022-05:05:48] [V] [TRT] Tactic: -9153228964338181824 Time: 0.137336
[03/07/2022-05:05:48] [V] [TRT] MatMul + b3/read:0 + (Unnamed Layer* 21) [Shuffle] + unsqueeze_node_after_b3/read:0 + (Unnamed Layer* 21) [Shuffle] + add_2 + Relu_2 Set Tactic Name: maxwell_scudnn_128x64_sliced1x2_ldg4_relu_exp_small_nhwc_tn_v1 Tactic: -7394439838318485025
[03/07/2022-05:05:48] [V] [TRT] Tactic: -7394439838318485025 Time: 0.186428
[03/07/2022-05:05:48] [V] [TRT] Fastest Tactic: 6629944304117643200 Time: 0.135212
[03/07/2022-05:05:48] [V] [TRT] >>>>>>>>>>>>>>> Chose Runner Type: CaskConvolution Tactic: 6629944304117643200
[03/07/2022-05:05:48] [V] [TRT] *************** Autotuning Reformat:Float(1024,1,1,1) -> Float(1024,1,1024,1024) ***************
[03/07/2022-05:05:48] [V] [TRT] --------------- Timing Runner: Optimizer Reformat (Reformat)
[03/07/2022-05:05:48] [V] [TRT] Tactic: 1002 Time: 0.004204
[03/07/2022-05:05:48] [V] [TRT] Tactic: 0 Time: 0.003192
[03/07/2022-05:05:48] [V] [TRT] Fastest Tactic: 0 Time: 0.003192
[03/07/2022-05:05:48] [V] [TRT] *************** Autotuning Reformat:Float(1024,1,1024,1024) -> Float(1024,1,1,1) ***************
[03/07/2022-05:05:48] [V] [TRT] --------------- Timing Runner: Optimizer Reformat (Reformat)
[03/07/2022-05:05:48] [V] [TRT] Tactic: 1002 Time: 0.004336
[03/07/2022-05:05:48] [V] [TRT] Tactic: 0 Time: 0.003192
[03/07/2022-05:05:48] [V] [TRT] Fastest Tactic: 0 Time: 0.003192
[03/07/2022-05:05:48] [V] [TRT] *************** Autotuning format combination: Float(1024,1,1,1) -> Float(10,1,1,1) ***************
[03/07/2022-05:05:48] [V] [TRT] --------------- Timing Runner: MatMul_1 + b4/read:0 + (Unnamed Layer* 37) [Shuffle] + unsqueeze_node_after_b4/read:0 + (Unnamed Layer* 37) [Shuffle] + add_3 (CudaDepthwiseConvolution)
[03/07/2022-05:05:48] [V] [TRT] CudaDepthwiseConvolution has no valid tactics for this config, skipping
[03/07/2022-05:05:48] [V] [TRT] --------------- Timing Runner: MatMul_1 + b4/read:0 + (Unnamed Layer* 37) [Shuffle] + unsqueeze_node_after_b4/read:0 + (Unnamed Layer* 37) [Shuffle] + add_3 (FusedConvActConvolution)
[03/07/2022-05:05:48] [V] [TRT] FusedConvActConvolution has no valid tactics for this config, skipping
[03/07/2022-05:05:48] [V] [TRT] --------------- Timing Runner: MatMul_1 + b4/read:0 + (Unnamed Layer* 37) [Shuffle] + unsqueeze_node_after_b4/read:0 + (Unnamed Layer* 37) [Shuffle] + add_3 (CudnnConvolution)
[03/07/2022-05:05:48] [V] [TRT] Tactic: 0 Time: 0.126088
[03/07/2022-05:05:48] [V] [TRT] Tactic: 1 Time: 0.053488
[03/07/2022-05:05:48] [V] [TRT] Tactic: 2 Time: 0.152756
[03/07/2022-05:05:48] [V] [TRT] Tactic: 4 Time: 0.318428
[03/07/2022-05:05:48] [V] [TRT] Tactic: 5 Time: 0.0986
[03/07/2022-05:05:48] [V] [TRT] Fastest Tactic: 1 Time: 0.053488
[03/07/2022-05:05:48] [V] [TRT] --------------- Timing Runner: MatMul_1 + b4/read:0 + (Unnamed Layer* 37) [Shuffle] + unsqueeze_node_after_b4/read:0 + (Unnamed Layer* 37) [Shuffle] + add_3 (CublasConvolution)
[03/07/2022-05:05:48] [V] [TRT] Tactic: 0 Time: 0.00836
[03/07/2022-05:05:48] [V] [TRT] Tactic: 1 Time: 0.0117
[03/07/2022-05:05:48] [V] [TRT] Fastest Tactic: 0 Time: 0.00836
[03/07/2022-05:05:48] [V] [TRT] --------------- Timing Runner: MatMul_1 + b4/read:0 + (Unnamed Layer* 37) [Shuffle] + unsqueeze_node_after_b4/read:0 + (Unnamed Layer* 37) [Shuffle] + add_3 (CaskConvolution)
[03/07/2022-05:05:48] [V] [TRT] MatMul_1 + b4/read:0 + (Unnamed Layer* 37) [Shuffle] + unsqueeze_node_after_b4/read:0 + (Unnamed Layer* 37) [Shuffle] + add_3 Set Tactic Name: maxwell_scudnn_128x32_relu_medium_nn_v1 Tactic: 1062367460111450758
[03/07/2022-05:05:49] [V] [TRT] Tactic: 1062367460111450758 Time: 0.092468
[03/07/2022-05:05:49] [V] [TRT] MatMul_1 + b4/read:0 + (Unnamed Layer* 37) [Shuffle] + unsqueeze_node_after_b4/read:0 + (Unnamed Layer* 37) [Shuffle] + add_3 Set Tactic Name: maxwell_scudnn_128x32_relu_interior_nn_v0 Tactic: 1698681053543049347
[03/07/2022-05:05:49] [V] [TRT] Tactic: 1698681053543049347 Time: 0.063852
[03/07/2022-05:05:49] [V] [TRT] MatMul_1 + b4/read:0 + (Unnamed Layer* 37) [Shuffle] + unsqueeze_node_after_b4/read:0 + (Unnamed Layer* 37) [Shuffle] + add_3 Set Tactic Name: maxwell_scudnn_128x128_relu_medium_nn_v1 Tactic: 4501471010995462441
[03/07/2022-05:05:49] [V] [TRT] Tactic: 4501471010995462441 Time: 0.09816
[03/07/2022-05:05:49] [V] [TRT] MatMul_1 + b4/read:0 + (Unnamed Layer* 37) [Shuffle] + unsqueeze_node_after_b4/read:0 + (Unnamed Layer* 37) [Shuffle] + add_3 Set Tactic Name: maxwell_scudnn_128x64_relu_small_nn_v1 Tactic: 5137655947464784826
[03/07/2022-05:05:49] [V] [TRT] Tactic: 5137655947464784826 Time: 0.065772
[03/07/2022-05:05:49] [V] [TRT] MatMul_1 + b4/read:0 + (Unnamed Layer* 37) [Shuffle] + unsqueeze_node_after_b4/read:0 + (Unnamed Layer* 37) [Shuffle] + add_3 Set Tactic Name: maxwell_scudnn_128x128_relu_small_nn_v0 Tactic: 5288347012147084929
[03/07/2022-05:05:49] [V] [TRT] Tactic: 5288347012147084929 Time: 0.094832
[03/07/2022-05:05:49] [V] [TRT] MatMul_1 + b4/read:0 + (Unnamed Layer* 37) [Shuffle] + unsqueeze_node_after_b4/read:0 + (Unnamed Layer* 37) [Shuffle] + add_3 Set Tactic Name: maxwell_scudnn_128x128_relu_interior_nn_v1 Tactic: 5326823351883942011
[03/07/2022-05:05:49] [V] [TRT] Tactic: 5326823351883942011 Time: 0.094328
[03/07/2022-05:05:49] [V] [TRT] MatMul_1 + b4/read:0 + (Unnamed Layer* 37) [Shuffle] + unsqueeze_node_after_b4/read:0 + (Unnamed Layer* 37) [Shuffle] + add_3 Set Tactic Name: maxwell_scudnn_128x64_relu_interior_nn_v0 Tactic: 5500448035057547314
[03/07/2022-05:05:49] [V] [TRT] Tactic: 5500448035057547314 Time: 0.081396
[03/07/2022-05:05:49] [V] [TRT] MatMul_1 + b4/read:0 + (Unnamed Layer* 37) [Shuffle] + unsqueeze_node_after_b4/read:0 + (Unnamed Layer* 37) [Shuffle] + add_3 Set Tactic Name: maxwell_scudnn_128x64_relu_medium_nn_v1 Tactic: 6645123197870846056
[03/07/2022-05:05:49] [V] [TRT] Tactic: 6645123197870846056 Time: 0.070896
[03/07/2022-05:05:49] [V] [TRT] MatMul_1 + b4/read:0 + (Unnamed Layer* 37) [Shuffle] + unsqueeze_node_after_b4/read:0 + (Unnamed Layer* 37) [Shuffle] + add_3 Set Tactic Name: maxwell_scudnn_128x32_relu_small_nn_v0 Tactic: 7144526460361122478
[03/07/2022-05:05:49] [V] [TRT] Tactic: 7144526460361122478 Time: 0.06662
[03/07/2022-05:05:49] [V] [TRT] MatMul_1 + b4/read:0 + (Unnamed Layer* 37) [Shuffle] + unsqueeze_node_after_b4/read:0 + (Unnamed Layer* 37) [Shuffle] + add_3 Set Tactic Name: maxwell_scudnn_128x128_relu_medium_nn_v0 Tactic: -8262349710178828730
[03/07/2022-05:05:49] [V] [TRT] Tactic: -8262349710178828730 Time: 0.097272
[03/07/2022-05:05:49] [V] [TRT] MatMul_1 + b4/read:0 + (Unnamed Layer* 37) [Shuffle] + unsqueeze_node_after_b4/read:0 + (Unnamed Layer* 37) [Shuffle] + add_3 Set Tactic Name: maxwell_scudnn_128x32_relu_interior_nn_v1 Tactic: -6576203419454146580
[03/07/2022-05:05:49] [V] [TRT] Tactic: -6576203419454146580 Time: 0.069692
[03/07/2022-05:05:49] [V] [TRT] MatMul_1 + b4/read:0 + (Unnamed Layer* 37) [Shuffle] + unsqueeze_node_after_b4/read:0 + (Unnamed Layer* 37) [Shuffle] + add_3 Set Tactic Name: maxwell_scudnn_128x32_relu_medium_nn_v0 Tactic: -4787320710726427159
[03/07/2022-05:05:49] [V] [TRT] Tactic: -4787320710726427159 Time: 0.071996
[03/07/2022-05:05:49] [V] [TRT] MatMul_1 + b4/read:0 + (Unnamed Layer* 37) [Shuffle] + unsqueeze_node_after_b4/read:0 + (Unnamed Layer* 37) [Shuffle] + add_3 Set Tactic Name: maxwell_scudnn_128x32_relu_small_nn_v1 Tactic: -3456450830548107839
[03/07/2022-05:05:49] [V] [TRT] Tactic: -3456450830548107839 Time: 0.074164
[03/07/2022-05:05:49] [V] [TRT] MatMul_1 + b4/read:0 + (Unnamed Layer* 37) [Shuffle] + unsqueeze_node_after_b4/read:0 + (Unnamed Layer* 37) [Shuffle] + add_3 Set Tactic Name: maxwell_scudnn_128x64_relu_medium_nn_v0 Tactic: -1218658103698133241
[03/07/2022-05:05:49] [V] [TRT] Tactic: -1218658103698133241 Time: 0.088184
[03/07/2022-05:05:49] [V] [TRT] MatMul_1 + b4/read:0 + (Unnamed Layer* 37) [Shuffle] + unsqueeze_node_after_b4/read:0 + (Unnamed Layer* 37) [Shuffle] + add_3 Set Tactic Name: maxwell_scudnn_128x64_relu_small_nn_v0 Tactic: -836875257600482091
[03/07/2022-05:05:49] [V] [TRT] Tactic: -836875257600482091 Time: 0.082988
[03/07/2022-05:05:49] [V] [TRT] MatMul_1 + b4/read:0 + (Unnamed Layer* 37) [Shuffle] + unsqueeze_node_after_b4/read:0 + (Unnamed Layer* 37) [Shuffle] + add_3 Set Tactic Name: maxwell_scudnn_128x128_relu_small_nn_v1 Tactic: -410470605513481746
[03/07/2022-05:05:49] [V] [TRT] Tactic: -410470605513481746 Time: 0.093688
[03/07/2022-05:05:49] [V] [TRT] MatMul_1 + b4/read:0 + (Unnamed Layer* 37) [Shuffle] + unsqueeze_node_after_b4/read:0 + (Unnamed Layer* 37) [Shuffle] + add_3 Set Tactic Name: maxwell_scudnn_128x128_relu_interior_nn_v0 Tactic: -377491875521947884
[03/07/2022-05:05:49] [V] [TRT] Tactic: -377491875521947884 Time: 0.093608
[03/07/2022-05:05:49] [V] [TRT] MatMul_1 + b4/read:0 + (Unnamed Layer* 37) [Shuffle] + unsqueeze_node_after_b4/read:0 + (Unnamed Layer* 37) [Shuffle] + add_3 Set Tactic Name: maxwell_scudnn_128x64_relu_interior_nn_v1 Tactic: -37215280111360163
[03/07/2022-05:05:49] [V] [TRT] Tactic: -37215280111360163 Time: 0.063608
[03/07/2022-05:05:49] [V] [TRT] Fastest Tactic: -37215280111360163 Time: 0.063608
[03/07/2022-05:05:49] [V] [TRT] >>>>>>>>>>>>>>> Chose Runner Type: CublasConvolution Tactic: 0
[03/07/2022-05:05:49] [V] [TRT] *************** Autotuning format combination: Float(1024,1,1024,1024) -> Float(10,1,10,10) ***************
[03/07/2022-05:05:49] [V] [TRT] --------------- Timing Runner: MatMul_1 + b4/read:0 + (Unnamed Layer* 37) [Shuffle] + unsqueeze_node_after_b4/read:0 + (Unnamed Layer* 37) [Shuffle] + add_3 (CudnnConvolution)
[03/07/2022-05:05:49] [V] [TRT] CudnnConvolution has no valid tactics for this config, skipping
[03/07/2022-05:05:49] [V] [TRT] --------------- Timing Runner: MatMul_1 + b4/read:0 + (Unnamed Layer* 37) [Shuffle] + unsqueeze_node_after_b4/read:0 + (Unnamed Layer* 37) [Shuffle] + add_3 (CublasConvolution)
[03/07/2022-05:05:49] [V] [TRT] CublasConvolution has no valid tactics for this config, skipping
[03/07/2022-05:05:49] [V] [TRT] --------------- Timing Runner: MatMul_1 + b4/read:0 + (Unnamed Layer* 37) [Shuffle] + unsqueeze_node_after_b4/read:0 + (Unnamed Layer* 37) [Shuffle] + add_3 (CaskConvolution)
[03/07/2022-05:05:49] [V] [TRT] CaskConvolution has no valid tactics for this config, skipping
[03/07/2022-05:05:49] [V] [TRT] *************** Autotuning Reformat:Float(10,1,10,10) -> Float(10,1,1,1) ***************
[03/07/2022-05:05:49] [V] [TRT] --------------- Timing Runner: Optimizer Reformat (Reformat)
[03/07/2022-05:05:49] [V] [TRT] Tactic: 1002 Time: 0.004404
[03/07/2022-05:05:49] [V] [TRT] Tactic: 0 Time: 0.003132
[03/07/2022-05:05:49] [V] [TRT] Fastest Tactic: 0 Time: 0.003132
[03/07/2022-05:05:49] [V] [TRT] *************** Autotuning format combination: Float(10,1,1,1) -> Float(10,1) ***************
[03/07/2022-05:05:49] [V] [TRT] --------------- Timing Runner: copied_squeeze_after_add_3 (Shuffle)
[03/07/2022-05:05:49] [V] [TRT] Tactic: 0 is the only option, timing skipped
[03/07/2022-05:05:49] [V] [TRT] Fastest Tactic: 0 Time: 0
[03/07/2022-05:05:49] [V] [TRT] >>>>>>>>>>>>>>> Chose Runner Type: Shuffle Tactic: 0
[03/07/2022-05:05:49] [V] [TRT] *************** Autotuning format combination: Float(10,1) -> Float(1,1), Int32(1,1) ***************
[03/07/2022-05:05:49] [V] [TRT] --------------- Timing Runner: y + z (LogSoftmaxTopK)
[03/07/2022-05:05:49] [V] [TRT] Tactic: 1001 Time: 0.003072
[03/07/2022-05:05:49] [V] [TRT] Tactic: 1002 Time: 0.015324
[03/07/2022-05:05:49] [V] [TRT] Fastest Tactic: 1001 Time: 0.003072
[03/07/2022-05:05:49] [V] [TRT] >>>>>>>>>>>>>>> Chose Runner Type: LogSoftmaxTopK Tactic: 1001
[03/07/2022-05:05:49] [V] [TRT] *************** Autotuning format combination: Int32(1,1) -> Int32(1) ***************
[03/07/2022-05:05:49] [V] [TRT] --------------- Timing Runner: (Unnamed Layer* 52) [Shuffle] (Shuffle)
[03/07/2022-05:05:49] [V] [TRT] Tactic: 0 is the only option, timing skipped
[03/07/2022-05:05:49] [V] [TRT] Fastest Tactic: 0 Time: 0
[03/07/2022-05:05:49] [V] [TRT] >>>>>>>>>>>>>>> Chose Runner Type: Shuffle Tactic: 0
[03/07/2022-05:05:49] [V] [TRT] Adding reformat layer: Reformatted Input Tensor 0 to Conv__27 + Relu_1 (MaxPool2d:0) from Float(6272,196,14,1) to Float(6272,1,448,32)
[03/07/2022-05:05:49] [V] [TRT] Adding reformat layer: Reformatted Input Tensor 0 to MaxPool2d_1 (Relu_1:0) from Float(12544,1,896,64) to Float(12544,196,14,1)
[03/07/2022-05:05:49] [V] [TRT] Formats and tactics selection completed in 3.71546 seconds.
[03/07/2022-05:05:49] [V] [TRT] After reformat layers: 12 layers
[03/07/2022-05:05:49] [V] [TRT] Block size 1073741824
[03/07/2022-05:05:49] [V] [TRT] Block size 1605632
[03/07/2022-05:05:49] [V] [TRT] Block size 802816
[03/07/2022-05:05:49] [V] [TRT] Block size 401408
[03/07/2022-05:05:49] [V] [TRT] Block size 1
[03/07/2022-05:05:49] [V] [TRT] Total Activation Memory: 1076551681
[03/07/2022-05:05:49] [I] [TRT] Detected 1 inputs and 1 output network tensors.
[03/07/2022-05:05:49] [V] [TRT] Conv__25 + Relu Set Tactic Name: maxwell_scudnn_128x32_relu_small_nn_v0 Tactic: 7144526460361122478
[03/07/2022-05:05:49] [V] [TRT] Conv__27 + Relu_1 Set Tactic Name: maxwell_scudnn_128x32_sliced1x4_ldg4_relu_exp_small_nhwc_tn_v1 Tactic: -9153228964338181824
[03/07/2022-05:05:49] [V] [TRT] Layer: Conv__25 + Relu HostPersistent: 1664 DevicePersistent: 8192
[03/07/2022-05:05:49] [V] [TRT] Layer: MaxPool2d HostPersistent: 0 DevicePersistent: 0
[03/07/2022-05:05:49] [V] [TRT] Layer: Reformatting CopyNode for Input Tensor 0 to Conv__27 + Relu_1 HostPersistent: 0 DevicePersistent: 0
[03/07/2022-05:05:49] [V] [TRT] Layer: Conv__27 + Relu_1 HostPersistent: 1664 DevicePersistent: 206336
[03/07/2022-05:05:49] [V] [TRT] Layer: Reformatting CopyNode for Input Tensor 0 to MaxPool2d_1 HostPersistent: 0 DevicePersistent: 0
[03/07/2022-05:05:49] [V] [TRT] Layer: MaxPool2d_1 HostPersistent: 0 DevicePersistent: 0
[03/07/2022-05:05:49] [V] [TRT] Layer: MaxPool2d_1__22 + Reshape + (Unnamed Layer* 14) [Shuffle] HostPersistent: 0 DevicePersistent: 0
[03/07/2022-05:05:49] [V] [TRT] Layer: MatMul + b3/read:0 + (Unnamed Layer* 21) [Shuffle] + unsqueeze_node_after_b3/read:0 + (Unnamed Layer* 21) [Shuffle] + add_2 + Relu_2 HostPersistent: 340 DevicePersistent: 0
[03/07/2022-05:05:49] [V] [TRT] Layer: MatMul_1 + b4/read:0 + (Unnamed Layer* 37) [Shuffle] + unsqueeze_node_after_b4/read:0 + (Unnamed Layer* 37) [Shuffle] + add_3 HostPersistent: 340 DevicePersistent: 0
[03/07/2022-05:05:49] [V] [TRT] Layer: y + z HostPersistent: 0 DevicePersistent: 0
[03/07/2022-05:05:49] [I] [TRT] Total Host Persistent Memory: 4032
[03/07/2022-05:05:49] [I] [TRT] Total Device Persistent Memory: 214528
[03/07/2022-05:05:49] [I] [TRT] Total Scratch Memory: 0
[03/07/2022-05:05:49] [I] [TRT] [MemUsageStats] Peak memory usage of TRT CPU/GPU memory allocators: CPU 12 MiB, GPU 4 MiB
[03/07/2022-05:05:49] [V] [TRT] Using cublas a tactic source
[03/07/2022-05:05:49] [I] [TRT] [MemUsageChange] Init cuBLAS/cuBLASLt: CPU +0, GPU +8, now: CPU 772, GPU 919 (MiB)
[03/07/2022-05:05:49] [V] [TRT] Using cuDNN as a tactic source
[03/07/2022-05:05:49] [I] [TRT] [MemUsageChange] Init cuDNN: CPU +0, GPU +8, now: CPU 772, GPU 927 (MiB)
[03/07/2022-05:05:49] [I] [TRT] [MemUsageChange] Init cuBLAS/cuBLASLt: CPU +0, GPU +0, now: CPU 772, GPU 911 (MiB)
[03/07/2022-05:05:49] [V] [TRT] Engine generation completed in 4.21962 seconds.
[03/07/2022-05:05:49] [V] [TRT] Deleting timing cache: 29 entries, 0 hits
[03/07/2022-05:05:49] [I] [TRT] [MemUsageChange] Init cuBLAS/cuBLASLt: CPU +0, GPU +0, now: CPU 772, GPU 893 (MiB)
[03/07/2022-05:05:49] [V] [TRT] Engine Layer Information:
Layer(CaskConvolution): Conv__25 + Relu, Tactic: 7144526460361122478, x:0[Float(-2,1,28,28)] -> Relu:0[Float(-2,32,28,28)]
Layer(TiledPooling): MaxPool2d, Tactic: 6226177, Relu:0[Float(-2,32,28,28)] -> MaxPool2d:0[Float(-2,32,14,14)]
Layer(Reformat): Reformatting CopyNode for Input Tensor 0 to Conv__27 + Relu_1, Tactic: 0, MaxPool2d:0[Float(-2,32,14,14)] -> Reformatted Input Tensor 0 to Conv__27 + Relu_1[Float(-2,32,14,14)]
Layer(CaskConvolution): Conv__27 + Relu_1, Tactic: -9153228964338181824, Reformatted Input Tensor 0 to Conv__27 + Relu_1[Float(-2,32,14,14)] -> Relu_1:0[Float(-2,64,14,14)]
Layer(Reformat): Reformatting CopyNode for Input Tensor 0 to MaxPool2d_1, Tactic: 0, Relu_1:0[Float(-2,64,14,14)] -> Reformatted Input Tensor 0 to MaxPool2d_1[Float(-2,64,14,14)]
Layer(TiledPooling): MaxPool2d_1, Tactic: 6291713, Reformatted Input Tensor 0 to MaxPool2d_1[Float(-2,64,14,14)] -> MaxPool2d_1:0[Float(-2,64,7,7)]
Layer(Shuffle): MaxPool2d_1__22 + Reshape + (Unnamed Layer* 14) [Shuffle], Tactic: 0, MaxPool2d_1:0[Float(-2,64,7,7)] -> (Unnamed Layer* 14) [Shuffle]_output[Float(-2,3136,1,1)]
Layer(CublasConvolution): MatMul + b3/read:0 + (Unnamed Layer* 21) [Shuffle] + unsqueeze_node_after_b3/read:0 + (Unnamed Layer* 21) [Shuffle] + add_2 + Relu_2, Tactic: 1, (Unnamed Layer* 14) [Shuffle]_output[Float(-2,3136,1,1)] -> Relu_2_out_tensor[Float(-2,1024,1,1)]
Layer(CublasConvolution): MatMul_1 + b4/read:0 + (Unnamed Layer* 37) [Shuffle] + unsqueeze_node_after_b4/read:0 + (Unnamed Layer* 37) [Shuffle] + add_3, Tactic: 0, Relu_2_out_tensor[Float(-2,1024,1,1)] -> add_3_out_tensor[Float(-2,10,1,1)]
Layer(LogSoftmaxTopK): y + z, Tactic: 1001, add_3:0[Float(-2,10)] -> (Unnamed Layer* 48) [TopK]_output_1[Float(-2,1)], (Unnamed Layer* 48) [TopK]_output_2[Int32(-2,1)]
[03/07/2022-05:05:49] [I] [TRT] [MemUsageSnapshot] Builder end: CPU 772 MiB, GPU 893 MiB
[03/07/2022-05:05:49] [I] [TRT] Loaded engine size: 12 MB
[03/07/2022-05:05:49] [I] [TRT] [MemUsageSnapshot] deserializeCudaEngine begin: CPU 784 MiB, GPU 879 MiB
[03/07/2022-05:05:49] [V] [TRT] Using cublas a tactic source
[03/07/2022-05:05:49] [I] [TRT] [MemUsageChange] Init cuBLAS/cuBLASLt: CPU +0, GPU +10, now: CPU 785, GPU 903 (MiB)
[03/07/2022-05:05:49] [V] [TRT] Using cuDNN as a tactic source
[03/07/2022-05:05:49] [I] [TRT] [MemUsageChange] Init cuDNN: CPU +0, GPU +8, now: CPU 785, GPU 911 (MiB)
[03/07/2022-05:05:49] [I] [TRT] [MemUsageChange] Init cuBLAS/cuBLASLt: CPU +0, GPU +0, now: CPU 785, GPU 893 (MiB)
[03/07/2022-05:05:49] [V] [TRT] Deserialization required 29910 microseconds.
[03/07/2022-05:05:49] [I] [TRT] [MemUsageSnapshot] deserializeCudaEngine end: CPU 785 MiB, GPU 893 MiB
[03/07/2022-05:05:49] [I] Engine built in 4.58764 sec.
[03/07/2022-05:05:49] [I] [TRT] [MemUsageSnapshot] ExecutionContext creation begin: CPU 747 MiB, GPU 893 MiB
[03/07/2022-05:05:49] [V] [TRT] Using cublas a tactic source
[03/07/2022-05:05:49] [I] [TRT] [MemUsageChange] Init cuBLAS/cuBLASLt: CPU +0, GPU +10, now: CPU 747, GPU 903 (MiB)
[03/07/2022-05:05:49] [V] [TRT] Using cuDNN as a tactic source
[03/07/2022-05:05:49] [I] [TRT] [MemUsageChange] Init cuDNN: CPU +0, GPU +8, now: CPU 747, GPU 911 (MiB)
[03/07/2022-05:05:49] [V] [TRT] Total per-runner device memory is 214528
[03/07/2022-05:05:49] [V] [TRT] Total per-runner host memory is 4032
[03/07/2022-05:05:49] [V] [TRT] Allocated activation device memory of size 2810368
[03/07/2022-05:05:49] [I] [TRT] [MemUsageSnapshot] ExecutionContext creation end: CPU 747 MiB, GPU 915 MiB
[03/07/2022-05:05:49] [I] Created input binding for x:0 with dimensions 4x1x28x28
[03/07/2022-05:05:49] [I] Created output binding for z:0 with dimensions 4
[03/07/2022-05:05:49] [I] Starting inference
[03/07/2022-05:05:52] [I] Warmup completed 1240 queries over 200 ms
[03/07/2022-05:05:52] [I] Timing trace has 19295 queries over 3.00036 s
[03/07/2022-05:05:52] [I] 
[03/07/2022-05:05:52] [I] === Trace details ===
[03/07/2022-05:05:52] [I] Trace averages of 10 runs:
[03/07/2022-05:05:52] [I] Average on 10 runs - GPU latency: 0.153807 ms - Host latency: 0.160852 ms (end to end 0.274324 ms, enqueue 0.0509155 ms)
[03/07/2022-05:05:52] [I] Average on 10 runs - GPU latency: 0.153807 ms - Host latency: 0.160921 ms (end to end 0.282648 ms, enqueue 0.0590546 ms)
[03/07/2022-05:05:52] [I] Average on 10 runs - GPU latency: 0.153497 ms - Host latency: 0.159993 ms (end to end 0.285652 ms, enqueue 0.0450531 ms)
[03/07/2022-05:05:52] [I] Average on 10 runs - GPU latency: 0.15401 ms - Host latency: 0.161705 ms (end to end 0.285077 ms, enqueue 0.0530167 ms)
[03/07/2022-05:05:52] [I] Average on 10 runs - GPU latency: 0.153499 ms - Host latency: 0.15984 ms (end to end 0.28736 ms, enqueue 0.0461533 ms)
[03/07/2022-05:05:52] [I] Average on 10 runs - GPU latency: 0.153395 ms - Host latency: 0.159729 ms (end to end 0.2873 ms, enqueue 0.045372 ms)
[03/07/2022-05:05:52] [I] Average on 10 runs - GPU latency: 0.153188 ms - Host latency: 0.15957 ms (end to end 0.287689 ms, enqueue 0.0450317 ms)
[03/07/2022-05:05:52] [I] Average on 10 runs - GPU latency: 0.15401 ms - Host latency: 0.160339 ms (end to end 0.269775 ms, enqueue 0.0449387 ms)
[03/07/2022-05:05:52] [I] Average on 10 runs - GPU latency: 0.153601 ms - Host latency: 0.160258 ms (end to end 0.278796 ms, enqueue 0.0484436 ms)
[03/07/2022-05:05:52] [I] Average on 10 runs - GPU latency: 0.153397 ms - Host latency: 0.160551 ms (end to end 0.280096 ms, enqueue 0.0550354 ms)
[03/07/2022-05:05:52] [I] Average on 10 runs - GPU latency: 0.153291 ms - Host latency: 0.16022 ms (end to end 0.286195 ms, enqueue 0.0521851 ms)
[03/07/2022-05:05:52] [I] Average on 10 runs - GPU latency: 0.153499 ms - Host latency: 0.1604 ms (end to end 0.286517 ms, enqueue 0.0521881 ms)
[03/07/2022-05:05:52] [I] Average on 10 runs - GPU latency: 0.1536 ms - Host latency: 0.160793 ms (end to end 0.274834 ms, enqueue 0.0509232 ms)
[03/07/2022-05:05:52] [I] Average on 10 runs - GPU latency: 0.153703 ms - Host latency: 0.160648 ms (end to end 0.277077 ms, enqueue 0.0519943 ms)
[03/07/2022-05:05:52] [I] Average on 10 runs - GPU latency: 0.153807 ms - Host latency: 0.16123 ms (end to end 0.282451 ms, enqueue 0.0544434 ms)
[03/07/2022-05:05:52] [I] Average on 10 runs - GPU latency: 0.153496 ms - Host latency: 0.160014 ms (end to end 0.285422 ms, enqueue 0.0453278 ms)
[03/07/2022-05:05:52] [I] Average on 10 runs - GPU latency: 0.153395 ms - Host latency: 0.159735 ms (end to end 0.287206 ms, enqueue 0.0450867 ms)
[03/07/2022-05:05:52] [I] Average on 10 runs - GPU latency: 0.153601 ms - Host latency: 0.160107 ms (end to end 0.286937 ms, enqueue 0.0454285 ms)
[03/07/2022-05:05:52] [I] Average on 10 runs - GPU latency: 0.153802 ms - Host latency: 0.160287 ms (end to end 0.286996 ms, enqueue 0.0450394 ms)
[03/07/2022-05:05:52] [I] Average on 10 runs - GPU latency: 0.153601 ms - Host latency: 0.160057 ms (end to end 0.287573 ms, enqueue 0.0450623 ms)
[03/07/2022-05:05:52] [I] Average on 10 runs - GPU latency: 0.153494 ms - Host latency: 0.160454 ms (end to end 0.275684 ms, enqueue 0.0510788 ms)
[03/07/2022-05:05:52] [I] Average on 10 runs - GPU latency: 0.153703 ms - Host latency: 0.160817 ms (end to end 0.281998 ms, enqueue 0.0579636 ms)
[03/07/2022-05:05:52] [I] Average on 10 runs - GPU latency: 0.1537 ms - Host latency: 0.160362 ms (end to end 0.281569 ms, enqueue 0.0464294 ms)
[03/07/2022-05:05:52] [I] Average on 10 runs - GPU latency: 0.1536 ms - Host latency: 0.159758 ms (end to end 0.286726 ms, enqueue 0.0445892 ms)
[03/07/2022-05:05:52] [I] Average on 10 runs - GPU latency: 0.153908 ms - Host latency: 0.160115 ms (end to end 0.286008 ms, enqueue 0.0444199 ms)
[03/07/2022-05:05:52] [I] Average on 10 runs - GPU latency: 0.153293 ms - Host latency: 0.159737 ms (end to end 0.285292 ms, enqueue 0.0446915 ms)
[03/07/2022-05:05:52] [I] Average on 10 runs - GPU latency: 0.153497 ms - Host latency: 0.160774 ms (end to end 0.270128 ms, enqueue 0.0544952 ms)
[03/07/2022-05:05:52] [I] Average on 10 runs - GPU latency: 0.153806 ms - Host latency: 0.161449 ms (end to end 0.283157 ms, enqueue 0.0550018 ms)
[03/07/2022-05:05:52] [I] Average on 10 runs - GPU latency: 0.154214 ms - Host latency: 0.163295 ms (end to end 0.285524 ms, enqueue 0.0542099 ms)
[03/07/2022-05:05:52] [I] Average on 10 runs - GPU latency: 0.153395 ms - Host latency: 0.160332 ms (end to end 0.286304 ms, enqueue 0.0516388 ms)
[03/07/2022-05:05:52] [I] Average on 10 runs - GPU latency: 0.153395 ms - Host latency: 0.160257 ms (end to end 0.281604 ms, enqueue 0.0507202 ms)
[03/07/2022-05:05:52] [I] Average on 10 runs - GPU latency: 0.153601 ms - Host latency: 0.16073 ms (end to end 0.272301 ms, enqueue 0.0498886 ms)
[03/07/2022-05:05:52] [I] Average on 10 runs - GPU latency: 0.153806 ms - Host latency: 0.161023 ms (end to end 0.273753 ms, enqueue 0.0526993 ms)
[03/07/2022-05:05:52] [I] Average on 10 runs - GPU latency: 0.153499 ms - Host latency: 0.160471 ms (end to end 0.281685 ms, enqueue 0.0520493 ms)
[03/07/2022-05:05:52] [I] Average on 10 runs - GPU latency: 0.153703 ms - Host latency: 0.160606 ms (end to end 0.274023 ms, enqueue 0.0519058 ms)
[03/07/2022-05:05:52] [I] Average on 10 runs - GPU latency: 0.153598 ms - Host latency: 0.16011 ms (end to end 0.28105 ms, enqueue 0.0449905 ms)
[03/07/2022-05:05:52] [I] Average on 10 runs - GPU latency: 0.1535 ms - Host latency: 0.159975 ms (end to end 0.293829 ms, enqueue 0.0377594 ms)
[03/07/2022-05:05:52] [I] Average on 10 runs - GPU latency: 0.153192 ms - Host latency: 0.159576 ms (end to end 0.292548 ms, enqueue 0.0377258 ms)
[03/07/2022-05:05:52] [I] Average on 10 runs - GPU latency: 0.15329 ms - Host latency: 0.159607 ms (end to end 0.282663 ms, enqueue 0.0362793 ms)
[03/07/2022-05:05:52] [I] Average on 10 runs - GPU latency: 0.153802 ms - Host latency: 0.159583 ms (end to end 0.291949 ms, enqueue 0.0323181 ms)
[03/07/2022-05:05:52] [I] Average on 10 runs - GPU latency: 0.153601 ms - Host latency: 0.159518 ms (end to end 0.294351 ms, enqueue 0.0330109 ms)
[03/07/2022-05:05:52] [I] Average on 10 runs - GPU latency: 0.15318 ms - Host latency: 0.158948 ms (end to end 0.294763 ms, enqueue 0.0324646 ms)
[03/07/2022-05:05:52] [I] Average on 10 runs - GPU latency: 0.153192 ms - Host latency: 0.15896 ms (end to end 0.293912 ms, enqueue 0.0323303 ms)
[03/07/2022-05:05:52] [I] Average on 10 runs - GPU latency: 0.15329 ms - Host latency: 0.159335 ms (end to end 0.294113 ms, enqueue 0.0324921 ms)
[03/07/2022-05:05:52] [I] Average on 10 runs - GPU latency: 0.153506 ms - Host latency: 0.159412 ms (end to end 0.291284 ms, enqueue 0.0326782 ms)
[03/07/2022-05:05:52] [I] Average on 10 runs - GPU latency: 0.153598 ms - Host latency: 0.159375 ms (end to end 0.289301 ms, enqueue 0.0319519 ms)
[03/07/2022-05:05:52] [I] Average on 10 runs - GPU latency: 0.153595 ms - Host latency: 0.160422 ms (end to end 0.281631 ms, enqueue 0.0375977 ms)
[03/07/2022-05:05:52] [I] Average on 10 runs - GPU latency: 0.15329 ms - Host latency: 0.160025 ms (end to end 0.278476 ms, enqueue 0.0389648 ms)
[03/07/2022-05:05:52] [I] Average on 10 runs - GPU latency: 0.1535 ms - Host latency: 0.160794 ms (end to end 0.271063 ms, enqueue 0.0406311 ms)
[03/07/2022-05:05:52] [I] Average on 10 runs - GPU latency: 0.153595 ms - Host latency: 0.160413 ms (end to end 0.277106 ms, enqueue 0.0395172 ms)
[03/07/2022-05:05:52] [I] Average on 10 runs - GPU latency: 0.15361 ms - Host latency: 0.160519 ms (end to end 0.287161 ms, enqueue 0.0416138 ms)
[03/07/2022-05:05:52] [I] Average on 10 runs - GPU latency: 0.153293 ms - Host latency: 0.159695 ms (end to end 0.293558 ms, enqueue 0.0376282 ms)
[03/07/2022-05:05:52] [I] Average on 10 runs - GPU latency: 0.153696 ms - Host latency: 0.160077 ms (end to end 0.293719 ms, enqueue 0.0375488 ms)
[03/07/2022-05:05:52] [I] Average on 10 runs - GPU latency: 0.153296 ms - Host latency: 0.159656 ms (end to end 0.291919 ms, enqueue 0.0376465 ms)
[03/07/2022-05:05:52] [I] Average on 10 runs - GPU latency: 0.15329 ms - Host latency: 0.159381 ms (end to end 0.293384 ms, enqueue 0.037735 ms)
[03/07/2022-05:05:52] [I] Average on 10 runs - GPU latency: 0.153397 ms - Host latency: 0.159879 ms (end to end 0.292654 ms, enqueue 0.0372955 ms)
[03/07/2022-05:05:52] [I] Average on 10 runs - GPU latency: 0.15339 ms - Host latency: 0.159286 ms (end to end 0.29252 ms, enqueue 0.0339325 ms)
[03/07/2022-05:05:52] [I] Average on 10 runs - GPU latency: 0.15339 ms - Host latency: 0.159329 ms (end to end 0.294492 ms, enqueue 0.031897 ms)
[03/07/2022-05:05:52] [I] Average on 10 runs - GPU latency: 0.15339 ms - Host latency: 0.159128 ms (end to end 0.291235 ms, enqueue 0.0319702 ms)
[03/07/2022-05:05:52] [I] Average on 10 runs - GPU latency: 0.15329 ms - Host latency: 0.159198 ms (end to end 0.290848 ms, enqueue 0.0318237 ms)
[03/07/2022-05:05:52] [I] Average on 10 runs - GPU latency: 0.153293 ms - Host latency: 0.159146 ms (end to end 0.293118 ms, enqueue 0.0318085 ms)
[03/07/2022-05:05:52] [I] Average on 10 runs - GPU latency: 0.153915 ms - Host latency: 0.160156 ms (end to end 0.281723 ms, enqueue 0.0339722 ms)
[03/07/2022-05:05:52] [I] Average on 10 runs - GPU latency: 0.153287 ms - Host latency: 0.164249 ms (end to end 0.281323 ms, enqueue 0.0399719 ms)
[03/07/2022-05:05:52] [I] Average on 10 runs - GPU latency: 0.153296 ms - Host latency: 0.159012 ms (end to end 0.29455 ms, enqueue 0.0324158 ms)
[03/07/2022-05:05:52] [I] Average on 10 runs - GPU latency: 0.153497 ms - Host latency: 0.159854 ms (end to end 0.284448 ms, enqueue 0.0324188 ms)
[03/07/2022-05:05:52] [I] Average on 10 runs - GPU latency: 0.153296 ms - Host latency: 0.159204 ms (end to end 0.294131 ms, enqueue 0.0323151 ms)
[03/07/2022-05:05:52] [I] Average on 10 runs - GPU latency: 0.153595 ms - Host latency: 0.159421 ms (end to end 0.294528 ms, enqueue 0.0331116 ms)
[03/07/2022-05:05:52] [I] Average on 10 runs - GPU latency: 0.153296 ms - Host latency: 0.159552 ms (end to end 0.283426 ms, enqueue 0.0427185 ms)
[03/07/2022-05:05:52] [I] Average on 10 runs - GPU latency: 0.153806 ms - Host latency: 0.159802 ms (end to end 0.294138 ms, enqueue 0.0334534 ms)
[03/07/2022-05:05:52] [I] Average on 10 runs - GPU latency: 0.153598 ms - Host latency: 0.159564 ms (end to end 0.287289 ms, enqueue 0.0323883 ms)
[03/07/2022-05:05:52] [I] Average on 10 runs - GPU latency: 0.153394 ms - Host latency: 0.159283 ms (end to end 0.290881 ms, enqueue 0.0323242 ms)
