cookbook/08-Tool/trtexec/result-FP16.log
[08/17/2022-07:51:00] [V] [TRT] *************** Autotuning Reformat: Float(784,784,28,1) -> Float(784,1,28,1) ***************
[08/17/2022-07:51:00] [V] [TRT] --------------- Timing Runner: Optimizer Reformat(tensor-0 -> <out>) (Reformat)
[08/17/2022-07:51:00] [V] [TRT] Tactic: 0x00000000000003e8 Time: 0.00193877
[08/17/2022-07:51:00] [V] [TRT] Tactic: 0x00000000000003ea Time: 0.00598019
[08/17/2022-07:51:00] [V] [TRT] Tactic: 0x0000000000000000 Time: 0.00196784
[08/17/2022-07:51:00] [V] [TRT] Fastest Tactic: 0x00000000000003e8 Time: 0.00193877
[08/17/2022-07:51:00] [V] [TRT] *************** Autotuning Reformat: Float(784,784,28,1) -> Half(784,784,28,1) ***************
[08/17/2022-07:51:00] [V] [TRT] --------------- Timing Runner: Optimizer Reformat(tensor-0 -> <out>) (Reformat)
[08/17/2022-07:51:00] [V] [TRT] Tactic: 0x00000000000003e8 Time: 0.00149052
[08/17/2022-07:51:00] [V] [TRT] Tactic: 0x00000000000003ea Time: 0.0054505
[08/17/2022-07:51:00] [V] [TRT] Tactic: 0x0000000000000000 Time: 0.00286418
[08/17/2022-07:51:00] [V] [TRT] Fastest Tactic: 0x00000000000003e8 Time: 0.00149052
[08/17/2022-07:51:00] [V] [TRT] =============== Computing reformatting costs
[08/17/2022-07:51:00] [V] [TRT] *************** Autotuning Reformat: Float(25088,784,28,1) -> Half(25088,784,28,1) ***************
[08/17/2022-07:51:00] [V] [TRT] --------------- Timing Runner: Optimizer Reformat(tensor-2 -> <out>) (Reformat)
[08/17/2022-07:51:00] [V] [TRT] Tactic: 0x00000000000003e8 Time: 0.00311642
[08/17/2022-07:51:00] [V] [TRT] Tactic: 0x00000000000003ea Time: 0.00669631
[08/17/2022-07:51:00] [V] [TRT] Tactic: 0x0000000000000000 Time: 0.00530895
[08/17/2022-07:51:00] [V] [TRT] Fastest Tactic: 0x00000000000003e8 Time: 0.00311642
[08/17/2022-07:51:00] [V] [TRT] *************** Autotuning Reformat: Float(25088,1,896,32) -> Float(25088,784,28,1) ***************
[08/17/2022-07:51:00] [V] [TRT] --------------- Timing Runner: Optimizer Reformat(tensor-2 -> <out>) (Reformat)
[08/17/2022-07:51:00] [V] [TRT] Tactic: 0x00000000000003e8 Time: 0.00602191
[08/17/2022-07:51:00] [V] [TRT] Tactic: 0x00000000000003ea Time: 0.0137243
[08/17/2022-07:51:00] [V] [TRT] Tactic: 0x0000000000000000 Time: 0.00619295
[08/17/2022-07:51:00] [V] [TRT] Fastest Tactic: 0x00000000000003e8 Time: 0.00602191
[08/17/2022-07:51:00] [V] [TRT] *************** Autotuning Reformat: Float(25088,1,896,32) -> Half(25088,784,28,1) ***************
[08/17/2022-07:51:00] [V] [TRT] --------------- Timing Runner: Optimizer Reformat(tensor-2 -> <out>) (Reformat)
[08/17/2022-07:51:00] [V] [TRT] Tactic: 0x00000000000003e8 Time: 0.00610743
[08/17/2022-07:51:00] [V] [TRT] Tactic: 0x00000000000003ea Time: 0.00598591
[08/17/2022-07:51:00] [V] [TRT] Tactic: 0x0000000000000000 Time: 0.00606305
[08/17/2022-07:51:00] [V] [TRT] Fastest Tactic: 0x00000000000003ea Time: 0.00598591
[08/17/2022-07:51:00] [V] [TRT] *************** Autotuning Reformat: Half(25088,784,28,1) -> Float(25088,784,28,1) ***************
[08/17/2022-07:51:00] [V] [TRT] --------------- Timing Runner: Optimizer Reformat(tensor-2 -> <out>) (Reformat)
[08/17/2022-07:51:00] [V] [TRT] Tactic: 0x00000000000003e8 Time: 0.00312089
[08/17/2022-07:51:00] [V] [TRT] Tactic: 0x00000000000003ea Time: 0.00789365
[08/17/2022-07:51:00] [V] [TRT] Tactic: 0x0000000000000000 Time: 0.0046897
[08/17/2022-07:51:00] [V] [TRT] Fastest Tactic: 0x00000000000003e8 Time: 0.00312089
[08/17/2022-07:51:00] [V] [TRT] =============== Computing reformatting costs
[08/17/2022-07:51:00] [V] [TRT] *************** Autotuning Reformat: Float(6272,196,14,1) -> Float(6272,1,448,32) ***************
[08/17/2022-07:51:00] [V] [TRT] --------------- Timing Runner: Optimizer Reformat(tensor-3 -> <out>) (Reformat)
[08/17/2022-07:51:00] [V] [TRT] Tactic: 0x00000000000003e8 Time: 0.00320802
[08/17/2022-07:51:00] [V] [TRT] Tactic: 0x00000000000003ea Time: 0.013285
[08/17/2022-07:51:00] [V] [TRT] Tactic: 0x0000000000000000 Time: 0.00315279
[08/17/2022-07:51:00] [V] [TRT] Fastest Tactic: 0x0000000000000000 Time: 0.00315279
[08/17/2022-07:51:00] [V] [TRT] *************** Autotuning Reformat: Float(6272,196,14,1) -> Half(6272,196,14,1) ***************
[08/17/2022-07:51:00] [V] [TRT] --------------- Timing Runner: Optimizer Reformat(tensor-3 -> <out>) (Reformat)
[08/17/2022-07:51:00] [V] [TRT] Tactic: 0x00000000000003e8 Time: 0.00193291
[08/17/2022-07:51:00] [V] [TRT] Tactic: 0x00000000000003ea Time: 0.0254293
[08/17/2022-07:51:00] [V] [TRT] Tactic: 0x0000000000000000 Time: 0.00339445
[08/17/2022-07:51:00] [V] [TRT] Fastest Tactic: 0x00000000000003e8 Time: 0.00193291
[08/17/2022-07:51:00] [V] [TRT] *************** Autotuning Reformat: Float(6272,1,448,32) -> Float(6272,196,14,1) ***************
[08/17/2022-07:51:00] [V] [TRT] --------------- Timing Runner: Optimizer Reformat(tensor-3 -> <out>) (Reformat)
[08/17/2022-07:51:00] [V] [TRT] Tactic: 0x00000000000003e8 Time: 0.00309417
[08/17/2022-07:51:00] [V] [TRT] Tactic: 0x00000000000003ea Time: 0.0133544
[08/17/2022-07:51:00] [V] [TRT] Tactic: 0x0000000000000000 Time: 0.00320427
[08/17/2022-07:51:00] [V] [TRT] Fastest Tactic: 0x00000000000003e8 Time: 0.00309417
[08/17/2022-07:51:00] [V] [TRT] *************** Autotuning Reformat: Float(6272,1,448,32) -> Half(6272,196,14,1) ***************
[08/17/2022-07:51:00] [V] [TRT] --------------- Timing Runner: Optimizer Reformat(tensor-3 -> <out>) (Reformat)
[08/17/2022-07:51:00] [V] [TRT] Tactic: 0x00000000000003e8 Time: 0.00313133
[08/17/2022-07:51:00] [V] [TRT] Tactic: 0x00000000000003ea Time: 0.00551385
[08/17/2022-07:51:00] [V] [TRT] Tactic: 0x0000000000000000 Time: 0.00313779
[08/17/2022-07:51:00] [V] [TRT] Fastest Tactic: 0x00000000000003e8 Time: 0.00313133
[08/17/2022-07:51:00] [V] [TRT] *************** Autotuning Reformat: Half(6272,196,14,1) -> Float(6272,196,14,1) ***************
[08/17/2022-07:51:00] [V] [TRT] --------------- Timing Runner: Optimizer Reformat(tensor-3 -> <out>) (Reformat)
[08/17/2022-07:51:00] [V] [TRT] Tactic: 0x00000000000003e8 Time: 0.00183994
[08/17/2022-07:51:00] [V] [TRT] Tactic: 0x00000000000003ea Time: 0.0260145
[08/17/2022-07:51:00] [V] [TRT] Tactic: 0x0000000000000000 Time: 0.00257404
[08/17/2022-07:51:00] [V] [TRT] Fastest Tactic: 0x00000000000003e8 Time: 0.00183994
[08/17/2022-07:51:00] [V] [TRT] *************** Autotuning Reformat: Half(6272,196,14,1) -> Float(6272,1,448,32) ***************
[08/17/2022-07:51:00] [V] [TRT] --------------- Timing Runner: Optimizer Reformat(tensor-3 -> <out>) (Reformat)
[08/17/2022-07:51:00] [V] [TRT] Tactic: 0x00000000000003e8 Time: 0.0033174
[08/17/2022-07:51:00] [V] [TRT] Tactic: 0x00000000000003ea Time: 0.00505584
[08/17/2022-07:51:00] [V] [TRT] Tactic: 0x0000000000000000 Time: 0.00331023
[08/17/2022-07:51:00] [V] [TRT] Fastest Tactic: 0x0000000000000000 Time: 0.00331023
[08/17/2022-07:51:00] [V] [TRT] =============== Computing reformatting costs
[08/17/2022-07:51:00] [V] [TRT] *************** Autotuning Reformat: Float(12544,196,14,1) -> Half(12544,196,14,1) ***************
[08/17/2022-07:51:00] [V] [TRT] --------------- Timing Runner: Optimizer Reformat(tensor-5 -> <out>) (Reformat)
[08/17/2022-07:51:00] [V] [TRT] Tactic: 0x00000000000003e8 Time: 0.00232406
[08/17/2022-07:51:00] [V] [TRT] Tactic: 0x00000000000003ea Time: 0.0484206
[08/17/2022-07:51:00] [V] [TRT] Tactic: 0x0000000000000000 Time: 0.00382003
[08/17/2022-07:51:00] [V] [TRT] Fastest Tactic: 0x00000000000003e8 Time: 0.00232406
[08/17/2022-07:51:00] [V] [TRT] *************** Autotuning Reformat: Float(12544,1,896,64) -> Float(12544,196,14,1) ***************
[08/17/2022-07:51:00] [V] [TRT] --------------- Timing Runner: Optimizer Reformat(tensor-5 -> <out>) (Reformat)
[08/17/2022-07:51:00] [V] [TRT] Tactic: 0x00000000000003e8 Time: 0.00414615
[08/17/2022-07:51:00] [V] [TRT] Tactic: 0x00000000000003ea Time: 0.0130859
[08/17/2022-07:51:00] [V] [TRT] Tactic: 0x0000000000000000 Time: 0.00412865
[08/17/2022-07:51:00] [V] [TRT] Fastest Tactic: 0x0000000000000000 Time: 0.00412865
[08/17/2022-07:51:00] [V] [TRT] *************** Autotuning Reformat: Float(12544,1,896,64) -> Half(12544,196,14,1) ***************
[08/17/2022-07:51:00] [V] [TRT] --------------- Timing Runner: Optimizer Reformat(tensor-5 -> <out>) (Reformat)
[08/17/2022-07:51:00] [V] [TRT] Tactic: 0x00000000000003e8 Time: 0.00407162
[08/17/2022-07:51:00] [V] [TRT] Tactic: 0x00000000000003ea Time: 0.00526547
[08/17/2022-07:51:00] [V] [TRT] Tactic: 0x0000000000000000 Time: 0.00407682
[08/17/2022-07:51:00] [V] [TRT] Fastest Tactic: 0x00000000000003e8 Time: 0.00407162
[08/17/2022-07:51:00] [V] [TRT] *************** Autotuning Reformat: Half(12544,196,14,1) -> Float(12544,196,14,1) ***************
[08/17/2022-07:51:00] [V] [TRT] --------------- Timing Runner: Optimizer Reformat(tensor-5 -> <out>) (Reformat)
[08/17/2022-07:51:00] [V] [TRT] Tactic: 0x00000000000003e8 Time: 0.00235976
[08/17/2022-07:51:00] [V] [TRT] Tactic: 0x00000000000003ea Time: 0.0495909
[08/17/2022-07:51:00] [V] [TRT] Tactic: 0x0000000000000000 Time: 0.00302086
[08/17/2022-07:51:00] [V] [TRT] Fastest Tactic: 0x00000000000003e8 Time: 0.00235976
[08/17/2022-07:51:00] [V] [TRT] =============== Computing reformatting costs
[08/17/2022-07:51:00] [V] [TRT] *************** Autotuning Reformat: Float(3136,49,7,1) -> Float(3136,1,448,64) ***************
[08/17/2022-07:51:00] [V] [TRT] --------------- Timing Runner: Optimizer Reformat(tensor-6 -> <out>) (Reformat)
[08/17/2022-07:51:00] [V] [TRT] Tactic: 0x00000000000003e8 Time: 0.0025341
[08/17/2022-07:51:00] [V] [TRT] Tactic: 0x00000000000003ea Time: 0.0118214
[08/17/2022-07:51:00] [V] [TRT] Tactic: 0x0000000000000000 Time: 0.00254332
[08/17/2022-07:51:00] [V] [TRT] Fastest Tactic: 0x00000000000003e8 Time: 0.0025341
[08/17/2022-07:51:00] [V] [TRT] *************** Autotuning Reformat: Float(3136,49,7,1) -> Float(98,49:32,7,1) ***************
[08/17/2022-07:51:00] [V] [TRT] --------------- Timing Runner: Optimizer Reformat(tensor-6 -> <out>) (Reformat)
[08/17/2022-07:51:00] [V] [TRT] Tactic: 0x00000000000003e8 Time: 0.00293038
[08/17/2022-07:51:00] [V] [TRT] Tactic: 0x00000000000003ea Time: 0.0118604
[08/17/2022-07:51:00] [V] [TRT] Tactic: 0x0000000000000000 Time: 0.00291227
[08/17/2022-07:51:00] [V] [TRT] Fastest Tactic: 0x0000000000000000 Time: 0.00291227
[08/17/2022-07:51:00] [V] [TRT] *************** Autotuning Reformat: Float(3136,49,7,1) -> Half(3136,49,7,1) ***************
[08/17/2022-07:51:00] [V] [TRT] --------------- Timing Runner: Optimizer Reformat(tensor-6 -> <out>) (Reformat)
[08/17/2022-07:51:00] [V] [TRT] Tactic: 0x00000000000003e8 Time: 0.00166958
[08/17/2022-07:51:00] [V] [TRT] Tactic: 0x00000000000003ea Time: 0.0156293
[08/17/2022-07:51:00] [V] [TRT] Tactic: 0x0000000000000000 Time: 0.00293747
[08/17/2022-07:51:00] [V] [TRT] Fastest Tactic: 0x00000000000003e8 Time: 0.00166958
[08/17/2022-07:51:00] [V] [TRT] *************** Autotuning Reformat: Float(3136,1,448,64) -> Float(3136,49,7,1) ***************
[08/17/2022-07:51:00] [V] [TRT] --------------- Timing Runner: Optimizer Reformat(tensor-6 -> <out>) (Reformat)
[08/17/2022-07:51:00] [V] [TRT] Tactic: 0x00000000000003e8 Time: 0.00385908
[08/17/2022-07:51:00] [V] [TRT] Tactic: 0x00000000000003ea Time: 0.0147767
[08/17/2022-07:51:00] [V] [TRT] Tactic: 0x0000000000000000 Time: 0.00337552
[08/17/2022-07:51:00] [V] [TRT] Fastest Tactic: 0x0000000000000000 Time: 0.00337552
[08/17/2022-07:51:00] [V] [TRT] *************** Autotuning Reformat: Float(3136,1,448,64) -> Float(98,49:32,7,1) ***************
[08/17/2022-07:51:00] [V] [TRT] --------------- Timing Runner: Optimizer Reformat(tensor-6 -> <out>) (Reformat)
[08/17/2022-07:51:00] [V] [TRT] Tactic: 0x00000000000003e8 Time: 0.00314385
[08/17/2022-07:51:00] [V] [TRT] Tactic: 0x00000000000003ea Time: 0.010705
[08/17/2022-07:51:00] [V] [TRT] Tactic: 0x0000000000000000 Time: 0.0031684
[08/17/2022-07:51:00] [V] [TRT] Fastest Tactic: 0x00000000000003e8 Time: 0.00314385
[08/17/2022-07:51:00] [V] [TRT] *************** Autotuning Reformat: Float(3136,1,448,64) -> Half(3136,49,7,1) ***************
[08/17/2022-07:51:00] [V] [TRT] --------------- Timing Runner: Optimizer Reformat(tensor-6 -> <out>) (Reformat)
[08/17/2022-07:51:00] [V] [TRT] Tactic: 0x00000000000003e8 Time: 0.00393094
[08/17/2022-07:51:00] [V] [TRT] Tactic: 0x00000000000003ea Time: 0.0104072
[08/17/2022-07:51:00] [V] [TRT] Tactic: 0x0000000000000000 Time: 0.00379898
[08/17/2022-07:51:00] [V] [TRT] Fastest Tactic: 0x0000000000000000 Time: 0.00379898
[08/17/2022-07:51:00] [V] [TRT] *************** Autotuning Reformat: Float(98,49:32,7,1) -> Float(3136,49,7,1) ***************
[08/17/2022-07:51:00] [V] [TRT] --------------- Timing Runner: Optimizer Reformat(tensor-6 -> <out>) (Reformat)
[08/17/2022-07:51:00] [V] [TRT] Tactic: 0x00000000000003e8 Time: 0.0028758
[08/17/2022-07:51:00] [V] [TRT] Tactic: 0x00000000000003ea Time: 0.0122758
[08/17/2022-07:51:00] [V] [TRT] Tactic: 0x0000000000000000 Time: 0.00246763
[08/17/2022-07:51:00] [V] [TRT] Fastest Tactic: 0x0000000000000000 Time: 0.00246763
[08/17/2022-07:51:00] [V] [TRT] *************** Autotuning Reformat: Float(98,49:32,7,1) -> Float(3136,1,448,64) ***************
[08/17/2022-07:51:00] [V] [TRT] --------------- Timing Runner: Optimizer Reformat(tensor-6 -> <out>) (Reformat)
[08/17/2022-07:51:00] [V] [TRT] Tactic: 0x00000000000003e8 Time: 0.00238926
[08/17/2022-07:51:00] [V] [TRT] Tactic: 0x00000000000003ea Time: 0.0106922
[08/17/2022-07:51:00] [V] [TRT] Tactic: 0x0000000000000000 Time: 0.00239025
[08/17/2022-07:51:00] [V] [TRT] Fastest Tactic: 0x00000000000003e8 Time: 0.00238926
[08/17/2022-07:51:00] [V] [TRT] *************** Autotuning Reformat: Float(98,49:32,7,1) -> Half(3136,49,7,1) ***************
[08/17/2022-07:51:00] [V] [TRT] --------------- Timing Runner: Optimizer Reformat(tensor-6 -> <out>) (Reformat)
[08/17/2022-07:51:00] [V] [TRT] Tactic: 0x00000000000003e8 Time: 0.00267615
[08/17/2022-07:51:00] [V] [TRT] Tactic: 0x00000000000003ea Time: 0.00553635
[08/17/2022-07:51:00] [V] [TRT] Tactic: 0x0000000000000000 Time: 0.00255363
[08/17/2022-07:51:00] [V] [TRT] Fastest Tactic: 0x0000000000000000 Time: 0.00255363
[08/17/2022-07:51:00] [V] [TRT] *************** Autotuning Reformat: Half(3136,49,7,1) -> Float(3136,49,7,1) ***************
[08/17/2022-07:51:00] [V] [TRT] --------------- Timing Runner: Optimizer Reformat(tensor-6 -> <out>) (Reformat)
[08/17/2022-07:51:00] [V] [TRT] Tactic: 0x00000000000003e8 Time: 0.00195274
[08/17/2022-07:51:00] [V] [TRT] Tactic: 0x00000000000003ea Time: 0.0159538
[08/17/2022-07:51:00] [V] [TRT] Tactic: 0x0000000000000000 Time: 0.00225071
[08/17/2022-07:51:00] [V] [TRT] Fastest Tactic: 0x00000000000003e8 Time: 0.00195274
[08/17/2022-07:51:00] [V] [TRT] *************** Autotuning Reformat: Half(3136,49,7,1) -> Float(3136,1,448,64) ***************
[08/17/2022-07:51:00] [V] [TRT] --------------- Timing Runner: Optimizer Reformat(tensor-6 -> <out>) (Reformat)
[08/17/2022-07:51:00] [V] [TRT] Tactic: 0x00000000000003e8 Time: 0.0026299
[08/17/2022-07:51:00] [V] [TRT] Tactic: 0x00000000000003ea Time: 0.00544339
[08/17/2022-07:51:00] [V] [TRT] Tactic: 0x0000000000000000 Time: 0.00247291
[08/17/2022-07:51:00] [V] [TRT] Fastest Tactic: 0x0000000000000000 Time: 0.00247291
[08/17/2022-07:51:00] [V] [TRT] *************** Autotuning Reformat: Half(3136,49,7,1) -> Float(98,49:32,7,1) ***************
[08/17/2022-07:51:00] [V] [TRT] --------------- Timing Runner: Optimizer Reformat(tensor-6 -> <out>) (Reformat)
[08/17/2022-07:51:00] [V] [TRT] Tactic: 0x00000000000003e8 Time: 0.00297059
[08/17/2022-07:51:00] [V] [TRT] Tactic: 0x00000000000003ea Time: 0.00511135
[08/17/2022-07:51:00] [V] [TRT] Tactic: 0x0000000000000000 Time: 0.00292245
[08/17/2022-07:51:00] [V] [TRT] Fastest Tactic: 0x0000000000000000 Time: 0.00292245
[08/17/2022-07:51:00] [V] [TRT] =============== Computing reformatting costs
[08/17/2022-07:51:00] [V] [TRT] *************** Autotuning Reformat: Float(3136,1,1,1) -> Float(3136,1,3136,3136) ***************
[08/17/2022-07:51:00] [V] [TRT] --------------- Timing Runner: Optimizer Reformat(reshape_before_MatMul-9_out_tensor -> <out>) (Reformat)
[08/17/2022-07:51:00] [V] [TRT] Tactic: 0x00000000000003e8 Time: 0.00218154
[08/17/2022-07:51:00] [V] [TRT] Tactic: 0x00000000000003ea Time: 0.00525192
[08/17/2022-07:51:00] [V] [TRT] Tactic: 0x0000000000000000 Time: 0.00227244
[08/17/2022-07:51:00] [V] [TRT] Fastest Tactic: 0x00000000000003e8 Time: 0.00218154
[08/17/2022-07:51:00] [V] [TRT] *************** Autotuning Reformat: Float(3136,1,1,1) -> Half(3136,1,1,1) ***************
[08/17/2022-07:51:00] [V] [TRT] --------------- Timing Runner: Optimizer Reformat(reshape_before_MatMul-9_out_tensor -> <out>) (Reformat)
[08/17/2022-07:51:00] [V] [TRT] Tactic: 0x00000000000003e8 Time: 0.0017215
[08/17/2022-07:51:00] [V] [TRT] Tactic: 0x00000000000003ea Time: 0.00535873
[08/17/2022-07:51:00] [V] [TRT] Tactic: 0x0000000000000000 Time: 0.00295324
[08/17/2022-07:51:00] [V] [TRT] Fastest Tactic: 0x00000000000003e8 Time: 0.0017215
[08/17/2022-07:51:00] [V] [TRT] *************** Autotuning Reformat: Float(3136,1,3136,3136) -> Float(3136,1,1,1) ***************
[08/17/2022-07:51:00] [V] [TRT] --------------- Timing Runner: Optimizer Reformat(reshape_before_MatMul-9_out_tensor -> <out>) (Reformat)
[08/17/2022-07:51:00] [V] [TRT] Tactic: 0x00000000000003e8 Time: 0.00218632
[08/17/2022-07:51:00] [V] [TRT] Tactic: 0x00000000000003ea Time: 0.00507082
[08/17/2022-07:51:00] [V] [TRT] Tactic: 0x0000000000000000 Time: 0.0021654
[08/17/2022-07:51:00] [V] [TRT] Fastest Tactic: 0x0000000000000000 Time: 0.0021654
[08/17/2022-07:51:00] [V] [TRT] *************** Autotuning Reformat: Float(3136,1,3136,3136) -> Half(3136,1,1,1) ***************
[08/17/2022-07:51:00] [V] [TRT] --------------- Timing Runner: Optimizer Reformat(reshape_before_MatMul-9_out_tensor -> <out>) (Reformat)
[08/17/2022-07:51:00] [V] [TRT] Tactic: 0x00000000000003e8 Time: 0.00217579
[08/17/2022-07:51:00] [V] [TRT] Tactic: 0x00000000000003ea Time: 0.00518302
[08/17/2022-07:51:00] [V] [TRT] Tactic: 0x0000000000000000 Time: 0.00219435
[08/17/2022-07:51:00] [V] [TRT] Fastest Tactic: 0x00000000000003e8 Time: 0.00217579
[08/17/2022-07:51:00] [V] [TRT] *************** Autotuning Reformat: Float(98,1:32,1,1) -> Float(3136,1,1,1) ***************
[08/17/2022-07:51:00] [V] [TRT] --------------- Timing Runner: Optimizer Reformat(reshape_before_MatMul-9_out_tensor -> <out>) (Reformat)
[08/17/2022-07:51:00] [V] [TRT] Tactic: 0x00000000000003e8 Time: 0.00231912
[08/17/2022-07:51:00] [V] [TRT] Tactic: 0x00000000000003ea Time: 0.0350501
[08/17/2022-07:51:00] [V] [TRT] Tactic: 0x0000000000000000 Time: 0.0023068
[08/17/2022-07:51:00] [V] [TRT] Fastest Tactic: 0x0000000000000000 Time: 0.0023068
[08/17/2022-07:51:00] [V] [TRT] *************** Autotuning Reformat: Float(98,1:32,1,1) -> Float(3136,1,3136,3136) ***************
[08/17/2022-07:51:00] [V] [TRT] --------------- Timing Runner: Optimizer Reformat(reshape_before_MatMul-9_out_tensor -> <out>) (Reformat)
[08/17/2022-07:51:00] [V] [TRT] Tactic: 0x00000000000003e8 Time: 0.00230872
[08/17/2022-07:51:00] [V] [TRT] Tactic: 0x00000000000003ea Time: 0.0122149
[08/17/2022-07:51:00] [V] [TRT] Tactic: 0x0000000000000000 Time: 0.00293934
[08/17/2022-07:51:00] [V] [TRT] Fastest Tactic: 0x00000000000003e8 Time: 0.00230872
[08/17/2022-07:51:00] [V] [TRT] *************** Autotuning Reformat: Float(98,1:32,1,1) -> Half(3136,1,1,1) ***************
[08/17/2022-07:51:00] [V] [TRT] --------------- Timing Runner: Optimizer Reformat(reshape_before_MatMul-9_out_tensor -> <out>) (Reformat)
[08/17/2022-07:51:00] [V] [TRT] Tactic: 0x00000000000003e8 Time: 0.0035952
[08/17/2022-07:51:00] [V] [TRT] Tactic: 0x00000000000003ea Time: 0.0127116
[08/17/2022-07:51:00] [V] [TRT] Tactic: 0x0000000000000000 Time: 0.00433233
[08/17/2022-07:51:00] [V] [TRT] Fastest Tactic: 0x00000000000003e8 Time: 0.0035952
[08/17/2022-07:51:00] [V] [TRT] *************** Autotuning Reformat: Half(3136,1,1,1) -> Float(3136,1,1,1) ***************
[08/17/2022-07:51:00] [V] [TRT] --------------- Timing Runner: Optimizer Reformat(reshape_before_MatMul-9_out_tensor -> <out>) (Reformat)
[08/17/2022-07:51:00] [V] [TRT] Tactic: 0x00000000000003e8 Time: 0.00165538
[08/17/2022-07:51:00] [V] [TRT] Tactic: 0x00000000000003ea Time: 0.00544406
[08/17/2022-07:51:00] [V] [TRT] Tactic: 0x0000000000000000 Time: 0.0022802
[08/17/2022-07:51:00] [V] [TRT] Fastest Tactic: 0x00000000000003e8 Time: 0.00165538
[08/17/2022-07:51:00] [V] [TRT] *************** Autotuning Reformat: Half(3136,1,1,1) -> Float(3136,1,3136,3136) ***************
[08/17/2022-07:51:00] [V] [TRT] --------------- Timing Runner: Optimizer Reformat(reshape_before_MatMul-9_out_tensor -> <out>) (Reformat)
[08/17/2022-07:51:00] [V] [TRT] Tactic: 0x00000000000003e8 Time: 0.00219214
[08/17/2022-07:51:00] [V] [TRT] Tactic: 0x00000000000003ea Time: 0.0050746
[08/17/2022-07:51:00] [V] [TRT] Tactic: 0x0000000000000000 Time: 0.00220969
[08/17/2022-07:51:00] [V] [TRT] Fastest Tactic: 0x00000000000003e8 Time: 0.00219214
[08/17/2022-07:51:00] [V] [TRT] =============== Computing reformatting costs
[08/17/2022-07:51:00] [V] [TRT] *************** Autotuning Reformat: Float(1024,1,1,1) -> Float(1024,1,1024,1024) ***************
[08/17/2022-07:51:00] [V] [TRT] --------------- Timing Runner: Optimizer Reformat(ReLU-11_out_tensor -> <out>) (Reformat)
[08/17/2022-07:51:00] [V] [TRT] Tactic: 0x00000000000003e8 Time: 0.00191726
[08/17/2022-07:51:00] [V] [TRT] Tactic: 0x00000000000003ea Time: 0.00505458
[08/17/2022-07:51:00] [V] [TRT] Tactic: 0x0000000000000000 Time: 0.00189305
[08/17/2022-07:51:00] [V] [TRT] Fastest Tactic: 0x0000000000000000 Time: 0.00189305
[08/17/2022-07:51:00] [V] [TRT] *************** Autotuning Reformat: Float(1024,1,1,1) -> Half(1024,1,1,1) ***************
[08/17/2022-07:51:00] [V] [TRT] --------------- Timing Runner: Optimizer Reformat(ReLU-11_out_tensor -> <out>) (Reformat)
[08/17/2022-07:51:00] [V] [TRT] Tactic: 0x00000000000003e8 Time: 0.00150732
[08/17/2022-07:51:00] [V] [TRT] Tactic: 0x00000000000003ea Time: 0.00529405
[08/17/2022-07:51:00] [V] [TRT] Tactic: 0x0000000000000000 Time: 0.00286308
[08/17/2022-07:51:00] [V] [TRT] Fastest Tactic: 0x00000000000003e8 Time: 0.00150732
[08/17/2022-07:51:00] [V] [TRT] *************** Autotuning Reformat: Float(1024,1,1024,1024) -> Float(1024,1,1,1) ***************
[08/17/2022-07:51:00] [V] [TRT] --------------- Timing Runner: Optimizer Reformat(ReLU-11_out_tensor -> <out>) (Reformat)
[08/17/2022-07:51:00] [V] [TRT] Tactic: 0x00000000000003e8 Time: 0.00190653
[08/17/2022-07:51:00] [V] [TRT] Tactic: 0x00000000000003ea Time: 0.00508296
[08/17/2022-07:51:00] [V] [TRT] Tactic: 0x0000000000000000 Time: 0.00191976
[08/17/2022-07:51:00] [V] [TRT] Fastest Tactic: 0x00000000000003e8 Time: 0.00190653
[08/17/2022-07:51:00] [V] [TRT] *************** Autotuning Reformat: Float(1024,1,1024,1024) -> Half(1024,1,1,1) ***************
[08/17/2022-07:51:00] [V] [TRT] --------------- Timing Runner: Optimizer Reformat(ReLU-11_out_tensor -> <out>) (Reformat)
[08/17/2022-07:51:00] [V] [TRT] Tactic: 0x00000000000003e8 Time: 0.00192299
[08/17/2022-07:51:00] [V] [TRT] Tactic: 0x00000000000003ea Time: 0.00503693
[08/17/2022-07:51:00] [V] [TRT] Tactic: 0x0000000000000000 Time: 0.00193353
[08/17/2022-07:51:00] [V] [TRT] Fastest Tactic: 0x00000000000003e8 Time: 0.00192299
[08/17/2022-07:51:00] [V] [TRT] *************** Autotuning Reformat: Half(1024,1,1,1) -> Float(1024,1,1,1) ***************
[08/17/2022-07:51:00] [V] [TRT] --------------- Timing Runner: Optimizer Reformat(ReLU-11_out_tensor -> <out>) (Reformat)
[08/17/2022-07:51:00] [V] [TRT] Tactic: 0x00000000000003e8 Time: 0.00152054
[08/17/2022-07:51:00] [V] [TRT] Tactic: 0x00000000000003ea Time: 0.00533672
[08/17/2022-07:51:00] [V] [TRT] Tactic: 0x0000000000000000 Time: 0.00200736
[08/17/2022-07:51:00] [V] [TRT] Fastest Tactic: 0x00000000000003e8 Time: 0.00152054
[08/17/2022-07:51:00] [V] [TRT] *************** Autotuning Reformat: Half(1024,1,1,1) -> Float(1024,1,1024,1024) ***************
[08/17/2022-07:51:00] [V] [TRT] --------------- Timing Runner: Optimizer Reformat(ReLU-11_out_tensor -> <out>) (Reformat)
[08/17/2022-07:51:00] [V] [TRT] Tactic: 0x00000000000003e8 Time: 0.00193606
[08/17/2022-07:51:00] [V] [TRT] Tactic: 0x00000000000003ea Time: 0.00505805
[08/17/2022-07:51:00] [V] [TRT] Tactic: 0x0000000000000000 Time: 0.00193266
[08/17/2022-07:51:00] [V] [TRT] Fastest Tactic: 0x0000000000000000 Time: 0.00193266
[08/17/2022-07:51:00] [V] [TRT] =============== Computing reformatting costs
[08/17/2022-07:51:00] [V] [TRT] *************** Autotuning Reformat: Float(10,1,1,1) -> Half(10,1,1,1) ***************
[08/17/2022-07:51:00] [V] [TRT] --------------- Timing Runner: Optimizer Reformat(MatMul-12_out_tensor -> <out>) (Reformat)
[08/17/2022-07:51:00] [V] [TRT] Tactic: 0x00000000000003e8 Time: 0.00143497
[08/17/2022-07:51:00] [V] [TRT] Tactic: 0x00000000000003ea Time: 0.00532046
[08/17/2022-07:51:00] [V] [TRT] Tactic: 0x0000000000000000 Time: 0.00258939
[08/17/2022-07:51:00] [V] [TRT] Fastest Tactic: 0x00000000000003e8 Time: 0.00143497
[08/17/2022-07:51:00] [V] [TRT] *************** Autotuning Reformat: Float(10,1,10,10) -> Float(10,1,1,1) ***************
[08/17/2022-07:51:00] [V] [TRT] --------------- Timing Runner: Optimizer Reformat(MatMul-12_out_tensor -> <out>) (Reformat)
[08/17/2022-07:51:00] [V] [TRT] Tactic: 0x00000000000003e8 Time: 0.00182348
[08/17/2022-07:51:00] [V] [TRT] Tactic: 0x00000000000003ea Time: 0.0117655
[08/17/2022-07:51:00] [V] [TRT] Tactic: 0x0000000000000000 Time: 0.00181925
[08/17/2022-07:51:00] [V] [TRT] Fastest Tactic: 0x0000000000000000 Time: 0.00181925
[08/17/2022-07:51:00] [V] [TRT] *************** Autotuning Reformat: Float(10,1,10,10) -> Half(10,1,1,1) ***************
[08/17/2022-07:51:00] [V] [TRT] --------------- Timing Runner: Optimizer Reformat(MatMul-12_out_tensor -> <out>) (Reformat)
[08/17/2022-07:51:00] [V] [TRT] Tactic: 0x00000000000003e8 Time: 0.00182024
[08/17/2022-07:51:00] [V] [TRT] Tactic: 0x00000000000003ea Time: 0.00502573
[08/17/2022-07:51:00] [V] [TRT] Tactic: 0x0000000000000000 Time: 0.00183765
[08/17/2022-07:51:00] [V] [TRT] Fastest Tactic: 0x00000000000003e8 Time: 0.00182024
[08/17/2022-07:51:00] [V] [TRT] *************** Autotuning Reformat: Half(10,1,1,1) -> Float(10,1,1,1) ***************
[08/17/2022-07:51:00] [V] [TRT] --------------- Timing Runner: Optimizer Reformat(MatMul-12_out_tensor -> <out>) (Reformat)
[08/17/2022-07:51:00] [V] [TRT] Tactic: 0x00000000000003e8 Time: 0.00145261
[08/17/2022-07:51:00] [V] [TRT] Tactic: 0x00000000000003ea Time: 0.00530336
[08/17/2022-07:51:00] [V] [TRT] Tactic: 0x0000000000000000 Time: 0.00264643
[08/17/2022-07:51:00] [V] [TRT] Fastest Tactic: 0x00000000000003e8 Time: 0.00145261
[08/17/2022-07:51:00] [V] [TRT] =============== Computing reformatting costs
[08/17/2022-07:51:00] [V] [TRT] *************** Autotuning Reformat: Float(10,1) -> Half(10,1) ***************
[08/17/2022-07:51:00] [V] [TRT] --------------- Timing Runner: Optimizer Reformat(tensor-13 -> <out>) (Reformat)
[08/17/2022-07:51:00] [V] [TRT] Tactic: 0x00000000000003e8 Time: 0.00215403
[08/17/2022-07:51:00] [V] [TRT] Tactic: 0x00000000000003ea Time: 0.0058293
[08/17/2022-07:51:00] [V] [TRT] Tactic: 0x0000000000000000 Time: 0.00230607
[08/17/2022-07:51:00] [V] [TRT] Fastest Tactic: 0x00000000000003e8 Time: 0.00215403
[08/17/2022-07:51:00] [V] [TRT] *************** Autotuning Reformat: Half(10,1) -> Float(10,1) ***************
[08/17/2022-07:51:00] [V] [TRT] --------------- Timing Runner: Optimizer Reformat(tensor-13 -> <out>) (Reformat)
[08/17/2022-07:51:00] [V] [TRT] Tactic: 0x00000000000003e8 Time: 0.00185843
[08/17/2022-07:51:00] [V] [TRT] Tactic: 0x00000000000003ea Time: 0.00583899
[08/17/2022-07:51:00] [V] [TRT] Tactic: 0x0000000000000000 Time: 0.00220913
[08/17/2022-07:51:00] [V] [TRT] Fastest Tactic: 0x00000000000003e8 Time: 0.00185843
[08/17/2022-07:51:00] [V] [TRT] =============== Computing reformatting costs
[08/17/2022-07:51:00] [V] [TRT] *************** Autotuning Reformat: Float(1,1) -> Half(1,1) ***************
[08/17/2022-07:51:00] [V] [TRT] --------------- Timing Runner: Optimizer Reformat(<in> -> (Unnamed Layer* 28) [TopK]_output_1) (Reformat)
[08/17/2022-07:51:00] [V] [TRT] Tactic: 0x00000000000003e8 Time: 0.00217635
[08/17/2022-07:51:00] [V] [TRT] Tactic: 0x00000000000003ea Time: 0.00576951
[08/17/2022-07:51:00] [V] [TRT] Tactic: 0x0000000000000000 Time: 0.00237662
[08/17/2022-07:51:00] [V] [TRT] Fastest Tactic: 0x00000000000003e8 Time: 0.00217635
[08/17/2022-07:51:00] [V] [TRT] *************** Autotuning Reformat: Half(1,1) -> Float(1,1) ***************
[08/17/2022-07:51:00] [V] [TRT] --------------- Timing Runner: Optimizer Reformat(<in> -> (Unnamed Layer* 28) [TopK]_output_1) (Reformat)
[08/17/2022-07:51:00] [V] [TRT] Tactic: 0x00000000000003e8 Time: 0.00169272
[08/17/2022-07:51:00] [V] [TRT] Tactic: 0x00000000000003ea Time: 0.00552211
[08/17/2022-07:51:00] [V] [TRT] Tactic: 0x0000000000000000 Time: 0.00147695
[08/17/2022-07:51:00] [V] [TRT] Fastest Tactic: 0x0000000000000000 Time: 0.00147695
[08/17/2022-07:51:00] [V] [TRT] =============== Computing reformatting costs
[08/17/2022-07:51:00] [V] [TRT] =============== Computing reformatting costs
[08/17/2022-07:51:00] [V] [TRT] =============== Computing costs for 
[08/17/2022-07:51:00] [V] [TRT] *************** Autotuning format combination: Float(784,784,28,1) -> Float(25088,784,28,1) ***************
[08/17/2022-07:51:00] [V] [TRT] --------------- Timing Runner: Conv-1 + ReLU-2 (CudaDepthwiseConvolution)
[08/17/2022-07:51:00] [V] [TRT] CudaDepthwiseConvolution has no valid tactics for this config, skipping
[08/17/2022-07:51:00] [V] [TRT] --------------- Timing Runner: Conv-1 + ReLU-2 (FusedConvActConvolution)
[08/17/2022-07:51:00] [V] [TRT] FusedConvActConvolution has no valid tactics for this config, skipping
[08/17/2022-07:51:00] [V] [TRT] --------------- Timing Runner: Conv-1 + ReLU-2 (CudnnConvolution)
[08/17/2022-07:51:00] [V] [TRT] Tactic: 0x0000000000000000 Time: 0.0188343
[08/17/2022-07:51:00] [V] [TRT] Tactic: 0x0000000000000001 Time: 0.0181566
[08/17/2022-07:51:00] [V] [TRT] Tactic: 0x0000000000000002 Time: 0.0234057
[08/17/2022-07:51:00] [V] [TRT] Tactic: 0x0000000000000004 Time: 0.0373326
[08/17/2022-07:51:00] [V] [TRT] Tactic: 0x0000000000000005 Time: 0.0379829
[08/17/2022-07:51:00] [V] [TRT] Fastest Tactic: 0x0000000000000001 Time: 0.0181566
[08/17/2022-07:51:00] [V] [TRT] --------------- Timing Runner: Conv-1 + ReLU-2 (CaskConvolution)
[08/17/2022-07:51:00] [V] [TRT] Conv-1 + ReLU-2 Set Tactic Name: maxwell_scudnn_128x32_relu_medium_nn_v1 Tactic: 0x0ebe499388e08286
[08/17/2022-07:51:00] [V] [TRT] Tactic: 0x0ebe499388e08286 Time: 0.0102553
[08/17/2022-07:51:00] [V] [TRT] Conv-1 + ReLU-2 Set Tactic Name: maxwell_scudnn_128x32_relu_large_nn_v0 Tactic: 0x185af5379580418f
[08/17/2022-07:51:00] [V] [TRT] Tactic: 0x185af5379580418f Time: 0.00764295
[08/17/2022-07:51:00] [V] [TRT] Conv-1 + ReLU-2 Set Tactic Name: maxwell_scudnn_128x128_relu_large_nn_v0 Tactic: 0x321f7a577fb21da0
[08/17/2022-07:51:00] [V] [TRT] Tactic: 0x321f7a577fb21da0 Time: 0.0135805
[08/17/2022-07:51:00] [V] [TRT] Conv-1 + ReLU-2 Set Tactic Name: maxwell_scudnn_128x64_relu_large_nn_v1 Tactic: 0x3c301f1cd57bd89b
[08/17/2022-07:51:00] [V] [TRT] Tactic: 0x3c301f1cd57bd89b Time: 0.0101522
[08/17/2022-07:51:00] [V] [TRT] Conv-1 + ReLU-2 Set Tactic Name: maxwell_scudnn_128x128_relu_medium_nn_v1 Tactic: 0x3e787008e11a6129
[08/17/2022-07:51:00] [V] [TRT] Tactic: 0x3e787008e11a6129 Time: 0.0128975
[08/17/2022-07:51:00] [V] [TRT] Conv-1 + ReLU-2 Set Tactic Name: maxwell_scudnn_128x64_relu_small_nn_v1 Tactic: 0x474c9edd1ecfbbba
[08/17/2022-07:51:00] [V] [TRT] Tactic: 0x474c9edd1ecfbbba Time: 0.00924172
[08/17/2022-07:51:00] [V] [TRT] Conv-1 + ReLU-2 Set Tactic Name: maxwell_scudnn_128x128_relu_small_nn_v0 Tactic: 0x4963fb96b4067e81
[08/17/2022-07:51:00] [V] [TRT] Tactic: 0x4963fb96b4067e81 Time: 0.0130298
[08/17/2022-07:51:00] [V] [TRT] Conv-1 + ReLU-2 Set Tactic Name: maxwell_scudnn_128x64_relu_medium_nn_v1 Tactic: 0x5c38385751ccb068
[08/17/2022-07:51:00] [V] [TRT] Tactic: 0x5c38385751ccb068 Time: 0.00994316
[08/17/2022-07:51:00] [V] [TRT] Conv-1 + ReLU-2 Set Tactic Name: maxwell_scudnn_128x32_relu_small_nn_v0 Tactic: 0x632674f65e3422ae
[08/17/2022-07:51:00] [V] [TRT] Tactic: 0x632674f65e3422ae Time: 0.00713448
[08/17/2022-07:51:00] [V] [TRT] Conv-1 + ReLU-2 Set Tactic Name: maxwell_scudnn_128x128_relu_large_nn_v1 Tactic: 0x813136e97c1542cf
[08/17/2022-07:51:00] [V] [TRT] Tactic: 0x813136e97c1542cf Time: 0.0132322
[08/17/2022-07:51:00] [V] [TRT] Conv-1 + ReLU-2 Set Tactic Name: maxwell_scudnn_128x128_relu_medium_nn_v0 Tactic: 0x8d563cb6e2bd3e46
[08/17/2022-07:51:00] [V] [TRT] Tactic: 0x8d563cb6e2bd3e46 Time: 0.0134716
[08/17/2022-07:51:00] [V] [TRT] Conv-1 + ReLU-2 Set Tactic Name: maxwell_scudnn_128x64_relu_large_nn_v0 Tactic: 0x8f1e53a2d6dc87f4
[08/17/2022-07:51:00] [V] [TRT] Tactic: 0x8f1e53a2d6dc87f4 Time: 0.0100517
[08/17/2022-07:51:00] [V] [TRT] Conv-1 + ReLU-2 Set Tactic Name: maxwell_scudnn_128x32_relu_large_nn_v1 Tactic: 0xab74b98996271ee0
[08/17/2022-07:51:00] [V] [TRT] Tactic: 0xab74b98996271ee0 Time: 0.0103105
[08/17/2022-07:51:00] [V] [TRT] Conv-1 + ReLU-2 Set Tactic Name: maxwell_scudnn_128x32_relu_medium_nn_v0 Tactic: 0xbd90052d8b47dde9
[08/17/2022-07:51:00] [V] [TRT] Tactic: 0xbd90052d8b47dde9 Time: 0.00756066
[08/17/2022-07:51:00] [V] [TRT] Conv-1 + ReLU-2 Set Tactic Name: maxwell_scudnn_128x32_relu_small_nn_v1 Tactic: 0xd00838485d937dc1
[08/17/2022-07:51:00] [V] [TRT] Tactic: 0xd00838485d937dc1 Time: 0.00878171
[08/17/2022-07:51:00] [V] [TRT] Conv-1 + ReLU-2 Set Tactic Name: maxwell_scudnn_128x64_relu_medium_nn_v0 Tactic: 0xef1674e9526bef07
[08/17/2022-07:51:00] [V] [TRT] Tactic: 0xef1674e9526bef07 Time: 0.00990507
[08/17/2022-07:51:00] [V] [TRT] Conv-1 + ReLU-2 Set Tactic Name: maxwell_scudnn_128x64_relu_small_nn_v0 Tactic: 0xf462d2631d68e4d5
[08/17/2022-07:51:00] [V] [TRT] Tactic: 0xf462d2631d68e4d5 Time: 0.0096256
[08/17/2022-07:51:00] [V] [TRT] Conv-1 + ReLU-2 Set Tactic Name: maxwell_scudnn_128x128_relu_small_nn_v1 Tactic: 0xfa4db728b7a121ee
[08/17/2022-07:51:00] [V] [TRT] Tactic: 0xfa4db728b7a121ee Time: 0.0124914
[08/17/2022-07:51:00] [V] [TRT] Fastest Tactic: 0x632674f65e3422ae Time: 0.00713448
[08/17/2022-07:51:00] [V] [TRT] >>>>>>>>>>>>>>> Chose Runner Type: CaskConvolution Tactic: 0x632674f65e3422ae
[08/17/2022-07:51:00] [V] [TRT] *************** Autotuning format combination: Float(784,1,28,1) -> Float(25088,1,896,32) ***************
[08/17/2022-07:51:00] [V] [TRT] --------------- Timing Runner: Conv-1 + ReLU-2 (CaskConvolution)
[08/17/2022-07:51:00] [V] [TRT] CaskConvolution has no valid tactics for this config, skipping
[08/17/2022-07:51:00] [V] [TRT] *************** Autotuning format combination: Half(784,784,28,1) -> Half(25088,784,28,1) ***************
[08/17/2022-07:51:00] [V] [TRT] --------------- Timing Runner: Conv-1 + ReLU-2 (CudnnConvolution)
[08/17/2022-07:51:00] [V] [TRT] Tactic: 0x0000000000000000 Time: 0.0150821
[08/17/2022-07:51:00] [V] [TRT] Tactic: 0x0000000000000001 Time: 0.0149943
[08/17/2022-07:51:00] [V] [TRT] Tactic: 0x0000000000000002 Time: 0.0398994
[08/17/2022-07:51:00] [V] [TRT] Tactic: 0x0000000000000004 Time: 0.029813
[08/17/2022-07:51:00] [V] [TRT] Tactic: 0x0000000000000005 Time: 0.030603
[08/17/2022-07:51:00] [V] [TRT] Fastest Tactic: 0x0000000000000001 Time: 0.0149943
[08/17/2022-07:51:00] [V] [TRT] --------------- Timing Runner: Conv-1 + ReLU-2 (CaskConvolution)
[08/17/2022-07:51:00] [V] [TRT] CaskConvolution has no valid tactics for this config, skipping
[08/17/2022-07:51:00] [V] [TRT] >>>>>>>>>>>>>>> Chose Runner Type: CudnnConvolution Tactic: 0x0000000000000001
[08/17/2022-07:51:00] [V] [TRT] =============== Computing costs for 
[08/17/2022-07:51:00] [V] [TRT] *************** Autotuning format combination: Float(25088,784,28,1) -> Float(6272,196,14,1) ***************
[08/17/2022-07:51:00] [V] [TRT] --------------- Timing Runner: MaxPool-3 (TiledPooling)
[08/17/2022-07:51:00] [V] [TRT] Tactic: 0x0000000000540101 Time: 0.00678005
[08/17/2022-07:51:00] [V] [TRT] Tactic: 0x0000000000550101 Time: 0.00465829
[08/17/2022-07:51:00] [V] [TRT] Tactic: 0x0000000000560101 Time: 0.00405943
[08/17/2022-07:51:00] [V] [TRT] Tactic: 0x0000000000570101 Time: 0.00363989
[08/17/2022-07:51:00] [V] [TRT] Tactic: 0x0000000000580101 Time: 0.00371095
[08/17/2022-07:51:00] [V] [TRT] Tactic: 0x0000000000590101 Time: 0.0038335
[08/17/2022-07:51:00] [V] [TRT] Tactic: 0x00000000005a0101 Time: 0.00388806
[08/17/2022-07:51:00] [V] [TRT] Tactic: 0x00000000005b0101 Time: 0.00321178
[08/17/2022-07:51:00] [V] [TRT] Tactic: 0x00000000005c0101 Time: 0.00430682
[08/17/2022-07:51:00] [V] [TRT] Tactic: 0x00000000005d0101 Time: 0.00308581
[08/17/2022-07:51:00] [V] [TRT] Tactic: 0x00000000005e0101 Time: 0.00292459
[08/17/2022-07:51:00] [V] [TRT] Tactic: 0x00000000005f0101 Time: 0.00263506
[08/17/2022-07:51:00] [V] [TRT] Tactic: 0x0000000000600101 Time: 0.00268089
[08/17/2022-07:51:00] [V] [TRT] Tactic: 0x0000000000610101 Time: 0.0026324
[08/17/2022-07:51:00] [V] [TRT] Tactic: 0x0000000000620101 Time: 0.00252279
[08/17/2022-07:51:00] [V] [TRT] Tactic: 0x0000000000630101 Time: 0.00253145
[08/17/2022-07:51:00] [V] [TRT] Fastest Tactic: 0x0000000000620101 Time: 0.00252279
[08/17/2022-07:51:00] [V] [TRT] --------------- Timing Runner: MaxPool-3 (CudnnPooling)
[08/17/2022-07:51:00] [V] [TRT] Tactic: 0xffffffffffffffff Time: 0.00302924
[08/17/2022-07:51:00] [V] [TRT] Fastest Tactic: 0xffffffffffffffff Time: 0.00302924
[08/17/2022-07:51:00] [V] [TRT] --------------- Timing Runner: MaxPool-3 (CaskPooling)
[08/17/2022-07:51:00] [V] [TRT] MaxPool-3 Set Tactic Name: sm50_xmma_pooling_fw_4d_FP32FP32NCHW_Max Tactic: 0xb59f9cfb90407c92
[08/17/2022-07:51:00] [V] [TRT] Tactic: 0xb59f9cfb90407c92 Time: 0.00318466
[08/17/2022-07:51:00] [V] [TRT] Fastest Tactic: 0xb59f9cfb90407c92 Time: 0.00318466
[08/17/2022-07:51:00] [V] [TRT] >>>>>>>>>>>>>>> Chose Runner Type: TiledPooling Tactic: 0x0000000000620101
[08/17/2022-07:51:00] [V] [TRT] *************** Autotuning format combination: Half(25088,784,28,1) -> Half(6272,196,14,1) ***************
[08/17/2022-07:51:00] [V] [TRT] --------------- Timing Runner: MaxPool-3 (TiledPooling)
[08/17/2022-07:51:00] [V] [TRT] TiledPooling has no valid tactics for this config, skipping
[08/17/2022-07:51:00] [V] [TRT] --------------- Timing Runner: MaxPool-3 (CudnnPooling)
[08/17/2022-07:51:00] [V] [TRT] Tactic: 0xffffffffffffffff Time: 0.0030614
[08/17/2022-07:51:00] [V] [TRT] Fastest Tactic: 0xffffffffffffffff Time: 0.0030614
[08/17/2022-07:51:00] [V] [TRT] --------------- Timing Runner: MaxPool-3 (CaskPooling)
[08/17/2022-07:51:00] [V] [TRT] MaxPool-3 Set Tactic Name: sm50_xmma_pooling_fw_4d_FP16FP32NCHW_Max Tactic: 0xfd3a631f5c3e741e
[08/17/2022-07:51:00] [V] [TRT] Tactic: 0xfd3a631f5c3e741e Time: 0.00313769
[08/17/2022-07:51:00] [V] [TRT] Fastest Tactic: 0xfd3a631f5c3e741e Time: 0.00313769
[08/17/2022-07:51:00] [V] [TRT] >>>>>>>>>>>>>>> Chose Runner Type: CudnnPooling Tactic: 0xffffffffffffffff
[08/17/2022-07:51:00] [V] [TRT] =============== Computing costs for 
[08/17/2022-07:51:00] [V] [TRT] *************** Autotuning format combination: Float(6272,196,14,1) -> Float(12544,196,14,1) ***************
[08/17/2022-07:51:00] [V] [TRT] --------------- Timing Runner: Conv-4 + ReLU-5 (CudaDepthwiseConvolution)
[08/17/2022-07:51:00] [V] [TRT] CudaDepthwiseConvolution has no valid tactics for this config, skipping
[08/17/2022-07:51:00] [V] [TRT] --------------- Timing Runner: Conv-4 + ReLU-5 (FusedConvActConvolution)
[08/17/2022-07:51:00] [V] [TRT] FusedConvActConvolution has no valid tactics for this config, skipping
[08/17/2022-07:51:00] [V] [TRT] --------------- Timing Runner: Conv-4 + ReLU-5 (CudnnConvolution)
[08/17/2022-07:51:00] [V] [TRT] Tactic: 0x0000000000000000 Time: 0.0656335
[08/17/2022-07:51:00] [V] [TRT] Tactic: 0x0000000000000001 Time: 0.0683154
[08/17/2022-07:51:00] [V] [TRT] Tactic: 0x0000000000000002 Time: 0.107886
[08/17/2022-07:51:00] [V] [TRT] Tactic: 0x0000000000000004 Time: 0.17648
[08/17/2022-07:51:00] [V] [TRT] Tactic: 0x0000000000000005 Time: 0.183296
[08/17/2022-07:51:00] [V] [TRT] Fastest Tactic: 0x0000000000000000 Time: 0.0656335
[08/17/2022-07:51:00] [V] [TRT] --------------- Timing Runner: Conv-4 + ReLU-5 (CaskConvolution)
[08/17/2022-07:51:00] [V] [TRT] Conv-4 + ReLU-5 Set Tactic Name: maxwell_scudnn_128x32_relu_medium_nn_v1 Tactic: 0x0ebe499388e08286
[08/17/2022-07:51:00] [V] [TRT] Tactic: 0x0ebe499388e08286 Time: 0.105253
[08/17/2022-07:51:00] [V] [TRT] Conv-4 + ReLU-5 Set Tactic Name: maxwell_scudnn_128x32_relu_large_nn_v0 Tactic: 0x185af5379580418f
[08/17/2022-07:51:00] [V] [TRT] Tactic: 0x185af5379580418f Time: 0.077312
[08/17/2022-07:51:00] [V] [TRT] Conv-4 + ReLU-5 Set Tactic Name: maxwell_scudnn_128x128_relu_large_nn_v0 Tactic: 0x321f7a577fb21da0
[08/17/2022-07:51:00] [V] [TRT] Tactic: 0x321f7a577fb21da0 Time: 0.0847726
[08/17/2022-07:51:00] [V] [TRT] Conv-4 + ReLU-5 Set Tactic Name: maxwell_scudnn_128x64_relu_large_nn_v1 Tactic: 0x3c301f1cd57bd89b
[08/17/2022-07:51:00] [V] [TRT] Tactic: 0x3c301f1cd57bd89b Time: 0.0778971
[08/17/2022-07:51:00] [V] [TRT] Conv-4 + ReLU-5 Set Tactic Name: maxwell_scudnn_128x128_relu_medium_nn_v1 Tactic: 0x3e787008e11a6129
[08/17/2022-07:51:00] [V] [TRT] Tactic: 0x3e787008e11a6129 Time: 0.0849189
[08/17/2022-07:51:00] [V] [TRT] Conv-4 + ReLU-5 Set Tactic Name: maxwell_scudnn_128x64_relu_small_nn_v1 Tactic: 0x474c9edd1ecfbbba
[08/17/2022-07:51:00] [V] [TRT] Tactic: 0x474c9edd1ecfbbba Time: 0.0516876
[08/17/2022-07:51:00] [V] [TRT] Conv-4 + ReLU-5 Set Tactic Name: maxwell_scudnn_128x128_relu_small_nn_v0 Tactic: 0x4963fb96b4067e81
[08/17/2022-07:51:00] [V] [TRT] Tactic: 0x4963fb96b4067e81 Time: 0.0736549
[08/17/2022-07:51:00] [V] [TRT] Conv-4 + ReLU-5 Set Tactic Name: maxwell_scudnn_128x64_relu_medium_nn_v1 Tactic: 0x5c38385751ccb068
[08/17/2022-07:51:00] [V] [TRT] Tactic: 0x5c38385751ccb068 Time: 0.0700709
[08/17/2022-07:51:00] [V] [TRT] Conv-4 + ReLU-5 Set Tactic Name: maxwell_scudnn_128x32_relu_small_nn_v0 Tactic: 0x632674f65e3422ae
[08/17/2022-07:51:00] [V] [TRT] Tactic: 0x632674f65e3422ae Time: 0.0591055
[08/17/2022-07:51:00] [V] [TRT] Conv-4 + ReLU-5 Set Tactic Name: maxwell_scudnn_128x128_relu_large_nn_v1 Tactic: 0x813136e97c1542cf
[08/17/2022-07:51:00] [V] [TRT] Tactic: 0x813136e97c1542cf Time: 0.088064
[08/17/2022-07:51:00] [V] [TRT] Conv-4 + ReLU-5 Set Tactic Name: maxwell_scudnn_128x128_relu_medium_nn_v0 Tactic: 0x8d563cb6e2bd3e46
[08/17/2022-07:51:00] [V] [TRT] Tactic: 0x8d563cb6e2bd3e46 Time: 0.0846994
[08/17/2022-07:51:00] [V] [TRT] Conv-4 + ReLU-5 Set Tactic Name: maxwell_scudnn_128x64_relu_large_nn_v0 Tactic: 0x8f1e53a2d6dc87f4
[08/17/2022-07:51:00] [V] [TRT] Tactic: 0x8f1e53a2d6dc87f4 Time: 0.0912091
[08/17/2022-07:51:00] [V] [TRT] Conv-4 + ReLU-5 Set Tactic Name: maxwell_scudnn_128x32_relu_large_nn_v1 Tactic: 0xab74b98996271ee0
[08/17/2022-07:51:00] [V] [TRT] Tactic: 0xab74b98996271ee0 Time: 0.109422
[08/17/2022-07:51:00] [V] [TRT] Conv-4 + ReLU-5 Set Tactic Name: maxwell_scudnn_128x32_relu_medium_nn_v0 Tactic: 0xbd90052d8b47dde9
[08/17/2022-07:51:00] [V] [TRT] Tactic: 0xbd90052d8b47dde9 Time: 0.0763611
[08/17/2022-07:51:00] [V] [TRT] Conv-4 + ReLU-5 Set Tactic Name: maxwell_scudnn_128x32_relu_small_nn_v1 Tactic: 0xd00838485d937dc1
[08/17/2022-07:51:00] [V] [TRT] Tactic: 0xd00838485d937dc1 Time: 0.0603185
[08/17/2022-07:51:00] [V] [TRT] Conv-4 + ReLU-5 Set Tactic Name: maxwell_scudnn_128x64_relu_medium_nn_v0 Tactic: 0xef1674e9526bef07
[08/17/2022-07:51:00] [V] [TRT] Tactic: 0xef1674e9526bef07 Time: 0.0903314
[08/17/2022-07:51:00] [V] [TRT] Conv-4 + ReLU-5 Set Tactic Name: maxwell_scudnn_128x64_relu_small_nn_v0 Tactic: 0xf462d2631d68e4d5
[08/17/2022-07:51:00] [V] [TRT] Tactic: 0xf462d2631d68e4d5 Time: 0.0745326
[08/17/2022-07:51:00] [V] [TRT] Conv-4 + ReLU-5 Set Tactic Name: maxwell_scudnn_128x128_relu_small_nn_v1 Tactic: 0xfa4db728b7a121ee
[08/17/2022-07:51:00] [V] [TRT] Tactic: 0xfa4db728b7a121ee Time: 0.0719726
[08/17/2022-07:51:00] [V] [TRT] Fastest Tactic: 0x474c9edd1ecfbbba Time: 0.0516876
[08/17/2022-07:51:00] [V] [TRT] >>>>>>>>>>>>>>> Chose Runner Type: CaskConvolution Tactic: 0x474c9edd1ecfbbba
[08/17/2022-07:51:00] [V] [TRT] *************** Autotuning format combination: Float(6272,1,448,32) -> Float(12544,1,896,64) ***************
[08/17/2022-07:51:00] [V] [TRT] --------------- Timing Runner: Conv-4 + ReLU-5 (CaskConvolution)
[08/17/2022-07:51:00] [V] [TRT] Conv-4 + ReLU-5 Set Tactic Name: maxwell_scudnn_128x32_sliced1x4_ldg4_relu_exp_small_nhwc_tn_v1 Tactic: 0x80f932c0b8ce5940
[08/17/2022-07:51:00] [V] [TRT] Tactic: 0x80f932c0b8ce5940 Time: 0.0224653
[08/17/2022-07:51:00] [V] [TRT] Conv-4 + ReLU-5 Set Tactic Name: maxwell_scudnn_128x64_sliced1x2_ldg4_relu_exp_small_nhwc_tn_v1 Tactic: 0x9961ac24fc07a1df
[08/17/2022-07:51:00] [V] [TRT] Tactic: 0x9961ac24fc07a1df Time: 0.0400823
[08/17/2022-07:51:00] [V] [TRT] Fastest Tactic: 0x80f932c0b8ce5940 Time: 0.0224653
[08/17/2022-07:51:00] [V] [TRT] >>>>>>>>>>>>>>> Chose Runner Type: CaskConvolution Tactic: 0x80f932c0b8ce5940
[08/17/2022-07:51:00] [V] [TRT] *************** Autotuning format combination: Half(6272,196,14,1) -> Half(12544,196,14,1) ***************
[08/17/2022-07:51:00] [V] [TRT] --------------- Timing Runner: Conv-4 + ReLU-5 (CudnnConvolution)
[08/17/2022-07:51:00] [V] [TRT] Tactic: 0x0000000000000000 Time: 0.08192
[08/17/2022-07:51:00] [V] [TRT] Tactic: 0x0000000000000001 Time: 0.105179
[08/17/2022-07:51:00] [V] [TRT] Tactic: 0x0000000000000002 Time: 0.0956709
[08/17/2022-07:51:00] [V] [TRT] Tactic: 0x0000000000000004 Time: 0.17243
[08/17/2022-07:51:00] [V] [TRT] Tactic: 0x0000000000000005 Time: 0.180055
[08/17/2022-07:51:00] [V] [TRT] Fastest Tactic: 0x0000000000000000 Time: 0.08192
[08/17/2022-07:51:00] [V] [TRT] --------------- Timing Runner: Conv-4 + ReLU-5 (CaskConvolution)
[08/17/2022-07:51:00] [V] [TRT] CaskConvolution has no valid tactics for this config, skipping
[08/17/2022-07:51:00] [V] [TRT] >>>>>>>>>>>>>>> Chose Runner Type: CudnnConvolution Tactic: 0x0000000000000000
[08/17/2022-07:51:00] [V] [TRT] =============== Computing costs for 
[08/17/2022-07:51:00] [V] [TRT] *************** Autotuning format combination: Float(12544,196,14,1) -> Float(3136,49,7,1) ***************
[08/17/2022-07:51:00] [V] [TRT] --------------- Timing Runner: MaxPool-6 (TiledPooling)
[08/17/2022-07:51:00] [V] [TRT] Tactic: 0x0000000000540101 Time: 0.00776084
[08/17/2022-07:51:00] [V] [TRT] Tactic: 0x0000000000550101 Time: 0.00538159
[08/17/2022-07:51:00] [V] [TRT] Tactic: 0x0000000000560101 Time: 0.0056309
[08/17/2022-07:51:00] [V] [TRT] Tactic: 0x0000000000570101 Time: 0.00659345
[08/17/2022-07:51:00] [V] [TRT] Tactic: 0x0000000000580101 Time: 0.00375947
[08/17/2022-07:51:00] [V] [TRT] Tactic: 0x0000000000590101 Time: 0.00388151
[08/17/2022-07:51:00] [V] [TRT] Tactic: 0x00000000005a0101 Time: 0.00398146
[08/17/2022-07:51:00] [V] [TRT] Tactic: 0x00000000005b0101 Time: 0.00337999
[08/17/2022-07:51:00] [V] [TRT] Tactic: 0x00000000005c0101 Time: 0.00464207
[08/17/2022-07:51:00] [V] [TRT] Tactic: 0x00000000005d0101 Time: 0.00333714
[08/17/2022-07:51:00] [V] [TRT] Tactic: 0x00000000005e0101 Time: 0.00300333
[08/17/2022-07:51:00] [V] [TRT] Tactic: 0x00000000005f0101 Time: 0.00275859
[08/17/2022-07:51:00] [V] [TRT] Tactic: 0x0000000000600101 Time: 0.00268123
[08/17/2022-07:51:00] [V] [TRT] Tactic: 0x0000000000610101 Time: 0.0026304
[08/17/2022-07:51:01] [V] [TRT] Tactic: 0x0000000000620101 Time: 0.00264054
[08/17/2022-07:51:01] [V] [TRT] Tactic: 0x0000000000630101 Time: 0.0026122
[08/17/2022-07:51:01] [V] [TRT] Fastest Tactic: 0x0000000000630101 Time: 0.0026122
[08/17/2022-07:51:01] [V] [TRT] --------------- Timing Runner: MaxPool-6 (CudnnPooling)
[08/17/2022-07:51:01] [V] [TRT] Tactic: 0xffffffffffffffff Time: 0.00265329
[08/17/2022-07:51:01] [V] [TRT] Fastest Tactic: 0xffffffffffffffff Time: 0.00265329
[08/17/2022-07:51:01] [V] [TRT] --------------- Timing Runner: MaxPool-6 (CaskPooling)
[08/17/2022-07:51:01] [V] [TRT] MaxPool-6 Set Tactic Name: sm50_xmma_pooling_fw_4d_FP32FP32NCHW_Max Tactic: 0xb59f9cfb90407c92
[08/17/2022-07:51:01] [V] [TRT] Tactic: 0xb59f9cfb90407c92 Time: 0.00276387
[08/17/2022-07:51:01] [V] [TRT] Fastest Tactic: 0xb59f9cfb90407c92 Time: 0.00276387
[08/17/2022-07:51:01] [V] [TRT] >>>>>>>>>>>>>>> Chose Runner Type: TiledPooling Tactic: 0x0000000000630101
[08/17/2022-07:51:01] [V] [TRT] *************** Autotuning format combination: Half(12544,196,14,1) -> Half(3136,49,7,1) ***************
[08/17/2022-07:51:01] [V] [TRT] --------------- Timing Runner: MaxPool-6 (TiledPooling)
[08/17/2022-07:51:01] [V] [TRT] TiledPooling has no valid tactics for this config, skipping
[08/17/2022-07:51:01] [V] [TRT] --------------- Timing Runner: MaxPool-6 (CudnnPooling)
[08/17/2022-07:51:01] [V] [TRT] Tactic: 0xffffffffffffffff Time: 0.00263406
[08/17/2022-07:51:01] [V] [TRT] Fastest Tactic: 0xffffffffffffffff Time: 0.00263406
[08/17/2022-07:51:01] [V] [TRT] --------------- Timing Runner: MaxPool-6 (CaskPooling)
[08/17/2022-07:51:01] [V] [TRT] MaxPool-6 Set Tactic Name: sm50_xmma_pooling_fw_4d_FP16FP32NCHW_Max Tactic: 0xfd3a631f5c3e741e
[08/17/2022-07:51:01] [V] [TRT] Tactic: 0xfd3a631f5c3e741e Time: 0.00253498
[08/17/2022-07:51:01] [V] [TRT] Fastest Tactic: 0xfd3a631f5c3e741e Time: 0.00253498
[08/17/2022-07:51:01] [V] [TRT] >>>>>>>>>>>>>>> Chose Runner Type: CaskPooling Tactic: 0xfd3a631f5c3e741e
[08/17/2022-07:51:01] [V] [TRT] =============== Computing costs for 
[08/17/2022-07:51:01] [V] [TRT] *************** Autotuning format combination: Float(3136,49,7,1) -> Float(3136,1,1,1) ***************
[08/17/2022-07:51:01] [V] [TRT] --------------- Timing Runner: Transpose-7 + Reshape-7 + reshape_before_MatMul-9 (Shuffle)
[08/17/2022-07:51:01] [V] [TRT] Tactic: 0x0000000000000000 Time: 0.00247377
[08/17/2022-07:51:01] [V] [TRT] Tactic: 0x0000000000000001 Time: 0.0165303
[08/17/2022-07:51:01] [V] [TRT] Fastest Tactic: 0x0000000000000000 Time: 0.00247377
[08/17/2022-07:51:01] [V] [TRT] >>>>>>>>>>>>>>> Chose Runner Type: Shuffle Tactic: 0x0000000000000000
[08/17/2022-07:51:01] [V] [TRT] *************** Autotuning format combination: Float(3136,1,448,64) -> Float(3136,1,3136,3136) ***************
[08/17/2022-07:51:01] [V] [TRT] --------------- Timing Runner: Transpose-7 + Reshape-7 + reshape_before_MatMul-9 (Shuffle)
[08/17/2022-07:51:01] [V] [TRT] Tactic: 0x0000000000000000 Time: 0.00220062
[08/17/2022-07:51:01] [V] [TRT] Tactic: 0x0000000000000001 Time: 0.0125562
[08/17/2022-07:51:01] [V] [TRT] Fastest Tactic: 0x0000000000000000 Time: 0.00220062
[08/17/2022-07:51:01] [V] [TRT] >>>>>>>>>>>>>>> Chose Runner Type: Shuffle Tactic: 0x0000000000000000
[08/17/2022-07:51:01] [V] [TRT] *************** Autotuning format combination: Float(98,49:32,7,1) -> Float(98,1:32,1,1) ***************
[08/17/2022-07:51:01] [V] [TRT] --------------- Timing Runner: Transpose-7 + Reshape-7 + reshape_before_MatMul-9 (Shuffle)
[08/17/2022-07:51:01] [V] [TRT] Tactic: 0x0000000000000000 Time: 0.00349469
[08/17/2022-07:51:01] [V] [TRT] Tactic: 0x0000000000000001 Time: 0.0448731
[08/17/2022-07:51:01] [V] [TRT] Fastest Tactic: 0x0000000000000000 Time: 0.00349469
[08/17/2022-07:51:01] [V] [TRT] >>>>>>>>>>>>>>> Chose Runner Type: Shuffle Tactic: 0x0000000000000000
[08/17/2022-07:51:01] [V] [TRT] *************** Autotuning format combination: Half(3136,49,7,1) -> Half(3136,1,1,1) ***************
[08/17/2022-07:51:01] [V] [TRT] --------------- Timing Runner: Transpose-7 + Reshape-7 + reshape_before_MatMul-9 (Shuffle)
[08/17/2022-07:51:01] [V] [TRT] Tactic: 0x0000000000000000 Time: 0.00230415
[08/17/2022-07:51:01] [V] [TRT] Tactic: 0x0000000000000001 Time: 0.011129
[08/17/2022-07:51:01] [V] [TRT] Fastest Tactic: 0x0000000000000000 Time: 0.00230415
[08/17/2022-07:51:01] [V] [TRT] >>>>>>>>>>>>>>> Chose Runner Type: Shuffle Tactic: 0x0000000000000000
[08/17/2022-07:51:01] [V] [TRT] =============== Computing costs for 
[08/17/2022-07:51:01] [V] [TRT] *************** Autotuning format combination: Float(3136,1,1,1) -> Float(1024,1,1,1) ***************
[08/17/2022-07:51:01] [V] [TRT] --------------- Timing Runner: MatMul-9 + ReLU-11 (CudaDepthwiseConvolution)
[08/17/2022-07:51:01] [V] [TRT] CudaDepthwiseConvolution has no valid tactics for this config, skipping
[08/17/2022-07:51:01] [V] [TRT] --------------- Timing Runner: MatMul-9 + ReLU-11 (FusedConvActConvolution)
[08/17/2022-07:51:01] [V] [TRT] FusedConvActConvolution has no valid tactics for this config, skipping
[08/17/2022-07:51:01] [V] [TRT] --------------- Timing Runner: MatMul-9 + ReLU-11 (CudnnConvolution)
[08/17/2022-07:51:01] [V] [TRT] Tactic: 0x0000000000000000 Time: 0.320951
[08/17/2022-07:51:01] [V] [TRT] Tactic: 0x0000000000000001 Time: 0.270336
[08/17/2022-07:51:01] [V] [TRT] Tactic: 0x0000000000000002 Time: 0.385317
[08/17/2022-07:51:01] [V] [TRT] Tactic: 0x0000000000000004 skipped. Scratch requested: 7527202816, available: 1073741824
[08/17/2022-07:51:01] [V] [TRT] Tactic: 0x0000000000000005 Time: 6.42589
[08/17/2022-07:51:01] [I] [TRT] Some tactics do not have sufficient workspace memory to run. Increasing workspace size will enable more tactics, please check verbose output for requested sizes.
[08/17/2022-07:51:01] [V] [TRT] Fastest Tactic: 0x0000000000000001 Time: 0.270336
[08/17/2022-07:51:01] [V] [TRT] Setting workspace to 7527202816enables more tactics for profiling
[08/17/2022-07:51:01] [V] [TRT] --------------- Timing Runner: MatMul-9 + ReLU-11 (CublasConvolution)
[08/17/2022-07:51:01] [V] [TRT] Tactic: 0x0000000000000000 Time: 0.0692907
[08/17/2022-07:51:01] [V] [TRT] Tactic: 0x0000000000000001 Time: 0.0686568
[08/17/2022-07:51:01] [V] [TRT] Fastest Tactic: 0x0000000000000001 Time: 0.0686568
[08/17/2022-07:51:01] [V] [TRT] --------------- Timing Runner: MatMul-9 + ReLU-11 (CaskConvolution)
[08/17/2022-07:51:01] [V] [TRT] MatMul-9 + ReLU-11 Set Tactic Name: maxwell_scudnn_128x32_relu_medium_nn_v1 Tactic: 0x0ebe499388e08286
[08/17/2022-07:51:01] [V] [TRT] Tactic: 0x0ebe499388e08286 Time: 0.425106
[08/17/2022-07:51:01] [V] [TRT] MatMul-9 + ReLU-11 Set Tactic Name: maxwell_scudnn_128x32_relu_interior_nn_v0 Tactic: 0x1792ed6b0f1ea883
[08/17/2022-07:51:01] [V] [TRT] Tactic: 0x1792ed6b0f1ea883 Time: 0.364251
[08/17/2022-07:51:01] [V] [TRT] MatMul-9 + ReLU-11 Set Tactic Name: maxwell_scudnn_128x128_relu_medium_nn_v1 Tactic: 0x3e787008e11a6129
[08/17/2022-07:51:01] [V] [TRT] Tactic: 0x3e787008e11a6129 Time: 0.383269
[08/17/2022-07:51:01] [V] [TRT] MatMul-9 + ReLU-11 Set Tactic Name: maxwell_scudnn_128x64_relu_small_nn_v1 Tactic: 0x474c9edd1ecfbbba
[08/17/2022-07:51:01] [V] [TRT] Tactic: 0x474c9edd1ecfbbba Time: 0.325925
[08/17/2022-07:51:01] [V] [TRT] MatMul-9 + ReLU-11 Set Tactic Name: maxwell_scudnn_128x128_relu_small_nn_v0 Tactic: 0x4963fb96b4067e81
[08/17/2022-07:51:01] [V] [TRT] Tactic: 0x4963fb96b4067e81 Time: 0.369225
[08/17/2022-07:51:01] [V] [TRT] MatMul-9 + ReLU-11 Set Tactic Name: maxwell_scudnn_128x128_relu_interior_nn_v1 Tactic: 0x49ecad9da64c487b
[08/17/2022-07:51:01] [V] [TRT] Tactic: 0x49ecad9da64c487b Time: 0.377856
[08/17/2022-07:51:01] [V] [TRT] MatMul-9 + ReLU-11 Set Tactic Name: maxwell_scudnn_128x64_relu_interior_nn_v0 Tactic: 0x4c5584586319b832
[08/17/2022-07:51:01] [V] [TRT] Tactic: 0x4c5584586319b832 Time: 0.354743
[08/17/2022-07:51:01] [V] [TRT] MatMul-9 + ReLU-11 Set Tactic Name: maxwell_scudnn_128x64_relu_medium_nn_v1 Tactic: 0x5c38385751ccb068
[08/17/2022-07:51:01] [V] [TRT] Tactic: 0x5c38385751ccb068 Time: 0.333239
[08/17/2022-07:51:01] [V] [TRT] MatMul-9 + ReLU-11 Set Tactic Name: maxwell_scudnn_128x32_relu_small_nn_v0 Tactic: 0x632674f65e3422ae
[08/17/2022-07:51:01] [V] [TRT] Tactic: 0x632674f65e3422ae Time: 0.364983
[08/17/2022-07:51:01] [V] [TRT] MatMul-9 + ReLU-11 Set Tactic Name: maxwell_scudnn_128x128_relu_medium_nn_v0 Tactic: 0x8d563cb6e2bd3e46
[08/17/2022-07:51:01] [V] [TRT] Tactic: 0x8d563cb6e2bd3e46 Time: 0.428471
[08/17/2022-07:51:01] [V] [TRT] MatMul-9 + ReLU-11 Set Tactic Name: maxwell_scudnn_128x32_relu_interior_nn_v1 Tactic: 0xa4bca1d50cb9f7ec
[08/17/2022-07:51:01] [V] [TRT] Tactic: 0xa4bca1d50cb9f7ec Time: 0.334263
[08/17/2022-07:51:01] [V] [TRT] MatMul-9 + ReLU-11 Set Tactic Name: maxwell_scudnn_128x32_relu_medium_nn_v0 Tactic: 0xbd90052d8b47dde9
[08/17/2022-07:51:01] [V] [TRT] Tactic: 0xbd90052d8b47dde9 Time: 0.346258
[08/17/2022-07:51:01] [V] [TRT] MatMul-9 + ReLU-11 Set Tactic Name: maxwell_scudnn_128x32_relu_small_nn_v1 Tactic: 0xd00838485d937dc1
[08/17/2022-07:51:01] [V] [TRT] Tactic: 0xd00838485d937dc1 Time: 0.338359
[08/17/2022-07:51:01] [V] [TRT] MatMul-9 + ReLU-11 Set Tactic Name: maxwell_scudnn_128x64_relu_medium_nn_v0 Tactic: 0xef1674e9526bef07
[08/17/2022-07:51:01] [V] [TRT] Tactic: 0xef1674e9526bef07 Time: 0.369518
[08/17/2022-07:51:01] [V] [TRT] MatMul-9 + ReLU-11 Set Tactic Name: maxwell_scudnn_128x64_relu_small_nn_v0 Tactic: 0xf462d2631d68e4d5
[08/17/2022-07:51:01] [V] [TRT] Tactic: 0xf462d2631d68e4d5 Time: 0.358107
[08/17/2022-07:51:01] [V] [TRT] MatMul-9 + ReLU-11 Set Tactic Name: maxwell_scudnn_128x128_relu_small_nn_v1 Tactic: 0xfa4db728b7a121ee
[08/17/2022-07:51:01] [V] [TRT] Tactic: 0xfa4db728b7a121ee Time: 0.38005
[08/17/2022-07:51:01] [V] [TRT] MatMul-9 + ReLU-11 Set Tactic Name: maxwell_scudnn_128x128_relu_interior_nn_v0 Tactic: 0xfac2e123a5eb1714
[08/17/2022-07:51:01] [V] [TRT] Tactic: 0xfac2e123a5eb1714 Time: 0.442368
[08/17/2022-07:51:01] [V] [TRT] MatMul-9 + ReLU-11 Set Tactic Name: maxwell_scudnn_128x64_relu_interior_nn_v1 Tactic: 0xff7bc8e660bee75d
[08/17/2022-07:51:01] [V] [TRT] Tactic: 0xff7bc8e660bee75d Time: 0.325339
[08/17/2022-07:51:01] [V] [TRT] Fastest Tactic: 0xff7bc8e660bee75d Time: 0.325339
[08/17/2022-07:51:01] [V] [TRT] >>>>>>>>>>>>>>> Chose Runner Type: CublasConvolution Tactic: 0x0000000000000001
[08/17/2022-07:51:01] [V] [TRT] *************** Autotuning format combination: Float(3136,1,3136,3136) -> Float(1024,1,1024,1024) ***************
[08/17/2022-07:51:01] [V] [TRT] --------------- Timing Runner: MatMul-9 + ReLU-11 (CublasConvolution)
[08/17/2022-07:51:01] [V] [TRT] CublasConvolution has no valid tactics for this config, skipping
[08/17/2022-07:51:01] [V] [TRT] --------------- Timing Runner: MatMul-9 + ReLU-11 (CaskConvolution)
[08/17/2022-07:51:01] [V] [TRT] MatMul-9 + ReLU-11 Set Tactic Name: maxwell_scudnn_128x64_sliced1x2_ldg4_relu_exp_interior_nhwc_tn_v1 Tactic: 0x35f071de80e3b3c4
[08/17/2022-07:51:01] [V] [TRT] Tactic: 0x35f071de80e3b3c4 Time: 0.183296
[08/17/2022-07:51:01] [V] [TRT] MatMul-9 + ReLU-11 Set Tactic Name: maxwell_scudnn_128x32_sliced1x4_ldg4_relu_exp_interior_nhwc_tn_v1 Tactic: 0x5c024b37b78e77c0
[08/17/2022-07:51:01] [V] [TRT] Tactic: 0x5c024b37b78e77c0 Time: 0.128658
[08/17/2022-07:51:01] [V] [TRT] MatMul-9 + ReLU-11 Set Tactic Name: maxwell_scudnn_128x32_sliced1x4_ldg4_relu_exp_small_nhwc_tn_v1 Tactic: 0x80f932c0b8ce5940
[08/17/2022-07:51:01] [V] [TRT] Tactic: 0x80f932c0b8ce5940 Time: 0.130267
[08/17/2022-07:51:01] [V] [TRT] MatMul-9 + ReLU-11 Set Tactic Name: maxwell_scudnn_128x64_sliced1x2_ldg4_relu_exp_small_nhwc_tn_v1 Tactic: 0x9961ac24fc07a1df
[08/17/2022-07:51:01] [V] [TRT] Tactic: 0x9961ac24fc07a1df Time: 0.183003
[08/17/2022-07:51:01] [V] [TRT] Fastest Tactic: 0x5c024b37b78e77c0 Time: 0.128658
[08/17/2022-07:51:01] [V] [TRT] >>>>>>>>>>>>>>> Chose Runner Type: CaskConvolution Tactic: 0x5c024b37b78e77c0
[08/17/2022-07:51:01] [V] [TRT] *************** Autotuning format combination: Half(3136,1,1,1) -> Half(1024,1,1,1) ***************
[08/17/2022-07:51:01] [V] [TRT] --------------- Timing Runner: MatMul-9 + ReLU-11 (CudnnConvolution)
[08/17/2022-07:51:01] [V] [TRT] Tactic: 0x0000000000000000 Time: 0.405065
[08/17/2022-07:51:01] [V] [TRT] Tactic: 0x0000000000000001 Time: 0.182857
[08/17/2022-07:51:01] [V] [TRT] Tactic: 0x0000000000000002 Time: 0.263753
[08/17/2022-07:51:01] [V] [TRT] Tactic: 0x0000000000000004 skipped. Scratch requested: 7527202816, available: 1073741824
[08/17/2022-07:51:01] [V] [TRT] Tactic: 0x0000000000000005 Time: 6.45098
[08/17/2022-07:51:01] [V] [TRT] Fastest Tactic: 0x0000000000000001 Time: 0.182857
[08/17/2022-07:51:01] [V] [TRT] Setting workspace to 7527202816enables more tactics for profiling
[08/17/2022-07:51:01] [V] [TRT] --------------- Timing Runner: MatMul-9 + ReLU-11 (CublasConvolution)
[08/17/2022-07:51:01] [V] [TRT] CublasConvolution has no valid tactics for this config, skipping
[08/17/2022-07:51:01] [V] [TRT] --------------- Timing Runner: MatMul-9 + ReLU-11 (CaskConvolution)
[08/17/2022-07:51:01] [V] [TRT] CaskConvolution has no valid tactics for this config, skipping
[08/17/2022-07:51:01] [V] [TRT] >>>>>>>>>>>>>>> Chose Runner Type: CudnnConvolution Tactic: 0x0000000000000001
[08/17/2022-07:51:01] [V] [TRT] =============== Computing costs for 
[08/17/2022-07:51:01] [V] [TRT] *************** Autotuning format combination: Float(1024,1,1,1) -> Float(10,1,1,1) ***************
[08/17/2022-07:51:01] [V] [TRT] --------------- Timing Runner: MatMul-12 (CudaDepthwiseConvolution)
[08/17/2022-07:51:01] [V] [TRT] CudaDepthwiseConvolution has no valid tactics for this config, skipping
[08/17/2022-07:51:01] [V] [TRT] --------------- Timing Runner: MatMul-12 (FusedConvActConvolution)
[08/17/2022-07:51:01] [V] [TRT] FusedConvActConvolution has no valid tactics for this config, skipping
[08/17/2022-07:51:01] [V] [TRT] --------------- Timing Runner: MatMul-12 (CudnnConvolution)
[08/17/2022-07:51:01] [V] [TRT] Tactic: 0x0000000000000000 Time: 0.0660724
[08/17/2022-07:51:01] [V] [TRT] Tactic: 0x0000000000000001 Time: 0.00833829
[08/17/2022-07:51:01] [V] [TRT] Tactic: 0x0000000000000002 Time: 0.398775
[08/17/2022-07:51:01] [V] [TRT] Tactic: 0x0000000000000004 Time: 0.360448
[08/17/2022-07:51:01] [V] [TRT] Tactic: 0x0000000000000005 Time: 0.108683
[08/17/2022-07:51:01] [V] [TRT] Fastest Tactic: 0x0000000000000001 Time: 0.00833829
[08/17/2022-07:51:01] [V] [TRT] --------------- Timing Runner: MatMul-12 (CublasConvolution)
[08/17/2022-07:51:01] [V] [TRT] Tactic: 0x0000000000000000 Time: 0.00746789
[08/17/2022-07:51:01] [V] [TRT] Tactic: 0x0000000000000001 Time: 0.0104281
[08/17/2022-07:51:01] [V] [TRT] Fastest Tactic: 0x0000000000000000 Time: 0.00746789
[08/17/2022-07:51:01] [V] [TRT] --------------- Timing Runner: MatMul-12 (CaskConvolution)
[08/17/2022-07:51:01] [V] [TRT] MatMul-12 Set Tactic Name: maxwell_scudnn_128x32_relu_medium_nn_v1 Tactic: 0x0ebe499388e08286
[08/17/2022-07:51:01] [V] [TRT] Tactic: 0x0ebe499388e08286 Time: 0.0848457
[08/17/2022-07:51:01] [V] [TRT] MatMul-12 Set Tactic Name: maxwell_scudnn_128x32_relu_interior_nn_v0 Tactic: 0x1792ed6b0f1ea883
[08/17/2022-07:51:01] [V] [TRT] Tactic: 0x1792ed6b0f1ea883 Time: 0.0602209
[08/17/2022-07:51:01] [V] [TRT] MatMul-12 Set Tactic Name: maxwell_scudnn_128x128_relu_medium_nn_v1 Tactic: 0x3e787008e11a6129
[08/17/2022-07:51:01] [V] [TRT] Tactic: 0x3e787008e11a6129 Time: 0.0932571
[08/17/2022-07:51:01] [V] [TRT] MatMul-12 Set Tactic Name: maxwell_scudnn_128x64_relu_small_nn_v1 Tactic: 0x474c9edd1ecfbbba
[08/17/2022-07:51:01] [V] [TRT] Tactic: 0x474c9edd1ecfbbba Time: 0.0618789
[08/17/2022-07:51:01] [V] [TRT] MatMul-12 Set Tactic Name: maxwell_scudnn_128x128_relu_small_nn_v0 Tactic: 0x4963fb96b4067e81
[08/17/2022-07:51:01] [V] [TRT] Tactic: 0x4963fb96b4067e81 Time: 0.0902583
[08/17/2022-07:51:01] [V] [TRT] MatMul-12 Set Tactic Name: maxwell_scudnn_128x128_relu_interior_nn_v1 Tactic: 0x49ecad9da64c487b
[08/17/2022-07:51:01] [V] [TRT] Tactic: 0x49ecad9da64c487b Time: 0.090112
[08/17/2022-07:51:01] [V] [TRT] MatMul-12 Set Tactic Name: maxwell_scudnn_128x64_relu_interior_nn_v0 Tactic: 0x4c5584586319b832
[08/17/2022-07:51:01] [V] [TRT] Tactic: 0x4c5584586319b832 Time: 0.0772389
[08/17/2022-07:51:01] [V] [TRT] MatMul-12 Set Tactic Name: maxwell_scudnn_128x64_relu_medium_nn_v1 Tactic: 0x5c38385751ccb068
