cookbook/08-Tool/trtexec/result-FP16.txt
[06/15/2022-05:43:27] [V] [TRT] *************** Autotuning Reformat: Float(784,784,28,1) -> Float(784,1,28,1) ***************
[06/15/2022-05:43:27] [V] [TRT] --------------- Timing Runner: Optimizer Reformat(tensor-0 -> <out>) (Reformat)
[06/15/2022-05:43:27] [V] [TRT] Tactic: 0x00000000000003e8 Time: 0.00190256
[06/15/2022-05:43:27] [V] [TRT] Tactic: 0x00000000000003ea Time: 0.00505442
[06/15/2022-05:43:27] [V] [TRT] Tactic: 0x0000000000000000 Time: 0.00190171
[06/15/2022-05:43:27] [V] [TRT] Fastest Tactic: 0x0000000000000000 Time: 0.00190171
[06/15/2022-05:43:27] [V] [TRT] *************** Autotuning Reformat: Float(784,784,28,1) -> Half(784,784,28,1) ***************
[06/15/2022-05:43:27] [V] [TRT] --------------- Timing Runner: Optimizer Reformat(tensor-0 -> <out>) (Reformat)
[06/15/2022-05:43:27] [V] [TRT] Tactic: 0x00000000000003e8 Time: 0.00150901
[06/15/2022-05:43:27] [V] [TRT] Tactic: 0x00000000000003ea Time: 0.00530421
[06/15/2022-05:43:27] [V] [TRT] Tactic: 0x0000000000000000 Time: 0.0028768
[06/15/2022-05:43:27] [V] [TRT] Fastest Tactic: 0x00000000000003e8 Time: 0.00150901
[06/15/2022-05:43:27] [V] [TRT] =============== Computing reformatting costs
[06/15/2022-05:43:27] [V] [TRT] *************** Autotuning Reformat: Float(25088,784,28,1) -> Half(25088,784,28,1) ***************
[06/15/2022-05:43:27] [V] [TRT] --------------- Timing Runner: Optimizer Reformat(tensor-2 -> <out>) (Reformat)
[06/15/2022-05:43:27] [V] [TRT] Tactic: 0x00000000000003e8 Time: 0.00308367
[06/15/2022-05:43:27] [V] [TRT] Tactic: 0x00000000000003ea Time: 0.00660322
[06/15/2022-05:43:27] [V] [TRT] Tactic: 0x0000000000000000 Time: 0.00519445
[06/15/2022-05:43:27] [V] [TRT] Fastest Tactic: 0x00000000000003e8 Time: 0.00308367
[06/15/2022-05:43:27] [V] [TRT] *************** Autotuning Reformat: Float(25088,1,896,32) -> Float(25088,784,28,1) ***************
[06/15/2022-05:43:27] [V] [TRT] --------------- Timing Runner: Optimizer Reformat(tensor-2 -> <out>) (Reformat)
[06/15/2022-05:43:27] [V] [TRT] Tactic: 0x00000000000003e8 Time: 0.00596533
[06/15/2022-05:43:27] [V] [TRT] Tactic: 0x00000000000003ea Time: 0.0138041
[06/15/2022-05:43:27] [V] [TRT] Tactic: 0x0000000000000000 Time: 0.00597048
[06/15/2022-05:43:27] [V] [TRT] Fastest Tactic: 0x00000000000003e8 Time: 0.00596533
[06/15/2022-05:43:27] [V] [TRT] *************** Autotuning Reformat: Float(25088,1,896,32) -> Half(25088,784,28,1) ***************
[06/15/2022-05:43:27] [V] [TRT] --------------- Timing Runner: Optimizer Reformat(tensor-2 -> <out>) (Reformat)
[06/15/2022-05:43:27] [V] [TRT] Tactic: 0x00000000000003e8 Time: 0.00601886
[06/15/2022-05:43:27] [V] [TRT] Tactic: 0x00000000000003ea Time: 0.00592165
[06/15/2022-05:43:27] [V] [TRT] Tactic: 0x0000000000000000 Time: 0.00601562
[06/15/2022-05:43:27] [V] [TRT] Fastest Tactic: 0x00000000000003ea Time: 0.00592165
[06/15/2022-05:43:27] [V] [TRT] *************** Autotuning Reformat: Half(25088,784,28,1) -> Float(25088,784,28,1) ***************
[06/15/2022-05:43:27] [V] [TRT] --------------- Timing Runner: Optimizer Reformat(tensor-2 -> <out>) (Reformat)
[06/15/2022-05:43:27] [V] [TRT] Tactic: 0x00000000000003e8 Time: 0.00309281
[06/15/2022-05:43:27] [V] [TRT] Tactic: 0x00000000000003ea Time: 0.00779068
[06/15/2022-05:43:27] [V] [TRT] Tactic: 0x0000000000000000 Time: 0.00460229
[06/15/2022-05:43:27] [V] [TRT] Fastest Tactic: 0x00000000000003e8 Time: 0.00309281
[06/15/2022-05:43:27] [V] [TRT] =============== Computing reformatting costs
[06/15/2022-05:43:27] [V] [TRT] *************** Autotuning Reformat: Float(6272,196,14,1) -> Float(6272,1,448,32) ***************
[06/15/2022-05:43:27] [V] [TRT] --------------- Timing Runner: Optimizer Reformat(tensor-3 -> <out>) (Reformat)
[06/15/2022-05:43:27] [V] [TRT] Tactic: 0x00000000000003e8 Time: 0.00316174
[06/15/2022-05:43:27] [V] [TRT] Tactic: 0x00000000000003ea Time: 0.0136046
[06/15/2022-05:43:27] [V] [TRT] Tactic: 0x0000000000000000 Time: 0.00313809
[06/15/2022-05:43:27] [V] [TRT] Fastest Tactic: 0x0000000000000000 Time: 0.00313809
[06/15/2022-05:43:27] [V] [TRT] *************** Autotuning Reformat: Float(6272,196,14,1) -> Half(6272,196,14,1) ***************
[06/15/2022-05:43:27] [V] [TRT] --------------- Timing Runner: Optimizer Reformat(tensor-3 -> <out>) (Reformat)
[06/15/2022-05:43:27] [V] [TRT] Tactic: 0x00000000000003e8 Time: 0.00180468
[06/15/2022-05:43:27] [V] [TRT] Tactic: 0x00000000000003ea Time: 0.025427
[06/15/2022-05:43:27] [V] [TRT] Tactic: 0x0000000000000000 Time: 0.00338307
[06/15/2022-05:43:27] [V] [TRT] Fastest Tactic: 0x00000000000003e8 Time: 0.00180468
[06/15/2022-05:43:27] [V] [TRT] *************** Autotuning Reformat: Float(6272,1,448,32) -> Float(6272,196,14,1) ***************
[06/15/2022-05:43:27] [V] [TRT] --------------- Timing Runner: Optimizer Reformat(tensor-3 -> <out>) (Reformat)
[06/15/2022-05:43:27] [V] [TRT] Tactic: 0x00000000000003e8 Time: 0.00309311
[06/15/2022-05:43:27] [V] [TRT] Tactic: 0x00000000000003ea Time: 0.0134699
[06/15/2022-05:43:27] [V] [TRT] Tactic: 0x0000000000000000 Time: 0.00309807
[06/15/2022-05:43:27] [V] [TRT] Fastest Tactic: 0x00000000000003e8 Time: 0.00309311
[06/15/2022-05:43:27] [V] [TRT] *************** Autotuning Reformat: Float(6272,1,448,32) -> Half(6272,196,14,1) ***************
[06/15/2022-05:43:27] [V] [TRT] --------------- Timing Runner: Optimizer Reformat(tensor-3 -> <out>) (Reformat)
[06/15/2022-05:43:27] [V] [TRT] Tactic: 0x00000000000003e8 Time: 0.00312765
[06/15/2022-05:43:27] [V] [TRT] Tactic: 0x00000000000003ea Time: 0.00509478
[06/15/2022-05:43:27] [V] [TRT] Tactic: 0x0000000000000000 Time: 0.003097
[06/15/2022-05:43:27] [V] [TRT] Fastest Tactic: 0x0000000000000000 Time: 0.003097
[06/15/2022-05:43:27] [V] [TRT] *************** Autotuning Reformat: Half(6272,196,14,1) -> Float(6272,196,14,1) ***************
[06/15/2022-05:43:27] [V] [TRT] --------------- Timing Runner: Optimizer Reformat(tensor-3 -> <out>) (Reformat)
[06/15/2022-05:43:27] [V] [TRT] Tactic: 0x00000000000003e8 Time: 0.00181792
[06/15/2022-05:43:27] [V] [TRT] Tactic: 0x00000000000003ea Time: 0.0258682
[06/15/2022-05:43:27] [V] [TRT] Tactic: 0x0000000000000000 Time: 0.00328062
[06/15/2022-05:43:27] [V] [TRT] Fastest Tactic: 0x00000000000003e8 Time: 0.00181792
[06/15/2022-05:43:27] [V] [TRT] *************** Autotuning Reformat: Half(6272,196,14,1) -> Float(6272,1,448,32) ***************
[06/15/2022-05:43:27] [V] [TRT] --------------- Timing Runner: Optimizer Reformat(tensor-3 -> <out>) (Reformat)
[06/15/2022-05:43:27] [V] [TRT] Tactic: 0x00000000000003e8 Time: 0.00327813
[06/15/2022-05:43:27] [V] [TRT] Tactic: 0x00000000000003ea Time: 0.00499894
[06/15/2022-05:43:27] [V] [TRT] Tactic: 0x0000000000000000 Time: 0.00328145
[06/15/2022-05:43:27] [V] [TRT] Fastest Tactic: 0x00000000000003e8 Time: 0.00327813
[06/15/2022-05:43:27] [V] [TRT] =============== Computing reformatting costs
[06/15/2022-05:43:27] [V] [TRT] *************** Autotuning Reformat: Float(12544,196,14,1) -> Half(12544,196,14,1) ***************
[06/15/2022-05:43:27] [V] [TRT] --------------- Timing Runner: Optimizer Reformat(tensor-5 -> <out>) (Reformat)
[06/15/2022-05:43:27] [V] [TRT] Tactic: 0x00000000000003e8 Time: 0.00225507
[06/15/2022-05:43:27] [V] [TRT] Tactic: 0x00000000000003ea Time: 0.0482743
[06/15/2022-05:43:27] [V] [TRT] Tactic: 0x0000000000000000 Time: 0.00377516
[06/15/2022-05:43:27] [V] [TRT] Fastest Tactic: 0x00000000000003e8 Time: 0.00225507
[06/15/2022-05:43:27] [V] [TRT] *************** Autotuning Reformat: Float(12544,1,896,64) -> Float(12544,196,14,1) ***************
[06/15/2022-05:43:27] [V] [TRT] --------------- Timing Runner: Optimizer Reformat(tensor-5 -> <out>) (Reformat)
[06/15/2022-05:43:27] [V] [TRT] Tactic: 0x00000000000003e8 Time: 0.00408202
[06/15/2022-05:43:27] [V] [TRT] Tactic: 0x00000000000003ea Time: 0.013312
[06/15/2022-05:43:27] [V] [TRT] Tactic: 0x0000000000000000 Time: 0.00406438
[06/15/2022-05:43:27] [V] [TRT] Fastest Tactic: 0x0000000000000000 Time: 0.00406438
[06/15/2022-05:43:27] [V] [TRT] *************** Autotuning Reformat: Float(12544,1,896,64) -> Half(12544,196,14,1) ***************
[06/15/2022-05:43:27] [V] [TRT] --------------- Timing Runner: Optimizer Reformat(tensor-5 -> <out>) (Reformat)
[06/15/2022-05:43:27] [V] [TRT] Tactic: 0x00000000000003e8 Time: 0.00407784
[06/15/2022-05:43:27] [V] [TRT] Tactic: 0x00000000000003ea Time: 0.00557486
[06/15/2022-05:43:27] [V] [TRT] Tactic: 0x0000000000000000 Time: 0.00407467
[06/15/2022-05:43:27] [V] [TRT] Fastest Tactic: 0x0000000000000000 Time: 0.00407467
[06/15/2022-05:43:27] [V] [TRT] *************** Autotuning Reformat: Half(12544,196,14,1) -> Float(12544,196,14,1) ***************
[06/15/2022-05:43:27] [V] [TRT] --------------- Timing Runner: Optimizer Reformat(tensor-5 -> <out>) (Reformat)
[06/15/2022-05:43:27] [V] [TRT] Tactic: 0x00000000000003e8 Time: 0.00227309
[06/15/2022-05:43:27] [V] [TRT] Tactic: 0x00000000000003ea Time: 0.0492495
[06/15/2022-05:43:27] [V] [TRT] Tactic: 0x0000000000000000 Time: 0.00302019
[06/15/2022-05:43:27] [V] [TRT] Fastest Tactic: 0x00000000000003e8 Time: 0.00227309
[06/15/2022-05:43:27] [V] [TRT] =============== Computing reformatting costs
[06/15/2022-05:43:27] [V] [TRT] *************** Autotuning Reformat: Float(3136,49,7,1) -> Float(3136,1,448,64) ***************
[06/15/2022-05:43:27] [V] [TRT] --------------- Timing Runner: Optimizer Reformat(tensor-6 -> <out>) (Reformat)
[06/15/2022-05:43:27] [V] [TRT] Tactic: 0x00000000000003e8 Time: 0.00252271
[06/15/2022-05:43:27] [V] [TRT] Tactic: 0x00000000000003ea Time: 0.0124343
[06/15/2022-05:43:27] [V] [TRT] Tactic: 0x0000000000000000 Time: 0.00250223
[06/15/2022-05:43:27] [V] [TRT] Fastest Tactic: 0x0000000000000000 Time: 0.00250223
[06/15/2022-05:43:27] [V] [TRT] *************** Autotuning Reformat: Float(3136,49,7,1) -> Float(98,49:32,7,1) ***************
[06/15/2022-05:43:27] [V] [TRT] --------------- Timing Runner: Optimizer Reformat(tensor-6 -> <out>) (Reformat)
[06/15/2022-05:43:27] [V] [TRT] Tactic: 0x00000000000003e8 Time: 0.00289033
[06/15/2022-05:43:27] [V] [TRT] Tactic: 0x00000000000003ea Time: 0.0124099
[06/15/2022-05:43:27] [V] [TRT] Tactic: 0x0000000000000000 Time: 0.00290395
[06/15/2022-05:43:27] [V] [TRT] Fastest Tactic: 0x00000000000003e8 Time: 0.00289033
[06/15/2022-05:43:27] [V] [TRT] *************** Autotuning Reformat: Float(3136,49,7,1) -> Half(3136,49,7,1) ***************
[06/15/2022-05:43:27] [V] [TRT] --------------- Timing Runner: Optimizer Reformat(tensor-6 -> <out>) (Reformat)
[06/15/2022-05:43:27] [V] [TRT] Tactic: 0x00000000000003e8 Time: 0.00204264
[06/15/2022-05:43:27] [V] [TRT] Tactic: 0x00000000000003ea Time: 0.0156014
[06/15/2022-05:43:27] [V] [TRT] Tactic: 0x0000000000000000 Time: 0.00292263
[06/15/2022-05:43:27] [V] [TRT] Fastest Tactic: 0x00000000000003e8 Time: 0.00204264
[06/15/2022-05:43:27] [V] [TRT] *************** Autotuning Reformat: Float(3136,1,448,64) -> Float(3136,49,7,1) ***************
[06/15/2022-05:43:27] [V] [TRT] --------------- Timing Runner: Optimizer Reformat(tensor-6 -> <out>) (Reformat)
[06/15/2022-05:43:27] [V] [TRT] Tactic: 0x00000000000003e8 Time: 0.00237265
[06/15/2022-05:43:27] [V] [TRT] Tactic: 0x00000000000003ea Time: 0.0129219
[06/15/2022-05:43:27] [V] [TRT] Tactic: 0x0000000000000000 Time: 0.00239238
[06/15/2022-05:43:27] [V] [TRT] Fastest Tactic: 0x00000000000003e8 Time: 0.00237265
[06/15/2022-05:43:27] [V] [TRT] *************** Autotuning Reformat: Float(3136,1,448,64) -> Float(98,49:32,7,1) ***************
[06/15/2022-05:43:27] [V] [TRT] --------------- Timing Runner: Optimizer Reformat(tensor-6 -> <out>) (Reformat)
[06/15/2022-05:43:27] [V] [TRT] Tactic: 0x00000000000003e8 Time: 0.00307083
[06/15/2022-05:43:27] [V] [TRT] Tactic: 0x00000000000003ea Time: 0.0106978
[06/15/2022-05:43:27] [V] [TRT] Tactic: 0x0000000000000000 Time: 0.00305517
[06/15/2022-05:43:27] [V] [TRT] Fastest Tactic: 0x0000000000000000 Time: 0.00305517
[06/15/2022-05:43:27] [V] [TRT] *************** Autotuning Reformat: Float(3136,1,448,64) -> Half(3136,49,7,1) ***************
[06/15/2022-05:43:27] [V] [TRT] --------------- Timing Runner: Optimizer Reformat(tensor-6 -> <out>) (Reformat)
[06/15/2022-05:43:27] [V] [TRT] Tactic: 0x00000000000003e8 Time: 0.00240183
[06/15/2022-05:43:27] [V] [TRT] Tactic: 0x00000000000003ea Time: 0.00558699
[06/15/2022-05:43:27] [V] [TRT] Tactic: 0x0000000000000000 Time: 0.00241006
[06/15/2022-05:43:27] [V] [TRT] Fastest Tactic: 0x00000000000003e8 Time: 0.00240183
[06/15/2022-05:43:27] [V] [TRT] *************** Autotuning Reformat: Float(98,49:32,7,1) -> Float(3136,49,7,1) ***************
[06/15/2022-05:43:27] [V] [TRT] --------------- Timing Runner: Optimizer Reformat(tensor-6 -> <out>) (Reformat)
[06/15/2022-05:43:27] [V] [TRT] Tactic: 0x00000000000003e8 Time: 0.00244967
[06/15/2022-05:43:27] [V] [TRT] Tactic: 0x00000000000003ea Time: 0.012957
[06/15/2022-05:43:27] [V] [TRT] Tactic: 0x0000000000000000 Time: 0.00244471
[06/15/2022-05:43:27] [V] [TRT] Fastest Tactic: 0x0000000000000000 Time: 0.00244471
[06/15/2022-05:43:27] [V] [TRT] *************** Autotuning Reformat: Float(98,49:32,7,1) -> Float(3136,1,448,64) ***************
[06/15/2022-05:43:27] [V] [TRT] --------------- Timing Runner: Optimizer Reformat(tensor-6 -> <out>) (Reformat)
[06/15/2022-05:43:27] [V] [TRT] Tactic: 0x00000000000003e8 Time: 0.00230732
[06/15/2022-05:43:27] [V] [TRT] Tactic: 0x00000000000003ea Time: 0.0106893
[06/15/2022-05:43:27] [V] [TRT] Tactic: 0x0000000000000000 Time: 0.00242139
[06/15/2022-05:43:27] [V] [TRT] Fastest Tactic: 0x00000000000003e8 Time: 0.00230732
[06/15/2022-05:43:27] [V] [TRT] *************** Autotuning Reformat: Float(98,49:32,7,1) -> Half(3136,49,7,1) ***************
[06/15/2022-05:43:27] [V] [TRT] --------------- Timing Runner: Optimizer Reformat(tensor-6 -> <out>) (Reformat)
[06/15/2022-05:43:27] [V] [TRT] Tactic: 0x00000000000003e8 Time: 0.00242418
[06/15/2022-05:43:27] [V] [TRT] Tactic: 0x00000000000003ea Time: 0.00560949
[06/15/2022-05:43:27] [V] [TRT] Tactic: 0x0000000000000000 Time: 0.00241356
[06/15/2022-05:43:27] [V] [TRT] Fastest Tactic: 0x0000000000000000 Time: 0.00241356
[06/15/2022-05:43:27] [V] [TRT] *************** Autotuning Reformat: Half(3136,49,7,1) -> Float(3136,49,7,1) ***************
[06/15/2022-05:43:27] [V] [TRT] --------------- Timing Runner: Optimizer Reformat(tensor-6 -> <out>) (Reformat)
[06/15/2022-05:43:27] [V] [TRT] Tactic: 0x00000000000003e8 Time: 0.00203074
[06/15/2022-05:43:27] [V] [TRT] Tactic: 0x00000000000003ea Time: 0.0158683
[06/15/2022-05:43:27] [V] [TRT] Tactic: 0x0000000000000000 Time: 0.00224636
[06/15/2022-05:43:27] [V] [TRT] Fastest Tactic: 0x00000000000003e8 Time: 0.00203074
[06/15/2022-05:43:27] [V] [TRT] *************** Autotuning Reformat: Half(3136,49,7,1) -> Float(3136,1,448,64) ***************
[06/15/2022-05:43:27] [V] [TRT] --------------- Timing Runner: Optimizer Reformat(tensor-6 -> <out>) (Reformat)
[06/15/2022-05:43:27] [V] [TRT] Tactic: 0x00000000000003e8 Time: 0.0024492
[06/15/2022-05:43:27] [V] [TRT] Tactic: 0x00000000000003ea Time: 0.00548233
[06/15/2022-05:43:27] [V] [TRT] Tactic: 0x0000000000000000 Time: 0.00254492
[06/15/2022-05:43:27] [V] [TRT] Fastest Tactic: 0x00000000000003e8 Time: 0.0024492
[06/15/2022-05:43:27] [V] [TRT] *************** Autotuning Reformat: Half(3136,49,7,1) -> Float(98,49:32,7,1) ***************
[06/15/2022-05:43:27] [V] [TRT] --------------- Timing Runner: Optimizer Reformat(tensor-6 -> <out>) (Reformat)
[06/15/2022-05:43:27] [V] [TRT] Tactic: 0x00000000000003e8 Time: 0.0033014
[06/15/2022-05:43:27] [V] [TRT] Tactic: 0x00000000000003ea Time: 0.00506451
[06/15/2022-05:43:27] [V] [TRT] Tactic: 0x0000000000000000 Time: 0.00293374
[06/15/2022-05:43:27] [V] [TRT] Fastest Tactic: 0x0000000000000000 Time: 0.00293374
[06/15/2022-05:43:27] [V] [TRT] =============== Computing reformatting costs
[06/15/2022-05:43:27] [V] [TRT] *************** Autotuning Reformat: Float(3136,1,1,1) -> Float(3136,1,3136,3136) ***************
[06/15/2022-05:43:27] [V] [TRT] --------------- Timing Runner: Optimizer Reformat(reshape_before_MatMul-9_out_tensor -> <out>) (Reformat)
[06/15/2022-05:43:27] [V] [TRT] Tactic: 0x00000000000003e8 Time: 0.00237752
[06/15/2022-05:43:27] [V] [TRT] Tactic: 0x00000000000003ea Time: 0.00560193
[06/15/2022-05:43:27] [V] [TRT] Tactic: 0x0000000000000000 Time: 0.00214625
[06/15/2022-05:43:27] [V] [TRT] Fastest Tactic: 0x0000000000000000 Time: 0.00214625
[06/15/2022-05:43:27] [V] [TRT] *************** Autotuning Reformat: Float(3136,1,1,1) -> Half(3136,1,1,1) ***************
[06/15/2022-05:43:27] [V] [TRT] --------------- Timing Runner: Optimizer Reformat(reshape_before_MatMul-9_out_tensor -> <out>) (Reformat)
[06/15/2022-05:43:27] [V] [TRT] Tactic: 0x00000000000003e8 Time: 0.00210339
[06/15/2022-05:43:27] [V] [TRT] Tactic: 0x00000000000003ea Time: 0.00594505
[06/15/2022-05:43:27] [V] [TRT] Tactic: 0x0000000000000000 Time: 0.00293178
[06/15/2022-05:43:27] [V] [TRT] Fastest Tactic: 0x00000000000003e8 Time: 0.00210339
[06/15/2022-05:43:27] [V] [TRT] *************** Autotuning Reformat: Float(3136,1,3136,3136) -> Float(3136,1,1,1) ***************
[06/15/2022-05:43:27] [V] [TRT] --------------- Timing Runner: Optimizer Reformat(reshape_before_MatMul-9_out_tensor -> <out>) (Reformat)
[06/15/2022-05:43:27] [V] [TRT] Tactic: 0x00000000000003e8 Time: 0.00216761
[06/15/2022-05:43:27] [V] [TRT] Tactic: 0x00000000000003ea Time: 0.00503157
[06/15/2022-05:43:27] [V] [TRT] Tactic: 0x0000000000000000 Time: 0.00217233
[06/15/2022-05:43:27] [V] [TRT] Fastest Tactic: 0x00000000000003e8 Time: 0.00216761
[06/15/2022-05:43:27] [V] [TRT] *************** Autotuning Reformat: Float(3136,1,3136,3136) -> Half(3136,1,1,1) ***************
[06/15/2022-05:43:27] [V] [TRT] --------------- Timing Runner: Optimizer Reformat(reshape_before_MatMul-9_out_tensor -> <out>) (Reformat)
[06/15/2022-05:43:27] [V] [TRT] Tactic: 0x00000000000003e8 Time: 0.00238202
[06/15/2022-05:43:27] [V] [TRT] Tactic: 0x00000000000003ea Time: 0.00605752
[06/15/2022-05:43:27] [V] [TRT] Tactic: 0x0000000000000000 Time: 0.0027847
[06/15/2022-05:43:27] [V] [TRT] Fastest Tactic: 0x00000000000003e8 Time: 0.00238202
[06/15/2022-05:43:27] [V] [TRT] *************** Autotuning Reformat: Float(98,1:32,1,1) -> Float(3136,1,1,1) ***************
[06/15/2022-05:43:27] [V] [TRT] --------------- Timing Runner: Optimizer Reformat(reshape_before_MatMul-9_out_tensor -> <out>) (Reformat)
[06/15/2022-05:43:27] [V] [TRT] Tactic: 0x00000000000003e8 Time: 0.00273001
[06/15/2022-05:43:27] [V] [TRT] Tactic: 0x00000000000003ea Time: 0.0344649
[06/15/2022-05:43:27] [V] [TRT] Tactic: 0x0000000000000000 Time: 0.00284513
[06/15/2022-05:43:27] [V] [TRT] Fastest Tactic: 0x00000000000003e8 Time: 0.00273001
[06/15/2022-05:43:27] [V] [TRT] *************** Autotuning Reformat: Float(98,1:32,1,1) -> Float(3136,1,3136,3136) ***************
[06/15/2022-05:43:27] [V] [TRT] --------------- Timing Runner: Optimizer Reformat(reshape_before_MatMul-9_out_tensor -> <out>) (Reformat)
[06/15/2022-05:43:27] [V] [TRT] Tactic: 0x00000000000003e8 Time: 0.0027607
[06/15/2022-05:43:27] [V] [TRT] Tactic: 0x00000000000003ea Time: 0.0110432
[06/15/2022-05:43:27] [V] [TRT] Tactic: 0x0000000000000000 Time: 0.00281098
[06/15/2022-05:43:27] [V] [TRT] Fastest Tactic: 0x00000000000003e8 Time: 0.0027607
[06/15/2022-05:43:27] [V] [TRT] *************** Autotuning Reformat: Float(98,1:32,1,1) -> Half(3136,1,1,1) ***************
[06/15/2022-05:43:27] [V] [TRT] --------------- Timing Runner: Optimizer Reformat(reshape_before_MatMul-9_out_tensor -> <out>) (Reformat)
[06/15/2022-05:43:27] [V] [TRT] Tactic: 0x00000000000003e8 Time: 0.002752
[06/15/2022-05:43:27] [V] [TRT] Tactic: 0x00000000000003ea Time: 0.0126419
[06/15/2022-05:43:27] [V] [TRT] Tactic: 0x0000000000000000 Time: 0.0027615
[06/15/2022-05:43:27] [V] [TRT] Fastest Tactic: 0x00000000000003e8 Time: 0.002752
[06/15/2022-05:43:27] [V] [TRT] *************** Autotuning Reformat: Half(3136,1,1,1) -> Float(3136,1,1,1) ***************
[06/15/2022-05:43:27] [V] [TRT] --------------- Timing Runner: Optimizer Reformat(reshape_before_MatMul-9_out_tensor -> <out>) (Reformat)
[06/15/2022-05:43:27] [V] [TRT] Tactic: 0x00000000000003e8 Time: 0.00240884
[06/15/2022-05:43:27] [V] [TRT] Tactic: 0x00000000000003ea Time: 0.00625351
[06/15/2022-05:43:27] [V] [TRT] Tactic: 0x0000000000000000 Time: 0.00251685
[06/15/2022-05:43:27] [V] [TRT] Fastest Tactic: 0x00000000000003e8 Time: 0.00240884
[06/15/2022-05:43:27] [V] [TRT] *************** Autotuning Reformat: Half(3136,1,1,1) -> Float(3136,1,3136,3136) ***************
[06/15/2022-05:43:27] [V] [TRT] --------------- Timing Runner: Optimizer Reformat(reshape_before_MatMul-9_out_tensor -> <out>) (Reformat)
[06/15/2022-05:43:27] [V] [TRT] Tactic: 0x00000000000003e8 Time: 0.00267632
[06/15/2022-05:43:27] [V] [TRT] Tactic: 0x00000000000003ea Time: 0.00606476
[06/15/2022-05:43:27] [V] [TRT] Tactic: 0x0000000000000000 Time: 0.0027513
[06/15/2022-05:43:27] [V] [TRT] Fastest Tactic: 0x00000000000003e8 Time: 0.00267632
[06/15/2022-05:43:27] [V] [TRT] =============== Computing reformatting costs
[06/15/2022-05:43:27] [V] [TRT] *************** Autotuning Reformat: Float(1024,1,1,1) -> Float(1024,1,1024,1024) ***************
[06/15/2022-05:43:27] [V] [TRT] --------------- Timing Runner: Optimizer Reformat(ReLU-11_out_tensor -> <out>) (Reformat)
[06/15/2022-05:43:27] [V] [TRT] Tactic: 0x00000000000003e8 Time: 0.00277802
[06/15/2022-05:43:27] [V] [TRT] Tactic: 0x00000000000003ea Time: 0.00604667
[06/15/2022-05:43:27] [V] [TRT] Tactic: 0x0000000000000000 Time: 0.0028672
[06/15/2022-05:43:27] [V] [TRT] Fastest Tactic: 0x00000000000003e8 Time: 0.00277802
[06/15/2022-05:43:27] [V] [TRT] *************** Autotuning Reformat: Float(1024,1,1,1) -> Half(1024,1,1,1) ***************
[06/15/2022-05:43:27] [V] [TRT] --------------- Timing Runner: Optimizer Reformat(ReLU-11_out_tensor -> <out>) (Reformat)
[06/15/2022-05:43:27] [V] [TRT] Tactic: 0x00000000000003e8 Time: 0.00240099
[06/15/2022-05:43:27] [V] [TRT] Tactic: 0x00000000000003ea Time: 0.00616838
[06/15/2022-05:43:27] [V] [TRT] Tactic: 0x0000000000000000 Time: 0.00286939
[06/15/2022-05:43:27] [V] [TRT] Fastest Tactic: 0x00000000000003e8 Time: 0.00240099
[06/15/2022-05:43:27] [V] [TRT] *************** Autotuning Reformat: Float(1024,1,1024,1024) -> Float(1024,1,1,1) ***************
[06/15/2022-05:43:27] [V] [TRT] --------------- Timing Runner: Optimizer Reformat(ReLU-11_out_tensor -> <out>) (Reformat)
[06/15/2022-05:43:27] [V] [TRT] Tactic: 0x00000000000003e8 Time: 0.00270534
[06/15/2022-05:43:27] [V] [TRT] Tactic: 0x00000000000003ea Time: 0.00609524
[06/15/2022-05:43:27] [V] [TRT] Tactic: 0x0000000000000000 Time: 0.00274989
[06/15/2022-05:43:27] [V] [TRT] Fastest Tactic: 0x00000000000003e8 Time: 0.00270534
[06/15/2022-05:43:27] [V] [TRT] *************** Autotuning Reformat: Float(1024,1,1024,1024) -> Half(1024,1,1,1) ***************
[06/15/2022-05:43:27] [V] [TRT] --------------- Timing Runner: Optimizer Reformat(ReLU-11_out_tensor -> <out>) (Reformat)
[06/15/2022-05:43:27] [V] [TRT] Tactic: 0x00000000000003e8 Time: 0.00269878
[06/15/2022-05:43:27] [V] [TRT] Tactic: 0x00000000000003ea Time: 0.00602895
[06/15/2022-05:43:27] [V] [TRT] Tactic: 0x0000000000000000 Time: 0.00273208
[06/15/2022-05:43:27] [V] [TRT] Fastest Tactic: 0x00000000000003e8 Time: 0.00269878
[06/15/2022-05:43:27] [V] [TRT] *************** Autotuning Reformat: Half(1024,1,1,1) -> Float(1024,1,1,1) ***************
[06/15/2022-05:43:27] [V] [TRT] --------------- Timing Runner: Optimizer Reformat(ReLU-11_out_tensor -> <out>) (Reformat)
[06/15/2022-05:43:27] [V] [TRT] Tactic: 0x00000000000003e8 Time: 0.00232929
[06/15/2022-05:43:27] [V] [TRT] Tactic: 0x00000000000003ea Time: 0.00622032
[06/15/2022-05:43:27] [V] [TRT] Tactic: 0x0000000000000000 Time: 0.00256261
[06/15/2022-05:43:27] [V] [TRT] Fastest Tactic: 0x00000000000003e8 Time: 0.00232929
[06/15/2022-05:43:27] [V] [TRT] *************** Autotuning Reformat: Half(1024,1,1,1) -> Float(1024,1,1024,1024) ***************
[06/15/2022-05:43:27] [V] [TRT] --------------- Timing Runner: Optimizer Reformat(ReLU-11_out_tensor -> <out>) (Reformat)
[06/15/2022-05:43:27] [V] [TRT] Tactic: 0x00000000000003e8 Time: 0.00259915
[06/15/2022-05:43:27] [V] [TRT] Tactic: 0x00000000000003ea Time: 0.00599772
[06/15/2022-05:43:27] [V] [TRT] Tactic: 0x0000000000000000 Time: 0.00270905
[06/15/2022-05:43:27] [V] [TRT] Fastest Tactic: 0x00000000000003e8 Time: 0.00259915
[06/15/2022-05:43:27] [V] [TRT] =============== Computing reformatting costs
[06/15/2022-05:43:27] [V] [TRT] *************** Autotuning Reformat: Float(10,1,1,1) -> Half(10,1,1,1) ***************
[06/15/2022-05:43:27] [V] [TRT] --------------- Timing Runner: Optimizer Reformat(MatMul-12_out_tensor -> <out>) (Reformat)
[06/15/2022-05:43:27] [V] [TRT] Tactic: 0x00000000000003e8 Time: 0.00245331
[06/15/2022-05:43:27] [V] [TRT] Tactic: 0x00000000000003ea Time: 0.00620971
[06/15/2022-05:43:27] [V] [TRT] Tactic: 0x0000000000000000 Time: 0.00261087
[06/15/2022-05:43:27] [V] [TRT] Fastest Tactic: 0x00000000000003e8 Time: 0.00245331
[06/15/2022-05:43:27] [V] [TRT] *************** Autotuning Reformat: Float(10,1,10,10) -> Float(10,1,1,1) ***************
[06/15/2022-05:43:27] [V] [TRT] --------------- Timing Runner: Optimizer Reformat(MatMul-12_out_tensor -> <out>) (Reformat)
[06/15/2022-05:43:27] [V] [TRT] Tactic: 0x00000000000003e8 Time: 0.00271707
[06/15/2022-05:43:27] [V] [TRT] Tactic: 0x00000000000003ea Time: 0.0116336
[06/15/2022-05:43:27] [V] [TRT] Tactic: 0x0000000000000000 Time: 0.00278224
[06/15/2022-05:43:27] [V] [TRT] Fastest Tactic: 0x00000000000003e8 Time: 0.00271707
[06/15/2022-05:43:27] [V] [TRT] *************** Autotuning Reformat: Float(10,1,10,10) -> Half(10,1,1,1) ***************
[06/15/2022-05:43:27] [V] [TRT] --------------- Timing Runner: Optimizer Reformat(MatMul-12_out_tensor -> <out>) (Reformat)
[06/15/2022-05:43:27] [V] [TRT] Tactic: 0x00000000000003e8 Time: 0.00272
[06/15/2022-05:43:27] [V] [TRT] Tactic: 0x00000000000003ea Time: 0.00612571
[06/15/2022-05:43:27] [V] [TRT] Tactic: 0x0000000000000000 Time: 0.00287131
[06/15/2022-05:43:27] [V] [TRT] Fastest Tactic: 0x00000000000003e8 Time: 0.00272
[06/15/2022-05:43:27] [V] [TRT] *************** Autotuning Reformat: Half(10,1,1,1) -> Float(10,1,1,1) ***************
[06/15/2022-05:43:27] [V] [TRT] --------------- Timing Runner: Optimizer Reformat(MatMul-12_out_tensor -> <out>) (Reformat)
[06/15/2022-05:43:27] [V] [TRT] Tactic: 0x00000000000003e8 Time: 0.00247401
[06/15/2022-05:43:27] [V] [TRT] Tactic: 0x00000000000003ea Time: 0.00615867
[06/15/2022-05:43:27] [V] [TRT] Tactic: 0x0000000000000000 Time: 0.00258351
[06/15/2022-05:43:27] [V] [TRT] Fastest Tactic: 0x00000000000003e8 Time: 0.00247401
[06/15/2022-05:43:27] [V] [TRT] =============== Computing reformatting costs
[06/15/2022-05:43:27] [V] [TRT] *************** Autotuning Reformat: Float(10,1) -> Half(10,1) ***************
[06/15/2022-05:43:27] [V] [TRT] --------------- Timing Runner: Optimizer Reformat(tensor-13 -> <out>) (Reformat)
[06/15/2022-05:43:27] [V] [TRT] Tactic: 0x00000000000003e8 Time: 0.00237887
[06/15/2022-05:43:27] [V] [TRT] Tactic: 0x00000000000003ea Time: 0.0062394
[06/15/2022-05:43:27] [V] [TRT] Tactic: 0x0000000000000000 Time: 0.0025098
[06/15/2022-05:43:27] [V] [TRT] Fastest Tactic: 0x00000000000003e8 Time: 0.00237887
[06/15/2022-05:43:27] [V] [TRT] *************** Autotuning Reformat: Half(10,1) -> Float(10,1) ***************
[06/15/2022-05:43:27] [V] [TRT] --------------- Timing Runner: Optimizer Reformat(tensor-13 -> <out>) (Reformat)
[06/15/2022-05:43:27] [V] [TRT] Tactic: 0x00000000000003e8 Time: 0.00230015
[06/15/2022-05:43:27] [V] [TRT] Tactic: 0x00000000000003ea Time: 0.0061979
[06/15/2022-05:43:27] [V] [TRT] Tactic: 0x0000000000000000 Time: 0.00249127
[06/15/2022-05:43:27] [V] [TRT] Fastest Tactic: 0x00000000000003e8 Time: 0.00230015
[06/15/2022-05:43:27] [V] [TRT] =============== Computing reformatting costs
[06/15/2022-05:43:27] [V] [TRT] *************** Autotuning Reformat: Float(1,1) -> Half(1,1) ***************
[06/15/2022-05:43:27] [V] [TRT] --------------- Timing Runner: Optimizer Reformat(<in> -> (Unnamed Layer* 28) [TopK]_output_1) (Reformat)
[06/15/2022-05:43:27] [V] [TRT] Tactic: 0x00000000000003e8 Time: 0.00238834
[06/15/2022-05:43:27] [V] [TRT] Tactic: 0x00000000000003ea Time: 0.0062712
[06/15/2022-05:43:27] [V] [TRT] Tactic: 0x0000000000000000 Time: 0.00248481
[06/15/2022-05:43:27] [V] [TRT] Fastest Tactic: 0x00000000000003e8 Time: 0.00238834
[06/15/2022-05:43:27] [V] [TRT] *************** Autotuning Reformat: Half(1,1) -> Float(1,1) ***************
[06/15/2022-05:43:27] [V] [TRT] --------------- Timing Runner: Optimizer Reformat(<in> -> (Unnamed Layer* 28) [TopK]_output_1) (Reformat)
[06/15/2022-05:43:27] [V] [TRT] Tactic: 0x00000000000003e8 Time: 0.00238347
[06/15/2022-05:43:27] [V] [TRT] Tactic: 0x00000000000003ea Time: 0.00618076
[06/15/2022-05:43:27] [V] [TRT] Tactic: 0x0000000000000000 Time: 0.0024644
[06/15/2022-05:43:27] [V] [TRT] Fastest Tactic: 0x00000000000003e8 Time: 0.00238347
[06/15/2022-05:43:27] [V] [TRT] =============== Computing reformatting costs
[06/15/2022-05:43:27] [V] [TRT] =============== Computing reformatting costs
[06/15/2022-05:43:27] [V] [TRT] =============== Computing costs for 
[06/15/2022-05:43:27] [V] [TRT] *************** Autotuning format combination: Float(784,784,28,1) -> Float(25088,784,28,1) ***************
[06/15/2022-05:43:27] [V] [TRT] --------------- Timing Runner: Conv-1 + ReLU-2 (CudaDepthwiseConvolution)
[06/15/2022-05:43:27] [V] [TRT] CudaDepthwiseConvolution has no valid tactics for this config, skipping
[06/15/2022-05:43:27] [V] [TRT] --------------- Timing Runner: Conv-1 + ReLU-2 (FusedConvActConvolution)
[06/15/2022-05:43:27] [V] [TRT] FusedConvActConvolution has no valid tactics for this config, skipping
[06/15/2022-05:43:27] [V] [TRT] --------------- Timing Runner: Conv-1 + ReLU-2 (CudnnConvolution)
[06/15/2022-05:43:27] [V] [TRT] Tactic: 0x0000000000000000 Time: 0.0206054
[06/15/2022-05:43:27] [V] [TRT] Tactic: 0x0000000000000001 Time: 0.0179749
[06/15/2022-05:43:27] [V] [TRT] Tactic: 0x0000000000000002 Time: 0.0235102
[06/15/2022-05:43:27] [V] [TRT] Tactic: 0x0000000000000004 Time: 0.0395714
[06/15/2022-05:43:27] [V] [TRT] Tactic: 0x0000000000000005 Time: 0.0379566
[06/15/2022-05:43:27] [V] [TRT] Fastest Tactic: 0x0000000000000001 Time: 0.0179749
[06/15/2022-05:43:27] [V] [TRT] --------------- Timing Runner: Conv-1 + ReLU-2 (CaskConvolution)
[06/15/2022-05:43:27] [V] [TRT] Conv-1 + ReLU-2 Set Tactic Name: maxwell_scudnn_128x32_relu_medium_nn_v1 Tactic: 0x0ebe499388e08286
[06/15/2022-05:43:27] [V] [TRT] Tactic: 0x0ebe499388e08286 Time: 0.0102191
[06/15/2022-05:43:27] [V] [TRT] Conv-1 + ReLU-2 Set Tactic Name: maxwell_scudnn_128x32_relu_large_nn_v0 Tactic: 0x185af5379580418f
[06/15/2022-05:43:27] [V] [TRT] Tactic: 0x185af5379580418f Time: 0.00766292
[06/15/2022-05:43:27] [V] [TRT] Conv-1 + ReLU-2 Set Tactic Name: maxwell_scudnn_128x128_relu_large_nn_v0 Tactic: 0x321f7a577fb21da0
[06/15/2022-05:43:27] [V] [TRT] Tactic: 0x321f7a577fb21da0 Time: 0.0134936
[06/15/2022-05:43:27] [V] [TRT] Conv-1 + ReLU-2 Set Tactic Name: maxwell_scudnn_128x64_relu_large_nn_v1 Tactic: 0x3c301f1cd57bd89b
[06/15/2022-05:43:27] [V] [TRT] Tactic: 0x3c301f1cd57bd89b Time: 0.0102191
[06/15/2022-05:43:27] [V] [TRT] Conv-1 + ReLU-2 Set Tactic Name: maxwell_scudnn_128x128_relu_medium_nn_v1 Tactic: 0x3e787008e11a6129
[06/15/2022-05:43:27] [V] [TRT] Tactic: 0x3e787008e11a6129 Time: 0.0128232
[06/15/2022-05:43:27] [V] [TRT] Conv-1 + ReLU-2 Set Tactic Name: maxwell_scudnn_128x64_relu_small_nn_v1 Tactic: 0x474c9edd1ecfbbba
[06/15/2022-05:43:27] [V] [TRT] Tactic: 0x474c9edd1ecfbbba Time: 0.00924714
[06/15/2022-05:43:27] [V] [TRT] Conv-1 + ReLU-2 Set Tactic Name: maxwell_scudnn_128x128_relu_small_nn_v0 Tactic: 0x4963fb96b4067e81
[06/15/2022-05:43:27] [V] [TRT] Tactic: 0x4963fb96b4067e81 Time: 0.0129097
[06/15/2022-05:43:27] [V] [TRT] Conv-1 + ReLU-2 Set Tactic Name: maxwell_scudnn_128x64_relu_medium_nn_v1 Tactic: 0x5c38385751ccb068
[06/15/2022-05:43:27] [V] [TRT] Tactic: 0x5c38385751ccb068 Time: 0.00984015
[06/15/2022-05:43:27] [V] [TRT] Conv-1 + ReLU-2 Set Tactic Name: maxwell_scudnn_128x32_relu_small_nn_v0 Tactic: 0x632674f65e3422ae
[06/15/2022-05:43:27] [V] [TRT] Tactic: 0x632674f65e3422ae Time: 0.00710248
[06/15/2022-05:43:27] [V] [TRT] Conv-1 + ReLU-2 Set Tactic Name: maxwell_scudnn_128x128_relu_large_nn_v1 Tactic: 0x813136e97c1542cf
[06/15/2022-05:43:27] [V] [TRT] Tactic: 0x813136e97c1542cf Time: 0.0131923
[06/15/2022-05:43:27] [V] [TRT] Conv-1 + ReLU-2 Set Tactic Name: maxwell_scudnn_128x128_relu_medium_nn_v0 Tactic: 0x8d563cb6e2bd3e46
[06/15/2022-05:43:27] [V] [TRT] Tactic: 0x8d563cb6e2bd3e46 Time: 0.0134408
[06/15/2022-05:43:27] [V] [TRT] Conv-1 + ReLU-2 Set Tactic Name: maxwell_scudnn_128x64_relu_large_nn_v0 Tactic: 0x8f1e53a2d6dc87f4
[06/15/2022-05:43:27] [V] [TRT] Tactic: 0x8f1e53a2d6dc87f4 Time: 0.00998644
[06/15/2022-05:43:27] [V] [TRT] Conv-1 + ReLU-2 Set Tactic Name: maxwell_scudnn_128x32_relu_large_nn_v1 Tactic: 0xab74b98996271ee0
[06/15/2022-05:43:27] [V] [TRT] Tactic: 0xab74b98996271ee0 Time: 0.0102087
[06/15/2022-05:43:27] [V] [TRT] Conv-1 + ReLU-2 Set Tactic Name: maxwell_scudnn_128x32_relu_medium_nn_v0 Tactic: 0xbd90052d8b47dde9
[06/15/2022-05:43:27] [V] [TRT] Tactic: 0xbd90052d8b47dde9 Time: 0.0075597
[06/15/2022-05:43:27] [V] [TRT] Conv-1 + ReLU-2 Set Tactic Name: maxwell_scudnn_128x32_relu_small_nn_v1 Tactic: 0xd00838485d937dc1
[06/15/2022-05:43:27] [V] [TRT] Tactic: 0xd00838485d937dc1 Time: 0.00875429
[06/15/2022-05:43:27] [V] [TRT] Conv-1 + ReLU-2 Set Tactic Name: maxwell_scudnn_128x64_relu_medium_nn_v0 Tactic: 0xef1674e9526bef07
[06/15/2022-05:43:27] [V] [TRT] Tactic: 0xef1674e9526bef07 Time: 0.00989867
[06/15/2022-05:43:27] [V] [TRT] Conv-1 + ReLU-2 Set Tactic Name: maxwell_scudnn_128x64_relu_small_nn_v0 Tactic: 0xf462d2631d68e4d5
[06/15/2022-05:43:27] [V] [TRT] Tactic: 0xf462d2631d68e4d5 Time: 0.00958385
[06/15/2022-05:43:27] [V] [TRT] Conv-1 + ReLU-2 Set Tactic Name: maxwell_scudnn_128x128_relu_small_nn_v1 Tactic: 0xfa4db728b7a121ee
[06/15/2022-05:43:27] [V] [TRT] Tactic: 0xfa4db728b7a121ee Time: 0.0124766
[06/15/2022-05:43:27] [V] [TRT] Fastest Tactic: 0x632674f65e3422ae Time: 0.00710248
[06/15/2022-05:43:27] [V] [TRT] >>>>>>>>>>>>>>> Chose Runner Type: CaskConvolution Tactic: 0x632674f65e3422ae
[06/15/2022-05:43:27] [V] [TRT] *************** Autotuning format combination: Float(784,1,28,1) -> Float(25088,1,896,32) ***************
[06/15/2022-05:43:27] [V] [TRT] --------------- Timing Runner: Conv-1 + ReLU-2 (CaskConvolution)
[06/15/2022-05:43:27] [V] [TRT] CaskConvolution has no valid tactics for this config, skipping
[06/15/2022-05:43:27] [V] [TRT] *************** Autotuning format combination: Half(784,784,28,1) -> Half(25088,784,28,1) ***************
[06/15/2022-05:43:27] [V] [TRT] --------------- Timing Runner: Conv-1 + ReLU-2 (CudnnConvolution)
[06/15/2022-05:43:27] [V] [TRT] Tactic: 0x0000000000000000 Time: 0.0158756
[06/15/2022-05:43:27] [V] [TRT] Tactic: 0x0000000000000001 Time: 0.0162215
[06/15/2022-05:43:27] [V] [TRT] Tactic: 0x0000000000000002 Time: 0.0397897
[06/15/2022-05:43:27] [V] [TRT] Tactic: 0x0000000000000004 Time: 0.0292233
[06/15/2022-05:43:27] [V] [TRT] Tactic: 0x0000000000000005 Time: 0.0305051
[06/15/2022-05:43:27] [V] [TRT] Fastest Tactic: 0x0000000000000000 Time: 0.0158756
[06/15/2022-05:43:27] [V] [TRT] --------------- Timing Runner: Conv-1 + ReLU-2 (CaskConvolution)
[06/15/2022-05:43:27] [V] [TRT] CaskConvolution has no valid tactics for this config, skipping
[06/15/2022-05:43:27] [V] [TRT] >>>>>>>>>>>>>>> Chose Runner Type: CudnnConvolution Tactic: 0x0000000000000000
[06/15/2022-05:43:27] [V] [TRT] =============== Computing costs for 
[06/15/2022-05:43:27] [V] [TRT] *************** Autotuning format combination: Float(25088,784,28,1) -> Float(6272,196,14,1) ***************
[06/15/2022-05:43:27] [V] [TRT] --------------- Timing Runner: MaxPool-3 (TiledPooling)
[06/15/2022-05:43:27] [V] [TRT] Tactic: 0x0000000000540101 Time: 0.00674473
[06/15/2022-05:43:27] [V] [TRT] Tactic: 0x0000000000550101 Time: 0.0046428
[06/15/2022-05:43:27] [V] [TRT] Tactic: 0x0000000000560101 Time: 0.00405308
[06/15/2022-05:43:27] [V] [TRT] Tactic: 0x0000000000570101 Time: 0.00363154
[06/15/2022-05:43:27] [V] [TRT] Tactic: 0x0000000000580101 Time: 0.00366699
[06/15/2022-05:43:27] [V] [TRT] Tactic: 0x0000000000590101 Time: 0.00381787
[06/15/2022-05:43:27] [V] [TRT] Tactic: 0x00000000005a0101 Time: 0.00387966
[06/15/2022-05:43:27] [V] [TRT] Tactic: 0x00000000005b0101 Time: 0.00321635
[06/15/2022-05:43:27] [V] [TRT] Tactic: 0x00000000005c0101 Time: 0.00430158
[06/15/2022-05:43:27] [V] [TRT] Tactic: 0x00000000005d0101 Time: 0.00310118
[06/15/2022-05:43:27] [V] [TRT] Tactic: 0x00000000005e0101 Time: 0.00291629
[06/15/2022-05:43:27] [V] [TRT] Tactic: 0x00000000005f0101 Time: 0.00262516
[06/15/2022-05:43:27] [V] [TRT] Tactic: 0x0000000000600101 Time: 0.00265363
[06/15/2022-05:43:27] [V] [TRT] Tactic: 0x0000000000610101 Time: 0.00263738
[06/15/2022-05:43:27] [V] [TRT] Tactic: 0x0000000000620101 Time: 0.00252768
[06/15/2022-05:43:27] [V] [TRT] Tactic: 0x0000000000630101 Time: 0.00251116
[06/15/2022-05:43:27] [V] [TRT] Fastest Tactic: 0x0000000000630101 Time: 0.00251116
[06/15/2022-05:43:27] [V] [TRT] --------------- Timing Runner: MaxPool-3 (CudnnPooling)
[06/15/2022-05:43:27] [V] [TRT] Tactic: 0xffffffffffffffff Time: 0.00304603
[06/15/2022-05:43:27] [V] [TRT] Fastest Tactic: 0xffffffffffffffff Time: 0.00304603
[06/15/2022-05:43:27] [V] [TRT] --------------- Timing Runner: MaxPool-3 (CaskPooling)
[06/15/2022-05:43:27] [V] [TRT] MaxPool-3 Set Tactic Name: sm50_xmma_pooling_fw_4d_FP32FP32NCHW_Max Tactic: 0xb59f9cfb90407c92
[06/15/2022-05:43:27] [V] [TRT] Tactic: 0xb59f9cfb90407c92 Time: 0.00317694
[06/15/2022-05:43:27] [V] [TRT] Fastest Tactic: 0xb59f9cfb90407c92 Time: 0.00317694
[06/15/2022-05:43:27] [V] [TRT] >>>>>>>>>>>>>>> Chose Runner Type: TiledPooling Tactic: 0x0000000000630101
[06/15/2022-05:43:27] [V] [TRT] *************** Autotuning format combination: Half(25088,784,28,1) -> Half(6272,196,14,1) ***************
[06/15/2022-05:43:27] [V] [TRT] --------------- Timing Runner: MaxPool-3 (TiledPooling)
[06/15/2022-05:43:27] [V] [TRT] TiledPooling has no valid tactics for this config, skipping
[06/15/2022-05:43:27] [V] [TRT] --------------- Timing Runner: MaxPool-3 (CudnnPooling)
[06/15/2022-05:43:27] [V] [TRT] Tactic: 0xffffffffffffffff Time: 0.00305342
[06/15/2022-05:43:27] [V] [TRT] Fastest Tactic: 0xffffffffffffffff Time: 0.00305342
[06/15/2022-05:43:27] [V] [TRT] --------------- Timing Runner: MaxPool-3 (CaskPooling)
[06/15/2022-05:43:27] [V] [TRT] MaxPool-3 Set Tactic Name: sm50_xmma_pooling_fw_4d_FP16FP32NCHW_Max Tactic: 0xfd3a631f5c3e741e
[06/15/2022-05:43:27] [V] [TRT] Tactic: 0xfd3a631f5c3e741e Time: 0.0031521
[06/15/2022-05:43:27] [V] [TRT] Fastest Tactic: 0xfd3a631f5c3e741e Time: 0.0031521
[06/15/2022-05:43:27] [V] [TRT] >>>>>>>>>>>>>>> Chose Runner Type: CudnnPooling Tactic: 0xffffffffffffffff
[06/15/2022-05:43:27] [V] [TRT] =============== Computing costs for 
[06/15/2022-05:43:27] [V] [TRT] *************** Autotuning format combination: Float(6272,196,14,1) -> Float(12544,196,14,1) ***************
[06/15/2022-05:43:27] [V] [TRT] --------------- Timing Runner: Conv-4 + ReLU-5 (CudaDepthwiseConvolution)
[06/15/2022-05:43:27] [V] [TRT] CudaDepthwiseConvolution has no valid tactics for this config, skipping
[06/15/2022-05:43:27] [V] [TRT] --------------- Timing Runner: Conv-4 + ReLU-5 (FusedConvActConvolution)
[06/15/2022-05:43:27] [V] [TRT] FusedConvActConvolution has no valid tactics for this config, skipping
[06/15/2022-05:43:27] [V] [TRT] --------------- Timing Runner: Conv-4 + ReLU-5 (CudnnConvolution)
[06/15/2022-05:43:27] [V] [TRT] Tactic: 0x0000000000000000 Time: 0.0658286
[06/15/2022-05:43:27] [V] [TRT] Tactic: 0x0000000000000001 Time: 0.0685105
[06/15/2022-05:43:27] [V] [TRT] Tactic: 0x0000000000000002 Time: 0.107227
[06/15/2022-05:43:27] [V] [TRT] Tactic: 0x0000000000000004 Time: 0.179182
[06/15/2022-05:43:27] [V] [TRT] Tactic: 0x0000000000000005 Time: 0.185637
[06/15/2022-05:43:27] [V] [TRT] Fastest Tactic: 0x0000000000000000 Time: 0.0658286
[06/15/2022-05:43:27] [V] [TRT] --------------- Timing Runner: Conv-4 + ReLU-5 (CaskConvolution)
[06/15/2022-05:43:27] [V] [TRT] Conv-4 + ReLU-5 Set Tactic Name: maxwell_scudnn_128x32_relu_medium_nn_v1 Tactic: 0x0ebe499388e08286
[06/15/2022-05:43:27] [V] [TRT] Tactic: 0x0ebe499388e08286 Time: 0.104814
[06/15/2022-05:43:27] [V] [TRT] Conv-4 + ReLU-5 Set Tactic Name: maxwell_scudnn_128x32_relu_large_nn_v0 Tactic: 0x185af5379580418f
[06/15/2022-05:43:27] [V] [TRT] Tactic: 0x185af5379580418f Time: 0.0768731
[06/15/2022-05:43:27] [V] [TRT] Conv-4 + ReLU-5 Set Tactic Name: maxwell_scudnn_128x128_relu_large_nn_v0 Tactic: 0x321f7a577fb21da0
[06/15/2022-05:43:27] [V] [TRT] Tactic: 0x321f7a577fb21da0 Time: 0.0843337
[06/15/2022-05:43:27] [V] [TRT] Conv-4 + ReLU-5 Set Tactic Name: maxwell_scudnn_128x64_relu_large_nn_v1 Tactic: 0x3c301f1cd57bd89b
[06/15/2022-05:43:27] [V] [TRT] Tactic: 0x3c301f1cd57bd89b Time: 0.0776046
[06/15/2022-05:43:27] [V] [TRT] Conv-4 + ReLU-5 Set Tactic Name: maxwell_scudnn_128x128_relu_medium_nn_v1 Tactic: 0x3e787008e11a6129
[06/15/2022-05:43:27] [V] [TRT] Tactic: 0x3e787008e11a6129 Time: 0.08448
[06/15/2022-05:43:27] [V] [TRT] Conv-4 + ReLU-5 Set Tactic Name: maxwell_scudnn_128x64_relu_small_nn_v1 Tactic: 0x474c9edd1ecfbbba
[06/15/2022-05:43:27] [V] [TRT] Tactic: 0x474c9edd1ecfbbba Time: 0.0508587
[06/15/2022-05:43:27] [V] [TRT] Conv-4 + ReLU-5 Set Tactic Name: maxwell_scudnn_128x128_relu_small_nn_v0 Tactic: 0x4963fb96b4067e81
[06/15/2022-05:43:27] [V] [TRT] Tactic: 0x4963fb96b4067e81 Time: 0.073216
[06/15/2022-05:43:27] [V] [TRT] Conv-4 + ReLU-5 Set Tactic Name: maxwell_scudnn_128x64_relu_medium_nn_v1 Tactic: 0x5c38385751ccb068
[06/15/2022-05:43:27] [V] [TRT] Tactic: 0x5c38385751ccb068 Time: 0.0697783
[06/15/2022-05:43:27] [V] [TRT] Conv-4 + ReLU-5 Set Tactic Name: maxwell_scudnn_128x32_relu_small_nn_v0 Tactic: 0x632674f65e3422ae
[06/15/2022-05:43:27] [V] [TRT] Tactic: 0x632674f65e3422ae Time: 0.0587581
[06/15/2022-05:43:27] [V] [TRT] Conv-4 + ReLU-5 Set Tactic Name: maxwell_scudnn_128x128_relu_large_nn_v1 Tactic: 0x813136e97c1542cf
[06/15/2022-05:43:27] [V] [TRT] Tactic: 0x813136e97c1542cf Time: 0.0879177
[06/15/2022-05:43:27] [V] [TRT] Conv-4 + ReLU-5 Set Tactic Name: maxwell_scudnn_128x128_relu_medium_nn_v0 Tactic: 0x8d563cb6e2bd3e46
[06/15/2022-05:43:27] [V] [TRT] Tactic: 0x8d563cb6e2bd3e46 Time: 0.0845531
[06/15/2022-05:43:27] [V] [TRT] Conv-4 + ReLU-5 Set Tactic Name: maxwell_scudnn_128x64_relu_large_nn_v0 Tactic: 0x8f1e53a2d6dc87f4
[06/15/2022-05:43:27] [V] [TRT] Tactic: 0x8f1e53a2d6dc87f4 Time: 0.0908434
[06/15/2022-05:43:27] [V] [TRT] Conv-4 + ReLU-5 Set Tactic Name: maxwell_scudnn_128x32_relu_large_nn_v1 Tactic: 0xab74b98996271ee0
[06/15/2022-05:43:27] [V] [TRT] Tactic: 0xab74b98996271ee0 Time: 0.107008
[06/15/2022-05:43:27] [V] [TRT] Conv-4 + ReLU-5 Set Tactic Name: maxwell_scudnn_128x32_relu_medium_nn_v0 Tactic: 0xbd90052d8b47dde9
[06/15/2022-05:43:27] [V] [TRT] Tactic: 0xbd90052d8b47dde9 Time: 0.0759223
[06/15/2022-05:43:27] [V] [TRT] Conv-4 + ReLU-5 Set Tactic Name: maxwell_scudnn_128x32_relu_small_nn_v1 Tactic: 0xd00838485d937dc1
[06/15/2022-05:43:27] [V] [TRT] Tactic: 0xd00838485d937dc1 Time: 0.0600259
[06/15/2022-05:43:27] [V] [TRT] Conv-4 + ReLU-5 Set Tactic Name: maxwell_scudnn_128x64_relu_medium_nn_v0 Tactic: 0xef1674e9526bef07
[06/15/2022-05:43:27] [V] [TRT] Tactic: 0xef1674e9526bef07 Time: 0.090112
[06/15/2022-05:43:27] [V] [TRT] Conv-4 + ReLU-5 Set Tactic Name: maxwell_scudnn_128x64_relu_small_nn_v0 Tactic: 0xf462d2631d68e4d5
[06/15/2022-05:43:27] [V] [TRT] Tactic: 0xf462d2631d68e4d5 Time: 0.0740206
[06/15/2022-05:43:27] [V] [TRT] Conv-4 + ReLU-5 Set Tactic Name: maxwell_scudnn_128x128_relu_small_nn_v1 Tactic: 0xfa4db728b7a121ee
[06/15/2022-05:43:27] [V] [TRT] Tactic: 0xfa4db728b7a121ee Time: 0.0715337
[06/15/2022-05:43:27] [V] [TRT] Fastest Tactic: 0x474c9edd1ecfbbba Time: 0.0508587
[06/15/2022-05:43:27] [V] [TRT] >>>>>>>>>>>>>>> Chose Runner Type: CaskConvolution Tactic: 0x474c9edd1ecfbbba
[06/15/2022-05:43:27] [V] [TRT] *************** Autotuning format combination: Float(6272,1,448,32) -> Float(12544,1,896,64) ***************
[06/15/2022-05:43:27] [V] [TRT] --------------- Timing Runner: Conv-4 + ReLU-5 (CaskConvolution)
[06/15/2022-05:43:27] [V] [TRT] Conv-4 + ReLU-5 Set Tactic Name: maxwell_scudnn_128x32_sliced1x4_ldg4_relu_exp_small_nhwc_tn_v1 Tactic: 0x80f932c0b8ce5940
[06/15/2022-05:43:27] [V] [TRT] Tactic: 0x80f932c0b8ce5940 Time: 0.0224653
[06/15/2022-05:43:27] [V] [TRT] Conv-4 + ReLU-5 Set Tactic Name: maxwell_scudnn_128x64_sliced1x2_ldg4_relu_exp_small_nhwc_tn_v1 Tactic: 0x9961ac24fc07a1df
[06/15/2022-05:43:27] [V] [TRT] Tactic: 0x9961ac24fc07a1df Time: 0.0398994
[06/15/2022-05:43:27] [V] [TRT] Fastest Tactic: 0x80f932c0b8ce5940 Time: 0.0224653
[06/15/2022-05:43:27] [V] [TRT] >>>>>>>>>>>>>>> Chose Runner Type: CaskConvolution Tactic: 0x80f932c0b8ce5940
[06/15/2022-05:43:27] [V] [TRT] *************** Autotuning format combination: Half(6272,196,14,1) -> Half(12544,196,14,1) ***************
[06/15/2022-05:43:27] [V] [TRT] --------------- Timing Runner: Conv-4 + ReLU-5 (CudnnConvolution)
[06/15/2022-05:43:27] [V] [TRT] Tactic: 0x0000000000000000 Time: 0.079872
[06/15/2022-05:43:27] [V] [TRT] Tactic: 0x0000000000000001 Time: 0.068413
[06/15/2022-05:43:27] [V] [TRT] Tactic: 0x0000000000000002 Time: 0.095744
[06/15/2022-05:43:27] [V] [TRT] Tactic: 0x0000000000000004 Time: 0.173641
[06/15/2022-05:43:27] [V] [TRT] Tactic: 0x0000000000000005 Time: 0.179785
[06/15/2022-05:43:27] [V] [TRT] Fastest Tactic: 0x0000000000000001 Time: 0.068413
[06/15/2022-05:43:27] [V] [TRT] --------------- Timing Runner: Conv-4 + ReLU-5 (CaskConvolution)
[06/15/2022-05:43:27] [V] [TRT] CaskConvolution has no valid tactics for this config, skipping
[06/15/2022-05:43:27] [V] [TRT] >>>>>>>>>>>>>>> Chose Runner Type: CudnnConvolution Tactic: 0x0000000000000001
[06/15/2022-05:43:27] [V] [TRT] =============== Computing costs for 
[06/15/2022-05:43:27] [V] [TRT] *************** Autotuning format combination: Float(12544,196,14,1) -> Float(3136,49,7,1) ***************
[06/15/2022-05:43:27] [V] [TRT] --------------- Timing Runner: MaxPool-6 (TiledPooling)
[06/15/2022-05:43:27] [V] [TRT] Tactic: 0x0000000000540101 Time: 0.00743931
[06/15/2022-05:43:27] [V] [TRT] Tactic: 0x0000000000550101 Time: 0.00501565
[06/15/2022-05:43:27] [V] [TRT] Tactic: 0x0000000000560101 Time: 0.0043653
[06/15/2022-05:43:27] [V] [TRT] Tactic: 0x0000000000570101 Time: 0.00393686
[06/15/2022-05:43:27] [V] [TRT] Tactic: 0x0000000000580101 Time: 0.00373603
[06/15/2022-05:43:27] [V] [TRT] Tactic: 0x0000000000590101 Time: 0.00383543
[06/15/2022-05:43:27] [V] [TRT] Tactic: 0x00000000005a0101 Time: 0.00403721
[06/15/2022-05:43:27] [V] [TRT] Tactic: 0x00000000005b0101 Time: 0.00373146
[06/15/2022-05:43:27] [V] [TRT] Tactic: 0x00000000005c0101 Time: 0.00460557
[06/15/2022-05:43:27] [V] [TRT] Tactic: 0x00000000005d0101 Time: 0.00372466
[06/15/2022-05:43:27] [V] [TRT] Tactic: 0x00000000005e0101 Time: 0.00371341
[06/15/2022-05:43:27] [V] [TRT] Tactic: 0x00000000005f0101 Time: 0.0036096
[06/15/2022-05:43:27] [V] [TRT] Tactic: 0x0000000000600101 Time: 0.00353818
[06/15/2022-05:43:27] [V] [TRT] Tactic: 0x0000000000610101 Time: 0.00358389
[06/15/2022-05:43:27] [V] [TRT] Tactic: 0x0000000000620101 Time: 0.003576
[06/15/2022-05:43:27] [V] [TRT] Tactic: 0x0000000000630101 Time: 0.00286144
[06/15/2022-05:43:27] [V] [TRT] Fastest Tactic: 0x0000000000630101 Time: 0.00286144
[06/15/2022-05:43:27] [V] [TRT] --------------- Timing Runner: MaxPool-6 (CudnnPooling)
[06/15/2022-05:43:27] [V] [TRT] Tactic: 0xffffffffffffffff Time: 0.00265829
[06/15/2022-05:43:27] [V] [TRT] Fastest Tactic: 0xffffffffffffffff Time: 0.00265829
[06/15/2022-05:43:27] [V] [TRT] --------------- Timing Runner: MaxPool-6 (CaskPooling)
[06/15/2022-05:43:27] [V] [TRT] MaxPool-6 Set Tactic Name: sm50_xmma_pooling_fw_4d_FP32FP32NCHW_Max Tactic: 0xb59f9cfb90407c92
[06/15/2022-05:43:27] [V] [TRT] Tactic: 0xb59f9cfb90407c92 Time: 0.00278233
[06/15/2022-05:43:27] [V] [TRT] Fastest Tactic: 0xb59f9cfb90407c92 Time: 0.00278233
[06/15/2022-05:43:27] [V] [TRT] >>>>>>>>>>>>>>> Chose Runner Type: CudnnPooling Tactic: 0xffffffffffffffff
[06/15/2022-05:43:27] [V] [TRT] *************** Autotuning format combination: Half(12544,196,14,1) -> Half(3136,49,7,1) ***************
[06/15/2022-05:43:27] [V] [TRT] --------------- Timing Runner: MaxPool-6 (TiledPooling)
[06/15/2022-05:43:27] [V] [TRT] TiledPooling has no valid tactics for this config, skipping
[06/15/2022-05:43:27] [V] [TRT] --------------- Timing Runner: MaxPool-6 (CudnnPooling)
[06/15/2022-05:43:27] [V] [TRT] Tactic: 0xffffffffffffffff Time: 0.00307433
[06/15/2022-05:43:27] [V] [TRT] Fastest Tactic: 0xffffffffffffffff Time: 0.00307433
[06/15/2022-05:43:27] [V] [TRT] --------------- Timing Runner: MaxPool-6 (CaskPooling)
[06/15/2022-05:43:27] [V] [TRT] MaxPool-6 Set Tactic Name: sm50_xmma_pooling_fw_4d_FP16FP32NCHW_Max Tactic: 0xfd3a631f5c3e741e
[06/15/2022-05:43:27] [V] [TRT] Tactic: 0xfd3a631f5c3e741e Time: 0.00256261
[06/15/2022-05:43:27] [V] [TRT] Fastest Tactic: 0xfd3a631f5c3e741e Time: 0.00256261
[06/15/2022-05:43:27] [V] [TRT] >>>>>>>>>>>>>>> Chose Runner Type: CaskPooling Tactic: 0xfd3a631f5c3e741e
[06/15/2022-05:43:27] [V] [TRT] =============== Computing costs for 
[06/15/2022-05:43:27] [V] [TRT] *************** Autotuning format combination: Float(3136,49,7,1) -> Float(3136,1,1,1) ***************
[06/15/2022-05:43:27] [V] [TRT] --------------- Timing Runner: Transpose-7 + Reshape-7 + reshape_before_MatMul-9 (Shuffle)
[06/15/2022-05:43:27] [V] [TRT] Tactic: 0x0000000000000000 Time: 0.00269792
[06/15/2022-05:43:27] [V] [TRT] Tactic: 0x0000000000000001 Time: 0.0169366
[06/15/2022-05:43:27] [V] [TRT] Fastest Tactic: 0x0000000000000000 Time: 0.00269792
[06/15/2022-05:43:27] [V] [TRT] >>>>>>>>>>>>>>> Chose Runner Type: Shuffle Tactic: 0x0000000000000000
[06/15/2022-05:43:27] [V] [TRT] *************** Autotuning format combination: Float(3136,1,448,64) -> Float(3136,1,3136,3136) ***************
[06/15/2022-05:43:27] [V] [TRT] --------------- Timing Runner: Transpose-7 + Reshape-7 + reshape_before_MatMul-9 (Shuffle)
[06/15/2022-05:43:27] [V] [TRT] Tactic: 0x0000000000000000 Time: 0.00274614
[06/15/2022-05:43:27] [V] [TRT] Tactic: 0x0000000000000001 Time: 0.0106305
[06/15/2022-05:43:27] [V] [TRT] Fastest Tactic: 0x0000000000000000 Time: 0.00274614
[06/15/2022-05:43:27] [V] [TRT] >>>>>>>>>>>>>>> Chose Runner Type: Shuffle Tactic: 0x0000000000000000
[06/15/2022-05:43:27] [V] [TRT] *************** Autotuning format combination: Float(98,49:32,7,1) -> Float(98,1:32,1,1) ***************
[06/15/2022-05:43:27] [V] [TRT] --------------- Timing Runner: Transpose-7 + Reshape-7 + reshape_before_MatMul-9 (Shuffle)
[06/15/2022-05:43:27] [V] [TRT] Tactic: 0x0000000000000000 Time: 0.00270456
[06/15/2022-05:43:27] [V] [TRT] Tactic: 0x0000000000000001 Time: 0.0446903
[06/15/2022-05:43:27] [V] [TRT] Fastest Tactic: 0x0000000000000000 Time: 0.00270456
[06/15/2022-05:43:27] [V] [TRT] >>>>>>>>>>>>>>> Chose Runner Type: Shuffle Tactic: 0x0000000000000000
[06/15/2022-05:43:27] [V] [TRT] *************** Autotuning format combination: Half(3136,49,7,1) -> Half(3136,1,1,1) ***************
[06/15/2022-05:43:27] [V] [TRT] --------------- Timing Runner: Transpose-7 + Reshape-7 + reshape_before_MatMul-9 (Shuffle)
[06/15/2022-05:43:27] [V] [TRT] Tactic: 0x0000000000000000 Time: 0.00257592
[06/15/2022-05:43:27] [V] [TRT] Tactic: 0x0000000000000001 Time: 0.0108042
[06/15/2022-05:43:27] [V] [TRT] Fastest Tactic: 0x0000000000000000 Time: 0.00257592
[06/15/2022-05:43:27] [V] [TRT] >>>>>>>>>>>>>>> Chose Runner Type: Shuffle Tactic: 0x0000000000000000
[06/15/2022-05:43:27] [V] [TRT] =============== Computing costs for 
[06/15/2022-05:43:27] [V] [TRT] *************** Autotuning format combination: Float(3136,1,1,1) -> Float(1024,1,1,1) ***************
[06/15/2022-05:43:27] [V] [TRT] --------------- Timing Runner: MatMul-9 + ReLU-11 (CudaDepthwiseConvolution)
[06/15/2022-05:43:27] [V] [TRT] CudaDepthwiseConvolution has no valid tactics for this config, skipping
[06/15/2022-05:43:27] [V] [TRT] --------------- Timing Runner: MatMul-9 + ReLU-11 (FusedConvActConvolution)
[06/15/2022-05:43:27] [V] [TRT] FusedConvActConvolution has no valid tactics for this config, skipping
[06/15/2022-05:43:27] [V] [TRT] --------------- Timing Runner: MatMul-9 + ReLU-11 (CudnnConvolution)
[06/15/2022-05:43:27] [V] [TRT] Tactic: 0x0000000000000000 Time: 0.311589
[06/15/2022-05:43:27] [V] [TRT] Tactic: 0x0000000000000001 Time: 0.265655
[06/15/2022-05:43:27] [V] [TRT] Tactic: 0x0000000000000002 Time: 0.366885
[06/15/2022-05:43:27] [V] [TRT] Tactic: 0x0000000000000004 skipped. Scratch requested: 7527202816, available: 1073741824
[06/15/2022-05:43:28] [V] [TRT] Tactic: 0x0000000000000005 Time: 6.0691
[06/15/2022-05:43:28] [I] [TRT] Some tactics do not have sufficient workspace memory to run. Increasing workspace size will enable more tactics, please check verbose output for requested sizes.
[06/15/2022-05:43:28] [V] [TRT] Fastest Tactic: 0x0000000000000001 Time: 0.265655
[06/15/2022-05:43:28] [V] [TRT] Setting workspace to 7527202816enables more tactics for profiling
[06/15/2022-05:43:28] [V] [TRT] --------------- Timing Runner: MatMul-9 + ReLU-11 (CublasConvolution)
[06/15/2022-05:43:28] [V] [TRT] Tactic: 0x0000000000000000 Time: 0.0680716
[06/15/2022-05:43:28] [V] [TRT] Tactic: 0x0000000000000001 Time: 0.0682179
[06/15/2022-05:43:28] [V] [TRT] Fastest Tactic: 0x0000000000000000 Time: 0.0680716
[06/15/2022-05:43:28] [V] [TRT] --------------- Timing Runner: MatMul-9 + ReLU-11 (CaskConvolution)
[06/15/2022-05:43:28] [V] [TRT] MatMul-9 + ReLU-11 Set Tactic Name: maxwell_scudnn_128x32_relu_medium_nn_v1 Tactic: 0x0ebe499388e08286
[06/15/2022-05:43:28] [V] [TRT] Tactic: 0x0ebe499388e08286 Time: 0.378002
[06/15/2022-05:43:28] [V] [TRT] MatMul-9 + ReLU-11 Set Tactic Name: maxwell_scudnn_128x32_relu_interior_nn_v0 Tactic: 0x1792ed6b0f1ea883
[06/15/2022-05:43:28] [V] [TRT] Tactic: 0x1792ed6b0f1ea883 Time: 0.372882
[06/15/2022-05:43:28] [V] [TRT] MatMul-9 + ReLU-11 Set Tactic Name: maxwell_scudnn_128x128_relu_medium_nn_v1 Tactic: 0x3e787008e11a6129
[06/15/2022-05:43:28] [V] [TRT] Tactic: 0x3e787008e11a6129 Time: 0.414427
[06/15/2022-05:43:28] [V] [TRT] MatMul-9 + ReLU-11 Set Tactic Name: maxwell_scudnn_128x64_relu_small_nn_v1 Tactic: 0x474c9edd1ecfbbba
[06/15/2022-05:43:28] [V] [TRT] Tactic: 0x474c9edd1ecfbbba Time: 0.319634
[06/15/2022-05:43:28] [V] [TRT] MatMul-9 + ReLU-11 Set Tactic Name: maxwell_scudnn_128x128_relu_small_nn_v0 Tactic: 0x4963fb96b4067e81
[06/15/2022-05:43:28] [V] [TRT] Tactic: 0x4963fb96b4067e81 Time: 0.384
[06/15/2022-05:43:28] [V] [TRT] MatMul-9 + ReLU-11 Set Tactic Name: maxwell_scudnn_128x128_relu_interior_nn_v1 Tactic: 0x49ecad9da64c487b
[06/15/2022-05:43:28] [V] [TRT] Tactic: 0x49ecad9da64c487b Time: 0.40448
[06/15/2022-05:43:28] [V] [TRT] MatMul-9 + ReLU-11 Set Tactic Name: maxwell_scudnn_128x64_relu_interior_nn_v0 Tactic: 0x4c5584586319b832
[06/15/2022-05:43:28] [V] [TRT] Tactic: 0x4c5584586319b832 Time: 0.36469
[06/15/2022-05:43:28] [V] [TRT] MatMul-9 + ReLU-11 Set Tactic Name: maxwell_scudnn_128x64_relu_medium_nn_v1 Tactic: 0x5c38385751ccb068
[06/15/2022-05:43:28] [V] [TRT] Tactic: 0x5c38385751ccb068 Time: 0.326949
[06/15/2022-05:43:28] [V] [TRT] MatMul-9 + ReLU-11 Set Tactic Name: maxwell_scudnn_128x32_relu_small_nn_v0 Tactic: 0x632674f65e3422ae
[06/15/2022-05:43:28] [V] [TRT] Tactic: 0x632674f65e3422ae Time: 0.37493
[06/15/2022-05:43:28] [V] [TRT] MatMul-9 + ReLU-11 Set Tactic Name: maxwell_scudnn_128x128_relu_medium_nn_v0 Tactic: 0x8d563cb6e2bd3e46
[06/15/2022-05:43:28] [V] [TRT] Tactic: 0x8d563cb6e2bd3e46 Time: 0.375954
[06/15/2022-05:43:28] [V] [TRT] MatMul-9 + ReLU-11 Set Tactic Name: maxwell_scudnn_128x32_relu_interior_nn_v1 Tactic: 0xa4bca1d50cb9f7ec
[06/15/2022-05:43:28] [V] [TRT] Tactic: 0xa4bca1d50cb9f7ec Time: 0.328558
[06/15/2022-05:43:28] [V] [TRT] MatMul-9 + ReLU-11 Set Tactic Name: maxwell_scudnn_128x32_relu_medium_nn_v0 Tactic: 0xbd90052d8b47dde9
[06/15/2022-05:43:28] [V] [TRT] Tactic: 0xbd90052d8b47dde9 Time: 0.355182
[06/15/2022-05:43:28] [V] [TRT] MatMul-9 + ReLU-11 Set Tactic Name: maxwell_scudnn_128x32_relu_small_nn_v1 Tactic: 0xd00838485d937dc1
[06/15/2022-05:43:28] [V] [TRT] Tactic: 0xd00838485d937dc1 Time: 0.338798
[06/15/2022-05:43:28] [V] [TRT] MatMul-9 + ReLU-11 Set Tactic Name: maxwell_scudnn_128x64_relu_medium_nn_v0 Tactic: 0xef1674e9526bef07
[06/15/2022-05:43:28] [V] [TRT] Tactic: 0xef1674e9526bef07 Time: 0.379173
[06/15/2022-05:43:28] [V] [TRT] MatMul-9 + ReLU-11 Set Tactic Name: maxwell_scudnn_128x64_relu_small_nn_v0 Tactic: 0xf462d2631d68e4d5
[06/15/2022-05:43:28] [V] [TRT] Tactic: 0xf462d2631d68e4d5 Time: 0.370249
[06/15/2022-05:43:28] [V] [TRT] MatMul-9 + ReLU-11 Set Tactic Name: maxwell_scudnn_128x128_relu_small_nn_v1 Tactic: 0xfa4db728b7a121ee
[06/15/2022-05:43:28] [V] [TRT] Tactic: 0xfa4db728b7a121ee Time: 0.403749
[06/15/2022-05:43:28] [V] [TRT] MatMul-9 + ReLU-11 Set Tactic Name: maxwell_scudnn_128x128_relu_interior_nn_v0 Tactic: 0xfac2e123a5eb1714
[06/15/2022-05:43:28] [V] [TRT] Tactic: 0xfac2e123a5eb1714 Time: 0.427154
[06/15/2022-05:43:28] [V] [TRT] MatMul-9 + ReLU-11 Set Tactic Name: maxwell_scudnn_128x64_relu_interior_nn_v1 Tactic: 0xff7bc8e660bee75d
[06/15/2022-05:43:28] [V] [TRT] Tactic: 0xff7bc8e660bee75d Time: 0.314953
[06/15/2022-05:43:28] [V] [TRT] Fastest Tactic: 0xff7bc8e660bee75d Time: 0.314953
[06/15/2022-05:43:28] [V] [TRT] >>>>>>>>>>>>>>> Chose Runner Type: CublasConvolution Tactic: 0x0000000000000000
[06/15/2022-05:43:28] [V] [TRT] *************** Autotuning format combination: Float(3136,1,3136,3136) -> Float(1024,1,1024,1024) ***************
[06/15/2022-05:43:28] [V] [TRT] --------------- Timing Runner: MatMul-9 + ReLU-11 (CublasConvolution)
[06/15/2022-05:43:28] [V] [TRT] CublasConvolution has no valid tactics for this config, skipping
[06/15/2022-05:43:28] [V] [TRT] --------------- Timing Runner: MatMul-9 + ReLU-11 (CaskConvolution)
[06/15/2022-05:43:28] [V] [TRT] MatMul-9 + ReLU-11 Set Tactic Name: maxwell_scudnn_128x64_sliced1x2_ldg4_relu_exp_interior_nhwc_tn_v1 Tactic: 0x35f071de80e3b3c4
[06/15/2022-05:43:28] [V] [TRT] Tactic: 0x35f071de80e3b3c4 Time: 0.186953
[06/15/2022-05:43:28] [V] [TRT] MatMul-9 + ReLU-11 Set Tactic Name: maxwell_scudnn_128x32_sliced1x4_ldg4_relu_exp_interior_nhwc_tn_v1 Tactic: 0x5c024b37b78e77c0
[06/15/2022-05:43:28] [V] [TRT] Tactic: 0x5c024b37b78e77c0 Time: 0.140069
[06/15/2022-05:43:28] [V] [TRT] MatMul-9 + ReLU-11 Set Tactic Name: maxwell_scudnn_128x32_sliced1x4_ldg4_relu_exp_small_nhwc_tn_v1 Tactic: 0x80f932c0b8ce5940
[06/15/2022-05:43:28] [V] [TRT] Tactic: 0x80f932c0b8ce5940 Time: 0.141751
[06/15/2022-05:43:28] [V] [TRT] MatMul-9 + ReLU-11 Set Tactic Name: maxwell_scudnn_128x64_sliced1x2_ldg4_relu_exp_small_nhwc_tn_v1 Tactic: 0x9961ac24fc07a1df
[06/15/2022-05:43:28] [V] [TRT] Tactic: 0x9961ac24fc07a1df Time: 0.187538
[06/15/2022-05:43:28] [V] [TRT] Fastest Tactic: 0x5c024b37b78e77c0 Time: 0.140069
[06/15/2022-05:43:28] [V] [TRT] >>>>>>>>>>>>>>> Chose Runner Type: CaskConvolution Tactic: 0x5c024b37b78e77c0
[06/15/2022-05:43:28] [V] [TRT] *************** Autotuning format combination: Half(3136,1,1,1) -> Half(1024,1,1,1) ***************
[06/15/2022-05:43:28] [V] [TRT] --------------- Timing Runner: MatMul-9 + ReLU-11 (CudnnConvolution)
[06/15/2022-05:43:28] [V] [TRT] Tactic: 0x0000000000000000 Time: 0.347867
[06/15/2022-05:43:28] [V] [TRT] Tactic: 0x0000000000000001 Time: 0.189586
[06/15/2022-05:43:28] [V] [TRT] Tactic: 0x0000000000000002 Time: 0.267557
[06/15/2022-05:43:28] [V] [TRT] Tactic: 0x0000000000000004 skipped. Scratch requested: 7527202816, available: 1073741824
[06/15/2022-05:43:28] [V] [TRT] Tactic: 0x0000000000000005 Time: 6.12659
[06/15/2022-05:43:28] [V] [TRT] Fastest Tactic: 0x0000000000000001 Time: 0.189586
[06/15/2022-05:43:28] [V] [TRT] Setting workspace to 7527202816enables more tactics for profiling
[06/15/2022-05:43:28] [V] [TRT] --------------- Timing Runner: MatMul-9 + ReLU-11 (CublasConvolution)
[06/15/2022-05:43:28] [V] [TRT] CublasConvolution has no valid tactics for this config, skipping
[06/15/2022-05:43:28] [V] [TRT] --------------- Timing Runner: MatMul-9 + ReLU-11 (CaskConvolution)
[06/15/2022-05:43:28] [V] [TRT] CaskConvolution has no valid tactics for this config, skipping
[06/15/2022-05:43:28] [V] [TRT] >>>>>>>>>>>>>>> Chose Runner Type: CudnnConvolution Tactic: 0x0000000000000001
[06/15/2022-05:43:28] [V] [TRT] =============== Computing costs for 
[06/15/2022-05:43:28] [V] [TRT] *************** Autotuning format combination: Float(1024,1,1,1) -> Float(10,1,1,1) ***************
[06/15/2022-05:43:28] [V] [TRT] --------------- Timing Runner: MatMul-12 (CudaDepthwiseConvolution)
[06/15/2022-05:43:28] [V] [TRT] CudaDepthwiseConvolution has no valid tactics for this config, skipping
[06/15/2022-05:43:28] [V] [TRT] --------------- Timing Runner: MatMul-12 (FusedConvActConvolution)
[06/15/2022-05:43:28] [V] [TRT] FusedConvActConvolution has no valid tactics for this config, skipping
[06/15/2022-05:43:28] [V] [TRT] --------------- Timing Runner: MatMul-12 (CudnnConvolution)
[06/15/2022-05:43:28] [V] [TRT] Tactic: 0x0000000000000000 Time: 0.065731
[06/15/2022-05:43:28] [V] [TRT] Tactic: 0x0000000000000001 Time: 0.00818387
[06/15/2022-05:43:28] [V] [TRT] Tactic: 0x0000000000000002 Time: 0.315685
[06/15/2022-05:43:28] [V] [TRT] Tactic: 0x0000000000000004 Time: 0.369518
[06/15/2022-05:43:28] [V] [TRT] Tactic: 0x0000000000000005 Time: 0.111616
[06/15/2022-05:43:28] [V] [TRT] Fastest Tactic: 0x0000000000000001 Time: 0.00818387
[06/15/2022-05:43:28] [V] [TRT] --------------- Timing Runner: MatMul-12 (CublasConvolution)
[06/15/2022-05:43:28] [V] [TRT] Tactic: 0x0000000000000000 Time: 0.00879328
[06/15/2022-05:43:28] [V] [TRT] Tactic: 0x0000000000000001 Time: 0.0106162
[06/15/2022-05:43:28] [V] [TRT] Fastest Tactic: 0x0000000000000000 Time: 0.00879328
[06/15/2022-05:43:28] [V] [TRT] --------------- Timing Runner: MatMul-12 (CaskConvolution)
[06/15/2022-05:43:28] [V] [TRT] MatMul-12 Set Tactic Name: maxwell_scudnn_128x32_relu_medium_nn_v1 Tactic: 0x0ebe499388e08286
[06/15/2022-05:43:28] [V] [TRT] Tactic: 0x0ebe499388e08286 Time: 0.0866743
[06/15/2022-05:43:28] [V] [TRT] MatMul-12 Set Tactic Name: maxwell_scudnn_128x32_relu_interior_nn_v0 Tactic: 0x1792ed6b0f1ea883
[06/15/2022-05:43:28] [V] [TRT] Tactic: 0x1792ed6b0f1ea883 Time: 0.0617326
[06/15/2022-05:43:28] [V] [TRT] MatMul-12 Set Tactic Name: maxwell_scudnn_128x128_relu_medium_nn_v1 Tactic: 0x3e787008e11a6129
[06/15/2022-05:43:28] [V] [TRT] Tactic: 0x3e787008e11a6129 Time: 0.0955246
[06/15/2022-05:43:28] [V] [TRT] MatMul-12 Set Tactic Name: maxwell_scudnn_128x64_relu_small_nn_v1 Tactic: 0x474c9edd1ecfbbba
[06/15/2022-05:43:28] [V] [TRT] Tactic: 0x474c9edd1ecfbbba Time: 0.063293
[06/15/2022-05:43:28] [V] [TRT] MatMul-12 Set Tactic Name: maxwell_scudnn_128x128_relu_small_nn_v0 Tactic: 0x4963fb96b4067e81
[06/15/2022-05:43:28] [V] [TRT] Tactic: 0x4963fb96b4067e81 Time: 0.0923063
[06/15/2022-05:43:28] [V] [TRT] MatMul-12 Set Tactic Name: maxwell_scudnn_128x128_relu_interior_nn_v1 Tactic: 0x49ecad9da64c487b
[06/15/2022-05:43:28] [V] [TRT] Tactic: 0x49ecad9da64c487b Time: 0.0920137
[06/15/2022-05:43:28] [V] [TRT] MatMul-12 Set Tactic Name: maxwell_scudnn_128x64_relu_interior_nn_v0 Tactic: 0x4c5584586319b832
[06/15/2022-05:43:28] [V] [TRT] Tactic: 0x4c5584586319b832 Time: 0.0787749
[06/15/2022-05:43:28] [V] [TRT] MatMul-12 Set Tactic Name: maxwell_scudnn_128x64_relu_medium_nn_v1 Tactic: 0x5c38385751ccb068
