cookbook/07-Tool/trtexec/result-02.log
[04/24/2026-02:25:25] [V] [TRT] *************** Autotuning format combination: Float(784,784,28,1) -> Float(25088,784,28,1) ***************
[04/24/2026-02:25:25] [V] [TRT] --------------- Timing Runner: node_conv2d + node_relu (CaskConvolution[0x80000009])
[04/24/2026-02:25:25] [V] [TRT] Tactic Name: ampere_scudnn_128x128_relu_medium_nn_v1 Tactic: 0xf067e6205da31c2e Time: 0.0084964
[04/24/2026-02:25:25] [V] [TRT] Tactic Name: ampere_scudnn_128x32_relu_small_nn_v1 Tactic: 0xa8609adc4e0ceb90 Time: 0.00695271
[04/24/2026-02:25:25] [V] [TRT] Tactic Name: ampere_scudnn_128x64_relu_medium_nn_v1 Tactic: 0xf64396b97c889179 Time: 0.00758809
[04/24/2026-02:25:25] [V] [TRT] Tactic Name: sm70_xmma_fprop_implicit_gemm_f32f32_f32f32_f32_nchwkcrs_nchw_tilesize64x64x8_stage1_warpsize1x4x1_g1_ffma_aligna4_alignc4 Tactic: 0xe40b38338a3a7d7e Time: 0.0043351
[04/24/2026-02:25:25] [V] [TRT] Tactic Name: sm70_xmma_fprop_implicit_gemm_f32f32_f32f32_f32_nchwkcrs_nchw_tilesize32x32x8_stage1_warpsize1x2x1_g1_ffma_aligna4_alignc4 Tactic: 0xf7a98be0a08d77c4 Time: 0.00407428
[04/24/2026-02:25:25] [V] [TRT] Tactic Name: sm70_xmma_fprop_implicit_gemm_f32f32_f32f32_f32_nchwkcrs_nchw_tilesize64x128x8_stage1_warpsize1x4x1_g1_ffma_aligna4_alignc4 Tactic: 0xd1338f4b38d341e2 Time: 0.00519135
[04/24/2026-02:25:25] [V] [TRT] Tactic Name: sm80_xmma_fprop_implicit_gemm_f32f32_f32f32_f32_nchwkcrs_nchw_tilesize64x128x8_stage3_warpsize1x4x1_g1_ffma_aligna4_alignc4 Tactic: 0x5aa723e0481da855 Time: 0.0053352
[04/24/2026-02:25:25] [V] [TRT] Tactic Name: sm80_xmma_fprop_implicit_gemm_f32f32_f32f32_f32_nchwkcrs_nchw_tilesize256x128x8_stage3_warpsize4x2x1_g1_ffma_aligna4_alignc4 Tactic: 0xbb8c3889c7eacd30 Time: 0.0114142
[04/24/2026-02:25:25] [V] [TRT] Tactic Name: sm70_xmma_fprop_implicit_gemm_indexed_f32f32_f32f32_f32_nchwkcrs_nchw_tilesize128x16x8_stage1_warpsize4x1x1_g1_ffma_aligna4_alignc4 Tactic: 0x65d82d184f452332 Time: 0.00483276
[04/24/2026-02:25:25] [V] [TRT] Tactic Name: sm70_xmma_fprop_implicit_gemm_indexed_f32f32_f32f32_f32_nchwkcrs_nchw_tilesize32x32x8_stage1_warpsize1x2x1_g1_ffma_aligna4_alignc4 Tactic: 0x9efed776051c0873 Time: 0.00446643
[04/24/2026-02:25:25] [V] [TRT] Tactic Name: sm70_xmma_fprop_implicit_gemm_indexed_f32f32_f32f32_f32_nchwkcrs_nchw_tilesize128x32x8_stage1_warpsize2x2x1_g1_ffma_aligna4_alignc4 Tactic: 0x8c4f6360145d6a1f Time: 0.0052338
[04/24/2026-02:25:25] [V] [TRT] Tactic Name: sm70_xmma_fprop_implicit_gemm_indexed_f32f32_f32f32_f32_nchwkcrs_nchw_tilesize64x64x8_stage1_warpsize1x4x1_g1_ffma_aligna4_alignc4 Tactic: 0x8d5c64a52fab02c9 Time: 0.00445908
[04/24/2026-02:25:25] [V] [TRT] Tactic Name: sm80_xmma_fprop_implicit_gemm_indexed_f32f32_f32f32_f32_nchwkcrs_nchw_tilesize128x64x8_stage2_warpsize4x1x1_g1_ffma_aligna4_alignc4_beta0_packed_stride Tactic: 0x1673e3594ce11cea Time: 0.00639543
[04/24/2026-02:25:25] [V] [TRT] Tactic Name: sm80_xmma_fprop_implicit_gemm_indexed_f32f32_f32f32_f32_nchwkcrs_nchw_tilesize128x16x8_stage3_warpsize4x1x1_g1_ffma_aligna4_alignc4 Tactic: 0x40a12e3938221818 Time: 0.00489173
[04/24/2026-02:25:25] [V] [TRT] Tactic Name: sm80_xmma_fprop_implicit_gemm_indexed_f32f32_f32f32_f32_nchwkcrs_nchw_tilesize128x32x8_stage3_warpsize2x2x1_g1_ffma_aligna4_alignc4 Tactic: 0xa9366041633a5135 Time: 0.0052351
[04/24/2026-02:25:25] [V] [TRT] Tactic Name: sm80_xmma_fprop_implicit_gemm_f32f32_f32f32_f32_nchwkcrs_nchw_tilesize32x32x8_stage3_warpsize1x2x1_g1_ffma_t1r5s5_aligna4_alignc4 Tactic: 0x5b8bf1b8028629d9 Time: 0.00403784
[04/24/2026-02:25:25] [V] [TRT] Tactic Name: sm70_xmma_fprop_implicit_gemm_f32f32_f32f32_f32_nchwkcrs_nchw_tilesize32x32x8_stage1_warpsize1x2x1_g1_ffma_t1r5s5_aligna4_alignc4 Tactic: 0x7e1e4d26cfa285f9 Time: 0.00409731
[04/24/2026-02:25:25] [V] [TRT] Tactic Name: ampere_scudnn_128x64_relu_small_nn_v1 Tactic: 0x3f243c490d502deb Time: 0.00709072
[04/24/2026-02:25:25] [V] [TRT] Tactic Name: sm70_xmma_fprop_implicit_gemm_f32f32_f32f32_f32_nchwkcrs_nchw_tilesize128x16x8_stage1_warpsize4x1x1_g1_ffma_aligna4_alignc4 Tactic: 0x160b77f4a95ab6d3 Time: 0.00441475
[04/24/2026-02:25:25] [V] [TRT] Tactic Name: sm70_xmma_fprop_implicit_gemm_f32f32_f32f32_f32_nchwkcrs_nchw_tilesize128x64x8_stage1_warpsize2x2x1_g1_ffma_aligna4_alignc4 Tactic: 0x994f5b723e2d80da Time: 0.00553899
[04/24/2026-02:25:25] [V] [TRT] Tactic Name: sm80_xmma_fprop_implicit_gemm_f32f32_f32f32_f32_nchwkcrs_nchw_tilesize64x64x8_stage3_warpsize1x4x1_g1_ffma_aligna4_alignc4 Tactic: 0xa31d27de74b895ff Time: 0.00432417
[04/24/2026-02:25:25] [V] [TRT] Tactic Name: sm80_xmma_fprop_implicit_gemm_f32f32_f32f32_f32_nchwkcrs_nchw_tilesize32x32x8_stage3_warpsize1x2x1_g1_ffma_aligna4_alignc4 Tactic: 0xb0bf940d5e0f9f45 Time: 0.00413153
[04/24/2026-02:25:25] [V] [TRT] Tactic Name: ampere_scudnn_128x64_relu_xregs_large_nn_v1 Tactic: 0x5deb29b7a8e275f7 Time: 0.00743131
[04/24/2026-02:25:25] [V] [TRT] Tactic Name: sm70_xmma_fprop_implicit_gemm_f32f32_f32f32_f32_nchwkcrs_nchw_tilesize64x64x8_stage1_warpsize1x4x1_g1_ffma_t1r5s5_aligna4_alignc4 Tactic: 0xb3ea28771604ad88 Time: 0.00431207
[04/24/2026-02:25:25] [V] [TRT] Tactic Name: sm80_xmma_fprop_implicit_gemm_f32f32_f32f32_f32_nchwkcrs_nchw_tilesize128x16x8_stage3_warpsize4x1x1_g1_ffma_aligna4_alignc4 Tactic: 0x9d9fdb5fd9945f64 Time: 0.00429163
[04/24/2026-02:25:25] [V] [TRT] Tactic Name: sm80_xmma_fprop_implicit_gemm_indexed_f32f32_f32f32_f32_nchwkcrs_nchw_tilesize64x64x8_stage3_warpsize1x4x1_g1_ffma_aligna4_alignc4 Tactic: 0xd828f024626fa982 Time: 0.00445049
[04/24/2026-02:25:25] [V] [TRT] Tactic Name: sm80_xmma_fprop_implicit_gemm_f32f32_f32f32_f32_nchwkcrs_nchw_tilesize128x64x8_stage3_warpsize2x2x1_g1_ffma_aligna4_alignc4 Tactic: 0x12dbf7d94ee3696d Time: 0.00557908
[04/24/2026-02:25:25] [V] [TRT] Tactic Name: sm80_xmma_fprop_implicit_gemm_f32f32_f32f32_f32_nchwkcrs_nchw_tilesize64x64x8_stage3_warpsize1x4x1_g1_ffma_t1r5s5_aligna4_alignc4 Tactic: 0x967f94e9db2001a8 Time: 0.00425855
[04/24/2026-02:25:25] [V] [TRT] Tactic Name: sm80_xmma_fprop_implicit_gemm_indexed_f32f32_f32f32_f32_nchwkcrs_nchw_tilesize32x32x8_stage3_warpsize1x2x1_g1_ffma_aligna4_alignc4 Tactic: 0xcb8a43f748d8a338 Time: 0.00426003
[04/24/2026-02:25:25] [V] [TRT] Tactic Name: sm70_xmma_fprop_implicit_gemm_f32f32_f32f32_f32_nchwkcrs_nchw_tilesize128x256x8_stage1_warpsize2x4x1_g1_ffma_aligna4_alignc4 Tactic: 0xd2aa21bfe2167c0c Time: 0.0106527
[04/24/2026-02:25:25] [V] [TRT] Tactic Name: ampere_scudnn_128x128_relu_small_nn_v1 Tactic: 0x503619c69ae500ff Time: 0.0081313
[04/24/2026-02:25:25] [V] [TRT] Tactic Name: sm80_xmma_fprop_implicit_gemm_indexed_f32f32_f32f32_f32_nchwkcrs_nchw_tilesize128x64x8_stage2_warpsize1x4x1_g1_ffma_aligna4_alignc4_beta0_packed_stride Tactic: 0xede36641840ce3d2 Time: 0.00586167
[04/24/2026-02:25:25] [V] [TRT] Tactic Name: sm70_xmma_fprop_implicit_gemm_f32f32_f32f32_f32_nchwkcrs_nchw_tilesize128x128x8_stage1_warpsize2x2x1_g1_ffma_aligna4_alignc4 Tactic: 0xac49795b871b0d29 Time: 0.0084999
[04/24/2026-02:25:25] [V] [TRT] Tactic Name: sm80_xmma_fprop_implicit_gemm_indexed_f32f32_f32f32_f32_nchwkcrs_nchw_tilesize128x64x8_stage2_warpsize2x2x1_g1_ffma_aligna4_alignc4_beta0_packed_stride Tactic: 0x31aa67f57c5aea77 Time: 0.00593646
[04/24/2026-02:25:25] [V] [TRT] node_conv2d + node_relu (CaskConvolution[0x80000009]) profiling completed in 0.145044 seconds. Fastest Tactic: 0x5b8bf1b8028629d9 Time: 0.00403784
[04/24/2026-02:25:25] [V] [TRT] Skipping CaskFlattenConvolution: No valid tactics for node_conv2d + node_relu
[04/24/2026-02:25:25] [V] [TRT] >>>>>>>>>>>>>>> Chose Runner Type: CaskConvolution Tactic: 0x5b8bf1b8028629d9
[04/24/2026-02:25:25] [V] [TRT] *************** Autotuning format combination: Float(784,1,28,1) -> Float(25088,1,896,32) ***************
[04/24/2026-02:25:25] [V] [TRT] --------------- Timing Runner: node_conv2d + node_relu (CaskConvolution[0x80000009])
[04/24/2026-02:25:25] [V] [TRT] Tactic Name: sm70_xmma_fprop_implicit_gemm_f32f32_f32f32_f32_nhwckrsc_nhwc_tilesize64x32x32_stage1_warpsize1x1x1_g1_ffma_t1r5s5_aligna4_alignc4 Tactic: 0x737793996edbf8e2 Time: 0.105399
[04/24/2026-02:25:25] [V] [TRT] Tactic Name: sm80_xmma_fprop_implicit_gemm_f32f32_f32f32_f32_nhwckrsc_nhwc_tilesize64x64x8_stage3_warpsize1x4x1_g1_ffma_t1r5s5_aligna4_alignc4 Tactic: 0x45ff0c3a09b02e78 Time: 0.00863839
[04/24/2026-02:25:25] [V] [TRT] Tactic Name: sm80_xmma_fprop_implicit_gemm_f32f32_f32f32_f32_nhwckrsc_nhwc_tilesize128x64x8_stage3_warpsize2x2x1_g1_ffma_aligna4_alignc4 Tactic: 0x1da91d865428f237 Time: 0.0133261
[04/24/2026-02:25:25] [V] [TRT] Tactic Name: sm70_xmma_fprop_implicit_gemm_indexed_f32f32_f32f32_f32_nhwckrsc_nhwc_tilesize32x32x8_stage1_warpsize1x2x1_g1_ffma_aligna4_alignc4 Tactic: 0x5f60af66e8eb9b51 Time: 0.00907171
[04/24/2026-02:25:25] [V] [TRT] Tactic Name: sm70_xmma_fprop_implicit_gemm_indexed_f32f32_f32f32_f32_nhwckrsc_nhwc_tilesize128x32x8_stage1_warpsize2x2x1_g1_ffma_aligna4_alignc4 Tactic: 0x833d893f0e96f145 Time: 0.0106233
[04/24/2026-02:25:25] [V] [TRT] Tactic Name: sm70_xmma_fprop_implicit_gemm_f32f32_f32f32_f32_nhwckrsc_nhwc_tilesize64x16x16_stage1_warpsize1x1x1_g1_ffma_t1r5s5_aligna4_alignc4 Tactic: 0x247bb0dcaf6f9760 Time: 0.0171251
[04/24/2026-02:25:25] [V] [TRT] Tactic Name: sm80_xmma_fprop_implicit_gemm_indexed_f32f32_f32f32_f32_nhwckrsc_nhwc_tilesize128x16x8_stage3_warpsize4x1x1_g1_ffma_aligna4_alignc4 Tactic: 0x4fd3c46622e98342 Time: 0.0102344
[04/24/2026-02:25:25] [V] [TRT] Tactic Name: sm80_xmma_fprop_implicit_gemm_f32f32_f32f32_f32_nhwckrsc_nhwc_tilesize32x32x8_stage3_warpsize1x2x1_g1_ffma_t1r5s5_aligna4_alignc4 Tactic: 0x880b696bd0160609 Time: 0.00638112
[04/24/2026-02:25:25] [V] [TRT] Tactic Name: sm70_xmma_fprop_implicit_gemm_f32f32_f32f32_f32_nhwckrsc_nhwc_tilesize128x16x8_stage1_warpsize4x1x1_g1_ffma_aligna4_alignc4 Tactic: 0x19799dabb3912d89 Time: 0.00939114
[04/24/2026-02:25:25] [V] [TRT] Tactic Name: sm70_xmma_fprop_implicit_gemm_f32f32_f32f32_f32_nhwckrsc_nhwc_tilesize64x128x8_stage1_warpsize1x4x1_g1_ffma_aligna4_alignc4 Tactic: 0xde4165142218dab8 Time: 0.0125882
[04/24/2026-02:25:25] [V] [TRT] Tactic Name: sm70_xmma_fprop_implicit_gemm_f32f32_f32f32_f32_nhwckrsc_nhwc_tilesize128x64x8_stage1_warpsize2x2x1_g1_ffma_aligna4_alignc4 Tactic: 0x963db12d24e61b80 Time: 0.0128491
[04/24/2026-02:25:25] [V] [TRT] Tactic Name: sm80_xmma_fprop_implicit_gemm_indexed_f32f32_f32f32_f32_nhwckrsc_nhwc_tilesize128x32x8_stage3_warpsize2x2x1_g1_ffma_aligna4_alignc4 Tactic: 0xa6448a1e79f1ca6f Time: 0.00980785
[04/24/2026-02:25:25] [V] [TRT] Tactic Name: sm80_xmma_fprop_implicit_gemm_f32f32_f32f32_f32_nhwckrsc_nhwc_tilesize128x16x8_stage3_warpsize4x1x1_g1_ffma_t1r5s5_aligna4_alignc4 Tactic: 0xe35d4a4a3b499fe7 Time: 0.00737257
[04/24/2026-02:25:25] [V] [TRT] Tactic Name: sm80_xmma_fprop_implicit_gemm_indexed_f32f32_f32f32_f32_nhwckrsc_nhwc_tilesize64x64x8_stage3_warpsize1x4x1_g1_ffma_aligna4_alignc4 Tactic: 0x19b688348f983aa0 Time: 0.00907514
[04/24/2026-02:25:25] [V] [TRT] Tactic Name: sm80_xmma_fprop_implicit_gemm_f32f32_f32f32_f32_nhwckrsc_nhwc_tilesize256x64x8_stage3_warpsize2x2x1_g1_ffma_aligna4_alignc4 Tactic: 0x8014228ec08b4d49 Time: 0.0236304
[04/24/2026-02:25:25] [V] [TRT] Tactic Name: sm70_xmma_fprop_implicit_gemm_f32f32_f32f32_f32_nhwckrsc_nhwc_tilesize128x16x8_stage1_warpsize4x1x1_g1_ffma_t1r5s5_aligna4_alignc4 Tactic: 0x54e3b8c9b1e5f17a Time: 0.00916314
[04/24/2026-02:25:25] [V] [TRT] Tactic Name: sm70_xmma_fprop_implicit_gemm_indexed_f32f32_f32f32_f32_nhwckrsc_nhwc_tilesize128x16x8_stage1_warpsize4x1x1_g1_ffma_aligna4_alignc4 Tactic: 0x6aaac747558eb868 Time: 0.0100614
[04/24/2026-02:25:25] [V] [TRT] Tactic Name: sm70_xmma_fprop_implicit_gemm_f32f32_f32f32_f32_nhwckrsc_nhwc_tilesize32x32x8_stage1_warpsize1x2x1_g1_ffma_aligna4_alignc4 Tactic: 0x3637f3f04d7ae4e6 Time: 0.00940029
[04/24/2026-02:25:25] [V] [TRT] Tactic Name: sm70_xmma_fprop_implicit_gemm_f32f32_f32f32_f32_nhwckrsc_nhwc_tilesize64x32x32_stage1_warpsize1x1x1_g1_ffma_aligna4_alignc4 Tactic: 0xdb73e25ae4006f74 Time: 0.104375
[04/24/2026-02:25:25] [V] [TRT] Tactic Name: sm70_xmma_fprop_implicit_gemm_f32f32_f32f32_f32_nhwckrsc_nhwc_tilesize64x64x8_stage1_warpsize1x4x1_g1_ffma_aligna4_alignc4 Tactic: 0x2595402367cdee5c Time: 0.00944857
[04/24/2026-02:25:25] [V] [TRT] Tactic Name: sm80_xmma_fprop_implicit_gemm_f32f32_f32f32_f32_nhwckrsc_nhwc_tilesize128x16x8_stage3_warpsize4x1x1_g1_ffma_aligna4_alignc4 Tactic: 0x92ed3100c35fc43e Time: 0.00756283
[04/24/2026-02:25:25] [V] [TRT] Tactic Name: sm80_xmma_fprop_implicit_gemm_f32f32_f32f32_f32_nhwckrsc_nhwc_tilesize64x64x8_stage3_warpsize1x4x1_g1_ffma_aligna4_alignc4 Tactic: 0x62835fce994f06dd Time: 0.00891644
[04/24/2026-02:25:25] [V] [TRT] Tactic Name: sm70_xmma_fprop_implicit_gemm_f32f32_f32f32_f32_nhwckrsc_nhwc_tilesize32x32x8_stage1_warpsize1x2x1_g1_ffma_t1r5s5_aligna4_alignc4 Tactic: 0xad9ed5f51d32aa29 Time: 0.00885217
[04/24/2026-02:25:25] [V] [TRT] Tactic Name: sm70_xmma_fprop_implicit_gemm_f32f32_f32f32_f32_nhwckrsc_nhwc_tilesize64x16x16_stage1_warpsize1x1x1_g1_ffma_aligna4_alignc4 Tactic: 0x3f904b355d9ca8e6 Time: 0.0173577
[04/24/2026-02:25:25] [V] [TRT] Tactic Name: sm80_xmma_fprop_implicit_gemm_indexed_f32f32_f32f32_f32_nhwckrsc_nhwc_tilesize32x32x8_stage3_warpsize1x2x1_g1_ffma_aligna4_alignc4 Tactic: 0x0a143be7a52f301a Time: 0.00705284
[04/24/2026-02:25:25] [V] [TRT] Tactic Name: sm80_xmma_fprop_implicit_gemm_f32f32_f32f32_f32_nhwckrsc_nhwc_tilesize32x32x8_stage3_warpsize1x2x1_g1_ffma_aligna4_alignc4 Tactic: 0x7121ec1db3f80c67 Time: 0.00654026
[04/24/2026-02:25:25] [V] [TRT] Tactic Name: sm70_xmma_fprop_implicit_gemm_f32f32_f32f32_f32_nhwckrsc_nhwc_tilesize256x128x8_stage1_warpsize2x4x1_g1_ffma_aligna4_alignc4 Tactic: 0x0447933cc2be855a Time: 0.0330578
[04/24/2026-02:25:25] [V] [TRT] node_conv2d + node_relu (CaskConvolution[0x80000009]) profiling completed in 0.0685855 seconds. Fastest Tactic: 0x880b696bd0160609 Time: 0.00638112
[04/24/2026-02:25:25] [V] [TRT] Skipping CaskFlattenConvolution: No valid tactics for node_conv2d + node_relu
[04/24/2026-02:25:25] [V] [TRT] >>>>>>>>>>>>>>> Chose Runner Type: CaskConvolution Tactic: 0x880b696bd0160609
[04/24/2026-02:25:25] [V] [TRT] *************** Autotuning format combination: Float(784,1:4,28,1) -> Float(25088,784,28,1) ***************
[04/24/2026-02:25:25] [V] [TRT] Skipping CaskConvolution: No valid tactics for node_conv2d + node_relu
[04/24/2026-02:25:25] [V] [TRT] Skipping CaskFlattenConvolution: No valid tactics for node_conv2d + node_relu
[04/24/2026-02:25:25] [V] [TRT] *************** Autotuning format combination: Float(784,1:4,28,1) -> Float(6272,1:4,224,8) ***************
[04/24/2026-02:25:25] [V] [TRT] --------------- Timing Runner: node_conv2d + node_relu (CaskConvolution[0x80000009])
[04/24/2026-02:25:25] [V] [TRT] Tactic Name: ampere_scudnn_128x32_sliced1x4_ldg4_relu_exp_small_nhwc_tn_v1 Tactic: 0x3e2b881168d9689d Time: 0.0234893
[04/24/2026-02:25:25] [V] [TRT] Tactic Name: ampere_scudnn_128x128_ldg4_relu_exp_medium_nhwc_tn_v1 Tactic: 0x7bc32c782b800c48 Time: 0.0205009
[04/24/2026-02:25:25] [V] [TRT] Tactic Name: ampere_scudnn_128x128_ldg4_relu_exp_small_nhwc_tn_v1 Tactic: 0xf90060ce8193b811 Time: 0.0202366
[04/24/2026-02:25:25] [V] [TRT] Tactic Name: ampere_scudnn_128x64_sliced1x2_ldg4_relu_exp_large_nhwc_tn_v1 Tactic: 0xbdfdef6b84f7ccc9 Time: 0.0230309
[04/24/2026-02:25:25] [V] [TRT] node_conv2d + node_relu (CaskConvolution[0x80000009]) profiling completed in 0.0113475 seconds. Fastest Tactic: 0xf90060ce8193b811 Time: 0.0202366
[04/24/2026-02:25:25] [V] [TRT] Skipping CaskFlattenConvolution: No valid tactics for node_conv2d + node_relu
[04/24/2026-02:25:25] [V] [TRT] >>>>>>>>>>>>>>> Chose Runner Type: CaskConvolution Tactic: 0xf90060ce8193b811
[04/24/2026-02:25:25] [V] [TRT] *************** Autotuning format combination: Half(784,784,28,1) -> Half(25088,784,28,1) ***************
[04/24/2026-02:25:25] [V] [TRT] Skipping CaskConvolution: No valid tactics for node_conv2d + node_relu
[04/24/2026-02:25:25] [V] [TRT] Skipping CaskFlattenConvolution: No valid tactics for node_conv2d + node_relu
[04/24/2026-02:25:25] [V] [TRT] *************** Autotuning format combination: Half(784,1:2,28,1) -> Half(12544,1:2,448,16) ***************
[04/24/2026-02:25:25] [V] [TRT] --------------- Timing Runner: node_conv2d + node_relu (CaskConvolution[0x80000009])
[04/24/2026-02:25:25] [V] [TRT] Tactic Name: sm80_xmma_fprop_implicit_gemm_indexed_wo_smem_f16f16_f16f16_f16_nhwckrsc_nhwc_tilesize128x32x16_stage1_warpsize4x1x1_g1_tensor16x8x16_aligna4_alignc4 Tactic: 0x72c5a15b17fc333a Time: 0.00393847
[04/24/2026-02:25:25] [V] [TRT] Tactic Name: sm80_xmma_fprop_implicit_gemm_indexed_wo_smem_f16f16_f16f16_f16_nhwckrsc_nhwc_tilesize128x16x32_stage1_warpsize4x1x1_g1_tensor16x8x16_aligna4_alignc2 Tactic: 0x90e2d6b4ee50185b Time: 0.00375607
[04/24/2026-02:25:25] [V] [TRT] Tactic Name: sm75_xmma_fprop_implicit_gemm_indexed_wo_smem_f16f16_f16f16_f16_nhwckrsc_nhwc_tilesize128x16x32_stage1_warpsize4x1x1_g1_tensor16x8x8_aligna2_alignc2 Tactic: 0xc93552e3e587bd46 Time: 0.00446757
[04/24/2026-02:25:25] [V] [TRT] Tactic Name: sm80_xmma_fprop_implicit_gemm_indexed_wo_smem_f16f16_f16f16_f16_nhwckrsc_nhwc_tilesize128x16x64_stage1_warpsize4x1x1_g1_tensor16x8x16_aligna2_alignc2 Tactic: 0xdc0e0882e8ef55d1 Time: 0.00455914
[04/24/2026-02:25:25] [V] [TRT] Tactic Name: sm80_xmma_fprop_implicit_gemm_indexed_wo_smem_f16f16_f16f16_f16_nhwckrsc_nhwc_tilesize128x16x32_stage1_warpsize4x1x1_g1_tensor16x8x16_aligna4_alignc4 Tactic: 0x1fb62367b99fe633 Time: 0.00338318
[04/24/2026-02:25:25] [V] [TRT] Tactic Name: sm80_xmma_fprop_implicit_gemm_indexed_wo_smem_f16f16_f16f16_f16_nhwckrsc_nhwc_tilesize128x16x32_stage1_warpsize4x1x1_g1_tensor16x8x16_aligna2_alignc2 Tactic: 0x5b51065cd94604da Time: 0.00449371
[04/24/2026-02:25:25] [V] [TRT] Tactic Name: sm75_xmma_fprop_implicit_gemm_indexed_wo_smem_f16f16_f16f16_f16_nhwckrsc_nhwc_tilesize128x16x64_stage1_warpsize4x1x1_g1_tensor16x8x8_aligna4_alignc2 Tactic: 0x63b3bbe281646f72 Time: 0.00384974
[04/24/2026-02:25:25] [V] [TRT] Tactic Name: sm80_xmma_fprop_implicit_gemm_indexed_wo_smem_f16f16_f16f16_f16_nhwckrsc_nhwc_tilesize128x16x32_stage1_warpsize4x1x1_g1_tensor16x8x16_aligna2_alignc4 Tactic: 0xd405f38f8e89fab2 Time: 0.00432175
[04/24/2026-02:25:25] [V] [TRT] Tactic Name: sm75_xmma_fprop_implicit_gemm_indexed_wo_smem_f16f16_f16f16_f16_nhwckrsc_nhwc_tilesize128x16x32_stage1_warpsize4x1x1_g1_tensor16x8x8_aligna4_alignc2 Tactic: 0x0286820bd291a1c7 Time: 0.00401422
[04/24/2026-02:25:25] [V] [TRT] Tactic Name: sm80_xmma_fprop_implicit_gemm_indexed_wo_smem_f16f16_f16f16_f16_nhwckrsc_nhwc_tilesize128x32x16_stage1_warpsize4x1x1_g1_tensor16x8x16_aligna4_alignc2 Tactic: 0xfd9154884033cd52 Time: 0.00434396
[04/24/2026-02:25:25] [V] [TRT] Tactic Name: sm75_xmma_fprop_implicit_gemm_indexed_wo_smem_f16f16_f16f16_f16_nhwckrsc_nhwc_tilesize128x16x32_stage1_warpsize4x1x1_g1_tensor16x8x8_aligna4_alignc4 Tactic: 0x8dd277d8855e5faf Time: 0.00338201
[04/24/2026-02:25:25] [V] [TRT] Tactic Name: sm75_xmma_fprop_implicit_gemm_indexed_wo_smem_f16f16_f16f16_f16_nhwckrsc_nhwc_tilesize128x32x16_stage1_warpsize4x1x1_g1_tensor16x8x8_aligna2_alignc4 Tactic: 0x7bdecad1884e5858 Time: 0.00523984
[04/24/2026-02:25:25] [V] [TRT] Tactic Name: sm75_xmma_fprop_implicit_gemm_indexed_wo_smem_f16f16_f16f16_f16_nhwckrsc_nhwc_tilesize128x32x64_stage1_warpsize4x1x1_g1_tensor16x8x8_aligna4_alignc2 Tactic: 0x5bb428c4b317876b Time: 0.00404165
[04/24/2026-02:25:25] [V] [TRT] Tactic Name: sm80_xmma_fprop_implicit_gemm_indexed_wo_smem_f16f16_f16f16_f16_nhwckrsc_nhwc_tilesize128x32x64_stage1_warpsize4x1x1_g1_tensor16x8x16_aligna2_alignc4 Tactic: 0x6a76904d34985d11 Time: 0.00451229
[04/24/2026-02:25:25] [V] [TRT] Tactic Name: sm80_xmma_fprop_implicit_gemm_indexed_wo_smem_f16f16_f16f16_f16_nhwckrsc_nhwc_tilesize128x32x16_stage1_warpsize4x1x1_g1_tensor16x8x16_aligna2_alignc4 Tactic: 0xb97671b320ea2fbb Time: 0.00502069
[04/24/2026-02:25:25] [V] [TRT] Tactic Name: sm75_xmma_fprop_implicit_gemm_indexed_wo_smem_f16f16_f16f16_f16_nhwckrsc_nhwc_tilesize128x32x16_stage1_warpsize4x1x1_g1_tensor16x8x8_aligna2_alignc2 Tactic: 0xf48a3f02df81a630 Time: 0.00573221
[04/24/2026-02:25:25] [V] [TRT] Tactic Name: sm80_xmma_fprop_implicit_gemm_indexed_wo_smem_f16f16_f16f16_f16_nhwckrsc_nhwc_tilesize128x32x64_stage1_warpsize4x1x1_g1_tensor16x8x16_aligna2_alignc2 Tactic: 0xe522659e6357a379 Time: 0.00473895
[04/24/2026-02:25:25] [V] [TRT] Tactic Name: sm75_xmma_fprop_implicit_gemm_indexed_wo_smem_f16f16_f16f16_f16_nhwckrsc_nhwc_tilesize128x32x16_stage1_warpsize4x1x1_g1_tensor16x8x8_aligna4_alignc4 Tactic: 0xb06d1a39bf5844d9 Time: 0.00428477
[04/24/2026-02:25:25] [V] [TRT] Tactic Name: sm75_xmma_fprop_implicit_gemm_indexed_wo_smem_f16f16_f16f16_f16_nhwckrsc_nhwc_tilesize128x32x16_stage1_warpsize4x1x1_g1_tensor16x8x8_aligna4_alignc2 Tactic: 0x3f39efeae897bab1 Time: 0.00428679
[04/24/2026-02:25:25] [V] [TRT] Tactic Name: sm75_xmma_fprop_implicit_gemm_indexed_wo_smem_f16f16_f16f16_f16_nhwckrsc_nhwc_tilesize128x32x64_stage1_warpsize4x1x1_g1_tensor16x8x8_aligna4_alignc4 Tactic: 0xd4e0dd17e4d87903 Time: 0.0036868
[04/24/2026-02:25:25] [V] [TRT] Tactic Name: sm80_xmma_fprop_implicit_gemm_indexed_wo_smem_f16f16_f16f16_f16_nhwckrsc_nhwc_tilesize128x16x64_stage1_warpsize4x1x1_g1_tensor16x8x16_aligna4_alignc4 Tactic: 0x98e92db98836b738 Time: 0.00323535
[04/24/2026-02:25:25] [V] [TRT] Tactic Name: sm80_xmma_fprop_implicit_gemm_indexed_wo_smem_f16f16_f16f16_f16_nhwckrsc_nhwc_tilesize128x32x16_stage1_warpsize4x1x1_g1_tensor16x8x16_aligna2_alignc2 Tactic: 0x362284607725d1d3 Time: 0.00545405
[04/24/2026-02:25:25] [V] [TRT] Tactic Name: sm75_xmma_fprop_implicit_gemm_indexed_wo_smem_f16f16_f16f16_f16_nhwckrsc_nhwc_tilesize128x16x64_stage1_warpsize4x1x1_g1_tensor16x8x8_aligna2_alignc4 Tactic: 0x27549ed9e1bd8d9b Time: 0.00432565
[04/24/2026-02:25:25] [V] [TRT] Tactic Name: sm75_xmma_fprop_implicit_gemm_indexed_wo_smem_f16f16_f16f16_f16_nhwckrsc_nhwc_tilesize128x32x64_stage1_warpsize4x1x1_g1_tensor16x8x8_aligna2_alignc2 Tactic: 0x9007f82c84019bea Time: 0.00470076
[04/24/2026-02:25:25] [V] [TRT] Tactic Name: sm80_xmma_fprop_implicit_gemm_indexed_wo_smem_f16f16_f16f16_f16_nhwckrsc_nhwc_tilesize128x32x64_stage1_warpsize4x1x1_g1_tensor16x8x16_aligna4_alignc2 Tactic: 0x2e91b5765441bff8 Time: 0.00396936
[04/24/2026-02:25:25] [V] [TRT] Tactic Name: sm75_xmma_fprop_implicit_gemm_indexed_wo_smem_f16f16_f16f16_f16_nhwckrsc_nhwc_tilesize128x32x64_stage1_warpsize4x1x1_g1_tensor16x8x8_aligna2_alignc4 Tactic: 0x1f530dffd3ce6582 Time: 0.00449643
[04/24/2026-02:25:25] [V] [TRT] Tactic Name: sm80_xmma_fprop_implicit_gemm_indexed_wo_smem_f16f16_f16f16_f16_nhwckrsc_nhwc_tilesize128x16x64_stage1_warpsize4x1x1_g1_tensor16x8x16_aligna2_alignc4 Tactic: 0x535afd51bf20abb9 Time: 0.00439841
[04/24/2026-02:25:25] [V] [TRT] Tactic Name: sm80_xmma_fprop_implicit_gemm_indexed_wo_smem_f16f16_f16f16_f16_nhwckrsc_nhwc_tilesize128x16x64_stage1_warpsize4x1x1_g1_tensor16x8x16_aligna4_alignc2 Tactic: 0x17bdd86adff94950 Time: 0.00398235
[04/24/2026-02:25:25] [V] [TRT] Tactic Name: sm75_xmma_fprop_implicit_gemm_indexed_wo_smem_f16f16_f16f16_f16_nhwckrsc_nhwc_tilesize128x16x64_stage1_warpsize4x1x1_g1_tensor16x8x8_aligna2_alignc2 Tactic: 0xa8006b0ab67273f3 Time: 0.00453814
[04/24/2026-02:25:25] [V] [TRT] Tactic Name: sm75_xmma_fprop_implicit_gemm_indexed_wo_smem_f16f16_f16f16_f16_nhwckrsc_nhwc_tilesize128x16x64_stage1_warpsize4x1x1_g1_tensor16x8x8_aligna4_alignc4 Tactic: 0xece74e31d6ab911a Time: 0.00408215
[04/24/2026-02:25:25] [V] [TRT] Tactic Name: sm75_xmma_fprop_implicit_gemm_indexed_wo_smem_f16f16_f16f16_f16_nhwckrsc_nhwc_tilesize128x16x32_stage1_warpsize4x1x1_g1_tensor16x8x8_aligna2_alignc4 Tactic: 0x4661a730b248432e Time: 0.00436571
[04/24/2026-02:25:25] [V] [TRT] Tactic Name: sm80_xmma_fprop_implicit_gemm_indexed_wo_smem_f16f16_f16f16_f16_nhwckrsc_nhwc_tilesize128x32x64_stage1_warpsize4x1x1_g1_tensor16x8x16_aligna4_alignc4 Tactic: 0xa1c540a5038e4190 Time: 0.00374646
[04/24/2026-02:25:25] [V] [TRT] node_conv2d + node_relu (CaskConvolution[0x80000009]) profiling completed in 0.0832474 seconds. Fastest Tactic: 0x98e92db98836b738 Time: 0.00323535
[04/24/2026-02:25:25] [V] [TRT] Skipping CaskFlattenConvolution: No valid tactics for node_conv2d + node_relu
[04/24/2026-02:25:25] [V] [TRT] >>>>>>>>>>>>>>> Chose Runner Type: CaskConvolution Tactic: 0x98e92db98836b738
[04/24/2026-02:25:25] [V] [TRT] *************** Autotuning format combination: Half(784,1:4,28,1) -> Half(6272,1:4,224,8) ***************
[04/24/2026-02:25:25] [V] [TRT] Skipping CaskConvolution: No valid tactics for node_conv2d + node_relu
[04/24/2026-02:25:25] [V] [TRT] Skipping CaskFlattenConvolution: No valid tactics for node_conv2d + node_relu
[04/24/2026-02:25:25] [V] [TRT] *************** Autotuning format combination: Half(784,1:4,28,1) -> Half(3136,1:8,112,4) ***************
[04/24/2026-02:25:25] [V] [TRT] --------------- Timing Runner: node_conv2d + node_relu (CaskConvolution[0x80000009])
[04/24/2026-02:25:25] [V] [TRT] Tactic Name: sm80_xmma_fprop_implicit_gemm_indexed_wo_smem_f16f16_f16f16_f16_nhwckrsc_nhwc_tilesize128x32x16_stage1_warpsize4x1x1_g1_tensor16x8x16_aligna4_alignc4 Tactic: 0x72c5a15b17fc333a Time: 0.00505427
[04/24/2026-02:25:25] [V] [TRT] Tactic Name: sm80_xmma_fprop_implicit_gemm_indexed_wo_smem_f16f16_f16f16_f16_nhwckrsc_nhwc_tilesize128x32x16_stage1_warpsize4x1x1_g1_tensor16x8x16_aligna2_alignc8 Tactic: 0x3507353e207bcdee Time: 0.00705763
[04/24/2026-02:25:25] [V] [TRT] Tactic Name: sm75_xmma_fprop_implicit_gemm_indexed_wo_smem_f16f16_f16f16_f16_nhwckrsc_nhwc_tilesize128x16x32_stage1_warpsize4x1x1_g1_tensor16x8x8_aligna8_alignc2 Tactic: 0x07398cf013b38640 Time: 0.00444343
[04/24/2026-02:25:25] [V] [TRT] Tactic Name: sm80_xmma_fprop_implicit_gemm_indexed_wo_smem_f16f16_f16f16_f16_nhwckrsc_nhwc_tilesize128x16x32_stage1_warpsize4x1x1_g1_tensor16x8x16_aligna4_alignc2 Tactic: 0x90e2d6b4ee50185b Time: 0.00489128
[04/24/2026-02:25:25] [V] [TRT] Tactic Name: sm75_xmma_fprop_implicit_gemm_indexed_wo_smem_f16f16_f16f16_f16_nhwckrsc_nhwc_tilesize128x16x32_stage1_warpsize4x1x1_g1_tensor16x8x8_aligna2_alignc8 Tactic: 0xca10e3bdb2d9a17b Time: 0.00643001
[04/24/2026-02:25:25] [V] [TRT] Tactic Name: sm75_xmma_fprop_implicit_gemm_indexed_wo_smem_f16f16_f16f16_f16_nhwckrsc_nhwc_tilesize128x16x32_stage1_warpsize4x1x1_g1_tensor16x8x8_aligna2_alignc2 Tactic: 0xc93552e3e587bd46 Time: 0.00612324
[04/24/2026-02:25:25] [V] [TRT] Tactic Name: sm80_xmma_fprop_implicit_gemm_indexed_wo_smem_f16f16_f16f16_f16_nhwckrsc_nhwc_tilesize128x16x64_stage1_warpsize4x1x1_g1_tensor16x8x16_aligna8_alignc2 Tactic: 0x1202d6911edb6ed7 Time: 0.0042482
[04/24/2026-02:25:25] [V] [TRT] Tactic Name: sm80_xmma_fprop_implicit_gemm_indexed_wo_smem_f16f16_f16f16_f16_nhwckrsc_nhwc_tilesize128x16x64_stage1_warpsize4x1x1_g1_tensor16x8x16_aligna4_alignc8 Tactic: 0x1498693488a7556d Time: 0.00394489
[04/24/2026-02:25:25] [V] [TRT] Tactic Name: sm80_xmma_fprop_implicit_gemm_indexed_wo_smem_f16f16_f16f16_f16_nhwckrsc_nhwc_tilesize128x16x64_stage1_warpsize4x1x1_g1_tensor16x8x16_aligna2_alignc2 Tactic: 0xdc0e0882e8ef55d1 Time: 0.006496
[04/24/2026-02:25:25] [V] [TRT] Tactic Name: sm75_xmma_fprop_implicit_gemm_indexed_wo_smem_f16f16_f16f16_f16_nhwckrsc_nhwc_tilesize128x16x64_stage1_warpsize4x1x1_g1_tensor16x8x8_aligna2_alignc8 Tactic: 0xab25da54e12c6fce Time: 0.00674223
[04/24/2026-02:25:25] [V] [TRT] Tactic Name: sm75_xmma_fprop_implicit_gemm_indexed_wo_smem_f16f16_f16f16_f16_nhwckrsc_nhwc_tilesize128x32x64_stage1_warpsize4x1x1_g1_tensor16x8x8_aligna8_alignc4 Tactic: 0xd15fd3ec25fa5e84 Time: 0.00515657
[04/24/2026-02:25:25] [V] [TRT] Tactic Name: sm80_xmma_fprop_implicit_gemm_indexed_wo_smem_f16f16_f16f16_f16_nhwckrsc_nhwc_tilesize128x16x32_stage1_warpsize4x1x1_g1_tensor16x8x16_aligna4_alignc4 Tactic: 0x1fb62367b99fe633 Time: 0.00419748
[04/24/2026-02:25:25] [V] [TRT] Tactic Name: sm75_xmma_fprop_implicit_gemm_indexed_wo_smem_f16f16_f16f16_f16_nhwckrsc_nhwc_tilesize128x32x16_stage1_warpsize4x1x1_g1_tensor16x8x8_aligna8_alignc8 Tactic: 0x39a3504f7eeb810b Time: 0.00634673
[04/24/2026-02:25:25] [V] [TRT] Tactic Name: sm80_xmma_fprop_implicit_gemm_indexed_wo_smem_f16f16_f16f16_f16_nhwckrsc_nhwc_tilesize128x32x64_stage1_warpsize4x1x1_g1_tensor16x8x16_aligna8_alignc4 Tactic: 0xa47a4e5ec2ac6617 Time: 0.00411298
[04/24/2026-02:25:25] [V] [TRT] Tactic Name: sm80_xmma_fprop_implicit_gemm_indexed_wo_smem_f16f16_f16f16_f16_nhwckrsc_nhwc_tilesize128x32x64_stage1_warpsize4x1x1_g1_tensor16x8x16_aligna4_alignc8 Tactic: 0x2db40428031fa3c5 Time: 0.00494203
[04/24/2026-02:25:25] [V] [TRT] Tactic Name: sm80_xmma_fprop_implicit_gemm_indexed_wo_smem_f16f16_f16f16_f16_nhwckrsc_nhwc_tilesize128x16x32_stage1_warpsize4x1x1_g1_tensor16x8x16_aligna2_alignc2 Tactic: 0x5b51065cd94604da Time: 0.00633262
[04/24/2026-02:25:25] [V] [TRT] Tactic Name: sm75_xmma_fprop_implicit_gemm_indexed_wo_smem_f16f16_f16f16_f16_nhwckrsc_nhwc_tilesize128x16x32_stage1_warpsize4x1x1_g1_tensor16x8x8_aligna8_alignc8 Tactic: 0x041c3dae44ed9a7d Time: 0.00413531
[04/24/2026-02:25:25] [V] [TRT] Tactic Name: sm75_xmma_fprop_implicit_gemm_indexed_wo_smem_f16f16_f16f16_f16_nhwckrsc_nhwc_tilesize128x16x64_stage1_warpsize4x1x1_g1_tensor16x8x8_aligna4_alignc8 Tactic: 0x60960abcd63a734f Time: 0.00399708
[04/24/2026-02:25:25] [V] [TRT] Tactic Name: sm75_xmma_fprop_implicit_gemm_indexed_wo_smem_f16f16_f16f16_f16_nhwckrsc_nhwc_tilesize128x16x64_stage1_warpsize4x1x1_g1_tensor16x8x8_aligna4_alignc2 Tactic: 0x63b3bbe281646f72 Time: 0.00506609
[04/24/2026-02:25:25] [V] [TRT] Tactic Name: sm80_xmma_fprop_implicit_gemm_indexed_wo_smem_f16f16_f16f16_f16_nhwckrsc_nhwc_tilesize128x16x32_stage1_warpsize4x1x1_g1_tensor16x8x16_aligna2_alignc4 Tactic: 0xd405f38f8e89fab2 Time: 0.00614209
[04/24/2026-02:25:25] [V] [TRT] Tactic Name: sm75_xmma_fprop_implicit_gemm_indexed_wo_smem_f16f16_f16f16_f16_nhwckrsc_nhwc_tilesize128x16x32_stage1_warpsize4x1x1_g1_tensor16x8x8_aligna4_alignc2 Tactic: 0x0286820bd291a1c7 Time: 0.00542476
[04/24/2026-02:25:25] [V] [TRT] Tactic Name: sm80_xmma_fprop_implicit_gemm_indexed_wo_smem_f16f16_f16f16_f16_nhwckrsc_nhwc_tilesize128x32x16_stage1_warpsize4x1x1_g1_tensor16x8x16_aligna4_alignc2 Tactic: 0xfd9154884033cd52 Time: 0.0053032
[04/24/2026-02:25:25] [V] [TRT] Tactic Name: sm80_xmma_fprop_implicit_gemm_indexed_wo_smem_f16f16_f16f16_f16_nhwckrsc_nhwc_tilesize128x32x16_stage1_warpsize4x1x1_g1_tensor16x8x16_aligna8_alignc4 Tactic: 0x777aafa0d6de14bd Time: 0.004832
[04/24/2026-02:25:25] [V] [TRT] Tactic Name: sm75_xmma_fprop_implicit_gemm_indexed_wo_smem_f16f16_f16f16_f16_nhwckrsc_nhwc_tilesize128x16x32_stage1_warpsize4x1x1_g1_tensor16x8x8_aligna4_alignc4 Tactic: 0x8dd277d8855e5faf Time: 0.00429096
[04/24/2026-02:25:25] [V] [TRT] Tactic Name: sm80_xmma_fprop_implicit_gemm_indexed_wo_smem_f16f16_f16f16_f16_nhwckrsc_nhwc_tilesize128x16x32_stage1_warpsize4x1x1_g1_tensor16x8x16_aligna8_alignc4 Tactic: 0x1a092d9c78bdc1b4 Time: 0.00420679
[04/24/2026-02:25:25] [V] [TRT] Tactic Name: sm75_xmma_fprop_implicit_gemm_indexed_wo_smem_f16f16_f16f16_f16_nhwckrsc_nhwc_tilesize128x32x16_stage1_warpsize4x1x1_g1_tensor16x8x8_aligna2_alignc4 Tactic: 0x7bdecad1884e5858 Time: 0.00734628
[04/24/2026-02:25:25] [V] [TRT] Tactic Name: sm75_xmma_fprop_implicit_gemm_indexed_wo_smem_f16f16_f16f16_f16_nhwckrsc_nhwc_tilesize128x32x64_stage1_warpsize4x1x1_g1_tensor16x8x8_aligna4_alignc8 Tactic: 0x5891999ae4499b56 Time: 0.00521322
[04/24/2026-02:25:25] [V] [TRT] Tactic Name: sm75_xmma_fprop_implicit_gemm_indexed_wo_smem_f16f16_f16f16_f16_nhwckrsc_nhwc_tilesize128x32x64_stage1_warpsize4x1x1_g1_tensor16x8x8_aligna4_alignc2 Tactic: 0x5bb428c4b317876b Time: 0.00499988
[04/24/2026-02:25:25] [V] [TRT] Tactic Name: sm80_xmma_fprop_implicit_gemm_indexed_wo_smem_f16f16_f16f16_f16_nhwckrsc_nhwc_tilesize128x32x64_stage1_warpsize4x1x1_g1_tensor16x8x16_aligna2_alignc4 Tactic: 0x6a76904d34985d11 Time: 0.00636104
[04/24/2026-02:25:25] [V] [TRT] Tactic Name: sm80_xmma_fprop_implicit_gemm_indexed_wo_smem_f16f16_f16f16_f16_nhwckrsc_nhwc_tilesize128x16x32_stage1_warpsize4x1x1_g1_tensor16x8x16_aligna8_alignc8 Tactic: 0x96786911782c23e1 Time: 0.00420219
[04/24/2026-02:25:25] [V] [TRT] Tactic Name: sm80_xmma_fprop_implicit_gemm_indexed_wo_smem_f16f16_f16f16_f16_nhwckrsc_nhwc_tilesize128x16x32_stage1_warpsize4x1x1_g1_tensor16x8x16_aligna4_alignc8 Tactic: 0x93c767eab90e0466 Time: 0.00423744
[04/24/2026-02:25:25] [V] [TRT] Tactic Name: sm80_xmma_fprop_implicit_gemm_indexed_wo_smem_f16f16_f16f16_f16_nhwckrsc_nhwc_tilesize128x32x16_stage1_warpsize4x1x1_g1_tensor16x8x16_aligna2_alignc4 Tactic: 0xb97671b320ea2fbb Time: 0.00731337
[04/24/2026-02:25:25] [V] [TRT] Tactic Name: sm75_xmma_fprop_implicit_gemm_indexed_wo_smem_f16f16_f16f16_f16_nhwckrsc_nhwc_tilesize128x32x16_stage1_warpsize4x1x1_g1_tensor16x8x8_aligna2_alignc2 Tactic: 0xf48a3f02df81a630 Time: 0.00790713
[04/24/2026-02:25:25] [V] [TRT] Tactic Name: sm75_xmma_fprop_implicit_gemm_indexed_wo_smem_f16f16_f16f16_f16_nhwckrsc_nhwc_tilesize128x16x32_stage1_warpsize4x1x1_g1_tensor16x8x8_aligna8_alignc4 Tactic: 0x886d7923447c7828 Time: 0.00415739
[04/24/2026-02:25:25] [V] [TRT] Tactic Name: sm75_xmma_fprop_implicit_gemm_indexed_wo_smem_f16f16_f16f16_f16_nhwckrsc_nhwc_tilesize128x32x64_stage1_warpsize4x1x1_g1_tensor16x8x8_aligna2_alignc8 Tactic: 0x93224972d35f87d7 Time: 0.00597562
[04/24/2026-02:25:25] [V] [TRT] Tactic Name: sm75_xmma_fprop_implicit_gemm_indexed_wo_smem_f16f16_f16f16_f16_nhwckrsc_nhwc_tilesize128x32x16_stage1_warpsize4x1x1_g1_tensor16x8x8_aligna8_alignc2 Tactic: 0x3a86e11129b59d36 Time: 0.00748137
[04/24/2026-02:25:25] [V] [TRT] Tactic Name: sm75_xmma_fprop_implicit_gemm_indexed_wo_smem_f16f16_f16f16_f16_nhwckrsc_nhwc_tilesize128x32x16_stage1_warpsize4x1x1_g1_tensor16x8x8_aligna2_alignc8 Tactic: 0xf7af8e5c88dfba0d Time: 0.0071262
[04/24/2026-02:25:25] [V] [TRT] Tactic Name: sm80_xmma_fprop_implicit_gemm_indexed_wo_smem_f16f16_f16f16_f16_nhwckrsc_nhwc_tilesize128x32x64_stage1_warpsize4x1x1_g1_tensor16x8x16_aligna8_alignc2 Tactic: 0x2b2ebb8d9563987f Time: 0.00419017
[04/24/2026-02:25:25] [V] [TRT] Tactic Name: sm80_xmma_fprop_implicit_gemm_indexed_wo_smem_f16f16_f16f16_f16_nhwckrsc_nhwc_tilesize128x32x64_stage1_warpsize4x1x1_g1_tensor16x8x16_aligna2_alignc2 Tactic: 0xe522659e6357a379 Time: 0.00656623
[04/24/2026-02:25:25] [V] [TRT] Tactic Name: sm80_xmma_fprop_implicit_gemm_indexed_wo_smem_f16f16_f16f16_f16_nhwckrsc_nhwc_tilesize128x16x64_stage1_warpsize4x1x1_g1_tensor16x8x16_aligna8_alignc8 Tactic: 0x112767cf498572ea Time: 0.00350473
[04/24/2026-02:25:25] [V] [TRT] Tactic Name: sm75_xmma_fprop_implicit_gemm_indexed_wo_smem_f16f16_f16f16_f16_nhwckrsc_nhwc_tilesize128x32x16_stage1_warpsize4x1x1_g1_tensor16x8x8_aligna4_alignc4 Tactic: 0xb06d1a39bf5844d9 Time: 0.00577134
[04/24/2026-02:25:25] [V] [TRT] Tactic Name: sm75_xmma_fprop_implicit_gemm_indexed_wo_smem_f16f16_f16f16_f16_nhwckrsc_nhwc_tilesize128x32x16_stage1_warpsize4x1x1_g1_tensor16x8x8_aligna4_alignc2 Tactic: 0x3f39efeae897bab1 Time: 0.00526775
[04/24/2026-02:25:25] [V] [TRT] Tactic Name: sm75_xmma_fprop_implicit_gemm_indexed_wo_smem_f16f16_f16f16_f16_nhwckrsc_nhwc_tilesize128x32x64_stage1_warpsize4x1x1_g1_tensor16x8x8_aligna4_alignc4 Tactic: 0xd4e0dd17e4d87903 Time: 0.00476387
[04/24/2026-02:25:25] [V] [TRT] Tactic Name: sm80_xmma_fprop_implicit_gemm_indexed_wo_smem_f16f16_f16f16_f16_nhwckrsc_nhwc_tilesize128x16x32_stage1_warpsize4x1x1_g1_tensor16x8x16_aligna8_alignc2 Tactic: 0x955dd84f2f723fdc Time: 0.00438913
[04/24/2026-02:25:25] [V] [TRT] Tactic Name: sm80_xmma_fprop_implicit_gemm_indexed_wo_smem_f16f16_f16f16_f16_nhwckrsc_nhwc_tilesize128x32x16_stage1_warpsize4x1x1_g1_tensor16x8x16_aligna8_alignc2 Tactic: 0xf82e5a738111ead5 Time: 0.00520865
[04/24/2026-02:25:25] [V] [TRT] Tactic Name: sm80_xmma_fprop_implicit_gemm_indexed_wo_smem_f16f16_f16f16_f16_nhwckrsc_nhwc_tilesize128x16x64_stage1_warpsize4x1x1_g1_tensor16x8x16_aligna4_alignc4 Tactic: 0x98e92db98836b738 Time: 0.00394292
[04/24/2026-02:25:25] [V] [TRT] Tactic Name: sm75_xmma_fprop_implicit_gemm_indexed_wo_smem_f16f16_f16f16_f16_nhwckrsc_nhwc_tilesize128x32x64_stage1_warpsize4x1x1_g1_tensor16x8x8_aligna8_alignc2 Tactic: 0x5e0b263f7235a0ec Time: 0.00468852
[04/24/2026-02:25:25] [V] [TRT] Tactic Name: sm80_xmma_fprop_implicit_gemm_indexed_wo_smem_f16f16_f16f16_f16_nhwckrsc_nhwc_tilesize128x32x16_stage1_warpsize4x1x1_g1_tensor16x8x16_aligna2_alignc2 Tactic: 0x362284607725d1d3 Time: 0.0076148
[04/24/2026-02:25:25] [V] [TRT] Tactic Name: sm80_xmma_fprop_implicit_gemm_indexed_wo_smem_f16f16_f16f16_f16_nhwckrsc_nhwc_tilesize128x32x64_stage1_warpsize4x1x1_g1_tensor16x8x16_aligna2_alignc8 Tactic: 0xe607d4c03409bf44 Time: 0.00622151
[04/24/2026-02:25:25] [V] [TRT] Tactic Name: sm80_xmma_fprop_implicit_gemm_indexed_wo_smem_f16f16_f16f16_f16_nhwckrsc_nhwc_tilesize128x16x64_stage1_warpsize4x1x1_g1_tensor16x8x16_aligna2_alignc8 Tactic: 0xdf2bb9dcbfb149ec Time: 0.00637953
[04/24/2026-02:25:25] [V] [TRT] Tactic Name: sm75_xmma_fprop_implicit_gemm_indexed_wo_smem_f16f16_f16f16_f16_nhwckrsc_nhwc_tilesize128x16x64_stage1_warpsize4x1x1_g1_tensor16x8x8_aligna2_alignc4 Tactic: 0x27549ed9e1bd8d9b Time: 0.00624576
[04/24/2026-02:25:25] [V] [TRT] Tactic Name: sm80_xmma_fprop_implicit_gemm_indexed_wo_smem_f16f16_f16f16_f16_nhwckrsc_nhwc_tilesize128x32x64_stage1_warpsize4x1x1_g1_tensor16x8x16_aligna8_alignc8 Tactic: 0x280b0ad3c23d8442 Time: 0.00412382
[04/24/2026-02:25:25] [V] [TRT] Tactic Name: sm75_xmma_fprop_implicit_gemm_indexed_wo_smem_f16f16_f16f16_f16_nhwckrsc_nhwc_tilesize128x32x64_stage1_warpsize4x1x1_g1_tensor16x8x8_aligna2_alignc2 Tactic: 0x9007f82c84019bea Time: 0.0064473
[04/24/2026-02:25:25] [V] [TRT] Tactic Name: sm75_xmma_fprop_implicit_gemm_indexed_wo_smem_f16f16_f16f16_f16_nhwckrsc_nhwc_tilesize128x16x32_stage1_warpsize4x1x1_g1_tensor16x8x8_aligna4_alignc8 Tactic: 0x01a3335585cfbdfa Time: 0.00444204
[04/24/2026-02:25:25] [V] [TRT] Tactic Name: sm75_xmma_fprop_implicit_gemm_indexed_wo_smem_f16f16_f16f16_f16_nhwckrsc_nhwc_tilesize128x32x16_stage1_warpsize4x1x1_g1_tensor16x8x8_aligna4_alignc8 Tactic: 0x3c1c5eb4bfc9a68c Time: 0.00580407
[04/24/2026-02:25:25] [V] [TRT] Tactic Name: sm80_xmma_fprop_implicit_gemm_indexed_wo_smem_f16f16_f16f16_f16_nhwckrsc_nhwc_tilesize128x16x32_stage1_warpsize4x1x1_g1_tensor16x8x16_aligna2_alignc8 Tactic: 0x5874b7028e1818e7 Time: 0.00607352
[04/24/2026-02:25:25] [V] [TRT] Tactic Name: sm80_xmma_fprop_implicit_gemm_indexed_wo_smem_f16f16_f16f16_f16_nhwckrsc_nhwc_tilesize128x32x64_stage1_warpsize4x1x1_g1_tensor16x8x16_aligna4_alignc2 Tactic: 0x2e91b5765441bff8 Time: 0.00484572
[04/24/2026-02:25:25] [V] [TRT] Tactic Name: sm75_xmma_fprop_implicit_gemm_indexed_wo_smem_f16f16_f16f16_f16_nhwckrsc_nhwc_tilesize128x32x64_stage1_warpsize4x1x1_g1_tensor16x8x8_aligna2_alignc4 Tactic: 0x1f530dffd3ce6582 Time: 0.00636005
[04/24/2026-02:25:25] [V] [TRT] Tactic Name: sm80_xmma_fprop_implicit_gemm_indexed_wo_smem_f16f16_f16f16_f16_nhwckrsc_nhwc_tilesize128x16x64_stage1_warpsize4x1x1_g1_tensor16x8x16_aligna2_alignc4 Tactic: 0x535afd51bf20abb9 Time: 0.00629784
[04/24/2026-02:25:25] [V] [TRT] Tactic Name: sm80_xmma_fprop_implicit_gemm_indexed_wo_smem_f16f16_f16f16_f16_nhwckrsc_nhwc_tilesize128x16x64_stage1_warpsize4x1x1_g1_tensor16x8x16_aligna4_alignc2 Tactic: 0x17bdd86adff94950 Time: 0.00470518
[04/24/2026-02:25:26] [V] [TRT] Tactic Name: sm75_xmma_fprop_implicit_gemm_indexed_wo_smem_f16f16_f16f16_f16_nhwckrsc_nhwc_tilesize128x16x64_stage1_warpsize4x1x1_g1_tensor16x8x8_aligna8_alignc2 Tactic: 0x660cb519404648f5 Time: 0.00390388
[04/24/2026-02:25:26] [V] [TRT] Tactic Name: sm75_xmma_fprop_implicit_gemm_indexed_wo_smem_f16f16_f16f16_f16_nhwckrsc_nhwc_tilesize128x32x16_stage1_warpsize4x1x1_g1_tensor16x8x8_aligna8_alignc4 Tactic: 0xb5d214c27e7a635e Time: 0.00694095
[04/24/2026-02:25:26] [V] [TRT] Tactic Name: sm75_xmma_fprop_implicit_gemm_indexed_wo_smem_f16f16_f16f16_f16_nhwckrsc_nhwc_tilesize128x16x64_stage1_warpsize4x1x1_g1_tensor16x8x8_aligna2_alignc2 Tactic: 0xa8006b0ab67273f3 Time: 0.00640735
[04/24/2026-02:25:26] [V] [TRT] Tactic Name: sm75_xmma_fprop_implicit_gemm_indexed_wo_smem_f16f16_f16f16_f16_nhwckrsc_nhwc_tilesize128x16x64_stage1_warpsize4x1x1_g1_tensor16x8x8_aligna8_alignc4 Tactic: 0xe95840ca1789b69d Time: 0.00367918
[04/24/2026-02:25:26] [V] [TRT] Tactic Name: sm75_xmma_fprop_implicit_gemm_indexed_wo_smem_f16f16_f16f16_f16_nhwckrsc_nhwc_tilesize128x16x64_stage1_warpsize4x1x1_g1_tensor16x8x8_aligna4_alignc4 Tactic: 0xece74e31d6ab911a Time: 0.00404406
[04/24/2026-02:25:26] [V] [TRT] Tactic Name: sm80_xmma_fprop_implicit_gemm_indexed_wo_smem_f16f16_f16f16_f16_nhwckrsc_nhwc_tilesize128x16x64_stage1_warpsize4x1x1_g1_tensor16x8x16_aligna8_alignc4 Tactic: 0x9d562342491490bf Time: 0.00402997
[04/24/2026-02:25:26] [V] [TRT] Tactic Name: sm75_xmma_fprop_implicit_gemm_indexed_wo_smem_f16f16_f16f16_f16_nhwckrsc_nhwc_tilesize128x16x32_stage1_warpsize4x1x1_g1_tensor16x8x8_aligna2_alignc4 Tactic: 0x4661a730b248432e Time: 0.00595714
[04/24/2026-02:25:26] [V] [TRT] Tactic Name: sm75_xmma_fprop_implicit_gemm_indexed_wo_smem_f16f16_f16f16_f16_nhwckrsc_nhwc_tilesize128x16x64_stage1_warpsize4x1x1_g1_tensor16x8x8_aligna8_alignc8 Tactic: 0x65290447171854c8 Time: 0.00401828
[04/24/2026-02:25:26] [V] [TRT] Tactic Name: sm75_xmma_fprop_implicit_gemm_indexed_wo_smem_f16f16_f16f16_f16_nhwckrsc_nhwc_tilesize128x32x64_stage1_warpsize4x1x1_g1_tensor16x8x8_aligna8_alignc8 Tactic: 0x5d2e9761256bbcd1 Time: 0.00559578
[04/24/2026-02:25:26] [V] [TRT] Tactic Name: sm80_xmma_fprop_implicit_gemm_indexed_wo_smem_f16f16_f16f16_f16_nhwckrsc_nhwc_tilesize128x32x64_stage1_warpsize4x1x1_g1_tensor16x8x16_aligna4_alignc4 Tactic: 0xa1c540a5038e4190 Time: 0.00492114
[04/24/2026-02:25:26] [V] [TRT] Tactic Name: sm80_xmma_fprop_implicit_gemm_indexed_wo_smem_f16f16_f16f16_f16_nhwckrsc_nhwc_tilesize128x32x16_stage1_warpsize4x1x1_g1_tensor16x8x16_aligna8_alignc8 Tactic: 0xfb0beb2dd64ff6e8 Time: 0.00477166
[04/24/2026-02:25:26] [V] [TRT] Tactic Name: sm80_xmma_fprop_implicit_gemm_indexed_wo_smem_f16f16_f16f16_f16_nhwckrsc_nhwc_tilesize128x32x16_stage1_warpsize4x1x1_g1_tensor16x8x16_aligna4_alignc8 Tactic: 0xfeb4e5d6176dd16f Time: 0.00505695
[04/24/2026-02:25:26] [V] [TRT] node_conv2d + node_relu (CaskConvolution[0x80000009]) profiling completed in 0.170857 seconds. Fastest Tactic: 0x112767cf498572ea Time: 0.00350473
[04/24/2026-02:25:26] [V] [TRT] Skipping CaskFlattenConvolution: No valid tactics for node_conv2d + node_relu
[04/24/2026-02:25:26] [V] [TRT] >>>>>>>>>>>>>>> Chose Runner Type: CaskConvolution Tactic: 0x112767cf498572ea
[04/24/2026-02:25:26] [V] [TRT] *************** Autotuning format combination: Half(784,1:8,28,1) -> Float(25088,784,28,1) ***************
[04/24/2026-02:25:26] [V] [TRT] Skipping CaskConvolution: No valid tactics for node_conv2d + node_relu
[04/24/2026-02:25:26] [V] [TRT] Skipping CaskFlattenConvolution: No valid tactics for node_conv2d + node_relu
[04/24/2026-02:25:26] [V] [TRT] *************** Autotuning format combination: Half(784,1:8,28,1) -> Half(3136,1:8,112,4) ***************
[04/24/2026-02:25:26] [V] [TRT] --------------- Timing Runner: node_conv2d + node_relu (CaskConvolution[0x80000009])
[04/24/2026-02:25:26] [V] [TRT] Tactic Name: sm80_xmma_fprop_implicit_gemm_f16f16_f16f16_f16_nhwckrsc_nhwc_tilesize256x128x32_stage3_warpsize4x2x1_g1_tensor16x8x16_t1r5s5 Tactic: 0x09e1df683041a6eb Time: 0.0236408
[04/24/2026-02:25:26] [V] [TRT] Tactic Name: sm80_xmma_fprop_implicit_gemm_indexed_f16f16_f16f16_f16_nhwckrsc_nhwc_tilesize128x256x32_stage3_warpsize2x4x1_g1_tensor16x8x16 Tactic: 0x7005d10718f6c22d Time: 0.0239909
[04/24/2026-02:25:26] [V] [TRT] Tactic Name: sm80_xmma_fprop_implicit_gemm_f16f16_f16f16_f16_nhwckrsc_nhwc_tilesize64x128x32_stage5_warpsize2x2x1_g1_tensor16x8x16 Tactic: 0xdb0b80f591d1bb6d Time: 0.00844262
[04/24/2026-02:25:26] [V] [TRT] Tactic Name: sm80_xmma_fprop_implicit_gemm_f16f16_f16f16_f16_nhwckrsc_nhwc_tilesize128x64x32_stage5_warpsize2x2x1_g1_tensor16x8x16_t1r5s5 Tactic: 0xb9d272ea28cc4e2e Time: 0.00852921
[04/24/2026-02:25:26] [V] [TRT] Tactic Name: sm80_xmma_fprop_implicit_gemm_f16f16_f16f16_f16_nhwckrsc_nhwc_tilesize128x128x32_stage4_warpsize2x2x1_g1_tensor16x8x16 Tactic: 0xdfa020ef435ef810 Time: 0.0139271
[04/24/2026-02:25:26] [V] [TRT] Tactic Name: sm80_xmma_fprop_implicit_gemm_f16f16_f16f16_f16_nhwckrsc_nhwc_tilesize128x128x64_stage3_warpsize2x2x1_g1_tensor16x8x16_t1r5s5 Tactic: 0xcdcc9faa39e6051e Time: 0.0235958
[04/24/2026-02:25:26] [V] [TRT] Tactic Name: sm80_xmma_fprop_implicit_gemm_f16f16_f16f16_f16_nhwckrsc_nhwc_tilesize128x128x64_stage3_warpsize2x2x1_g1_tensor16x8x16 Tactic: 0x57c9a5ff682354a6 Time: 0.0236918
[04/24/2026-02:25:26] [V] [TRT] Tactic Name: sm80_xmma_fprop_implicit_gemm_f16f16_f16f16_f16_nhwckrsc_nhwc_tilesize128x256x32_stage3_warpsize2x4x1_g1_tensor16x8x16 Tactic: 0xa1a20ea714d420f4 Time: 0.0236774
[04/24/2026-02:25:26] [V] [TRT] Tactic Name: sm80_xmma_fprop_implicit_gemm_f16f16_f16f16_f16_nhwckrsc_nhwc_tilesize256x32x32_stage4_warpsize4x1x1_g1_tensor16x8x16 Tactic: 0xa83b68f30462f971 Time: 0.00926743
[04/24/2026-02:25:26] [V] [TRT] Tactic Name: sm80_xmma_fprop_implicit_gemm_f16f16_f16f16_f16_nhwckrsc_nhwc_tilesize256x64x32_stage3_warpsize4x1x1_g1_tensor16x8x16_t1r5s5 Tactic: 0x5ff3f65d8d1c0627 Time: 0.0139358
[04/24/2026-02:25:26] [V] [TRT] Tactic Name: sm80_xmma_fprop_implicit_gemm_f16f16_f16f16_f16_nhwckrsc_nhwc_tilesize256x128x32_stage3_warpsize4x2x1_g1_tensor16x8x16 Tactic: 0x60da8c7151d91e47 Time: 0.023837
[04/24/2026-02:25:26] [V] [TRT] Tactic Name: sm75_xmma_fprop_implicit_gemm_f16f16_f16f16_f16_nhwckrsc_nhwc_tilesize64x128x32_stage1_warpsize2x2x1_g1_tensor16x8x8_t1r5s5 Tactic: 0xbe6b0e1b15aa4105 Time: 0.0102286
[04/24/2026-02:25:26] [V] [TRT] Tactic Name: sm75_xmma_fprop_implicit_gemm_f16f16_f16f16_f16_nhwckrsc_nhwc_tilesize64x128x32_stage1_warpsize2x2x1_g1_tensor16x8x8 Tactic: 0xd297ae2cdb8b1406 Time: 0.0101312
[04/24/2026-02:25:26] [V] [TRT] Tactic Name: sm75_xmma_fprop_implicit_gemm_f16f16_f16f16_f16_nhwckrsc_nhwc_tilesize128x64x32_stage1_warpsize2x2x1_g1_tensor16x8x8_t1r5s5 Tactic: 0x108b96eabe6d8362 Time: 0.0106798
[04/24/2026-02:25:26] [V] [TRT] Tactic Name: sm75_xmma_fprop_implicit_gemm_f16f16_f16f16_f16_nhwckrsc_nhwc_tilesize128x256x32_stage1_warpsize2x4x1_g1_tensor16x8x8_t1r5s5 Tactic: 0x4106dfcb71f6d6c0 Time: 0.025008
[04/24/2026-02:25:26] [V] [TRT] Tactic Name: sm75_xmma_fprop_implicit_gemm_f16f16_f16f16_f16_nhwckrsc_nhwc_tilesize256x64x32_stage1_warpsize4x1x1_g1_tensor16x8x8_t1r5s5 Tactic: 0x3d79bf6932f95bc3 Time: 0.0152654
[04/24/2026-02:25:26] [V] [TRT] Tactic Name: sm75_xmma_fprop_implicit_gemm_f16f16_f16f16_f16_nhwckrsc_nhwc_tilesize256x64x32_stage1_warpsize4x1x1_g1_tensor16x8x8 Tactic: 0xb7dc3705357cc965 Time: 0.0155081
[04/24/2026-02:25:26] [V] [TRT] Tactic Name: sm75_xmma_fprop_implicit_gemm_f16f16_f16f16_f16_nhwckrsc_nhwc_tilesize256x128x32_stage1_warpsize4x2x1_g1_tensor16x8x8 Tactic: 0x8d73ddfc444be692 Time: 0.0253455
[04/24/2026-02:25:26] [V] [TRT] Tactic Name: sm75_xmma_fprop_implicit_gemm_indexed_f16f16_f16f16_f16_nhwckrsc_nhwc_tilesize256x64x32_stage1_warpsize4x1x1_g1_tensor16x8x8 Tactic: 0x0e0f7f10867063ba Time: 0.0165318
[04/24/2026-02:25:26] [V] [TRT] Tactic Name: sm80_xmma_fprop_implicit_gemm_indexed_wo_smem_f16f16_f16f16_f16_nhwckrsc_nhwc_tilesize128x32x16_stage1_warpsize4x1x1_g1_tensor16x8x16_aligna4_alignc4 Tactic: 0x72c5a15b17fc333a Time: 0.00725829
[04/24/2026-02:25:26] [V] [TRT] Tactic Name: sm80_xmma_fprop_implicit_gemm_indexed_wo_smem_f16f16_f16f16_f16_nhwckrsc_nhwc_tilesize128x32x16_stage1_warpsize4x1x1_g1_tensor16x8x16_aligna2_alignc8 Tactic: 0x3507353e207bcdee Time: 0.0112394
[04/24/2026-02:25:26] [V] [TRT] Tactic Name: sm75_xmma_fprop_implicit_gemm_indexed_wo_smem_f16f16_f16f16_f16_nhwckrsc_nhwc_tilesize128x16x32_stage1_warpsize4x1x1_g1_tensor16x8x8_alignc8 Tactic: 0x69501656100171de Time: 0.0048541
[04/24/2026-02:25:26] [V] [TRT] Tactic Name: sm75_xmma_fprop_implicit_gemm_indexed_wo_smem_f16f16_f16f16_f16_nhwckrsc_nhwc_tilesize128x16x32_stage1_warpsize4x1x1_g1_tensor16x8x8_alignc2 Tactic: 0x6a75a708475f6de3 Time: 0.00512114
[04/24/2026-02:25:26] [V] [TRT] Tactic Name: sm75_xmma_fprop_implicit_gemm_indexed_wo_smem_f16f16_f16f16_f16_nhwckrsc_nhwc_tilesize128x16x32_stage1_warpsize4x1x1_g1_tensor16x8x8_aligna8_alignc2 Tactic: 0x07398cf013b38640 Time: 0.00587301
[04/24/2026-02:25:26] [V] [TRT] Tactic Name: sm80_xmma_fprop_implicit_gemm_indexed_wo_smem_f16f16_f16f16_f16_nhwckrsc_nhwc_tilesize128x16x32_stage1_warpsize4x1x1_g1_tensor16x8x16_aligna4_alignc2 Tactic: 0x90e2d6b4ee50185b Time: 0.00647652
[04/24/2026-02:25:26] [V] [TRT] Tactic Name: sm75_xmma_fprop_implicit_gemm_indexed_wo_smem_f16f16_f16f16_f16_nhwckrsc_nhwc_tilesize128x16x32_stage1_warpsize4x1x1_g1_tensor16x8x8_aligna2_alignc8 Tactic: 0xca10e3bdb2d9a17b Time: 0.00902286
[04/24/2026-02:25:26] [V] [TRT] Tactic Name: sm75_xmma_fprop_implicit_gemm_indexed_wo_smem_f16f16_f16f16_f16_nhwckrsc_nhwc_tilesize128x16x32_stage1_warpsize4x1x1_g1_tensor16x8x8_aligna2_alignc2 Tactic: 0xc93552e3e587bd46 Time: 0.00860961
[04/24/2026-02:25:26] [V] [TRT] Tactic Name: sm80_xmma_fprop_implicit_gemm_indexed_wo_smem_f16f16_f16f16_f16_nhwckrsc_nhwc_tilesize128x16x64_stage1_warpsize4x1x1_g1_tensor16x8x16_alignc8 Tactic: 0x29d52f76d7883502 Time: 0.00417411
[04/24/2026-02:25:26] [V] [TRT] Tactic Name: sm75_xmma_fprop_implicit_gemm_indexed_wo_smem_f16f16_f16f16_f16_nhwckrsc_nhwc_tilesize128x16x64_stage1_warpsize4x1x1_g1_tensor16x8x8_alignc8 Tactic: 0xbf21db1a7c5b3781 Time: 0.00493746
[04/24/2026-02:25:26] [V] [TRT] Tactic Name: sm80_xmma_fprop_implicit_gemm_indexed_wo_smem_f16f16_f16f16_f16_nhwckrsc_nhwc_tilesize128x16x64_stage1_warpsize4x1x1_g1_tensor16x8x16_alignc4 Tactic: 0xa5a46bfbd719d757 Time: 0.00405181
[04/24/2026-02:25:26] [V] [TRT] Tactic Name: sm75_xmma_fprop_implicit_gemm_indexed_wo_smem_f16f16_f16f16_f16_nhwckrsc_nhwc_tilesize128x16x64_stage1_warpsize4x1x1_g1_tensor16x8x8_alignc2 Tactic: 0xbc046a442b052bbc Time: 0.00479695
[04/24/2026-02:25:26] [V] [TRT] Tactic Name: sm80_xmma_fprop_implicit_gemm_indexed_wo_smem_f16f16_f16f16_f16_nhwckrsc_nhwc_tilesize128x16x64_stage1_warpsize4x1x1_g1_tensor16x8x16_aligna8_alignc2 Tactic: 0x1202d6911edb6ed7 Time: 0.00573513
[04/24/2026-02:25:26] [V] [TRT] Tactic Name: sm80_xmma_fprop_implicit_gemm_indexed_wo_smem_f16f16_f16f16_f16_nhwckrsc_nhwc_tilesize128x16x64_stage1_warpsize4x1x1_g1_tensor16x8x16_aligna4_alignc8 Tactic: 0x1498693488a7556d Time: 0.00540309
[04/24/2026-02:25:26] [V] [TRT] Tactic Name: sm80_xmma_fprop_implicit_gemm_f16f16_f16f16_f16_nhwckrsc_nhwc_tilesize128x64x64_stage4_warpsize2x1x2_g1_tensor16x8x16 Tactic: 0x7273dde1d0cd3bd5 Time: 0.0139088
[04/24/2026-02:25:26] [V] [TRT] Tactic Name: sm80_xmma_fprop_implicit_gemm_indexed_wo_smem_f16f16_f16f16_f16_nhwckrsc_nhwc_tilesize128x16x64_stage1_warpsize4x1x1_g1_tensor16x8x16_aligna2_alignc2 Tactic: 0xdc0e0882e8ef55d1 Time: 0.00973623
[04/24/2026-02:25:26] [V] [TRT] Tactic Name: sm75_xmma_fprop_implicit_gemm_indexed_wo_smem_f16f16_f16f16_f16_nhwckrsc_nhwc_tilesize128x32x64_stage1_warpsize4x1x1_g1_tensor16x8x8_alignc4 Tactic: 0x49e0395ec5fc8474 Time: 0.00492989
[04/24/2026-02:25:26] [V] [TRT] Tactic Name: sm75_xmma_fprop_implicit_gemm_indexed_wo_smem_f16f16_f16f16_f16_nhwckrsc_nhwc_tilesize128x16x64_stage1_warpsize4x1x1_g1_tensor16x8x8_aligna2_alignc8 Tactic: 0xab25da54e12c6fce Time: 0.0107118
[04/24/2026-02:25:26] [V] [TRT] Tactic Name: sm80_xmma_fprop_implicit_gemm_indexed_wo_smem_f16f16_f16f16_f16_nhwckrsc_nhwc_tilesize128x32x64_stage1_warpsize4x1x1_g1_tensor16x8x16_alignc2 Tactic: 0x18d13b6b3c8edcbe Time: 0.00538971
[04/24/2026-02:25:26] [V] [TRT] Tactic Name: sm75_xmma_fprop_implicit_gemm_indexed_wo_smem_f16f16_f16f16_f16_nhwckrsc_nhwc_tilesize128x32x64_stage1_warpsize4x1x1_g1_tensor16x8x8_alignc2 Tactic: 0xc6b4cc8d92337a1c Time: 0.00549802
[04/24/2026-02:25:26] [V] [TRT] Tactic Name: sm75_xmma_fprop_implicit_gemm_indexed_wo_smem_f16f16_f16f16_f16_nhwckrsc_nhwc_tilesize128x32x64_stage1_warpsize4x1x1_g1_tensor16x8x8_aligna8_alignc4 Tactic: 0xd15fd3ec25fa5e84 Time: 0.00789919
[04/24/2026-02:25:26] [V] [TRT] Tactic Name: sm80_xmma_fprop_implicit_gemm_indexed_wo_smem_f16f16_f16f16_f16_nhwckrsc_nhwc_tilesize128x16x32_stage1_warpsize4x1x1_g1_tensor16x8x16_aligna4_alignc4 Tactic: 0x1fb62367b99fe633 Time: 0.00554233
[04/24/2026-02:25:26] [V] [TRT] Tactic Name: sm75_xmma_fprop_implicit_gemm_indexed_wo_smem_f16f16_f16f16_f16_nhwckrsc_nhwc_tilesize128x32x16_stage1_warpsize4x1x1_g1_tensor16x8x8_aligna8_alignc8 Tactic: 0x39a3504f7eeb810b Time: 0.00980145
[04/24/2026-02:25:26] [V] [TRT] Tactic Name: sm80_xmma_fprop_implicit_gemm_indexed_wo_smem_f16f16_f16f16_f16_nhwckrsc_nhwc_tilesize128x32x64_stage1_warpsize4x1x1_g1_tensor16x8x16_aligna8_alignc4 Tactic: 0xa47a4e5ec2ac6617 Time: 0.00584869
[04/24/2026-02:25:26] [V] [TRT] Tactic Name: sm80_xmma_fprop_implicit_gemm_indexed_wo_smem_f16f16_f16f16_f16_nhwckrsc_nhwc_tilesize128x32x64_stage1_warpsize4x1x1_g1_tensor16x8x16_aligna4_alignc8 Tactic: 0x2db40428031fa3c5 Time: 0.0072304
[04/24/2026-02:25:26] [V] [TRT] Tactic Name: sm80_xmma_fprop_implicit_gemm_indexed_wo_smem_f16f16_f16f16_f16_nhwckrsc_nhwc_tilesize128x16x32_stage1_warpsize4x1x1_g1_tensor16x8x16_aligna2_alignc2 Tactic: 0x5b51065cd94604da Time: 0.00934543
[04/24/2026-02:25:26] [V] [TRT] Tactic Name: sm80_xmma_fprop_implicit_gemm_indexed_f16f16_f16f16_f16_nhwckrsc_nhwc_tilesize128x64x32_stage5_warpsize2x2x1_g1_tensor16x8x16 Tactic: 0xc9d24bd069159fa8 Time: 0.0096579
[04/24/2026-02:25:26] [V] [TRT] Tactic Name: sm75_xmma_fprop_implicit_gemm_f16f16_f16f16_f16_nhwckrsc_nhwc_tilesize64x64x64_stage1_warpsize2x2x1_g1_tensor16x8x8_t1r5s5 Tactic: 0x6182fff0b6065f07 Time: 0.00997791
[04/24/2026-02:25:26] [V] [TRT] Tactic Name: sm75_xmma_fprop_implicit_gemm_indexed_wo_smem_f16f16_f16f16_f16_nhwckrsc_nhwc_tilesize128x16x32_stage1_warpsize4x1x1_g1_tensor16x8x8_aligna8_alignc8 Tactic: 0x041c3dae44ed9a7d Time: 0.00550435
[04/24/2026-02:25:26] [V] [TRT] Tactic Name: sm75_xmma_fprop_implicit_gemm_indexed_wo_smem_f16f16_f16f16_f16_nhwckrsc_nhwc_tilesize128x16x64_stage1_warpsize4x1x1_g1_tensor16x8x8_aligna4_alignc8 Tactic: 0x60960abcd63a734f Time: 0.00548775
[04/24/2026-02:25:26] [V] [TRT] Tactic Name: sm75_xmma_fprop_implicit_gemm_indexed_wo_smem_f16f16_f16f16_f16_nhwckrsc_nhwc_tilesize128x16x64_stage1_warpsize4x1x1_g1_tensor16x8x8_aligna4_alignc2 Tactic: 0x63b3bbe281646f72 Time: 0.00744411
[04/24/2026-02:25:26] [V] [TRT] Tactic Name: sm80_xmma_fprop_implicit_gemm_indexed_f16f16_f16f16_f16_nhwckrsc_nhwc_tilesize64x32x64_stage5_warpsize2x2x1_g1_tensor16x8x16 Tactic: 0xe1ff5ad20f5c6bf6 Time: 0.00683799
[04/24/2026-02:25:26] [V] [TRT] Tactic Name: sm75_xmma_fprop_implicit_gemm_indexed_wo_smem_f16f16_f16f16_f16_nhwckrsc_nhwc_tilesize128x16x32_stage1_warpsize4x1x1_g1_tensor16x8x8_alignc4 Tactic: 0xe52152db1090938b Time: 0.00486354
[04/24/2026-02:25:26] [V] [TRT] Tactic Name: sm75_xmma_fprop_implicit_gemm_f16f16_f16f16_f16_nhwckrsc_nhwc_tilesize128x32x32_stage1_warpsize4x1x1_g1_tensor16x8x8 Tactic: 0x18ef97651ad5379a Time: 0.00972312
[04/24/2026-02:25:26] [V] [TRT] Tactic Name: sm80_xmma_fprop_implicit_gemm_indexed_wo_smem_f16f16_f16f16_f16_nhwckrsc_nhwc_tilesize128x16x32_stage1_warpsize4x1x1_g1_tensor16x8x16_aligna2_alignc4 Tactic: 0xd405f38f8e89fab2 Time: 0.009444
[04/24/2026-02:25:26] [V] [TRT] Tactic Name: sm75_xmma_fprop_implicit_gemm_indexed_wo_smem_f16f16_f16f16_f16_nhwckrsc_nhwc_tilesize128x16x32_stage1_warpsize4x1x1_g1_tensor16x8x8_aligna4_alignc2 Tactic: 0x0286820bd291a1c7 Time: 0.00739726
[04/24/2026-02:25:26] [V] [TRT] Tactic Name: sm75_xmma_fprop_implicit_gemm_indexed_f16f16_f16f16_f16_nhwckrsc_nhwc_tilesize128x128x32_stage1_warpsize2x2x1_g1_tensor16x8x8 Tactic: 0x0ecf8dc91198fd5e Time: 0.0144338
[04/24/2026-02:25:26] [V] [TRT] Tactic Name: sm75_xmma_fprop_implicit_gemm_indexed_f16f16_f16f16_f16_nhwckrsc_nhwc_tilesize128x128x64_stage1_warpsize2x2x1_g1_tensor16x8x8 Tactic: 0xb0bf64026e546f4d Time: 0.0249905
[04/24/2026-02:25:26] [V] [TRT] Tactic Name: sm80_xmma_fprop_implicit_gemm_indexed_wo_smem_f16f16_f16f16_f16_nhwckrsc_nhwc_tilesize128x32x16_stage1_warpsize4x1x1_g1_tensor16x8x16_aligna4_alignc2 Tactic: 0xfd9154884033cd52 Time: 0.00711271
[04/24/2026-02:25:26] [V] [TRT] Tactic Name: sm80_xmma_fprop_implicit_gemm_indexed_wo_smem_f16f16_f16f16_f16_nhwckrsc_nhwc_tilesize128x32x16_stage1_warpsize4x1x1_g1_tensor16x8x16_aligna8_alignc4 Tactic: 0x777aafa0d6de14bd Time: 0.00670732
[04/24/2026-02:25:26] [V] [TRT] Tactic Name: sm75_xmma_fprop_implicit_gemm_indexed_wo_smem_f16f16_f16f16_f16_nhwckrsc_nhwc_tilesize128x16x32_stage1_warpsize4x1x1_g1_tensor16x8x8_aligna4_alignc4 Tactic: 0x8dd277d8855e5faf Time: 0.00568404
[04/24/2026-02:25:26] [V] [TRT] Tactic Name: sm75_xmma_fprop_implicit_gemm_indexed_wo_smem_f16f16_f16f16_f16_nhwckrsc_nhwc_tilesize128x32x64_stage1_warpsize4x1x1_g1_tensor16x8x8_alignc8 Tactic: 0xc5917dd3c56d6621 Time: 0.00497545
[04/24/2026-02:25:26] [V] [TRT] Tactic Name: sm80_xmma_fprop_implicit_gemm_f16f16_f16f16_f16_nhwckrsc_nhwc_tilesize128x64x64_stage3_warpsize2x2x1_g1_tensor16x8x16_t1r5s5 Tactic: 0x08da9063148c481f Time: 0.0136187
[04/24/2026-02:25:26] [V] [TRT] Tactic Name: sm80_xmma_fprop_implicit_gemm_indexed_wo_smem_f16f16_f16f16_f16_nhwckrsc_nhwc_tilesize128x16x32_stage1_warpsize4x1x1_g1_tensor16x8x16_aligna8_alignc4 Tactic: 0x1a092d9c78bdc1b4 Time: 0.00558593
[04/24/2026-02:25:26] [V] [TRT] Tactic Name: sm75_xmma_fprop_implicit_gemm_indexed_wo_smem_f16f16_f16f16_f16_nhwckrsc_nhwc_tilesize128x32x16_stage1_warpsize4x1x1_g1_tensor16x8x8_aligna2_alignc4 Tactic: 0x7bdecad1884e5858 Time: 0.0109345
[04/24/2026-02:25:26] [V] [TRT] Tactic Name: sm80_xmma_fprop_implicit_gemm_indexed_f16f16_f16f16_f16_nhwckrsc_nhwc_tilesize128x32x32_stage4_warpsize4x1x1_g1_tensor16x8x16 Tactic: 0xf79479a62ea9f901 Time: 0.00762442
[04/24/2026-02:25:26] [V] [TRT] Tactic Name: sm75_xmma_fprop_implicit_gemm_f16f16_f16f16_f16_nhwckrsc_nhwc_tilesize64x32x64_stage1_warpsize2x1x2_g1_tensor16x8x8 Tactic: 0x55fb34a08663e5ae Time: 0.00961859
[04/24/2026-02:25:26] [V] [TRT] Tactic Name: sm75_xmma_fprop_implicit_gemm_f16f16_f16f16_f16_nhwckrsc_nhwc_tilesize128x32x32_stage1_warpsize4x1x1_g1_tensor16x8x8_t1r5s5 Tactic: 0xc617e29f6a359b99 Time: 0.00951029
[04/24/2026-02:25:26] [V] [TRT] Tactic Name: sm80_xmma_fprop_implicit_gemm_f16f16_f16f16_f16_nhwckrsc_nhwc_tilesize128x64x32_stage5_warpsize2x2x1_g1_tensor16x8x16 Tactic: 0xbd08239a9317f2fd Time: 0.00855556
[04/24/2026-02:25:26] [V] [TRT] Tactic Name: sm75_xmma_fprop_implicit_gemm_indexed_f16f16_f16f16_f16_nhwckrsc_nhwc_tilesize256x32x32_stage1_warpsize4x1x1_g1_tensor16x8x8 Tactic: 0xa2dad76f719680b5 Time: 0.0136262
[04/24/2026-02:25:26] [V] [TRT] Tactic Name: sm75_xmma_fprop_implicit_gemm_indexed_wo_smem_f16f16_f16f16_f16_nhwckrsc_nhwc_tilesize128x32x64_stage1_warpsize4x1x1_g1_tensor16x8x8_aligna4_alignc8 Tactic: 0x5891999ae4499b56 Time: 0.00803251
[04/24/2026-02:25:26] [V] [TRT] Tactic Name: sm75_xmma_fprop_implicit_gemm_indexed_wo_smem_f16f16_f16f16_f16_nhwckrsc_nhwc_tilesize128x32x64_stage1_warpsize4x1x1_g1_tensor16x8x8_aligna4_alignc2 Tactic: 0x5bb428c4b317876b Time: 0.00692963
[04/24/2026-02:25:26] [V] [TRT] Tactic Name: sm80_xmma_fprop_implicit_gemm_indexed_wo_smem_f16f16_f16f16_f16_nhwckrsc_nhwc_tilesize128x32x64_stage1_warpsize4x1x1_g1_tensor16x8x16_alignc8 Tactic: 0x1bf48a356bd0c083 Time: 0.00492267
[04/24/2026-02:25:26] [V] [TRT] Tactic Name: sm80_xmma_fprop_implicit_gemm_indexed_wo_smem_f16f16_f16f16_f16_nhwckrsc_nhwc_tilesize128x32x64_stage1_warpsize4x1x1_g1_tensor16x8x16_aligna2_alignc4 Tactic: 0x6a76904d34985d11 Time: 0.00996328
[04/24/2026-02:25:26] [V] [TRT] Tactic Name: sm75_xmma_fprop_implicit_gemm_indexed_f16f16_f16f16_f16_nhwckrsc_nhwc_tilesize128x256x32_stage1_warpsize2x4x1_g1_tensor16x8x8 Tactic: 0xe84b9aaa289245c0 Time: 0.0248632
[04/24/2026-02:25:26] [V] [TRT] Tactic Name: sm80_xmma_fprop_implicit_gemm_indexed_wo_smem_f16f16_f16f16_f16_nhwckrsc_nhwc_tilesize128x16x32_stage1_warpsize4x1x1_g1_tensor16x8x16_alignc4 Tactic: 0x7784aea08af37198 Time: 0.00479634
[04/24/2026-02:25:26] [V] [TRT] Tactic Name: sm75_xmma_fprop_implicit_gemm_indexed_f16f16_f16f16_f16_nhwckrsc_nhwc_tilesize64x128x32_stage1_warpsize2x2x1_g1_tensor16x8x8 Tactic: 0x6b44e6396887bed9 Time: 0.0100821
[04/24/2026-02:25:26] [V] [TRT] Tactic Name: sm80_xmma_fprop_implicit_gemm_indexed_f16f16_f16f16_f16_nhwckrsc_nhwc_tilesize128x128x64_stage3_warpsize2x2x1_g1_tensor16x8x16 Tactic: 0x866e7a5f6401b67f Time: 0.0236284
[04/24/2026-02:25:26] [V] [TRT] Tactic Name: sm80_xmma_fprop_implicit_gemm_indexed_wo_smem_f16f16_f16f16_f16_nhwckrsc_nhwc_tilesize128x16x32_stage1_warpsize4x1x1_g1_tensor16x8x16_aligna8_alignc8 Tactic: 0x96786911782c23e1 Time: 0.00555253
[04/24/2026-02:25:26] [V] [TRT] Tactic Name: sm80_xmma_fprop_implicit_gemm_indexed_f16f16_f16f16_f16_nhwckrsc_nhwc_tilesize128x64x64_stage3_warpsize2x2x1_g1_tensor16x8x16 Tactic: 0x21b295c0c8f6c95a Time: 0.0136033
[04/24/2026-02:25:26] [V] [TRT] Tactic Name: sm80_xmma_fprop_implicit_gemm_indexed_wo_smem_f16f16_f16f16_f16_nhwckrsc_nhwc_tilesize128x16x32_stage1_warpsize4x1x1_g1_tensor16x8x16_aligna4_alignc8 Tactic: 0x93c767eab90e0466 Time: 0.00553846
[04/24/2026-02:25:26] [V] [TRT] Tactic Name: sm80_xmma_fprop_implicit_gemm_indexed_wo_smem_f16f16_f16f16_f16_nhwckrsc_nhwc_tilesize128x32x16_stage1_warpsize4x1x1_g1_tensor16x8x16_aligna2_alignc4 Tactic: 0xb97671b320ea2fbb Time: 0.0113428
[04/24/2026-02:25:26] [V] [TRT] Tactic Name: sm75_xmma_fprop_implicit_gemm_indexed_wo_smem_f16f16_f16f16_f16_nhwckrsc_nhwc_tilesize128x32x16_stage1_warpsize4x1x1_g1_tensor16x8x8_aligna2_alignc2 Tactic: 0xf48a3f02df81a630 Time: 0.0114275
[04/24/2026-02:25:26] [V] [TRT] Tactic Name: sm75_xmma_fprop_implicit_gemm_indexed_wo_smem_f16f16_f16f16_f16_nhwckrsc_nhwc_tilesize128x16x32_stage1_warpsize4x1x1_g1_tensor16x8x8_aligna8_alignc4 Tactic: 0x886d7923447c7828 Time: 0.0055091
[04/24/2026-02:25:26] [V] [TRT] Tactic Name: sm75_xmma_fprop_implicit_gemm_f16f16_f16f16_f16_nhwckrsc_nhwc_tilesize256x32x32_stage1_warpsize4x1x1_g1_tensor16x8x8_t1r5s5 Tactic: 0x5baadd97fe9624e7 Time: 0.0122556
[04/24/2026-02:25:26] [V] [TRT] Tactic Name: sm75_xmma_fprop_implicit_gemm_f16f16_f16f16_f16_nhwckrsc_nhwc_tilesize64x32x64_stage1_warpsize2x1x2_g1_tensor16x8x8_t1r5s5 Tactic: 0x5f3e6e00aceda82d Time: 0.00959634
[04/24/2026-02:25:26] [V] [TRT] Tactic Name: sm80_xmma_fprop_implicit_gemm_f16f16_f16f16_f16_nhwckrsc_nhwc_tilesize128x32x32_stage4_warpsize4x1x1_g1_tensor16x8x16_t1r5s5 Tactic: 0x33120137a10b68b1 Time: 0.00662213
[04/24/2026-02:25:26] [V] [TRT] Tactic Name: sm75_xmma_fprop_implicit_gemm_indexed_wo_smem_f16f16_f16f16_f16_nhwckrsc_nhwc_tilesize128x32x64_stage1_warpsize4x1x1_g1_tensor16x8x8_aligna2_alignc8 Tactic: 0x93224972d35f87d7 Time: 0.00902743
[04/24/2026-02:25:26] [V] [TRT] Tactic Name: sm75_xmma_fprop_implicit_gemm_indexed_wo_smem_f16f16_f16f16_f16_nhwckrsc_nhwc_tilesize128x32x16_stage1_warpsize4x1x1_g1_tensor16x8x8_aligna8_alignc2 Tactic: 0x3a86e11129b59d36 Time: 0.0115404
[04/24/2026-02:25:26] [V] [TRT] Tactic Name: sm75_xmma_fprop_implicit_gemm_indexed_wo_smem_f16f16_f16f16_f16_nhwckrsc_nhwc_tilesize128x32x16_stage1_warpsize4x1x1_g1_tensor16x8x8_aligna2_alignc8 Tactic: 0xf7af8e5c88dfba0d Time: 0.0110463
[04/24/2026-02:25:26] [V] [TRT] Tactic Name: sm80_xmma_fprop_implicit_gemm_indexed_f16f16_f16f16_f16_nhwckrsc_nhwc_tilesize64x64x64_stage4_warpsize2x2x1_g1_tensor16x8x16 Tactic: 0x4a81ea1e51436a30 Time: 0.00940429
[04/24/2026-02:25:26] [V] [TRT] Tactic Name: sm80_xmma_fprop_implicit_gemm_indexed_wo_smem_f16f16_f16f16_f16_nhwckrsc_nhwc_tilesize128x32x64_stage1_warpsize4x1x1_g1_tensor16x8x16_aligna8_alignc2 Tactic: 0x2b2ebb8d9563987f Time: 0.00542154
[04/24/2026-02:25:26] [V] [TRT] Tactic Name: sm80_xmma_fprop_implicit_gemm_f16f16_f16f16_f16_nhwckrsc_nhwc_tilesize256x64x32_stage3_warpsize4x1x1_g1_tensor16x8x16 Tactic: 0xd1aaad17ca35fbaa Time: 0.0140779
[04/24/2026-02:25:26] [V] [TRT] Tactic Name: sm80_xmma_fprop_implicit_gemm_indexed_wo_smem_f16f16_f16f16_f16_nhwckrsc_nhwc_tilesize128x32x64_stage1_warpsize4x1x1_g1_tensor16x8x16_aligna2_alignc2 Tactic: 0xe522659e6357a379 Time: 0.00995871
