cookbook/07-Tool/trtexec/result-02.log
[07/07/2026-02:11:00] [V] [TRT] *************** Autotuning format combination: Float(784,784,28,1) -> Float(25088,784,28,1) ***************
[07/07/2026-02:11:00] [V] [TRT] --------------- Timing Runner: node_conv2d + node_relu (CaskConvolution[0x80000009])
[07/07/2026-02:11:00] [V] [TRT] Tactic Name: sm80_xmma_fprop_implicit_gemm_f32f32_f32f32_f32_nchwkcrs_nchw_tilesize64x64x8_stage3_warpsize1x4x1_g1_ffma_t1r5s5_aligna4_alignc4 Tactic: 0x967f94e9db2001a8 Time: 0.00615314
[07/07/2026-02:11:00] [V] [TRT] Tactic Name: sm80_xmma_fprop_implicit_gemm_indexed_f32f32_f32f32_f32_nchwkcrs_nchw_tilesize32x32x8_stage3_warpsize1x2x1_g1_ffma_aligna4_alignc4 Tactic: 0xcb8a43f748d8a338 Time: 0.00618952
[07/07/2026-02:11:00] [V] [TRT] Tactic Name: sm80_xmma_fprop_implicit_gemm_indexed_f32f32_f32f32_f32_nchwkcrs_nchw_tilesize128x64x8_stage2_warpsize1x4x1_g1_ffma_aligna4_alignc4_beta0_packed_stride Tactic: 0xede36641840ce3d2 Time: 0.010561
[07/07/2026-02:11:00] [V] [TRT] Tactic Name: sm80_xmma_fprop_implicit_gemm_indexed_f32f32_f32f32_f32_nchwkcrs_nchw_tilesize64x64x8_stage3_warpsize1x4x1_g1_ffma_aligna4_alignc4 Tactic: 0xd828f024626fa982 Time: 0.00716594
[07/07/2026-02:11:00] [V] [TRT] Tactic Name: sm70_xmma_fprop_implicit_gemm_f32f32_f32f32_f32_nchwkcrs_nchw_tilesize64x128x8_stage1_warpsize1x4x1_g1_ffma_aligna4_alignc4 Tactic: 0xd1338f4b38d341e2 Time: 0.00905686
[07/07/2026-02:11:00] [V] [TRT] Tactic Name: sm80_xmma_fprop_implicit_gemm_f32f32_f32f32_f32_nchwkcrs_nchw_tilesize32x32x8_stage3_warpsize1x2x1_g1_ffma_t1r5s5_aligna4_alignc4 Tactic: 0x5b8bf1b8028629d9 Time: 0.00534603
[07/07/2026-02:11:00] [V] [TRT] Tactic Name: sm80_xmma_fprop_implicit_gemm_f32f32_f32f32_f32_nchwkcrs_nchw_tilesize128x64x8_stage3_warpsize2x2x1_g1_ffma_aligna4_alignc4 Tactic: 0x12dbf7d94ee3696d Time: 0.00980023
[07/07/2026-02:11:00] [V] [TRT] Tactic Name: sm70_xmma_fprop_implicit_gemm_indexed_f32f32_f32f32_f32_nchwkcrs_nchw_tilesize128x16x8_stage1_warpsize4x1x1_g1_ffma_aligna4_alignc4 Tactic: 0x65d82d184f452332 Time: 0.00753251
[07/07/2026-02:11:00] [V] [TRT] Tactic Name: sm80_xmma_fprop_implicit_gemm_indexed_f32f32_f32f32_f32_nchwkcrs_nchw_tilesize128x64x8_stage2_warpsize2x2x1_g1_ffma_aligna4_alignc4_beta0_packed_stride Tactic: 0x31aa67f57c5aea77 Time: 0.0105927
[07/07/2026-02:11:00] [V] [TRT] Tactic Name: sm70_xmma_fprop_implicit_gemm_f32f32_f32f32_f32_nchwkcrs_nchw_tilesize128x128x8_stage1_warpsize2x2x1_g1_ffma_aligna4_alignc4 Tactic: 0xac49795b871b0d29 Time: 0.01409
[07/07/2026-02:11:00] [V] [TRT] Tactic Name: sm80_xmma_fprop_implicit_gemm_f32f32_f32f32_f32_nchwkcrs_nchw_tilesize128x16x8_stage3_warpsize4x1x1_g1_ffma_aligna4_alignc4 Tactic: 0x9d9fdb5fd9945f64 Time: 0.00594267
[07/07/2026-02:11:00] [V] [TRT] Tactic Name: sm80_xmma_fprop_implicit_gemm_f32f32_f32f32_f32_nchwkcrs_nchw_tilesize64x64x8_stage3_warpsize1x4x1_g1_ffma_aligna4_alignc4 Tactic: 0xa31d27de74b895ff Time: 0.00638311
[07/07/2026-02:11:00] [V] [TRT] Tactic Name: sm70_xmma_fprop_implicit_gemm_f32f32_f32f32_f32_nchwkcrs_nchw_tilesize128x64x8_stage1_warpsize2x2x1_g1_ffma_aligna4_alignc4 Tactic: 0x994f5b723e2d80da Time: 0.00968411
[07/07/2026-02:11:00] [V] [TRT] Tactic Name: sm70_xmma_fprop_implicit_gemm_f32f32_f32f32_f32_nchwkcrs_nchw_tilesize128x256x8_stage1_warpsize2x4x1_g1_ffma_aligna4_alignc4 Tactic: 0xd2aa21bfe2167c0c Time: 0.0166928
[07/07/2026-02:11:00] [V] [TRT] Tactic Name: sm70_xmma_fprop_implicit_gemm_f32f32_f32f32_f32_nchwkcrs_nchw_tilesize32x32x8_stage1_warpsize1x2x1_g1_ffma_t1r5s5_aligna4_alignc4 Tactic: 0x7e1e4d26cfa285f9 Time: 0.00568422
[07/07/2026-02:11:00] [V] [TRT] Tactic Name: sm70_xmma_fprop_implicit_gemm_f32f32_f32f32_f32_nchwkcrs_nchw_tilesize64x64x8_stage1_warpsize1x4x1_g1_ffma_t1r5s5_aligna4_alignc4 Tactic: 0xb3ea28771604ad88 Time: 0.00628889
[07/07/2026-02:11:00] [V] [TRT] Tactic Name: sm80_xmma_fprop_implicit_gemm_indexed_f32f32_f32f32_f32_nchwkcrs_nchw_tilesize128x16x8_stage3_warpsize4x1x1_g1_ffma_aligna4_alignc4 Tactic: 0x40a12e3938221818 Time: 0.00743474
[07/07/2026-02:11:00] [V] [TRT] Tactic Name: sm80_xmma_fprop_implicit_gemm_f32f32_f32f32_f32_nchwkcrs_nchw_tilesize32x32x8_stage3_warpsize1x2x1_g1_ffma_aligna4_alignc4 Tactic: 0xb0bf940d5e0f9f45 Time: 0.00545964
[07/07/2026-02:11:00] [V] [TRT] Tactic Name: sm70_xmma_fprop_implicit_gemm_f32f32_f32f32_f32_nchwkcrs_nchw_tilesize128x16x8_stage1_warpsize4x1x1_g1_ffma_aligna4_alignc4 Tactic: 0x160b77f4a95ab6d3 Time: 0.00608286
[07/07/2026-02:11:00] [V] [TRT] Tactic Name: sm80_xmma_fprop_implicit_gemm_indexed_f32f32_f32f32_f32_nchwkcrs_nchw_tilesize128x32x8_stage3_warpsize2x2x1_g1_ffma_aligna4_alignc4 Tactic: 0xa9366041633a5135 Time: 0.00905029
[07/07/2026-02:11:00] [V] [TRT] Tactic Name: sm80_xmma_fprop_implicit_gemm_indexed_f32f32_f32f32_f32_nchwkcrs_nchw_tilesize128x64x8_stage2_warpsize4x1x1_g1_ffma_aligna4_alignc4_beta0_packed_stride Tactic: 0x1673e3594ce11cea Time: 0.0108744
[07/07/2026-02:11:00] [V] [TRT] Tactic Name: sm70_xmma_fprop_implicit_gemm_indexed_f32f32_f32f32_f32_nchwkcrs_nchw_tilesize64x64x8_stage1_warpsize1x4x1_g1_ffma_aligna4_alignc4 Tactic: 0x8d5c64a52fab02c9 Time: 0.00699842
[07/07/2026-02:11:00] [V] [TRT] Tactic Name: sm70_xmma_fprop_implicit_gemm_indexed_f32f32_f32f32_f32_nchwkcrs_nchw_tilesize128x32x8_stage1_warpsize2x2x1_g1_ffma_aligna4_alignc4 Tactic: 0x8c4f6360145d6a1f Time: 0.00840471
[07/07/2026-02:11:00] [V] [TRT] Tactic Name: sm70_xmma_fprop_implicit_gemm_indexed_f32f32_f32f32_f32_nchwkcrs_nchw_tilesize32x32x8_stage1_warpsize1x2x1_g1_ffma_aligna4_alignc4 Tactic: 0x9efed776051c0873 Time: 0.00639463
[07/07/2026-02:11:00] [V] [TRT] Tactic Name: sm80_xmma_fprop_implicit_gemm_f32f32_f32f32_f32_nchwkcrs_nchw_tilesize256x128x8_stage3_warpsize4x2x1_g1_ffma_aligna4_alignc4 Tactic: 0xbb8c3889c7eacd30 Time: 0.0172983
[07/07/2026-02:11:00] [V] [TRT] Tactic Name: sm80_xmma_fprop_implicit_gemm_f32f32_f32f32_f32_nchwkcrs_nchw_tilesize64x128x8_stage3_warpsize1x4x1_g1_ffma_aligna4_alignc4 Tactic: 0x5aa723e0481da855 Time: 0.00927143
[07/07/2026-02:11:00] [V] [TRT] Tactic Name: sm70_xmma_fprop_implicit_gemm_f32f32_f32f32_f32_nchwkcrs_nchw_tilesize32x32x8_stage1_warpsize1x2x1_g1_ffma_aligna4_alignc4 Tactic: 0xf7a98be0a08d77c4 Time: 0.00561565
[07/07/2026-02:11:00] [V] [TRT] Tactic Name: sm70_xmma_fprop_implicit_gemm_f32f32_f32f32_f32_nchwkcrs_nchw_tilesize64x64x8_stage1_warpsize1x4x1_g1_ffma_aligna4_alignc4 Tactic: 0xe40b38338a3a7d7e Time: 0.00641471
[07/07/2026-02:11:00] [V] [TRT] node_conv2d + node_relu (CaskConvolution[0x80000009]) profiling completed in 0.0819054 seconds. Fastest Tactic: 0x5b8bf1b8028629d9 Time: 0.00534603
[07/07/2026-02:11:00] [V] [TRT] Skipping CaskFlattenConvolution: No valid tactics for node_conv2d + node_relu
[07/07/2026-02:11:00] [V] [TRT] >>>>>>>>>>>>>>> Chose Runner Type: CaskConvolution Tactic: 0x5b8bf1b8028629d9
[07/07/2026-02:11:00] [V] [TRT] *************** Autotuning format combination: Float(784,1,28,1) -> Float(25088,1,896,32) ***************
[07/07/2026-02:11:00] [V] [TRT] --------------- Timing Runner: node_conv2d + node_relu (CaskConvolution[0x80000009])
[07/07/2026-02:11:00] [V] [TRT] Tactic Name: sm80_xmma_fprop_implicit_gemm_f32f32_f32f32_f32_nhwckrsc_nhwc_tilesize128x16x8_stage3_warpsize4x1x1_g1_ffma_t1r5s5_aligna4_alignc4 Tactic: 0xe35d4a4a3b499fe7 Time: 0.00946
[07/07/2026-02:11:00] [V] [TRT] Tactic Name: sm80_xmma_fprop_implicit_gemm_indexed_f32f32_f32f32_f32_nhwckrsc_nhwc_tilesize32x32x8_stage3_warpsize1x2x1_g1_ffma_aligna4_alignc4 Tactic: 0x0a143be7a52f301a Time: 0.0112373
[07/07/2026-02:11:00] [V] [TRT] Tactic Name: sm80_xmma_fprop_implicit_gemm_f32f32_f32f32_f32_nhwckrsc_nhwc_tilesize64x32x32_stage3_warpsize1x1x1_g1_ffma_aligna4_alignc4 Tactic: 0x50e74ef194ce86c3 Time: 0.146875
[07/07/2026-02:11:00] [V] [TRT] Tactic Name: sm80_xmma_fprop_implicit_gemm_f32f32_f32f32_f32_nhwckrsc_nhwc_tilesize64x16x16_stage3_warpsize1x1x1_g1_ffma_t1r5s5_aligna4_alignc4 Tactic: 0x93c5425f25c3f9fd Time: 0.0238872
[07/07/2026-02:11:00] [V] [TRT] Tactic Name: sm80_xmma_fprop_implicit_gemm_f32f32_f32f32_f32_nhwckrsc_nhwc_tilesize64x64x8_stage3_warpsize1x4x1_g1_ffma_aligna4_alignc4 Tactic: 0x62835fce994f06dd Time: 0.0135198
[07/07/2026-02:11:00] [V] [TRT] Tactic Name: sm70_xmma_fprop_implicit_gemm_f32f32_f32f32_f32_nhwckrsc_nhwc_tilesize64x64x8_stage1_warpsize1x4x1_g1_ffma_aligna4_alignc4 Tactic: 0x2595402367cdee5c Time: 0.0146414
[07/07/2026-02:11:00] [V] [TRT] Tactic Name: sm80_xmma_fprop_implicit_gemm_f32f32_f32f32_f32_nhwckrsc_nhwc_tilesize256x64x8_stage3_warpsize2x2x1_g1_ffma_aligna4_alignc4 Tactic: 0x8014228ec08b4d49 Time: 0.0404526
[07/07/2026-02:11:00] [V] [TRT] Tactic Name: sm70_xmma_fprop_implicit_gemm_indexed_f32f32_f32f32_f32_nhwckrsc_nhwc_tilesize128x16x8_stage1_warpsize4x1x1_g1_ffma_aligna4_alignc4 Tactic: 0x6aaac747558eb868 Time: 0.0144219
[07/07/2026-02:11:00] [V] [TRT] Tactic Name: sm70_xmma_fprop_implicit_gemm_f32f32_f32f32_f32_nhwckrsc_nhwc_tilesize128x16x8_stage1_warpsize4x1x1_g1_ffma_t1r5s5_aligna4_alignc4 Tactic: 0x54e3b8c9b1e5f17a Time: 0.0123352
[07/07/2026-02:11:00] [V] [TRT] Tactic Name: sm70_xmma_fprop_implicit_gemm_f32f32_f32f32_f32_nhwckrsc_nhwc_tilesize128x16x8_stage1_warpsize4x1x1_g1_ffma_aligna4_alignc4 Tactic: 0x19799dabb3912d89 Time: 0.014667
[07/07/2026-02:11:00] [V] [TRT] Tactic Name: sm80_xmma_fprop_implicit_gemm_indexed_f32f32_f32f32_f32_nhwckrsc_nhwc_tilesize64x64x8_stage3_warpsize1x4x1_g1_ffma_aligna4_alignc4 Tactic: 0x19b688348f983aa0 Time: 0.0151909
[07/07/2026-02:11:00] [V] [TRT] Tactic Name: sm80_xmma_fprop_implicit_gemm_f32f32_f32f32_f32_nhwckrsc_nhwc_tilesize128x16x8_stage3_warpsize4x1x1_g1_ffma_aligna4_alignc4 Tactic: 0x92ed3100c35fc43e Time: 0.011494
[07/07/2026-02:11:00] [V] [TRT] Tactic Name: sm70_xmma_fprop_implicit_gemm_f32f32_f32f32_f32_nhwckrsc_nhwc_tilesize64x128x8_stage1_warpsize1x4x1_g1_ffma_aligna4_alignc4 Tactic: 0xde4165142218dab8 Time: 0.0202509
[07/07/2026-02:11:00] [V] [TRT] Tactic Name: sm80_xmma_fprop_implicit_gemm_f32f32_f32f32_f32_nhwckrsc_nhwc_tilesize32x32x8_stage3_warpsize1x2x1_g1_ffma_aligna4_alignc4 Tactic: 0x7121ec1db3f80c67 Time: 0.00907886
[07/07/2026-02:11:00] [V] [TRT] Tactic Name: sm80_xmma_fprop_implicit_gemm_f32f32_f32f32_f32_nhwckrsc_nhwc_tilesize64x64x8_stage3_warpsize1x4x1_g1_ffma_t1r5s5_aligna4_alignc4 Tactic: 0x45ff0c3a09b02e78 Time: 0.0129903
[07/07/2026-02:11:00] [V] [TRT] Tactic Name: sm80_xmma_fprop_implicit_gemm_f32f32_f32f32_f32_nhwckrsc_nhwc_tilesize64x16x16_stage3_warpsize1x1x1_g1_ffma_aligna4_alignc4 Tactic: 0xb404e79e2d524151 Time: 0.0237864
[07/07/2026-02:11:00] [V] [TRT] Tactic Name: sm70_xmma_fprop_implicit_gemm_f32f32_f32f32_f32_nhwckrsc_nhwc_tilesize64x32x32_stage1_warpsize1x1x1_g1_ffma_aligna4_alignc4 Tactic: 0xdb73e25ae4006f74 Time: 0.154766
[07/07/2026-02:11:00] [V] [TRT] Tactic Name: sm70_xmma_fprop_implicit_gemm_f32f32_f32f32_f32_nhwckrsc_nhwc_tilesize64x16x16_stage1_warpsize1x1x1_g1_ffma_aligna4_alignc4 Tactic: 0x3f904b355d9ca8e6 Time: 0.0279467
[07/07/2026-02:11:00] [V] [TRT] Tactic Name: sm70_xmma_fprop_implicit_gemm_f32f32_f32f32_f32_nhwckrsc_nhwc_tilesize128x64x8_stage1_warpsize2x2x1_g1_ffma_aligna4_alignc4 Tactic: 0x963db12d24e61b80 Time: 0.0209215
[07/07/2026-02:11:00] [V] [TRT] Tactic Name: sm70_xmma_fprop_implicit_gemm_f32f32_f32f32_f32_nhwckrsc_nhwc_tilesize32x32x8_stage1_warpsize1x2x1_g1_ffma_t1r5s5_aligna4_alignc4 Tactic: 0xad9ed5f51d32aa29 Time: 0.0119832
[07/07/2026-02:11:00] [V] [TRT] Tactic Name: sm70_xmma_fprop_implicit_gemm_f32f32_f32f32_f32_nhwckrsc_nhwc_tilesize64x32x32_stage1_warpsize1x1x1_g1_ffma_t1r5s5_aligna4_alignc4 Tactic: 0x737793996edbf8e2 Time: 0.145216
[07/07/2026-02:11:00] [V] [TRT] Tactic Name: sm70_xmma_fprop_implicit_gemm_f32f32_f32f32_f32_nhwckrsc_nhwc_tilesize32x32x8_stage1_warpsize1x2x1_g1_ffma_aligna4_alignc4 Tactic: 0x3637f3f04d7ae4e6 Time: 0.0121844
[07/07/2026-02:11:00] [V] [TRT] Tactic Name: sm70_xmma_fprop_implicit_gemm_f32f32_f32f32_f32_nhwckrsc_nhwc_tilesize256x128x8_stage1_warpsize2x4x1_g1_ffma_aligna4_alignc4 Tactic: 0x0447933cc2be855a Time: 0.0537036
[07/07/2026-02:11:00] [V] [TRT] Tactic Name: sm80_xmma_fprop_implicit_gemm_f32f32_f32f32_f32_nhwckrsc_nhwc_tilesize32x32x8_stage3_warpsize1x2x1_g1_ffma_t1r5s5_aligna4_alignc4 Tactic: 0x880b696bd0160609 Time: 0.008672
[07/07/2026-02:11:00] [V] [TRT] Tactic Name: sm80_xmma_fprop_implicit_gemm_indexed_f32f32_f32f32_f32_nhwckrsc_nhwc_tilesize128x32x8_stage3_warpsize2x2x1_g1_ffma_aligna4_alignc4 Tactic: 0xa6448a1e79f1ca6f Time: 0.0169168
[07/07/2026-02:11:00] [V] [TRT] Tactic Name: sm80_xmma_fprop_implicit_gemm_indexed_f32f32_f32f32_f32_nhwckrsc_nhwc_tilesize128x16x8_stage3_warpsize4x1x1_g1_ffma_aligna4_alignc4 Tactic: 0x4fd3c46622e98342 Time: 0.0130302
[07/07/2026-02:11:00] [V] [TRT] Tactic Name: sm70_xmma_fprop_implicit_gemm_f32f32_f32f32_f32_nhwckrsc_nhwc_tilesize64x16x16_stage1_warpsize1x1x1_g1_ffma_t1r5s5_aligna4_alignc4 Tactic: 0x247bb0dcaf6f9760 Time: 0.027104
[07/07/2026-02:11:00] [V] [TRT] Tactic Name: sm70_xmma_fprop_implicit_gemm_indexed_f32f32_f32f32_f32_nhwckrsc_nhwc_tilesize128x32x8_stage1_warpsize2x2x1_g1_ffma_aligna4_alignc4 Tactic: 0x833d893f0e96f145 Time: 0.0176508
[07/07/2026-02:11:00] [V] [TRT] Tactic Name: sm70_xmma_fprop_implicit_gemm_indexed_f32f32_f32f32_f32_nhwckrsc_nhwc_tilesize32x32x8_stage1_warpsize1x2x1_g1_ffma_aligna4_alignc4 Tactic: 0x5f60af66e8eb9b51 Time: 0.0140738
[07/07/2026-02:11:00] [V] [TRT] Tactic Name: sm80_xmma_fprop_implicit_gemm_f32f32_f32f32_f32_nhwckrsc_nhwc_tilesize128x64x8_stage3_warpsize2x2x1_g1_ffma_aligna4_alignc4 Tactic: 0x1da91d865428f237 Time: 0.0212865
[07/07/2026-02:11:00] [V] [TRT] Tactic Name: sm80_xmma_fprop_implicit_gemm_f32f32_f32f32_f32_nhwckrsc_nhwc_tilesize64x32x32_stage3_warpsize1x1x1_g1_ffma_t1r5s5_aligna4_alignc4 Tactic: 0xc4c9611ae477967f Time: 0.138935
[07/07/2026-02:11:00] [V] [TRT] node_conv2d + node_relu (CaskConvolution[0x80000009]) profiling completed in 0.0895276 seconds. Fastest Tactic: 0x880b696bd0160609 Time: 0.008672
[07/07/2026-02:11:00] [V] [TRT] Skipping CaskFlattenConvolution: No valid tactics for node_conv2d + node_relu
[07/07/2026-02:11:00] [V] [TRT] >>>>>>>>>>>>>>> Chose Runner Type: CaskConvolution Tactic: 0x880b696bd0160609
[07/07/2026-02:11:00] [V] [TRT] *************** Autotuning format combination: Float(784,1:4,28,1) -> Float(25088,784,28,1) ***************
[07/07/2026-02:11:00] [V] [TRT] Skipping CaskConvolution: No valid tactics for node_conv2d + node_relu
[07/07/2026-02:11:00] [V] [TRT] Skipping CaskFlattenConvolution: No valid tactics for node_conv2d + node_relu
[07/07/2026-02:11:00] [V] [TRT] *************** Autotuning format combination: Float(784,1:4,28,1) -> Float(6272,1:4,224,8) ***************
[07/07/2026-02:11:00] [V] [TRT] Skipping CaskConvolution: No valid tactics for node_conv2d + node_relu
[07/07/2026-02:11:00] [V] [TRT] Skipping CaskFlattenConvolution: No valid tactics for node_conv2d + node_relu
[07/07/2026-02:11:00] [V] [TRT] *************** Autotuning format combination: Half(784,784,28,1) -> Half(25088,784,28,1) ***************
[07/07/2026-02:11:00] [V] [TRT] Skipping CaskConvolution: No valid tactics for node_conv2d + node_relu
[07/07/2026-02:11:00] [V] [TRT] Skipping CaskFlattenConvolution: No valid tactics for node_conv2d + node_relu
[07/07/2026-02:11:00] [V] [TRT] *************** Autotuning format combination: Half(784,1:2,28,1) -> Half(12544,1:2,448,16) ***************
[07/07/2026-02:11:00] [V] [TRT] --------------- Timing Runner: node_conv2d + node_relu (CaskConvolution[0x80000009])
[07/07/2026-02:11:00] [V] [TRT] Tactic Name: sm75_xmma_fprop_implicit_gemm_indexed_wo_smem_f16f16_f16f16_f16_nhwckrsc_nhwc_tilesize128x32x64_stage1_warpsize4x1x1_g1_tensor16x8x8_aligna4_alignc4 Tactic: 0xd4e0dd17e4d87903 Time: 0.00580462
[07/07/2026-02:11:00] [V] [TRT] Tactic Name: sm75_xmma_fprop_implicit_gemm_indexed_wo_smem_f16f16_f16f16_f16_nhwckrsc_nhwc_tilesize128x32x16_stage1_warpsize4x1x1_g1_tensor16x8x8_aligna4_alignc2 Tactic: 0x3f39efeae897bab1 Time: 0.0072096
[07/07/2026-02:11:00] [V] [TRT] Tactic Name: sm80_xmma_fprop_implicit_gemm_indexed_wo_smem_f16f16_f16f16_f16_nhwckrsc_nhwc_tilesize128x32x64_stage1_warpsize4x1x1_g1_tensor16x8x16_aligna2_alignc4 Tactic: 0x6a76904d34985d11 Time: 0.00715337
[07/07/2026-02:11:00] [V] [TRT] Tactic Name: sm80_xmma_fprop_implicit_gemm_indexed_wo_smem_f16f16_f16f16_f16_nhwckrsc_nhwc_tilesize128x32x64_stage1_warpsize4x1x1_g1_tensor16x8x16_aligna2_alignc2 Tactic: 0xe522659e6357a379 Time: 0.00793879
[07/07/2026-02:11:00] [V] [TRT] Tactic Name: sm75_xmma_fprop_implicit_gemm_indexed_wo_smem_f16f16_f16f16_f16_nhwckrsc_nhwc_tilesize128x16x32_stage1_warpsize4x1x1_g1_tensor16x8x8_aligna2_alignc4 Tactic: 0x4661a730b248432e Time: 0.00729486
[07/07/2026-02:11:00] [V] [TRT] Tactic Name: sm80_xmma_fprop_implicit_gemm_indexed_wo_smem_f16f16_f16f16_f16_nhwckrsc_nhwc_tilesize128x32x64_stage1_warpsize4x1x1_g1_tensor16x8x16_aligna4_alignc2 Tactic: 0x2e91b5765441bff8 Time: 0.00584375
[07/07/2026-02:11:00] [V] [TRT] Tactic Name: sm75_xmma_fprop_implicit_gemm_indexed_wo_smem_f16f16_f16f16_f16_nhwckrsc_nhwc_tilesize128x16x32_stage1_warpsize4x1x1_g1_tensor16x8x8_aligna4_alignc4 Tactic: 0x8dd277d8855e5faf Time: 0.00560352
[07/07/2026-02:11:00] [V] [TRT] Tactic Name: sm75_xmma_fprop_implicit_gemm_indexed_wo_smem_f16f16_f16f16_f16_nhwckrsc_nhwc_tilesize128x32x64_stage1_warpsize4x1x1_g1_tensor16x8x8_aligna2_alignc2 Tactic: 0x9007f82c84019bea Time: 0.00795226
[07/07/2026-02:11:00] [V] [TRT] Tactic Name: sm80_xmma_fprop_implicit_gemm_indexed_wo_smem_f16f16_f16f16_f16_nhwckrsc_nhwc_tilesize128x32x16_stage1_warpsize4x1x1_g1_tensor16x8x16_aligna2_alignc2 Tactic: 0x362284607725d1d3 Time: 0.00969722
[07/07/2026-02:11:00] [V] [TRT] Tactic Name: sm75_xmma_fprop_implicit_gemm_indexed_wo_smem_f16f16_f16f16_f16_nhwckrsc_nhwc_tilesize128x32x16_stage1_warpsize4x1x1_g1_tensor16x8x8_aligna4_alignc4 Tactic: 0xb06d1a39bf5844d9 Time: 0.00644015
[07/07/2026-02:11:00] [V] [TRT] Tactic Name: sm80_xmma_fprop_implicit_gemm_indexed_wo_smem_f16f16_f16f16_f16_nhwckrsc_nhwc_tilesize128x32x16_stage1_warpsize4x1x1_g1_tensor16x8x16_aligna4_alignc2 Tactic: 0xfd9154884033cd52 Time: 0.00685649
[07/07/2026-02:11:00] [V] [TRT] Tactic Name: sm80_xmma_fprop_implicit_gemm_indexed_wo_smem_f16f16_f16f16_f16_nhwckrsc_nhwc_tilesize128x32x16_stage1_warpsize4x1x1_g1_tensor16x8x16_aligna2_alignc4 Tactic: 0xb97671b320ea2fbb Time: 0.00877284
[07/07/2026-02:11:00] [V] [TRT] Tactic Name: sm75_xmma_fprop_implicit_gemm_indexed_wo_smem_f16f16_f16f16_f16_nhwckrsc_nhwc_tilesize128x16x64_stage1_warpsize4x1x1_g1_tensor16x8x8_aligna2_alignc4 Tactic: 0x27549ed9e1bd8d9b Time: 0.00769997
[07/07/2026-02:11:00] [V] [TRT] Tactic Name: sm75_xmma_fprop_implicit_gemm_indexed_wo_smem_f16f16_f16f16_f16_nhwckrsc_nhwc_tilesize128x32x16_stage1_warpsize4x1x1_g1_tensor16x8x8_aligna2_alignc2 Tactic: 0xf48a3f02df81a630 Time: 0.00910743
[07/07/2026-02:11:00] [V] [TRT] Tactic Name: sm75_xmma_fprop_implicit_gemm_indexed_wo_smem_f16f16_f16f16_f16_nhwckrsc_nhwc_tilesize128x16x64_stage1_warpsize4x1x1_g1_tensor16x8x8_aligna4_alignc4 Tactic: 0xece74e31d6ab911a Time: 0.00526433
[07/07/2026-02:11:00] [V] [TRT] Tactic Name: sm75_xmma_fprop_implicit_gemm_indexed_wo_smem_f16f16_f16f16_f16_nhwckrsc_nhwc_tilesize128x32x16_stage1_warpsize4x1x1_g1_tensor16x8x8_aligna2_alignc4 Tactic: 0x7bdecad1884e5858 Time: 0.00834083
[07/07/2026-02:11:00] [V] [TRT] Tactic Name: sm75_xmma_fprop_implicit_gemm_indexed_wo_smem_f16f16_f16f16_f16_nhwckrsc_nhwc_tilesize128x32x64_stage1_warpsize4x1x1_g1_tensor16x8x8_aligna2_alignc4 Tactic: 0x1f530dffd3ce6582 Time: 0.00798705
[07/07/2026-02:11:00] [V] [TRT] Tactic Name: sm80_xmma_fprop_implicit_gemm_indexed_wo_smem_f16f16_f16f16_f16_nhwckrsc_nhwc_tilesize128x16x32_stage1_warpsize4x1x1_g1_tensor16x8x16_aligna2_alignc4 Tactic: 0xd405f38f8e89fab2 Time: 0.00732983
[07/07/2026-02:11:00] [V] [TRT] Tactic Name: sm80_xmma_fprop_implicit_gemm_indexed_wo_smem_f16f16_f16f16_f16_nhwckrsc_nhwc_tilesize128x16x64_stage1_warpsize4x1x1_g1_tensor16x8x16_aligna4_alignc2 Tactic: 0x17bdd86adff94950 Time: 0.0058933
[07/07/2026-02:11:00] [V] [TRT] Tactic Name: sm80_xmma_fprop_implicit_gemm_indexed_wo_smem_f16f16_f16f16_f16_nhwckrsc_nhwc_tilesize128x16x64_stage1_warpsize4x1x1_g1_tensor16x8x16_aligna2_alignc4 Tactic: 0x535afd51bf20abb9 Time: 0.00746446
[07/07/2026-02:11:00] [V] [TRT] Tactic Name: sm75_xmma_fprop_implicit_gemm_indexed_wo_smem_f16f16_f16f16_f16_nhwckrsc_nhwc_tilesize128x16x32_stage1_warpsize4x1x1_g1_tensor16x8x8_aligna4_alignc2 Tactic: 0x0286820bd291a1c7 Time: 0.00594249
[07/07/2026-02:11:00] [V] [TRT] Tactic Name: sm75_xmma_fprop_implicit_gemm_indexed_wo_smem_f16f16_f16f16_f16_nhwckrsc_nhwc_tilesize128x16x64_stage1_warpsize4x1x1_g1_tensor16x8x8_aligna2_alignc2 Tactic: 0xa8006b0ab67273f3 Time: 0.00796241
[07/07/2026-02:11:00] [V] [TRT] Tactic Name: sm75_xmma_fprop_implicit_gemm_indexed_wo_smem_f16f16_f16f16_f16_nhwckrsc_nhwc_tilesize128x16x64_stage1_warpsize4x1x1_g1_tensor16x8x8_aligna4_alignc2 Tactic: 0x63b3bbe281646f72 Time: 0.00630917
[07/07/2026-02:11:00] [V] [TRT] Tactic Name: sm80_xmma_fprop_implicit_gemm_indexed_wo_smem_f16f16_f16f16_f16_nhwckrsc_nhwc_tilesize128x32x64_stage1_warpsize4x1x1_g1_tensor16x8x16_aligna4_alignc4 Tactic: 0xa1c540a5038e4190 Time: 0.00568633
[07/07/2026-02:11:00] [V] [TRT] Tactic Name: sm75_xmma_fprop_implicit_gemm_indexed_wo_smem_f16f16_f16f16_f16_nhwckrsc_nhwc_tilesize128x32x64_stage1_warpsize4x1x1_g1_tensor16x8x8_aligna4_alignc2 Tactic: 0x5bb428c4b317876b Time: 0.00602076
[07/07/2026-02:11:00] [V] [TRT] Tactic Name: sm80_xmma_fprop_implicit_gemm_indexed_wo_smem_f16f16_f16f16_f16_nhwckrsc_nhwc_tilesize128x16x32_stage1_warpsize4x1x1_g1_tensor16x8x16_aligna2_alignc2 Tactic: 0x5b51065cd94604da Time: 0.00766508
[07/07/2026-02:11:00] [V] [TRT] Tactic Name: sm80_xmma_fprop_implicit_gemm_indexed_wo_smem_f16f16_f16f16_f16_nhwckrsc_nhwc_tilesize128x16x32_stage1_warpsize4x1x1_g1_tensor16x8x16_aligna4_alignc4 Tactic: 0x1fb62367b99fe633 Time: 0.00540715
[07/07/2026-02:11:00] [V] [TRT] Tactic Name: sm80_xmma_fprop_implicit_gemm_indexed_wo_smem_f16f16_f16f16_f16_nhwckrsc_nhwc_tilesize128x16x64_stage1_warpsize4x1x1_g1_tensor16x8x16_aligna2_alignc2 Tactic: 0xdc0e0882e8ef55d1 Time: 0.00771537
[07/07/2026-02:11:00] [V] [TRT] Tactic Name: sm80_xmma_fprop_implicit_gemm_indexed_wo_smem_f16f16_f16f16_f16_nhwckrsc_nhwc_tilesize128x16x64_stage1_warpsize4x1x1_g1_tensor16x8x16_aligna4_alignc4 Tactic: 0x98e92db98836b738 Time: 0.00521567
[07/07/2026-02:11:00] [V] [TRT] Tactic Name: sm75_xmma_fprop_implicit_gemm_indexed_wo_smem_f16f16_f16f16_f16_nhwckrsc_nhwc_tilesize128x16x32_stage1_warpsize4x1x1_g1_tensor16x8x8_aligna2_alignc2 Tactic: 0xc93552e3e587bd46 Time: 0.007648
[07/07/2026-02:11:00] [V] [TRT] Tactic Name: sm80_xmma_fprop_implicit_gemm_indexed_wo_smem_f16f16_f16f16_f16_nhwckrsc_nhwc_tilesize128x16x32_stage1_warpsize4x1x1_g1_tensor16x8x16_aligna4_alignc2 Tactic: 0x90e2d6b4ee50185b Time: 0.00678753
[07/07/2026-02:11:00] [V] [TRT] Tactic Name: sm80_xmma_fprop_implicit_gemm_indexed_wo_smem_f16f16_f16f16_f16_nhwckrsc_nhwc_tilesize128x32x16_stage1_warpsize4x1x1_g1_tensor16x8x16_aligna4_alignc4 Tactic: 0x72c5a15b17fc333a Time: 0.00626961
[07/07/2026-02:11:00] [V] [TRT] node_conv2d + node_relu (CaskConvolution[0x80000009]) profiling completed in 0.0880687 seconds. Fastest Tactic: 0x98e92db98836b738 Time: 0.00521567
[07/07/2026-02:11:00] [V] [TRT] Skipping CaskFlattenConvolution: No valid tactics for node_conv2d + node_relu
[07/07/2026-02:11:00] [V] [TRT] >>>>>>>>>>>>>>> Chose Runner Type: CaskConvolution Tactic: 0x98e92db98836b738
[07/07/2026-02:11:00] [V] [TRT] *************** Autotuning format combination: Half(784,1:4,28,1) -> Half(6272,1:4,224,8) ***************
[07/07/2026-02:11:00] [V] [TRT] Skipping CaskConvolution: No valid tactics for node_conv2d + node_relu
[07/07/2026-02:11:00] [V] [TRT] Skipping CaskFlattenConvolution: No valid tactics for node_conv2d + node_relu
[07/07/2026-02:11:00] [V] [TRT] *************** Autotuning format combination: Half(784,1:4,28,1) -> Half(3136,1:8,112,4) ***************
[07/07/2026-02:11:00] [V] [TRT] --------------- Timing Runner: node_conv2d + node_relu (CaskConvolution[0x80000009])
[07/07/2026-02:11:00] [V] [TRT] Tactic Name: sm80_xmma_fprop_implicit_gemm_indexed_wo_smem_f16f16_f16f16_f16_nhwckrsc_nhwc_tilesize128x32x64_stage1_warpsize4x1x1_g1_tensor16x8x16_aligna8_alignc8 Tactic: 0x280b0ad3c23d8442 Time: 0.00658057
[07/07/2026-02:11:00] [V] [TRT] Tactic Name: sm80_xmma_fprop_implicit_gemm_indexed_wo_smem_f16f16_f16f16_f16_nhwckrsc_nhwc_tilesize128x16x32_stage1_warpsize4x1x1_g1_tensor16x8x16_aligna8_alignc2 Tactic: 0x955dd84f2f723fdc Time: 0.00810641
[07/07/2026-02:11:00] [V] [TRT] Tactic Name: sm75_xmma_fprop_implicit_gemm_indexed_wo_smem_f16f16_f16f16_f16_nhwckrsc_nhwc_tilesize128x32x64_stage1_warpsize4x1x1_g1_tensor16x8x8_aligna4_alignc4 Tactic: 0xd4e0dd17e4d87903 Time: 0.00794413
[07/07/2026-02:11:00] [V] [TRT] Tactic Name: sm75_xmma_fprop_implicit_gemm_indexed_wo_smem_f16f16_f16f16_f16_nhwckrsc_nhwc_tilesize128x32x16_stage1_warpsize4x1x1_g1_tensor16x8x8_aligna8_alignc2 Tactic: 0x3a86e11129b59d36 Time: 0.00959969
[07/07/2026-02:11:00] [V] [TRT] Tactic Name: sm75_xmma_fprop_implicit_gemm_indexed_wo_smem_f16f16_f16f16_f16_nhwckrsc_nhwc_tilesize128x32x16_stage1_warpsize4x1x1_g1_tensor16x8x8_aligna4_alignc2 Tactic: 0x3f39efeae897bab1 Time: 0.00938086
[07/07/2026-02:11:00] [V] [TRT] Tactic Name: sm80_xmma_fprop_implicit_gemm_indexed_wo_smem_f16f16_f16f16_f16_nhwckrsc_nhwc_tilesize128x32x64_stage1_warpsize4x1x1_g1_tensor16x8x16_aligna2_alignc4 Tactic: 0x6a76904d34985d11 Time: 0.0102896
[07/07/2026-02:11:00] [V] [TRT] Tactic Name: sm80_xmma_fprop_implicit_gemm_indexed_wo_smem_f16f16_f16f16_f16_nhwckrsc_nhwc_tilesize128x16x64_stage1_warpsize4x1x1_g1_tensor16x8x16_aligna8_alignc8 Tactic: 0x112767cf498572ea Time: 0.00556765
[07/07/2026-02:11:00] [V] [TRT] Tactic Name: sm80_xmma_fprop_implicit_gemm_indexed_wo_smem_f16f16_f16f16_f16_nhwckrsc_nhwc_tilesize128x32x64_stage1_warpsize4x1x1_g1_tensor16x8x16_aligna2_alignc2 Tactic: 0xe522659e6357a379 Time: 0.0111103
[07/07/2026-02:11:00] [V] [TRT] Tactic Name: sm75_xmma_fprop_implicit_gemm_indexed_wo_smem_f16f16_f16f16_f16_nhwckrsc_nhwc_tilesize128x16x32_stage1_warpsize4x1x1_g1_tensor16x8x8_aligna2_alignc4 Tactic: 0x4661a730b248432e Time: 0.010607
[07/07/2026-02:11:00] [V] [TRT] Tactic Name: sm80_xmma_fprop_implicit_gemm_indexed_wo_smem_f16f16_f16f16_f16_nhwckrsc_nhwc_tilesize128x32x64_stage1_warpsize4x1x1_g1_tensor16x8x16_aligna4_alignc2 Tactic: 0x2e91b5765441bff8 Time: 0.00752553
[07/07/2026-02:11:00] [V] [TRT] Tactic Name: sm75_xmma_fprop_implicit_gemm_indexed_wo_smem_f16f16_f16f16_f16_nhwckrsc_nhwc_tilesize128x32x16_stage1_warpsize4x1x1_g1_tensor16x8x8_aligna2_alignc8 Tactic: 0xf7af8e5c88dfba0d Time: 0.0125451
[07/07/2026-02:11:00] [V] [TRT] Tactic Name: sm75_xmma_fprop_implicit_gemm_indexed_wo_smem_f16f16_f16f16_f16_nhwckrsc_nhwc_tilesize128x16x32_stage1_warpsize4x1x1_g1_tensor16x8x8_aligna8_alignc4 Tactic: 0x886d7923447c7828 Time: 0.00742034
[07/07/2026-02:11:00] [V] [TRT] Tactic Name: sm75_xmma_fprop_implicit_gemm_indexed_wo_smem_f16f16_f16f16_f16_nhwckrsc_nhwc_tilesize128x16x32_stage1_warpsize4x1x1_g1_tensor16x8x8_aligna4_alignc4 Tactic: 0x8dd277d8855e5faf Time: 0.00739726
[07/07/2026-02:11:00] [V] [TRT] Tactic Name: sm75_xmma_fprop_implicit_gemm_indexed_wo_smem_f16f16_f16f16_f16_nhwckrsc_nhwc_tilesize128x32x64_stage1_warpsize4x1x1_g1_tensor16x8x8_aligna2_alignc8 Tactic: 0x93224972d35f87d7 Time: 0.0105907
[07/07/2026-02:11:00] [V] [TRT] Tactic Name: sm75_xmma_fprop_implicit_gemm_indexed_wo_smem_f16f16_f16f16_f16_nhwckrsc_nhwc_tilesize128x32x64_stage1_warpsize4x1x1_g1_tensor16x8x8_aligna2_alignc2 Tactic: 0x9007f82c84019bea Time: 0.0111286
[07/07/2026-02:11:00] [V] [TRT] Tactic Name: sm80_xmma_fprop_implicit_gemm_indexed_wo_smem_f16f16_f16f16_f16_nhwckrsc_nhwc_tilesize128x32x16_stage1_warpsize4x1x1_g1_tensor16x8x16_aligna2_alignc2 Tactic: 0x362284607725d1d3 Time: 0.0141477
[07/07/2026-02:11:00] [V] [TRT] Tactic Name: sm80_xmma_fprop_implicit_gemm_indexed_wo_smem_f16f16_f16f16_f16_nhwckrsc_nhwc_tilesize128x16x32_stage1_warpsize4x1x1_g1_tensor16x8x16_aligna8_alignc4 Tactic: 0x1a092d9c78bdc1b4 Time: 0.00647712
[07/07/2026-02:11:00] [V] [TRT] Tactic Name: sm80_xmma_fprop_implicit_gemm_indexed_wo_smem_f16f16_f16f16_f16_nhwckrsc_nhwc_tilesize128x16x32_stage1_warpsize4x1x1_g1_tensor16x8x16_aligna4_alignc8 Tactic: 0x93c767eab90e0466 Time: 0.00710509
[07/07/2026-02:11:00] [V] [TRT] Tactic Name: sm75_xmma_fprop_implicit_gemm_indexed_wo_smem_f16f16_f16f16_f16_nhwckrsc_nhwc_tilesize128x32x16_stage1_warpsize4x1x1_g1_tensor16x8x8_aligna4_alignc4 Tactic: 0xb06d1a39bf5844d9 Time: 0.00849802
[07/07/2026-02:11:00] [V] [TRT] Tactic Name: sm80_xmma_fprop_implicit_gemm_indexed_wo_smem_f16f16_f16f16_f16_nhwckrsc_nhwc_tilesize128x32x16_stage1_warpsize4x1x1_g1_tensor16x8x16_aligna8_alignc8 Tactic: 0xfb0beb2dd64ff6e8 Time: 0.00766893
[07/07/2026-02:11:00] [V] [TRT] Tactic Name: sm75_xmma_fprop_implicit_gemm_indexed_wo_smem_f16f16_f16f16_f16_nhwckrsc_nhwc_tilesize128x16x32_stage1_warpsize4x1x1_g1_tensor16x8x8_aligna8_alignc8 Tactic: 0x041c3dae44ed9a7d Time: 0.00747406
[07/07/2026-02:11:00] [V] [TRT] Tactic Name: sm80_xmma_fprop_implicit_gemm_indexed_wo_smem_f16f16_f16f16_f16_nhwckrsc_nhwc_tilesize128x32x16_stage1_warpsize4x1x1_g1_tensor16x8x16_aligna8_alignc4 Tactic: 0x777aafa0d6de14bd Time: 0.00768529
[07/07/2026-02:11:00] [V] [TRT] Tactic Name: sm80_xmma_fprop_implicit_gemm_indexed_wo_smem_f16f16_f16f16_f16_nhwckrsc_nhwc_tilesize128x32x16_stage1_warpsize4x1x1_g1_tensor16x8x16_aligna4_alignc2 Tactic: 0xfd9154884033cd52 Time: 0.00838806
[07/07/2026-02:11:00] [V] [TRT] Tactic Name: sm75_xmma_fprop_implicit_gemm_indexed_wo_smem_f16f16_f16f16_f16_nhwckrsc_nhwc_tilesize128x16x64_stage1_warpsize4x1x1_g1_tensor16x8x8_aligna4_alignc8 Tactic: 0x60960abcd63a734f Time: 0.00662026
[07/07/2026-02:11:00] [V] [TRT] Tactic Name: sm80_xmma_fprop_implicit_gemm_indexed_wo_smem_f16f16_f16f16_f16_nhwckrsc_nhwc_tilesize128x16x64_stage1_warpsize4x1x1_g1_tensor16x8x16_aligna8_alignc2 Tactic: 0x1202d6911edb6ed7 Time: 0.00672187
[07/07/2026-02:11:00] [V] [TRT] Tactic Name: sm80_xmma_fprop_implicit_gemm_indexed_wo_smem_f16f16_f16f16_f16_nhwckrsc_nhwc_tilesize128x32x16_stage1_warpsize4x1x1_g1_tensor16x8x16_aligna2_alignc4 Tactic: 0xb97671b320ea2fbb Time: 0.0133099
[07/07/2026-02:11:00] [V] [TRT] Tactic Name: sm80_xmma_fprop_implicit_gemm_indexed_wo_smem_f16f16_f16f16_f16_nhwckrsc_nhwc_tilesize128x32x64_stage1_warpsize4x1x1_g1_tensor16x8x16_aligna2_alignc8 Tactic: 0xe607d4c03409bf44 Time: 0.0105949
[07/07/2026-02:11:00] [V] [TRT] Tactic Name: sm80_xmma_fprop_implicit_gemm_indexed_wo_smem_f16f16_f16f16_f16_nhwckrsc_nhwc_tilesize128x32x64_stage1_warpsize4x1x1_g1_tensor16x8x16_aligna8_alignc2 Tactic: 0x2b2ebb8d9563987f Time: 0.00754647
[07/07/2026-02:11:00] [V] [TRT] Tactic Name: sm75_xmma_fprop_implicit_gemm_indexed_wo_smem_f16f16_f16f16_f16_nhwckrsc_nhwc_tilesize128x16x64_stage1_warpsize4x1x1_g1_tensor16x8x8_aligna2_alignc4 Tactic: 0x27549ed9e1bd8d9b Time: 0.0118622
[07/07/2026-02:11:00] [V] [TRT] Tactic Name: sm80_xmma_fprop_implicit_gemm_indexed_wo_smem_f16f16_f16f16_f16_nhwckrsc_nhwc_tilesize128x16x32_stage1_warpsize4x1x1_g1_tensor16x8x16_aligna8_alignc8 Tactic: 0x96786911782c23e1 Time: 0.00679106
[07/07/2026-02:11:00] [V] [TRT] Tactic Name: sm75_xmma_fprop_implicit_gemm_indexed_wo_smem_f16f16_f16f16_f16_nhwckrsc_nhwc_tilesize128x32x64_stage1_warpsize4x1x1_g1_tensor16x8x8_aligna4_alignc8 Tactic: 0x5891999ae4499b56 Time: 0.00781618
[07/07/2026-02:11:00] [V] [TRT] Tactic Name: sm75_xmma_fprop_implicit_gemm_indexed_wo_smem_f16f16_f16f16_f16_nhwckrsc_nhwc_tilesize128x32x16_stage1_warpsize4x1x1_g1_tensor16x8x8_aligna2_alignc2 Tactic: 0xf48a3f02df81a630 Time: 0.0130614
[07/07/2026-02:11:00] [V] [TRT] Tactic Name: sm75_xmma_fprop_implicit_gemm_indexed_wo_smem_f16f16_f16f16_f16_nhwckrsc_nhwc_tilesize128x16x64_stage1_warpsize4x1x1_g1_tensor16x8x8_aligna4_alignc4 Tactic: 0xece74e31d6ab911a Time: 0.00678857
[07/07/2026-02:11:00] [V] [TRT] Tactic Name: sm75_xmma_fprop_implicit_gemm_indexed_wo_smem_f16f16_f16f16_f16_nhwckrsc_nhwc_tilesize128x32x16_stage1_warpsize4x1x1_g1_tensor16x8x8_aligna2_alignc4 Tactic: 0x7bdecad1884e5858 Time: 0.0122655
[07/07/2026-02:11:00] [V] [TRT] Tactic Name: sm75_xmma_fprop_implicit_gemm_indexed_wo_smem_f16f16_f16f16_f16_nhwckrsc_nhwc_tilesize128x32x64_stage1_warpsize4x1x1_g1_tensor16x8x8_aligna2_alignc4 Tactic: 0x1f530dffd3ce6582 Time: 0.0121493
[07/07/2026-02:11:00] [V] [TRT] Tactic Name: sm75_xmma_fprop_implicit_gemm_indexed_wo_smem_f16f16_f16f16_f16_nhwckrsc_nhwc_tilesize128x32x16_stage1_warpsize4x1x1_g1_tensor16x8x8_aligna4_alignc8 Tactic: 0x3c1c5eb4bfc9a68c Time: 0.00853109
[07/07/2026-02:11:00] [V] [TRT] Tactic Name: sm75_xmma_fprop_implicit_gemm_indexed_wo_smem_f16f16_f16f16_f16_nhwckrsc_nhwc_tilesize128x16x32_stage1_warpsize4x1x1_g1_tensor16x8x8_aligna4_alignc8 Tactic: 0x01a3335585cfbdfa Time: 0.00738377
[07/07/2026-02:11:00] [V] [TRT] Tactic Name: sm75_xmma_fprop_implicit_gemm_indexed_wo_smem_f16f16_f16f16_f16_nhwckrsc_nhwc_tilesize128x16x64_stage1_warpsize4x1x1_g1_tensor16x8x8_aligna8_alignc4 Tactic: 0xe95840ca1789b69d Time: 0.00655273
[07/07/2026-02:11:00] [V] [TRT] Tactic Name: sm80_xmma_fprop_implicit_gemm_indexed_wo_smem_f16f16_f16f16_f16_nhwckrsc_nhwc_tilesize128x32x16_stage1_warpsize4x1x1_g1_tensor16x8x16_aligna2_alignc8 Tactic: 0x3507353e207bcdee Time: 0.0124461
[07/07/2026-02:11:00] [V] [TRT] Tactic Name: sm80_xmma_fprop_implicit_gemm_indexed_wo_smem_f16f16_f16f16_f16_nhwckrsc_nhwc_tilesize128x16x32_stage1_warpsize4x1x1_g1_tensor16x8x16_aligna2_alignc4 Tactic: 0xd405f38f8e89fab2 Time: 0.0112672
[07/07/2026-02:11:00] [V] [TRT] Tactic Name: sm80_xmma_fprop_implicit_gemm_indexed_wo_smem_f16f16_f16f16_f16_nhwckrsc_nhwc_tilesize128x16x32_stage1_warpsize4x1x1_g1_tensor16x8x16_aligna2_alignc8 Tactic: 0x5874b7028e1818e7 Time: 0.0108869
[07/07/2026-02:11:00] [V] [TRT] Tactic Name: sm75_xmma_fprop_implicit_gemm_indexed_wo_smem_f16f16_f16f16_f16_nhwckrsc_nhwc_tilesize128x16x64_stage1_warpsize4x1x1_g1_tensor16x8x8_aligna8_alignc8 Tactic: 0x65290447171854c8 Time: 0.00624676
[07/07/2026-02:11:00] [V] [TRT] Tactic Name: sm80_xmma_fprop_implicit_gemm_indexed_wo_smem_f16f16_f16f16_f16_nhwckrsc_nhwc_tilesize128x16x64_stage1_warpsize4x1x1_g1_tensor16x8x16_aligna4_alignc2 Tactic: 0x17bdd86adff94950 Time: 0.00780848
[07/07/2026-02:11:00] [V] [TRT] Tactic Name: sm75_xmma_fprop_implicit_gemm_indexed_wo_smem_f16f16_f16f16_f16_nhwckrsc_nhwc_tilesize128x16x64_stage1_warpsize4x1x1_g1_tensor16x8x8_aligna8_alignc2 Tactic: 0x660cb519404648f5 Time: 0.00690482
[07/07/2026-02:11:00] [V] [TRT] Tactic Name: sm75_xmma_fprop_implicit_gemm_indexed_wo_smem_f16f16_f16f16_f16_nhwckrsc_nhwc_tilesize128x32x64_stage1_warpsize4x1x1_g1_tensor16x8x8_aligna8_alignc8 Tactic: 0x5d2e9761256bbcd1 Time: 0.00874676
[07/07/2026-02:11:00] [V] [TRT] Tactic Name: sm80_xmma_fprop_implicit_gemm_indexed_wo_smem_f16f16_f16f16_f16_nhwckrsc_nhwc_tilesize128x16x64_stage1_warpsize4x1x1_g1_tensor16x8x16_aligna2_alignc4 Tactic: 0x535afd51bf20abb9 Time: 0.0115573
[07/07/2026-02:11:00] [V] [TRT] Tactic Name: sm75_xmma_fprop_implicit_gemm_indexed_wo_smem_f16f16_f16f16_f16_nhwckrsc_nhwc_tilesize128x16x32_stage1_warpsize4x1x1_g1_tensor16x8x8_aligna4_alignc2 Tactic: 0x0286820bd291a1c7 Time: 0.00780271
[07/07/2026-02:11:00] [V] [TRT] Tactic Name: sm75_xmma_fprop_implicit_gemm_indexed_wo_smem_f16f16_f16f16_f16_nhwckrsc_nhwc_tilesize128x16x64_stage1_warpsize4x1x1_g1_tensor16x8x8_aligna2_alignc2 Tactic: 0xa8006b0ab67273f3 Time: 0.0121535
[07/07/2026-02:11:00] [V] [TRT] Tactic Name: sm80_xmma_fprop_implicit_gemm_indexed_wo_smem_f16f16_f16f16_f16_nhwckrsc_nhwc_tilesize128x16x64_stage1_warpsize4x1x1_g1_tensor16x8x16_aligna8_alignc4 Tactic: 0x9d562342491490bf Time: 0.00637178
[07/07/2026-02:11:00] [V] [TRT] Tactic Name: sm80_xmma_fprop_implicit_gemm_indexed_wo_smem_f16f16_f16f16_f16_nhwckrsc_nhwc_tilesize128x32x16_stage1_warpsize4x1x1_g1_tensor16x8x16_aligna8_alignc2 Tactic: 0xf82e5a738111ead5 Time: 0.00834794
[07/07/2026-02:11:00] [V] [TRT] Tactic Name: sm75_xmma_fprop_implicit_gemm_indexed_wo_smem_f16f16_f16f16_f16_nhwckrsc_nhwc_tilesize128x32x64_stage1_warpsize4x1x1_g1_tensor16x8x8_aligna8_alignc4 Tactic: 0xd15fd3ec25fa5e84 Time: 0.00852975
[07/07/2026-02:11:00] [V] [TRT] Tactic Name: sm75_xmma_fprop_implicit_gemm_indexed_wo_smem_f16f16_f16f16_f16_nhwckrsc_nhwc_tilesize128x16x64_stage1_warpsize4x1x1_g1_tensor16x8x8_aligna4_alignc2 Tactic: 0x63b3bbe281646f72 Time: 0.00894257
[07/07/2026-02:11:00] [V] [TRT] Tactic Name: sm75_xmma_fprop_implicit_gemm_indexed_wo_smem_f16f16_f16f16_f16_nhwckrsc_nhwc_tilesize128x32x16_stage1_warpsize4x1x1_g1_tensor16x8x8_aligna8_alignc4 Tactic: 0xb5d214c27e7a635e Time: 0.00875832
[07/07/2026-02:11:00] [V] [TRT] Tactic Name: sm80_xmma_fprop_implicit_gemm_indexed_wo_smem_f16f16_f16f16_f16_nhwckrsc_nhwc_tilesize128x16x64_stage1_warpsize4x1x1_g1_tensor16x8x16_aligna2_alignc8 Tactic: 0xdf2bb9dcbfb149ec Time: 0.0121657
[07/07/2026-02:11:00] [V] [TRT] Tactic Name: sm80_xmma_fprop_implicit_gemm_indexed_wo_smem_f16f16_f16f16_f16_nhwckrsc_nhwc_tilesize128x32x64_stage1_warpsize4x1x1_g1_tensor16x8x16_aligna4_alignc4 Tactic: 0xa1c540a5038e4190 Time: 0.00788668
[07/07/2026-02:11:00] [V] [TRT] Tactic Name: sm80_xmma_fprop_implicit_gemm_indexed_wo_smem_f16f16_f16f16_f16_nhwckrsc_nhwc_tilesize128x32x16_stage1_warpsize4x1x1_g1_tensor16x8x16_aligna4_alignc8 Tactic: 0xfeb4e5d6176dd16f Time: 0.00774496
[07/07/2026-02:11:00] [V] [TRT] Tactic Name: sm75_xmma_fprop_implicit_gemm_indexed_wo_smem_f16f16_f16f16_f16_nhwckrsc_nhwc_tilesize128x32x64_stage1_warpsize4x1x1_g1_tensor16x8x8_aligna4_alignc2 Tactic: 0x5bb428c4b317876b Time: 0.00766725
[07/07/2026-02:11:00] [V] [TRT] Tactic Name: sm80_xmma_fprop_implicit_gemm_indexed_wo_smem_f16f16_f16f16_f16_nhwckrsc_nhwc_tilesize128x16x32_stage1_warpsize4x1x1_g1_tensor16x8x16_aligna2_alignc2 Tactic: 0x5b51065cd94604da Time: 0.0115309
[07/07/2026-02:11:00] [V] [TRT] Tactic Name: sm75_xmma_fprop_implicit_gemm_indexed_wo_smem_f16f16_f16f16_f16_nhwckrsc_nhwc_tilesize128x32x64_stage1_warpsize4x1x1_g1_tensor16x8x8_aligna8_alignc2 Tactic: 0x5e0b263f7235a0ec Time: 0.00766749
[07/07/2026-02:11:00] [V] [TRT] Tactic Name: sm80_xmma_fprop_implicit_gemm_indexed_wo_smem_f16f16_f16f16_f16_nhwckrsc_nhwc_tilesize128x32x64_stage1_warpsize4x1x1_g1_tensor16x8x16_aligna4_alignc8 Tactic: 0x2db40428031fa3c5 Time: 0.00787393
[07/07/2026-02:11:00] [V] [TRT] Tactic Name: sm80_xmma_fprop_implicit_gemm_indexed_wo_smem_f16f16_f16f16_f16_nhwckrsc_nhwc_tilesize128x32x64_stage1_warpsize4x1x1_g1_tensor16x8x16_aligna8_alignc4 Tactic: 0xa47a4e5ec2ac6617 Time: 0.00639881
[07/07/2026-02:11:00] [V] [TRT] Tactic Name: sm80_xmma_fprop_implicit_gemm_indexed_wo_smem_f16f16_f16f16_f16_nhwckrsc_nhwc_tilesize128x16x32_stage1_warpsize4x1x1_g1_tensor16x8x16_aligna4_alignc4 Tactic: 0x1fb62367b99fe633 Time: 0.00689263
[07/07/2026-02:11:00] [V] [TRT] Tactic Name: sm75_xmma_fprop_implicit_gemm_indexed_wo_smem_f16f16_f16f16_f16_nhwckrsc_nhwc_tilesize128x16x64_stage1_warpsize4x1x1_g1_tensor16x8x8_aligna2_alignc8 Tactic: 0xab25da54e12c6fce Time: 0.0114711
[07/07/2026-02:11:00] [V] [TRT] Tactic Name: sm80_xmma_fprop_implicit_gemm_indexed_wo_smem_f16f16_f16f16_f16_nhwckrsc_nhwc_tilesize128x16x64_stage1_warpsize4x1x1_g1_tensor16x8x16_aligna2_alignc2 Tactic: 0xdc0e0882e8ef55d1 Time: 0.0118396
[07/07/2026-02:11:00] [V] [TRT] Tactic Name: sm80_xmma_fprop_implicit_gemm_indexed_wo_smem_f16f16_f16f16_f16_nhwckrsc_nhwc_tilesize128x16x64_stage1_warpsize4x1x1_g1_tensor16x8x16_aligna4_alignc4 Tactic: 0x98e92db98836b738 Time: 0.00659449
[07/07/2026-02:11:00] [V] [TRT] Tactic Name: sm75_xmma_fprop_implicit_gemm_indexed_wo_smem_f16f16_f16f16_f16_nhwckrsc_nhwc_tilesize128x16x32_stage1_warpsize4x1x1_g1_tensor16x8x8_aligna2_alignc2 Tactic: 0xc93552e3e587bd46 Time: 0.0109195
[07/07/2026-02:11:00] [V] [TRT] Tactic Name: sm75_xmma_fprop_implicit_gemm_indexed_wo_smem_f16f16_f16f16_f16_nhwckrsc_nhwc_tilesize128x16x32_stage1_warpsize4x1x1_g1_tensor16x8x8_aligna2_alignc8 Tactic: 0xca10e3bdb2d9a17b Time: 0.0108059
[07/07/2026-02:11:00] [V] [TRT] Tactic Name: sm80_xmma_fprop_implicit_gemm_indexed_wo_smem_f16f16_f16f16_f16_nhwckrsc_nhwc_tilesize128x16x32_stage1_warpsize4x1x1_g1_tensor16x8x16_aligna4_alignc2 Tactic: 0x90e2d6b4ee50185b Time: 0.00944486
[07/07/2026-02:11:00] [V] [TRT] Tactic Name: sm75_xmma_fprop_implicit_gemm_indexed_wo_smem_f16f16_f16f16_f16_nhwckrsc_nhwc_tilesize128x16x32_stage1_warpsize4x1x1_g1_tensor16x8x8_aligna8_alignc2 Tactic: 0x07398cf013b38640 Time: 0.00717531
[07/07/2026-02:11:00] [V] [TRT] Tactic Name: sm80_xmma_fprop_implicit_gemm_indexed_wo_smem_f16f16_f16f16_f16_nhwckrsc_nhwc_tilesize128x32x16_stage1_warpsize4x1x1_g1_tensor16x8x16_aligna4_alignc4 Tactic: 0x72c5a15b17fc333a Time: 0.00825625
[07/07/2026-02:11:00] [V] [TRT] Tactic Name: sm80_xmma_fprop_implicit_gemm_indexed_wo_smem_f16f16_f16f16_f16_nhwckrsc_nhwc_tilesize128x16x64_stage1_warpsize4x1x1_g1_tensor16x8x16_aligna4_alignc8 Tactic: 0x1498693488a7556d Time: 0.00647931
[07/07/2026-02:11:00] [V] [TRT] Tactic Name: sm75_xmma_fprop_implicit_gemm_indexed_wo_smem_f16f16_f16f16_f16_nhwckrsc_nhwc_tilesize128x32x16_stage1_warpsize4x1x1_g1_tensor16x8x8_aligna8_alignc8 Tactic: 0x39a3504f7eeb810b Time: 0.00887449
[07/07/2026-02:11:00] [V] [TRT] node_conv2d + node_relu (CaskConvolution[0x80000009]) profiling completed in 0.183081 seconds. Fastest Tactic: 0x112767cf498572ea Time: 0.00556765
[07/07/2026-02:11:00] [V] [TRT] Skipping CaskFlattenConvolution: No valid tactics for node_conv2d + node_relu
[07/07/2026-02:11:00] [V] [TRT] >>>>>>>>>>>>>>> Chose Runner Type: CaskConvolution Tactic: 0x112767cf498572ea
[07/07/2026-02:11:00] [V] [TRT] *************** Autotuning format combination: Half(784,1:8,28,1) -> Float(25088,784,28,1) ***************
[07/07/2026-02:11:00] [V] [TRT] Skipping CaskConvolution: No valid tactics for node_conv2d + node_relu
[07/07/2026-02:11:00] [V] [TRT] Skipping CaskFlattenConvolution: No valid tactics for node_conv2d + node_relu
[07/07/2026-02:11:00] [V] [TRT] *************** Autotuning format combination: Half(784,1:8,28,1) -> Half(3136,1:8,112,4) ***************
[07/07/2026-02:11:00] [V] [TRT] --------------- Timing Runner: node_conv2d + node_relu (CaskConvolution[0x80000009])
[07/07/2026-02:11:00] [V] [TRT] Tactic Name: sm90_xmma_fprop_implicit_gemm_f16f16_f16f16_f16_nhwckrsc_nhwc_tilesize64x256x32_cgasize1x2x1_warpgroupsize1x1x1_g1_beta0 Tactic: 0xd38069b4d0a2a926 Time: 0.0186343
[07/07/2026-02:11:00] [V] [TRT] Tactic Name: sm90_xmma_fprop_implicit_gemm_f16f16_f16f16_f16_nhwckrsc_nhwc_tilesize64x64x64_cgasize4x4x1_warpgroupsize1x1x1_g1 Tactic: 0xc0971c6cdfee41ed Time: 0.0194126
[07/07/2026-02:11:00] [V] [TRT] Tactic Name: sm90_xmma_fprop_implicit_gemm_f16f16_f16f16_f16_nhwckrsc_nhwc_tilesize128x128x32_cgasize2x2x1_warpgroupsize1x1x1_g1_beta0 Tactic: 0x2460e8d070ac9206 Time: 0.0157111
[07/07/2026-02:11:00] [V] [TRT] Tactic Name: sm90_xmma_fprop_implicit_gemm_f16f16_f16f16_f16_nhwckrsc_nhwc_tilesize128x64x64_cgasize1x1x1_warpgroupsize1x1x1_g1 Tactic: 0x469a1d3c71e1e37f Time: 0.0135011
[07/07/2026-02:11:00] [V] [TRT] Tactic Name: sm90_xmma_fprop_implicit_gemm_f16f16_f16f16_f16_nhwckrsc_nhwc_tilesize256x64x64_cgasize1x1x1_warpgroupsize1x1x1_g1 Tactic: 0x4e2bc209336b25c3 Time: 0.0197171
[07/07/2026-02:11:00] [V] [TRT] Tactic Name: sm80_xmma_fprop_implicit_gemm_f16f16_f16f16_f16_nhwckrsc_nhwc_tilesize64x32x64_stage5_warpsize2x2x1_g1_tensor16x8x16 Tactic: 0x5820b3dda403c4d0 Time: 0.0103004
[07/07/2026-02:11:00] [V] [TRT] Tactic Name: sm80_xmma_fprop_implicit_gemm_f16f16_f16f16_f16_nhwckrsc_nhwc_tilesize64x64x64_stage4_warpsize2x2x1_g1_tensor16x8x16_t1r5s5 Tactic: 0x3cb58fae1d986253 Time: 0.0124107
[07/07/2026-02:11:00] [V] [TRT] Tactic Name: sm90_xmma_fprop_implicit_gemm_f16f16_f16f16_f16_nhwckrsc_nhwc_tilesize64x128x32_cgasize4x2x1_warpgroupsize1x1x1_g1 Tactic: 0x054e5f9f532e8027 Time: 0.0145609
[07/07/2026-02:11:00] [V] [TRT] Tactic Name: sm90_xmma_fprop_implicit_gemm_f16f16_f16f16_f16_nhwckrsc_nhwc_tilesize256x64x64_cgasize2x2x1_warpgroupsize1x1x1_g1 Tactic: 0x3686df20956ce345 Time: 0.0150112
[07/07/2026-02:11:00] [V] [TRT] Tactic Name: sm80_xmma_fprop_implicit_gemm_indexed_f16f16_f16f16_f16_nhwckrsc_nhwc_tilesize256x128x32_stage3_warpsize4x2x1_g1_tensor16x8x16 Tactic: 0xb17d53d15dfbfc9e Time: 0.0218985
[07/07/2026-02:11:00] [V] [TRT] Tactic Name: sm90_xmma_fprop_implicit_gemm_f16f16_f16f16_f16_nhwckrsc_nhwc_tilesize256x128x64_cgasize2x1x1_warpgroupsize1x1x1_g1_beta0 Tactic: 0xbd26b4bbf06f7274 Time: 0.0236754
[07/07/2026-02:11:00] [V] [TRT] Tactic Name: sm80_xmma_fprop_implicit_gemm_indexed_f16f16_f16f16_f16_nhwckrsc_nhwc_tilesize128x64x64_stage3_warpsize2x2x1_g1_tensor16x8x16 Tactic: 0x21b295c0c8f6c95a Time: 0.0173003
[07/07/2026-02:11:01] [V] [TRT] Tactic Name: sm90_xmma_fprop_implicit_gemm_f16f16_f16f16_f16_nhwckrsc_nhwc_tilesize128x64x64_cgasize1x4x1_warpgroupsize1x1x1_g1 Tactic: 0xf32b4c23f3cae378 Time: 0.0170951
[07/07/2026-02:11:01] [V] [TRT] Tactic Name: sm90_xmma_fprop_implicit_gemm_f16f16_f16f16_f16_nhwckrsc_nhwc_tilesize64x256x64_cgasize1x2x1_warpgroupsize1x1x1_g1 Tactic: 0x3f78311127ff1926 Time: 0.0290341
[07/07/2026-02:11:01] [V] [TRT] Tactic Name: sm90_xmma_fprop_implicit_gemm_f16f16_f16f16_f16_nhwckrsc_nhwc_tilesize256x64x32_cgasize1x2x1_warpgroupsize1x1x1_g1 Tactic: 0xe1e3517c5b2ff3f6 Time: 0.0136727
[07/07/2026-02:11:01] [V] [TRT] Tactic Name: sm90_xmma_fprop_implicit_gemm_f16f16_f16f16_f16_nhwckrsc_nhwc_tilesize64x256x32_cgasize1x1x1_warpgroupsize1x1x1_g1 Tactic: 0x90b0a2644fbbcf13 Time: 0.0177072
[07/07/2026-02:11:01] [V] [TRT] Tactic Name: sm90_xmma_fprop_implicit_gemm_f16f16_f16f16_f16_nhwckrsc_nhwc_tilesize64x128x32_warpgroupsize1x1x1_g1_beta0 Tactic: 0x499409533fde7271 Time: 0.0184223
[07/07/2026-02:11:01] [V] [TRT] Tactic Name: sm75_xmma_fprop_implicit_gemm_f16f16_f16f16_f16_nhwckrsc_nhwc_tilesize128x128x32_stage1_warpsize2x2x1_g1_tensor16x8x8 Tactic: 0x15ecbd82c22a023f Time: 0.0183274
[07/07/2026-02:11:01] [V] [TRT] Tactic Name: sm80_xmma_fprop_implicit_gemm_indexed_wo_smem_f16f16_f16f16_f16_nhwckrsc_nhwc_tilesize128x16x32_stage1_warpsize4x1x1_g1_tensor16x8x16_alignc2 Tactic: 0xf8d05b73dd3c8ff0 Time: 0.00799619
[07/07/2026-02:11:01] [V] [TRT] Tactic Name: sm90_xmma_fprop_implicit_gemm_f16f16_f16f16_f16_nhwckrsc_nhwc_tilesize256x128x64_cgasize1x1x1_warpgroupsize1x1x1_g1_beta0 Tactic: 0x9c2d9784cd25bbcc Time: 0.0230158
[07/07/2026-02:11:01] [V] [TRT] Tactic Name: sm90_xmma_fprop_implicit_gemm_f16f16_f16f16_f16_nhwckrsc_nhwc_tilesize128x128x64_warpgroupsize1x1x1_g1_beta0 Tactic: 0xcb76c907cf987d7b Time: 0.0173288
[07/07/2026-02:11:01] [V] [TRT] Tactic Name: sm90_xmma_fprop_implicit_gemm_f16f16_f16f16_f16_nhwckrsc_nhwc_tilesize64x64x64_cgasize2x1x1_warpgroupsize1x1x1_g1 Tactic: 0x5d5de9351207331c Time: 0.0107298
[07/07/2026-02:11:01] [V] [TRT] Tactic Name: sm90_xmma_fprop_implicit_gemm_f16f16_f16f16_f16_nhwckrsc_nhwc_tilesize64x64x64_cgasize1x1x1_warpgroupsize1x1x1_g1_beta0 Tactic: 0xc5b678b79dec25fd Time: 0.0125505
[07/07/2026-02:11:01] [V] [TRT] Tactic Name: sm90_xmma_fprop_implicit_gemm_f16f16_f16f16_f16_nhwckrsc_nhwc_tilesize64x256x64_cgasize2x2x1_warpgroupsize1x1x1_g1 Tactic: 0x2b45e332001e205d Time: 0.0344786
[07/07/2026-02:11:01] [V] [TRT] Tactic Name: sm90_xmma_fprop_implicit_gemm_f16f16_f16f16_f16_nhwckrsc_nhwc_tilesize64x64x64_cgasize2x2x1_warpgroupsize1x1x1_g1 Tactic: 0x31cd263f93e1cce1 Time: 0.0163815
[07/07/2026-02:11:01] [V] [TRT] Tactic Name: sm80_xmma_fprop_implicit_gemm_f16f16_f16f16_f16_nhwckrsc_nhwc_tilesize256x128x64_stage3_warpsize4x2x1_g1_tensor16x8x16_t1r5s5 Tactic: 0xdf9012245c1be0b4 Time: 0.0341595
[07/07/2026-02:11:01] [V] [TRT] Tactic Name: sm90_xmma_fprop_implicit_gemm_f16f16_f16f16_f16_nhwckrsc_nhwc_tilesize64x64x32_cgasize4x1x1_warpgroupsize1x1x1_g1 Tactic: 0xb67e110cb4676822 Time: 0.010608
[07/07/2026-02:11:01] [V] [TRT] Tactic Name: sm80_xmma_fprop_implicit_gemm_indexed_wo_smem_f16f16_f16f16_f16_nhwckrsc_nhwc_tilesize128x32x64_stage1_warpsize4x1x1_g1_tensor16x8x16_aligna8_alignc8 Tactic: 0x280b0ad3c23d8442 Time: 0.00929257
[07/07/2026-02:11:01] [V] [TRT] Tactic Name: sm75_xmma_fprop_implicit_gemm_f16f16_f16f16_f16_nhwckrsc_nhwc_tilesize64x256x64_stage1_warpsize1x4x2_g1_tensor16x8x8_t1r5s5 Tactic: 0xa52496945cd3400a Time: 0.0262545
[07/07/2026-02:11:01] [V] [TRT] Tactic Name: sm80_xmma_fprop_implicit_gemm_indexed_wo_smem_f16f16_f16f16_f16_nhwckrsc_nhwc_tilesize128x16x64_stage1_warpsize4x1x1_g1_tensor16x8x16_alignc2 Tactic: 0x2af09e2880d6293f Time: 0.0074784
[07/07/2026-02:11:01] [V] [TRT] Tactic Name: sm90_xmma_fprop_implicit_gemm_f16f16_f16f16_f16_nhwckrsc_nhwc_tilesize128x64x64_cgasize4x1x1_warpgroupsize1x1x1_g1_beta0 Tactic: 0x445095b78d582a01 Time: 0.0122457
[07/07/2026-02:11:01] [V] [TRT] Tactic Name: sm90_xmma_fprop_implicit_gemm_f16f16_f16f16_f16_nhwckrsc_nhwc_tilesize128x64x64_cgasize2x4x1_warpgroupsize1x1x1_g1 Tactic: 0xe7169e00d42bda03 Time: 0.0171683
[07/07/2026-02:11:01] [V] [TRT] Tactic Name: sm90_xmma_fprop_implicit_gemm_f16f16_f16f16_f16_nhwckrsc_nhwc_tilesize64x64x64_warpgroupsize1x1x1_g1 Tactic: 0xae080317ddbc9f75 Time: 0.0166557
[07/07/2026-02:11:01] [V] [TRT] Tactic Name: sm90_xmma_fprop_implicit_gemm_f16f16_f16f16_f16_nhwckrsc_nhwc_tilesize256x128x64_cgasize1x2x1_warpgroupsize1x1x1_g1 Tactic: 0xb3dce81d47c7f2ae Time: 0.0232281
[07/07/2026-02:11:01] [V] [TRT] Tactic Name: sm75_xmma_fprop_implicit_gemm_f16f16_f16f16_f16_nhwckrsc_nhwc_tilesize128x256x32_stage1_warpsize2x4x1_g1_tensor16x8x8 Tactic: 0xf368aae1fb20baa1 Time: 0.0268114
[07/07/2026-02:11:01] [V] [TRT] Tactic Name: sm90_xmma_fprop_implicit_gemm_f16f16_f16f16_f16_nhwckrsc_nhwc_tilesize64x128x32_cgasize2x2x1_warpgroupsize1x1x1_g1 Tactic: 0x2d35fbd91cecf2d1 Time: 0.0184731
[07/07/2026-02:11:01] [V] [TRT] Tactic Name: sm90_xmma_fprop_implicit_gemm_f16f16_f16f16_f16_nhwckrsc_nhwc_tilesize256x128x32_warpgroupsize1x1x1_g1_beta0 Tactic: 0xab463eead9ea1b1d Time: 0.0169077
[07/07/2026-02:11:01] [V] [TRT] Tactic Name: sm90_xmma_fprop_implicit_gemm_f16f16_f16f16_f16_nhwckrsc_nhwc_tilesize256x128x64_cgasize1x1x1_warpgroupsize1x1x1_g1 Tactic: 0xdf4c2717c6210d53 Time: 0.0231399
[07/07/2026-02:11:01] [V] [TRT] Tactic Name: sm80_xmma_fprop_implicit_gemm_indexed_wo_smem_f16f16_f16f16_f16_nhwckrsc_nhwc_tilesize128x16x32_stage1_warpsize4x1x1_g1_tensor16x8x16_aligna8_alignc2 Tactic: 0x955dd84f2f723fdc Time: 0.0113129
[07/07/2026-02:11:01] [V] [TRT] Tactic Name: sm75_xmma_fprop_implicit_gemm_f16f16_f16f16_f16_nhwckrsc_nhwc_tilesize256x32x32_stage1_warpsize4x1x1_g1_tensor16x8x8 Tactic: 0x1b099f7ac29a2a6a Time: 0.0186789
[07/07/2026-02:11:01] [V] [TRT] Tactic Name: sm75_xmma_fprop_implicit_gemm_indexed_wo_smem_f16f16_f16f16_f16_nhwckrsc_nhwc_tilesize128x32x64_stage1_warpsize4x1x1_g1_tensor16x8x8_aligna4_alignc4 Tactic: 0xd4e0dd17e4d87903 Time: 0.012328
[07/07/2026-02:11:01] [V] [TRT] Tactic Name: sm90_xmma_fprop_implicit_gemm_f16f16_f16f16_f16_nhwckrsc_nhwc_tilesize64x256x32_cgasize1x1x1_warpgroupsize1x1x1_g1_beta0 Tactic: 0x160ce161e05a6c4b Time: 0.0177138
[07/07/2026-02:11:01] [V] [TRT] Tactic Name: sm75_xmma_fprop_implicit_gemm_indexed_wo_smem_f16f16_f16f16_f16_nhwckrsc_nhwc_tilesize128x32x16_stage1_warpsize4x1x1_g1_tensor16x8x8_aligna8_alignc2 Tactic: 0x3a86e11129b59d36 Time: 0.0139877
[07/07/2026-02:11:01] [V] [TRT] Tactic Name: sm75_xmma_fprop_implicit_gemm_indexed_wo_smem_f16f16_f16f16_f16_nhwckrsc_nhwc_tilesize128x32x64_stage1_warpsize4x1x1_g1_tensor16x8x8_alignc2 Tactic: 0xc6b4cc8d92337a1c Time: 0.00821841
[07/07/2026-02:11:01] [V] [TRT] Tactic Name: sm90_xmma_fprop_implicit_gemm_f16f16_f16f16_f16_nhwckrsc_nhwc_tilesize64x128x64_cgasize1x4x1_warpgroupsize1x1x1_g1 Tactic: 0x2371eb90d1621d98 Time: 0.0292151
[07/07/2026-02:11:01] [V] [TRT] Tactic Name: sm75_xmma_fprop_implicit_gemm_indexed_wo_smem_f16f16_f16f16_f16_nhwckrsc_nhwc_tilesize128x32x16_stage1_warpsize4x1x1_g1_tensor16x8x8_aligna4_alignc2 Tactic: 0x3f39efeae897bab1 Time: 0.0136781
[07/07/2026-02:11:01] [V] [TRT] Tactic Name: sm90_xmma_fprop_implicit_gemm_f16f16_f16f16_f16_nhwckrsc_nhwc_tilesize256x64x64_cgasize2x1x1_warpgroupsize1x1x1_g1_beta0 Tactic: 0x50de2f6bdd02baa2 Time: 0.0193851
[07/07/2026-02:11:01] [V] [TRT] Tactic Name: sm80_xmma_fprop_implicit_gemm_indexed_wo_smem_f16f16_f16f16_f16_nhwckrsc_nhwc_tilesize128x32x64_stage1_warpsize4x1x1_g1_tensor16x8x16_aligna2_alignc4 Tactic: 0x6a76904d34985d11 Time: 0.0160645
[07/07/2026-02:11:01] [V] [TRT] Tactic Name: sm80_xmma_fprop_implicit_gemm_f16f16_f16f16_f16_nhwckrsc_nhwc_tilesize256x32x32_stage4_warpsize4x1x1_g1_tensor16x8x16_t1r5s5 Tactic: 0xa960065019d8a47a Time: 0.0127036
[07/07/2026-02:11:01] [V] [TRT] Tactic Name: sm80_xmma_fprop_implicit_gemm_indexed_wo_smem_f16f16_f16f16_f16_nhwckrsc_nhwc_tilesize128x16x64_stage1_warpsize4x1x1_g1_tensor16x8x16_aligna8_alignc8 Tactic: 0x112767cf498572ea Time: 0.00699472
[07/07/2026-02:11:01] [V] [TRT] Tactic Name: sm80_xmma_fprop_implicit_gemm_indexed_wo_smem_f16f16_f16f16_f16_nhwckrsc_nhwc_tilesize128x32x64_stage1_warpsize4x1x1_g1_tensor16x8x16_aligna2_alignc2 Tactic: 0xe522659e6357a379 Time: 0.0175152
[07/07/2026-02:11:01] [V] [TRT] Tactic Name: sm90_xmma_fprop_implicit_gemm_f16f16_f16f16_f16_nhwckrsc_nhwc_tilesize64x64x32_cgasize1x4x1_warpgroupsize1x1x1_g1_beta0 Tactic: 0xd28ca52fb76a8f4d Time: 0.0171408
[07/07/2026-02:11:01] [V] [TRT] Tactic Name: sm75_xmma_fprop_implicit_gemm_indexed_wo_smem_f16f16_f16f16_f16_nhwckrsc_nhwc_tilesize128x16x32_stage1_warpsize4x1x1_g1_tensor16x8x8_aligna2_alignc4 Tactic: 0x4661a730b248432e Time: 0.0152951
[07/07/2026-02:11:01] [V] [TRT] Tactic Name: sm80_xmma_fprop_implicit_gemm_indexed_wo_smem_f16f16_f16f16_f16_nhwckrsc_nhwc_tilesize128x32x64_stage1_warpsize4x1x1_g1_tensor16x8x16_aligna4_alignc2 Tactic: 0x2e91b5765441bff8 Time: 0.0106031
[07/07/2026-02:11:01] [V] [TRT] Tactic Name: sm80_xmma_fprop_implicit_gemm_f16f16_f16f16_f16_nhwckrsc_nhwc_tilesize256x64x32_stage3_warpsize4x1x1_g1_tensor16x8x16 Tactic: 0xd1aaad17ca35fbaa Time: 0.014597
[07/07/2026-02:11:01] [V] [TRT] Tactic Name: sm90_xmma_fprop_implicit_gemm_f16f16_f16f16_f16_nhwckrsc_nhwc_tilesize64x128x64_cgasize1x2x1_warpgroupsize1x1x1_g1 Tactic: 0xfa507585d2afe262 Time: 0.0198429
[07/07/2026-02:11:01] [V] [TRT] Tactic Name: sm90_xmma_fprop_implicit_gemm_f16f16_f16f16_f16_nhwckrsc_nhwc_tilesize256x64x32_cgasize2x1x1_warpgroupsize1x1x1_g1 Tactic: 0x994e4c55fd283570 Time: 0.0192251
[07/07/2026-02:11:01] [V] [TRT] Tactic Name: sm90_xmma_fprop_implicit_gemm_f16f16_f16f16_f16_nhwckrsc_nhwc_tilesize64x128x32_cgasize2x1x1_warpgroupsize1x1x1_g1_beta0 Tactic: 0x1c72bb410dd9c8d6 Time: 0.0111244
[07/07/2026-02:11:01] [V] [TRT] Tactic Name: sm90_xmma_fprop_implicit_gemm_f16f16_f16f16_f16_nhwckrsc_nhwc_tilesize64x64x64_cgasize1x4x1_warpgroupsize1x1x1_g1_beta0 Tactic: 0x19fb4ee363eb74cf Time: 0.0213858
[07/07/2026-02:11:01] [V] [TRT] Tactic Name: sm90_xmma_fprop_implicit_gemm_f16f16_f16f16_f16_nhwckrsc_nhwc_tilesize128x128x32_cgasize2x1x1_warpgroupsize1x1x1_g1_beta0 Tactic: 0xe1ec60054054576b Time: 0.0142321
[07/07/2026-02:11:01] [V] [TRT] Tactic Name: sm75_xmma_fprop_implicit_gemm_indexed_wo_smem_f16f16_f16f16_f16_nhwckrsc_nhwc_tilesize128x32x16_stage1_warpsize4x1x1_g1_tensor16x8x8_aligna2_alignc8 Tactic: 0xf7af8e5c88dfba0d Time: 0.0192726
[07/07/2026-02:11:01] [V] [TRT] Tactic Name: sm75_xmma_fprop_implicit_gemm_indexed_wo_smem_f16f16_f16f16_f16_nhwckrsc_nhwc_tilesize128x16x32_stage1_warpsize4x1x1_g1_tensor16x8x8_aligna8_alignc4 Tactic: 0x886d7923447c7828 Time: 0.0103363
[07/07/2026-02:11:01] [V] [TRT] Tactic Name: sm90_xmma_fprop_implicit_gemm_f16f16_f16f16_f16_nhwckrsc_nhwc_tilesize128x128x32_cgasize1x2x1_warpgroupsize1x1x1_g1 Tactic: 0xb33df5edbf64166c Time: 0.0126564
[07/07/2026-02:11:01] [V] [TRT] Tactic Name: sm75_xmma_fprop_implicit_gemm_indexed_wo_smem_f16f16_f16f16_f16_nhwckrsc_nhwc_tilesize128x16x32_stage1_warpsize4x1x1_g1_tensor16x8x8_aligna4_alignc4 Tactic: 0x8dd277d8855e5faf Time: 0.00997608
[07/07/2026-02:11:01] [V] [TRT] Tactic Name: sm90_xmma_fprop_implicit_gemm_f16f16_f16f16_f16_nhwckrsc_nhwc_tilesize128x64x64_cgasize2x1x1_warpgroupsize1x1x1_g1_beta0 Tactic: 0x0646d3c9f7cdb971 Time: 0.0130743
[07/07/2026-02:11:01] [V] [TRT] Tactic Name: sm90_xmma_fprop_implicit_gemm_f16f16_f16f16_f16_nhwckrsc_nhwc_tilesize64x256x64_warpgroupsize1x1x1_g1_beta0 Tactic: 0xcee9514c4de88847 Time: 0.0342327
[07/07/2026-02:11:01] [V] [TRT] Tactic Name: sm90_xmma_fprop_implicit_gemm_f16f16_f16f16_f16_nhwckrsc_nhwc_tilesize64x256x64_cgasize1x1x1_warpgroupsize1x1x1_g1 Tactic: 0x53e8fe1ba619e6db Time: 0.0259413
[07/07/2026-02:11:01] [V] [TRT] Tactic Name: sm90_xmma_fprop_implicit_gemm_f16f16_f16f16_f16_nhwckrsc_nhwc_tilesize128x64x64_cgasize2x2x1_warpgroupsize1x1x1_g1 Tactic: 0x3e370015d7e625f9 Time: 0.0130834
[07/07/2026-02:11:01] [V] [TRT] Tactic Name: sm90_xmma_fprop_implicit_gemm_f16f16_f16f16_f16_nhwckrsc_nhwc_tilesize256x64x32_cgasize1x2x1_warpgroupsize1x1x1_g1_beta0 Tactic: 0x7f2e6f4d04314df5 Time: 0.0131113
[07/07/2026-02:11:01] [V] [TRT] Tactic Name: sm90_xmma_fprop_implicit_gemm_f16f16_f16f16_f16_nhwckrsc_nhwc_tilesize128x256x64_cgasize2x1x1_warpgroupsize1x1x1_g1 Tactic: 0xcde0f02f05910266 Time: 0.0229682
[07/07/2026-02:11:01] [V] [TRT] Tactic Name: sm75_xmma_fprop_implicit_gemm_indexed_f16f16_f16f16_f16_nhwckrsc_nhwc_tilesize64x128x32_stage1_warpsize2x2x1_g1_tensor16x8x8 Tactic: 0x6b44e6396887bed9 Time: 0.0140842
[07/07/2026-02:11:01] [V] [TRT] Tactic Name: sm75_xmma_fprop_implicit_gemm_indexed_wo_smem_f16f16_f16f16_f16_nhwckrsc_nhwc_tilesize128x16x64_stage1_warpsize4x1x1_g1_tensor16x8x8_alignc8 Tactic: 0xbf21db1a7c5b3781 Time: 0.00721897
[07/07/2026-02:11:01] [V] [TRT] Tactic Name: sm90_xmma_fprop_implicit_gemm_f16f16_f16f16_f16_nhwckrsc_nhwc_tilesize64x128x64_cgasize4x2x1_warpgroupsize1x1x1_g1_beta0 Tactic: 0x509f9e2693356549 Time: 0.0162636
[07/07/2026-02:11:01] [V] [TRT] Tactic Name: sm80_xmma_fprop_implicit_gemm_f16f16_f16f16_f16_nhwckrsc_nhwc_tilesize128x32x32_stage4_warpsize4x1x1_g1_tensor16x8x16 Tactic: 0x834e11ecd4ab9454 Time: 0.00921629
[07/07/2026-02:11:01] [V] [TRT] Tactic Name: sm75_xmma_fprop_implicit_gemm_indexed_wo_smem_f16f16_f16f16_f16_nhwckrsc_nhwc_tilesize128x32x64_stage1_warpsize4x1x1_g1_tensor16x8x8_aligna2_alignc8 Tactic: 0x93224972d35f87d7 Time: 0.0165714
[07/07/2026-02:11:01] [V] [TRT] Tactic Name: sm90_xmma_fprop_implicit_gemm_f16f16_f16f16_f16_nhwckrsc_nhwc_tilesize128x64x64_cgasize2x1x1_warpgroupsize1x1x1_g1 Tactic: 0x52a7cf1f5600da04 Time: 0.0133145
[07/07/2026-02:11:01] [V] [TRT] Tactic Name: sm90_xmma_fprop_implicit_gemm_f16f16_f16f16_f16_nhwckrsc_nhwc_tilesize64x256x64_warpgroupsize1x1x1_g1 Tactic: 0x04b83479d732de74 Time: 0.0349851
[07/07/2026-02:11:01] [V] [TRT] Tactic Name: sm80_xmma_fprop_implicit_gemm_indexed_f16f16_f16f16_f16_nhwckrsc_nhwc_tilesize256x64x32_stage3_warpsize4x1x1_g1_tensor16x8x16 Tactic: 0xa570c55d303796ff Time: 0.0163637
[07/07/2026-02:11:01] [V] [TRT] Tactic Name: sm90_xmma_fprop_implicit_gemm_f16f16_f16f16_f16_nhwckrsc_nhwc_tilesize64x128x64_cgasize2x2x1_warpgroupsize1x1x1_g1 Tactic: 0xee6da7a6f54edb19 Time: 0.0224327
[07/07/2026-02:11:01] [V] [TRT] Tactic Name: sm90_xmma_fprop_implicit_gemm_f16f16_f16f16_f16_nhwckrsc_nhwc_tilesize128x64x64_cgasize2x4x1_warpgroupsize1x1x1_g1_beta0 Tactic: 0xda0be59d09cae843 Time: 0.0165811
[07/07/2026-02:11:01] [V] [TRT] Tactic Name: sm90_xmma_fprop_implicit_gemm_f16f16_f16f16_f16_nhwckrsc_nhwc_tilesize128x128x64_cgasize2x1x1_warpgroupsize1x1x1_g1 Tactic: 0x08c8b4bbf0c1f922 Time: 0.0145618
[07/07/2026-02:11:01] [V] [TRT] Tactic Name: sm90_xmma_fprop_implicit_gemm_f16f16_f16f16_f16_nhwckrsc_nhwc_tilesize128x256x64_cgasize1x2x1_warpgroupsize1x1x1_g1 Tactic: 0xb54ded06a396c4e0 Time: 0.023586
[07/07/2026-02:11:01] [V] [TRT] Tactic Name: sm75_xmma_fprop_implicit_gemm_indexed_wo_smem_f16f16_f16f16_f16_nhwckrsc_nhwc_tilesize128x32x64_stage1_warpsize4x1x1_g1_tensor16x8x8_aligna2_alignc2 Tactic: 0x9007f82c84019bea Time: 0.0171439
[07/07/2026-02:11:01] [V] [TRT] Tactic Name: sm80_xmma_fprop_implicit_gemm_indexed_wo_smem_f16f16_f16f16_f16_nhwckrsc_nhwc_tilesize128x32x16_stage1_warpsize4x1x1_g1_tensor16x8x16_aligna2_alignc2 Tactic: 0x362284607725d1d3 Time: 0.022178
[07/07/2026-02:11:01] [V] [TRT] Tactic Name: sm90_xmma_fprop_implicit_gemm_f16f16_f16f16_f16_nhwckrsc_nhwc_tilesize128x64x64_cgasize4x1x1_warpgroupsize1x1x1_g1 Tactic: 0x7adc6b5919c2a8f2 Time: 0.0124164
[07/07/2026-02:11:01] [V] [TRT] Tactic Name: sm80_xmma_fprop_implicit_gemm_indexed_wo_smem_f16f16_f16f16_f16_nhwckrsc_nhwc_tilesize128x16x32_stage1_warpsize4x1x1_g1_tensor16x8x16_aligna8_alignc4 Tactic: 0x1a092d9c78bdc1b4 Time: 0.00849613
[07/07/2026-02:11:01] [V] [TRT] Tactic Name: sm75_xmma_fprop_implicit_gemm_f16f16_f16f16_f16_nhwckrsc_nhwc_tilesize256x32x32_stage1_warpsize4x1x1_g1_tensor16x8x8_t1r5s5 Tactic: 0x5baadd97fe9624e7 Time: 0.0159888
[07/07/2026-02:11:01] [V] [TRT] Tactic Name: sm80_xmma_fprop_implicit_gemm_f16f16_f16f16_f16_nhwckrsc_nhwc_tilesize128x64x64_stage3_warpsize2x2x1_g1_tensor16x8x16_t1r5s5 Tactic: 0x08da9063148c481f Time: 0.0150587
[07/07/2026-02:11:01] [V] [TRT] Tactic Name: sm90_xmma_fprop_implicit_gemm_f16f16_f16f16_f16_nhwckrsc_nhwc_tilesize64x128x64_cgasize1x1x1_warpgroupsize1x1x1_g1 Tactic: 0x96c0ba8f53491d9f Time: 0.0173928
[07/07/2026-02:11:01] [V] [TRT] Tactic Name: sm80_xmma_fprop_implicit_gemm_indexed_wo_smem_f16f16_f16f16_f16_nhwckrsc_nhwc_tilesize128x16x32_stage1_warpsize4x1x1_g1_tensor16x8x16_aligna4_alignc8 Tactic: 0x93c767eab90e0466 Time: 0.00955124
[07/07/2026-02:11:01] [V] [TRT] Tactic Name: sm90_xmma_fprop_implicit_gemm_f16f16_f16f16_f16_nhwckrsc_nhwc_tilesize256x64x32_cgasize1x4x1_warpgroupsize1x1x1_g1 Tactic: 0x38c2cf6958e20c0c Time: 0.0147355
[07/07/2026-02:11:01] [V] [TRT] Tactic Name: sm90_xmma_fprop_implicit_gemm_f16f16_f16f16_f16_nhwckrsc_nhwc_tilesize128x128x32_cgasize2x2x1_warpgroupsize1x1x1_g1 Tactic: 0xa70027ce98852f17 Time: 0.0156535
[07/07/2026-02:11:01] [V] [TRT] Tactic Name: sm75_xmma_fprop_implicit_gemm_indexed_wo_smem_f16f16_f16f16_f16_nhwckrsc_nhwc_tilesize128x32x16_stage1_warpsize4x1x1_g1_tensor16x8x8_aligna4_alignc4 Tactic: 0xb06d1a39bf5844d9 Time: 0.0125291
[07/07/2026-02:11:01] [V] [TRT] Tactic Name: sm90_xmma_fprop_implicit_gemm_f16f16_f16f16_f16_nhwckrsc_nhwc_tilesize128x64x64_cgasize1x4x1_warpgroupsize1x1x1_g1_beta0 Tactic: 0xfb00c6a2348021fb Time: 0.0163037
[07/07/2026-02:11:01] [V] [TRT] Tactic Name: sm80_xmma_fprop_implicit_gemm_indexed_wo_smem_f16f16_f16f16_f16_nhwckrsc_nhwc_tilesize128x32x16_stage1_warpsize4x1x1_g1_tensor16x8x16_aligna8_alignc8 Tactic: 0xfb0beb2dd64ff6e8 Time: 0.0110773
[07/07/2026-02:11:01] [V] [TRT] Tactic Name: sm90_xmma_fprop_implicit_gemm_f16f16_f16f16_f16_nhwckrsc_nhwc_tilesize256x64x64_cgasize1x4x1_warpgroupsize1x1x1_g1 Tactic: 0xfb9a9316b14025c4 Time: 0.0164312
[07/07/2026-02:11:01] [V] [TRT] Tactic Name: sm75_xmma_fprop_implicit_gemm_indexed_wo_smem_f16f16_f16f16_f16_nhwckrsc_nhwc_tilesize128x16x32_stage1_warpsize4x1x1_g1_tensor16x8x8_aligna8_alignc8 Tactic: 0x041c3dae44ed9a7d Time: 0.0105535
[07/07/2026-02:11:01] [V] [TRT] Tactic Name: sm80_xmma_fprop_implicit_gemm_indexed_wo_smem_f16f16_f16f16_f16_nhwckrsc_nhwc_tilesize128x32x16_stage1_warpsize4x1x1_g1_tensor16x8x16_aligna8_alignc4 Tactic: 0x777aafa0d6de14bd Time: 0.011052
[07/07/2026-02:11:01] [V] [TRT] Tactic Name: sm80_xmma_fprop_implicit_gemm_indexed_f16f16_f16f16_f16_nhwckrsc_nhwc_tilesize128x128x32_stage4_warpsize2x2x1_g1_tensor16x8x16 Tactic: 0x0e07ff4f4f7c1ac9 Time: 0.0148485
[07/07/2026-02:11:01] [V] [TRT] Tactic Name: sm90_xmma_fprop_implicit_gemm_f16f16_f16f16_f16_nhwckrsc_nhwc_tilesize64x64x32_cgasize1x4x1_warpgroupsize1x1x1_g1 Tactic: 0x3f8936765e6f23a8 Time: 0.0175878
[07/07/2026-02:11:01] [V] [TRT] Tactic Name: sm80_xmma_fprop_implicit_gemm_indexed_wo_smem_f16f16_f16f16_f16_nhwckrsc_nhwc_tilesize128x32x16_stage1_warpsize4x1x1_g1_tensor16x8x16_aligna4_alignc2 Tactic: 0xfd9154884033cd52 Time: 0.0114922
