cookbook/07-Tool/trtexec/result-02.log
[07/02/2026-03:47:09] [V] [TRT] *************** Autotuning format combination: Float(784,784,28,1) -> Float(25088,784,28,1) ***************
[07/02/2026-03:47:09] [V] [TRT] --------------- Timing Runner: node_conv2d + node_relu (CaskConvolution[0x80000009])
[07/02/2026-03:47:09] [V] [TRT] Tactic Name: ampere_scudnn_128x128_relu_medium_nn_v1 Tactic: 0xf067e6205da31c2e Time: 0.00840102
[07/02/2026-03:47:09] [V] [TRT] Tactic Name: ampere_scudnn_128x32_relu_small_nn_v1 Tactic: 0xa8609adc4e0ceb90 Time: 0.00692702
[07/02/2026-03:47:09] [V] [TRT] Tactic Name: ampere_scudnn_128x64_relu_medium_nn_v1 Tactic: 0xf64396b97c889179 Time: 0.00755633
[07/02/2026-03:47:09] [V] [TRT] Tactic Name: sm70_xmma_fprop_implicit_gemm_f32f32_f32f32_f32_nchwkcrs_nchw_tilesize64x64x8_stage1_warpsize1x4x1_g1_ffma_aligna4_alignc4 Tactic: 0xe40b38338a3a7d7e Time: 0.00436045
[07/02/2026-03:47:09] [V] [TRT] Tactic Name: sm70_xmma_fprop_implicit_gemm_f32f32_f32f32_f32_nchwkcrs_nchw_tilesize32x32x8_stage1_warpsize1x2x1_g1_ffma_aligna4_alignc4 Tactic: 0xf7a98be0a08d77c4 Time: 0.00405511
[07/02/2026-03:47:09] [V] [TRT] Tactic Name: sm70_xmma_fprop_implicit_gemm_f32f32_f32f32_f32_nchwkcrs_nchw_tilesize64x128x8_stage1_warpsize1x4x1_g1_ffma_aligna4_alignc4 Tactic: 0xd1338f4b38d341e2 Time: 0.00518237
[07/02/2026-03:47:09] [V] [TRT] Tactic Name: sm80_xmma_fprop_implicit_gemm_f32f32_f32f32_f32_nchwkcrs_nchw_tilesize64x128x8_stage3_warpsize1x4x1_g1_ffma_aligna4_alignc4 Tactic: 0x5aa723e0481da855 Time: 0.00534535
[07/02/2026-03:47:09] [V] [TRT] Tactic Name: sm80_xmma_fprop_implicit_gemm_f32f32_f32f32_f32_nchwkcrs_nchw_tilesize256x128x8_stage3_warpsize4x2x1_g1_ffma_aligna4_alignc4 Tactic: 0xbb8c3889c7eacd30 Time: 0.0113836
[07/02/2026-03:47:09] [V] [TRT] Tactic Name: sm70_xmma_fprop_implicit_gemm_indexed_f32f32_f32f32_f32_nchwkcrs_nchw_tilesize128x16x8_stage1_warpsize4x1x1_g1_ffma_aligna4_alignc4 Tactic: 0x65d82d184f452332 Time: 0.00473615
[07/02/2026-03:47:09] [V] [TRT] Tactic Name: sm70_xmma_fprop_implicit_gemm_indexed_f32f32_f32f32_f32_nchwkcrs_nchw_tilesize32x32x8_stage1_warpsize1x2x1_g1_ffma_aligna4_alignc4 Tactic: 0x9efed776051c0873 Time: 0.00441766
[07/02/2026-03:47:09] [V] [TRT] Tactic Name: sm70_xmma_fprop_implicit_gemm_indexed_f32f32_f32f32_f32_nchwkcrs_nchw_tilesize128x32x8_stage1_warpsize2x2x1_g1_ffma_aligna4_alignc4 Tactic: 0x8c4f6360145d6a1f Time: 0.00542188
[07/02/2026-03:47:09] [V] [TRT] Tactic Name: sm70_xmma_fprop_implicit_gemm_indexed_f32f32_f32f32_f32_nchwkcrs_nchw_tilesize64x64x8_stage1_warpsize1x4x1_g1_ffma_aligna4_alignc4 Tactic: 0x8d5c64a52fab02c9 Time: 0.0044419
[07/02/2026-03:47:09] [V] [TRT] Tactic Name: sm80_xmma_fprop_implicit_gemm_indexed_f32f32_f32f32_f32_nchwkcrs_nchw_tilesize128x64x8_stage2_warpsize4x1x1_g1_ffma_aligna4_alignc4_beta0_packed_stride Tactic: 0x1673e3594ce11cea Time: 0.00642405
[07/02/2026-03:47:09] [V] [TRT] Tactic Name: sm80_xmma_fprop_implicit_gemm_indexed_f32f32_f32f32_f32_nchwkcrs_nchw_tilesize128x16x8_stage3_warpsize4x1x1_g1_ffma_aligna4_alignc4 Tactic: 0x40a12e3938221818 Time: 0.00485669
[07/02/2026-03:47:09] [V] [TRT] Tactic Name: sm80_xmma_fprop_implicit_gemm_indexed_f32f32_f32f32_f32_nchwkcrs_nchw_tilesize128x32x8_stage3_warpsize2x2x1_g1_ffma_aligna4_alignc4 Tactic: 0xa9366041633a5135 Time: 0.00521976
[07/02/2026-03:47:09] [V] [TRT] Tactic Name: sm80_xmma_fprop_implicit_gemm_f32f32_f32f32_f32_nchwkcrs_nchw_tilesize32x32x8_stage3_warpsize1x2x1_g1_ffma_t1r5s5_aligna4_alignc4 Tactic: 0x5b8bf1b8028629d9 Time: 0.00403289
[07/02/2026-03:47:09] [V] [TRT] Tactic Name: sm70_xmma_fprop_implicit_gemm_f32f32_f32f32_f32_nchwkcrs_nchw_tilesize32x32x8_stage1_warpsize1x2x1_g1_ffma_t1r5s5_aligna4_alignc4 Tactic: 0x7e1e4d26cfa285f9 Time: 0.00405892
[07/02/2026-03:47:09] [V] [TRT] Tactic Name: ampere_scudnn_128x64_relu_small_nn_v1 Tactic: 0x3f243c490d502deb Time: 0.0070707
[07/02/2026-03:47:09] [V] [TRT] Tactic Name: sm70_xmma_fprop_implicit_gemm_f32f32_f32f32_f32_nchwkcrs_nchw_tilesize128x16x8_stage1_warpsize4x1x1_g1_ffma_aligna4_alignc4 Tactic: 0x160b77f4a95ab6d3 Time: 0.00514743
[07/02/2026-03:47:09] [V] [TRT] Tactic Name: sm70_xmma_fprop_implicit_gemm_f32f32_f32f32_f32_nchwkcrs_nchw_tilesize128x64x8_stage1_warpsize2x2x1_g1_ffma_aligna4_alignc4 Tactic: 0x994f5b723e2d80da Time: 0.00553864
[07/02/2026-03:47:09] [V] [TRT] Tactic Name: sm80_xmma_fprop_implicit_gemm_f32f32_f32f32_f32_nchwkcrs_nchw_tilesize64x64x8_stage3_warpsize1x4x1_g1_ffma_aligna4_alignc4 Tactic: 0xa31d27de74b895ff Time: 0.00429351
[07/02/2026-03:47:09] [V] [TRT] Tactic Name: sm80_xmma_fprop_implicit_gemm_f32f32_f32f32_f32_nchwkcrs_nchw_tilesize32x32x8_stage3_warpsize1x2x1_g1_ffma_aligna4_alignc4 Tactic: 0xb0bf940d5e0f9f45 Time: 0.00410619
[07/02/2026-03:47:09] [V] [TRT] Tactic Name: ampere_scudnn_128x64_relu_xregs_large_nn_v1 Tactic: 0x5deb29b7a8e275f7 Time: 0.00738583
[07/02/2026-03:47:09] [V] [TRT] Tactic Name: sm70_xmma_fprop_implicit_gemm_f32f32_f32f32_f32_nchwkcrs_nchw_tilesize64x64x8_stage1_warpsize1x4x1_g1_ffma_t1r5s5_aligna4_alignc4 Tactic: 0xb3ea28771604ad88 Time: 0.00427886
[07/02/2026-03:47:09] [V] [TRT] Tactic Name: sm80_xmma_fprop_implicit_gemm_f32f32_f32f32_f32_nchwkcrs_nchw_tilesize128x16x8_stage3_warpsize4x1x1_g1_ffma_aligna4_alignc4 Tactic: 0x9d9fdb5fd9945f64 Time: 0.00560158
[07/02/2026-03:47:09] [V] [TRT] Tactic Name: sm80_xmma_fprop_implicit_gemm_indexed_f32f32_f32f32_f32_nchwkcrs_nchw_tilesize64x64x8_stage3_warpsize1x4x1_g1_ffma_aligna4_alignc4 Tactic: 0xd828f024626fa982 Time: 0.00444564
[07/02/2026-03:47:09] [V] [TRT] Tactic Name: sm80_xmma_fprop_implicit_gemm_f32f32_f32f32_f32_nchwkcrs_nchw_tilesize128x64x8_stage3_warpsize2x2x1_g1_ffma_aligna4_alignc4 Tactic: 0x12dbf7d94ee3696d Time: 0.00592677
[07/02/2026-03:47:09] [V] [TRT] Tactic Name: sm80_xmma_fprop_implicit_gemm_f32f32_f32f32_f32_nchwkcrs_nchw_tilesize64x64x8_stage3_warpsize1x4x1_g1_ffma_t1r5s5_aligna4_alignc4 Tactic: 0x967f94e9db2001a8 Time: 0.00690939
[07/02/2026-03:47:09] [V] [TRT] Tactic Name: sm80_xmma_fprop_implicit_gemm_indexed_f32f32_f32f32_f32_nchwkcrs_nchw_tilesize32x32x8_stage3_warpsize1x2x1_g1_ffma_aligna4_alignc4 Tactic: 0xcb8a43f748d8a338 Time: 0.00624099
[07/02/2026-03:47:09] [V] [TRT] Tactic Name: sm70_xmma_fprop_implicit_gemm_f32f32_f32f32_f32_nchwkcrs_nchw_tilesize128x256x8_stage1_warpsize2x4x1_g1_ffma_aligna4_alignc4 Tactic: 0xd2aa21bfe2167c0c Time: 0.010734
[07/02/2026-03:47:09] [V] [TRT] Tactic Name: ampere_scudnn_128x128_relu_small_nn_v1 Tactic: 0x503619c69ae500ff Time: 0.0084074
[07/02/2026-03:47:09] [V] [TRT] Tactic Name: sm80_xmma_fprop_implicit_gemm_indexed_f32f32_f32f32_f32_nchwkcrs_nchw_tilesize128x64x8_stage2_warpsize1x4x1_g1_ffma_aligna4_alignc4_beta0_packed_stride Tactic: 0xede36641840ce3d2 Time: 0.00628114
[07/02/2026-03:47:10] [V] [TRT] Tactic Name: sm70_xmma_fprop_implicit_gemm_f32f32_f32f32_f32_nchwkcrs_nchw_tilesize128x128x8_stage1_warpsize2x2x1_g1_ffma_aligna4_alignc4 Tactic: 0xac49795b871b0d29 Time: 0.00858568
[07/02/2026-03:47:10] [V] [TRT] Tactic Name: sm80_xmma_fprop_implicit_gemm_indexed_f32f32_f32f32_f32_nchwkcrs_nchw_tilesize128x64x8_stage2_warpsize2x2x1_g1_ffma_aligna4_alignc4_beta0_packed_stride Tactic: 0x31aa67f57c5aea77 Time: 0.00591086
[07/02/2026-03:47:10] [V] [TRT] node_conv2d + node_relu (CaskConvolution[0x80000009]) profiling completed in 0.163695 seconds. Fastest Tactic: 0x5b8bf1b8028629d9 Time: 0.00403289
[07/02/2026-03:47:10] [V] [TRT] Skipping CaskFlattenConvolution: No valid tactics for node_conv2d + node_relu
[07/02/2026-03:47:10] [V] [TRT] >>>>>>>>>>>>>>> Chose Runner Type: CaskConvolution Tactic: 0x5b8bf1b8028629d9
[07/02/2026-03:47:10] [V] [TRT] *************** Autotuning format combination: Float(784,1,28,1) -> Float(25088,1,896,32) ***************
[07/02/2026-03:47:10] [V] [TRT] --------------- Timing Runner: node_conv2d + node_relu (CaskConvolution[0x80000009])
[07/02/2026-03:47:10] [V] [TRT] Tactic Name: sm70_xmma_fprop_implicit_gemm_f32f32_f32f32_f32_nhwckrsc_nhwc_tilesize64x32x32_stage1_warpsize1x1x1_g1_ffma_t1r5s5_aligna4_alignc4 Tactic: 0x737793996edbf8e2 Time: 0.104448
[07/02/2026-03:47:10] [V] [TRT] Tactic Name: sm80_xmma_fprop_implicit_gemm_f32f32_f32f32_f32_nhwckrsc_nhwc_tilesize64x64x8_stage3_warpsize1x4x1_g1_ffma_t1r5s5_aligna4_alignc4 Tactic: 0x45ff0c3a09b02e78 Time: 0.00862978
[07/02/2026-03:47:10] [V] [TRT] Tactic Name: sm80_xmma_fprop_implicit_gemm_f32f32_f32f32_f32_nhwckrsc_nhwc_tilesize128x64x8_stage3_warpsize2x2x1_g1_ffma_aligna4_alignc4 Tactic: 0x1da91d865428f237 Time: 0.0133669
[07/02/2026-03:47:10] [V] [TRT] Tactic Name: sm70_xmma_fprop_implicit_gemm_indexed_f32f32_f32f32_f32_nhwckrsc_nhwc_tilesize32x32x8_stage1_warpsize1x2x1_g1_ffma_aligna4_alignc4 Tactic: 0x5f60af66e8eb9b51 Time: 0.00900514
[07/02/2026-03:47:10] [V] [TRT] Tactic Name: sm70_xmma_fprop_implicit_gemm_indexed_f32f32_f32f32_f32_nhwckrsc_nhwc_tilesize128x32x8_stage1_warpsize2x2x1_g1_ffma_aligna4_alignc4 Tactic: 0x833d893f0e96f145 Time: 0.0106397
[07/02/2026-03:47:10] [V] [TRT] Tactic Name: sm70_xmma_fprop_implicit_gemm_f32f32_f32f32_f32_nhwckrsc_nhwc_tilesize64x16x16_stage1_warpsize1x1x1_g1_ffma_t1r5s5_aligna4_alignc4 Tactic: 0x247bb0dcaf6f9760 Time: 0.0170723
[07/02/2026-03:47:10] [V] [TRT] Tactic Name: sm80_xmma_fprop_implicit_gemm_indexed_f32f32_f32f32_f32_nhwckrsc_nhwc_tilesize128x16x8_stage3_warpsize4x1x1_g1_ffma_aligna4_alignc4 Tactic: 0x4fd3c46622e98342 Time: 0.0138617
[07/02/2026-03:47:10] [V] [TRT] Tactic Name: sm80_xmma_fprop_implicit_gemm_f32f32_f32f32_f32_nhwckrsc_nhwc_tilesize32x32x8_stage3_warpsize1x2x1_g1_ffma_t1r5s5_aligna4_alignc4 Tactic: 0x880b696bd0160609 Time: 0.00645088
[07/02/2026-03:47:10] [V] [TRT] Tactic Name: sm70_xmma_fprop_implicit_gemm_f32f32_f32f32_f32_nhwckrsc_nhwc_tilesize128x16x8_stage1_warpsize4x1x1_g1_ffma_aligna4_alignc4 Tactic: 0x19799dabb3912d89 Time: 0.00926972
[07/02/2026-03:47:10] [V] [TRT] Tactic Name: sm70_xmma_fprop_implicit_gemm_f32f32_f32f32_f32_nhwckrsc_nhwc_tilesize64x128x8_stage1_warpsize1x4x1_g1_ffma_aligna4_alignc4 Tactic: 0xde4165142218dab8 Time: 0.0125676
[07/02/2026-03:47:10] [V] [TRT] Tactic Name: sm70_xmma_fprop_implicit_gemm_f32f32_f32f32_f32_nhwckrsc_nhwc_tilesize128x64x8_stage1_warpsize2x2x1_g1_ffma_aligna4_alignc4 Tactic: 0x963db12d24e61b80 Time: 0.0128568
[07/02/2026-03:47:10] [V] [TRT] Tactic Name: sm80_xmma_fprop_implicit_gemm_indexed_f32f32_f32f32_f32_nhwckrsc_nhwc_tilesize128x32x8_stage3_warpsize2x2x1_g1_ffma_aligna4_alignc4 Tactic: 0xa6448a1e79f1ca6f Time: 0.00977707
[07/02/2026-03:47:10] [V] [TRT] Tactic Name: sm80_xmma_fprop_implicit_gemm_f32f32_f32f32_f32_nhwckrsc_nhwc_tilesize128x16x8_stage3_warpsize4x1x1_g1_ffma_t1r5s5_aligna4_alignc4 Tactic: 0xe35d4a4a3b499fe7 Time: 0.00737486
[07/02/2026-03:47:10] [V] [TRT] Tactic Name: sm80_xmma_fprop_implicit_gemm_indexed_f32f32_f32f32_f32_nhwckrsc_nhwc_tilesize64x64x8_stage3_warpsize1x4x1_g1_ffma_aligna4_alignc4 Tactic: 0x19b688348f983aa0 Time: 0.00906714
[07/02/2026-03:47:10] [V] [TRT] Tactic Name: sm80_xmma_fprop_implicit_gemm_f32f32_f32f32_f32_nhwckrsc_nhwc_tilesize256x64x8_stage3_warpsize2x2x1_g1_ffma_aligna4_alignc4 Tactic: 0x8014228ec08b4d49 Time: 0.0236931
[07/02/2026-03:47:10] [V] [TRT] Tactic Name: sm70_xmma_fprop_implicit_gemm_f32f32_f32f32_f32_nhwckrsc_nhwc_tilesize128x16x8_stage1_warpsize4x1x1_g1_ffma_t1r5s5_aligna4_alignc4 Tactic: 0x54e3b8c9b1e5f17a Time: 0.00901972
[07/02/2026-03:47:10] [V] [TRT] Tactic Name: sm70_xmma_fprop_implicit_gemm_indexed_f32f32_f32f32_f32_nhwckrsc_nhwc_tilesize128x16x8_stage1_warpsize4x1x1_g1_ffma_aligna4_alignc4 Tactic: 0x6aaac747558eb868 Time: 0.00991695
[07/02/2026-03:47:10] [V] [TRT] Tactic Name: sm70_xmma_fprop_implicit_gemm_f32f32_f32f32_f32_nhwckrsc_nhwc_tilesize32x32x8_stage1_warpsize1x2x1_g1_ffma_aligna4_alignc4 Tactic: 0x3637f3f04d7ae4e6 Time: 0.00934114
[07/02/2026-03:47:10] [V] [TRT] Tactic Name: sm70_xmma_fprop_implicit_gemm_f32f32_f32f32_f32_nhwckrsc_nhwc_tilesize64x32x32_stage1_warpsize1x1x1_g1_ffma_aligna4_alignc4 Tactic: 0xdb73e25ae4006f74 Time: 0.103385
[07/02/2026-03:47:10] [V] [TRT] Tactic Name: sm70_xmma_fprop_implicit_gemm_f32f32_f32f32_f32_nhwckrsc_nhwc_tilesize64x64x8_stage1_warpsize1x4x1_g1_ffma_aligna4_alignc4 Tactic: 0x2595402367cdee5c Time: 0.00941343
[07/02/2026-03:47:10] [V] [TRT] Tactic Name: sm80_xmma_fprop_implicit_gemm_f32f32_f32f32_f32_nhwckrsc_nhwc_tilesize128x16x8_stage3_warpsize4x1x1_g1_ffma_aligna4_alignc4 Tactic: 0x92ed3100c35fc43e Time: 0.00788259
[07/02/2026-03:47:10] [V] [TRT] Tactic Name: sm80_xmma_fprop_implicit_gemm_f32f32_f32f32_f32_nhwckrsc_nhwc_tilesize64x64x8_stage3_warpsize1x4x1_g1_ffma_aligna4_alignc4 Tactic: 0x62835fce994f06dd Time: 0.00888605
[07/02/2026-03:47:10] [V] [TRT] Tactic Name: sm70_xmma_fprop_implicit_gemm_f32f32_f32f32_f32_nhwckrsc_nhwc_tilesize32x32x8_stage1_warpsize1x2x1_g1_ffma_t1r5s5_aligna4_alignc4 Tactic: 0xad9ed5f51d32aa29 Time: 0.00876854
[07/02/2026-03:47:10] [V] [TRT] Tactic Name: sm70_xmma_fprop_implicit_gemm_f32f32_f32f32_f32_nhwckrsc_nhwc_tilesize64x16x16_stage1_warpsize1x1x1_g1_ffma_aligna4_alignc4 Tactic: 0x3f904b355d9ca8e6 Time: 0.0173074
[07/02/2026-03:47:10] [V] [TRT] Tactic Name: sm80_xmma_fprop_implicit_gemm_indexed_f32f32_f32f32_f32_nhwckrsc_nhwc_tilesize32x32x8_stage3_warpsize1x2x1_g1_ffma_aligna4_alignc4 Tactic: 0x0a143be7a52f301a Time: 0.00702346
[07/02/2026-03:47:10] [V] [TRT] Tactic Name: sm80_xmma_fprop_implicit_gemm_f32f32_f32f32_f32_nhwckrsc_nhwc_tilesize32x32x8_stage3_warpsize1x2x1_g1_ffma_aligna4_alignc4 Tactic: 0x7121ec1db3f80c67 Time: 0.0065014
[07/02/2026-03:47:10] [V] [TRT] Tactic Name: sm70_xmma_fprop_implicit_gemm_f32f32_f32f32_f32_nhwckrsc_nhwc_tilesize256x128x8_stage1_warpsize2x4x1_g1_ffma_aligna4_alignc4 Tactic: 0x0447933cc2be855a Time: 0.0329783
[07/02/2026-03:47:10] [V] [TRT] node_conv2d + node_relu (CaskConvolution[0x80000009]) profiling completed in 0.0834065 seconds. Fastest Tactic: 0x880b696bd0160609 Time: 0.00645088
[07/02/2026-03:47:10] [V] [TRT] Skipping CaskFlattenConvolution: No valid tactics for node_conv2d + node_relu
[07/02/2026-03:47:10] [V] [TRT] >>>>>>>>>>>>>>> Chose Runner Type: CaskConvolution Tactic: 0x880b696bd0160609
[07/02/2026-03:47:10] [V] [TRT] *************** Autotuning format combination: Float(784,1:4,28,1) -> Float(25088,784,28,1) ***************
[07/02/2026-03:47:10] [V] [TRT] Skipping CaskConvolution: No valid tactics for node_conv2d + node_relu
[07/02/2026-03:47:10] [V] [TRT] Skipping CaskFlattenConvolution: No valid tactics for node_conv2d + node_relu
[07/02/2026-03:47:10] [V] [TRT] *************** Autotuning format combination: Float(784,1:4,28,1) -> Float(6272,1:4,224,8) ***************
[07/02/2026-03:47:10] [V] [TRT] --------------- Timing Runner: node_conv2d + node_relu (CaskConvolution[0x80000009])
[07/02/2026-03:47:10] [V] [TRT] Tactic Name: ampere_scudnn_128x32_sliced1x4_ldg4_relu_exp_small_nhwc_tn_v1 Tactic: 0x3e2b881168d9689d Time: 0.0234651
[07/02/2026-03:47:10] [V] [TRT] Tactic Name: ampere_scudnn_128x128_ldg4_relu_exp_medium_nhwc_tn_v1 Tactic: 0x7bc32c782b800c48 Time: 0.0205355
[07/02/2026-03:47:10] [V] [TRT] Tactic Name: ampere_scudnn_128x128_ldg4_relu_exp_small_nhwc_tn_v1 Tactic: 0xf90060ce8193b811 Time: 0.020236
[07/02/2026-03:47:10] [V] [TRT] Tactic Name: ampere_scudnn_128x64_sliced1x2_ldg4_relu_exp_large_nhwc_tn_v1 Tactic: 0xbdfdef6b84f7ccc9 Time: 0.0230818
[07/02/2026-03:47:10] [V] [TRT] node_conv2d + node_relu (CaskConvolution[0x80000009]) profiling completed in 0.0126064 seconds. Fastest Tactic: 0xf90060ce8193b811 Time: 0.020236
[07/02/2026-03:47:10] [V] [TRT] Skipping CaskFlattenConvolution: No valid tactics for node_conv2d + node_relu
[07/02/2026-03:47:10] [V] [TRT] >>>>>>>>>>>>>>> Chose Runner Type: CaskConvolution Tactic: 0xf90060ce8193b811
[07/02/2026-03:47:10] [V] [TRT] *************** Autotuning format combination: Half(784,784,28,1) -> Half(25088,784,28,1) ***************
[07/02/2026-03:47:10] [V] [TRT] Skipping CaskConvolution: No valid tactics for node_conv2d + node_relu
[07/02/2026-03:47:10] [V] [TRT] Skipping CaskFlattenConvolution: No valid tactics for node_conv2d + node_relu
[07/02/2026-03:47:10] [V] [TRT] *************** Autotuning format combination: Half(784,1:2,28,1) -> Half(12544,1:2,448,16) ***************
[07/02/2026-03:47:10] [V] [TRT] --------------- Timing Runner: node_conv2d + node_relu (CaskConvolution[0x80000009])
[07/02/2026-03:47:10] [V] [TRT] Tactic Name: sm80_xmma_fprop_implicit_gemm_indexed_wo_smem_f16f16_f16f16_f16_nhwckrsc_nhwc_tilesize128x32x16_stage1_warpsize4x1x1_g1_tensor16x8x16_aligna4_alignc4 Tactic: 0x72c5a15b17fc333a Time: 0.00388843
[07/02/2026-03:47:10] [V] [TRT] Tactic Name: sm80_xmma_fprop_implicit_gemm_indexed_wo_smem_f16f16_f16f16_f16_nhwckrsc_nhwc_tilesize128x16x32_stage1_warpsize4x1x1_g1_tensor16x8x16_aligna4_alignc2 Tactic: 0x90e2d6b4ee50185b Time: 0.00387447
[07/02/2026-03:47:10] [V] [TRT] Tactic Name: sm75_xmma_fprop_implicit_gemm_indexed_wo_smem_f16f16_f16f16_f16_nhwckrsc_nhwc_tilesize128x16x32_stage1_warpsize4x1x1_g1_tensor16x8x8_aligna2_alignc2 Tactic: 0xc93552e3e587bd46 Time: 0.00479954
[07/02/2026-03:47:10] [V] [TRT] Tactic Name: sm80_xmma_fprop_implicit_gemm_indexed_wo_smem_f16f16_f16f16_f16_nhwckrsc_nhwc_tilesize128x16x64_stage1_warpsize4x1x1_g1_tensor16x8x16_aligna2_alignc2 Tactic: 0xdc0e0882e8ef55d1 Time: 0.00523193
[07/02/2026-03:47:10] [V] [TRT] Tactic Name: sm80_xmma_fprop_implicit_gemm_indexed_wo_smem_f16f16_f16f16_f16_nhwckrsc_nhwc_tilesize128x16x32_stage1_warpsize4x1x1_g1_tensor16x8x16_aligna4_alignc4 Tactic: 0x1fb62367b99fe633 Time: 0.00434036
[07/02/2026-03:47:10] [V] [TRT] Tactic Name: sm80_xmma_fprop_implicit_gemm_indexed_wo_smem_f16f16_f16f16_f16_nhwckrsc_nhwc_tilesize128x16x32_stage1_warpsize4x1x1_g1_tensor16x8x16_aligna2_alignc2 Tactic: 0x5b51065cd94604da Time: 0.00449
[07/02/2026-03:47:10] [V] [TRT] Tactic Name: sm75_xmma_fprop_implicit_gemm_indexed_wo_smem_f16f16_f16f16_f16_nhwckrsc_nhwc_tilesize128x16x64_stage1_warpsize4x1x1_g1_tensor16x8x8_aligna4_alignc2 Tactic: 0x63b3bbe281646f72 Time: 0.00378202
[07/02/2026-03:47:10] [V] [TRT] Tactic Name: sm80_xmma_fprop_implicit_gemm_indexed_wo_smem_f16f16_f16f16_f16_nhwckrsc_nhwc_tilesize128x16x32_stage1_warpsize4x1x1_g1_tensor16x8x16_aligna2_alignc4 Tactic: 0xd405f38f8e89fab2 Time: 0.00431731
[07/02/2026-03:47:10] [V] [TRT] Tactic Name: sm75_xmma_fprop_implicit_gemm_indexed_wo_smem_f16f16_f16f16_f16_nhwckrsc_nhwc_tilesize128x16x32_stage1_warpsize4x1x1_g1_tensor16x8x8_aligna4_alignc2 Tactic: 0x0286820bd291a1c7 Time: 0.00399416
[07/02/2026-03:47:10] [V] [TRT] Tactic Name: sm80_xmma_fprop_implicit_gemm_indexed_wo_smem_f16f16_f16f16_f16_nhwckrsc_nhwc_tilesize128x32x16_stage1_warpsize4x1x1_g1_tensor16x8x16_aligna4_alignc2 Tactic: 0xfd9154884033cd52 Time: 0.00436682
[07/02/2026-03:47:10] [V] [TRT] Tactic Name: sm75_xmma_fprop_implicit_gemm_indexed_wo_smem_f16f16_f16f16_f16_nhwckrsc_nhwc_tilesize128x16x32_stage1_warpsize4x1x1_g1_tensor16x8x8_aligna4_alignc4 Tactic: 0x8dd277d8855e5faf Time: 0.00339519
[07/02/2026-03:47:10] [V] [TRT] Tactic Name: sm75_xmma_fprop_implicit_gemm_indexed_wo_smem_f16f16_f16f16_f16_nhwckrsc_nhwc_tilesize128x32x16_stage1_warpsize4x1x1_g1_tensor16x8x8_aligna2_alignc4 Tactic: 0x7bdecad1884e5858 Time: 0.00521845
[07/02/2026-03:47:10] [V] [TRT] Tactic Name: sm75_xmma_fprop_implicit_gemm_indexed_wo_smem_f16f16_f16f16_f16_nhwckrsc_nhwc_tilesize128x32x64_stage1_warpsize4x1x1_g1_tensor16x8x8_aligna4_alignc2 Tactic: 0x5bb428c4b317876b Time: 0.00401625
[07/02/2026-03:47:10] [V] [TRT] Tactic Name: sm80_xmma_fprop_implicit_gemm_indexed_wo_smem_f16f16_f16f16_f16_nhwckrsc_nhwc_tilesize128x32x64_stage1_warpsize4x1x1_g1_tensor16x8x16_aligna2_alignc4 Tactic: 0x6a76904d34985d11 Time: 0.00456357
[07/02/2026-03:47:10] [V] [TRT] Tactic Name: sm80_xmma_fprop_implicit_gemm_indexed_wo_smem_f16f16_f16f16_f16_nhwckrsc_nhwc_tilesize128x32x16_stage1_warpsize4x1x1_g1_tensor16x8x16_aligna2_alignc4 Tactic: 0xb97671b320ea2fbb Time: 0.00500713
[07/02/2026-03:47:10] [V] [TRT] Tactic Name: sm75_xmma_fprop_implicit_gemm_indexed_wo_smem_f16f16_f16f16_f16_nhwckrsc_nhwc_tilesize128x32x16_stage1_warpsize4x1x1_g1_tensor16x8x8_aligna2_alignc2 Tactic: 0xf48a3f02df81a630 Time: 0.00574848
[07/02/2026-03:47:10] [V] [TRT] Tactic Name: sm80_xmma_fprop_implicit_gemm_indexed_wo_smem_f16f16_f16f16_f16_nhwckrsc_nhwc_tilesize128x32x64_stage1_warpsize4x1x1_g1_tensor16x8x16_aligna2_alignc2 Tactic: 0xe522659e6357a379 Time: 0.0049816
[07/02/2026-03:47:10] [V] [TRT] Tactic Name: sm75_xmma_fprop_implicit_gemm_indexed_wo_smem_f16f16_f16f16_f16_nhwckrsc_nhwc_tilesize128x32x16_stage1_warpsize4x1x1_g1_tensor16x8x8_aligna4_alignc4 Tactic: 0xb06d1a39bf5844d9 Time: 0.00550646
[07/02/2026-03:47:10] [V] [TRT] Tactic Name: sm75_xmma_fprop_implicit_gemm_indexed_wo_smem_f16f16_f16f16_f16_nhwckrsc_nhwc_tilesize128x32x16_stage1_warpsize4x1x1_g1_tensor16x8x8_aligna4_alignc2 Tactic: 0x3f39efeae897bab1 Time: 0.0043351
[07/02/2026-03:47:10] [V] [TRT] Tactic Name: sm75_xmma_fprop_implicit_gemm_indexed_wo_smem_f16f16_f16f16_f16_nhwckrsc_nhwc_tilesize128x32x64_stage1_warpsize4x1x1_g1_tensor16x8x8_aligna4_alignc4 Tactic: 0xd4e0dd17e4d87903 Time: 0.00362994
[07/02/2026-03:47:10] [V] [TRT] Tactic Name: sm80_xmma_fprop_implicit_gemm_indexed_wo_smem_f16f16_f16f16_f16_nhwckrsc_nhwc_tilesize128x16x64_stage1_warpsize4x1x1_g1_tensor16x8x16_aligna4_alignc4 Tactic: 0x98e92db98836b738 Time: 0.0032534
[07/02/2026-03:47:10] [V] [TRT] Tactic Name: sm80_xmma_fprop_implicit_gemm_indexed_wo_smem_f16f16_f16f16_f16_nhwckrsc_nhwc_tilesize128x32x16_stage1_warpsize4x1x1_g1_tensor16x8x16_aligna2_alignc2 Tactic: 0x362284607725d1d3 Time: 0.0054488
[07/02/2026-03:47:10] [V] [TRT] Tactic Name: sm75_xmma_fprop_implicit_gemm_indexed_wo_smem_f16f16_f16f16_f16_nhwckrsc_nhwc_tilesize128x16x64_stage1_warpsize4x1x1_g1_tensor16x8x8_aligna2_alignc4 Tactic: 0x27549ed9e1bd8d9b Time: 0.00425748
[07/02/2026-03:47:10] [V] [TRT] Tactic Name: sm75_xmma_fprop_implicit_gemm_indexed_wo_smem_f16f16_f16f16_f16_nhwckrsc_nhwc_tilesize128x32x64_stage1_warpsize4x1x1_g1_tensor16x8x8_aligna2_alignc2 Tactic: 0x9007f82c84019bea Time: 0.00462407
[07/02/2026-03:47:10] [V] [TRT] Tactic Name: sm80_xmma_fprop_implicit_gemm_indexed_wo_smem_f16f16_f16f16_f16_nhwckrsc_nhwc_tilesize128x32x64_stage1_warpsize4x1x1_g1_tensor16x8x16_aligna4_alignc2 Tactic: 0x2e91b5765441bff8 Time: 0.00395181
[07/02/2026-03:47:10] [V] [TRT] Tactic Name: sm75_xmma_fprop_implicit_gemm_indexed_wo_smem_f16f16_f16f16_f16_nhwckrsc_nhwc_tilesize128x32x64_stage1_warpsize4x1x1_g1_tensor16x8x8_aligna2_alignc4 Tactic: 0x1f530dffd3ce6582 Time: 0.00441032
[07/02/2026-03:47:10] [V] [TRT] Tactic Name: sm80_xmma_fprop_implicit_gemm_indexed_wo_smem_f16f16_f16f16_f16_nhwckrsc_nhwc_tilesize128x16x64_stage1_warpsize4x1x1_g1_tensor16x8x16_aligna2_alignc4 Tactic: 0x535afd51bf20abb9 Time: 0.00436073
[07/02/2026-03:47:10] [V] [TRT] Tactic Name: sm80_xmma_fprop_implicit_gemm_indexed_wo_smem_f16f16_f16f16_f16_nhwckrsc_nhwc_tilesize128x16x64_stage1_warpsize4x1x1_g1_tensor16x8x16_aligna4_alignc2 Tactic: 0x17bdd86adff94950 Time: 0.0036698
[07/02/2026-03:47:10] [V] [TRT] Tactic Name: sm75_xmma_fprop_implicit_gemm_indexed_wo_smem_f16f16_f16f16_f16_nhwckrsc_nhwc_tilesize128x16x64_stage1_warpsize4x1x1_g1_tensor16x8x8_aligna2_alignc2 Tactic: 0xa8006b0ab67273f3 Time: 0.00454486
[07/02/2026-03:47:10] [V] [TRT] Tactic Name: sm75_xmma_fprop_implicit_gemm_indexed_wo_smem_f16f16_f16f16_f16_nhwckrsc_nhwc_tilesize128x16x64_stage1_warpsize4x1x1_g1_tensor16x8x8_aligna4_alignc4 Tactic: 0xece74e31d6ab911a Time: 0.00340147
[07/02/2026-03:47:10] [V] [TRT] Tactic Name: sm75_xmma_fprop_implicit_gemm_indexed_wo_smem_f16f16_f16f16_f16_nhwckrsc_nhwc_tilesize128x16x32_stage1_warpsize4x1x1_g1_tensor16x8x8_aligna2_alignc4 Tactic: 0x4661a730b248432e Time: 0.00735608
[07/02/2026-03:47:10] [V] [TRT] Tactic Name: sm80_xmma_fprop_implicit_gemm_indexed_wo_smem_f16f16_f16f16_f16_nhwckrsc_nhwc_tilesize128x32x64_stage1_warpsize4x1x1_g1_tensor16x8x16_aligna4_alignc4 Tactic: 0xa1c540a5038e4190 Time: 0.00512
[07/02/2026-03:47:10] [V] [TRT] node_conv2d + node_relu (CaskConvolution[0x80000009]) profiling completed in 0.0981109 seconds. Fastest Tactic: 0x98e92db98836b738 Time: 0.0032534
[07/02/2026-03:47:10] [V] [TRT] Skipping CaskFlattenConvolution: No valid tactics for node_conv2d + node_relu
[07/02/2026-03:47:10] [V] [TRT] >>>>>>>>>>>>>>> Chose Runner Type: CaskConvolution Tactic: 0x98e92db98836b738
[07/02/2026-03:47:10] [V] [TRT] *************** Autotuning format combination: Half(784,1:4,28,1) -> Half(6272,1:4,224,8) ***************
[07/02/2026-03:47:10] [V] [TRT] Skipping CaskConvolution: No valid tactics for node_conv2d + node_relu
[07/02/2026-03:47:10] [V] [TRT] Skipping CaskFlattenConvolution: No valid tactics for node_conv2d + node_relu
[07/02/2026-03:47:10] [V] [TRT] *************** Autotuning format combination: Half(784,1:4,28,1) -> Half(3136,1:8,112,4) ***************
[07/02/2026-03:47:10] [V] [TRT] --------------- Timing Runner: node_conv2d + node_relu (CaskConvolution[0x80000009])
[07/02/2026-03:47:10] [V] [TRT] Tactic Name: sm80_xmma_fprop_implicit_gemm_indexed_wo_smem_f16f16_f16f16_f16_nhwckrsc_nhwc_tilesize128x32x16_stage1_warpsize4x1x1_g1_tensor16x8x16_aligna4_alignc4 Tactic: 0x72c5a15b17fc333a Time: 0.00496741
[07/02/2026-03:47:10] [V] [TRT] Tactic Name: sm80_xmma_fprop_implicit_gemm_indexed_wo_smem_f16f16_f16f16_f16_nhwckrsc_nhwc_tilesize128x32x16_stage1_warpsize4x1x1_g1_tensor16x8x16_aligna2_alignc8 Tactic: 0x3507353e207bcdee Time: 0.00692245
[07/02/2026-03:47:10] [V] [TRT] Tactic Name: sm75_xmma_fprop_implicit_gemm_indexed_wo_smem_f16f16_f16f16_f16_nhwckrsc_nhwc_tilesize128x16x32_stage1_warpsize4x1x1_g1_tensor16x8x8_aligna8_alignc2 Tactic: 0x07398cf013b38640 Time: 0.00450457
[07/02/2026-03:47:10] [V] [TRT] Tactic Name: sm80_xmma_fprop_implicit_gemm_indexed_wo_smem_f16f16_f16f16_f16_nhwckrsc_nhwc_tilesize128x16x32_stage1_warpsize4x1x1_g1_tensor16x8x16_aligna4_alignc2 Tactic: 0x90e2d6b4ee50185b Time: 0.00477775
[07/02/2026-03:47:10] [V] [TRT] Tactic Name: sm75_xmma_fprop_implicit_gemm_indexed_wo_smem_f16f16_f16f16_f16_nhwckrsc_nhwc_tilesize128x16x32_stage1_warpsize4x1x1_g1_tensor16x8x8_aligna2_alignc8 Tactic: 0xca10e3bdb2d9a17b Time: 0.00632785
[07/02/2026-03:47:10] [V] [TRT] Tactic Name: sm75_xmma_fprop_implicit_gemm_indexed_wo_smem_f16f16_f16f16_f16_nhwckrsc_nhwc_tilesize128x16x32_stage1_warpsize4x1x1_g1_tensor16x8x8_aligna2_alignc2 Tactic: 0xc93552e3e587bd46 Time: 0.00609314
[07/02/2026-03:47:10] [V] [TRT] Tactic Name: sm80_xmma_fprop_implicit_gemm_indexed_wo_smem_f16f16_f16f16_f16_nhwckrsc_nhwc_tilesize128x16x64_stage1_warpsize4x1x1_g1_tensor16x8x16_aligna8_alignc2 Tactic: 0x1202d6911edb6ed7 Time: 0.00442057
[07/02/2026-03:47:10] [V] [TRT] Tactic Name: sm80_xmma_fprop_implicit_gemm_indexed_wo_smem_f16f16_f16f16_f16_nhwckrsc_nhwc_tilesize128x16x64_stage1_warpsize4x1x1_g1_tensor16x8x16_aligna4_alignc8 Tactic: 0x1498693488a7556d Time: 0.00394057
[07/02/2026-03:47:10] [V] [TRT] Tactic Name: sm80_xmma_fprop_implicit_gemm_indexed_wo_smem_f16f16_f16f16_f16_nhwckrsc_nhwc_tilesize128x16x64_stage1_warpsize4x1x1_g1_tensor16x8x16_aligna2_alignc2 Tactic: 0xdc0e0882e8ef55d1 Time: 0.00647096
[07/02/2026-03:47:10] [V] [TRT] Tactic Name: sm75_xmma_fprop_implicit_gemm_indexed_wo_smem_f16f16_f16f16_f16_nhwckrsc_nhwc_tilesize128x16x64_stage1_warpsize4x1x1_g1_tensor16x8x8_aligna2_alignc8 Tactic: 0xab25da54e12c6fce Time: 0.00667927
[07/02/2026-03:47:10] [V] [TRT] Tactic Name: sm75_xmma_fprop_implicit_gemm_indexed_wo_smem_f16f16_f16f16_f16_nhwckrsc_nhwc_tilesize128x32x64_stage1_warpsize4x1x1_g1_tensor16x8x8_aligna8_alignc4 Tactic: 0xd15fd3ec25fa5e84 Time: 0.00547183
[07/02/2026-03:47:10] [V] [TRT] Tactic Name: sm80_xmma_fprop_implicit_gemm_indexed_wo_smem_f16f16_f16f16_f16_nhwckrsc_nhwc_tilesize128x16x32_stage1_warpsize4x1x1_g1_tensor16x8x16_aligna4_alignc4 Tactic: 0x1fb62367b99fe633 Time: 0.0053962
[07/02/2026-03:47:10] [V] [TRT] Tactic Name: sm75_xmma_fprop_implicit_gemm_indexed_wo_smem_f16f16_f16f16_f16_nhwckrsc_nhwc_tilesize128x32x16_stage1_warpsize4x1x1_g1_tensor16x8x8_aligna8_alignc8 Tactic: 0x39a3504f7eeb810b Time: 0.00624199
[07/02/2026-03:47:10] [V] [TRT] Tactic Name: sm80_xmma_fprop_implicit_gemm_indexed_wo_smem_f16f16_f16f16_f16_nhwckrsc_nhwc_tilesize128x32x64_stage1_warpsize4x1x1_g1_tensor16x8x16_aligna8_alignc4 Tactic: 0xa47a4e5ec2ac6617 Time: 0.00409352
[07/02/2026-03:47:10] [V] [TRT] Tactic Name: sm80_xmma_fprop_implicit_gemm_indexed_wo_smem_f16f16_f16f16_f16_nhwckrsc_nhwc_tilesize128x32x64_stage1_warpsize4x1x1_g1_tensor16x8x16_aligna4_alignc8 Tactic: 0x2db40428031fa3c5 Time: 0.00494723
[07/02/2026-03:47:10] [V] [TRT] Tactic Name: sm80_xmma_fprop_implicit_gemm_indexed_wo_smem_f16f16_f16f16_f16_nhwckrsc_nhwc_tilesize128x16x32_stage1_warpsize4x1x1_g1_tensor16x8x16_aligna2_alignc2 Tactic: 0x5b51065cd94604da Time: 0.00623304
[07/02/2026-03:47:10] [V] [TRT] Tactic Name: sm75_xmma_fprop_implicit_gemm_indexed_wo_smem_f16f16_f16f16_f16_nhwckrsc_nhwc_tilesize128x16x32_stage1_warpsize4x1x1_g1_tensor16x8x8_aligna8_alignc8 Tactic: 0x041c3dae44ed9a7d Time: 0.00429566
[07/02/2026-03:47:10] [V] [TRT] Tactic Name: sm75_xmma_fprop_implicit_gemm_indexed_wo_smem_f16f16_f16f16_f16_nhwckrsc_nhwc_tilesize128x16x64_stage1_warpsize4x1x1_g1_tensor16x8x8_aligna4_alignc8 Tactic: 0x60960abcd63a734f Time: 0.00396034
[07/02/2026-03:47:10] [V] [TRT] Tactic Name: sm75_xmma_fprop_implicit_gemm_indexed_wo_smem_f16f16_f16f16_f16_nhwckrsc_nhwc_tilesize128x16x64_stage1_warpsize4x1x1_g1_tensor16x8x8_aligna4_alignc2 Tactic: 0x63b3bbe281646f72 Time: 0.00498317
[07/02/2026-03:47:10] [V] [TRT] Tactic Name: sm80_xmma_fprop_implicit_gemm_indexed_wo_smem_f16f16_f16f16_f16_nhwckrsc_nhwc_tilesize128x16x32_stage1_warpsize4x1x1_g1_tensor16x8x16_aligna2_alignc4 Tactic: 0xd405f38f8e89fab2 Time: 0.00605772
[07/02/2026-03:47:10] [V] [TRT] Tactic Name: sm75_xmma_fprop_implicit_gemm_indexed_wo_smem_f16f16_f16f16_f16_nhwckrsc_nhwc_tilesize128x16x32_stage1_warpsize4x1x1_g1_tensor16x8x8_aligna4_alignc2 Tactic: 0x0286820bd291a1c7 Time: 0.00621515
[07/02/2026-03:47:10] [V] [TRT] Tactic Name: sm80_xmma_fprop_implicit_gemm_indexed_wo_smem_f16f16_f16f16_f16_nhwckrsc_nhwc_tilesize128x32x16_stage1_warpsize4x1x1_g1_tensor16x8x16_aligna4_alignc2 Tactic: 0xfd9154884033cd52 Time: 0.00527575
[07/02/2026-03:47:10] [V] [TRT] Tactic Name: sm80_xmma_fprop_implicit_gemm_indexed_wo_smem_f16f16_f16f16_f16_nhwckrsc_nhwc_tilesize128x32x16_stage1_warpsize4x1x1_g1_tensor16x8x16_aligna8_alignc4 Tactic: 0x777aafa0d6de14bd Time: 0.00476236
[07/02/2026-03:47:10] [V] [TRT] Tactic Name: sm75_xmma_fprop_implicit_gemm_indexed_wo_smem_f16f16_f16f16_f16_nhwckrsc_nhwc_tilesize128x16x32_stage1_warpsize4x1x1_g1_tensor16x8x8_aligna4_alignc4 Tactic: 0x8dd277d8855e5faf Time: 0.00426057
[07/02/2026-03:47:10] [V] [TRT] Tactic Name: sm80_xmma_fprop_implicit_gemm_indexed_wo_smem_f16f16_f16f16_f16_nhwckrsc_nhwc_tilesize128x16x32_stage1_warpsize4x1x1_g1_tensor16x8x16_aligna8_alignc4 Tactic: 0x1a092d9c78bdc1b4 Time: 0.00916168
[07/02/2026-03:47:10] [V] [TRT] Tactic Name: sm75_xmma_fprop_implicit_gemm_indexed_wo_smem_f16f16_f16f16_f16_nhwckrsc_nhwc_tilesize128x32x16_stage1_warpsize4x1x1_g1_tensor16x8x8_aligna2_alignc4 Tactic: 0x7bdecad1884e5858 Time: 0.00728754
[07/02/2026-03:47:10] [V] [TRT] Tactic Name: sm75_xmma_fprop_implicit_gemm_indexed_wo_smem_f16f16_f16f16_f16_nhwckrsc_nhwc_tilesize128x32x64_stage1_warpsize4x1x1_g1_tensor16x8x8_aligna4_alignc8 Tactic: 0x5891999ae4499b56 Time: 0.00604743
[07/02/2026-03:47:10] [V] [TRT] Tactic Name: sm75_xmma_fprop_implicit_gemm_indexed_wo_smem_f16f16_f16f16_f16_nhwckrsc_nhwc_tilesize128x32x64_stage1_warpsize4x1x1_g1_tensor16x8x8_aligna4_alignc2 Tactic: 0x5bb428c4b317876b Time: 0.00496363
[07/02/2026-03:47:10] [V] [TRT] Tactic Name: sm80_xmma_fprop_implicit_gemm_indexed_wo_smem_f16f16_f16f16_f16_nhwckrsc_nhwc_tilesize128x32x64_stage1_warpsize4x1x1_g1_tensor16x8x16_aligna2_alignc4 Tactic: 0x6a76904d34985d11 Time: 0.00631016
[07/02/2026-03:47:10] [V] [TRT] Tactic Name: sm80_xmma_fprop_implicit_gemm_indexed_wo_smem_f16f16_f16f16_f16_nhwckrsc_nhwc_tilesize128x16x32_stage1_warpsize4x1x1_g1_tensor16x8x16_aligna8_alignc8 Tactic: 0x96786911782c23e1 Time: 0.00418638
[07/02/2026-03:47:10] [V] [TRT] Tactic Name: sm80_xmma_fprop_implicit_gemm_indexed_wo_smem_f16f16_f16f16_f16_nhwckrsc_nhwc_tilesize128x16x32_stage1_warpsize4x1x1_g1_tensor16x8x16_aligna4_alignc8 Tactic: 0x93c767eab90e0466 Time: 0.00434327
[07/02/2026-03:47:10] [V] [TRT] Tactic Name: sm80_xmma_fprop_implicit_gemm_indexed_wo_smem_f16f16_f16f16_f16_nhwckrsc_nhwc_tilesize128x32x16_stage1_warpsize4x1x1_g1_tensor16x8x16_aligna2_alignc4 Tactic: 0xb97671b320ea2fbb Time: 0.00700343
[07/02/2026-03:47:10] [V] [TRT] Tactic Name: sm75_xmma_fprop_implicit_gemm_indexed_wo_smem_f16f16_f16f16_f16_nhwckrsc_nhwc_tilesize128x32x16_stage1_warpsize4x1x1_g1_tensor16x8x8_aligna2_alignc2 Tactic: 0xf48a3f02df81a630 Time: 0.00778538
[07/02/2026-03:47:10] [V] [TRT] Tactic Name: sm75_xmma_fprop_implicit_gemm_indexed_wo_smem_f16f16_f16f16_f16_nhwckrsc_nhwc_tilesize128x16x32_stage1_warpsize4x1x1_g1_tensor16x8x8_aligna8_alignc4 Tactic: 0x886d7923447c7828 Time: 0.00421338
[07/02/2026-03:47:10] [V] [TRT] Tactic Name: sm75_xmma_fprop_implicit_gemm_indexed_wo_smem_f16f16_f16f16_f16_nhwckrsc_nhwc_tilesize128x32x64_stage1_warpsize4x1x1_g1_tensor16x8x8_aligna2_alignc8 Tactic: 0x93224972d35f87d7 Time: 0.00589422
[07/02/2026-03:47:10] [V] [TRT] Tactic Name: sm75_xmma_fprop_implicit_gemm_indexed_wo_smem_f16f16_f16f16_f16_nhwckrsc_nhwc_tilesize128x32x16_stage1_warpsize4x1x1_g1_tensor16x8x8_aligna8_alignc2 Tactic: 0x3a86e11129b59d36 Time: 0.00732594
[07/02/2026-03:47:10] [V] [TRT] Tactic Name: sm75_xmma_fprop_implicit_gemm_indexed_wo_smem_f16f16_f16f16_f16_nhwckrsc_nhwc_tilesize128x32x16_stage1_warpsize4x1x1_g1_tensor16x8x8_aligna2_alignc8 Tactic: 0xf7af8e5c88dfba0d Time: 0.00703957
[07/02/2026-03:47:10] [V] [TRT] Tactic Name: sm80_xmma_fprop_implicit_gemm_indexed_wo_smem_f16f16_f16f16_f16_nhwckrsc_nhwc_tilesize128x32x64_stage1_warpsize4x1x1_g1_tensor16x8x16_aligna8_alignc2 Tactic: 0x2b2ebb8d9563987f Time: 0.00420531
[07/02/2026-03:47:10] [V] [TRT] Tactic Name: sm80_xmma_fprop_implicit_gemm_indexed_wo_smem_f16f16_f16f16_f16_nhwckrsc_nhwc_tilesize128x32x64_stage1_warpsize4x1x1_g1_tensor16x8x16_aligna2_alignc2 Tactic: 0xe522659e6357a379 Time: 0.00655543
[07/02/2026-03:47:10] [V] [TRT] Tactic Name: sm80_xmma_fprop_implicit_gemm_indexed_wo_smem_f16f16_f16f16_f16_nhwckrsc_nhwc_tilesize128x16x64_stage1_warpsize4x1x1_g1_tensor16x8x16_aligna8_alignc8 Tactic: 0x112767cf498572ea Time: 0.0060859
[07/02/2026-03:47:10] [V] [TRT] Tactic Name: sm75_xmma_fprop_implicit_gemm_indexed_wo_smem_f16f16_f16f16_f16_nhwckrsc_nhwc_tilesize128x32x16_stage1_warpsize4x1x1_g1_tensor16x8x8_aligna4_alignc4 Tactic: 0xb06d1a39bf5844d9 Time: 0.00716754
[07/02/2026-03:47:10] [V] [TRT] Tactic Name: sm75_xmma_fprop_implicit_gemm_indexed_wo_smem_f16f16_f16f16_f16_nhwckrsc_nhwc_tilesize128x32x16_stage1_warpsize4x1x1_g1_tensor16x8x8_aligna4_alignc2 Tactic: 0x3f39efeae897bab1 Time: 0.0052542
[07/02/2026-03:47:10] [V] [TRT] Tactic Name: sm75_xmma_fprop_implicit_gemm_indexed_wo_smem_f16f16_f16f16_f16_nhwckrsc_nhwc_tilesize128x32x64_stage1_warpsize4x1x1_g1_tensor16x8x8_aligna4_alignc4 Tactic: 0xd4e0dd17e4d87903 Time: 0.00475591
[07/02/2026-03:47:10] [V] [TRT] Tactic Name: sm80_xmma_fprop_implicit_gemm_indexed_wo_smem_f16f16_f16f16_f16_nhwckrsc_nhwc_tilesize128x16x32_stage1_warpsize4x1x1_g1_tensor16x8x16_aligna8_alignc2 Tactic: 0x955dd84f2f723fdc Time: 0.00436142
[07/02/2026-03:47:10] [V] [TRT] Tactic Name: sm80_xmma_fprop_implicit_gemm_indexed_wo_smem_f16f16_f16f16_f16_nhwckrsc_nhwc_tilesize128x32x16_stage1_warpsize4x1x1_g1_tensor16x8x16_aligna8_alignc2 Tactic: 0xf82e5a738111ead5 Time: 0.00517747
[07/02/2026-03:47:10] [V] [TRT] Tactic Name: sm80_xmma_fprop_implicit_gemm_indexed_wo_smem_f16f16_f16f16_f16_nhwckrsc_nhwc_tilesize128x16x64_stage1_warpsize4x1x1_g1_tensor16x8x16_aligna4_alignc4 Tactic: 0x98e92db98836b738 Time: 0.00400419
[07/02/2026-03:47:10] [V] [TRT] Tactic Name: sm75_xmma_fprop_implicit_gemm_indexed_wo_smem_f16f16_f16f16_f16_nhwckrsc_nhwc_tilesize128x32x64_stage1_warpsize4x1x1_g1_tensor16x8x8_aligna8_alignc2 Tactic: 0x5e0b263f7235a0ec Time: 0.00461965
[07/02/2026-03:47:10] [V] [TRT] Tactic Name: sm80_xmma_fprop_implicit_gemm_indexed_wo_smem_f16f16_f16f16_f16_nhwckrsc_nhwc_tilesize128x32x16_stage1_warpsize4x1x1_g1_tensor16x8x16_aligna2_alignc2 Tactic: 0x362284607725d1d3 Time: 0.00751017
[07/02/2026-03:47:10] [V] [TRT] Tactic Name: sm80_xmma_fprop_implicit_gemm_indexed_wo_smem_f16f16_f16f16_f16_nhwckrsc_nhwc_tilesize128x32x64_stage1_warpsize4x1x1_g1_tensor16x8x16_aligna2_alignc8 Tactic: 0xe607d4c03409bf44 Time: 0.00608838
[07/02/2026-03:47:10] [V] [TRT] Tactic Name: sm80_xmma_fprop_implicit_gemm_indexed_wo_smem_f16f16_f16f16_f16_nhwckrsc_nhwc_tilesize128x16x64_stage1_warpsize4x1x1_g1_tensor16x8x16_aligna2_alignc8 Tactic: 0xdf2bb9dcbfb149ec Time: 0.00634574
[07/02/2026-03:47:10] [V] [TRT] Tactic Name: sm75_xmma_fprop_implicit_gemm_indexed_wo_smem_f16f16_f16f16_f16_nhwckrsc_nhwc_tilesize128x16x64_stage1_warpsize4x1x1_g1_tensor16x8x8_aligna2_alignc4 Tactic: 0x27549ed9e1bd8d9b Time: 0.00620343
[07/02/2026-03:47:10] [V] [TRT] Tactic Name: sm80_xmma_fprop_implicit_gemm_indexed_wo_smem_f16f16_f16f16_f16_nhwckrsc_nhwc_tilesize128x32x64_stage1_warpsize4x1x1_g1_tensor16x8x16_aligna8_alignc8 Tactic: 0x280b0ad3c23d8442 Time: 0.00411167
[07/02/2026-03:47:10] [V] [TRT] Tactic Name: sm75_xmma_fprop_implicit_gemm_indexed_wo_smem_f16f16_f16f16_f16_nhwckrsc_nhwc_tilesize128x32x64_stage1_warpsize4x1x1_g1_tensor16x8x8_aligna2_alignc2 Tactic: 0x9007f82c84019bea Time: 0.00639602
[07/02/2026-03:47:10] [V] [TRT] Tactic Name: sm75_xmma_fprop_implicit_gemm_indexed_wo_smem_f16f16_f16f16_f16_nhwckrsc_nhwc_tilesize128x16x32_stage1_warpsize4x1x1_g1_tensor16x8x8_aligna4_alignc8 Tactic: 0x01a3335585cfbdfa Time: 0.0044268
[07/02/2026-03:47:10] [V] [TRT] Tactic Name: sm75_xmma_fprop_implicit_gemm_indexed_wo_smem_f16f16_f16f16_f16_nhwckrsc_nhwc_tilesize128x32x16_stage1_warpsize4x1x1_g1_tensor16x8x8_aligna4_alignc8 Tactic: 0x3c1c5eb4bfc9a68c Time: 0.00778265
[07/02/2026-03:47:10] [V] [TRT] Tactic Name: sm80_xmma_fprop_implicit_gemm_indexed_wo_smem_f16f16_f16f16_f16_nhwckrsc_nhwc_tilesize128x16x32_stage1_warpsize4x1x1_g1_tensor16x8x16_aligna2_alignc8 Tactic: 0x5874b7028e1818e7 Time: 0.00599562
[07/02/2026-03:47:10] [V] [TRT] Tactic Name: sm80_xmma_fprop_implicit_gemm_indexed_wo_smem_f16f16_f16f16_f16_nhwckrsc_nhwc_tilesize128x32x64_stage1_warpsize4x1x1_g1_tensor16x8x16_aligna4_alignc2 Tactic: 0x2e91b5765441bff8 Time: 0.00484038
[07/02/2026-03:47:10] [V] [TRT] Tactic Name: sm75_xmma_fprop_implicit_gemm_indexed_wo_smem_f16f16_f16f16_f16_nhwckrsc_nhwc_tilesize128x32x64_stage1_warpsize4x1x1_g1_tensor16x8x8_aligna2_alignc4 Tactic: 0x1f530dffd3ce6582 Time: 0.00736754
[07/02/2026-03:47:10] [V] [TRT] Tactic Name: sm80_xmma_fprop_implicit_gemm_indexed_wo_smem_f16f16_f16f16_f16_nhwckrsc_nhwc_tilesize128x16x64_stage1_warpsize4x1x1_g1_tensor16x8x16_aligna2_alignc4 Tactic: 0x535afd51bf20abb9 Time: 0.0063038
[07/02/2026-03:47:10] [V] [TRT] Tactic Name: sm80_xmma_fprop_implicit_gemm_indexed_wo_smem_f16f16_f16f16_f16_nhwckrsc_nhwc_tilesize128x16x64_stage1_warpsize4x1x1_g1_tensor16x8x16_aligna4_alignc2 Tactic: 0x17bdd86adff94950 Time: 0.00464826
[07/02/2026-03:47:10] [V] [TRT] Tactic Name: sm75_xmma_fprop_implicit_gemm_indexed_wo_smem_f16f16_f16f16_f16_nhwckrsc_nhwc_tilesize128x16x64_stage1_warpsize4x1x1_g1_tensor16x8x8_aligna8_alignc2 Tactic: 0x660cb519404648f5 Time: 0.00383747
[07/02/2026-03:47:10] [V] [TRT] Tactic Name: sm75_xmma_fprop_implicit_gemm_indexed_wo_smem_f16f16_f16f16_f16_nhwckrsc_nhwc_tilesize128x32x16_stage1_warpsize4x1x1_g1_tensor16x8x8_aligna8_alignc4 Tactic: 0xb5d214c27e7a635e Time: 0.00681121
[07/02/2026-03:47:10] [V] [TRT] Tactic Name: sm75_xmma_fprop_implicit_gemm_indexed_wo_smem_f16f16_f16f16_f16_nhwckrsc_nhwc_tilesize128x16x64_stage1_warpsize4x1x1_g1_tensor16x8x8_aligna2_alignc2 Tactic: 0xa8006b0ab67273f3 Time: 0.00642047
[07/02/2026-03:47:10] [V] [TRT] Tactic Name: sm75_xmma_fprop_implicit_gemm_indexed_wo_smem_f16f16_f16f16_f16_nhwckrsc_nhwc_tilesize128x16x64_stage1_warpsize4x1x1_g1_tensor16x8x8_aligna8_alignc4 Tactic: 0xe95840ca1789b69d Time: 0.00369829
[07/02/2026-03:47:10] [V] [TRT] Tactic Name: sm75_xmma_fprop_implicit_gemm_indexed_wo_smem_f16f16_f16f16_f16_nhwckrsc_nhwc_tilesize128x16x64_stage1_warpsize4x1x1_g1_tensor16x8x8_aligna4_alignc4 Tactic: 0xece74e31d6ab911a Time: 0.00400724
[07/02/2026-03:47:10] [V] [TRT] Tactic Name: sm80_xmma_fprop_implicit_gemm_indexed_wo_smem_f16f16_f16f16_f16_nhwckrsc_nhwc_tilesize128x16x64_stage1_warpsize4x1x1_g1_tensor16x8x16_aligna8_alignc4 Tactic: 0x9d562342491490bf Time: 0.00400559
[07/02/2026-03:47:10] [V] [TRT] Tactic Name: sm75_xmma_fprop_implicit_gemm_indexed_wo_smem_f16f16_f16f16_f16_nhwckrsc_nhwc_tilesize128x16x32_stage1_warpsize4x1x1_g1_tensor16x8x8_aligna2_alignc4 Tactic: 0x4661a730b248432e Time: 0.00586642
[07/02/2026-03:47:10] [V] [TRT] Tactic Name: sm75_xmma_fprop_implicit_gemm_indexed_wo_smem_f16f16_f16f16_f16_nhwckrsc_nhwc_tilesize128x16x64_stage1_warpsize4x1x1_g1_tensor16x8x8_aligna8_alignc8 Tactic: 0x65290447171854c8 Time: 0.00403784
[07/02/2026-03:47:10] [V] [TRT] Tactic Name: sm75_xmma_fprop_implicit_gemm_indexed_wo_smem_f16f16_f16f16_f16_nhwckrsc_nhwc_tilesize128x32x64_stage1_warpsize4x1x1_g1_tensor16x8x8_aligna8_alignc8 Tactic: 0x5d2e9761256bbcd1 Time: 0.00561899
[07/02/2026-03:47:10] [V] [TRT] Tactic Name: sm80_xmma_fprop_implicit_gemm_indexed_wo_smem_f16f16_f16f16_f16_nhwckrsc_nhwc_tilesize128x32x64_stage1_warpsize4x1x1_g1_tensor16x8x16_aligna4_alignc4 Tactic: 0xa1c540a5038e4190 Time: 0.00696555
[07/02/2026-03:47:10] [V] [TRT] Tactic Name: sm80_xmma_fprop_implicit_gemm_indexed_wo_smem_f16f16_f16f16_f16_nhwckrsc_nhwc_tilesize128x32x16_stage1_warpsize4x1x1_g1_tensor16x8x16_aligna8_alignc8 Tactic: 0xfb0beb2dd64ff6e8 Time: 0.0060661
[07/02/2026-03:47:10] [V] [TRT] Tactic Name: sm80_xmma_fprop_implicit_gemm_indexed_wo_smem_f16f16_f16f16_f16_nhwckrsc_nhwc_tilesize128x32x16_stage1_warpsize4x1x1_g1_tensor16x8x16_aligna4_alignc8 Tactic: 0xfeb4e5d6176dd16f Time: 0.00502826
[07/02/2026-03:47:10] [V] [TRT] node_conv2d + node_relu (CaskConvolution[0x80000009]) profiling completed in 0.194953 seconds. Fastest Tactic: 0xe95840ca1789b69d Time: 0.00369829
[07/02/2026-03:47:10] [V] [TRT] Skipping CaskFlattenConvolution: No valid tactics for node_conv2d + node_relu
[07/02/2026-03:47:10] [V] [TRT] >>>>>>>>>>>>>>> Chose Runner Type: CaskConvolution Tactic: 0xe95840ca1789b69d
[07/02/2026-03:47:10] [V] [TRT] *************** Autotuning format combination: Half(784,1:8,28,1) -> Float(25088,784,28,1) ***************
[07/02/2026-03:47:10] [V] [TRT] Skipping CaskConvolution: No valid tactics for node_conv2d + node_relu
[07/02/2026-03:47:10] [V] [TRT] Skipping CaskFlattenConvolution: No valid tactics for node_conv2d + node_relu
[07/02/2026-03:47:10] [V] [TRT] *************** Autotuning format combination: Half(784,1:8,28,1) -> Half(3136,1:8,112,4) ***************
[07/02/2026-03:47:10] [V] [TRT] --------------- Timing Runner: node_conv2d + node_relu (CaskConvolution[0x80000009])
[07/02/2026-03:47:10] [V] [TRT] Tactic Name: sm80_xmma_fprop_implicit_gemm_f16f16_f16f16_f16_nhwckrsc_nhwc_tilesize256x128x32_stage3_warpsize4x2x1_g1_tensor16x8x16_t1r5s5 Tactic: 0x09e1df683041a6eb Time: 0.0236356
[07/02/2026-03:47:10] [V] [TRT] Tactic Name: sm80_xmma_fprop_implicit_gemm_indexed_f16f16_f16f16_f16_nhwckrsc_nhwc_tilesize128x256x32_stage3_warpsize2x4x1_g1_tensor16x8x16 Tactic: 0x7005d10718f6c22d Time: 0.0246644
[07/02/2026-03:47:10] [V] [TRT] Tactic Name: sm80_xmma_fprop_implicit_gemm_f16f16_f16f16_f16_nhwckrsc_nhwc_tilesize64x128x32_stage5_warpsize2x2x1_g1_tensor16x8x16 Tactic: 0xdb0b80f591d1bb6d Time: 0.00845203
[07/02/2026-03:47:10] [V] [TRT] Tactic Name: sm80_xmma_fprop_implicit_gemm_f16f16_f16f16_f16_nhwckrsc_nhwc_tilesize128x64x32_stage5_warpsize2x2x1_g1_tensor16x8x16_t1r5s5 Tactic: 0xb9d272ea28cc4e2e Time: 0.00854642
[07/02/2026-03:47:10] [V] [TRT] Tactic Name: sm80_xmma_fprop_implicit_gemm_f16f16_f16f16_f16_nhwckrsc_nhwc_tilesize128x128x32_stage4_warpsize2x2x1_g1_tensor16x8x16 Tactic: 0xdfa020ef435ef810 Time: 0.0138884
[07/02/2026-03:47:10] [V] [TRT] Tactic Name: sm80_xmma_fprop_implicit_gemm_f16f16_f16f16_f16_nhwckrsc_nhwc_tilesize128x128x64_stage3_warpsize2x2x1_g1_tensor16x8x16_t1r5s5 Tactic: 0xcdcc9faa39e6051e Time: 0.0236147
[07/02/2026-03:47:10] [V] [TRT] Tactic Name: sm80_xmma_fprop_implicit_gemm_f16f16_f16f16_f16_nhwckrsc_nhwc_tilesize128x128x64_stage3_warpsize2x2x1_g1_tensor16x8x16 Tactic: 0x57c9a5ff682354a6 Time: 0.0237427
[07/02/2026-03:47:10] [V] [TRT] Tactic Name: sm80_xmma_fprop_implicit_gemm_f16f16_f16f16_f16_nhwckrsc_nhwc_tilesize128x256x32_stage3_warpsize2x4x1_g1_tensor16x8x16 Tactic: 0xa1a20ea714d420f4 Time: 0.0236983
[07/02/2026-03:47:10] [V] [TRT] Tactic Name: sm80_xmma_fprop_implicit_gemm_f16f16_f16f16_f16_nhwckrsc_nhwc_tilesize256x32x32_stage4_warpsize4x1x1_g1_tensor16x8x16 Tactic: 0xa83b68f30462f971 Time: 0.00892585
[07/02/2026-03:47:10] [V] [TRT] Tactic Name: sm80_xmma_fprop_implicit_gemm_f16f16_f16f16_f16_nhwckrsc_nhwc_tilesize256x64x32_stage3_warpsize4x1x1_g1_tensor16x8x16_t1r5s5 Tactic: 0x5ff3f65d8d1c0627 Time: 0.0139237
[07/02/2026-03:47:10] [V] [TRT] Tactic Name: sm80_xmma_fprop_implicit_gemm_f16f16_f16f16_f16_nhwckrsc_nhwc_tilesize256x128x32_stage3_warpsize4x2x1_g1_tensor16x8x16 Tactic: 0x60da8c7151d91e47 Time: 0.0238469
[07/02/2026-03:47:10] [V] [TRT] Tactic Name: sm75_xmma_fprop_implicit_gemm_f16f16_f16f16_f16_nhwckrsc_nhwc_tilesize64x128x32_stage1_warpsize2x2x1_g1_tensor16x8x8_t1r5s5 Tactic: 0xbe6b0e1b15aa4105 Time: 0.0102286
[07/02/2026-03:47:10] [V] [TRT] Tactic Name: sm75_xmma_fprop_implicit_gemm_f16f16_f16f16_f16_nhwckrsc_nhwc_tilesize64x128x32_stage1_warpsize2x2x1_g1_tensor16x8x8 Tactic: 0xd297ae2cdb8b1406 Time: 0.010123
[07/02/2026-03:47:10] [V] [TRT] Tactic Name: sm75_xmma_fprop_implicit_gemm_f16f16_f16f16_f16_nhwckrsc_nhwc_tilesize128x64x32_stage1_warpsize2x2x1_g1_tensor16x8x8_t1r5s5 Tactic: 0x108b96eabe6d8362 Time: 0.0106828
[07/02/2026-03:47:10] [V] [TRT] Tactic Name: sm75_xmma_fprop_implicit_gemm_f16f16_f16f16_f16_nhwckrsc_nhwc_tilesize128x256x32_stage1_warpsize2x4x1_g1_tensor16x8x8_t1r5s5 Tactic: 0x4106dfcb71f6d6c0 Time: 0.0249806
[07/02/2026-03:47:10] [V] [TRT] Tactic Name: sm75_xmma_fprop_implicit_gemm_f16f16_f16f16_f16_nhwckrsc_nhwc_tilesize256x64x32_stage1_warpsize4x1x1_g1_tensor16x8x8_t1r5s5 Tactic: 0x3d79bf6932f95bc3 Time: 0.0152361
[07/02/2026-03:47:10] [V] [TRT] Tactic Name: sm75_xmma_fprop_implicit_gemm_f16f16_f16f16_f16_nhwckrsc_nhwc_tilesize256x64x32_stage1_warpsize4x1x1_g1_tensor16x8x8 Tactic: 0xb7dc3705357cc965 Time: 0.0154811
[07/02/2026-03:47:10] [V] [TRT] Tactic Name: sm75_xmma_fprop_implicit_gemm_f16f16_f16f16_f16_nhwckrsc_nhwc_tilesize256x128x32_stage1_warpsize4x2x1_g1_tensor16x8x8 Tactic: 0x8d73ddfc444be692 Time: 0.0253562
[07/02/2026-03:47:10] [V] [TRT] Tactic Name: sm75_xmma_fprop_implicit_gemm_indexed_f16f16_f16f16_f16_nhwckrsc_nhwc_tilesize256x64x32_stage1_warpsize4x1x1_g1_tensor16x8x8 Tactic: 0x0e0f7f10867063ba Time: 0.0164851
[07/02/2026-03:47:10] [V] [TRT] Tactic Name: sm80_xmma_fprop_implicit_gemm_indexed_wo_smem_f16f16_f16f16_f16_nhwckrsc_nhwc_tilesize128x32x16_stage1_warpsize4x1x1_g1_tensor16x8x16_aligna4_alignc4 Tactic: 0x72c5a15b17fc333a Time: 0.00720891
[07/02/2026-03:47:10] [V] [TRT] Tactic Name: sm80_xmma_fprop_implicit_gemm_indexed_wo_smem_f16f16_f16f16_f16_nhwckrsc_nhwc_tilesize128x32x16_stage1_warpsize4x1x1_g1_tensor16x8x16_aligna2_alignc8 Tactic: 0x3507353e207bcdee Time: 0.0111669
[07/02/2026-03:47:10] [V] [TRT] Tactic Name: sm75_xmma_fprop_implicit_gemm_indexed_wo_smem_f16f16_f16f16_f16_nhwckrsc_nhwc_tilesize128x16x32_stage1_warpsize4x1x1_g1_tensor16x8x8_alignc8 Tactic: 0x69501656100171de Time: 0.00503456
[07/02/2026-03:47:10] [V] [TRT] Tactic Name: sm75_xmma_fprop_implicit_gemm_indexed_wo_smem_f16f16_f16f16_f16_nhwckrsc_nhwc_tilesize128x16x32_stage1_warpsize4x1x1_g1_tensor16x8x8_alignc2 Tactic: 0x6a75a708475f6de3 Time: 0.00536026
[07/02/2026-03:47:10] [V] [TRT] Tactic Name: sm75_xmma_fprop_implicit_gemm_indexed_wo_smem_f16f16_f16f16_f16_nhwckrsc_nhwc_tilesize128x16x32_stage1_warpsize4x1x1_g1_tensor16x8x8_aligna8_alignc2 Tactic: 0x07398cf013b38640 Time: 0.00585545
[07/02/2026-03:47:10] [V] [TRT] Tactic Name: sm80_xmma_fprop_implicit_gemm_indexed_wo_smem_f16f16_f16f16_f16_nhwckrsc_nhwc_tilesize128x16x32_stage1_warpsize4x1x1_g1_tensor16x8x16_aligna4_alignc2 Tactic: 0x90e2d6b4ee50185b Time: 0.00641471
[07/02/2026-03:47:10] [V] [TRT] Tactic Name: sm75_xmma_fprop_implicit_gemm_indexed_wo_smem_f16f16_f16f16_f16_nhwckrsc_nhwc_tilesize128x16x32_stage1_warpsize4x1x1_g1_tensor16x8x8_aligna2_alignc8 Tactic: 0xca10e3bdb2d9a17b Time: 0.00898943
[07/02/2026-03:47:10] [V] [TRT] Tactic Name: sm75_xmma_fprop_implicit_gemm_indexed_wo_smem_f16f16_f16f16_f16_nhwckrsc_nhwc_tilesize128x16x32_stage1_warpsize4x1x1_g1_tensor16x8x8_aligna2_alignc2 Tactic: 0xc93552e3e587bd46 Time: 0.00865855
[07/02/2026-03:47:10] [V] [TRT] Tactic Name: sm80_xmma_fprop_implicit_gemm_indexed_wo_smem_f16f16_f16f16_f16_nhwckrsc_nhwc_tilesize128x16x64_stage1_warpsize4x1x1_g1_tensor16x8x16_alignc8 Tactic: 0x29d52f76d7883502 Time: 0.00412565
[07/02/2026-03:47:10] [V] [TRT] Tactic Name: sm75_xmma_fprop_implicit_gemm_indexed_wo_smem_f16f16_f16f16_f16_nhwckrsc_nhwc_tilesize128x16x64_stage1_warpsize4x1x1_g1_tensor16x8x8_alignc8 Tactic: 0xbf21db1a7c5b3781 Time: 0.00495748
[07/02/2026-03:47:10] [V] [TRT] Tactic Name: sm80_xmma_fprop_implicit_gemm_indexed_wo_smem_f16f16_f16f16_f16_nhwckrsc_nhwc_tilesize128x16x64_stage1_warpsize4x1x1_g1_tensor16x8x16_alignc4 Tactic: 0xa5a46bfbd719d757 Time: 0.00405321
[07/02/2026-03:47:10] [V] [TRT] Tactic Name: sm75_xmma_fprop_implicit_gemm_indexed_wo_smem_f16f16_f16f16_f16_nhwckrsc_nhwc_tilesize128x16x64_stage1_warpsize4x1x1_g1_tensor16x8x8_alignc2 Tactic: 0xbc046a442b052bbc Time: 0.00479314
[07/02/2026-03:47:10] [V] [TRT] Tactic Name: sm80_xmma_fprop_implicit_gemm_indexed_wo_smem_f16f16_f16f16_f16_nhwckrsc_nhwc_tilesize128x16x64_stage1_warpsize4x1x1_g1_tensor16x8x16_aligna8_alignc2 Tactic: 0x1202d6911edb6ed7 Time: 0.00573897
[07/02/2026-03:47:10] [V] [TRT] Tactic Name: sm80_xmma_fprop_implicit_gemm_indexed_wo_smem_f16f16_f16f16_f16_nhwckrsc_nhwc_tilesize128x16x64_stage1_warpsize4x1x1_g1_tensor16x8x16_aligna4_alignc8 Tactic: 0x1498693488a7556d Time: 0.00535026
[07/02/2026-03:47:10] [V] [TRT] Tactic Name: sm80_xmma_fprop_implicit_gemm_f16f16_f16f16_f16_nhwckrsc_nhwc_tilesize128x64x64_stage4_warpsize2x1x2_g1_tensor16x8x16 Tactic: 0x7273dde1d0cd3bd5 Time: 0.0143579
[07/02/2026-03:47:10] [V] [TRT] Tactic Name: sm80_xmma_fprop_implicit_gemm_indexed_wo_smem_f16f16_f16f16_f16_nhwckrsc_nhwc_tilesize128x16x64_stage1_warpsize4x1x1_g1_tensor16x8x16_aligna2_alignc2 Tactic: 0xdc0e0882e8ef55d1 Time: 0.00977219
[07/02/2026-03:47:10] [V] [TRT] Tactic Name: sm75_xmma_fprop_implicit_gemm_indexed_wo_smem_f16f16_f16f16_f16_nhwckrsc_nhwc_tilesize128x32x64_stage1_warpsize4x1x1_g1_tensor16x8x8_alignc4 Tactic: 0x49e0395ec5fc8474 Time: 0.00490895
[07/02/2026-03:47:10] [V] [TRT] Tactic Name: sm75_xmma_fprop_implicit_gemm_indexed_wo_smem_f16f16_f16f16_f16_nhwckrsc_nhwc_tilesize128x16x64_stage1_warpsize4x1x1_g1_tensor16x8x8_aligna2_alignc8 Tactic: 0xab25da54e12c6fce Time: 0.0106975
[07/02/2026-03:47:10] [V] [TRT] Tactic Name: sm80_xmma_fprop_implicit_gemm_indexed_wo_smem_f16f16_f16f16_f16_nhwckrsc_nhwc_tilesize128x32x64_stage1_warpsize4x1x1_g1_tensor16x8x16_alignc2 Tactic: 0x18d13b6b3c8edcbe Time: 0.00569231
[07/02/2026-03:47:10] [V] [TRT] Tactic Name: sm75_xmma_fprop_implicit_gemm_indexed_wo_smem_f16f16_f16f16_f16_nhwckrsc_nhwc_tilesize128x32x64_stage1_warpsize4x1x1_g1_tensor16x8x8_alignc2 Tactic: 0xc6b4cc8d92337a1c Time: 0.00545524
[07/02/2026-03:47:10] [V] [TRT] Tactic Name: sm75_xmma_fprop_implicit_gemm_indexed_wo_smem_f16f16_f16f16_f16_nhwckrsc_nhwc_tilesize128x32x64_stage1_warpsize4x1x1_g1_tensor16x8x8_aligna8_alignc4 Tactic: 0xd15fd3ec25fa5e84 Time: 0.00785781
[07/02/2026-03:47:10] [V] [TRT] Tactic Name: sm80_xmma_fprop_implicit_gemm_indexed_wo_smem_f16f16_f16f16_f16_nhwckrsc_nhwc_tilesize128x16x32_stage1_warpsize4x1x1_g1_tensor16x8x16_aligna4_alignc4 Tactic: 0x1fb62367b99fe633 Time: 0.00550207
[07/02/2026-03:47:10] [V] [TRT] Tactic Name: sm75_xmma_fprop_implicit_gemm_indexed_wo_smem_f16f16_f16f16_f16_nhwckrsc_nhwc_tilesize128x32x16_stage1_warpsize4x1x1_g1_tensor16x8x8_aligna8_alignc8 Tactic: 0x39a3504f7eeb810b Time: 0.00980541
[07/02/2026-03:47:10] [V] [TRT] Tactic Name: sm80_xmma_fprop_implicit_gemm_indexed_wo_smem_f16f16_f16f16_f16_nhwckrsc_nhwc_tilesize128x32x64_stage1_warpsize4x1x1_g1_tensor16x8x16_aligna8_alignc4 Tactic: 0xa47a4e5ec2ac6617 Time: 0.00577847
[07/02/2026-03:47:10] [V] [TRT] Tactic Name: sm80_xmma_fprop_implicit_gemm_indexed_wo_smem_f16f16_f16f16_f16_nhwckrsc_nhwc_tilesize128x32x64_stage1_warpsize4x1x1_g1_tensor16x8x16_aligna4_alignc8 Tactic: 0x2db40428031fa3c5 Time: 0.00716526
[07/02/2026-03:47:10] [V] [TRT] Tactic Name: sm80_xmma_fprop_implicit_gemm_indexed_wo_smem_f16f16_f16f16_f16_nhwckrsc_nhwc_tilesize128x16x32_stage1_warpsize4x1x1_g1_tensor16x8x16_aligna2_alignc2 Tactic: 0x5b51065cd94604da Time: 0.00931686
[07/02/2026-03:47:10] [V] [TRT] Tactic Name: sm80_xmma_fprop_implicit_gemm_indexed_f16f16_f16f16_f16_nhwckrsc_nhwc_tilesize128x64x32_stage5_warpsize2x2x1_g1_tensor16x8x16 Tactic: 0xc9d24bd069159fa8 Time: 0.00966644
[07/02/2026-03:47:10] [V] [TRT] Tactic Name: sm75_xmma_fprop_implicit_gemm_f16f16_f16f16_f16_nhwckrsc_nhwc_tilesize64x64x64_stage1_warpsize2x2x1_g1_tensor16x8x8_t1r5s5 Tactic: 0x6182fff0b6065f07 Time: 0.0101528
[07/02/2026-03:47:10] [V] [TRT] Tactic Name: sm75_xmma_fprop_implicit_gemm_indexed_wo_smem_f16f16_f16f16_f16_nhwckrsc_nhwc_tilesize128x16x32_stage1_warpsize4x1x1_g1_tensor16x8x8_aligna8_alignc8 Tactic: 0x041c3dae44ed9a7d Time: 0.0054466
[07/02/2026-03:47:10] [V] [TRT] Tactic Name: sm75_xmma_fprop_implicit_gemm_indexed_wo_smem_f16f16_f16f16_f16_nhwckrsc_nhwc_tilesize128x16x64_stage1_warpsize4x1x1_g1_tensor16x8x8_aligna4_alignc8 Tactic: 0x60960abcd63a734f Time: 0.00547725
[07/02/2026-03:47:10] [V] [TRT] Tactic Name: sm75_xmma_fprop_implicit_gemm_indexed_wo_smem_f16f16_f16f16_f16_nhwckrsc_nhwc_tilesize128x16x64_stage1_warpsize4x1x1_g1_tensor16x8x8_aligna4_alignc2 Tactic: 0x63b3bbe281646f72 Time: 0.00746469
[07/02/2026-03:47:10] [V] [TRT] Tactic Name: sm80_xmma_fprop_implicit_gemm_indexed_f16f16_f16f16_f16_nhwckrsc_nhwc_tilesize64x32x64_stage5_warpsize2x2x1_g1_tensor16x8x16 Tactic: 0xe1ff5ad20f5c6bf6 Time: 0.00690895
[07/02/2026-03:47:10] [V] [TRT] Tactic Name: sm75_xmma_fprop_implicit_gemm_indexed_wo_smem_f16f16_f16f16_f16_nhwckrsc_nhwc_tilesize128x16x32_stage1_warpsize4x1x1_g1_tensor16x8x8_alignc4 Tactic: 0xe52152db1090938b Time: 0.0048096
[07/02/2026-03:47:10] [V] [TRT] Tactic Name: sm75_xmma_fprop_implicit_gemm_f16f16_f16f16_f16_nhwckrsc_nhwc_tilesize128x32x32_stage1_warpsize4x1x1_g1_tensor16x8x8 Tactic: 0x18ef97651ad5379a Time: 0.00959177
[07/02/2026-03:47:10] [V] [TRT] Tactic Name: sm80_xmma_fprop_implicit_gemm_indexed_wo_smem_f16f16_f16f16_f16_nhwckrsc_nhwc_tilesize128x16x32_stage1_warpsize4x1x1_g1_tensor16x8x16_aligna2_alignc4 Tactic: 0xd405f38f8e89fab2 Time: 0.009344
[07/02/2026-03:47:10] [V] [TRT] Tactic Name: sm75_xmma_fprop_implicit_gemm_indexed_wo_smem_f16f16_f16f16_f16_nhwckrsc_nhwc_tilesize128x16x32_stage1_warpsize4x1x1_g1_tensor16x8x8_aligna4_alignc2 Tactic: 0x0286820bd291a1c7 Time: 0.0074768
[07/02/2026-03:47:10] [V] [TRT] Tactic Name: sm75_xmma_fprop_implicit_gemm_indexed_f16f16_f16f16_f16_nhwckrsc_nhwc_tilesize128x128x32_stage1_warpsize2x2x1_g1_tensor16x8x8 Tactic: 0x0ecf8dc91198fd5e Time: 0.01448
[07/02/2026-03:47:10] [V] [TRT] Tactic Name: sm75_xmma_fprop_implicit_gemm_indexed_f16f16_f16f16_f16_nhwckrsc_nhwc_tilesize128x128x64_stage1_warpsize2x2x1_g1_tensor16x8x8 Tactic: 0xb0bf64026e546f4d Time: 0.0249608
[07/02/2026-03:47:10] [V] [TRT] Tactic Name: sm80_xmma_fprop_implicit_gemm_indexed_wo_smem_f16f16_f16f16_f16_nhwckrsc_nhwc_tilesize128x32x16_stage1_warpsize4x1x1_g1_tensor16x8x16_aligna4_alignc2 Tactic: 0xfd9154884033cd52 Time: 0.00704
[07/02/2026-03:47:10] [V] [TRT] Tactic Name: sm80_xmma_fprop_implicit_gemm_indexed_wo_smem_f16f16_f16f16_f16_nhwckrsc_nhwc_tilesize128x32x16_stage1_warpsize4x1x1_g1_tensor16x8x16_aligna8_alignc4 Tactic: 0x777aafa0d6de14bd Time: 0.00671003
[07/02/2026-03:47:10] [V] [TRT] Tactic Name: sm75_xmma_fprop_implicit_gemm_indexed_wo_smem_f16f16_f16f16_f16_nhwckrsc_nhwc_tilesize128x16x32_stage1_warpsize4x1x1_g1_tensor16x8x8_aligna4_alignc4 Tactic: 0x8dd277d8855e5faf Time: 0.00569987
[07/02/2026-03:47:10] [V] [TRT] Tactic Name: sm75_xmma_fprop_implicit_gemm_indexed_wo_smem_f16f16_f16f16_f16_nhwckrsc_nhwc_tilesize128x32x64_stage1_warpsize4x1x1_g1_tensor16x8x8_alignc8 Tactic: 0xc5917dd3c56d6621 Time: 0.00489509
[07/02/2026-03:47:10] [V] [TRT] Tactic Name: sm80_xmma_fprop_implicit_gemm_f16f16_f16f16_f16_nhwckrsc_nhwc_tilesize128x64x64_stage3_warpsize2x2x1_g1_tensor16x8x16_t1r5s5 Tactic: 0x08da9063148c481f Time: 0.0136179
[07/02/2026-03:47:10] [V] [TRT] Tactic Name: sm80_xmma_fprop_implicit_gemm_indexed_wo_smem_f16f16_f16f16_f16_nhwckrsc_nhwc_tilesize128x16x32_stage1_warpsize4x1x1_g1_tensor16x8x16_aligna8_alignc4 Tactic: 0x1a092d9c78bdc1b4 Time: 0.00551947
[07/02/2026-03:47:10] [V] [TRT] Tactic Name: sm75_xmma_fprop_implicit_gemm_indexed_wo_smem_f16f16_f16f16_f16_nhwckrsc_nhwc_tilesize128x32x16_stage1_warpsize4x1x1_g1_tensor16x8x8_aligna2_alignc4 Tactic: 0x7bdecad1884e5858 Time: 0.0108895
[07/02/2026-03:47:10] [V] [TRT] Tactic Name: sm80_xmma_fprop_implicit_gemm_indexed_f16f16_f16f16_f16_nhwckrsc_nhwc_tilesize128x32x32_stage4_warpsize4x1x1_g1_tensor16x8x16 Tactic: 0xf79479a62ea9f901 Time: 0.00764511
[07/02/2026-03:47:10] [V] [TRT] Tactic Name: sm75_xmma_fprop_implicit_gemm_f16f16_f16f16_f16_nhwckrsc_nhwc_tilesize64x32x64_stage1_warpsize2x1x2_g1_tensor16x8x8 Tactic: 0x55fb34a08663e5ae Time: 0.00975604
[07/02/2026-03:47:10] [V] [TRT] Tactic Name: sm75_xmma_fprop_implicit_gemm_f16f16_f16f16_f16_nhwckrsc_nhwc_tilesize128x32x32_stage1_warpsize4x1x1_g1_tensor16x8x8_t1r5s5 Tactic: 0xc617e29f6a359b99 Time: 0.00952899
[07/02/2026-03:47:10] [V] [TRT] Tactic Name: sm80_xmma_fprop_implicit_gemm_f16f16_f16f16_f16_nhwckrsc_nhwc_tilesize128x64x32_stage5_warpsize2x2x1_g1_tensor16x8x16 Tactic: 0xbd08239a9317f2fd Time: 0.00893607
[07/02/2026-03:47:10] [V] [TRT] Tactic Name: sm75_xmma_fprop_implicit_gemm_indexed_f16f16_f16f16_f16_nhwckrsc_nhwc_tilesize256x32x32_stage1_warpsize4x1x1_g1_tensor16x8x8 Tactic: 0xa2dad76f719680b5 Time: 0.0137509
[07/02/2026-03:47:10] [V] [TRT] Tactic Name: sm75_xmma_fprop_implicit_gemm_indexed_wo_smem_f16f16_f16f16_f16_nhwckrsc_nhwc_tilesize128x32x64_stage1_warpsize4x1x1_g1_tensor16x8x8_aligna4_alignc8 Tactic: 0x5891999ae4499b56 Time: 0.00979759
[07/02/2026-03:47:10] [V] [TRT] Tactic Name: sm75_xmma_fprop_implicit_gemm_indexed_wo_smem_f16f16_f16f16_f16_nhwckrsc_nhwc_tilesize128x32x64_stage1_warpsize4x1x1_g1_tensor16x8x8_aligna4_alignc2 Tactic: 0x5bb428c4b317876b Time: 0.00694748
[07/02/2026-03:47:10] [V] [TRT] Tactic Name: sm80_xmma_fprop_implicit_gemm_indexed_wo_smem_f16f16_f16f16_f16_nhwckrsc_nhwc_tilesize128x32x64_stage1_warpsize4x1x1_g1_tensor16x8x16_alignc8 Tactic: 0x1bf48a356bd0c083 Time: 0.00497513
[07/02/2026-03:47:10] [V] [TRT] Tactic Name: sm80_xmma_fprop_implicit_gemm_indexed_wo_smem_f16f16_f16f16_f16_nhwckrsc_nhwc_tilesize128x32x64_stage1_warpsize4x1x1_g1_tensor16x8x16_aligna2_alignc4 Tactic: 0x6a76904d34985d11 Time: 0.00998827
[07/02/2026-03:47:10] [V] [TRT] Tactic Name: sm75_xmma_fprop_implicit_gemm_indexed_f16f16_f16f16_f16_nhwckrsc_nhwc_tilesize128x256x32_stage1_warpsize2x4x1_g1_tensor16x8x8 Tactic: 0xe84b9aaa289245c0 Time: 0.0248198
[07/02/2026-03:47:10] [V] [TRT] Tactic Name: sm80_xmma_fprop_implicit_gemm_indexed_wo_smem_f16f16_f16f16_f16_nhwckrsc_nhwc_tilesize128x16x32_stage1_warpsize4x1x1_g1_tensor16x8x16_alignc4 Tactic: 0x7784aea08af37198 Time: 0.00478095
[07/02/2026-03:47:10] [V] [TRT] Tactic Name: sm75_xmma_fprop_implicit_gemm_indexed_f16f16_f16f16_f16_nhwckrsc_nhwc_tilesize64x128x32_stage1_warpsize2x2x1_g1_tensor16x8x8 Tactic: 0x6b44e6396887bed9 Time: 0.0100157
[07/02/2026-03:47:10] [V] [TRT] Tactic Name: sm80_xmma_fprop_implicit_gemm_indexed_f16f16_f16f16_f16_nhwckrsc_nhwc_tilesize128x128x64_stage3_warpsize2x2x1_g1_tensor16x8x16 Tactic: 0x866e7a5f6401b67f Time: 0.0236271
[07/02/2026-03:47:10] [V] [TRT] Tactic Name: sm80_xmma_fprop_implicit_gemm_indexed_wo_smem_f16f16_f16f16_f16_nhwckrsc_nhwc_tilesize128x16x32_stage1_warpsize4x1x1_g1_tensor16x8x16_aligna8_alignc8 Tactic: 0x96786911782c23e1 Time: 0.00556993
[07/02/2026-03:47:10] [V] [TRT] Tactic Name: sm80_xmma_fprop_implicit_gemm_indexed_f16f16_f16f16_f16_nhwckrsc_nhwc_tilesize128x64x64_stage3_warpsize2x2x1_g1_tensor16x8x16 Tactic: 0x21b295c0c8f6c95a Time: 0.0135763
[07/02/2026-03:47:10] [V] [TRT] Tactic Name: sm80_xmma_fprop_implicit_gemm_indexed_wo_smem_f16f16_f16f16_f16_nhwckrsc_nhwc_tilesize128x16x32_stage1_warpsize4x1x1_g1_tensor16x8x16_aligna4_alignc8 Tactic: 0x93c767eab90e0466 Time: 0.00550664
[07/02/2026-03:47:10] [V] [TRT] Tactic Name: sm80_xmma_fprop_implicit_gemm_indexed_wo_smem_f16f16_f16f16_f16_nhwckrsc_nhwc_tilesize128x32x16_stage1_warpsize4x1x1_g1_tensor16x8x16_aligna2_alignc4 Tactic: 0xb97671b320ea2fbb Time: 0.011219
[07/02/2026-03:47:10] [V] [TRT] Tactic Name: sm75_xmma_fprop_implicit_gemm_indexed_wo_smem_f16f16_f16f16_f16_nhwckrsc_nhwc_tilesize128x32x16_stage1_warpsize4x1x1_g1_tensor16x8x8_aligna2_alignc2 Tactic: 0xf48a3f02df81a630 Time: 0.0114532
[07/02/2026-03:47:10] [V] [TRT] Tactic Name: sm75_xmma_fprop_implicit_gemm_indexed_wo_smem_f16f16_f16f16_f16_nhwckrsc_nhwc_tilesize128x16x32_stage1_warpsize4x1x1_g1_tensor16x8x8_aligna8_alignc4 Tactic: 0x886d7923447c7828 Time: 0.00553969
[07/02/2026-03:47:10] [V] [TRT] Tactic Name: sm75_xmma_fprop_implicit_gemm_f16f16_f16f16_f16_nhwckrsc_nhwc_tilesize256x32x32_stage1_warpsize4x1x1_g1_tensor16x8x8_t1r5s5 Tactic: 0x5baadd97fe9624e7 Time: 0.0123432
[07/02/2026-03:47:10] [V] [TRT] Tactic Name: sm75_xmma_fprop_implicit_gemm_f16f16_f16f16_f16_nhwckrsc_nhwc_tilesize64x32x64_stage1_warpsize2x1x2_g1_tensor16x8x8_t1r5s5 Tactic: 0x5f3e6e00aceda82d Time: 0.0110934
[07/02/2026-03:47:10] [V] [TRT] Tactic Name: sm80_xmma_fprop_implicit_gemm_f16f16_f16f16_f16_nhwckrsc_nhwc_tilesize128x32x32_stage4_warpsize4x1x1_g1_tensor16x8x16_t1r5s5 Tactic: 0x33120137a10b68b1 Time: 0.00674244
[07/02/2026-03:47:10] [V] [TRT] Tactic Name: sm75_xmma_fprop_implicit_gemm_indexed_wo_smem_f16f16_f16f16_f16_nhwckrsc_nhwc_tilesize128x32x64_stage1_warpsize4x1x1_g1_tensor16x8x8_aligna2_alignc8 Tactic: 0x93224972d35f87d7 Time: 0.00905657
[07/02/2026-03:47:10] [V] [TRT] Tactic Name: sm75_xmma_fprop_implicit_gemm_indexed_wo_smem_f16f16_f16f16_f16_nhwckrsc_nhwc_tilesize128x32x16_stage1_warpsize4x1x1_g1_tensor16x8x8_aligna8_alignc2 Tactic: 0x3a86e11129b59d36 Time: 0.0113811
[07/02/2026-03:47:10] [V] [TRT] Tactic Name: sm75_xmma_fprop_implicit_gemm_indexed_wo_smem_f16f16_f16f16_f16_nhwckrsc_nhwc_tilesize128x32x16_stage1_warpsize4x1x1_g1_tensor16x8x8_aligna2_alignc8 Tactic: 0xf7af8e5c88dfba0d Time: 0.0110477
[07/02/2026-03:47:10] [V] [TRT] Tactic Name: sm80_xmma_fprop_implicit_gemm_indexed_f16f16_f16f16_f16_nhwckrsc_nhwc_tilesize64x64x64_stage4_warpsize2x2x1_g1_tensor16x8x16 Tactic: 0x4a81ea1e51436a30 Time: 0.00939257
[07/02/2026-03:47:10] [V] [TRT] Tactic Name: sm80_xmma_fprop_implicit_gemm_indexed_wo_smem_f16f16_f16f16_f16_nhwckrsc_nhwc_tilesize128x32x64_stage1_warpsize4x1x1_g1_tensor16x8x16_aligna8_alignc2 Tactic: 0x2b2ebb8d9563987f Time: 0.00532216
[07/02/2026-03:47:10] [V] [TRT] Tactic Name: sm80_xmma_fprop_implicit_gemm_f16f16_f16f16_f16_nhwckrsc_nhwc_tilesize256x64x32_stage3_warpsize4x1x1_g1_tensor16x8x16 Tactic: 0xd1aaad17ca35fbaa Time: 0.0140659
[07/02/2026-03:47:10] [V] [TRT] Tactic Name: sm80_xmma_fprop_implicit_gemm_indexed_wo_smem_f16f16_f16f16_f16_nhwckrsc_nhwc_tilesize128x32x64_stage1_warpsize4x1x1_g1_tensor16x8x16_aligna2_alignc2 Tactic: 0xe522659e6357a379 Time: 0.010002
