cookbook/09-Advance/Logger/result.log
My Logger: Severity.VERBOSE *************** Autotuning Reformat: Float((* (# 1 (SHAPE inputT0)) (# 2 (SHAPE inputT0))),(# 2 (SHAPE inputT0)),1) -> Float(1,(* (# 0 (SHAPE inputT0)) (# 2 (SHAPE inputT0))),(# 0 (SHAPE inputT0))) ***************
My Logger: Severity.VERBOSE --------------- Timing Runner: Optimizer Reformat(inputT0 -> <out>) (Reformat)
My Logger: Severity.VERBOSE Tactic: 0x00000000000003e8 Time: 0.00313341
My Logger: Severity.VERBOSE Tactic: 0x00000000000003ea Time: 0.00919176
My Logger: Severity.VERBOSE Tactic: 0x0000000000000000 Time: 0.00268929
My Logger: Severity.VERBOSE Fastest Tactic: 0x0000000000000000 Time: 0.00268929
My Logger: Severity.VERBOSE *************** Autotuning Reformat: Float((* (# 1 (SHAPE inputT0)) (# 2 (SHAPE inputT0))),(# 2 (SHAPE inputT0)),1) -> Float((* (# 1 (SHAPE inputT0)) (# 2 (SHAPE inputT0))):32,(# 2 (SHAPE inputT0)),1) ***************
My Logger: Severity.VERBOSE --------------- Timing Runner: Optimizer Reformat(inputT0 -> <out>) (Reformat)
My Logger: Severity.VERBOSE Tactic: 0x00000000000003e8 Time: 0.00314737
My Logger: Severity.VERBOSE Tactic: 0x00000000000003ea Time: 0.0177493
My Logger: Severity.VERBOSE Tactic: 0x0000000000000000 Time: 0.00311547
My Logger: Severity.VERBOSE Fastest Tactic: 0x0000000000000000 Time: 0.00311547
My Logger: Severity.VERBOSE =============== Computing reformatting costs
My Logger: Severity.VERBOSE *************** Autotuning Reformat: Float(1,(* (# 0 (SHAPE inputT0)) (# 2 (SHAPE inputT0))),(# 0 (SHAPE inputT0))) -> Float((* (# 1 (SHAPE inputT0)) (# 2 (SHAPE inputT0))),(# 2 (SHAPE inputT0)),1) ***************
My Logger: Severity.VERBOSE --------------- Timing Runner: Optimizer Reformat(<in> -> (Unnamed Layer* 0) [Identity]_output) (Reformat)
My Logger: Severity.VERBOSE Tactic: 0x00000000000003e8 Time: 0.00255292
My Logger: Severity.VERBOSE Tactic: 0x00000000000003ea Time: 0.0178566
My Logger: Severity.VERBOSE Tactic: 0x0000000000000000 Time: 0.00368504
My Logger: Severity.VERBOSE Fastest Tactic: 0x00000000000003e8 Time: 0.00255292
My Logger: Severity.VERBOSE *************** Autotuning Reformat: Float((* (# 1 (SHAPE inputT0)) (# 2 (SHAPE inputT0))):32,(# 2 (SHAPE inputT0)),1) -> Float((* (# 1 (SHAPE inputT0)) (# 2 (SHAPE inputT0))),(# 2 (SHAPE inputT0)),1) ***************
My Logger: Severity.VERBOSE --------------- Timing Runner: Optimizer Reformat(<in> -> (Unnamed Layer* 0) [Identity]_output) (Reformat)
My Logger: Severity.VERBOSE Tactic: 0x00000000000003e8 Time: 0.00319157
My Logger: Severity.VERBOSE Tactic: 0x00000000000003ea Time: 0.0179284
My Logger: Severity.VERBOSE Tactic: 0x0000000000000000 Time: 0.00281708
My Logger: Severity.VERBOSE Fastest Tactic: 0x0000000000000000 Time: 0.00281708
My Logger: Severity.VERBOSE =============== Computing costs for 
My Logger: Severity.VERBOSE *************** Autotuning format combination: Float(E0,(# 2 (SHAPE inputT0)),1) -> Float(E0,(# 2 (SHAPE inputT0)),1) where E0=(* (# 1 (SHAPE inputT0)) (# 2 (SHAPE inputT0))) ***************
My Logger: Severity.VERBOSE --------------- Timing Runner: (Unnamed Layer* 0) [Identity] (Cast)
My Logger: Severity.VERBOSE Cast has no valid tactics for this config, skipping
My Logger: Severity.VERBOSE --------------- Timing Runner: (Unnamed Layer* 0) [Identity] (Reformat)
My Logger: Severity.VERBOSE Tactic: 0x00000000000003e8 Time: 0.0027936
My Logger: Severity.VERBOSE Tactic: 0x00000000000003ea Time: 0.0231445
My Logger: Severity.VERBOSE Tactic: 0x0000000000000000 Time: 0.00270142
My Logger: Severity.VERBOSE Fastest Tactic: 0x0000000000000000 Time: 0.00270142
My Logger: Severity.VERBOSE >>>>>>>>>>>>>>> Chose Runner Type: Reformat Tactic: 0x0000000000000000
My Logger: Severity.VERBOSE *************** Autotuning format combination: Float((* (# 1 (SHAPE inputT0)) (# 2 (SHAPE inputT0))),(# 2 (SHAPE inputT0)),1) -> Float(1,(* (# 0 (SHAPE inputT0)) (# 2 (SHAPE inputT0))),(# 0 (SHAPE inputT0))) ***************
My Logger: Severity.VERBOSE --------------- Timing Runner: (Unnamed Layer* 0) [Identity] (Cast)
My Logger: Severity.VERBOSE Cast has no valid tactics for this config, skipping
My Logger: Severity.VERBOSE --------------- Timing Runner: (Unnamed Layer* 0) [Identity] (Reformat)
My Logger: Severity.VERBOSE Tactic: 0x00000000000003e8 Time: 0.00255015
My Logger: Severity.VERBOSE Tactic: 0x00000000000003ea Time: 0.0077946
My Logger: Severity.VERBOSE Tactic: 0x0000000000000000 Time: 0.00418187
My Logger: Severity.VERBOSE Fastest Tactic: 0x00000000000003e8 Time: 0.00255015
My Logger: Severity.VERBOSE >>>>>>>>>>>>>>> Chose Runner Type: Reformat Tactic: 0x00000000000003e8
My Logger: Severity.VERBOSE *************** Autotuning format combination: Float(E0,(# 2 (SHAPE inputT0)),1) -> Float(E0:32,(# 2 (SHAPE inputT0)),1) where E0=(* (# 1 (SHAPE inputT0)) (# 2 (SHAPE inputT0))) ***************
My Logger: Severity.VERBOSE --------------- Timing Runner: (Unnamed Layer* 0) [Identity] (Cast)
My Logger: Severity.VERBOSE Cast has no valid tactics for this config, skipping
My Logger: Severity.VERBOSE --------------- Timing Runner: (Unnamed Layer* 0) [Identity] (Reformat)
My Logger: Severity.VERBOSE Tactic: 0x00000000000003e8 Time: 0.00526429
My Logger: Severity.VERBOSE Tactic: 0x00000000000003ea Time: 0.0176601
My Logger: Severity.VERBOSE Tactic: 0x0000000000000000 Time: 0.00354594
My Logger: Severity.VERBOSE Fastest Tactic: 0x0000000000000000 Time: 0.00354594
My Logger: Severity.VERBOSE >>>>>>>>>>>>>>> Chose Runner Type: Reformat Tactic: 0x0000000000000000
My Logger: Severity.VERBOSE *************** Autotuning format combination: Float(1,(* (# 0 (SHAPE inputT0)) (# 2 (SHAPE inputT0))),(# 0 (SHAPE inputT0))) -> Float((* (# 1 (SHAPE inputT0)) (# 2 (SHAPE inputT0))),(# 2 (SHAPE inputT0)),1) ***************
My Logger: Severity.VERBOSE --------------- Timing Runner: (Unnamed Layer* 0) [Identity] (Cast)
My Logger: Severity.VERBOSE Cast has no valid tactics for this config, skipping
My Logger: Severity.VERBOSE --------------- Timing Runner: (Unnamed Layer* 0) [Identity] (Reformat)
My Logger: Severity.VERBOSE Tactic: 0x00000000000003e8 Time: 0.00294634
My Logger: Severity.VERBOSE Tactic: 0x00000000000003ea Time: 0.0178908
My Logger: Severity.VERBOSE Tactic: 0x0000000000000000 Time: 0.00266769
My Logger: Severity.VERBOSE Fastest Tactic: 0x0000000000000000 Time: 0.00266769
My Logger: Severity.VERBOSE >>>>>>>>>>>>>>> Chose Runner Type: Reformat Tactic: 0x0000000000000000
My Logger: Severity.VERBOSE *************** Autotuning format combination: Float(1,E0,(# 0 (SHAPE inputT0))) -> Float(1,E0,(# 0 (SHAPE inputT0))) where E0=(* (# 0 (SHAPE inputT0)) (# 2 (SHAPE inputT0))) ***************
My Logger: Severity.VERBOSE --------------- Timing Runner: (Unnamed Layer* 0) [Identity] (Cast)
My Logger: Severity.VERBOSE Cast has no valid tactics for this config, skipping
My Logger: Severity.VERBOSE --------------- Timing Runner: (Unnamed Layer* 0) [Identity] (Reformat)
My Logger: Severity.VERBOSE Tactic: 0x00000000000003e8 Time: 0.00256451
My Logger: Severity.VERBOSE Tactic: 0x00000000000003ea Time: 0.015313
My Logger: Severity.VERBOSE Tactic: 0x0000000000000000 Time: 0.00280722
My Logger: Severity.VERBOSE Fastest Tactic: 0x00000000000003e8 Time: 0.00256451
My Logger: Severity.VERBOSE >>>>>>>>>>>>>>> Chose Runner Type: Reformat Tactic: 0x00000000000003e8
My Logger: Severity.VERBOSE *************** Autotuning format combination: Float(1,(* (# 0 (SHAPE inputT0)) (# 2 (SHAPE inputT0))),(# 0 (SHAPE inputT0))) -> Float((* (# 1 (SHAPE inputT0)) (# 2 (SHAPE inputT0))):32,(# 2 (SHAPE inputT0)),1) ***************
My Logger: Severity.VERBOSE --------------- Timing Runner: (Unnamed Layer* 0) [Identity] (Cast)
My Logger: Severity.VERBOSE Cast has no valid tactics for this config, skipping
My Logger: Severity.VERBOSE --------------- Timing Runner: (Unnamed Layer* 0) [Identity] (Reformat)
My Logger: Severity.VERBOSE Tactic: 0x00000000000003e8 Time: 0.00302847
My Logger: Severity.VERBOSE Tactic: 0x00000000000003ea Time: 0.0155884
My Logger: Severity.VERBOSE Tactic: 0x0000000000000000 Time: 0.00304311
My Logger: Severity.VERBOSE Fastest Tactic: 0x00000000000003e8 Time: 0.00302847
My Logger: Severity.VERBOSE >>>>>>>>>>>>>>> Chose Runner Type: Reformat Tactic: 0x00000000000003e8
My Logger: Severity.VERBOSE *************** Autotuning format combination: Float(E0:32,(# 2 (SHAPE inputT0)),1) -> Float(E0,(# 2 (SHAPE inputT0)),1) where E0=(* (# 1 (SHAPE inputT0)) (# 2 (SHAPE inputT0))) ***************
My Logger: Severity.VERBOSE --------------- Timing Runner: (Unnamed Layer* 0) [Identity] (Cast)
My Logger: Severity.VERBOSE Cast has no valid tactics for this config, skipping
My Logger: Severity.VERBOSE --------------- Timing Runner: (Unnamed Layer* 0) [Identity] (Reformat)
My Logger: Severity.VERBOSE Tactic: 0x00000000000003e8 Time: 0.00280327
My Logger: Severity.VERBOSE Tactic: 0x00000000000003ea Time: 0.0179486
My Logger: Severity.VERBOSE Tactic: 0x0000000000000000 Time: 0.00430708
My Logger: Severity.VERBOSE Fastest Tactic: 0x00000000000003e8 Time: 0.00280327
My Logger: Severity.VERBOSE >>>>>>>>>>>>>>> Chose Runner Type: Reformat Tactic: 0x00000000000003e8
My Logger: Severity.VERBOSE *************** Autotuning format combination: Float((* (# 1 (SHAPE inputT0)) (# 2 (SHAPE inputT0))):32,(# 2 (SHAPE inputT0)),1) -> Float(1,(* (# 0 (SHAPE inputT0)) (# 2 (SHAPE inputT0))),(# 0 (SHAPE inputT0))) ***************
My Logger: Severity.VERBOSE --------------- Timing Runner: (Unnamed Layer* 0) [Identity] (Cast)
My Logger: Severity.VERBOSE Cast has no valid tactics for this config, skipping
My Logger: Severity.VERBOSE --------------- Timing Runner: (Unnamed Layer* 0) [Identity] (Reformat)
My Logger: Severity.VERBOSE Tactic: 0x00000000000003e8 Time: 0.0027617
My Logger: Severity.VERBOSE Tactic: 0x00000000000003ea Time: 0.0156853
My Logger: Severity.VERBOSE Tactic: 0x0000000000000000 Time: 0.00265685
My Logger: Severity.VERBOSE Fastest Tactic: 0x0000000000000000 Time: 0.00265685
My Logger: Severity.VERBOSE >>>>>>>>>>>>>>> Chose Runner Type: Reformat Tactic: 0x0000000000000000
My Logger: Severity.VERBOSE *************** Autotuning format combination: Float(E0:32,(# 2 (SHAPE inputT0)),1) -> Float(E0:32,(# 2 (SHAPE inputT0)),1) where E0=(* (# 1 (SHAPE inputT0)) (# 2 (SHAPE inputT0))) ***************
My Logger: Severity.VERBOSE --------------- Timing Runner: (Unnamed Layer* 0) [Identity] (Cast)
My Logger: Severity.VERBOSE Cast has no valid tactics for this config, skipping
My Logger: Severity.VERBOSE --------------- Timing Runner: (Unnamed Layer* 0) [Identity] (Reformat)
My Logger: Severity.VERBOSE Tactic: 0x00000000000003e8 Time: 0.00306525
My Logger: Severity.VERBOSE Tactic: 0x00000000000003ea Time: 0.0156407
My Logger: Severity.VERBOSE Tactic: 0x0000000000000000 Time: 0.00308081
My Logger: Severity.VERBOSE Fastest Tactic: 0x00000000000003e8 Time: 0.00306525
My Logger: Severity.VERBOSE >>>>>>>>>>>>>>> Chose Runner Type: Reformat Tactic: 0x00000000000003e8
My Logger: Severity.VERBOSE Formats and tactics selection completed in 0.112786 seconds.
My Logger: Severity.VERBOSE After reformat layers: 1 layers
My Logger: Severity.VERBOSE Pre-optimized block assignment.
My Logger: Severity.VERBOSE Block size 1073741824
My Logger: Severity.VERBOSE Total Activation Memory: 1073741824
My Logger: Severity.INFO Detected 1 inputs and 1 output network tensors.
My Logger: Severity.VERBOSE Layer: (Unnamed Layer* 0) [Identity] Host Persistent: 0 Device Persistent: 0 Scratch Memory: 0
My Logger: Severity.INFO Total Host Persistent Memory: 0
My Logger: Severity.INFO Total Device Persistent Memory: 0
My Logger: Severity.INFO Total Scratch Memory: 0
My Logger: Severity.INFO [MemUsageStats] Peak memory usage of TRT CPU/GPU memory allocators: CPU 0 MiB, GPU 4 MiB
My Logger: Severity.VERBOSE Optimized block assignment.
My Logger: Severity.INFO Total Activation Memory: 0
My Logger: Severity.VERBOSE Disabling unused tactic source: CUDNN
My Logger: Severity.VERBOSE Disabling unused tactic source: CUBLAS, CUBLAS_LT
My Logger: Severity.VERBOSE Disabling unused tactic source: EDGE_MASK_CONVOLUTIONS
My Logger: Severity.VERBOSE Engine generation completed in 0.432615 seconds.
My Logger: Severity.VERBOSE Deleting timing cache: 4 entries, served 0 hits since creation.
My Logger: Severity.VERBOSE Engine Layer Information:
Layer(Reformat): (Unnamed Layer* 0) [Identity], Tactic: 0x0000000000000000, inputT0[Float(-3,-4,-5)] -> (Unnamed Layer* 0) [Identity]_output[Float(-3,-4,-5)]
My Logger: Severity.INFO [MemUsageChange] TensorRT-managed allocation in building engine: CPU +0, GPU +0, now: CPU 0, GPU 0 (MiB)
My Logger: Severity.WARNING The getMaxBatchSize() function should not be used with an engine built from a network created with NetworkDefinitionCreationFlag::kEXPLICIT_BATCH flag. This function will always return 1.
My Logger: Severity.WARNING The getMaxBatchSize() function should not be used with an engine built from a network created with NetworkDefinitionCreationFlag::kEXPLICIT_BATCH flag. This function will always return 1.
My Logger: Severity.INFO [MemUsageChange] Init CUDA: CPU +0, GPU +0, now: CPU 603, GPU 632 (MiB)
My Logger: Severity.INFO Loaded engine size: 0 MiB
My Logger: Severity.VERBOSE Deserialization required 296 microseconds.
My Logger: Severity.INFO [MemUsageChange] TensorRT-managed allocation in engine deserialization: CPU +0, GPU +0, now: CPU 0, GPU 0 (MiB)
My Logger: Severity.VERBOSE Total per-runner device persistent memory is 0
My Logger: Severity.VERBOSE Total per-runner host persistent memory is 0
My Logger: Severity.VERBOSE Allocated activation device memory of size 0
My Logger: Severity.INFO [MemUsageChange] TensorRT-managed allocation in IExecutionContext creation: CPU +0, GPU +0, now: CPU 0, GPU 0 (MiB)
Bind[ 0]:i[ 0]-> DataType.FLOAT (-1, -1, -1) (3, 4, 5) inputT0
Bind[ 1]:o[ 0]-> DataType.FLOAT (-1, -1, -1) (3, 4, 5) (Unnamed Layer* 0) [Identity]_output
inputT0
[[[ 0.  1.  2.  3.  4.]
  [ 5.  6.  7.  8.  9.]
  [10. 11. 12. 13. 14.]
  [15. 16. 17. 18. 19.]]

 [[20. 21. 22. 23. 24.]
  [25. 26. 27. 28. 29.]
  [30. 31. 32. 33. 34.]
  [35. 36. 37. 38. 39.]]

 [[40. 41. 42. 43. 44.]
  [45. 46. 47. 48. 49.]
  [50. 51. 52. 53. 54.]
  [55. 56. 57. 58. 59.]]]
(Unnamed Layer* 0) [Identity]_output
[[[ 0.  1.  2.  3.  4.]
  [ 5.  6.  7.  8.  9.]
  [10. 11. 12. 13. 14.]
  [15. 16. 17. 18. 19.]]

 [[20. 21. 22. 23. 24.]
  [25. 26. 27. 28. 29.]
  [30. 31. 32. 33. 34.]
  [35. 36. 37. 38. 39.]]

 [[40. 41. 42. 43. 44.]
  [45. 46. 47. 48. 49.]
  [50. 51. 52. 53. 54.]
  [55. 56. 57. 58. 59.]]]
