cookbook/07-Advance/04-trtexec/output-fp16.txt
[01/29/2022-15:09:36] [V] [TRT] *************** Autotuning Reformat:Float(784,784,28,1) -> Float(784,1,28,1) ***************
[01/29/2022-15:09:36] [V] [TRT] --------------- Timing Runner: Optimizer Reformat (Reformat)
[01/29/2022-15:09:36] [V] [TRT] Tactic: 1002 Time: 0.00452
[01/29/2022-15:09:36] [V] [TRT] Tactic: 0 Time: 0.003276
[01/29/2022-15:09:36] [V] [TRT] Fastest Tactic: 0 Time: 0.003276
[01/29/2022-15:09:36] [V] [TRT] *************** Autotuning Reformat:Float(784,784,28,1) -> Half(784,784,28,1) ***************
[01/29/2022-15:09:36] [V] [TRT] --------------- Timing Runner: Optimizer Reformat (Reformat)
[01/29/2022-15:09:36] [V] [TRT] Tactic: 1002 Time: 0.004416
[01/29/2022-15:09:36] [V] [TRT] Tactic: 0 Time: 0.003904
[01/29/2022-15:09:36] [V] [TRT] Fastest Tactic: 0 Time: 0.003904
[01/29/2022-15:09:36] [V] [TRT] *************** Autotuning format combination: Float(784,784,28,1) -> Float(25088,784,28,1) ***************
[01/29/2022-15:09:36] [V] [TRT] --------------- Timing Runner: Conv__25 + Relu (CudaDepthwiseConvolution)
[01/29/2022-15:09:36] [V] [TRT] CudaDepthwiseConvolution has no valid tactics for this config, skipping
[01/29/2022-15:09:36] [V] [TRT] --------------- Timing Runner: Conv__25 + Relu (FusedConvActConvolution)
[01/29/2022-15:09:36] [V] [TRT] FusedConvActConvolution has no valid tactics for this config, skipping
[01/29/2022-15:09:36] [V] [TRT] --------------- Timing Runner: Conv__25 + Relu (CudnnConvolution)
[01/29/2022-15:09:36] [V] [TRT] Tactic: 0 Time: 0.017708
[01/29/2022-15:09:36] [V] [TRT] Tactic: 1 Time: 0.01976
[01/29/2022-15:09:36] [V] [TRT] Tactic: 2 Time: 0.023572
[01/29/2022-15:09:36] [V] [TRT] Tactic: 4 Time: 0.043616
[01/29/2022-15:09:36] [V] [TRT] Tactic: 5 Time: 0.046644
[01/29/2022-15:09:36] [V] [TRT] Fastest Tactic: 0 Time: 0.017708
[01/29/2022-15:09:36] [V] [TRT] --------------- Timing Runner: Conv__25 + Relu (CaskConvolution)
[01/29/2022-15:09:36] [V] [TRT] Conv__25 + Relu Set Tactic Name: maxwell_scudnn_128x32_relu_medium_nn_v1 Tactic: 1062367460111450758
[01/29/2022-15:09:36] [V] [TRT] Tactic: 1062367460111450758 Time: 0.010816
[01/29/2022-15:09:36] [V] [TRT] Conv__25 + Relu Set Tactic Name: maxwell_scudnn_128x32_relu_large_nn_v0 Tactic: 1754984623894446479
[01/29/2022-15:09:36] [V] [TRT] Tactic: 1754984623894446479 Time: 0.008576
[01/29/2022-15:09:36] [V] [TRT] Conv__25 + Relu Set Tactic Name: maxwell_scudnn_128x128_relu_large_nn_v0 Tactic: 3611739942397549984
[01/29/2022-15:09:36] [V] [TRT] Tactic: 3611739942397549984 Time: 0.01462
[01/29/2022-15:09:36] [V] [TRT] Conv__25 + Relu Set Tactic Name: maxwell_scudnn_128x64_relu_large_nn_v1 Tactic: 4337000649858996379
[01/29/2022-15:09:36] [V] [TRT] Tactic: 4337000649858996379 Time: 0.011548
[01/29/2022-15:09:36] [V] [TRT] Conv__25 + Relu Set Tactic Name: maxwell_scudnn_128x128_relu_medium_nn_v1 Tactic: 4501471010995462441
[01/29/2022-15:09:36] [V] [TRT] Tactic: 4501471010995462441 Time: 0.013744
[01/29/2022-15:09:36] [V] [TRT] Conv__25 + Relu Set Tactic Name: maxwell_scudnn_128x64_relu_small_nn_v1 Tactic: 5137655947464784826
[01/29/2022-15:09:36] [V] [TRT] Tactic: 5137655947464784826 Time: 0.010524
[01/29/2022-15:09:36] [V] [TRT] Conv__25 + Relu Set Tactic Name: maxwell_scudnn_128x128_relu_small_nn_v0 Tactic: 5288347012147084929
[01/29/2022-15:09:36] [V] [TRT] Tactic: 5288347012147084929 Time: 0.014084
[01/29/2022-15:09:36] [V] [TRT] Conv__25 + Relu Set Tactic Name: maxwell_scudnn_128x64_relu_medium_nn_v1 Tactic: 6645123197870846056
[01/29/2022-15:09:36] [V] [TRT] Tactic: 6645123197870846056 Time: 0.010812
[01/29/2022-15:09:36] [V] [TRT] Conv__25 + Relu Set Tactic Name: maxwell_scudnn_128x32_relu_small_nn_v0 Tactic: 7144526460361122478
[01/29/2022-15:09:37] [V] [TRT] Tactic: 7144526460361122478 Time: 0.008432
[01/29/2022-15:09:37] [V] [TRT] Conv__25 + Relu Set Tactic Name: maxwell_scudnn_128x128_relu_large_nn_v1 Tactic: -9137461792520977713
[01/29/2022-15:09:37] [V] [TRT] Tactic: -9137461792520977713 Time: 0.014432
[01/29/2022-15:09:37] [V] [TRT] Conv__25 + Relu Set Tactic Name: maxwell_scudnn_128x128_relu_medium_nn_v0 Tactic: -8262349710178828730
[01/29/2022-15:09:37] [V] [TRT] Tactic: -8262349710178828730 Time: 0.014532
[01/29/2022-15:09:37] [V] [TRT] Conv__25 + Relu Set Tactic Name: maxwell_scudnn_128x64_relu_large_nn_v0 Tactic: -8133971918129952780
[01/29/2022-15:09:37] [V] [TRT] Tactic: -8133971918129952780 Time: 0.0115
[01/29/2022-15:09:37] [V] [TRT] Conv__25 + Relu Set Tactic Name: maxwell_scudnn_128x32_relu_large_nn_v1 Tactic: -6092040395344634144
[01/29/2022-15:09:37] [V] [TRT] Tactic: -6092040395344634144 Time: 0.01164
[01/29/2022-15:09:37] [V] [TRT] Conv__25 + Relu Set Tactic Name: maxwell_scudnn_128x32_relu_medium_nn_v0 Tactic: -4787320710726427159
[01/29/2022-15:09:37] [V] [TRT] Tactic: -4787320710726427159 Time: 0.008616
[01/29/2022-15:09:37] [V] [TRT] Conv__25 + Relu Set Tactic Name: maxwell_scudnn_128x32_relu_small_nn_v1 Tactic: -3456450830548107839
[01/29/2022-15:09:37] [V] [TRT] Tactic: -3456450830548107839 Time: 0.009768
[01/29/2022-15:09:37] [V] [TRT] Conv__25 + Relu Set Tactic Name: maxwell_scudnn_128x64_relu_medium_nn_v0 Tactic: -1218658103698133241
[01/29/2022-15:09:37] [V] [TRT] Tactic: -1218658103698133241 Time: 0.010644
[01/29/2022-15:09:37] [V] [TRT] Conv__25 + Relu Set Tactic Name: maxwell_scudnn_128x64_relu_small_nn_v0 Tactic: -836875257600482091
[01/29/2022-15:09:37] [V] [TRT] Tactic: -836875257600482091 Time: 0.010548
[01/29/2022-15:09:37] [V] [TRT] Conv__25 + Relu Set Tactic Name: maxwell_scudnn_128x128_relu_small_nn_v1 Tactic: -410470605513481746
[01/29/2022-15:09:37] [V] [TRT] Tactic: -410470605513481746 Time: 0.013636
[01/29/2022-15:09:37] [V] [TRT] Fastest Tactic: 7144526460361122478 Time: 0.008432
[01/29/2022-15:09:37] [V] [TRT] >>>>>>>>>>>>>>> Chose Runner Type: CaskConvolution Tactic: 7144526460361122478
[01/29/2022-15:09:37] [V] [TRT] *************** Autotuning format combination: Float(784,1,28,1) -> Float(25088,1,896,32) ***************
[01/29/2022-15:09:37] [V] [TRT] --------------- Timing Runner: Conv__25 + Relu (CudnnConvolution)
[01/29/2022-15:09:37] [V] [TRT] CudnnConvolution has no valid tactics for this config, skipping
[01/29/2022-15:09:37] [V] [TRT] --------------- Timing Runner: Conv__25 + Relu (CaskConvolution)
[01/29/2022-15:09:37] [V] [TRT] CaskConvolution has no valid tactics for this config, skipping
[01/29/2022-15:09:37] [V] [TRT] *************** Autotuning format combination: Half(784,784,28,1) -> Half(25088,784,28,1) ***************
[01/29/2022-15:09:37] [V] [TRT] --------------- Timing Runner: Conv__25 + Relu (CudnnConvolution)
[01/29/2022-15:09:37] [V] [TRT] Tactic: 0 Time: 0.017076
[01/29/2022-15:09:37] [V] [TRT] Tactic: 1 Time: 0.016944
[01/29/2022-15:09:37] [V] [TRT] Tactic: 2 Time: 0.032768
[01/29/2022-15:09:37] [V] [TRT] Tactic: 4 Time: 0.044912
[01/29/2022-15:09:37] [V] [TRT] Tactic: 5 Time: 0.047776
[01/29/2022-15:09:37] [V] [TRT] Fastest Tactic: 1 Time: 0.016944
[01/29/2022-15:09:37] [V] [TRT] --------------- Timing Runner: Conv__25 + Relu (CaskConvolution)
[01/29/2022-15:09:37] [V] [TRT] CaskConvolution has no valid tactics for this config, skipping
[01/29/2022-15:09:37] [V] [TRT] >>>>>>>>>>>>>>> Chose Runner Type: CudnnConvolution Tactic: 1
[01/29/2022-15:09:37] [V] [TRT] *************** Autotuning Reformat:Float(25088,784,28,1) -> Half(25088,784,28,1) ***************
[01/29/2022-15:09:37] [V] [TRT] --------------- Timing Runner: Optimizer Reformat (Reformat)
[01/29/2022-15:09:37] [V] [TRT] Tactic: 1002 Time: 0.007276
[01/29/2022-15:09:37] [V] [TRT] Tactic: 0 Time: 0.006272
[01/29/2022-15:09:37] [V] [TRT] Fastest Tactic: 0 Time: 0.006272
[01/29/2022-15:09:37] [V] [TRT] *************** Autotuning Reformat:Float(25088,1,896,32) -> Float(25088,784,28,1) ***************
[01/29/2022-15:09:37] [V] [TRT] --------------- Timing Runner: Optimizer Reformat (Reformat)
[01/29/2022-15:09:37] [V] [TRT] Tactic: 1002 Time: 0.011264
[01/29/2022-15:09:37] [V] [TRT] Tactic: 0 Time: 0.007276
[01/29/2022-15:09:37] [V] [TRT] Fastest Tactic: 0 Time: 0.007276
[01/29/2022-15:09:37] [V] [TRT] *************** Autotuning Reformat:Float(25088,1,896,32) -> Half(25088,784,28,1) ***************
[01/29/2022-15:09:37] [V] [TRT] --------------- Timing Runner: Optimizer Reformat (Reformat)
[01/29/2022-15:09:37] [V] [TRT] Tactic: 1002 Time: 0.007132
[01/29/2022-15:09:37] [V] [TRT] Tactic: 0 Time: 0.007148
[01/29/2022-15:09:37] [V] [TRT] Fastest Tactic: 1002 Time: 0.007132
[01/29/2022-15:09:37] [V] [TRT] *************** Autotuning Reformat:Half(25088,784,28,1) -> Float(25088,784,28,1) ***************
[01/29/2022-15:09:37] [V] [TRT] --------------- Timing Runner: Optimizer Reformat (Reformat)
[01/29/2022-15:09:37] [V] [TRT] Tactic: 1002 Time: 0.00832
[01/29/2022-15:09:37] [V] [TRT] Tactic: 0 Time: 0.00574
[01/29/2022-15:09:37] [V] [TRT] Fastest Tactic: 0 Time: 0.00574
[01/29/2022-15:09:37] [V] [TRT] *************** Autotuning format combination: Float(25088,784,28,1) -> Float(6272,196,14,1) ***************
[01/29/2022-15:09:37] [V] [TRT] --------------- Timing Runner: MaxPool2d (TiledPooling)
[01/29/2022-15:09:37] [V] [TRT] Tactic: 5505281 Time: 0.0083
[01/29/2022-15:09:37] [V] [TRT] Tactic: 5570817 Time: 0.006044
[01/29/2022-15:09:37] [V] [TRT] Tactic: 5636353 Time: 0.00512
[01/29/2022-15:09:37] [V] [TRT] Tactic: 5701889 Time: 0.004952
[01/29/2022-15:09:37] [V] [TRT] Tactic: 5767425 Time: 0.004992
[01/29/2022-15:09:37] [V] [TRT] Tactic: 5832961 Time: 0.005084
[01/29/2022-15:09:37] [V] [TRT] Tactic: 5898497 Time: 0.00512
[01/29/2022-15:09:37] [V] [TRT] Tactic: 5964033 Time: 0.004096
[01/29/2022-15:09:37] [V] [TRT] Tactic: 6029569 Time: 0.00512
[01/29/2022-15:09:37] [V] [TRT] Tactic: 6095105 Time: 0.004096
[01/29/2022-15:09:37] [V] [TRT] Tactic: 6160641 Time: 0.004076
[01/29/2022-15:09:37] [V] [TRT] Tactic: 6226177 Time: 0.003968
[01/29/2022-15:09:37] [V] [TRT] Tactic: 6291713 Time: 0.004052
[01/29/2022-15:09:37] [V] [TRT] Tactic: 6357249 Time: 0.004052
[01/29/2022-15:09:37] [V] [TRT] Tactic: 6422785 Time: 0.003456
[01/29/2022-15:09:37] [V] [TRT] Tactic: 6488321 Time: 0.003328
[01/29/2022-15:09:37] [V] [TRT] Fastest Tactic: 6488321 Time: 0.003328
[01/29/2022-15:09:37] [V] [TRT] --------------- Timing Runner: MaxPool2d (CudnnPooling)
[01/29/2022-15:09:37] [V] [TRT] Tactic: -1 Time: 0.004096
[01/29/2022-15:09:37] [V] [TRT] Fastest Tactic: -1 Time: 0.004096
[01/29/2022-15:09:37] [V] [TRT] >>>>>>>>>>>>>>> Chose Runner Type: TiledPooling Tactic: 6488321
[01/29/2022-15:09:37] [V] [TRT] *************** Autotuning format combination: Half(25088,784,28,1) -> Half(6272,196,14,1) ***************
[01/29/2022-15:09:37] [V] [TRT] --------------- Timing Runner: MaxPool2d (TiledPooling)
[01/29/2022-15:09:37] [V] [TRT] TiledPooling has no valid tactics for this config, skipping
[01/29/2022-15:09:37] [V] [TRT] --------------- Timing Runner: MaxPool2d (CudnnPooling)
[01/29/2022-15:09:37] [V] [TRT] Tactic: -1 Time: 0.004492
[01/29/2022-15:09:37] [V] [TRT] Fastest Tactic: -1 Time: 0.004492
[01/29/2022-15:09:37] [V] [TRT] >>>>>>>>>>>>>>> Chose Runner Type: CudnnPooling Tactic: -1
[01/29/2022-15:09:37] [V] [TRT] *************** Autotuning Reformat:Float(6272,196,14,1) -> Float(6272,1,448,32) ***************
[01/29/2022-15:09:37] [V] [TRT] --------------- Timing Runner: Optimizer Reformat (Reformat)
[01/29/2022-15:09:37] [V] [TRT] Tactic: 1002 Time: 0.007576
[01/29/2022-15:09:38] [V] [TRT] Tactic: 0 Time: 0.004096
[01/29/2022-15:09:38] [V] [TRT] Fastest Tactic: 0 Time: 0.004096
[01/29/2022-15:09:38] [V] [TRT] *************** Autotuning Reformat:Float(6272,196,14,1) -> Half(6272,196,14,1) ***************
[01/29/2022-15:09:38] [V] [TRT] --------------- Timing Runner: Optimizer Reformat (Reformat)
[01/29/2022-15:09:38] [V] [TRT] Tactic: 1002 Time: 0.022508
[01/29/2022-15:09:38] [V] [TRT] Tactic: 0 Time: 0.004328
[01/29/2022-15:09:38] [V] [TRT] Fastest Tactic: 0 Time: 0.004328
[01/29/2022-15:09:38] [V] [TRT] *************** Autotuning Reformat:Float(6272,1,448,32) -> Float(6272,196,14,1) ***************
[01/29/2022-15:09:38] [V] [TRT] --------------- Timing Runner: Optimizer Reformat (Reformat)
[01/29/2022-15:09:38] [V] [TRT] Tactic: 1002 Time: 0.0072
[01/29/2022-15:09:38] [V] [TRT] Tactic: 0 Time: 0.004096
[01/29/2022-15:09:38] [V] [TRT] Fastest Tactic: 0 Time: 0.004096
[01/29/2022-15:09:38] [V] [TRT] *************** Autotuning Reformat:Float(6272,1,448,32) -> Half(6272,196,14,1) ***************
[01/29/2022-15:09:38] [V] [TRT] --------------- Timing Runner: Optimizer Reformat (Reformat)
[01/29/2022-15:09:38] [V] [TRT] Tactic: 1002 Time: 0.005096
[01/29/2022-15:09:38] [V] [TRT] Tactic: 0 Time: 0.004096
[01/29/2022-15:09:38] [V] [TRT] Fastest Tactic: 0 Time: 0.004096
[01/29/2022-15:09:38] [V] [TRT] *************** Autotuning Reformat:Half(6272,196,14,1) -> Float(6272,196,14,1) ***************
[01/29/2022-15:09:38] [V] [TRT] --------------- Timing Runner: Optimizer Reformat (Reformat)
[01/29/2022-15:09:38] [V] [TRT] Tactic: 1002 Time: 0.022656
[01/29/2022-15:09:38] [V] [TRT] Tactic: 0 Time: 0.003328
[01/29/2022-15:09:38] [V] [TRT] Fastest Tactic: 0 Time: 0.003328
[01/29/2022-15:09:38] [V] [TRT] *************** Autotuning Reformat:Half(6272,196,14,1) -> Float(6272,1,448,32) ***************
[01/29/2022-15:09:38] [V] [TRT] --------------- Timing Runner: Optimizer Reformat (Reformat)
[01/29/2022-15:09:38] [V] [TRT] Tactic: 1002 Time: 0.005216
[01/29/2022-15:09:38] [V] [TRT] Tactic: 0 Time: 0.00426
[01/29/2022-15:09:38] [V] [TRT] Fastest Tactic: 0 Time: 0.00426
[01/29/2022-15:09:38] [V] [TRT] *************** Autotuning format combination: Float(6272,196,14,1) -> Float(12544,196,14,1) ***************
[01/29/2022-15:09:38] [V] [TRT] --------------- Timing Runner: Conv__27 + Relu_1 (CudaDepthwiseConvolution)
[01/29/2022-15:09:38] [V] [TRT] CudaDepthwiseConvolution has no valid tactics for this config, skipping
[01/29/2022-15:09:38] [V] [TRT] --------------- Timing Runner: Conv__27 + Relu_1 (FusedConvActConvolution)
[01/29/2022-15:09:38] [V] [TRT] FusedConvActConvolution has no valid tactics for this config, skipping
[01/29/2022-15:09:38] [V] [TRT] --------------- Timing Runner: Conv__27 + Relu_1 (CudnnConvolution)
[01/29/2022-15:09:38] [V] [TRT] Tactic: 0 Time: 0.063588
[01/29/2022-15:09:38] [V] [TRT] Tactic: 1 Time: 0.063552
[01/29/2022-15:09:38] [V] [TRT] Tactic: 2 Time: 0.128836
[01/29/2022-15:09:38] [V] [TRT] Tactic: 4 Time: 0.162412
[01/29/2022-15:09:38] [V] [TRT] Tactic: 5 Time: 0.179252
[01/29/2022-15:09:38] [V] [TRT] Fastest Tactic: 1 Time: 0.063552
[01/29/2022-15:09:38] [V] [TRT] --------------- Timing Runner: Conv__27 + Relu_1 (CaskConvolution)
[01/29/2022-15:09:38] [V] [TRT] Conv__27 + Relu_1 Set Tactic Name: maxwell_scudnn_128x32_relu_medium_nn_v1 Tactic: 1062367460111450758
[01/29/2022-15:09:38] [V] [TRT] Tactic: 1062367460111450758 Time: 0.106752
[01/29/2022-15:09:38] [V] [TRT] Conv__27 + Relu_1 Set Tactic Name: maxwell_scudnn_128x32_relu_large_nn_v0 Tactic: 1754984623894446479
[01/29/2022-15:09:38] [V] [TRT] Tactic: 1754984623894446479 Time: 0.078128
[01/29/2022-15:09:38] [V] [TRT] Conv__27 + Relu_1 Set Tactic Name: maxwell_scudnn_128x128_relu_large_nn_v0 Tactic: 3611739942397549984
[01/29/2022-15:09:38] [V] [TRT] Tactic: 3611739942397549984 Time: 0.08512
[01/29/2022-15:09:38] [V] [TRT] Conv__27 + Relu_1 Set Tactic Name: maxwell_scudnn_128x64_relu_large_nn_v1 Tactic: 4337000649858996379
[01/29/2022-15:09:38] [V] [TRT] Tactic: 4337000649858996379 Time: 0.078832
[01/29/2022-15:09:38] [V] [TRT] Conv__27 + Relu_1 Set Tactic Name: maxwell_scudnn_128x128_relu_medium_nn_v1 Tactic: 4501471010995462441
[01/29/2022-15:09:38] [V] [TRT] Tactic: 4501471010995462441 Time: 0.085808
[01/29/2022-15:09:38] [V] [TRT] Conv__27 + Relu_1 Set Tactic Name: maxwell_scudnn_128x64_relu_small_nn_v1 Tactic: 5137655947464784826
[01/29/2022-15:09:38] [V] [TRT] Tactic: 5137655947464784826 Time: 0.052096
[01/29/2022-15:09:38] [V] [TRT] Conv__27 + Relu_1 Set Tactic Name: maxwell_scudnn_128x128_relu_small_nn_v0 Tactic: 5288347012147084929
[01/29/2022-15:09:38] [V] [TRT] Tactic: 5288347012147084929 Time: 0.073984
[01/29/2022-15:09:38] [V] [TRT] Conv__27 + Relu_1 Set Tactic Name: maxwell_scudnn_128x64_relu_medium_nn_v1 Tactic: 6645123197870846056
[01/29/2022-15:09:38] [V] [TRT] Tactic: 6645123197870846056 Time: 0.070656
[01/29/2022-15:09:38] [V] [TRT] Conv__27 + Relu_1 Set Tactic Name: maxwell_scudnn_128x32_relu_small_nn_v0 Tactic: 7144526460361122478
[01/29/2022-15:09:38] [V] [TRT] Tactic: 7144526460361122478 Time: 0.059624
[01/29/2022-15:09:38] [V] [TRT] Conv__27 + Relu_1 Set Tactic Name: maxwell_scudnn_128x128_relu_large_nn_v1 Tactic: -9137461792520977713
[01/29/2022-15:09:38] [V] [TRT] Tactic: -9137461792520977713 Time: 0.08826
[01/29/2022-15:09:38] [V] [TRT] Conv__27 + Relu_1 Set Tactic Name: maxwell_scudnn_128x128_relu_medium_nn_v0 Tactic: -8262349710178828730
[01/29/2022-15:09:38] [V] [TRT] Tactic: -8262349710178828730 Time: 0.085632
[01/29/2022-15:09:38] [V] [TRT] Conv__27 + Relu_1 Set Tactic Name: maxwell_scudnn_128x64_relu_large_nn_v0 Tactic: -8133971918129952780
[01/29/2022-15:09:38] [V] [TRT] Tactic: -8133971918129952780 Time: 0.092032
[01/29/2022-15:09:38] [V] [TRT] Conv__27 + Relu_1 Set Tactic Name: maxwell_scudnn_128x32_relu_large_nn_v1 Tactic: -6092040395344634144
[01/29/2022-15:09:38] [V] [TRT] Tactic: -6092040395344634144 Time: 0.108464
[01/29/2022-15:09:38] [V] [TRT] Conv__27 + Relu_1 Set Tactic Name: maxwell_scudnn_128x32_relu_medium_nn_v0 Tactic: -4787320710726427159
[01/29/2022-15:09:38] [V] [TRT] Tactic: -4787320710726427159 Time: 0.077244
[01/29/2022-15:09:38] [V] [TRT] Conv__27 + Relu_1 Set Tactic Name: maxwell_scudnn_128x32_relu_small_nn_v1 Tactic: -3456450830548107839
[01/29/2022-15:09:38] [V] [TRT] Tactic: -3456450830548107839 Time: 0.060912
[01/29/2022-15:09:38] [V] [TRT] Conv__27 + Relu_1 Set Tactic Name: maxwell_scudnn_128x64_relu_medium_nn_v0 Tactic: -1218658103698133241
[01/29/2022-15:09:38] [V] [TRT] Tactic: -1218658103698133241 Time: 0.091172
[01/29/2022-15:09:38] [V] [TRT] Conv__27 + Relu_1 Set Tactic Name: maxwell_scudnn_128x64_relu_small_nn_v0 Tactic: -836875257600482091
[01/29/2022-15:09:38] [V] [TRT] Tactic: -836875257600482091 Time: 0.075148
[01/29/2022-15:09:38] [V] [TRT] Conv__27 + Relu_1 Set Tactic Name: maxwell_scudnn_128x128_relu_small_nn_v1 Tactic: -410470605513481746
[01/29/2022-15:09:38] [V] [TRT] Tactic: -410470605513481746 Time: 0.07286
[01/29/2022-15:09:38] [V] [TRT] Fastest Tactic: 5137655947464784826 Time: 0.052096
[01/29/2022-15:09:38] [V] [TRT] >>>>>>>>>>>>>>> Chose Runner Type: CaskConvolution Tactic: 5137655947464784826
[01/29/2022-15:09:38] [V] [TRT] *************** Autotuning format combination: Float(6272,1,448,32) -> Float(12544,1,896,64) ***************
[01/29/2022-15:09:38] [V] [TRT] --------------- Timing Runner: Conv__27 + Relu_1 (CudnnConvolution)
[01/29/2022-15:09:38] [V] [TRT] CudnnConvolution has no valid tactics for this config, skipping
[01/29/2022-15:09:38] [V] [TRT] --------------- Timing Runner: Conv__27 + Relu_1 (CaskConvolution)
[01/29/2022-15:09:38] [V] [TRT] Conv__27 + Relu_1 Set Tactic Name: maxwell_scudnn_128x32_sliced1x4_ldg4_relu_exp_small_nhwc_tn_v1 Tactic: -9153228964338181824
[01/29/2022-15:09:38] [V] [TRT] Tactic: -9153228964338181824 Time: 0.023784
[01/29/2022-15:09:38] [V] [TRT] Conv__27 + Relu_1 Set Tactic Name: maxwell_scudnn_128x64_sliced1x2_ldg4_relu_exp_small_nhwc_tn_v1 Tactic: -7394439838318485025
[01/29/2022-15:09:38] [V] [TRT] Tactic: -7394439838318485025 Time: 0.041196
[01/29/2022-15:09:38] [V] [TRT] Fastest Tactic: -9153228964338181824 Time: 0.023784
[01/29/2022-15:09:38] [V] [TRT] >>>>>>>>>>>>>>> Chose Runner Type: CaskConvolution Tactic: -9153228964338181824
[01/29/2022-15:09:38] [V] [TRT] *************** Autotuning format combination: Half(6272,196,14,1) -> Half(12544,196,14,1) ***************
[01/29/2022-15:09:38] [V] [TRT] --------------- Timing Runner: Conv__27 + Relu_1 (CudnnConvolution)
[01/29/2022-15:09:38] [V] [TRT] Tactic: 0 Time: 0.070984
[01/29/2022-15:09:38] [V] [TRT] Tactic: 1 Time: 0.06956
[01/29/2022-15:09:38] [V] [TRT] Tactic: 2 Time: 0.125824
[01/29/2022-15:09:38] [V] [TRT] Tactic: 4 Time: 0.161324
[01/29/2022-15:09:38] [V] [TRT] Tactic: 5 Time: 0.177844
[01/29/2022-15:09:38] [V] [TRT] Fastest Tactic: 1 Time: 0.06956
[01/29/2022-15:09:38] [V] [TRT] --------------- Timing Runner: Conv__27 + Relu_1 (CaskConvolution)
[01/29/2022-15:09:38] [V] [TRT] CaskConvolution has no valid tactics for this config, skipping
[01/29/2022-15:09:38] [V] [TRT] >>>>>>>>>>>>>>> Chose Runner Type: CudnnConvolution Tactic: 1
[01/29/2022-15:09:38] [V] [TRT] *************** Autotuning Reformat:Float(12544,196,14,1) -> Half(12544,196,14,1) ***************
[01/29/2022-15:09:38] [V] [TRT] --------------- Timing Runner: Optimizer Reformat (Reformat)
[01/29/2022-15:09:38] [V] [TRT] Tactic: 1002 Time: 0.041452
[01/29/2022-15:09:38] [V] [TRT] Tactic: 0 Time: 0.00478
[01/29/2022-15:09:38] [V] [TRT] Fastest Tactic: 0 Time: 0.00478
[01/29/2022-15:09:38] [V] [TRT] *************** Autotuning Reformat:Float(12544,1,896,64) -> Float(12544,196,14,1) ***************
[01/29/2022-15:09:38] [V] [TRT] --------------- Timing Runner: Optimizer Reformat (Reformat)
[01/29/2022-15:09:38] [V] [TRT] Tactic: 1002 Time: 0.00756
[01/29/2022-15:09:38] [V] [TRT] Tactic: 0 Time: 0.00548
[01/29/2022-15:09:38] [V] [TRT] Fastest Tactic: 0 Time: 0.00548
[01/29/2022-15:09:38] [V] [TRT] *************** Autotuning Reformat:Float(12544,1,896,64) -> Half(12544,196,14,1) ***************
[01/29/2022-15:09:38] [V] [TRT] --------------- Timing Runner: Optimizer Reformat (Reformat)
[01/29/2022-15:09:38] [V] [TRT] Tactic: 1002 Time: 0.00626
[01/29/2022-15:09:38] [V] [TRT] Tactic: 0 Time: 0.005488
[01/29/2022-15:09:38] [V] [TRT] Fastest Tactic: 0 Time: 0.005488
[01/29/2022-15:09:38] [V] [TRT] *************** Autotuning Reformat:Half(12544,196,14,1) -> Float(12544,196,14,1) ***************
[01/29/2022-15:09:38] [V] [TRT] --------------- Timing Runner: Optimizer Reformat (Reformat)
[01/29/2022-15:09:38] [V] [TRT] Tactic: 1002 Time: 0.042356
[01/29/2022-15:09:38] [V] [TRT] Tactic: 0 Time: 0.004268
[01/29/2022-15:09:38] [V] [TRT] Fastest Tactic: 0 Time: 0.004268
[01/29/2022-15:09:38] [V] [TRT] *************** Autotuning format combination: Float(12544,196,14,1) -> Float(3136,49,7,1) ***************
[01/29/2022-15:09:38] [V] [TRT] --------------- Timing Runner: MaxPool2d_1 (TiledPooling)
[01/29/2022-15:09:38] [V] [TRT] Tactic: 5505281 Time: 0.009248
[01/29/2022-15:09:38] [V] [TRT] Tactic: 5570817 Time: 0.006124
[01/29/2022-15:09:38] [V] [TRT] Tactic: 5636353 Time: 0.00512
[01/29/2022-15:09:38] [V] [TRT] Tactic: 5701889 Time: 0.005104
[01/29/2022-15:09:38] [V] [TRT] Tactic: 5767425 Time: 0.005112
[01/29/2022-15:09:38] [V] [TRT] Tactic: 5832961 Time: 0.00512
[01/29/2022-15:09:38] [V] [TRT] Tactic: 5898497 Time: 0.00512
[01/29/2022-15:09:38] [V] [TRT] Tactic: 5964033 Time: 0.004096
[01/29/2022-15:09:38] [V] [TRT] Tactic: 6029569 Time: 0.006104
[01/29/2022-15:09:38] [V] [TRT] Tactic: 6095105 Time: 0.004096
[01/29/2022-15:09:38] [V] [TRT] Tactic: 6160641 Time: 0.004096
[01/29/2022-15:09:38] [V] [TRT] Tactic: 6226177 Time: 0.004096
[01/29/2022-15:09:39] [V] [TRT] Tactic: 6291713 Time: 0.003996
[01/29/2022-15:09:39] [V] [TRT] Tactic: 6357249 Time: 0.003708
[01/29/2022-15:09:39] [V] [TRT] Tactic: 6422785 Time: 0.004076
[01/29/2022-15:09:39] [V] [TRT] Tactic: 6488321 Time: 0.003904
[01/29/2022-15:09:39] [V] [TRT] Fastest Tactic: 6357249 Time: 0.003708
[01/29/2022-15:09:39] [V] [TRT] --------------- Timing Runner: MaxPool2d_1 (CudnnPooling)
[01/29/2022-15:09:39] [V] [TRT] Tactic: -1 Time: 0.004016
[01/29/2022-15:09:39] [V] [TRT] Fastest Tactic: -1 Time: 0.004016
[01/29/2022-15:09:39] [V] [TRT] >>>>>>>>>>>>>>> Chose Runner Type: TiledPooling Tactic: 6357249
[01/29/2022-15:09:39] [V] [TRT] *************** Autotuning format combination: Half(12544,196,14,1) -> Half(3136,49,7,1) ***************
[01/29/2022-15:09:39] [V] [TRT] --------------- Timing Runner: MaxPool2d_1 (TiledPooling)
[01/29/2022-15:09:39] [V] [TRT] TiledPooling has no valid tactics for this config, skipping
[01/29/2022-15:09:39] [V] [TRT] --------------- Timing Runner: MaxPool2d_1 (CudnnPooling)
[01/29/2022-15:09:39] [V] [TRT] Tactic: -1 Time: 0.004096
[01/29/2022-15:09:39] [V] [TRT] Fastest Tactic: -1 Time: 0.004096
[01/29/2022-15:09:39] [V] [TRT] >>>>>>>>>>>>>>> Chose Runner Type: CudnnPooling Tactic: -1
[01/29/2022-15:09:39] [V] [TRT] *************** Autotuning Reformat:Float(3136,49,7,1) -> Float(3136,1,448,64) ***************
[01/29/2022-15:09:39] [V] [TRT] --------------- Timing Runner: Optimizer Reformat (Reformat)
[01/29/2022-15:09:39] [V] [TRT] Tactic: 1002 Time: 0.007168
[01/29/2022-15:09:39] [V] [TRT] Tactic: 0 Time: 0.003456
[01/29/2022-15:09:39] [V] [TRT] Fastest Tactic: 0 Time: 0.003456
[01/29/2022-15:09:39] [V] [TRT] *************** Autotuning Reformat:Float(3136,49,7,1) -> Float(98,49:32,7,1) ***************
[01/29/2022-15:09:39] [V] [TRT] --------------- Timing Runner: Optimizer Reformat (Reformat)
[01/29/2022-15:09:39] [V] [TRT] Tactic: 1002 Time: 0.007168
[01/29/2022-15:09:39] [V] [TRT] Tactic: 0 Time: 0.004044
[01/29/2022-15:09:39] [V] [TRT] Fastest Tactic: 0 Time: 0.004044
[01/29/2022-15:09:39] [V] [TRT] *************** Autotuning Reformat:Float(3136,49,7,1) -> Half(3136,49,7,1) ***************
[01/29/2022-15:09:39] [V] [TRT] --------------- Timing Runner: Optimizer Reformat (Reformat)
[01/29/2022-15:09:39] [V] [TRT] Tactic: 1002 Time: 0.014336
[01/29/2022-15:09:39] [V] [TRT] Tactic: 0 Time: 0.004092
[01/29/2022-15:09:39] [V] [TRT] Fastest Tactic: 0 Time: 0.004092
[01/29/2022-15:09:39] [V] [TRT] *************** Autotuning Reformat:Float(3136,1,448,64) -> Float(3136,49,7,1) ***************
[01/29/2022-15:09:39] [V] [TRT] --------------- Timing Runner: Optimizer Reformat (Reformat)
[01/29/2022-15:09:39] [V] [TRT] Tactic: 1002 Time: 0.007168
[01/29/2022-15:09:39] [V] [TRT] Tactic: 0 Time: 0.003072
[01/29/2022-15:09:39] [V] [TRT] Fastest Tactic: 0 Time: 0.003072
[01/29/2022-15:09:39] [V] [TRT] *************** Autotuning Reformat:Float(3136,1,448,64) -> Float(98,49:32,7,1) ***************
[01/29/2022-15:09:39] [V] [TRT] --------------- Timing Runner: Optimizer Reformat (Reformat)
[01/29/2022-15:09:39] [V] [TRT] Tactic: 1002 Time: 0.007168
[01/29/2022-15:09:39] [V] [TRT] Tactic: 0 Time: 0.004096
[01/29/2022-15:09:39] [V] [TRT] Fastest Tactic: 0 Time: 0.004096
[01/29/2022-15:09:39] [V] [TRT] *************** Autotuning Reformat:Float(3136,1,448,64) -> Half(3136,49,7,1) ***************
[01/29/2022-15:09:39] [V] [TRT] --------------- Timing Runner: Optimizer Reformat (Reformat)
[01/29/2022-15:09:39] [V] [TRT] Tactic: 1002 Time: 0.00496
[01/29/2022-15:09:39] [V] [TRT] Tactic: 0 Time: 0.003072
[01/29/2022-15:09:39] [V] [TRT] Fastest Tactic: 0 Time: 0.003072
[01/29/2022-15:09:39] [V] [TRT] *************** Autotuning Reformat:Float(98,49:32,7,1) -> Float(3136,49,7,1) ***************
[01/29/2022-15:09:39] [V] [TRT] --------------- Timing Runner: Optimizer Reformat (Reformat)
[01/29/2022-15:09:39] [V] [TRT] Tactic: 1002 Time: 0.007148
[01/29/2022-15:09:39] [V] [TRT] Tactic: 0 Time: 0.003296
[01/29/2022-15:09:39] [V] [TRT] Fastest Tactic: 0 Time: 0.003296
[01/29/2022-15:09:39] [V] [TRT] *************** Autotuning Reformat:Float(98,49:32,7,1) -> Float(3136,1,448,64) ***************
[01/29/2022-15:09:39] [V] [TRT] --------------- Timing Runner: Optimizer Reformat (Reformat)
[01/29/2022-15:09:39] [V] [TRT] Tactic: 1002 Time: 0.00716
[01/29/2022-15:09:39] [V] [TRT] Tactic: 0 Time: 0.003072
[01/29/2022-15:09:39] [V] [TRT] Fastest Tactic: 0 Time: 0.003072
[01/29/2022-15:09:39] [V] [TRT] *************** Autotuning Reformat:Float(98,49:32,7,1) -> Half(3136,49,7,1) ***************
[01/29/2022-15:09:39] [V] [TRT] --------------- Timing Runner: Optimizer Reformat (Reformat)
[01/29/2022-15:09:39] [V] [TRT] Tactic: 1002 Time: 0.0051
[01/29/2022-15:09:39] [V] [TRT] Tactic: 0 Time: 0.0032
[01/29/2022-15:09:39] [V] [TRT] Fastest Tactic: 0 Time: 0.0032
[01/29/2022-15:09:39] [V] [TRT] *************** Autotuning Reformat:Half(3136,49,7,1) -> Float(3136,49,7,1) ***************
[01/29/2022-15:09:39] [V] [TRT] --------------- Timing Runner: Optimizer Reformat (Reformat)
[01/29/2022-15:09:39] [V] [TRT] Tactic: 1002 Time: 0.014464
[01/29/2022-15:09:39] [V] [TRT] Tactic: 0 Time: 0.003072
[01/29/2022-15:09:39] [V] [TRT] Fastest Tactic: 0 Time: 0.003072
[01/29/2022-15:09:39] [V] [TRT] *************** Autotuning Reformat:Half(3136,49,7,1) -> Float(3136,1,448,64) ***************
[01/29/2022-15:09:39] [V] [TRT] --------------- Timing Runner: Optimizer Reformat (Reformat)
[01/29/2022-15:09:39] [V] [TRT] Tactic: 1002 Time: 0.00512
[01/29/2022-15:09:39] [V] [TRT] Tactic: 0 Time: 0.003304
[01/29/2022-15:09:39] [V] [TRT] Fastest Tactic: 0 Time: 0.003304
[01/29/2022-15:09:39] [V] [TRT] *************** Autotuning Reformat:Half(3136,49,7,1) -> Float(98,49:32,7,1) ***************
[01/29/2022-15:09:39] [V] [TRT] --------------- Timing Runner: Optimizer Reformat (Reformat)
[01/29/2022-15:09:39] [V] [TRT] Tactic: 1002 Time: 0.005068
[01/29/2022-15:09:39] [V] [TRT] Tactic: 0 Time: 0.004092
[01/29/2022-15:09:39] [V] [TRT] Fastest Tactic: 0 Time: 0.004092
[01/29/2022-15:09:39] [V] [TRT] *************** Autotuning format combination: Float(3136,49,7,1) -> Float(3136,1,1,1) ***************
[01/29/2022-15:09:39] [V] [TRT] --------------- Timing Runner: MaxPool2d_1__22 + Reshape + (Unnamed Layer* 14) [Shuffle] (Shuffle)
[01/29/2022-15:09:39] [V] [TRT] Tactic: 0 Time: 0.003328
[01/29/2022-15:09:39] [V] [TRT] Fastest Tactic: 0 Time: 0.003328
[01/29/2022-15:09:39] [V] [TRT] >>>>>>>>>>>>>>> Chose Runner Type: Shuffle Tactic: 0
[01/29/2022-15:09:39] [V] [TRT] *************** Autotuning format combination: Float(3136,1,448,64) -> Float(3136,1,3136,3136) ***************
[01/29/2022-15:09:39] [V] [TRT] --------------- Timing Runner: MaxPool2d_1__22 + Reshape + (Unnamed Layer* 14) [Shuffle] (Shuffle)
[01/29/2022-15:09:39] [V] [TRT] Tactic: 0 Time: 0.0032
[01/29/2022-15:09:39] [V] [TRT] Fastest Tactic: 0 Time: 0.0032
[01/29/2022-15:09:39] [V] [TRT] >>>>>>>>>>>>>>> Chose Runner Type: Shuffle Tactic: 0
[01/29/2022-15:09:39] [V] [TRT] *************** Autotuning format combination: Float(98,49:32,7,1) -> Float(98,1:32,1,1) ***************
[01/29/2022-15:09:39] [V] [TRT] --------------- Timing Runner: MaxPool2d_1__22 + Reshape + (Unnamed Layer* 14) [Shuffle] (Shuffle)
[01/29/2022-15:09:39] [V] [TRT] Tactic: 0 Time: 0.0032
[01/29/2022-15:09:39] [V] [TRT] Fastest Tactic: 0 Time: 0.0032
[01/29/2022-15:09:39] [V] [TRT] >>>>>>>>>>>>>>> Chose Runner Type: Shuffle Tactic: 0
[01/29/2022-15:09:39] [V] [TRT] *************** Autotuning format combination: Half(3136,49,7,1) -> Half(3136,1,1,1) ***************
[01/29/2022-15:09:39] [V] [TRT] --------------- Timing Runner: MaxPool2d_1__22 + Reshape + (Unnamed Layer* 14) [Shuffle] (Shuffle)
[01/29/2022-15:09:39] [V] [TRT] Tactic: 0 Time: 0.0032
[01/29/2022-15:09:39] [V] [TRT] Fastest Tactic: 0 Time: 0.0032
[01/29/2022-15:09:39] [V] [TRT] >>>>>>>>>>>>>>> Chose Runner Type: Shuffle Tactic: 0
[01/29/2022-15:09:39] [V] [TRT] *************** Autotuning Reformat:Float(3136,1,1,1) -> Float(3136,1,3136,3136) ***************
[01/29/2022-15:09:39] [V] [TRT] --------------- Timing Runner: Optimizer Reformat (Reformat)
[01/29/2022-15:09:39] [V] [TRT] Tactic: 1002 Time: 0.004076
[01/29/2022-15:09:39] [V] [TRT] Tactic: 0 Time: 0.003072
[01/29/2022-15:09:39] [V] [TRT] Fastest Tactic: 0 Time: 0.003072
[01/29/2022-15:09:39] [V] [TRT] *************** Autotuning Reformat:Float(3136,1,1,1) -> Half(3136,1,1,1) ***************
[01/29/2022-15:09:39] [V] [TRT] --------------- Timing Runner: Optimizer Reformat (Reformat)
[01/29/2022-15:09:39] [V] [TRT] Tactic: 1002 Time: 0.00416
[01/29/2022-15:09:39] [V] [TRT] Tactic: 0 Time: 0.004096
[01/29/2022-15:09:39] [V] [TRT] Fastest Tactic: 0 Time: 0.004096
[01/29/2022-15:09:39] [V] [TRT] *************** Autotuning Reformat:Float(3136,1,3136,3136) -> Float(3136,1,1,1) ***************
[01/29/2022-15:09:39] [V] [TRT] --------------- Timing Runner: Optimizer Reformat (Reformat)
[01/29/2022-15:09:39] [V] [TRT] Tactic: 1002 Time: 0.004076
[01/29/2022-15:09:39] [V] [TRT] Tactic: 0 Time: 0.003072
[01/29/2022-15:09:39] [V] [TRT] Fastest Tactic: 0 Time: 0.003072
[01/29/2022-15:09:39] [V] [TRT] *************** Autotuning Reformat:Float(3136,1,3136,3136) -> Half(3136,1,1,1) ***************
[01/29/2022-15:09:39] [V] [TRT] --------------- Timing Runner: Optimizer Reformat (Reformat)
[01/29/2022-15:09:39] [V] [TRT] Tactic: 1002 Time: 0.004072
[01/29/2022-15:09:39] [V] [TRT] Tactic: 0 Time: 0.003176
[01/29/2022-15:09:39] [V] [TRT] Fastest Tactic: 0 Time: 0.003176
[01/29/2022-15:09:39] [V] [TRT] *************** Autotuning Reformat:Float(98,1:32,1,1) -> Float(3136,1,1,1) ***************
[01/29/2022-15:09:39] [V] [TRT] --------------- Timing Runner: Optimizer Reformat (Reformat)
[01/29/2022-15:09:39] [V] [TRT] Tactic: 1002 Time: 0.02622
[01/29/2022-15:09:39] [V] [TRT] Tactic: 0 Time: 0.003072
[01/29/2022-15:09:39] [V] [TRT] Fastest Tactic: 0 Time: 0.003072
[01/29/2022-15:09:39] [V] [TRT] *************** Autotuning Reformat:Float(98,1:32,1,1) -> Float(3136,1,3136,3136) ***************
[01/29/2022-15:09:39] [V] [TRT] --------------- Timing Runner: Optimizer Reformat (Reformat)
[01/29/2022-15:09:39] [V] [TRT] Tactic: 1002 Time: 0.00832
[01/29/2022-15:09:39] [V] [TRT] Tactic: 0 Time: 0.003072
[01/29/2022-15:09:39] [V] [TRT] Fastest Tactic: 0 Time: 0.003072
[01/29/2022-15:09:39] [V] [TRT] *************** Autotuning Reformat:Float(98,1:32,1,1) -> Half(3136,1,1,1) ***************
[01/29/2022-15:09:39] [V] [TRT] --------------- Timing Runner: Optimizer Reformat (Reformat)
[01/29/2022-15:09:39] [V] [TRT] Tactic: 1002 Time: 0.011392
[01/29/2022-15:09:39] [V] [TRT] Tactic: 0 Time: 0.00332
[01/29/2022-15:09:39] [V] [TRT] Fastest Tactic: 0 Time: 0.00332
[01/29/2022-15:09:39] [V] [TRT] *************** Autotuning Reformat:Half(3136,1,1,1) -> Float(3136,1,1,1) ***************
[01/29/2022-15:09:39] [V] [TRT] --------------- Timing Runner: Optimizer Reformat (Reformat)
[01/29/2022-15:09:39] [V] [TRT] Tactic: 1002 Time: 0.00446
[01/29/2022-15:09:39] [V] [TRT] Tactic: 0 Time: 0.003376
[01/29/2022-15:09:39] [V] [TRT] Fastest Tactic: 0 Time: 0.003376
[01/29/2022-15:09:39] [V] [TRT] *************** Autotuning Reformat:Half(3136,1,1,1) -> Float(3136,1,3136,3136) ***************
[01/29/2022-15:09:39] [V] [TRT] --------------- Timing Runner: Optimizer Reformat (Reformat)
[01/29/2022-15:09:39] [V] [TRT] Tactic: 1002 Time: 0.004392
[01/29/2022-15:09:39] [V] [TRT] Tactic: 0 Time: 0.003496
[01/29/2022-15:09:39] [V] [TRT] Fastest Tactic: 0 Time: 0.003496
[01/29/2022-15:09:39] [V] [TRT] *************** Autotuning format combination: Float(3136,1,1,1) -> Float(1024,1,1,1) ***************
[01/29/2022-15:09:39] [V] [TRT] --------------- Timing Runner: MatMul + b3/read:0 + (Unnamed Layer* 21) [Shuffle] + unsqueeze_node_after_b3/read:0 + (Unnamed Layer* 21) [Shuffle] + add_2 + Relu_2 (CudaDepthwiseConvolution)
[01/29/2022-15:09:39] [V] [TRT] CudaDepthwiseConvolution has no valid tactics for this config, skipping
[01/29/2022-15:09:39] [V] [TRT] --------------- Timing Runner: MatMul + b3/read:0 + (Unnamed Layer* 21) [Shuffle] + unsqueeze_node_after_b3/read:0 + (Unnamed Layer* 21) [Shuffle] + add_2 + Relu_2 (FusedConvActConvolution)
[01/29/2022-15:09:39] [V] [TRT] FusedConvActConvolution has no valid tactics for this config, skipping
[01/29/2022-15:09:39] [V] [TRT] --------------- Timing Runner: MatMul + b3/read:0 + (Unnamed Layer* 21) [Shuffle] + unsqueeze_node_after_b3/read:0 + (Unnamed Layer* 21) [Shuffle] + add_2 + Relu_2 (CudnnConvolution)
[01/29/2022-15:09:39] [V] [TRT] Tactic: 0 Time: 0.312544
[01/29/2022-15:09:39] [V] [TRT] Tactic: 1 Time: 0.179692
[01/29/2022-15:09:39] [V] [TRT] Tactic: 2 Time: 0.387252
[01/29/2022-15:09:39] [V] [TRT] Tactic: 4 skipped. Scratch requested: 7527202816, available: 1073741824
[01/29/2022-15:09:39] [V] [TRT] Tactic: 5 Time: 5.97019
[01/29/2022-15:09:39] [I] [TRT] Some tactics do not have sufficient workspace memory to run. Increasing workspace size may increase performance, please check verbose output.
[01/29/2022-15:09:39] [V] [TRT] Fastest Tactic: 1 Time: 0.179692
[01/29/2022-15:09:39] [V] [TRT] --------------- Timing Runner: MatMul + b3/read:0 + (Unnamed Layer* 21) [Shuffle] + unsqueeze_node_after_b3/read:0 + (Unnamed Layer* 21) [Shuffle] + add_2 + Relu_2 (CublasConvolution)
[01/29/2022-15:09:40] [V] [TRT] Tactic: 0 Time: 0.06876
[01/29/2022-15:09:40] [V] [TRT] Tactic: 1 Time: 0.069992
[01/29/2022-15:09:40] [V] [TRT] Fastest Tactic: 0 Time: 0.06876
[01/29/2022-15:09:40] [V] [TRT] --------------- Timing Runner: MatMul + b3/read:0 + (Unnamed Layer* 21) [Shuffle] + unsqueeze_node_after_b3/read:0 + (Unnamed Layer* 21) [Shuffle] + add_2 + Relu_2 (CaskConvolution)
[01/29/2022-15:09:40] [V] [TRT] MatMul + b3/read:0 + (Unnamed Layer* 21) [Shuffle] + unsqueeze_node_after_b3/read:0 + (Unnamed Layer* 21) [Shuffle] + add_2 + Relu_2 Set Tactic Name: maxwell_scudnn_128x32_relu_medium_nn_v1 Tactic: 1062367460111450758
[01/29/2022-15:09:40] [V] [TRT] Tactic: 1062367460111450758 Time: 0.379232
[01/29/2022-15:09:40] [V] [TRT] MatMul + b3/read:0 + (Unnamed Layer* 21) [Shuffle] + unsqueeze_node_after_b3/read:0 + (Unnamed Layer* 21) [Shuffle] + add_2 + Relu_2 Set Tactic Name: maxwell_scudnn_128x32_relu_interior_nn_v0 Tactic: 1698681053543049347
[01/29/2022-15:09:40] [V] [TRT] Tactic: 1698681053543049347 Time: 0.376188
[01/29/2022-15:09:40] [V] [TRT] MatMul + b3/read:0 + (Unnamed Layer* 21) [Shuffle] + unsqueeze_node_after_b3/read:0 + (Unnamed Layer* 21) [Shuffle] + add_2 + Relu_2 Set Tactic Name: maxwell_scudnn_128x128_relu_medium_nn_v1 Tactic: 4501471010995462441
[01/29/2022-15:09:40] [V] [TRT] Tactic: 4501471010995462441 Time: 0.41042
[01/29/2022-15:09:40] [V] [TRT] MatMul + b3/read:0 + (Unnamed Layer* 21) [Shuffle] + unsqueeze_node_after_b3/read:0 + (Unnamed Layer* 21) [Shuffle] + add_2 + Relu_2 Set Tactic Name: maxwell_scudnn_128x64_relu_small_nn_v1 Tactic: 5137655947464784826
[01/29/2022-15:09:40] [V] [TRT] Tactic: 5137655947464784826 Time: 0.317756
[01/29/2022-15:09:40] [V] [TRT] MatMul + b3/read:0 + (Unnamed Layer* 21) [Shuffle] + unsqueeze_node_after_b3/read:0 + (Unnamed Layer* 21) [Shuffle] + add_2 + Relu_2 Set Tactic Name: maxwell_scudnn_128x128_relu_small_nn_v0 Tactic: 5288347012147084929
[01/29/2022-15:09:40] [V] [TRT] Tactic: 5288347012147084929 Time: 0.381696
[01/29/2022-15:09:40] [V] [TRT] MatMul + b3/read:0 + (Unnamed Layer* 21) [Shuffle] + unsqueeze_node_after_b3/read:0 + (Unnamed Layer* 21) [Shuffle] + add_2 + Relu_2 Set Tactic Name: maxwell_scudnn_128x128_relu_interior_nn_v1 Tactic: 5326823351883942011
[01/29/2022-15:09:40] [V] [TRT] Tactic: 5326823351883942011 Time: 0.406392
[01/29/2022-15:09:40] [V] [TRT] MatMul + b3/read:0 + (Unnamed Layer* 21) [Shuffle] + unsqueeze_node_after_b3/read:0 + (Unnamed Layer* 21) [Shuffle] + add_2 + Relu_2 Set Tactic Name: maxwell_scudnn_128x64_relu_interior_nn_v0 Tactic: 5500448035057547314
[01/29/2022-15:09:40] [V] [TRT] Tactic: 5500448035057547314 Time: 0.363364
[01/29/2022-15:09:40] [V] [TRT] MatMul + b3/read:0 + (Unnamed Layer* 21) [Shuffle] + unsqueeze_node_after_b3/read:0 + (Unnamed Layer* 21) [Shuffle] + add_2 + Relu_2 Set Tactic Name: maxwell_scudnn_128x64_relu_medium_nn_v1 Tactic: 6645123197870846056
[01/29/2022-15:09:40] [V] [TRT] Tactic: 6645123197870846056 Time: 0.325832
[01/29/2022-15:09:40] [V] [TRT] MatMul + b3/read:0 + (Unnamed Layer* 21) [Shuffle] + unsqueeze_node_after_b3/read:0 + (Unnamed Layer* 21) [Shuffle] + add_2 + Relu_2 Set Tactic Name: maxwell_scudnn_128x32_relu_small_nn_v0 Tactic: 7144526460361122478
[01/29/2022-15:09:40] [V] [TRT] Tactic: 7144526460361122478 Time: 0.37714
[01/29/2022-15:09:40] [V] [TRT] MatMul + b3/read:0 + (Unnamed Layer* 21) [Shuffle] + unsqueeze_node_after_b3/read:0 + (Unnamed Layer* 21) [Shuffle] + add_2 + Relu_2 Set Tactic Name: maxwell_scudnn_128x128_relu_medium_nn_v0 Tactic: -8262349710178828730
[01/29/2022-15:09:40] [V] [TRT] Tactic: -8262349710178828730 Time: 0.374272
[01/29/2022-15:09:40] [V] [TRT] MatMul + b3/read:0 + (Unnamed Layer* 21) [Shuffle] + unsqueeze_node_after_b3/read:0 + (Unnamed Layer* 21) [Shuffle] + add_2 + Relu_2 Set Tactic Name: maxwell_scudnn_128x32_relu_interior_nn_v1 Tactic: -6576203419454146580
[01/29/2022-15:09:40] [V] [TRT] Tactic: -6576203419454146580 Time: 0.328448
[01/29/2022-15:09:40] [V] [TRT] MatMul + b3/read:0 + (Unnamed Layer* 21) [Shuffle] + unsqueeze_node_after_b3/read:0 + (Unnamed Layer* 21) [Shuffle] + add_2 + Relu_2 Set Tactic Name: maxwell_scudnn_128x32_relu_medium_nn_v0 Tactic: -4787320710726427159
[01/29/2022-15:09:40] [V] [TRT] Tactic: -4787320710726427159 Time: 0.354944
[01/29/2022-15:09:40] [V] [TRT] MatMul + b3/read:0 + (Unnamed Layer* 21) [Shuffle] + unsqueeze_node_after_b3/read:0 + (Unnamed Layer* 21) [Shuffle] + add_2 + Relu_2 Set Tactic Name: maxwell_scudnn_128x32_relu_small_nn_v1 Tactic: -3456450830548107839
[01/29/2022-15:09:40] [V] [TRT] Tactic: -3456450830548107839 Time: 0.33792
[01/29/2022-15:09:40] [V] [TRT] MatMul + b3/read:0 + (Unnamed Layer* 21) [Shuffle] + unsqueeze_node_after_b3/read:0 + (Unnamed Layer* 21) [Shuffle] + add_2 + Relu_2 Set Tactic Name: maxwell_scudnn_128x64_relu_medium_nn_v0 Tactic: -1218658103698133241
[01/29/2022-15:09:40] [V] [TRT] Tactic: -1218658103698133241 Time: 0.379328
[01/29/2022-15:09:40] [V] [TRT] MatMul + b3/read:0 + (Unnamed Layer* 21) [Shuffle] + unsqueeze_node_after_b3/read:0 + (Unnamed Layer* 21) [Shuffle] + add_2 + Relu_2 Set Tactic Name: maxwell_scudnn_128x64_relu_small_nn_v0 Tactic: -836875257600482091
[01/29/2022-15:09:40] [V] [TRT] Tactic: -836875257600482091 Time: 0.369532
[01/29/2022-15:09:40] [V] [TRT] MatMul + b3/read:0 + (Unnamed Layer* 21) [Shuffle] + unsqueeze_node_after_b3/read:0 + (Unnamed Layer* 21) [Shuffle] + add_2 + Relu_2 Set Tactic Name: maxwell_scudnn_128x128_relu_small_nn_v1 Tactic: -410470605513481746
[01/29/2022-15:09:40] [V] [TRT] Tactic: -410470605513481746 Time: 0.407424
[01/29/2022-15:09:40] [V] [TRT] MatMul + b3/read:0 + (Unnamed Layer* 21) [Shuffle] + unsqueeze_node_after_b3/read:0 + (Unnamed Layer* 21) [Shuffle] + add_2 + Relu_2 Set Tactic Name: maxwell_scudnn_128x128_relu_interior_nn_v0 Tactic: -377491875521947884
[01/29/2022-15:09:40] [V] [TRT] Tactic: -377491875521947884 Time: 0.379008
[01/29/2022-15:09:40] [V] [TRT] MatMul + b3/read:0 + (Unnamed Layer* 21) [Shuffle] + unsqueeze_node_after_b3/read:0 + (Unnamed Layer* 21) [Shuffle] + add_2 + Relu_2 Set Tactic Name: maxwell_scudnn_128x64_relu_interior_nn_v1 Tactic: -37215280111360163
[01/29/2022-15:09:40] [V] [TRT] Tactic: -37215280111360163 Time: 0.316584
[01/29/2022-15:09:40] [V] [TRT] Fastest Tactic: -37215280111360163 Time: 0.316584
[01/29/2022-15:09:40] [V] [TRT] >>>>>>>>>>>>>>> Chose Runner Type: CublasConvolution Tactic: 0
[01/29/2022-15:09:40] [V] [TRT] *************** Autotuning format combination: Float(3136,1,3136,3136) -> Float(1024,1,1024,1024) ***************
[01/29/2022-15:09:40] [V] [TRT] --------------- Timing Runner: MatMul + b3/read:0 + (Unnamed Layer* 21) [Shuffle] + unsqueeze_node_after_b3/read:0 + (Unnamed Layer* 21) [Shuffle] + add_2 + Relu_2 (CudnnConvolution)
[01/29/2022-15:09:40] [V] [TRT] CudnnConvolution has no valid tactics for this config, skipping
[01/29/2022-15:09:40] [V] [TRT] --------------- Timing Runner: MatMul + b3/read:0 + (Unnamed Layer* 21) [Shuffle] + unsqueeze_node_after_b3/read:0 + (Unnamed Layer* 21) [Shuffle] + add_2 + Relu_2 (CublasConvolution)
[01/29/2022-15:09:40] [V] [TRT] CublasConvolution has no valid tactics for this config, skipping
[01/29/2022-15:09:40] [V] [TRT] --------------- Timing Runner: MatMul + b3/read:0 + (Unnamed Layer* 21) [Shuffle] + unsqueeze_node_after_b3/read:0 + (Unnamed Layer* 21) [Shuffle] + add_2 + Relu_2 (CaskConvolution)
[01/29/2022-15:09:40] [V] [TRT] MatMul + b3/read:0 + (Unnamed Layer* 21) [Shuffle] + unsqueeze_node_after_b3/read:0 + (Unnamed Layer* 21) [Shuffle] + add_2 + Relu_2 Set Tactic Name: maxwell_scudnn_128x64_sliced1x2_ldg4_relu_exp_interior_nhwc_tn_v1 Tactic: 3886731678879822788
[01/29/2022-15:09:40] [V] [TRT] Tactic: 3886731678879822788 Time: 0.186752
[01/29/2022-15:09:40] [V] [TRT] MatMul + b3/read:0 + (Unnamed Layer* 21) [Shuffle] + unsqueeze_node_after_b3/read:0 + (Unnamed Layer* 21) [Shuffle] + add_2 + Relu_2 Set Tactic Name: maxwell_scudnn_128x32_sliced1x4_ldg4_relu_exp_interior_nhwc_tn_v1 Tactic: 6629944304117643200
[01/29/2022-15:09:40] [V] [TRT] Tactic: 6629944304117643200 Time: 0.139648
[01/29/2022-15:09:40] [V] [TRT] MatMul + b3/read:0 + (Unnamed Layer* 21) [Shuffle] + unsqueeze_node_after_b3/read:0 + (Unnamed Layer* 21) [Shuffle] + add_2 + Relu_2 Set Tactic Name: maxwell_scudnn_128x32_sliced1x4_ldg4_relu_exp_small_nhwc_tn_v1 Tactic: -9153228964338181824
[01/29/2022-15:09:40] [V] [TRT] Tactic: -9153228964338181824 Time: 0.14106
[01/29/2022-15:09:40] [V] [TRT] MatMul + b3/read:0 + (Unnamed Layer* 21) [Shuffle] + unsqueeze_node_after_b3/read:0 + (Unnamed Layer* 21) [Shuffle] + add_2 + Relu_2 Set Tactic Name: maxwell_scudnn_128x64_sliced1x2_ldg4_relu_exp_small_nhwc_tn_v1 Tactic: -7394439838318485025
[01/29/2022-15:09:40] [V] [TRT] Tactic: -7394439838318485025 Time: 0.187264
[01/29/2022-15:09:40] [V] [TRT] Fastest Tactic: 6629944304117643200 Time: 0.139648
[01/29/2022-15:09:40] [V] [TRT] >>>>>>>>>>>>>>> Chose Runner Type: CaskConvolution Tactic: 6629944304117643200
[01/29/2022-15:09:40] [V] [TRT] *************** Autotuning format combination: Half(3136,1,1,1) -> Half(1024,1,1,1) ***************
[01/29/2022-15:09:40] [V] [TRT] --------------- Timing Runner: MatMul + b3/read:0 + (Unnamed Layer* 21) [Shuffle] + unsqueeze_node_after_b3/read:0 + (Unnamed Layer* 21) [Shuffle] + add_2 + Relu_2 (CudnnConvolution)
[01/29/2022-15:09:40] [V] [TRT] Tactic: 0 Time: 0.27604
[01/29/2022-15:09:40] [V] [TRT] Tactic: 1 Time: 0.287156
[01/29/2022-15:09:40] [V] [TRT] Tactic: 2 Time: 0.381824
[01/29/2022-15:09:40] [V] [TRT] Tactic: 4 skipped. Scratch requested: 7527202816, available: 1073741824
[01/29/2022-15:09:40] [V] [TRT] Tactic: 5 Time: 5.79721
[01/29/2022-15:09:40] [V] [TRT] Fastest Tactic: 0 Time: 0.27604
[01/29/2022-15:09:40] [V] [TRT] --------------- Timing Runner: MatMul + b3/read:0 + (Unnamed Layer* 21) [Shuffle] + unsqueeze_node_after_b3/read:0 + (Unnamed Layer* 21) [Shuffle] + add_2 + Relu_2 (CublasConvolution)
[01/29/2022-15:09:40] [V] [TRT] CublasConvolution has no valid tactics for this config, skipping
[01/29/2022-15:09:40] [V] [TRT] --------------- Timing Runner: MatMul + b3/read:0 + (Unnamed Layer* 21) [Shuffle] + unsqueeze_node_after_b3/read:0 + (Unnamed Layer* 21) [Shuffle] + add_2 + Relu_2 (CaskConvolution)
[01/29/2022-15:09:40] [V] [TRT] CaskConvolution has no valid tactics for this config, skipping
[01/29/2022-15:09:40] [V] [TRT] >>>>>>>>>>>>>>> Chose Runner Type: CudnnConvolution Tactic: 0
[01/29/2022-15:09:40] [V] [TRT] *************** Autotuning Reformat:Float(1024,1,1,1) -> Float(1024,1,1024,1024) ***************
[01/29/2022-15:09:40] [V] [TRT] --------------- Timing Runner: Optimizer Reformat (Reformat)
[01/29/2022-15:09:40] [V] [TRT] Tactic: 1002 Time: 0.00362
[01/29/2022-15:09:40] [V] [TRT] Tactic: 0 Time: 0.003312
[01/29/2022-15:09:40] [V] [TRT] Fastest Tactic: 0 Time: 0.003312
[01/29/2022-15:09:40] [V] [TRT] *************** Autotuning Reformat:Float(1024,1,1,1) -> Half(1024,1,1,1) ***************
[01/29/2022-15:09:40] [V] [TRT] --------------- Timing Runner: Optimizer Reformat (Reformat)
[01/29/2022-15:09:40] [V] [TRT] Tactic: 1002 Time: 0.004392
[01/29/2022-15:09:40] [V] [TRT] Tactic: 0 Time: 0.00446
[01/29/2022-15:09:40] [V] [TRT] Fastest Tactic: 1002 Time: 0.004392
[01/29/2022-15:09:40] [V] [TRT] *************** Autotuning Reformat:Float(1024,1,1024,1024) -> Float(1024,1,1,1) ***************
[01/29/2022-15:09:40] [V] [TRT] --------------- Timing Runner: Optimizer Reformat (Reformat)
[01/29/2022-15:09:40] [V] [TRT] Tactic: 1002 Time: 0.003832
[01/29/2022-15:09:40] [V] [TRT] Tactic: 0 Time: 0.003368
[01/29/2022-15:09:40] [V] [TRT] Fastest Tactic: 0 Time: 0.003368
[01/29/2022-15:09:40] [V] [TRT] *************** Autotuning Reformat:Float(1024,1,1024,1024) -> Half(1024,1,1,1) ***************
[01/29/2022-15:09:40] [V] [TRT] --------------- Timing Runner: Optimizer Reformat (Reformat)
[01/29/2022-15:09:40] [V] [TRT] Tactic: 1002 Time: 0.003552
[01/29/2022-15:09:40] [V] [TRT] Tactic: 0 Time: 0.00332
[01/29/2022-15:09:40] [V] [TRT] Fastest Tactic: 0 Time: 0.00332
[01/29/2022-15:09:40] [V] [TRT] *************** Autotuning Reformat:Half(1024,1,1,1) -> Float(1024,1,1,1) ***************
[01/29/2022-15:09:40] [V] [TRT] --------------- Timing Runner: Optimizer Reformat (Reformat)
[01/29/2022-15:09:40] [V] [TRT] Tactic: 1002 Time: 0.004348
[01/29/2022-15:09:41] [V] [TRT] Tactic: 0 Time: 0.003436
[01/29/2022-15:09:41] [V] [TRT] Fastest Tactic: 0 Time: 0.003436
[01/29/2022-15:09:41] [V] [TRT] *************** Autotuning Reformat:Half(1024,1,1,1) -> Float(1024,1,1024,1024) ***************
[01/29/2022-15:09:41] [V] [TRT] --------------- Timing Runner: Optimizer Reformat (Reformat)
[01/29/2022-15:09:41] [V] [TRT] Tactic: 1002 Time: 0.004464
[01/29/2022-15:09:41] [V] [TRT] Tactic: 0 Time: 0.003428
[01/29/2022-15:09:41] [V] [TRT] Fastest Tactic: 0 Time: 0.003428
[01/29/2022-15:09:41] [V] [TRT] *************** Autotuning format combination: Float(1024,1,1,1) -> Float(10,1,1,1) ***************
[01/29/2022-15:09:41] [V] [TRT] --------------- Timing Runner: MatMul_1 + b4/read:0 + (Unnamed Layer* 37) [Shuffle] + unsqueeze_node_after_b4/read:0 + (Unnamed Layer* 37) [Shuffle] + add_3 (CudaDepthwiseConvolution)
[01/29/2022-15:09:41] [V] [TRT] CudaDepthwiseConvolution has no valid tactics for this config, skipping
[01/29/2022-15:09:41] [V] [TRT] --------------- Timing Runner: MatMul_1 + b4/read:0 + (Unnamed Layer* 37) [Shuffle] + unsqueeze_node_after_b4/read:0 + (Unnamed Layer* 37) [Shuffle] + add_3 (FusedConvActConvolution)
[01/29/2022-15:09:41] [V] [TRT] FusedConvActConvolution has no valid tactics for this config, skipping
[01/29/2022-15:09:41] [V] [TRT] --------------- Timing Runner: MatMul_1 + b4/read:0 + (Unnamed Layer* 37) [Shuffle] + unsqueeze_node_after_b4/read:0 + (Unnamed Layer* 37) [Shuffle] + add_3 (CudnnConvolution)
[01/29/2022-15:09:41] [V] [TRT] Tactic: 0 Time: 0.123752
[01/29/2022-15:09:41] [V] [TRT] Tactic: 1 Time: 0.052276
[01/29/2022-15:09:41] [V] [TRT] Tactic: 2 Time: 0.150212
[01/29/2022-15:09:41] [V] [TRT] Tactic: 4 Time: 0.315188
[01/29/2022-15:09:41] [V] [TRT] Tactic: 5 Time: 0.093788
[01/29/2022-15:09:41] [V] [TRT] Fastest Tactic: 1 Time: 0.052276
[01/29/2022-15:09:41] [V] [TRT] --------------- Timing Runner: MatMul_1 + b4/read:0 + (Unnamed Layer* 37) [Shuffle] + unsqueeze_node_after_b4/read:0 + (Unnamed Layer* 37) [Shuffle] + add_3 (CublasConvolution)
[01/29/2022-15:09:41] [V] [TRT] Tactic: 0 Time: 0.0086
[01/29/2022-15:09:41] [V] [TRT] Tactic: 1 Time: 0.011624
[01/29/2022-15:09:41] [V] [TRT] Fastest Tactic: 0 Time: 0.0086
[01/29/2022-15:09:41] [V] [TRT] --------------- Timing Runner: MatMul_1 + b4/read:0 + (Unnamed Layer* 37) [Shuffle] + unsqueeze_node_after_b4/read:0 + (Unnamed Layer* 37) [Shuffle] + add_3 (CaskConvolution)
[01/29/2022-15:09:41] [V] [TRT] MatMul_1 + b4/read:0 + (Unnamed Layer* 37) [Shuffle] + unsqueeze_node_after_b4/read:0 + (Unnamed Layer* 37) [Shuffle] + add_3 Set Tactic Name: maxwell_scudnn_128x32_relu_medium_nn_v1 Tactic: 1062367460111450758
[01/29/2022-15:09:41] [V] [TRT] Tactic: 1062367460111450758 Time: 0.090868
[01/29/2022-15:09:41] [V] [TRT] MatMul_1 + b4/read:0 + (Unnamed Layer* 37) [Shuffle] + unsqueeze_node_after_b4/read:0 + (Unnamed Layer* 37) [Shuffle] + add_3 Set Tactic Name: maxwell_scudnn_128x32_relu_interior_nn_v0 Tactic: 1698681053543049347
[01/29/2022-15:09:41] [V] [TRT] Tactic: 1698681053543049347 Time: 0.06296
[01/29/2022-15:09:41] [V] [TRT] MatMul_1 + b4/read:0 + (Unnamed Layer* 37) [Shuffle] + unsqueeze_node_after_b4/read:0 + (Unnamed Layer* 37) [Shuffle] + add_3 Set Tactic Name: maxwell_scudnn_128x128_relu_medium_nn_v1 Tactic: 4501471010995462441
[01/29/2022-15:09:41] [V] [TRT] Tactic: 4501471010995462441 Time: 0.096356
[01/29/2022-15:09:41] [V] [TRT] MatMul_1 + b4/read:0 + (Unnamed Layer* 37) [Shuffle] + unsqueeze_node_after_b4/read:0 + (Unnamed Layer* 37) [Shuffle] + add_3 Set Tactic Name: maxwell_scudnn_128x64_relu_small_nn_v1 Tactic: 5137655947464784826
[01/29/2022-15:09:41] [V] [TRT] Tactic: 5137655947464784826 Time: 0.064408
[01/29/2022-15:09:41] [V] [TRT] MatMul_1 + b4/read:0 + (Unnamed Layer* 37) [Shuffle] + unsqueeze_node_after_b4/read:0 + (Unnamed Layer* 37) [Shuffle] + add_3 Set Tactic Name: maxwell_scudnn_128x128_relu_small_nn_v0 Tactic: 5288347012147084929
[01/29/2022-15:09:41] [V] [TRT] Tactic: 5288347012147084929 Time: 0.09354
[01/29/2022-15:09:41] [V] [TRT] MatMul_1 + b4/read:0 + (Unnamed Layer* 37) [Shuffle] + unsqueeze_node_after_b4/read:0 + (Unnamed Layer* 37) [Shuffle] + add_3 Set Tactic Name: maxwell_scudnn_128x128_relu_interior_nn_v1 Tactic: 5326823351883942011
[01/29/2022-15:09:41] [V] [TRT] Tactic: 5326823351883942011 Time: 0.093416
[01/29/2022-15:09:41] [V] [TRT] MatMul_1 + b4/read:0 + (Unnamed Layer* 37) [Shuffle] + unsqueeze_node_after_b4/read:0 + (Unnamed Layer* 37) [Shuffle] + add_3 Set Tactic Name: maxwell_scudnn_128x64_relu_interior_nn_v0 Tactic: 5500448035057547314
[01/29/2022-15:09:41] [V] [TRT] Tactic: 5500448035057547314 Time: 0.080168
[01/29/2022-15:09:41] [V] [TRT] MatMul_1 + b4/read:0 + (Unnamed Layer* 37) [Shuffle] + unsqueeze_node_after_b4/read:0 + (Unnamed Layer* 37) [Shuffle] + add_3 Set Tactic Name: maxwell_scudnn_128x64_relu_medium_nn_v1 Tactic: 6645123197870846056
[01/29/2022-15:09:41] [V] [TRT] Tactic: 6645123197870846056 Time: 0.070064
[01/29/2022-15:09:41] [V] [TRT] MatMul_1 + b4/read:0 + (Unnamed Layer* 37) [Shuffle] + unsqueeze_node_after_b4/read:0 + (Unnamed Layer* 37) [Shuffle] + add_3 Set Tactic Name: maxwell_scudnn_128x32_relu_small_nn_v0 Tactic: 7144526460361122478
[01/29/2022-15:09:41] [V] [TRT] Tactic: 7144526460361122478 Time: 0.065956
[01/29/2022-15:09:41] [V] [TRT] MatMul_1 + b4/read:0 + (Unnamed Layer* 37) [Shuffle] + unsqueeze_node_after_b4/read:0 + (Unnamed Layer* 37) [Shuffle] + add_3 Set Tactic Name: maxwell_scudnn_128x128_relu_medium_nn_v0 Tactic: -8262349710178828730
[01/29/2022-15:09:41] [V] [TRT] Tactic: -8262349710178828730 Time: 0.095524
[01/29/2022-15:09:41] [V] [TRT] MatMul_1 + b4/read:0 + (Unnamed Layer* 37) [Shuffle] + unsqueeze_node_after_b4/read:0 + (Unnamed Layer* 37) [Shuffle] + add_3 Set Tactic Name: maxwell_scudnn_128x32_relu_interior_nn_v1 Tactic: -6576203419454146580
[01/29/2022-15:09:41] [V] [TRT] Tactic: -6576203419454146580 Time: 0.068712
[01/29/2022-15:09:41] [V] [TRT] MatMul_1 + b4/read:0 + (Unnamed Layer* 37) [Shuffle] + unsqueeze_node_after_b4/read:0 + (Unnamed Layer* 37) [Shuffle] + add_3 Set Tactic Name: maxwell_scudnn_128x32_relu_medium_nn_v0 Tactic: -4787320710726427159
[01/29/2022-15:09:41] [V] [TRT] Tactic: -4787320710726427159 Time: 0.070904
[01/29/2022-15:09:41] [V] [TRT] MatMul_1 + b4/read:0 + (Unnamed Layer* 37) [Shuffle] + unsqueeze_node_after_b4/read:0 + (Unnamed Layer* 37) [Shuffle] + add_3 Set Tactic Name: maxwell_scudnn_128x32_relu_small_nn_v1 Tactic: -3456450830548107839
[01/29/2022-15:09:41] [V] [TRT] Tactic: -3456450830548107839 Time: 0.07298
[01/29/2022-15:09:41] [V] [TRT] MatMul_1 + b4/read:0 + (Unnamed Layer* 37) [Shuffle] + unsqueeze_node_after_b4/read:0 + (Unnamed Layer* 37) [Shuffle] + add_3 Set Tactic Name: maxwell_scudnn_128x64_relu_medium_nn_v0 Tactic: -1218658103698133241
[01/29/2022-15:09:41] [V] [TRT] Tactic: -1218658103698133241 Time: 0.086804
[01/29/2022-15:09:41] [V] [TRT] MatMul_1 + b4/read:0 + (Unnamed Layer* 37) [Shuffle] + unsqueeze_node_after_b4/read:0 + (Unnamed Layer* 37) [Shuffle] + add_3 Set Tactic Name: maxwell_scudnn_128x64_relu_small_nn_v0 Tactic: -836875257600482091
[01/29/2022-15:09:41] [V] [TRT] Tactic: -836875257600482091 Time: 0.081724
[01/29/2022-15:09:41] [V] [TRT] MatMul_1 + b4/read:0 + (Unnamed Layer* 37) [Shuffle] + unsqueeze_node_after_b4/read:0 + (Unnamed Layer* 37) [Shuffle] + add_3 Set Tactic Name: maxwell_scudnn_128x128_relu_small_nn_v1 Tactic: -410470605513481746
[01/29/2022-15:09:41] [V] [TRT] Tactic: -410470605513481746 Time: 0.09252
[01/29/2022-15:09:41] [V] [TRT] MatMul_1 + b4/read:0 + (Unnamed Layer* 37) [Shuffle] + unsqueeze_node_after_b4/read:0 + (Unnamed Layer* 37) [Shuffle] + add_3 Set Tactic Name: maxwell_scudnn_128x128_relu_interior_nn_v0 Tactic: -377491875521947884
[01/29/2022-15:09:41] [V] [TRT] Tactic: -377491875521947884 Time: 0.09246
[01/29/2022-15:09:41] [V] [TRT] MatMul_1 + b4/read:0 + (Unnamed Layer* 37) [Shuffle] + unsqueeze_node_after_b4/read:0 + (Unnamed Layer* 37) [Shuffle] + add_3 Set Tactic Name: maxwell_scudnn_128x64_relu_interior_nn_v1 Tactic: -37215280111360163
[01/29/2022-15:09:41] [V] [TRT] Tactic: -37215280111360163 Time: 0.062868
[01/29/2022-15:09:41] [V] [TRT] Fastest Tactic: -37215280111360163 Time: 0.062868
[01/29/2022-15:09:41] [V] [TRT] >>>>>>>>>>>>>>> Chose Runner Type: CublasConvolution Tactic: 0
[01/29/2022-15:09:41] [V] [TRT] *************** Autotuning format combination: Float(1024,1,1024,1024) -> Float(10,1,10,10) ***************
[01/29/2022-15:09:41] [V] [TRT] --------------- Timing Runner: MatMul_1 + b4/read:0 + (Unnamed Layer* 37) [Shuffle] + unsqueeze_node_after_b4/read:0 + (Unnamed Layer* 37) [Shuffle] + add_3 (CudnnConvolution)
[01/29/2022-15:09:41] [V] [TRT] CudnnConvolution has no valid tactics for this config, skipping
[01/29/2022-15:09:41] [V] [TRT] --------------- Timing Runner: MatMul_1 + b4/read:0 + (Unnamed Layer* 37) [Shuffle] + unsqueeze_node_after_b4/read:0 + (Unnamed Layer* 37) [Shuffle] + add_3 (CublasConvolution)
[01/29/2022-15:09:41] [V] [TRT] CublasConvolution has no valid tactics for this config, skipping
[01/29/2022-15:09:41] [V] [TRT] --------------- Timing Runner: MatMul_1 + b4/read:0 + (Unnamed Layer* 37) [Shuffle] + unsqueeze_node_after_b4/read:0 + (Unnamed Layer* 37) [Shuffle] + add_3 (CaskConvolution)
[01/29/2022-15:09:41] [V] [TRT] CaskConvolution has no valid tactics for this config, skipping
[01/29/2022-15:09:41] [V] [TRT] *************** Autotuning format combination: Half(1024,1,1,1) -> Half(10,1,1,1) ***************
[01/29/2022-15:09:41] [V] [TRT] --------------- Timing Runner: MatMul_1 + b4/read:0 + (Unnamed Layer* 37) [Shuffle] + unsqueeze_node_after_b4/read:0 + (Unnamed Layer* 37) [Shuffle] + add_3 (CudnnConvolution)
[01/29/2022-15:09:41] [V] [TRT] Tactic: 0 Time: 0.074152
[01/29/2022-15:09:41] [V] [TRT] Tactic: 1 Time: 0.069368
[01/29/2022-15:09:41] [V] [TRT] Tactic: 2 Time: 0.160632
[01/29/2022-15:09:41] [V] [TRT] Tactic: 4 Time: 0.314824
[01/29/2022-15:09:41] [V] [TRT] Tactic: 5 Time: 0.095092
[01/29/2022-15:09:41] [V] [TRT] Fastest Tactic: 1 Time: 0.069368
[01/29/2022-15:09:41] [V] [TRT] --------------- Timing Runner: MatMul_1 + b4/read:0 + (Unnamed Layer* 37) [Shuffle] + unsqueeze_node_after_b4/read:0 + (Unnamed Layer* 37) [Shuffle] + add_3 (CublasConvolution)
[01/29/2022-15:09:41] [V] [TRT] CublasConvolution has no valid tactics for this config, skipping
[01/29/2022-15:09:41] [V] [TRT] --------------- Timing Runner: MatMul_1 + b4/read:0 + (Unnamed Layer* 37) [Shuffle] + unsqueeze_node_after_b4/read:0 + (Unnamed Layer* 37) [Shuffle] + add_3 (CaskConvolution)
[01/29/2022-15:09:41] [V] [TRT] CaskConvolution has no valid tactics for this config, skipping
[01/29/2022-15:09:41] [V] [TRT] >>>>>>>>>>>>>>> Chose Runner Type: CudnnConvolution Tactic: 1
[01/29/2022-15:09:41] [V] [TRT] *************** Autotuning Reformat:Float(10,1,1,1) -> Half(10,1,1,1) ***************
[01/29/2022-15:09:41] [V] [TRT] --------------- Timing Runner: Optimizer Reformat (Reformat)
[01/29/2022-15:09:41] [V] [TRT] Tactic: 1002 Time: 0.00446
[01/29/2022-15:09:41] [V] [TRT] Tactic: 0 Time: 0.003444
[01/29/2022-15:09:41] [V] [TRT] Fastest Tactic: 0 Time: 0.003444
[01/29/2022-15:09:41] [V] [TRT] *************** Autotuning Reformat:Float(10,1,10,10) -> Float(10,1,1,1) ***************
[01/29/2022-15:09:41] [V] [TRT] --------------- Timing Runner: Optimizer Reformat (Reformat)
[01/29/2022-15:09:41] [V] [TRT] Tactic: 1002 Time: 0.0044
[01/29/2022-15:09:41] [V] [TRT] Tactic: 0 Time: 0.003256
[01/29/2022-15:09:41] [V] [TRT] Fastest Tactic: 0 Time: 0.003256
[01/29/2022-15:09:41] [V] [TRT] *************** Autotuning Reformat:Float(10,1,10,10) -> Half(10,1,1,1) ***************
[01/29/2022-15:09:41] [V] [TRT] --------------- Timing Runner: Optimizer Reformat (Reformat)
[01/29/2022-15:09:41] [V] [TRT] Tactic: 1002 Time: 0.004276
[01/29/2022-15:09:41] [V] [TRT] Tactic: 0 Time: 0.003396
[01/29/2022-15:09:41] [V] [TRT] Fastest Tactic: 0 Time: 0.003396
[01/29/2022-15:09:41] [V] [TRT] *************** Autotuning Reformat:Half(10,1,1,1) -> Float(10,1,1,1) ***************
[01/29/2022-15:09:41] [V] [TRT] --------------- Timing Runner: Optimizer Reformat (Reformat)
[01/29/2022-15:09:41] [V] [TRT] Tactic: 1002 Time: 0.004412
[01/29/2022-15:09:41] [V] [TRT] Tactic: 0 Time: 0.003448
[01/29/2022-15:09:41] [V] [TRT] Fastest Tactic: 0 Time: 0.003448
[01/29/2022-15:09:41] [V] [TRT] *************** Autotuning format combination: Float(10,1,1,1) -> Float(10,1) ***************
[01/29/2022-15:09:41] [V] [TRT] --------------- Timing Runner: copied_squeeze_after_add_3 (Shuffle)
[01/29/2022-15:09:41] [V] [TRT] Tactic: 0 Time: 0.00248
[01/29/2022-15:09:41] [V] [TRT] Fastest Tactic: 0 Time: 0.00248
[01/29/2022-15:09:41] [V] [TRT] >>>>>>>>>>>>>>> Chose Runner Type: Shuffle Tactic: 0
[01/29/2022-15:09:41] [V] [TRT] *************** Autotuning format combination: Half(10,1,1,1) -> Half(10,1) ***************
[01/29/2022-15:09:41] [V] [TRT] --------------- Timing Runner: copied_squeeze_after_add_3 (Shuffle)
[01/29/2022-15:09:41] [V] [TRT] Tactic: 0 Time: 0.002348
[01/29/2022-15:09:41] [V] [TRT] Fastest Tactic: 0 Time: 0.002348
[01/29/2022-15:09:41] [V] [TRT] >>>>>>>>>>>>>>> Chose Runner Type: Shuffle Tactic: 0
[01/29/2022-15:09:41] [V] [TRT] *************** Autotuning Reformat:Float(10,1) -> Half(10,1) ***************
[01/29/2022-15:09:41] [V] [TRT] --------------- Timing Runner: Optimizer Reformat (Reformat)
[01/29/2022-15:09:41] [V] [TRT] Tactic: 1002 Time: 0.004328
[01/29/2022-15:09:41] [V] [TRT] Tactic: 0 Time: 0.00364
[01/29/2022-15:09:41] [V] [TRT] Fastest Tactic: 0 Time: 0.00364
[01/29/2022-15:09:41] [V] [TRT] *************** Autotuning Reformat:Half(10,1) -> Float(10,1) ***************
[01/29/2022-15:09:41] [V] [TRT] --------------- Timing Runner: Optimizer Reformat (Reformat)
[01/29/2022-15:09:41] [V] [TRT] Tactic: 1002 Time: 0.004452
[01/29/2022-15:09:41] [V] [TRT] Tactic: 0 Time: 0.00326
[01/29/2022-15:09:41] [V] [TRT] Fastest Tactic: 0 Time: 0.00326
[01/29/2022-15:09:41] [V] [TRT] *************** Autotuning format combination: Float(10,1) -> Float(1,1), Int32(1,1) ***************
[01/29/2022-15:09:41] [V] [TRT] --------------- Timing Runner: y + z (LogSoftmaxTopK)
[01/29/2022-15:09:41] [V] [TRT] Tactic: 1001 Time: 0.003436
[01/29/2022-15:09:41] [V] [TRT] Tactic: 1002 Time: 0.014964
[01/29/2022-15:09:41] [V] [TRT] Fastest Tactic: 1001 Time: 0.003436
[01/29/2022-15:09:41] [V] [TRT] >>>>>>>>>>>>>>> Chose Runner Type: LogSoftmaxTopK Tactic: 1001
[01/29/2022-15:09:41] [V] [TRT] *************** Autotuning format combination: Half(10,1) -> Half(1,1), Int32(1,1) ***************
[01/29/2022-15:09:41] [V] [TRT] --------------- Timing Runner: y + z (LogSoftmaxTopK)
[01/29/2022-15:09:41] [V] [TRT] Tactic: 1001 Time: 0.003312
[01/29/2022-15:09:41] [V] [TRT] Tactic: 1002 Time: 0.015072
[01/29/2022-15:09:41] [V] [TRT] Fastest Tactic: 1001 Time: 0.003312
[01/29/2022-15:09:41] [V] [TRT] >>>>>>>>>>>>>>> Chose Runner Type: LogSoftmaxTopK Tactic: 1001
[01/29/2022-15:09:41] [V] [TRT] *************** Autotuning Reformat:Float(1,1) -> Half(1,1) ***************
