cookbook/07-Advance/04-trtexec/output-fp32.txt
[01/29/2022-15:09:28] [V] [TRT] *************** Autotuning Reformat:Float(784,784,28,1) -> Float(784,1,28,1) ***************
[01/29/2022-15:09:28] [V] [TRT] --------------- Timing Runner: Optimizer Reformat (Reformat)
[01/29/2022-15:09:28] [V] [TRT] Tactic: 1002 Time: 0.005108
[01/29/2022-15:09:28] [V] [TRT] Tactic: 0 Time: 0.003176
[01/29/2022-15:09:28] [V] [TRT] Fastest Tactic: 0 Time: 0.003176
[01/29/2022-15:09:28] [V] [TRT] *************** Autotuning format combination: Float(784,784,28,1) -> Float(25088,784,28,1) ***************
[01/29/2022-15:09:28] [V] [TRT] --------------- Timing Runner: Conv__25 + Relu (CudaDepthwiseConvolution)
[01/29/2022-15:09:28] [V] [TRT] CudaDepthwiseConvolution has no valid tactics for this config, skipping
[01/29/2022-15:09:28] [V] [TRT] --------------- Timing Runner: Conv__25 + Relu (FusedConvActConvolution)
[01/29/2022-15:09:28] [V] [TRT] FusedConvActConvolution has no valid tactics for this config, skipping
[01/29/2022-15:09:28] [V] [TRT] --------------- Timing Runner: Conv__25 + Relu (CudnnConvolution)
[01/29/2022-15:09:28] [V] [TRT] Tactic: 0 Time: 0.022628
[01/29/2022-15:09:28] [V] [TRT] Tactic: 1 Time: 0.024568
[01/29/2022-15:09:28] [V] [TRT] Tactic: 2 Time: 0.029692
[01/29/2022-15:09:28] [V] [TRT] Tactic: 4 Time: 0.056184
[01/29/2022-15:09:28] [V] [TRT] Tactic: 5 Time: 0.059888
[01/29/2022-15:09:28] [V] [TRT] Fastest Tactic: 0 Time: 0.022628
[01/29/2022-15:09:28] [V] [TRT] --------------- Timing Runner: Conv__25 + Relu (CaskConvolution)
[01/29/2022-15:09:28] [V] [TRT] Conv__25 + Relu Set Tactic Name: maxwell_scudnn_128x32_relu_medium_nn_v1 Tactic: 1062367460111450758
[01/29/2022-15:09:28] [V] [TRT] Tactic: 1062367460111450758 Time: 0.01432
[01/29/2022-15:09:28] [V] [TRT] Conv__25 + Relu Set Tactic Name: maxwell_scudnn_128x32_relu_large_nn_v0 Tactic: 1754984623894446479
[01/29/2022-15:09:28] [V] [TRT] Tactic: 1754984623894446479 Time: 0.01126
[01/29/2022-15:09:28] [V] [TRT] Conv__25 + Relu Set Tactic Name: maxwell_scudnn_128x128_relu_large_nn_v0 Tactic: 3611739942397549984
[01/29/2022-15:09:28] [V] [TRT] Tactic: 3611739942397549984 Time: 0.018428
[01/29/2022-15:09:28] [V] [TRT] Conv__25 + Relu Set Tactic Name: maxwell_scudnn_128x64_relu_large_nn_v1 Tactic: 4337000649858996379
[01/29/2022-15:09:28] [V] [TRT] Tactic: 4337000649858996379 Time: 0.014332
[01/29/2022-15:09:28] [V] [TRT] Conv__25 + Relu Set Tactic Name: maxwell_scudnn_128x128_relu_medium_nn_v1 Tactic: 4501471010995462441
[01/29/2022-15:09:28] [V] [TRT] Tactic: 4501471010995462441 Time: 0.017404
[01/29/2022-15:09:28] [V] [TRT] Conv__25 + Relu Set Tactic Name: maxwell_scudnn_128x64_relu_small_nn_v1 Tactic: 5137655947464784826
[01/29/2022-15:09:28] [V] [TRT] Tactic: 5137655947464784826 Time: 0.01318
[01/29/2022-15:09:28] [V] [TRT] Conv__25 + Relu Set Tactic Name: maxwell_scudnn_128x128_relu_small_nn_v0 Tactic: 5288347012147084929
[01/29/2022-15:09:28] [V] [TRT] Tactic: 5288347012147084929 Time: 0.017628
[01/29/2022-15:09:28] [V] [TRT] Conv__25 + Relu Set Tactic Name: maxwell_scudnn_128x64_relu_medium_nn_v1 Tactic: 6645123197870846056
[01/29/2022-15:09:28] [V] [TRT] Tactic: 6645123197870846056 Time: 0.013308
[01/29/2022-15:09:28] [V] [TRT] Conv__25 + Relu Set Tactic Name: maxwell_scudnn_128x32_relu_small_nn_v0 Tactic: 7144526460361122478
[01/29/2022-15:09:28] [V] [TRT] Tactic: 7144526460361122478 Time: 0.010224
[01/29/2022-15:09:28] [V] [TRT] Conv__25 + Relu Set Tactic Name: maxwell_scudnn_128x128_relu_large_nn_v1 Tactic: -9137461792520977713
[01/29/2022-15:09:28] [V] [TRT] Tactic: -9137461792520977713 Time: 0.01838
[01/29/2022-15:09:28] [V] [TRT] Conv__25 + Relu Set Tactic Name: maxwell_scudnn_128x128_relu_medium_nn_v0 Tactic: -8262349710178828730
[01/29/2022-15:09:28] [V] [TRT] Tactic: -8262349710178828730 Time: 0.018432
[01/29/2022-15:09:28] [V] [TRT] Conv__25 + Relu Set Tactic Name: maxwell_scudnn_128x64_relu_large_nn_v0 Tactic: -8133971918129952780
[01/29/2022-15:09:28] [V] [TRT] Tactic: -8133971918129952780 Time: 0.01432
[01/29/2022-15:09:28] [V] [TRT] Conv__25 + Relu Set Tactic Name: maxwell_scudnn_128x32_relu_large_nn_v1 Tactic: -6092040395344634144
[01/29/2022-15:09:28] [V] [TRT] Tactic: -6092040395344634144 Time: 0.014336
[01/29/2022-15:09:28] [V] [TRT] Conv__25 + Relu Set Tactic Name: maxwell_scudnn_128x32_relu_medium_nn_v0 Tactic: -4787320710726427159
[01/29/2022-15:09:28] [V] [TRT] Tactic: -4787320710726427159 Time: 0.010748
[01/29/2022-15:09:28] [V] [TRT] Conv__25 + Relu Set Tactic Name: maxwell_scudnn_128x32_relu_small_nn_v1 Tactic: -3456450830548107839
[01/29/2022-15:09:28] [V] [TRT] Tactic: -3456450830548107839 Time: 0.012288
[01/29/2022-15:09:28] [V] [TRT] Conv__25 + Relu Set Tactic Name: maxwell_scudnn_128x64_relu_medium_nn_v0 Tactic: -1218658103698133241
[01/29/2022-15:09:28] [V] [TRT] Tactic: -1218658103698133241 Time: 0.013304
[01/29/2022-15:09:28] [V] [TRT] Conv__25 + Relu Set Tactic Name: maxwell_scudnn_128x64_relu_small_nn_v0 Tactic: -836875257600482091
[01/29/2022-15:09:28] [V] [TRT] Tactic: -836875257600482091 Time: 0.013288
[01/29/2022-15:09:28] [V] [TRT] Conv__25 + Relu Set Tactic Name: maxwell_scudnn_128x128_relu_small_nn_v1 Tactic: -410470605513481746
[01/29/2022-15:09:28] [V] [TRT] Tactic: -410470605513481746 Time: 0.01728
[01/29/2022-15:09:28] [V] [TRT] Fastest Tactic: 7144526460361122478 Time: 0.010224
[01/29/2022-15:09:28] [V] [TRT] >>>>>>>>>>>>>>> Chose Runner Type: CaskConvolution Tactic: 7144526460361122478
[01/29/2022-15:09:28] [V] [TRT] *************** Autotuning format combination: Float(784,1,28,1) -> Float(25088,1,896,32) ***************
[01/29/2022-15:09:28] [V] [TRT] --------------- Timing Runner: Conv__25 + Relu (CudnnConvolution)
[01/29/2022-15:09:28] [V] [TRT] CudnnConvolution has no valid tactics for this config, skipping
[01/29/2022-15:09:28] [V] [TRT] --------------- Timing Runner: Conv__25 + Relu (CaskConvolution)
[01/29/2022-15:09:28] [V] [TRT] CaskConvolution has no valid tactics for this config, skipping
[01/29/2022-15:09:28] [V] [TRT] *************** Autotuning Reformat:Float(25088,1,896,32) -> Float(25088,784,28,1) ***************
[01/29/2022-15:09:28] [V] [TRT] --------------- Timing Runner: Optimizer Reformat (Reformat)
[01/29/2022-15:09:28] [V] [TRT] Tactic: 1002 Time: 0.01382
[01/29/2022-15:09:28] [V] [TRT] Tactic: 0 Time: 0.0092
[01/29/2022-15:09:28] [V] [TRT] Fastest Tactic: 0 Time: 0.0092
[01/29/2022-15:09:28] [V] [TRT] *************** Autotuning format combination: Float(25088,784,28,1) -> Float(6272,196,14,1) ***************
[01/29/2022-15:09:28] [V] [TRT] --------------- Timing Runner: MaxPool2d (TiledPooling)
[01/29/2022-15:09:28] [V] [TRT] Tactic: 5505281 Time: 0.010576
[01/29/2022-15:09:29] [V] [TRT] Tactic: 5570817 Time: 0.007356
[01/29/2022-15:09:29] [V] [TRT] Tactic: 5636353 Time: 0.00654
[01/29/2022-15:09:29] [V] [TRT] Tactic: 5701889 Time: 0.006092
[01/29/2022-15:09:29] [V] [TRT] Tactic: 5767425 Time: 0.006076
[01/29/2022-15:09:29] [V] [TRT] Tactic: 5832961 Time: 0.006304
[01/29/2022-15:09:29] [V] [TRT] Tactic: 5898497 Time: 0.006448
[01/29/2022-15:09:29] [V] [TRT] Tactic: 5964033 Time: 0.00552
[01/29/2022-15:09:29] [V] [TRT] Tactic: 6029569 Time: 0.007016
[01/29/2022-15:09:29] [V] [TRT] Tactic: 6095105 Time: 0.005336
[01/29/2022-15:09:29] [V] [TRT] Tactic: 6160641 Time: 0.005012
[01/29/2022-15:09:29] [V] [TRT] Tactic: 6226177 Time: 0.00446
[01/29/2022-15:09:29] [V] [TRT] Tactic: 6291713 Time: 0.004988
[01/29/2022-15:09:29] [V] [TRT] Tactic: 6357249 Time: 0.005064
[01/29/2022-15:09:29] [V] [TRT] Tactic: 6422785 Time: 0.004296
[01/29/2022-15:09:29] [V] [TRT] Tactic: 6488321 Time: 0.004224
[01/29/2022-15:09:29] [V] [TRT] Fastest Tactic: 6488321 Time: 0.004224
[01/29/2022-15:09:29] [V] [TRT] --------------- Timing Runner: MaxPool2d (CudnnPooling)
[01/29/2022-15:09:29] [V] [TRT] Tactic: -1 Time: 0.005116
[01/29/2022-15:09:29] [V] [TRT] Fastest Tactic: -1 Time: 0.005116
[01/29/2022-15:09:29] [V] [TRT] >>>>>>>>>>>>>>> Chose Runner Type: TiledPooling Tactic: 6488321
[01/29/2022-15:09:29] [V] [TRT] *************** Autotuning Reformat:Float(6272,196,14,1) -> Float(6272,1,448,32) ***************
[01/29/2022-15:09:29] [V] [TRT] --------------- Timing Runner: Optimizer Reformat (Reformat)
[01/29/2022-15:09:29] [V] [TRT] Tactic: 1002 Time: 0.009184
[01/29/2022-15:09:29] [V] [TRT] Tactic: 0 Time: 0.005216
[01/29/2022-15:09:29] [V] [TRT] Fastest Tactic: 0 Time: 0.005216
[01/29/2022-15:09:29] [V] [TRT] *************** Autotuning Reformat:Float(6272,196,14,1) -> Float(6272,1,448,32) ***************
[01/29/2022-15:09:29] [V] [TRT] --------------- Timing Runner: Optimizer Reformat (Reformat)
[01/29/2022-15:09:29] [V] [TRT] Tactic: 1002 Time: 0.009212
[01/29/2022-15:09:29] [V] [TRT] Tactic: 0 Time: 0.00512
[01/29/2022-15:09:29] [V] [TRT] Fastest Tactic: 0 Time: 0.00512
[01/29/2022-15:09:29] [V] [TRT] *************** Autotuning Reformat:Float(6272,1,448,32) -> Float(6272,196,14,1) ***************
[01/29/2022-15:09:29] [V] [TRT] --------------- Timing Runner: Optimizer Reformat (Reformat)
[01/29/2022-15:09:29] [V] [TRT] Tactic: 1002 Time: 0.009196
[01/29/2022-15:09:29] [V] [TRT] Tactic: 0 Time: 0.00522
[01/29/2022-15:09:29] [V] [TRT] Fastest Tactic: 0 Time: 0.00522
[01/29/2022-15:09:29] [V] [TRT] *************** Autotuning format combination: Float(6272,196,14,1) -> Float(12544,196,14,1) ***************
[01/29/2022-15:09:29] [V] [TRT] --------------- Timing Runner: Conv__27 + Relu_1 (CudaDepthwiseConvolution)
[01/29/2022-15:09:29] [V] [TRT] CudaDepthwiseConvolution has no valid tactics for this config, skipping
[01/29/2022-15:09:29] [V] [TRT] --------------- Timing Runner: Conv__27 + Relu_1 (FusedConvActConvolution)
[01/29/2022-15:09:29] [V] [TRT] FusedConvActConvolution has no valid tactics for this config, skipping
[01/29/2022-15:09:29] [V] [TRT] --------------- Timing Runner: Conv__27 + Relu_1 (CudnnConvolution)
[01/29/2022-15:09:29] [V] [TRT] Tactic: 0 Time: 0.082656
[01/29/2022-15:09:29] [V] [TRT] Tactic: 1 Time: 0.082536
[01/29/2022-15:09:29] [V] [TRT] Tactic: 2 Time: 0.162508
[01/29/2022-15:09:29] [V] [TRT] Tactic: 4 Time: 0.18426
[01/29/2022-15:09:29] [V] [TRT] Tactic: 5 Time: 0.202784
[01/29/2022-15:09:29] [V] [TRT] Fastest Tactic: 1 Time: 0.082536
[01/29/2022-15:09:29] [V] [TRT] --------------- Timing Runner: Conv__27 + Relu_1 (CaskConvolution)
[01/29/2022-15:09:29] [V] [TRT] Conv__27 + Relu_1 Set Tactic Name: maxwell_scudnn_128x32_relu_medium_nn_v1 Tactic: 1062367460111450758
[01/29/2022-15:09:29] [V] [TRT] Tactic: 1062367460111450758 Time: 0.13838
[01/29/2022-15:09:29] [V] [TRT] Conv__27 + Relu_1 Set Tactic Name: maxwell_scudnn_128x32_relu_large_nn_v0 Tactic: 1754984623894446479
[01/29/2022-15:09:29] [V] [TRT] Tactic: 1754984623894446479 Time: 0.101712
[01/29/2022-15:09:29] [V] [TRT] Conv__27 + Relu_1 Set Tactic Name: maxwell_scudnn_128x128_relu_large_nn_v0 Tactic: 3611739942397549984
[01/29/2022-15:09:29] [V] [TRT] Tactic: 3611739942397549984 Time: 0.11154
[01/29/2022-15:09:29] [V] [TRT] Conv__27 + Relu_1 Set Tactic Name: maxwell_scudnn_128x64_relu_large_nn_v1 Tactic: 4337000649858996379
[01/29/2022-15:09:29] [V] [TRT] Tactic: 4337000649858996379 Time: 0.102516
[01/29/2022-15:09:29] [V] [TRT] Conv__27 + Relu_1 Set Tactic Name: maxwell_scudnn_128x128_relu_medium_nn_v1 Tactic: 4501471010995462441
[01/29/2022-15:09:29] [V] [TRT] Tactic: 4501471010995462441 Time: 0.111588
[01/29/2022-15:09:29] [V] [TRT] Conv__27 + Relu_1 Set Tactic Name: maxwell_scudnn_128x64_relu_small_nn_v1 Tactic: 5137655947464784826
[01/29/2022-15:09:29] [V] [TRT] Tactic: 5137655947464784826 Time: 0.0675
[01/29/2022-15:09:29] [V] [TRT] Conv__27 + Relu_1 Set Tactic Name: maxwell_scudnn_128x128_relu_small_nn_v0 Tactic: 5288347012147084929
[01/29/2022-15:09:29] [V] [TRT] Tactic: 5288347012147084929 Time: 0.096088
[01/29/2022-15:09:29] [V] [TRT] Conv__27 + Relu_1 Set Tactic Name: maxwell_scudnn_128x64_relu_medium_nn_v1 Tactic: 6645123197870846056
[01/29/2022-15:09:29] [V] [TRT] Tactic: 6645123197870846056 Time: 0.092116
[01/29/2022-15:09:29] [V] [TRT] Conv__27 + Relu_1 Set Tactic Name: maxwell_scudnn_128x32_relu_small_nn_v0 Tactic: 7144526460361122478
[01/29/2022-15:09:29] [V] [TRT] Tactic: 7144526460361122478 Time: 0.077292
[01/29/2022-15:09:29] [V] [TRT] Conv__27 + Relu_1 Set Tactic Name: maxwell_scudnn_128x128_relu_large_nn_v1 Tactic: -9137461792520977713
[01/29/2022-15:09:29] [V] [TRT] Tactic: -9137461792520977713 Time: 0.114816
[01/29/2022-15:09:29] [V] [TRT] Conv__27 + Relu_1 Set Tactic Name: maxwell_scudnn_128x128_relu_medium_nn_v0 Tactic: -8262349710178828730
[01/29/2022-15:09:29] [V] [TRT] Tactic: -8262349710178828730 Time: 0.110972
[01/29/2022-15:09:29] [V] [TRT] Conv__27 + Relu_1 Set Tactic Name: maxwell_scudnn_128x64_relu_large_nn_v0 Tactic: -8133971918129952780
[01/29/2022-15:09:29] [V] [TRT] Tactic: -8133971918129952780 Time: 0.119416
[01/29/2022-15:09:29] [V] [TRT] Conv__27 + Relu_1 Set Tactic Name: maxwell_scudnn_128x32_relu_large_nn_v1 Tactic: -6092040395344634144
[01/29/2022-15:09:29] [V] [TRT] Tactic: -6092040395344634144 Time: 0.14092
[01/29/2022-15:09:29] [V] [TRT] Conv__27 + Relu_1 Set Tactic Name: maxwell_scudnn_128x32_relu_medium_nn_v0 Tactic: -4787320710726427159
[01/29/2022-15:09:29] [V] [TRT] Tactic: -4787320710726427159 Time: 0.099588
[01/29/2022-15:09:29] [V] [TRT] Conv__27 + Relu_1 Set Tactic Name: maxwell_scudnn_128x32_relu_small_nn_v1 Tactic: -3456450830548107839
[01/29/2022-15:09:29] [V] [TRT] Tactic: -3456450830548107839 Time: 0.07882
[01/29/2022-15:09:29] [V] [TRT] Conv__27 + Relu_1 Set Tactic Name: maxwell_scudnn_128x64_relu_medium_nn_v0 Tactic: -1218658103698133241
[01/29/2022-15:09:29] [V] [TRT] Tactic: -1218658103698133241 Time: 0.117996
[01/29/2022-15:09:29] [V] [TRT] Conv__27 + Relu_1 Set Tactic Name: maxwell_scudnn_128x64_relu_small_nn_v0 Tactic: -836875257600482091
[01/29/2022-15:09:29] [V] [TRT] Tactic: -836875257600482091 Time: 0.09698
[01/29/2022-15:09:29] [V] [TRT] Conv__27 + Relu_1 Set Tactic Name: maxwell_scudnn_128x128_relu_small_nn_v1 Tactic: -410470605513481746
[01/29/2022-15:09:29] [V] [TRT] Tactic: -410470605513481746 Time: 0.09394
[01/29/2022-15:09:29] [V] [TRT] Fastest Tactic: 5137655947464784826 Time: 0.0675
[01/29/2022-15:09:29] [V] [TRT] >>>>>>>>>>>>>>> Chose Runner Type: CaskConvolution Tactic: 5137655947464784826
[01/29/2022-15:09:29] [V] [TRT] *************** Autotuning format combination: Float(6272,1,448,32) -> Float(12544,1,896,64) ***************
[01/29/2022-15:09:29] [V] [TRT] --------------- Timing Runner: Conv__27 + Relu_1 (CudnnConvolution)
[01/29/2022-15:09:29] [V] [TRT] CudnnConvolution has no valid tactics for this config, skipping
[01/29/2022-15:09:29] [V] [TRT] --------------- Timing Runner: Conv__27 + Relu_1 (CaskConvolution)
[01/29/2022-15:09:29] [V] [TRT] Conv__27 + Relu_1 Set Tactic Name: maxwell_scudnn_128x32_sliced1x4_ldg4_relu_exp_small_nhwc_tn_v1 Tactic: -9153228964338181824
[01/29/2022-15:09:29] [V] [TRT] Tactic: -9153228964338181824 Time: 0.029828
[01/29/2022-15:09:29] [V] [TRT] Conv__27 + Relu_1 Set Tactic Name: maxwell_scudnn_128x64_sliced1x2_ldg4_relu_exp_small_nhwc_tn_v1 Tactic: -7394439838318485025
[01/29/2022-15:09:29] [V] [TRT] Tactic: -7394439838318485025 Time: 0.05268
[01/29/2022-15:09:29] [V] [TRT] Fastest Tactic: -9153228964338181824 Time: 0.029828
[01/29/2022-15:09:29] [V] [TRT] >>>>>>>>>>>>>>> Chose Runner Type: CaskConvolution Tactic: -9153228964338181824
[01/29/2022-15:09:29] [V] [TRT] *************** Autotuning Reformat:Float(12544,1,896,64) -> Float(12544,196,14,1) ***************
[01/29/2022-15:09:29] [V] [TRT] --------------- Timing Runner: Optimizer Reformat (Reformat)
[01/29/2022-15:09:29] [V] [TRT] Tactic: 1002 Time: 0.009204
[01/29/2022-15:09:29] [V] [TRT] Tactic: 0 Time: 0.006144
[01/29/2022-15:09:29] [V] [TRT] Fastest Tactic: 0 Time: 0.006144
[01/29/2022-15:09:29] [V] [TRT] *************** Autotuning format combination: Float(12544,196,14,1) -> Float(3136,49,7,1) ***************
[01/29/2022-15:09:29] [V] [TRT] --------------- Timing Runner: MaxPool2d_1 (TiledPooling)
[01/29/2022-15:09:30] [V] [TRT] Tactic: 5505281 Time: 0.011508
[01/29/2022-15:09:30] [V] [TRT] Tactic: 5570817 Time: 0.008044
[01/29/2022-15:09:30] [V] [TRT] Tactic: 5636353 Time: 0.007116
[01/29/2022-15:09:30] [V] [TRT] Tactic: 5701889 Time: 0.006252
[01/29/2022-15:09:30] [V] [TRT] Tactic: 5767425 Time: 0.006144
[01/29/2022-15:09:30] [V] [TRT] Tactic: 5832961 Time: 0.006144
[01/29/2022-15:09:30] [V] [TRT] Tactic: 5898497 Time: 0.006384
[01/29/2022-15:09:30] [V] [TRT] Tactic: 5964033 Time: 0.00512
[01/29/2022-15:09:30] [V] [TRT] Tactic: 6029569 Time: 0.007292
[01/29/2022-15:09:30] [V] [TRT] Tactic: 6095105 Time: 0.0056
[01/29/2022-15:09:30] [V] [TRT] Tactic: 6160641 Time: 0.005124
[01/29/2022-15:09:30] [V] [TRT] Tactic: 6226177 Time: 0.00508
[01/29/2022-15:09:30] [V] [TRT] Tactic: 6291713 Time: 0.00504
[01/29/2022-15:09:30] [V] [TRT] Tactic: 6357249 Time: 0.0041
[01/29/2022-15:09:30] [V] [TRT] Tactic: 6422785 Time: 0.0051
[01/29/2022-15:09:30] [V] [TRT] Tactic: 6488321 Time: 0.004356
[01/29/2022-15:09:30] [V] [TRT] Fastest Tactic: 6357249 Time: 0.0041
[01/29/2022-15:09:30] [V] [TRT] --------------- Timing Runner: MaxPool2d_1 (CudnnPooling)
[01/29/2022-15:09:30] [V] [TRT] Tactic: -1 Time: 0.0051
[01/29/2022-15:09:30] [V] [TRT] Fastest Tactic: -1 Time: 0.0051
[01/29/2022-15:09:30] [V] [TRT] >>>>>>>>>>>>>>> Chose Runner Type: TiledPooling Tactic: 6357249
[01/29/2022-15:09:30] [V] [TRT] *************** Autotuning Reformat:Float(3136,49,7,1) -> Float(3136,1,448,64) ***************
[01/29/2022-15:09:30] [V] [TRT] --------------- Timing Runner: Optimizer Reformat (Reformat)
[01/29/2022-15:09:30] [V] [TRT] Tactic: 1002 Time: 0.009072
[01/29/2022-15:09:30] [V] [TRT] Tactic: 0 Time: 0.004576
[01/29/2022-15:09:30] [V] [TRT] Fastest Tactic: 0 Time: 0.004576
[01/29/2022-15:09:30] [V] [TRT] *************** Autotuning Reformat:Float(3136,49,7,1) -> Float(98,49:32,7,1) ***************
[01/29/2022-15:09:30] [V] [TRT] --------------- Timing Runner: Optimizer Reformat (Reformat)
[01/29/2022-15:09:30] [V] [TRT] Tactic: 1002 Time: 0.009164
[01/29/2022-15:09:30] [V] [TRT] Tactic: 0 Time: 0.005116
[01/29/2022-15:09:30] [V] [TRT] Fastest Tactic: 0 Time: 0.005116
[01/29/2022-15:09:30] [V] [TRT] *************** Autotuning Reformat:Float(3136,49,7,1) -> Float(3136,1,448,64) ***************
[01/29/2022-15:09:30] [V] [TRT] --------------- Timing Runner: Optimizer Reformat (Reformat)
[01/29/2022-15:09:30] [V] [TRT] Tactic: 1002 Time: 0.008548
[01/29/2022-15:09:30] [V] [TRT] Tactic: 0 Time: 0.004224
[01/29/2022-15:09:30] [V] [TRT] Fastest Tactic: 0 Time: 0.004224
[01/29/2022-15:09:30] [V] [TRT] *************** Autotuning Reformat:Float(3136,49,7,1) -> Float(98,49:32,7,1) ***************
[01/29/2022-15:09:30] [V] [TRT] --------------- Timing Runner: Optimizer Reformat (Reformat)
[01/29/2022-15:09:30] [V] [TRT] Tactic: 1002 Time: 0.009004
[01/29/2022-15:09:30] [V] [TRT] Tactic: 0 Time: 0.005112
[01/29/2022-15:09:30] [V] [TRT] Fastest Tactic: 0 Time: 0.005112
[01/29/2022-15:09:30] [V] [TRT] *************** Autotuning Reformat:Float(3136,1,448,64) -> Float(3136,49,7,1) ***************
[01/29/2022-15:09:30] [V] [TRT] --------------- Timing Runner: Optimizer Reformat (Reformat)
[01/29/2022-15:09:30] [V] [TRT] Tactic: 1002 Time: 0.009172
[01/29/2022-15:09:30] [V] [TRT] Tactic: 0 Time: 0.004228
[01/29/2022-15:09:30] [V] [TRT] Fastest Tactic: 0 Time: 0.004228
[01/29/2022-15:09:30] [V] [TRT] *************** Autotuning Reformat:Float(3136,1,448,64) -> Float(98,49:32,7,1) ***************
[01/29/2022-15:09:30] [V] [TRT] --------------- Timing Runner: Optimizer Reformat (Reformat)
[01/29/2022-15:09:30] [V] [TRT] Tactic: 1002 Time: 0.009216
[01/29/2022-15:09:30] [V] [TRT] Tactic: 0 Time: 0.00518
[01/29/2022-15:09:30] [V] [TRT] Fastest Tactic: 0 Time: 0.00518
[01/29/2022-15:09:30] [V] [TRT] *************** Autotuning Reformat:Float(98,49:32,7,1) -> Float(3136,49,7,1) ***************
[01/29/2022-15:09:30] [V] [TRT] --------------- Timing Runner: Optimizer Reformat (Reformat)
[01/29/2022-15:09:30] [V] [TRT] Tactic: 1002 Time: 0.009156
[01/29/2022-15:09:30] [V] [TRT] Tactic: 0 Time: 0.004312
[01/29/2022-15:09:30] [V] [TRT] Fastest Tactic: 0 Time: 0.004312
[01/29/2022-15:09:30] [V] [TRT] *************** Autotuning Reformat:Float(98,49:32,7,1) -> Float(3136,1,448,64) ***************
[01/29/2022-15:09:30] [V] [TRT] --------------- Timing Runner: Optimizer Reformat (Reformat)
[01/29/2022-15:09:30] [V] [TRT] Tactic: 1002 Time: 0.009192
[01/29/2022-15:09:30] [V] [TRT] Tactic: 0 Time: 0.004192
[01/29/2022-15:09:30] [V] [TRT] Fastest Tactic: 0 Time: 0.004192
[01/29/2022-15:09:30] [V] [TRT] *************** Autotuning format combination: Float(3136,49,7,1) -> Float(3136,1,1,1) ***************
[01/29/2022-15:09:30] [V] [TRT] --------------- Timing Runner: MaxPool2d_1__22 + Reshape + (Unnamed Layer* 14) [Shuffle] (Shuffle)
[01/29/2022-15:09:30] [V] [TRT] Tactic: 0 Time: 0.004096
[01/29/2022-15:09:30] [V] [TRT] Fastest Tactic: 0 Time: 0.004096
[01/29/2022-15:09:30] [V] [TRT] >>>>>>>>>>>>>>> Chose Runner Type: Shuffle Tactic: 0
[01/29/2022-15:09:30] [V] [TRT] *************** Autotuning format combination: Float(3136,1,448,64) -> Float(3136,1,3136,3136) ***************
[01/29/2022-15:09:30] [V] [TRT] --------------- Timing Runner: MaxPool2d_1__22 + Reshape + (Unnamed Layer* 14) [Shuffle] (Shuffle)
[01/29/2022-15:09:30] [V] [TRT] Tactic: 0 Time: 0.004096
[01/29/2022-15:09:30] [V] [TRT] Fastest Tactic: 0 Time: 0.004096
[01/29/2022-15:09:30] [V] [TRT] >>>>>>>>>>>>>>> Chose Runner Type: Shuffle Tactic: 0
[01/29/2022-15:09:30] [V] [TRT] *************** Autotuning format combination: Float(98,49:32,7,1) -> Float(98,1:32,1,1) ***************
[01/29/2022-15:09:30] [V] [TRT] --------------- Timing Runner: MaxPool2d_1__22 + Reshape + (Unnamed Layer* 14) [Shuffle] (Shuffle)
[01/29/2022-15:09:30] [V] [TRT] Tactic: 0 Time: 0.00422
[01/29/2022-15:09:30] [V] [TRT] Fastest Tactic: 0 Time: 0.00422
[01/29/2022-15:09:30] [V] [TRT] >>>>>>>>>>>>>>> Chose Runner Type: Shuffle Tactic: 0
[01/29/2022-15:09:30] [V] [TRT] *************** Autotuning Reformat:Float(3136,1,1,1) -> Float(3136,1,3136,3136) ***************
[01/29/2022-15:09:30] [V] [TRT] --------------- Timing Runner: Optimizer Reformat (Reformat)
[01/29/2022-15:09:30] [V] [TRT] Tactic: 1002 Time: 0.005112
[01/29/2022-15:09:30] [V] [TRT] Tactic: 0 Time: 0.004072
[01/29/2022-15:09:30] [V] [TRT] Fastest Tactic: 0 Time: 0.004072
[01/29/2022-15:09:30] [V] [TRT] *************** Autotuning Reformat:Float(3136,1,3136,3136) -> Float(3136,1,1,1) ***************
[01/29/2022-15:09:30] [V] [TRT] --------------- Timing Runner: Optimizer Reformat (Reformat)
[01/29/2022-15:09:30] [V] [TRT] Tactic: 1002 Time: 0.005068
[01/29/2022-15:09:30] [V] [TRT] Tactic: 0 Time: 0.004096
[01/29/2022-15:09:30] [V] [TRT] Fastest Tactic: 0 Time: 0.004096
[01/29/2022-15:09:30] [V] [TRT] *************** Autotuning Reformat:Float(98,1:32,1,1) -> Float(3136,1,1,1) ***************
[01/29/2022-15:09:30] [V] [TRT] --------------- Timing Runner: Optimizer Reformat (Reformat)
[01/29/2022-15:09:30] [V] [TRT] Tactic: 1002 Time: 0.033888
[01/29/2022-15:09:31] [V] [TRT] Tactic: 0 Time: 0.004192
[01/29/2022-15:09:31] [V] [TRT] Fastest Tactic: 0 Time: 0.004192
[01/29/2022-15:09:31] [V] [TRT] *************** Autotuning Reformat:Float(98,1:32,1,1) -> Float(3136,1,3136,3136) ***************
[01/29/2022-15:09:31] [V] [TRT] --------------- Timing Runner: Optimizer Reformat (Reformat)
[01/29/2022-15:09:31] [V] [TRT] Tactic: 1002 Time: 0.011104
[01/29/2022-15:09:31] [V] [TRT] Tactic: 0 Time: 0.004208
[01/29/2022-15:09:31] [V] [TRT] Fastest Tactic: 0 Time: 0.004208
[01/29/2022-15:09:31] [V] [TRT] *************** Autotuning format combination: Float(3136,1,1,1) -> Float(1024,1,1,1) ***************
[01/29/2022-15:09:31] [V] [TRT] --------------- Timing Runner: MatMul + b3/read:0 + (Unnamed Layer* 21) [Shuffle] + unsqueeze_node_after_b3/read:0 + (Unnamed Layer* 21) [Shuffle] + add_2 + Relu_2 (CudaDepthwiseConvolution)
[01/29/2022-15:09:31] [V] [TRT] CudaDepthwiseConvolution has no valid tactics for this config, skipping
[01/29/2022-15:09:31] [V] [TRT] --------------- Timing Runner: MatMul + b3/read:0 + (Unnamed Layer* 21) [Shuffle] + unsqueeze_node_after_b3/read:0 + (Unnamed Layer* 21) [Shuffle] + add_2 + Relu_2 (FusedConvActConvolution)
[01/29/2022-15:09:31] [V] [TRT] FusedConvActConvolution has no valid tactics for this config, skipping
[01/29/2022-15:09:31] [V] [TRT] --------------- Timing Runner: MatMul + b3/read:0 + (Unnamed Layer* 21) [Shuffle] + unsqueeze_node_after_b3/read:0 + (Unnamed Layer* 21) [Shuffle] + add_2 + Relu_2 (CudnnConvolution)
[01/29/2022-15:09:31] [V] [TRT] Tactic: 0 Time: 0.322524
[01/29/2022-15:09:31] [V] [TRT] Tactic: 1 Time: 0.204032
[01/29/2022-15:09:31] [V] [TRT] Tactic: 2 Time: 0.42812
[01/29/2022-15:09:31] [V] [TRT] Tactic: 4 skipped. Scratch requested: 7527202816, available: 1073741824
[01/29/2022-15:09:31] [V] [TRT] Tactic: 5 Time: 6.77866
[01/29/2022-15:09:31] [I] [TRT] Some tactics do not have sufficient workspace memory to run. Increasing workspace size may increase performance, please check verbose output.
[01/29/2022-15:09:31] [V] [TRT] Fastest Tactic: 1 Time: 0.204032
[01/29/2022-15:09:31] [V] [TRT] --------------- Timing Runner: MatMul + b3/read:0 + (Unnamed Layer* 21) [Shuffle] + unsqueeze_node_after_b3/read:0 + (Unnamed Layer* 21) [Shuffle] + add_2 + Relu_2 (CublasConvolution)
[01/29/2022-15:09:31] [V] [TRT] Tactic: 0 Time: 0.069504
[01/29/2022-15:09:31] [V] [TRT] Tactic: 1 Time: 0.072808
[01/29/2022-15:09:31] [V] [TRT] Fastest Tactic: 0 Time: 0.069504
[01/29/2022-15:09:31] [V] [TRT] --------------- Timing Runner: MatMul + b3/read:0 + (Unnamed Layer* 21) [Shuffle] + unsqueeze_node_after_b3/read:0 + (Unnamed Layer* 21) [Shuffle] + add_2 + Relu_2 (CaskConvolution)
[01/29/2022-15:09:31] [V] [TRT] MatMul + b3/read:0 + (Unnamed Layer* 21) [Shuffle] + unsqueeze_node_after_b3/read:0 + (Unnamed Layer* 21) [Shuffle] + add_2 + Relu_2 Set Tactic Name: maxwell_scudnn_128x32_relu_medium_nn_v1 Tactic: 1062367460111450758
[01/29/2022-15:09:31] [V] [TRT] Tactic: 1062367460111450758 Time: 0.390516
[01/29/2022-15:09:31] [V] [TRT] MatMul + b3/read:0 + (Unnamed Layer* 21) [Shuffle] + unsqueeze_node_after_b3/read:0 + (Unnamed Layer* 21) [Shuffle] + add_2 + Relu_2 Set Tactic Name: maxwell_scudnn_128x32_relu_interior_nn_v0 Tactic: 1698681053543049347
[01/29/2022-15:09:31] [V] [TRT] Tactic: 1698681053543049347 Time: 0.383232
[01/29/2022-15:09:31] [V] [TRT] MatMul + b3/read:0 + (Unnamed Layer* 21) [Shuffle] + unsqueeze_node_after_b3/read:0 + (Unnamed Layer* 21) [Shuffle] + add_2 + Relu_2 Set Tactic Name: maxwell_scudnn_128x128_relu_medium_nn_v1 Tactic: 4501471010995462441
[01/29/2022-15:09:31] [V] [TRT] Tactic: 4501471010995462441 Time: 0.438392
[01/29/2022-15:09:31] [V] [TRT] MatMul + b3/read:0 + (Unnamed Layer* 21) [Shuffle] + unsqueeze_node_after_b3/read:0 + (Unnamed Layer* 21) [Shuffle] + add_2 + Relu_2 Set Tactic Name: maxwell_scudnn_128x64_relu_small_nn_v1 Tactic: 5137655947464784826
[01/29/2022-15:09:31] [V] [TRT] Tactic: 5137655947464784826 Time: 0.323428
[01/29/2022-15:09:31] [V] [TRT] MatMul + b3/read:0 + (Unnamed Layer* 21) [Shuffle] + unsqueeze_node_after_b3/read:0 + (Unnamed Layer* 21) [Shuffle] + add_2 + Relu_2 Set Tactic Name: maxwell_scudnn_128x128_relu_small_nn_v0 Tactic: 5288347012147084929
[01/29/2022-15:09:31] [V] [TRT] Tactic: 5288347012147084929 Time: 0.396372
[01/29/2022-15:09:31] [V] [TRT] MatMul + b3/read:0 + (Unnamed Layer* 21) [Shuffle] + unsqueeze_node_after_b3/read:0 + (Unnamed Layer* 21) [Shuffle] + add_2 + Relu_2 Set Tactic Name: maxwell_scudnn_128x128_relu_interior_nn_v1 Tactic: 5326823351883942011
[01/29/2022-15:09:31] [V] [TRT] Tactic: 5326823351883942011 Time: 0.429248
[01/29/2022-15:09:31] [V] [TRT] MatMul + b3/read:0 + (Unnamed Layer* 21) [Shuffle] + unsqueeze_node_after_b3/read:0 + (Unnamed Layer* 21) [Shuffle] + add_2 + Relu_2 Set Tactic Name: maxwell_scudnn_128x64_relu_interior_nn_v0 Tactic: 5500448035057547314
[01/29/2022-15:09:31] [V] [TRT] Tactic: 5500448035057547314 Time: 0.376576
[01/29/2022-15:09:31] [V] [TRT] MatMul + b3/read:0 + (Unnamed Layer* 21) [Shuffle] + unsqueeze_node_after_b3/read:0 + (Unnamed Layer* 21) [Shuffle] + add_2 + Relu_2 Set Tactic Name: maxwell_scudnn_128x64_relu_medium_nn_v1 Tactic: 6645123197870846056
[01/29/2022-15:09:31] [V] [TRT] Tactic: 6645123197870846056 Time: 0.335324
[01/29/2022-15:09:31] [V] [TRT] MatMul + b3/read:0 + (Unnamed Layer* 21) [Shuffle] + unsqueeze_node_after_b3/read:0 + (Unnamed Layer* 21) [Shuffle] + add_2 + Relu_2 Set Tactic Name: maxwell_scudnn_128x32_relu_small_nn_v0 Tactic: 7144526460361122478
[01/29/2022-15:09:31] [V] [TRT] Tactic: 7144526460361122478 Time: 0.383076
[01/29/2022-15:09:31] [V] [TRT] MatMul + b3/read:0 + (Unnamed Layer* 21) [Shuffle] + unsqueeze_node_after_b3/read:0 + (Unnamed Layer* 21) [Shuffle] + add_2 + Relu_2 Set Tactic Name: maxwell_scudnn_128x128_relu_medium_nn_v0 Tactic: -8262349710178828730
[01/29/2022-15:09:31] [V] [TRT] Tactic: -8262349710178828730 Time: 0.387328
[01/29/2022-15:09:31] [V] [TRT] MatMul + b3/read:0 + (Unnamed Layer* 21) [Shuffle] + unsqueeze_node_after_b3/read:0 + (Unnamed Layer* 21) [Shuffle] + add_2 + Relu_2 Set Tactic Name: maxwell_scudnn_128x32_relu_interior_nn_v1 Tactic: -6576203419454146580
[01/29/2022-15:09:31] [V] [TRT] Tactic: -6576203419454146580 Time: 0.339776
[01/29/2022-15:09:31] [V] [TRT] MatMul + b3/read:0 + (Unnamed Layer* 21) [Shuffle] + unsqueeze_node_after_b3/read:0 + (Unnamed Layer* 21) [Shuffle] + add_2 + Relu_2 Set Tactic Name: maxwell_scudnn_128x32_relu_medium_nn_v0 Tactic: -4787320710726427159
[01/29/2022-15:09:31] [V] [TRT] Tactic: -4787320710726427159 Time: 0.367104
[01/29/2022-15:09:31] [V] [TRT] MatMul + b3/read:0 + (Unnamed Layer* 21) [Shuffle] + unsqueeze_node_after_b3/read:0 + (Unnamed Layer* 21) [Shuffle] + add_2 + Relu_2 Set Tactic Name: maxwell_scudnn_128x32_relu_small_nn_v1 Tactic: -3456450830548107839
[01/29/2022-15:09:31] [V] [TRT] Tactic: -3456450830548107839 Time: 0.352064
[01/29/2022-15:09:31] [V] [TRT] MatMul + b3/read:0 + (Unnamed Layer* 21) [Shuffle] + unsqueeze_node_after_b3/read:0 + (Unnamed Layer* 21) [Shuffle] + add_2 + Relu_2 Set Tactic Name: maxwell_scudnn_128x64_relu_medium_nn_v0 Tactic: -1218658103698133241
[01/29/2022-15:09:31] [V] [TRT] Tactic: -1218658103698133241 Time: 0.390272
[01/29/2022-15:09:31] [V] [TRT] MatMul + b3/read:0 + (Unnamed Layer* 21) [Shuffle] + unsqueeze_node_after_b3/read:0 + (Unnamed Layer* 21) [Shuffle] + add_2 + Relu_2 Set Tactic Name: maxwell_scudnn_128x64_relu_small_nn_v0 Tactic: -836875257600482091
[01/29/2022-15:09:31] [V] [TRT] Tactic: -836875257600482091 Time: 0.379956
[01/29/2022-15:09:31] [V] [TRT] MatMul + b3/read:0 + (Unnamed Layer* 21) [Shuffle] + unsqueeze_node_after_b3/read:0 + (Unnamed Layer* 21) [Shuffle] + add_2 + Relu_2 Set Tactic Name: maxwell_scudnn_128x128_relu_small_nn_v1 Tactic: -410470605513481746
[01/29/2022-15:09:31] [V] [TRT] Tactic: -410470605513481746 Time: 0.431616
[01/29/2022-15:09:31] [V] [TRT] MatMul + b3/read:0 + (Unnamed Layer* 21) [Shuffle] + unsqueeze_node_after_b3/read:0 + (Unnamed Layer* 21) [Shuffle] + add_2 + Relu_2 Set Tactic Name: maxwell_scudnn_128x128_relu_interior_nn_v0 Tactic: -377491875521947884
[01/29/2022-15:09:31] [V] [TRT] Tactic: -377491875521947884 Time: 0.3925
[01/29/2022-15:09:31] [V] [TRT] MatMul + b3/read:0 + (Unnamed Layer* 21) [Shuffle] + unsqueeze_node_after_b3/read:0 + (Unnamed Layer* 21) [Shuffle] + add_2 + Relu_2 Set Tactic Name: maxwell_scudnn_128x64_relu_interior_nn_v1 Tactic: -37215280111360163
[01/29/2022-15:09:31] [V] [TRT] Tactic: -37215280111360163 Time: 0.321268
[01/29/2022-15:09:31] [V] [TRT] Fastest Tactic: -37215280111360163 Time: 0.321268
[01/29/2022-15:09:31] [V] [TRT] >>>>>>>>>>>>>>> Chose Runner Type: CublasConvolution Tactic: 0
[01/29/2022-15:09:31] [V] [TRT] *************** Autotuning format combination: Float(3136,1,3136,3136) -> Float(1024,1,1024,1024) ***************
[01/29/2022-15:09:31] [V] [TRT] --------------- Timing Runner: MatMul + b3/read:0 + (Unnamed Layer* 21) [Shuffle] + unsqueeze_node_after_b3/read:0 + (Unnamed Layer* 21) [Shuffle] + add_2 + Relu_2 (CudnnConvolution)
[01/29/2022-15:09:31] [V] [TRT] CudnnConvolution has no valid tactics for this config, skipping
[01/29/2022-15:09:31] [V] [TRT] --------------- Timing Runner: MatMul + b3/read:0 + (Unnamed Layer* 21) [Shuffle] + unsqueeze_node_after_b3/read:0 + (Unnamed Layer* 21) [Shuffle] + add_2 + Relu_2 (CublasConvolution)
[01/29/2022-15:09:31] [V] [TRT] CublasConvolution has no valid tactics for this config, skipping
[01/29/2022-15:09:31] [V] [TRT] --------------- Timing Runner: MatMul + b3/read:0 + (Unnamed Layer* 21) [Shuffle] + unsqueeze_node_after_b3/read:0 + (Unnamed Layer* 21) [Shuffle] + add_2 + Relu_2 (CaskConvolution)
[01/29/2022-15:09:31] [V] [TRT] MatMul + b3/read:0 + (Unnamed Layer* 21) [Shuffle] + unsqueeze_node_after_b3/read:0 + (Unnamed Layer* 21) [Shuffle] + add_2 + Relu_2 Set Tactic Name: maxwell_scudnn_128x64_sliced1x2_ldg4_relu_exp_interior_nhwc_tn_v1 Tactic: 3886731678879822788
[01/29/2022-15:09:31] [V] [TRT] Tactic: 3886731678879822788 Time: 0.191584
[01/29/2022-15:09:31] [V] [TRT] MatMul + b3/read:0 + (Unnamed Layer* 21) [Shuffle] + unsqueeze_node_after_b3/read:0 + (Unnamed Layer* 21) [Shuffle] + add_2 + Relu_2 Set Tactic Name: maxwell_scudnn_128x32_sliced1x4_ldg4_relu_exp_interior_nhwc_tn_v1 Tactic: 6629944304117643200
[01/29/2022-15:09:31] [V] [TRT] Tactic: 6629944304117643200 Time: 0.149836
[01/29/2022-15:09:31] [V] [TRT] MatMul + b3/read:0 + (Unnamed Layer* 21) [Shuffle] + unsqueeze_node_after_b3/read:0 + (Unnamed Layer* 21) [Shuffle] + add_2 + Relu_2 Set Tactic Name: maxwell_scudnn_128x32_sliced1x4_ldg4_relu_exp_small_nhwc_tn_v1 Tactic: -9153228964338181824
[01/29/2022-15:09:31] [V] [TRT] Tactic: -9153228964338181824 Time: 0.1504
[01/29/2022-15:09:31] [V] [TRT] MatMul + b3/read:0 + (Unnamed Layer* 21) [Shuffle] + unsqueeze_node_after_b3/read:0 + (Unnamed Layer* 21) [Shuffle] + add_2 + Relu_2 Set Tactic Name: maxwell_scudnn_128x64_sliced1x2_ldg4_relu_exp_small_nhwc_tn_v1 Tactic: -7394439838318485025
[01/29/2022-15:09:31] [V] [TRT] Tactic: -7394439838318485025 Time: 0.191744
[01/29/2022-15:09:31] [V] [TRT] Fastest Tactic: 6629944304117643200 Time: 0.149836
[01/29/2022-15:09:31] [V] [TRT] >>>>>>>>>>>>>>> Chose Runner Type: CaskConvolution Tactic: 6629944304117643200
[01/29/2022-15:09:31] [V] [TRT] *************** Autotuning Reformat:Float(1024,1,1,1) -> Float(1024,1,1024,1024) ***************
[01/29/2022-15:09:31] [V] [TRT] --------------- Timing Runner: Optimizer Reformat (Reformat)
[01/29/2022-15:09:32] [V] [TRT] Tactic: 1002 Time: 0.004096
[01/29/2022-15:09:32] [V] [TRT] Tactic: 0 Time: 0.003072
[01/29/2022-15:09:32] [V] [TRT] Fastest Tactic: 0 Time: 0.003072
[01/29/2022-15:09:32] [V] [TRT] *************** Autotuning Reformat:Float(1024,1,1024,1024) -> Float(1024,1,1,1) ***************
[01/29/2022-15:09:32] [V] [TRT] --------------- Timing Runner: Optimizer Reformat (Reformat)
[01/29/2022-15:09:32] [V] [TRT] Tactic: 1002 Time: 0.004096
[01/29/2022-15:09:32] [V] [TRT] Tactic: 0 Time: 0.003072
[01/29/2022-15:09:32] [V] [TRT] Fastest Tactic: 0 Time: 0.003072
[01/29/2022-15:09:32] [V] [TRT] *************** Autotuning format combination: Float(1024,1,1,1) -> Float(10,1,1,1) ***************
[01/29/2022-15:09:32] [V] [TRT] --------------- Timing Runner: MatMul_1 + b4/read:0 + (Unnamed Layer* 37) [Shuffle] + unsqueeze_node_after_b4/read:0 + (Unnamed Layer* 37) [Shuffle] + add_3 (CudaDepthwiseConvolution)
[01/29/2022-15:09:32] [V] [TRT] CudaDepthwiseConvolution has no valid tactics for this config, skipping
[01/29/2022-15:09:32] [V] [TRT] --------------- Timing Runner: MatMul_1 + b4/read:0 + (Unnamed Layer* 37) [Shuffle] + unsqueeze_node_after_b4/read:0 + (Unnamed Layer* 37) [Shuffle] + add_3 (FusedConvActConvolution)
[01/29/2022-15:09:32] [V] [TRT] FusedConvActConvolution has no valid tactics for this config, skipping
[01/29/2022-15:09:32] [V] [TRT] --------------- Timing Runner: MatMul_1 + b4/read:0 + (Unnamed Layer* 37) [Shuffle] + unsqueeze_node_after_b4/read:0 + (Unnamed Layer* 37) [Shuffle] + add_3 (CudnnConvolution)
[01/29/2022-15:09:32] [V] [TRT] Tactic: 0 Time: 0.139836
[01/29/2022-15:09:32] [V] [TRT] Tactic: 1 Time: 0.059136
[01/29/2022-15:09:32] [V] [TRT] Tactic: 2 Time: 0.170232
[01/29/2022-15:09:32] [V] [TRT] Tactic: 4 Time: 0.346668
[01/29/2022-15:09:32] [V] [TRT] Tactic: 5 Time: 0.110828
[01/29/2022-15:09:32] [V] [TRT] Fastest Tactic: 1 Time: 0.059136
[01/29/2022-15:09:32] [V] [TRT] --------------- Timing Runner: MatMul_1 + b4/read:0 + (Unnamed Layer* 37) [Shuffle] + unsqueeze_node_after_b4/read:0 + (Unnamed Layer* 37) [Shuffle] + add_3 (CublasConvolution)
[01/29/2022-15:09:32] [V] [TRT] Tactic: 0 Time: 0.00928
[01/29/2022-15:09:32] [V] [TRT] Tactic: 1 Time: 0.013152
[01/29/2022-15:09:32] [V] [TRT] Fastest Tactic: 0 Time: 0.00928
[01/29/2022-15:09:32] [V] [TRT] --------------- Timing Runner: MatMul_1 + b4/read:0 + (Unnamed Layer* 37) [Shuffle] + unsqueeze_node_after_b4/read:0 + (Unnamed Layer* 37) [Shuffle] + add_3 (CaskConvolution)
[01/29/2022-15:09:32] [V] [TRT] MatMul_1 + b4/read:0 + (Unnamed Layer* 37) [Shuffle] + unsqueeze_node_after_b4/read:0 + (Unnamed Layer* 37) [Shuffle] + add_3 Set Tactic Name: maxwell_scudnn_128x32_relu_medium_nn_v1 Tactic: 1062367460111450758
[01/29/2022-15:09:32] [V] [TRT] Tactic: 1062367460111450758 Time: 0.1029
[01/29/2022-15:09:32] [V] [TRT] MatMul_1 + b4/read:0 + (Unnamed Layer* 37) [Shuffle] + unsqueeze_node_after_b4/read:0 + (Unnamed Layer* 37) [Shuffle] + add_3 Set Tactic Name: maxwell_scudnn_128x32_relu_interior_nn_v0 Tactic: 1698681053543049347
[01/29/2022-15:09:32] [V] [TRT] Tactic: 1698681053543049347 Time: 0.071092
[01/29/2022-15:09:32] [V] [TRT] MatMul_1 + b4/read:0 + (Unnamed Layer* 37) [Shuffle] + unsqueeze_node_after_b4/read:0 + (Unnamed Layer* 37) [Shuffle] + add_3 Set Tactic Name: maxwell_scudnn_128x128_relu_medium_nn_v1 Tactic: 4501471010995462441
[01/29/2022-15:09:32] [V] [TRT] Tactic: 4501471010995462441 Time: 0.109344
[01/29/2022-15:09:32] [V] [TRT] MatMul_1 + b4/read:0 + (Unnamed Layer* 37) [Shuffle] + unsqueeze_node_after_b4/read:0 + (Unnamed Layer* 37) [Shuffle] + add_3 Set Tactic Name: maxwell_scudnn_128x64_relu_small_nn_v1 Tactic: 5137655947464784826
[01/29/2022-15:09:32] [V] [TRT] Tactic: 5137655947464784826 Time: 0.072704
[01/29/2022-15:09:32] [V] [TRT] MatMul_1 + b4/read:0 + (Unnamed Layer* 37) [Shuffle] + unsqueeze_node_after_b4/read:0 + (Unnamed Layer* 37) [Shuffle] + add_3 Set Tactic Name: maxwell_scudnn_128x128_relu_small_nn_v0 Tactic: 5288347012147084929
[01/29/2022-15:09:32] [V] [TRT] Tactic: 5288347012147084929 Time: 0.105536
[01/29/2022-15:09:32] [V] [TRT] MatMul_1 + b4/read:0 + (Unnamed Layer* 37) [Shuffle] + unsqueeze_node_after_b4/read:0 + (Unnamed Layer* 37) [Shuffle] + add_3 Set Tactic Name: maxwell_scudnn_128x128_relu_interior_nn_v1 Tactic: 5326823351883942011
[01/29/2022-15:09:32] [V] [TRT] Tactic: 5326823351883942011 Time: 0.105472
[01/29/2022-15:09:32] [V] [TRT] MatMul_1 + b4/read:0 + (Unnamed Layer* 37) [Shuffle] + unsqueeze_node_after_b4/read:0 + (Unnamed Layer* 37) [Shuffle] + add_3 Set Tactic Name: maxwell_scudnn_128x64_relu_interior_nn_v0 Tactic: 5500448035057547314
[01/29/2022-15:09:32] [V] [TRT] Tactic: 5500448035057547314 Time: 0.090456
[01/29/2022-15:09:32] [V] [TRT] MatMul_1 + b4/read:0 + (Unnamed Layer* 37) [Shuffle] + unsqueeze_node_after_b4/read:0 + (Unnamed Layer* 37) [Shuffle] + add_3 Set Tactic Name: maxwell_scudnn_128x64_relu_medium_nn_v1 Tactic: 6645123197870846056
[01/29/2022-15:09:32] [V] [TRT] Tactic: 6645123197870846056 Time: 0.078848
[01/29/2022-15:09:32] [V] [TRT] MatMul_1 + b4/read:0 + (Unnamed Layer* 37) [Shuffle] + unsqueeze_node_after_b4/read:0 + (Unnamed Layer* 37) [Shuffle] + add_3 Set Tactic Name: maxwell_scudnn_128x32_relu_small_nn_v0 Tactic: 7144526460361122478
[01/29/2022-15:09:32] [V] [TRT] Tactic: 7144526460361122478 Time: 0.074204
[01/29/2022-15:09:32] [V] [TRT] MatMul_1 + b4/read:0 + (Unnamed Layer* 37) [Shuffle] + unsqueeze_node_after_b4/read:0 + (Unnamed Layer* 37) [Shuffle] + add_3 Set Tactic Name: maxwell_scudnn_128x128_relu_medium_nn_v0 Tactic: -8262349710178828730
[01/29/2022-15:09:32] [V] [TRT] Tactic: -8262349710178828730 Time: 0.108404
[01/29/2022-15:09:32] [V] [TRT] MatMul_1 + b4/read:0 + (Unnamed Layer* 37) [Shuffle] + unsqueeze_node_after_b4/read:0 + (Unnamed Layer* 37) [Shuffle] + add_3 Set Tactic Name: maxwell_scudnn_128x32_relu_interior_nn_v1 Tactic: -6576203419454146580
[01/29/2022-15:09:32] [V] [TRT] Tactic: -6576203419454146580 Time: 0.077684
[01/29/2022-15:09:32] [V] [TRT] MatMul_1 + b4/read:0 + (Unnamed Layer* 37) [Shuffle] + unsqueeze_node_after_b4/read:0 + (Unnamed Layer* 37) [Shuffle] + add_3 Set Tactic Name: maxwell_scudnn_128x32_relu_medium_nn_v0 Tactic: -4787320710726427159
[01/29/2022-15:09:32] [V] [TRT] Tactic: -4787320710726427159 Time: 0.079872
[01/29/2022-15:09:32] [V] [TRT] MatMul_1 + b4/read:0 + (Unnamed Layer* 37) [Shuffle] + unsqueeze_node_after_b4/read:0 + (Unnamed Layer* 37) [Shuffle] + add_3 Set Tactic Name: maxwell_scudnn_128x32_relu_small_nn_v1 Tactic: -3456450830548107839
[01/29/2022-15:09:32] [V] [TRT] Tactic: -3456450830548107839 Time: 0.082816
[01/29/2022-15:09:32] [V] [TRT] MatMul_1 + b4/read:0 + (Unnamed Layer* 37) [Shuffle] + unsqueeze_node_after_b4/read:0 + (Unnamed Layer* 37) [Shuffle] + add_3 Set Tactic Name: maxwell_scudnn_128x64_relu_medium_nn_v0 Tactic: -1218658103698133241
[01/29/2022-15:09:32] [V] [TRT] Tactic: -1218658103698133241 Time: 0.098176
[01/29/2022-15:09:32] [V] [TRT] MatMul_1 + b4/read:0 + (Unnamed Layer* 37) [Shuffle] + unsqueeze_node_after_b4/read:0 + (Unnamed Layer* 37) [Shuffle] + add_3 Set Tactic Name: maxwell_scudnn_128x64_relu_small_nn_v0 Tactic: -836875257600482091
[01/29/2022-15:09:32] [V] [TRT] Tactic: -836875257600482091 Time: 0.09216
[01/29/2022-15:09:32] [V] [TRT] MatMul_1 + b4/read:0 + (Unnamed Layer* 37) [Shuffle] + unsqueeze_node_after_b4/read:0 + (Unnamed Layer* 37) [Shuffle] + add_3 Set Tactic Name: maxwell_scudnn_128x128_relu_small_nn_v1 Tactic: -410470605513481746
[01/29/2022-15:09:32] [V] [TRT] Tactic: -410470605513481746 Time: 0.104448
[01/29/2022-15:09:32] [V] [TRT] MatMul_1 + b4/read:0 + (Unnamed Layer* 37) [Shuffle] + unsqueeze_node_after_b4/read:0 + (Unnamed Layer* 37) [Shuffle] + add_3 Set Tactic Name: maxwell_scudnn_128x128_relu_interior_nn_v0 Tactic: -377491875521947884
[01/29/2022-15:09:32] [V] [TRT] Tactic: -377491875521947884 Time: 0.104576
[01/29/2022-15:09:32] [V] [TRT] MatMul_1 + b4/read:0 + (Unnamed Layer* 37) [Shuffle] + unsqueeze_node_after_b4/read:0 + (Unnamed Layer* 37) [Shuffle] + add_3 Set Tactic Name: maxwell_scudnn_128x64_relu_interior_nn_v1 Tactic: -37215280111360163
[01/29/2022-15:09:32] [V] [TRT] Tactic: -37215280111360163 Time: 0.070656
[01/29/2022-15:09:32] [V] [TRT] Fastest Tactic: -37215280111360163 Time: 0.070656
[01/29/2022-15:09:32] [V] [TRT] >>>>>>>>>>>>>>> Chose Runner Type: CublasConvolution Tactic: 0
[01/29/2022-15:09:32] [V] [TRT] *************** Autotuning format combination: Float(1024,1,1024,1024) -> Float(10,1,10,10) ***************
[01/29/2022-15:09:32] [V] [TRT] --------------- Timing Runner: MatMul_1 + b4/read:0 + (Unnamed Layer* 37) [Shuffle] + unsqueeze_node_after_b4/read:0 + (Unnamed Layer* 37) [Shuffle] + add_3 (CudnnConvolution)
[01/29/2022-15:09:32] [V] [TRT] CudnnConvolution has no valid tactics for this config, skipping
[01/29/2022-15:09:32] [V] [TRT] --------------- Timing Runner: MatMul_1 + b4/read:0 + (Unnamed Layer* 37) [Shuffle] + unsqueeze_node_after_b4/read:0 + (Unnamed Layer* 37) [Shuffle] + add_3 (CublasConvolution)
[01/29/2022-15:09:32] [V] [TRT] CublasConvolution has no valid tactics for this config, skipping
[01/29/2022-15:09:32] [V] [TRT] --------------- Timing Runner: MatMul_1 + b4/read:0 + (Unnamed Layer* 37) [Shuffle] + unsqueeze_node_after_b4/read:0 + (Unnamed Layer* 37) [Shuffle] + add_3 (CaskConvolution)
[01/29/2022-15:09:32] [V] [TRT] CaskConvolution has no valid tactics for this config, skipping
[01/29/2022-15:09:32] [V] [TRT] *************** Autotuning Reformat:Float(10,1,10,10) -> Float(10,1,1,1) ***************
[01/29/2022-15:09:32] [V] [TRT] --------------- Timing Runner: Optimizer Reformat (Reformat)
[01/29/2022-15:09:32] [V] [TRT] Tactic: 1002 Time: 0.00512
[01/29/2022-15:09:32] [V] [TRT] Tactic: 0 Time: 0.003072
[01/29/2022-15:09:32] [V] [TRT] Fastest Tactic: 0 Time: 0.003072
[01/29/2022-15:09:32] [V] [TRT] *************** Autotuning format combination: Float(10,1,1,1) -> Float(10,1) ***************
[01/29/2022-15:09:32] [V] [TRT] --------------- Timing Runner: copied_squeeze_after_add_3 (Shuffle)
[01/29/2022-15:09:32] [V] [TRT] Tactic: 0 is the only option, timing skipped
[01/29/2022-15:09:32] [V] [TRT] Fastest Tactic: 0 Time: 0
[01/29/2022-15:09:32] [V] [TRT] >>>>>>>>>>>>>>> Chose Runner Type: Shuffle Tactic: 0
[01/29/2022-15:09:32] [V] [TRT] *************** Autotuning format combination: Float(10,1) -> Float(1,1), Int32(1,1) ***************
[01/29/2022-15:09:32] [V] [TRT] --------------- Timing Runner: y + z (LogSoftmaxTopK)
[01/29/2022-15:09:32] [V] [TRT] Tactic: 1001 Time: 0.003316
[01/29/2022-15:09:32] [V] [TRT] Tactic: 1002 Time: 0.016384
[01/29/2022-15:09:32] [V] [TRT] Fastest Tactic: 1001 Time: 0.003316
[01/29/2022-15:09:32] [V] [TRT] >>>>>>>>>>>>>>> Chose Runner Type: LogSoftmaxTopK Tactic: 1001
[01/29/2022-15:09:32] [V] [TRT] *************** Autotuning format combination: Int32(1,1) -> Int32(1) ***************
[01/29/2022-15:09:32] [V] [TRT] --------------- Timing Runner: (Unnamed Layer* 52) [Shuffle] (Shuffle)
[01/29/2022-15:09:32] [V] [TRT] Tactic: 0 is the only option, timing skipped
[01/29/2022-15:09:32] [V] [TRT] Fastest Tactic: 0 Time: 0
[01/29/2022-15:09:32] [V] [TRT] >>>>>>>>>>>>>>> Chose Runner Type: Shuffle Tactic: 0
[01/29/2022-15:09:32] [V] [TRT] Adding reformat layer: Reformatted Input Tensor 0 to Conv__27 + Relu_1 (MaxPool2d:0) from Float(6272,196,14,1) to Float(6272,1,448,32)
[01/29/2022-15:09:32] [V] [TRT] Adding reformat layer: Reformatted Input Tensor 0 to MaxPool2d_1 (Relu_1:0) from Float(12544,1,896,64) to Float(12544,196,14,1)
[01/29/2022-15:09:32] [V] [TRT] Formats and tactics selection completed in 3.82038 seconds.
[01/29/2022-15:09:32] [V] [TRT] After reformat layers: 12 layers
[01/29/2022-15:09:32] [V] [TRT] Block size 1073741824
[01/29/2022-15:09:32] [V] [TRT] Block size 1605632
[01/29/2022-15:09:32] [V] [TRT] Block size 802816
[01/29/2022-15:09:32] [V] [TRT] Block size 401408
[01/29/2022-15:09:32] [V] [TRT] Block size 1
[01/29/2022-15:09:32] [V] [TRT] Total Activation Memory: 1076551681
[01/29/2022-15:09:32] [I] [TRT] Detected 1 inputs and 1 output network tensors.
[01/29/2022-15:09:32] [V] [TRT] Conv__25 + Relu Set Tactic Name: maxwell_scudnn_128x32_relu_small_nn_v0 Tactic: 7144526460361122478
[01/29/2022-15:09:32] [V] [TRT] Conv__27 + Relu_1 Set Tactic Name: maxwell_scudnn_128x32_sliced1x4_ldg4_relu_exp_small_nhwc_tn_v1 Tactic: -9153228964338181824
[01/29/2022-15:09:32] [V] [TRT] Layer: Conv__25 + Relu HostPersistent: 1664 DevicePersistent: 8192
[01/29/2022-15:09:32] [V] [TRT] Layer: MaxPool2d HostPersistent: 0 DevicePersistent: 0
[01/29/2022-15:09:32] [V] [TRT] Layer: Reformatting CopyNode for Input Tensor 0 to Conv__27 + Relu_1 HostPersistent: 0 DevicePersistent: 0
[01/29/2022-15:09:32] [V] [TRT] Layer: Conv__27 + Relu_1 HostPersistent: 1664 DevicePersistent: 206336
[01/29/2022-15:09:32] [V] [TRT] Layer: Reformatting CopyNode for Input Tensor 0 to MaxPool2d_1 HostPersistent: 0 DevicePersistent: 0
[01/29/2022-15:09:32] [V] [TRT] Layer: MaxPool2d_1 HostPersistent: 0 DevicePersistent: 0
[01/29/2022-15:09:32] [V] [TRT] Layer: MaxPool2d_1__22 + Reshape + (Unnamed Layer* 14) [Shuffle] HostPersistent: 0 DevicePersistent: 0
[01/29/2022-15:09:32] [V] [TRT] Layer: MatMul + b3/read:0 + (Unnamed Layer* 21) [Shuffle] + unsqueeze_node_after_b3/read:0 + (Unnamed Layer* 21) [Shuffle] + add_2 + Relu_2 HostPersistent: 340 DevicePersistent: 0
[01/29/2022-15:09:32] [V] [TRT] Layer: MatMul_1 + b4/read:0 + (Unnamed Layer* 37) [Shuffle] + unsqueeze_node_after_b4/read:0 + (Unnamed Layer* 37) [Shuffle] + add_3 HostPersistent: 340 DevicePersistent: 0
[01/29/2022-15:09:32] [V] [TRT] Layer: y + z HostPersistent: 0 DevicePersistent: 0
[01/29/2022-15:09:32] [I] [TRT] Total Host Persistent Memory: 4032
[01/29/2022-15:09:32] [I] [TRT] Total Device Persistent Memory: 214528
[01/29/2022-15:09:32] [I] [TRT] Total Scratch Memory: 0
[01/29/2022-15:09:32] [I] [TRT] [MemUsageStats] Peak memory usage of TRT CPU/GPU memory allocators: CPU 12 MiB, GPU 4 MiB
[01/29/2022-15:09:32] [V] [TRT] Using cublas a tactic source
[01/29/2022-15:09:32] [I] [TRT] [MemUsageChange] Init cuBLAS/cuBLASLt: CPU +0, GPU +8, now: CPU 772, GPU 802 (MiB)
[01/29/2022-15:09:32] [V] [TRT] Using cuDNN as a tactic source
[01/29/2022-15:09:32] [I] [TRT] [MemUsageChange] Init cuDNN: CPU +0, GPU +8, now: CPU 772, GPU 810 (MiB)
[01/29/2022-15:09:32] [I] [TRT] [MemUsageChange] Init cuBLAS/cuBLASLt: CPU +0, GPU +0, now: CPU 772, GPU 794 (MiB)
[01/29/2022-15:09:32] [V] [TRT] Engine generation completed in 4.30075 seconds.
[01/29/2022-15:09:32] [V] [TRT] Deleting timing cache: 29 entries, 0 hits
[01/29/2022-15:09:32] [I] [TRT] [MemUsageChange] Init cuBLAS/cuBLASLt: CPU +0, GPU +0, now: CPU 772, GPU 776 (MiB)
[01/29/2022-15:09:32] [V] [TRT] Engine Layer Information:
Layer(CaskConvolution): Conv__25 + Relu, Tactic: 7144526460361122478, x:0[Float(-2,1,28,28)] -> Relu:0[Float(-2,32,28,28)]
Layer(TiledPooling): MaxPool2d, Tactic: 6488321, Relu:0[Float(-2,32,28,28)] -> MaxPool2d:0[Float(-2,32,14,14)]
Layer(Reformat): Reformatting CopyNode for Input Tensor 0 to Conv__27 + Relu_1, Tactic: 0, MaxPool2d:0[Float(-2,32,14,14)] -> Reformatted Input Tensor 0 to Conv__27 + Relu_1[Float(-2,32,14,14)]
Layer(CaskConvolution): Conv__27 + Relu_1, Tactic: -9153228964338181824, Reformatted Input Tensor 0 to Conv__27 + Relu_1[Float(-2,32,14,14)] -> Relu_1:0[Float(-2,64,14,14)]
Layer(Reformat): Reformatting CopyNode for Input Tensor 0 to MaxPool2d_1, Tactic: 0, Relu_1:0[Float(-2,64,14,14)] -> Reformatted Input Tensor 0 to MaxPool2d_1[Float(-2,64,14,14)]
Layer(TiledPooling): MaxPool2d_1, Tactic: 6357249, Reformatted Input Tensor 0 to MaxPool2d_1[Float(-2,64,14,14)] -> MaxPool2d_1:0[Float(-2,64,7,7)]
Layer(Shuffle): MaxPool2d_1__22 + Reshape + (Unnamed Layer* 14) [Shuffle], Tactic: 0, MaxPool2d_1:0[Float(-2,64,7,7)] -> (Unnamed Layer* 14) [Shuffle]_output[Float(-2,3136,1,1)]
Layer(CublasConvolution): MatMul + b3/read:0 + (Unnamed Layer* 21) [Shuffle] + unsqueeze_node_after_b3/read:0 + (Unnamed Layer* 21) [Shuffle] + add_2 + Relu_2, Tactic: 0, (Unnamed Layer* 14) [Shuffle]_output[Float(-2,3136,1,1)] -> Relu_2_out_tensor[Float(-2,1024,1,1)]
Layer(CublasConvolution): MatMul_1 + b4/read:0 + (Unnamed Layer* 37) [Shuffle] + unsqueeze_node_after_b4/read:0 + (Unnamed Layer* 37) [Shuffle] + add_3, Tactic: 0, Relu_2_out_tensor[Float(-2,1024,1,1)] -> add_3_out_tensor[Float(-2,10,1,1)]
Layer(LogSoftmaxTopK): y + z, Tactic: 1001, add_3:0[Float(-2,10)] -> (Unnamed Layer* 48) [TopK]_output_1[Float(-2,1)], (Unnamed Layer* 48) [TopK]_output_2[Int32(-2,1)]
[01/29/2022-15:09:32] [I] [TRT] [MemUsageSnapshot] Builder end: CPU 772 MiB, GPU 776 MiB
[01/29/2022-15:09:32] [I] [TRT] Loaded engine size: 12 MB
[01/29/2022-15:09:32] [I] [TRT] [MemUsageSnapshot] deserializeCudaEngine begin: CPU 784 MiB, GPU 762 MiB
[01/29/2022-15:09:32] [V] [TRT] Using cublas a tactic source
[01/29/2022-15:09:32] [I] [TRT] [MemUsageChange] Init cuBLAS/cuBLASLt: CPU +0, GPU +10, now: CPU 785, GPU 786 (MiB)
[01/29/2022-15:09:32] [V] [TRT] Using cuDNN as a tactic source
[01/29/2022-15:09:32] [I] [TRT] [MemUsageChange] Init cuDNN: CPU +0, GPU +8, now: CPU 785, GPU 794 (MiB)
[01/29/2022-15:09:32] [I] [TRT] [MemUsageChange] Init cuBLAS/cuBLASLt: CPU +0, GPU +0, now: CPU 785, GPU 776 (MiB)
[01/29/2022-15:09:32] [V] [TRT] Deserialization required 29534 microseconds.
[01/29/2022-15:09:32] [I] [TRT] [MemUsageSnapshot] deserializeCudaEngine end: CPU 785 MiB, GPU 776 MiB
[01/29/2022-15:09:32] [I] Engine built in 4.66332 sec.
[01/29/2022-15:09:32] [I] [TRT] [MemUsageSnapshot] ExecutionContext creation begin: CPU 747 MiB, GPU 776 MiB
[01/29/2022-15:09:32] [V] [TRT] Using cublas a tactic source
[01/29/2022-15:09:32] [I] [TRT] [MemUsageChange] Init cuBLAS/cuBLASLt: CPU +0, GPU +10, now: CPU 747, GPU 786 (MiB)
[01/29/2022-15:09:32] [V] [TRT] Using cuDNN as a tactic source
[01/29/2022-15:09:32] [I] [TRT] [MemUsageChange] Init cuDNN: CPU +0, GPU +8, now: CPU 747, GPU 794 (MiB)
[01/29/2022-15:09:32] [V] [TRT] Total per-runner device memory is 214528
[01/29/2022-15:09:32] [V] [TRT] Total per-runner host memory is 4032
[01/29/2022-15:09:32] [V] [TRT] Allocated activation device memory of size 2810368
[01/29/2022-15:09:32] [I] [TRT] [MemUsageSnapshot] ExecutionContext creation end: CPU 747 MiB, GPU 798 MiB
[01/29/2022-15:09:32] [I] Created input binding for x:0 with dimensions 4x1x28x28
[01/29/2022-15:09:32] [I] Created output binding for z:0 with dimensions 4
[01/29/2022-15:09:32] [I] Starting inference
[01/29/2022-15:09:35] [I] Warmup completed 1169 queries over 200 ms
[01/29/2022-15:09:35] [I] Timing trace has 18510 queries over 3.0005 s
[01/29/2022-15:09:35] [I] 
[01/29/2022-15:09:35] [I] === Trace details ===
[01/29/2022-15:09:35] [I] Trace averages of 10 runs:
[01/29/2022-15:09:35] [I] Average on 10 runs - GPU latency: 0.156978 ms - Host latency: 0.163629 ms (end to end 0.29006 ms, enqueue 0.0391022 ms)
[01/29/2022-15:09:35] [I] Average on 10 runs - GPU latency: 0.156467 ms - Host latency: 0.164818 ms (end to end 0.270024 ms, enqueue 0.0506226 ms)
[01/29/2022-15:09:35] [I] Average on 10 runs - GPU latency: 0.157343 ms - Host latency: 0.164697 ms (end to end 0.262506 ms, enqueue 0.0446625 ms)
[01/29/2022-15:09:35] [I] Average on 10 runs - GPU latency: 0.156673 ms - Host latency: 0.163734 ms (end to end 0.280624 ms, enqueue 0.0436172 ms)
[01/29/2022-15:09:35] [I] Average on 10 runs - GPU latency: 0.15657 ms - Host latency: 0.163641 ms (end to end 0.290529 ms, enqueue 0.043512 ms)
[01/29/2022-15:09:35] [I] Average on 10 runs - GPU latency: 0.156468 ms - Host latency: 0.163332 ms (end to end 0.280412 ms, enqueue 0.044841 ms)
[01/29/2022-15:09:35] [I] Average on 10 runs - GPU latency: 0.15657 ms - Host latency: 0.163643 ms (end to end 0.28383 ms, enqueue 0.0434845 ms)
[01/29/2022-15:09:35] [I] Average on 10 runs - GPU latency: 0.15657 ms - Host latency: 0.163777 ms (end to end 0.289993 ms, enqueue 0.0443161 ms)
[01/29/2022-15:09:35] [I] Average on 10 runs - GPU latency: 0.156673 ms - Host latency: 0.163623 ms (end to end 0.283321 ms, enqueue 0.0439438 ms)
[01/29/2022-15:09:35] [I] Average on 10 runs - GPU latency: 0.157388 ms - Host latency: 0.165791 ms (end to end 0.285219 ms, enqueue 0.0509308 ms)
[01/29/2022-15:09:35] [I] Average on 10 runs - GPU latency: 0.156569 ms - Host latency: 0.16492 ms (end to end 0.272234 ms, enqueue 0.0532028 ms)
[01/29/2022-15:09:35] [I] Average on 10 runs - GPU latency: 0.15596 ms - Host latency: 0.163582 ms (end to end 0.28119 ms, enqueue 0.046524 ms)
[01/29/2022-15:09:35] [I] Average on 10 runs - GPU latency: 0.156058 ms - Host latency: 0.162917 ms (end to end 0.280411 ms, enqueue 0.0437164 ms)
[01/29/2022-15:09:35] [I] Average on 10 runs - GPU latency: 0.156162 ms - Host latency: 0.163039 ms (end to end 0.28157 ms, enqueue 0.0437256 ms)
[01/29/2022-15:09:35] [I] Average on 10 runs - GPU latency: 0.156876 ms - Host latency: 0.163623 ms (end to end 0.272571 ms, enqueue 0.0434113 ms)
[01/29/2022-15:09:35] [I] Average on 10 runs - GPU latency: 0.156261 ms - Host latency: 0.163287 ms (end to end 0.28008 ms, enqueue 0.043457 ms)
[01/29/2022-15:09:35] [I] Average on 10 runs - GPU latency: 0.156387 ms - Host latency: 0.163295 ms (end to end 0.285506 ms, enqueue 0.0440979 ms)
[01/29/2022-15:09:35] [I] Average on 10 runs - GPU latency: 0.155956 ms - Host latency: 0.162682 ms (end to end 0.284836 ms, enqueue 0.0444244 ms)
[01/29/2022-15:09:35] [I] Average on 10 runs - GPU latency: 0.15657 ms - Host latency: 0.163577 ms (end to end 0.286481 ms, enqueue 0.0445312 ms)
[01/29/2022-15:09:35] [I] Average on 10 runs - GPU latency: 0.156364 ms - Host latency: 0.16254 ms (end to end 0.297908 ms, enqueue 0.0319504 ms)
[01/29/2022-15:09:35] [I] Average on 10 runs - GPU latency: 0.156104 ms - Host latency: 0.162202 ms (end to end 0.291025 ms, enqueue 0.0317017 ms)
[01/29/2022-15:09:35] [I] Average on 10 runs - GPU latency: 0.155853 ms - Host latency: 0.162073 ms (end to end 0.299081 ms, enqueue 0.0317642 ms)
[01/29/2022-15:09:35] [I] Average on 10 runs - GPU latency: 0.156162 ms - Host latency: 0.162366 ms (end to end 0.298027 ms, enqueue 0.0324417 ms)
[01/29/2022-15:09:35] [I] Average on 10 runs - GPU latency: 0.156468 ms - Host latency: 0.162753 ms (end to end 0.296585 ms, enqueue 0.0317123 ms)
[01/29/2022-15:09:35] [I] Average on 10 runs - GPU latency: 0.156569 ms - Host latency: 0.162727 ms (end to end 0.293723 ms, enqueue 0.0318375 ms)
[01/29/2022-15:09:35] [I] Average on 10 runs - GPU latency: 0.156467 ms - Host latency: 0.162668 ms (end to end 0.296826 ms, enqueue 0.0317337 ms)
[01/29/2022-15:09:35] [I] Average on 10 runs - GPU latency: 0.156058 ms - Host latency: 0.162242 ms (end to end 0.299179 ms, enqueue 0.0317581 ms)
[01/29/2022-15:09:35] [I] Average on 10 runs - GPU latency: 0.156671 ms - Host latency: 0.163892 ms (end to end 0.282742 ms, enqueue 0.038977 ms)
[01/29/2022-15:09:35] [I] Average on 10 runs - GPU latency: 0.156671 ms - Host latency: 0.16385 ms (end to end 0.283449 ms, enqueue 0.0384445 ms)
[01/29/2022-15:09:35] [I] Average on 10 runs - GPU latency: 0.156465 ms - Host latency: 0.16378 ms (end to end 0.28351 ms, enqueue 0.0391327 ms)
[01/29/2022-15:09:35] [I] Average on 10 runs - GPU latency: 0.15616 ms - Host latency: 0.162244 ms (end to end 0.295587 ms, enqueue 0.0319855 ms)
[01/29/2022-15:09:35] [I] Average on 10 runs - GPU latency: 0.156366 ms - Host latency: 0.16232 ms (end to end 0.301047 ms, enqueue 0.0314972 ms)
[01/29/2022-15:09:35] [I] Average on 10 runs - GPU latency: 0.156468 ms - Host latency: 0.162633 ms (end to end 0.292969 ms, enqueue 0.031604 ms)
[01/29/2022-15:09:35] [I] Average on 10 runs - GPU latency: 0.155954 ms - Host latency: 0.16219 ms (end to end 0.293707 ms, enqueue 0.0320709 ms)
[01/29/2022-15:09:35] [I] Average on 10 runs - GPU latency: 0.156668 ms - Host latency: 0.162906 ms (end to end 0.29444 ms, enqueue 0.0332062 ms)
[01/29/2022-15:09:35] [I] Average on 10 runs - GPU latency: 0.15636 ms - Host latency: 0.163449 ms (end to end 0.282776 ms, enqueue 0.0386169 ms)
[01/29/2022-15:09:35] [I] Average on 10 runs - GPU latency: 0.15647 ms - Host latency: 0.163635 ms (end to end 0.280591 ms, enqueue 0.0386658 ms)
[01/29/2022-15:09:35] [I] Average on 10 runs - GPU latency: 0.156467 ms - Host latency: 0.163403 ms (end to end 0.280383 ms, enqueue 0.0382965 ms)
[01/29/2022-15:09:35] [I] Average on 10 runs - GPU latency: 0.156976 ms - Host latency: 0.163052 ms (end to end 0.295407 ms, enqueue 0.0323273 ms)
[01/29/2022-15:09:35] [I] Average on 10 runs - GPU latency: 0.156744 ms - Host latency: 0.162964 ms (end to end 0.278091 ms, enqueue 0.034317 ms)
[01/29/2022-15:09:35] [I] Average on 10 runs - GPU latency: 0.15658 ms - Host latency: 0.162833 ms (end to end 0.296112 ms, enqueue 0.0316895 ms)
[01/29/2022-15:09:35] [I] Average on 10 runs - GPU latency: 0.156061 ms - Host latency: 0.16207 ms (end to end 0.29382 ms, enqueue 0.0318573 ms)
[01/29/2022-15:09:35] [I] Average on 10 runs - GPU latency: 0.155859 ms - Host latency: 0.161737 ms (end to end 0.296774 ms, enqueue 0.0316772 ms)
[01/29/2022-15:09:35] [I] Average on 10 runs - GPU latency: 0.156265 ms - Host latency: 0.162192 ms (end to end 0.299286 ms, enqueue 0.0315765 ms)
[01/29/2022-15:09:35] [I] Average on 10 runs - GPU latency: 0.157388 ms - Host latency: 0.163663 ms (end to end 0.296619 ms, enqueue 0.0338745 ms)
[01/29/2022-15:09:35] [I] Average on 10 runs - GPU latency: 0.156976 ms - Host latency: 0.162991 ms (end to end 0.300534 ms, enqueue 0.0317566 ms)
[01/29/2022-15:09:35] [I] Average on 10 runs - GPU latency: 0.156464 ms - Host latency: 0.162592 ms (end to end 0.296185 ms, enqueue 0.0318787 ms)
[01/29/2022-15:09:35] [I] Average on 10 runs - GPU latency: 0.156567 ms - Host latency: 0.162576 ms (end to end 0.293863 ms, enqueue 0.0316406 ms)
[01/29/2022-15:09:35] [I] Average on 10 runs - GPU latency: 0.156162 ms - Host latency: 0.162378 ms (end to end 0.295242 ms, enqueue 0.0317902 ms)
[01/29/2022-15:09:35] [I] Average on 10 runs - GPU latency: 0.155646 ms - Host latency: 0.16174 ms (end to end 0.295337 ms, enqueue 0.0317413 ms)
[01/29/2022-15:09:35] [I] Average on 10 runs - GPU latency: 0.155756 ms - Host latency: 0.161865 ms (end to end 0.294635 ms, enqueue 0.0323181 ms)
[01/29/2022-15:09:35] [I] Average on 10 runs - GPU latency: 0.156223 ms - Host latency: 0.162314 ms (end to end 0.284778 ms, enqueue 0.0318451 ms)
[01/29/2022-15:09:35] [I] Average on 10 runs - GPU latency: 0.155685 ms - Host latency: 0.161749 ms (end to end 0.296677 ms, enqueue 0.0317169 ms)
[01/29/2022-15:09:35] [I] Average on 10 runs - GPU latency: 0.15647 ms - Host latency: 0.163171 ms (end to end 0.293744 ms, enqueue 0.0366303 ms)
[01/29/2022-15:09:35] [I] Average on 10 runs - GPU latency: 0.155954 ms - Host latency: 0.163177 ms (end to end 0.275534 ms, enqueue 0.0385101 ms)
[01/29/2022-15:09:35] [I] Average on 10 runs - GPU latency: 0.156357 ms - Host latency: 0.16366 ms (end to end 0.280887 ms, enqueue 0.0396637 ms)
[01/29/2022-15:09:35] [I] Average on 10 runs - GPU latency: 0.155963 ms - Host latency: 0.1625 ms (end to end 0.288437 ms, enqueue 0.0343018 ms)
[01/29/2022-15:09:35] [I] Average on 10 runs - GPU latency: 0.155795 ms - Host latency: 0.161969 ms (end to end 0.295432 ms, enqueue 0.0314453 ms)
[01/29/2022-15:09:35] [I] Average on 10 runs - GPU latency: 0.155746 ms - Host latency: 0.161734 ms (end to end 0.296088 ms, enqueue 0.0316284 ms)
[01/29/2022-15:09:35] [I] Average on 10 runs - GPU latency: 0.156366 ms - Host latency: 0.162387 ms (end to end 0.300192 ms, enqueue 0.0313843 ms)
[01/29/2022-15:09:35] [I] Average on 10 runs - GPU latency: 0.156158 ms - Host latency: 0.162213 ms (end to end 0.292184 ms, enqueue 0.0314362 ms)
[01/29/2022-15:09:35] [I] Average on 10 runs - GPU latency: 0.15585 ms - Host latency: 0.162085 ms (end to end 0.293372 ms, enqueue 0.0346558 ms)
[01/29/2022-15:09:35] [I] Average on 10 runs - GPU latency: 0.15585 ms - Host latency: 0.161926 ms (end to end 0.296106 ms, enqueue 0.0314728 ms)
[01/29/2022-15:09:35] [I] Average on 10 runs - GPU latency: 0.156461 ms - Host latency: 0.162613 ms (end to end 0.281488 ms, enqueue 0.033725 ms)
[01/29/2022-15:09:35] [I] Average on 10 runs - GPU latency: 0.15585 ms - Host latency: 0.162051 ms (end to end 0.298605 ms, enqueue 0.0315826 ms)
[01/29/2022-15:09:35] [I] Average on 10 runs - GPU latency: 0.156259 ms - Host latency: 0.163708 ms (end to end 0.284363 ms, enqueue 0.0402252 ms)
[01/29/2022-15:09:35] [I] Average on 10 runs - GPU latency: 0.156055 ms - Host latency: 0.164325 ms (end to end 0.295154 ms, enqueue 0.0387329 ms)
[01/29/2022-15:09:35] [I] Average on 10 runs - GPU latency: 0.156259 ms - Host latency: 0.162442 ms (end to end 0.29874 ms, enqueue 0.0323181 ms)
[01/29/2022-15:09:35] [I] Average on 10 runs - GPU latency: 0.156256 ms - Host latency: 0.162485 ms (end to end 0.295462 ms, enqueue 0.0322937 ms)
[01/29/2022-15:09:35] [I] Average on 10 runs - GPU latency: 0.156152 ms - Host latency: 0.162408 ms (end to end 0.295279 ms, enqueue 0.0318878 ms)
[01/29/2022-15:09:35] [I] Average on 10 runs - GPU latency: 0.155542 ms - Host latency: 0.161749 ms (end to end 0.298923 ms, enqueue 0.0322388 ms)
