cookbook/04-Feature/ProfilingVerbosity/log-main.py.log
[07/07/2026-01:46:40] [TRT] [V] *************** Autotuning format combination: Float(784,784,28,1) -> Float(25088,784,28,1) ***************
[07/07/2026-01:46:40] [TRT] [V] --------------- Timing Runner: node_conv2d + node_relu (CaskConvolution[0x80000009])
[07/07/2026-01:46:40] [TRT] [V] Tactic Name: sm80_xmma_fprop_implicit_gemm_f32f32_f32f32_f32_nchwkcrs_nchw_tilesize64x64x8_stage3_warpsize1x4x1_g1_ffma_t1r5s5_aligna4_alignc4 Tactic: 0x967f94e9db2001a8 Time: 0.0126815
[07/07/2026-01:46:40] [TRT] [V] Tactic Name: sm80_xmma_fprop_implicit_gemm_indexed_f32f32_f32f32_f32_nchwkcrs_nchw_tilesize32x32x8_stage3_warpsize1x2x1_g1_ffma_aligna4_alignc4 Tactic: 0xcb8a43f748d8a338 Time: 0.0118452
[07/07/2026-01:46:40] [TRT] [V] Tactic Name: sm80_xmma_fprop_implicit_gemm_indexed_f32f32_f32f32_f32_nchwkcrs_nchw_tilesize128x64x8_stage2_warpsize1x4x1_g1_ffma_aligna4_alignc4_beta0_packed_stride Tactic: 0xede36641840ce3d2 Time: 0.0105737
[07/07/2026-01:46:40] [TRT] [V] Tactic Name: sm80_xmma_fprop_implicit_gemm_indexed_f32f32_f32f32_f32_nchwkcrs_nchw_tilesize64x64x8_stage3_warpsize1x4x1_g1_ffma_aligna4_alignc4 Tactic: 0xd828f024626fa982 Time: 0.0102245
[07/07/2026-01:46:40] [TRT] [V] Tactic Name: sm70_xmma_fprop_implicit_gemm_f32f32_f32f32_f32_nchwkcrs_nchw_tilesize64x128x8_stage1_warpsize1x4x1_g1_ffma_aligna4_alignc4 Tactic: 0xd1338f4b38d341e2 Time: 0.0094643
[07/07/2026-01:46:40] [TRT] [V] Tactic Name: sm80_xmma_fprop_implicit_gemm_f32f32_f32f32_f32_nchwkcrs_nchw_tilesize32x32x8_stage3_warpsize1x2x1_g1_ffma_t1r5s5_aligna4_alignc4 Tactic: 0x5b8bf1b8028629d9 Time: 0.0120663
[07/07/2026-01:46:40] [TRT] [V] Tactic Name: sm80_xmma_fprop_implicit_gemm_f32f32_f32f32_f32_nchwkcrs_nchw_tilesize128x64x8_stage3_warpsize2x2x1_g1_ffma_aligna4_alignc4 Tactic: 0x12dbf7d94ee3696d Time: 0.00977829
[07/07/2026-01:46:40] [TRT] [V] Tactic Name: sm70_xmma_fprop_implicit_gemm_indexed_f32f32_f32f32_f32_nchwkcrs_nchw_tilesize128x16x8_stage1_warpsize4x1x1_g1_ffma_aligna4_alignc4 Tactic: 0x65d82d184f452332 Time: 0.00957166
[07/07/2026-01:46:40] [TRT] [V] Tactic Name: sm80_xmma_fprop_implicit_gemm_indexed_f32f32_f32f32_f32_nchwkcrs_nchw_tilesize128x64x8_stage2_warpsize2x2x1_g1_ffma_aligna4_alignc4_beta0_packed_stride Tactic: 0x31aa67f57c5aea77 Time: 0.0107483
[07/07/2026-01:46:40] [TRT] [V] Tactic Name: sm70_xmma_fprop_implicit_gemm_f32f32_f32f32_f32_nchwkcrs_nchw_tilesize128x128x8_stage1_warpsize2x2x1_g1_ffma_aligna4_alignc4 Tactic: 0xac49795b871b0d29 Time: 0.0137852
[07/07/2026-01:46:40] [TRT] [V] Tactic Name: sm80_xmma_fprop_implicit_gemm_f32f32_f32f32_f32_nchwkcrs_nchw_tilesize128x16x8_stage3_warpsize4x1x1_g1_ffma_aligna4_alignc4 Tactic: 0x9d9fdb5fd9945f64 Time: 0.0106143
[07/07/2026-01:46:40] [TRT] [V] Tactic Name: sm80_xmma_fprop_implicit_gemm_f32f32_f32f32_f32_nchwkcrs_nchw_tilesize64x64x8_stage3_warpsize1x4x1_g1_ffma_aligna4_alignc4 Tactic: 0xa31d27de74b895ff Time: 0.0103955
[07/07/2026-01:46:40] [TRT] [V] Tactic Name: sm70_xmma_fprop_implicit_gemm_f32f32_f32f32_f32_nchwkcrs_nchw_tilesize128x64x8_stage1_warpsize2x2x1_g1_ffma_aligna4_alignc4 Tactic: 0x994f5b723e2d80da Time: 0.00969265
[07/07/2026-01:46:40] [TRT] [V] Tactic Name: sm70_xmma_fprop_implicit_gemm_f32f32_f32f32_f32_nchwkcrs_nchw_tilesize128x256x8_stage1_warpsize2x4x1_g1_ffma_aligna4_alignc4 Tactic: 0xd2aa21bfe2167c0c Time: 0.0168661
[07/07/2026-01:46:40] [TRT] [V] Tactic Name: sm70_xmma_fprop_implicit_gemm_f32f32_f32f32_f32_nchwkcrs_nchw_tilesize32x32x8_stage1_warpsize1x2x1_g1_ffma_t1r5s5_aligna4_alignc4 Tactic: 0x7e1e4d26cfa285f9 Time: 0.0111196
[07/07/2026-01:46:40] [TRT] [V] Tactic Name: sm70_xmma_fprop_implicit_gemm_f32f32_f32f32_f32_nchwkcrs_nchw_tilesize64x64x8_stage1_warpsize1x4x1_g1_ffma_t1r5s5_aligna4_alignc4 Tactic: 0xb3ea28771604ad88 Time: 0.0102213
[07/07/2026-01:46:40] [TRT] [V] Tactic Name: sm80_xmma_fprop_implicit_gemm_indexed_f32f32_f32f32_f32_nchwkcrs_nchw_tilesize128x16x8_stage3_warpsize4x1x1_g1_ffma_aligna4_alignc4 Tactic: 0x40a12e3938221818 Time: 0.00827005
[07/07/2026-01:46:40] [TRT] [V] Tactic Name: sm80_xmma_fprop_implicit_gemm_f32f32_f32f32_f32_nchwkcrs_nchw_tilesize32x32x8_stage3_warpsize1x2x1_g1_ffma_aligna4_alignc4 Tactic: 0xb0bf940d5e0f9f45 Time: 0.0120537
[07/07/2026-01:46:40] [TRT] [V] Tactic Name: sm70_xmma_fprop_implicit_gemm_f32f32_f32f32_f32_nchwkcrs_nchw_tilesize128x16x8_stage1_warpsize4x1x1_g1_ffma_aligna4_alignc4 Tactic: 0x160b77f4a95ab6d3 Time: 0.0106847
[07/07/2026-01:46:40] [TRT] [V] Tactic Name: sm80_xmma_fprop_implicit_gemm_indexed_f32f32_f32f32_f32_nchwkcrs_nchw_tilesize128x32x8_stage3_warpsize2x2x1_g1_ffma_aligna4_alignc4 Tactic: 0xa9366041633a5135 Time: 0.0091742
[07/07/2026-01:46:40] [TRT] [V] Tactic Name: sm80_xmma_fprop_implicit_gemm_indexed_f32f32_f32f32_f32_nchwkcrs_nchw_tilesize128x64x8_stage2_warpsize4x1x1_g1_ffma_aligna4_alignc4_beta0_packed_stride Tactic: 0x1673e3594ce11cea Time: 0.0110049
[07/07/2026-01:46:40] [TRT] [V] Tactic Name: sm70_xmma_fprop_implicit_gemm_indexed_f32f32_f32f32_f32_nchwkcrs_nchw_tilesize64x64x8_stage1_warpsize1x4x1_g1_ffma_aligna4_alignc4 Tactic: 0x8d5c64a52fab02c9 Time: 0.0101621
[07/07/2026-01:46:40] [TRT] [V] Tactic Name: sm70_xmma_fprop_implicit_gemm_indexed_f32f32_f32f32_f32_nchwkcrs_nchw_tilesize128x32x8_stage1_warpsize2x2x1_g1_ffma_aligna4_alignc4 Tactic: 0x8c4f6360145d6a1f Time: 0.00860034
[07/07/2026-01:46:40] [TRT] [V] Tactic Name: sm70_xmma_fprop_implicit_gemm_indexed_f32f32_f32f32_f32_nchwkcrs_nchw_tilesize32x32x8_stage1_warpsize1x2x1_g1_ffma_aligna4_alignc4 Tactic: 0x9efed776051c0873 Time: 0.0109643
[07/07/2026-01:46:40] [TRT] [V] Tactic Name: sm80_xmma_fprop_implicit_gemm_f32f32_f32f32_f32_nchwkcrs_nchw_tilesize256x128x8_stage3_warpsize4x2x1_g1_ffma_aligna4_alignc4 Tactic: 0xbb8c3889c7eacd30 Time: 0.0176651
[07/07/2026-01:46:40] [TRT] [V] Tactic Name: sm80_xmma_fprop_implicit_gemm_f32f32_f32f32_f32_nchwkcrs_nchw_tilesize64x128x8_stage3_warpsize1x4x1_g1_ffma_aligna4_alignc4 Tactic: 0x5aa723e0481da855 Time: 0.0101744
[07/07/2026-01:46:40] [TRT] [V] Tactic Name: sm70_xmma_fprop_implicit_gemm_f32f32_f32f32_f32_nchwkcrs_nchw_tilesize32x32x8_stage1_warpsize1x2x1_g1_ffma_aligna4_alignc4 Tactic: 0xf7a98be0a08d77c4 Time: 0.0113408
[07/07/2026-01:46:40] [TRT] [V] Tactic Name: sm70_xmma_fprop_implicit_gemm_f32f32_f32f32_f32_nchwkcrs_nchw_tilesize64x64x8_stage1_warpsize1x4x1_g1_ffma_aligna4_alignc4 Tactic: 0xe40b38338a3a7d7e Time: 0.0107637
[07/07/2026-01:46:40] [TRT] [V] node_conv2d + node_relu (CaskConvolution[0x80000009]) profiling completed in 0.101391 seconds. Fastest Tactic: 0x40a12e3938221818 Time: 0.00827005
[07/07/2026-01:46:40] [TRT] [V] Skipping CaskFlattenConvolution: No valid tactics for node_conv2d + node_relu
[07/07/2026-01:46:40] [TRT] [V] >>>>>>>>>>>>>>> Chose Runner Type: CaskConvolution Tactic: 0x40a12e3938221818
[07/07/2026-01:46:40] [TRT] [V] *************** Autotuning format combination: Float(784,1,28,1) -> Float(25088,1,896,32) ***************
[07/07/2026-01:46:40] [TRT] [V] --------------- Timing Runner: node_conv2d + node_relu (CaskConvolution[0x80000009])
[07/07/2026-01:46:40] [TRT] [V] Tactic Name: sm80_xmma_fprop_implicit_gemm_f32f32_f32f32_f32_nhwckrsc_nhwc_tilesize128x16x8_stage3_warpsize4x1x1_g1_ffma_t1r5s5_aligna4_alignc4 Tactic: 0xe35d4a4a3b499fe7 Time: 0.00998902
[07/07/2026-01:46:40] [TRT] [V] Tactic Name: sm80_xmma_fprop_implicit_gemm_indexed_f32f32_f32f32_f32_nhwckrsc_nhwc_tilesize32x32x8_stage3_warpsize1x2x1_g1_ffma_aligna4_alignc4 Tactic: 0x0a143be7a52f301a Time: 0.0115288
[07/07/2026-01:46:40] [TRT] [V] Tactic Name: sm80_xmma_fprop_implicit_gemm_f32f32_f32f32_f32_nhwckrsc_nhwc_tilesize64x32x32_stage3_warpsize1x1x1_g1_ffma_aligna4_alignc4 Tactic: 0x50e74ef194ce86c3 Time: 0.147186
[07/07/2026-01:46:40] [TRT] [V] Tactic Name: sm80_xmma_fprop_implicit_gemm_f32f32_f32f32_f32_nhwckrsc_nhwc_tilesize64x16x16_stage3_warpsize1x1x1_g1_ffma_t1r5s5_aligna4_alignc4 Tactic: 0x93c5425f25c3f9fd Time: 0.0242255
[07/07/2026-01:46:40] [TRT] [V] Tactic Name: sm80_xmma_fprop_implicit_gemm_f32f32_f32f32_f32_nhwckrsc_nhwc_tilesize64x64x8_stage3_warpsize1x4x1_g1_ffma_aligna4_alignc4 Tactic: 0x62835fce994f06dd Time: 0.013763
[07/07/2026-01:46:40] [TRT] [V] Tactic Name: sm70_xmma_fprop_implicit_gemm_f32f32_f32f32_f32_nhwckrsc_nhwc_tilesize64x64x8_stage1_warpsize1x4x1_g1_ffma_aligna4_alignc4 Tactic: 0x2595402367cdee5c Time: 0.0148916
[07/07/2026-01:46:40] [TRT] [V] Tactic Name: sm80_xmma_fprop_implicit_gemm_f32f32_f32f32_f32_nhwckrsc_nhwc_tilesize256x64x8_stage3_warpsize2x2x1_g1_ffma_aligna4_alignc4 Tactic: 0x8014228ec08b4d49 Time: 0.0408889
[07/07/2026-01:46:40] [TRT] [V] Tactic Name: sm70_xmma_fprop_implicit_gemm_indexed_f32f32_f32f32_f32_nhwckrsc_nhwc_tilesize128x16x8_stage1_warpsize4x1x1_g1_ffma_aligna4_alignc4 Tactic: 0x6aaac747558eb868 Time: 0.0146871
[07/07/2026-01:46:40] [TRT] [V] Tactic Name: sm70_xmma_fprop_implicit_gemm_f32f32_f32f32_f32_nhwckrsc_nhwc_tilesize128x16x8_stage1_warpsize4x1x1_g1_ffma_t1r5s5_aligna4_alignc4 Tactic: 0x54e3b8c9b1e5f17a Time: 0.012589
[07/07/2026-01:46:40] [TRT] [V] Tactic Name: sm70_xmma_fprop_implicit_gemm_f32f32_f32f32_f32_nhwckrsc_nhwc_tilesize128x16x8_stage1_warpsize4x1x1_g1_ffma_aligna4_alignc4 Tactic: 0x19799dabb3912d89 Time: 0.0149486
[07/07/2026-01:46:40] [TRT] [V] Tactic Name: sm80_xmma_fprop_implicit_gemm_indexed_f32f32_f32f32_f32_nhwckrsc_nhwc_tilesize64x64x8_stage3_warpsize1x4x1_g1_ffma_aligna4_alignc4 Tactic: 0x19b688348f983aa0 Time: 0.0154545
[07/07/2026-01:46:40] [TRT] [V] Tactic Name: sm80_xmma_fprop_implicit_gemm_f32f32_f32f32_f32_nhwckrsc_nhwc_tilesize128x16x8_stage3_warpsize4x1x1_g1_ffma_aligna4_alignc4 Tactic: 0x92ed3100c35fc43e Time: 0.0117712
[07/07/2026-01:46:40] [TRT] [V] Tactic Name: sm70_xmma_fprop_implicit_gemm_f32f32_f32f32_f32_nhwckrsc_nhwc_tilesize64x128x8_stage1_warpsize1x4x1_g1_ffma_aligna4_alignc4 Tactic: 0xde4165142218dab8 Time: 0.0204317
[07/07/2026-01:46:40] [TRT] [V] Tactic Name: sm80_xmma_fprop_implicit_gemm_f32f32_f32f32_f32_nhwckrsc_nhwc_tilesize32x32x8_stage3_warpsize1x2x1_g1_ffma_aligna4_alignc4 Tactic: 0x7121ec1db3f80c67 Time: 0.00977036
[07/07/2026-01:46:40] [TRT] [V] Tactic Name: sm80_xmma_fprop_implicit_gemm_f32f32_f32f32_f32_nhwckrsc_nhwc_tilesize64x64x8_stage3_warpsize1x4x1_g1_ffma_t1r5s5_aligna4_alignc4 Tactic: 0x45ff0c3a09b02e78 Time: 0.0133013
[07/07/2026-01:46:40] [TRT] [V] Tactic Name: sm80_xmma_fprop_implicit_gemm_f32f32_f32f32_f32_nhwckrsc_nhwc_tilesize64x16x16_stage3_warpsize1x1x1_g1_ffma_aligna4_alignc4 Tactic: 0xb404e79e2d524151 Time: 0.0241539
[07/07/2026-01:46:40] [TRT] [V] Tactic Name: sm70_xmma_fprop_implicit_gemm_f32f32_f32f32_f32_nhwckrsc_nhwc_tilesize64x32x32_stage1_warpsize1x1x1_g1_ffma_aligna4_alignc4 Tactic: 0xdb73e25ae4006f74 Time: 0.155268
[07/07/2026-01:46:40] [TRT] [V] Tactic Name: sm70_xmma_fprop_implicit_gemm_f32f32_f32f32_f32_nhwckrsc_nhwc_tilesize64x16x16_stage1_warpsize1x1x1_g1_ffma_aligna4_alignc4 Tactic: 0x3f904b355d9ca8e6 Time: 0.0282782
[07/07/2026-01:46:40] [TRT] [V] Tactic Name: sm70_xmma_fprop_implicit_gemm_f32f32_f32f32_f32_nhwckrsc_nhwc_tilesize128x64x8_stage1_warpsize2x2x1_g1_ffma_aligna4_alignc4 Tactic: 0x963db12d24e61b80 Time: 0.0205948
[07/07/2026-01:46:40] [TRT] [V] Tactic Name: sm70_xmma_fprop_implicit_gemm_f32f32_f32f32_f32_nhwckrsc_nhwc_tilesize32x32x8_stage1_warpsize1x2x1_g1_ffma_t1r5s5_aligna4_alignc4 Tactic: 0xad9ed5f51d32aa29 Time: 0.012589
[07/07/2026-01:46:40] [TRT] [V] Tactic Name: sm70_xmma_fprop_implicit_gemm_f32f32_f32f32_f32_nhwckrsc_nhwc_tilesize64x32x32_stage1_warpsize1x1x1_g1_ffma_t1r5s5_aligna4_alignc4 Tactic: 0x737793996edbf8e2 Time: 0.145461
[07/07/2026-01:46:40] [TRT] [V] Tactic Name: sm70_xmma_fprop_implicit_gemm_f32f32_f32f32_f32_nhwckrsc_nhwc_tilesize32x32x8_stage1_warpsize1x2x1_g1_ffma_aligna4_alignc4 Tactic: 0x3637f3f04d7ae4e6 Time: 0.0124788
[07/07/2026-01:46:40] [TRT] [V] Tactic Name: sm70_xmma_fprop_implicit_gemm_f32f32_f32f32_f32_nhwckrsc_nhwc_tilesize256x128x8_stage1_warpsize2x4x1_g1_ffma_aligna4_alignc4 Tactic: 0x0447933cc2be855a Time: 0.0540891
[07/07/2026-01:46:40] [TRT] [V] Tactic Name: sm80_xmma_fprop_implicit_gemm_f32f32_f32f32_f32_nhwckrsc_nhwc_tilesize32x32x8_stage3_warpsize1x2x1_g1_ffma_t1r5s5_aligna4_alignc4 Tactic: 0x880b696bd0160609 Time: 0.00913672
[07/07/2026-01:46:40] [TRT] [V] Tactic Name: sm80_xmma_fprop_implicit_gemm_indexed_f32f32_f32f32_f32_nhwckrsc_nhwc_tilesize128x32x8_stage3_warpsize2x2x1_g1_ffma_aligna4_alignc4 Tactic: 0xa6448a1e79f1ca6f Time: 0.017096
[07/07/2026-01:46:40] [TRT] [V] Tactic Name: sm80_xmma_fprop_implicit_gemm_indexed_wo_smem_f32f32_tf32f32_f32_nhwckrsc_nhwc_tilesize128x16x32_stage1_warpsize4x1x1_g1_tensor16x8x8_aligna4_alignc4 Tactic: 0xcf8ea142095f02d2 Time: 0.0119714
[07/07/2026-01:46:40] [TRT] [V] Tactic Name: sm80_xmma_fprop_implicit_gemm_indexed_f32f32_f32f32_f32_nhwckrsc_nhwc_tilesize128x16x8_stage3_warpsize4x1x1_g1_ffma_aligna4_alignc4 Tactic: 0x4fd3c46622e98342 Time: 0.0133995
[07/07/2026-01:46:40] [TRT] [V] Tactic Name: sm70_xmma_fprop_implicit_gemm_f32f32_f32f32_f32_nhwckrsc_nhwc_tilesize64x16x16_stage1_warpsize1x1x1_g1_ffma_t1r5s5_aligna4_alignc4 Tactic: 0x247bb0dcaf6f9760 Time: 0.0274289
[07/07/2026-01:46:40] [TRT] [V] Tactic Name: sm80_xmma_fprop_implicit_gemm_indexed_wo_smem_f32f32_tf32f32_f32_nhwckrsc_nhwc_tilesize128x32x16_stage1_warpsize4x1x1_g1_tensor16x8x8_aligna4_alignc4 Tactic: 0xf231cca3335919a4 Time: 0.011552
[07/07/2026-01:46:40] [TRT] [V] Tactic Name: sm70_xmma_fprop_implicit_gemm_indexed_f32f32_f32f32_f32_nhwckrsc_nhwc_tilesize128x32x8_stage1_warpsize2x2x1_g1_ffma_aligna4_alignc4 Tactic: 0x833d893f0e96f145 Time: 0.0176135
[07/07/2026-01:46:40] [TRT] [V] Tactic Name: sm70_xmma_fprop_implicit_gemm_indexed_f32f32_f32f32_f32_nhwckrsc_nhwc_tilesize32x32x8_stage1_warpsize1x2x1_g1_ffma_aligna4_alignc4 Tactic: 0x5f60af66e8eb9b51 Time: 0.0143627
[07/07/2026-01:46:40] [TRT] [V] Tactic Name: sm80_xmma_fprop_implicit_gemm_f32f32_f32f32_f32_nhwckrsc_nhwc_tilesize128x64x8_stage3_warpsize2x2x1_g1_ffma_aligna4_alignc4 Tactic: 0x1da91d865428f237 Time: 0.020962
[07/07/2026-01:46:40] [TRT] [V] Tactic Name: sm80_xmma_fprop_implicit_gemm_f32f32_f32f32_f32_nhwckrsc_nhwc_tilesize64x32x32_stage3_warpsize1x1x1_g1_ffma_t1r5s5_aligna4_alignc4 Tactic: 0xc4c9611ae477967f Time: 0.139648
[07/07/2026-01:46:40] [TRT] [V] node_conv2d + node_relu (CaskConvolution[0x80000009]) profiling completed in 0.116987 seconds. Fastest Tactic: 0x880b696bd0160609 Time: 0.00913672
[07/07/2026-01:46:40] [TRT] [V] Skipping CaskFlattenConvolution: No valid tactics for node_conv2d + node_relu
[07/07/2026-01:46:40] [TRT] [V] >>>>>>>>>>>>>>> Chose Runner Type: CaskConvolution Tactic: 0x880b696bd0160609
[07/07/2026-01:46:40] [TRT] [V] *************** Autotuning format combination: Float(784,1:4,28,1) -> Float(25088,784,28,1) ***************
[07/07/2026-01:46:40] [TRT] [V] --------------- Timing Runner: node_conv2d + node_relu (CaskConvolution[0x80000009])
[07/07/2026-01:46:40] [TRT] [V] Tactic Name: sm80_xmma_fprop_implicit_gemm_indexed_f32f32_tf32f32_f32_nhwckrsc_nchw_tilesize128x256x32_stage3_warpsize2x4x1_g1_tensor16x8x8_alignc4 Tactic: 0xbf7080aca6804022 Time: 0.0475093
[07/07/2026-01:46:40] [TRT] [V] Tactic Name: sm80_xmma_fprop_implicit_gemm_indexed_f32f32_tf32f32_f32_nhwckrsc_nchw_tilesize64x32x64_stage5_warpsize2x2x1_g1_tensor16x8x8_alignc4 Tactic: 0x06ac89b47db4fceb Time: 0.0194104
[07/07/2026-01:46:40] [TRT] [V] Tactic Name: sm80_xmma_fprop_implicit_gemm_indexed_f32f32_tf32f32_f32_nhwckrsc_nchw_tilesize128x256x32_stage3_warpsize2x4x1_g1_tensor16x8x8 Tactic: 0xcd6c525a3239bae9 Time: 0.0455627
[07/07/2026-01:46:40] [TRT] [V] Tactic Name: sm80_xmma_fprop_implicit_gemm_f32f32_tf32f32_f32_nhwckrsc_nchw_tilesize128x128x16_stage4_warpsize2x2x1_g1_tensor16x8x8_alignc4 Tactic: 0x9fd9fe001908ce2e Time: 0.0180677
[07/07/2026-01:46:40] [TRT] [V] Tactic Name: sm80_xmma_fprop_implicit_gemm_indexed_f32f32_tf32f32_f32_nhwckrsc_nchw_tilesize64x128x32_stage5_warpsize2x2x1_g1_tensor16x8x8_alignc4 Tactic: 0xe25738550dba0da6 Time: 0.0205208
[07/07/2026-01:46:40] [TRT] [V] Tactic Name: sm80_xmma_fprop_implicit_gemm_indexed_f32f32_tf32f32_f32_nhwckrsc_nchw_tilesize128x64x32_stage5_warpsize2x2x1_g1_tensor16x8x8 Tactic: 0xdd84426cbb67ea98 Time: 0.0199686
[07/07/2026-01:46:40] [TRT] [V] Tactic Name: sm80_xmma_fprop_implicit_gemm_f32f32_tf32f32_f32_nhwckrsc_nchw_tilesize128x256x32_stage3_warpsize2x4x1_g1_tensor16x8x8_alignc4 Tactic: 0xc85ec809053babf4 Time: 0.0450867
[07/07/2026-01:46:40] [TRT] [V] Tactic Name: sm80_xmma_fprop_implicit_gemm_indexed_f32f32_tf32f32_f32_nhwckrsc_nchw_tilesize128x128x16_stage4_warpsize2x2x1_g1_tensor16x8x8_alignc4 Tactic: 0xe8f7b6a5bab325f8 Time: 0.0189849
[07/07/2026-01:46:40] [TRT] [V] Tactic Name: sm80_xmma_fprop_implicit_gemm_indexed_f32f32_tf32f32_f32_nhwckrsc_nchw_tilesize128x64x64_stage3_warpsize2x2x1_g1_tensor16x8x8_alignc4 Tactic: 0xf00aea93dd9c2661 Time: 0.0341547
[07/07/2026-01:46:40] [TRT] [V] Tactic Name: sm80_xmma_fprop_implicit_gemm_indexed_f32f32_tf32f32_f32_nhwckrsc_nchw_tilesize64x32x64_stage5_warpsize2x2x1_g1_tensor16x8x8 Tactic: 0x2a70e740f46257d6 Time: 0.0186584
[07/07/2026-01:46:40] [TRT] [V] Tactic Name: sm80_xmma_fprop_implicit_gemm_f32f32_tf32f32_f32_nhwckrsc_nchw_tilesize64x64x64_stage4_warpsize2x2x1_g1_tensor16x8x8 Tactic: 0x7c012183b88ca724 Time: 0.0214593
[07/07/2026-01:46:40] [TRT] [V] Tactic Name: sm80_xmma_fprop_implicit_gemm_f32f32_tf32f32_f32_nhwckrsc_nchw_tilesize128x64x32_stage5_warpsize2x2x1_g1_tensor16x8x8 Tactic: 0xa95e2a26416587cd Time: 0.0185843
[07/07/2026-01:46:40] [TRT] [V] Tactic Name: sm80_xmma_fprop_implicit_gemm_indexed_f32f32_tf32f32_f32_nhwckrsc_nchw_tilesize64x64x64_stage4_warpsize2x2x1_g1_tensor16x8x8 Tactic: 0xc5dec88c13d30802 Time: 0.0232085
[07/07/2026-01:46:40] [TRT] [V] Tactic Name: sm80_xmma_fprop_implicit_gemm_f32f32_tf32f32_f32_nhwckrsc_nchw_tilesize64x32x64_stage5_warpsize2x2x1_g1_tensor16x8x8_t1r5s5_alignc4 Tactic: 0x2f4d03736e9ddce5 Time: 0.0155612
[07/07/2026-01:46:40] [TRT] [V] Tactic Name: sm80_xmma_fprop_implicit_gemm_f32f32_tf32f32_f32_nhwckrsc_nchw_tilesize64x32x64_stage5_warpsize2x2x1_g1_tensor16x8x8 Tactic: 0x93af0e4f5f3df8f0 Time: 0.0158933
[07/07/2026-01:46:40] [TRT] [V] Tactic Name: sm80_xmma_fprop_implicit_gemm_f32f32_tf32f32_f32_nhwckrsc_nchw_tilesize64x64x64_stage4_warpsize2x2x1_g1_tensor16x8x8_alignc4 Tactic: 0xf9f0e486c78c67b0 Time: 0.021312
[07/07/2026-01:46:40] [TRT] [V] Tactic Name: sm80_xmma_fprop_implicit_gemm_f32f32_tf32f32_f32_nhwckrsc_nchw_tilesize64x128x32_stage5_warpsize2x2x1_g1_tensor16x8x8 Tactic: 0xabbf7eb3b5b99502 Time: 0.0187935
[07/07/2026-01:46:40] [TRT] [V] Tactic Name: sm80_xmma_fprop_implicit_gemm_f32f32_tf32f32_f32_nhwckrsc_nchw_tilesize128x128x16_stage4_warpsize2x2x1_g1_tensor16x8x8 Tactic: 0x3104d85fecdd547c Time: 0.0169547
[07/07/2026-01:46:40] [TRT] [V] Tactic Name: sm80_xmma_fprop_implicit_gemm_f32f32_tf32f32_f32_nhwckrsc_nchw_tilesize256x64x32_stage3_warpsize4x2x1_g1_tensor16x8x8 Tactic: 0x009385d9017d87ea Time: 0.0272123
[07/07/2026-01:46:41] [TRT] [V] Tactic Name: sm80_xmma_fprop_implicit_gemm_f32f32_tf32f32_f32_nhwckrsc_nchw_tilesize256x64x32_stage3_warpsize4x2x1_g1_tensor16x8x8_alignc4 Tactic: 0xdb50068f2f28400e Time: 0.0291858
[07/07/2026-01:46:41] [TRT] [V] Tactic Name: sm80_xmma_fprop_implicit_gemm_f32f32_tf32f32_f32_nhwckrsc_nchw_tilesize128x128x32_stage4_warpsize2x2x1_g1_tensor16x8x8_alignc4 Tactic: 0x018af1a619a2581c Time: 0.0267651
[07/07/2026-01:46:41] [TRT] [V] Tactic Name: sm80_xmma_fprop_implicit_gemm_f32f32_tf32f32_f32_nhwckrsc_nchw_tilesize128x64x32_stage5_warpsize2x2x1_g1_tensor16x8x8_alignc4 Tactic: 0x294c501bad19317c Time: 0.0195721
[07/07/2026-01:46:41] [TRT] [V] Tactic Name: sm80_xmma_fprop_implicit_gemm_f32f32_tf32f32_f32_nhwckrsc_nchw_tilesize64x128x32_stage5_warpsize2x2x1_g1_tensor16x8x8_alignc4 Tactic: 0x8a196054417f1c8a Time: 0.0195656
[07/07/2026-01:46:41] [TRT] [V] Tactic Name: sm80_xmma_fprop_implicit_gemm_indexed_f32f32_tf32f32_f32_nhwckrsc_nchw_tilesize256x64x32_stage3_warpsize4x2x1_g1_tensor16x8x8 Tactic: 0x7449ed93fb7feabf Time: 0.0309789
[07/07/2026-01:46:41] [TRT] [V] Tactic Name: sm80_xmma_fprop_implicit_gemm_indexed_f32f32_tf32f32_f32_nhwckrsc_nchw_tilesize128x128x16_stage4_warpsize2x2x1_g1_tensor16x8x8 Tactic: 0xe0a307ffe0ffb6a5 Time: 0.0171424
[07/07/2026-01:46:41] [TRT] [V] Tactic Name: sm80_xmma_fprop_implicit_gemm_indexed_f32f32_tf32f32_f32_nhwckrsc_nchw_tilesize64x64x64_stage4_warpsize2x2x1_g1_tensor16x8x8_alignc4 Tactic: 0x9746567cb96a1ed8 Time: 0.0227029
[07/07/2026-01:46:41] [TRT] [V] Tactic Name: sm80_xmma_fprop_implicit_gemm_indexed_f32f32_tf32f32_f32_nhwckrsc_nchw_tilesize64x128x32_stage5_warpsize2x2x1_g1_tensor16x8x8 Tactic: 0xdf6516f94fbbf857 Time: 0.0203106
[07/07/2026-01:46:41] [TRT] [V] Tactic Name: sm80_xmma_fprop_implicit_gemm_f32f32_tf32f32_f32_nhwckrsc_nchw_tilesize256x128x32_stage3_warpsize4x2x1_g1_tensor16x8x8 Tactic: 0x62d0fae781700403 Time: 0.039219
[07/07/2026-01:46:41] [TRT] [V] Tactic Name: sm80_xmma_fprop_implicit_gemm_f32f32_tf32f32_f32_nhwckrsc_nchw_tilesize128x256x32_stage3_warpsize2x4x1_g1_tensor16x8x8 Tactic: 0x1ccb8dfa3e1b5830 Time: 0.0411923
[07/07/2026-01:46:41] [TRT] [V] Tactic Name: sm80_xmma_fprop_implicit_gemm_f32f32_tf32f32_f32_nhwckrsc_nchw_tilesize128x128x32_stage4_warpsize2x2x1_g1_tensor16x8x8 Tactic: 0xa0f5a3abd9b9c82a Time: 0.0253928
[07/07/2026-01:46:41] [TRT] [V] Tactic Name: sm80_xmma_fprop_implicit_gemm_f32f32_tf32f32_f32_nhwckrsc_nchw_tilesize128x64x64_stage3_warpsize2x2x1_g1_tensor16x8x8 Tactic: 0x0eef7d6cf0568181 Time: 0.0296302
[07/07/2026-01:46:41] [TRT] [V] Tactic Name: sm80_xmma_fprop_implicit_gemm_f32f32_tf32f32_f32_nhwckrsc_nchw_tilesize64x32x64_stage5_warpsize2x2x1_g1_tensor16x8x8_alignc4 Tactic: 0x681a3b4e03528583 Time: 0.0158172
[07/07/2026-01:46:41] [TRT] [V] node_conv2d + node_relu (CaskConvolution[0x80000009]) profiling completed in 0.102071 seconds. Fastest Tactic: 0x2f4d03736e9ddce5 Time: 0.0155612
[07/07/2026-01:46:41] [TRT] [V] Skipping CaskFlattenConvolution: No valid tactics for node_conv2d + node_relu
[07/07/2026-01:46:41] [TRT] [V] >>>>>>>>>>>>>>> Chose Runner Type: CaskConvolution Tactic: 0x2f4d03736e9ddce5
[07/07/2026-01:46:41] [TRT] [V] *************** Autotuning format combination: Float(784,1:4,28,1) -> Float(6272,1:4,224,8) ***************
[07/07/2026-01:46:41] [TRT] [V] --------------- Timing Runner: node_conv2d + node_relu (CaskConvolution[0x80000009])
[07/07/2026-01:46:41] [TRT] [V] Tactic Name: sm80_xmma_fprop_implicit_gemm_indexed_wo_smem_f32f32_tf32f32_f32_nhwckrsc_nhwc_tilesize128x32x16_stage1_warpsize4x1x1_g1_tensor16x8x8_alignc8 Tactic: 0x72a5d05b1bb165ef Time: 0.00976335
[07/07/2026-01:46:41] [TRT] [V] Tactic Name: sm90_xmma_fprop_implicit_gemm_f32f32_tf32f32_f32_nhwckrsc_nhwc_tilesize256x32x32_cgasize1x1x1_warpgroupsize1x1x1_g1 Tactic: 0x33d806e85053ff20 Time: 0.0192438
[07/07/2026-01:46:41] [TRT] [V] Tactic Name: sm90_xmma_fprop_implicit_gemm_f32f32_tf32f32_f32_nhwckrsc_nhwc_tilesize128x128x32_cgasize1x4x1_warpgroupsize1x1x1_g1 Tactic: 0xbc92f010d9d90ee0 Time: 0.0163383
[07/07/2026-01:46:41] [TRT] [V] Tactic Name: sm90_xmma_fprop_implicit_gemm_f32f32_tf32f32_f32_nhwckrsc_nhwc_tilesize128x128x32_cgasize2x1x1_warpgroupsize1x1x1_g1 Tactic: 0x1d1e732c7c13379c Time: 0.0157566
[07/07/2026-01:46:41] [TRT] [V] Tactic Name: sm90_xmma_fprop_implicit_gemm_f32f32_tf32f32_f32_nhwckrsc_nhwc_tilesize64x128x32_cgasize1x2x1_warpgroupsize1x1x1_g1_beta0 Tactic: 0x177029deb90b8927 Time: 0.0142142
[07/07/2026-01:46:41] [TRT] [V] Tactic Name: sm90_xmma_fprop_implicit_gemm_f32f32_tf32f32_f32_nhwckrsc_nhwc_tilesize64x64x32_warpgroupsize1x1x1_g1_beta0 Tactic: 0x5c6579de472c54e3 Time: 0.0107978
[07/07/2026-01:46:41] [TRT] [V] Tactic Name: sm80_xmma_fprop_implicit_gemm_indexed_wo_smem_f32f32_tf32f32_f32_nhwckrsc_nhwc_tilesize128x16x64_stage1_warpsize4x1x1_g1_tensor16x8x8_aligna4_alignc8 Tactic: 0x22cadc265a3b2e32 Time: 0.0111566
[07/07/2026-01:46:41] [TRT] [V] Tactic Name: sm90_xmma_fprop_implicit_gemm_f32f32_tf32f32_f32_nhwckrsc_nhwc_tilesize256x128x32_cgasize1x2x1_warpgroupsize2x1x1_g1 Tactic: 0x5b113e512c92c355 Time: 0.0245257
[07/07/2026-01:46:41] [TRT] [V] Tactic Name: sm90_xmma_fprop_implicit_gemm_f32f32_tf32f32_f32_nhwckrsc_nhwc_tilesize128x256x32_cgasize1x2x1_warpgroupsize2x1x1_g1 Tactic: 0x5d803b4ac8c3f51b Time: 0.0245981
[07/07/2026-01:46:41] [TRT] [V] Tactic Name: sm90_xmma_fprop_implicit_gemm_f32f32_tf32f32_f32_nhwckrsc_nhwc_tilesize64x256x32_cgasize4x1x1_warpgroupsize1x1x1_g1_beta0 Tactic: 0x9a94bd551ee57ba7 Time: 0.0153251
[07/07/2026-01:46:41] [TRT] [V] Tactic Name: sm90_xmma_fprop_implicit_gemm_f32f32_tf32f32_f32_nhwckrsc_nhwc_tilesize128x64x32_cgasize1x2x1_warpgroupsize1x1x1_g1_beta0 Tactic: 0xc633aa9a979e0302 Time: 0.0118014
[07/07/2026-01:46:41] [TRT] [V] Tactic Name: sm90_xmma_fprop_implicit_gemm_f32f32_tf32f32_f32_nhwckrsc_nhwc_tilesize64x256x32_cgasize1x2x1_warpgroupsize1x1x1_g1 Tactic: 0x78045ec8756c962a Time: 0.0204242
[07/07/2026-01:46:41] [TRT] [V] Tactic Name: sm80_xmma_fprop_implicit_gemm_indexed_wo_smem_f32f32_tf32f32_f32_nhwckrsc_nhwc_tilesize128x32x16_stage1_warpsize4x1x1_g1_tensor16x8x8_aligna8 Tactic: 0xdb77237fa21087f5 Time: 0.0107682
[07/07/2026-01:46:41] [TRT] [V] Tactic Name: sm90_xmma_fprop_implicit_gemm_f32f32_tf32f32_f32_nhwckrsc_nhwc_tilesize128x32x32_warpgroupsize1x1x1_g1_beta0 Tactic: 0xe53287547fb919fc Time: 0.0117344
[07/07/2026-01:46:41] [TRT] [V] Tactic Name: sm90_xmma_fprop_implicit_gemm_f32f32_tf32f32_f32_nhwckrsc_nhwc_tilesize64x256x32_warpgroupsize1x1x1_g1_beta0 Tactic: 0xdb682b361ae4af71 Time: 0.0207536
[07/07/2026-01:46:41] [TRT] [V] Tactic Name: sm90_xmma_fprop_implicit_gemm_f32f32_tf32f32_f32_nhwckrsc_nhwc_tilesize256x64x32_cgasize4x1x1_warpgroupsize1x1x1_g1_beta0 Tactic: 0x363abbacca769f74 Time: 0.0195016
[07/07/2026-01:46:41] [TRT] [V] Tactic Name: sm90_xmma_fprop_implicit_gemm_f32f32_tf32f32_f32_nhwckrsc_nhwc_tilesize256x64x32_cgasize2x2x1_warpgroupsize1x1x1_g1_beta0 Tactic: 0xb1a07507801bc969 Time: 0.0170331
[07/07/2026-01:46:41] [TRT] [V] Tactic Name: sm80_xmma_fprop_implicit_gemm_indexed_wo_smem_f32f32_tf32f32_f32_nhwckrsc_nhwc_tilesize128x32x64_stage1_warpsize4x1x1_g1_tensor16x8x8_alignc4 Tactic: 0xb6f6563c77d057d7 Time: 0.00924137
[07/07/2026-01:46:41] [TRT] [V] Tactic Name: sm90_xmma_fprop_implicit_gemm_f32f32_tf32f32_f32_nhwckrsc_nhwc_tilesize128x64x32_cgasize2x1x1_warpgroupsize1x1x1_g1_beta0 Tactic: 0x22b401709a2c0fd7 Time: 0.0138091
[07/07/2026-01:46:41] [TRT] [V] Tactic Name: sm90_xmma_fprop_implicit_gemm_f32f32_tf32f32_f32_nhwckrsc_nhwc_tilesize128x64x32_cgasize2x4x1_warpgroupsize1x1x1_g1 Tactic: 0xa06af1d986b8550f Time: 0.0126072
[07/07/2026-01:46:41] [TRT] [V] Tactic Name: sm90_xmma_fprop_implicit_gemm_f32f32_tf32f32_f32_nhwckrsc_nhwc_tilesize64x32x32_warpgroupsize1x1x1_g1_beta0 Tactic: 0xed9769b790bb0d36 Time: 0.0109075
[07/07/2026-01:46:41] [TRT] [V] Tactic Name: sm90_xmma_fprop_implicit_gemm_f32f32_tf32f32_f32_nhwckrsc_nhwc_tilesize256x32x32_warpgroupsize1x1x1_g1 Tactic: 0x17d2c600f961b7b5 Time: 0.0159253
[07/07/2026-01:46:41] [TRT] [V] Tactic Name: sm90_xmma_fprop_implicit_gemm_f32f32_tf32f32_f32_nhwckrsc_nhwc_tilesize64x32x32_cgasize1x1x1_warpgroupsize1x1x1_g1 Tactic: 0x8f0ed36578f14aff Time: 0.0100618
[07/07/2026-01:46:41] [TRT] [V] Tactic Name: sm90_xmma_fprop_implicit_gemm_f32f32_tf32f32_f32_nhwckrsc_nhwc_tilesize64x128x32_cgasize4x1x1_warpgroupsize1x1x1_g1 Tactic: 0xedfaa33369f9d91e Time: 0.0110816
[07/07/2026-01:46:41] [TRT] [V] Tactic Name: sm80_xmma_fprop_implicit_gemm_indexed_wo_smem_f32f32_tf32f32_f32_nhwckrsc_nhwc_tilesize128x32x64_stage1_warpsize4x1x1_g1_tensor16x8x8 Tactic: 0xb33296dda7141c64 Time: 0.0105807
[07/07/2026-01:46:41] [TRT] [V] Tactic Name: sm80_xmma_fprop_implicit_gemm_indexed_wo_smem_f32f32_tf32f32_f32_nhwckrsc_nhwc_tilesize128x16x64_stage1_warpsize4x1x1_g1_tensor16x8x8_aligna8_alignc4 Tactic: 0xab0496509b88ebe0 Time: 0.00998494
[07/07/2026-01:46:41] [TRT] [V] Tactic Name: sm80_xmma_fprop_implicit_gemm_indexed_wo_smem_f32f32_tf32f32_f32_nhwckrsc_nhwc_tilesize128x16x32_stage1_warpsize4x1x1_g1_tensor16x8x8_alignc8 Tactic: 0x96467934a22da27d Time: 0.0105217
[07/07/2026-01:46:41] [TRT] [V] Tactic Name: sm80_xmma_fprop_implicit_gemm_indexed_wo_smem_f32f32_tf32f32_f32_nhwckrsc_nhwc_tilesize128x16x64_stage1_warpsize4x1x1_g1_tensor16x8x8 Tactic: 0x10383a0781d24dde Time: 0.0120773
[07/07/2026-01:46:41] [TRT] [V] Tactic Name: sm80_xmma_fprop_implicit_gemm_indexed_f32f32_tf32f32_f32_nhwckrsc_nhwc_tilesize256x64x32_stage3_warpsize4x2x1_g1_tensor16x8x8 Tactic: 0xba0185279ccb2b85 Time: 0.0309595
[07/07/2026-01:46:41] [TRT] [V] Tactic Name: sm80_xmma_fprop_implicit_gemm_f32f32_tf32f32_f32_nhwckrsc_nhwc_tilesize64x64x64_stage4_warpsize2x2x1_g1_tensor16x8x8 Tactic: 0x818413b69874bb35 Time: 0.0205427
[07/07/2026-01:46:41] [TRT] [V] Tactic Name: sm80_xmma_fprop_implicit_gemm_f32f32_tf32f32_f32_nhwckrsc_nhwc_tilesize128x64x64_stage3_warpsize2x2x1_g1_tensor16x8x8 Tactic: 0xc0a715d897e240bb Time: 0.0298356
[07/07/2026-01:46:41] [TRT] [V] Tactic Name: sm90_xmma_fprop_implicit_gemm_f32f32_tf32f32_f32_nhwckrsc_nhwc_tilesize256x128x32_cgasize1x2x1_warpgroupsize2x1x1_g1_beta0 Tactic: 0x04b42c3c19547164 Time: 0.0239992
[07/07/2026-01:46:41] [TRT] [V] Tactic Name: sm80_xmma_fprop_implicit_gemm_f32f32_tf32f32_f32_nhwckrsc_nhwc_tilesize256x128x32_stage3_warpsize4x2x1_g1_tensor16x8x8_t1r5s5 Tactic: 0x2c48dee9745d6bd1 Time: 0.0375858
[07/07/2026-01:46:41] [TRT] [V] Tactic Name: sm80_xmma_fprop_implicit_gemm_f32f32_tf32f32_f32_nhwckrsc_nhwc_tilesize64x32x64_stage5_warpsize2x2x1_g1_tensor16x8x8 Tactic: 0x6e2a3c7a7fc5e4e1 Time: 0.0153998
[07/07/2026-01:46:41] [TRT] [V] Tactic Name: sm80_xmma_fprop_implicit_gemm_indexed_wo_smem_f32f32_tf32f32_f32_nhwckrsc_nhwc_tilesize128x16x32_stage1_warpsize4x1x1_g1_tensor16x8x8_alignc4 Tactic: 0x1a373db9a2bc4028 Time: 0.010358
[07/07/2026-01:46:41] [TRT] [V] Tactic Name: sm90_xmma_fprop_implicit_gemm_f32f32_tf32f32_f32_nhwckrsc_nhwc_tilesize128x256x32_warpgroupsize2x1x1_g1 Tactic: 0x95e84b9b8e64ec67 Time: 0.0246994
[07/07/2026-01:46:41] [TRT] [V] Tactic Name: sm90_xmma_fprop_implicit_gemm_f32f32_tf32f32_f32_nhwckrsc_nhwc_tilesize64x64x32_warpgroupsize1x1x1_g1 Tactic: 0xdc815d089b01c0ae Time: 0.0109757
[07/07/2026-01:46:41] [TRT] [V] Tactic Name: sm90_xmma_fprop_implicit_gemm_f32f32_tf32f32_f32_nhwckrsc_nhwc_tilesize256x128x32_warpgroupsize2x1x1_g1 Tactic: 0xcf5a65ab42d47ed5 Time: 0.0245059
[07/07/2026-01:46:41] [TRT] [V] Tactic Name: sm80_xmma_fprop_implicit_gemm_f32f32_tf32f32_f32_nhwckrsc_nhwc_tilesize256x64x32_stage3_warpsize4x2x1_g1_tensor16x8x8 Tactic: 0xcedbed6d66c946d0 Time: 0.0275594
[07/07/2026-01:46:41] [TRT] [V] Tactic Name: sm90_xmma_fprop_implicit_gemm_f32f32_tf32f32_f32_nhwckrsc_nhwc_tilesize64x256x32_warpgroupsize1x1x1_g1 Tactic: 0x90215bb6906d8ed6 Time: 0.0208427
[07/07/2026-01:46:41] [TRT] [V] Tactic Name: sm90_xmma_fprop_implicit_gemm_f32f32_tf32f32_f32_nhwckrsc_nhwc_tilesize64x32x32_warpgroupsize1x1x1_g1 Tactic: 0xc84d24ba7e6e78d9 Time: 0.0110954
[07/07/2026-01:46:41] [TRT] [V] Tactic Name: sm90_xmma_fprop_implicit_gemm_f32f32_tf32f32_f32_nhwckrsc_nhwc_tilesize256x64x32_cgasize2x1x1_warpgroupsize1x1x1_g1 Tactic: 0x1d6a7ff3461993b4 Time: 0.0205133
[07/07/2026-01:46:41] [TRT] [V] Tactic Name: sm90_xmma_fprop_implicit_gemm_f32f32_tf32f32_f32_nhwckrsc_nhwc_tilesize128x32x32_cgasize1x1x1_warpgroupsize1x1x1_g1_beta0 Tactic: 0x78cdb5e036f649ab Time: 0.0128537
[07/07/2026-01:46:41] [TRT] [V] Tactic Name: sm90_xmma_fprop_implicit_gemm_f32f32_tf32f32_f32_nhwckrsc_nhwc_tilesize128x64x32_cgasize1x2x1_warpgroupsize1x1x1_g1 Tactic: 0x6d76bdefa294938e Time: 0.012069
[07/07/2026-01:46:41] [TRT] [V] Tactic Name: sm80_xmma_fprop_implicit_gemm_f32f32_tf32f32_f32_nhwckrsc_nhwc_tilesize64x64x64_stage4_warpsize2x2x1_g1_tensor16x8x8_t1r5s5 Tactic: 0x20ec60dfb4198123 Time: 0.0199554
[07/07/2026-01:46:41] [TRT] [V] Tactic Name: sm80_xmma_fprop_implicit_gemm_indexed_f32f32_tf32f32_f32_nhwckrsc_nhwc_tilesize128x128x32_stage4_warpsize2x2x1_g1_tensor16x8x8 Tactic: 0xf4156675c5f728d4 Time: 0.0290107
[07/07/2026-01:46:41] [TRT] [V] Tactic Name: sm90_xmma_fprop_implicit_gemm_f32f32_tf32f32_f32_nhwckrsc_nhwc_tilesize256x64x32_warpgroupsize1x1x1_g1_beta0 Tactic: 0x4bed7aca02774cae Time: 0.0172608
[07/07/2026-01:46:41] [TRT] [V] Tactic Name: sm80_xmma_fprop_implicit_gemm_f32f32_tf32f32_f32_nhwckrsc_nhwc_tilesize64x32x64_stage5_warpsize2x2x1_g1_tensor16x8x8_t1r5s5 Tactic: 0x6af69a7346d256e4 Time: 0.016031
[07/07/2026-01:46:41] [TRT] [V] Tactic Name: sm80_xmma_fprop_implicit_gemm_indexed_wo_smem_f32f32_tf32f32_f32_nhwckrsc_nhwc_tilesize128x16x64_stage1_warpsize4x1x1_g1_tensor16x8x8_aligna8 Tactic: 0xe9e5475c77d60638 Time: 0.00976762
[07/07/2026-01:46:41] [TRT] [V] Tactic Name: sm90_xmma_fprop_implicit_gemm_f32f32_tf32f32_f32_nhwckrsc_nhwc_tilesize64x128x32_cgasize1x4x1_warpgroupsize1x1x1_g1 Tactic: 0x640d844983f19294 Time: 0.0179975
[07/07/2026-01:46:41] [TRT] [V] Tactic Name: sm90_xmma_fprop_implicit_gemm_f32f32_tf32f32_f32_nhwckrsc_nhwc_tilesize64x64x32_cgasize1x2x1_warpgroupsize1x1x1_g1_beta0 Tactic: 0x50a13a79588bafcf Time: 0.011296
[07/07/2026-01:46:41] [TRT] [V] Tactic Name: sm90_xmma_fprop_implicit_gemm_f32f32_tf32f32_f32_nhwckrsc_nhwc_tilesize128x128x32_cgasize4x1x1_warpgroupsize1x1x1_g1 Tactic: 0x3565d76a33d1456a Time: 0.0155544
[07/07/2026-01:46:41] [TRT] [V] Tactic Name: sm80_xmma_fprop_implicit_gemm_indexed_wo_smem_f32f32_tf32f32_f32_nhwckrsc_nhwc_tilesize128x32x16_stage1_warpsize4x1x1_g1_tensor16x8x8_aligna4 Tactic: 0x570667f2a28165a0 Time: 0.0109691
[07/07/2026-01:46:41] [TRT] [V] Tactic Name: sm90_xmma_fprop_implicit_gemm_f32f32_tf32f32_f32_nhwckrsc_nhwc_tilesize128x128x32_cgasize2x2x1_warpgroupsize1x1x1_g1 Tactic: 0x718ebc26fdf5c861 Time: 0.0155593
[07/07/2026-01:46:41] [TRT] [V] Tactic Name: sm90_xmma_fprop_implicit_gemm_f32f32_tf32f32_f32_nhwckrsc_nhwc_tilesize64x256x32_cgasize2x1x1_warpgroupsize1x1x1_g1_beta0 Tactic: 0xd882fb2b6470e8d7 Time: 0.0151142
[07/07/2026-01:46:41] [TRT] [V] Tactic Name: sm90_xmma_fprop_implicit_gemm_f32f32_tf32f32_f32_nhwckrsc_nhwc_tilesize256x32x32_warpgroupsize1x1x1_g1_beta0 Tactic: 0xfa1f6aa3d5e0157b Time: 0.0157421
[07/07/2026-01:46:41] [TRT] [V] Tactic Name: sm80_xmma_fprop_implicit_gemm_f32f32_tf32f32_f32_nhwckrsc_nhwc_tilesize64x128x32_stage5_warpsize2x2x1_g1_tensor16x8x8 Tactic: 0x65f71607d20d5438 Time: 0.0181726
[07/07/2026-01:46:41] [TRT] [V] Tactic Name: sm90_xmma_fprop_implicit_gemm_f32f32_tf32f32_f32_nhwckrsc_nhwc_tilesize64x128x32_cgasize4x1x1_warpgroupsize1x1x1_g1_beta0 Tactic: 0xb1e1c44ace2c1682 Time: 0.0109062
[07/07/2026-01:46:41] [TRT] [V] Tactic Name: sm90_xmma_fprop_implicit_gemm_f32f32_tf32f32_f32_nhwckrsc_nhwc_tilesize64x32x32_cgasize1x1x1_warpgroupsize1x1x1_g1_beta0 Tactic: 0xee5f2503f9e3e566 Time: 0.00980706
[07/07/2026-01:46:41] [TRT] [V] Tactic Name: sm90_xmma_fprop_implicit_gemm_f32f32_tf32f32_f32_nhwckrsc_nhwc_tilesize64x128x32_warpgroupsize1x1x1_g1 Tactic: 0x216ec6a556e02739 Time: 0.0140724
[07/07/2026-01:46:41] [TRT] [V] Tactic Name: sm90_xmma_fprop_implicit_gemm_f32f32_tf32f32_f32_nhwckrsc_nhwc_tilesize128x64x32_cgasize1x4x1_warpgroupsize1x1x1_g1_beta0 Tactic: 0xdff2141b5961975d Time: 0.0127775
[07/07/2026-01:46:41] [TRT] [V] Tactic Name: sm80_xmma_fprop_implicit_gemm_indexed_wo_smem_f32f32_tf32f32_f32_nhwckrsc_nhwc_tilesize128x16x32_stage1_warpsize4x1x1_g1_tensor16x8x8_aligna4 Tactic: 0xb3e5ce9d1b1da232 Time: 0.0118029
[07/07/2026-01:46:41] [TRT] [V] Tactic Name: sm80_xmma_fprop_implicit_gemm_f32f32_tf32f32_f32_nhwckrsc_nhwc_tilesize256x64x32_stage3_warpsize4x2x1_g1_tensor16x8x8_t1r5s5 Tactic: 0xa4ccdf6a03ea9ede Time: 0.0259783
[07/07/2026-01:46:41] [TRT] [V] Tactic Name: sm90_xmma_fprop_implicit_gemm_f32f32_tf32f32_f32_nhwckrsc_nhwc_tilesize128x64x32_cgasize2x4x1_warpgroupsize1x1x1_g1_beta0 Tactic: 0xfef93724642b5ee5 Time: 0.0123872
[07/07/2026-01:46:41] [TRT] [V] Tactic Name: sm80_xmma_fprop_implicit_gemm_indexed_wo_smem_f32f32_tf32f32_f32_nhwckrsc_nhwc_tilesize128x32x16_stage1_warpsize4x1x1_g1_tensor16x8x8_alignc4 Tactic: 0xfed494d61b2087ba Time: 0.0100248
[07/07/2026-01:46:41] [TRT] [V] Tactic Name: sm90_xmma_fprop_implicit_gemm_f32f32_tf32f32_f32_nhwckrsc_nhwc_tilesize64x128x32_cgasize4x2x1_warpgroupsize1x1x1_g1 Tactic: 0x816a6c39e81f26e3 Time: 0.0117341
[07/07/2026-01:46:41] [TRT] [V] Tactic Name: sm90_xmma_fprop_implicit_gemm_f32f32_tf32f32_f32_nhwckrsc_nhwc_tilesize64x256x32_cgasize2x2x1_warpgroupsize1x1x1_g1 Tactic: 0x6c398ceb528daf51 Time: 0.0207002
[07/07/2026-01:46:41] [TRT] [V] Tactic Name: sm90_xmma_fprop_implicit_gemm_f32f32_tf32f32_f32_nhwckrsc_nhwc_tilesize256x128x32_cgasize2x1x1_warpgroupsize2x1x1_g1_beta0 Tactic: 0xe03387d614e67db1 Time: 0.0242842
[07/07/2026-01:46:41] [TRT] [V] Tactic Name: sm90_xmma_fprop_implicit_gemm_f32f32_tf32f32_f32_nhwckrsc_nhwc_tilesize128x128x32_cgasize2x1x1_warpgroupsize1x1x1_g1_beta0 Tactic: 0x61e464c86804a587 Time: 0.0154385
[07/07/2026-01:46:41] [TRT] [V] Tactic Name: sm90_xmma_fprop_implicit_gemm_f32f32_tf32f32_f32_nhwckrsc_nhwc_tilesize128x32x32_warpgroupsize1x1x1_g1 Tactic: 0x08bffcb6c82323f3 Time: 0.0117311
[07/07/2026-01:46:41] [TRT] [V] Tactic Name: sm90_xmma_fprop_implicit_gemm_f32f32_tf32f32_f32_nhwckrsc_nhwc_tilesize256x64x32_cgasize1x4x1_warpgroupsize1x1x1_g1 Tactic: 0xbce6fccfe3d3aac8 Time: 0.0167413
[07/07/2026-01:46:41] [TRT] [V] Tactic Name: sm90_xmma_fprop_implicit_gemm_f32f32_tf32f32_f32_nhwckrsc_nhwc_tilesize64x256x32_cgasize4x1x1_warpgroupsize1x1x1_g1 Tactic: 0x28d2e7a79ca9225a Time: 0.0155355
[07/07/2026-01:46:41] [TRT] [V] Tactic Name: sm90_xmma_fprop_implicit_gemm_f32f32_tf32f32_f32_nhwckrsc_nhwc_tilesize128x128x32_cgasize4x1x1_warpgroupsize1x1x1_g1_beta0 Tactic: 0x23f222b6129136f7 Time: 0.0150655
[07/07/2026-01:46:41] [TRT] [V] Tactic Name: sm80_xmma_fprop_implicit_gemm_indexed_wo_smem_f32f32_tf32f32_f32_nhwckrsc_nhwc_tilesize128x16x32_stage1_warpsize4x1x1_g1_tensor16x8x8_aligna4_alignc8 Tactic: 0x43ffe5cf09cee087 Time: 0.0118124
[07/07/2026-01:46:41] [TRT] [V] Tactic Name: sm90_xmma_fprop_implicit_gemm_f32f32_tf32f32_f32_nhwckrsc_nhwc_tilesize128x64x32_warpgroupsize1x1x1_g1 Tactic: 0x1c7385042d4c9b84 Time: 0.0125531
[07/07/2026-01:46:41] [TRT] [V] Tactic Name: sm90_xmma_fprop_implicit_gemm_f32f32_tf32f32_f32_nhwckrsc_nhwc_tilesize64x64x32_cgasize4x4x1_warpgroupsize1x1x1_g1_beta0 Tactic: 0x2a7de1b9d1ab6158 Time: 0.0138022
[07/07/2026-01:46:41] [TRT] [V] Tactic Name: sm90_xmma_fprop_implicit_gemm_f32f32_tf32f32_f32_nhwckrsc_nhwc_tilesize64x128x32_cgasize2x1x1_warpgroupsize1x1x1_g1 Tactic: 0xc5810775263babe8 Time: 0.0119585
[07/07/2026-01:46:41] [TRT] [V] Tactic Name: sm90_xmma_fprop_implicit_gemm_f32f32_tf32f32_f32_nhwckrsc_nhwc_tilesize64x256x32_cgasize1x4x1_warpgroupsize1x1x1_g1 Tactic: 0xa125c0dd76a169d0 Time: 0.0263893
[07/07/2026-01:46:41] [TRT] [V] Tactic Name: sm90_xmma_fprop_implicit_gemm_f32f32_tf32f32_f32_nhwckrsc_nhwc_tilesize64x64x32_cgasize4x1x1_warpgroupsize1x1x1_g1 Tactic: 0x89c70e382179549d Time: 0.0098949
[07/07/2026-01:46:41] [TRT] [V] Tactic Name: sm80_xmma_fprop_implicit_gemm_indexed_f32f32_tf32f32_f32_nhwckrsc_nhwc_tilesize128x64x64_stage3_warpsize2x2x1_g1_tensor16x8x8 Tactic: 0xb47d7d926de02dee Time: 0.0348501
[07/07/2026-01:46:41] [TRT] [V] Tactic Name: sm90_xmma_fprop_implicit_gemm_f32f32_tf32f32_f32_nhwckrsc_nhwc_tilesize128x32x32_cgasize1x1x1_warpgroupsize1x1x1_g1 Tactic: 0x3b69d9dd12d9399c Time: 0.0131056
[07/07/2026-01:46:41] [TRT] [V] Tactic Name: sm90_xmma_fprop_implicit_gemm_f32f32_tf32f32_f32_nhwckrsc_nhwc_tilesize64x64x32_cgasize1x2x1_warpgroupsize1x1x1_g1 Tactic: 0xd911b757c8bce0ed Time: 0.0114898
[07/07/2026-01:46:41] [TRT] [V] Tactic Name: sm90_xmma_fprop_implicit_gemm_f32f32_tf32f32_f32_nhwckrsc_nhwc_tilesize128x64x32_cgasize2x1x1_warpgroupsize1x1x1_g1 Tactic: 0x15dba0c604935508 Time: 0.0139591
[07/07/2026-01:46:41] [TRT] [V] Tactic Name: sm90_xmma_fprop_implicit_gemm_f32f32_tf32f32_f32_nhwckrsc_nhwc_tilesize256x64x32_cgasize4x1x1_warpgroupsize1x1x1_g1 Tactic: 0x3511dbb509dbe142 Time: 0.0196838
[07/07/2026-01:46:41] [TRT] [V] Tactic Name: sm90_xmma_fprop_implicit_gemm_f32f32_tf32f32_f32_nhwckrsc_nhwc_tilesize64x256x32_cgasize2x1x1_warpgroupsize1x1x1_g1 Tactic: 0x00a943e1d36b50ac Time: 0.0153057
[07/07/2026-01:46:41] [TRT] [V] Tactic Name: sm90_xmma_fprop_implicit_gemm_f32f32_tf32f32_f32_nhwckrsc_nhwc_tilesize128x128x32_cgasize2x2x1_warpgroupsize1x1x1_g1_beta0 Tactic: 0xa468ec1d58fc60ea Time: 0.0153105
[07/07/2026-01:46:41] [TRT] [V] Tactic Name: sm90_xmma_fprop_implicit_gemm_f32f32_tf32f32_f32_nhwckrsc_nhwc_tilesize256x64x32_cgasize2x2x1_warpgroupsize1x1x1_g1 Tactic: 0x71fab0f9c7ff6c49 Time: 0.0172165
[07/07/2026-01:46:41] [TRT] [V] Tactic Name: sm90_xmma_fprop_implicit_gemm_f32f32_tf32f32_f32_nhwckrsc_nhwc_tilesize128x256x32_cgasize2x1x1_warpgroupsize2x1x1_g1 Tactic: 0x252d26636ec4339d Time: 0.0245478
[07/07/2026-01:46:41] [TRT] [V] Tactic Name: sm90_xmma_fprop_implicit_gemm_f32f32_tf32f32_f32_nhwckrsc_nhwc_tilesize64x256x32_cgasize1x2x1_warpgroupsize1x1x1_g1_beta0 Tactic: 0x3c0550c169c2e402 Time: 0.0202328
[07/07/2026-01:46:41] [TRT] [V] Tactic Name: sm90_xmma_fprop_implicit_gemm_f32f32_tf32f32_f32_nhwckrsc_nhwc_tilesize128x256x32_cgasize2x1x1_warpgroupsize2x1x1_g1_beta0 Tactic: 0x5cfbc1bba095ce09 Time: 0.0241775
[07/07/2026-01:46:41] [TRT] [V] Tactic Name: sm80_xmma_fprop_implicit_gemm_f32f32_tf32f32_f32_nhwckrsc_nhwc_tilesize128x128x16_stage4_warpsize2x2x1_g1_tensor16x8x8_t1r5s5 Tactic: 0x94f2b2320bb3fc74 Time: 0.01552
[07/07/2026-01:46:41] [TRT] [V] Tactic Name: sm80_xmma_fprop_implicit_gemm_indexed_f32f32_tf32f32_f32_nhwckrsc_nhwc_tilesize64x64x64_stage4_warpsize2x2x1_g1_tensor16x8x8 Tactic: 0x385bfab9332b1413 Time: 0.0234233
[07/07/2026-01:46:41] [TRT] [V] Tactic Name: sm90_xmma_fprop_implicit_gemm_f32f32_tf32f32_f32_nhwckrsc_nhwc_tilesize256x64x32_cgasize2x1x1_warpgroupsize1x1x1_g1_beta0 Tactic: 0x742cfdd2b0e30c04 Time: 0.0203714
[07/07/2026-01:46:41] [TRT] [V] Tactic Name: sm90_xmma_fprop_implicit_gemm_f32f32_tf32f32_f32_nhwckrsc_nhwc_tilesize256x64x32_cgasize1x4x1_warpgroupsize1x1x1_g1_beta0 Tactic: 0x896ae8b973ae948e Time: 0.0166683
[07/07/2026-01:46:41] [TRT] [V] Tactic Name: sm90_xmma_fprop_implicit_gemm_f32f32_tf32f32_f32_nhwckrsc_nhwc_tilesize128x128x32_warpgroupsize1x1x1_g1 Tactic: 0xd9bcc753af6ebacd Time: 0.0157338
[07/07/2026-01:46:41] [TRT] [V] Tactic Name: sm90_xmma_fprop_implicit_gemm_f32f32_tf32f32_f32_nhwckrsc_nhwc_tilesize256x64x32_warpgroupsize1x1x1_g1 Tactic: 0x031ebfb21c0e0fc2 Time: 0.0174283
[07/07/2026-01:46:41] [TRT] [V] Tactic Name: sm90_xmma_fprop_implicit_gemm_f32f32_tf32f32_f32_nhwckrsc_nhwc_tilesize64x64x32_cgasize1x4x1_warpgroupsize1x1x1_g1_beta0 Tactic: 0x496084f896743b90 Time: 0.0134114
[07/07/2026-01:46:41] [TRT] [V] Tactic Name: sm80_xmma_fprop_implicit_gemm_indexed_f32f32_tf32f32_f32_nhwckrsc_nhwc_tilesize128x64x32_stage5_warpsize2x2x1_g1_tensor16x8x8 Tactic: 0x13cc2ad8dcd32ba2 Time: 0.0208947
[07/07/2026-01:46:41] [TRT] [V] Tactic Name: sm80_xmma_fprop_implicit_gemm_indexed_wo_smem_f32f32_tf32f32_f32_nhwckrsc_nhwc_tilesize128x32x64_stage1_warpsize4x1x1_g1_tensor16x8x8_aligna8_alignc4 Tactic: 0x93030576a9fb03f9 Time: 0.00920101
[07/07/2026-01:46:41] [TRT] [V] Tactic Name: sm90_xmma_fprop_implicit_gemm_f32f32_tf32f32_f32_nhwckrsc_nhwc_tilesize256x64x32_cgasize1x2x1_warpgroupsize1x1x1_g1 Tactic: 0x65c762dae01e5532 Time: 0.01668
[07/07/2026-01:46:41] [TRT] [V] Tactic Name: sm90_xmma_fprop_implicit_gemm_f32f32_tf32f32_f32_nhwckrsc_nhwc_tilesize128x64x32_cgasize4x1x1_warpgroupsize1x1x1_g1_beta0 Tactic: 0x60a2470ee0b99ca7 Time: 0.0129768
[07/07/2026-01:46:41] [TRT] [V] Tactic Name: sm80_xmma_fprop_implicit_gemm_f32f32_tf32f32_f32_nhwckrsc_nhwc_tilesize128x256x32_stage3_warpsize2x4x1_g1_tensor16x8x8 Tactic: 0x998c97842e775a17 Time: 0.0404492
[07/07/2026-01:46:41] [TRT] [V] Tactic Name: sm90_xmma_fprop_implicit_gemm_f32f32_tf32f32_f32_nhwckrsc_nhwc_tilesize128x64x32_cgasize1x4x1_warpgroupsize1x1x1_g1 Tactic: 0xb45723faa1596c74 Time: 0.0129752
[07/07/2026-01:46:41] [TRT] [V] Tactic Name: sm80_xmma_fprop_implicit_gemm_f32f32_tf32f32_f32_nhwckrsc_nhwc_tilesize256x128x32_stage3_warpsize4x2x1_g1_tensor16x8x8 Tactic: 0xe797e099911c0624 Time: 0.0383976
[07/07/2026-01:46:41] [TRT] [V] Tactic Name: sm80_xmma_fprop_implicit_gemm_indexed_wo_smem_f32f32_tf32f32_f32_nhwckrsc_nhwc_tilesize128x32x16_stage1_warpsize4x1x1_g1_tensor16x8x8_aligna4_alignc8 Tactic: 0x7e40882e33c8fbf1 Time: 0.0110159
[07/07/2026-01:46:41] [TRT] [V] Tactic Name: sm90_xmma_fprop_implicit_gemm_f32f32_tf32f32_f32_nhwckrsc_nhwc_tilesize64x256x32_cgasize2x2x1_warpgroupsize1x1x1_g1_beta0 Tactic: 0x1d0e73fe54882dba Time: 0.0204731
[07/07/2026-01:46:41] [TRT] [V] Tactic Name: sm90_xmma_fprop_implicit_gemm_f32f32_tf32f32_f32_nhwckrsc_nhwc_tilesize64x128x32_cgasize4x2x1_warpgroupsize1x1x1_g1_beta0 Tactic: 0x746d4c9ffed4d3ef Time: 0.0115288
[07/07/2026-01:46:41] [TRT] [V] Tactic Name: sm90_xmma_fprop_implicit_gemm_f32f32_tf32f32_f32_nhwckrsc_nhwc_tilesize128x128x32_cgasize1x2x1_warpgroupsize1x1x1_g1_beta0 Tactic: 0x8563cf2265b6a952 Time: 0.0152402
[07/07/2026-01:46:41] [TRT] [V] Tactic Name: sm90_xmma_fprop_implicit_gemm_f32f32_tf32f32_f32_nhwckrsc_nhwc_tilesize64x64x32_cgasize4x1x1_warpgroupsize1x1x1_g1_beta0 Tactic: 0xf630d7ed2fac306a Time: 0.0097341
[07/07/2026-01:46:41] [TRT] [V] Tactic Name: sm80_xmma_fprop_implicit_gemm_indexed_wo_smem_f32f32_tf32f32_f32_nhwckrsc_nhwc_tilesize128x32x16_stage1_warpsize4x1x1_g1_tensor16x8x8 Tactic: 0x9cb304e2edbc1221 Time: 0.00982776
[07/07/2026-01:46:41] [TRT] [V] Tactic Name: sm90_xmma_fprop_implicit_gemm_f32f32_tf32f32_f32_nhwckrsc_nhwc_tilesize128x128x32_warpgroupsize1x1x1_g1_beta0 Tactic: 0x67db2f3e821052a2 Time: 0.0155336
[07/07/2026-01:46:41] [TRT] [V] Tactic Name: sm90_xmma_fprop_implicit_gemm_f32f32_tf32f32_f32_nhwckrsc_nhwc_tilesize128x256x32_cgasize1x2x1_warpgroupsize2x1x1_g1_beta0 Tactic: 0xb87c6a51ad27c2dc Time: 0.0240244
[07/07/2026-01:46:41] [TRT] [V] Tactic Name: sm90_xmma_fprop_implicit_gemm_f32f32_tf32f32_f32_nhwckrsc_nhwc_tilesize256x128x32_warpgroupsize2x1x1_g1_beta0 Tactic: 0x84b83047ee0da340 Time: 0.0242568
[07/07/2026-01:46:41] [TRT] [V] Tactic Name: sm80_xmma_fprop_implicit_gemm_indexed_wo_smem_f32f32_tf32f32_f32_nhwckrsc_nhwc_tilesize128x32x64_stage1_warpsize4x1x1_g1_tensor16x8x8_aligna4_alignc8 Tactic: 0x1acd4f006848c62b Time: 0.0115822
[07/07/2026-01:46:41] [TRT] [V] Tactic Name: sm80_xmma_fprop_implicit_gemm_indexed_wo_smem_f32f32_tf32f32_f32_nhwckrsc_nhwc_tilesize128x16x32_stage1_warpsize4x1x1_g1_tensor16x8x8 Tactic: 0xae48d3ccfe1edfcd Time: 0.00867255
[07/07/2026-01:46:41] [TRT] [V] Tactic Name: sm90_xmma_fprop_implicit_gemm_f32f32_tf32f32_f32_nhwckrsc_nhwc_tilesize64x128x32_cgasize2x1x1_warpgroupsize1x1x1_g1_beta0 Tactic: 0xf3f78234b4b985f2 Time: 0.0117977
[07/07/2026-01:46:41] [TRT] [V] Tactic Name: sm80_xmma_fprop_implicit_gemm_f32f32_tf32f32_f32_nhwckrsc_nhwc_tilesize128x64x64_stage3_warpsize2x2x1_g1_tensor16x8x8_t1r5s5 Tactic: 0xe60966add848b046 Time: 0.0293991
[07/07/2026-01:46:41] [TRT] [V] Tactic Name: sm90_xmma_fprop_implicit_gemm_f32f32_tf32f32_f32_nhwckrsc_nhwc_tilesize128x64x32_warpgroupsize1x1x1_g1_beta0 Tactic: 0x54c0973da82e4029 Time: 0.0123425
[07/07/2026-01:46:41] [TRT] [V] Tactic Name: sm90_xmma_fprop_implicit_gemm_f32f32_tf32f32_f32_nhwckrsc_nhwc_tilesize64x64x32_cgasize4x4x1_warpgroupsize1x1x1_g1 Tactic: 0x3c765f27a352549a Time: 0.0142138
[07/07/2026-01:46:41] [TRT] [V] Tactic Name: sm80_xmma_fprop_implicit_gemm_f32f32_tf32f32_f32_nhwckrsc_nhwc_tilesize128x256x32_stage3_warpsize2x4x1_g1_tensor16x8x8_t1r5s5 Tactic: 0x6c223b9bb59c4911 Time: 0.0365301
[07/07/2026-01:46:41] [TRT] [V] Tactic Name: sm90_xmma_fprop_implicit_gemm_f32f32_tf32f32_f32_nhwckrsc_nhwc_tilesize128x64x32_cgasize4x1x1_warpgroupsize1x1x1_g1 Tactic: 0x3da004804b5127fe Time: 0.0130921
[07/07/2026-01:46:41] [TRT] [V] Tactic Name: sm90_xmma_fprop_implicit_gemm_f32f32_tf32f32_f32_nhwckrsc_nhwc_tilesize256x128x32_cgasize2x1x1_warpgroupsize2x1x1_g1 Tactic: 0x23bc23788a9505d3 Time: 0.024515
[07/07/2026-01:46:41] [TRT] [V] Tactic Name: sm80_xmma_fprop_implicit_gemm_indexed_f32f32_tf32f32_f32_nhwckrsc_nhwc_tilesize128x256x32_stage3_warpsize2x4x1_g1_tensor16x8x8 Tactic: 0x482b48242255b8ce Time: 0.0444987
[07/07/2026-01:46:41] [TRT] [V] Tactic Name: sm80_xmma_fprop_implicit_gemm_f32f32_tf32f32_f32_nhwckrsc_nhwc_tilesize128x64x32_stage5_warpsize2x2x1_g1_tensor16x8x8 Tactic: 0x6716429226d146f7 Time: 0.0185902
[07/07/2026-01:46:41] [TRT] [V] Tactic Name: sm90_xmma_fprop_implicit_gemm_f32f32_tf32f32_f32_nhwckrsc_nhwc_tilesize64x64x32_cgasize1x4x1_warpgroupsize1x1x1_g1 Tactic: 0x00302942cb711f17 Time: 0.014072
[07/07/2026-01:46:41] [TRT] [V] Tactic Name: sm90_xmma_fprop_implicit_gemm_f32f32_tf32f32_f32_nhwckrsc_nhwc_tilesize128x128x32_cgasize1x4x1_warpgroupsize1x1x1_g1_beta0 Tactic: 0x9ca271a3ab493d0d Time: 0.0158075
[07/07/2026-01:46:41] [TRT] [V] Tactic Name: sm90_xmma_fprop_implicit_gemm_f32f32_tf32f32_f32_nhwckrsc_nhwc_tilesize128x256x32_warpgroupsize2x1x1_g1_beta0 Tactic: 0x63f59fb58a493f10 Time: 0.0245592
[07/07/2026-01:46:41] [TRT] [V] Tactic Name: sm90_xmma_fprop_implicit_gemm_f32f32_tf32f32_f32_nhwckrsc_nhwc_tilesize64x64x32_cgasize2x1x1_warpgroupsize1x1x1_g1_beta0 Tactic: 0xb42691935539a31a Time: 0.0105487
[07/07/2026-01:46:41] [TRT] [V] Tactic Name: sm90_xmma_fprop_implicit_gemm_f32f32_tf32f32_f32_nhwckrsc_nhwc_tilesize64x128x32_warpgroupsize1x1x1_g1_beta0 Tactic: 0xc92c47d10ae5c468 Time: 0.0138526
[07/07/2026-01:46:41] [TRT] [V] Tactic Name: sm90_xmma_fprop_implicit_gemm_f32f32_tf32f32_f32_nhwckrsc_nhwc_tilesize64x64x32_cgasize2x1x1_warpgroupsize1x1x1_g1 Tactic: 0xa1bcaa7e6ebb266b Time: 0.0107668
[07/07/2026-01:46:41] [TRT] [V] Tactic Name: sm80_xmma_fprop_implicit_gemm_indexed_wo_smem_f32f32_tf32f32_f32_nhwckrsc_nhwc_tilesize128x16x64_stage1_warpsize4x1x1_g1_tensor16x8x8_alignc4 Tactic: 0xcc46f0f5cee60677 Time: 0.00658907
[07/07/2026-01:46:41] [TRT] [V] Tactic Name: sm80_xmma_fprop_implicit_gemm_indexed_wo_smem_f32f32_tf32f32_f32_nhwckrsc_nhwc_tilesize128x32x64_stage1_warpsize4x1x1_g1_tensor16x8x8_aligna8 Tactic: 0x9355e195cee05798 Time: 0.00849093
[07/07/2026-01:46:41] [TRT] [V] Tactic Name: sm80_xmma_fprop_implicit_gemm_indexed_wo_smem_f32f32_tf32f32_f32_nhwckrsc_nhwc_tilesize128x32x64_stage1_warpsize4x1x1_g1_tensor16x8x8_alignc8 Tactic: 0x3a8712b17741b582 Time: 0.00736881
[07/07/2026-01:46:41] [TRT] [V] Tactic Name: sm80_xmma_fprop_implicit_gemm_indexed_wo_smem_f32f32_tf32f32_f32_nhwckrsc_nhwc_tilesize128x16x32_stage1_warpsize4x1x1_g1_tensor16x8x8_aligna8_alignc8 Tactic: 0x4640eb34c8ecc700 Time: 0.00901795
[07/07/2026-01:46:41] [TRT] [V] Tactic Name: sm80_xmma_fprop_implicit_gemm_indexed_wo_smem_f32f32_tf32f32_f32_nhwckrsc_nhwc_tilesize128x32x16_stage1_warpsize4x1x1_g1_tensor16x8x8_aligna8_alignc4 Tactic: 0xf78ec258f27b3e23 Time: 0.011328
[07/07/2026-01:46:41] [TRT] [V] Tactic Name: sm80_xmma_fprop_implicit_gemm_indexed_wo_smem_f32f32_tf32f32_f32_nhwckrsc_nhwc_tilesize128x32x16_stage1_warpsize4x1x1_g1_tensor16x8x8_aligna8_alignc8 Tactic: 0x7bff86d5f2eadc76 Time: 0.010679
[07/07/2026-01:46:41] [TRT] [V] Tactic Name: sm90_xmma_fprop_implicit_gemm_f32f32_tf32f32_f32_nhwckrsc_nhwc_tilesize64x128x32_cgasize1x2x1_warpgroupsize1x1x1_g1 Tactic: 0xbd2c1a5c803c6d6e Time: 0.0144604
[07/07/2026-01:46:41] [TRT] [V] Tactic Name: sm90_xmma_fprop_implicit_gemm_f32f32_tf32f32_f32_nhwckrsc_nhwc_tilesize64x128x32_cgasize1x4x1_warpgroupsize1x1x1_g1_beta0 Tactic: 0x0eb1975f77f41d78 Time: 0.0175843
[07/07/2026-01:46:41] [TRT] [V] Tactic Name: sm80_xmma_fprop_implicit_gemm_indexed_f32f32_tf32f32_f32_nhwckrsc_nhwc_tilesize64x32x64_stage5_warpsize2x2x1_g1_tensor16x8x8 Tactic: 0xd7f5d575d49a4bc7 Time: 0.0181272
[07/07/2026-01:46:41] [TRT] [V] Tactic Name: sm80_xmma_fprop_implicit_gemm_indexed_f32f32_tf32f32_f32_nhwckrsc_nhwc_tilesize256x128x32_stage3_warpsize4x2x1_g1_tensor16x8x8 Tactic: 0x36303f399d3ee4fd Time: 0.0442133
[07/07/2026-01:46:41] [TRT] [V] Tactic Name: sm80_xmma_fprop_implicit_gemm_indexed_f32f32_tf32f32_f32_nhwckrsc_nhwc_tilesize128x128x16_stage4_warpsize2x2x1_g1_tensor16x8x8 Tactic: 0x65e41d81f093b482 Time: 0.0178526
[07/07/2026-01:46:41] [TRT] [V] Tactic Name: sm90_xmma_fprop_implicit_gemm_f32f32_tf32f32_f32_nhwckrsc_nhwc_tilesize128x128x32_cgasize1x2x1_warpgroupsize1x1x1_g1 Tactic: 0x65b36e05da14f11a Time: 0.0155956
[07/07/2026-01:46:41] [TRT] [V] Tactic Name: sm80_xmma_fprop_implicit_gemm_f32f32_tf32f32_f32_nhwckrsc_nhwc_tilesize128x128x32_stage4_warpsize2x2x1_g1_tensor16x8x8_t1r5s5 Tactic: 0xd44c0150ab60e391 Time: 0.0247863
[07/07/2026-01:46:41] [TRT] [V] Tactic Name: sm80_xmma_fprop_implicit_gemm_indexed_wo_smem_f32f32_tf32f32_f32_nhwckrsc_nhwc_tilesize128x16x32_stage1_warpsize4x1x1_g1_tensor16x8x8_aligna8 Tactic: 0x3f948a101b8c4067 Time: 0.00921312
[07/07/2026-01:46:41] [TRT] [V] Tactic Name: sm80_xmma_fprop_implicit_gemm_f32f32_tf32f32_f32_nhwckrsc_nhwc_tilesize128x128x32_stage4_warpsize2x2x1_g1_tensor16x8x8 Tactic: 0x25b2b9d5c9d5ca0d Time: 0.0253752
[07/07/2026-01:46:41] [TRT] [V] Tactic Name: sm80_xmma_fprop_implicit_gemm_indexed_f32f32_tf32f32_f32_nhwckrsc_nhwc_tilesize64x128x32_stage5_warpsize2x2x1_g1_tensor16x8x8 Tactic: 0x112d7e4d280f396d Time: 0.0203658
[07/07/2026-01:46:41] [TRT] [V] Tactic Name: sm90_xmma_fprop_implicit_gemm_f32f32_tf32f32_f32_nhwckrsc_nhwc_tilesize64x256x32_cgasize1x4x1_warpgroupsize1x1x1_g1_beta0 Tactic: 0x25c4ee40a73d705d Time: 0.0258273
[07/07/2026-01:46:41] [TRT] [V] Tactic Name: sm80_xmma_fprop_implicit_gemm_indexed_wo_smem_f32f32_tf32f32_f32_nhwckrsc_nhwc_tilesize128x16x64_stage1_warpsize4x1x1_g1_tensor16x8x8_alignc8 Tactic: 0x4037b478ce77e422 Time: 0.00744533
[07/07/2026-01:46:41] [TRT] [V] Tactic Name: sm80_xmma_fprop_implicit_gemm_f32f32_tf32f32_f32_nhwckrsc_nhwc_tilesize64x128x32_stage5_warpsize2x2x1_g1_tensor16x8x8_t1r5s5 Tactic: 0xd92e381f65c40faf Time: 0.0168075
[07/07/2026-01:46:41] [TRT] [V] Tactic Name: sm90_xmma_fprop_implicit_gemm_f32f32_tf32f32_f32_nhwckrsc_nhwc_tilesize256x64x32_cgasize1x2x1_warpgroupsize1x1x1_g1_beta0 Tactic: 0x90ab5638bd5100d1 Time: 0.0166273
[07/07/2026-01:46:41] [TRT] [V] Tactic Name: sm80_xmma_fprop_implicit_gemm_f32f32_tf32f32_f32_nhwckrsc_nhwc_tilesize128x64x32_stage5_warpsize2x2x1_g1_tensor16x8x8_t1r5s5 Tactic: 0x77cea0eece03cdc8 Time: 0.017865
[07/07/2026-01:46:41] [TRT] [V] Tactic Name: sm80_xmma_fprop_implicit_gemm_f32f32_tf32f32_f32_nhwckrsc_nhwc_tilesize128x128x16_stage4_warpsize2x2x1_g1_tensor16x8x8 Tactic: 0xb443c221fcb1565b Time: 0.0164307
[07/07/2026-01:46:41] [TRT] [V] Tactic Name: sm90_xmma_fprop_implicit_gemm_f32f32_tf32f32_f32_nhwckrsc_nhwc_tilesize256x32x32_cgasize1x1x1_warpgroupsize1x1x1_g1_beta0 Tactic: 0x2e5549421c394a78 Time: 0.0189001
[07/07/2026-01:46:41] [TRT] [V] node_conv2d + node_relu (CaskConvolution[0x80000009]) profiling completed in 0.5365 seconds. Fastest Tactic: 0xcc46f0f5cee60677 Time: 0.00658907
[07/07/2026-01:46:41] [TRT] [V] Skipping CaskFlattenConvolution: No valid tactics for node_conv2d + node_relu
[07/07/2026-01:46:41] [TRT] [V] >>>>>>>>>>>>>>> Chose Runner Type: CaskConvolution Tactic: 0xcc46f0f5cee60677
[07/07/2026-01:46:41] [TRT] [V] =============== Computing costs for node_max_pool2d
[07/07/2026-01:46:41] [TRT] [V] *************** Autotuning format combination: Float(25088,784,28,1) -> Float(6272,196,14,1) ***************
[07/07/2026-01:46:41] [TRT] [V] --------------- Timing Runner: node_max_pool2d (CaskPooling[0x8000002f])
[07/07/2026-01:46:41] [TRT] [V] Tactic Name: sm50_xmma_pooling_tiled_FP32NCHW_kMAX_tP2_tQ32_tR2_tS2_tU2_tV2_tUnroll6_tThreads256 Tactic: 0x60eceb67eff69444 Time: 0.00358162
[07/07/2026-01:46:41] [TRT] [V] Tactic Name: sm50_xmma_pooling_tiled_FP32NCHW_kMAX_tP2_tQ32_tR2_tS2_tU2_tV2_tUnroll1_tThreads256 Tactic: 0xc7d8c563bd6ced88 Time: 0.0037983
[07/07/2026-01:46:41] [TRT] [V] Tactic Name: sm50_xmma_pooling_nd_NCDHW_kMAX_kGENERIC_3D_POOLING_MODE_kFLOAT_0 Tactic: 0x5faf4a0a8a5670ed Time: 0.00405051
[07/07/2026-01:46:41] [TRT] [V] Tactic Name: sm50_xmma_pooling_tiled_FP32NCHW_kMAX_tP2_tQ16_tR2_tS2_tU2_tV2_tUnroll6_tThreads128 Tactic: 0xf4b20242f8c135e7 Time: 0.00365461
[07/07/2026-01:46:41] [TRT] [V] Tactic Name: sm50_xmma_pooling_tiled_FP32NCHW_kMAX_tP2_tQ16_tR2_tS2_tU2_tV2_tUnroll2_tThreads128 Tactic: 0xa7a495ee24d0c659 Time: 0.00342857
[07/07/2026-01:46:41] [TRT] [V] Tactic Name: sm50_xmma_pooling_fw_4d_FP32FP32NCHW_Max Tactic: 0xb59f9cfb90407c92 Time: 0.00407089
[07/07/2026-01:46:41] [TRT] [V] Tactic Name: sm50_xmma_pooling_tiled_FP32NCHW_kMAX_tP2_tQ32_tR2_tS2_tU2_tV2_tUnroll8_tThreads256 Tactic: 0xbc5c1844e5cc7959 Time: 0.00371224
[07/07/2026-01:46:41] [TRT] [V] Tactic Name: sm50_xmma_pooling_tiled_FP32NCHW_kMAX_tP2_tQ16_tR2_tS2_tU2_tV2_tUnroll8_tThreads128 Tactic: 0x2802f161f2fbd8fa Time: 0.00375922
[07/07/2026-01:46:41] [TRT] [V] Tactic Name: sm50_xmma_pooling_tiled_FP32NCHW_kMAX_tP2_tQ16_tR2_tS2_tU2_tV2_tUnroll3_tThreads128 Tactic: 0x7a0d6790c453b5f4 Time: 0.00355484
[07/07/2026-01:46:41] [TRT] [V] Tactic Name: sm50_xmma_pooling_tiled_FP32NCHW_kMAX_tP2_tQ16_tR2_tS2_tU2_tV2_tUnroll1_tThreads128 Tactic: 0x53862c46aa5b4c2b Time: 0.00375467
[07/07/2026-01:46:41] [TRT] [V] Tactic Name: sm50_xmma_pooling_tiled_FP32NCHW_kMAX_tP2_tQ16_tR2_tS2_tU2_tV2_tUnroll7_tThreads128 Tactic: 0x291bf03c1842464a Time: 0.00368059
[07/07/2026-01:46:41] [TRT] [V] Tactic Name: sm50_xmma_pooling_tiled_FP32NCHW_kMAX_tP2_tQ32_tR2_tS2_tU2_tV2_tUnroll5_tThreads256 Tactic: 0x94ce52cf617d1e36 Time: 0.00343983
[07/07/2026-01:46:41] [TRT] [V] Tactic Name: sm50_xmma_pooling_tiled_FP32NCHW_kMAX_tP2_tQ32_tR2_tS2_tU2_tV2_tUnroll4_tThreads256 Tactic: 0x4967a0b181fe6d9b Time: 0.00351573
[07/07/2026-01:46:41] [TRT] [V] Tactic Name: sm50_xmma_pooling_tiled_FP32NCHW_kMAX_tP2_tQ16_tR2_tS2_tU2_tV2_tUnroll5_tThreads128 Tactic: 0x0090bbea764abf95 Time: 0.0035907
[07/07/2026-01:46:41] [TRT] [V] Tactic Name: sm50_xmma_pooling_tiled_FP32NCHW_kMAX_tP2_tQ32_tR2_tS2_tU2_tV2_tUnroll7_tThreads256 Tactic: 0xbd4519190f75e7e9 Time: 0.00367027
[07/07/2026-01:46:41] [TRT] [V] Tactic Name: sm50_xmma_pooling_tiled_FP32NCHW_kMAX_tP2_tQ32_tR2_tS2_tU2_tV2_tUnroll2_tThreads256 Tactic: 0x33fa7ccb33e767fa Time: 0.00354962
[07/07/2026-01:46:41] [TRT] [V] Tactic Name: sm50_xmma_pooling_tiled_FP32NCHW_kMAX_tP2_tQ32_tR2_tS2_tU2_tV2_tUnroll3_tThreads256 Tactic: 0xee538eb5d3641457 Time: 0.0035988
[07/07/2026-01:46:41] [TRT] [V] Tactic Name: sm50_xmma_pooling_tiled_FP32NCHW_kMAX_tP2_tQ16_tR2_tS2_tU2_tV2_tUnroll4_tThreads128 Tactic: 0xdd39499496c9cc38 Time: 0.00354894
[07/07/2026-01:46:41] [TRT] [V] node_max_pool2d (CaskPooling[0x8000002f]) profiling completed in 0.0597607 seconds. Fastest Tactic: 0xa7a495ee24d0c659 Time: 0.00342857
[07/07/2026-01:46:41] [TRT] [V] >>>>>>>>>>>>>>> Chose Runner Type: CaskPooling Tactic: 0xa7a495ee24d0c659
[07/07/2026-01:46:41] [TRT] [V] *************** Autotuning format combination: Float(6272,1:4,224,8) -> Float(1568,1:4,112,8) ***************
[07/07/2026-01:46:41] [TRT] [V] --------------- Timing Runner: node_max_pool2d (CaskPooling[0x8000002f])
[07/07/2026-01:46:41] [TRT] [V] Tactic Name: sm50_xmma_pooling_max_nhwc_FP32FP32_WINDOWSIZE_0_PROPAGATE_NAN_2D Tactic: 0x8382d5c464539e87 Time: 0.00418187
[07/07/2026-01:46:41] [TRT] [V] Tactic Name: sm50_xmma_pooling_max_nhwc_FP32FP32_WINDOWSIZE_0_NOT_PROPAGATE_NAN_2D Tactic: 0xaec8628e8180bced Time: 0.00415407
[07/07/2026-01:46:41] [TRT] [V] Tactic Name: sm50_xmma_pooling_max_nhwc_FP32FP32_WINDOWSIZE_0_PROPAGATE_NAN_3D Tactic: 0xd76bac5638836f8a Time: 0.00431316
[07/07/2026-01:46:41] [TRT] [V] Tactic Name: sm50_xmma_pooling_max_nhwc_FP32FP32_WINDOWSIZE_0_NOT_PROPAGATE_NAN_3D Tactic: 0xfa211b1cdd504de0 Time: 0.00423683
[07/07/2026-01:46:41] [TRT] [V] Tactic Name: sm50_xmma_pooling_fw_4d_FP32FP32NHWC_Max_CAlign4 Tactic: 0x22fb1bb4a70e340d Time: 0.004184
[07/07/2026-01:46:41] [TRT] [V] node_max_pool2d (CaskPooling[0x8000002f]) profiling completed in 0.0156243 seconds. Fastest Tactic: 0xaec8628e8180bced Time: 0.00415407
[07/07/2026-01:46:41] [TRT] [V] >>>>>>>>>>>>>>> Chose Runner Type: CaskPooling Tactic: 0xaec8628e8180bced
[07/07/2026-01:46:41] [TRT] [V] =============== Computing costs for node_conv2d_1 + node_relu_1
[07/07/2026-01:46:41] [TRT] [V] *************** Autotuning format combination: Float(6272,196,14,1) -> Float(12544,196,14,1) ***************
[07/07/2026-01:46:41] [TRT] [V] --------------- Timing Runner: node_conv2d_1 + node_relu_1 (CaskConvolution[0x80000009])
[07/07/2026-01:46:41] [TRT] [V] Tactic Name: sm80_xmma_fprop_implicit_gemm_f32f32_f32f32_f32_nchwkcrs_nchw_tilesize64x64x8_stage3_warpsize1x4x1_g1_ffma_t1r5s5_aligna4_alignc4 Tactic: 0x967f94e9db2001a8 Time: 0.0356704
[07/07/2026-01:46:41] [TRT] [V] Tactic Name: sm80_xmma_fprop_implicit_gemm_indexed_f32f32_f32f32_f32_nchwkcrs_nchw_tilesize32x32x8_stage3_warpsize1x2x1_g1_ffma_aligna4_alignc4 Tactic: 0xcb8a43f748d8a338 Time: 0.0379899
[07/07/2026-01:46:41] [TRT] [V] Tactic Name: sm80_xmma_fprop_implicit_gemm_indexed_f32f32_f32f32_f32_nchwkcrs_nchw_tilesize128x64x8_stage2_warpsize1x4x1_g1_ffma_aligna4_alignc4_beta0_packed_stride Tactic: 0xede36641840ce3d2 Time: 0.080544
[07/07/2026-01:46:41] [TRT] [V] Tactic Name: sm80_xmma_fprop_implicit_gemm_indexed_f32f32_f32f32_f32_nchwkcrs_nchw_tilesize64x64x8_stage3_warpsize1x4x1_g1_ffma_aligna4_alignc4 Tactic: 0xd828f024626fa982 Time: 0.0451827
[07/07/2026-01:46:41] [TRT] [V] Tactic Name: sm70_xmma_fprop_implicit_gemm_f32f32_f32f32_f32_nchwkcrs_nchw_tilesize64x128x8_stage1_warpsize1x4x1_g1_ffma_aligna4_alignc4 Tactic: 0xd1338f4b38d341e2 Time: 0.0545173
[07/07/2026-01:46:41] [TRT] [V] Tactic Name: sm80_xmma_fprop_implicit_gemm_f32f32_f32f32_f32_nchwkcrs_nchw_tilesize32x32x8_stage3_warpsize1x2x1_g1_ffma_t1r5s5_aligna4_alignc4 Tactic: 0x5b8bf1b8028629d9 Time: 0.0266716
[07/07/2026-01:46:41] [TRT] [V] Tactic Name: sm80_xmma_fprop_implicit_gemm_f32f32_f32f32_f32_nchwkcrs_nchw_tilesize128x64x8_stage3_warpsize2x2x1_g1_ffma_aligna4_alignc4 Tactic: 0x12dbf7d94ee3696d Time: 0.0614347
[07/07/2026-01:46:41] [TRT] [V] Tactic Name: sm70_xmma_fprop_implicit_gemm_indexed_f32f32_f32f32_f32_nchwkcrs_nchw_tilesize128x16x8_stage1_warpsize4x1x1_g1_ffma_aligna4_alignc4 Tactic: 0x65d82d184f452332 Time: 0.0703424
[07/07/2026-01:46:41] [TRT] [V] Tactic Name: sm80_xmma_fprop_implicit_gemm_indexed_f32f32_f32f32_f32_nchwkcrs_nchw_tilesize128x64x8_stage2_warpsize2x2x1_g1_ffma_aligna4_alignc4_beta0_packed_stride Tactic: 0x31aa67f57c5aea77 Time: 0.0811691
[07/07/2026-01:46:41] [TRT] [V] Tactic Name: sm70_xmma_fprop_implicit_gemm_f32f32_f32f32_f32_nchwkcrs_nchw_tilesize128x128x8_stage1_warpsize2x2x1_g1_ffma_aligna4_alignc4 Tactic: 0xac49795b871b0d29 Time: 0.102072
[07/07/2026-01:46:41] [TRT] [V] Tactic Name: sm80_xmma_fprop_implicit_gemm_f32f32_f32f32_f32_nchwkcrs_nchw_tilesize128x16x8_stage3_warpsize4x1x1_g1_ffma_aligna4_alignc4 Tactic: 0x9d9fdb5fd9945f64 Time: 0.0319535
[07/07/2026-01:46:41] [TRT] [V] Tactic Name: sm80_xmma_fprop_implicit_gemm_f32f32_f32f32_f32_nchwkcrs_nchw_tilesize64x64x8_stage3_warpsize1x4x1_g1_ffma_aligna4_alignc4 Tactic: 0xa31d27de74b895ff Time: 0.0358432
[07/07/2026-01:46:41] [TRT] [V] Tactic Name: sm70_xmma_fprop_implicit_gemm_f32f32_f32f32_f32_nchwkcrs_nchw_tilesize128x64x8_stage1_warpsize2x2x1_g1_ffma_aligna4_alignc4 Tactic: 0x994f5b723e2d80da Time: 0.0665138
[07/07/2026-01:46:41] [TRT] [V] Tactic Name: sm70_xmma_fprop_implicit_gemm_f32f32_f32f32_f32_nchwkcrs_nchw_tilesize128x256x8_stage1_warpsize2x4x1_g1_ffma_aligna4_alignc4 Tactic: 0xd2aa21bfe2167c0c Time: 0.160992
[07/07/2026-01:46:41] [TRT] [V] Tactic Name: sm70_xmma_fprop_implicit_gemm_f32f32_f32f32_f32_nchwkcrs_nchw_tilesize32x32x8_stage1_warpsize1x2x1_g1_ffma_t1r5s5_aligna4_alignc4 Tactic: 0x7e1e4d26cfa285f9 Time: 0.044992
[07/07/2026-01:46:41] [TRT] [V] Tactic Name: sm70_xmma_fprop_implicit_gemm_f32f32_f32f32_f32_nchwkcrs_nchw_tilesize64x64x8_stage1_warpsize1x4x1_g1_ffma_t1r5s5_aligna4_alignc4 Tactic: 0xb3ea28771604ad88 Time: 0.0397772
[07/07/2026-01:46:41] [TRT] [V] Tactic Name: sm80_xmma_fprop_implicit_gemm_indexed_f32f32_f32f32_f32_nchwkcrs_nchw_tilesize128x16x8_stage3_warpsize4x1x1_g1_ffma_aligna4_alignc4 Tactic: 0x40a12e3938221818 Time: 0.0568267
