cookbook/04-Feature/ProfilingVerbosity/log-main.py.log
[04/24/2026-01:59:26] [TRT] [V] *************** Autotuning format combination: Float(784,784,28,1) -> Float(25088,784,28,1) ***************
[04/24/2026-01:59:26] [TRT] [V] --------------- Timing Runner: Convolution1 + Activation1 (CaskConvolution[0x80000009])
[04/24/2026-01:59:26] [TRT] [V] Tactic Name: ampere_scudnn_128x128_relu_medium_nn_v1 Tactic: 0xf067e6205da31c2e Time: 0.00948059
[04/24/2026-01:59:26] [TRT] [V] Tactic Name: ampere_scudnn_128x32_relu_small_nn_v1 Tactic: 0xa8609adc4e0ceb90 Time: 0.00792137
[04/24/2026-01:59:26] [TRT] [V] Tactic Name: ampere_scudnn_128x64_relu_medium_nn_v1 Tactic: 0xf64396b97c889179 Time: 0.00861347
[04/24/2026-01:59:26] [TRT] [V] Tactic Name: sm70_xmma_fprop_implicit_gemm_f32f32_f32f32_f32_nchwkcrs_nchw_tilesize64x64x8_stage1_warpsize1x4x1_g1_ffma_aligna4_alignc4 Tactic: 0xe40b38338a3a7d7e Time: 0.00503371
[04/24/2026-01:59:26] [TRT] [V] Tactic Name: sm70_xmma_fprop_implicit_gemm_f32f32_f32f32_f32_nchwkcrs_nchw_tilesize32x32x8_stage1_warpsize1x2x1_g1_ffma_aligna4_alignc4 Tactic: 0xf7a98be0a08d77c4 Time: 0.00457483
[04/24/2026-01:59:26] [TRT] [V] Tactic Name: sm70_xmma_fprop_implicit_gemm_f32f32_f32f32_f32_nchwkcrs_nchw_tilesize64x128x8_stage1_warpsize1x4x1_g1_ffma_aligna4_alignc4 Tactic: 0xd1338f4b38d341e2 Time: 0.00594489
[04/24/2026-01:59:26] [TRT] [V] Tactic Name: sm80_xmma_fprop_implicit_gemm_f32f32_f32f32_f32_nchwkcrs_nchw_tilesize64x128x8_stage3_warpsize1x4x1_g1_ffma_aligna4_alignc4 Tactic: 0x5aa723e0481da855 Time: 0.00612635
[04/24/2026-01:59:26] [TRT] [V] Tactic Name: sm80_xmma_fprop_implicit_gemm_f32f32_f32f32_f32_nchwkcrs_nchw_tilesize256x128x8_stage3_warpsize4x2x1_g1_ffma_aligna4_alignc4 Tactic: 0xbb8c3889c7eacd30 Time: 0.0126428
[04/24/2026-01:59:26] [TRT] [V] Tactic Name: sm70_xmma_fprop_implicit_gemm_indexed_f32f32_f32f32_f32_nchwkcrs_nchw_tilesize128x16x8_stage1_warpsize4x1x1_g1_ffma_aligna4_alignc4 Tactic: 0x65d82d184f452332 Time: 0.00554422
[04/24/2026-01:59:26] [TRT] [V] Tactic Name: sm70_xmma_fprop_implicit_gemm_indexed_f32f32_f32f32_f32_nchwkcrs_nchw_tilesize32x32x8_stage1_warpsize1x2x1_g1_ffma_aligna4_alignc4 Tactic: 0x9efed776051c0873 Time: 0.00506731
[04/24/2026-01:59:26] [TRT] [V] Tactic Name: sm70_xmma_fprop_implicit_gemm_indexed_f32f32_f32f32_f32_nchwkcrs_nchw_tilesize128x32x8_stage1_warpsize2x2x1_g1_ffma_aligna4_alignc4 Tactic: 0x8c4f6360145d6a1f Time: 0.00603657
[04/24/2026-01:59:26] [TRT] [V] Tactic Name: sm70_xmma_fprop_implicit_gemm_indexed_f32f32_f32f32_f32_nchwkcrs_nchw_tilesize64x64x8_stage1_warpsize1x4x1_g1_ffma_aligna4_alignc4 Tactic: 0x8d5c64a52fab02c9 Time: 0.00515249
[04/24/2026-01:59:26] [TRT] [V] Tactic Name: sm80_xmma_fprop_implicit_gemm_indexed_f32f32_f32f32_f32_nchwkcrs_nchw_tilesize128x64x8_stage2_warpsize4x1x1_g1_ffma_aligna4_alignc4_beta0_packed_stride Tactic: 0x1673e3594ce11cea Time: 0.00731223
[04/24/2026-01:59:26] [TRT] [V] Tactic Name: sm80_xmma_fprop_implicit_gemm_indexed_f32f32_f32f32_f32_nchwkcrs_nchw_tilesize128x16x8_stage3_warpsize4x1x1_g1_ffma_aligna4_alignc4 Tactic: 0x40a12e3938221818 Time: 0.00564534
[04/24/2026-01:59:26] [TRT] [V] Tactic Name: sm80_xmma_fprop_implicit_gemm_indexed_f32f32_f32f32_f32_nchwkcrs_nchw_tilesize128x32x8_stage3_warpsize2x2x1_g1_ffma_aligna4_alignc4 Tactic: 0xa9366041633a5135 Time: 0.00605676
[04/24/2026-01:59:26] [TRT] [V] Tactic Name: sm80_xmma_fprop_implicit_gemm_f32f32_f32f32_f32_nchwkcrs_nchw_tilesize32x32x8_stage3_warpsize1x2x1_g1_ffma_t1r5s5_aligna4_alignc4 Tactic: 0x5b8bf1b8028629d9 Time: 0.00446066
[04/24/2026-01:59:26] [TRT] [V] Tactic Name: sm70_xmma_fprop_implicit_gemm_f32f32_f32f32_f32_nchwkcrs_nchw_tilesize32x32x8_stage1_warpsize1x2x1_g1_ffma_t1r5s5_aligna4_alignc4 Tactic: 0x7e1e4d26cfa285f9 Time: 0.00469919
[04/24/2026-01:59:26] [TRT] [V] Tactic Name: ampere_scudnn_128x64_relu_small_nn_v1 Tactic: 0x3f243c490d502deb Time: 0.00805867
[04/24/2026-01:59:26] [TRT] [V] Tactic Name: sm70_xmma_fprop_implicit_gemm_f32f32_f32f32_f32_nchwkcrs_nchw_tilesize128x16x8_stage1_warpsize4x1x1_g1_ffma_aligna4_alignc4 Tactic: 0x160b77f4a95ab6d3 Time: 0.00513149
[04/24/2026-01:59:26] [TRT] [V] Tactic Name: sm70_xmma_fprop_implicit_gemm_f32f32_f32f32_f32_nchwkcrs_nchw_tilesize128x64x8_stage1_warpsize2x2x1_g1_ffma_aligna4_alignc4 Tactic: 0x994f5b723e2d80da Time: 0.00635995
[04/24/2026-01:59:26] [TRT] [V] Tactic Name: sm80_xmma_fprop_implicit_gemm_f32f32_f32f32_f32_nchwkcrs_nchw_tilesize64x64x8_stage3_warpsize1x4x1_g1_ffma_aligna4_alignc4 Tactic: 0xa31d27de74b895ff Time: 0.0050076
[04/24/2026-01:59:26] [TRT] [V] Tactic Name: sm80_xmma_fprop_implicit_gemm_f32f32_f32f32_f32_nchwkcrs_nchw_tilesize32x32x8_stage3_warpsize1x2x1_g1_ffma_aligna4_alignc4 Tactic: 0xb0bf940d5e0f9f45 Time: 0.00451834
[04/24/2026-01:59:26] [TRT] [V] Tactic Name: ampere_scudnn_128x64_relu_xregs_large_nn_v1 Tactic: 0x5deb29b7a8e275f7 Time: 0.0084224
[04/24/2026-01:59:26] [TRT] [V] Tactic Name: sm70_xmma_fprop_implicit_gemm_f32f32_f32f32_f32_nchwkcrs_nchw_tilesize64x64x8_stage1_warpsize1x4x1_g1_ffma_t1r5s5_aligna4_alignc4 Tactic: 0xb3ea28771604ad88 Time: 0.00497847
[04/24/2026-01:59:26] [TRT] [V] Tactic Name: sm80_xmma_fprop_implicit_gemm_f32f32_f32f32_f32_nchwkcrs_nchw_tilesize128x16x8_stage3_warpsize4x1x1_g1_ffma_aligna4_alignc4 Tactic: 0x9d9fdb5fd9945f64 Time: 0.00497161
[04/24/2026-01:59:26] [TRT] [V] Tactic Name: sm80_xmma_fprop_implicit_gemm_indexed_f32f32_f32f32_f32_nchwkcrs_nchw_tilesize64x64x8_stage3_warpsize1x4x1_g1_ffma_aligna4_alignc4 Tactic: 0xd828f024626fa982 Time: 0.00516021
[04/24/2026-01:59:26] [TRT] [V] Tactic Name: sm80_xmma_fprop_implicit_gemm_f32f32_f32f32_f32_nchwkcrs_nchw_tilesize128x64x8_stage3_warpsize2x2x1_g1_ffma_aligna4_alignc4 Tactic: 0x12dbf7d94ee3696d Time: 0.00643446
[04/24/2026-01:59:26] [TRT] [V] Tactic Name: sm80_xmma_fprop_implicit_gemm_f32f32_f32f32_f32_nchwkcrs_nchw_tilesize64x64x8_stage3_warpsize1x4x1_g1_ffma_t1r5s5_aligna4_alignc4 Tactic: 0x967f94e9db2001a8 Time: 0.00488873
[04/24/2026-01:59:26] [TRT] [V] Tactic Name: sm80_xmma_fprop_implicit_gemm_indexed_f32f32_f32f32_f32_nchwkcrs_nchw_tilesize32x32x8_stage3_warpsize1x2x1_g1_ffma_aligna4_alignc4 Tactic: 0xcb8a43f748d8a338 Time: 0.00472398
[04/24/2026-01:59:26] [TRT] [V] Tactic Name: sm70_xmma_fprop_implicit_gemm_f32f32_f32f32_f32_nchwkcrs_nchw_tilesize128x256x8_stage1_warpsize2x4x1_g1_ffma_aligna4_alignc4 Tactic: 0xd2aa21bfe2167c0c Time: 0.0119592
[04/24/2026-01:59:26] [TRT] [V] Tactic Name: ampere_scudnn_128x128_relu_small_nn_v1 Tactic: 0x503619c69ae500ff Time: 0.00914104
[04/24/2026-01:59:26] [TRT] [V] Tactic Name: sm80_xmma_fprop_implicit_gemm_indexed_f32f32_f32f32_f32_nchwkcrs_nchw_tilesize128x64x8_stage2_warpsize1x4x1_g1_ffma_aligna4_alignc4_beta0_packed_stride Tactic: 0xede36641840ce3d2 Time: 0.00674986
[04/24/2026-01:59:26] [TRT] [V] Tactic Name: sm70_xmma_fprop_implicit_gemm_f32f32_f32f32_f32_nchwkcrs_nchw_tilesize128x128x8_stage1_warpsize2x2x1_g1_ffma_aligna4_alignc4 Tactic: 0xac49795b871b0d29 Time: 0.00959208
[04/24/2026-01:59:26] [TRT] [V] Tactic Name: sm80_xmma_fprop_implicit_gemm_indexed_f32f32_f32f32_f32_nchwkcrs_nchw_tilesize128x64x8_stage2_warpsize2x2x1_g1_ffma_aligna4_alignc4_beta0_packed_stride Tactic: 0x31aa67f57c5aea77 Time: 0.00677589
[04/24/2026-01:59:26] [TRT] [V] Convolution1 + Activation1 (CaskConvolution[0x80000009]) profiling completed in 0.170835 seconds. Fastest Tactic: 0x5b8bf1b8028629d9 Time: 0.00446066
[04/24/2026-01:59:26] [TRT] [V] Skipping CaskFlattenConvolution: No valid tactics for Convolution1 + Activation1
[04/24/2026-01:59:26] [TRT] [V] >>>>>>>>>>>>>>> Chose Runner Type: CaskConvolution Tactic: 0x5b8bf1b8028629d9
[04/24/2026-01:59:26] [TRT] [V] *************** Autotuning format combination: Float(784,1,28,1) -> Float(25088,1,896,32) ***************
[04/24/2026-01:59:26] [TRT] [V] --------------- Timing Runner: Convolution1 + Activation1 (CaskConvolution[0x80000009])
[04/24/2026-01:59:26] [TRT] [V] Tactic Name: sm70_xmma_fprop_implicit_gemm_f32f32_f32f32_f32_nhwckrsc_nhwc_tilesize64x32x32_stage1_warpsize1x1x1_g1_ffma_t1r5s5_aligna4_alignc4 Tactic: 0x737793996edbf8e2 Time: 0.113792
[04/24/2026-01:59:26] [TRT] [V] Tactic Name: sm80_xmma_fprop_implicit_gemm_f32f32_f32f32_f32_nhwckrsc_nhwc_tilesize64x64x8_stage3_warpsize1x4x1_g1_ffma_t1r5s5_aligna4_alignc4 Tactic: 0x45ff0c3a09b02e78 Time: 0.00971977
[04/24/2026-01:59:26] [TRT] [V] Tactic Name: sm80_xmma_fprop_implicit_gemm_f32f32_f32f32_f32_nhwckrsc_nhwc_tilesize128x64x8_stage3_warpsize2x2x1_g1_ffma_aligna4_alignc4 Tactic: 0x1da91d865428f237 Time: 0.0148165
[04/24/2026-01:59:26] [TRT] [V] Tactic Name: sm70_xmma_fprop_implicit_gemm_indexed_f32f32_f32f32_f32_nhwckrsc_nhwc_tilesize32x32x8_stage1_warpsize1x2x1_g1_ffma_aligna4_alignc4 Tactic: 0x5f60af66e8eb9b51 Time: 0.0101207
[04/24/2026-01:59:26] [TRT] [V] Tactic Name: sm70_xmma_fprop_implicit_gemm_indexed_f32f32_f32f32_f32_nhwckrsc_nhwc_tilesize128x32x8_stage1_warpsize2x2x1_g1_ffma_aligna4_alignc4 Tactic: 0x833d893f0e96f145 Time: 0.0118749
[04/24/2026-01:59:26] [TRT] [V] Tactic Name: sm80_xmma_fprop_implicit_gemm_indexed_wo_smem_f32f32_tf32f32_f32_nhwckrsc_nhwc_tilesize128x32x16_stage1_warpsize4x1x1_g1_tensor16x8x8_aligna4_alignc4 Tactic: 0xf231cca3335919a4 Time: 0.00487281
[04/24/2026-01:59:26] [TRT] [V] Tactic Name: sm70_xmma_fprop_implicit_gemm_f32f32_f32f32_f32_nhwckrsc_nhwc_tilesize64x16x16_stage1_warpsize1x1x1_g1_ffma_t1r5s5_aligna4_alignc4 Tactic: 0x247bb0dcaf6f9760 Time: 0.0190015
[04/24/2026-01:59:26] [TRT] [V] Tactic Name: sm80_xmma_fprop_implicit_gemm_indexed_f32f32_f32f32_f32_nhwckrsc_nhwc_tilesize128x16x8_stage3_warpsize4x1x1_g1_ffma_aligna4_alignc4 Tactic: 0x4fd3c46622e98342 Time: 0.0110286
[04/24/2026-01:59:26] [TRT] [V] Tactic Name: sm80_xmma_fprop_implicit_gemm_indexed_wo_smem_f32f32_tf32f32_f32_nhwckrsc_nhwc_tilesize128x16x32_stage1_warpsize4x1x1_g1_tensor16x8x8_aligna4_alignc4 Tactic: 0xcf8ea142095f02d2 Time: 0.00442793
[04/24/2026-01:59:26] [TRT] [V] Tactic Name: sm80_xmma_fprop_implicit_gemm_f32f32_f32f32_f32_nhwckrsc_nhwc_tilesize32x32x8_stage3_warpsize1x2x1_g1_ffma_t1r5s5_aligna4_alignc4 Tactic: 0x880b696bd0160609 Time: 0.00709583
[04/24/2026-01:59:26] [TRT] [V] Tactic Name: sm70_xmma_fprop_implicit_gemm_f32f32_f32f32_f32_nhwckrsc_nhwc_tilesize128x16x8_stage1_warpsize4x1x1_g1_ffma_aligna4_alignc4 Tactic: 0x19799dabb3912d89 Time: 0.010464
[04/24/2026-01:59:26] [TRT] [V] Tactic Name: sm70_xmma_fprop_implicit_gemm_f32f32_f32f32_f32_nhwckrsc_nhwc_tilesize64x128x8_stage1_warpsize1x4x1_g1_ffma_aligna4_alignc4 Tactic: 0xde4165142218dab8 Time: 0.0138765
[04/24/2026-01:59:26] [TRT] [V] Tactic Name: sm70_xmma_fprop_implicit_gemm_f32f32_f32f32_f32_nhwckrsc_nhwc_tilesize128x64x8_stage1_warpsize2x2x1_g1_ffma_aligna4_alignc4 Tactic: 0x963db12d24e61b80 Time: 0.0143147
[04/24/2026-01:59:26] [TRT] [V] Tactic Name: sm80_xmma_fprop_implicit_gemm_indexed_f32f32_f32f32_f32_nhwckrsc_nhwc_tilesize128x32x8_stage3_warpsize2x2x1_g1_ffma_aligna4_alignc4 Tactic: 0xa6448a1e79f1ca6f Time: 0.0110142
[04/24/2026-01:59:26] [TRT] [V] Tactic Name: sm80_xmma_fprop_implicit_gemm_f32f32_f32f32_f32_nhwckrsc_nhwc_tilesize128x16x8_stage3_warpsize4x1x1_g1_ffma_t1r5s5_aligna4_alignc4 Tactic: 0xe35d4a4a3b499fe7 Time: 0.00826979
[04/24/2026-01:59:26] [TRT] [V] Tactic Name: sm80_xmma_fprop_implicit_gemm_indexed_f32f32_f32f32_f32_nhwckrsc_nhwc_tilesize64x64x8_stage3_warpsize1x4x1_g1_ffma_aligna4_alignc4 Tactic: 0x19b688348f983aa0 Time: 0.0102539
[04/24/2026-01:59:26] [TRT] [V] Tactic Name: sm80_xmma_fprop_implicit_gemm_f32f32_f32f32_f32_nhwckrsc_nhwc_tilesize256x64x8_stage3_warpsize2x2x1_g1_ffma_aligna4_alignc4 Tactic: 0x8014228ec08b4d49 Time: 0.0254545
[04/24/2026-01:59:26] [TRT] [V] Tactic Name: sm70_xmma_fprop_implicit_gemm_f32f32_f32f32_f32_nhwckrsc_nhwc_tilesize128x16x8_stage1_warpsize4x1x1_g1_ffma_t1r5s5_aligna4_alignc4 Tactic: 0x54e3b8c9b1e5f17a Time: 0.0102158
[04/24/2026-01:59:26] [TRT] [V] Tactic Name: sm70_xmma_fprop_implicit_gemm_indexed_f32f32_f32f32_f32_nhwckrsc_nhwc_tilesize128x16x8_stage1_warpsize4x1x1_g1_ffma_aligna4_alignc4 Tactic: 0x6aaac747558eb868 Time: 0.0110985
[04/24/2026-01:59:26] [TRT] [V] Tactic Name: sm70_xmma_fprop_implicit_gemm_f32f32_f32f32_f32_nhwckrsc_nhwc_tilesize32x32x8_stage1_warpsize1x2x1_g1_ffma_aligna4_alignc4 Tactic: 0x3637f3f04d7ae4e6 Time: 0.0105177
[04/24/2026-01:59:26] [TRT] [V] Tactic Name: sm70_xmma_fprop_implicit_gemm_f32f32_f32f32_f32_nhwckrsc_nhwc_tilesize64x32x32_stage1_warpsize1x1x1_g1_ffma_aligna4_alignc4 Tactic: 0xdb73e25ae4006f74 Time: 0.113113
[04/24/2026-01:59:26] [TRT] [V] Tactic Name: sm70_xmma_fprop_implicit_gemm_f32f32_f32f32_f32_nhwckrsc_nhwc_tilesize64x64x8_stage1_warpsize1x4x1_g1_ffma_aligna4_alignc4 Tactic: 0x2595402367cdee5c Time: 0.0106517
[04/24/2026-01:59:26] [TRT] [V] Tactic Name: sm80_xmma_fprop_implicit_gemm_f32f32_f32f32_f32_nhwckrsc_nhwc_tilesize128x16x8_stage3_warpsize4x1x1_g1_ffma_aligna4_alignc4 Tactic: 0x92ed3100c35fc43e Time: 0.0084872
[04/24/2026-01:59:26] [TRT] [V] Tactic Name: sm80_xmma_fprop_implicit_gemm_f32f32_f32f32_f32_nhwckrsc_nhwc_tilesize64x64x8_stage3_warpsize1x4x1_g1_ffma_aligna4_alignc4 Tactic: 0x62835fce994f06dd Time: 0.00998557
[04/24/2026-01:59:26] [TRT] [V] Tactic Name: sm70_xmma_fprop_implicit_gemm_f32f32_f32f32_f32_nhwckrsc_nhwc_tilesize32x32x8_stage1_warpsize1x2x1_g1_ffma_t1r5s5_aligna4_alignc4 Tactic: 0xad9ed5f51d32aa29 Time: 0.00989804
[04/24/2026-01:59:26] [TRT] [V] Tactic Name: sm70_xmma_fprop_implicit_gemm_f32f32_f32f32_f32_nhwckrsc_nhwc_tilesize64x16x16_stage1_warpsize1x1x1_g1_ffma_aligna4_alignc4 Tactic: 0x3f904b355d9ca8e6 Time: 0.019136
[04/24/2026-01:59:26] [TRT] [V] Tactic Name: sm80_xmma_fprop_implicit_gemm_indexed_f32f32_f32f32_f32_nhwckrsc_nhwc_tilesize32x32x8_stage3_warpsize1x2x1_g1_ffma_aligna4_alignc4 Tactic: 0x0a143be7a52f301a Time: 0.0080226
[04/24/2026-01:59:26] [TRT] [V] Tactic Name: sm80_xmma_fprop_implicit_gemm_f32f32_f32f32_f32_nhwckrsc_nhwc_tilesize32x32x8_stage3_warpsize1x2x1_g1_ffma_aligna4_alignc4 Tactic: 0x7121ec1db3f80c67 Time: 0.00730411
[04/24/2026-01:59:26] [TRT] [V] Tactic Name: sm70_xmma_fprop_implicit_gemm_f32f32_f32f32_f32_nhwckrsc_nhwc_tilesize256x128x8_stage1_warpsize2x4x1_g1_ffma_aligna4_alignc4 Tactic: 0x0447933cc2be855a Time: 0.0360117
[04/24/2026-01:59:26] [TRT] [V] Convolution1 + Activation1 (CaskConvolution[0x80000009]) profiling completed in 0.0897245 seconds. Fastest Tactic: 0xcf8ea142095f02d2 Time: 0.00442793
[04/24/2026-01:59:26] [TRT] [V] Skipping CaskFlattenConvolution: No valid tactics for Convolution1 + Activation1
[04/24/2026-01:59:26] [TRT] [V] >>>>>>>>>>>>>>> Chose Runner Type: CaskConvolution Tactic: 0xcf8ea142095f02d2
[04/24/2026-01:59:26] [TRT] [V] *************** Autotuning format combination: Float(784,1:4,28,1) -> Float(25088,784,28,1) ***************
[04/24/2026-01:59:26] [TRT] [V] --------------- Timing Runner: Convolution1 + Activation1 (CaskConvolution[0x80000009])
[04/24/2026-01:59:26] [TRT] [V] Tactic Name: sm80_xmma_fprop_implicit_gemm_indexed_f32f32_tf32f32_f32_nhwckrsc_nchw_tilesize128x128x16_stage4_warpsize2x2x1_g1_tensor16x8x8 Tactic: 0xe0a307ffe0ffb6a5 Time: 0.0167749
[04/24/2026-01:59:26] [TRT] [V] Tactic Name: sm80_xmma_fprop_implicit_gemm_f32f32_tf32f32_f32_nhwckrsc_nchw_tilesize128x128x16_stage4_warpsize2x2x1_g1_tensor16x8x8 Tactic: 0x3104d85fecdd547c Time: 0.0170811
[04/24/2026-01:59:26] [TRT] [V] Tactic Name: sm80_xmma_fprop_implicit_gemm_indexed_f32f32_tf32f32_f32_nhwckrsc_nchw_tilesize128x128x16_stage4_warpsize2x2x1_g1_tensor16x8x8_alignc4 Tactic: 0xe8f7b6a5bab325f8 Time: 0.0179818
[04/24/2026-01:59:26] [TRT] [V] Tactic Name: sm80_xmma_fprop_implicit_gemm_f32f32_tf32f32_f32_nhwckrsc_nchw_tilesize128x128x16_stage4_warpsize2x2x1_g1_tensor16x8x8_alignc4 Tactic: 0x9fd9fe001908ce2e Time: 0.017296
[04/24/2026-01:59:26] [TRT] [V] Convolution1 + Activation1 (CaskConvolution[0x80000009]) profiling completed in 0.0110184 seconds. Fastest Tactic: 0xe0a307ffe0ffb6a5 Time: 0.0167749
[04/24/2026-01:59:26] [TRT] [V] Skipping CaskFlattenConvolution: No valid tactics for Convolution1 + Activation1
[04/24/2026-01:59:26] [TRT] [V] >>>>>>>>>>>>>>> Chose Runner Type: CaskConvolution Tactic: 0xe0a307ffe0ffb6a5
[04/24/2026-01:59:26] [TRT] [V] *************** Autotuning format combination: Float(784,1:4,28,1) -> Float(6272,1:4,224,8) ***************
[04/24/2026-01:59:26] [TRT] [V] --------------- Timing Runner: Convolution1 + Activation1 (CaskConvolution[0x80000009])
[04/24/2026-01:59:26] [TRT] [V] Tactic Name: ampere_scudnn_128x32_sliced1x4_ldg4_relu_exp_small_nhwc_tn_v1 Tactic: 0x3e2b881168d9689d Time: 0.0256788
[04/24/2026-01:59:26] [TRT] [V] Tactic Name: ampere_scudnn_128x128_ldg4_relu_exp_medium_nhwc_tn_v1 Tactic: 0x7bc32c782b800c48 Time: 0.0224789
[04/24/2026-01:59:26] [TRT] [V] Tactic Name: sm80_xmma_fprop_implicit_gemm_f32f32_tf32f32_f32_nhwckrsc_nhwc_tilesize128x128x16_stage4_warpsize2x2x1_g1_tensor16x8x8 Tactic: 0xb443c221fcb1565b Time: 0.0165277
[04/24/2026-01:59:26] [TRT] [V] Tactic Name: sm80_xmma_fprop_implicit_gemm_indexed_f32f32_tf32f32_f32_nhwckrsc_nhwc_tilesize128x128x16_stage4_warpsize2x2x1_g1_tensor16x8x8 Tactic: 0x65e41d81f093b482 Time: 0.0173829
[04/24/2026-01:59:26] [TRT] [V] Tactic Name: sm80_xmma_fprop_implicit_gemm_indexed_wo_smem_f32f32_tf32f32_f32_nhwckrsc_nhwc_tilesize128x32x16_stage1_warpsize4x1x1_g1_tensor16x8x8_aligna8_alignc4 Tactic: 0xf78ec258f27b3e23 Time: 0.00853333
[04/24/2026-01:59:26] [TRT] [V] Tactic Name: sm80_xmma_fprop_implicit_gemm_indexed_wo_smem_f32f32_tf32f32_f32_nhwckrsc_nhwc_tilesize128x32x16_stage1_warpsize4x1x1_g1_tensor16x8x8_aligna4_alignc8 Tactic: 0x7e40882e33c8fbf1 Time: 0.00721112
[04/24/2026-01:59:26] [TRT] [V] Tactic Name: sm80_xmma_fprop_implicit_gemm_indexed_wo_smem_f32f32_tf32f32_f32_nhwckrsc_nhwc_tilesize128x16x32_stage1_warpsize4x1x1_g1_tensor16x8x8_aligna8_alignc8 Tactic: 0x4640eb34c8ecc700 Time: 0.00801956
[04/24/2026-01:59:26] [TRT] [V] Tactic Name: sm80_xmma_fprop_implicit_gemm_indexed_wo_smem_f32f32_tf32f32_f32_nhwckrsc_nhwc_tilesize128x16x32_stage1_warpsize4x1x1_g1_tensor16x8x8_aligna4 Tactic: 0xb3e5ce9d1b1da232 Time: 0.00798222
[04/24/2026-01:59:26] [TRT] [V] Tactic Name: sm80_xmma_fprop_implicit_gemm_indexed_wo_smem_f32f32_tf32f32_f32_nhwckrsc_nhwc_tilesize128x16x64_stage1_warpsize4x1x1_g1_tensor16x8x8 Tactic: 0x10383a0781d24dde Time: 0.00451214
[04/24/2026-01:59:26] [TRT] [V] Tactic Name: sm80_xmma_fprop_implicit_gemm_indexed_wo_smem_f32f32_tf32f32_f32_nhwckrsc_nhwc_tilesize128x16x64_stage1_warpsize4x1x1_g1_tensor16x8x8_alignc8 Tactic: 0x4037b478ce77e422 Time: 0.00545325
[04/24/2026-01:59:26] [TRT] [V] Tactic Name: sm80_xmma_fprop_implicit_gemm_indexed_wo_smem_f32f32_tf32f32_f32_nhwckrsc_nhwc_tilesize128x32x64_stage1_warpsize4x1x1_g1_tensor16x8x8_alignc8 Tactic: 0x3a8712b17741b582 Time: 0.00557885
[04/24/2026-01:59:26] [TRT] [V] Tactic Name: sm80_xmma_fprop_implicit_gemm_indexed_wo_smem_f32f32_tf32f32_f32_nhwckrsc_nhwc_tilesize128x32x64_stage1_warpsize4x1x1_g1_tensor16x8x8_alignc4 Tactic: 0xb6f6563c77d057d7 Time: 0.00604781
[04/24/2026-01:59:26] [TRT] [V] Tactic Name: sm80_xmma_fprop_implicit_gemm_indexed_wo_smem_f32f32_tf32f32_f32_nhwckrsc_nhwc_tilesize128x32x64_stage1_warpsize4x1x1_g1_tensor16x8x8_aligna8 Tactic: 0x9355e195cee05798 Time: 0.00628523
[04/24/2026-01:59:26] [TRT] [V] Tactic Name: sm80_xmma_fprop_implicit_gemm_indexed_wo_smem_f32f32_tf32f32_f32_nhwckrsc_nhwc_tilesize128x32x64_stage1_warpsize4x1x1_g1_tensor16x8x8_aligna4_alignc8 Tactic: 0x1acd4f006848c62b Time: 0.00820631
[04/24/2026-01:59:26] [TRT] [V] Tactic Name: sm80_xmma_fprop_implicit_gemm_indexed_wo_smem_f32f32_tf32f32_f32_nhwckrsc_nhwc_tilesize128x16x64_stage1_warpsize4x1x1_g1_tensor16x8x8_alignc4 Tactic: 0xcc46f0f5cee60677 Time: 0.0047061
[04/24/2026-01:59:26] [TRT] [V] Tactic Name: sm80_xmma_fprop_implicit_gemm_indexed_wo_smem_f32f32_tf32f32_f32_nhwckrsc_nhwc_tilesize128x32x16_stage1_warpsize4x1x1_g1_tensor16x8x8 Tactic: 0x9cb304e2edbc1221 Time: 0.00633178
[04/24/2026-01:59:26] [TRT] [V] Tactic Name: sm80_xmma_fprop_implicit_gemm_indexed_wo_smem_f32f32_tf32f32_f32_nhwckrsc_nhwc_tilesize128x32x64_stage1_warpsize4x1x1_g1_tensor16x8x8_aligna8_alignc4 Tactic: 0x93030576a9fb03f9 Time: 0.00668437
[04/24/2026-01:59:26] [TRT] [V] Tactic Name: sm80_xmma_fprop_implicit_gemm_indexed_wo_smem_f32f32_tf32f32_f32_nhwckrsc_nhwc_tilesize128x16x32_stage1_warpsize4x1x1_g1_tensor16x8x8_aligna8 Tactic: 0x3f948a101b8c4067 Time: 0.00764606
[04/24/2026-01:59:26] [TRT] [V] Tactic Name: sm80_xmma_fprop_implicit_gemm_indexed_wo_smem_f32f32_tf32f32_f32_nhwckrsc_nhwc_tilesize128x16x32_stage1_warpsize4x1x1_g1_tensor16x8x8_alignc4 Tactic: 0x1a373db9a2bc4028 Time: 0.00610114
[04/24/2026-01:59:26] [TRT] [V] Tactic Name: sm80_xmma_fprop_implicit_gemm_indexed_wo_smem_f32f32_tf32f32_f32_nhwckrsc_nhwc_tilesize128x16x64_stage1_warpsize4x1x1_g1_tensor16x8x8_aligna8_alignc4 Tactic: 0xab0496509b88ebe0 Time: 0.0067697
[04/24/2026-01:59:26] [TRT] [V] Tactic Name: sm80_xmma_fprop_implicit_gemm_indexed_wo_smem_f32f32_tf32f32_f32_nhwckrsc_nhwc_tilesize128x32x64_stage1_warpsize4x1x1_g1_tensor16x8x8 Tactic: 0xb33296dda7141c64 Time: 0.00531674
[04/24/2026-01:59:26] [TRT] [V] Tactic Name: ampere_scudnn_128x128_ldg4_relu_exp_small_nhwc_tn_v1 Tactic: 0xf90060ce8193b811 Time: 0.02125
[04/24/2026-01:59:26] [TRT] [V] Tactic Name: sm80_xmma_fprop_implicit_gemm_indexed_wo_smem_f32f32_tf32f32_f32_nhwckrsc_nhwc_tilesize128x32x16_stage1_warpsize4x1x1_g1_tensor16x8x8_aligna4 Tactic: 0x570667f2a28165a0 Time: 0.00758642
[04/24/2026-01:59:26] [TRT] [V] Tactic Name: sm80_xmma_fprop_implicit_gemm_indexed_wo_smem_f32f32_tf32f32_f32_nhwckrsc_nhwc_tilesize128x32x16_stage1_warpsize4x1x1_g1_tensor16x8x8_alignc4 Tactic: 0xfed494d61b2087ba Time: 0.00629414
[04/24/2026-01:59:26] [TRT] [V] Tactic Name: sm80_xmma_fprop_implicit_gemm_indexed_wo_smem_f32f32_tf32f32_f32_nhwckrsc_nhwc_tilesize128x32x16_stage1_warpsize4x1x1_g1_tensor16x8x8_aligna8_alignc8 Tactic: 0x7bff86d5f2eadc76 Time: 0.00739455
[04/24/2026-01:59:26] [TRT] [V] Tactic Name: sm80_xmma_fprop_implicit_gemm_f32f32_tf32f32_f32_nhwckrsc_nhwc_tilesize128x128x16_stage4_warpsize2x2x1_g1_tensor16x8x8_t1r5s5 Tactic: 0x94f2b2320bb3fc74 Time: 0.0147919
[04/24/2026-01:59:26] [TRT] [V] Tactic Name: sm80_xmma_fprop_implicit_gemm_indexed_wo_smem_f32f32_tf32f32_f32_nhwckrsc_nhwc_tilesize128x16x32_stage1_warpsize4x1x1_g1_tensor16x8x8_alignc8 Tactic: 0x96467934a22da27d Time: 0.00548284
[04/24/2026-01:59:26] [TRT] [V] Tactic Name: sm80_xmma_fprop_implicit_gemm_indexed_wo_smem_f32f32_tf32f32_f32_nhwckrsc_nhwc_tilesize128x32x16_stage1_warpsize4x1x1_g1_tensor16x8x8_aligna8 Tactic: 0xdb77237fa21087f5 Time: 0.00739594
[04/24/2026-01:59:26] [TRT] [V] Tactic Name: sm80_xmma_fprop_implicit_gemm_indexed_wo_smem_f32f32_tf32f32_f32_nhwckrsc_nhwc_tilesize128x16x64_stage1_warpsize4x1x1_g1_tensor16x8x8_aligna4_alignc8 Tactic: 0x22cadc265a3b2e32 Time: 0.00674816
[04/24/2026-01:59:26] [TRT] [V] Tactic Name: sm80_xmma_fprop_implicit_gemm_indexed_wo_smem_f32f32_tf32f32_f32_nhwckrsc_nhwc_tilesize128x32x16_stage1_warpsize4x1x1_g1_tensor16x8x8_alignc8 Tactic: 0x72a5d05b1bb165ef Time: 0.00587958
[04/24/2026-01:59:26] [TRT] [V] Tactic Name: sm80_xmma_fprop_implicit_gemm_indexed_wo_smem_f32f32_tf32f32_f32_nhwckrsc_nhwc_tilesize128x16x64_stage1_warpsize4x1x1_g1_tensor16x8x8_aligna8 Tactic: 0xe9e5475c77d60638 Time: 0.00607166
[04/24/2026-01:59:26] [TRT] [V] Tactic Name: ampere_scudnn_128x64_sliced1x2_ldg4_relu_exp_large_nhwc_tn_v1 Tactic: 0xbdfdef6b84f7ccc9 Time: 0.023269
[04/24/2026-01:59:26] [TRT] [V] Tactic Name: sm80_xmma_fprop_implicit_gemm_indexed_wo_smem_f32f32_tf32f32_f32_nhwckrsc_nhwc_tilesize128x16x32_stage1_warpsize4x1x1_g1_tensor16x8x8_aligna4_alignc8 Tactic: 0x43ffe5cf09cee087 Time: 0.00703511
[04/24/2026-01:59:26] [TRT] [V] Tactic Name: sm80_xmma_fprop_implicit_gemm_indexed_wo_smem_f32f32_tf32f32_f32_nhwckrsc_nhwc_tilesize128x16x32_stage1_warpsize4x1x1_g1_tensor16x8x8 Tactic: 0xae48d3ccfe1edfcd Time: 0.00486709
[04/24/2026-01:59:26] [TRT] [V] Convolution1 + Activation1 (CaskConvolution[0x80000009]) profiling completed in 0.109126 seconds. Fastest Tactic: 0x10383a0781d24dde Time: 0.00451214
[04/24/2026-01:59:26] [TRT] [V] Skipping CaskFlattenConvolution: No valid tactics for Convolution1 + Activation1
[04/24/2026-01:59:26] [TRT] [V] >>>>>>>>>>>>>>> Chose Runner Type: CaskConvolution Tactic: 0x10383a0781d24dde
[04/24/2026-01:59:26] [TRT] [V] =============== Computing costs for Pooling1
[04/24/2026-01:59:26] [TRT] [V] *************** Autotuning format combination: Float(25088,784,28,1) -> Float(6272,196,14,1) ***************
[04/24/2026-01:59:26] [TRT] [V] --------------- Timing Runner: Pooling1 (CaskPooling[0x8000002f])
[04/24/2026-01:59:26] [TRT] [V] Tactic Name: sm50_xmma_pooling_tiled_FP32NCHW_kMAX_tP2_tQ32_tR2_tS2_tU2_tV2_tUnroll6_tThreads256 Tactic: 0x60eceb67eff69444 Time: 0.00783944
[04/24/2026-01:59:26] [TRT] [V] Tactic Name: sm50_xmma_pooling_tiled_FP32NCHW_kMAX_tP2_tQ32_tR2_tS2_tU2_tV2_tUnroll1_tThreads256 Tactic: 0xc7d8c563bd6ced88 Time: 0.00284673
[04/24/2026-01:59:26] [TRT] [V] Tactic Name: sm50_xmma_pooling_nd_NCDHW_kMAX_kGENERIC_3D_POOLING_MODE_kFLOAT_0 Tactic: 0x5faf4a0a8a5670ed Time: 0.00317816
[04/24/2026-01:59:26] [TRT] [V] Tactic Name: sm50_xmma_pooling_tiled_FP32NCHW_kMAX_tP2_tQ16_tR2_tS2_tU2_tV2_tUnroll6_tThreads128 Tactic: 0xf4b20242f8c135e7 Time: 0.00284294
[04/24/2026-01:59:26] [TRT] [V] Tactic Name: sm50_xmma_pooling_tiled_FP32NCHW_kMAX_tP2_tQ16_tR2_tS2_tU2_tV2_tUnroll2_tThreads128 Tactic: 0xa7a495ee24d0c659 Time: 0.00244002
[04/24/2026-01:59:26] [TRT] [V] Tactic Name: sm50_xmma_pooling_fw_4d_FP32FP32NCHW_Max Tactic: 0xb59f9cfb90407c92 Time: 0.00280856
[04/24/2026-01:59:26] [TRT] [V] Tactic Name: sm50_xmma_pooling_tiled_FP32NCHW_kMAX_tP2_tQ32_tR2_tS2_tU2_tV2_tUnroll8_tThreads256 Tactic: 0xbc5c1844e5cc7959 Time: 0.00274911
[04/24/2026-01:59:26] [TRT] [V] Tactic Name: sm50_xmma_pooling_tiled_FP32NCHW_kMAX_tP2_tQ16_tR2_tS2_tU2_tV2_tUnroll8_tThreads128 Tactic: 0x2802f161f2fbd8fa Time: 0.00259886
[04/24/2026-01:59:26] [TRT] [V] Tactic Name: sm50_xmma_pooling_tiled_FP32NCHW_kMAX_tP2_tQ16_tR2_tS2_tU2_tV2_tUnroll3_tThreads128 Tactic: 0x7a0d6790c453b5f4 Time: 0.00282544
[04/24/2026-01:59:26] [TRT] [V] Tactic Name: sm50_xmma_pooling_tiled_FP32NCHW_kMAX_tP2_tQ16_tR2_tS2_tU2_tV2_tUnroll1_tThreads128 Tactic: 0x53862c46aa5b4c2b Time: 0.00246831
[04/24/2026-01:59:26] [TRT] [V] Tactic Name: sm50_xmma_pooling_tiled_FP32NCHW_kMAX_tP2_tQ16_tR2_tS2_tU2_tV2_tUnroll7_tThreads128 Tactic: 0x291bf03c1842464a Time: 0.00246071
[04/24/2026-01:59:26] [TRT] [V] Tactic Name: sm50_xmma_pooling_tiled_FP32NCHW_kMAX_tP2_tQ32_tR2_tS2_tU2_tV2_tUnroll5_tThreads256 Tactic: 0x94ce52cf617d1e36 Time: 0.00245624
[04/24/2026-01:59:26] [TRT] [V] Tactic Name: sm50_xmma_pooling_tiled_FP32NCHW_kMAX_tP2_tQ32_tR2_tS2_tU2_tV2_tUnroll4_tThreads256 Tactic: 0x4967a0b181fe6d9b Time: 0.00246353
[04/24/2026-01:59:26] [TRT] [V] Tactic Name: sm50_xmma_pooling_tiled_FP32NCHW_kMAX_tP2_tQ16_tR2_tS2_tU2_tV2_tUnroll5_tThreads128 Tactic: 0x0090bbea764abf95 Time: 0.00246267
[04/24/2026-01:59:26] [TRT] [V] Tactic Name: sm50_xmma_pooling_tiled_FP32NCHW_kMAX_tP2_tQ32_tR2_tS2_tU2_tV2_tUnroll7_tThreads256 Tactic: 0xbd4519190f75e7e9 Time: 0.00330635
[04/24/2026-01:59:26] [TRT] [V] Tactic Name: sm50_xmma_pooling_tiled_FP32NCHW_kMAX_tP2_tQ32_tR2_tS2_tU2_tV2_tUnroll2_tThreads256 Tactic: 0x33fa7ccb33e767fa Time: 0.00272841
[04/24/2026-01:59:26] [TRT] [V] Tactic Name: sm50_xmma_pooling_tiled_FP32NCHW_kMAX_tP2_tQ32_tR2_tS2_tU2_tV2_tUnroll3_tThreads256 Tactic: 0xee538eb5d3641457 Time: 0.00244259
[04/24/2026-01:59:26] [TRT] [V] Tactic Name: sm50_xmma_pooling_tiled_FP32NCHW_kMAX_tP2_tQ16_tR2_tS2_tU2_tV2_tUnroll4_tThreads128 Tactic: 0xdd39499496c9cc38 Time: 0.00236342
[04/24/2026-01:59:26] [TRT] [V] Pooling1 (CaskPooling[0x8000002f]) profiling completed in 0.05561 seconds. Fastest Tactic: 0xdd39499496c9cc38 Time: 0.00236342
[04/24/2026-01:59:26] [TRT] [V] >>>>>>>>>>>>>>> Chose Runner Type: CaskPooling Tactic: 0xdd39499496c9cc38
[04/24/2026-01:59:26] [TRT] [V] *************** Autotuning format combination: Float(6272,1:4,224,8) -> Float(1568,1:4,112,8) ***************
[04/24/2026-01:59:26] [TRT] [V] --------------- Timing Runner: Pooling1 (CaskPooling[0x8000002f])
[04/24/2026-01:59:26] [TRT] [V] Tactic Name: sm50_xmma_pooling_max_nhwc_FP32FP32_WINDOWSIZE_0_PROPAGATE_NAN_2D Tactic: 0x8382d5c464539e87 Time: 0.00287816
[04/24/2026-01:59:26] [TRT] [V] Tactic Name: sm50_xmma_pooling_max_nhwc_FP32FP32_WINDOWSIZE_0_NOT_PROPAGATE_NAN_2D Tactic: 0xaec8628e8180bced Time: 0.003013
[04/24/2026-01:59:26] [TRT] [V] Tactic Name: sm50_xmma_pooling_max_nhwc_FP32FP32_WINDOWSIZE_0_PROPAGATE_NAN_3D Tactic: 0xd76bac5638836f8a Time: 0.00288791
[04/24/2026-01:59:26] [TRT] [V] Tactic Name: sm50_xmma_pooling_max_nhwc_FP32FP32_WINDOWSIZE_0_NOT_PROPAGATE_NAN_3D Tactic: 0xfa211b1cdd504de0 Time: 0.00289251
[04/24/2026-01:59:26] [TRT] [V] Tactic Name: sm50_xmma_pooling_fw_4d_FP32FP32NHWC_Max_CAlign4 Tactic: 0x22fb1bb4a70e340d Time: 0.00288809
[04/24/2026-01:59:26] [TRT] [V] Pooling1 (CaskPooling[0x8000002f]) profiling completed in 0.0144833 seconds. Fastest Tactic: 0x8382d5c464539e87 Time: 0.00287816
[04/24/2026-01:59:26] [TRT] [V] >>>>>>>>>>>>>>> Chose Runner Type: CaskPooling Tactic: 0x8382d5c464539e87
[04/24/2026-01:59:26] [TRT] [V] =============== Computing costs for Convolution2 + Activation2
[04/24/2026-01:59:26] [TRT] [V] *************** Autotuning format combination: Float(6272,196,14,1) -> Float(12544,196,14,1) ***************
[04/24/2026-01:59:26] [TRT] [V] --------------- Timing Runner: Convolution2 + Activation2 (CaskConvolution[0x80000009])
[04/24/2026-01:59:26] [TRT] [V] Tactic Name: ampere_scudnn_128x128_relu_medium_nn_v1 Tactic: 0xf067e6205da31c2e Time: 0.0772267
[04/24/2026-01:59:27] [TRT] [V] Tactic Name: ampere_scudnn_128x32_relu_small_nn_v1 Tactic: 0xa8609adc4e0ceb90 Time: 0.0671723
[04/24/2026-01:59:27] [TRT] [V] Tactic Name: ampere_scudnn_128x64_relu_medium_nn_v1 Tactic: 0xf64396b97c889179 Time: 0.070656
[04/24/2026-01:59:27] [TRT] [V] Tactic Name: sm70_xmma_fprop_implicit_gemm_f32f32_f32f32_f32_nchwkcrs_nchw_tilesize64x64x8_stage1_warpsize1x4x1_g1_ffma_aligna4_alignc4 Tactic: 0xe40b38338a3a7d7e Time: 0.0265264
[04/24/2026-01:59:27] [TRT] [V] Tactic Name: sm70_xmma_fprop_implicit_gemm_f32f32_f32f32_f32_nchwkcrs_nchw_tilesize32x32x8_stage1_warpsize1x2x1_g1_ffma_aligna4_alignc4 Tactic: 0xf7a98be0a08d77c4 Time: 0.0240084
[04/24/2026-01:59:27] [TRT] [V] Tactic Name: sm70_xmma_fprop_implicit_gemm_f32f32_f32f32_f32_nchwkcrs_nchw_tilesize64x128x8_stage1_warpsize1x4x1_g1_ffma_aligna4_alignc4 Tactic: 0xd1338f4b38d341e2 Time: 0.0357813
[04/24/2026-01:59:27] [TRT] [V] Tactic Name: sm80_xmma_fprop_implicit_gemm_f32f32_f32f32_f32_nchwkcrs_nchw_tilesize64x128x8_stage3_warpsize1x4x1_g1_ffma_aligna4_alignc4 Tactic: 0x5aa723e0481da855 Time: 0.0384438
[04/24/2026-01:59:27] [TRT] [V] Tactic Name: sm80_xmma_fprop_implicit_gemm_f32f32_f32f32_f32_nchwkcrs_nchw_tilesize256x128x8_stage3_warpsize4x2x1_g1_ffma_aligna4_alignc4 Tactic: 0xbb8c3889c7eacd30 Time: 0.114005
[04/24/2026-01:59:27] [TRT] [V] Tactic Name: sm70_xmma_fprop_implicit_gemm_indexed_f32f32_f32f32_f32_nchwkcrs_nchw_tilesize128x16x8_stage1_warpsize4x1x1_g1_ffma_aligna4_alignc4 Tactic: 0x65d82d184f452332 Time: 0.04242
[04/24/2026-01:59:27] [TRT] [V] Tactic Name: sm70_xmma_fprop_implicit_gemm_indexed_f32f32_f32f32_f32_nchwkcrs_nchw_tilesize32x32x8_stage1_warpsize1x2x1_g1_ffma_aligna4_alignc4 Tactic: 0x9efed776051c0873 Time: 0.0381819
[04/24/2026-01:59:27] [TRT] [V] Tactic Name: sm70_xmma_fprop_implicit_gemm_indexed_f32f32_f32f32_f32_nchwkcrs_nchw_tilesize128x32x8_stage1_warpsize2x2x1_g1_ffma_aligna4_alignc4 Tactic: 0x8c4f6360145d6a1f Time: 0.04618
[04/24/2026-01:59:27] [TRT] [V] Tactic Name: sm70_xmma_fprop_implicit_gemm_indexed_f32f32_f32f32_f32_nchwkcrs_nchw_tilesize64x64x8_stage1_warpsize1x4x1_g1_ffma_aligna4_alignc4 Tactic: 0x8d5c64a52fab02c9 Time: 0.0329425
[04/24/2026-01:59:27] [TRT] [V] Tactic Name: sm80_xmma_fprop_implicit_gemm_indexed_f32f32_f32f32_f32_nchwkcrs_nchw_tilesize128x64x8_stage2_warpsize4x1x1_g1_ffma_aligna4_alignc4_beta0_packed_stride Tactic: 0x1673e3594ce11cea Time: 0.0552731
[04/24/2026-01:59:27] [TRT] [V] Tactic Name: sm80_xmma_fprop_implicit_gemm_indexed_f32f32_f32f32_f32_nchwkcrs_nchw_tilesize128x16x8_stage3_warpsize4x1x1_g1_ffma_aligna4_alignc4 Tactic: 0x40a12e3938221818 Time: 0.0384474
[04/24/2026-01:59:27] [TRT] [V] Tactic Name: sm80_xmma_fprop_implicit_gemm_indexed_f32f32_f32f32_f32_nchwkcrs_nchw_tilesize128x32x8_stage3_warpsize2x2x1_g1_ffma_aligna4_alignc4 Tactic: 0xa9366041633a5135 Time: 0.0425907
[04/24/2026-01:59:27] [TRT] [V] Tactic Name: sm80_xmma_fprop_implicit_gemm_f32f32_f32f32_f32_nchwkcrs_nchw_tilesize32x32x8_stage3_warpsize1x2x1_g1_ffma_t1r5s5_aligna4_alignc4 Tactic: 0x5b8bf1b8028629d9 Time: 0.0187804
[04/24/2026-01:59:27] [TRT] [V] Tactic Name: sm70_xmma_fprop_implicit_gemm_f32f32_f32f32_f32_nchwkcrs_nchw_tilesize32x32x8_stage1_warpsize1x2x1_g1_ffma_t1r5s5_aligna4_alignc4 Tactic: 0x7e1e4d26cfa285f9 Time: 0.0277087
[04/24/2026-01:59:27] [TRT] [V] Tactic Name: ampere_scudnn_128x64_relu_small_nn_v1 Tactic: 0x3f243c490d502deb Time: 0.052093
[04/24/2026-01:59:27] [TRT] [V] Tactic Name: sm70_xmma_fprop_implicit_gemm_f32f32_f32f32_f32_nchwkcrs_nchw_tilesize128x16x8_stage1_warpsize4x1x1_g1_ffma_aligna4_alignc4 Tactic: 0x160b77f4a95ab6d3 Time: 0.0334805
[04/24/2026-01:59:27] [TRT] [V] Tactic Name: sm70_xmma_fprop_implicit_gemm_f32f32_f32f32_f32_nchwkcrs_nchw_tilesize128x64x8_stage1_warpsize2x2x1_g1_ffma_aligna4_alignc4 Tactic: 0x994f5b723e2d80da Time: 0.0437147
[04/24/2026-01:59:27] [TRT] [V] Tactic Name: sm80_xmma_fprop_implicit_gemm_f32f32_f32f32_f32_nchwkcrs_nchw_tilesize64x64x8_stage3_warpsize1x4x1_g1_ffma_aligna4_alignc4 Tactic: 0xa31d27de74b895ff Time: 0.0254613
[04/24/2026-01:59:27] [TRT] [V] Tactic Name: sm80_xmma_fprop_implicit_gemm_f32f32_f32f32_f32_nchwkcrs_nchw_tilesize32x32x8_stage3_warpsize1x2x1_g1_ffma_aligna4_alignc4 Tactic: 0xb0bf940d5e0f9f45 Time: 0.0193203
[04/24/2026-01:59:27] [TRT] [V] Tactic Name: ampere_scudnn_128x64_relu_xregs_large_nn_v1 Tactic: 0x5deb29b7a8e275f7 Time: 0.061776
[04/24/2026-01:59:27] [TRT] [V] Tactic Name: sm70_xmma_fprop_implicit_gemm_f32f32_f32f32_f32_nchwkcrs_nchw_tilesize64x64x8_stage1_warpsize1x4x1_g1_ffma_t1r5s5_aligna4_alignc4 Tactic: 0xb3ea28771604ad88 Time: 0.0262835
[04/24/2026-01:59:27] [TRT] [V] Tactic Name: sm80_xmma_fprop_implicit_gemm_f32f32_f32f32_f32_nchwkcrs_nchw_tilesize128x16x8_stage3_warpsize4x1x1_g1_ffma_aligna4_alignc4 Tactic: 0x9d9fdb5fd9945f64 Time: 0.0253105
[04/24/2026-01:59:27] [TRT] [V] Tactic Name: sm80_xmma_fprop_implicit_gemm_indexed_f32f32_f32f32_f32_nchwkcrs_nchw_tilesize64x64x8_stage3_warpsize1x4x1_g1_ffma_aligna4_alignc4 Tactic: 0xd828f024626fa982 Time: 0.0310652
[04/24/2026-01:59:27] [TRT] [V] Tactic Name: sm80_xmma_fprop_implicit_gemm_f32f32_f32f32_f32_nchwkcrs_nchw_tilesize128x64x8_stage3_warpsize2x2x1_g1_ffma_aligna4_alignc4 Tactic: 0x12dbf7d94ee3696d Time: 0.0409873
[04/24/2026-01:59:27] [TRT] [V] Tactic Name: sm80_xmma_fprop_implicit_gemm_f32f32_f32f32_f32_nchwkcrs_nchw_tilesize64x64x8_stage3_warpsize1x4x1_g1_ffma_t1r5s5_aligna4_alignc4 Tactic: 0x967f94e9db2001a8 Time: 0.0240777
[04/24/2026-01:59:27] [TRT] [V] Tactic Name: sm80_xmma_fprop_implicit_gemm_indexed_f32f32_f32f32_f32_nchwkcrs_nchw_tilesize32x32x8_stage3_warpsize1x2x1_g1_ffma_aligna4_alignc4 Tactic: 0xcb8a43f748d8a338 Time: 0.0251589
[04/24/2026-01:59:27] [TRT] [V] Tactic Name: sm70_xmma_fprop_implicit_gemm_f32f32_f32f32_f32_nchwkcrs_nchw_tilesize128x256x8_stage1_warpsize2x4x1_g1_ffma_aligna4_alignc4 Tactic: 0xd2aa21bfe2167c0c Time: 0.107669
[04/24/2026-01:59:27] [TRT] [V] Tactic Name: ampere_scudnn_128x128_relu_small_nn_v1 Tactic: 0x503619c69ae500ff Time: 0.0662187
[04/24/2026-01:59:27] [TRT] [V] Tactic Name: sm80_xmma_fprop_implicit_gemm_indexed_f32f32_f32f32_f32_nchwkcrs_nchw_tilesize128x64x8_stage2_warpsize1x4x1_g1_ffma_aligna4_alignc4_beta0_packed_stride Tactic: 0xede36641840ce3d2 Time: 0.050525
[04/24/2026-01:59:27] [TRT] [V] Tactic Name: sm70_xmma_fprop_implicit_gemm_f32f32_f32f32_f32_nchwkcrs_nchw_tilesize128x128x8_stage1_warpsize2x2x1_g1_ffma_aligna4_alignc4 Tactic: 0xac49795b871b0d29 Time: 0.0665191
[04/24/2026-01:59:27] [TRT] [V] Tactic Name: sm80_xmma_fprop_implicit_gemm_indexed_f32f32_f32f32_f32_nchwkcrs_nchw_tilesize128x64x8_stage2_warpsize2x2x1_g1_ffma_aligna4_alignc4_beta0_packed_stride Tactic: 0x31aa67f57c5aea77 Time: 0.0507398
[04/24/2026-01:59:27] [TRT] [V] Convolution2 + Activation2 (CaskConvolution[0x80000009]) profiling completed in 0.0825807 seconds. Fastest Tactic: 0x5b8bf1b8028629d9 Time: 0.0187804
[04/24/2026-01:59:27] [TRT] [V] Skipping CaskFlattenConvolution: No valid tactics for Convolution2 + Activation2
[04/24/2026-01:59:27] [TRT] [V] >>>>>>>>>>>>>>> Chose Runner Type: CaskConvolution Tactic: 0x5b8bf1b8028629d9
[04/24/2026-01:59:27] [TRT] [V] *************** Autotuning format combination: Float(6272,1,448,32) -> Float(12544,1,896,64) ***************
[04/24/2026-01:59:27] [TRT] [V] --------------- Timing Runner: Convolution2 + Activation2 (CaskConvolution[0x80000009])
[04/24/2026-01:59:27] [TRT] [V] Tactic Name: sm70_xmma_fprop_implicit_gemm_f32f32_f32f32_f32_nhwckrsc_nhwc_tilesize64x32x32_stage1_warpsize1x1x1_g1_ffma_t1r5s5_aligna4_alignc4 Tactic: 0x737793996edbf8e2 Time: 0.110592
[04/24/2026-01:59:27] [TRT] [V] Tactic Name: sm80_xmma_fprop_implicit_gemm_f32f32_f32f32_f32_nhwckrsc_nhwc_tilesize64x64x8_stage3_warpsize1x4x1_g1_ffma_t1r5s5_aligna4_alignc4 Tactic: 0x45ff0c3a09b02e78 Time: 0.0239322
[04/24/2026-01:59:27] [TRT] [V] Tactic Name: sm80_xmma_fprop_implicit_gemm_f32f32_f32f32_f32_nhwckrsc_nhwc_tilesize128x64x8_stage3_warpsize2x2x1_g1_ffma_aligna4_alignc4 Tactic: 0x1da91d865428f237 Time: 0.0364715
[04/24/2026-01:59:27] [TRT] [V] Tactic Name: sm70_xmma_fprop_implicit_gemm_indexed_f32f32_f32f32_f32_nhwckrsc_nhwc_tilesize32x32x8_stage1_warpsize1x2x1_g1_ffma_aligna4_alignc4 Tactic: 0x5f60af66e8eb9b51 Time: 0.0303166
[04/24/2026-01:59:27] [TRT] [V] Tactic Name: sm70_xmma_fprop_implicit_gemm_indexed_f32f32_f32f32_f32_nhwckrsc_nhwc_tilesize128x32x8_stage1_warpsize2x2x1_g1_ffma_aligna4_alignc4 Tactic: 0x833d893f0e96f145 Time: 0.0339243
[04/24/2026-01:59:27] [TRT] [V] Tactic Name: sm80_xmma_fprop_implicit_gemm_indexed_wo_smem_f32f32_tf32f32_f32_nhwckrsc_nhwc_tilesize128x32x16_stage1_warpsize4x1x1_g1_tensor16x8x8_aligna4_alignc4 Tactic: 0xf231cca3335919a4 Time: 0.0353504
[04/24/2026-01:59:27] [TRT] [V] Tactic Name: sm70_xmma_fprop_implicit_gemm_f32f32_f32f32_f32_nhwckrsc_nhwc_tilesize64x16x16_stage1_warpsize1x1x1_g1_ffma_t1r5s5_aligna4_alignc4 Tactic: 0x247bb0dcaf6f9760 Time: 0.0293342
[04/24/2026-01:59:27] [TRT] [V] Tactic Name: sm80_xmma_fprop_implicit_gemm_indexed_f32f32_f32f32_f32_nhwckrsc_nhwc_tilesize128x16x8_stage3_warpsize4x1x1_g1_ffma_aligna4_alignc4 Tactic: 0x4fd3c46622e98342 Time: 0.0300142
[04/24/2026-01:59:27] [TRT] [V] Tactic Name: sm80_xmma_fprop_implicit_gemm_indexed_wo_smem_f32f32_tf32f32_f32_nhwckrsc_nhwc_tilesize128x16x32_stage1_warpsize4x1x1_g1_tensor16x8x8_aligna4_alignc4 Tactic: 0xcf8ea142095f02d2 Time: 0.0297636
[04/24/2026-01:59:27] [TRT] [V] Tactic Name: sm80_xmma_fprop_implicit_gemm_f32f32_f32f32_f32_nhwckrsc_nhwc_tilesize32x32x8_stage3_warpsize1x2x1_g1_ffma_t1r5s5_aligna4_alignc4 Tactic: 0x880b696bd0160609 Time: 0.014944
[04/24/2026-01:59:27] [TRT] [V] Tactic Name: sm70_xmma_fprop_implicit_gemm_f32f32_f32f32_f32_nhwckrsc_nhwc_tilesize128x16x8_stage1_warpsize4x1x1_g1_ffma_aligna4_alignc4 Tactic: 0x19799dabb3912d89 Time: 0.0307821
[04/24/2026-01:59:27] [TRT] [V] Tactic Name: sm70_xmma_fprop_implicit_gemm_f32f32_f32f32_f32_nhwckrsc_nhwc_tilesize64x128x8_stage1_warpsize1x4x1_g1_ffma_aligna4_alignc4 Tactic: 0xde4165142218dab8 Time: 0.0348555
[04/24/2026-01:59:27] [TRT] [V] Tactic Name: sm70_xmma_fprop_implicit_gemm_f32f32_f32f32_f32_nhwckrsc_nhwc_tilesize128x64x8_stage1_warpsize2x2x1_g1_ffma_aligna4_alignc4 Tactic: 0x963db12d24e61b80 Time: 0.0357824
[04/24/2026-01:59:27] [TRT] [V] Tactic Name: sm80_xmma_fprop_implicit_gemm_indexed_f32f32_f32f32_f32_nhwckrsc_nhwc_tilesize128x32x8_stage3_warpsize2x2x1_g1_ffma_aligna4_alignc4 Tactic: 0xa6448a1e79f1ca6f Time: 0.0288044
[04/24/2026-01:59:27] [TRT] [V] Tactic Name: sm80_xmma_fprop_implicit_gemm_f32f32_f32f32_f32_nhwckrsc_nhwc_tilesize128x16x8_stage3_warpsize4x1x1_g1_ffma_t1r5s5_aligna4_alignc4 Tactic: 0xe35d4a4a3b499fe7 Time: 0.019904
[04/24/2026-01:59:27] [TRT] [V] Tactic Name: sm80_xmma_fprop_implicit_gemm_indexed_f32f32_f32f32_f32_nhwckrsc_nhwc_tilesize64x64x8_stage3_warpsize1x4x1_g1_ffma_aligna4_alignc4 Tactic: 0x19b688348f983aa0 Time: 0.0263787
[04/24/2026-01:59:27] [TRT] [V] Tactic Name: sm80_xmma_fprop_implicit_gemm_f32f32_f32f32_f32_nhwckrsc_nhwc_tilesize256x64x8_stage3_warpsize2x2x1_g1_ffma_aligna4_alignc4 Tactic: 0x8014228ec08b4d49 Time: 0.062464
[04/24/2026-01:59:27] [TRT] [V] Tactic Name: sm70_xmma_fprop_implicit_gemm_f32f32_f32f32_f32_nhwckrsc_nhwc_tilesize128x16x8_stage1_warpsize4x1x1_g1_ffma_t1r5s5_aligna4_alignc4 Tactic: 0x54e3b8c9b1e5f17a Time: 0.0298516
[04/24/2026-01:59:27] [TRT] [V] Tactic Name: sm70_xmma_fprop_implicit_gemm_indexed_f32f32_f32f32_f32_nhwckrsc_nhwc_tilesize128x16x8_stage1_warpsize4x1x1_g1_ffma_aligna4_alignc4 Tactic: 0x6aaac747558eb868 Time: 0.0339339
[04/24/2026-01:59:27] [TRT] [V] Tactic Name: sm70_xmma_fprop_implicit_gemm_f32f32_f32f32_f32_nhwckrsc_nhwc_tilesize32x32x8_stage1_warpsize1x2x1_g1_ffma_aligna4_alignc4 Tactic: 0x3637f3f04d7ae4e6 Time: 0.0300142
[04/24/2026-01:59:27] [TRT] [V] Tactic Name: sm70_xmma_fprop_implicit_gemm_f32f32_f32f32_f32_nhwckrsc_nhwc_tilesize64x32x32_stage1_warpsize1x1x1_g1_ffma_aligna4_alignc4 Tactic: 0xdb73e25ae4006f74 Time: 0.110531
[04/24/2026-01:59:27] [TRT] [V] Tactic Name: sm70_xmma_fprop_implicit_gemm_f32f32_f32f32_f32_nhwckrsc_nhwc_tilesize64x64x8_stage1_warpsize1x4x1_g1_ffma_aligna4_alignc4 Tactic: 0x2595402367cdee5c Time: 0.0283404
[04/24/2026-01:59:27] [TRT] [V] Tactic Name: sm80_xmma_fprop_implicit_gemm_f32f32_f32f32_f32_nhwckrsc_nhwc_tilesize128x16x8_stage3_warpsize4x1x1_g1_ffma_aligna4_alignc4 Tactic: 0x92ed3100c35fc43e Time: 0.0208507
[04/24/2026-01:59:27] [TRT] [V] Tactic Name: sm80_xmma_fprop_implicit_gemm_f32f32_f32f32_f32_nhwckrsc_nhwc_tilesize64x64x8_stage3_warpsize1x4x1_g1_ffma_aligna4_alignc4 Tactic: 0x62835fce994f06dd Time: 0.0242583
[04/24/2026-01:59:27] [TRT] [V] Tactic Name: sm70_xmma_fprop_implicit_gemm_f32f32_f32f32_f32_nhwckrsc_nhwc_tilesize32x32x8_stage1_warpsize1x2x1_g1_ffma_t1r5s5_aligna4_alignc4 Tactic: 0xad9ed5f51d32aa29 Time: 0.0285396
[04/24/2026-01:59:27] [TRT] [V] Tactic Name: sm70_xmma_fprop_implicit_gemm_f32f32_f32f32_f32_nhwckrsc_nhwc_tilesize64x16x16_stage1_warpsize1x1x1_g1_ffma_aligna4_alignc4 Tactic: 0x3f904b355d9ca8e6 Time: 0.0300711
[04/24/2026-01:59:27] [TRT] [V] Tactic Name: sm80_xmma_fprop_implicit_gemm_indexed_f32f32_f32f32_f32_nhwckrsc_nhwc_tilesize32x32x8_stage3_warpsize1x2x1_g1_ffma_aligna4_alignc4 Tactic: 0x0a143be7a52f301a Time: 0.0188504
[04/24/2026-01:59:27] [TRT] [V] Tactic Name: sm80_xmma_fprop_implicit_gemm_f32f32_f32f32_f32_nhwckrsc_nhwc_tilesize32x32x8_stage3_warpsize1x2x1_g1_ffma_aligna4_alignc4 Tactic: 0x7121ec1db3f80c67 Time: 0.0155079
[04/24/2026-01:59:27] [TRT] [V] Tactic Name: sm70_xmma_fprop_implicit_gemm_f32f32_f32f32_f32_nhwckrsc_nhwc_tilesize256x128x8_stage1_warpsize2x4x1_g1_ffma_aligna4_alignc4 Tactic: 0x0447933cc2be855a Time: 0.103856
[04/24/2026-01:59:27] [TRT] [V] Convolution2 + Activation2 (CaskConvolution[0x80000009]) profiling completed in 0.0666611 seconds. Fastest Tactic: 0x880b696bd0160609 Time: 0.014944
[04/24/2026-01:59:27] [TRT] [V] Skipping CaskFlattenConvolution: No valid tactics for Convolution2 + Activation2
[04/24/2026-01:59:27] [TRT] [V] >>>>>>>>>>>>>>> Chose Runner Type: CaskConvolution Tactic: 0x880b696bd0160609
[04/24/2026-01:59:27] [TRT] [V] *************** Autotuning format combination: Float(1568,1:4,112,8) -> Float(12544,196,14,1) ***************
[04/24/2026-01:59:27] [TRT] [V] --------------- Timing Runner: Convolution2 + Activation2 (CaskConvolution[0x80000009])
[04/24/2026-01:59:27] [TRT] [V] Tactic Name: sm80_xmma_fprop_implicit_gemm_indexed_f32f32_tf32f32_f32_nhwckrsc_nchw_tilesize128x128x16_stage4_warpsize2x2x1_g1_tensor16x8x8_alignc4 Tactic: 0xe8f7b6a5bab325f8 Time: 0.0282089
[04/24/2026-01:59:27] [TRT] [V] Tactic Name: sm80_xmma_fprop_implicit_gemm_f32f32_tf32f32_f32_nhwckrsc_nchw_tilesize128x128x16_stage4_warpsize2x2x1_g1_tensor16x8x8_alignc4 Tactic: 0x9fd9fe001908ce2e Time: 0.0264107
[04/24/2026-01:59:27] [TRT] [V] Convolution2 + Activation2 (CaskConvolution[0x80000009]) profiling completed in 0.00446154 seconds. Fastest Tactic: 0x9fd9fe001908ce2e Time: 0.0264107
[04/24/2026-01:59:27] [TRT] [V] Skipping CaskFlattenConvolution: No valid tactics for Convolution2 + Activation2
[04/24/2026-01:59:27] [TRT] [V] >>>>>>>>>>>>>>> Chose Runner Type: CaskConvolution Tactic: 0x9fd9fe001908ce2e
[04/24/2026-01:59:27] [TRT] [V] *************** Autotuning format combination: Float(1568,1:4,112,8) -> Float(3136,1:4,224,16) ***************
[04/24/2026-01:59:27] [TRT] [V] --------------- Timing Runner: Convolution2 + Activation2 (CaskConvolution[0x80000009])
[04/24/2026-01:59:27] [TRT] [V] Tactic Name: ampere_scudnn_128x32_sliced1x4_ldg4_relu_exp_small_nhwc_tn_v1 Tactic: 0x3e2b881168d9689d Time: 0.0233913
[04/24/2026-01:59:27] [TRT] [V] Tactic Name: ampere_scudnn_128x128_ldg4_relu_exp_medium_nhwc_tn_v1 Tactic: 0x7bc32c782b800c48 Time: 0.065536
[04/24/2026-01:59:27] [TRT] [V] Tactic Name: sm80_xmma_fprop_implicit_gemm_f32f32_tf32f32_f32_nhwckrsc_nhwc_tilesize128x128x16_stage4_warpsize2x2x1_g1_tensor16x8x8 Tactic: 0xb443c221fcb1565b Time: 0.0255596
[04/24/2026-01:59:27] [TRT] [V] Tactic Name: sm80_xmma_fprop_implicit_gemm_indexed_f32f32_tf32f32_f32_nhwckrsc_nhwc_tilesize128x128x16_stage4_warpsize2x2x1_g1_tensor16x8x8 Tactic: 0x65e41d81f093b482 Time: 0.0273666
[04/24/2026-01:59:27] [TRT] [V] Tactic Name: sm80_xmma_fprop_implicit_gemm_indexed_wo_smem_f32f32_tf32f32_f32_nhwckrsc_nhwc_tilesize128x32x16_stage1_warpsize4x1x1_g1_tensor16x8x8_aligna8_alignc4 Tactic: 0xf78ec258f27b3e23 Time: 0.0380883
[04/24/2026-01:59:27] [TRT] [V] Tactic Name: sm80_xmma_fprop_implicit_gemm_indexed_wo_smem_f32f32_tf32f32_f32_nhwckrsc_nhwc_tilesize128x32x16_stage1_warpsize4x1x1_g1_tensor16x8x8_aligna4_alignc8 Tactic: 0x7e40882e33c8fbf1 Time: 0.0349952
[04/24/2026-01:59:27] [TRT] [V] Tactic Name: sm80_xmma_fprop_implicit_gemm_indexed_wo_smem_f32f32_tf32f32_f32_nhwckrsc_nhwc_tilesize128x16x32_stage1_warpsize4x1x1_g1_tensor16x8x8_aligna8_alignc8 Tactic: 0x4640eb34c8ecc700 Time: 0.0368373
[04/24/2026-01:59:27] [TRT] [V] Tactic Name: sm80_xmma_fprop_implicit_gemm_indexed_wo_smem_f32f32_tf32f32_f32_nhwckrsc_nhwc_tilesize128x16x32_stage1_warpsize4x1x1_g1_tensor16x8x8_aligna4 Tactic: 0xb3e5ce9d1b1da232 Time: 0.0345696
[04/24/2026-01:59:27] [TRT] [V] Tactic Name: sm80_xmma_fprop_implicit_gemm_indexed_wo_smem_f32f32_tf32f32_f32_nhwckrsc_nhwc_tilesize128x16x64_stage1_warpsize4x1x1_g1_tensor16x8x8 Tactic: 0x10383a0781d24dde Time: 0.0110369
[04/24/2026-01:59:27] [TRT] [V] Tactic Name: sm80_xmma_fprop_implicit_gemm_indexed_wo_smem_f32f32_tf32f32_f32_nhwckrsc_nhwc_tilesize128x16x64_stage1_warpsize4x1x1_g1_tensor16x8x8_alignc8 Tactic: 0x4037b478ce77e422 Time: 0.0188646
[04/24/2026-01:59:27] [TRT] [V] Tactic Name: sm80_xmma_fprop_implicit_gemm_indexed_wo_smem_f32f32_tf32f32_f32_nhwckrsc_nhwc_tilesize128x32x64_stage1_warpsize4x1x1_g1_tensor16x8x8_alignc8 Tactic: 0x3a8712b17741b582 Time: 0.0173787
[04/24/2026-01:59:27] [TRT] [V] Tactic Name: sm80_xmma_fprop_implicit_gemm_indexed_wo_smem_f32f32_tf32f32_f32_nhwckrsc_nhwc_tilesize128x32x64_stage1_warpsize4x1x1_g1_tensor16x8x8_alignc4 Tactic: 0xb6f6563c77d057d7 Time: 0.0177903
[04/24/2026-01:59:27] [TRT] [V] Tactic Name: sm80_xmma_fprop_implicit_gemm_indexed_wo_smem_f32f32_tf32f32_f32_nhwckrsc_nhwc_tilesize128x32x64_stage1_warpsize4x1x1_g1_tensor16x8x8_aligna8 Tactic: 0x9355e195cee05798 Time: 0.0211773
[04/24/2026-01:59:27] [TRT] [V] Tactic Name: sm80_xmma_fprop_implicit_gemm_indexed_wo_smem_f32f32_tf32f32_f32_nhwckrsc_nhwc_tilesize128x32x64_stage1_warpsize4x1x1_g1_tensor16x8x8_aligna4_alignc8 Tactic: 0x1acd4f006848c62b Time: 0.0352544
[04/24/2026-01:59:27] [TRT] [V] Tactic Name: sm80_xmma_fprop_implicit_gemm_indexed_wo_smem_f32f32_tf32f32_f32_nhwckrsc_nhwc_tilesize128x16x64_stage1_warpsize4x1x1_g1_tensor16x8x8_alignc4 Tactic: 0xcc46f0f5cee60677 Time: 0.0113657
[04/24/2026-01:59:27] [TRT] [V] Tactic Name: sm80_xmma_fprop_implicit_gemm_indexed_wo_smem_f32f32_tf32f32_f32_nhwckrsc_nhwc_tilesize128x32x16_stage1_warpsize4x1x1_g1_tensor16x8x8 Tactic: 0x9cb304e2edbc1221 Time: 0.0233287
[04/24/2026-01:59:27] [TRT] [V] Tactic Name: sm80_xmma_fprop_implicit_gemm_indexed_wo_smem_f32f32_tf32f32_f32_nhwckrsc_nhwc_tilesize128x32x64_stage1_warpsize4x1x1_g1_tensor16x8x8_aligna8_alignc4 Tactic: 0x93030576a9fb03f9 Time: 0.0218647
[04/24/2026-01:59:27] [TRT] [V] Tactic Name: sm80_xmma_fprop_implicit_gemm_indexed_wo_smem_f32f32_tf32f32_f32_nhwckrsc_nhwc_tilesize128x16x32_stage1_warpsize4x1x1_g1_tensor16x8x8_aligna8 Tactic: 0x3f948a101b8c4067 Time: 0.0347925
[04/24/2026-01:59:27] [TRT] [V] Tactic Name: sm80_xmma_fprop_implicit_gemm_indexed_wo_smem_f32f32_tf32f32_f32_nhwckrsc_nhwc_tilesize128x16x32_stage1_warpsize4x1x1_g1_tensor16x8x8_alignc4 Tactic: 0x1a373db9a2bc4028 Time: 0.0204706
[04/24/2026-01:59:27] [TRT] [V] Tactic Name: sm80_xmma_fprop_implicit_gemm_indexed_wo_smem_f32f32_tf32f32_f32_nhwckrsc_nhwc_tilesize128x16x64_stage1_warpsize4x1x1_g1_tensor16x8x8_aligna8_alignc4 Tactic: 0xab0496509b88ebe0 Time: 0.0278329
[04/24/2026-01:59:27] [TRT] [V] Tactic Name: sm80_xmma_fprop_implicit_gemm_indexed_wo_smem_f32f32_tf32f32_f32_nhwckrsc_nhwc_tilesize128x32x64_stage1_warpsize4x1x1_g1_tensor16x8x8 Tactic: 0xb33296dda7141c64 Time: 0.0180761
[04/24/2026-01:59:27] [TRT] [V] Tactic Name: ampere_scudnn_128x128_ldg4_relu_exp_small_nhwc_tn_v1 Tactic: 0xf90060ce8193b811 Time: 0.0646311
[04/24/2026-01:59:27] [TRT] [V] Tactic Name: sm80_xmma_fprop_implicit_gemm_indexed_wo_smem_f32f32_tf32f32_f32_nhwckrsc_nhwc_tilesize128x32x16_stage1_warpsize4x1x1_g1_tensor16x8x8_aligna4 Tactic: 0x570667f2a28165a0 Time: 0.0385837
[04/24/2026-01:59:27] [TRT] [V] Tactic Name: sm80_xmma_fprop_implicit_gemm_indexed_wo_smem_f32f32_tf32f32_f32_nhwckrsc_nhwc_tilesize128x32x16_stage1_warpsize4x1x1_g1_tensor16x8x8_alignc4 Tactic: 0xfed494d61b2087ba Time: 0.0234354
[04/24/2026-01:59:27] [TRT] [V] Tactic Name: sm80_xmma_fprop_implicit_gemm_indexed_wo_smem_f32f32_tf32f32_f32_nhwckrsc_nhwc_tilesize128x32x16_stage1_warpsize4x1x1_g1_tensor16x8x8_aligna8_alignc8 Tactic: 0x7bff86d5f2eadc76 Time: 0.0376972
[04/24/2026-01:59:27] [TRT] [V] Tactic Name: sm80_xmma_fprop_implicit_gemm_f32f32_tf32f32_f32_nhwckrsc_nhwc_tilesize128x128x16_stage4_warpsize2x2x1_g1_tensor16x8x8_t1r5s5 Tactic: 0x94f2b2320bb3fc74 Time: 0.0247619
[04/24/2026-01:59:27] [TRT] [V] Tactic Name: sm80_xmma_fprop_implicit_gemm_indexed_wo_smem_f32f32_tf32f32_f32_nhwckrsc_nhwc_tilesize128x16x32_stage1_warpsize4x1x1_g1_tensor16x8x8_alignc8 Tactic: 0x96467934a22da27d Time: 0.0204104
[04/24/2026-01:59:27] [TRT] [V] Tactic Name: sm80_xmma_fprop_implicit_gemm_indexed_wo_smem_f32f32_tf32f32_f32_nhwckrsc_nhwc_tilesize128x32x16_stage1_warpsize4x1x1_g1_tensor16x8x8_aligna8 Tactic: 0xdb77237fa21087f5 Time: 0.0365109
[04/24/2026-01:59:27] [TRT] [V] Tactic Name: sm80_xmma_fprop_implicit_gemm_indexed_wo_smem_f32f32_tf32f32_f32_nhwckrsc_nhwc_tilesize128x16x64_stage1_warpsize4x1x1_g1_tensor16x8x8_aligna4_alignc8 Tactic: 0x22cadc265a3b2e32 Time: 0.0283164
[04/24/2026-01:59:27] [TRT] [V] Tactic Name: sm80_xmma_fprop_implicit_gemm_indexed_wo_smem_f32f32_tf32f32_f32_nhwckrsc_nhwc_tilesize128x32x16_stage1_warpsize4x1x1_g1_tensor16x8x8_alignc8 Tactic: 0x72a5d05b1bb165ef Time: 0.0230315
[04/24/2026-01:59:27] [TRT] [V] Tactic Name: sm80_xmma_fprop_implicit_gemm_indexed_wo_smem_f32f32_tf32f32_f32_nhwckrsc_nhwc_tilesize128x16x64_stage1_warpsize4x1x1_g1_tensor16x8x8_aligna8 Tactic: 0xe9e5475c77d60638 Time: 0.0267077
[04/24/2026-01:59:27] [TRT] [V] Tactic Name: ampere_scudnn_128x64_sliced1x2_ldg4_relu_exp_large_nhwc_tn_v1 Tactic: 0xbdfdef6b84f7ccc9 Time: 0.042488
[04/24/2026-01:59:27] [TRT] [V] Tactic Name: sm80_xmma_fprop_implicit_gemm_indexed_wo_smem_f32f32_tf32f32_f32_nhwckrsc_nhwc_tilesize128x16x32_stage1_warpsize4x1x1_g1_tensor16x8x8_aligna4_alignc8 Tactic: 0x43ffe5cf09cee087 Time: 0.0296089
[04/24/2026-01:59:27] [TRT] [V] Tactic Name: sm80_xmma_fprop_implicit_gemm_indexed_wo_smem_f32f32_tf32f32_f32_nhwckrsc_nhwc_tilesize128x16x32_stage1_warpsize4x1x1_g1_tensor16x8x8 Tactic: 0xae48d3ccfe1edfcd Time: 0.0162834
[04/24/2026-01:59:27] [TRT] [V] Convolution2 + Activation2 (CaskConvolution[0x80000009]) profiling completed in 0.0810995 seconds. Fastest Tactic: 0x10383a0781d24dde Time: 0.0110369
[04/24/2026-01:59:27] [TRT] [V] Skipping CaskFlattenConvolution: No valid tactics for Convolution2 + Activation2
[04/24/2026-01:59:27] [TRT] [V] >>>>>>>>>>>>>>> Chose Runner Type: CaskConvolution Tactic: 0x10383a0781d24dde
[04/24/2026-01:59:27] [TRT] [V] =============== Computing costs for Pooling2
[04/24/2026-01:59:27] [TRT] [V] *************** Autotuning format combination: Float(12544,196,14,1) -> Float(3136,49,7,1) ***************
[04/24/2026-01:59:27] [TRT] [V] --------------- Timing Runner: Pooling2 (CaskPooling[0x8000002f])
[04/24/2026-01:59:27] [TRT] [V] Tactic Name: sm50_xmma_pooling_tiled_FP32NCHW_kMAX_tP2_tQ32_tR2_tS2_tU2_tV2_tUnroll6_tThreads256 Tactic: 0x60eceb67eff69444 Time: 0.00261625
[04/24/2026-01:59:27] [TRT] [V] Tactic Name: sm50_xmma_pooling_tiled_FP32NCHW_kMAX_tP2_tQ32_tR2_tS2_tU2_tV2_tUnroll1_tThreads256 Tactic: 0xc7d8c563bd6ced88 Time: 0.00267401
[04/24/2026-01:59:27] [TRT] [V] Tactic Name: sm50_xmma_pooling_nd_NCDHW_kMAX_kGENERIC_3D_POOLING_MODE_kFLOAT_0 Tactic: 0x5faf4a0a8a5670ed Time: 0.00338306
[04/24/2026-01:59:27] [TRT] [V] Tactic Name: sm50_xmma_pooling_tiled_FP32NCHW_kMAX_tP2_tQ16_tR2_tS2_tU2_tV2_tUnroll6_tThreads128 Tactic: 0xf4b20242f8c135e7 Time: 0.00260467
[04/24/2026-01:59:27] [TRT] [V] Tactic Name: sm50_xmma_pooling_tiled_FP32NCHW_kMAX_tP2_tQ16_tR2_tS2_tU2_tV2_tUnroll2_tThreads128 Tactic: 0xa7a495ee24d0c659 Time: 0.00248636
[04/24/2026-01:59:27] [TRT] [V] Tactic Name: sm50_xmma_pooling_fw_4d_FP32FP32NCHW_Max Tactic: 0xb59f9cfb90407c92 Time: 0.00275174
[04/24/2026-01:59:27] [TRT] [V] Tactic Name: sm50_xmma_pooling_tiled_FP32NCHW_kMAX_tP2_tQ32_tR2_tS2_tU2_tV2_tUnroll8_tThreads256 Tactic: 0xbc5c1844e5cc7959 Time: 0.00262694
[04/24/2026-01:59:27] [TRT] [V] Tactic Name: sm50_xmma_pooling_tiled_FP32NCHW_kMAX_tP2_tQ16_tR2_tS2_tU2_tV2_tUnroll8_tThreads128 Tactic: 0x2802f161f2fbd8fa Time: 0.00252126
[04/24/2026-01:59:27] [TRT] [V] Tactic Name: sm50_xmma_pooling_tiled_FP32NCHW_kMAX_tP2_tQ16_tR2_tS2_tU2_tV2_tUnroll3_tThreads128 Tactic: 0x7a0d6790c453b5f4 Time: 0.00280273
[04/24/2026-01:59:27] [TRT] [V] Tactic Name: sm50_xmma_pooling_tiled_FP32NCHW_kMAX_tP2_tQ16_tR2_tS2_tU2_tV2_tUnroll1_tThreads128 Tactic: 0x53862c46aa5b4c2b Time: 0.00259729
[04/24/2026-01:59:27] [TRT] [V] Tactic Name: sm50_xmma_pooling_tiled_FP32NCHW_kMAX_tP2_tQ16_tR2_tS2_tU2_tV2_tUnroll7_tThreads128 Tactic: 0x291bf03c1842464a Time: 0.00255121
[04/24/2026-01:59:27] [TRT] [V] Tactic Name: sm50_xmma_pooling_tiled_FP32NCHW_kMAX_tP2_tQ32_tR2_tS2_tU2_tV2_tUnroll5_tThreads256 Tactic: 0x94ce52cf617d1e36 Time: 0.00250404
[04/24/2026-01:59:27] [TRT] [V] Tactic Name: sm50_xmma_pooling_tiled_FP32NCHW_kMAX_tP2_tQ32_tR2_tS2_tU2_tV2_tUnroll4_tThreads256 Tactic: 0x4967a0b181fe6d9b Time: 0.00247625
[04/24/2026-01:59:27] [TRT] [V] Tactic Name: sm50_xmma_pooling_tiled_FP32NCHW_kMAX_tP2_tQ16_tR2_tS2_tU2_tV2_tUnroll5_tThreads128 Tactic: 0x0090bbea764abf95 Time: 0.00247261
[04/24/2026-01:59:27] [TRT] [V] Tactic Name: sm50_xmma_pooling_tiled_FP32NCHW_kMAX_tP2_tQ32_tR2_tS2_tU2_tV2_tUnroll7_tThreads256 Tactic: 0xbd4519190f75e7e9 Time: 0.00254933
[04/24/2026-01:59:27] [TRT] [V] Tactic Name: sm50_xmma_pooling_tiled_FP32NCHW_kMAX_tP2_tQ32_tR2_tS2_tU2_tV2_tUnroll2_tThreads256 Tactic: 0x33fa7ccb33e767fa Time: 0.00251212
[04/24/2026-01:59:27] [TRT] [V] Tactic Name: sm50_xmma_pooling_tiled_FP32NCHW_kMAX_tP2_tQ32_tR2_tS2_tU2_tV2_tUnroll3_tThreads256 Tactic: 0xee538eb5d3641457 Time: 0.00259994
[04/24/2026-01:59:27] [TRT] [V] Tactic Name: sm50_xmma_pooling_tiled_FP32NCHW_kMAX_tP2_tQ16_tR2_tS2_tU2_tV2_tUnroll4_tThreads128 Tactic: 0xdd39499496c9cc38 Time: 0.00252816
[04/24/2026-01:59:27] [TRT] [V] Pooling2 (CaskPooling[0x8000002f]) profiling completed in 0.0530067 seconds. Fastest Tactic: 0x0090bbea764abf95 Time: 0.00247261
[04/24/2026-01:59:27] [TRT] [V] >>>>>>>>>>>>>>> Chose Runner Type: CaskPooling Tactic: 0x0090bbea764abf95
[04/24/2026-01:59:27] [TRT] [V] *************** Autotuning format combination: Float(3136,1:4,224,16) -> Float(784,1:4,112,16) ***************
[04/24/2026-01:59:27] [TRT] [V] --------------- Timing Runner: Pooling2 (CaskPooling[0x8000002f])
[04/24/2026-01:59:27] [TRT] [V] Tactic Name: sm50_xmma_pooling_max_nhwc_FP32FP32_WINDOWSIZE_0_PROPAGATE_NAN_2D Tactic: 0x8382d5c464539e87 Time: 0.0029508
[04/24/2026-01:59:27] [TRT] [V] Tactic Name: sm50_xmma_pooling_max_nhwc_FP32FP32_WINDOWSIZE_0_NOT_PROPAGATE_NAN_2D Tactic: 0xaec8628e8180bced Time: 0.00278036
[04/24/2026-01:59:27] [TRT] [V] Tactic Name: sm50_xmma_pooling_max_nhwc_FP32FP32_WINDOWSIZE_0_PROPAGATE_NAN_3D Tactic: 0xd76bac5638836f8a Time: 0.00306662
[04/24/2026-01:59:27] [TRT] [V] Tactic Name: sm50_xmma_pooling_max_nhwc_FP32FP32_WINDOWSIZE_0_NOT_PROPAGATE_NAN_3D Tactic: 0xfa211b1cdd504de0 Time: 0.00298638
[04/24/2026-01:59:27] [TRT] [V] Tactic Name: sm50_xmma_pooling_fw_4d_FP32FP32NHWC_Max_CAlign4 Tactic: 0x22fb1bb4a70e340d Time: 0.00299667
[04/24/2026-01:59:27] [TRT] [V] Pooling2 (CaskPooling[0x8000002f]) profiling completed in 0.0151061 seconds. Fastest Tactic: 0xaec8628e8180bced Time: 0.00278036
[04/24/2026-01:59:27] [TRT] [V] >>>>>>>>>>>>>>> Chose Runner Type: CaskPooling Tactic: 0xaec8628e8180bced
[04/24/2026-01:59:27] [TRT] [V] =============== Computing costs for {ForeignNode[Shuffle...TopK]}
[04/24/2026-01:59:27] [TRT] [V] ForeignNode {ForeignNode[Shuffle...TopK]} metadata:
[04/24/2026-01:59:27] [TRT] [V] *************** Autotuning format combination: Float(3136,49,7,1) -> Float(10,1), Int32(1,1) ***************
[04/24/2026-01:59:27] [TRT] [V] --------------- Timing Runner: {ForeignNode[Shuffle...TopK]} (Myelin[0x80000023])
[04/24/2026-01:59:27] [TRT] [I] Compiler backend is used during engine build.
[04/24/2026-01:59:29] [TRT] [V]  (foreignNode) Set user's cuda kernel library
[04/24/2026-01:59:29] [TRT] [V]  (foreignNode) Autotuning op MatrixMultiplication1:
[04/24/2026-01:59:29] [TRT] [V]  (foreignNode) Sorted table of all evaluated tactics:
[04/24/2026-01:59:29] [TRT] [V]  (foreignNode) tactic_id, cost(in ms), cost/fastest_cost, prediction_correlation, kernel_name, tactic_hash, tunable_parameter
[04/24/2026-01:59:29] [TRT] [V]  (foreignNode)   34, 0.0083968, 1.00000, 2.09402, sm80_xmma_gemm_f32f32_tf32f32_f32_tn_n_tilesize32x32x64_stage3_warpsize2x1x2_tensor16x8x8, 0x4754af3ee6112,
[04/24/2026-01:59:29] [TRT] [V]  (foreignNode)   55, 0.0086656, 1.03201, 2.03290, sm86_xmma_gemm_f32f32_tf32f32_f32_tn_n_tilesize32x32x64_stage6_warpsize2x2x1_tensor16x8x8, 0x49440904257ce,
[04/24/2026-01:59:29] [TRT] [V]  (foreignNode)   32, 0.0087040, 1.03659, 2.02011, sm80_xmma_gemm_f32f32_tf32f32_f32_nn_n_tilesize32x32x64_stage3_warpsize2x1x2_tensor16x8x8, 0x601ffa534e573,
[04/24/2026-01:59:29] [TRT] [V]  (foreignNode)   54, 0.0090112, 1.07317, 1.95493, sm86_xmma_gemm_f32f32_tf32f32_f32_nn_n_tilesize32x32x64_stage6_warpsize2x2x1_tensor16x8x8, 0x5f006fb224208,
[04/24/2026-01:59:29] [TRT] [V]  (foreignNode)   47, 0.0091136, 1.08537, 1.93192, sm86_xmma_gemm_f32f32_tf32f32_f32_tn_n_tilesize32x32x64_stage6_warpsize2x2x1_tensor16x8x8, 0x334d6aeb9ee39,
[04/24/2026-01:59:29] [TRT] [V]  (foreignNode)   51, 0.0092160, 1.09756, 1.91069, sm80_xmma_gemm_f32f32_tf32f32_f32_tn_n_tilesize64x32x64_stage4_warpsize2x1x2_tensor16x8x8, 0x53bebff85b741,
[04/24/2026-01:59:29] [TRT] [V]  (foreignNode)   24, 0.0093184, 1.10976, 1.88589, sm80_xmma_gemm_f32f32_tf32f32_f32_tn_n_tilesize32x32x64_stage3_warpsize2x1x2_tensor16x8x8, 0x55ca59c01c8e6,
[04/24/2026-01:59:29] [TRT] [V]  (foreignNode)   14, 0.0094208, 1.12195, 1.86239, sm80_xmma_gemm_f32f32_tf32f32_f32_tn_n_tilesize32x32x64_stage3_warpsize2x1x2_tensor16x8x8, 0x49387e4fabbcb,
[04/24/2026-01:59:29] [TRT] [V]  (foreignNode)   22, 0.0094464, 1.12500, 1.86034, sm80_xmma_gemm_f32f32_tf32f32_f32_nn_n_tilesize32x32x64_stage3_warpsize2x1x2_tensor16x8x8, 0x60be6a68c09be,
[04/24/2026-01:59:29] [TRT] [V]  (foreignNode)   46, 0.0094528, 1.12576, 1.86259, sm86_xmma_gemm_f32f32_tf32f32_f32_nn_n_tilesize32x32x64_stage6_warpsize2x2x1_tensor16x8x8, 0x66dc88611833d,
[04/24/2026-01:59:29] [TRT] [V]  (foreignNode)   18, 0.0097280, 1.15854, 1.80452, sm80_xmma_gemm_f32f32_tf32f32_f32_tn_n_tilesize32x32x64_stage3_warpsize2x1x2_tensor16x8x8, 0x2b826e27b0430,
[04/24/2026-01:59:29] [TRT] [V]  (foreignNode)   49, 0.0097312, 1.15892, 1.80953, sm80_xmma_gemm_f32f32_tf32f32_f32_nn_n_tilesize64x32x64_stage4_warpsize2x1x2_tensor16x8x8, 0x4a785364cf633,
[04/24/2026-01:59:29] [TRT] [V]  (foreignNode)   50, 0.0098304, 1.17073, 1.79127, sm86_xmma_gemm_f32f32_tf32f32_f32_tn_n_tilesize64x32x64_stage4_warpsize2x2x1_tensor16x8x8, 0x694678a07693e,
[04/24/2026-01:59:29] [TRT] [V]  (foreignNode)   27, 0.0100352, 1.19512, 1.75181, sm86_xmma_gemm_f32f32_tf32f32_f32_tn_n_tilesize32x32x64_stage6_warpsize2x2x1_tensor16x8x8, 0x666742dc17af9,
[04/24/2026-01:59:29] [TRT] [V]  (foreignNode)   48, 0.0102400, 1.21951, 1.71962, sm86_xmma_gemm_f32f32_tf32f32_f32_nn_n_tilesize64x32x64_stage4_warpsize2x2x1_tensor16x8x8, 0x4d62854379fc9,
[04/24/2026-01:59:29] [TRT] [V]  (foreignNode)   37, 0.0103584, 1.23361, 1.69804, sm86_xmma_gemm_f32f32_tf32f32_f32_tn_n_tilesize32x32x64_stage6_warpsize2x2x1_tensor16x8x8, 0x3dbcaf58d3467,
[04/24/2026-01:59:29] [TRT] [V]  (foreignNode)   12, 0.0105472, 1.25610, 1.66349, sm80_xmma_gemm_f32f32_tf32f32_f32_nn_n_tilesize32x32x64_stage3_warpsize2x1x2_tensor16x8x8, 0x5c2792944e3c4,
[04/24/2026-01:59:29] [TRT] [V]  (foreignNode)   16, 0.0108224, 1.28887, 1.62204, sm80_xmma_gemm_f32f32_tf32f32_f32_nn_n_tilesize32x32x64_stage3_warpsize2x1x2_tensor16x8x8, 0x50069414d8929,
[04/24/2026-01:59:29] [TRT] [V]  (foreignNode)   44, 0.0109568, 1.30488, 1.60625, sm86_xmma_gemm_f32f32_tf32f32_f32_tn_n_tilesize64x32x64_stage4_warpsize2x2x1_tensor16x8x8, 0x5bdb18571edf6,
[04/24/2026-01:59:29] [TRT] [V]  (foreignNode)   26, 0.0110592, 1.31707, 1.58961, sm86_xmma_gemm_f32f32_tf32f32_f32_nn_n_tilesize32x32x64_stage6_warpsize2x2x1_tensor16x8x8, 0x5f3ab6c1e639c,
[04/24/2026-01:59:29] [TRT] [V]  (foreignNode)   45, 0.0110592, 1.31707, 1.59137, sm80_xmma_gemm_f32f32_tf32f32_f32_tn_n_tilesize64x32x64_stage4_warpsize2x1x2_tensor16x8x8, 0x6115cd11889d1,
[04/24/2026-01:59:29] [TRT] [V]  (foreignNode)   36, 0.0114688, 1.36585, 1.53364, sm86_xmma_gemm_f32f32_tf32f32_f32_nn_n_tilesize32x32x64_stage6_warpsize2x2x1_tensor16x8x8, 0x4880ea4ce8166,
[04/24/2026-01:59:29] [TRT] [V]  (foreignNode)    2, 0.0115712, 1.37805, 1.44570, sm80_xmma_gemm_f32f32_tf32f32_f32_tn_n_tilesize32x32x64_stage3_warpsize2x1x2_tensor16x8x8, 0x3954c87e6ea47,
[04/24/2026-01:59:29] [TRT] [V]  (foreignNode)   42, 0.0115712, 1.37805, 1.52096, sm86_xmma_gemm_f32f32_tf32f32_f32_nn_n_tilesize64x32x64_stage4_warpsize2x2x1_tensor16x8x8, 0x2d3ed03083ee6,
[04/24/2026-01:59:29] [TRT] [V]  (foreignNode)   43, 0.0116064, 1.38224, 1.51635, sm80_xmma_gemm_f32f32_tf32f32_f32_nn_n_tilesize64x32x64_stage4_warpsize2x1x2_tensor16x8x8, 0x505b265d2fd84,
[04/24/2026-01:59:29] [TRT] [V]  (foreignNode)   33, 0.0116768, 1.39063, 1.50581, sm80_xmma_gemm_f32f32_tf32f32_f32_nn_n_tilesize32x32x64_stage3_warpsize2x2x1_tensor16x8x8_aligna4_alignc4, 0x35611bbfad2a8,
[04/24/2026-01:59:29] [TRT] [V]  (foreignNode)   35, 0.0116928, 1.39253, 1.50375, sm80_xmma_gemm_f32f32_tf32f32_f32_tn_n_tilesize32x32x64_stage3_warpsize2x2x1_tensor16x8x8_aligna4_alignc4, 0x4556015dc0d65,
