cookbook/04-Feature/ProfilingVerbosity/log-main.py.log
[04/25/2026-00:42:53] [TRT] [V] *************** Autotuning format combination: Float(784,784,28,1) -> Float(25088,784,28,1) ***************
[04/25/2026-00:42:53] [TRT] [V] --------------- Timing Runner: Convolution1 + Activation1 (CaskConvolution[0x80000009])
[04/25/2026-00:42:53] [TRT] [V] Tactic Name: ampere_scudnn_128x64_relu_medium_nn_v1 Tactic: 0xf64396b97c889179 Time: 0.00876308
[04/25/2026-00:42:53] [TRT] [V] Tactic Name: ampere_scudnn_128x32_relu_small_nn_v1 Tactic: 0xa8609adc4e0ceb90 Time: 0.00796952
[04/25/2026-00:42:53] [TRT] [V] Tactic Name: ampere_scudnn_128x128_relu_medium_nn_v1 Tactic: 0xf067e6205da31c2e Time: 0.00948977
[04/25/2026-00:42:53] [TRT] [V] Tactic Name: sm70_xmma_fprop_implicit_gemm_f32f32_f32f32_f32_nchwkcrs_nchw_tilesize64x64x8_stage1_warpsize1x4x1_g1_ffma_aligna4_alignc4 Tactic: 0xe40b38338a3a7d7e Time: 0.00506036
[04/25/2026-00:42:53] [TRT] [V] Tactic Name: sm70_xmma_fprop_implicit_gemm_f32f32_f32f32_f32_nchwkcrs_nchw_tilesize32x32x8_stage1_warpsize1x2x1_g1_ffma_aligna4_alignc4 Tactic: 0xf7a98be0a08d77c4 Time: 0.00476206
[04/25/2026-00:42:53] [TRT] [V] Tactic Name: sm70_xmma_fprop_implicit_gemm_f32f32_f32f32_f32_nchwkcrs_nchw_tilesize64x128x8_stage1_warpsize1x4x1_g1_ffma_aligna4_alignc4 Tactic: 0xd1338f4b38d341e2 Time: 0.00595905
[04/25/2026-00:42:53] [TRT] [V] Tactic Name: sm80_xmma_fprop_implicit_gemm_f32f32_f32f32_f32_nchwkcrs_nchw_tilesize64x128x8_stage3_warpsize1x4x1_g1_ffma_aligna4_alignc4 Tactic: 0x5aa723e0481da855 Time: 0.0061841
[04/25/2026-00:42:53] [TRT] [V] Tactic Name: sm80_xmma_fprop_implicit_gemm_f32f32_f32f32_f32_nchwkcrs_nchw_tilesize256x128x8_stage3_warpsize4x2x1_g1_ffma_aligna4_alignc4 Tactic: 0xbb8c3889c7eacd30 Time: 0.0126594
[04/25/2026-00:42:53] [TRT] [V] Tactic Name: sm70_xmma_fprop_implicit_gemm_indexed_f32f32_f32f32_f32_nchwkcrs_nchw_tilesize128x16x8_stage1_warpsize4x1x1_g1_ffma_aligna4_alignc4 Tactic: 0x65d82d184f452332 Time: 0.00558578
[04/25/2026-00:42:53] [TRT] [V] Tactic Name: sm70_xmma_fprop_implicit_gemm_indexed_f32f32_f32f32_f32_nchwkcrs_nchw_tilesize32x32x8_stage1_warpsize1x2x1_g1_ffma_aligna4_alignc4 Tactic: 0x9efed776051c0873 Time: 0.00506456
[04/25/2026-00:42:53] [TRT] [V] Tactic Name: sm70_xmma_fprop_implicit_gemm_indexed_f32f32_f32f32_f32_nchwkcrs_nchw_tilesize128x32x8_stage1_warpsize2x2x1_g1_ffma_aligna4_alignc4 Tactic: 0x8c4f6360145d6a1f Time: 0.00597962
[04/25/2026-00:42:53] [TRT] [V] Tactic Name: sm70_xmma_fprop_implicit_gemm_indexed_f32f32_f32f32_f32_nchwkcrs_nchw_tilesize64x64x8_stage1_warpsize1x4x1_g1_ffma_aligna4_alignc4 Tactic: 0x8d5c64a52fab02c9 Time: 0.00517136
[04/25/2026-00:42:53] [TRT] [V] Tactic Name: sm80_xmma_fprop_implicit_gemm_indexed_f32f32_f32f32_f32_nchwkcrs_nchw_tilesize128x64x8_stage2_warpsize4x1x1_g1_ffma_aligna4_alignc4_beta0_packed_stride Tactic: 0x1673e3594ce11cea Time: 0.00733032
[04/25/2026-00:42:53] [TRT] [V] Tactic Name: sm80_xmma_fprop_implicit_gemm_indexed_f32f32_f32f32_f32_nchwkcrs_nchw_tilesize128x16x8_stage3_warpsize4x1x1_g1_ffma_aligna4_alignc4 Tactic: 0x40a12e3938221818 Time: 0.00567485
[04/25/2026-00:42:53] [TRT] [V] Tactic Name: sm80_xmma_fprop_implicit_gemm_indexed_f32f32_f32f32_f32_nchwkcrs_nchw_tilesize128x32x8_stage3_warpsize2x2x1_g1_ffma_aligna4_alignc4 Tactic: 0xa9366041633a5135 Time: 0.00611666
[04/25/2026-00:42:53] [TRT] [V] Tactic Name: sm80_xmma_fprop_implicit_gemm_f32f32_f32f32_f32_nchwkcrs_nchw_tilesize32x32x8_stage3_warpsize1x2x1_g1_ffma_t1r5s5_aligna4_alignc4 Tactic: 0x5b8bf1b8028629d9 Time: 0.00448768
[04/25/2026-00:42:53] [TRT] [V] Tactic Name: sm70_xmma_fprop_implicit_gemm_f32f32_f32f32_f32_nchwkcrs_nchw_tilesize32x32x8_stage1_warpsize1x2x1_g1_ffma_t1r5s5_aligna4_alignc4 Tactic: 0x7e1e4d26cfa285f9 Time: 0.00468489
[04/25/2026-00:42:53] [TRT] [V] Tactic Name: ampere_scudnn_128x64_relu_small_nn_v1 Tactic: 0x3f243c490d502deb Time: 0.00804241
[04/25/2026-00:42:53] [TRT] [V] Tactic Name: sm70_xmma_fprop_implicit_gemm_f32f32_f32f32_f32_nchwkcrs_nchw_tilesize128x16x8_stage1_warpsize4x1x1_g1_ffma_aligna4_alignc4 Tactic: 0x160b77f4a95ab6d3 Time: 0.00527967
[04/25/2026-00:42:53] [TRT] [V] Tactic Name: sm70_xmma_fprop_implicit_gemm_f32f32_f32f32_f32_nchwkcrs_nchw_tilesize128x64x8_stage1_warpsize2x2x1_g1_ffma_aligna4_alignc4 Tactic: 0x994f5b723e2d80da Time: 0.00637042
[04/25/2026-00:42:53] [TRT] [V] Tactic Name: sm80_xmma_fprop_implicit_gemm_f32f32_f32f32_f32_nchwkcrs_nchw_tilesize64x64x8_stage3_warpsize1x4x1_g1_ffma_aligna4_alignc4 Tactic: 0xa31d27de74b895ff Time: 0.00503196
[04/25/2026-00:42:53] [TRT] [V] Tactic Name: sm80_xmma_fprop_implicit_gemm_f32f32_f32f32_f32_nchwkcrs_nchw_tilesize32x32x8_stage3_warpsize1x2x1_g1_ffma_aligna4_alignc4 Tactic: 0xb0bf940d5e0f9f45 Time: 0.00457424
[04/25/2026-00:42:53] [TRT] [V] Tactic Name: ampere_scudnn_128x64_relu_xregs_large_nn_v1 Tactic: 0x5deb29b7a8e275f7 Time: 0.00842747
[04/25/2026-00:42:53] [TRT] [V] Tactic Name: sm70_xmma_fprop_implicit_gemm_f32f32_f32f32_f32_nchwkcrs_nchw_tilesize64x64x8_stage1_warpsize1x4x1_g1_ffma_t1r5s5_aligna4_alignc4 Tactic: 0xb3ea28771604ad88 Time: 0.00505632
[04/25/2026-00:42:53] [TRT] [V] Tactic Name: sm80_xmma_fprop_implicit_gemm_f32f32_f32f32_f32_nchwkcrs_nchw_tilesize128x16x8_stage3_warpsize4x1x1_g1_ffma_aligna4_alignc4 Tactic: 0x9d9fdb5fd9945f64 Time: 0.00500872
[04/25/2026-00:42:53] [TRT] [V] Tactic Name: sm80_xmma_fprop_implicit_gemm_indexed_f32f32_f32f32_f32_nchwkcrs_nchw_tilesize64x64x8_stage3_warpsize1x4x1_g1_ffma_aligna4_alignc4 Tactic: 0xd828f024626fa982 Time: 0.00517661
[04/25/2026-00:42:53] [TRT] [V] Tactic Name: sm80_xmma_fprop_implicit_gemm_f32f32_f32f32_f32_nchwkcrs_nchw_tilesize128x64x8_stage3_warpsize2x2x1_g1_ffma_aligna4_alignc4 Tactic: 0x12dbf7d94ee3696d Time: 0.00643015
[04/25/2026-00:42:53] [TRT] [V] Tactic Name: sm80_xmma_fprop_implicit_gemm_f32f32_f32f32_f32_nchwkcrs_nchw_tilesize64x64x8_stage3_warpsize1x4x1_g1_ffma_t1r5s5_aligna4_alignc4 Tactic: 0x967f94e9db2001a8 Time: 0.00498866
[04/25/2026-00:42:53] [TRT] [V] Tactic Name: sm80_xmma_fprop_implicit_gemm_indexed_f32f32_f32f32_f32_nchwkcrs_nchw_tilesize32x32x8_stage3_warpsize1x2x1_g1_ffma_aligna4_alignc4 Tactic: 0xcb8a43f748d8a338 Time: 0.00475328
[04/25/2026-00:42:53] [TRT] [V] Tactic Name: sm70_xmma_fprop_implicit_gemm_f32f32_f32f32_f32_nchwkcrs_nchw_tilesize128x256x8_stage1_warpsize2x4x1_g1_ffma_aligna4_alignc4 Tactic: 0xd2aa21bfe2167c0c Time: 0.0119596
[04/25/2026-00:42:54] [TRT] [V] Tactic Name: ampere_scudnn_128x128_relu_small_nn_v1 Tactic: 0x503619c69ae500ff Time: 0.00908944
[04/25/2026-00:42:54] [TRT] [V] Tactic Name: sm80_xmma_fprop_implicit_gemm_indexed_f32f32_f32f32_f32_nchwkcrs_nchw_tilesize128x64x8_stage2_warpsize1x4x1_g1_ffma_aligna4_alignc4_beta0_packed_stride Tactic: 0xede36641840ce3d2 Time: 0.00674539
[04/25/2026-00:42:54] [TRT] [V] Tactic Name: sm70_xmma_fprop_implicit_gemm_f32f32_f32f32_f32_nchwkcrs_nchw_tilesize128x128x8_stage1_warpsize2x2x1_g1_ffma_aligna4_alignc4 Tactic: 0xac49795b871b0d29 Time: 0.00963383
[04/25/2026-00:42:54] [TRT] [V] Tactic Name: sm80_xmma_fprop_implicit_gemm_indexed_f32f32_f32f32_f32_nchwkcrs_nchw_tilesize128x64x8_stage2_warpsize2x2x1_g1_ffma_aligna4_alignc4_beta0_packed_stride Tactic: 0x31aa67f57c5aea77 Time: 0.00685954
[04/25/2026-00:42:54] [TRT] [V] Convolution1 + Activation1 (CaskConvolution[0x80000009]) profiling completed in 0.183691 seconds. Fastest Tactic: 0x5b8bf1b8028629d9 Time: 0.00448768
[04/25/2026-00:42:54] [TRT] [V] Skipping CaskFlattenConvolution: No valid tactics for Convolution1 + Activation1
[04/25/2026-00:42:54] [TRT] [V] >>>>>>>>>>>>>>> Chose Runner Type: CaskConvolution Tactic: 0x5b8bf1b8028629d9
[04/25/2026-00:42:54] [TRT] [V] *************** Autotuning format combination: Float(784,1,28,1) -> Float(25088,1,896,32) ***************
[04/25/2026-00:42:54] [TRT] [V] --------------- Timing Runner: Convolution1 + Activation1 (CaskConvolution[0x80000009])
[04/25/2026-00:42:54] [TRT] [V] Tactic Name: sm70_xmma_fprop_implicit_gemm_f32f32_f32f32_f32_nhwckrsc_nhwc_tilesize64x32x32_stage1_warpsize1x1x1_g1_ffma_t1r5s5_aligna4_alignc4 Tactic: 0x737793996edbf8e2 Time: 0.114023
[04/25/2026-00:42:54] [TRT] [V] Tactic Name: sm80_xmma_fprop_implicit_gemm_f32f32_f32f32_f32_nhwckrsc_nhwc_tilesize64x64x8_stage3_warpsize1x4x1_g1_ffma_t1r5s5_aligna4_alignc4 Tactic: 0x45ff0c3a09b02e78 Time: 0.00972434
[04/25/2026-00:42:54] [TRT] [V] Tactic Name: sm80_xmma_fprop_implicit_gemm_f32f32_f32f32_f32_nhwckrsc_nhwc_tilesize128x64x8_stage3_warpsize2x2x1_g1_ffma_aligna4_alignc4 Tactic: 0x1da91d865428f237 Time: 0.0149412
[04/25/2026-00:42:54] [TRT] [V] Tactic Name: sm70_xmma_fprop_implicit_gemm_indexed_f32f32_f32f32_f32_nhwckrsc_nhwc_tilesize32x32x8_stage1_warpsize1x2x1_g1_ffma_aligna4_alignc4 Tactic: 0x5f60af66e8eb9b51 Time: 0.00986541
[04/25/2026-00:42:54] [TRT] [V] Tactic Name: sm70_xmma_fprop_implicit_gemm_indexed_f32f32_f32f32_f32_nhwckrsc_nhwc_tilesize128x32x8_stage1_warpsize2x2x1_g1_ffma_aligna4_alignc4 Tactic: 0x833d893f0e96f145 Time: 0.0121211
[04/25/2026-00:42:54] [TRT] [V] Tactic Name: sm80_xmma_fprop_implicit_gemm_indexed_wo_smem_f32f32_tf32f32_f32_nhwckrsc_nhwc_tilesize128x32x16_stage1_warpsize4x1x1_g1_tensor16x8x8_aligna4_alignc4 Tactic: 0xf231cca3335919a4 Time: 0.00485395
[04/25/2026-00:42:54] [TRT] [V] Tactic Name: sm70_xmma_fprop_implicit_gemm_f32f32_f32f32_f32_nhwckrsc_nhwc_tilesize64x16x16_stage1_warpsize1x1x1_g1_ffma_t1r5s5_aligna4_alignc4 Tactic: 0x247bb0dcaf6f9760 Time: 0.0189404
[04/25/2026-00:42:54] [TRT] [V] Tactic Name: sm80_xmma_fprop_implicit_gemm_indexed_f32f32_f32f32_f32_nhwckrsc_nhwc_tilesize128x16x8_stage3_warpsize4x1x1_g1_ffma_aligna4_alignc4 Tactic: 0x4fd3c46622e98342 Time: 0.0109313
[04/25/2026-00:42:54] [TRT] [V] Tactic Name: sm80_xmma_fprop_implicit_gemm_indexed_wo_smem_f32f32_tf32f32_f32_nhwckrsc_nhwc_tilesize128x16x32_stage1_warpsize4x1x1_g1_tensor16x8x8_aligna4_alignc4 Tactic: 0xcf8ea142095f02d2 Time: 0.00444473
[04/25/2026-00:42:54] [TRT] [V] Tactic Name: sm80_xmma_fprop_implicit_gemm_f32f32_f32f32_f32_nhwckrsc_nhwc_tilesize32x32x8_stage3_warpsize1x2x1_g1_ffma_t1r5s5_aligna4_alignc4 Tactic: 0x880b696bd0160609 Time: 0.00718298
[04/25/2026-00:42:54] [TRT] [V] Tactic Name: sm70_xmma_fprop_implicit_gemm_f32f32_f32f32_f32_nhwckrsc_nhwc_tilesize128x16x8_stage1_warpsize4x1x1_g1_ffma_aligna4_alignc4 Tactic: 0x19799dabb3912d89 Time: 0.01053
[04/25/2026-00:42:54] [TRT] [V] Tactic Name: sm70_xmma_fprop_implicit_gemm_f32f32_f32f32_f32_nhwckrsc_nhwc_tilesize64x128x8_stage1_warpsize1x4x1_g1_ffma_aligna4_alignc4 Tactic: 0xde4165142218dab8 Time: 0.0140182
[04/25/2026-00:42:54] [TRT] [V] Tactic Name: sm70_xmma_fprop_implicit_gemm_f32f32_f32f32_f32_nhwckrsc_nhwc_tilesize128x64x8_stage1_warpsize2x2x1_g1_ffma_aligna4_alignc4 Tactic: 0x963db12d24e61b80 Time: 0.0143151
[04/25/2026-00:42:54] [TRT] [V] Tactic Name: sm80_xmma_fprop_implicit_gemm_indexed_f32f32_f32f32_f32_nhwckrsc_nhwc_tilesize128x32x8_stage3_warpsize2x2x1_g1_ffma_aligna4_alignc4 Tactic: 0xa6448a1e79f1ca6f Time: 0.0110097
[04/25/2026-00:42:54] [TRT] [V] Tactic Name: sm80_xmma_fprop_implicit_gemm_f32f32_f32f32_f32_nhwckrsc_nhwc_tilesize128x16x8_stage3_warpsize4x1x1_g1_ffma_t1r5s5_aligna4_alignc4 Tactic: 0xe35d4a4a3b499fe7 Time: 0.00841813
[04/25/2026-00:42:54] [TRT] [V] Tactic Name: sm70_xmma_fprop_implicit_gemm_f32f32_f32f32_f32_nhwckrsc_nhwc_tilesize64x32x32_stage1_warpsize1x1x1_g1_ffma_aligna4_alignc4 Tactic: 0xdb73e25ae4006f74 Time: 0.112668
[04/25/2026-00:42:54] [TRT] [V] Tactic Name: sm80_xmma_fprop_implicit_gemm_indexed_f32f32_f32f32_f32_nhwckrsc_nhwc_tilesize64x64x8_stage3_warpsize1x4x1_g1_ffma_aligna4_alignc4 Tactic: 0x19b688348f983aa0 Time: 0.00991874
[04/25/2026-00:42:54] [TRT] [V] Tactic Name: sm80_xmma_fprop_implicit_gemm_f32f32_f32f32_f32_nhwckrsc_nhwc_tilesize256x64x8_stage3_warpsize2x2x1_g1_ffma_aligna4_alignc4 Tactic: 0x8014228ec08b4d49 Time: 0.0253562
[04/25/2026-00:42:54] [TRT] [V] Tactic Name: sm70_xmma_fprop_implicit_gemm_f32f32_f32f32_f32_nhwckrsc_nhwc_tilesize128x16x8_stage1_warpsize4x1x1_g1_ffma_t1r5s5_aligna4_alignc4 Tactic: 0x54e3b8c9b1e5f17a Time: 0.0102271
[04/25/2026-00:42:54] [TRT] [V] Tactic Name: sm70_xmma_fprop_implicit_gemm_indexed_f32f32_f32f32_f32_nhwckrsc_nhwc_tilesize128x16x8_stage1_warpsize4x1x1_g1_ffma_aligna4_alignc4 Tactic: 0x6aaac747558eb868 Time: 0.0112892
[04/25/2026-00:42:54] [TRT] [V] Tactic Name: sm70_xmma_fprop_implicit_gemm_f32f32_f32f32_f32_nhwckrsc_nhwc_tilesize64x64x8_stage1_warpsize1x4x1_g1_ffma_aligna4_alignc4 Tactic: 0x2595402367cdee5c Time: 0.0107293
[04/25/2026-00:42:54] [TRT] [V] Tactic Name: sm80_xmma_fprop_implicit_gemm_f32f32_f32f32_f32_nhwckrsc_nhwc_tilesize128x16x8_stage3_warpsize4x1x1_g1_ffma_aligna4_alignc4 Tactic: 0x92ed3100c35fc43e Time: 0.00883088
[04/25/2026-00:42:54] [TRT] [V] Tactic Name: sm80_xmma_fprop_implicit_gemm_f32f32_f32f32_f32_nhwckrsc_nhwc_tilesize64x64x8_stage3_warpsize1x4x1_g1_ffma_aligna4_alignc4 Tactic: 0x62835fce994f06dd Time: 0.00982682
[04/25/2026-00:42:54] [TRT] [V] Tactic Name: sm70_xmma_fprop_implicit_gemm_f32f32_f32f32_f32_nhwckrsc_nhwc_tilesize32x32x8_stage1_warpsize1x2x1_g1_ffma_t1r5s5_aligna4_alignc4 Tactic: 0xad9ed5f51d32aa29 Time: 0.00998117
[04/25/2026-00:42:54] [TRT] [V] Tactic Name: sm70_xmma_fprop_implicit_gemm_f32f32_f32f32_f32_nhwckrsc_nhwc_tilesize64x16x16_stage1_warpsize1x1x1_g1_ffma_aligna4_alignc4 Tactic: 0x3f904b355d9ca8e6 Time: 0.0191295
[04/25/2026-00:42:54] [TRT] [V] Tactic Name: sm80_xmma_fprop_implicit_gemm_indexed_f32f32_f32f32_f32_nhwckrsc_nhwc_tilesize32x32x8_stage3_warpsize1x2x1_g1_ffma_aligna4_alignc4 Tactic: 0x0a143be7a52f301a Time: 0.00808584
[04/25/2026-00:42:54] [TRT] [V] Tactic Name: sm80_xmma_fprop_implicit_gemm_f32f32_f32f32_f32_nhwckrsc_nhwc_tilesize32x32x8_stage3_warpsize1x2x1_g1_ffma_aligna4_alignc4 Tactic: 0x7121ec1db3f80c67 Time: 0.00732707
[04/25/2026-00:42:54] [TRT] [V] Tactic Name: sm70_xmma_fprop_implicit_gemm_f32f32_f32f32_f32_nhwckrsc_nhwc_tilesize256x128x8_stage1_warpsize2x4x1_g1_ffma_aligna4_alignc4 Tactic: 0x0447933cc2be855a Time: 0.0360043
[04/25/2026-00:42:54] [TRT] [V] Tactic Name: sm70_xmma_fprop_implicit_gemm_f32f32_f32f32_f32_nhwckrsc_nhwc_tilesize32x32x8_stage1_warpsize1x2x1_g1_ffma_aligna4_alignc4 Tactic: 0x3637f3f04d7ae4e6 Time: 0.0104813
[04/25/2026-00:42:54] [TRT] [V] Convolution1 + Activation1 (CaskConvolution[0x80000009]) profiling completed in 0.0963739 seconds. Fastest Tactic: 0xcf8ea142095f02d2 Time: 0.00444473
[04/25/2026-00:42:54] [TRT] [V] Skipping CaskFlattenConvolution: No valid tactics for Convolution1 + Activation1
[04/25/2026-00:42:54] [TRT] [V] >>>>>>>>>>>>>>> Chose Runner Type: CaskConvolution Tactic: 0xcf8ea142095f02d2
[04/25/2026-00:42:54] [TRT] [V] *************** Autotuning format combination: Float(784,1:4,28,1) -> Float(25088,784,28,1) ***************
[04/25/2026-00:42:54] [TRT] [V] --------------- Timing Runner: Convolution1 + Activation1 (CaskConvolution[0x80000009])
[04/25/2026-00:42:54] [TRT] [V] Tactic Name: sm80_xmma_fprop_implicit_gemm_indexed_f32f32_tf32f32_f32_nhwckrsc_nchw_tilesize128x128x16_stage4_warpsize2x2x1_g1_tensor16x8x8 Tactic: 0xe0a307ffe0ffb6a5 Time: 0.0171621
[04/25/2026-00:42:54] [TRT] [V] Tactic Name: sm80_xmma_fprop_implicit_gemm_f32f32_tf32f32_f32_nhwckrsc_nchw_tilesize128x128x16_stage4_warpsize2x2x1_g1_tensor16x8x8 Tactic: 0x3104d85fecdd547c Time: 0.0168971
[04/25/2026-00:42:54] [TRT] [V] Tactic Name: sm80_xmma_fprop_implicit_gemm_indexed_f32f32_tf32f32_f32_nhwckrsc_nchw_tilesize128x128x16_stage4_warpsize2x2x1_g1_tensor16x8x8_alignc4 Tactic: 0xe8f7b6a5bab325f8 Time: 0.0183422
[04/25/2026-00:42:54] [TRT] [V] Tactic Name: sm80_xmma_fprop_implicit_gemm_f32f32_tf32f32_f32_nhwckrsc_nchw_tilesize128x128x16_stage4_warpsize2x2x1_g1_tensor16x8x8_alignc4 Tactic: 0x9fd9fe001908ce2e Time: 0.0175019
[04/25/2026-00:42:54] [TRT] [V] Convolution1 + Activation1 (CaskConvolution[0x80000009]) profiling completed in 0.0116166 seconds. Fastest Tactic: 0x3104d85fecdd547c Time: 0.0168971
[04/25/2026-00:42:54] [TRT] [V] Skipping CaskFlattenConvolution: No valid tactics for Convolution1 + Activation1
[04/25/2026-00:42:54] [TRT] [V] >>>>>>>>>>>>>>> Chose Runner Type: CaskConvolution Tactic: 0x3104d85fecdd547c
[04/25/2026-00:42:54] [TRT] [V] *************** Autotuning format combination: Float(784,1:4,28,1) -> Float(6272,1:4,224,8) ***************
[04/25/2026-00:42:54] [TRT] [V] --------------- Timing Runner: Convolution1 + Activation1 (CaskConvolution[0x80000009])
[04/25/2026-00:42:54] [TRT] [V] Tactic Name: ampere_scudnn_128x32_sliced1x4_ldg4_relu_exp_small_nhwc_tn_v1 Tactic: 0x3e2b881168d9689d Time: 0.0257387
[04/25/2026-00:42:54] [TRT] [V] Tactic Name: ampere_scudnn_128x128_ldg4_relu_exp_medium_nhwc_tn_v1 Tactic: 0x7bc32c782b800c48 Time: 0.0225756
[04/25/2026-00:42:54] [TRT] [V] Tactic Name: sm80_xmma_fprop_implicit_gemm_f32f32_tf32f32_f32_nhwckrsc_nhwc_tilesize128x128x16_stage4_warpsize2x2x1_g1_tensor16x8x8 Tactic: 0xb443c221fcb1565b Time: 0.0165811
[04/25/2026-00:42:54] [TRT] [V] Tactic Name: sm80_xmma_fprop_implicit_gemm_indexed_f32f32_tf32f32_f32_nhwckrsc_nhwc_tilesize128x128x16_stage4_warpsize2x2x1_g1_tensor16x8x8 Tactic: 0x65e41d81f093b482 Time: 0.0176225
[04/25/2026-00:42:54] [TRT] [V] Tactic Name: sm80_xmma_fprop_implicit_gemm_indexed_wo_smem_f32f32_tf32f32_f32_nhwckrsc_nhwc_tilesize128x32x16_stage1_warpsize4x1x1_g1_tensor16x8x8_aligna8_alignc4 Tactic: 0xf78ec258f27b3e23 Time: 0.00857354
[04/25/2026-00:42:54] [TRT] [V] Tactic Name: sm80_xmma_fprop_implicit_gemm_indexed_wo_smem_f32f32_tf32f32_f32_nhwckrsc_nhwc_tilesize128x32x16_stage1_warpsize4x1x1_g1_tensor16x8x8_aligna4_alignc8 Tactic: 0x7e40882e33c8fbf1 Time: 0.00719319
[04/25/2026-00:42:54] [TRT] [V] Tactic Name: sm80_xmma_fprop_implicit_gemm_indexed_wo_smem_f32f32_tf32f32_f32_nhwckrsc_nhwc_tilesize128x16x32_stage1_warpsize4x1x1_g1_tensor16x8x8_aligna8_alignc8 Tactic: 0x4640eb34c8ecc700 Time: 0.00805587
[04/25/2026-00:42:54] [TRT] [V] Tactic Name: sm80_xmma_fprop_implicit_gemm_indexed_wo_smem_f32f32_tf32f32_f32_nhwckrsc_nhwc_tilesize128x16x32_stage1_warpsize4x1x1_g1_tensor16x8x8_aligna4 Tactic: 0xb3e5ce9d1b1da232 Time: 0.00799492
[04/25/2026-00:42:54] [TRT] [V] Tactic Name: sm80_xmma_fprop_implicit_gemm_indexed_wo_smem_f32f32_tf32f32_f32_nhwckrsc_nhwc_tilesize128x16x64_stage1_warpsize4x1x1_g1_tensor16x8x8 Tactic: 0x10383a0781d24dde Time: 0.00456738
[04/25/2026-00:42:54] [TRT] [V] Tactic Name: sm80_xmma_fprop_implicit_gemm_indexed_wo_smem_f32f32_tf32f32_f32_nhwckrsc_nhwc_tilesize128x16x64_stage1_warpsize4x1x1_g1_tensor16x8x8_alignc8 Tactic: 0x4037b478ce77e422 Time: 0.00546082
[04/25/2026-00:42:54] [TRT] [V] Tactic Name: sm80_xmma_fprop_implicit_gemm_indexed_wo_smem_f32f32_tf32f32_f32_nhwckrsc_nhwc_tilesize128x32x64_stage1_warpsize4x1x1_g1_tensor16x8x8_alignc8 Tactic: 0x3a8712b17741b582 Time: 0.00560551
[04/25/2026-00:42:54] [TRT] [V] Tactic Name: sm80_xmma_fprop_implicit_gemm_indexed_wo_smem_f32f32_tf32f32_f32_nhwckrsc_nhwc_tilesize128x32x64_stage1_warpsize4x1x1_g1_tensor16x8x8_alignc4 Tactic: 0xb6f6563c77d057d7 Time: 0.00601467
[04/25/2026-00:42:54] [TRT] [V] Tactic Name: sm80_xmma_fprop_implicit_gemm_indexed_wo_smem_f32f32_tf32f32_f32_nhwckrsc_nhwc_tilesize128x32x64_stage1_warpsize4x1x1_g1_tensor16x8x8_aligna8 Tactic: 0x9355e195cee05798 Time: 0.00627378
[04/25/2026-00:42:54] [TRT] [V] Tactic Name: sm80_xmma_fprop_implicit_gemm_indexed_wo_smem_f32f32_tf32f32_f32_nhwckrsc_nhwc_tilesize128x32x64_stage1_warpsize4x1x1_g1_tensor16x8x8_aligna4_alignc8 Tactic: 0x1acd4f006848c62b Time: 0.00824716
[04/25/2026-00:42:54] [TRT] [V] Tactic Name: sm80_xmma_fprop_implicit_gemm_indexed_wo_smem_f32f32_tf32f32_f32_nhwckrsc_nhwc_tilesize128x16x64_stage1_warpsize4x1x1_g1_tensor16x8x8_alignc4 Tactic: 0xcc46f0f5cee60677 Time: 0.004652
[04/25/2026-00:42:54] [TRT] [V] Tactic Name: sm80_xmma_fprop_implicit_gemm_indexed_wo_smem_f32f32_tf32f32_f32_nhwckrsc_nhwc_tilesize128x32x16_stage1_warpsize4x1x1_g1_tensor16x8x8 Tactic: 0x9cb304e2edbc1221 Time: 0.00633037
[04/25/2026-00:42:54] [TRT] [V] Tactic Name: sm80_xmma_fprop_implicit_gemm_indexed_wo_smem_f32f32_tf32f32_f32_nhwckrsc_nhwc_tilesize128x16x32_stage1_warpsize4x1x1_g1_tensor16x8x8_aligna8 Tactic: 0x3f948a101b8c4067 Time: 0.00776484
[04/25/2026-00:42:54] [TRT] [V] Tactic Name: sm80_xmma_fprop_implicit_gemm_indexed_wo_smem_f32f32_tf32f32_f32_nhwckrsc_nhwc_tilesize128x16x32_stage1_warpsize4x1x1_g1_tensor16x8x8_alignc4 Tactic: 0x1a373db9a2bc4028 Time: 0.00603905
[04/25/2026-00:42:54] [TRT] [V] Tactic Name: sm80_xmma_fprop_implicit_gemm_indexed_wo_smem_f32f32_tf32f32_f32_nhwckrsc_nhwc_tilesize128x32x16_stage1_warpsize4x1x1_g1_tensor16x8x8_aligna8_alignc8 Tactic: 0x7bff86d5f2eadc76 Time: 0.00810997
[04/25/2026-00:42:54] [TRT] [V] Tactic Name: sm80_xmma_fprop_implicit_gemm_indexed_wo_smem_f32f32_tf32f32_f32_nhwckrsc_nhwc_tilesize128x16x64_stage1_warpsize4x1x1_g1_tensor16x8x8_aligna8_alignc4 Tactic: 0xab0496509b88ebe0 Time: 0.00677099
[04/25/2026-00:42:54] [TRT] [V] Tactic Name: sm80_xmma_fprop_implicit_gemm_indexed_wo_smem_f32f32_tf32f32_f32_nhwckrsc_nhwc_tilesize128x32x64_stage1_warpsize4x1x1_g1_tensor16x8x8 Tactic: 0xb33296dda7141c64 Time: 0.00570757
[04/25/2026-00:42:54] [TRT] [V] Tactic Name: sm80_xmma_fprop_implicit_gemm_indexed_wo_smem_f32f32_tf32f32_f32_nhwckrsc_nhwc_tilesize128x32x64_stage1_warpsize4x1x1_g1_tensor16x8x8_aligna8_alignc4 Tactic: 0x93030576a9fb03f9 Time: 0.00619181
[04/25/2026-00:42:54] [TRT] [V] Tactic Name: ampere_scudnn_128x128_ldg4_relu_exp_small_nhwc_tn_v1 Tactic: 0xf90060ce8193b811 Time: 0.0205622
[04/25/2026-00:42:54] [TRT] [V] Tactic Name: sm80_xmma_fprop_implicit_gemm_indexed_wo_smem_f32f32_tf32f32_f32_nhwckrsc_nhwc_tilesize128x32x16_stage1_warpsize4x1x1_g1_tensor16x8x8_aligna4 Tactic: 0x570667f2a28165a0 Time: 0.00769067
[04/25/2026-00:42:54] [TRT] [V] Tactic Name: sm80_xmma_fprop_implicit_gemm_indexed_wo_smem_f32f32_tf32f32_f32_nhwckrsc_nhwc_tilesize128x32x16_stage1_warpsize4x1x1_g1_tensor16x8x8_alignc4 Tactic: 0xfed494d61b2087ba Time: 0.00634365
[04/25/2026-00:42:54] [TRT] [V] Tactic Name: sm80_xmma_fprop_implicit_gemm_f32f32_tf32f32_f32_nhwckrsc_nhwc_tilesize128x128x16_stage4_warpsize2x2x1_g1_tensor16x8x8_t1r5s5 Tactic: 0x94f2b2320bb3fc74 Time: 0.0150015
[04/25/2026-00:42:54] [TRT] [V] Tactic Name: sm80_xmma_fprop_implicit_gemm_indexed_wo_smem_f32f32_tf32f32_f32_nhwckrsc_nhwc_tilesize128x16x32_stage1_warpsize4x1x1_g1_tensor16x8x8_alignc8 Tactic: 0x96467934a22da27d Time: 0.00551344
[04/25/2026-00:42:54] [TRT] [V] Tactic Name: sm80_xmma_fprop_implicit_gemm_indexed_wo_smem_f32f32_tf32f32_f32_nhwckrsc_nhwc_tilesize128x32x16_stage1_warpsize4x1x1_g1_tensor16x8x8_aligna8 Tactic: 0xdb77237fa21087f5 Time: 0.00737646
[04/25/2026-00:42:54] [TRT] [V] Tactic Name: sm80_xmma_fprop_implicit_gemm_indexed_wo_smem_f32f32_tf32f32_f32_nhwckrsc_nhwc_tilesize128x16x64_stage1_warpsize4x1x1_g1_tensor16x8x8_aligna4_alignc8 Tactic: 0x22cadc265a3b2e32 Time: 0.00674154
[04/25/2026-00:42:54] [TRT] [V] Tactic Name: sm80_xmma_fprop_implicit_gemm_indexed_wo_smem_f32f32_tf32f32_f32_nhwckrsc_nhwc_tilesize128x32x16_stage1_warpsize4x1x1_g1_tensor16x8x8_alignc8 Tactic: 0x72a5d05b1bb165ef Time: 0.00588594
[04/25/2026-00:42:54] [TRT] [V] Tactic Name: sm80_xmma_fprop_implicit_gemm_indexed_wo_smem_f32f32_tf32f32_f32_nhwckrsc_nhwc_tilesize128x16x64_stage1_warpsize4x1x1_g1_tensor16x8x8_aligna8 Tactic: 0xe9e5475c77d60638 Time: 0.00608407
[04/25/2026-00:42:54] [TRT] [V] Tactic Name: ampere_scudnn_128x64_sliced1x2_ldg4_relu_exp_large_nhwc_tn_v1 Tactic: 0xbdfdef6b84f7ccc9 Time: 0.0234347
[04/25/2026-00:42:54] [TRT] [V] Tactic Name: sm80_xmma_fprop_implicit_gemm_indexed_wo_smem_f32f32_tf32f32_f32_nhwckrsc_nhwc_tilesize128x16x32_stage1_warpsize4x1x1_g1_tensor16x8x8_aligna4_alignc8 Tactic: 0x43ffe5cf09cee087 Time: 0.00699089
[04/25/2026-00:42:54] [TRT] [V] Tactic Name: sm80_xmma_fprop_implicit_gemm_indexed_wo_smem_f32f32_tf32f32_f32_nhwckrsc_nhwc_tilesize128x16x32_stage1_warpsize4x1x1_g1_tensor16x8x8 Tactic: 0xae48d3ccfe1edfcd Time: 0.00489461
[04/25/2026-00:42:54] [TRT] [V] Convolution1 + Activation1 (CaskConvolution[0x80000009]) profiling completed in 0.113922 seconds. Fastest Tactic: 0x10383a0781d24dde Time: 0.00456738
[04/25/2026-00:42:54] [TRT] [V] Skipping CaskFlattenConvolution: No valid tactics for Convolution1 + Activation1
[04/25/2026-00:42:54] [TRT] [V] >>>>>>>>>>>>>>> Chose Runner Type: CaskConvolution Tactic: 0x10383a0781d24dde
[04/25/2026-00:42:54] [TRT] [V] =============== Computing costs for Pooling1
[04/25/2026-00:42:54] [TRT] [V] *************** Autotuning format combination: Float(25088,784,28,1) -> Float(6272,196,14,1) ***************
[04/25/2026-00:42:54] [TRT] [V] --------------- Timing Runner: Pooling1 (CaskPooling[0x8000002f])
[04/25/2026-00:42:54] [TRT] [V] Tactic Name: sm50_xmma_pooling_tiled_FP32NCHW_kMAX_tP2_tQ32_tR2_tS2_tU2_tV2_tUnroll6_tThreads256 Tactic: 0x60eceb67eff69444 Time: 0.00248138
[04/25/2026-00:42:54] [TRT] [V] Tactic Name: sm50_xmma_pooling_tiled_FP32NCHW_kMAX_tP2_tQ32_tR2_tS2_tU2_tV2_tUnroll1_tThreads256 Tactic: 0xc7d8c563bd6ced88 Time: 0.00257575
[04/25/2026-00:42:54] [TRT] [V] Tactic Name: sm50_xmma_pooling_nd_NCDHW_kMAX_kGENERIC_3D_POOLING_MODE_kFLOAT_0 Tactic: 0x5faf4a0a8a5670ed Time: 0.00276972
[04/25/2026-00:42:54] [TRT] [V] Tactic Name: sm50_xmma_pooling_tiled_FP32NCHW_kMAX_tP2_tQ16_tR2_tS2_tU2_tV2_tUnroll6_tThreads128 Tactic: 0xf4b20242f8c135e7 Time: 0.00244524
[04/25/2026-00:42:54] [TRT] [V] Tactic Name: sm50_xmma_pooling_tiled_FP32NCHW_kMAX_tP2_tQ16_tR2_tS2_tU2_tV2_tUnroll2_tThreads128 Tactic: 0xa7a495ee24d0c659 Time: 0.0024262
[04/25/2026-00:42:54] [TRT] [V] Tactic Name: sm50_xmma_pooling_fw_4d_FP32FP32NCHW_Max Tactic: 0xb59f9cfb90407c92 Time: 0.00284438
[04/25/2026-00:42:54] [TRT] [V] Tactic Name: sm50_xmma_pooling_tiled_FP32NCHW_kMAX_tP2_tQ32_tR2_tS2_tU2_tV2_tUnroll8_tThreads256 Tactic: 0xbc5c1844e5cc7959 Time: 0.00316136
[04/25/2026-00:42:54] [TRT] [V] Tactic Name: sm50_xmma_pooling_tiled_FP32NCHW_kMAX_tP2_tQ16_tR2_tS2_tU2_tV2_tUnroll8_tThreads128 Tactic: 0x2802f161f2fbd8fa Time: 0.00257953
[04/25/2026-00:42:54] [TRT] [V] Tactic Name: sm50_xmma_pooling_tiled_FP32NCHW_kMAX_tP2_tQ16_tR2_tS2_tU2_tV2_tUnroll3_tThreads128 Tactic: 0x7a0d6790c453b5f4 Time: 0.00243354
[04/25/2026-00:42:54] [TRT] [V] Tactic Name: sm50_xmma_pooling_tiled_FP32NCHW_kMAX_tP2_tQ16_tR2_tS2_tU2_tV2_tUnroll1_tThreads128 Tactic: 0x53862c46aa5b4c2b Time: 0.00259688
[04/25/2026-00:42:54] [TRT] [V] Tactic Name: sm50_xmma_pooling_tiled_FP32NCHW_kMAX_tP2_tQ16_tR2_tS2_tU2_tV2_tUnroll7_tThreads128 Tactic: 0x291bf03c1842464a Time: 0.00295929
[04/25/2026-00:42:54] [TRT] [V] Tactic Name: sm50_xmma_pooling_tiled_FP32NCHW_kMAX_tP2_tQ32_tR2_tS2_tU2_tV2_tUnroll5_tThreads256 Tactic: 0x94ce52cf617d1e36 Time: 0.00293352
[04/25/2026-00:42:54] [TRT] [V] Tactic Name: sm50_xmma_pooling_tiled_FP32NCHW_kMAX_tP2_tQ32_tR2_tS2_tU2_tV2_tUnroll4_tThreads256 Tactic: 0x4967a0b181fe6d9b Time: 0.00245271
[04/25/2026-00:42:54] [TRT] [V] Tactic Name: sm50_xmma_pooling_tiled_FP32NCHW_kMAX_tP2_tQ16_tR2_tS2_tU2_tV2_tUnroll5_tThreads128 Tactic: 0x0090bbea764abf95 Time: 0.00247617
[04/25/2026-00:42:54] [TRT] [V] Tactic Name: sm50_xmma_pooling_tiled_FP32NCHW_kMAX_tP2_tQ32_tR2_tS2_tU2_tV2_tUnroll7_tThreads256 Tactic: 0xbd4519190f75e7e9 Time: 0.00252006
[04/25/2026-00:42:54] [TRT] [V] Tactic Name: sm50_xmma_pooling_tiled_FP32NCHW_kMAX_tP2_tQ32_tR2_tS2_tU2_tV2_tUnroll2_tThreads256 Tactic: 0x33fa7ccb33e767fa Time: 0.0024925
[04/25/2026-00:42:54] [TRT] [V] Tactic Name: sm50_xmma_pooling_tiled_FP32NCHW_kMAX_tP2_tQ32_tR2_tS2_tU2_tV2_tUnroll3_tThreads256 Tactic: 0xee538eb5d3641457 Time: 0.00292791
[04/25/2026-00:42:54] [TRT] [V] Tactic Name: sm50_xmma_pooling_tiled_FP32NCHW_kMAX_tP2_tQ16_tR2_tS2_tU2_tV2_tUnroll4_tThreads128 Tactic: 0xdd39499496c9cc38 Time: 0.002456
[04/25/2026-00:42:54] [TRT] [V] Pooling1 (CaskPooling[0x8000002f]) profiling completed in 0.067492 seconds. Fastest Tactic: 0xa7a495ee24d0c659 Time: 0.0024262
[04/25/2026-00:42:54] [TRT] [V] >>>>>>>>>>>>>>> Chose Runner Type: CaskPooling Tactic: 0xa7a495ee24d0c659
[04/25/2026-00:42:54] [TRT] [V] *************** Autotuning format combination: Float(6272,1:4,224,8) -> Float(1568,1:4,112,8) ***************
[04/25/2026-00:42:54] [TRT] [V] --------------- Timing Runner: Pooling1 (CaskPooling[0x8000002f])
[04/25/2026-00:42:54] [TRT] [V] Tactic Name: sm50_xmma_pooling_max_nhwc_FP32FP32_WINDOWSIZE_0_PROPAGATE_NAN_2D Tactic: 0x8382d5c464539e87 Time: 0.00289269
[04/25/2026-00:42:54] [TRT] [V] Tactic Name: sm50_xmma_pooling_max_nhwc_FP32FP32_WINDOWSIZE_0_NOT_PROPAGATE_NAN_2D Tactic: 0xaec8628e8180bced Time: 0.00290532
[04/25/2026-00:42:54] [TRT] [V] Tactic Name: sm50_xmma_pooling_max_nhwc_FP32FP32_WINDOWSIZE_0_PROPAGATE_NAN_3D Tactic: 0xd76bac5638836f8a Time: 0.00292445
[04/25/2026-00:42:54] [TRT] [V] Tactic Name: sm50_xmma_pooling_max_nhwc_FP32FP32_WINDOWSIZE_0_NOT_PROPAGATE_NAN_3D Tactic: 0xfa211b1cdd504de0 Time: 0.00290838
[04/25/2026-00:42:54] [TRT] [V] Tactic Name: sm50_xmma_pooling_fw_4d_FP32FP32NHWC_Max_CAlign4 Tactic: 0x22fb1bb4a70e340d Time: 0.00290291
[04/25/2026-00:42:54] [TRT] [V] Pooling1 (CaskPooling[0x8000002f]) profiling completed in 0.0169525 seconds. Fastest Tactic: 0x8382d5c464539e87 Time: 0.00289269
[04/25/2026-00:42:54] [TRT] [V] >>>>>>>>>>>>>>> Chose Runner Type: CaskPooling Tactic: 0x8382d5c464539e87
[04/25/2026-00:42:54] [TRT] [V] =============== Computing costs for Convolution2 + Activation2
[04/25/2026-00:42:54] [TRT] [V] *************** Autotuning format combination: Float(6272,196,14,1) -> Float(12544,196,14,1) ***************
[04/25/2026-00:42:54] [TRT] [V] --------------- Timing Runner: Convolution2 + Activation2 (CaskConvolution[0x80000009])
[04/25/2026-00:42:54] [TRT] [V] Tactic Name: ampere_scudnn_128x64_relu_medium_nn_v1 Tactic: 0xf64396b97c889179 Time: 0.0709909
[04/25/2026-00:42:54] [TRT] [V] Tactic Name: ampere_scudnn_128x32_relu_small_nn_v1 Tactic: 0xa8609adc4e0ceb90 Time: 0.0675627
[04/25/2026-00:42:54] [TRT] [V] Tactic Name: ampere_scudnn_128x128_relu_medium_nn_v1 Tactic: 0xf067e6205da31c2e Time: 0.0775424
[04/25/2026-00:42:54] [TRT] [V] Tactic Name: sm70_xmma_fprop_implicit_gemm_f32f32_f32f32_f32_nchwkcrs_nchw_tilesize64x64x8_stage1_warpsize1x4x1_g1_ffma_aligna4_alignc4 Tactic: 0xe40b38338a3a7d7e Time: 0.0266306
[04/25/2026-00:42:54] [TRT] [V] Tactic Name: sm70_xmma_fprop_implicit_gemm_f32f32_f32f32_f32_nchwkcrs_nchw_tilesize32x32x8_stage1_warpsize1x2x1_g1_ffma_aligna4_alignc4 Tactic: 0xf7a98be0a08d77c4 Time: 0.0247802
[04/25/2026-00:42:54] [TRT] [V] Tactic Name: sm70_xmma_fprop_implicit_gemm_f32f32_f32f32_f32_nchwkcrs_nchw_tilesize64x128x8_stage1_warpsize1x4x1_g1_ffma_aligna4_alignc4 Tactic: 0xd1338f4b38d341e2 Time: 0.0375004
[04/25/2026-00:42:54] [TRT] [V] Tactic Name: sm80_xmma_fprop_implicit_gemm_f32f32_f32f32_f32_nchwkcrs_nchw_tilesize64x128x8_stage3_warpsize1x4x1_g1_ffma_aligna4_alignc4 Tactic: 0x5aa723e0481da855 Time: 0.0384747
[04/25/2026-00:42:54] [TRT] [V] Tactic Name: sm80_xmma_fprop_implicit_gemm_f32f32_f32f32_f32_nchwkcrs_nchw_tilesize256x128x8_stage3_warpsize4x2x1_g1_ffma_aligna4_alignc4 Tactic: 0xbb8c3889c7eacd30 Time: 0.114656
[04/25/2026-00:42:54] [TRT] [V] Tactic Name: sm70_xmma_fprop_implicit_gemm_indexed_f32f32_f32f32_f32_nchwkcrs_nchw_tilesize128x16x8_stage1_warpsize4x1x1_g1_ffma_aligna4_alignc4 Tactic: 0x65d82d184f452332 Time: 0.0426293
[04/25/2026-00:42:54] [TRT] [V] Tactic Name: sm70_xmma_fprop_implicit_gemm_indexed_f32f32_f32f32_f32_nchwkcrs_nchw_tilesize32x32x8_stage1_warpsize1x2x1_g1_ffma_aligna4_alignc4 Tactic: 0x9efed776051c0873 Time: 0.038291
[04/25/2026-00:42:54] [TRT] [V] Tactic Name: sm70_xmma_fprop_implicit_gemm_indexed_f32f32_f32f32_f32_nchwkcrs_nchw_tilesize128x32x8_stage1_warpsize2x2x1_g1_ffma_aligna4_alignc4 Tactic: 0x8c4f6360145d6a1f Time: 0.0455573
[04/25/2026-00:42:54] [TRT] [V] Tactic Name: sm70_xmma_fprop_implicit_gemm_indexed_f32f32_f32f32_f32_nchwkcrs_nchw_tilesize64x64x8_stage1_warpsize1x4x1_g1_ffma_aligna4_alignc4 Tactic: 0x8d5c64a52fab02c9 Time: 0.0337109
[04/25/2026-00:42:54] [TRT] [V] Tactic Name: sm80_xmma_fprop_implicit_gemm_indexed_f32f32_f32f32_f32_nchwkcrs_nchw_tilesize128x64x8_stage2_warpsize4x1x1_g1_ffma_aligna4_alignc4_beta0_packed_stride Tactic: 0x1673e3594ce11cea Time: 0.0573943
[04/25/2026-00:42:54] [TRT] [V] Tactic Name: sm80_xmma_fprop_implicit_gemm_indexed_f32f32_f32f32_f32_nchwkcrs_nchw_tilesize128x16x8_stage3_warpsize4x1x1_g1_ffma_aligna4_alignc4 Tactic: 0x40a12e3938221818 Time: 0.0386145
[04/25/2026-00:42:54] [TRT] [V] Tactic Name: sm80_xmma_fprop_implicit_gemm_indexed_f32f32_f32f32_f32_nchwkcrs_nchw_tilesize128x32x8_stage3_warpsize2x2x1_g1_ffma_aligna4_alignc4 Tactic: 0xa9366041633a5135 Time: 0.043364
[04/25/2026-00:42:54] [TRT] [V] Tactic Name: sm80_xmma_fprop_implicit_gemm_f32f32_f32f32_f32_nchwkcrs_nchw_tilesize32x32x8_stage3_warpsize1x2x1_g1_ffma_t1r5s5_aligna4_alignc4 Tactic: 0x5b8bf1b8028629d9 Time: 0.0188243
[04/25/2026-00:42:54] [TRT] [V] Tactic Name: sm70_xmma_fprop_implicit_gemm_f32f32_f32f32_f32_nchwkcrs_nchw_tilesize32x32x8_stage1_warpsize1x2x1_g1_ffma_t1r5s5_aligna4_alignc4 Tactic: 0x7e1e4d26cfa285f9 Time: 0.027896
[04/25/2026-00:42:54] [TRT] [V] Tactic Name: ampere_scudnn_128x64_relu_small_nn_v1 Tactic: 0x3f243c490d502deb Time: 0.0523505
[04/25/2026-00:42:54] [TRT] [V] Tactic Name: sm70_xmma_fprop_implicit_gemm_f32f32_f32f32_f32_nchwkcrs_nchw_tilesize128x16x8_stage1_warpsize4x1x1_g1_ffma_aligna4_alignc4 Tactic: 0x160b77f4a95ab6d3 Time: 0.03368
[04/25/2026-00:42:54] [TRT] [V] Tactic Name: sm70_xmma_fprop_implicit_gemm_f32f32_f32f32_f32_nchwkcrs_nchw_tilesize128x64x8_stage1_warpsize2x2x1_g1_ffma_aligna4_alignc4 Tactic: 0x994f5b723e2d80da Time: 0.0423627
[04/25/2026-00:42:54] [TRT] [V] Tactic Name: sm80_xmma_fprop_implicit_gemm_f32f32_f32f32_f32_nchwkcrs_nchw_tilesize64x64x8_stage3_warpsize1x4x1_g1_ffma_aligna4_alignc4 Tactic: 0xa31d27de74b895ff Time: 0.0255939
[04/25/2026-00:42:54] [TRT] [V] Tactic Name: sm80_xmma_fprop_implicit_gemm_f32f32_f32f32_f32_nchwkcrs_nchw_tilesize32x32x8_stage3_warpsize1x2x1_g1_ffma_aligna4_alignc4 Tactic: 0xb0bf940d5e0f9f45 Time: 0.0195289
[04/25/2026-00:42:54] [TRT] [V] Tactic Name: ampere_scudnn_128x64_relu_xregs_large_nn_v1 Tactic: 0x5deb29b7a8e275f7 Time: 0.0621031
[04/25/2026-00:42:54] [TRT] [V] Tactic Name: sm70_xmma_fprop_implicit_gemm_f32f32_f32f32_f32_nchwkcrs_nchw_tilesize64x64x8_stage1_warpsize1x4x1_g1_ffma_t1r5s5_aligna4_alignc4 Tactic: 0xb3ea28771604ad88 Time: 0.0264353
[04/25/2026-00:42:54] [TRT] [V] Tactic Name: sm80_xmma_fprop_implicit_gemm_f32f32_f32f32_f32_nchwkcrs_nchw_tilesize128x16x8_stage3_warpsize4x1x1_g1_ffma_aligna4_alignc4 Tactic: 0x9d9fdb5fd9945f64 Time: 0.0253981
[04/25/2026-00:42:54] [TRT] [V] Tactic Name: sm80_xmma_fprop_implicit_gemm_indexed_f32f32_f32f32_f32_nchwkcrs_nchw_tilesize64x64x8_stage3_warpsize1x4x1_g1_ffma_aligna4_alignc4 Tactic: 0xd828f024626fa982 Time: 0.0322308
[04/25/2026-00:42:54] [TRT] [V] Tactic Name: sm80_xmma_fprop_implicit_gemm_f32f32_f32f32_f32_nchwkcrs_nchw_tilesize128x64x8_stage3_warpsize2x2x1_g1_ffma_aligna4_alignc4 Tactic: 0x12dbf7d94ee3696d Time: 0.0413855
[04/25/2026-00:42:54] [TRT] [V] Tactic Name: sm80_xmma_fprop_implicit_gemm_f32f32_f32f32_f32_nchwkcrs_nchw_tilesize64x64x8_stage3_warpsize1x4x1_g1_ffma_t1r5s5_aligna4_alignc4 Tactic: 0x967f94e9db2001a8 Time: 0.0255017
[04/25/2026-00:42:54] [TRT] [V] Tactic Name: sm80_xmma_fprop_implicit_gemm_indexed_f32f32_f32f32_f32_nchwkcrs_nchw_tilesize32x32x8_stage3_warpsize1x2x1_g1_ffma_aligna4_alignc4 Tactic: 0xcb8a43f748d8a338 Time: 0.0253234
[04/25/2026-00:42:54] [TRT] [V] Tactic Name: sm70_xmma_fprop_implicit_gemm_f32f32_f32f32_f32_nchwkcrs_nchw_tilesize128x256x8_stage1_warpsize2x4x1_g1_ffma_aligna4_alignc4 Tactic: 0xd2aa21bfe2167c0c Time: 0.107637
[04/25/2026-00:42:54] [TRT] [V] Tactic Name: ampere_scudnn_128x128_relu_small_nn_v1 Tactic: 0x503619c69ae500ff Time: 0.0665653
[04/25/2026-00:42:54] [TRT] [V] Tactic Name: sm80_xmma_fprop_implicit_gemm_indexed_f32f32_f32f32_f32_nchwkcrs_nchw_tilesize128x64x8_stage2_warpsize1x4x1_g1_ffma_aligna4_alignc4_beta0_packed_stride Tactic: 0xede36641840ce3d2 Time: 0.0509044
[04/25/2026-00:42:54] [TRT] [V] Tactic Name: sm70_xmma_fprop_implicit_gemm_f32f32_f32f32_f32_nchwkcrs_nchw_tilesize128x128x8_stage1_warpsize2x2x1_g1_ffma_aligna4_alignc4 Tactic: 0xac49795b871b0d29 Time: 0.0667648
[04/25/2026-00:42:54] [TRT] [V] Tactic Name: sm80_xmma_fprop_implicit_gemm_indexed_f32f32_f32f32_f32_nchwkcrs_nchw_tilesize128x64x8_stage2_warpsize2x2x1_g1_ffma_aligna4_alignc4_beta0_packed_stride Tactic: 0x31aa67f57c5aea77 Time: 0.0530682
[04/25/2026-00:42:54] [TRT] [V] Convolution2 + Activation2 (CaskConvolution[0x80000009]) profiling completed in 0.0831408 seconds. Fastest Tactic: 0x5b8bf1b8028629d9 Time: 0.0188243
[04/25/2026-00:42:54] [TRT] [V] Skipping CaskFlattenConvolution: No valid tactics for Convolution2 + Activation2
[04/25/2026-00:42:54] [TRT] [V] >>>>>>>>>>>>>>> Chose Runner Type: CaskConvolution Tactic: 0x5b8bf1b8028629d9
[04/25/2026-00:42:54] [TRT] [V] *************** Autotuning format combination: Float(6272,1,448,32) -> Float(12544,1,896,64) ***************
[04/25/2026-00:42:54] [TRT] [V] --------------- Timing Runner: Convolution2 + Activation2 (CaskConvolution[0x80000009])
[04/25/2026-00:42:54] [TRT] [V] Tactic Name: sm70_xmma_fprop_implicit_gemm_f32f32_f32f32_f32_nhwckrsc_nhwc_tilesize64x32x32_stage1_warpsize1x1x1_g1_ffma_t1r5s5_aligna4_alignc4 Tactic: 0x737793996edbf8e2 Time: 0.110829
[04/25/2026-00:42:54] [TRT] [V] Tactic Name: sm80_xmma_fprop_implicit_gemm_f32f32_f32f32_f32_nhwckrsc_nhwc_tilesize64x64x8_stage3_warpsize1x4x1_g1_ffma_t1r5s5_aligna4_alignc4 Tactic: 0x45ff0c3a09b02e78 Time: 0.0239543
[04/25/2026-00:42:54] [TRT] [V] Tactic Name: sm80_xmma_fprop_implicit_gemm_f32f32_f32f32_f32_nhwckrsc_nhwc_tilesize128x64x8_stage3_warpsize2x2x1_g1_ffma_aligna4_alignc4 Tactic: 0x1da91d865428f237 Time: 0.0367243
[04/25/2026-00:42:54] [TRT] [V] Tactic Name: sm70_xmma_fprop_implicit_gemm_indexed_f32f32_f32f32_f32_nhwckrsc_nhwc_tilesize32x32x8_stage1_warpsize1x2x1_g1_ffma_aligna4_alignc4 Tactic: 0x5f60af66e8eb9b51 Time: 0.0298916
[04/25/2026-00:42:54] [TRT] [V] Tactic Name: sm70_xmma_fprop_implicit_gemm_indexed_f32f32_f32f32_f32_nhwckrsc_nhwc_tilesize128x32x8_stage1_warpsize2x2x1_g1_ffma_aligna4_alignc4 Tactic: 0x833d893f0e96f145 Time: 0.0338987
[04/25/2026-00:42:54] [TRT] [V] Tactic Name: sm80_xmma_fprop_implicit_gemm_indexed_wo_smem_f32f32_tf32f32_f32_nhwckrsc_nhwc_tilesize128x32x16_stage1_warpsize4x1x1_g1_tensor16x8x8_aligna4_alignc4 Tactic: 0xf231cca3335919a4 Time: 0.0355072
[04/25/2026-00:42:54] [TRT] [V] Tactic Name: sm70_xmma_fprop_implicit_gemm_f32f32_f32f32_f32_nhwckrsc_nhwc_tilesize64x16x16_stage1_warpsize1x1x1_g1_ffma_t1r5s5_aligna4_alignc4 Tactic: 0x247bb0dcaf6f9760 Time: 0.02956
[04/25/2026-00:42:54] [TRT] [V] Tactic Name: sm80_xmma_fprop_implicit_gemm_indexed_f32f32_f32f32_f32_nhwckrsc_nhwc_tilesize128x16x8_stage3_warpsize4x1x1_g1_ffma_aligna4_alignc4 Tactic: 0x4fd3c46622e98342 Time: 0.0301813
[04/25/2026-00:42:54] [TRT] [V] Tactic Name: sm80_xmma_fprop_implicit_gemm_indexed_wo_smem_f32f32_tf32f32_f32_nhwckrsc_nhwc_tilesize128x16x32_stage1_warpsize4x1x1_g1_tensor16x8x8_aligna4_alignc4 Tactic: 0xcf8ea142095f02d2 Time: 0.0300027
[04/25/2026-00:42:54] [TRT] [V] Tactic Name: sm80_xmma_fprop_implicit_gemm_f32f32_f32f32_f32_nhwckrsc_nhwc_tilesize32x32x8_stage3_warpsize1x2x1_g1_ffma_t1r5s5_aligna4_alignc4 Tactic: 0x880b696bd0160609 Time: 0.0149598
[04/25/2026-00:42:54] [TRT] [V] Tactic Name: sm70_xmma_fprop_implicit_gemm_f32f32_f32f32_f32_nhwckrsc_nhwc_tilesize128x16x8_stage1_warpsize4x1x1_g1_ffma_aligna4_alignc4 Tactic: 0x19799dabb3912d89 Time: 0.0308693
[04/25/2026-00:42:54] [TRT] [V] Tactic Name: sm70_xmma_fprop_implicit_gemm_f32f32_f32f32_f32_nhwckrsc_nhwc_tilesize64x128x8_stage1_warpsize1x4x1_g1_ffma_aligna4_alignc4 Tactic: 0xde4165142218dab8 Time: 0.0349547
[04/25/2026-00:42:54] [TRT] [V] Tactic Name: sm70_xmma_fprop_implicit_gemm_f32f32_f32f32_f32_nhwckrsc_nhwc_tilesize128x64x8_stage1_warpsize2x2x1_g1_ffma_aligna4_alignc4 Tactic: 0x963db12d24e61b80 Time: 0.0358965
[04/25/2026-00:42:54] [TRT] [V] Tactic Name: sm80_xmma_fprop_implicit_gemm_indexed_f32f32_f32f32_f32_nhwckrsc_nhwc_tilesize128x32x8_stage3_warpsize2x2x1_g1_ffma_aligna4_alignc4 Tactic: 0xa6448a1e79f1ca6f Time: 0.028824
[04/25/2026-00:42:54] [TRT] [V] Tactic Name: sm80_xmma_fprop_implicit_gemm_f32f32_f32f32_f32_nhwckrsc_nhwc_tilesize128x16x8_stage3_warpsize4x1x1_g1_ffma_t1r5s5_aligna4_alignc4 Tactic: 0xe35d4a4a3b499fe7 Time: 0.020229
[04/25/2026-00:42:54] [TRT] [V] Tactic Name: sm70_xmma_fprop_implicit_gemm_f32f32_f32f32_f32_nhwckrsc_nhwc_tilesize64x32x32_stage1_warpsize1x1x1_g1_ffma_aligna4_alignc4 Tactic: 0xdb73e25ae4006f74 Time: 0.110848
[04/25/2026-00:42:54] [TRT] [V] Tactic Name: sm80_xmma_fprop_implicit_gemm_indexed_f32f32_f32f32_f32_nhwckrsc_nhwc_tilesize64x64x8_stage3_warpsize1x4x1_g1_ffma_aligna4_alignc4 Tactic: 0x19b688348f983aa0 Time: 0.0258101
[04/25/2026-00:42:54] [TRT] [V] Tactic Name: sm80_xmma_fprop_implicit_gemm_f32f32_f32f32_f32_nhwckrsc_nhwc_tilesize256x64x8_stage3_warpsize2x2x1_g1_ffma_aligna4_alignc4 Tactic: 0x8014228ec08b4d49 Time: 0.0636142
[04/25/2026-00:42:54] [TRT] [V] Tactic Name: sm70_xmma_fprop_implicit_gemm_f32f32_f32f32_f32_nhwckrsc_nhwc_tilesize128x16x8_stage1_warpsize4x1x1_g1_ffma_t1r5s5_aligna4_alignc4 Tactic: 0x54e3b8c9b1e5f17a Time: 0.0301511
[04/25/2026-00:42:54] [TRT] [V] Tactic Name: sm70_xmma_fprop_implicit_gemm_indexed_f32f32_f32f32_f32_nhwckrsc_nhwc_tilesize128x16x8_stage1_warpsize4x1x1_g1_ffma_aligna4_alignc4 Tactic: 0x6aaac747558eb868 Time: 0.0345984
[04/25/2026-00:42:54] [TRT] [V] Tactic Name: sm70_xmma_fprop_implicit_gemm_f32f32_f32f32_f32_nhwckrsc_nhwc_tilesize64x64x8_stage1_warpsize1x4x1_g1_ffma_aligna4_alignc4 Tactic: 0x2595402367cdee5c Time: 0.0287369
[04/25/2026-00:42:54] [TRT] [V] Tactic Name: sm80_xmma_fprop_implicit_gemm_f32f32_f32f32_f32_nhwckrsc_nhwc_tilesize128x16x8_stage3_warpsize4x1x1_g1_ffma_aligna4_alignc4 Tactic: 0x92ed3100c35fc43e Time: 0.02201
[04/25/2026-00:42:54] [TRT] [V] Tactic Name: sm80_xmma_fprop_implicit_gemm_f32f32_f32f32_f32_nhwckrsc_nhwc_tilesize64x64x8_stage3_warpsize1x4x1_g1_ffma_aligna4_alignc4 Tactic: 0x62835fce994f06dd Time: 0.0243619
[04/25/2026-00:42:54] [TRT] [V] Tactic Name: sm70_xmma_fprop_implicit_gemm_f32f32_f32f32_f32_nhwckrsc_nhwc_tilesize32x32x8_stage1_warpsize1x2x1_g1_ffma_t1r5s5_aligna4_alignc4 Tactic: 0xad9ed5f51d32aa29 Time: 0.0287182
[04/25/2026-00:42:54] [TRT] [V] Tactic Name: sm70_xmma_fprop_implicit_gemm_f32f32_f32f32_f32_nhwckrsc_nhwc_tilesize64x16x16_stage1_warpsize1x1x1_g1_ffma_aligna4_alignc4 Tactic: 0x3f904b355d9ca8e6 Time: 0.0301084
[04/25/2026-00:42:54] [TRT] [V] Tactic Name: sm80_xmma_fprop_implicit_gemm_indexed_f32f32_f32f32_f32_nhwckrsc_nhwc_tilesize32x32x8_stage3_warpsize1x2x1_g1_ffma_aligna4_alignc4 Tactic: 0x0a143be7a52f301a Time: 0.019453
[04/25/2026-00:42:54] [TRT] [V] Tactic Name: sm80_xmma_fprop_implicit_gemm_f32f32_f32f32_f32_nhwckrsc_nhwc_tilesize32x32x8_stage3_warpsize1x2x1_g1_ffma_aligna4_alignc4 Tactic: 0x7121ec1db3f80c67 Time: 0.0155297
[04/25/2026-00:42:54] [TRT] [V] Tactic Name: sm70_xmma_fprop_implicit_gemm_f32f32_f32f32_f32_nhwckrsc_nhwc_tilesize256x128x8_stage1_warpsize2x4x1_g1_ffma_aligna4_alignc4 Tactic: 0x0447933cc2be855a Time: 0.104451
[04/25/2026-00:42:54] [TRT] [V] Tactic Name: sm70_xmma_fprop_implicit_gemm_f32f32_f32f32_f32_nhwckrsc_nhwc_tilesize32x32x8_stage1_warpsize1x2x1_g1_ffma_aligna4_alignc4 Tactic: 0x3637f3f04d7ae4e6 Time: 0.0300942
[04/25/2026-00:42:54] [TRT] [V] Convolution2 + Activation2 (CaskConvolution[0x80000009]) profiling completed in 0.0725052 seconds. Fastest Tactic: 0x880b696bd0160609 Time: 0.0149598
[04/25/2026-00:42:54] [TRT] [V] Skipping CaskFlattenConvolution: No valid tactics for Convolution2 + Activation2
[04/25/2026-00:42:54] [TRT] [V] >>>>>>>>>>>>>>> Chose Runner Type: CaskConvolution Tactic: 0x880b696bd0160609
[04/25/2026-00:42:54] [TRT] [V] *************** Autotuning format combination: Float(1568,1:4,112,8) -> Float(12544,196,14,1) ***************
[04/25/2026-00:42:54] [TRT] [V] --------------- Timing Runner: Convolution2 + Activation2 (CaskConvolution[0x80000009])
[04/25/2026-00:42:54] [TRT] [V] Tactic Name: sm80_xmma_fprop_implicit_gemm_indexed_f32f32_tf32f32_f32_nhwckrsc_nchw_tilesize128x128x16_stage4_warpsize2x2x1_g1_tensor16x8x8_alignc4 Tactic: 0xe8f7b6a5bab325f8 Time: 0.0287947
[04/25/2026-00:42:54] [TRT] [V] Tactic Name: sm80_xmma_fprop_implicit_gemm_f32f32_tf32f32_f32_nhwckrsc_nchw_tilesize128x128x16_stage4_warpsize2x2x1_g1_tensor16x8x8_alignc4 Tactic: 0x9fd9fe001908ce2e Time: 0.0267381
[04/25/2026-00:42:54] [TRT] [V] Convolution2 + Activation2 (CaskConvolution[0x80000009]) profiling completed in 0.00445501 seconds. Fastest Tactic: 0x9fd9fe001908ce2e Time: 0.0267381
[04/25/2026-00:42:54] [TRT] [V] Skipping CaskFlattenConvolution: No valid tactics for Convolution2 + Activation2
[04/25/2026-00:42:54] [TRT] [V] >>>>>>>>>>>>>>> Chose Runner Type: CaskConvolution Tactic: 0x9fd9fe001908ce2e
[04/25/2026-00:42:54] [TRT] [V] *************** Autotuning format combination: Float(1568,1:4,112,8) -> Float(3136,1:4,224,16) ***************
[04/25/2026-00:42:54] [TRT] [V] --------------- Timing Runner: Convolution2 + Activation2 (CaskConvolution[0x80000009])
[04/25/2026-00:42:54] [TRT] [V] Tactic Name: ampere_scudnn_128x32_sliced1x4_ldg4_relu_exp_small_nhwc_tn_v1 Tactic: 0x3e2b881168d9689d Time: 0.0235264
[04/25/2026-00:42:54] [TRT] [V] Tactic Name: ampere_scudnn_128x128_ldg4_relu_exp_medium_nhwc_tn_v1 Tactic: 0x7bc32c782b800c48 Time: 0.068256
[04/25/2026-00:42:54] [TRT] [V] Tactic Name: sm80_xmma_fprop_implicit_gemm_f32f32_tf32f32_f32_nhwckrsc_nhwc_tilesize128x128x16_stage4_warpsize2x2x1_g1_tensor16x8x8 Tactic: 0xb443c221fcb1565b Time: 0.0258593
[04/25/2026-00:42:54] [TRT] [V] Tactic Name: sm80_xmma_fprop_implicit_gemm_indexed_f32f32_tf32f32_f32_nhwckrsc_nhwc_tilesize128x128x16_stage4_warpsize2x2x1_g1_tensor16x8x8 Tactic: 0x65e41d81f093b482 Time: 0.0280596
[04/25/2026-00:42:54] [TRT] [V] Tactic Name: sm80_xmma_fprop_implicit_gemm_indexed_wo_smem_f32f32_tf32f32_f32_nhwckrsc_nhwc_tilesize128x32x16_stage1_warpsize4x1x1_g1_tensor16x8x8_aligna8_alignc4 Tactic: 0xf78ec258f27b3e23 Time: 0.0384616
[04/25/2026-00:42:54] [TRT] [V] Tactic Name: sm80_xmma_fprop_implicit_gemm_indexed_wo_smem_f32f32_tf32f32_f32_nhwckrsc_nhwc_tilesize128x32x16_stage1_warpsize4x1x1_g1_tensor16x8x8_aligna4_alignc8 Tactic: 0x7e40882e33c8fbf1 Time: 0.0351243
[04/25/2026-00:42:54] [TRT] [V] Tactic Name: sm80_xmma_fprop_implicit_gemm_indexed_wo_smem_f32f32_tf32f32_f32_nhwckrsc_nhwc_tilesize128x16x32_stage1_warpsize4x1x1_g1_tensor16x8x8_aligna8_alignc8 Tactic: 0x4640eb34c8ecc700 Time: 0.0370091
[04/25/2026-00:42:54] [TRT] [V] Tactic Name: sm80_xmma_fprop_implicit_gemm_indexed_wo_smem_f32f32_tf32f32_f32_nhwckrsc_nhwc_tilesize128x16x32_stage1_warpsize4x1x1_g1_tensor16x8x8_aligna4 Tactic: 0xb3e5ce9d1b1da232 Time: 0.034752
[04/25/2026-00:42:54] [TRT] [V] Tactic Name: sm80_xmma_fprop_implicit_gemm_indexed_wo_smem_f32f32_tf32f32_f32_nhwckrsc_nhwc_tilesize128x16x64_stage1_warpsize4x1x1_g1_tensor16x8x8 Tactic: 0x10383a0781d24dde Time: 0.0110968
[04/25/2026-00:42:54] [TRT] [V] Tactic Name: sm80_xmma_fprop_implicit_gemm_indexed_wo_smem_f32f32_tf32f32_f32_nhwckrsc_nhwc_tilesize128x16x64_stage1_warpsize4x1x1_g1_tensor16x8x8_alignc8 Tactic: 0x4037b478ce77e422 Time: 0.0182305
[04/25/2026-00:42:54] [TRT] [V] Tactic Name: sm80_xmma_fprop_implicit_gemm_indexed_wo_smem_f32f32_tf32f32_f32_nhwckrsc_nhwc_tilesize128x32x64_stage1_warpsize4x1x1_g1_tensor16x8x8_alignc8 Tactic: 0x3a8712b17741b582 Time: 0.0174368
[04/25/2026-00:42:54] [TRT] [V] Tactic Name: sm80_xmma_fprop_implicit_gemm_indexed_wo_smem_f32f32_tf32f32_f32_nhwckrsc_nhwc_tilesize128x32x64_stage1_warpsize4x1x1_g1_tensor16x8x8_alignc4 Tactic: 0xb6f6563c77d057d7 Time: 0.0178908
[04/25/2026-00:42:54] [TRT] [V] Tactic Name: sm80_xmma_fprop_implicit_gemm_indexed_wo_smem_f32f32_tf32f32_f32_nhwckrsc_nhwc_tilesize128x32x64_stage1_warpsize4x1x1_g1_tensor16x8x8_aligna8 Tactic: 0x9355e195cee05798 Time: 0.0214167
[04/25/2026-00:42:54] [TRT] [V] Tactic Name: sm80_xmma_fprop_implicit_gemm_indexed_wo_smem_f32f32_tf32f32_f32_nhwckrsc_nhwc_tilesize128x32x64_stage1_warpsize4x1x1_g1_tensor16x8x8_aligna4_alignc8 Tactic: 0x1acd4f006848c62b Time: 0.0355253
[04/25/2026-00:42:54] [TRT] [V] Tactic Name: sm80_xmma_fprop_implicit_gemm_indexed_wo_smem_f32f32_tf32f32_f32_nhwckrsc_nhwc_tilesize128x16x64_stage1_warpsize4x1x1_g1_tensor16x8x8_alignc4 Tactic: 0xcc46f0f5cee60677 Time: 0.0113988
[04/25/2026-00:42:54] [TRT] [V] Tactic Name: sm80_xmma_fprop_implicit_gemm_indexed_wo_smem_f32f32_tf32f32_f32_nhwckrsc_nhwc_tilesize128x32x16_stage1_warpsize4x1x1_g1_tensor16x8x8 Tactic: 0x9cb304e2edbc1221 Time: 0.0234908
[04/25/2026-00:42:54] [TRT] [V] Tactic Name: sm80_xmma_fprop_implicit_gemm_indexed_wo_smem_f32f32_tf32f32_f32_nhwckrsc_nhwc_tilesize128x16x32_stage1_warpsize4x1x1_g1_tensor16x8x8_aligna8 Tactic: 0x3f948a101b8c4067 Time: 0.0349504
[04/25/2026-00:42:54] [TRT] [V] Tactic Name: sm80_xmma_fprop_implicit_gemm_indexed_wo_smem_f32f32_tf32f32_f32_nhwckrsc_nhwc_tilesize128x16x32_stage1_warpsize4x1x1_g1_tensor16x8x8_alignc4 Tactic: 0x1a373db9a2bc4028 Time: 0.0205453
[04/25/2026-00:42:54] [TRT] [V] Tactic Name: sm80_xmma_fprop_implicit_gemm_indexed_wo_smem_f32f32_tf32f32_f32_nhwckrsc_nhwc_tilesize128x32x16_stage1_warpsize4x1x1_g1_tensor16x8x8_aligna8_alignc8 Tactic: 0x7bff86d5f2eadc76 Time: 0.0378074
[04/25/2026-00:42:54] [TRT] [V] Tactic Name: sm80_xmma_fprop_implicit_gemm_indexed_wo_smem_f32f32_tf32f32_f32_nhwckrsc_nhwc_tilesize128x16x64_stage1_warpsize4x1x1_g1_tensor16x8x8_aligna8_alignc4 Tactic: 0xab0496509b88ebe0 Time: 0.0279724
[04/25/2026-00:42:54] [TRT] [V] Tactic Name: sm80_xmma_fprop_implicit_gemm_indexed_wo_smem_f32f32_tf32f32_f32_nhwckrsc_nhwc_tilesize128x32x64_stage1_warpsize4x1x1_g1_tensor16x8x8 Tactic: 0xb33296dda7141c64 Time: 0.0182187
[04/25/2026-00:42:54] [TRT] [V] Tactic Name: sm80_xmma_fprop_implicit_gemm_indexed_wo_smem_f32f32_tf32f32_f32_nhwckrsc_nhwc_tilesize128x32x64_stage1_warpsize4x1x1_g1_tensor16x8x8_aligna8_alignc4 Tactic: 0x93030576a9fb03f9 Time: 0.021258
[04/25/2026-00:42:54] [TRT] [V] Tactic Name: ampere_scudnn_128x128_ldg4_relu_exp_small_nhwc_tn_v1 Tactic: 0xf90060ce8193b811 Time: 0.0648658
[04/25/2026-00:42:54] [TRT] [V] Tactic Name: sm80_xmma_fprop_implicit_gemm_indexed_wo_smem_f32f32_tf32f32_f32_nhwckrsc_nhwc_tilesize128x32x16_stage1_warpsize4x1x1_g1_tensor16x8x8_aligna4 Tactic: 0x570667f2a28165a0 Time: 0.0400936
[04/25/2026-00:42:54] [TRT] [V] Tactic Name: sm80_xmma_fprop_implicit_gemm_indexed_wo_smem_f32f32_tf32f32_f32_nhwckrsc_nhwc_tilesize128x32x16_stage1_warpsize4x1x1_g1_tensor16x8x8_alignc4 Tactic: 0xfed494d61b2087ba Time: 0.0236907
[04/25/2026-00:42:54] [TRT] [V] Tactic Name: sm80_xmma_fprop_implicit_gemm_f32f32_tf32f32_f32_nhwckrsc_nhwc_tilesize128x128x16_stage4_warpsize2x2x1_g1_tensor16x8x8_t1r5s5 Tactic: 0x94f2b2320bb3fc74 Time: 0.0251223
[04/25/2026-00:42:54] [TRT] [V] Tactic Name: sm80_xmma_fprop_implicit_gemm_indexed_wo_smem_f32f32_tf32f32_f32_nhwckrsc_nhwc_tilesize128x16x32_stage1_warpsize4x1x1_g1_tensor16x8x8_alignc8 Tactic: 0x96467934a22da27d Time: 0.0204549
[04/25/2026-00:42:54] [TRT] [V] Tactic Name: sm80_xmma_fprop_implicit_gemm_indexed_wo_smem_f32f32_tf32f32_f32_nhwckrsc_nhwc_tilesize128x32x16_stage1_warpsize4x1x1_g1_tensor16x8x8_aligna8 Tactic: 0xdb77237fa21087f5 Time: 0.0367115
[04/25/2026-00:42:54] [TRT] [V] Tactic Name: sm80_xmma_fprop_implicit_gemm_indexed_wo_smem_f32f32_tf32f32_f32_nhwckrsc_nhwc_tilesize128x16x64_stage1_warpsize4x1x1_g1_tensor16x8x8_aligna4_alignc8 Tactic: 0x22cadc265a3b2e32 Time: 0.028488
[04/25/2026-00:42:54] [TRT] [V] Tactic Name: sm80_xmma_fprop_implicit_gemm_indexed_wo_smem_f32f32_tf32f32_f32_nhwckrsc_nhwc_tilesize128x32x16_stage1_warpsize4x1x1_g1_tensor16x8x8_alignc8 Tactic: 0x72a5d05b1bb165ef Time: 0.0232128
[04/25/2026-00:42:54] [TRT] [V] Tactic Name: sm80_xmma_fprop_implicit_gemm_indexed_wo_smem_f32f32_tf32f32_f32_nhwckrsc_nhwc_tilesize128x16x64_stage1_warpsize4x1x1_g1_tensor16x8x8_aligna8 Tactic: 0xe9e5475c77d60638 Time: 0.0268825
[04/25/2026-00:42:54] [TRT] [V] Tactic Name: ampere_scudnn_128x64_sliced1x2_ldg4_relu_exp_large_nhwc_tn_v1 Tactic: 0xbdfdef6b84f7ccc9 Time: 0.042616
[04/25/2026-00:42:54] [TRT] [V] Tactic Name: sm80_xmma_fprop_implicit_gemm_indexed_wo_smem_f32f32_tf32f32_f32_nhwckrsc_nhwc_tilesize128x16x32_stage1_warpsize4x1x1_g1_tensor16x8x8_aligna4_alignc8 Tactic: 0x43ffe5cf09cee087 Time: 0.0298578
[04/25/2026-00:42:54] [TRT] [V] Tactic Name: sm80_xmma_fprop_implicit_gemm_indexed_wo_smem_f32f32_tf32f32_f32_nhwckrsc_nhwc_tilesize128x16x32_stage1_warpsize4x1x1_g1_tensor16x8x8 Tactic: 0xae48d3ccfe1edfcd Time: 0.0163799
[04/25/2026-00:42:54] [TRT] [V] Convolution2 + Activation2 (CaskConvolution[0x80000009]) profiling completed in 0.0807521 seconds. Fastest Tactic: 0x10383a0781d24dde Time: 0.0110968
[04/25/2026-00:42:54] [TRT] [V] Skipping CaskFlattenConvolution: No valid tactics for Convolution2 + Activation2
[04/25/2026-00:42:54] [TRT] [V] >>>>>>>>>>>>>>> Chose Runner Type: CaskConvolution Tactic: 0x10383a0781d24dde
[04/25/2026-00:42:54] [TRT] [V] =============== Computing costs for Pooling2
[04/25/2026-00:42:54] [TRT] [V] *************** Autotuning format combination: Float(12544,196,14,1) -> Float(3136,49,7,1) ***************
[04/25/2026-00:42:54] [TRT] [V] --------------- Timing Runner: Pooling2 (CaskPooling[0x8000002f])
[04/25/2026-00:42:54] [TRT] [V] Tactic Name: sm50_xmma_pooling_tiled_FP32NCHW_kMAX_tP2_tQ32_tR2_tS2_tU2_tV2_tUnroll6_tThreads256 Tactic: 0x60eceb67eff69444 Time: 0.0024832
[04/25/2026-00:42:54] [TRT] [V] Tactic Name: sm50_xmma_pooling_tiled_FP32NCHW_kMAX_tP2_tQ32_tR2_tS2_tU2_tV2_tUnroll1_tThreads256 Tactic: 0xc7d8c563bd6ced88 Time: 0.00262828
[04/25/2026-00:42:54] [TRT] [V] Tactic Name: sm50_xmma_pooling_nd_NCDHW_kMAX_kGENERIC_3D_POOLING_MODE_kFLOAT_0 Tactic: 0x5faf4a0a8a5670ed Time: 0.00283444
[04/25/2026-00:42:54] [TRT] [V] Tactic Name: sm50_xmma_pooling_tiled_FP32NCHW_kMAX_tP2_tQ16_tR2_tS2_tU2_tV2_tUnroll6_tThreads128 Tactic: 0xf4b20242f8c135e7 Time: 0.00239543
[04/25/2026-00:42:54] [TRT] [V] Tactic Name: sm50_xmma_pooling_tiled_FP32NCHW_kMAX_tP2_tQ16_tR2_tS2_tU2_tV2_tUnroll2_tThreads128 Tactic: 0xa7a495ee24d0c659 Time: 0.00242211
[04/25/2026-00:42:54] [TRT] [V] Tactic Name: sm50_xmma_pooling_fw_4d_FP32FP32NCHW_Max Tactic: 0xb59f9cfb90407c92 Time: 0.00290226
[04/25/2026-00:42:54] [TRT] [V] Tactic Name: sm50_xmma_pooling_tiled_FP32NCHW_kMAX_tP2_tQ32_tR2_tS2_tU2_tV2_tUnroll8_tThreads256 Tactic: 0xbc5c1844e5cc7959 Time: 0.00323749
[04/25/2026-00:42:54] [TRT] [V] Tactic Name: sm50_xmma_pooling_tiled_FP32NCHW_kMAX_tP2_tQ16_tR2_tS2_tU2_tV2_tUnroll8_tThreads128 Tactic: 0x2802f161f2fbd8fa Time: 0.00248889
[04/25/2026-00:42:54] [TRT] [V] Tactic Name: sm50_xmma_pooling_tiled_FP32NCHW_kMAX_tP2_tQ16_tR2_tS2_tU2_tV2_tUnroll3_tThreads128 Tactic: 0x7a0d6790c453b5f4 Time: 0.00237753
[04/25/2026-00:42:54] [TRT] [V] Tactic Name: sm50_xmma_pooling_tiled_FP32NCHW_kMAX_tP2_tQ16_tR2_tS2_tU2_tV2_tUnroll1_tThreads128 Tactic: 0x53862c46aa5b4c2b Time: 0.00254876
[04/25/2026-00:42:54] [TRT] [V] Tactic Name: sm50_xmma_pooling_tiled_FP32NCHW_kMAX_tP2_tQ16_tR2_tS2_tU2_tV2_tUnroll7_tThreads128 Tactic: 0x291bf03c1842464a Time: 0.00240614
[04/25/2026-00:42:54] [TRT] [V] Tactic Name: sm50_xmma_pooling_tiled_FP32NCHW_kMAX_tP2_tQ32_tR2_tS2_tU2_tV2_tUnroll5_tThreads256 Tactic: 0x94ce52cf617d1e36 Time: 0.00240376
[04/25/2026-00:42:54] [TRT] [V] Tactic Name: sm50_xmma_pooling_tiled_FP32NCHW_kMAX_tP2_tQ32_tR2_tS2_tU2_tV2_tUnroll4_tThreads256 Tactic: 0x4967a0b181fe6d9b Time: 0.00302251
[04/25/2026-00:42:54] [TRT] [V] Tactic Name: sm50_xmma_pooling_tiled_FP32NCHW_kMAX_tP2_tQ16_tR2_tS2_tU2_tV2_tUnroll5_tThreads128 Tactic: 0x0090bbea764abf95 Time: 0.00283778
[04/25/2026-00:42:54] [TRT] [V] Tactic Name: sm50_xmma_pooling_tiled_FP32NCHW_kMAX_tP2_tQ32_tR2_tS2_tU2_tV2_tUnroll7_tThreads256 Tactic: 0xbd4519190f75e7e9 Time: 0.00248209
[04/25/2026-00:42:54] [TRT] [V] Tactic Name: sm50_xmma_pooling_tiled_FP32NCHW_kMAX_tP2_tQ32_tR2_tS2_tU2_tV2_tUnroll2_tThreads256 Tactic: 0x33fa7ccb33e767fa Time: 0.00240123
[04/25/2026-00:42:54] [TRT] [V] Tactic Name: sm50_xmma_pooling_tiled_FP32NCHW_kMAX_tP2_tQ32_tR2_tS2_tU2_tV2_tUnroll3_tThreads256 Tactic: 0xee538eb5d3641457 Time: 0.00241592
[04/25/2026-00:42:54] [TRT] [V] Tactic Name: sm50_xmma_pooling_tiled_FP32NCHW_kMAX_tP2_tQ16_tR2_tS2_tU2_tV2_tUnroll4_tThreads128 Tactic: 0xdd39499496c9cc38 Time: 0.00232126
[04/25/2026-00:42:54] [TRT] [V] Pooling2 (CaskPooling[0x8000002f]) profiling completed in 0.0538814 seconds. Fastest Tactic: 0xdd39499496c9cc38 Time: 0.00232126
[04/25/2026-00:42:54] [TRT] [V] >>>>>>>>>>>>>>> Chose Runner Type: CaskPooling Tactic: 0xdd39499496c9cc38
[04/25/2026-00:42:54] [TRT] [V] *************** Autotuning format combination: Float(3136,1:4,224,16) -> Float(784,1:4,112,16) ***************
[04/25/2026-00:42:54] [TRT] [V] --------------- Timing Runner: Pooling2 (CaskPooling[0x8000002f])
[04/25/2026-00:42:54] [TRT] [V] Tactic Name: sm50_xmma_pooling_max_nhwc_FP32FP32_WINDOWSIZE_0_PROPAGATE_NAN_2D Tactic: 0x8382d5c464539e87 Time: 0.00290903
[04/25/2026-00:42:54] [TRT] [V] Tactic Name: sm50_xmma_pooling_max_nhwc_FP32FP32_WINDOWSIZE_0_NOT_PROPAGATE_NAN_2D Tactic: 0xaec8628e8180bced Time: 0.00287366
[04/25/2026-00:42:54] [TRT] [V] Tactic Name: sm50_xmma_pooling_max_nhwc_FP32FP32_WINDOWSIZE_0_PROPAGATE_NAN_3D Tactic: 0xd76bac5638836f8a Time: 0.00289591
[04/25/2026-00:42:54] [TRT] [V] Tactic Name: sm50_xmma_pooling_max_nhwc_FP32FP32_WINDOWSIZE_0_NOT_PROPAGATE_NAN_3D Tactic: 0xfa211b1cdd504de0 Time: 0.00291914
[04/25/2026-00:42:54] [TRT] [V] Tactic Name: sm50_xmma_pooling_fw_4d_FP32FP32NHWC_Max_CAlign4 Tactic: 0x22fb1bb4a70e340d Time: 0.0028676
[04/25/2026-00:42:54] [TRT] [V] Pooling2 (CaskPooling[0x8000002f]) profiling completed in 0.0152058 seconds. Fastest Tactic: 0x22fb1bb4a70e340d Time: 0.0028676
[04/25/2026-00:42:54] [TRT] [V] >>>>>>>>>>>>>>> Chose Runner Type: CaskPooling Tactic: 0x22fb1bb4a70e340d
[04/25/2026-00:42:54] [TRT] [V] =============== Computing costs for {ForeignNode[Shuffle...TopK]}
[04/25/2026-00:42:54] [TRT] [V] ForeignNode {ForeignNode[Shuffle...TopK]} metadata:
[04/25/2026-00:42:54] [TRT] [V] *************** Autotuning format combination: Float(3136,49,7,1) -> Float(10,1), Int32(1,1) ***************
[04/25/2026-00:42:54] [TRT] [V] --------------- Timing Runner: {ForeignNode[Shuffle...TopK]} (Myelin[0x80000023])
[04/25/2026-00:42:54] [TRT] [I] Compiler backend is used during engine build.
[04/25/2026-00:42:56] [TRT] [V]  (foreignNode) Set user's cuda kernel library
[04/25/2026-00:42:56] [TRT] [V]  (foreignNode) Autotuning op MatrixMultiplication1:
[04/25/2026-00:42:56] [TRT] [V]  (foreignNode) Sorted table of all evaluated tactics:
[04/25/2026-00:42:56] [TRT] [V]  (foreignNode) tactic_id, cost(in ms), cost/fastest_cost, prediction_correlation, kernel_name, tactic_hash, tunable_parameter
[04/25/2026-00:42:56] [TRT] [V]  (foreignNode)   34, 0.0082976, 1.00000, 2.11905, sm80_xmma_gemm_f32f32_tf32f32_f32_tn_n_tilesize32x32x64_stage3_warpsize2x1x2_tensor16x8x8, 0x55f45ef917aa0,
[04/25/2026-00:42:56] [TRT] [V]  (foreignNode)   55, 0.0084992, 1.02430, 2.07270, sm86_xmma_gemm_f32f32_tf32f32_f32_tn_n_tilesize32x32x64_stage6_warpsize2x2x1_tensor16x8x8, 0x466f4cc14ec9a,
[04/25/2026-00:42:56] [TRT] [V]  (foreignNode)   32, 0.0087040, 1.04898, 2.02011, sm80_xmma_gemm_f32f32_tf32f32_f32_nn_n_tilesize32x32x64_stage3_warpsize2x1x2_tensor16x8x8, 0x4717121680969,
[04/25/2026-00:42:56] [TRT] [V]  (foreignNode)   54, 0.0089088, 1.07366, 1.97740, sm86_xmma_gemm_f32f32_tf32f32_f32_nn_n_tilesize32x32x64_stage6_warpsize2x2x1_tensor16x8x8, 0x2c2696063c56d,
[04/25/2026-00:42:56] [TRT] [V]  (foreignNode)   47, 0.0090976, 1.09641, 1.93531, sm86_xmma_gemm_f32f32_tf32f32_f32_tn_n_tilesize32x32x64_stage6_warpsize2x2x1_tensor16x8x8, 0x331264bbc2d3b,
[04/25/2026-00:42:56] [TRT] [V]  (foreignNode)   51, 0.0092192, 1.11107, 1.91003, sm80_xmma_gemm_f32f32_tf32f32_f32_tn_n_tilesize64x32x64_stage4_warpsize2x1x2_tensor16x8x8, 0x585498719b980,
[04/25/2026-00:42:56] [TRT] [V]  (foreignNode)   24, 0.0093088, 1.12187, 1.88783, sm80_xmma_gemm_f32f32_tf32f32_f32_tn_n_tilesize32x32x64_stage3_warpsize2x1x2_tensor16x8x8, 0x3935ae10c1f9a,
[04/25/2026-00:42:56] [TRT] [V]  (foreignNode)   14, 0.0094208, 1.13536, 1.86239, sm80_xmma_gemm_f32f32_tf32f32_f32_tn_n_tilesize32x32x64_stage3_warpsize2x1x2_tensor16x8x8, 0x2da47b0cf1dbc,
[04/25/2026-00:42:56] [TRT] [V]  (foreignNode)   46, 0.0094208, 1.13536, 1.86892, sm86_xmma_gemm_f32f32_tf32f32_f32_nn_n_tilesize32x32x64_stage6_warpsize2x2x1_tensor16x8x8, 0x646f398fcceb7,
[04/25/2026-00:42:56] [TRT] [V]  (foreignNode)   22, 0.0095232, 1.14771, 1.84533, sm80_xmma_gemm_f32f32_tf32f32_f32_nn_n_tilesize32x32x64_stage3_warpsize2x1x2_tensor16x8x8, 0x300c64483ea58,
[04/25/2026-00:42:56] [TRT] [V]  (foreignNode)   50, 0.0097120, 1.17046, 1.81311, sm86_xmma_gemm_f32f32_tf32f32_f32_tn_n_tilesize64x32x64_stage4_warpsize2x2x1_tensor16x8x8, 0x54b1d6189f2b2,
[04/25/2026-00:42:56] [TRT] [V]  (foreignNode)   18, 0.0097216, 1.17162, 1.80571, sm80_xmma_gemm_f32f32_tf32f32_f32_tn_n_tilesize32x32x64_stage3_warpsize2x1x2_tensor16x8x8, 0x42f47609068e1,
[04/25/2026-00:42:56] [TRT] [V]  (foreignNode)   49, 0.0097440, 1.17432, 1.80715, sm80_xmma_gemm_f32f32_tf32f32_f32_nn_n_tilesize64x32x64_stage4_warpsize2x1x2_tensor16x8x8, 0x395aa98306a59,
[04/25/2026-00:42:56] [TRT] [V]  (foreignNode)   27, 0.0099328, 1.19707, 1.76987, sm86_xmma_gemm_f32f32_tf32f32_f32_tn_n_tilesize32x32x64_stage6_warpsize2x2x1_tensor16x8x8, 0x3aa2fa0049c68,
[04/25/2026-00:42:56] [TRT] [V]  (foreignNode)   48, 0.0103424, 1.24643, 1.70259, sm86_xmma_gemm_f32f32_tf32f32_f32_nn_n_tilesize64x32x64_stage4_warpsize2x2x1_tensor16x8x8, 0x40349892f06fb,
[04/25/2026-00:42:56] [TRT] [V]  (foreignNode)   37, 0.0104448, 1.25877, 1.68399, sm86_xmma_gemm_f32f32_tf32f32_f32_tn_n_tilesize32x32x64_stage6_warpsize2x2x1_tensor16x8x8, 0x4d4a7e5435fc6,
[04/25/2026-00:42:56] [TRT] [V]  (foreignNode)   12, 0.0106496, 1.28346, 1.64750, sm80_xmma_gemm_f32f32_tf32f32_f32_nn_n_tilesize32x32x64_stage3_warpsize2x1x2_tensor16x8x8, 0x5809eb195e7d9,
[04/25/2026-00:42:56] [TRT] [V]  (foreignNode)   16, 0.0108544, 1.30814, 1.61726, sm80_xmma_gemm_f32f32_tf32f32_f32_nn_n_tilesize32x32x64_stage3_warpsize2x1x2_tensor16x8x8, 0x391b54080a292,
[04/25/2026-00:42:56] [TRT] [V]  (foreignNode)   26, 0.0108544, 1.30814, 1.61960, sm86_xmma_gemm_f32f32_tf32f32_f32_nn_n_tilesize32x32x64_stage6_warpsize2x2x1_tensor16x8x8, 0x59a3574e28670,
[04/25/2026-00:42:56] [TRT] [V]  (foreignNode)   44, 0.0109440, 1.31894, 1.60813, sm86_xmma_gemm_f32f32_tf32f32_f32_tn_n_tilesize64x32x64_stage4_warpsize2x2x1_tensor16x8x8, 0x5136c06bd0006,
[04/25/2026-00:42:56] [TRT] [V]  (foreignNode)   45, 0.0109824, 1.32356, 1.60250, sm80_xmma_gemm_f32f32_tf32f32_f32_tn_n_tilesize64x32x64_stage4_warpsize2x1x2_tensor16x8x8, 0x54098f19d547a,
[04/25/2026-00:42:56] [TRT] [V]  (foreignNode)   36, 0.0113664, 1.36984, 1.54745, sm86_xmma_gemm_f32f32_tf32f32_f32_nn_n_tilesize32x32x64_stage6_warpsize2x2x1_tensor16x8x8, 0x43b6aa11c8fa7,
[04/25/2026-00:42:56] [TRT] [V]  (foreignNode)   43, 0.0115648, 1.39375, 1.52180, sm80_xmma_gemm_f32f32_tf32f32_f32_nn_n_tilesize64x32x64_stage4_warpsize2x1x2_tensor16x8x8, 0x5c0cf6ce9bfa3,
[04/25/2026-00:42:56] [TRT] [V]  (foreignNode)   35, 0.0115712, 1.39452, 1.51955, sm80_xmma_gemm_f32f32_tf32f32_f32_tn_n_tilesize32x32x64_stage3_warpsize2x2x1_tensor16x8x8_aligna4_alignc4, 0x5c58842729fbd,
[04/25/2026-00:42:56] [TRT] [V]  (foreignNode)   42, 0.0115712, 1.39452, 1.52096, sm86_xmma_gemm_f32f32_tf32f32_f32_nn_n_tilesize64x32x64_stage4_warpsize2x2x1_tensor16x8x8, 0x48b167302e12f,
[04/25/2026-00:42:56] [TRT] [V]  (foreignNode)    2, 0.0116448, 1.40339, 1.43657, sm80_xmma_gemm_f32f32_tf32f32_f32_tn_n_tilesize32x32x64_stage3_warpsize2x1x2_tensor16x8x8, 0x69acb924edc91,
[04/25/2026-00:42:56] [TRT] [V]  (foreignNode)   31, 0.0116736, 1.40686, 1.50616, sm80_xmma_gemm_f32f32_tf32f32_f32_tn_n_tilesize64x32x64_stage4_warpsize2x1x2_tensor16x8x8, 0x55ddb10a2fcde,
