cookbook/04-Feature/ProfilingVerbosity/log-main.py.log
[07/07/2026-06:12:04] [TRT] [V] *************** Autotuning format combination: Float(784,784,28,1) -> Float(25088,784,28,1) ***************
[07/07/2026-06:12:04] [TRT] [V] --------------- Timing Runner: node_conv2d + node_relu (CaskConvolution[0x80000009])
[07/07/2026-06:12:04] [TRT] [V] Tactic Name: sm80_xmma_fprop_implicit_gemm_f32f32_f32f32_f32_nchwkcrs_nchw_tilesize64x64x8_stage3_warpsize1x4x1_g1_ffma_t1r5s5_aligna4_alignc4 Tactic: 0x967f94e9db2001a8 Time: 0.00641429
[07/07/2026-06:12:04] [TRT] [V] Tactic Name: sm80_xmma_fprop_implicit_gemm_indexed_f32f32_f32f32_f32_nchwkcrs_nchw_tilesize32x32x8_stage3_warpsize1x2x1_g1_ffma_aligna4_alignc4 Tactic: 0xcb8a43f748d8a338 Time: 0.00640101
[07/07/2026-06:12:04] [TRT] [V] Tactic Name: sm80_xmma_fprop_implicit_gemm_indexed_f32f32_f32f32_f32_nchwkcrs_nchw_tilesize128x64x8_stage2_warpsize1x4x1_g1_ffma_aligna4_alignc4_beta0_packed_stride Tactic: 0xede36641840ce3d2 Time: 0.0103761
[07/07/2026-06:12:04] [TRT] [V] Tactic Name: sm80_xmma_fprop_implicit_gemm_indexed_f32f32_f32f32_f32_nchwkcrs_nchw_tilesize64x64x8_stage3_warpsize1x4x1_g1_ffma_aligna4_alignc4 Tactic: 0xd828f024626fa982 Time: 0.0073869
[07/07/2026-06:12:04] [TRT] [V] Tactic Name: sm70_xmma_fprop_implicit_gemm_f32f32_f32f32_f32_nchwkcrs_nchw_tilesize64x128x8_stage1_warpsize1x4x1_g1_ffma_aligna4_alignc4 Tactic: 0xd1338f4b38d341e2 Time: 0.00924915
[07/07/2026-06:12:04] [TRT] [V] Tactic Name: sm80_xmma_fprop_implicit_gemm_f32f32_f32f32_f32_nchwkcrs_nchw_tilesize32x32x8_stage3_warpsize1x2x1_g1_ffma_t1r5s5_aligna4_alignc4 Tactic: 0x5b8bf1b8028629d9 Time: 0.00557795
[07/07/2026-06:12:04] [TRT] [V] Tactic Name: sm80_xmma_fprop_implicit_gemm_f32f32_f32f32_f32_nchwkcrs_nchw_tilesize128x64x8_stage3_warpsize2x2x1_g1_ffma_aligna4_alignc4 Tactic: 0x12dbf7d94ee3696d Time: 0.00957684
[07/07/2026-06:12:04] [TRT] [V] Tactic Name: sm70_xmma_fprop_implicit_gemm_indexed_f32f32_f32f32_f32_nchwkcrs_nchw_tilesize128x16x8_stage1_warpsize4x1x1_g1_ffma_aligna4_alignc4 Tactic: 0x65d82d184f452332 Time: 0.00777253
[07/07/2026-06:12:04] [TRT] [V] Tactic Name: sm80_xmma_fprop_implicit_gemm_indexed_f32f32_f32f32_f32_nchwkcrs_nchw_tilesize128x64x8_stage2_warpsize2x2x1_g1_ffma_aligna4_alignc4_beta0_packed_stride Tactic: 0x31aa67f57c5aea77 Time: 0.0104126
[07/07/2026-06:12:04] [TRT] [V] Tactic Name: sm70_xmma_fprop_implicit_gemm_f32f32_f32f32_f32_nchwkcrs_nchw_tilesize128x128x8_stage1_warpsize2x2x1_g1_ffma_aligna4_alignc4 Tactic: 0xac49795b871b0d29 Time: 0.0136205
[07/07/2026-06:12:04] [TRT] [V] Tactic Name: sm80_xmma_fprop_implicit_gemm_f32f32_f32f32_f32_nchwkcrs_nchw_tilesize128x16x8_stage3_warpsize4x1x1_g1_ffma_aligna4_alignc4 Tactic: 0x9d9fdb5fd9945f64 Time: 0.00614788
[07/07/2026-06:12:04] [TRT] [V] Tactic Name: sm80_xmma_fprop_implicit_gemm_f32f32_f32f32_f32_nchwkcrs_nchw_tilesize64x64x8_stage3_warpsize1x4x1_g1_ffma_aligna4_alignc4 Tactic: 0xa31d27de74b895ff Time: 0.00662421
[07/07/2026-06:12:04] [TRT] [V] Tactic Name: sm70_xmma_fprop_implicit_gemm_f32f32_f32f32_f32_nchwkcrs_nchw_tilesize128x64x8_stage1_warpsize2x2x1_g1_ffma_aligna4_alignc4 Tactic: 0x994f5b723e2d80da Time: 0.00955093
[07/07/2026-06:12:04] [TRT] [V] Tactic Name: sm70_xmma_fprop_implicit_gemm_f32f32_f32f32_f32_nchwkcrs_nchw_tilesize128x256x8_stage1_warpsize2x4x1_g1_ffma_aligna4_alignc4 Tactic: 0xd2aa21bfe2167c0c Time: 0.0167525
[07/07/2026-06:12:04] [TRT] [V] Tactic Name: sm70_xmma_fprop_implicit_gemm_f32f32_f32f32_f32_nchwkcrs_nchw_tilesize32x32x8_stage1_warpsize1x2x1_g1_ffma_t1r5s5_aligna4_alignc4 Tactic: 0x7e1e4d26cfa285f9 Time: 0.00585694
[07/07/2026-06:12:04] [TRT] [V] Tactic Name: sm70_xmma_fprop_implicit_gemm_f32f32_f32f32_f32_nchwkcrs_nchw_tilesize64x64x8_stage1_warpsize1x4x1_g1_ffma_t1r5s5_aligna4_alignc4 Tactic: 0xb3ea28771604ad88 Time: 0.00647672
[07/07/2026-06:12:04] [TRT] [V] Tactic Name: sm80_xmma_fprop_implicit_gemm_indexed_f32f32_f32f32_f32_nchwkcrs_nchw_tilesize128x16x8_stage3_warpsize4x1x1_g1_ffma_aligna4_alignc4 Tactic: 0x40a12e3938221818 Time: 0.00763879
[07/07/2026-06:12:04] [TRT] [V] Tactic Name: sm80_xmma_fprop_implicit_gemm_f32f32_f32f32_f32_nchwkcrs_nchw_tilesize32x32x8_stage3_warpsize1x2x1_g1_ffma_aligna4_alignc4 Tactic: 0xb0bf940d5e0f9f45 Time: 0.00562293
[07/07/2026-06:12:04] [TRT] [V] Tactic Name: sm70_xmma_fprop_implicit_gemm_f32f32_f32f32_f32_nchwkcrs_nchw_tilesize128x16x8_stage1_warpsize4x1x1_g1_ffma_aligna4_alignc4 Tactic: 0x160b77f4a95ab6d3 Time: 0.00629192
[07/07/2026-06:12:04] [TRT] [V] Tactic Name: sm80_xmma_fprop_implicit_gemm_indexed_f32f32_f32f32_f32_nchwkcrs_nchw_tilesize128x32x8_stage3_warpsize2x2x1_g1_ffma_aligna4_alignc4 Tactic: 0xa9366041633a5135 Time: 0.00898639
[07/07/2026-06:12:04] [TRT] [V] Tactic Name: sm80_xmma_fprop_implicit_gemm_indexed_f32f32_f32f32_f32_nchwkcrs_nchw_tilesize128x64x8_stage2_warpsize4x1x1_g1_ffma_aligna4_alignc4_beta0_packed_stride Tactic: 0x1673e3594ce11cea Time: 0.0107599
[07/07/2026-06:12:04] [TRT] [V] Tactic Name: sm70_xmma_fprop_implicit_gemm_indexed_f32f32_f32f32_f32_nchwkcrs_nchw_tilesize64x64x8_stage1_warpsize1x4x1_g1_ffma_aligna4_alignc4 Tactic: 0x8d5c64a52fab02c9 Time: 0.00724846
[07/07/2026-06:12:04] [TRT] [V] Tactic Name: sm70_xmma_fprop_implicit_gemm_indexed_f32f32_f32f32_f32_nchwkcrs_nchw_tilesize128x32x8_stage1_warpsize2x2x1_g1_ffma_aligna4_alignc4 Tactic: 0x8c4f6360145d6a1f Time: 0.008392
[07/07/2026-06:12:04] [TRT] [V] Tactic Name: sm70_xmma_fprop_implicit_gemm_indexed_f32f32_f32f32_f32_nchwkcrs_nchw_tilesize32x32x8_stage1_warpsize1x2x1_g1_ffma_aligna4_alignc4 Tactic: 0x9efed776051c0873 Time: 0.00655519
[07/07/2026-06:12:04] [TRT] [V] Tactic Name: sm80_xmma_fprop_implicit_gemm_f32f32_f32f32_f32_nchwkcrs_nchw_tilesize256x128x8_stage3_warpsize4x2x1_g1_ffma_aligna4_alignc4 Tactic: 0xbb8c3889c7eacd30 Time: 0.0174731
[07/07/2026-06:12:04] [TRT] [V] Tactic Name: sm80_xmma_fprop_implicit_gemm_f32f32_f32f32_f32_nchwkcrs_nchw_tilesize64x128x8_stage3_warpsize1x4x1_g1_ffma_aligna4_alignc4 Tactic: 0x5aa723e0481da855 Time: 0.00940326
[07/07/2026-06:12:04] [TRT] [V] Tactic Name: sm70_xmma_fprop_implicit_gemm_f32f32_f32f32_f32_nchwkcrs_nchw_tilesize32x32x8_stage1_warpsize1x2x1_g1_ffma_aligna4_alignc4 Tactic: 0xf7a98be0a08d77c4 Time: 0.00578667
[07/07/2026-06:12:04] [TRT] [V] Tactic Name: sm70_xmma_fprop_implicit_gemm_f32f32_f32f32_f32_nchwkcrs_nchw_tilesize64x64x8_stage1_warpsize1x4x1_g1_ffma_aligna4_alignc4 Tactic: 0xe40b38338a3a7d7e Time: 0.00663446
[07/07/2026-06:12:04] [TRT] [V] node_conv2d + node_relu (CaskConvolution[0x80000009]) profiling completed in 0.141296 seconds. Fastest Tactic: 0x5b8bf1b8028629d9 Time: 0.00557795
[07/07/2026-06:12:04] [TRT] [V] Skipping CaskFlattenConvolution: No valid tactics for node_conv2d + node_relu
[07/07/2026-06:12:04] [TRT] [V] >>>>>>>>>>>>>>> Chose Runner Type: CaskConvolution Tactic: 0x5b8bf1b8028629d9
[07/07/2026-06:12:04] [TRT] [V] *************** Autotuning format combination: Float(784,1,28,1) -> Float(25088,1,896,32) ***************
[07/07/2026-06:12:04] [TRT] [V] --------------- Timing Runner: node_conv2d + node_relu (CaskConvolution[0x80000009])
[07/07/2026-06:12:04] [TRT] [V] Tactic Name: sm80_xmma_fprop_implicit_gemm_f32f32_f32f32_f32_nhwckrsc_nhwc_tilesize128x16x8_stage3_warpsize4x1x1_g1_ffma_t1r5s5_aligna4_alignc4 Tactic: 0xe35d4a4a3b499fe7 Time: 0.009632
[07/07/2026-06:12:04] [TRT] [V] Tactic Name: sm80_xmma_fprop_implicit_gemm_indexed_f32f32_f32f32_f32_nhwckrsc_nhwc_tilesize32x32x8_stage3_warpsize1x2x1_g1_ffma_aligna4_alignc4 Tactic: 0x0a143be7a52f301a Time: 0.0113813
[07/07/2026-06:12:04] [TRT] [V] Tactic Name: sm80_xmma_fprop_implicit_gemm_f32f32_f32f32_f32_nhwckrsc_nhwc_tilesize64x32x32_stage3_warpsize1x1x1_g1_ffma_aligna4_alignc4 Tactic: 0x50e74ef194ce86c3 Time: 0.146997
[07/07/2026-06:12:04] [TRT] [V] Tactic Name: sm80_xmma_fprop_implicit_gemm_f32f32_f32f32_f32_nhwckrsc_nhwc_tilesize64x16x16_stage3_warpsize1x1x1_g1_ffma_t1r5s5_aligna4_alignc4 Tactic: 0x93c5425f25c3f9fd Time: 0.0239947
[07/07/2026-06:12:04] [TRT] [V] Tactic Name: sm80_xmma_fprop_implicit_gemm_f32f32_f32f32_f32_nhwckrsc_nhwc_tilesize64x64x8_stage3_warpsize1x4x1_g1_ffma_aligna4_alignc4 Tactic: 0x62835fce994f06dd Time: 0.0135727
[07/07/2026-06:12:04] [TRT] [V] Tactic Name: sm70_xmma_fprop_implicit_gemm_f32f32_f32f32_f32_nhwckrsc_nhwc_tilesize64x64x8_stage1_warpsize1x4x1_g1_ffma_aligna4_alignc4 Tactic: 0x2595402367cdee5c Time: 0.0147729
[07/07/2026-06:12:04] [TRT] [V] Tactic Name: sm80_xmma_fprop_implicit_gemm_f32f32_f32f32_f32_nhwckrsc_nhwc_tilesize256x64x8_stage3_warpsize2x2x1_g1_ffma_aligna4_alignc4 Tactic: 0x8014228ec08b4d49 Time: 0.0399076
[07/07/2026-06:12:04] [TRT] [V] Tactic Name: sm70_xmma_fprop_implicit_gemm_indexed_f32f32_f32f32_f32_nhwckrsc_nhwc_tilesize128x16x8_stage1_warpsize4x1x1_g1_ffma_aligna4_alignc4 Tactic: 0x6aaac747558eb868 Time: 0.0144969
[07/07/2026-06:12:04] [TRT] [V] Tactic Name: sm70_xmma_fprop_implicit_gemm_f32f32_f32f32_f32_nhwckrsc_nhwc_tilesize128x16x8_stage1_warpsize4x1x1_g1_ffma_t1r5s5_aligna4_alignc4 Tactic: 0x54e3b8c9b1e5f17a Time: 0.0123982
[07/07/2026-06:12:04] [TRT] [V] Tactic Name: sm70_xmma_fprop_implicit_gemm_f32f32_f32f32_f32_nhwckrsc_nhwc_tilesize128x16x8_stage1_warpsize4x1x1_g1_ffma_aligna4_alignc4 Tactic: 0x19799dabb3912d89 Time: 0.0146296
[07/07/2026-06:12:04] [TRT] [V] Tactic Name: sm80_xmma_fprop_implicit_gemm_indexed_f32f32_f32f32_f32_nhwckrsc_nhwc_tilesize64x64x8_stage3_warpsize1x4x1_g1_ffma_aligna4_alignc4 Tactic: 0x19b688348f983aa0 Time: 0.0152873
[07/07/2026-06:12:04] [TRT] [V] Tactic Name: sm80_xmma_fprop_implicit_gemm_f32f32_f32f32_f32_nhwckrsc_nhwc_tilesize128x16x8_stage3_warpsize4x1x1_g1_ffma_aligna4_alignc4 Tactic: 0x92ed3100c35fc43e Time: 0.0115516
[07/07/2026-06:12:04] [TRT] [V] Tactic Name: sm70_xmma_fprop_implicit_gemm_f32f32_f32f32_f32_nhwckrsc_nhwc_tilesize64x128x8_stage1_warpsize1x4x1_g1_ffma_aligna4_alignc4 Tactic: 0xde4165142218dab8 Time: 0.0203219
[07/07/2026-06:12:04] [TRT] [V] Tactic Name: sm80_xmma_fprop_implicit_gemm_f32f32_f32f32_f32_nhwckrsc_nhwc_tilesize32x32x8_stage3_warpsize1x2x1_g1_ffma_aligna4_alignc4 Tactic: 0x7121ec1db3f80c67 Time: 0.00922984
[07/07/2026-06:12:04] [TRT] [V] Tactic Name: sm80_xmma_fprop_implicit_gemm_f32f32_f32f32_f32_nhwckrsc_nhwc_tilesize64x64x8_stage3_warpsize1x4x1_g1_ffma_t1r5s5_aligna4_alignc4 Tactic: 0x45ff0c3a09b02e78 Time: 0.0130429
[07/07/2026-06:12:04] [TRT] [V] Tactic Name: sm80_xmma_fprop_implicit_gemm_f32f32_f32f32_f32_nhwckrsc_nhwc_tilesize64x16x16_stage3_warpsize1x1x1_g1_ffma_aligna4_alignc4 Tactic: 0xb404e79e2d524151 Time: 0.0239634
[07/07/2026-06:12:04] [TRT] [V] Tactic Name: sm70_xmma_fprop_implicit_gemm_f32f32_f32f32_f32_nhwckrsc_nhwc_tilesize64x32x32_stage1_warpsize1x1x1_g1_ffma_aligna4_alignc4 Tactic: 0xdb73e25ae4006f74 Time: 0.154788
[07/07/2026-06:12:04] [TRT] [V] Tactic Name: sm70_xmma_fprop_implicit_gemm_f32f32_f32f32_f32_nhwckrsc_nhwc_tilesize64x16x16_stage1_warpsize1x1x1_g1_ffma_aligna4_alignc4 Tactic: 0x3f904b355d9ca8e6 Time: 0.0281049
[07/07/2026-06:12:04] [TRT] [V] Tactic Name: sm70_xmma_fprop_implicit_gemm_f32f32_f32f32_f32_nhwckrsc_nhwc_tilesize128x64x8_stage1_warpsize2x2x1_g1_ffma_aligna4_alignc4 Tactic: 0x963db12d24e61b80 Time: 0.0203796
[07/07/2026-06:12:04] [TRT] [V] Tactic Name: sm70_xmma_fprop_implicit_gemm_f32f32_f32f32_f32_nhwckrsc_nhwc_tilesize32x32x8_stage1_warpsize1x2x1_g1_ffma_t1r5s5_aligna4_alignc4 Tactic: 0xad9ed5f51d32aa29 Time: 0.0120994
[07/07/2026-06:12:04] [TRT] [V] Tactic Name: sm70_xmma_fprop_implicit_gemm_f32f32_f32f32_f32_nhwckrsc_nhwc_tilesize64x32x32_stage1_warpsize1x1x1_g1_ffma_t1r5s5_aligna4_alignc4 Tactic: 0x737793996edbf8e2 Time: 0.145166
[07/07/2026-06:12:04] [TRT] [V] Tactic Name: sm70_xmma_fprop_implicit_gemm_f32f32_f32f32_f32_nhwckrsc_nhwc_tilesize32x32x8_stage1_warpsize1x2x1_g1_ffma_aligna4_alignc4 Tactic: 0x3637f3f04d7ae4e6 Time: 0.0122343
[07/07/2026-06:12:04] [TRT] [V] Tactic Name: sm70_xmma_fprop_implicit_gemm_f32f32_f32f32_f32_nhwckrsc_nhwc_tilesize256x128x8_stage1_warpsize2x4x1_g1_ffma_aligna4_alignc4 Tactic: 0x0447933cc2be855a Time: 0.0533821
[07/07/2026-06:12:04] [TRT] [V] Tactic Name: sm80_xmma_fprop_implicit_gemm_f32f32_f32f32_f32_nhwckrsc_nhwc_tilesize32x32x8_stage3_warpsize1x2x1_g1_ffma_t1r5s5_aligna4_alignc4 Tactic: 0x880b696bd0160609 Time: 0.00884688
[07/07/2026-06:12:04] [TRT] [V] Tactic Name: sm80_xmma_fprop_implicit_gemm_indexed_f32f32_f32f32_f32_nhwckrsc_nhwc_tilesize128x32x8_stage3_warpsize2x2x1_g1_ffma_aligna4_alignc4 Tactic: 0xa6448a1e79f1ca6f Time: 0.0168784
[07/07/2026-06:12:04] [TRT] [V] Tactic Name: sm80_xmma_fprop_implicit_gemm_indexed_wo_smem_f32f32_tf32f32_f32_nhwckrsc_nhwc_tilesize128x16x32_stage1_warpsize4x1x1_g1_tensor16x8x8_aligna4_alignc4 Tactic: 0xcf8ea142095f02d2 Time: 0.00623802
[07/07/2026-06:12:04] [TRT] [V] Tactic Name: sm80_xmma_fprop_implicit_gemm_indexed_f32f32_f32f32_f32_nhwckrsc_nhwc_tilesize128x16x8_stage3_warpsize4x1x1_g1_ffma_aligna4_alignc4 Tactic: 0x4fd3c46622e98342 Time: 0.0131762
[07/07/2026-06:12:04] [TRT] [V] Tactic Name: sm70_xmma_fprop_implicit_gemm_f32f32_f32f32_f32_nhwckrsc_nhwc_tilesize64x16x16_stage1_warpsize1x1x1_g1_ffma_t1r5s5_aligna4_alignc4 Tactic: 0x247bb0dcaf6f9760 Time: 0.0272607
[07/07/2026-06:12:04] [TRT] [V] Tactic Name: sm80_xmma_fprop_implicit_gemm_indexed_wo_smem_f32f32_tf32f32_f32_nhwckrsc_nhwc_tilesize128x32x16_stage1_warpsize4x1x1_g1_tensor16x8x8_aligna4_alignc4 Tactic: 0xf231cca3335919a4 Time: 0.00665119
[07/07/2026-06:12:04] [TRT] [V] Tactic Name: sm70_xmma_fprop_implicit_gemm_indexed_f32f32_f32f32_f32_nhwckrsc_nhwc_tilesize128x32x8_stage1_warpsize2x2x1_g1_ffma_aligna4_alignc4 Tactic: 0x833d893f0e96f145 Time: 0.0174053
[07/07/2026-06:12:04] [TRT] [V] Tactic Name: sm70_xmma_fprop_implicit_gemm_indexed_f32f32_f32f32_f32_nhwckrsc_nhwc_tilesize32x32x8_stage1_warpsize1x2x1_g1_ffma_aligna4_alignc4 Tactic: 0x5f60af66e8eb9b51 Time: 0.0141853
[07/07/2026-06:12:04] [TRT] [V] Tactic Name: sm80_xmma_fprop_implicit_gemm_f32f32_f32f32_f32_nhwckrsc_nhwc_tilesize128x64x8_stage3_warpsize2x2x1_g1_ffma_aligna4_alignc4 Tactic: 0x1da91d865428f237 Time: 0.0207253
[07/07/2026-06:12:04] [TRT] [V] Tactic Name: sm80_xmma_fprop_implicit_gemm_f32f32_f32f32_f32_nhwckrsc_nhwc_tilesize64x32x32_stage3_warpsize1x1x1_g1_ffma_t1r5s5_aligna4_alignc4 Tactic: 0xc4c9611ae477967f Time: 0.139556
[07/07/2026-06:12:04] [TRT] [V] node_conv2d + node_relu (CaskConvolution[0x80000009]) profiling completed in 0.343514 seconds. Fastest Tactic: 0xcf8ea142095f02d2 Time: 0.00623802
[07/07/2026-06:12:04] [TRT] [V] Skipping CaskFlattenConvolution: No valid tactics for node_conv2d + node_relu
[07/07/2026-06:12:04] [TRT] [V] >>>>>>>>>>>>>>> Chose Runner Type: CaskConvolution Tactic: 0xcf8ea142095f02d2
[07/07/2026-06:12:04] [TRT] [V] *************** Autotuning format combination: Float(784,1:4,28,1) -> Float(25088,784,28,1) ***************
[07/07/2026-06:12:04] [TRT] [V] --------------- Timing Runner: node_conv2d + node_relu (CaskConvolution[0x80000009])
[07/07/2026-06:12:04] [TRT] [V] Tactic Name: sm80_xmma_fprop_implicit_gemm_indexed_f32f32_tf32f32_f32_nhwckrsc_nchw_tilesize128x256x32_stage3_warpsize2x4x1_g1_tensor16x8x8_alignc4 Tactic: 0xbf7080aca6804022 Time: 0.04728
[07/07/2026-06:12:04] [TRT] [V] Tactic Name: sm80_xmma_fprop_implicit_gemm_indexed_f32f32_tf32f32_f32_nhwckrsc_nchw_tilesize64x32x64_stage5_warpsize2x2x1_g1_tensor16x8x8_alignc4 Tactic: 0x06ac89b47db4fceb Time: 0.0192261
[07/07/2026-06:12:04] [TRT] [V] Tactic Name: sm80_xmma_fprop_implicit_gemm_indexed_f32f32_tf32f32_f32_nhwckrsc_nchw_tilesize128x256x32_stage3_warpsize2x4x1_g1_tensor16x8x8 Tactic: 0xcd6c525a3239bae9 Time: 0.0454
[07/07/2026-06:12:04] [TRT] [V] Tactic Name: sm80_xmma_fprop_implicit_gemm_f32f32_tf32f32_f32_nhwckrsc_nchw_tilesize128x128x16_stage4_warpsize2x2x1_g1_tensor16x8x8_alignc4 Tactic: 0x9fd9fe001908ce2e Time: 0.0178532
[07/07/2026-06:12:04] [TRT] [V] Tactic Name: sm80_xmma_fprop_implicit_gemm_indexed_f32f32_tf32f32_f32_nhwckrsc_nchw_tilesize64x128x32_stage5_warpsize2x2x1_g1_tensor16x8x8_alignc4 Tactic: 0xe25738550dba0da6 Time: 0.0203884
[07/07/2026-06:12:04] [TRT] [V] Tactic Name: sm80_xmma_fprop_implicit_gemm_indexed_f32f32_tf32f32_f32_nhwckrsc_nchw_tilesize128x64x32_stage5_warpsize2x2x1_g1_tensor16x8x8 Tactic: 0xdd84426cbb67ea98 Time: 0.0197622
[07/07/2026-06:12:04] [TRT] [V] Tactic Name: sm80_xmma_fprop_implicit_gemm_f32f32_tf32f32_f32_nhwckrsc_nchw_tilesize128x256x32_stage3_warpsize2x4x1_g1_tensor16x8x8_alignc4 Tactic: 0xc85ec809053babf4 Time: 0.0448547
[07/07/2026-06:12:04] [TRT] [V] Tactic Name: sm80_xmma_fprop_implicit_gemm_indexed_f32f32_tf32f32_f32_nhwckrsc_nchw_tilesize128x128x16_stage4_warpsize2x2x1_g1_tensor16x8x8_alignc4 Tactic: 0xe8f7b6a5bab325f8 Time: 0.0186904
[07/07/2026-06:12:04] [TRT] [V] Tactic Name: sm80_xmma_fprop_implicit_gemm_indexed_f32f32_tf32f32_f32_nhwckrsc_nchw_tilesize128x64x64_stage3_warpsize2x2x1_g1_tensor16x8x8_alignc4 Tactic: 0xf00aea93dd9c2661 Time: 0.0336672
[07/07/2026-06:12:04] [TRT] [V] Tactic Name: sm80_xmma_fprop_implicit_gemm_indexed_f32f32_tf32f32_f32_nhwckrsc_nchw_tilesize64x32x64_stage5_warpsize2x2x1_g1_tensor16x8x8 Tactic: 0x2a70e740f46257d6 Time: 0.0183321
[07/07/2026-06:12:04] [TRT] [V] Tactic Name: sm80_xmma_fprop_implicit_gemm_f32f32_tf32f32_f32_nhwckrsc_nchw_tilesize64x64x64_stage4_warpsize2x2x1_g1_tensor16x8x8 Tactic: 0x7c012183b88ca724 Time: 0.0210647
[07/07/2026-06:12:04] [TRT] [V] Tactic Name: sm80_xmma_fprop_implicit_gemm_f32f32_tf32f32_f32_nhwckrsc_nchw_tilesize128x64x32_stage5_warpsize2x2x1_g1_tensor16x8x8 Tactic: 0xa95e2a26416587cd Time: 0.0181867
[07/07/2026-06:12:04] [TRT] [V] Tactic Name: sm80_xmma_fprop_implicit_gemm_indexed_f32f32_tf32f32_f32_nhwckrsc_nchw_tilesize64x64x64_stage4_warpsize2x2x1_g1_tensor16x8x8 Tactic: 0xc5dec88c13d30802 Time: 0.0228352
[07/07/2026-06:12:04] [TRT] [V] Tactic Name: sm80_xmma_fprop_implicit_gemm_f32f32_tf32f32_f32_nhwckrsc_nchw_tilesize64x32x64_stage5_warpsize2x2x1_g1_tensor16x8x8_t1r5s5_alignc4 Tactic: 0x2f4d03736e9ddce5 Time: 0.0152378
[07/07/2026-06:12:04] [TRT] [V] Tactic Name: sm80_xmma_fprop_implicit_gemm_f32f32_tf32f32_f32_nhwckrsc_nchw_tilesize64x32x64_stage5_warpsize2x2x1_g1_tensor16x8x8 Tactic: 0x93af0e4f5f3df8f0 Time: 0.0155452
[07/07/2026-06:12:04] [TRT] [V] Tactic Name: sm80_xmma_fprop_implicit_gemm_f32f32_tf32f32_f32_nhwckrsc_nchw_tilesize64x64x64_stage4_warpsize2x2x1_g1_tensor16x8x8_alignc4 Tactic: 0xf9f0e486c78c67b0 Time: 0.0209027
[07/07/2026-06:12:04] [TRT] [V] Tactic Name: sm80_xmma_fprop_implicit_gemm_f32f32_tf32f32_f32_nhwckrsc_nchw_tilesize64x128x32_stage5_warpsize2x2x1_g1_tensor16x8x8 Tactic: 0xabbf7eb3b5b99502 Time: 0.0184679
[07/07/2026-06:12:04] [TRT] [V] Tactic Name: sm80_xmma_fprop_implicit_gemm_f32f32_tf32f32_f32_nhwckrsc_nchw_tilesize128x128x16_stage4_warpsize2x2x1_g1_tensor16x8x8 Tactic: 0x3104d85fecdd547c Time: 0.0165562
[07/07/2026-06:12:04] [TRT] [V] Tactic Name: sm80_xmma_fprop_implicit_gemm_f32f32_tf32f32_f32_nhwckrsc_nchw_tilesize256x64x32_stage3_warpsize4x2x1_g1_tensor16x8x8 Tactic: 0x009385d9017d87ea Time: 0.027264
[07/07/2026-06:12:04] [TRT] [V] Tactic Name: sm80_xmma_fprop_implicit_gemm_f32f32_tf32f32_f32_nhwckrsc_nchw_tilesize256x64x32_stage3_warpsize4x2x1_g1_tensor16x8x8_alignc4 Tactic: 0xdb50068f2f28400e Time: 0.029208
[07/07/2026-06:12:04] [TRT] [V] Tactic Name: sm80_xmma_fprop_implicit_gemm_f32f32_tf32f32_f32_nhwckrsc_nchw_tilesize128x128x32_stage4_warpsize2x2x1_g1_tensor16x8x8_alignc4 Tactic: 0x018af1a619a2581c Time: 0.0268111
[07/07/2026-06:12:04] [TRT] [V] Tactic Name: sm80_xmma_fprop_implicit_gemm_f32f32_tf32f32_f32_nhwckrsc_nchw_tilesize128x64x32_stage5_warpsize2x2x1_g1_tensor16x8x8_alignc4 Tactic: 0x294c501bad19317c Time: 0.0195407
[07/07/2026-06:12:04] [TRT] [V] Tactic Name: sm80_xmma_fprop_implicit_gemm_f32f32_tf32f32_f32_nhwckrsc_nchw_tilesize64x128x32_stage5_warpsize2x2x1_g1_tensor16x8x8_alignc4 Tactic: 0x8a196054417f1c8a Time: 0.0195514
[07/07/2026-06:12:04] [TRT] [V] Tactic Name: sm80_xmma_fprop_implicit_gemm_indexed_f32f32_tf32f32_f32_nhwckrsc_nchw_tilesize256x64x32_stage3_warpsize4x2x1_g1_tensor16x8x8 Tactic: 0x7449ed93fb7feabf Time: 0.0311331
[07/07/2026-06:12:04] [TRT] [V] Tactic Name: sm80_xmma_fprop_implicit_gemm_indexed_f32f32_tf32f32_f32_nhwckrsc_nchw_tilesize128x128x16_stage4_warpsize2x2x1_g1_tensor16x8x8 Tactic: 0xe0a307ffe0ffb6a5 Time: 0.0171168
[07/07/2026-06:12:04] [TRT] [V] Tactic Name: sm80_xmma_fprop_implicit_gemm_indexed_f32f32_tf32f32_f32_nhwckrsc_nchw_tilesize64x64x64_stage4_warpsize2x2x1_g1_tensor16x8x8_alignc4 Tactic: 0x9746567cb96a1ed8 Time: 0.0227684
[07/07/2026-06:12:04] [TRT] [V] Tactic Name: sm80_xmma_fprop_implicit_gemm_indexed_f32f32_tf32f32_f32_nhwckrsc_nchw_tilesize64x128x32_stage5_warpsize2x2x1_g1_tensor16x8x8 Tactic: 0xdf6516f94fbbf857 Time: 0.0203809
[07/07/2026-06:12:04] [TRT] [V] Tactic Name: sm80_xmma_fprop_implicit_gemm_f32f32_tf32f32_f32_nhwckrsc_nchw_tilesize256x128x32_stage3_warpsize4x2x1_g1_tensor16x8x8 Tactic: 0x62d0fae781700403 Time: 0.039373
[07/07/2026-06:12:04] [TRT] [V] Tactic Name: sm80_xmma_fprop_implicit_gemm_f32f32_tf32f32_f32_nhwckrsc_nchw_tilesize128x256x32_stage3_warpsize2x4x1_g1_tensor16x8x8 Tactic: 0x1ccb8dfa3e1b5830 Time: 0.0414258
[07/07/2026-06:12:04] [TRT] [V] Tactic Name: sm80_xmma_fprop_implicit_gemm_f32f32_tf32f32_f32_nhwckrsc_nchw_tilesize128x128x32_stage4_warpsize2x2x1_g1_tensor16x8x8 Tactic: 0xa0f5a3abd9b9c82a Time: 0.0254149
[07/07/2026-06:12:04] [TRT] [V] Tactic Name: sm80_xmma_fprop_implicit_gemm_f32f32_tf32f32_f32_nhwckrsc_nchw_tilesize128x64x64_stage3_warpsize2x2x1_g1_tensor16x8x8 Tactic: 0x0eef7d6cf0568181 Time: 0.0299484
[07/07/2026-06:12:04] [TRT] [V] Tactic Name: sm80_xmma_fprop_implicit_gemm_f32f32_tf32f32_f32_nhwckrsc_nchw_tilesize64x32x64_stage5_warpsize2x2x1_g1_tensor16x8x8_alignc4 Tactic: 0x681a3b4e03528583 Time: 0.0159258
[07/07/2026-06:12:04] [TRT] [V] node_conv2d + node_relu (CaskConvolution[0x80000009]) profiling completed in 0.253148 seconds. Fastest Tactic: 0x2f4d03736e9ddce5 Time: 0.0152378
[07/07/2026-06:12:04] [TRT] [V] Skipping CaskFlattenConvolution: No valid tactics for node_conv2d + node_relu
[07/07/2026-06:12:04] [TRT] [V] >>>>>>>>>>>>>>> Chose Runner Type: CaskConvolution Tactic: 0x2f4d03736e9ddce5
[07/07/2026-06:12:04] [TRT] [V] *************** Autotuning format combination: Float(784,1:4,28,1) -> Float(6272,1:4,224,8) ***************
[07/07/2026-06:12:04] [TRT] [V] --------------- Timing Runner: node_conv2d + node_relu (CaskConvolution[0x80000009])
[07/07/2026-06:12:04] [TRT] [V] Tactic Name: sm80_xmma_fprop_implicit_gemm_indexed_wo_smem_f32f32_tf32f32_f32_nhwckrsc_nhwc_tilesize128x32x16_stage1_warpsize4x1x1_g1_tensor16x8x8_alignc8 Tactic: 0x72a5d05b1bb165ef Time: 0.00925088
[07/07/2026-06:12:04] [TRT] [V] Tactic Name: sm90_xmma_fprop_implicit_gemm_f32f32_tf32f32_f32_nhwckrsc_nhwc_tilesize256x32x32_cgasize1x1x1_warpgroupsize1x1x1_g1 Tactic: 0x33d806e85053ff20 Time: 0.0193825
[07/07/2026-06:12:04] [TRT] [V] Tactic Name: sm90_xmma_fprop_implicit_gemm_f32f32_tf32f32_f32_nhwckrsc_nhwc_tilesize128x128x32_cgasize1x4x1_warpgroupsize1x1x1_g1 Tactic: 0xbc92f010d9d90ee0 Time: 0.016478
[07/07/2026-06:12:04] [TRT] [V] Tactic Name: sm90_xmma_fprop_implicit_gemm_f32f32_tf32f32_f32_nhwckrsc_nhwc_tilesize128x128x32_cgasize2x1x1_warpgroupsize1x1x1_g1 Tactic: 0x1d1e732c7c13379c Time: 0.0158109
[07/07/2026-06:12:04] [TRT] [V] Tactic Name: sm90_xmma_fprop_implicit_gemm_f32f32_tf32f32_f32_nhwckrsc_nhwc_tilesize64x128x32_cgasize1x2x1_warpgroupsize1x1x1_g1_beta0 Tactic: 0x177029deb90b8927 Time: 0.0141578
[07/07/2026-06:12:04] [TRT] [V] Tactic Name: sm90_xmma_fprop_implicit_gemm_f32f32_tf32f32_f32_nhwckrsc_nhwc_tilesize64x64x32_warpgroupsize1x1x1_g1_beta0 Tactic: 0x5c6579de472c54e3 Time: 0.0111095
[07/07/2026-06:12:04] [TRT] [V] Tactic Name: sm80_xmma_fprop_implicit_gemm_indexed_wo_smem_f32f32_tf32f32_f32_nhwckrsc_nhwc_tilesize128x16x64_stage1_warpsize4x1x1_g1_tensor16x8x8_aligna4_alignc8 Tactic: 0x22cadc265a3b2e32 Time: 0.0112046
[07/07/2026-06:12:04] [TRT] [V] Tactic Name: sm90_xmma_fprop_implicit_gemm_f32f32_tf32f32_f32_nhwckrsc_nhwc_tilesize256x128x32_cgasize1x2x1_warpgroupsize2x1x1_g1 Tactic: 0x5b113e512c92c355 Time: 0.0248053
[07/07/2026-06:12:04] [TRT] [V] Tactic Name: sm90_xmma_fprop_implicit_gemm_f32f32_tf32f32_f32_nhwckrsc_nhwc_tilesize128x256x32_cgasize1x2x1_warpgroupsize2x1x1_g1 Tactic: 0x5d803b4ac8c3f51b Time: 0.0248008
[07/07/2026-06:12:04] [TRT] [V] Tactic Name: sm90_xmma_fprop_implicit_gemm_f32f32_tf32f32_f32_nhwckrsc_nhwc_tilesize64x256x32_cgasize4x1x1_warpgroupsize1x1x1_g1_beta0 Tactic: 0x9a94bd551ee57ba7 Time: 0.0153954
[07/07/2026-06:12:04] [TRT] [V] Tactic Name: sm90_xmma_fprop_implicit_gemm_f32f32_tf32f32_f32_nhwckrsc_nhwc_tilesize128x64x32_cgasize1x2x1_warpgroupsize1x1x1_g1_beta0 Tactic: 0xc633aa9a979e0302 Time: 0.011783
[07/07/2026-06:12:04] [TRT] [V] Tactic Name: sm90_xmma_fprop_implicit_gemm_f32f32_tf32f32_f32_nhwckrsc_nhwc_tilesize64x256x32_cgasize1x2x1_warpgroupsize1x1x1_g1 Tactic: 0x78045ec8756c962a Time: 0.0204392
[07/07/2026-06:12:04] [TRT] [V] Tactic Name: sm80_xmma_fprop_implicit_gemm_indexed_wo_smem_f32f32_tf32f32_f32_nhwckrsc_nhwc_tilesize128x32x16_stage1_warpsize4x1x1_g1_tensor16x8x8_aligna8 Tactic: 0xdb77237fa21087f5 Time: 0.0106563
[07/07/2026-06:12:04] [TRT] [V] Tactic Name: sm90_xmma_fprop_implicit_gemm_f32f32_tf32f32_f32_nhwckrsc_nhwc_tilesize128x32x32_warpgroupsize1x1x1_g1_beta0 Tactic: 0xe53287547fb919fc Time: 0.0115171
[07/07/2026-06:12:04] [TRT] [V] Tactic Name: sm90_xmma_fprop_implicit_gemm_f32f32_tf32f32_f32_nhwckrsc_nhwc_tilesize64x256x32_warpgroupsize1x1x1_g1_beta0 Tactic: 0xdb682b361ae4af71 Time: 0.0207529
[07/07/2026-06:12:04] [TRT] [V] Tactic Name: sm90_xmma_fprop_implicit_gemm_f32f32_tf32f32_f32_nhwckrsc_nhwc_tilesize256x64x32_cgasize4x1x1_warpgroupsize1x1x1_g1_beta0 Tactic: 0x363abbacca769f74 Time: 0.0198513
[07/07/2026-06:12:04] [TRT] [V] Tactic Name: sm90_xmma_fprop_implicit_gemm_f32f32_tf32f32_f32_nhwckrsc_nhwc_tilesize256x64x32_cgasize2x2x1_warpgroupsize1x1x1_g1_beta0 Tactic: 0xb1a07507801bc969 Time: 0.0173445
[07/07/2026-06:12:05] [TRT] [V] Tactic Name: sm80_xmma_fprop_implicit_gemm_indexed_wo_smem_f32f32_tf32f32_f32_nhwckrsc_nhwc_tilesize128x32x64_stage1_warpsize4x1x1_g1_tensor16x8x8_alignc4 Tactic: 0xb6f6563c77d057d7 Time: 0.00804571
[07/07/2026-06:12:05] [TRT] [V] Tactic Name: sm90_xmma_fprop_implicit_gemm_f32f32_tf32f32_f32_nhwckrsc_nhwc_tilesize128x64x32_cgasize2x1x1_warpgroupsize1x1x1_g1_beta0 Tactic: 0x22b401709a2c0fd7 Time: 0.0138718
[07/07/2026-06:12:05] [TRT] [V] Tactic Name: sm90_xmma_fprop_implicit_gemm_f32f32_tf32f32_f32_nhwckrsc_nhwc_tilesize128x64x32_cgasize2x4x1_warpgroupsize1x1x1_g1 Tactic: 0xa06af1d986b8550f Time: 0.012768
[07/07/2026-06:12:05] [TRT] [V] Tactic Name: sm90_xmma_fprop_implicit_gemm_f32f32_tf32f32_f32_nhwckrsc_nhwc_tilesize64x32x32_warpgroupsize1x1x1_g1_beta0 Tactic: 0xed9769b790bb0d36 Time: 0.0109024
[07/07/2026-06:12:05] [TRT] [V] Tactic Name: sm90_xmma_fprop_implicit_gemm_f32f32_tf32f32_f32_nhwckrsc_nhwc_tilesize256x32x32_warpgroupsize1x1x1_g1 Tactic: 0x17d2c600f961b7b5 Time: 0.0162037
[07/07/2026-06:12:05] [TRT] [V] Tactic Name: sm90_xmma_fprop_implicit_gemm_f32f32_tf32f32_f32_nhwckrsc_nhwc_tilesize64x32x32_cgasize1x1x1_warpgroupsize1x1x1_g1 Tactic: 0x8f0ed36578f14aff Time: 0.0100355
[07/07/2026-06:12:05] [TRT] [V] Tactic Name: sm90_xmma_fprop_implicit_gemm_f32f32_tf32f32_f32_nhwckrsc_nhwc_tilesize64x128x32_cgasize4x1x1_warpgroupsize1x1x1_g1 Tactic: 0xedfaa33369f9d91e Time: 0.0110871
[07/07/2026-06:12:05] [TRT] [V] Tactic Name: sm80_xmma_fprop_implicit_gemm_indexed_wo_smem_f32f32_tf32f32_f32_nhwckrsc_nhwc_tilesize128x32x64_stage1_warpsize4x1x1_g1_tensor16x8x8 Tactic: 0xb33296dda7141c64 Time: 0.0074022
[07/07/2026-06:12:05] [TRT] [V] Tactic Name: sm80_xmma_fprop_implicit_gemm_indexed_wo_smem_f32f32_tf32f32_f32_nhwckrsc_nhwc_tilesize128x16x64_stage1_warpsize4x1x1_g1_tensor16x8x8_aligna8_alignc4 Tactic: 0xab0496509b88ebe0 Time: 0.00935407
[07/07/2026-06:12:05] [TRT] [V] Tactic Name: sm80_xmma_fprop_implicit_gemm_indexed_wo_smem_f32f32_tf32f32_f32_nhwckrsc_nhwc_tilesize128x16x32_stage1_warpsize4x1x1_g1_tensor16x8x8_alignc8 Tactic: 0x96467934a22da27d Time: 0.00715439
[07/07/2026-06:12:05] [TRT] [V] Tactic Name: sm80_xmma_fprop_implicit_gemm_indexed_wo_smem_f32f32_tf32f32_f32_nhwckrsc_nhwc_tilesize128x16x64_stage1_warpsize4x1x1_g1_tensor16x8x8 Tactic: 0x10383a0781d24dde Time: 0.00610909
[07/07/2026-06:12:05] [TRT] [V] Tactic Name: sm80_xmma_fprop_implicit_gemm_indexed_f32f32_tf32f32_f32_nhwckrsc_nhwc_tilesize256x64x32_stage3_warpsize4x2x1_g1_tensor16x8x8 Tactic: 0xba0185279ccb2b85 Time: 0.0315956
[07/07/2026-06:12:05] [TRT] [V] Tactic Name: sm80_xmma_fprop_implicit_gemm_f32f32_tf32f32_f32_nhwckrsc_nhwc_tilesize64x64x64_stage4_warpsize2x2x1_g1_tensor16x8x8 Tactic: 0x818413b69874bb35 Time: 0.0208773
[07/07/2026-06:12:05] [TRT] [V] Tactic Name: sm80_xmma_fprop_implicit_gemm_f32f32_tf32f32_f32_nhwckrsc_nhwc_tilesize128x64x64_stage3_warpsize2x2x1_g1_tensor16x8x8 Tactic: 0xc0a715d897e240bb Time: 0.0304165
[07/07/2026-06:12:05] [TRT] [V] Tactic Name: sm90_xmma_fprop_implicit_gemm_f32f32_tf32f32_f32_nhwckrsc_nhwc_tilesize256x128x32_cgasize1x2x1_warpgroupsize2x1x1_g1_beta0 Tactic: 0x04b42c3c19547164 Time: 0.0244617
[07/07/2026-06:12:05] [TRT] [V] Tactic Name: sm80_xmma_fprop_implicit_gemm_f32f32_tf32f32_f32_nhwckrsc_nhwc_tilesize256x128x32_stage3_warpsize4x2x1_g1_tensor16x8x8_t1r5s5 Tactic: 0x2c48dee9745d6bd1 Time: 0.0384533
[07/07/2026-06:12:05] [TRT] [V] Tactic Name: sm80_xmma_fprop_implicit_gemm_f32f32_tf32f32_f32_nhwckrsc_nhwc_tilesize64x32x64_stage5_warpsize2x2x1_g1_tensor16x8x8 Tactic: 0x6e2a3c7a7fc5e4e1 Time: 0.0155884
[07/07/2026-06:12:05] [TRT] [V] Tactic Name: sm80_xmma_fprop_implicit_gemm_indexed_wo_smem_f32f32_tf32f32_f32_nhwckrsc_nhwc_tilesize128x16x32_stage1_warpsize4x1x1_g1_tensor16x8x8_alignc4 Tactic: 0x1a373db9a2bc4028 Time: 0.00748349
[07/07/2026-06:12:05] [TRT] [V] Tactic Name: sm90_xmma_fprop_implicit_gemm_f32f32_tf32f32_f32_nhwckrsc_nhwc_tilesize128x256x32_warpgroupsize2x1x1_g1 Tactic: 0x95e84b9b8e64ec67 Time: 0.0251909
[07/07/2026-06:12:05] [TRT] [V] Tactic Name: sm90_xmma_fprop_implicit_gemm_f32f32_tf32f32_f32_nhwckrsc_nhwc_tilesize64x64x32_warpgroupsize1x1x1_g1 Tactic: 0xdc815d089b01c0ae Time: 0.0113508
[07/07/2026-06:12:05] [TRT] [V] Tactic Name: sm90_xmma_fprop_implicit_gemm_f32f32_tf32f32_f32_nhwckrsc_nhwc_tilesize256x128x32_warpgroupsize2x1x1_g1 Tactic: 0xcf5a65ab42d47ed5 Time: 0.0249592
[07/07/2026-06:12:05] [TRT] [V] Tactic Name: sm80_xmma_fprop_implicit_gemm_f32f32_tf32f32_f32_nhwckrsc_nhwc_tilesize256x64x32_stage3_warpsize4x2x1_g1_tensor16x8x8 Tactic: 0xcedbed6d66c946d0 Time: 0.028072
[07/07/2026-06:12:05] [TRT] [V] Tactic Name: sm90_xmma_fprop_implicit_gemm_f32f32_tf32f32_f32_nhwckrsc_nhwc_tilesize64x256x32_warpgroupsize1x1x1_g1 Tactic: 0x90215bb6906d8ed6 Time: 0.0208031
[07/07/2026-06:12:05] [TRT] [V] Tactic Name: sm90_xmma_fprop_implicit_gemm_f32f32_tf32f32_f32_nhwckrsc_nhwc_tilesize64x32x32_warpgroupsize1x1x1_g1 Tactic: 0xc84d24ba7e6e78d9 Time: 0.011093
[07/07/2026-06:12:05] [TRT] [V] Tactic Name: sm90_xmma_fprop_implicit_gemm_f32f32_tf32f32_f32_nhwckrsc_nhwc_tilesize256x64x32_cgasize2x1x1_warpgroupsize1x1x1_g1 Tactic: 0x1d6a7ff3461993b4 Time: 0.0208376
[07/07/2026-06:12:05] [TRT] [V] Tactic Name: sm90_xmma_fprop_implicit_gemm_f32f32_tf32f32_f32_nhwckrsc_nhwc_tilesize128x32x32_cgasize1x1x1_warpgroupsize1x1x1_g1_beta0 Tactic: 0x78cdb5e036f649ab Time: 0.0129785
[07/07/2026-06:12:05] [TRT] [V] Tactic Name: sm90_xmma_fprop_implicit_gemm_f32f32_tf32f32_f32_nhwckrsc_nhwc_tilesize128x64x32_cgasize1x2x1_warpgroupsize1x1x1_g1 Tactic: 0x6d76bdefa294938e Time: 0.0121493
[07/07/2026-06:12:05] [TRT] [V] Tactic Name: sm80_xmma_fprop_implicit_gemm_f32f32_tf32f32_f32_nhwckrsc_nhwc_tilesize64x64x64_stage4_warpsize2x2x1_g1_tensor16x8x8_t1r5s5 Tactic: 0x20ec60dfb4198123 Time: 0.02033
[07/07/2026-06:12:05] [TRT] [V] Tactic Name: sm80_xmma_fprop_implicit_gemm_indexed_f32f32_tf32f32_f32_nhwckrsc_nhwc_tilesize128x128x32_stage4_warpsize2x2x1_g1_tensor16x8x8 Tactic: 0xf4156675c5f728d4 Time: 0.0295867
[07/07/2026-06:12:05] [TRT] [V] Tactic Name: sm90_xmma_fprop_implicit_gemm_f32f32_tf32f32_f32_nhwckrsc_nhwc_tilesize256x64x32_warpgroupsize1x1x1_g1_beta0 Tactic: 0x4bed7aca02774cae Time: 0.0175285
[07/07/2026-06:12:05] [TRT] [V] Tactic Name: sm80_xmma_fprop_implicit_gemm_f32f32_tf32f32_f32_nhwckrsc_nhwc_tilesize64x32x64_stage5_warpsize2x2x1_g1_tensor16x8x8_t1r5s5 Tactic: 0x6af69a7346d256e4 Time: 0.0163291
[07/07/2026-06:12:05] [TRT] [V] Tactic Name: sm80_xmma_fprop_implicit_gemm_indexed_wo_smem_f32f32_tf32f32_f32_nhwckrsc_nhwc_tilesize128x16x64_stage1_warpsize4x1x1_g1_tensor16x8x8_aligna8 Tactic: 0xe9e5475c77d60638 Time: 0.00970636
[07/07/2026-06:12:05] [TRT] [V] Tactic Name: sm90_xmma_fprop_implicit_gemm_f32f32_tf32f32_f32_nhwckrsc_nhwc_tilesize64x128x32_cgasize1x4x1_warpgroupsize1x1x1_g1 Tactic: 0x640d844983f19294 Time: 0.0180205
[07/07/2026-06:12:05] [TRT] [V] Tactic Name: sm90_xmma_fprop_implicit_gemm_f32f32_tf32f32_f32_nhwckrsc_nhwc_tilesize64x64x32_cgasize1x2x1_warpgroupsize1x1x1_g1_beta0 Tactic: 0x50a13a79588bafcf Time: 0.0111342
[07/07/2026-06:12:05] [TRT] [V] Tactic Name: sm90_xmma_fprop_implicit_gemm_f32f32_tf32f32_f32_nhwckrsc_nhwc_tilesize128x128x32_cgasize4x1x1_warpgroupsize1x1x1_g1 Tactic: 0x3565d76a33d1456a Time: 0.015777
[07/07/2026-06:12:05] [TRT] [V] Tactic Name: sm80_xmma_fprop_implicit_gemm_indexed_wo_smem_f32f32_tf32f32_f32_nhwckrsc_nhwc_tilesize128x32x16_stage1_warpsize4x1x1_g1_tensor16x8x8_aligna4 Tactic: 0x570667f2a28165a0 Time: 0.0109254
[07/07/2026-06:12:05] [TRT] [V] Tactic Name: sm90_xmma_fprop_implicit_gemm_f32f32_tf32f32_f32_nhwckrsc_nhwc_tilesize128x128x32_cgasize2x2x1_warpgroupsize1x1x1_g1 Tactic: 0x718ebc26fdf5c861 Time: 0.0157901
[07/07/2026-06:12:05] [TRT] [V] Tactic Name: sm90_xmma_fprop_implicit_gemm_f32f32_tf32f32_f32_nhwckrsc_nhwc_tilesize64x256x32_cgasize2x1x1_warpgroupsize1x1x1_g1_beta0 Tactic: 0xd882fb2b6470e8d7 Time: 0.0153464
[07/07/2026-06:12:05] [TRT] [V] Tactic Name: sm90_xmma_fprop_implicit_gemm_f32f32_tf32f32_f32_nhwckrsc_nhwc_tilesize256x32x32_warpgroupsize1x1x1_g1_beta0 Tactic: 0xfa1f6aa3d5e0157b Time: 0.016157
[07/07/2026-06:12:05] [TRT] [V] Tactic Name: sm80_xmma_fprop_implicit_gemm_f32f32_tf32f32_f32_nhwckrsc_nhwc_tilesize64x128x32_stage5_warpsize2x2x1_g1_tensor16x8x8 Tactic: 0x65f71607d20d5438 Time: 0.0184241
[07/07/2026-06:12:05] [TRT] [V] Tactic Name: sm90_xmma_fprop_implicit_gemm_f32f32_tf32f32_f32_nhwckrsc_nhwc_tilesize64x128x32_cgasize4x1x1_warpgroupsize1x1x1_g1_beta0 Tactic: 0xb1e1c44ace2c1682 Time: 0.0108841
[07/07/2026-06:12:05] [TRT] [V] Tactic Name: sm90_xmma_fprop_implicit_gemm_f32f32_tf32f32_f32_nhwckrsc_nhwc_tilesize64x32x32_cgasize1x1x1_warpgroupsize1x1x1_g1_beta0 Tactic: 0xee5f2503f9e3e566 Time: 0.00985632
[07/07/2026-06:12:05] [TRT] [V] Tactic Name: sm90_xmma_fprop_implicit_gemm_f32f32_tf32f32_f32_nhwckrsc_nhwc_tilesize64x128x32_warpgroupsize1x1x1_g1 Tactic: 0x216ec6a556e02739 Time: 0.0139867
[07/07/2026-06:12:05] [TRT] [V] Tactic Name: sm90_xmma_fprop_implicit_gemm_f32f32_tf32f32_f32_nhwckrsc_nhwc_tilesize128x64x32_cgasize1x4x1_warpgroupsize1x1x1_g1_beta0 Tactic: 0xdff2141b5961975d Time: 0.0129436
[07/07/2026-06:12:05] [TRT] [V] Tactic Name: sm80_xmma_fprop_implicit_gemm_indexed_wo_smem_f32f32_tf32f32_f32_nhwckrsc_nhwc_tilesize128x16x32_stage1_warpsize4x1x1_g1_tensor16x8x8_aligna4 Tactic: 0xb3e5ce9d1b1da232 Time: 0.0118014
[07/07/2026-06:12:05] [TRT] [V] Tactic Name: sm80_xmma_fprop_implicit_gemm_f32f32_tf32f32_f32_nhwckrsc_nhwc_tilesize256x64x32_stage3_warpsize4x2x1_g1_tensor16x8x8_t1r5s5 Tactic: 0xa4ccdf6a03ea9ede Time: 0.0264648
[07/07/2026-06:12:05] [TRT] [V] Tactic Name: sm90_xmma_fprop_implicit_gemm_f32f32_tf32f32_f32_nhwckrsc_nhwc_tilesize128x64x32_cgasize2x4x1_warpgroupsize1x1x1_g1_beta0 Tactic: 0xfef93724642b5ee5 Time: 0.0124922
[07/07/2026-06:12:05] [TRT] [V] Tactic Name: sm80_xmma_fprop_implicit_gemm_indexed_wo_smem_f32f32_tf32f32_f32_nhwckrsc_nhwc_tilesize128x32x16_stage1_warpsize4x1x1_g1_tensor16x8x8_alignc4 Tactic: 0xfed494d61b2087ba Time: 0.00996957
[07/07/2026-06:12:05] [TRT] [V] Tactic Name: sm90_xmma_fprop_implicit_gemm_f32f32_tf32f32_f32_nhwckrsc_nhwc_tilesize64x128x32_cgasize4x2x1_warpgroupsize1x1x1_g1 Tactic: 0x816a6c39e81f26e3 Time: 0.0118411
[07/07/2026-06:12:05] [TRT] [V] Tactic Name: sm90_xmma_fprop_implicit_gemm_f32f32_tf32f32_f32_nhwckrsc_nhwc_tilesize64x256x32_cgasize2x2x1_warpgroupsize1x1x1_g1 Tactic: 0x6c398ceb528daf51 Time: 0.0206657
[07/07/2026-06:12:05] [TRT] [V] Tactic Name: sm90_xmma_fprop_implicit_gemm_f32f32_tf32f32_f32_nhwckrsc_nhwc_tilesize256x128x32_cgasize2x1x1_warpgroupsize2x1x1_g1_beta0 Tactic: 0xe03387d614e67db1 Time: 0.0247421
[07/07/2026-06:12:05] [TRT] [V] Tactic Name: sm90_xmma_fprop_implicit_gemm_f32f32_tf32f32_f32_nhwckrsc_nhwc_tilesize128x128x32_cgasize2x1x1_warpgroupsize1x1x1_g1_beta0 Tactic: 0x61e464c86804a587 Time: 0.0156024
[07/07/2026-06:12:05] [TRT] [V] Tactic Name: sm90_xmma_fprop_implicit_gemm_f32f32_tf32f32_f32_nhwckrsc_nhwc_tilesize128x32x32_warpgroupsize1x1x1_g1 Tactic: 0x08bffcb6c82323f3 Time: 0.0117543
[07/07/2026-06:12:05] [TRT] [V] Tactic Name: sm90_xmma_fprop_implicit_gemm_f32f32_tf32f32_f32_nhwckrsc_nhwc_tilesize256x64x32_cgasize1x4x1_warpgroupsize1x1x1_g1 Tactic: 0xbce6fccfe3d3aac8 Time: 0.0170336
[07/07/2026-06:12:05] [TRT] [V] Tactic Name: sm90_xmma_fprop_implicit_gemm_f32f32_tf32f32_f32_nhwckrsc_nhwc_tilesize64x256x32_cgasize4x1x1_warpgroupsize1x1x1_g1 Tactic: 0x28d2e7a79ca9225a Time: 0.015711
[07/07/2026-06:12:05] [TRT] [V] Tactic Name: sm90_xmma_fprop_implicit_gemm_f32f32_tf32f32_f32_nhwckrsc_nhwc_tilesize128x128x32_cgasize4x1x1_warpgroupsize1x1x1_g1_beta0 Tactic: 0x23f222b6129136f7 Time: 0.0152441
[07/07/2026-06:12:05] [TRT] [V] Tactic Name: sm80_xmma_fprop_implicit_gemm_indexed_wo_smem_f32f32_tf32f32_f32_nhwckrsc_nhwc_tilesize128x16x32_stage1_warpsize4x1x1_g1_tensor16x8x8_aligna4_alignc8 Tactic: 0x43ffe5cf09cee087 Time: 0.0118661
[07/07/2026-06:12:05] [TRT] [V] Tactic Name: sm90_xmma_fprop_implicit_gemm_f32f32_tf32f32_f32_nhwckrsc_nhwc_tilesize128x64x32_warpgroupsize1x1x1_g1 Tactic: 0x1c7385042d4c9b84 Time: 0.0127356
[07/07/2026-06:12:05] [TRT] [V] Tactic Name: sm90_xmma_fprop_implicit_gemm_f32f32_tf32f32_f32_nhwckrsc_nhwc_tilesize64x64x32_cgasize4x4x1_warpgroupsize1x1x1_g1_beta0 Tactic: 0x2a7de1b9d1ab6158 Time: 0.0139822
[07/07/2026-06:12:05] [TRT] [V] Tactic Name: sm90_xmma_fprop_implicit_gemm_f32f32_tf32f32_f32_nhwckrsc_nhwc_tilesize64x128x32_cgasize2x1x1_warpgroupsize1x1x1_g1 Tactic: 0xc5810775263babe8 Time: 0.0119912
[07/07/2026-06:12:05] [TRT] [V] Tactic Name: sm90_xmma_fprop_implicit_gemm_f32f32_tf32f32_f32_nhwckrsc_nhwc_tilesize64x256x32_cgasize1x4x1_warpgroupsize1x1x1_g1 Tactic: 0xa125c0dd76a169d0 Time: 0.0265083
[07/07/2026-06:12:05] [TRT] [V] Tactic Name: sm90_xmma_fprop_implicit_gemm_f32f32_tf32f32_f32_nhwckrsc_nhwc_tilesize64x64x32_cgasize4x1x1_warpgroupsize1x1x1_g1 Tactic: 0x89c70e382179549d Time: 0.00986416
[07/07/2026-06:12:05] [TRT] [V] Tactic Name: sm80_xmma_fprop_implicit_gemm_indexed_f32f32_tf32f32_f32_nhwckrsc_nhwc_tilesize128x64x64_stage3_warpsize2x2x1_g1_tensor16x8x8 Tactic: 0xb47d7d926de02dee Time: 0.0356213
[07/07/2026-06:12:05] [TRT] [V] Tactic Name: sm90_xmma_fprop_implicit_gemm_f32f32_tf32f32_f32_nhwckrsc_nhwc_tilesize128x32x32_cgasize1x1x1_warpgroupsize1x1x1_g1 Tactic: 0x3b69d9dd12d9399c Time: 0.0131454
[07/07/2026-06:12:05] [TRT] [V] Tactic Name: sm90_xmma_fprop_implicit_gemm_f32f32_tf32f32_f32_nhwckrsc_nhwc_tilesize64x64x32_cgasize1x2x1_warpgroupsize1x1x1_g1 Tactic: 0xd911b757c8bce0ed Time: 0.0112896
[07/07/2026-06:12:05] [TRT] [V] Tactic Name: sm90_xmma_fprop_implicit_gemm_f32f32_tf32f32_f32_nhwckrsc_nhwc_tilesize128x64x32_cgasize2x1x1_warpgroupsize1x1x1_g1 Tactic: 0x15dba0c604935508 Time: 0.0140671
[07/07/2026-06:12:05] [TRT] [V] Tactic Name: sm90_xmma_fprop_implicit_gemm_f32f32_tf32f32_f32_nhwckrsc_nhwc_tilesize256x64x32_cgasize4x1x1_warpgroupsize1x1x1_g1 Tactic: 0x3511dbb509dbe142 Time: 0.0199787
[07/07/2026-06:12:05] [TRT] [V] Tactic Name: sm90_xmma_fprop_implicit_gemm_f32f32_tf32f32_f32_nhwckrsc_nhwc_tilesize64x256x32_cgasize2x1x1_warpgroupsize1x1x1_g1 Tactic: 0x00a943e1d36b50ac Time: 0.0155253
[07/07/2026-06:12:05] [TRT] [V] Tactic Name: sm90_xmma_fprop_implicit_gemm_f32f32_tf32f32_f32_nhwckrsc_nhwc_tilesize128x128x32_cgasize2x2x1_warpgroupsize1x1x1_g1_beta0 Tactic: 0xa468ec1d58fc60ea Time: 0.015489
[07/07/2026-06:12:05] [TRT] [V] Tactic Name: sm90_xmma_fprop_implicit_gemm_f32f32_tf32f32_f32_nhwckrsc_nhwc_tilesize256x64x32_cgasize2x2x1_warpgroupsize1x1x1_g1 Tactic: 0x71fab0f9c7ff6c49 Time: 0.0174549
[07/07/2026-06:12:05] [TRT] [V] Tactic Name: sm90_xmma_fprop_implicit_gemm_f32f32_tf32f32_f32_nhwckrsc_nhwc_tilesize128x256x32_cgasize2x1x1_warpgroupsize2x1x1_g1 Tactic: 0x252d26636ec4339d Time: 0.0250019
[07/07/2026-06:12:05] [TRT] [V] Tactic Name: sm90_xmma_fprop_implicit_gemm_f32f32_tf32f32_f32_nhwckrsc_nhwc_tilesize64x256x32_cgasize1x2x1_warpgroupsize1x1x1_g1_beta0 Tactic: 0x3c0550c169c2e402 Time: 0.0203363
[07/07/2026-06:12:05] [TRT] [V] Tactic Name: sm90_xmma_fprop_implicit_gemm_f32f32_tf32f32_f32_nhwckrsc_nhwc_tilesize128x256x32_cgasize2x1x1_warpgroupsize2x1x1_g1_beta0 Tactic: 0x5cfbc1bba095ce09 Time: 0.0244823
[07/07/2026-06:12:05] [TRT] [V] Tactic Name: sm80_xmma_fprop_implicit_gemm_f32f32_tf32f32_f32_nhwckrsc_nhwc_tilesize128x128x16_stage4_warpsize2x2x1_g1_tensor16x8x8_t1r5s5 Tactic: 0x94f2b2320bb3fc74 Time: 0.0156601
[07/07/2026-06:12:05] [TRT] [V] Tactic Name: sm80_xmma_fprop_implicit_gemm_indexed_f32f32_tf32f32_f32_nhwckrsc_nhwc_tilesize64x64x64_stage4_warpsize2x2x1_g1_tensor16x8x8 Tactic: 0x385bfab9332b1413 Time: 0.023885
[07/07/2026-06:12:05] [TRT] [V] Tactic Name: sm90_xmma_fprop_implicit_gemm_f32f32_tf32f32_f32_nhwckrsc_nhwc_tilesize256x64x32_cgasize2x1x1_warpgroupsize1x1x1_g1_beta0 Tactic: 0x742cfdd2b0e30c04 Time: 0.0207322
[07/07/2026-06:12:05] [TRT] [V] Tactic Name: sm90_xmma_fprop_implicit_gemm_f32f32_tf32f32_f32_nhwckrsc_nhwc_tilesize256x64x32_cgasize1x4x1_warpgroupsize1x1x1_g1_beta0 Tactic: 0x896ae8b973ae948e Time: 0.0169877
[07/07/2026-06:12:05] [TRT] [V] Tactic Name: sm90_xmma_fprop_implicit_gemm_f32f32_tf32f32_f32_nhwckrsc_nhwc_tilesize128x128x32_warpgroupsize1x1x1_g1 Tactic: 0xd9bcc753af6ebacd Time: 0.0158999
[07/07/2026-06:12:05] [TRT] [V] Tactic Name: sm90_xmma_fprop_implicit_gemm_f32f32_tf32f32_f32_nhwckrsc_nhwc_tilesize256x64x32_warpgroupsize1x1x1_g1 Tactic: 0x031ebfb21c0e0fc2 Time: 0.017664
[07/07/2026-06:12:05] [TRT] [V] Tactic Name: sm90_xmma_fprop_implicit_gemm_f32f32_tf32f32_f32_nhwckrsc_nhwc_tilesize64x64x32_cgasize1x4x1_warpgroupsize1x1x1_g1_beta0 Tactic: 0x496084f896743b90 Time: 0.0135164
[07/07/2026-06:12:05] [TRT] [V] Tactic Name: sm80_xmma_fprop_implicit_gemm_indexed_f32f32_tf32f32_f32_nhwckrsc_nhwc_tilesize128x64x32_stage5_warpsize2x2x1_g1_tensor16x8x8 Tactic: 0x13cc2ad8dcd32ba2 Time: 0.0212567
[07/07/2026-06:12:05] [TRT] [V] Tactic Name: sm80_xmma_fprop_implicit_gemm_indexed_wo_smem_f32f32_tf32f32_f32_nhwckrsc_nhwc_tilesize128x32x64_stage1_warpsize4x1x1_g1_tensor16x8x8_aligna8_alignc4 Tactic: 0x93030576a9fb03f9 Time: 0.00913153
[07/07/2026-06:12:05] [TRT] [V] Tactic Name: sm90_xmma_fprop_implicit_gemm_f32f32_tf32f32_f32_nhwckrsc_nhwc_tilesize256x64x32_cgasize1x2x1_warpgroupsize1x1x1_g1 Tactic: 0x65c762dae01e5532 Time: 0.0169109
[07/07/2026-06:12:05] [TRT] [V] Tactic Name: sm90_xmma_fprop_implicit_gemm_f32f32_tf32f32_f32_nhwckrsc_nhwc_tilesize128x64x32_cgasize4x1x1_warpgroupsize1x1x1_g1_beta0 Tactic: 0x60a2470ee0b99ca7 Time: 0.0129698
[07/07/2026-06:12:05] [TRT] [V] Tactic Name: sm80_xmma_fprop_implicit_gemm_f32f32_tf32f32_f32_nhwckrsc_nhwc_tilesize128x256x32_stage3_warpsize2x4x1_g1_tensor16x8x8 Tactic: 0x998c97842e775a17 Time: 0.041312
[07/07/2026-06:12:05] [TRT] [V] Tactic Name: sm90_xmma_fprop_implicit_gemm_f32f32_tf32f32_f32_nhwckrsc_nhwc_tilesize128x64x32_cgasize1x4x1_warpgroupsize1x1x1_g1 Tactic: 0xb45723faa1596c74 Time: 0.0131844
[07/07/2026-06:12:05] [TRT] [V] Tactic Name: sm80_xmma_fprop_implicit_gemm_f32f32_tf32f32_f32_nhwckrsc_nhwc_tilesize256x128x32_stage3_warpsize4x2x1_g1_tensor16x8x8 Tactic: 0xe797e099911c0624 Time: 0.0392676
[07/07/2026-06:12:05] [TRT] [V] Tactic Name: sm80_xmma_fprop_implicit_gemm_indexed_wo_smem_f32f32_tf32f32_f32_nhwckrsc_nhwc_tilesize128x32x16_stage1_warpsize4x1x1_g1_tensor16x8x8_aligna4_alignc8 Tactic: 0x7e40882e33c8fbf1 Time: 0.0109344
[07/07/2026-06:12:05] [TRT] [V] Tactic Name: sm90_xmma_fprop_implicit_gemm_f32f32_tf32f32_f32_nhwckrsc_nhwc_tilesize64x256x32_cgasize2x2x1_warpgroupsize1x1x1_g1_beta0 Tactic: 0x1d0e73fe54882dba Time: 0.0204198
[07/07/2026-06:12:05] [TRT] [V] Tactic Name: sm90_xmma_fprop_implicit_gemm_f32f32_tf32f32_f32_nhwckrsc_nhwc_tilesize64x128x32_cgasize4x2x1_warpgroupsize1x1x1_g1_beta0 Tactic: 0x746d4c9ffed4d3ef Time: 0.0116417
[07/07/2026-06:12:05] [TRT] [V] Tactic Name: sm90_xmma_fprop_implicit_gemm_f32f32_tf32f32_f32_nhwckrsc_nhwc_tilesize128x128x32_cgasize1x2x1_warpgroupsize1x1x1_g1_beta0 Tactic: 0x8563cf2265b6a952 Time: 0.0153901
[07/07/2026-06:12:06] [TRT] [V] Tactic Name: sm90_xmma_fprop_implicit_gemm_f32f32_tf32f32_f32_nhwckrsc_nhwc_tilesize64x64x32_cgasize4x1x1_warpgroupsize1x1x1_g1_beta0 Tactic: 0xf630d7ed2fac306a Time: 0.00956709
[07/07/2026-06:12:06] [TRT] [V] Tactic Name: sm80_xmma_fprop_implicit_gemm_indexed_wo_smem_f32f32_tf32f32_f32_nhwckrsc_nhwc_tilesize128x32x16_stage1_warpsize4x1x1_g1_tensor16x8x8 Tactic: 0x9cb304e2edbc1221 Time: 0.00945037
[07/07/2026-06:12:06] [TRT] [V] Tactic Name: sm90_xmma_fprop_implicit_gemm_f32f32_tf32f32_f32_nhwckrsc_nhwc_tilesize128x128x32_warpgroupsize1x1x1_g1_beta0 Tactic: 0x67db2f3e821052a2 Time: 0.0156698
[07/07/2026-06:12:06] [TRT] [V] Tactic Name: sm90_xmma_fprop_implicit_gemm_f32f32_tf32f32_f32_nhwckrsc_nhwc_tilesize128x256x32_cgasize1x2x1_warpgroupsize2x1x1_g1_beta0 Tactic: 0xb87c6a51ad27c2dc Time: 0.0244107
[07/07/2026-06:12:06] [TRT] [V] Tactic Name: sm90_xmma_fprop_implicit_gemm_f32f32_tf32f32_f32_nhwckrsc_nhwc_tilesize256x128x32_warpgroupsize2x1x1_g1_beta0 Tactic: 0x84b83047ee0da340 Time: 0.0249257
[07/07/2026-06:12:06] [TRT] [V] Tactic Name: sm80_xmma_fprop_implicit_gemm_indexed_wo_smem_f32f32_tf32f32_f32_nhwckrsc_nhwc_tilesize128x32x64_stage1_warpsize4x1x1_g1_tensor16x8x8_aligna4_alignc8 Tactic: 0x1acd4f006848c62b Time: 0.0116112
[07/07/2026-06:12:06] [TRT] [V] Tactic Name: sm80_xmma_fprop_implicit_gemm_indexed_wo_smem_f32f32_tf32f32_f32_nhwckrsc_nhwc_tilesize128x16x32_stage1_warpsize4x1x1_g1_tensor16x8x8 Tactic: 0xae48d3ccfe1edfcd Time: 0.00859569
[07/07/2026-06:12:06] [TRT] [V] Tactic Name: sm90_xmma_fprop_implicit_gemm_f32f32_tf32f32_f32_nhwckrsc_nhwc_tilesize64x128x32_cgasize2x1x1_warpgroupsize1x1x1_g1_beta0 Tactic: 0xf3f78234b4b985f2 Time: 0.0118588
[07/07/2026-06:12:06] [TRT] [V] Tactic Name: sm80_xmma_fprop_implicit_gemm_f32f32_tf32f32_f32_nhwckrsc_nhwc_tilesize128x64x64_stage3_warpsize2x2x1_g1_tensor16x8x8_t1r5s5 Tactic: 0xe60966add848b046 Time: 0.0299973
[07/07/2026-06:12:06] [TRT] [V] Tactic Name: sm90_xmma_fprop_implicit_gemm_f32f32_tf32f32_f32_nhwckrsc_nhwc_tilesize128x64x32_warpgroupsize1x1x1_g1_beta0 Tactic: 0x54c0973da82e4029 Time: 0.0124685
[07/07/2026-06:12:06] [TRT] [V] Tactic Name: sm90_xmma_fprop_implicit_gemm_f32f32_tf32f32_f32_nhwckrsc_nhwc_tilesize64x64x32_cgasize4x4x1_warpgroupsize1x1x1_g1 Tactic: 0x3c765f27a352549a Time: 0.0146894
[07/07/2026-06:12:06] [TRT] [V] Tactic Name: sm80_xmma_fprop_implicit_gemm_f32f32_tf32f32_f32_nhwckrsc_nhwc_tilesize128x256x32_stage3_warpsize2x4x1_g1_tensor16x8x8_t1r5s5 Tactic: 0x6c223b9bb59c4911 Time: 0.0373369
[07/07/2026-06:12:06] [TRT] [V] Tactic Name: sm90_xmma_fprop_implicit_gemm_f32f32_tf32f32_f32_nhwckrsc_nhwc_tilesize128x64x32_cgasize4x1x1_warpgroupsize1x1x1_g1 Tactic: 0x3da004804b5127fe Time: 0.0131352
[07/07/2026-06:12:06] [TRT] [V] Tactic Name: sm90_xmma_fprop_implicit_gemm_f32f32_tf32f32_f32_nhwckrsc_nhwc_tilesize256x128x32_cgasize2x1x1_warpgroupsize2x1x1_g1 Tactic: 0x23bc23788a9505d3 Time: 0.0249615
[07/07/2026-06:12:06] [TRT] [V] Tactic Name: sm80_xmma_fprop_implicit_gemm_indexed_f32f32_tf32f32_f32_nhwckrsc_nhwc_tilesize128x256x32_stage3_warpsize2x4x1_g1_tensor16x8x8 Tactic: 0x482b48242255b8ce Time: 0.0455547
[07/07/2026-06:12:06] [TRT] [V] Tactic Name: sm80_xmma_fprop_implicit_gemm_f32f32_tf32f32_f32_nhwckrsc_nhwc_tilesize128x64x32_stage5_warpsize2x2x1_g1_tensor16x8x8 Tactic: 0x6716429226d146f7 Time: 0.0188427
[07/07/2026-06:12:06] [TRT] [V] Tactic Name: sm90_xmma_fprop_implicit_gemm_f32f32_tf32f32_f32_nhwckrsc_nhwc_tilesize64x64x32_cgasize1x4x1_warpgroupsize1x1x1_g1 Tactic: 0x00302942cb711f17 Time: 0.0141116
[07/07/2026-06:12:06] [TRT] [V] Tactic Name: sm90_xmma_fprop_implicit_gemm_f32f32_tf32f32_f32_nhwckrsc_nhwc_tilesize128x128x32_cgasize1x4x1_warpgroupsize1x1x1_g1_beta0 Tactic: 0x9ca271a3ab493d0d Time: 0.0159203
[07/07/2026-06:12:06] [TRT] [V] Tactic Name: sm90_xmma_fprop_implicit_gemm_f32f32_tf32f32_f32_nhwckrsc_nhwc_tilesize128x256x32_warpgroupsize2x1x1_g1_beta0 Tactic: 0x63f59fb58a493f10 Time: 0.0250796
[07/07/2026-06:12:06] [TRT] [V] Tactic Name: sm90_xmma_fprop_implicit_gemm_f32f32_tf32f32_f32_nhwckrsc_nhwc_tilesize64x64x32_cgasize2x1x1_warpgroupsize1x1x1_g1_beta0 Tactic: 0xb42691935539a31a Time: 0.010563
[07/07/2026-06:12:06] [TRT] [V] Tactic Name: sm90_xmma_fprop_implicit_gemm_f32f32_tf32f32_f32_nhwckrsc_nhwc_tilesize64x128x32_warpgroupsize1x1x1_g1_beta0 Tactic: 0xc92c47d10ae5c468 Time: 0.0138065
[07/07/2026-06:12:06] [TRT] [V] Tactic Name: sm90_xmma_fprop_implicit_gemm_f32f32_tf32f32_f32_nhwckrsc_nhwc_tilesize64x64x32_cgasize2x1x1_warpgroupsize1x1x1_g1 Tactic: 0xa1bcaa7e6ebb266b Time: 0.0107423
[07/07/2026-06:12:06] [TRT] [V] Tactic Name: sm80_xmma_fprop_implicit_gemm_indexed_wo_smem_f32f32_tf32f32_f32_nhwckrsc_nhwc_tilesize128x16x64_stage1_warpsize4x1x1_g1_tensor16x8x8_alignc4 Tactic: 0xcc46f0f5cee60677 Time: 0.00645908
[07/07/2026-06:12:06] [TRT] [V] Tactic Name: sm80_xmma_fprop_implicit_gemm_indexed_wo_smem_f32f32_tf32f32_f32_nhwckrsc_nhwc_tilesize128x32x64_stage1_warpsize4x1x1_g1_tensor16x8x8_aligna8 Tactic: 0x9355e195cee05798 Time: 0.0084072
[07/07/2026-06:12:06] [TRT] [V] Tactic Name: sm80_xmma_fprop_implicit_gemm_indexed_wo_smem_f32f32_tf32f32_f32_nhwckrsc_nhwc_tilesize128x32x64_stage1_warpsize4x1x1_g1_tensor16x8x8_alignc8 Tactic: 0x3a8712b17741b582 Time: 0.00728139
[07/07/2026-06:12:06] [TRT] [V] Tactic Name: sm80_xmma_fprop_implicit_gemm_indexed_wo_smem_f32f32_tf32f32_f32_nhwckrsc_nhwc_tilesize128x16x32_stage1_warpsize4x1x1_g1_tensor16x8x8_aligna8_alignc8 Tactic: 0x4640eb34c8ecc700 Time: 0.00889544
[07/07/2026-06:12:06] [TRT] [V] Tactic Name: sm80_xmma_fprop_implicit_gemm_indexed_wo_smem_f32f32_tf32f32_f32_nhwckrsc_nhwc_tilesize128x32x16_stage1_warpsize4x1x1_g1_tensor16x8x8_aligna8_alignc4 Tactic: 0xf78ec258f27b3e23 Time: 0.0114105
[07/07/2026-06:12:06] [TRT] [V] Tactic Name: sm80_xmma_fprop_implicit_gemm_indexed_wo_smem_f32f32_tf32f32_f32_nhwckrsc_nhwc_tilesize128x32x16_stage1_warpsize4x1x1_g1_tensor16x8x8_aligna8_alignc8 Tactic: 0x7bff86d5f2eadc76 Time: 0.010603
[07/07/2026-06:12:06] [TRT] [V] Tactic Name: sm90_xmma_fprop_implicit_gemm_f32f32_tf32f32_f32_nhwckrsc_nhwc_tilesize64x128x32_cgasize1x2x1_warpgroupsize1x1x1_g1 Tactic: 0xbd2c1a5c803c6d6e Time: 0.0143667
[07/07/2026-06:12:06] [TRT] [V] Tactic Name: sm90_xmma_fprop_implicit_gemm_f32f32_tf32f32_f32_nhwckrsc_nhwc_tilesize64x128x32_cgasize1x4x1_warpgroupsize1x1x1_g1_beta0 Tactic: 0x0eb1975f77f41d78 Time: 0.0175933
[07/07/2026-06:12:06] [TRT] [V] Tactic Name: sm80_xmma_fprop_implicit_gemm_indexed_f32f32_tf32f32_f32_nhwckrsc_nhwc_tilesize64x32x64_stage5_warpsize2x2x1_g1_tensor16x8x8 Tactic: 0xd7f5d575d49a4bc7 Time: 0.0184387
[07/07/2026-06:12:06] [TRT] [V] Tactic Name: sm80_xmma_fprop_implicit_gemm_indexed_f32f32_tf32f32_f32_nhwckrsc_nhwc_tilesize256x128x32_stage3_warpsize4x2x1_g1_tensor16x8x8 Tactic: 0x36303f399d3ee4fd Time: 0.0451973
[07/07/2026-06:12:06] [TRT] [V] Tactic Name: sm80_xmma_fprop_implicit_gemm_indexed_f32f32_tf32f32_f32_nhwckrsc_nhwc_tilesize128x128x16_stage4_warpsize2x2x1_g1_tensor16x8x8 Tactic: 0x65e41d81f093b482 Time: 0.0181496
[07/07/2026-06:12:06] [TRT] [V] Tactic Name: sm90_xmma_fprop_implicit_gemm_f32f32_tf32f32_f32_nhwckrsc_nhwc_tilesize128x128x32_cgasize1x2x1_warpgroupsize1x1x1_g1 Tactic: 0x65b36e05da14f11a Time: 0.0157852
[07/07/2026-06:12:06] [TRT] [V] Tactic Name: sm80_xmma_fprop_implicit_gemm_f32f32_tf32f32_f32_nhwckrsc_nhwc_tilesize128x128x32_stage4_warpsize2x2x1_g1_tensor16x8x8_t1r5s5 Tactic: 0xd44c0150ab60e391 Time: 0.0251794
[07/07/2026-06:12:06] [TRT] [V] Tactic Name: sm80_xmma_fprop_implicit_gemm_indexed_wo_smem_f32f32_tf32f32_f32_nhwckrsc_nhwc_tilesize128x16x32_stage1_warpsize4x1x1_g1_tensor16x8x8_aligna8 Tactic: 0x3f948a101b8c4067 Time: 0.00921859
[07/07/2026-06:12:06] [TRT] [V] Tactic Name: sm80_xmma_fprop_implicit_gemm_f32f32_tf32f32_f32_nhwckrsc_nhwc_tilesize128x128x32_stage4_warpsize2x2x1_g1_tensor16x8x8 Tactic: 0x25b2b9d5c9d5ca0d Time: 0.0257329
[07/07/2026-06:12:06] [TRT] [V] Tactic Name: sm80_xmma_fprop_implicit_gemm_indexed_f32f32_tf32f32_f32_nhwckrsc_nhwc_tilesize64x128x32_stage5_warpsize2x2x1_g1_tensor16x8x8 Tactic: 0x112d7e4d280f396d Time: 0.0207548
[07/07/2026-06:12:06] [TRT] [V] Tactic Name: sm90_xmma_fprop_implicit_gemm_f32f32_tf32f32_f32_nhwckrsc_nhwc_tilesize64x256x32_cgasize1x4x1_warpgroupsize1x1x1_g1_beta0 Tactic: 0x25c4ee40a73d705d Time: 0.0258683
[07/07/2026-06:12:06] [TRT] [V] Tactic Name: sm80_xmma_fprop_implicit_gemm_indexed_wo_smem_f32f32_tf32f32_f32_nhwckrsc_nhwc_tilesize128x16x64_stage1_warpsize4x1x1_g1_tensor16x8x8_alignc8 Tactic: 0x4037b478ce77e422 Time: 0.00740568
[07/07/2026-06:12:06] [TRT] [V] Tactic Name: sm80_xmma_fprop_implicit_gemm_f32f32_tf32f32_f32_nhwckrsc_nhwc_tilesize64x128x32_stage5_warpsize2x2x1_g1_tensor16x8x8_t1r5s5 Tactic: 0xd92e381f65c40faf Time: 0.0170741
[07/07/2026-06:12:06] [TRT] [V] Tactic Name: sm90_xmma_fprop_implicit_gemm_f32f32_tf32f32_f32_nhwckrsc_nhwc_tilesize256x64x32_cgasize1x2x1_warpgroupsize1x1x1_g1_beta0 Tactic: 0x90ab5638bd5100d1 Time: 0.0169003
[07/07/2026-06:12:06] [TRT] [V] Tactic Name: sm80_xmma_fprop_implicit_gemm_f32f32_tf32f32_f32_nhwckrsc_nhwc_tilesize128x64x32_stage5_warpsize2x2x1_g1_tensor16x8x8_t1r5s5 Tactic: 0x77cea0eece03cdc8 Time: 0.0180452
[07/07/2026-06:12:06] [TRT] [V] Tactic Name: sm80_xmma_fprop_implicit_gemm_f32f32_tf32f32_f32_nhwckrsc_nhwc_tilesize128x128x16_stage4_warpsize2x2x1_g1_tensor16x8x8 Tactic: 0xb443c221fcb1565b Time: 0.0165857
[07/07/2026-06:12:06] [TRT] [V] Tactic Name: sm90_xmma_fprop_implicit_gemm_f32f32_tf32f32_f32_nhwckrsc_nhwc_tilesize256x32x32_cgasize1x1x1_warpgroupsize1x1x1_g1_beta0 Tactic: 0x2e5549421c394a78 Time: 0.0191283
[07/07/2026-06:12:06] [TRT] [V] node_conv2d + node_relu (CaskConvolution[0x80000009]) profiling completed in 1.69435 seconds. Fastest Tactic: 0x10383a0781d24dde Time: 0.00610909
[07/07/2026-06:12:06] [TRT] [V] Skipping CaskFlattenConvolution: No valid tactics for node_conv2d + node_relu
[07/07/2026-06:12:06] [TRT] [V] >>>>>>>>>>>>>>> Chose Runner Type: CaskConvolution Tactic: 0x10383a0781d24dde
[07/07/2026-06:12:06] [TRT] [V] =============== Computing costs for node_max_pool2d
[07/07/2026-06:12:06] [TRT] [V] *************** Autotuning format combination: Float(25088,784,28,1) -> Float(6272,196,14,1) ***************
[07/07/2026-06:12:06] [TRT] [V] --------------- Timing Runner: node_max_pool2d (CaskPooling[0x8000002f])
[07/07/2026-06:12:06] [TRT] [V] Tactic Name: sm50_xmma_pooling_tiled_FP32NCHW_kMAX_tP2_tQ32_tR2_tS2_tU2_tV2_tUnroll6_tThreads256 Tactic: 0x60eceb67eff69444 Time: 0.00317826
[07/07/2026-06:12:06] [TRT] [V] Tactic Name: sm50_xmma_pooling_tiled_FP32NCHW_kMAX_tP2_tQ32_tR2_tS2_tU2_tV2_tUnroll1_tThreads256 Tactic: 0xc7d8c563bd6ced88 Time: 0.00331332
[07/07/2026-06:12:06] [TRT] [V] Tactic Name: sm50_xmma_pooling_nd_NCDHW_kMAX_kGENERIC_3D_POOLING_MODE_kFLOAT_0 Tactic: 0x5faf4a0a8a5670ed Time: 0.00375599
[07/07/2026-06:12:06] [TRT] [V] Tactic Name: sm50_xmma_pooling_tiled_FP32NCHW_kMAX_tP2_tQ16_tR2_tS2_tU2_tV2_tUnroll6_tThreads128 Tactic: 0xf4b20242f8c135e7 Time: 0.00316216
[07/07/2026-06:12:06] [TRT] [V] Tactic Name: sm50_xmma_pooling_tiled_FP32NCHW_kMAX_tP2_tQ16_tR2_tS2_tU2_tV2_tUnroll2_tThreads128 Tactic: 0xa7a495ee24d0c659 Time: 0.00313012
[07/07/2026-06:12:06] [TRT] [V] Tactic Name: sm50_xmma_pooling_fw_4d_FP32FP32NCHW_Max Tactic: 0xb59f9cfb90407c92 Time: 0.00540146
[07/07/2026-06:12:06] [TRT] [V] Tactic Name: sm50_xmma_pooling_tiled_FP32NCHW_kMAX_tP2_tQ32_tR2_tS2_tU2_tV2_tUnroll8_tThreads256 Tactic: 0xbc5c1844e5cc7959 Time: 0.00461219
[07/07/2026-06:12:06] [TRT] [V] Tactic Name: sm50_xmma_pooling_tiled_FP32NCHW_kMAX_tP2_tQ16_tR2_tS2_tU2_tV2_tUnroll8_tThreads128 Tactic: 0x2802f161f2fbd8fa Time: 0.00336704
[07/07/2026-06:12:06] [TRT] [V] Tactic Name: sm50_xmma_pooling_tiled_FP32NCHW_kMAX_tP2_tQ16_tR2_tS2_tU2_tV2_tUnroll3_tThreads128 Tactic: 0x7a0d6790c453b5f4 Time: 0.00314298
[07/07/2026-06:12:06] [TRT] [V] Tactic Name: sm50_xmma_pooling_tiled_FP32NCHW_kMAX_tP2_tQ16_tR2_tS2_tU2_tV2_tUnroll1_tThreads128 Tactic: 0x53862c46aa5b4c2b Time: 0.00321867
[07/07/2026-06:12:06] [TRT] [V] Tactic Name: sm50_xmma_pooling_tiled_FP32NCHW_kMAX_tP2_tQ16_tR2_tS2_tU2_tV2_tUnroll7_tThreads128 Tactic: 0x291bf03c1842464a Time: 0.00441881
[07/07/2026-06:12:06] [TRT] [V] Tactic Name: sm50_xmma_pooling_tiled_FP32NCHW_kMAX_tP2_tQ32_tR2_tS2_tU2_tV2_tUnroll5_tThreads256 Tactic: 0x94ce52cf617d1e36 Time: 0.00316961
[07/07/2026-06:12:06] [TRT] [V] Tactic Name: sm50_xmma_pooling_tiled_FP32NCHW_kMAX_tP2_tQ32_tR2_tS2_tU2_tV2_tUnroll4_tThreads256 Tactic: 0x4967a0b181fe6d9b Time: 0.00313331
[07/07/2026-06:12:06] [TRT] [V] Tactic Name: sm50_xmma_pooling_tiled_FP32NCHW_kMAX_tP2_tQ16_tR2_tS2_tU2_tV2_tUnroll5_tThreads128 Tactic: 0x0090bbea764abf95 Time: 0.00313291
[07/07/2026-06:12:06] [TRT] [V] Tactic Name: sm50_xmma_pooling_tiled_FP32NCHW_kMAX_tP2_tQ32_tR2_tS2_tU2_tV2_tUnroll7_tThreads256 Tactic: 0xbd4519190f75e7e9 Time: 0.00318466
[07/07/2026-06:12:07] [TRT] [V] Tactic Name: sm50_xmma_pooling_tiled_FP32NCHW_kMAX_tP2_tQ32_tR2_tS2_tU2_tV2_tUnroll2_tThreads256 Tactic: 0x33fa7ccb33e767fa Time: 0.00315331
[07/07/2026-06:12:07] [TRT] [V] Tactic Name: sm50_xmma_pooling_tiled_FP32NCHW_kMAX_tP2_tQ32_tR2_tS2_tU2_tV2_tUnroll3_tThreads256 Tactic: 0xee538eb5d3641457 Time: 0.00313221
[07/07/2026-06:12:07] [TRT] [V] Tactic Name: sm50_xmma_pooling_tiled_FP32NCHW_kMAX_tP2_tQ16_tR2_tS2_tU2_tV2_tUnroll4_tThreads128 Tactic: 0xdd39499496c9cc38 Time: 0.00313321
[07/07/2026-06:12:07] [TRT] [V] node_max_pool2d (CaskPooling[0x8000002f]) profiling completed in 0.578926 seconds. Fastest Tactic: 0xa7a495ee24d0c659 Time: 0.00313012
[07/07/2026-06:12:07] [TRT] [V] >>>>>>>>>>>>>>> Chose Runner Type: CaskPooling Tactic: 0xa7a495ee24d0c659
[07/07/2026-06:12:07] [TRT] [V] *************** Autotuning format combination: Float(6272,1:4,224,8) -> Float(1568,1:4,112,8) ***************
[07/07/2026-06:12:07] [TRT] [V] --------------- Timing Runner: node_max_pool2d (CaskPooling[0x8000002f])
[07/07/2026-06:12:07] [TRT] [V] Tactic Name: sm50_xmma_pooling_max_nhwc_FP32FP32_WINDOWSIZE_0_PROPAGATE_NAN_2D Tactic: 0x8382d5c464539e87 Time: 0.00385287
[07/07/2026-06:12:07] [TRT] [V] Tactic Name: sm50_xmma_pooling_max_nhwc_FP32FP32_WINDOWSIZE_0_NOT_PROPAGATE_NAN_2D Tactic: 0xaec8628e8180bced Time: 0.00379442
[07/07/2026-06:12:07] [TRT] [V] Tactic Name: sm50_xmma_pooling_max_nhwc_FP32FP32_WINDOWSIZE_0_PROPAGATE_NAN_3D Tactic: 0xd76bac5638836f8a Time: 0.00394905
[07/07/2026-06:12:07] [TRT] [V] Tactic Name: sm50_xmma_pooling_max_nhwc_FP32FP32_WINDOWSIZE_0_NOT_PROPAGATE_NAN_3D Tactic: 0xfa211b1cdd504de0 Time: 0.00391938
[07/07/2026-06:12:07] [TRT] [V] Tactic Name: sm50_xmma_pooling_fw_4d_FP32FP32NHWC_Max_CAlign4 Tactic: 0x22fb1bb4a70e340d Time: 0.00395809
[07/07/2026-06:12:07] [TRT] [V] node_max_pool2d (CaskPooling[0x8000002f]) profiling completed in 0.140563 seconds. Fastest Tactic: 0xaec8628e8180bced Time: 0.00379442
[07/07/2026-06:12:07] [TRT] [V] >>>>>>>>>>>>>>> Chose Runner Type: CaskPooling Tactic: 0xaec8628e8180bced
[07/07/2026-06:12:07] [TRT] [V] =============== Computing costs for node_conv2d_1 + node_relu_1
[07/07/2026-06:12:07] [TRT] [V] *************** Autotuning format combination: Float(6272,196,14,1) -> Float(12544,196,14,1) ***************
[07/07/2026-06:12:07] [TRT] [V] --------------- Timing Runner: node_conv2d_1 + node_relu_1 (CaskConvolution[0x80000009])
[07/07/2026-06:12:07] [TRT] [V] Tactic Name: sm80_xmma_fprop_implicit_gemm_f32f32_f32f32_f32_nchwkcrs_nchw_tilesize64x64x8_stage3_warpsize1x4x1_g1_ffma_t1r5s5_aligna4_alignc4 Tactic: 0x967f94e9db2001a8 Time: 0.0362741
[07/07/2026-06:12:07] [TRT] [V] Tactic Name: sm80_xmma_fprop_implicit_gemm_indexed_f32f32_f32f32_f32_nchwkcrs_nchw_tilesize32x32x8_stage3_warpsize1x2x1_g1_ffma_aligna4_alignc4 Tactic: 0xcb8a43f748d8a338 Time: 0.0387307
[07/07/2026-06:12:07] [TRT] [V] Tactic Name: sm80_xmma_fprop_implicit_gemm_indexed_f32f32_f32f32_f32_nchwkcrs_nchw_tilesize128x64x8_stage2_warpsize1x4x1_g1_ffma_aligna4_alignc4_beta0_packed_stride Tactic: 0xede36641840ce3d2 Time: 0.0825515
[07/07/2026-06:12:07] [TRT] [V] Tactic Name: sm80_xmma_fprop_implicit_gemm_indexed_f32f32_f32f32_f32_nchwkcrs_nchw_tilesize64x64x8_stage3_warpsize1x4x1_g1_ffma_aligna4_alignc4 Tactic: 0xd828f024626fa982 Time: 0.045184
[07/07/2026-06:12:07] [TRT] [V] Tactic Name: sm70_xmma_fprop_implicit_gemm_f32f32_f32f32_f32_nchwkcrs_nchw_tilesize64x128x8_stage1_warpsize1x4x1_g1_ffma_aligna4_alignc4 Tactic: 0xd1338f4b38d341e2 Time: 0.0543269
[07/07/2026-06:12:07] [TRT] [V] Tactic Name: sm80_xmma_fprop_implicit_gemm_f32f32_f32f32_f32_nchwkcrs_nchw_tilesize32x32x8_stage3_warpsize1x2x1_g1_ffma_t1r5s5_aligna4_alignc4 Tactic: 0x5b8bf1b8028629d9 Time: 0.026505
[07/07/2026-06:12:07] [TRT] [V] Tactic Name: sm80_xmma_fprop_implicit_gemm_f32f32_f32f32_f32_nchwkcrs_nchw_tilesize128x64x8_stage3_warpsize2x2x1_g1_ffma_aligna4_alignc4 Tactic: 0x12dbf7d94ee3696d Time: 0.0612018
[07/07/2026-06:12:07] [TRT] [V] Tactic Name: sm70_xmma_fprop_implicit_gemm_indexed_f32f32_f32f32_f32_nchwkcrs_nchw_tilesize128x16x8_stage1_warpsize4x1x1_g1_ffma_aligna4_alignc4 Tactic: 0x65d82d184f452332 Time: 0.0702379
[07/07/2026-06:12:07] [TRT] [V] Tactic Name: sm80_xmma_fprop_implicit_gemm_indexed_f32f32_f32f32_f32_nchwkcrs_nchw_tilesize128x64x8_stage2_warpsize2x2x1_g1_ffma_aligna4_alignc4_beta0_packed_stride Tactic: 0x31aa67f57c5aea77 Time: 0.0809237
[07/07/2026-06:12:07] [TRT] [V] Tactic Name: sm70_xmma_fprop_implicit_gemm_f32f32_f32f32_f32_nchwkcrs_nchw_tilesize128x128x8_stage1_warpsize2x2x1_g1_ffma_aligna4_alignc4 Tactic: 0xac49795b871b0d29 Time: 0.101872
[07/07/2026-06:12:07] [TRT] [V] Tactic Name: sm80_xmma_fprop_implicit_gemm_f32f32_f32f32_f32_nchwkcrs_nchw_tilesize128x16x8_stage3_warpsize4x1x1_g1_ffma_aligna4_alignc4 Tactic: 0x9d9fdb5fd9945f64 Time: 0.0317944
[07/07/2026-06:12:07] [TRT] [V] Tactic Name: sm80_xmma_fprop_implicit_gemm_f32f32_f32f32_f32_nchwkcrs_nchw_tilesize64x64x8_stage3_warpsize1x4x1_g1_ffma_aligna4_alignc4 Tactic: 0xa31d27de74b895ff Time: 0.0356608
[07/07/2026-06:12:07] [TRT] [V] Tactic Name: sm70_xmma_fprop_implicit_gemm_f32f32_f32f32_f32_nchwkcrs_nchw_tilesize128x64x8_stage1_warpsize2x2x1_g1_ffma_aligna4_alignc4 Tactic: 0x994f5b723e2d80da Time: 0.0663307
[07/07/2026-06:12:07] [TRT] [V] Tactic Name: sm70_xmma_fprop_implicit_gemm_f32f32_f32f32_f32_nchwkcrs_nchw_tilesize128x256x8_stage1_warpsize2x4x1_g1_ffma_aligna4_alignc4 Tactic: 0xd2aa21bfe2167c0c Time: 0.160668
[07/07/2026-06:12:07] [TRT] [V] Tactic Name: sm70_xmma_fprop_implicit_gemm_f32f32_f32f32_f32_nchwkcrs_nchw_tilesize32x32x8_stage1_warpsize1x2x1_g1_ffma_t1r5s5_aligna4_alignc4 Tactic: 0x7e1e4d26cfa285f9 Time: 0.0445227
[07/07/2026-06:12:07] [TRT] [V] Tactic Name: sm70_xmma_fprop_implicit_gemm_f32f32_f32f32_f32_nchwkcrs_nchw_tilesize64x64x8_stage1_warpsize1x4x1_g1_ffma_t1r5s5_aligna4_alignc4 Tactic: 0xb3ea28771604ad88 Time: 0.0396219
[07/07/2026-06:12:07] [TRT] [V] Tactic Name: sm80_xmma_fprop_implicit_gemm_indexed_f32f32_f32f32_f32_nchwkcrs_nchw_tilesize128x16x8_stage3_warpsize4x1x1_g1_ffma_aligna4_alignc4 Tactic: 0x40a12e3938221818 Time: 0.056592
